en,mni-Mtei
repeated and repeated themselves in his head. From being cold,ꯍꯟꯖꯤꯟ ꯍꯟꯖꯤꯟ ꯍꯥꯌꯔꯀꯈꯤ ꯑꯃꯁꯨꯡ ꯃꯍꯥꯛꯀꯤ ꯃꯀꯣꯛꯇꯥ ꯍꯟꯖꯤꯟ ꯍꯟꯖꯤꯟ ꯍꯥꯌꯔꯀꯏ꯫
"he was suddenly hot. His cheeks burnt with the rush of blood,",ꯃꯍꯥꯛ ꯈꯉꯍꯧꯗꯅꯥ ꯍꯨꯔꯥꯅꯈꯤ꯫
the room swam and darkened before his eyes. He ground his,ꯔꯨꯝ ꯑꯗꯨ ꯃꯍꯥꯛꯀꯤ ꯃꯤꯠꯌꯦꯡꯗꯨꯒꯤ ꯃꯃꯥꯡꯗꯥ ꯆꯦꯟꯊꯈꯤ ꯑꯃꯁꯨꯡ ꯑꯃꯝꯕꯥ ꯊꯣꯀꯈꯤ꯫
"teeth. ‘I’ll kill him, I’ll kill him, I’ll kill him,’ he kept saying. And",ꯌꯥ.
suddenly there were more words,ꯈꯉꯍꯧꯗꯅꯥ ꯋꯥꯍꯩ ꯀꯌꯥ ꯍꯦꯟꯅꯥ ꯂꯩꯔꯝꯃꯤ .
"When he is drunk asleep, or in his rage","ꯃꯍꯥꯛꯅꯥ ꯇꯨꯝꯕꯥ ꯃꯇꯃꯗꯥ, ꯅꯠꯠꯔꯒꯥ ꯃꯍꯥꯛꯀꯤ ꯔꯦꯖꯗꯥ"
Or in the incestuous pleasure of his bed . .,ꯅꯠꯔꯒꯥ ꯃꯍꯥꯛꯀꯤ ꯐꯃꯨꯡꯒꯤ ꯏꯅꯁꯦꯁ꯭ꯇꯨꯁꯟ ꯅꯨꯡꯉꯥꯏꯕꯗꯥ .
"The magic was on his side, the magic explained and gave","ꯃꯦꯖꯤꯛ ꯑꯗꯨ ꯃꯍꯥꯛꯀꯤ ꯃꯅꯥꯛꯇꯥ ꯂꯩꯔꯝꯃꯤ, ꯃꯦꯖꯤꯛ ꯑꯗꯨꯅꯥ ꯐꯣꯡꯗꯣꯀꯈꯤ ꯑꯃꯁꯨꯡ ꯄꯤꯈꯤ"
orders. He stepped back into the outer room. ‘When he is drunk,ꯑꯣꯔꯗꯔꯁꯤꯡ ꯇꯧꯕꯥ꯫
asleep . . .’ The knife for the meat was lying on the floor near the,ꯇꯨꯝꯂꯤꯕ .
fireplace. He picked it up and tiptoed to the door again. ‘When,ꯃꯩ ꯊꯥꯅꯕꯥ ꯃꯐꯝ꯫
"he is drunk asleep, drunk asleep . . .’ He ran across the room and","ꯃꯍꯥꯛ ꯃꯁꯥ ꯃꯊꯟꯇꯥ ꯇꯨꯝꯂꯤ, ꯃꯁꯥꯅꯥ ꯃꯁꯥꯕꯨ ꯊꯥꯖꯖꯔꯤ ."
"stabbed—oh, the blood!—stabbed again, as Popé heaved out of","ꯁ꯭ꯇꯥꯕ ꯇꯧꯔꯕꯥ—ꯑꯣꯍ, ꯏꯁꯤꯡ!—ꯄꯣꯄꯦꯅꯥ ꯍꯦꯟꯅꯥ ꯋꯥꯡꯈꯠꯂꯀꯄꯒꯥ ꯂꯣꯌꯅꯅꯥ ꯑꯃꯨꯛ ꯍꯟꯅꯥ ꯁ꯭ꯇꯥꯕ ꯇꯧꯈꯤ"
"his sleep, lifted his hand to stab once more, but found his wrist","ꯃꯍꯥꯛꯀꯤ ꯇꯨꯝꯕꯥ, ꯃꯍꯥꯛꯀꯤ ꯈꯨꯠ ꯑꯗꯨ ꯑꯃꯨꯛ ꯍꯟꯅꯥ ꯊꯨꯒꯥꯏꯅꯕꯥ ꯃꯍꯥꯛꯀꯤ ꯈꯨꯠ ꯊꯥꯈꯤ, ꯑꯗꯨꯕꯨ ꯃꯍꯥꯛꯀꯤ ꯃꯈꯨꯠ ꯑꯗꯨ ꯐꯪꯂꯦ"
"caught, held and— oh, oh!—twisted. He couldn’t move, he was","ꯊꯨꯡꯂꯈꯤ, ꯊꯃꯈꯤ ꯑꯃꯁꯨꯡ— ꯑꯣꯍ, ꯑꯣꯍ!—ꯇ꯭ꯕꯤꯁ꯭ꯠ ꯇꯧꯈꯤ꯫"
"trapped, and there were Popé’s small black eyes, very close,","ꯇ꯭ꯔꯦꯞ ꯇꯧꯔꯕꯥ, ꯑꯃꯁꯨꯡ ꯄꯣꯄꯀꯤ ꯑꯄꯤꯀꯄꯥ ꯕ꯭ꯂꯦꯛ ꯃꯃꯤꯁꯤꯡ ꯂꯩꯔꯝꯃꯤ, ꯌꯥꯝꯅꯥ ꯅꯛꯅꯥ,"
staring into his own. He looked away. There were two cuts on,ꯃꯁꯥꯒꯤ ꯑꯣꯏꯕꯥ ꯃꯤꯠꯌꯦꯡꯗꯥ ꯃꯤꯠꯌꯦꯡ ꯊꯝꯕꯥ꯫
"Popé’s left shoulder. ‘Oh, look at the blood!’ Linda was crying",ꯄꯣꯄꯦ’ꯒꯤ ꯂꯦꯃꯍꯧꯔꯤꯕꯥ ꯈꯣꯉꯎꯞ꯫
‘Look at the blood!’ She had never been able to bear the sight of,‘ꯏꯁꯤꯡ ꯌꯦꯡꯎ!’ ꯃꯍꯥꯛꯅꯥ ꯀꯩꯗꯧꯉꯩꯗꯁꯨ ꯎꯕꯥ ꯐꯪꯈꯤꯗꯦ
"blood. Popé lifted his other hand—to strike him, he thought. He",ꯏ.
stiffened to receive the blow. But the hand only took him under,ꯕ꯭ꯂꯣꯛ ꯑꯗꯨ ꯐꯪꯅꯕꯒꯤꯗꯃꯛ ꯁ꯭ꯇꯤꯐꯦꯟ ꯇꯧꯕꯥ꯫
"the chin and turned his face, so that he had to look again into","ꯆꯤꯟ ꯑꯃꯁꯨꯡ ꯃꯍꯥꯛꯀꯤ ꯃꯐꯝ ꯑꯗꯨ ꯑꯣꯟꯊꯣꯀꯈꯤ, ꯃꯔꯝ ꯑꯗꯨꯅꯥ ꯃꯍꯥꯛꯅꯥ ꯑꯃꯨꯛ ꯍꯟꯅꯥ ꯌꯦꯡꯒꯗꯕꯅꯤ꯫"
"Popé’s eyes. For a long time, for hours and hours. And",ꯄꯣꯄꯦ’ꯒꯤ ꯃꯤꯠꯌꯦꯡ꯫
suddenly—he couldn’t help it—he began to cry. Popé burst out,ꯈꯉꯍꯧꯗꯅꯥ—ꯃꯍꯥꯛꯅꯥ ꯃꯇꯦꯡ ꯄꯥꯡꯕꯥ ꯉꯃꯈꯤꯗꯦ—ꯃꯍꯥꯛꯅꯥ ꯀꯞꯄꯥ ꯍꯧꯔꯀꯈꯤ꯫
157,꯱꯵꯷ ꯑꯃꯁꯨꯡ ꯑꯦꯟ.
"laughing. ‘Go,’ he said, in the other Indian words. ‘Go, my brave",ꯅꯣꯛꯄ.
Ahaiyuta.’ He ran out into the other room to hide his tears,ꯑꯍꯥꯏꯌꯨꯇꯥ꯫’ ꯃꯍꯥꯛꯅꯥ ꯃꯍꯥꯛꯀꯤ ꯃꯤꯠꯀꯨꯞ ꯂꯣꯠꯅꯕꯥ ꯑꯇꯣꯞꯄꯥ ꯔꯨꯝ ꯑꯗꯨꯗꯥ ꯂꯥꯟꯊꯣꯀꯈꯤ꯫
"‘You are fifteen,’ said old Mitsima, in the Indian words. ‘Now I",‘ꯅꯉꯅꯥ ꯆꯍꯤ ꯇꯔꯥꯅꯤꯄꯥꯜ ꯁꯨꯔꯦ’ ꯍꯥꯌꯅꯥ ꯑꯔꯤꯕꯥ ꯃꯤꯠꯁꯤꯃꯥꯅꯥ ꯚꯥꯔꯇꯀꯤ ꯋꯥꯍꯩꯁꯤꯡꯗꯥ ꯍꯥꯌꯔꯀꯏ꯫
may teach you to work the clay.’,ꯅꯈꯣꯌꯕꯨ ꯀ꯭ꯂꯦꯏꯒꯤ ꯊꯕꯛ ꯇꯧꯅꯕꯥ ꯇꯥꯀꯄꯤꯕꯥ ꯌꯥꯏ꯫’
"Squatting by the river, they worked together",ꯇꯨꯔꯦꯂꯒꯤ ꯅꯥꯀꯂꯗꯥ ꯆꯦꯟꯊꯔꯒꯥ ꯃꯈꯣꯌꯅꯥ ꯄꯨꯟꯅꯥ ꯊꯕꯛ ꯇꯧꯃꯤꯟꯅꯈꯤ
"‘First of all,’ said Mitsima, taking a lump of the wetted clay","‘ꯑꯍꯥꯅꯕꯥ ꯑꯣꯏꯅꯥ,’ ꯃꯤꯇꯁꯤꯃꯥꯅꯥ ꯍꯥꯌꯈꯤ, ꯇꯔꯨ ꯇꯅꯥꯅꯕꯥ ꯀ꯭ꯂꯦꯒꯤ ꯂꯝꯕꯤ ꯑꯃꯥ ꯂꯧꯔꯒꯥ"
"between his hands, ‘we make a little moon.’ The old man","ꯃꯍꯥꯛꯀꯤ ꯈꯨꯠꯁꯥꯒꯤ ꯃꯔꯛꯇꯥ, ‘ꯑꯩꯈꯣꯌꯅꯥ ꯑꯄꯤꯀꯄꯥ ꯊꯥ ꯑꯃꯥ ꯁꯦꯝꯃꯤ꯫’ ꯑꯍꯜ ꯑꯣꯏꯔꯕꯥ ꯃꯤꯑꯣꯏ ꯑꯗꯨꯅꯥ"
"squeezed the lump into a disk, then bent up the edges; the","ꯂꯝꯕꯤ ꯑꯗꯨ ꯗꯤꯁ꯭ꯛ ꯑꯃꯗꯥ ꯆꯦꯟꯊꯈꯤ, ꯃꯗꯨꯒꯤ ꯃꯇꯨꯡꯗꯥ ꯃꯊꯛꯇꯥ ꯀꯨꯄꯁꯤꯜꯂꯕꯥ;"
moon became a shallow cup,ꯊꯥ ꯑꯁꯤ ꯌꯥꯝꯅꯥ ꯂꯨꯕꯥ ꯀꯞ ꯑꯃꯥ ꯑꯣꯏꯔꯀꯈꯤ꯫
Slowly and unskilfully he imitated the old man’s delicate,ꯇꯞꯅꯥ ꯇꯞꯅꯥ ꯑꯃꯁꯨꯡ ꯑꯅꯁ꯭ꯀꯤꯜ ꯑꯣꯏꯅꯥ ꯃꯍꯥꯛꯅꯥ ꯑꯍꯜ ꯑꯣꯏꯔꯕꯥ ꯃꯤꯑꯣꯏ ꯑꯗꯨꯒꯤ ꯃꯁꯛ ꯅꯥꯏꯕꯥ ꯑꯗꯨ ꯏꯃꯤꯠ ꯇꯧꯈꯤ
gestures,ꯖꯤꯖꯔꯁꯤꯡ .
"‘A moon, a cup, and now a snake.’ Mitsima rolled out another","‘ꯊꯥ ꯑꯃꯥ, ꯀꯞ ꯑꯃꯥ, ꯑꯃꯁꯨꯡ ꯍꯧꯖꯤꯛ ꯅꯣꯡꯃꯩ ꯑꯃꯥ’꯫’ ꯃꯤꯠꯁꯤꯃꯥꯅꯥ ꯑꯇꯣꯞꯄꯥ ꯑꯃꯥ ꯂꯣꯂꯍꯅꯈꯤ"
"piece of clay into a long flexible cylinder, hooped it into a circle","ꯂꯝꯕꯥ ꯐ꯭ꯂꯦꯛꯁꯤꯕꯜ ꯁꯤꯂꯤꯟꯗꯔ ꯑꯃꯗꯥ ꯀ꯭ꯂꯦꯒꯤ ꯁꯔꯨꯛ ꯑꯃꯥ, ꯃꯗꯨ ꯁꯔꯀꯜ ꯑꯃꯗꯥ ꯍꯨꯄꯆꯤꯜꯂꯀꯈꯤ꯫"
and pressed it on to the rim of the cup. ‘Then another snake,ꯑꯃꯁꯨꯡ ꯃꯗꯨ ꯀꯞ ꯑꯗꯨꯒꯤ ꯔꯤꯃꯗꯥ ꯆꯦꯠꯅꯥ ꯊꯃꯈꯤ꯫
"And another. And another.’ Round by round, Mitsima built up the",ꯑꯃꯁꯨꯡ ꯑꯇꯣꯞꯄꯥ ꯑꯃꯅꯥ꯫
"sides of the pot; it was narrow, it bulged, it narrowed again",ꯄꯣꯠꯁꯛ ꯑꯗꯨꯒꯤ ꯃꯄꯥꯟꯊꯪꯕꯥ ꯁꯔꯨꯀꯁꯤꯡ;
"towards the neck. Mitsima squeezed and patted, stroked and",ꯈꯣꯡꯒꯤ ꯃꯅꯥꯛꯇꯥ ꯂꯩꯕꯥ꯫
"scraped; and there at last it stood, in shape the familiar water-",ꯁ꯭ꯛꯔꯦꯞ ꯇꯧꯔꯕꯥ;
"pot of Malpais, but creamy white instead of black, and still soft","ꯃꯥꯂꯄꯥꯏꯒꯤ ꯄꯣꯠ, ꯑꯗꯨꯕꯨ ꯕ꯭ꯂꯦꯛ ꯃꯅꯤꯒꯤ ꯃꯍꯨꯠꯇꯥ ꯀ꯭ꯔꯤꯝ ꯌꯥꯑꯣꯕꯥ ꯑꯉꯧꯕꯥ, ꯑꯃꯁꯨꯡ ꯍꯧꯖꯤꯀꯁꯨ ꯇꯔꯨ ꯇꯅꯥꯅꯕꯥ"
"beside it. Looking at the two pots, he had to laugh",ꯃꯁꯤꯒꯤ ꯃꯅꯥꯛꯇꯥ ꯂꯩ꯫
158,꯱꯵꯸ ꯑꯃꯁꯨꯡ ꯑꯦꯟ.
"‘But the next one will be better,’ he said, and began to moisten","‘ ꯑꯗꯨꯕꯨ ꯃꯊꯪꯒꯤ ꯑꯃꯅꯥ ꯍꯦꯟꯅꯥ ꯐꯒꯅꯤ’ ꯍꯥꯌꯅꯥ ꯃꯍꯥꯛꯅꯥ ꯍꯥꯌꯈꯤ, ꯑꯃꯁꯨꯡ ꯏꯁꯤꯡ ꯇꯨꯡꯁꯤꯅꯕꯥ ꯍꯧꯔꯀꯈꯤ꯫"
another piece of clay,ꯀ꯭ꯂꯦ ꯑꯃꯒꯤ ꯑꯇꯣꯞꯄꯥ ꯁꯔꯨꯛ ꯑꯃꯥ .
"To fashion, to give form, to feel his fingers gaining in skill and","ꯐꯦꯁꯟ ꯇꯧꯅꯕꯥ, ꯐꯔꯝ ꯄꯤꯕꯥ, ꯃꯍꯥꯛꯀꯤ ꯃꯈꯨꯠꯁꯤꯡ ꯑꯗꯨ ꯍꯩꯊꯣꯏ-ꯁꯤꯡꯊꯣꯏꯕꯗꯥ ꯐꯪꯂꯤꯕꯥ ꯑꯗꯨ ꯐꯥꯑꯣꯕꯥ ꯑꯃꯁꯨꯡ ."
"power— this gave him an extraordinary pleasure. ‘A, B, C,",ꯄꯥꯋꯔ— ꯃꯁꯤꯅꯥ ꯃꯍꯥꯀꯄꯨ ꯑꯆꯝꯕꯥ ꯅꯨꯡꯉꯥꯏꯕꯥ ꯑꯃꯥ ꯄꯤꯈꯤ꯫
"Vitamin D,’ he sang to himself as he worked, ‘The fat’s in the","ꯚꯤꯇꯥꯃꯤꯟ ꯗꯤ,’ ꯃꯍꯥꯛꯅꯥ ꯊꯕꯛ ꯇꯧꯔꯤꯉꯩꯗꯥ ꯃꯁꯥꯃꯀꯄꯨ ꯏꯁꯩ ꯁꯀꯈꯤ, ‘ꯗꯤ ꯐꯦꯠ’ꯁ ꯏꯟ ꯗꯤ ."
"liver, the cod’s in the sea.’ And Mitsima also sang—a song about","ꯂꯤꯚꯔ, ꯗꯤ ꯀꯣꯗ’ꯁ ꯏꯟ ꯗꯤ ꯁꯤ꯫’ ꯑꯃꯁꯨꯡ ꯃꯤꯠꯁꯤꯃꯥꯁꯨ ꯏꯁꯩ ꯁꯀꯈꯤ—ꯃꯁꯤꯒꯤ ꯃꯇꯥꯡꯗꯥ ꯏꯁꯩ ꯑꯃꯥ꯫"
"killing a bear. They worked all day, and all day he was filled with",ꯎꯆꯦꯛ ꯑꯃꯥ ꯍꯥꯠꯄꯥ꯫
"an intense, absorbing happiness","ꯌꯥꯝꯅꯥ ꯁꯥꯊꯤꯕꯥ, ꯑꯦꯕꯁꯣꯔꯕꯤꯡ ꯑꯣꯏꯕꯥ ꯅꯨꯡꯉꯥꯏꯕꯥ ꯑꯃꯥ ."
"‘Next winter,’ said old Mitsima, ‘I will teach you to make the","‘ꯃꯊꯪꯒꯤ ꯋꯤꯟꯇꯔ’ ꯍꯥꯌꯅꯥ ꯑꯣꯜꯗ ꯃꯤꯠꯁꯤꯃꯥꯅꯥ ꯍꯥꯌꯈꯤ, ‘ꯑꯩꯅꯥ ꯅꯈꯣꯌꯗꯥ ꯅꯍꯥꯀꯄꯨ ꯁꯦꯝꯅꯕꯥ ꯇꯥꯀꯄꯤꯒꯅꯤ"
bow.’,ꯀꯣꯛ ꯅꯣꯟꯕ.'
He stood for a long time outside the house; and at last the,ꯃꯍꯥꯛ ꯌꯨꯃꯒꯤ ꯃꯄꯥꯟꯗꯥ ꯃꯇꯝ ꯁꯥꯡꯅꯥ ꯂꯦꯞꯂꯝꯃꯤ;
ceremonies within were finished. The door opened; they came,ꯃꯅꯨꯡꯗꯥ ꯂꯩꯕꯥ ꯊꯧꯔꯃꯁꯤꯡ ꯂꯣꯏꯁꯤꯅꯈꯤ꯫
"out. Kothlu came first, his right hand outstretched and tightly",ꯃꯄꯥꯟ.
"closed, as though over some precious jewel. Her clenched hand","ꯀ꯭ꯂꯣꯖ ꯇꯧꯔꯕꯥ, ꯃꯃꯜ ꯌꯥꯝꯂꯕꯥ ꯖꯨꯌꯦꯜ ꯈꯔꯒꯤ ꯃꯊꯛꯇꯥ ꯂꯩꯕꯥ ꯑꯣꯏꯅꯥ꯫"
"similarly outstretched, Kiakimé followed. They walked in silence,","ꯃꯇꯧ ꯑꯁꯨꯝꯅꯥ ꯑꯥꯎꯠꯁ꯭ꯠꯔ ꯇꯧꯈꯤ, ꯀꯤꯌꯥꯀꯤꯃꯦꯅꯥ ꯃꯇꯨꯡ ꯏꯜꯂꯀꯈꯤ꯫"
"and in silence, behind them, came the brothers and sisters and","ꯑꯃꯁꯨꯡ ꯅꯤꯡꯊꯤꯖꯅꯥ, ꯃꯈꯣꯌꯒꯤ ꯃꯇꯨꯡꯗꯥ, ꯃꯔꯨꯄꯁꯤꯡ ꯑꯃꯁꯨꯡ ꯃꯔꯨꯄꯁꯤꯡꯅꯥ ꯂꯥꯀꯈꯤ ꯑꯃꯁꯨꯡ ."
cousins and all the troop of old people,ꯃꯔꯨꯄꯁꯤꯡ ꯑꯃꯁꯨꯡ ꯑꯍꯜ ꯑꯣꯏꯔꯕꯥ ꯃꯤꯑꯣꯏꯁꯤꯡꯒꯤ ꯂꯥꯟꯃꯤ ꯄꯨꯝꯅꯃꯛ
"They walked out of the pueblo, across the mesa. At the edge of","ꯃꯈꯣꯌꯅꯥ ꯄꯨꯌꯦꯕꯂꯣꯗꯒꯤ ꯊꯣꯔꯀꯈꯤ, ꯃꯦꯁꯥꯒꯤ ꯃꯄꯥꯟꯗꯥ꯫"
"the cliff they halted, facing the early morning sun. Kothlu","ꯃꯈꯣꯌꯅꯥ ꯂꯦꯄꯈꯤꯕꯥ ꯀ꯭ꯂꯤꯐ, ꯑꯌꯨꯛꯀꯤ ꯑꯉꯅꯕꯥ ꯅꯨꯃꯤꯠꯀꯤ ꯃꯅꯥꯛꯇꯥ꯫"
opened his hand. A pinch of corn meal lay white on the palm; he,ꯃꯍꯥꯛꯀꯤ ꯈꯨꯠ ꯍꯥꯡꯗꯣꯀꯈꯤ꯫
"breathed on it, murmured a few words, then threw it, a handful","ꯃꯗꯨꯗꯥ ꯁ꯭ꯕꯔ ꯍꯣꯅꯈꯤ, ꯋꯥꯍꯩ ꯈꯔꯥ ꯍꯥꯌꯔꯀꯈꯤ, ꯃꯗꯨꯒꯤ ꯃꯇꯨꯡꯗꯥ ꯊꯥꯈꯤ, ꯃꯈꯨꯠ ꯑꯃꯥ"
"of white dust, towards the sun. Kiakimé did the same. Then","ꯋꯥꯏꯠ ꯗꯁ꯭ꯇꯀꯤ, ꯅꯨꯃꯤꯠꯀꯤ ꯃꯅꯥꯛꯇꯥ꯫"
"Kiakimé’s father stepped forward, and holding up a feathered","ꯀꯤꯌꯥꯀꯤꯃꯦꯒꯤ ꯃꯄꯥꯅꯥ ꯃꯥꯡꯂꯣꯃꯗꯥ ꯆꯪꯁꯤꯅꯈꯤ, ꯑꯃꯁꯨꯡ ꯐꯤꯔꯣꯜ ꯑꯃꯥ ꯊꯃꯗꯨꯅꯥ ."
159,꯱꯵꯹ ꯑꯃꯁꯨꯡ ꯑꯦꯟ.
"prayer stick, made a long prayer, then threw the stick after the","ꯄ꯭ꯔꯥꯔꯊꯅꯥ ꯇꯧꯕꯥ ꯁ꯭ꯇꯤꯛ, ꯁꯥꯡꯂꯕꯥ ꯄ꯭ꯔꯥꯔꯊꯅꯥ ꯑꯃꯥ ꯇꯧꯈꯤ, ꯃꯗꯨꯒꯤ ꯃꯇꯨꯡꯗꯥ ꯁ꯭ꯇꯤꯛ ꯑꯗꯨ ꯊꯥꯈꯤ ꯃꯗꯨꯒꯤ ꯃꯇꯨꯡꯗꯥ ."
corn meal,ꯀꯣꯔꯟ ꯃꯤꯜ .
"‘It is finished,’ said old Mitsima in a loud voice. ‘They are",‘ꯃꯁꯤ ꯂꯣꯏꯔꯦ’ ꯍꯥꯌꯅꯥ ꯑꯔꯤꯕꯥ ꯃꯤꯠꯁꯤꯃꯥꯅꯥ ꯑꯀꯅꯕꯥ ꯈꯣꯟꯖꯦꯜ ꯑꯃꯗꯥ ꯍꯥꯌꯔꯀꯏ꯫
"married.’ ‘Well,’ said Linda, as they turned away, ‘all I can say is,","ꯂꯨꯍꯣꯡꯈꯤ꯫’ ‘ꯑꯐꯕꯥ,’ ꯃꯈꯣꯌꯅꯥ ꯂꯥꯀꯄꯗꯥ ꯂꯤꯟꯗꯥ ꯍꯥꯌꯔꯀꯏ, ‘ꯑꯩꯅꯥ ꯍꯥꯌꯕꯥ ꯉꯝꯕꯥ ꯄꯨꯝꯅꯃꯛ ꯑꯁꯤ,"
it does seem a lot,ꯃꯁꯤ ꯌꯥꯝꯅꯥ ꯌꯥꯝꯅꯥ ꯎꯕꯥ ꯐꯪꯏ .
"wants to have a girl, he just . . . But where are you going, John?’","ꯅꯨꯄꯤꯃꯆꯥ ꯑꯃꯥ ꯂꯩꯕꯥ ꯄꯥꯝꯃꯤ, ꯃꯍꯥꯛꯅꯥ ꯁꯨꯞꯅꯇꯒꯤ ."
"He paid no attention to her calling, but ran on, away, away,","ꯃꯍꯥꯛꯅꯥ ꯃꯍꯥꯛꯀꯤ ꯀꯧꯔꯀꯄꯥ ꯑꯗꯨꯗꯥ ꯃꯤꯠꯌꯦꯡ ꯑꯃꯠꯇꯥ ꯊꯃꯈꯤꯗꯦ, ꯑꯗꯨꯕꯨ ꯂꯥꯟꯗꯥꯈꯤ, ꯂꯥꯞꯅꯥ, ꯂꯥꯞꯅꯥ ꯂꯩꯕꯥ꯫"
anywhere to be by himself,ꯃꯐꯝ ꯑꯃꯗꯥ ꯍꯦꯛꯇꯥ ꯂꯩꯖꯕꯥ .
It is finished. Old Mitsima’s words repeated themselves in his,ꯃꯁꯤ ꯂꯣꯏꯁꯤꯅꯈ꯭ꯔꯦ꯫
"mind. Finished, finished . . . In silence and from a long way off,",ꯋꯥꯈꯜ.
"but violently, desperately, hopelessly, he had loved Kiakimé. And","ꯑꯗꯨꯕꯨ ꯍꯤꯡꯁꯥꯅꯥ, ꯌꯥꯝꯅꯥ ꯋꯥꯅꯥ, ꯑꯥꯁꯥ ꯂꯩꯇꯅꯥ, ꯃꯍꯥꯛꯅꯥ ꯀꯤꯌꯥꯀꯤꯃꯦꯕꯨ ꯅꯨꯡꯁꯤꯖꯔꯝꯃꯤ꯫"
now it was finished. He was sixteen,ꯍꯧꯖꯤꯛꯇꯤ ꯂꯣꯏꯔꯦ꯫
"At the full moon, in the Antelope Kiva, secrets would be told,","ꯃꯄꯨꯡ ꯐꯥꯕꯥ ꯊꯥꯗꯥ, ꯑꯦꯟꯇꯤꯂꯣꯞ ꯀꯤꯚꯥꯗꯥ, ꯁꯤꯛꯔꯦꯠꯁꯤꯡ ꯍꯥꯌꯒꯅꯤ,"
"secrets would be done and borne. They would go down, boys,",ꯒꯣꯄꯟ ꯑꯣꯏꯕꯥ ꯊꯕꯀꯁꯤꯡ ꯄꯥꯡꯊꯣꯛꯀꯅꯤ ꯑꯃꯁꯨꯡ ꯂꯧꯒꯅꯤ꯫
"into the kiva and come out again, men. The boys were all afraid","ꯀꯤꯚꯥꯗꯥ ꯌꯥꯑꯣꯔꯒꯥ ꯑꯃꯨꯛ ꯊꯣꯛꯂꯀꯏ, ꯅꯨꯄꯥꯁꯤꯡ꯫"
and at the same time impatient. And at last it was the day. The,ꯑꯃꯁꯨꯡ ꯃꯇꯝ ꯑꯗꯨꯃꯛꯇꯗꯥ ꯑꯁꯥꯑꯣꯕꯥ ꯂꯩꯇꯕꯥ꯫
"sun went down, the moon rose. He went with the others. Men","ꯅꯨꯃꯤꯠ ꯆꯨꯞꯄꯥ ꯑꯃꯥ ꯂꯥꯀꯈꯤ, ꯊꯥꯅꯥ ꯂꯥꯀꯈꯤ꯫"
"were standing, dark, at the entrance to the kiva; the ladder went","ꯂꯦꯞꯂꯝꯃꯤ, ꯑꯃꯝꯕꯥ, ꯀꯤꯚꯥꯒꯤ ꯃꯅꯥꯛꯇꯥ ꯂꯩꯕꯥ;"
down into the red lighted depths. Already the leading boys had,ꯂꯥꯂꯍꯧꯒꯤ ꯃꯉꯥꯂꯒꯤ ꯃꯊꯛꯇꯥ ꯊꯨꯅꯥ ꯌꯥꯡꯅꯥ ꯆꯦꯜꯂꯤ꯫
begun to climb down. Suddenly one of the men stepped,ꯃꯈꯥꯗꯥ ꯂꯥꯀꯄꯥ ꯍꯧꯔꯦ꯫
"forward, caught him by the arm, and pulled him out of the","ꯃꯃꯥꯡꯗꯥ, ꯃꯍꯥꯀꯄꯨ ꯈꯨꯠꯁꯥꯒꯤ ꯃꯅꯥꯛꯇꯥ ꯐꯥꯈꯤ, ꯑꯃꯁꯨꯡ ꯃꯍꯥꯀꯄꯨ ꯂꯧꯊꯣꯀꯈꯤ꯫"
ranks. He broke free and dodged back into his place among the,ꯔꯦꯉ꯭ꯀꯁꯤꯡ ꯂꯩ꯫
160,꯱꯶꯰ ꯑꯃꯁꯨꯡ ꯑꯦꯟ.
"others. This time the man struck him, pulled his hair. ‘Not for",ꯑꯇꯣꯞꯄꯁꯤꯡ꯫
"you,","ꯑꯗꯣꯝ,"
"white-hair!’ ‘Not for the son of the she-dog,’ said one of the","ꯋꯥꯏꯇꯦꯞ-ꯍꯦꯌꯥꯔ!’ ‘ꯁꯦ-ꯗꯣꯒꯀꯤ ꯃꯆꯥꯒꯤꯗꯃꯛ ꯅꯠꯇꯦ,’ ꯍꯥꯌꯅꯥ ꯑꯃꯅꯥ ꯑꯃꯅꯥ ꯍꯥꯌꯈꯤ꯫"
other men. The boys laughed. ‘Go!’ And as he still hovered on,ꯑꯇꯣꯞꯄꯥ ꯅꯨꯄꯥꯁꯤꯡ꯫
"the fringes of the group, ‘Go!’ the men shouted again. One of",‘ꯒꯣ!’ ꯍꯥꯌꯕꯥ ꯀꯥꯡꯂꯨꯞ ꯑꯁꯤꯒꯤ ꯊꯣꯡꯁꯤꯡ ꯑꯗꯨ ꯅꯨꯄꯥꯁꯤꯡꯅꯥ ꯑꯃꯨꯛ ꯍꯟꯅꯥ ꯂꯥꯎꯔꯀꯏ꯫
"them bent down, took a stone, threw it. ‘Go, go, go!’ There was a","ꯃꯈꯣꯌꯅꯥ ꯀꯨꯄꯁꯤꯜꯂꯒꯥ, ꯁꯤꯜ ꯑꯃꯥ ꯂꯧꯈꯤ, ꯃꯗꯨ ꯊꯥꯗꯣꯀꯈꯤ꯫"
"shower of stones. Bleeding, he ran away into the darkness. From",ꯁꯤꯂꯁꯤꯡꯒꯤ ꯁꯣꯔꯣꯛ꯫
the red-lit kiva came the noise of singing. The last of the boys,ꯂꯥꯂꯍꯧꯕꯥ ꯀꯤꯚꯥ ꯑꯗꯨꯅꯥ ꯏꯁꯩꯒꯤ ꯈꯣꯟꯖꯦꯜ ꯂꯥꯀꯈꯤ꯫
had climbed down the ladder. He was all alone,ꯂꯦꯗꯔꯗꯥ ꯂꯥꯀꯈꯤꯕꯅꯤ꯫
"All alone, outside the pueblo, on the bare plain of the mesa. The","ꯄꯨꯝꯅꯃꯛ ꯑꯁꯤ, ꯄꯨꯌꯦꯕꯂꯣꯒꯤ ꯃꯄꯥꯟꯗꯥ, ꯃꯦꯁꯥꯒꯤ ꯑꯁꯪꯕꯥ ꯃꯐꯃꯗꯥ ꯂꯩ꯫"
rock was like bleached bones in the moonlight. Down in the,ꯁꯤꯜ ꯑꯁꯤ ꯊꯥꯒꯤ ꯃꯉꯥꯂꯗꯥ ꯕ꯭ꯂꯤꯆ ꯇꯧꯔꯕꯥ ꯁꯔꯨꯁꯤꯡꯒꯨꯝ ꯑꯣꯏꯈꯤ꯫
"valley, the coyotes were howling at the moon. The bruises hurt","ꯚꯦꯂꯤ, ꯀꯣꯌꯂꯥꯁꯤꯡꯅꯥ ꯊꯥꯗꯥ ꯍꯨꯔꯥꯟꯗꯨꯅꯥ ꯂꯩꯔꯝꯃꯤ꯫"
"him, the cuts were still bleeding; but it was not for pain that he","ꯃꯍꯥꯛ, ꯀꯠꯊꯣꯀꯄꯁꯤꯡ ꯑꯗꯨ ꯍꯧꯖꯤꯀꯁꯨ ꯏ ꯊꯣꯀꯄꯥ;"
"sobbed; it was because he was all alone, because he had been",ꯁꯣꯕ ꯇꯧꯈꯤ;
"driven out, alone, into this skeleton world of rocks and","ꯗ꯭ꯔꯥꯏꯕꯟ ꯑꯥꯎꯠ, ꯃꯁꯥ ꯃꯊꯟꯇꯥ, ꯁꯤꯂꯁꯤꯡꯒꯤ ꯁ꯭ꯀꯦꯂꯦꯇꯟ ꯃꯥꯂꯦꯝ ꯑꯁꯤꯗꯥ ꯑꯃꯁꯨꯡ ."
moonlight. At the edge of the precipice he sat down. The moon,ꯊꯥꯒꯤ ꯃꯉꯥꯜ꯫
was behind him; he looked down into the black shadow of the,ꯃꯍꯥꯛꯀꯤ ꯃꯇꯨꯡꯗꯥ ꯂꯩꯔꯝꯃꯤ;
"mesa, into the black shadow of death. He had only to take one","ꯃꯦꯁꯥ, ꯁꯤꯕꯒꯤ ꯕ꯭ꯂꯦꯛ ꯁꯦꯗꯣꯡꯗꯥ꯫"
"step, one little jump He held out his right hand in the","ꯈꯣꯡꯊꯥꯡ, ꯋꯥꯟ ꯂꯤꯇꯜ ꯖꯝꯄ ꯃꯍꯥꯛꯅꯥ ꯃꯍꯥꯛꯀꯤ ꯂꯃꯖꯤꯡ ꯃꯈꯥꯗꯥ ꯊꯃꯈꯤ"
moonlight. From the cut on his wrist the blood was still oozing,ꯊꯥꯒꯤ ꯃꯉꯥꯜ꯫
"Every few seconds a drop fell, dark, almost colourless in the","ꯁꯦꯀꯦꯟꯗ ꯈꯔꯒꯤ ꯃꯅꯨꯡꯗꯥ ꯗ꯭ꯔꯣꯞ ꯑꯃꯥ ꯁꯣꯀꯈꯤ, ꯑꯃꯝꯕꯥ, ꯆꯥꯎꯔꯥꯛꯅꯥ ꯃꯆꯨ ꯂꯩꯇꯕꯥ ."
"dead light. Drop, drop, drop. To-morrow and to-morrow and to-",ꯑꯁꯤꯕꯥ ꯃꯉꯥꯜ ꯂꯩꯕꯥ꯫
morrow . .,ꯃꯣꯔꯣ .
161,꯱꯶꯱ ꯑꯃꯁꯨꯡ ꯑꯦꯟ.
"He had discovered Time and Death and God. ‘Alone, always",ꯃꯍꯥꯛꯅꯥ ꯃꯇꯝ ꯑꯃꯁꯨꯡ ꯁꯤꯕꯥ ꯑꯃꯁꯨꯡ ꯏꯁ꯭ꯕꯔꯒꯤ ꯃꯔꯃꯗꯥ ꯈꯉꯕꯥ ꯉꯃꯈꯤ꯫
"alone,’ the young man was saying","ꯃꯁꯥ ꯃꯊꯟꯇꯥ,’ ꯍꯥꯌꯅꯥ ꯅꯍꯥ ꯑꯗꯨꯅꯥ ꯍꯥꯌꯔꯝꯃꯤ"
"The words awoke a plaintive echo in Bernard’s mind. Alone,",ꯋꯥꯍꯩꯁꯤꯡ ꯑꯁꯤꯅꯥ ꯕꯔꯅꯥꯔꯗꯀꯤ ꯋꯥꯈꯂꯗꯥ ꯄ꯭ꯂꯦꯅꯇꯤꯕ ꯏꯀꯣ ꯑꯃꯥ ꯄꯣꯀꯍꯅꯈꯤ꯫
alone,ꯃꯊꯟꯇ
‘So,'ꯑꯗꯨ ꯑꯣꯏꯔꯕꯗꯤ
"am I,’ he said, on a gush of confidingness. ‘Terribly alone.’","ꯑꯩꯅꯤ,’ ꯍꯥꯌꯅꯥ ꯃꯍꯥꯛꯅꯥ ꯍꯥꯌꯈꯤ, ꯀꯟꯐꯤꯗꯅꯦꯁꯀꯤ ꯒꯨꯁ ꯑꯃꯗꯥ꯫"
‘Are you?’ John looked surprised. ‘I thought that in the Other,‘ꯅꯉꯅꯥ ꯂꯩꯔꯤꯕꯔꯥ?’ ꯖꯣꯖꯣꯅꯥ ꯑꯉꯀꯄꯥ ꯐꯥꯑꯣꯈꯤ꯫
Place,ꯃꯐꯝ
I,ꯑꯩ
"mean, Linda always said that nobody was ever alone there.’","ꯃꯤꯟ, ꯂꯤꯟꯗꯥ ꯃꯇꯝ ꯄꯨꯝꯅꯃꯛꯇꯥ ꯍꯥꯌꯔꯝꯃꯤ ꯃꯗꯨꯗꯤ ꯀꯅꯥꯒꯨꯝꯕꯥ ꯑꯃꯠꯇꯥ ꯃꯐꯝ ꯑꯗꯨꯗꯥ ꯀꯩꯗꯧꯅꯨꯡꯗꯥ ꯃꯁꯥ ꯃꯊꯟꯇꯥ ꯂꯩꯈꯤꯗꯦ꯫’"
"Bernard blushed uncomfortably. ‘You see,’ he said, mumbling",ꯕꯔꯅꯥꯔꯗꯅꯥ ꯅꯨꯡꯉꯥꯏꯇꯕꯥ ꯃꯑꯣꯡꯗꯥ ꯕ꯭ꯂꯥꯁ ꯇꯧꯈꯤ꯫
"and with averted eyes, ‘I’m rather different from most people, I","ꯑꯃꯁꯨꯡ ꯑꯦꯚꯥꯔꯇꯦꯗ ꯃꯤꯠꯌꯦꯡꯒꯥ ꯂꯣꯌꯅꯅꯥ, ‘ꯑꯩꯍꯥꯛ ꯑꯁꯤ ꯃꯤꯑꯣꯏ ꯑꯌꯥꯝꯕꯗꯒꯤ ꯍꯦꯟꯅꯥ ꯈꯦꯠꯅꯩ, ꯑꯩ ."
suppose. If one happens to be decanted different ’,ꯀꯔꯤꯒꯨꯝꯕ ꯑꯃ ꯑꯣꯏꯔꯁꯤ ꯍꯥꯏꯅ ꯈꯅꯁꯤ.
"‘Yes, that’s just it.’ The young man nodded. ‘If one’s different,","‘ꯍꯣꯌ, ꯃꯗꯨ ꯈꯛꯇꯅꯤ꯫’ ꯅꯍꯥ ꯑꯗꯨꯅꯥ ꯅꯣꯀꯈꯤ꯫"
"one’s bound to be lonely. They’re beastly to one. Do you know,",ꯀꯅꯥꯒꯨꯝꯕꯥ ꯑꯃꯅꯥ ꯇꯪꯗꯨ ꯂꯩꯇꯥꯕꯥ ꯑꯣꯏꯒꯅꯤ꯫
they shut me out of absolutely everything? When the other boys,ꯃꯈꯣꯌꯅꯥ ꯑꯩꯕꯨ ꯃꯄꯨꯡ ꯐꯥꯅꯥ ꯄꯨꯝꯅꯃꯛꯇꯒꯤ ꯊꯤꯡꯖꯤꯜꯂꯤꯕꯔꯥ?
"were sent out to spend the night on the mountains—you know,","ꯅꯨꯃꯤꯠ ꯑꯗꯨ ꯇꯨꯔꯦꯂꯗꯥ ꯂꯦꯞꯅꯕꯥ ꯊꯥꯔꯀꯈꯤ—ꯑꯗꯣꯝꯅꯥ ꯈꯉꯕꯤꯔꯤꯕꯥ ꯑꯗꯨꯅꯤ,"
when you have to dream which your sacred animal is—they,ꯅꯍꯥꯛꯀꯤ ꯁꯦꯡꯂꯕꯥ ꯁꯥ-ꯁꯟ ꯑꯗꯨ ꯀꯅꯥꯅꯣ ꯍꯥꯌꯕꯗꯨ ꯅꯍꯥꯛꯅꯥ ꯃꯪꯂꯥꯟ ꯇꯧꯕꯥ ꯇꯥꯔꯀꯄꯥ ꯃꯇꯃꯗꯥ—ꯃꯈꯣꯌꯅꯥ .
wouldn’t let me go with the others; they wouldn’t tell me any of,ꯑꯩꯕꯨ ꯑꯇꯣꯞꯄꯁꯤꯡꯒꯥ ꯂꯣꯌꯅꯅꯥ ꯆꯠꯄꯥ ꯌꯥꯍꯅꯈꯤꯔꯣꯏ;
"the secrets. I did it by myself, though,’ he added. ‘Didn’t eat",ꯁꯤꯛꯔꯦꯇꯁꯤꯡ ꯑꯗꯨ꯫
anything for five days and then went out one night alone into,ꯅꯨꯃꯤꯠ ꯃꯉꯥꯅꯤꯒꯤ ꯑꯣꯏꯅꯥ ꯀꯔꯤꯒꯨꯝꯕꯥ ꯑꯃꯠꯇꯥ ꯑꯃꯁꯨꯡ ꯃꯗꯨꯒꯤ ꯃꯇꯨꯡꯗꯥ ꯅꯨꯃꯤꯠ ꯑꯃꯥ ꯃꯁꯥꯅꯥ ꯃꯁꯥꯕꯨ .
those mountains there.’ He pointed,ꯃꯐꯝ ꯑꯗꯨꯗꯥ ꯂꯩꯔꯤꯕꯥ ꯇꯨꯔꯦꯂꯁꯤꯡ ꯑꯗꯨ꯫’ ꯃꯍꯥꯛꯅꯥ ꯄꯅꯈꯤ
"Patronizingly, Bernard smiled. ‘And did you dream of anything?’",ꯄꯦꯠꯔꯣꯅꯤꯖ ꯑꯣꯏꯅꯥ ꯕꯔꯅꯥꯔꯗꯅꯥ ꯅꯣꯀꯈꯤ꯫
he asked. The other nodded. ‘But I mustn’t tell you what.’ He,ꯃꯍꯥꯛꯅꯥ ꯍꯪꯈꯤ꯫
"was silent for a little; then, in a low voice, ‘Once,’ he went on, ‘I",ꯈꯔꯥ ꯑꯃꯒꯤꯗꯃꯛ ꯋꯥ ꯉꯥꯡꯈꯤ;
162,꯱꯶꯲ ꯑꯃꯁꯨꯡ ꯑꯦꯟ.
did something that none of the others did: I stood against a,ꯑꯇꯣꯞꯄꯥ ꯀꯅꯥ ꯑꯃꯠꯇꯅꯥ ꯇꯧꯈꯤꯗꯕꯥ ꯋꯥꯐꯝ ꯑꯃꯥ ꯇꯧꯈꯤ: ꯑꯩꯅꯥ ꯑꯃꯒꯤ ꯃꯥꯌꯣꯛꯇꯥ ꯂꯦꯄꯈꯤ꯫
"rock in the middle of the day, in summer, with my","ꯅꯨꯃꯤꯠꯀꯤ ꯃꯔꯛꯇꯥ, ꯑꯌꯨꯛꯇꯥ, ꯑꯩꯒꯤ ."
"arms out, like Jesus on the cross.’ ‘What on earth for?’","ꯈꯨꯠꯁꯝꯅꯗꯨꯅꯥ, ꯀ꯭ꯔꯣꯁꯇꯥ ꯂꯩꯔꯤꯕꯥ ꯌꯤꯁꯨꯒꯨꯝꯅꯥ꯫’ ‘ꯄ꯭ꯔ꯭ꯏꯊꯤꯕꯤꯗꯥ ꯀꯔꯤꯒꯤꯗꯃꯛ?’"
‘I wanted to know what it was like being crucified. Hanging,‘ꯑꯩꯍꯥꯛꯅꯥ ꯀ꯭ꯔꯨꯁꯤꯐꯥꯏꯗ ꯇꯧꯕꯥ ꯑꯁꯤ ꯀꯔꯤꯅꯣ ꯍꯥꯌꯕꯥ ꯈꯉꯕꯥ ꯄꯥꯃꯈꯤ꯫
there in the,ꯃꯐꯝ ꯑꯗꯨꯗꯥ .
sun . . .’,ꯅꯨꯃꯤꯠ .
‘But why?’,‘ ꯑꯗꯨꯕꯨ ꯀꯔꯤꯒꯤꯅꯣ?’
‘Why? Well . . .’ He hesitated. ‘Because I felt I ought to. If Jesus,'ꯀꯔꯤꯒꯤꯅꯣ?
"could stand it. And then, if one has done something wrong . .",ꯃꯁꯤ ꯂꯦꯞꯄꯥ ꯉꯃꯈꯤ꯫
"Besides, I was unhappy; that was another reason.’",ꯃꯁꯤꯒꯤ ꯃꯊꯛꯇꯥ ꯑꯩꯍꯥꯛ ꯅꯨꯡꯉꯥꯏꯇꯕꯥ ꯐꯥꯑꯣꯈꯤ;
"‘It seems a funny way of curing your unhappiness,’ said",‘ꯑꯗꯣꯃꯒꯤ ꯅꯨꯡꯉꯥꯏꯇꯕꯥ ꯐꯍꯅꯕꯒꯤ ꯅꯨꯡꯉꯥꯏꯕꯥ ꯃꯑꯣꯡ ꯑꯃꯥ ꯑꯣꯏꯅꯥ ꯎꯏ’ ꯍꯥꯌꯅꯥ ꯍꯥꯌꯈꯤ꯫
"Bernard. But on second thoughts he decided that there was,",ꯕꯔꯅꯥꯔꯗ ꯑꯣꯏꯅꯥ ꯑꯦꯝ.
"after all, some sense in it. Better than taking soma. . .","ꯄꯨꯝꯅꯃꯛ ꯑꯁꯤꯒꯤ ꯃꯇꯨꯡꯗꯥ, ꯃꯁꯤꯗꯥ ꯋꯥꯈꯜꯂꯣꯟ ꯈꯔꯥ ꯂꯩ꯫"
"‘I fainted after a time,’ said the young man. ‘Fell down on my",‘ꯑꯩ ꯃꯇꯃꯒꯤ ꯃꯇꯨꯡꯗꯥ ꯃꯔꯥꯜ ꯁꯤꯈꯤ’ ꯍꯥꯌꯅꯥ ꯅꯍꯥ ꯑꯗꯨꯅꯥ ꯍꯥꯌꯔꯀꯏ꯫
face. Do you see the mark where I cut myself?’ He lifted the,ꯃꯥꯏ.
"thick yellow hair from his forehead. The scar showed, pale and",ꯃꯍꯥꯛꯀꯤ ꯃꯀꯣꯀꯊꯣꯡꯕꯗꯒꯤ ꯑꯀꯅꯕꯥ ꯌꯦꯜꯂꯣ ꯆꯨ꯫
"puckered, on his right temple","ꯄꯨꯀꯆꯦꯜ ꯁꯦꯡꯅꯥ, ꯃꯍꯥꯛꯀꯤ ꯂꯃꯖꯤꯡ ꯃꯈꯥꯗꯥ ꯂꯩꯕꯥ ꯃꯟꯗꯤꯔ"
"Bernard looked, and then quickly, with a little shudder, averted","ꯕꯔꯅꯥꯔꯗꯅꯥ ꯌꯦꯡꯈꯤ, ꯑꯃꯁꯨꯡ ꯃꯗꯨꯒꯤ ꯃꯇꯨꯡꯗꯥ ꯊꯨꯅꯥ, ꯈꯔꯥ ꯊꯨꯅꯥ ꯌꯥꯡꯅꯥ, ꯑꯦꯚꯥꯔꯠ ꯇꯧꯈꯤ"
his eyes. His conditioning had made him not so much pitiful as,ꯃꯍꯥꯛꯀꯤ ꯃꯤꯠꯌꯦꯡ꯫
profoundly squeamish. The mere suggestion of illness or wounds,ꯌꯥꯝꯅꯥ ꯂꯨꯅꯥ ꯁꯣꯀꯄꯥ꯫
