en,mni-Mtei
Have your say in treatment – your GP or psychiatrist should discuss all your,ꯂꯥꯌꯦꯡꯕꯗꯥ ꯅꯍꯥꯛꯀꯤ ꯋꯥꯐꯝ ꯊꯃꯕꯤꯌꯨ – ꯅꯍꯥꯛꯀꯤ ꯖꯤ.ꯄꯤ. ꯅꯠꯠꯔꯒꯥ ꯁꯥꯏꯀꯤꯌꯥꯠꯔꯤꯛ ꯑꯗꯨꯅꯥ ꯅꯍꯥꯛꯀꯤ ꯄꯨꯝꯅꯃꯛ ꯑꯗꯨ ꯈꯟꯅꯒꯗꯕꯅꯤ
"treatment options with you, and your views and preferences should always be","ꯑꯗꯣꯃꯒꯥ ꯂꯣꯌꯅꯅꯥ ꯂꯥꯌꯦꯡꯕꯒꯤ ꯑꯣꯄꯁꯅꯁꯤꯡ, ꯑꯃꯁꯨꯡ ꯑꯗꯣꯃꯒꯤ ꯋꯥꯈꯜꯂꯣꯅꯁꯤꯡ ꯑꯃꯁꯨꯡ ꯄꯁꯟꯗꯁꯤꯡ ꯃꯇꯝ ꯄꯨꯝꯅꯃꯛꯇꯥ ꯑꯣꯏꯒꯗꯕꯅꯤ꯫"
taken into account when making decisions about your treatment. See our pages,ꯅꯍꯥꯛꯀꯤ ꯂꯥꯏꯌꯦꯡꯒꯤ ꯃꯇꯥꯡꯗꯥ ꯋꯥꯔꯦꯞ ꯂꯧꯕꯥ ꯃꯇꯃꯗꯥ ꯂꯧꯈꯠꯄꯥ꯫
on seeking help for a mental health problem for more information on having your,ꯅꯍꯥꯛꯀꯤ ꯂꯩꯕꯒꯤ ꯃꯇꯥꯡꯗꯥ ꯍꯦꯟꯅꯥ ꯏꯅꯐꯣꯔꯃꯦꯁꯟ ꯐꯪꯅꯕꯒꯤꯗꯃꯛ ꯃꯦꯟꯇꯦꯜ ꯍꯦꯂꯊ ꯄ꯭ꯔꯣꯕ꯭ꯂꯦꯝ ꯑꯃꯒꯤꯗꯃꯛ ꯃꯇꯦꯡ ꯂꯧꯕꯒꯤ ꯃꯇꯥꯡꯗꯥ꯫
say,ꯍꯥꯏꯕ
Be involved in your care plan – a care plan is an agreement between you and the,ꯅꯍꯥꯛꯀꯤ ꯀꯦꯌꯔ ꯄ꯭ꯂꯥꯟ ꯑꯗꯨꯗꯥ ꯁꯔꯨꯛ ꯌꯥꯕꯤꯌꯨ – ꯀꯦꯌꯔ ꯄ꯭ꯂꯥꯟ ꯍꯥꯌꯕꯁꯤ ꯅꯍꯥꯛ ꯑꯃꯁꯨꯡ ꯅꯍꯥꯛꯀꯤ ꯃꯔꯛꯇꯥ ꯂꯩꯕꯥ ꯌꯥꯅꯆꯦ ꯑꯃꯅꯤ꯫
"professionals you're working with, about what you want to get out of your","ꯅꯍꯥꯛꯅꯥ ꯊꯕꯛ ꯇꯧꯔꯤꯕꯥ ꯄ꯭ꯔꯣꯐꯦꯁꯅꯦꯂꯁꯤꯡ, ꯅꯍꯥꯛꯅꯥ ꯅꯍꯥꯛꯀꯤ ꯃꯐꯃꯗꯒꯤ ꯂꯥꯀꯄꯥ ꯄꯥꯝꯂꯤꯕꯁꯤꯡ ꯑꯗꯨꯒꯤ ꯃꯇꯥꯡꯗꯥ ."
© Mind 2020,© ꯃꯥꯏꯟꯗ ꯲꯰꯲꯰ .
18,꯱꯸ꯗꯥ ꯂꯩꯕꯥ꯫
"treatment. It should include the problems you want help with, any treatments you",ꯂꯥꯏꯌꯦꯡꯕ.
may need and planning for a crisis,ꯀ꯭ꯔꯥꯏꯁꯤꯁ ꯑꯃꯥ ꯃꯊꯧ ꯇꯥꯕꯥ ꯑꯃꯁꯨꯡ ꯊꯧꯔꯥꯡ ꯇꯧꯕꯥ ꯌꯥꯏ .
"""It was only when I met some dedicated professionals willing to go that extra mile that I","""ꯃꯁꯤ ꯑꯩꯍꯥꯛꯅꯥ ꯑꯗꯨꯒꯨꯝꯕꯥ ꯑꯍꯦꯅꯕꯥ ꯃꯥꯏꯜ ꯑꯗꯨ ꯆꯠꯄꯥ ꯌꯥꯕꯥ ꯀꯠꯊꯣꯛꯂꯕꯥ ꯄ꯭ꯔꯣꯐꯦꯁ꯭ꯅꯦꯜ ꯈꯔꯒꯥ ꯎꯅꯈꯤꯕꯥ ꯃꯇꯝ ꯑꯗꯨꯗꯥ ꯑꯩꯍꯥꯛꯅꯥ ."
started to change and believe in myself. I was able to begin therapy and develop a good,ꯍꯣꯡꯗꯣꯀꯄꯥ ꯍꯧꯔꯀꯈꯤ ꯑꯃꯁꯨꯡ ꯑꯩꯍꯥꯛ ꯏꯁꯥꯃꯀꯄꯨ ꯊꯥꯖꯕꯥ ꯊꯃꯈꯤ꯫
"trusting relationship which has been consistent and secure.""",ꯂꯦꯞꯄꯥ ꯂꯩꯇꯅꯥ ꯑꯃꯁꯨꯡ ꯁꯦꯛꯌꯨꯑꯣꯔ ꯑꯣꯏꯗꯨꯅꯥ ꯂꯩꯔꯛꯂꯕꯥ ꯊꯥꯖꯕꯥ ꯌꯥꯕꯥ ꯃꯔꯤ꯫”
When don't I have a choice in my treatment?,ꯑꯩꯒꯤ ꯂꯥꯌꯦꯡꯕꯗꯥ ꯑꯩꯅꯥ ꯀꯗꯥꯌꯗꯥ ꯆꯌꯦꯠꯅꯕꯥ ꯑꯃꯥ ꯂꯩꯔꯃꯂꯣꯏꯗꯒꯦ?
You may not have a choice in your treatment if you:,ꯀꯔꯤꯒꯨꯝꯕꯥ ꯅꯍꯥꯛꯅꯥ ꯃꯈꯥꯗꯥ ꯄꯤꯔꯤꯕꯁꯤꯡꯁꯤꯗꯥ ꯅꯍꯥꯛꯀꯤ ꯂꯥꯏꯌꯦꯡꯗꯥ ꯆꯌꯦꯠꯅꯕꯥ ꯑꯃꯥ ꯂꯩꯇꯕꯥ ꯌꯥꯏ:
do not have mental capacity – this is where you are considered too unwell to,ꯃꯦꯟꯇꯦꯜ ꯀꯦꯄꯥꯁꯤꯇꯤ ꯂꯩꯔꯣꯏꯗꯕꯅꯤ – ꯃꯁꯤ ꯅꯍꯥꯛꯅꯥ ꯌꯥꯝꯅꯥ ꯑꯅꯋꯦꯜ ꯑꯣꯏꯅꯥ ꯂꯧꯅꯔꯤꯕꯥ ꯃꯐꯝ ꯑꯗꯨꯅꯤ
make informed decisions about a specific situation – see our pages on,ꯑꯀꯛꯅꯕꯥ ꯐꯤꯚꯝ ꯑꯃꯒꯤ ꯃꯇꯥꯡꯗꯥ ꯋꯥꯈꯜ ꯇꯥꯕꯥ ꯋꯥꯔꯦꯄꯁꯤꯡ ꯂꯧꯕꯤꯌꯨ – ꯑꯩꯈꯣꯌꯒꯤ ꯄꯦꯖꯁꯤꯡ ꯑꯁꯤ ꯌꯦꯡꯕꯤꯌꯨ
the Mental Capacity Act for more information,ꯑꯍꯦꯅꯕꯥ ꯏꯅꯐꯣꯔꯃꯦꯁꯅꯒꯤꯗꯃꯛ ꯃꯦꯟꯇꯦꯜ ꯀꯦꯄꯥꯁꯤꯇꯤ ꯑꯦꯛꯇ
are being kept in hospital under a section of the Mental Health Act (sometimes,ꯑꯁꯤ ꯃꯦꯟꯇꯦꯜ ꯍꯦꯜꯊ ꯑꯦꯛꯇꯀꯤ ꯁꯦꯛꯁꯟ ꯑꯃꯒꯤ ꯃꯈꯥꯗꯥ ꯍꯣꯁ꯭ꯄꯤꯇꯥꯂꯗꯥ ꯊꯝꯂꯤ (ꯀꯔꯤꯒꯨꯝꯕꯥ ꯃꯇꯃꯗꯥ .
called being sectioned),ꯁꯦꯛꯁꯟ ꯇꯧꯕꯥ ꯍꯥꯌꯅꯥ ꯀꯧꯕꯥ)
are being treated under a Community Treatment Order (CTO) – this means you,ꯀꯝꯝꯌꯨꯅꯤꯇꯤ ꯇ꯭ꯔꯤꯇꯃꯦꯟꯇ ꯑꯣꯔꯗꯔ (ꯁꯤ.ꯇꯤ.ꯑꯣ.) ꯑꯃꯒꯤ ꯃꯈꯥꯗꯥ ꯂꯥꯌꯦꯡꯂꯤꯕꯥ ꯑꯁꯤꯅꯤ – ꯃꯁꯤꯅꯥ ꯑꯗꯣꯝꯅꯥ [...]
are given supervised treatment in the community,ꯑꯁꯤ ꯀꯝꯌꯨꯅꯤꯇꯤꯗꯥ ꯁꯨꯄꯔꯚꯥꯏꯖ ꯇꯧꯔꯕꯥ ꯂꯥꯏꯌꯦꯡ ꯄꯤꯔꯤ
are being treated under a court order – this may be if you have committed an,ꯀꯣꯔꯇꯀꯤ ꯑꯣꯔꯗꯔ ꯑꯃꯒꯤ ꯃꯈꯥꯗꯥ ꯂꯧꯈꯠꯂꯤ – ꯃꯁꯤ ꯀꯔꯤꯒꯨꯝꯕꯥ ꯅꯍꯥꯛꯅꯥ ꯑꯦ.
offence,ꯑꯣꯐꯦꯟꯁ ꯇꯧꯕꯥ
See our pages on seeking help for a mental health problem for more information,ꯑꯍꯦꯅꯕꯥ ꯏꯅꯐꯣꯔꯃꯦꯁꯅꯒꯤꯗꯃꯛꯇꯥ ꯃꯦꯟꯇꯦꯜ ꯍꯦꯂꯊ ꯄ꯭ꯔꯣꯕ꯭ꯂꯦꯝ ꯑꯃꯒꯤꯗꯃꯛ ꯃꯇꯦꯡ ꯂꯧꯅꯕꯒꯤ ꯃꯇꯥꯡꯗꯥ ꯑꯩꯈꯣꯌꯒꯤ ꯄꯦꯖꯁꯤꯡ ꯌꯦꯡꯕꯤꯌꯨ
How can other people help?,ꯑꯇꯣꯞꯄꯥ ꯃꯤꯑꯣꯏꯁꯤꯡꯅꯥ ꯀꯔꯝꯅꯥ ꯃꯇꯦꯡ ꯄꯥꯡꯒꯅꯤ?
This section is for friends and family who want to support someone with a diagnosis of,ꯁꯦꯛꯁꯟ ꯑꯁꯤ ꯀꯅꯥꯒꯨꯝꯕꯥ ꯑꯃꯕꯨ ꯁꯄꯣꯔꯠ ꯇꯧꯕꯥ ꯄꯥꯝꯕꯥ ꯃꯔꯨꯄꯁꯤꯡ ꯑꯃꯁꯨꯡ ꯏꯃꯨꯡ ꯃꯅꯨꯡꯒꯤꯗꯃꯛꯇꯅꯤ
personality disorder,ꯄꯔꯁꯣꯅꯦꯂꯤꯇꯤ ꯗꯤꯁꯑꯣꯔꯗꯔ ꯂꯩꯕꯥ
"""I have become very aware of my feelings and emotions but I often find it really hard to","""ꯑꯩꯍꯥꯛꯅꯥ ꯑꯩꯍꯥꯛꯀꯤ ꯐꯤꯚꯝ ꯑꯃꯁꯨꯡ ꯏꯃꯣꯁꯅꯁꯤꯡ ꯑꯗꯨ ꯌꯥꯝꯅꯥ ꯈꯉꯕꯥ ꯉꯃꯈ꯭ꯔꯦ ꯑꯗꯨꯕꯨ ꯑꯌꯥꯝꯕꯅꯥ ꯑꯩꯍꯥꯛꯅꯥ ꯇꯁꯦꯡꯅꯥ ꯌꯥꯝꯅꯥ ꯂꯨꯕꯥ ꯑꯣꯏꯅꯥ ꯎꯏ꯫"""
"control them, like someone’s taken over my head for a short time I then feel","ꯃꯈꯣꯌꯕꯨ ꯀꯟꯠꯔꯣꯜ ꯇꯧꯕꯥ, ꯀꯅꯥꯒꯨꯝꯕꯥ ꯑꯃꯅꯥ ꯑꯩꯒꯤ ꯃꯀꯣꯛ ꯑꯗꯨ ꯃꯇꯝ ꯈꯔꯒꯤ ꯑꯣꯏꯅꯥ ꯂꯧꯈꯤꯕꯥ ꯑꯗꯨꯒꯨꯝꯅꯥ ꯑꯩꯅꯥ ꯃꯗꯨꯒꯤ ꯃꯇꯨꯡꯗꯥ ꯐꯥꯑꯣꯔꯤ"
"overwhelmingly embarrassed of my actions, and push people away to try and make","ꯑꯩꯒꯤ ꯊꯕꯀꯁꯤꯡꯗꯥ ꯌꯥꯝꯅꯥ ꯋꯥꯅꯥ ꯏꯀꯥꯏꯕꯥ ꯄꯤꯕꯥ, ꯑꯃꯁꯨꯡ ꯃꯤꯑꯣꯏꯁꯤꯡꯕꯨ ꯍꯣꯠꯅꯗꯨꯅꯥ ꯆꯠꯅꯕꯥ ꯄꯨꯛꯅꯤꯡ ꯊꯧꯒꯠꯄꯥ"
"myself feel better.""",ꯑꯩꯍꯥꯛ ꯏꯁꯥꯃꯀꯁꯨ ꯍꯦꯟꯅꯥ ꯐꯕꯥ ꯐꯥꯑꯣꯏ꯫”
"If somebody you know is diagnosed with a personality disorder, their thoughts, feelings","ꯀꯔꯤꯒꯨꯝꯕꯥ ꯅꯍꯥꯛꯅꯥ ꯈꯪꯂꯤꯕꯥ ꯀꯅꯥꯒꯨꯝꯕꯥ ꯑꯃꯅꯥ ꯄꯔꯁꯣꯅꯦꯂꯤꯇꯤ ꯗꯤꯁꯑꯣꯔꯗꯔ ꯑꯃꯥ ꯂꯩꯔꯦ ꯍꯥꯌꯅꯥ ꯈꯪꯂꯕꯗꯤ, ꯃꯈꯣꯌꯒꯤ ꯋꯥꯈꯜ, ꯐꯤꯜꯂꯤꯡ"
and behaviour might make it hard for them to always maintain a good relationship with,ꯑꯃꯁꯨꯡ ꯂꯃꯆꯠ-ꯁꯥꯖꯠꯅꯥ ꯃꯈꯣꯌꯗꯥ ꯃꯇꯝ ꯄꯨꯝꯅꯃꯛꯇꯥ ꯑꯐꯕꯥ ꯃꯔꯤ ꯑꯃꯥ ꯊꯝꯕꯥ ꯉꯃꯍꯟꯗꯕꯥ ꯌꯥꯏ .
you. Sometimes you may find it hard to know what to say or how to help. But there are,ꯑꯗꯣꯝ.
lots of positive things you can do to support them:,ꯃꯈꯣꯌꯕꯨ ꯃꯇꯦꯡ ꯄꯥꯡꯅꯕꯥ ꯅꯍꯥꯛꯅꯥ ꯇꯧꯕꯥ ꯌꯥꯕꯥ ꯄꯣꯖꯤꯇꯤꯕ ꯑꯣꯏꯕꯥ ꯊꯕꯛ ꯀꯌꯥ:
"Try to be patient – if your loved one is struggling to deal with their emotions, try","ꯑꯁꯥꯑꯣꯕꯥ ꯄꯣꯀꯍꯟꯅꯕꯥ ꯍꯣꯠꯅꯧ – ꯀꯔꯤꯒꯨꯝꯕꯥ ꯅꯍꯥꯛꯀꯤ ꯅꯨꯡꯁꯤꯖꯔꯕꯥ ꯃꯤꯑꯣꯏ ꯑꯗꯨꯅꯥ ꯃꯈꯣꯌꯒꯤ ꯏꯃꯣꯁꯅꯁꯤꯡ ꯑꯗꯨ ꯊꯦꯡꯅꯅꯕꯥ ꯍꯣꯠꯅꯔꯕꯗꯤ, ꯍꯣꯠꯅꯧ"
not to get involved in an argument in the heat of the moment. It could be better to,ꯃꯤꯀꯨꯞ ꯑꯁꯤꯒꯤ ꯑꯁꯥꯡꯕꯥ ꯃꯇꯃꯗꯥ ꯋꯥꯐꯝ ꯑꯃꯗꯥ ꯌꯥꯑꯣꯗꯅꯕꯥ꯫
wait until you both feel calmer to talk things through,ꯅꯈꯣꯌ ꯑꯅꯤꯅꯥ ꯋꯥꯐꯃꯁꯤꯡꯒꯤ ꯈꯨꯠꯊꯥꯡꯗꯥ ꯋꯥꯔꯤ ꯁꯥꯟꯅꯕꯥ ꯋꯥꯈꯜ ꯅꯨꯡꯉꯥꯏꯇꯕꯥ ꯐꯥꯑꯣꯔꯀꯄꯥ ꯐꯥꯑꯣꯕꯥ ꯉꯥꯏꯌꯨ .
Talk to them compassionately and calmly – when someone is experiencing difficult,ꯃꯈꯣꯌꯒꯥ ꯃꯤꯅꯨꯡꯁꯤ ꯂꯩꯅꯥ ꯑꯃꯁꯨꯡ ꯅꯤꯡꯊꯤꯖꯅꯥ ꯋꯥꯔꯤ ꯁꯥꯕꯤꯌꯨ – ꯀꯅꯥꯒꯨꯝꯕꯥ ꯑꯃꯅꯥ ꯑꯋꯥꯕꯥ ꯃꯥꯌꯣꯛꯅꯔꯀꯄꯥ ꯃꯇꯃꯗꯥ
"thoughts and feelings, their behaviour may be unexpected or upsetting, and you","ꯋꯥꯈꯂꯁꯤꯡ ꯑꯃꯁꯨꯡ ꯐꯤꯜꯂꯤꯡꯁꯤꯡ, ꯃꯈꯣꯌꯒꯤ ꯂꯃꯆꯠ-ꯁꯥꯖꯠ ꯑꯗꯨ ꯊꯥꯖꯗꯕꯥ ꯅꯠꯠꯔꯒꯥ ꯋꯥꯈꯜ ꯅꯨꯡꯉꯥꯏꯇꯕꯥ ꯑꯣꯏꯔꯀꯄꯥ ꯌꯥꯏ, ꯑꯃꯁꯨꯡ ꯅꯍꯥꯛꯅꯥ ."
may feel unsettled. Try to understand what they're experiencing and what's,ꯋꯥꯈꯜ ꯅꯨꯡꯉꯥꯏꯇꯕꯥ ꯐꯥꯑꯣꯕꯥ ꯌꯥꯏ꯫
"affecting their thoughts, feelings and behaviour – this can help you to stay calm","ꯃꯈꯣꯌꯒꯤ ꯋꯥꯈꯜ, ꯐꯤꯚꯝ ꯑꯃꯁꯨꯡ ꯂꯃꯆꯠ-ꯁꯥꯖꯠꯇꯥ ꯑꯀꯥꯌꯕꯥ ꯄꯤꯕꯥ – ꯃꯁꯤꯅꯥ ꯅꯍꯥꯀꯄꯨ ꯂꯦꯡꯗꯅꯥ ꯂꯩꯍꯅꯕꯗꯥ ꯃꯇꯦꯡ ꯄꯥꯡꯕꯥ ꯉꯃꯒꯅꯤ꯫"
Don't judge them – try to listen to them without telling them they should feel the,ꯃꯈꯣꯌꯕꯨ ꯋꯥꯌꯦꯜ ꯇꯧꯔꯣꯏꯗꯕꯅꯤ – ꯃꯈꯣꯌꯅꯥ ꯐꯥꯑꯣꯒꯗꯕꯅꯤ ꯍꯥꯌꯅꯥ ꯍꯥꯌꯗꯅꯥ ꯃꯈꯣꯌꯒꯤ ꯋꯥꯐꯝ ꯇꯥꯅꯕꯥ ꯍꯣꯠꯅꯧ
way they do or that they're being overly sensitive. You may not understand why,ꯃꯈꯣꯌꯅꯥ ꯇꯧꯔꯤꯕꯥ ꯅꯠꯠꯔꯒꯥ ꯃꯈꯣꯌꯅꯥ ꯌꯥꯝꯅꯥ ꯁꯦꯟꯁꯤꯇꯤꯕ ꯑꯣꯏꯕꯥ ꯃꯑꯣꯡꯗꯥ꯫
"they feel like this, but it can mean a lot to acknowledge and value how they're","ꯃꯈꯣꯌꯅꯥ ꯃꯁꯤꯒꯨꯝꯅꯥ ꯐꯥꯑꯣꯏ, ꯑꯗꯨꯕꯨ ꯃꯁꯤꯅꯥ ꯃꯈꯣꯌꯕꯨ ꯀꯔꯝꯅꯥ ꯑꯣꯏꯔꯤꯕꯅꯣ ꯍꯥꯌꯕꯗꯨ ꯌꯥꯕꯥ ꯑꯃꯁꯨꯡ ꯃꯃꯜ ꯌꯥꯝꯅꯥ ꯄꯤꯕꯥ ꯉꯝꯕꯥ ꯑꯁꯤ ꯌꯥꯝꯅꯥ ꯃꯔꯨ ꯑꯣꯏꯕꯥ ꯌꯥꯏ ."
feeling,ꯋꯥꯈꯜꯗ ꯐꯥꯎꯕ
"""Validate and try to be understanding – don’t question my thoughts or views. Put yourself","""ꯚꯦꯂꯤꯗꯦꯠ ꯇꯧꯕꯤꯌꯨ ꯑꯃꯁꯨꯡ ꯂꯧꯁꯤꯡ ꯂꯩꯅꯕꯥ ꯍꯣꯠꯅꯕꯤꯌꯨ – ꯑꯩꯒꯤ ꯋꯥꯈꯜꯂꯣꯟ ꯅꯠꯔꯒꯥ ꯋꯥꯈꯜꯂꯣꯅꯁꯤꯡꯗꯥ ꯋꯥꯍꯪ ꯍꯪꯕꯤꯒꯅꯨ꯫ ꯅꯍꯥꯛꯅꯥ ꯃꯁꯥꯕꯨ ꯊꯝꯕꯤꯌꯨ꯫"""
"in my shoes. If those were the thoughts and feelings you were experiencing, how would",ꯑꯩꯒꯤ ꯈꯣꯉꯗꯥ꯫
"they make you feel?""",ꯃꯈꯣꯌꯅꯥ ꯅꯉꯕꯨ ꯐꯤꯜ ꯇꯧꯍꯜꯂꯤꯕꯔꯥ?
© Mind 2020,© ꯃꯥꯏꯟꯗ ꯲꯰꯲꯰ .
19,꯱꯹ ꯑꯃꯁꯨꯡ ꯱꯹꯫
Remind them of other aspects of their personality – a diagnosis of personality,ꯃꯈꯣꯌꯒꯤ ꯄꯔꯁꯣꯅꯦꯂꯤꯇꯤꯒꯤ ꯑꯇꯩ ꯃꯁꯀꯁꯤꯡ – ꯄꯔꯁꯣꯅꯦꯂꯤꯇꯤꯒꯤ ꯗꯥꯏꯑꯦꯒ꯭ꯅꯣꯁꯤꯁ ꯑꯃꯥ ꯅꯤꯡꯁꯤꯡꯍꯅꯕꯥ
"disorder doesn't stop someone being likeable, intelligent, funny, kind, highly","ꯗꯤꯁꯑꯣꯔꯗꯔ ꯑꯁꯤꯅꯥ ꯀꯅꯥꯒꯨꯝꯕꯥ ꯑꯃꯕꯨ ꯅꯨꯡꯁꯤꯖꯕꯥ, ꯋꯥꯈꯜ ꯂꯧꯁꯤꯡ ꯂꯩꯕꯥ, ꯅꯨꯡꯉꯥꯏꯕꯥ, ꯃꯤꯅꯨꯡꯁꯤ ꯂꯩꯕꯥ, ꯌꯥꯝꯅꯥ ꯋꯥꯡꯅꯥ ꯂꯩꯕꯥ ꯊꯤꯡꯗꯦ꯫"
motivated or creative. It can be reassuring to remind them of the other things you,ꯃꯣꯇꯤꯕꯦꯠ ꯇꯧꯕꯥ ꯅꯠꯔꯒꯥ ꯀ꯭ꯔꯤꯌꯦꯇꯤꯕ ꯑꯣꯏꯕꯥ꯫
"see in them, particularly if they struggle to see these themselves","ꯃꯈꯣꯌꯗꯥ ꯌꯦꯡꯕꯤꯌꯨ, ꯃꯔꯨꯑꯣꯏꯅꯥ ꯀꯔꯤꯒꯨꯝꯕꯥ ꯃꯈꯣꯌꯅꯥ ꯃꯈꯣꯌ ꯃꯁꯥꯅꯥ ꯃꯁꯥꯕꯨ ꯎꯍꯟꯅꯕꯥ ꯍꯣꯠꯅꯔꯕꯗꯤ ."
Try to both set clear boundaries and expectations – it can be helpful to make sure,ꯃꯌꯦꯛ ꯁꯦꯡꯕꯥ ꯉꯃꯈꯩꯁꯤꯡ ꯑꯃꯁꯨꯡ ꯑꯦꯛꯁꯄꯦꯛꯇꯦꯁꯅꯁꯤꯡ ꯑꯅꯤꯃꯛ ꯁꯦꯝꯅꯕꯥ ꯍꯣꯠꯅꯕꯥ – ꯃꯁꯤꯅꯥ ꯃꯇꯦꯡ ꯄꯥꯡꯕꯥ ꯌꯥꯏ ꯍꯥꯌꯕꯁꯤ ꯁꯣꯌꯗꯅꯥ ꯈꯪꯖꯤꯅꯕꯗꯥ ꯃꯇꯦꯡ ꯄꯥꯡꯕꯥ ꯌꯥꯏ꯫
"you both know where the boundaries of your relationship are, and what you","ꯅꯈꯣꯌ ꯑꯅꯤꯃꯛꯅꯥ ꯅꯈꯣꯌꯒꯤ ꯃꯔꯤꯒꯤ ꯉꯃꯈꯩꯁꯤꯡ ꯑꯗꯨ ꯀꯗꯥꯏꯗꯥ ꯂꯩꯕꯒꯦ ꯍꯥꯌꯕꯗꯨ ꯈꯉꯏ, ꯑꯃꯁꯨꯡ ꯅꯍꯥꯛꯅꯥ ꯀꯔꯤ ."
expect from each other. This can help you both manage difficult feelings and,ꯑꯃꯅꯥ ꯑꯃꯗꯒꯤ ꯑꯦꯛꯁꯄꯦꯛꯇ ꯇꯧꯕꯥ꯫
"situations. Agreeing how you expect to speak to each other, be spoken to or what",ꯐꯤꯚꯃꯁꯤꯡ꯫
you are or aren't able to help with could be useful things to clarify,ꯅꯍꯥꯛꯅꯥ ꯃꯇꯦꯡ ꯄꯥꯡꯕꯥ ꯉꯃꯗꯕꯥ ꯅꯠꯠꯔꯒꯥ ꯇꯧꯕꯥ ꯉꯃꯗꯕꯥ ꯑꯁꯤ ꯃꯌꯦꯛ ꯁꯦꯡꯍꯟꯅꯕꯥ ꯀꯥꯟꯅꯕꯥ ꯋꯥꯐꯃꯁꯤꯡ ꯑꯣꯏꯕꯥ ꯌꯥꯏ .
"""Tell me a problem you’re having, let me be there for you for a change. Don’t hold back","""ꯑꯗꯣꯝꯅꯥ ꯊꯦꯡꯅꯔꯤꯕꯥ ꯁꯃꯁ꯭ꯌꯥ ꯑꯃꯥ ꯑꯩꯉꯣꯟꯗꯥ ꯍꯥꯌꯕꯤꯌꯨ, ꯑꯩꯍꯥꯛ ꯑꯗꯣꯃꯒꯤꯗꯃꯛ ꯑꯍꯣꯡꯕꯥ ꯑꯃꯥ ꯄꯨꯔꯛꯅꯕꯥ ꯃꯐꯝ ꯑꯗꯨꯗꯥ ꯂꯩꯕꯤꯌꯨ꯫"
"sharing difficulties in your life, I am your friend after all. It will make me feel valuable and","ꯑꯗꯣꯃꯒꯤ ꯄꯨꯟꯁꯤꯗꯥ ꯈꯨꯗꯣꯡꯆꯥꯗꯕꯥ ꯀꯌꯥ ꯁꯔꯨꯛ ꯌꯥꯃꯤꯟꯅꯗꯨꯅꯥ ꯑꯩꯍꯥꯛ ꯑꯗꯣꯃꯒꯤ ꯃꯔꯨꯄꯅꯤ, ꯄꯨꯝꯅꯃꯛ ꯑꯁꯤꯒꯤ ꯃꯇꯨꯡꯗꯥ꯫"
"useful.""","ꯀꯥꯟꯅꯕ."""
Plan ahead – it can be scary if you're worried someone you care about is hurting,ꯃꯃꯥꯡꯗꯥ ꯊꯧꯔꯥꯡ ꯇꯧꯕꯤꯌꯨ – ꯀꯔꯤꯒꯨꯝꯕꯥ ꯅꯍꯥꯛꯅꯥ ꯋꯥꯈꯜ ꯇꯥꯗꯕꯥ ꯇꯥꯔꯕꯗꯤ ꯅꯍꯥꯛꯅꯥ ꯋꯥꯈꯜ ꯇꯥꯗꯕꯥ ꯌꯥꯏ ꯍꯥꯌꯕꯁꯤ ꯌꯥꯝꯅꯥ ꯁꯥꯊꯤꯕꯥ ꯑꯣꯏꯕꯥ ꯌꯥꯏ .
"themselves, or is struggling with suicidal thoughts. Ask them how you could help","ꯃꯈꯣꯌ ꯃꯁꯥꯃꯛ, ꯅꯠꯠꯔꯒꯥ ꯃꯁꯥꯅꯥ ꯃꯁꯥꯕꯨ ꯊꯥꯖꯖꯕꯥ ꯋꯥꯈꯜꯂꯣꯅꯒꯥ ꯂꯣꯌꯅꯅꯥ ꯂꯥꯟꯊꯦꯡꯅꯔꯤ꯫"
when things are difficult. See our pages on supporting someone who is self-,ꯋꯥꯐꯃꯁꯤꯡ ꯑꯁꯤ ꯑꯔꯨꯕꯥ ꯑꯣꯏꯔꯀꯄꯥ ꯃꯇꯃꯗꯥ꯫
harming and supporting someone who feels suicidal for more information,ꯑꯍꯦꯅꯕꯥ ꯏꯅꯐꯣꯔꯃꯦꯁꯅꯒꯤꯗꯃꯛꯇꯥ ꯃꯁꯥꯅꯥ ꯃꯁꯥꯕꯨ ꯁꯤꯖꯔꯤꯕꯥ ꯃꯤꯑꯣꯏ ꯑꯃꯕꯨ ꯁꯣꯀꯍꯅꯕꯥ ꯑꯃꯁꯨꯡ ꯁꯄꯣꯔꯠ ꯇꯧꯕꯥ
Learn their triggers - talk to your loved one and try to work out what situations or,ꯃꯈꯣꯌꯒꯤ ꯇ꯭ꯔꯥꯏꯒ꯭ꯔꯤꯁꯤꯡ ꯑꯗꯨ ꯇꯃꯁꯤꯜꯂꯨ - ꯅꯍꯥꯛꯀꯤ ꯅꯨꯡꯁꯤꯖꯔꯕꯥ ꯃꯤꯑꯣꯏ ꯑꯗꯨꯒꯥ ꯋꯥꯔꯤ ꯁꯥꯟꯅꯧ ꯑꯃꯁꯨꯡ ꯀꯔꯤ ꯐꯤꯚꯃꯁꯤꯡ ꯅꯠꯠꯔꯒꯥ ꯀꯔꯤ ꯐꯤꯚꯃꯁꯤꯡ ꯅꯠꯠꯔꯒꯥ
conversations make them think or feel negative thoughts and emotions,ꯋꯥꯔꯤ ꯁꯥꯅꯕꯥ ꯑꯁꯤꯅꯥ ꯃꯈꯣꯌꯗꯥ ꯅꯦꯒꯦꯇꯤꯕ ꯑꯣꯏꯕꯥ ꯋꯥꯈꯜꯂꯣꯟ ꯑꯃꯁꯨꯡ ꯏꯃꯣꯁꯅꯁꯤꯡ ꯈꯅꯍꯜꯂꯤ .
"Learn more about personality disorder, and help to challenge stigma – personality","ꯄꯔꯁꯣꯅꯦꯂꯤꯇꯤ ꯗꯤꯁꯑꯣꯔꯗꯔꯒꯤ ꯃꯇꯥꯡꯗꯥ ꯍꯦꯟꯅꯥ ꯈꯪꯖꯤꯅꯕꯤꯌꯨ, ꯑꯃꯁꯨꯡ ꯁ꯭ꯇꯤꯒꯃꯥ – ꯄꯔꯁꯣꯅꯦꯂꯤꯇꯤ ꯆꯦꯂꯦꯟꯖ ꯇꯧꯕꯗꯥ ꯃꯇꯦꯡ ꯄꯥꯡꯕꯤꯌꯨ"
"disorder is a complicated diagnosis, and your loved one may have to deal with","ꯗꯤꯁꯑꯣꯔꯗꯔ ꯑꯁꯤ ꯌꯥꯝꯅꯥ ꯂꯨꯕꯥ ꯗꯥꯏꯑꯦꯒ꯭ꯅꯣꯁꯤꯁ ꯑꯃꯅꯤ, ꯑꯃꯁꯨꯡ ꯅꯍꯥꯛꯀꯤ ꯅꯨꯡꯁꯤꯖꯔꯕꯥ ꯃꯤꯑꯣꯏ ꯑꯗꯨꯅꯥ ꯊꯦꯡꯅꯒꯗꯕꯥ ꯌꯥꯏ꯫"
other people's misconceptions on top of coping with their own mental health,ꯃꯈꯣꯌ ꯃꯁꯥꯒꯤ ꯃꯦꯟꯇꯦꯜ ꯍꯦꯜꯊꯀꯥ ꯂꯣꯌꯅꯅꯥ ꯊꯦꯡꯅꯕꯒꯤ ꯃꯊꯛꯇꯥ ꯑꯇꯣꯞꯄꯥ ꯃꯤꯑꯣꯏꯁꯤꯡꯒꯤ ꯑꯔꯥꯅꯕꯥ ꯋꯥꯈꯜꯂꯣꯅꯁꯤꯡ
problem. Our pages about personality disorders and different types of personality,ꯁꯤꯡꯅꯕ.
disorder contain more information,ꯗꯤꯁꯑꯣꯔꯗꯔ ꯑꯁꯤ ꯍꯦꯟꯅꯥ ꯏꯅꯐꯣꯔꯃꯦꯁꯟ ꯌꯥꯎꯏ
Help them seek treatment and support – see our pages on how to support,ꯃꯈꯣꯌꯗꯥ ꯂꯥꯏꯌꯦꯡ ꯑꯃꯁꯨꯡ ꯁꯄꯣꯔꯠ ꯂꯧꯕꯗꯥ ꯃꯇꯦꯡ ꯄꯥꯡꯕꯤꯌꯨ – ꯃꯇꯧ ꯀꯔꯝꯅꯥ ꯁꯄꯣꯔꯠ ꯇꯧꯒꯗꯒꯦ ꯍꯥꯌꯕꯒꯤ ꯃꯇꯥꯡꯗꯥ ꯑꯩꯈꯣꯌꯒꯤ ꯄꯦꯖꯁꯤꯡ ꯌꯦꯡꯕꯤꯌꯨ꯫
someone to seek help for more information,ꯑꯍꯦꯅꯕꯥ ꯏꯅꯐꯣꯔꯃꯦꯁꯅꯒꯤꯗꯃꯛ ꯃꯇꯦꯡ ꯄꯥꯡꯅꯕꯥ ꯀꯅꯥꯒꯨꯝꯕꯥ ꯑꯃꯅꯥ
Help them find an advocate – see our pages on advocacy for more information,ꯃꯈꯣꯌꯗꯥ ꯑꯦꯗꯚꯣꯀꯦꯠ ꯑꯃꯥ ꯊꯤꯕꯗꯥ ꯃꯇꯦꯡ ꯄꯥꯡꯕꯤꯌꯨ – ꯑꯍꯦꯅꯕꯥ ꯏꯅꯐꯣꯔꯃꯦꯁꯅꯒꯤꯗꯃꯛꯇꯥ ꯑꯦꯗꯚꯣꯀꯦꯁꯤꯗꯥ ꯂꯩꯕꯥ ꯑꯩꯈꯣꯌꯒꯤ ꯄꯦꯖꯁꯤꯡ ꯌꯦꯡꯕꯤꯌꯨ
Take care of yourself – supporting a loved one who is struggling can be really,ꯅꯍꯥꯛꯀꯤ ꯏꯁꯥꯕꯨ ꯌꯦꯡꯁꯤꯅꯕꯤꯌꯨ – ꯂꯥꯟꯊꯦꯡꯅꯔꯤꯕꯥ ꯅꯨꯡꯁꯤꯖꯔꯕꯥ ꯃꯤꯑꯣꯏ ꯑꯃꯕꯨ ꯁꯄꯣꯔꯠ ꯇꯧꯕꯥ ꯑꯁꯤ ꯇꯁꯦꯡꯅꯥ ꯑꯣꯏꯕꯥ ꯌꯥꯏ
difficult. Try to remember that your own mental health is important as well. See,ꯑꯔꯨꯕ.
"our pages on coping when supporting someone else, managing","ꯑꯇꯣꯞꯄꯥ ꯀꯅꯥꯒꯨꯝꯕꯥ ꯑꯃꯕꯨ ꯁꯄꯣꯔꯠ ꯇꯧꯕꯥ ꯃꯇꯃꯗꯥ ꯀꯣꯄꯤꯡꯒꯤ ꯃꯇꯥꯡꯗꯥ ꯑꯩꯈꯣꯌꯒꯤ ꯄꯦꯖꯁꯤꯡ, ꯃꯦꯅꯦꯖ ꯇꯧꯕꯥ"
stress and maintaining your wellbeing for more information on how to look after,ꯃꯇꯧ ꯀꯔꯝꯅꯥ ꯌꯦꯡꯁꯤꯅꯒꯗꯒꯦ ꯍꯥꯌꯕꯒꯤ ꯃꯇꯥꯡꯗꯥ ꯑꯍꯦꯅꯕꯥ ꯏꯅꯐꯣꯔꯃꯦꯁꯅꯒꯤꯗꯃꯛꯇꯥ ꯅꯍꯥꯛꯀꯤ ꯌꯥꯏꯐ-ꯊꯧꯔꯥꯡ ꯑꯗꯨ ꯁ꯭ꯠꯔꯦꯁ ꯑꯃꯁꯨꯡ ꯃꯦꯟꯇꯦꯟ ꯇꯧꯕꯥ
yourself,ꯅꯁꯥꯃꯛ
"""Sometimes, when we don’t know who we are, we don’t know why we are doing what","""ꯀꯔꯤꯒꯨꯝꯕꯥ ꯃꯇꯃꯗꯥ, ꯑꯩꯈꯣꯌꯅꯥ ꯀꯅꯥꯅꯣ ꯍꯥꯌꯕꯥ ꯈꯉꯗꯕꯥ ꯃꯇꯃꯗꯥ, ꯑꯩꯈꯣꯌꯅꯥ ꯀꯔꯤꯒꯤ ꯇꯧꯔꯤꯕꯅꯣ ꯍꯥꯌꯕꯥ ꯈꯉꯗꯦ"
"we are doing, it just takes a person with hope to see something behind those eyes,","ꯑꯩꯈꯣꯌꯅꯥ ꯇꯧꯔꯤ, ꯁꯨꯞꯅꯇꯒꯤ ꯃꯤꯠꯌꯦꯡ ꯑꯗꯨ ꯌꯦꯡꯅꯕꯒꯤꯗꯃꯛ ꯑꯥꯁꯥ ꯂꯩꯕꯥ ꯃꯤꯑꯣꯏ ꯑꯃꯥ ꯆꯪꯏ,"
"something we cannot see ourselves, to save us and tell us that we can be okay.""","ꯑꯩꯈꯣꯌꯅꯥ ꯑꯩꯈꯣꯌ ꯏꯁꯥꯕꯨ ꯎꯕꯥ ꯉꯃꯗꯕꯥ ꯋꯥꯐꯝ ꯑꯃꯥ, ꯑꯩꯈꯣꯌꯕꯨ ꯀꯅꯕꯤꯅꯕꯥ ꯑꯃꯁꯨꯡ ꯑꯩꯈꯣꯌꯅꯥ ꯑꯐꯕꯥ ꯑꯣꯏꯕꯥ ꯌꯥꯏ ꯍꯥꯌꯅꯥ ꯍꯥꯌꯅꯕꯥ꯫”"
© Mind 2020,© ꯃꯥꯏꯟꯗ ꯲꯰꯲꯰ .
20,꯲꯰ ꯑꯃꯁꯨꯡ ꯲꯰꯫
Useful contacts,ꯀꯥꯟꯅꯕꯥ ꯀꯟꯇꯦꯛꯇꯁꯤꯡ .
Mind's services,ꯃꯥꯏꯟꯁꯀꯤ ꯁꯔꯚꯤꯁꯁꯤꯡ .
Helplines – all our helplines provide information and support by phone and,ꯍꯦꯜꯄꯂꯥꯏꯅꯁꯤꯡ – ꯑꯩꯈꯣꯌꯒꯤ ꯍꯦꯜꯄꯂꯥꯏꯟ ꯄꯨꯝꯅꯃꯛꯅꯥ ꯐꯣꯟ ꯑꯃꯁꯨꯡ ꯁꯄꯣꯔꯠ ꯄꯤꯔꯤ ꯑꯃꯁꯨꯡ ꯁꯄꯣꯔꯠ ꯄꯤꯔꯤ꯫
"email. Our Blue Light Infoline is just for emergency service staff, volunteers and",ꯏꯃꯦꯜ ꯊꯥꯔꯀꯄꯥ꯫
their families,ꯃꯈꯣꯌꯒꯤ ꯏꯃꯨꯡ ꯃꯅꯨꯡꯁꯤꯡ .
o,ꯑꯣ .
"Mind’s Infoline – 0300 123 3393, info@mind","ꯃꯥꯏꯟꯗ’ꯁ ꯏꯅꯐꯣꯂꯥꯏꯟ – ꯰꯳꯰꯰ ꯱꯲꯳ ꯳꯳꯹꯳, info@mind"
o,ꯑꯣ .
"Mind’s Legal Line – 0300 466 6463, legal@mind","ꯃꯥꯏꯟꯗ’ꯁ ꯂꯤꯒꯦꯜ ꯂꯥꯏꯟ – ꯰꯳꯰꯰ ꯴꯶꯶ ꯶꯴꯶꯳, ꯂꯤꯒꯦꯜ@ꯃꯥꯏꯟꯗ"
o,ꯑꯣ .
"Blue Light Infoline – 0300 303 5999, bluelightinfo@mind","ꯕ꯭ꯂꯨ ꯂꯥꯏꯠ ꯏꯅꯐꯣꯂꯥꯏꯟ – ꯰꯳꯰꯰ ꯳꯰꯳ ꯵꯹꯹꯹, ꯕ꯭ꯂꯨꯂꯥꯏꯠꯏꯅꯐꯣ@ꯃꯤꯟꯗ"
Local Minds – there are over 140 local Minds across England and Wales which,ꯂꯣꯀꯦꯜ ꯃꯥꯏꯟꯗꯁ – ꯏꯪꯂꯦꯟꯗ ꯑꯃꯁꯨꯡ ꯋꯦꯂꯁꯀꯤ ꯃꯐꯝ ꯀꯌꯥꯗꯥ ꯂꯣꯀꯦꯜ ꯃꯥꯏꯟꯗ ꯱꯴꯰ ꯍꯦꯟꯅꯥ ꯂꯩꯔꯤ ꯃꯗꯨ .
"provide services such as talking treatments, peer support, and advocacy. Find","ꯋꯥꯔꯤ ꯁꯥꯅꯕꯥ, ꯄꯤꯌꯔ ꯁꯄꯣꯔꯠ, ꯑꯃꯁꯨꯡ ꯑꯦꯗꯚꯣꯀꯦꯁꯤꯒꯨꯝꯕꯥ ꯁꯔꯚꯤꯁꯁꯤꯡ ꯄꯤꯕꯥ꯫"
"your local Mind here, and contact them directly to see how they can help","ꯃꯐꯝ ꯑꯁꯤꯗꯥ ꯑꯗꯣꯃꯒꯤ ꯂꯣꯀꯦꯜ ꯃꯥꯏꯟꯗ, ꯑꯃꯁꯨꯡ ꯃꯈꯣꯌꯒꯥ ꯍꯀꯊꯦꯡꯅꯅꯥ ꯄꯥꯎ ꯐꯥꯑꯣꯅꯗꯨꯅꯥ ꯃꯈꯣꯌꯅꯥ ꯀꯔꯝꯅꯥ ꯃꯇꯦꯡ ꯄꯥꯡꯒꯅꯤ ꯍꯥꯌꯕꯗꯨ ꯌꯦꯡꯕꯤꯌꯨ"
Elefriends is a supportive online community for anyone experiencing a mental,ꯑꯦꯂꯦꯐ꯭ꯔꯦꯟꯗꯁ ꯑꯁꯤ ꯃꯦꯟꯇꯦꯜ ꯑꯃꯥ ꯊꯦꯡꯅꯔꯤꯕꯥ ꯃꯤꯑꯣꯏ ꯑꯃꯒꯤꯗꯃꯛ ꯁꯄꯣꯔꯇꯤꯕ ꯑꯣꯅꯂꯥꯏꯟ ꯀꯝꯝꯌꯨꯅꯤꯇꯤ ꯑꯃꯅꯤ .
health problem. See our Elefriends page for details,ꯍꯀꯁꯦꯂꯒꯤ ꯁꯃꯁ꯭ꯌꯥ꯫
Other organisations,ꯑꯇꯣꯞꯄꯥ ꯑꯣꯔꯒꯅꯥꯏꯖꯦꯁꯅꯁꯤꯡꯅꯥ ꯑꯦꯝ.ꯑꯦꯁ.ꯑꯦꯝ.ꯏ.
The Consortium for Therapeutic Communities,ꯊꯦꯔꯥꯞꯌꯨꯇꯤꯛ ꯀꯝꯝꯌꯨꯅꯤꯇꯤꯁꯤꯡꯒꯤꯗꯃꯛ ꯀꯟꯁꯣꯔꯇꯤꯌꯝ ꯑꯁꯤ .
therapeuticcommunities.org,ꯊꯦꯔꯥꯞꯌꯨꯇꯤꯀꯀꯝꯌꯨꯅꯤꯇꯤꯁ.ꯑꯣꯔꯒ .
Online directory of therapeutic communities across the UK,ꯌꯨ.ꯀꯦ.ꯒꯤ ꯃꯐꯝ ꯄꯨꯝꯅꯃꯛꯇꯥ ꯂꯩꯕꯥ ꯊꯦꯔꯥꯄꯤꯌꯨꯇꯤꯛ ꯀꯝꯝꯌꯨꯅꯤꯇꯤꯁꯤꯡꯒꯤ ꯑꯣꯅꯂꯥꯏꯟ ꯗꯥꯏꯔꯦꯛꯇꯣꯔꯤ
FRANK,ꯐ꯭ꯔꯥꯉ꯭ꯛ .
0300 123 6600,꯰꯳꯰꯰ ꯱꯲꯳ ꯶꯶꯰꯰ ꯂꯩ꯫
"Confidential advice and information about drugs, their effects and the law","ꯒꯣꯄꯟ ꯑꯣꯏꯕꯥ ꯄꯥꯎꯇꯥꯛ ꯑꯃꯁꯨꯡ ꯗ꯭ꯔꯒꯁꯤꯡ, ꯃꯈꯣꯌꯒꯤ ꯏꯐꯦꯛꯇꯁꯤꯡ ꯑꯃꯁꯨꯡ ꯑꯥꯏꯅꯒꯤ ꯃꯇꯥꯡꯗꯥ ꯏꯅꯐꯣꯔꯃꯦꯁꯟ"
The National Association for People Abused in Childhood (NAPAC),ꯅꯦꯁ꯭ꯅꯦꯜ ꯑꯦꯁꯣꯁꯤꯑꯦꯁꯟ ꯐꯣꯔ ꯄꯤꯄꯜ ꯑꯦꯕꯤꯎꯖ ꯏꯟ ꯆꯥꯏꯜꯗꯍꯨꯗ (ꯑꯦꯟ.ꯑꯦ.ꯄꯤ.ꯑꯦ.ꯁꯤ.)
0808 801 0331,꯰꯸꯰꯸ ꯑꯃꯁꯨꯡ ꯸꯰꯱ ꯰꯳꯳꯱ ꯂꯩ꯫
napac.org.uk,ꯅꯥꯄꯥꯛ.ꯑꯣꯔꯒ.ꯌꯨ.ꯀꯦ.
A charity supporting adult survivors of any form of childhood abuse. Provides a support,ꯑꯉꯥꯡ ꯑꯣꯏꯔꯤꯉꯩꯗꯥ ꯁꯣꯀꯍꯜꯂꯕꯥ ꯃꯑꯣꯡ ꯑꯃꯍꯦꯛꯇꯒꯤ ꯑꯦꯗꯜꯇ ꯁꯔꯚꯤꯚꯔꯁꯤꯡꯕꯨ ꯁꯄꯣꯔꯠ ꯇꯧꯕꯥ ꯆꯦꯔꯤꯇꯤ ꯑꯃꯅꯤ꯫
line and local support services,ꯂꯥꯏꯟ ꯑꯃꯁꯨꯡ ꯂꯣꯀꯦꯜ ꯁꯄꯣꯔꯠ ꯁꯔꯕꯤꯁꯁꯤꯡ
National Institute for Health and Care Excellence (NICE),ꯅꯦꯁ꯭ꯅꯦꯜ ꯏꯟꯁꯇꯤꯠꯌꯨꯠ ꯐꯣꯔ ꯍꯦꯜꯊ ꯑꯦꯟꯗ ꯀꯦꯌꯔ ꯑꯦꯛꯁꯦꯂꯦꯟꯁ (ꯑꯦꯟ.ꯑꯥꯏ.ꯁꯤ.ꯏ.)
nice.org.uk,nice.org.uk ꯒꯤ ꯃꯇꯥꯡꯗꯥ ꯋꯥꯐꯝ ꯀꯌꯥ ꯊꯃꯈꯤ꯫
Produces guidelines on best practice in healthcare,ꯍꯦꯜꯊꯀꯦꯌꯔꯗꯥ ꯈ꯭ꯕꯥꯏꯗꯒꯤ ꯐꯕꯥ ꯊꯕꯀꯁꯤꯡꯒꯤ ꯃꯇꯥꯡꯗꯥ ꯒꯥꯏꯗꯂꯥꯏꯅꯁꯤꯡ ꯄꯨꯊꯣꯀꯏ
NHS UK,ꯑꯦꯟ.ꯑꯩꯆ.ꯑꯦꯁ.ꯌꯨ.ꯀꯦ.
nhs.uk,ꯑꯦꯟ.ꯑꯩꯆ.ꯑꯦꯁ.ꯌꯨ.ꯀꯦ.
