en,mni-Mtei
Grants army set out on the Overland Campaign intending to draw Lee into a defense of Richmond where they would attempt to pin down and destroy the Confederate army,ꯒ꯭ꯔꯥꯟꯇꯁ ꯑꯥꯔꯃꯤꯅꯥ ꯑꯣꯚꯔꯂꯦꯟꯗ ꯀꯦꯝꯄꯦꯅꯗꯥ ꯂꯤꯛꯅꯥ ꯔꯤꯆꯃꯟꯗꯒꯤ ꯉꯥꯀꯊꯣꯛꯅꯕꯥ ꯊꯧꯔꯥꯡ ꯇꯧꯗꯨꯅꯥ ꯂꯥꯀꯈꯤ ꯃꯐꯝ ꯑꯗꯨꯗꯥ ꯃꯈꯣꯌꯅꯥ ꯀꯅꯐꯦꯗꯔꯦꯠ ꯑꯥꯔꯃꯤꯕꯨ ꯄꯤꯟ ꯗꯥꯎꯟ ꯇꯧꯅꯕꯥ ꯑꯃꯁꯨꯡ ꯃꯥꯡꯍꯟ ꯇꯥꯀꯍꯟꯅꯕꯥ ꯍꯣꯠꯅꯒꯅꯤ
The Union army first attempted to maneuver past Lee and fought several battles notably at the Wilderness Spotsylvania and Cold Harbor,ꯌꯨꯅꯤꯌꯟ ꯑꯥꯔꯃꯤꯅꯥ ꯑꯍꯥꯅꯕꯥ ꯑꯣꯏꯅꯥ ꯂꯤꯒꯤ ꯃꯃꯥꯡꯗꯥ ꯃꯦꯟꯌꯨꯑꯣꯔ ꯇꯧꯅꯕꯥ ꯍꯣꯠꯅꯈꯤ ꯑꯃꯁꯨꯡ ꯋꯥꯏꯜꯗꯔꯅꯦꯁ ꯁ꯭ꯄꯣꯠꯁꯤꯂꯚꯥꯅꯤꯌꯥ ꯑꯃꯁꯨꯡ ꯀꯣꯜꯗ ꯍꯥꯔꯕꯔꯗꯥ ꯃꯔꯨꯑꯣꯏꯅꯥ ꯂꯥꯟ ꯀꯌꯥ ꯂꯥꯟꯊꯦꯡꯅꯈꯤ
These resulted in heavy losses on both sides and forced Lees Confederates to fall back repeatedly,ꯃꯁꯤꯒꯤ ꯃꯍꯩ ꯑꯣꯏꯅꯥ ꯅꯥꯀꯜ ꯑꯅꯤꯃꯛꯇꯥ ꯑꯀꯅꯕꯥ ꯑꯃꯥꯡ-ꯑꯇꯥ ꯊꯣꯀꯍꯅꯈꯤ ꯑꯃꯁꯨꯡ ꯂꯤꯁ ꯀꯅꯐꯦꯗꯔꯦꯠꯁꯤꯡ ꯍꯟꯖꯤꯟ ꯍꯟꯖꯤꯟ ꯁꯣꯀꯄꯥ ꯌꯥꯍꯅꯈꯤ
At the Battle of Yellow Tavern the Confederates lost Jeb Stuart,ꯌꯦꯜꯂꯣ ꯇꯦꯚꯔꯒꯤ ꯂꯥꯅꯗꯥ ꯀꯅꯐꯦꯗꯔꯦꯠꯁꯤꯡꯅꯥ ꯖꯦꯕ ꯁ꯭ꯇꯨꯌꯥꯔꯠ ꯃꯥꯏꯊꯤꯕꯥ ꯄꯤꯈꯤ
An attempt to outflank Lee from the south failed under Butler who was trapped inside the Bermuda Hundred river bend,ꯕꯔꯃꯨꯗꯥ ꯍꯟꯗ꯭ꯔꯦꯗ ꯔꯤꯚꯔ ꯕꯦꯟꯗꯒꯤ ꯃꯅꯨꯡꯗꯥ ꯊꯨꯡꯂꯈꯤꯕꯥ ꯕꯇꯂꯔꯒꯤ ꯃꯈꯥꯗꯥ ꯈꯥ ꯊꯪꯕꯥ ꯂꯤ ꯑꯥꯎꯠꯐ꯭ꯂꯦꯉ꯭ꯛ ꯇꯧꯅꯕꯥ ꯍꯣꯠꯅꯕꯗꯥ ꯃꯥꯌ ꯄꯥꯀꯈꯤꯗꯦ
Each battle resulted in setbacks for the Union that mirrored those they had suffered under prior generals though unlike them Grant chose to fight on rather than retreat,ꯂꯥꯟ ꯈꯨꯗꯤꯡꯃꯛꯀꯤ ꯃꯍꯩ ꯑꯣꯏꯅꯥ ꯌꯨꯅꯤꯌꯅꯒꯤꯗꯃꯛ ꯑꯋꯥꯕꯥ ꯊꯣꯀꯍꯅꯈꯤ ꯃꯗꯨꯗꯤ ꯃꯈꯣꯌꯅꯥ ꯃꯃꯥꯡꯒꯤ ꯖꯦꯅꯔꯦꯂꯁꯤꯡꯒꯤ ꯃꯈꯥꯗꯥ ꯊꯦꯡꯅꯈꯤꯕꯁꯤꯡ ꯑꯗꯨ ꯃꯤꯔꯔ ꯇꯧꯈꯤ ꯑꯗꯨꯕꯨ ꯃꯈꯣꯌꯒꯥ ꯃꯥꯟꯅꯗꯅꯥ ꯒ꯭ꯔꯥꯟꯇꯅꯥ ꯔꯤꯠꯔꯤꯠ ꯇꯧꯕꯒꯤ ꯃꯍꯨꯠꯇꯥ ꯂꯥꯟꯊꯦꯡꯅꯅꯕꯥ ꯈꯜꯂꯀꯈꯤ
Grant was tenacious and kept pressing Lees Army of Northern Virginia back to Richmond,ꯒ꯭ꯔꯥꯟꯇ ꯑꯁꯤ ꯇꯦꯅꯥꯁꯤꯁ ꯑꯣꯏꯈꯤ ꯑꯃꯁꯨꯡ ꯅꯣꯔꯊ ꯚꯔꯖꯤꯅꯤꯌꯥꯒꯤ ꯂꯤꯁ ꯑꯥꯔꯃꯤ ꯑꯁꯤ ꯔꯤꯆꯃꯟꯗꯗꯥ ꯑꯃꯨꯛ ꯍꯟꯅꯥ ꯄ꯭ꯔꯦꯁ ꯇꯧꯗꯨꯅꯥ ꯊꯃꯈꯤ
While Lee was preparing for an attack on Richmond Grant unexpectedly turned south to cross the James River and began the protracted Siege of Petersburg where the two armies engaged in trench warfare for over nine months,ꯂꯤꯅꯥ ꯔꯤꯆꯃꯟꯗ ꯒ꯭ꯔꯥꯟꯇꯇꯥ ꯑꯦꯇꯦꯛ ꯑꯃꯥ ꯇꯧꯅꯕꯥ ꯁꯦꯝ ꯁꯥꯔꯤꯉꯩꯗꯥ ꯃꯈꯥ ꯇꯥꯅꯥ ꯈꯥ ꯊꯪꯕꯥ ꯃꯥꯏꯀꯩꯗꯥ ꯖꯦꯃꯁ ꯇꯨꯔꯦꯜ ꯂꯥꯟꯗꯨꯅꯥ ꯈꯥ ꯊꯪꯕꯥ ꯃꯥꯏꯀꯩꯗꯥ ꯂꯥꯀꯈꯤ ꯑꯃꯁꯨꯡ ꯄꯤꯇꯔꯁꯕꯔꯒꯀꯤ ꯃꯇꯝ ꯁꯥꯡꯅꯥ ꯂꯥꯟꯗꯥꯕꯥ ꯍꯧꯈꯤ ꯃꯐꯝ ꯑꯗꯨꯗꯥ ꯂꯥꯟꯃꯤ ꯑꯅꯤꯅꯥ ꯊꯥ ꯑꯅꯤ ꯍꯦꯟꯅꯥ ꯇ꯭ꯔꯦꯟꯆ ꯋꯥꯔꯐꯦꯌꯔ ꯇꯧꯈꯤ
To deny the Confederacy continued use of the Shenandoah Valley as a base from which to launch invasions of Maryland and the Washington area and to threaten Lees supply lines for his forces Grant launched the Valley campaigns in the spring of 1864,ꯀꯅꯐꯦꯗꯔꯦꯁꯟ ꯑꯁꯤ ꯌꯥꯗꯕꯥ ꯍꯥꯌꯕꯁꯤꯅꯥ ꯁꯦꯅꯟꯗꯣꯍ ꯚꯦꯂꯤ ꯑꯁꯤ ꯃꯈꯥ ꯇꯥꯅꯥ ꯁꯤꯖꯤꯟꯅꯗꯨꯅꯥ ꯃꯦꯔꯤꯜꯌꯥꯟꯗ ꯑꯃꯁꯨꯡ ꯋꯥꯁꯤꯡꯇꯟꯗꯥ ꯂꯥꯀꯄꯥ ꯂꯥꯟꯃꯤꯁꯤꯡꯕꯨ ꯊꯥꯗꯣꯀꯄꯥ ꯑꯃꯁꯨꯡ ꯃꯍꯥꯛꯀꯤ ꯐꯣꯔꯁ ꯒ꯭ꯔꯥꯟꯇꯀꯤꯗꯃꯛ ꯂꯤꯁ ꯁꯞꯂꯥꯏ ꯂꯥꯏꯅꯁꯤꯡꯗꯥ ꯆꯩꯊꯦꯡ ꯄꯤꯕꯥ ꯕꯦꯖ ꯑꯃꯥ ꯑꯣꯏꯅꯥ ꯱꯸꯶꯴ ꯒꯤ ꯊꯥꯗꯥ ꯚꯦꯂꯤ ꯀꯦꯝꯄꯦꯅꯁꯤꯡ ꯍꯧꯗꯣꯀꯈꯤ꯫
Initial efforts led by Gen,ꯖꯤ.ꯏ.ꯑꯦꯟ.ꯅꯥ ꯂꯨꯆꯤꯡꯗꯨꯅꯥ ꯑꯍꯥꯅꯕꯥ ꯑꯣꯏꯅꯥ ꯍꯣꯠꯅꯔꯤꯕꯁꯤꯡ
Sigel were repelled at the Battle of New Market by Confederate Gen,ꯁꯤꯒꯦꯜ ꯑꯁꯤ ꯀꯅꯐꯦꯗꯔꯦꯠ ꯖꯦꯟ .
John C,ꯖꯣꯟ ꯁꯤ .
Breckinridge,ꯕ꯭ꯔꯦꯀꯤꯅꯔꯤꯖ
The Battle of New Market was the Confederacys last major victory and included a charge by teenage VMI cadets,ꯑꯅꯧꯕꯥ ꯀꯩꯊꯦꯂꯒꯤ ꯂꯥꯅꯐꯝ ꯑꯁꯤ ꯀꯅꯐꯦꯗꯔꯦꯁꯤꯁꯤꯡꯅꯥ ꯑꯔꯣꯏꯕꯥ ꯑꯣꯏꯅꯥ ꯑꯆꯧꯕꯥ ꯃꯥꯏꯄꯥꯀꯄꯥ ꯑꯃꯥ ꯑꯣꯏꯈꯤ ꯑꯃꯁꯨꯡ ꯃꯁꯤꯗꯥ ꯇꯤꯅꯑꯦꯖ ꯚꯤ.ꯑꯦꯝ.ꯑꯥꯏ.
After relieving Sigel and following mixed performances by his successor Grant finally found a commander General Philip Sheridan aggressive enough to prevail against the army of Maj,ꯁꯤꯒꯦꯜ ꯔꯤꯂꯤꯐ ꯇꯧꯔꯕꯥ ꯃꯇꯨꯡꯗꯥ ꯑꯃꯁꯨꯡ ꯃꯍꯥꯛꯀꯤ ꯃꯇꯨꯡ ꯇꯥꯔꯀꯄꯥ ꯒ꯭ꯔꯥꯟꯇꯅꯥ ꯃꯤꯛꯁ ꯇꯧꯔꯕꯥ ꯄꯔꯐꯣꯃꯦꯟꯁꯁꯤꯡꯒꯤ ꯃꯇꯨꯡ ꯏꯟꯅꯥ ꯑꯔꯣꯏꯕꯗꯥ ꯑꯦꯝ.ꯑꯦ.ꯖꯦ.
Gen,ꯖꯦꯟ ꯑꯁꯤ ꯌꯥꯑꯣꯔꯤ꯫
Jubal A,ꯖꯨꯕꯥꯜ ꯑꯦ .
Early,ꯉꯟꯅ
After a cautious start Sheridan defeated Early in a series of battles in September and October 1864 including a decisive defeat at the Battle of Cedar Creek,ꯆꯦꯀꯁꯤꯟꯅꯥ ꯍꯧꯔꯀꯄꯒꯤ ꯃꯇꯨꯡꯗꯥ ꯁꯦꯔꯤꯗꯥꯅꯅꯥ ꯁꯤꯗꯥꯔ ꯀ꯭ꯔꯤꯀꯀꯤ ꯂꯥꯅꯗꯥ ꯑꯀꯅꯕꯥ ꯃꯥꯏꯊꯤꯕꯥ ꯑꯃꯥ ꯌꯥꯑꯣꯅꯥ ꯁꯦꯞꯇꯦꯝꯕꯔ ꯑꯃꯁꯨꯡ ꯑꯣꯛꯇꯣꯕꯔ ꯱꯸꯶꯴ꯗꯥ ꯂꯥꯟ ꯀꯌꯥ ꯊꯣꯀꯈꯤꯕꯗꯥ ꯇꯣꯌꯅꯥ ꯃꯥꯏꯊꯤꯕꯥ ꯄꯤꯔꯕꯥ ꯃꯇꯨꯡꯗꯥ
Sheridan then proceeded through that winter to destroy the agricultural base of the Shenandoah Valley a strategy similar to the tactics Sherman later employed in Georgia,ꯃꯗꯨꯒꯤ ꯃꯇꯨꯡꯗꯥ ꯁꯦꯔꯤꯗꯥꯅꯅꯥ ꯁꯦꯔꯃꯥꯅꯅꯥ ꯃꯇꯨꯡꯗꯥ ꯖꯔꯖꯤꯌꯥꯗꯥ ꯊꯕꯛ ꯇꯧꯔꯝꯕꯥ ꯇꯦꯛꯅꯤꯀꯁꯤꯡꯒꯥ ꯃꯥꯟꯅꯕꯥ ꯁ꯭ꯠꯔꯦꯇꯦꯖꯤ ꯑꯃꯥ ꯁꯦꯅꯗꯣꯡ ꯚꯦꯂꯤꯒꯤ ꯂꯧꯎ-ꯁꯤꯡꯎꯒꯤ ꯕꯦꯖ ꯑꯗꯨ ꯃꯥꯡꯍꯟ ꯇꯥꯀꯍꯟꯅꯕꯥ ꯅꯣꯡꯖꯨ ꯑꯗꯨꯒꯤ ꯃꯅꯨꯡꯗꯥ ꯆꯪꯁꯤꯅꯈꯤ꯫
Meanwhile Sherman maneuvered from Chattanooga to Atlanta defeating Confederate Generals Joseph E,ꯃꯁꯤꯒꯤ ꯃꯅꯨꯡꯗꯥ ꯁꯦꯔꯃꯥꯅꯅꯥ ꯆꯠꯇꯅꯧꯒꯥ ꯂꯣꯌꯅꯅꯥ ꯑꯦꯇꯂꯥꯟꯇꯥꯗꯥ ꯀꯅꯐꯦꯗꯔꯦꯠ ꯖꯦꯅꯔꯦꯂꯁꯤꯡ ꯖꯣꯁꯦꯐ ꯏ .
Johnston and John Bell Hood,ꯖꯣꯅꯁ꯭ꯇꯣꯟ ꯑꯃꯁꯨꯡ ꯖꯣꯟ ꯕꯦꯜ ꯍꯨꯗ .
The fall of Atlanta on September 2 1864 guaranteed the reelection of Lincoln,"ꯁꯦꯞꯇꯦꯝꯕꯔ ꯲, ꯱꯸꯶꯴ꯗꯥ ꯑꯦꯇꯂꯥꯟꯇꯥ ꯊꯣꯀꯈꯤꯕꯥ ꯊꯧꯗꯣꯛ ꯑꯗꯨꯅꯥ ꯂꯤꯉ꯭ꯀꯅꯒꯤ ꯑꯃꯨꯛ ꯍꯟꯅꯥ ꯈꯅꯕꯒꯤ ꯒꯔꯦꯟꯇꯤ ꯄꯤꯈꯤ꯫"
Hood left the Atlanta area to swing around and menace Shermans supply lines and invade Tennessee in the FranklinNashville Campaign,ꯍꯨꯗꯅꯥ ꯑꯦꯇꯂꯥꯟꯇꯥ ꯃꯐꯝ ꯑꯗꯨ ꯊꯥꯗꯣꯛꯇꯨꯅꯥ ꯆꯠꯈꯤ ꯑꯃꯁꯨꯡ ꯁꯦꯔꯃꯟꯁ ꯁꯞꯂꯥꯏ ꯂꯥꯏꯅꯁꯤꯡ ꯑꯃꯁꯨꯡ ꯐ꯭ꯔꯥꯉ꯭ꯀꯂꯤꯅꯥꯁꯚꯤꯜ ꯀꯦꯝꯄꯦꯅꯗꯥ ꯇꯦꯅꯦꯁꯤꯗꯥ ꯆꯪꯁꯤꯅꯈꯤ
Union Maj,ꯌꯨꯅꯤꯌꯟ ꯑꯦꯝ.ꯑꯦ.ꯖꯦ.
Gen,ꯖꯦꯟ ꯑꯁꯤ ꯌꯥꯑꯣꯔꯤ꯫
John Schofield defeated Hood at the Battle of Franklin and George H,ꯖꯣꯟ ꯁ꯭ꯀꯣꯐꯤꯜꯗꯅꯥ ꯐ꯭ꯔꯥꯉ꯭ꯀꯂꯤꯟ ꯑꯃꯁꯨꯡ ꯖꯔꯖ ꯑꯦꯆꯀꯤ ꯂꯥꯅꯗꯥ ꯍꯨꯗꯄꯨ ꯃꯥꯏꯊꯤꯕꯥ ꯄꯤꯈꯤ
Thomas dealt Hood a massive defeat at the Battle of Nashville effectively destroying Hoods army,ꯊꯣꯃꯥꯁ ꯗꯤꯜ ꯇꯧꯈꯤ ꯍꯨꯗ ꯅꯥꯁꯚꯤꯂꯒꯤ ꯂꯥꯅꯗꯥ ꯑꯆꯧꯕꯥ ꯃꯥꯏꯊꯤꯕꯥ ꯑꯃꯥ ꯍꯨꯗꯁ ꯑꯥꯔꯃꯤꯕꯨ ꯏꯐꯦꯛꯇꯤꯕ ꯑꯣꯏꯅꯥ ꯃꯥꯡꯍꯅꯈꯤ
Leaving Atlanta and his base of supplies Shermans army marched with no destination set laying waste to about 20 of the farms in Georgia in his March to the Sea,"ꯑꯦꯇꯂꯥꯟꯇꯥ ꯑꯃꯁꯨꯡ ꯃꯍꯥꯛꯀꯤ ꯁꯞꯂꯥꯏꯁꯤꯡꯒꯤ ꯕꯦꯖ ꯊꯥꯗꯣꯛꯇꯨꯅꯥ ꯁꯦꯔꯃꯟꯁ ꯑꯥꯔꯃꯤꯅꯥ ꯃꯐꯝ ꯑꯃꯠꯇꯥ ꯂꯩꯇꯅꯥ ꯈꯣꯡꯆꯠ ꯆꯠꯈꯤ ꯁꯦꯠ ꯇꯧꯕꯥ ꯌꯥꯕꯥ ꯃꯐꯝ ꯑꯃꯠꯇꯥ ꯂꯩꯇꯦ, ꯃꯍꯥꯛꯀꯤ ꯁꯃꯨꯗ꯭ꯔ ꯈꯣꯡꯕꯥꯂꯗꯥ ꯃꯍꯥꯛꯀꯤ ꯈꯣꯡꯆꯠꯇꯥ ꯖꯔꯖꯤꯌꯥꯒꯤ ꯐꯥꯔꯝ ꯲꯰ꯗꯥ ꯃꯥꯡꯍꯅꯈꯤ꯫"
He reached the Atlantic at Savannah Georgia in December 1864,ꯃꯍꯥꯛ ꯱꯸꯶꯴ꯒꯤ ꯗꯤꯁꯦꯝꯕꯔꯗꯥ ꯁꯥꯚꯥꯅꯥ ꯖꯔꯖꯤꯌꯥꯗꯥ ꯑꯦꯇꯂꯥꯟꯇꯤꯀꯇꯥ ꯌꯧꯈꯤ꯫
Shermans army was followed by thousands of freed slaves there were no major battles along the march,ꯁꯦꯔꯃꯟꯁ ꯑꯥꯔꯃꯤꯒꯤ ꯃꯇꯨꯡꯗꯥ ꯐ꯭ꯔꯤꯗꯝ ꯁ꯭ꯂꯦꯕ ꯂꯤꯁꯤꯡ ꯀꯌꯥꯅꯥ ꯃꯥꯔꯆꯀꯤ ꯃꯅꯨꯡꯗꯥ ꯑꯆꯧꯕꯥ ꯂꯥꯟ ꯑꯃꯠꯇꯥ ꯂꯩꯈꯤꯗꯦ
Sherman turned north through South Carolina and North Carolina to approach the Confederate Virginia lines from the south increasing the pressure on Lees army,ꯁꯦꯔꯃꯟꯅꯥ ꯁꯥꯎꯊ ꯀꯦꯔꯣꯂꯥꯏꯅꯥ ꯑꯃꯁꯨꯡ ꯅꯣꯔꯊ ꯀꯦꯔꯣꯂꯥꯏꯅꯥꯒꯤ ꯈꯨꯠꯊꯥꯡꯗꯥ ꯅꯣꯡꯄꯣꯛ ꯊꯪꯕꯥ ꯂꯃꯗꯃꯗꯒꯤ ꯂꯥꯀꯄꯥ ꯀꯅꯐꯦꯗꯔꯦꯠ ꯚꯥꯔꯖꯤꯅꯤꯌꯥ ꯂꯥꯏꯅꯁꯤꯡꯗꯥ ꯂꯥꯀꯄꯥ ꯂꯤꯁ ꯑꯥꯔꯃꯤꯗꯥ ꯄ꯭ꯔꯦꯁꯔ ꯍꯦꯅꯒꯠꯍꯟꯗꯨꯅꯥ ꯂꯥꯀꯈꯤ
Lees army thinned by desertion and casualties was now much smaller than Grants,ꯂꯤꯁ ꯑꯥꯔꯃꯤꯅꯥ ꯊꯥꯗꯣꯀꯈꯤꯕꯥ ꯑꯃꯁꯨꯡ ꯁꯤꯈꯤꯕꯥ ꯑꯁꯤ ꯍꯧꯖꯤꯛꯇꯤ ꯒ꯭ꯔꯥꯟꯇꯁꯤꯡꯗꯒꯤ ꯌꯥꯝꯅꯥ ꯍꯦꯟꯅꯥ ꯄꯤꯀꯄꯥ ꯑꯣꯏꯔꯦ꯫
One last Confederate attempt to break the Union hold on Petersburg failed at the decisive Battle of Five Forks on April 1,ꯄꯤꯇꯔꯁꯕꯔꯒꯇꯥ ꯌꯨꯅꯤꯌꯟ ꯍꯣꯜꯗ ꯑꯁꯤ ꯊꯨꯒꯥꯏꯅꯕꯥ ꯑꯔꯣꯏꯕꯥ ꯀꯅꯐꯦꯗꯔꯦꯠꯀꯤ ꯍꯣꯠꯅꯕꯥ ꯑꯃꯅꯥ ꯑꯦꯞꯔꯤꯜ ꯱ꯗꯥ ꯐꯣꯔꯛ ꯃꯉꯥꯒꯤ ꯋꯥꯔꯦꯞ ꯂꯧꯕꯥ ꯉꯃꯈꯤꯕꯥ ꯑꯗꯨꯗꯥ ꯃꯥꯌ ꯄꯥꯀꯈꯤꯗꯦ꯫
The Union now controlled the entire perimeter surrounding RichmondPetersburg completely cutting it off from the Confederacy,ꯌꯨꯅꯤꯌꯟ ꯑꯁꯤꯅꯥ ꯍꯧꯖꯤꯛ ꯔꯤꯆꯃꯟꯗꯄꯦꯇꯔꯁꯕꯔꯒꯀꯤ ꯑꯀꯣꯌꯕꯗꯥ ꯂꯩꯕꯥ ꯄꯦꯔꯤꯃꯤꯇꯔ ꯄꯨꯝꯅꯃꯛ ꯀꯟꯠꯔꯣꯜ ꯇꯧꯈꯤ ꯃꯗꯨꯗꯤ ꯃꯁꯤꯕꯨ ꯀꯅꯐꯦꯗꯔꯦꯁꯤꯗꯒꯤ ꯃꯄꯨꯡ ꯐꯥꯅꯥ ꯀꯀꯊꯠꯈꯤ
Realizing the capital was now lost Lees army and the Confederate government were forced to evacuate,ꯀꯦꯄꯤꯇꯦꯂꯅꯥ ꯍꯧꯖꯤꯛ ꯂꯤꯁ ꯑꯥꯔꯃꯤ ꯃꯥꯡꯈ꯭ꯔꯦ ꯍꯥꯌꯕꯥ ꯈꯉꯂꯗꯨꯅꯥ ꯑꯃꯁꯨꯡ ꯀꯅꯐꯦꯗꯔꯦꯠ ꯁꯔꯀꯥꯔꯅꯥ ꯂꯧꯊꯣꯛꯅꯕꯥ ꯋꯥꯁꯀꯈꯤ
The Confederate capital fell on April 23 to the Union XXV Corps composed of black troops,ꯀꯅꯐꯦꯗꯔꯦꯠ ꯀꯦꯄꯤꯇꯦꯜ ꯑꯁꯤ ꯑꯦꯞꯔꯤꯜ ꯲꯳ꯗꯥ ꯕ꯭ꯂꯦꯛ ꯇ꯭ꯔꯨꯄꯁꯤꯡꯅꯥ ꯁꯦꯝꯕꯥ ꯌꯨꯅꯤꯌꯟ XXV ꯀꯣꯔꯄꯁꯇꯥ ꯁꯣꯀꯈꯤ
The remaining Confederate units fled west after a defeat at Saylers Creek on April 6,ꯂꯦꯃꯍꯧꯔꯤꯕꯥ ꯀꯅꯐꯦꯗꯔꯦꯠ ꯌꯨꯅꯤꯠꯁꯤꯡ ꯑꯁꯤ ꯑꯦꯞꯔꯤꯜ ꯶ꯇꯥ ꯁꯥꯏꯂꯔꯁ ꯀ꯭ꯔꯤꯀꯇꯥ ꯃꯥꯏꯊꯤꯕꯥ ꯄꯤꯔꯕꯥ ꯃꯇꯨꯡꯗꯥ ꯋꯦꯁ꯭ꯇꯅꯥ ꯂꯥꯟꯊꯣꯀꯈꯤ꯫
Lee did not intend to surrender but planned to regroup at Appomattox Station where supplies were to be waiting and then continue the war,ꯂꯤ .
Grant chased Lee and got in front of him so that when Lees army reached the village of Appomattox Court House they were surrounded,ꯒ꯭ꯔꯥꯟꯇꯅꯥ ꯂꯤꯕꯨ ꯂꯥꯟꯗꯥꯗꯨꯅꯥ ꯃꯍꯥꯛꯀꯤ ꯃꯅꯥꯛꯇꯥ ꯂꯥꯀꯈꯤ ꯃꯔꯝ ꯑꯗꯨꯅꯥ ꯂꯤꯁ ꯑꯥꯔꯃꯤꯅꯥ ꯑꯦꯄꯣꯃꯇꯣꯛꯁ ꯀꯣꯔꯠ ꯍꯥꯎꯁ ꯈꯨꯉ꯭ꯒꯪꯗꯥ ꯌꯧꯔꯀꯄꯥ ꯃꯇꯃꯗꯥ ꯃꯈꯣꯌꯅꯥ ꯀꯨꯄꯁꯤꯜꯂꯕꯥ .
After an initial battle Lee decided the fight was hopeless and surrendered his Army of Northern Virginia to Grant on April 9 1865 during a conference at the McLean House,"ꯑꯍꯥꯅꯕꯥ ꯂꯥꯟ ꯑꯃꯒꯤ ꯃꯇꯨꯡꯗꯥ ꯂꯤꯅꯥ ꯂꯥꯟ ꯑꯁꯤ ꯑꯥꯁꯥ ꯂꯩꯇꯕꯥ ꯑꯣꯏꯒꯅꯤ ꯍꯥꯌꯅꯥ ꯋꯥꯔꯦꯞ ꯂꯧꯈꯤ ꯑꯃꯁꯨꯡ ꯃꯍꯥꯛꯀꯤ ꯅꯣꯡꯄꯣꯛ ꯊꯪꯕꯥ ꯚꯥꯔꯖꯤꯅꯤꯌꯥꯒꯤ ꯂꯥꯟꯃꯤꯁꯤꯡꯅꯥ ꯃꯦꯀꯂꯤꯟ ꯍꯥꯎꯁꯇꯥ ꯄꯥꯡꯊꯣꯀꯈꯤꯕꯥ ꯀꯅꯐꯔꯦꯟꯁ ꯑꯃꯗꯥ ꯑꯦꯞꯔꯤꯜ ꯹, ꯱꯸꯶꯵ꯗꯥ ꯒ꯭ꯔꯥꯟꯇ ꯇꯧꯅꯕꯥ ꯁꯔꯦꯟꯗꯔ ꯇꯧꯈꯤ"
In an untraditional gesture and as a sign of Grants respect and anticipation of peacefully restoring Confederate states to the Union Lee was permitted to keep his sword and horse Traveller,ꯑꯅꯠꯔꯦꯗꯤꯁꯅꯦꯜ ꯖꯦꯁꯆꯔ ꯑꯃꯗꯥ ꯑꯃꯁꯨꯡ ꯒ꯭ꯔꯥꯟꯇꯁꯤꯡꯒꯤ ꯈꯨꯗꯝ ꯑꯣꯏꯅꯥ ꯏꯀꯥꯌꯈꯨꯝꯅꯕꯥ ꯑꯃꯁꯨꯡ ꯁꯥꯟꯇꯤ ꯑꯣꯏꯅꯥ ꯀꯅꯐꯦꯗꯔꯦꯠ ꯔꯥꯖ꯭ꯌꯁꯤꯡꯕꯨ ꯌꯨꯅꯤꯌꯟ ꯂꯤꯗꯥ ꯑꯃꯨꯛ ꯍꯟꯅꯥ ꯄꯨꯔꯛꯅꯕꯥ ꯑꯦꯟꯇꯤꯁꯤꯄꯦꯁꯟ ꯑꯃꯥ ꯑꯣꯏꯅꯥ ꯃꯍꯥꯛꯀꯤ ꯇꯝꯄꯥꯛ ꯑꯃꯁꯨꯡ ꯍꯨꯏꯒꯤ ꯈꯣꯡꯆꯠ ꯑꯗꯨ ꯊꯝꯅꯕꯥ ꯑꯌꯥꯕꯥ ꯄꯤꯈꯤ
His men were paroled and a chain of Confederate surrenders began,ꯃꯍꯥꯛꯀꯤ ꯃꯤꯑꯣꯏꯁꯤꯡ ꯑꯗꯨ ꯄꯦꯔꯣꯜ ꯇꯧꯈꯤ ꯑꯃꯁꯨꯡ ꯀꯅꯐꯦꯗꯔꯦꯠ ꯁꯔꯦꯟꯗꯔꯁꯤꯡꯒꯤ ꯆꯦꯟ ꯑꯃꯥ ꯍꯧꯈꯤ .
On April 14 1865 Lincoln was shot by John Wilkes Booth a Confederate sympathizer,ꯑꯦꯞꯔꯤꯜ ꯱꯴ ꯗꯥ ꯂꯤꯡꯀꯅꯅꯥ ꯖꯣꯟ ꯋꯤꯂꯀꯦꯁ ꯕꯨꯊꯅꯥ ꯀꯅꯐꯦꯗꯔꯦꯠ ꯁꯤꯝꯄꯇꯤꯖꯔ ꯑꯃꯥ ꯊꯥꯈꯤ
Lincoln died early the next morning,ꯂꯤꯉ꯭ꯀꯟ ꯃꯊꯪꯒꯤ ꯑꯌꯨꯛ ꯑꯉꯅꯕꯗꯥ ꯁꯤꯈꯤ
Lincolns vice president Andrew Johnson was unharmed because his wouldbe assassin George Atzerodt lost his nerve so Johnson was immediately sworn in as president,ꯂꯤꯉ꯭ꯀꯅꯁꯀꯤ ꯚꯥꯏꯁ ꯄ꯭ꯔꯁꯤꯗꯦꯟꯇ ꯑꯦꯟꯗ꯭ꯔꯦꯁ ꯖꯣꯅꯁꯟꯅꯥ ꯑꯁꯣꯛ ꯑꯄꯟ ꯅꯪꯈꯤꯗꯦ ꯃꯔꯃꯗꯤ ꯃꯍꯥꯛꯀꯤ ꯑꯣꯏꯒꯅꯤ ꯑꯦꯁꯥꯁꯤꯟ ꯖꯔꯖ ꯑꯦꯇꯖꯦꯔꯣꯗꯅꯥ ꯃꯍꯥꯛꯀꯤ ꯅꯔꯚ ꯃꯥꯡꯈꯤ ꯃꯔꯝ ꯑꯗꯨꯅꯥ ꯖꯣꯟꯁꯅꯅꯥ ꯈꯨꯗꯛꯇꯥ ꯔꯥꯁ꯭ꯠꯔꯄꯇꯤ ꯑꯣꯏꯅꯥ ꯋꯥꯁꯀꯈꯤ꯫
Meanwhile Confederate forces across the South surrendered as news of Lees surrender reached them,ꯃꯁꯤꯒꯤ ꯃꯅꯨꯡꯗꯥ ꯈꯥ ꯊꯪꯕꯥ ꯁꯔꯨꯛꯇꯥ ꯂꯩꯕꯥ ꯀꯅꯐꯦꯗꯔꯦꯠ ꯐꯣꯔꯁꯁꯤꯡꯅꯥ ꯂꯤꯁ ꯁꯔꯦꯟꯗꯔꯒꯤ ꯄꯥꯎ ꯃꯈꯣꯌꯗꯥ ꯌꯧꯔꯀꯄꯗꯒꯤ ꯁꯔꯦꯟꯗꯔ ꯇꯧꯈꯤ
On April 26 the same day Sergeant Boston Corbett killed Booth at a tobacco barn Johnston surrendered nearly 90000 troops of the Army of Tennessee to Sherman at Bennett Place near presentday Durham North Carolina,ꯑꯦꯞꯔꯤꯜ ꯲꯶ꯇꯥ ꯅꯨꯃꯤꯠ ꯑꯗꯨꯃꯛꯇꯗꯥ ꯁꯥꯔꯖꯦꯟꯇ ꯕꯣꯁ꯭ꯇꯟ ꯀꯣꯔꯕꯦꯠꯅꯥ ꯇꯝꯕꯥꯛ ꯕꯥꯔꯟ ꯖꯣꯅꯁ꯭ꯇꯣꯅꯗꯥ ꯕꯨꯊ ꯍꯥꯠꯈꯤꯕꯥ ꯕꯨꯊ ꯑꯗꯨ ꯍꯧꯖꯤꯛ ꯍꯧꯖꯤꯛ ꯗꯨꯔꯍꯝ ꯅꯣꯔꯊ ꯀꯦꯔꯣꯂꯥꯏꯅꯥꯒꯤ ꯃꯅꯥꯛꯇꯥ ꯂꯩꯕꯥ ꯕꯦꯅꯦꯠ ꯄ꯭ꯂꯦꯁꯇꯥ ꯇꯦꯅꯦꯁꯤꯒꯤ ꯂꯥꯟꯃꯤꯒꯤ ꯂꯥꯟꯃꯤ ꯹꯰꯰꯰꯰ ꯔꯣꯝ ꯁꯦꯔꯃꯟꯗꯥ ꯊꯥꯈꯤ꯫
It proved to be the largest surrender of Confederate forces,ꯃꯁꯤꯅꯥ ꯀꯅꯐꯦꯗꯔꯦꯠ ꯐꯣꯔꯁꯁꯤꯡꯒꯤ ꯈ꯭ꯕꯥꯏꯗꯒꯤ ꯆꯥꯎꯕꯥ ꯁꯔꯦꯟꯗꯔ ꯑꯣꯏ ꯍꯥꯌꯕꯥ ꯄ꯭ꯔꯃꯥꯟ ꯇꯧꯈꯤ
On May 4 all remaining Confederate forces in Alabama Mississippi and Louisiana east of the Mississippi under the command of Lt. General Richard Taylor surrendered,ꯃꯦ ꯴ꯗꯥ ꯑꯂꯕꯥꯃꯥ ꯃꯤꯁꯤꯁꯤꯄꯤ ꯑꯃꯁꯨꯡ ꯃꯤꯁꯤꯁꯤꯄꯤꯒꯤ ꯅꯣꯡꯄꯣꯛ ꯊꯪꯕꯥ ꯁꯔꯨꯛꯇꯥ ꯂꯩꯕꯥ ꯂꯦꯃꯍꯧꯔꯤꯕꯥ ꯀꯅꯐꯦꯗꯔꯦꯠ ꯐꯣꯔꯁ ꯄꯨꯝꯅꯃꯛ ꯂꯦꯐꯇꯦꯅꯦꯟꯇ ꯖꯦꯅꯦꯔꯦꯜ ꯔꯤꯆꯥꯔꯗ ꯇꯦꯂꯔꯅꯥ ꯁꯔꯦꯟꯗꯔ ꯇꯧꯈꯤ
Confederate president Davis was captured in retreat at Irwinville Georgia on May 10,ꯀꯅꯐꯦꯗꯔꯦꯠ ꯄ꯭ꯔꯦꯁꯤꯗꯦꯟꯇ ꯗꯦꯕꯤꯁꯅꯥ ꯃꯦ ꯱꯰ꯗꯥ ꯏꯔꯚꯤꯅꯚꯤꯜ ꯖꯔꯖꯤꯌꯥꯗꯥ ꯔꯤꯠꯔꯤꯇꯇꯥ ꯊꯨꯡꯂꯈꯤ꯫
The final land battle was fought on May 13 1865 at the Battle of Palmito Ranch in Texas,"ꯑꯔꯣꯏꯕꯥ ꯂꯃꯒꯤ ꯂꯥꯅꯐꯝ ꯑꯗꯨ ꯇꯦꯛꯁꯁꯀꯤ ꯄꯥꯂꯃꯤꯇꯣ ꯔꯦꯟꯆꯀꯤ ꯂꯥꯅꯐꯃꯗꯥ ꯃꯦ ꯱꯳, ꯱꯸꯶꯵ ꯗꯥ ꯂꯥꯟ ꯁꯣꯛꯅꯈꯤ"
On May 26 1865 Confederate Lt. Gen,ꯃꯦ ꯲꯶ꯇꯥ ꯱꯸꯶꯵ꯗꯥ ꯀꯅꯐꯦꯗꯔꯦꯠ ꯂꯦꯐꯇꯦꯅꯦꯟꯇ ꯖꯦꯟ
Simon B,ꯁꯥꯏꯃꯟ ꯕꯤ .
Buckner acting for Edmund Smith signed a military convention surrendering Confederate forces in the TransMississippi Department,ꯑꯦꯗꯃꯟꯗ ꯁ꯭ꯃꯤꯊꯀꯤꯗꯃꯛ ꯕꯀꯅꯔꯅꯥ ꯑꯦꯛꯇꯤꯕ ꯑꯣꯏꯕꯥ ꯇ꯭ꯔꯥꯟꯁꯃꯤꯁꯤꯁꯤꯄꯤ ꯕꯤꯚꯥꯒꯇꯥ ꯀꯅꯐꯦꯗꯔꯦꯠ ꯐꯣꯔꯁꯁꯤꯡ ꯁꯔꯦꯟꯗꯔ ꯇꯧꯕꯥ ꯃꯤꯂꯤꯇꯔꯤ ꯀꯅꯚꯦꯟꯁꯟ ꯑꯃꯗꯥ ꯈꯨꯠꯌꯦꯛ ꯄꯤꯅꯈꯤ
This date is often cited by contemporaries and historians as the effective end date of the war,ꯅꯨꯃꯤꯠ ꯑꯁꯤ ꯑꯌꯥꯝꯕꯅꯥ ꯂꯥꯅꯒꯤ ꯏꯐꯦꯛꯇꯤꯕ ꯑꯣꯏꯕꯥ ꯑꯔꯣꯏꯕꯥ ꯇꯥꯡꯅꯤ ꯍꯥꯌꯅꯥ ꯃꯇꯝ ꯑꯗꯨꯒꯤ ꯑꯃꯁꯨꯡ ꯄꯨꯋꯥꯔꯤꯒꯤ ꯋꯥꯔꯤ ꯁꯥꯅꯕꯥ ꯃꯤꯑꯣꯏꯁꯤꯡꯅꯥ ꯄꯅꯈꯤ꯫
On June 2 with most of his troops having already gone home a reluctant Kirby Smith had little choice but to sign the official surrender document,ꯖꯨꯟ ꯲ꯗꯥ ꯃꯍꯥꯛꯀꯤ ꯂꯥꯟꯃꯤ ꯑꯌꯥꯝꯕꯅꯥ ꯍꯥꯟꯅꯅꯥ ꯃꯌꯨꯃꯗꯥ ꯆꯠꯈ꯭ꯔꯕꯅꯤꯅꯥ ꯃꯤꯑꯣꯏ ꯑꯃꯥ ꯑꯅꯤꯡꯕꯥ ꯄꯣꯀꯄꯥ ꯀꯤꯔꯕꯤ ꯁ꯭ꯃꯤꯊ ꯑꯃꯥ ꯑꯣꯐꯤꯁꯤꯑꯦꯜ ꯁꯔꯦꯟꯗꯔ ꯗꯣꯀꯨꯃꯦꯟꯇꯇꯥ ꯈꯨꯠꯌꯦꯛ ꯄꯤꯅꯕꯒꯤ ꯑꯇꯣꯞꯄꯥ ꯄꯥꯝꯕꯩ ꯑꯃꯠꯇꯥ ꯂꯩꯈꯤꯗꯦ
On June 23 Cherokee leader and Brig,ꯖꯨꯟ ꯲꯳ꯗꯥ ꯆꯦꯔꯣꯀꯤ ꯂꯨꯆꯤꯡꯕꯥ ꯑꯃꯁꯨꯡ ꯕ꯭ꯔꯤ.
General Stand Watie became the last Confederate general to surrender his forces,ꯖꯦꯅꯦꯔꯦꯜ ꯁ꯭ꯇꯦꯟꯗ ꯋꯥꯇꯤꯅꯥ ꯃꯍꯥꯛꯀꯤ ꯐꯣꯔꯁꯁꯤꯡ ꯁꯔꯦꯟꯗꯔ ꯇꯧꯈꯤꯕꯥ ꯑꯔꯣꯏꯕꯥ ꯀꯅꯐꯦꯗꯔꯦꯠ ꯖꯦꯅꯦꯔꯦꯜ ꯑꯣꯏꯈꯤ
On June 19 1865 Union Maj,ꯖꯨꯟ ꯱꯹ꯗꯥ ꯱꯸꯶꯵ꯗꯥ ꯌꯨꯅꯤꯌꯟ ꯃꯦꯖ .
Gen,ꯖꯦꯟ ꯑꯁꯤ ꯌꯥꯑꯣꯔꯤ꯫
Gordon Granger announced General Order No. 3 bringing the Emancipation Proclamation into effect in Texas and freeing the last slaves of the Confederacy,ꯒꯔꯗꯟ ꯒ꯭ꯔꯦꯟꯖꯔꯅꯥ ꯖꯦꯅꯦꯔꯦꯜ ꯑꯣꯔꯗꯔ ꯅꯝꯕꯔ ꯳ꯅꯥ ꯇꯦꯛꯁꯇꯥꯏꯂꯗꯥ ꯏꯃꯥꯟꯁꯤꯄꯦꯁꯟ ꯄ꯭ꯔꯣꯛꯂꯥꯃꯦꯟꯇ ꯑꯁꯤ ꯆꯠꯅꯕꯥ ꯍꯧꯍꯟꯗꯨꯅꯥ ꯀꯅꯐꯦꯗꯔꯦꯁꯤꯒꯤ ꯑꯔꯣꯏꯕꯥ ꯂꯥꯟꯃꯤꯁꯤꯡꯕꯨ ꯅꯤꯡꯇꯃꯍꯟꯅꯕꯥ ꯂꯥꯎꯊꯣꯀꯈꯤ
The anniversary of this date is now celebrated as Juneteenth,ꯅꯨꯃꯤꯠ ꯑꯁꯤꯒꯤ ꯑꯦꯅꯤꯕꯔꯁꯦꯔꯤ ꯑꯁꯤ ꯍꯧꯖꯤꯛ ꯖꯨꯅꯇꯤꯅꯊꯇꯥ ꯄꯥꯡꯊꯣꯛꯂꯦ꯫
The naval part of the war ended more slowly,ꯂꯥꯅꯒꯤ ꯅꯦꯚꯤꯒꯤ ꯁꯔꯨꯛ ꯑꯗꯨ ꯍꯦꯟꯅꯥ ꯇꯞꯅꯥ ꯂꯣꯏꯁꯤꯅꯈꯤ꯫
It had begun on April 11 two days after Lees surrender when Lincoln proclaimed that foreign nations had no further claim or pretense to deny equality of maritime rights and hospitalities to U.S. warships and in effect that rights extended to Confederate ships to use neutral ports as safe havens from U.S. warships should end,ꯂꯤꯅꯀꯣꯟꯅꯥ ꯌꯨ.ꯑꯦꯁ.ꯀꯤ ꯂꯥꯟꯃꯤꯁꯤꯡꯗꯥ ꯁꯃꯨꯗ꯭ꯔꯒꯤ ꯍꯀꯁꯤꯡ ꯑꯃꯁꯨꯡ ꯍꯣꯁ꯭ꯄꯤꯇꯥꯂꯤꯇꯤꯁꯤꯡꯒꯤ ꯃꯥꯟꯅꯕꯥ ꯂꯩꯇꯕꯥ ꯑꯗꯨ ꯂꯧꯊꯣꯛꯅꯕꯥ ꯃꯈꯥ ꯇꯥꯕꯥ ꯀ꯭ꯂꯦꯝ ꯅꯠꯔꯒꯥ ꯄ꯭ꯔꯦꯇꯦꯟꯁ ꯂꯩꯇꯦ ꯍꯥꯌꯅꯥ ꯂꯥꯎꯊꯣꯀꯈꯤꯕꯥ ꯃꯇꯃꯗꯥ ꯂꯤꯁꯤꯡꯅꯥ ꯁꯔꯦꯟꯗꯔ ꯇꯧꯔꯕꯥ ꯃꯇꯨꯡꯗꯥ ꯅꯨꯃꯤꯠ ꯑꯅꯤꯒꯤ ꯃꯇꯨꯡꯗꯥ ꯃꯁꯤ ꯑꯦꯞꯔꯤꯜ ꯱꯱ꯗꯥ ꯍꯧꯈꯤꯕꯅꯤ ꯑꯃꯁꯨꯡ ꯃꯁꯤ ꯇꯁꯦꯡꯕꯗꯥ ꯌꯨ.ꯑꯦꯁ.
Having no response to Lincolns proclamation President Johnson issued a similar proclamation dated May 10 more directly stating that the war was almost at an end and insurgent cruisers still at sea and prepared to attack U.S. ships should not have rights to do so through use of safe foreign ports or,ꯂꯤꯉ꯭ꯀꯅꯁ ꯄ꯭ꯔꯣꯛꯂꯥꯃꯦꯁꯅꯒꯤ ꯃꯇꯥꯡꯗꯥ ꯄꯥꯎꯈꯨꯝ ꯑꯃꯠꯇꯥ ꯄꯤꯗꯅꯥ ꯄ꯭ꯔꯁꯤꯗꯦꯟꯇ ꯖꯣꯅꯁꯟꯅꯥ ꯃꯦ ꯱꯰ꯗꯥ ꯍꯦꯟꯅꯥ ꯍꯀꯊꯦꯡꯅꯅꯥ ꯍꯥꯌꯈꯤ ꯃꯗꯨꯗꯤ ꯂꯥꯟ ꯑꯁꯤ ꯆꯥꯎꯔꯥꯛꯅꯥ ꯂꯣꯏꯁꯤꯜꯂꯛꯂꯦ ꯑꯃꯁꯨꯡ ꯏꯅꯁꯥꯔꯖꯦꯟꯇ ꯀ꯭ꯔꯨꯏꯖꯁꯤꯡ ꯑꯁꯤ ꯍꯧꯖꯤꯀꯁꯨ ꯁꯃꯨꯗ꯭ꯔꯗꯥ ꯂꯩꯔꯤ ꯑꯃꯁꯨꯡ ꯌꯨ.ꯑꯦꯁ.
waters,ꯏꯁꯤꯡ ꯊꯨꯃꯖꯤꯅꯕꯥ .
Britain finally responded on June 6 by transmitting a letter from Foreign Secretary John Russell 1st Earl Russell to the Lords of the Admiralty withdrawing rights to Confederate warships to enter British ports and waters,ꯕ꯭ꯔꯤꯇꯦꯟꯅꯥ ꯑꯔꯣꯏꯕꯗꯥ ꯖꯨꯟ ꯶ꯇꯥ ꯐꯣꯔꯦꯟ ꯁꯦꯛꯔꯦꯇꯔꯤ ꯖꯣꯟ ꯔꯁꯜ ꯱ꯁꯨꯕꯥ ꯏꯔꯜ ꯔꯁꯂꯅꯥ ꯕ꯭ꯔꯤꯇꯤꯁ ꯄꯣꯔꯇꯁ ꯑꯃꯁꯨꯡ ꯋꯥꯇꯔꯁꯇꯥ ꯆꯪꯂꯀꯄꯒꯤ ꯀꯟꯐꯦꯗꯔꯦꯠ ꯂꯥꯟꯃꯤꯁꯤꯡꯒꯤ ꯍꯀꯁꯤꯡ ꯂꯧꯊꯣꯀꯄꯥ ꯑꯦꯗꯃꯤꯔꯦꯂꯇꯤꯒꯤ ꯂꯧꯃꯤꯁꯤꯡꯗꯥ ꯊꯥꯗꯨꯅꯥ ꯄꯥꯎꯈꯨꯝ ꯄꯤꯈꯤ꯫
U.S. Secretary of State Seward welcomed the withdrawal of concessions to the Confederates,ꯌꯨ.ꯑꯦꯁ.ꯀꯤ ꯁꯦꯛꯔꯦꯇꯔꯤ ꯑꯣꯐ ꯁ꯭ꯇꯦꯠ ꯁꯦꯋꯥꯔꯗꯅꯥ ꯀꯅꯐꯦꯗꯔꯦꯠꯁꯤꯡꯗꯥ ꯀꯟꯁꯦꯁꯅꯁꯤꯡ ꯂꯧꯊꯣꯀꯈꯤꯕꯥ ꯑꯗꯨ ꯇꯔꯥꯝꯅꯥ ꯑꯣꯀꯈꯤ
Finally on October 18 Russell advised the Admiralty that the time specified in his June message had elapsed and all measures of a restrictive nature on vessels of war of the United States in British ports harbors and waters are now to be considered as at an end,ꯑꯔꯣꯏꯕꯗꯥ ꯑꯣꯛꯇꯣꯕꯔ ꯱꯸ꯗꯥ ꯔꯁꯂꯅꯥ ꯑꯦꯗꯃꯤꯔꯦꯂꯇꯤꯗꯥ ꯄꯥꯎꯇꯥꯛ ꯄꯤꯈꯤ ꯃꯗꯨꯗꯤ ꯃꯍꯥꯛꯀꯤ ꯖꯨꯅꯒꯤ ꯄꯥꯎꯖꯦꯂꯗꯥ ꯄꯅꯈꯤꯕꯥ ꯃꯇꯝ ꯑꯗꯨ ꯂꯣꯏꯈ꯭ꯔꯦ ꯑꯃꯁꯨꯡ ꯕ꯭ꯔꯤꯇꯤꯁ ꯄꯣꯔꯇꯁ ꯍꯥꯔꯕꯔꯁ ꯑꯃꯁꯨꯡ ꯏꯁꯤꯡꯗꯥ ꯌꯨꯅꯥꯏꯇꯦꯗ ꯁ꯭ꯇꯦꯇꯁꯀꯤ ꯂꯥꯅꯒꯤ ꯚꯦꯁꯦꯂꯁꯤꯡꯗꯥ ꯑꯊꯤꯡꯕꯥ ꯊꯝꯂꯤꯕꯥ ꯃꯑꯣꯡꯒꯤ ꯈꯣꯡꯊꯥꯡ ꯄꯨꯝꯅꯃꯛ ꯍꯧꯖꯤꯛ ꯂꯣꯏꯁꯤꯜꯂꯀꯄꯗꯥ ꯂꯧꯒꯅꯤ
