en,mni-Mtei
COMMENTARY: Prakriti or Nature is that state in which the three Gunas exist in a state,ꯀꯃꯦꯟꯇꯔꯤ: ꯄ꯭ꯔꯀ꯭ꯔ꯭ꯏꯇꯤ ꯅꯠꯔꯒꯥ ꯅꯦꯆꯔ ꯍꯥꯌꯕꯁꯤ ꯔꯥꯖ꯭ꯌ ꯑꯃꯗꯥ ꯒꯨꯟ ꯑꯍꯨꯝ ꯑꯁꯤ ꯂꯩꯔꯤꯕꯥ ꯔꯥꯖ꯭ꯌ ꯑꯗꯨꯅꯤ
"of equilibrium. When this equilibrium is disturbed, creation begins and the body, senses and mind",ꯏꯛꯕꯤꯂꯤꯑꯦꯟꯁꯀꯤ ꯃꯇꯥꯡꯗꯥ ꯋꯥꯐꯝ ꯊꯃꯈꯤ꯫
"are formed. The man who is deluded by egoism identifies the Self with the body, mind, the",ꯁꯦꯝꯃꯤ꯫
34,꯳꯴ꯗꯥ ꯂꯩꯕꯥ ꯌꯨ.ꯑꯦꯁ.
THE YOGA OF ACTION,ꯑꯦꯛꯁꯅꯒꯤ ꯌꯣꯒ .
"life-force and the senses, and ascribes to the Self all the attributes of the body and the senses. In","ꯂꯥꯏꯐ-ꯐꯣꯔꯁ ꯑꯃꯁꯨꯡ ꯏꯟꯗ꯭ꯔꯤꯁꯤꯡ, ꯑꯃꯁꯨꯡ ꯍꯀꯆꯥꯡ ꯑꯃꯁꯨꯡ ꯁꯦꯟꯁꯁꯤꯡꯒꯤ ꯃꯒꯨꯟ ꯄꯨꯝꯅꯃꯛ ꯃꯁꯥꯗꯥ ꯄꯤꯔꯤ꯫"
reality the Gunas of nature perform all actions,ꯔꯤꯑꯦꯂꯤꯇꯤ ꯅꯦꯆꯔꯒꯤ ꯒꯨꯅꯁꯤꯡ ꯑꯁꯤꯅꯥ ꯑꯦꯛꯁꯟ ꯄꯨꯝꯅꯃꯛ ꯄꯥꯡꯊꯣꯀꯏ .
Tattwavittu mahaabaaho gunakarma vibhaagayoh;,ꯇꯠꯇꯋꯥꯕꯤꯠꯇꯨ ꯃꯍꯥꯕꯥꯌꯥꯍꯣ ꯒꯨꯅꯀꯔꯝ ꯕꯤꯚꯥꯒꯥꯌꯍ;
Gunaa guneshu vartanta iti matwaa na sajjate,ꯒꯨꯅꯥꯌꯥ ꯒꯨꯅꯦꯁꯨ ꯕꯔꯇꯟꯇꯥ ꯏꯇꯤ ꯃꯠꯋꯥ ꯅꯥ ꯁꯖ꯭ꯖꯥꯇꯦ
"28. But he who knows the truth, O mighty-armed Arjuna, about the divisions of the qualities","28. ꯑꯗꯨꯕꯨ ꯑꯆꯨꯝꯕꯥ ꯑꯗꯨ ꯈꯉꯕꯥ ꯃꯤꯑꯣꯏ ꯑꯗꯨꯅꯥ, ꯍꯦ ꯃꯥꯏꯇꯤ-ꯑꯥꯔꯝ ꯑꯔꯖꯨꯟ, ꯃꯒꯨꯅꯁꯤꯡꯒꯤ ꯈꯦꯟꯅꯕꯥ ꯑꯗꯨꯒꯤ ꯃꯇꯥꯡꯗꯥ"
"and their functions, knowing that the Gunas as senses move amidst the Gunas as the sense-objects,","ꯑꯃꯁꯨꯡ ꯃꯈꯣꯌꯒꯤ ꯐꯉ꯭ꯀꯁꯅꯁꯤꯡ, ꯒꯨꯅꯁꯤꯡ ꯑꯁꯤ ꯁꯦꯟꯁ ꯑꯣꯏꯅꯥ ꯒꯨꯅꯁꯤꯡ ꯑꯁꯤ ꯁꯦꯟꯁ-ꯑꯣꯕꯖꯦꯛꯇ ꯑꯣꯏꯅꯥ ꯆꯪꯁꯤꯜꯂꯤ ꯍꯥꯌꯕꯥ ꯈꯉꯂꯗꯨꯅꯥ, ꯑꯦꯝ.ꯑꯦꯁ.ꯑꯦꯝ.ꯏ."
is not attached,ꯑꯁꯤ ꯑꯦꯇꯦꯆ ꯇꯧꯗꯦ .
Prakriter gunasammoodhaah sajjante gunakarmasu;,ꯄ꯭ꯔꯀ꯭ꯔ꯭ꯏꯇꯔ ꯒꯨꯅꯁꯃꯃꯨꯗꯍ ꯁꯖ꯭ꯖꯥꯟꯇꯦ ꯒꯨꯅꯀꯔꯃꯁꯨ;
Taan akritsnavido mandaan kritsnavin na vichaalayet,ꯇꯥꯟ ꯑꯛꯠꯁꯅꯥꯚꯤꯗꯣ ꯃꯟꯗꯥꯟ ꯀ꯭ꯔ꯭ꯏꯠꯅꯥꯚꯤꯟ ꯅꯥ ꯚꯤꯆꯥꯂꯌꯌꯦꯠ
29. Those deluded by the qualities of Nature are attached to the functions of the qualities. A,29. ꯃꯍꯧꯁꯥꯒꯤ ꯃꯒꯨꯅꯁꯤꯡꯅꯥ ꯂꯥꯟꯅꯥ ꯂꯃꯖꯤꯡꯕꯁꯤꯡ ꯑꯁꯤ ꯃꯒꯨꯅꯁꯤꯡꯒꯤ ꯊꯕꯀꯁꯤꯡꯒꯥ ꯃꯔꯤ ꯂꯩꯅꯩ꯫
man of perfect knowledge should not unsettle the foolish one of imperfect knowledge,ꯃꯄꯨꯡ ꯐꯥꯕꯥ ꯂꯧꯁꯤꯡ ꯂꯩꯕꯥ ꯃꯤꯑꯣꯏ ꯑꯗꯨꯅꯥ ꯃꯄꯨꯡ ꯐꯥꯗꯕꯥ ꯖ꯭ꯅꯥꯅꯒꯤ ꯃꯨꯔꯈ ꯑꯗꯨ ꯑꯅꯁꯦꯇꯜ ꯇꯧꯔꯣꯏꯗꯕꯅꯤ
Mayi sarvaani karmaani sannyasyaadhyaatma chetasaa;,ꯃꯌꯤ ꯁꯔꯋꯥꯅꯤ ꯀꯔꯃꯅꯤ ꯁꯟꯟꯟꯌꯥꯁꯌꯗꯍꯌꯥꯠꯃꯥ ꯆꯦꯇꯥꯁꯥ;
Niraasheer nirmamo bhootwaa yudhyaswa vigatajwarah,ꯅꯤꯔꯥꯁꯤꯌꯔ ꯅꯤꯔꯃꯥꯃꯣ ꯚꯨꯇꯋꯥ ꯌꯨꯙ꯭ꯌꯥꯁꯋꯥ ꯚꯤꯒꯥꯇꯥꯖꯋꯥꯔꯥꯍ
"30. Renouncing all actions in Me, with the mind centred in the Self, free from hope and","꯳꯰.ꯑꯩꯉꯣꯟꯗꯥ ꯂꯩꯔꯤꯕꯥ ꯑꯦꯛꯁꯟ ꯄꯨꯝꯅꯃꯛ ꯊꯥꯗꯣꯀꯄꯥ, ꯋꯥꯈꯜ ꯑꯁꯤ ꯃꯁꯥꯗꯥ ꯁꯦꯟꯇꯔ ꯇꯧꯗꯨꯅꯥ, ꯑꯥꯁꯥꯗꯒꯤ ꯐ꯭ꯔꯤ ꯑꯣꯏꯅꯥ ꯑꯃꯁꯨꯡ"
"egoism, and from (mental) fever, do thou fight","ꯏꯒꯣꯏꯖꯝ, ꯑꯃꯁꯨꯡ (ꯃꯦꯟꯇꯦꯜ) ꯐꯤꯕꯔꯗꯒꯤ, ꯅꯍꯥꯛꯅꯥ ꯂꯥꯟꯊꯦꯡꯅꯔꯤ"
COMMENTARY: Surrender all actions to Me with the thought: “I perform all actions for,ꯀꯃꯦꯟꯇꯔꯤ: ꯋꯥꯈꯜꯂꯣꯟ ꯑꯗꯨꯒꯥ ꯂꯣꯌꯅꯅꯥ ꯑꯩꯉꯣꯟꯗꯥ ꯑꯦꯛꯁꯟ ꯄꯨꯝꯅꯃꯛ ꯁꯔꯦꯟꯗꯔ ꯇꯧꯕꯤꯌꯨ: “ꯑꯩꯅꯥ ꯊꯕꯛ ꯄꯨꯝꯅꯃꯛ ꯄꯥꯡꯊꯣꯛꯂꯤ꯫
the sake of the Lord only.”,ꯏꯕꯨꯡꯉꯣ ꯈꯛꯇꯒꯤꯗꯃꯛ꯫”
Ye me matam idam nityam anutishthanti maanavaah;,ꯌꯦ ꯃꯤ ꯃꯇꯥꯝ ꯏꯗꯝ ꯅꯤꯠꯝ ꯑꯟꯇꯤꯁ꯭ꯊꯥꯟ ꯃꯅꯥꯚꯥꯍ;
Shraddhaavanto’nasooyanto muchyante te’pi karmabhih,ꯁ꯭ꯔꯗ꯭ꯙꯥꯚꯥꯟꯇꯣ’ꯅꯥꯁꯣꯌꯥꯟꯇꯣ ꯃꯆꯌꯥꯟꯇꯦ ꯇꯦ’ꯄꯤ ꯀꯔꯃꯚꯤꯍ
31. Those men who constantly practise this teaching of Mine with faith and without,꯳꯱.ꯑꯩꯒꯤ ꯇꯝꯕꯤꯕꯥ ꯑꯁꯤ ꯂꯦꯞꯄꯥ ꯂꯩꯇꯅꯥ ꯊꯥꯖꯕꯥ ꯑꯃꯁꯨꯡ ꯌꯥꯑꯣꯗꯅꯥ ꯄꯥꯡꯊꯣꯀꯄꯥ ꯃꯤꯑꯣꯏꯁꯤꯡ ꯑꯗꯨ꯫
"cavilling, they too are freed from actions","ꯀꯦꯚꯤꯂꯤꯡ, ꯃꯈꯣꯌꯁꯨ ꯑꯦꯛꯁꯅꯁꯤꯡꯗꯒꯤ ꯅꯥꯟꯊꯣꯀꯏ ."
Ye twetad abhyasooyanto naanutishthanti me matam;,ꯌꯦ ꯇ꯭ꯕꯦꯇꯥꯗ ꯑꯚ꯭ꯌꯥꯁꯣꯌꯥꯟꯇꯣ ꯅꯥꯅꯨꯇꯤꯁ꯭ꯊꯥꯟꯇꯤ ꯃꯦ ꯃꯇꯝ;
Sarvajnaanavimoodhaam staan viddhi nashtaan achetasah,ꯁꯔꯕꯖꯅꯥꯅꯥꯚꯤꯃꯨꯗꯝ ꯁ꯭ꯇꯥꯟ ꯕꯤꯗ꯭ꯙꯤ ꯅꯁꯇꯥꯟ ꯑꯆꯦꯇꯥꯁꯥꯍ
"32. But those who carp at My teaching and do not practise it, deluded in all knowledge and","꯳꯲.ꯑꯗꯨꯕꯨ ꯑꯩꯒꯤ ꯇꯝꯕꯤꯕꯗꯥ ꯀꯥꯔꯞ ꯇꯧꯕꯥ ꯑꯃꯁꯨꯡ ꯃꯁꯤ ꯄ꯭ꯔꯦꯛꯇꯤꯁ ꯇꯧꯗꯕꯥ, ꯂꯧꯁꯤꯡ ꯄꯨꯝꯅꯃꯛꯇꯥ ꯂꯥꯟꯅꯥ ꯂꯃꯖꯤꯡꯈꯤ ꯑꯃꯁꯨꯡ ."
"devoid of discrimination, know them to be doomed to destruction","ꯈꯦꯟꯅꯕꯥ ꯊꯃꯗꯕꯥ, ꯃꯈꯣꯌꯕꯨ ꯃꯥꯡꯍꯟ ꯇꯥꯀꯍꯅꯕꯥ ꯌꯥꯕꯥ ꯋꯥꯐꯃꯁꯤꯡ ꯈꯉꯗꯣꯀꯎ"
Sadrisham cheshtate swasyaah prakriter jnaanavaan api;,ꯁꯗ꯭ꯔꯤꯁꯝ ꯆꯦꯁ꯭ꯇꯦꯠ ꯁ꯭ꯕꯥꯁꯌꯥꯍ ꯄ꯭ꯔꯀ꯭ꯔ꯭ꯏꯇꯔ ꯖ꯭ꯅꯥꯅꯕꯟ API;
Prakritim yaanti bhootaani nigrahah kim karishyati,ꯄ꯭ꯔꯀ꯭ꯔ꯭ꯏꯇꯤꯝ ꯌꯥꯌꯥꯟꯇꯤ ꯚꯨꯇꯥꯅꯤ ꯅꯤꯒ꯭ꯔꯍꯍ ꯀꯤꯝ ꯀꯔꯤꯁ꯭ꯌꯥꯇꯤ
33. Even a wise man acts in accordance with his own nature; beings will follow nature; what,꯳꯳.ꯂꯧꯁꯤꯡ ꯂꯩꯕꯥ ꯃꯤꯑꯣꯏ ꯑꯃꯅꯥ ꯐꯥꯑꯣꯕꯥ ꯃꯁꯥꯒꯤ ꯃꯑꯣꯡ ꯃꯇꯧꯒꯤ ꯃꯇꯨꯡ ꯏꯟꯅꯥ ꯊꯕꯛ ꯇꯧꯏ;
can restraint do?,ꯔꯤꯁ꯭ꯠꯔꯀꯆꯔ ꯇꯧꯕꯥ ꯉꯃꯒꯗ꯭ꯔꯥ?
COMMENTARY: Only the ignorant man comes under the sway of his natural,ꯀꯃꯦꯟꯇꯔꯤ: ꯃꯍꯧꯁꯥꯗꯒꯤ ꯂꯩꯔꯛꯂꯕꯥ ꯃꯤꯑꯣꯏ ꯑꯗꯨ ꯈꯛꯇꯅꯥ ꯃꯍꯥꯛꯀꯤ ꯃꯍꯧꯁꯥꯒꯤ ꯐꯤꯚꯃꯒꯤ ꯃꯈꯥꯗꯥ ꯂꯥꯀꯏ꯫
propensities. The seeker after Truth who is endowed with the ‘Four Means’ and who constantly,ꯄ꯭ꯔꯣꯄꯦꯟꯁꯤꯇꯤꯁꯤꯡ꯫
35,꯳꯵ ꯑꯃꯁꯨꯡ ꯑꯦꯟ.
BHAGAVAD GITA,ꯚꯒꯕꯠ ꯒꯤꯇꯥ
"practises meditation, can easily control Nature if he rises above the sway of the pairs of opposites,","ꯄ꯭ꯔꯦꯛꯇꯤꯁ ꯃꯦꯗꯤꯇꯦꯁꯟ, ꯀꯔꯤꯒꯨꯝꯕꯥ ꯃꯍꯥꯛꯅꯥ ꯑꯣꯄꯣꯖꯤꯁꯅꯒꯤ ꯄꯦꯔꯥꯁꯤꯡꯒꯤ ꯃꯊꯛꯇꯥ ꯋꯥꯡꯈꯠꯂꯛꯂꯕꯗꯤ ꯃꯍꯧꯁꯥꯕꯨ ꯐꯖꯅꯥ ꯀꯟꯠꯔꯣꯜ ꯇꯧꯕꯥ ꯉꯃꯒꯅꯤ,"
"like love and hate, etc","ꯅꯨꯡꯁꯤꯕꯥ ꯑꯃꯁꯨꯡ ꯌꯦꯛꯅꯕꯥ, ꯑꯁꯤꯅꯆꯤꯡꯕꯥ"
Indriyasyendriyasyaarthe raagadweshau vyavasthitau;,ꯏꯟꯗ꯭ꯔꯤꯌꯥꯁꯤꯌꯦꯅꯗ꯭ꯔꯤꯌꯥꯁꯌꯥꯔꯊꯦ ꯔꯥꯒꯥꯗꯋꯦꯁꯎ ꯋ꯭ꯌꯥꯚꯥꯁ꯭ꯇꯤꯇꯥꯎ;
Tayor na vasham aagacchet tau hyasya paripanthinau,ꯇꯥꯌꯣꯔ ꯅꯥ ꯋꯥꯁꯝ ꯑꯥꯒꯥꯆꯦꯠ ꯇꯥꯎ ꯍꯤꯌꯥꯌ ꯄꯥꯔꯤꯄꯟꯊꯤꯅꯥꯎ
34. Attachment and aversion for the objects of the senses abide in the senses; let none come,꯳꯴.ꯁꯦꯟꯁꯁꯤꯡꯒꯤ ꯄꯣꯠꯂꯃꯁꯤꯡꯒꯤꯗꯃꯛꯇꯥ ꯑꯦꯇꯦꯆꯃꯦꯟꯇ ꯑꯃꯁꯨꯡ ꯑꯦꯚꯔꯁꯟ ꯏꯟꯗ꯭ꯔꯤꯁꯤꯡꯗꯥ ꯂꯩꯔꯤ;
"under their sway, for they are his foes","ꯃꯈꯣꯌꯒꯤ ꯂꯃꯖꯤꯡ ꯃꯈꯥꯗꯥ, ꯃꯔꯃꯗꯤ ꯃꯈꯣꯌ ꯑꯁꯤ ꯃꯍꯥꯛꯀꯤ ꯌꯦꯛꯅꯕꯁꯤꯡꯅꯤ ."
Shreyaan swadharmo vigunah paradharmaat swanushthitaat;,ꯁ꯭ꯔꯤꯌꯥꯟ ꯁ꯭ꯕꯌꯥꯗꯍꯔꯃꯣ ꯚꯤꯒꯨꯅꯥꯍ ꯄꯥꯔꯥꯙꯔꯃꯠ ꯁ꯭ꯕꯅꯨꯁꯊꯤꯇꯠ;
Swadharme nidhanam shreyah paradharmo bhayaavahah,ꯁ꯭ꯕꯥꯙ꯭ꯌꯥꯝ ꯅꯤꯙꯅꯝ ꯁ꯭ꯔꯦꯌꯥꯍ ꯄꯥꯔꯥꯙꯔꯃꯣ ꯚꯌꯥꯚꯥꯍ
"35. Better is one’s own duty, though devoid of merit, than the duty of another well",꯳꯵.ꯑꯇꯣꯞꯄꯥ ꯀꯨꯌꯣꯝ ꯑꯃꯒꯤ ꯗ꯭ꯌꯨꯇꯤꯗꯒꯤ ꯍꯦꯟꯅꯥ ꯐꯕꯥ ꯑꯣꯏꯔꯕꯁꯨ ꯍꯦꯟꯅꯥ ꯐꯕꯥ ꯍꯥꯌꯕꯁꯤ ꯀꯅꯥꯒꯨꯝꯕꯥ ꯑꯃꯒꯤ ꯃꯁꯥꯒꯤ ꯗ꯭ꯌꯨꯇꯤꯅꯤ
discharged. Better is death in one’s own duty; the duty of another is fraught with fear,ꯗꯤꯁꯆꯥꯔꯖ ꯇꯧꯈꯤ꯫
Arjuna Uvaacha:,ꯑꯔꯖꯨꯟ ꯎꯋꯥꯆ꯭ꯌꯥ:
Atha kena prayukto’yam paapam charati poorushah;,ꯑꯥꯊꯥ ꯀꯦꯅꯥ ꯄ꯭ꯔꯀ꯭ꯔ꯭ꯏꯌꯨꯝ ꯄꯄꯥꯝ ꯆꯔꯇꯤ ꯄꯨꯔꯨꯁꯍ;
Anicchann api vaarshneya balaad iva niyojitah,ꯑꯅꯤꯀꯆꯟ ꯑꯦꯄꯤ ꯋꯥꯔꯁ꯭ꯅꯦꯌꯥ ꯕꯥꯂꯥꯗ ꯏꯚꯥ ꯅꯤꯌꯣꯖꯤꯇꯥꯍ
Arjuna said:,ꯑꯔꯖꯨꯟꯅꯥ ꯍꯥꯌꯈꯤ:
"36. But impelled by what does man commit sin, though against his wishes, O Varshneya","꯳꯶.ꯑꯗꯨꯕꯨ ꯃꯤꯑꯣꯏꯕꯅꯥ ꯃꯍꯥꯛꯀꯤ ꯑꯄꯥꯝꯕꯒꯤ ꯃꯥꯌꯣꯛꯇꯥ ꯀꯔꯤ ꯄꯥꯞ ꯇꯧꯕꯒꯦ ꯍꯥꯌꯕꯗꯨꯗꯥ ꯊꯧꯅꯥ ꯍꯥꯞꯄꯤꯈꯤ, ꯍꯦ ꯕꯔꯁꯅꯦꯌ"
"(Krishna), constrained, as it were, by force?","(ꯀ꯭ꯔ꯭ꯏꯁ꯭ꯟ), ꯀꯟꯠꯔꯣꯜ ꯇꯧꯔꯕꯥ, ꯍꯥꯌꯕꯗꯤ ꯐꯣꯔꯁꯀꯤ ꯃꯇꯨꯡ ꯏꯟꯅꯥ?"
Sri Bhagavaan Uvaacha:,ꯁ꯭ꯔꯤ ꯚꯒꯕꯥꯟ ꯎꯋꯥꯆ꯭ꯌꯥ:
Kaama esha krodha esha rajoguna samudbhavah;,ꯀꯥꯃꯥ ꯑꯦꯁꯥ ꯀ꯭ꯔꯣꯙꯥ ꯑꯥꯁꯥ ꯔꯥꯖꯣꯒꯨꯟ ꯁꯃꯨꯗ꯭ꯚꯕꯍ;
Mahaashano mahaapaapmaa viddhyenam iha vairinam,ꯃꯍꯥꯁꯥꯅꯣ ꯃꯍꯥꯄꯥꯑꯥꯄꯃꯥ ꯚꯤꯗ꯭ꯙꯟ ꯏꯍꯥ ꯚꯥꯏꯔꯤꯅꯥꯝ
The Blessed Lord said:,ꯊꯧꯖꯥꯜ ꯍꯩꯕꯥ ꯃꯄꯨꯅꯥ ꯍꯥꯌꯈꯤ:
"37. It is desire, it is anger born of the quality of Rajas, all-sinful and all-devouring; know this","37. ꯃꯁꯤ ꯑꯄꯥꯝꯕꯅꯤ, ꯃꯁꯤ ꯔꯥꯖꯁꯤꯡꯒꯤ ꯃꯒꯨꯅꯗꯒꯤ ꯄꯣꯀꯄꯥ ꯑꯁꯥꯑꯣꯕꯥ, ꯑꯜ-ꯁꯤꯅꯐꯨꯜ ꯑꯃꯁꯨꯡ ꯑꯣꯜ-ꯀ꯭ꯌꯨꯔꯤꯡꯅꯤ;"
as the foe here (in this world),ꯃꯐꯝ ꯑꯁꯤꯗꯥ (ꯃꯥꯂꯦꯝ ꯑꯁꯤꯗꯥ) ꯌꯦꯛꯅꯕꯥ ꯑꯣꯏꯅꯥ .
Dhoomenaavriyate vahnir yathaadarsho malena cha;,ꯙꯨꯃꯦꯅꯥꯚ꯭ꯔꯤꯌꯇꯦ ꯋꯥꯍꯅꯤꯔ ꯌꯥꯊꯥꯗꯥꯔꯁꯣ ꯃꯥꯂꯦꯅꯥ ꯆꯥ;
Yatholbenaavrito garbhas tathaa tenedam aavritam,ꯌꯥꯊꯣꯂꯕꯦꯅꯥꯚ꯭ꯔꯤꯇꯣ ꯒꯔꯚꯁ ꯇꯥꯊꯥꯌꯥ ꯇꯦꯅꯦꯗꯥꯝ ꯑꯥꯚ꯭ꯔꯤꯇꯥꯝ
"38. As fire is enveloped by smoke, as a mirror by dust, and as an embryo by the amnion, so is","꯳꯸.ꯃꯩꯅꯥ ꯃꯩꯅꯥ ꯆꯥꯀꯄꯅꯥ ꯃꯔꯝ ꯑꯣꯏꯗꯨꯅꯥ, ꯃꯩꯅꯥ ꯃꯤꯔꯔ ꯑꯃꯥ ꯑꯣꯏꯅꯥ, ꯑꯃꯁꯨꯡ ꯑꯦꯝꯕ꯭ꯔꯣꯏꯗ꯭ꯔꯤꯅꯥ ꯑꯦꯝꯕ꯭ꯔꯣꯏꯗ ꯑꯣꯏꯅꯥ, ꯑꯁꯤꯒꯨꯝꯅꯥ ."
this enveloped by that,ꯃꯁꯤ ꯃꯗꯨꯒꯤ ꯃꯇꯨꯡ ꯏꯟꯅꯥ ꯂꯣꯏꯁꯤꯅꯈꯤꯕꯥ .
Aavritam jnaanam etena jnaanino nityavairinaa;,ꯑꯚ꯭ꯔꯤꯇꯥꯝ ꯖ꯭ꯅꯥꯅꯝ ꯑꯦꯇꯦꯅꯥ ꯖ꯭ꯅꯥꯅꯤꯅꯣ ꯅꯤꯇꯌꯥꯚꯤꯅꯥ;
Kaamaroopena kaunteya dushpoorenaanalena cha,ꯀꯥꯃꯥꯔꯨꯄꯦꯅꯥ ꯀꯥꯎꯟꯇꯦꯌꯥ ꯗꯨꯁꯄꯨꯔꯦꯅꯥꯅꯥꯂꯦꯅꯥ ꯆꯥ
"39. O Arjuna, wisdom is enveloped by this constant enemy of the wise in the form of desire,","39. o ꯑꯔꯖꯨꯟ, ꯂꯧꯁꯤꯡ ꯑꯁꯤ ꯑꯄꯥꯝꯕꯒꯤ ꯃꯑꯣꯡꯗꯥ ꯂꯧꯁꯤꯡꯒꯤ ꯂꯦꯞꯄꯥ ꯂꯩꯇꯕꯥ ꯌꯦꯛꯅꯕꯥ ꯑꯁꯤꯅꯥ ꯊꯨꯒꯥꯏꯔꯤ,"
which is unappeasable as fire!,ꯃꯁꯤ ꯃꯩ ꯑꯣꯏꯅꯥ ꯂꯧꯕꯥ ꯌꯥꯗꯕꯥ ꯑꯃꯅꯤ!
Indriyaani mano buddhir asyaadhishthaanam uchyate;,ꯏꯟꯗ꯭ꯔꯤꯌꯥꯅꯤ ꯃꯅꯣ ꯕꯨꯗ꯭ꯙꯤꯔ ꯑꯁ꯭ꯌ꯭ꯌꯥꯙꯤꯁ꯭ꯊꯥꯅꯝ ꯎꯆ꯭ꯌꯥꯇꯦ;
36,꯳꯶ .
THE YOGA OF ACTION,ꯑꯦꯛꯁꯅꯒꯤ ꯌꯣꯒ .
Etair vimohayatyesha jnaanam aavritya dehinam,ꯑꯦꯇꯤꯌꯔ ꯚꯤꯃꯣꯍꯌꯥꯇꯤꯁꯥ ꯖ꯭ꯅꯥꯅꯝ ꯑꯥꯚ꯭ꯔꯤꯠꯌ ꯗꯦꯍꯤꯅꯥꯝ
"40. The senses, mind and intellect are said to be its seat; through these it deludes the","꯴꯰.ꯁꯦꯟꯁꯁꯤꯡ, ꯋꯥꯈꯜ ꯑꯃꯁꯨꯡ ꯋꯥꯈꯜ ꯂꯧꯁꯤꯡ ꯑꯁꯤ ꯃꯁꯤꯒꯤ ꯐꯝꯅꯤ ꯍꯥꯌꯅꯥ ꯍꯥꯌꯔꯤ;"
embodied by veiling his wisdom,ꯃꯍꯥꯛꯀꯤ ꯂꯧꯁꯤꯡ ꯑꯗꯨ ꯚꯦꯜꯌꯨ ꯇꯧꯗꯨꯅꯥ ꯃꯁꯛ ꯇꯥꯀꯄꯥ .
Tasmaat twam indriyaanyaadau niyamya bharatarshabha;,ꯇꯥꯁꯃꯥꯠ ꯇꯋꯥꯝ ꯏꯟꯗ꯭ꯔꯤꯌꯥꯅꯌꯥꯗꯥꯎ ꯅꯤꯌꯃꯌ ꯚꯥꯔꯇꯔꯁꯚꯥ;
Paapmaanam prajahi hyenam jnaana vijnaana naashanam,ꯄꯥꯄꯃꯥꯅꯝ ꯄ꯭ꯔꯖꯥꯍꯤ ꯍꯥꯏꯅꯥꯝ ꯖ꯭ꯅꯥꯅꯥ ꯕꯤꯖ꯭ꯅꯥꯅꯥ ꯅꯥꯁꯥꯟꯝ
"41. Therefore, O best of the Bharatas (Arjuna), controlling the senses first, do thou kill this","꯴꯱.ꯃꯔꯝ ꯑꯗꯨꯅꯥ, ꯍꯦ ꯕꯦꯁ꯭ꯠ ꯑꯣꯐ ꯗ ꯚꯥꯔꯇꯁ (ꯑꯔꯖꯨꯟ), ꯏꯟꯗ꯭ꯔꯤꯁꯤꯡꯕꯨ ꯑꯍꯥꯅꯕꯗꯥ ꯀꯟꯠꯔꯣꯜ ꯇꯧꯔꯤꯕꯥ, ꯅꯍꯥꯛꯅꯥ ꯃꯁꯤꯕꯨ ꯍꯥꯠꯄꯥ ."
"sinful thing (desire), the destroyer of knowledge and realisation!","ꯄꯥꯄꯀꯤ ꯋꯥꯐꯝ (ꯑꯄꯥꯝꯕꯥ), ꯂꯧꯁꯤꯡ ꯑꯃꯁꯨꯡ ꯋꯥꯈꯜ ꯂꯧꯁꯤꯡ ꯃꯥꯡꯍꯅꯕꯥ ꯉꯝꯕꯥ!"
Indriyaani paraanyaahur indriyebhyah param manah;,ꯏꯟꯗ꯭ꯔꯤꯌꯥꯅꯤ ꯄꯔꯅꯌꯥꯍꯨꯔ ꯏꯟꯗ꯭ꯔꯤꯌꯦꯕꯤꯌꯥꯍ ꯄꯔꯝ ꯃꯥꯅꯍ;
Manasastu paraa buddhir yo buddheh paratastu sah,ꯃꯅꯁꯥꯁ꯭ꯇꯨ ꯄꯥꯔꯥꯌꯥ ꯕꯨꯗ꯭ꯙꯤꯔ ꯌꯣ ꯕꯨꯗ꯭ꯙꯍ ꯄꯥꯔꯥꯇꯥꯁ꯭ꯇꯨ ꯁꯥꯍ
42. They say that the senses are superior (to the body); superior to the senses is the mind;,꯴꯲.ꯃꯈꯣꯌꯅꯥ ꯍꯥꯌꯔꯤ ꯃꯗꯨꯗꯤ ꯏꯟꯗ꯭ꯔꯤꯁꯤꯡ ꯑꯁꯤ ꯍꯦꯟꯅꯥ ꯐꯩ (ꯍꯀꯆꯥꯡꯗꯥ);
superior to the mind is the intellect; and one who is superior even to the intellect is He—the Self,ꯋꯥꯈꯂꯗꯒꯤ ꯍꯦꯟꯅꯥ ꯐꯕꯥ ꯍꯥꯌꯕꯁꯤ ꯋꯥꯈꯜ ꯂꯧꯁꯤꯡꯅꯤ;
Evam buddheh param buddhwaa samstabhyaatmaanam aatmanaa;,ꯏꯚꯥꯝ ꯕꯨꯗ꯭ꯙꯍ ꯄꯔꯥꯝ ꯕꯨꯗ꯭ꯙꯋꯥ ꯁꯪꯁ꯭ꯇꯥꯚ꯭ꯌꯥꯠꯃꯥꯅꯝ ꯑꯥꯇꯃꯅꯥ;
Jahi shatrum mahaabaaho kaamaroopam duraasadam,ꯖꯥꯍꯤ ꯁꯥꯠꯔꯨꯝ ꯃꯍꯥꯕꯥꯌꯥꯍꯣ ꯀꯥꯃꯔꯨꯞ ꯗꯨꯔꯥꯁꯗꯝ
"43. Thus, knowing Him who is superior to the intellect and restraining the self by the Self,","꯴꯳.ꯑꯁꯨꯝꯅꯥ, ꯋꯥꯈꯜ ꯂꯧꯁꯤꯡꯗꯒꯤ ꯍꯦꯟꯅꯥ ꯐꯕꯥ ꯑꯃꯁꯨꯡ ꯃꯁꯥꯕꯨ ꯉꯥꯀꯊꯣꯀꯆꯕꯥ ꯉꯝꯕꯥ ꯃꯍꯥꯀꯄꯨ ꯈꯉꯕꯥ,"
"slay thou, O mighty-armed Arjuna, the enemy in the form of desire, hard to conquer!","ꯅꯍꯥꯛꯅꯥ ꯃꯥꯏꯇꯤ-ꯑꯥꯔꯝ ꯇꯧꯔꯕꯥ ꯑꯔꯖꯨꯟꯅꯥ, ꯑꯄꯥꯝꯕꯒꯤ ꯃꯑꯣꯡꯗꯥ ꯌꯦꯛꯅꯕꯥ, ꯃꯥꯌꯊꯤꯕꯥ ꯄꯤꯕꯥ ꯉꯃꯗꯕꯥ, ꯃꯥꯏꯊꯤꯕꯥ ꯄꯤꯕꯥ ꯌꯥꯝꯅꯥ ꯂꯨꯕꯥ ꯑꯔꯖꯨꯟꯅꯥ ꯍꯥꯠꯄꯤꯌꯨ꯫"
COMMENTARY: Restrain the lower self by the higher Self. Subdue the lower mind by,ꯀꯃꯦꯟꯇꯔꯤ: ꯂꯣꯌꯔꯕꯥ ꯁꯦꯜꯐ ꯑꯁꯤ ꯑꯋꯥꯡꯕꯥ ꯊꯥꯛꯀꯤ ꯁꯦꯜꯐꯅꯥ ꯊꯤꯡꯖꯤꯜꯂꯨ꯫
the higher mind. It is difficult to conquer desire because it is of a highly complex and,ꯍꯦꯟꯅꯥ ꯋꯥꯡꯕꯥ ꯋꯥꯈꯜ꯫
"incomprehensible nature. But a man of discrimination and dispassion, who does constant and",ꯂꯧꯁꯤꯅꯕꯥ ꯉꯃꯗꯕꯥ ꯃꯍꯧꯁꯥ꯫
"intense Sadhana, can conquer it quite easily","ꯏꯟꯇꯦꯟꯁꯟ ꯁꯥꯙꯅꯥ, ꯃꯁꯤ ꯌꯥꯝꯅꯥ ꯂꯥꯏꯅꯥ ꯃꯥꯏꯊꯤꯕꯥ ꯄꯤꯕꯥ ꯉꯃꯒꯅꯤ"
Hari Om Tat Sat,ꯍꯔꯤ ꯑꯣꯝ ꯇꯥꯠ ꯁꯒꯣ
Iti Srimad Bhagavadgeetaasoopanishatsu Brahmavidyaayaam,iti ꯁ꯭ꯔꯤꯃꯗ ꯚꯒꯕꯗ꯭ꯒꯤꯇꯥꯁꯨꯄꯦꯅꯤꯁꯥꯠꯁꯨ ꯕ꯭ꯔꯍ꯭ꯃꯕꯤꯗꯌꯥꯌꯥꯌꯝ
Yogashaastre Sri Krishnaarjunasamvaade,ꯌꯣꯒꯁꯥꯁ꯭ꯠꯔꯦ ꯁ꯭ꯔꯤ ꯀ꯭ꯔ꯭ꯏꯁ꯭ꯅꯔꯖꯨꯅꯥꯁꯃꯚꯥꯗꯦ
Karmayogo Naama Tritiyo’dhyaayah,ꯀꯔꯃꯌꯣꯒꯣ ꯅꯥꯃꯥ ꯇ꯭ꯔꯤꯇꯤꯌꯣ’ꯙ꯭ꯌꯥꯌꯥꯍ
"Thus in the Upanishads of the glorious Bhagavad Gita, the science of the Eternal, the","ꯑꯁꯨꯝꯅꯥ ꯃꯁꯛ ꯅꯥꯏꯕꯥ ꯚꯒꯕꯠ ꯒꯤꯇꯥꯒꯤ ꯎꯄꯅꯤꯁꯗꯁꯤꯡꯗꯥ, ꯏꯇꯔꯅꯦꯂꯒꯤ ꯁꯥꯏꯟꯁ, ꯗꯤ."
"scripture of Yoga, the dialogue between Sri Krishna and Arjuna, ends the third discourse entitled:","ꯌꯣꯒꯒꯤ ꯁꯥꯁ꯭ꯠꯔ, ꯁ꯭ꯔꯤ ꯀ꯭ꯔ꯭ꯏꯁ꯭ꯟ ꯑꯃꯁꯨꯡ ꯑꯔꯖꯨꯅꯒꯤ ꯃꯔꯛꯇꯥ ꯂꯩꯔꯤꯕꯥ ꯋꯥꯔꯤ ꯁꯥꯅꯕꯥ ꯑꯁꯤꯅꯥ ꯑꯍꯨꯃꯁꯨꯕꯥ ꯋꯥꯔꯣꯜ ꯑꯁꯤ ꯂꯣꯏꯁꯤꯜꯂꯤ ꯃꯗꯨꯗꯤ:"
“The Yoga of Action”,“ꯑꯦꯛꯁꯅꯒꯤ ꯌꯣꯒ”꯫
37,꯳꯷ ꯑꯃꯁꯨꯡ ꯑꯦꯟ.
BHAGAVAD GITA,ꯚꯒꯕꯠ ꯒꯤꯇꯥ
IV,ꯑꯥꯏ.ꯚꯤ.
THE YOGA OF WISDOM,ꯂꯧꯁꯤꯡꯒꯤ ꯌꯣꯒ .
Summary of Fourth Discourse,ꯃꯔꯤꯁꯨꯕꯥ ꯗꯤꯁꯀꯣꯔꯁꯀꯤ ꯁꯝꯂꯞꯄꯥ ꯋꯥꯔꯣꯜ
"Lord Krishna declares that He is born from age to age, in order to raise man and take him to","ꯚꯒꯕꯥꯟ ꯀ꯭ꯔ꯭ꯏꯁ꯭ꯅꯅꯥ ꯃꯍꯥꯀꯄꯨ ꯆꯍꯤ ꯑꯃꯗꯒꯤ ꯆꯍꯤ ꯑꯃꯗꯥ ꯄꯣꯀꯏ ꯍꯥꯌꯅꯥ ꯂꯥꯑꯣꯊꯣꯀꯏ, ꯃꯁꯤꯅꯥ ꯃꯤꯑꯣꯏꯕꯕꯨ ꯌꯣꯀꯄꯤꯅꯕꯥ ꯑꯃꯁꯨꯡ ꯃꯍꯥꯀꯄꯨ ꯂꯃꯖꯤꯡꯕꯤꯅꯕꯥ ."
the Supreme. Whenever there is a prevalence of unrighteousness and the world is ruled by the,ꯁꯨꯞꯔꯤꯝ ꯑꯣꯏꯕꯥ꯫
"forces of darkness, the Lord manifests Himself to destroy these adverse forces and to establish","ꯑꯃꯝꯕꯒꯤ ꯁꯛꯇꯤꯁꯤꯡ, ꯏꯕꯨꯡꯉꯣꯅꯥ ꯃꯁꯥꯃꯀꯄꯨ ꯑꯔꯥꯅꯕꯥ ꯐꯣꯔꯁꯁꯤꯡ ꯑꯁꯤꯕꯨ ꯃꯥꯡꯍꯟ ꯇꯥꯀꯍꯅꯕꯥ ꯑꯃꯁꯨꯡ ꯂꯤꯡꯈꯠꯅꯕꯥ ꯃꯁꯛ ꯇꯥꯀꯏ ."
"peace, order and harmony. Hence we see the appearance of the great saviours of the world","ꯁꯥꯟꯇꯤ, ꯑꯣꯔꯗꯔ ꯑꯃꯁꯨꯡ ꯍꯥꯔꯃꯣꯅꯤ꯫"
What is the secret of Yogic action? This the Lord proceeds to explain to Arjuna. Even,ꯌꯣꯒꯒꯤ ꯑꯦꯛꯁꯅꯒꯤ ꯊꯣꯏꯗꯣꯀꯄꯥ ꯃꯑꯣꯡ ꯑꯁꯤ ꯀꯔꯤꯅꯣ?
"though one is not engaged in action, but if the mind is active with the idea of doership and egoism,","ꯀꯅꯥꯒꯨꯝꯕꯥ ꯑꯃꯅꯥ ꯊꯕꯛꯇꯥ ꯌꯥꯑꯣꯗ꯭ꯔꯤꯕꯁꯨ, ꯀꯔꯤꯒꯨꯝꯕꯥ ꯋꯥꯈꯂꯅꯥ ꯗꯣꯔꯁꯤꯞ ꯑꯃꯁꯨꯡ ꯏꯒꯣꯒꯤ ꯋꯥꯈꯜꯂꯣꯅꯒꯥ ꯂꯣꯌꯅꯅꯥ ꯑꯦꯛꯇꯤꯕ ꯑꯣꯏꯔꯕꯗꯤ,"
"then it is action in inaction. On the other hand, though engaged physically in intense action, if the",ꯃꯗꯨꯒꯤ ꯃꯇꯨꯡꯗꯥ ꯃꯁꯤ ꯊꯕꯛ ꯇꯧꯗꯅꯕꯥ ꯑꯦꯛꯁꯟ ꯑꯃꯅꯤ꯫
"idea of agency is absent, if one feels that Prakriti does everything, it is inaction in action. The","ꯑꯦꯖꯦꯟꯁꯤꯒꯤ ꯋꯥꯈꯜꯂꯣꯟ ꯑꯁꯤ ꯂꯩꯇꯦ, ꯀꯔꯤꯒꯨꯝꯕꯥ ꯀꯅꯥꯒꯨꯝꯕꯥ ꯑꯃꯅꯥ ꯄ꯭ꯔꯀ꯭ꯔ꯭ꯏꯇꯤꯅꯥ ꯄꯨꯝꯅꯃꯛ ꯇꯧꯏ ꯍꯥꯌꯅꯥ ꯈꯜꯂꯕꯗꯤ, ꯃꯁꯤ ꯊꯕꯛꯇꯥ ꯏꯅꯑꯦꯛꯁꯅꯅꯤ꯫"
liberated man is free from attachment and is always calm and serene though engaged in ceaseless,ꯂꯤꯕꯔꯦꯠ ꯇꯧꯔꯕꯥ ꯃꯤꯑꯣꯏ ꯑꯁꯤ ꯑꯦꯇꯦꯆꯃꯦꯟꯇꯇꯒꯤ ꯐ꯭ꯔꯤ ꯑꯣꯏ ꯑꯃꯁꯨꯡ ꯃꯇꯝ ꯄꯨꯝꯅꯃꯛꯇꯥ ꯂꯦꯞꯄꯥ ꯂꯩꯇꯅꯥ ꯊꯕꯛ ꯇꯧꯔꯕꯁꯨ ꯅꯤꯡꯊꯤꯖꯅꯥ ꯑꯃꯁꯨꯡ ꯅꯨꯡꯉꯥꯏꯕꯥ ꯄꯣꯀꯏ
"action. He is unaffected by the pairs of opposites like joy and grief, success and failure",ꯊꯕꯛ.
One who has true union with the Lord is not subject to rebirth. He attains immortality. Such,ꯏꯕꯨꯡꯉꯣꯒꯥ ꯑꯆꯨꯝꯕꯥ ꯃꯔꯤ ꯂꯩꯅꯕꯥ ꯃꯤꯑꯣꯏ ꯑꯃꯅꯥ ꯑꯃꯨꯛ ꯍꯟꯅꯥ ꯄꯣꯀꯄꯒꯤ ꯃꯈꯥ ꯄꯣꯜꯂꯤ꯫
"a union can only be achieved when one is free from attachment, fear and anger, being thoroughly","ꯌꯨꯅꯤꯌꯟ ꯑꯃꯥ ꯑꯁꯤ ꯀꯅꯥꯒꯨꯝꯕꯥ ꯑꯃꯅꯥ ꯑꯦꯇꯦꯆꯃꯦꯟꯇ, ꯑꯀꯤꯕꯥ ꯑꯃꯁꯨꯡ ꯑꯁꯥꯑꯣꯕꯥ ꯂꯩꯇꯕꯥ ꯃꯇꯃꯗꯥ ꯈꯛꯇꯗꯥ ꯐꯪꯕꯥ ꯉꯃꯒꯅꯤ, ꯃꯄꯨꯡ ꯐꯥꯅꯥ ."
"purified by right knowledge. The Lord accepts the devotion of all, whatever path they may use to",ꯑꯆꯨꯝꯕꯥ ꯂꯧꯁꯤꯡꯅꯥ ꯁꯨꯡꯗꯣꯀꯄꯥ꯫
approach Him,ꯃꯍꯥꯀꯄꯨ ꯑꯦꯞꯔꯣꯆ ꯇꯧꯕꯤꯌꯨ
Various kinds of sacrifices are performed by those engaged in the path to God. Through the,ꯇꯣꯉꯥꯟ ꯇꯣꯉꯥꯅꯕꯥ ꯃꯈꯂꯒꯤ ꯀꯠꯊꯣꯀꯄꯥ ꯑꯁꯤ ꯏꯁ꯭ꯕꯔꯒꯤ ꯂꯝꯕꯤꯗꯥ ꯆꯠꯂꯤꯕꯥ ꯃꯤꯑꯣꯏꯁꯤꯡꯅꯥ ꯄꯥꯡꯊꯣꯀꯏ꯫
practice of these sacrifices the mind is purified and led Godward. Here also there must be the spirit,ꯍꯥꯌꯔꯤꯕꯥ ꯀꯠꯊꯣꯀꯄꯁꯤꯡ ꯑꯁꯤꯒꯤ ꯆꯠꯅꯕꯤ ꯑꯁꯤ ꯋꯥꯈꯂꯅꯥ ꯁꯦꯡꯗꯣꯀꯏ ꯑꯃꯁꯨꯡ ꯏꯁ꯭ꯕꯔꯕꯨ ꯂꯨꯆꯤꯡꯏ꯫
of non-attachment to the fruits of actions,ꯑꯦꯛꯁꯅꯁꯤꯡꯒꯤ ꯃꯍꯩꯁꯤꯡꯗꯥ ꯅꯟ-ꯑꯦꯇꯦꯆꯃꯦꯟꯇꯀꯤ ꯃꯇꯥꯡꯗꯥ .
"Divine wisdom, according to Sri Krishna, should be sought at the feet of a liberated Guru,","ꯁ꯭ꯔꯤ ꯀ꯭ꯔ꯭ꯏꯁ꯭ꯅꯒꯤ ꯃꯇꯨꯡ ꯏꯟꯅꯥ ꯏꯁ꯭ꯕꯔꯒꯤ ꯂꯧꯁꯤꯡ ꯑꯁꯤ ꯂꯤꯕꯔꯦꯇꯦꯗ ꯒꯨꯔꯨ ꯑꯃꯒꯤ ꯈꯣꯡꯗꯥ ꯊꯤꯒꯗꯕꯅꯤ,"
one who has realised the Truth. The aspirant should approach such a sage in a spirit of humility and,ꯑꯆꯨꯝꯕꯥ ꯑꯗꯨ ꯈꯉꯂꯕꯥ ꯃꯤꯑꯣꯏ ꯑꯃꯥ꯫
devotion. God Himself manifests in the heart of the Guru and instructs the disciple. Having,ꯚꯛꯇꯤ ꯇꯧꯕꯥ꯫
understood the Truth from the Guru by direct intuitive experience the aspirant is no longer deluded,ꯗꯥꯏꯔꯦꯛꯇ ꯏꯟꯠꯌꯨꯏꯇꯤꯕ ꯑꯦꯛꯁꯄꯤꯔꯤꯑꯦꯟꯁꯅꯥ ꯒꯨꯔꯨꯗꯒꯤ ꯑꯆꯨꯝꯕꯥ ꯑꯗꯨ ꯈꯉꯂꯦ ꯑꯦꯁ꯭ꯄꯤꯔꯦꯟꯇ ꯑꯗꯨꯅꯥ ꯍꯧꯖꯤꯛ ꯂꯃꯖꯤꯡꯗ꯭ꯔꯦ
by ignorance,ꯏꯒꯅꯣꯔꯦꯁꯅꯒꯤ ꯃꯇꯨꯡ ꯏꯟꯅꯥ .
The liberated aspirant directly beholds the Self in all beings and all beings in the Self. He,ꯂꯤꯕꯔꯦꯠ ꯇꯧꯔꯕꯥ ꯑꯦꯁ꯭ꯄꯤꯔꯦꯟꯇ ꯑꯗꯨꯅꯥ ꯖꯤꯕ ꯄꯨꯝꯅꯃꯛꯇꯥ ꯑꯃꯁꯨꯡ ꯃꯁꯥꯗꯥ ꯂꯩꯔꯤꯕꯥ ꯖꯤꯕ ꯄꯨꯝꯅꯃꯛꯇꯥ ꯂꯩꯔꯤꯕꯥ ꯁꯦꯜꯐ ꯑꯗꯨ ꯍꯀꯊꯦꯡꯅꯅꯥ ꯌꯦꯡꯏ꯫
"cognises through internal experience or intuition that all beings, from the Creator down to a blade of","ꯖꯤꯕ ꯄꯨꯝꯅꯃꯛ, ꯁꯦꯝꯕꯤꯕꯥ ꯃꯄꯨꯗꯒꯤ ꯍꯧꯔꯒꯥ ꯕ꯭ꯂꯦꯗ ꯑꯃꯗꯥ ꯐꯥꯑꯣꯕꯥ ꯏꯟꯇꯔꯅꯦꯜ ꯑꯦꯛꯁꯄꯤꯔꯤꯑꯦꯟꯁ ꯅꯠꯔꯒꯥ ꯏꯟꯠꯌꯨꯏꯇꯤꯒꯤ ꯈꯨꯠꯊꯥꯡꯗꯥ ꯀꯣꯒꯅꯤꯖ ꯇꯧꯏ꯫"
"grass, exist in his own Self and also in God","ꯃꯍꯩ-ꯃꯔꯣꯡ, ꯃꯍꯥꯛꯀꯤ ꯃꯁꯥꯒꯤ ꯑꯣꯏꯕꯥ ꯑꯃꯁꯨꯡ ꯏꯁ꯭ꯕꯔꯗꯁꯨ ꯂꯩ"
Arjuna is given the most heartening assurance that divine wisdom liberates even the most,ꯑꯔꯖꯨꯟꯅꯥ ꯈ꯭ꯕꯥꯏꯗꯒꯤ ꯊꯝꯃꯣꯌ ꯁꯦꯡꯅꯥ ꯊꯥꯖꯕꯥ ꯄꯤꯕꯥ ꯉꯝꯕꯥ ꯏꯁ꯭ꯕꯔꯒꯤ ꯂꯧꯁꯤꯡꯅꯥ ꯈ꯭ꯕꯥꯏꯗꯒꯤ ꯌꯥꯝꯅꯥ ꯂꯤꯕꯔꯦꯠ ꯇꯧꯕꯥ ꯌꯥꯏ .
"sinful. When knowledge of the Self dawns, all actions with their results are burnt by the fire of that",ꯄꯥꯞ ꯇꯧꯕꯥ꯫
"knowledge, just as fuel is burnt by fire. When there is no idea of egoism, when there is no desire for","ꯅꯣꯂꯦꯖ, ꯃꯩꯅꯥ ꯆꯥꯀꯄꯥ ꯃꯑꯣꯡꯗꯥ ꯐ꯭ꯌꯨꯑꯦꯜ ꯃꯩ ꯊꯥꯗꯣꯀꯄꯒꯨꯝꯅꯥ꯫"
"the fruits of one’s actions, actions are no actions. They lose their potency","ꯀꯅꯥꯒꯨꯝꯕꯥ ꯑꯃꯒꯤ ꯊꯕꯀꯁꯤꯡ, ꯊꯕꯀꯁꯤꯡꯒꯤ ꯃꯍꯩꯁꯤꯡ ꯑꯁꯤ ꯊꯕꯛ ꯑꯃꯠꯇꯥ ꯅꯠꯇꯦ꯫"
