en,mni-Mtei
of space and attend merely to the act by which we determine the internal,ꯑꯣꯐ ꯁ꯭ꯄꯦꯁ ꯑꯃꯁꯨꯡ ꯑꯩꯈꯣꯌꯅꯥ ꯏꯟꯇꯔꯅꯦꯜ ꯑꯁꯤ ꯂꯦꯄꯊꯣꯛꯂꯤꯕꯥ ꯑꯦꯛꯇ ꯑꯗꯨꯗꯥ ꯁꯔꯨꯛ ꯌꯥꯕꯥ
"sense according to its form, is that which produces the conception of","ꯃꯁꯤꯒꯤ ꯃꯑꯣꯡ ꯃꯇꯧꯒꯤ ꯃꯇꯨꯡ ꯏꯟꯅꯥ ꯁꯦꯟꯁ, ꯑꯁꯤ ꯲꯰꯲꯰ꯒꯤ ꯀꯟꯁꯦꯄꯁꯟ ꯄꯨꯊꯣꯀꯄꯥ ꯑꯗꯨꯅꯤ꯫"
"succession. The understanding, therefore, does by no means find in the",ꯁꯛꯁꯤꯁꯟ ꯇꯧꯕꯥ꯫
"internal sense any such synthesis of the manifold, but produces it, in that it","ꯏꯟꯇꯔꯅꯦꯜ ꯁꯦꯟꯁ ꯑꯁꯤ ꯃꯦꯅꯤꯐꯣꯜꯗꯀꯤ ꯑꯁꯤꯒꯨꯝꯕꯥ ꯁꯤꯟꯊꯦꯁꯤꯁ ꯑꯃꯠꯇꯥ ꯂꯩꯇꯦ, ꯑꯗꯨꯕꯨ ꯃꯁꯤ ꯄꯨꯊꯣꯀꯏ, ꯃꯗꯨꯗꯤ ꯃꯁꯤꯅꯥ ."
"affects this sense. At the same time, how “I who think” is distinct from the",ꯃꯁꯤꯒꯤ ꯁꯦꯟꯁ ꯑꯁꯤ ꯁꯣꯀꯍꯜꯂꯤ꯫
“i” which intuites itself (other modes of intuition being cogitable as at least,“ꯑꯩ” ꯍꯥꯌꯕꯁꯤ ꯏꯟꯠꯌꯨꯏꯇꯁꯤꯡ ꯃꯁꯥꯃꯛꯅꯥ (ꯑꯇꯣꯞꯄꯥ ꯃꯑꯣꯡꯁꯤꯡꯒꯤ ꯏꯟꯠꯌꯨꯏꯇꯤꯖꯝ ꯑꯁꯤ ꯌꯥꯃꯗ꯭ꯔꯕꯗꯥ ꯀꯣꯒꯤꯇꯦꯕꯜ ꯑꯣꯏꯕꯥ ꯃꯑꯣꯡꯗꯥ ꯀꯣꯖꯤꯇꯦꯕꯜ ꯑꯣꯏꯕꯥ .
"possible), and yet one and the same with this latter as the same subject;","ꯑꯣꯏꯊꯣꯀꯄꯥ ꯌꯥꯕꯥ), ꯑꯗꯨꯝ ꯑꯣꯏꯅꯃꯛ ꯑꯃꯅꯥ ꯑꯃꯒꯥ ꯑꯃꯒꯥ ꯂꯣꯌꯅꯅꯥ ꯇꯨꯡꯗꯥ ꯂꯥꯀꯄꯥ ꯑꯁꯤꯒꯥ ꯆꯞ ꯃꯥꯟꯅꯕꯥ ꯁꯕꯖꯦꯛꯇ ꯑꯣꯏꯅꯥ;"
"how, therefore, I am able to say: “I, as an intelligence and thinking subject,","ꯃꯔꯝ ꯑꯗꯨꯅꯥ ꯑꯩꯍꯥꯛꯅꯥ ꯃꯇꯧ ꯀꯔꯝꯅꯥ ꯍꯥꯌꯕꯥ ꯉꯝꯂꯤꯕꯅꯣ: “ꯑꯩꯍꯥꯛ, ꯂꯧꯁꯤꯡ ꯑꯃꯁꯨꯡ ꯋꯥꯈꯜ ꯈꯅꯕꯥ ꯍꯤꯔꯝ ꯑꯃꯥ ꯑꯣꯏꯅꯥ,"
"cognize myself as an object thought, so far as I am, moreover, given to","ꯑꯩꯍꯥꯛ ꯏꯁꯥꯃꯀꯄꯨ ꯑꯣꯕꯖꯦꯛꯇꯀꯤ ꯋꯥꯈꯜꯂꯣꯟ ꯑꯃꯥ ꯑꯣꯏꯅꯥ ꯂꯧꯕꯤꯌꯨ, ꯑꯩꯍꯥꯛꯅꯥ ꯂꯩꯔꯤꯕꯥ ꯑꯁꯤꯒꯨꯝꯅꯥ, ꯃꯁꯤꯒꯤ ꯃꯊꯛꯇꯥ, ꯄꯤꯕꯥ"
"myself in intuition—only, like other phenomena, not as I am in myself, and","ꯑꯩꯍꯥꯛ ꯏꯁꯥꯃꯀꯄꯨ ꯏꯟꯠꯌꯨꯏꯁꯅꯗꯥ—ꯑꯇꯣꯞꯄꯥ ꯐꯤꯚꯃꯁꯤꯡꯒꯨꯝꯅꯥ, ꯑꯩꯍꯥꯛ ꯏꯁꯥꯃꯀꯁꯨ ꯂꯩꯕꯒꯨꯝ ꯅꯠꯇꯦ, ꯑꯃꯁꯨꯡ ."
"as considered by the understanding, but merely as I appear”—is a question","ꯂꯧꯁꯤꯡꯅꯥ ꯈꯟꯅꯔꯤꯕꯥ ꯃꯇꯨꯡ ꯏꯟꯅꯥ, ꯑꯗꯨꯕꯨ ꯑꯩꯅꯥ ꯎꯕꯥ ꯐꯪꯂꯤꯕꯥ ꯑꯁꯤꯒꯨꯝꯅꯥ”—ꯃꯁꯤ ꯋꯥꯍꯪ ꯑꯃꯅꯤ"
that has in it neither more nor less difficulty than the question—“How can I,ꯃꯗꯨꯗꯥ ꯃꯁꯤꯗꯥ ꯋꯥꯍꯪ ꯑꯁꯤꯗꯒꯤ ꯍꯦꯟꯅꯥ ꯅꯠꯔꯒꯥ ꯍꯦꯟꯅꯥ ꯑꯋꯥꯕꯥ ꯑꯃꯠꯇꯥ ꯂꯩꯇꯦ—“ꯑꯩꯍꯥꯛꯅꯥ ꯃꯇꯧ ꯀꯔꯝꯅꯥ ꯇꯧꯕꯥ ꯉꯃꯒꯅꯤ
be an object to myself?” or this—“How I can be an object of my own,ꯑꯩꯒꯤ ꯏꯁꯥꯒꯤ ꯄꯣꯠꯁꯛ ꯑꯃꯥ ꯑꯣꯏꯌꯨ?”
"intuition and internal perceptions?” But that such must be the fact, if we",ꯏꯟꯠꯌꯨꯏꯇꯤ ꯑꯃꯁꯨꯡ ꯏꯟꯇꯔꯅꯦꯜ ꯄꯔꯁꯦꯄꯁꯅꯁꯤꯡ?”
"admit that space is merely a pure form of the phenomena of external sense,","ꯁ꯭ꯄꯦꯁ ꯑꯁꯤ ꯃꯄꯥꯅꯒꯤ ꯋꯥꯈꯜꯂꯣꯅꯒꯤ ꯐꯤꯚꯃꯁꯤꯡꯒꯤ ꯑꯁꯦꯡꯕꯥ ꯃꯑꯣꯡ ꯑꯃꯈꯛꯇꯅꯤ ꯍꯥꯌꯅꯥ ꯌꯥꯕꯤꯌꯨ,"
"can be clearly proved by the consideration that we cannot represent time,","ꯑꯩꯈꯣꯌꯅꯥ ꯃꯇꯝ ꯔꯤꯞꯔꯖꯦꯟꯇ ꯇꯧꯕꯥ ꯉꯃꯗꯦ ꯍꯥꯌꯕꯥ ꯋꯥꯈꯜꯂꯣꯟ ꯑꯁꯤꯅꯥ ꯃꯌꯦꯛ ꯁꯦꯡꯅꯥ ꯄ꯭ꯔꯃꯥꯟ ꯇꯧꯕꯥ ꯉꯃꯒꯅꯤ,"
"which is not an object of external intuition, in any other way than under the","ꯃꯗꯨ ꯃꯄꯥꯅꯒꯤ ꯏꯟꯠꯌꯨꯏꯇꯤꯖꯃꯒꯤ ꯑꯣꯕꯖꯦꯛꯇ ꯅꯠꯇꯦ, ꯃꯈꯥꯗꯥ ꯂꯩꯕꯥ ꯑꯇꯣꯞꯄꯥ ꯃꯑꯣꯡ ꯑꯃꯗꯥ ."
"image of a line, which we draw in thought, a mode of representation","ꯂꯥꯏꯟ ꯑꯃꯒꯤ ꯏꯃꯦꯖ, ꯃꯗꯨ ꯑꯩꯈꯣꯌꯅꯥ ꯋꯥꯈꯂꯗꯥ ꯁꯦꯝꯕꯥ, ꯔꯤꯞꯔꯖꯦꯟꯇꯦꯁꯅꯒꯤ ꯃꯑꯣꯡ ꯑꯃꯥ"
"without which we could not cognize the unity of its dimension, and also","ꯃꯁꯤ ꯌꯥꯑꯣꯗꯅꯥ ꯑꯩꯈꯣꯌꯅꯥ ꯃꯁꯤꯒꯤ ꯗꯥꯏꯃꯦꯟꯁꯅꯒꯤ ꯑꯄꯨꯅꯕꯥ ꯑꯁꯤ ꯈꯉꯕꯥ ꯉꯃꯈꯤꯗꯦ, ꯑꯃꯁꯨꯡ ꯃꯁꯤꯒꯥ ꯂꯣꯌꯅꯅꯥ ."
"that we are necessitated to take our determination of periods of time, or of","ꯑꯩꯈꯣꯌꯅꯥ ꯃꯇꯝ ꯈꯔꯒꯤ ꯑꯣꯏꯕꯥ ꯋꯥꯔꯦꯞ ꯂꯧꯕꯥ, ꯅꯠꯔꯒꯥ ꯳."
"points of time, for all our internal perceptions from the changes which we","ꯃꯇꯃꯒꯤ ꯄꯣꯏꯟꯇꯁꯤꯡ, ꯑꯩꯈꯣꯌꯒꯤ ꯏꯟꯇꯔꯅꯦꯜ ꯄꯔꯁꯦꯄꯁꯟ ꯄꯨꯝꯅꯃꯛꯀꯤꯗꯃꯛ ꯑꯍꯣꯡꯕꯁꯤꯡꯗꯒꯤ ꯑꯩꯈꯣꯌꯅꯥ ."
perceive in outward things. It follows that we must arrange the,ꯃꯄꯥꯟꯊꯣꯡꯒꯤ ꯑꯣꯏꯕꯥ ꯋꯥꯐꯃꯁꯤꯡꯗꯥ ꯂꯧꯁꯤꯅꯕꯥ꯫
"determinations of the internal sense, as phenomena in time, exactly in the","ꯏꯟꯇꯔꯅꯦꯜ ꯁꯦꯟꯁꯀꯤ ꯋꯥꯔꯦꯄꯁꯤꯡ, ꯃꯇꯃꯒꯤ ꯃꯇꯨꯡ ꯏꯟꯅꯥ ꯐꯤꯚꯝ ꯑꯣꯏꯅꯥ, ꯇꯁꯦꯡꯅꯥ ."
same manner as we arrange those of the external senses in space. And,ꯑꯩꯈꯣꯌꯅꯥ ꯁ꯭ꯄꯦꯁꯇꯥ ꯂꯩꯔꯤꯕꯥ ꯃꯄꯥꯅꯒꯤ ꯁꯦꯟꯁꯁꯤꯡꯒꯤ ꯑꯗꯨꯁꯨ ꯁꯦꯝ ꯁꯥꯕꯒꯨꯝ꯫
"consequently, if we grant, respecting this latter, that by means of them we","ꯃꯔꯝ ꯑꯁꯤꯅꯥ, ꯀꯔꯤꯒꯨꯝꯕꯥ ꯑꯩꯈꯣꯌꯅꯥ ꯄꯤꯔꯕꯗꯤ, ꯇꯨꯡꯗꯥ ꯂꯥꯀꯄꯥ ꯑꯁꯤꯕꯨ ꯏꯀꯥꯌ ꯈꯨꯝꯅꯔꯕꯗꯤ, ꯃꯈꯣꯌꯒꯤ ꯈꯨꯠꯊꯥꯡꯗꯥ ꯑꯩꯈꯣꯌꯅꯥ ."
"know objects only in so far as we are affected externally, we must also","ꯑꯩꯈꯣꯌꯅꯥ ꯃꯄꯥꯟꯊꯣꯡꯒꯤ ꯑꯣꯏꯅꯥ ꯁꯣꯀꯍꯜꯂꯤꯕꯥ ꯃꯈꯩ ꯈꯛꯇꯗꯥ ꯄꯣꯠꯁꯤꯡ ꯈꯉꯕꯤꯌꯨ, ꯑꯩꯈꯣꯌꯁꯨ [...]"
"confess, with regard to the internal sense, that by means of it we intuite","ꯀꯅꯐꯦꯁꯟ, ꯏꯟꯇꯔꯅꯦꯜ ꯁꯦꯟꯁꯀꯤ ꯃꯇꯥꯡꯗꯥ, ꯃꯗꯨꯒꯤ ꯈꯨꯠꯊꯥꯡꯗꯥ ꯑꯩꯈꯣꯌꯅꯥ ꯏꯟꯠꯌꯨꯏꯠ ꯇꯧꯕꯥ ."
"ourselves only as we are internally affected by ourselves; in other words, as",ꯑꯩꯈꯣꯌ ꯏꯁꯥꯅꯥ ꯏꯁꯥꯅꯥ ꯏꯁꯥꯕꯨ ꯌꯥꯑꯣꯖꯔꯀꯄꯥ ꯑꯗꯨꯒꯨꯝꯅꯥ ꯑꯩꯈꯣꯌ ꯏꯁꯥꯅꯥ ꯏꯁꯥꯕꯨ ꯊꯥꯖꯖꯕꯒꯨꯝ;
"regards internal intuition, we cognize our own subject only as phenomenon,","ꯏꯟꯇꯔꯅꯦꯜ ꯏꯟꯠꯌꯨꯏꯇꯤꯖꯃꯗꯥ, ꯑꯩꯈꯣꯌꯅꯥ ꯑꯩꯈꯣꯌꯒꯤ ꯏꯁꯥꯒꯤ ꯍꯤꯔꯝ ꯑꯁꯤ ꯐꯤꯚꯝ ꯑꯣꯏꯅꯥ ꯈꯛꯇꯃꯛ ꯀꯣꯒꯅꯤꯖ ꯇꯧꯏ,"
and not as it is in itself.[21],ꯑꯃꯁꯨꯡ ꯃꯁꯥ ꯃꯊꯟꯇꯥ ꯂꯩꯖꯔꯤꯕꯥ ꯑꯗꯨꯒꯨꯝꯅꯥ ꯅꯠꯇꯦ꯫[21]
"[20] Motion of an object in space does not belong to a pure science,","[20] ꯁ꯭ꯄꯦꯁꯇꯥ ꯂꯩꯕꯥ ꯄꯣꯠꯁꯛ ꯑꯃꯒꯤ ꯃꯣꯁꯟ ꯑꯁꯤ ꯑꯁꯦꯡꯕꯥ ꯁꯥꯏꯟꯁ ꯑꯃꯒꯤ ꯑꯣꯏꯗꯦ,"
"consequently not to geometry; because, that a thing is movable cannot be known",ꯃꯔꯝ ꯑꯁꯤꯅꯥ ꯖꯤꯑꯣꯃꯦꯠꯔꯤꯗꯥ ꯅꯠꯇꯦ;
"à priori, but only from experience. But motion, considered as the description of a","à ꯄ꯭ꯔꯥꯏꯑꯣꯔꯤ, ꯑꯗꯨꯕꯨ ꯑꯦꯛꯁꯄꯔꯤꯌꯦꯟꯁꯇꯒꯤ ꯈꯛꯇꯅꯤ꯫"
"space, is a pure act of the successive synthesis of the manifold in external","ꯁ꯭ꯄꯦꯁ, ꯑꯁꯤ ꯃꯄꯥꯅꯒꯤ ꯑꯣꯏꯕꯥ ꯃꯑꯣꯡꯗꯥ ꯃꯦꯅꯤꯐꯣꯜꯗꯀꯤ ꯇꯨꯡ ꯀꯣꯏꯅꯥ ꯆꯠꯄꯥ ꯁꯤꯟꯊꯦꯁꯤꯁꯀꯤ ꯑꯁꯦꯡꯕꯥ ꯊꯕꯛ ꯑꯃꯅꯤ꯫"
"intuition by means of productive imagination, and belongs not only to geometry,","ꯄ꯭ꯔꯗꯛꯇꯤꯕ ꯏꯃꯦꯖꯤꯅꯦꯁꯅꯒꯤ ꯈꯨꯠꯊꯥꯡꯗꯥ ꯏꯟꯠꯌꯨꯏꯁꯟ, ꯑꯃꯁꯨꯡ ꯖꯤꯑꯣꯃꯦꯠꯔꯤ ꯈꯛꯇꯒꯤ ꯅꯠꯇꯦ,"
but even to transcendental philosophy,ꯑꯗꯨꯕꯨ ꯇ꯭ꯔꯥꯟꯁꯦꯟꯗꯦꯟꯇꯜ ꯐꯤꯂꯣꯁꯣꯐꯤꯗꯁꯨ .
[21] I do not see why so much difficulty should be found in admitting that our,[21] ꯑꯩꯈꯣꯌꯒꯤ .
internal sense is affected by ourselves. Every act of attention exemplifies it. In,ꯏꯟꯇꯔꯅꯦꯜ ꯁꯦꯟꯁ ꯑꯁꯤ ꯑꯩꯈꯣꯌ ꯏꯁꯥꯅꯥ ꯁꯣꯀꯍꯜꯂꯤ꯫
such an act the understanding determines the internal sense by the synthetical,ꯑꯁꯤꯒꯨꯝꯕꯥ ꯑꯦꯛꯇ ꯑꯁꯤꯅꯥ ꯂꯧꯁꯤꯡ ꯑꯁꯤꯅꯥ ꯏꯟꯇꯔꯅꯦꯜ ꯁꯦꯟꯁ ꯑꯗꯨ ꯁꯤꯟꯊꯦꯇꯤꯀꯦꯂꯒꯤ ꯃꯇꯨꯡ ꯏꯟꯅꯥ ꯂꯦꯄꯊꯣꯀꯏ .
"conjunction which it cogitates, conformably to the internal intuition which","ꯃꯁꯤꯅꯥ ꯀꯣꯖꯤꯇꯦꯠ ꯇꯧꯔꯤꯕꯥ ꯀꯟꯖꯅꯖꯦꯛꯁꯟ, ꯏꯟꯇꯔꯅꯦꯜ ꯏꯟꯠꯌꯨꯏꯇꯤꯖꯃꯒꯥ ꯀꯣꯟꯅꯗꯨꯅꯥ ꯊꯝꯕꯥ ."
corresponds to the manifold in the synthesis of the understanding. How much the,ꯂꯧꯁꯤꯡꯒꯤ ꯁꯤꯟꯊꯦꯁꯤꯁꯇꯥ ꯃꯦꯅꯤꯐꯣꯜꯗ ꯑꯗꯨꯒꯥ ꯃꯥꯟꯅꯩ꯫
mind is usually affected thereby every one will be able to perceive in himself,ꯋꯥꯈꯜ ꯑꯁꯤ ꯃꯍꯧꯁꯥꯅꯥ ꯁꯣꯀꯍꯜꯂꯤ ꯃꯗꯨꯅꯥ ꯃꯔꯝ ꯑꯣꯏꯔꯒꯥ ꯃꯤ ꯈꯨꯗꯤꯡꯃꯛꯅꯥ ꯃꯁꯥꯗꯥ ꯈꯉꯕꯥ ꯉꯃꯒꯅꯤ .
§ 21,§ ꯲꯱ꯗꯥ ꯂꯩꯕꯥ꯫
"On the other hand, in the transcendental synthesis of the manifold content","ꯑꯃꯔꯣꯃꯗꯥ, ꯃꯦꯅꯤꯐꯣꯜꯗ ꯀꯟꯇꯦꯟꯇꯀꯤ ꯇ꯭ꯔꯥꯟꯁꯦꯟꯗꯦꯟꯇꯜ ꯁꯤꯟꯊꯦꯁꯤꯁꯇꯥ ."
"of representations, consequently in the synthetical unity of apperception, I","ꯔꯤꯞꯔꯖꯦꯟꯇꯦꯁꯅꯁꯤꯡꯒꯤ, ꯃꯔꯝ ꯑꯁꯤꯅꯥ ꯑꯦꯄꯔꯁꯦꯄꯁꯅꯒꯤ ꯁꯤꯟꯊꯦꯇꯤꯀꯜ ꯌꯨꯅꯤꯇꯤꯗꯥ, ꯑꯥꯏ ."
"am conscious of myself, not as I appear to myself, nor as I am in myself,","ꯑꯩꯅꯥ ꯏꯁꯥꯗꯥ ꯎꯕꯥ ꯐꯪꯂꯤꯕꯥ ꯑꯗꯨꯒꯨꯝꯅꯥ ꯅꯠꯇꯦ, ꯅꯠꯔꯒꯥ ꯑꯩꯅꯥ ꯏꯁꯥꯗꯥ ꯂꯩꯔꯤꯕꯥ ꯑꯗꯨꯒꯨꯝꯅꯥ, ꯑꯩꯒꯤ ꯏꯁꯥꯕꯨ ꯀꯟꯁꯤꯌꯦꯟꯇ ꯑꯣꯏꯅꯥ ꯂꯧꯖꯔꯤ,"
"but only that “I am.” This representation is a thought, not an intuition. Now,",ꯑꯗꯨꯕꯨ “ꯑꯩꯍꯥꯛꯅꯤ꯫”
"as in order to cognize ourselves, in addition to the act of thinking, which","ꯑꯩꯈꯣꯌ ꯏꯁꯥꯕꯨ ꯈꯉꯅꯅꯕꯥ, ꯋꯥꯈꯜ ꯈꯅꯕꯒꯤ ꯊꯕꯛꯀꯤ ꯃꯊꯛꯇꯥ, ꯃꯁꯤꯅꯥ ."
subjects the manifold of every possible intuition to the unity of,ꯒꯤ ꯌꯨꯅꯤꯇꯤꯗꯥ ꯑꯣꯏꯊꯣꯀꯄꯥ ꯌꯥꯕꯥ ꯏꯟꯠꯌꯨꯏꯇꯤꯖꯝ ꯈꯨꯗꯤꯡꯃꯛꯀꯤ ꯃꯦꯅꯤꯐꯣꯜꯗ ꯑꯗꯨꯒꯤ ꯃꯈꯥꯗꯥ .
"apperception, there is necessary a determinate mode of intuition, whereby","ꯑꯦꯄꯔꯁꯦꯄꯁꯟ, ꯃꯊꯧ ꯇꯥꯕꯥ ꯗꯤꯇꯔꯃꯤꯅꯦꯠ ꯃꯣꯗ ꯑꯣꯐ ꯏꯟꯠꯌꯨꯏꯇꯤꯖ ꯂꯩ, ꯃꯗꯨꯒꯤ ꯃꯅꯨꯡꯗꯥ"
this manifold is given; although my own existence is certainly not mere,ꯃꯁꯤꯒꯤ ꯃꯦꯅꯤꯐꯣꯜꯗ ꯑꯁꯤ ꯄꯤꯔꯤ;
"phenomenon (much less mere illusion), the determination of my","ꯐꯦꯅꯣꯃꯦꯅꯟ (ꯌꯥꯝꯅꯥ ꯍꯦꯟꯅꯥ ꯅꯦꯝꯕꯥ ꯏꯜꯌꯨꯁꯟ), ꯗꯤ ꯗꯤꯇꯔꯃꯤꯅꯦꯁꯟ ꯑꯣꯐ ꯃꯥꯏ"
existence[22] Can only take place conformably to the form of the internal,existence[22] ꯑꯁꯤ ꯏꯟꯇꯔꯅꯦꯂꯒꯤ ꯃꯑꯣꯡꯗꯥ ꯈꯛꯇꯃꯛ ꯀꯟꯐꯣꯔꯃꯦꯕꯜ ꯑꯣꯏꯅꯥ ꯄꯥꯡꯊꯣꯀꯄꯥ ꯌꯥꯏ꯫
"sense, according to the particular mode in which the manifold which I","ꯁꯦꯟꯁ, ꯑꯀꯛꯅꯕꯥ ꯃꯣꯗ ꯑꯗꯨꯒꯤ ꯃꯇꯨꯡ ꯏꯟꯅꯥ ꯃꯗꯨꯒꯤ ꯃꯅꯨꯡꯗꯥ ꯂꯩꯔꯤꯕꯥ ꯃꯦꯅꯤꯐꯣꯜꯗ ꯑꯗꯨ ꯑꯥꯏ ."
"conjoin is given in internal intuition, and I have therefore no knowledge of","ꯀꯟꯖ꯭ꯌꯨꯝ ꯑꯁꯤ ꯏꯟꯇꯔꯅꯦꯜ ꯏꯟꯠꯌꯨꯏꯁꯅꯗꯥ ꯄꯤꯔꯤ, ꯑꯃꯁꯨꯡ ꯃꯔꯝ ꯑꯁꯤꯅꯥ ꯑꯩꯍꯥꯛꯅꯥ ꯃꯁꯤꯒꯤ ꯃꯇꯥꯡꯗꯥ ꯈꯉꯕꯥ ꯑꯃꯠꯇꯥ ꯂꯩꯇꯦ꯫"
"myself as I am, but merely as I appear to myself. The consciousness of self","ꯑꯩꯍꯥꯛ ꯏꯁꯥꯃꯀꯁꯨ ꯂꯩꯔꯤ, ꯑꯗꯨꯕꯨ ꯑꯩꯍꯥꯛ ꯏꯁꯥꯃꯀꯁꯨ ꯎꯕꯥ ꯐꯪꯂꯤꯕꯥ ꯑꯗꯨꯒꯨꯝꯅꯥ꯫"
"is thus very far from a knowledge of self, in which I do not use the","ꯑꯁꯤ ꯑꯁꯨꯝꯅꯥ ꯌꯥꯝꯅꯥ ꯂꯥꯞꯅꯥ ꯂꯩ, ꯃꯗꯨꯗꯥ ꯑꯩꯍꯥꯛꯅꯥ ."
"categories, whereby I cogitate an object, by means of the conjunction of the","ꯀꯦꯇꯦꯒꯣꯔꯤꯁꯤꯡ, ꯃꯗꯨꯗꯥ ꯑꯩꯅꯥ ꯄꯣꯠꯁꯛ ꯑꯃꯕꯨ ꯀꯣꯖꯤꯇꯦꯠ ꯇꯧꯏ, ꯃꯗꯨꯒꯤ ꯈꯨꯠꯊꯥꯡꯗꯥ ."
"manifold in one apperception. In the same way as I require, for the sake of",ꯃꯦꯅꯤꯐꯣꯜꯗ ꯑꯃꯗꯥ ꯑꯦꯄꯔꯁꯦꯄꯁꯟ ꯑꯃꯗꯥ꯫
"the cognition of an object distinct from myself, not only the thought of an","ꯑꯩꯉꯣꯟꯗꯒꯤ ꯇꯣꯉꯥꯅꯕꯥ ꯄꯣꯠꯁꯛ ꯑꯃꯒꯤ ꯀꯣꯒꯅꯤꯁꯟ, ꯑꯃꯒꯤ ꯋꯥꯈꯜꯂꯣꯟ ꯑꯗꯨ ꯈꯛꯇꯥ ꯅꯠꯇꯅꯥ ."
"object in general (in the category), but also an intuition by which to","ꯑꯣꯕꯖꯦꯛꯇ ꯑꯣꯏꯅꯥ (ꯀꯦꯇꯦꯒꯣꯔꯤꯗꯥ), ꯑꯗꯨꯕꯨ ꯏꯟꯠꯌꯨꯏꯁꯟ ꯑꯃꯁꯨ ꯌꯥꯑꯣꯔꯤ ꯃꯗꯨꯗꯤ ꯃꯁꯤꯅꯥ ."
"determine that general conception, in the same way do I require, in order to","ꯂꯦꯄꯊꯣꯛꯂꯕꯥ ꯖꯦꯅꯔꯦꯜ ꯀꯟꯁꯦꯄꯁꯟ ꯑꯗꯨ, ꯑꯩꯍꯥꯛꯅꯥ ꯃꯊꯧ ꯇꯥꯔꯤꯕꯥ ꯑꯗꯨꯒꯨꯝꯅꯥ, ꯃꯗꯨꯒꯤꯗꯃꯛꯇꯥ, ꯲꯰꯲꯰ꯒꯤ ꯃꯇꯨꯡ ꯏꯟꯅꯥ ꯂꯦꯄꯊꯣꯀꯎ꯫"
"the cognition of myself, not only the consciousness of myself or the thought","ꯑꯩꯒꯤ ꯏꯁꯥꯒꯤ ꯀꯣꯒꯅꯤꯁꯟ, ꯑꯩꯒꯤ ꯏꯁꯥꯒꯤ ꯋꯥꯈꯜ ꯅꯠꯔꯒꯥ ꯋꯥꯈꯜ ꯈꯛꯇꯃꯛ ꯅꯠꯇꯅꯥ ."
"that I think myself, but in addition an intuition of the manifold in myself, by","ꯑꯩꯍꯥꯛꯅꯥ ꯏꯁꯥꯃꯀꯄꯨ ꯈꯟꯖꯈꯤ, ꯑꯗꯨꯕꯨ ꯃꯁꯤꯒꯤ ꯃꯊꯛꯇꯥ ꯑꯩꯍꯥꯛ ꯏꯁꯥꯃꯀꯁꯨ ꯏꯟ ꯃꯦꯅꯤꯐꯣꯜꯗꯀꯤ ꯏꯟꯠꯌꯨꯏꯇꯤ ꯑꯃꯥ, ꯲꯰꯲꯰ꯒꯤ ꯃꯇꯨꯡ ꯏꯟꯅꯥ꯫"
which to determine this thought. It is true that I exist as an intelligence,ꯃꯁꯤꯒꯤ ꯋꯥꯈꯜꯂꯣꯟ ꯑꯁꯤ ꯂꯦꯄꯊꯣꯛꯅꯕꯥ꯫
"which is conscious only of its faculty of conjunction or synthesis, but","ꯃꯁꯤꯅꯥ ꯃꯁꯤꯒꯤ ꯀꯟꯖꯅꯖꯦꯛꯁꯟ ꯅꯠꯔꯒꯥ ꯁꯤꯟꯊꯦꯁꯤꯁꯀꯤ ꯐꯦꯀꯜꯇꯤ ꯈꯛꯇꯒꯤ ꯃꯇꯥꯡꯗꯥ ꯈꯉꯕꯥ ꯉꯝꯃꯤ, ꯑꯗꯨꯕꯨ ."
subjected in relation to the manifold which this intelligence has to conjoin,ꯃꯁꯤꯒꯤ ꯏꯟꯇꯦꯂꯤꯖꯦꯟꯁ ꯑꯁꯤꯅꯥ ꯀꯟꯖ꯭ꯌꯨꯝ ꯇꯧꯕꯥ ꯌꯥꯕꯥ ꯃꯦꯅꯤꯐꯣꯜꯗꯀꯥ ꯃꯔꯤ ꯂꯩꯅꯅꯥ ꯁꯖꯦꯁꯟ ꯇꯧꯕꯥ .
"to a limitative conjunction called the internal sense. My intelligence (that is,",ꯏꯟꯇꯔꯅꯦꯜ ꯁꯦꯟꯁ ꯍꯥꯌꯅꯥ ꯀꯧꯕꯥ ꯂꯤꯃꯤꯇꯦꯇꯤꯕ ꯀꯟꯖꯅꯛꯁꯟ ꯑꯃꯗꯥ꯫
I) can render that conjunction or synthesis perceptible only according to the,i) ꯑꯁꯤꯅꯥ ꯀꯟꯖꯅꯛꯁꯟ ꯅꯠꯔꯒꯥ ꯁꯤꯟꯊꯦꯁꯤꯁ ꯑꯁꯤ ꯂꯧꯁꯤꯅꯕꯥ ꯌꯥꯕꯥ ꯑꯣꯏꯅꯥ ꯔꯦꯟꯗꯔ ꯇꯧꯕꯥ ꯌꯥꯏ
"relations of time, which are quite beyond the proper sphere of the","ꯃꯇꯃꯒꯤ ꯃꯔꯤꯁꯤꯡ, ꯃꯈꯣꯌꯁꯤꯡ ꯑꯁꯤ ꯌꯥꯝꯅꯥ ꯊꯨꯅꯥ ꯌꯥꯡꯅꯥ ꯆꯠꯄꯥ ꯂꯝꯕꯤꯗꯒꯤ ꯌꯥꯝꯅꯥ ꯂꯥꯞꯅꯥ ꯂꯩ꯫"
conceptions of the understanding and consequently cognize itself in respect,ꯂꯧꯁꯤꯡꯒꯤ ꯋꯥꯈꯜꯂꯣꯅꯁꯤꯡ ꯑꯃꯁꯨꯡ ꯃꯗꯨꯒꯤ ꯃꯍꯩ ꯑꯣꯏꯅꯥ ꯃꯁꯥꯃꯀꯄꯨ ꯏꯀꯥꯏ ꯈꯨꯝꯅꯖꯕꯗꯥ ꯀꯣꯒꯅꯤꯖ ꯇꯧꯕꯥ
"to an intuition (which cannot possibly be intellectual, nor given by the","ꯏꯟꯠꯌꯨꯏꯇꯤꯖ ꯑꯃꯗꯥ (ꯃꯁꯤꯅꯥ ꯋꯥꯈꯜ ꯂꯧꯁꯤꯡ ꯂꯩꯕꯥ ꯌꯥꯔꯣꯏ, ꯅꯠꯔꯒꯥ ꯄꯤꯕꯥ ꯉꯃꯗꯕꯥ ."
"understanding), only as it appears to itself, and not as it would cognize","ꯂꯧꯁꯤꯅꯕꯥ), ꯃꯁꯥꯃꯀꯄꯨ ꯎꯕꯥ ꯐꯪꯂꯤꯕꯥ ꯃꯇꯨꯡ ꯏꯟꯅꯥ, ꯑꯃꯁꯨꯡ ꯃꯁꯤꯅꯥ ꯀꯣꯒꯅꯤꯖ ꯇꯧꯔꯀꯄꯒꯨꯝꯅꯥ ꯅꯠꯇꯦ"
"itself, if its intuition were intellectual","ꯃꯁꯥꯃꯛ, ꯀꯔꯤꯒꯨꯝꯕꯥ ꯃꯁꯤꯒꯤ ꯏꯟꯠꯌꯨꯏꯇꯤ ꯑꯁꯤ ꯏꯟꯇꯦꯂꯦꯀꯆꯨꯑꯦꯜ ꯑꯣꯏꯔꯝꯂꯕꯗꯤ ."
[22] The “I think” expresses the act of determining my own existence. My,[22] “ꯑꯩꯅꯥ ꯈꯜꯂꯤ” ꯍꯥꯌꯕꯁꯤꯅꯥ ꯑꯩꯒꯤ ꯏꯁꯥꯒꯤ ꯑꯣꯏꯕꯥ ꯋꯥꯐꯝ ꯂꯦꯄꯊꯣꯀꯄꯒꯤ ꯊꯕꯛ ꯑꯗꯨ ꯐꯣꯡꯗꯣꯀꯏ꯫
existence is thus already given by the act of consciousness; but the mode in,ꯑꯁꯨꯝꯅꯥ ꯂꯩꯔꯤꯕꯥ ꯑꯁꯤ ꯑꯁꯨꯝꯅꯥ ꯍꯥꯟꯅꯅꯥ ꯀꯟꯁꯇꯤꯠꯌꯨꯁꯅꯒꯤ ꯊꯕꯛꯅꯥ ꯄꯤꯕꯤꯔꯦ;
"which I must determine my existence, that is, the mode in which I must place the","ꯃꯗꯨ ꯑꯩꯅꯥ ꯑꯩꯒꯤ ꯂꯩꯔꯤꯕꯥ ꯑꯁꯤ ꯂꯦꯄꯊꯣꯛꯀꯗꯕꯅꯤ, ꯍꯥꯌꯕꯗꯤ ꯑꯩꯅꯥ ꯊꯝꯂꯤꯕꯥ ꯃꯣꯗ ꯑꯗꯨ ."
"manifold belonging to my existence, is not thereby given. For this purpose","ꯑꯩꯒꯤ ꯂꯩꯔꯤꯕꯥ ꯃꯐꯝ ꯑꯁꯤꯒꯤ ꯃꯅꯨꯡ ꯆꯅꯕꯥ ꯃꯦꯅꯤꯐꯣꯜꯗ, ꯃꯔꯝ ꯑꯁꯤꯅꯥ ꯄꯤꯕꯥ ꯅꯠꯇꯦ꯫"
"intuition of self is required, and this intuition possesses a form given à priori,","ꯁꯦꯜꯐꯀꯤ ꯏꯟꯠꯌꯨꯏꯇꯤꯖꯝ ꯑꯁꯤ ꯃꯊꯧ ꯇꯥꯏ, ꯑꯃꯁꯨꯡ ꯃꯁꯤꯒꯤ ꯏꯟꯠꯌꯨꯏꯁꯟ ꯑꯁꯤꯅꯥ à priori, ꯄꯤꯕꯥ ꯃꯑꯣꯡ ꯑꯃꯥ ꯂꯩ,"
"namely, time, which is sensuous, and belongs to our receptivity of the","ꯍꯥꯌꯕꯗꯤ, ꯃꯇꯝ, ꯃꯁꯤ ꯁꯦꯟꯁ꯭ꯌꯨꯜ ꯑꯣꯏꯕꯥ, ꯑꯃꯁꯨꯡ ꯑꯩꯈꯣꯌꯒꯤ ꯔꯤꯁꯦꯄꯇꯤꯕꯤꯇꯤꯒꯤ ꯃꯅꯨꯡ ꯆꯅꯕꯥ ."
"determinable. Now, as I do not possess another intuition of self which gives the",ꯂꯦꯄꯊꯣꯀꯄꯥ ꯌꯥꯕꯥ꯫
"determining in me (of the spontaneity of which I am conscious), prior to the act","ꯑꯩꯉꯣꯟꯗꯥ (ꯑꯩꯍꯥꯛ ꯋꯥꯈꯜ ꯈꯟꯗꯨꯅꯥ ꯂꯩꯔꯤꯕꯥ ꯁ꯭ꯄꯣꯟꯗꯦꯟꯁꯀꯤ ꯃꯅꯨꯡꯗꯥ), ꯑꯦꯛꯇ ꯑꯁꯤꯒꯤ ꯃꯃꯥꯡꯗꯥ ꯂꯦꯄꯊꯣꯀꯄꯥ"
"of determination, in the same manner as time gives the determinable, it is clear","ꯋꯥꯔꯦꯞ ꯂꯧꯕꯒꯤ, ꯃꯇꯃꯒꯥ ꯃꯥꯟꯅꯕꯥ ꯃꯑꯣꯡꯗꯥ ꯗꯤꯇꯔꯃꯤꯅꯦꯕꯜ ꯑꯣꯏꯕꯥ, ꯃꯁꯤ ꯃꯌꯦꯛ ꯁꯦꯡꯏ"
"that I am unable to determine my own existence as that of a spontaneous being,","ꯑꯩꯅꯥ ꯑꯩꯒꯤ ꯏꯁꯥꯒꯤ ꯑꯣꯏꯕꯥ ꯍꯤꯡꯕꯒꯤ ꯃꯑꯣꯡ ꯃꯇꯧ ꯑꯗꯨ ꯃꯁꯥꯅꯥ ꯃꯁꯥꯕꯨ ꯊꯥꯖꯕꯥ ꯉꯃꯗꯕꯥ ꯃꯤꯁꯛ ꯑꯃꯅꯤ ꯍꯥꯌꯅꯥ ꯂꯧꯕꯥ ꯉꯃꯗꯕꯥ ꯍꯥꯌꯕꯁꯤꯅꯤ,"
"but I am only able to represent to myself the spontaneity of my thought, that is,","ꯑꯗꯨꯕꯨ ꯑꯩꯍꯥꯛꯅꯥ ꯑꯩꯍꯥꯛꯀꯤ ꯋꯥꯈꯜꯂꯣꯅꯒꯤ ꯁ꯭ꯄꯣꯟꯗꯦꯟꯁ ꯑꯗꯨ ꯈꯛꯇꯥ ꯔꯤꯞꯔꯖꯦꯟꯇ ꯇꯧꯕꯥ ꯉꯝꯂꯤ, ꯍꯥꯌꯕꯗꯤ ."
"of my determination, and my existence remains ever determinable in a purely","ꯑꯩꯒꯤ ꯋꯥꯔꯦꯞ ꯑꯁꯤꯒꯤ ꯃꯇꯥꯡꯗꯥ, ꯑꯃꯁꯨꯡ ꯑꯩꯒꯤ ꯂꯩꯔꯤꯕꯥ ꯑꯁꯤ ꯃꯄꯨꯡ ꯐꯥꯅꯥ ꯂꯦꯞꯄꯥ ꯂꯩꯇꯅꯥ ꯂꯦꯞꯄꯥ ꯂꯩꯇꯅꯥ ꯂꯦꯞꯂꯤ꯫"
"sensuous manner, that is to say, like the existence of a phenomenon. But it is","ꯁꯦꯟꯁ꯭ꯌꯨꯜ ꯑꯣꯏꯕꯥ ꯃꯑꯣꯡꯗꯥ, ꯍꯥꯌꯕꯗꯤ ꯐꯤꯚꯝ ꯑꯃꯥ ꯂꯩꯕꯒꯨꯝ꯫"
because of this spontaneity that I call myself an intelligence,ꯃꯁꯤꯒꯤ ꯁ꯭ꯄꯣꯟꯗꯦꯟꯁ ꯑꯁꯤꯅꯥ ꯃꯔꯝ ꯑꯣꯏꯗꯨꯅꯥ ꯑꯩꯍꯥꯛꯅꯥ ꯏꯁꯥꯕꯨ ꯂꯧꯁꯤꯡ ꯑꯃꯥ ꯑꯣꯏꯅꯥ ꯀꯧꯏ .
Transcendental Deduction of the universally possible,ꯃꯥꯂꯦꯃꯒꯤ ꯑꯣꯏꯅꯥ ꯑꯣꯏꯊꯣꯀꯄꯥ ꯌꯥꯕꯥ ꯇ꯭ꯔꯥꯟꯁꯦꯟꯗꯦꯟꯇꯜ ꯗꯤꯗꯛꯁꯟ
employment in experience of the Pure Conceptions,ꯑꯁꯦꯡꯕꯥ ꯋꯥꯈꯜꯂꯣꯅꯁꯤꯡꯒꯤ ꯑꯦꯛꯁꯄꯔꯤꯌꯦꯟꯁꯇꯥ ꯊꯕꯛ ꯄꯤꯕꯥ
of the Understanding § 22,§ 22ꯒꯤ ꯃꯇꯥꯡꯗꯥ ꯂꯧꯁꯤꯡ ꯂꯩꯕꯥ꯫
"In the metaphysical deduction, the à priori origin of categories was","ꯃꯦꯇꯥꯐꯤꯁꯤꯀꯦꯜ ꯗꯤꯗꯛꯁꯟꯗꯥ, ꯀꯦꯇꯦꯒꯣꯔꯤꯁꯤꯡꯒꯤ ꯑꯦ ꯄ꯭ꯔꯤꯑꯣꯔꯤ ꯑꯣꯔꯤꯖꯤꯟ ꯑꯁꯤ ."
proved by their complete accordance with the general logical of thought; in,ꯃꯈꯣꯌꯒꯤ ꯃꯄꯨꯡ ꯐꯥꯅꯥ ꯋꯥꯈꯜꯂꯣꯅꯒꯤ ꯃꯇꯨꯡ ꯏꯟꯅꯥ ꯄ꯭ꯔꯃꯥꯟ ꯇꯧꯔꯕꯥ;
the transcendental deduction was exhibited the possibility of the categories,ꯇ꯭ꯔꯥꯟꯁꯦꯟꯗꯦꯟꯇꯜ ꯗꯤꯗꯛꯁꯟ ꯑꯁꯤ ꯀꯦꯇꯦꯒꯣꯔꯤꯁꯤꯡꯒꯤ ꯑꯣꯏꯊꯣꯀꯄꯥ ꯌꯥꯕꯥ ꯑꯗꯨ ꯎꯠꯈꯤ꯫
as à priori cognitions of objects of an intuition in general (§ 16 and 17).At,as à ꯄ꯭ꯔꯥꯏꯑꯣꯔꯤ ꯑꯣꯏꯅꯥ ꯏꯟꯠꯌꯨꯏꯁꯟ ꯑꯃꯒꯤ ꯑꯣꯕꯖꯦꯛꯇꯁꯤꯡꯒꯤ ꯀꯣꯒꯅꯤꯁꯅꯁꯤꯡ (§ 16 ꯑꯃꯁꯨꯡ 17).at.
"present we are about to explain the possibility of cognizing, à priori, by","ꯄ꯭ꯔꯦꯖꯦꯟꯇ ꯑꯩꯈꯣꯌꯅꯥ ꯀꯣꯒꯅꯤꯖ ꯇꯧꯕꯒꯤ ꯑꯣꯏꯊꯣꯀꯄꯥ ꯌꯥꯕꯁꯤꯡ ꯑꯗꯨ ꯐꯣꯡꯗꯣꯛꯀꯗꯧꯔꯤ, à priori, by"
"means of the categories, all objects which can possibly be presented to our","ꯀꯦꯇꯦꯒꯣꯔꯤꯁꯤꯡꯒꯤ ꯄꯥꯝꯕꯩꯁꯤꯡ, ꯑꯩꯈꯣꯌꯒꯤ ."
"senses, not, indeed, according to the form of their intuition, but according to","ꯁꯦꯟꯁꯁꯤꯡ, ꯅꯠꯇꯦ, ꯇꯁꯦꯡꯅꯃꯛ, ꯃꯈꯣꯌꯒꯤ ꯏꯟꯠꯌꯨꯏꯇꯤꯖꯃꯒꯤ ꯃꯑꯣꯡ ꯃꯇꯧꯒꯤ ꯃꯇꯨꯡ ꯏꯟꯅꯥ, ꯑꯗꯨꯕꯨ ꯃꯗꯨꯒꯤ ꯃꯇꯨꯡ ꯏꯟꯅꯥ ."
"the laws of their conjunction or synthesis, and thus, as it were, of","ꯃꯈꯣꯌꯒꯤ ꯀꯟꯖꯅꯖꯦꯛꯁꯟ ꯅꯠꯔꯒꯥ ꯁꯤꯟꯊꯦꯁꯤꯁꯀꯤ ꯑꯥꯏꯅꯁꯤꯡ, ꯑꯃꯁꯨꯡ ꯃꯔꯝ ꯑꯁꯤꯅꯥ, ꯍꯥꯌꯕꯗꯤ"
prescribing laws to nature and even of rendering nature possible. For if the,ꯃꯍꯧꯁꯥꯗꯥ ꯑꯃꯁꯨꯡ ꯃꯍꯧꯁꯥꯕꯨ ꯑꯣꯏꯊꯣꯀꯄꯥ ꯌꯥꯕꯥ ꯑꯣꯏꯍꯟꯅꯕꯥ ꯐꯥꯑꯣꯕꯥ ꯑꯥꯏꯅꯁꯤꯡ ꯊꯝꯕꯥ꯫
"categories were inadequate to this task, it would not be evident to us why","ꯀꯦꯇꯦꯒꯣꯔꯤꯁꯤꯡ ꯑꯁꯤ ꯊꯕꯛ ꯑꯁꯤꯒꯤ ꯃꯇꯤꯛ ꯆꯥꯗꯕꯥ ꯑꯣꯏꯈꯤ, ꯀꯔꯤꯒꯤꯗꯃꯛꯇꯥ ꯑꯩꯈꯣꯌꯗꯥ ꯃꯌꯦꯛ ꯁꯦꯡꯅꯥ ꯎꯕꯥ ꯐꯪꯂꯃꯂꯣꯏ꯫"
everything that is presented to our senses must be subject to those laws,ꯑꯩꯈꯣꯌꯒꯤ ꯁꯦꯟꯁꯁꯤꯡꯗꯥ ꯄꯤꯔꯤꯕꯥ ꯄꯨꯝꯅꯃꯛ ꯑꯁꯤ ꯑꯥꯏꯅꯁꯤꯡ ꯑꯗꯨꯒꯤ ꯃꯈꯥꯗꯥ ꯂꯩꯒꯗꯕꯅꯤ .
which have an à priori origin in the understanding itself,ꯃꯈꯣꯌꯁꯤꯡ ꯑꯁꯤ à priori origin ꯑꯃꯥ ꯂꯩ ꯃꯗꯨꯗꯤ ꯃꯁꯥꯅꯥ ꯃꯁꯥꯕꯨ ꯂꯧꯁꯤꯅꯖꯕꯗꯥ .
I premise that by the term synthesis of apprehension I understand the,ꯑꯩꯅꯥ ꯄ꯭ꯔꯤꯃꯤꯖꯝ ꯇꯧꯏ ꯃꯗꯨꯗꯤ ꯑꯦꯞꯔꯦꯁꯅꯒꯤ ꯁꯤꯟꯊꯦꯁꯤꯁ ꯍꯥꯌꯕꯥ ꯋꯥꯍꯩ ꯑꯁꯤꯅꯥ ꯑꯩꯅꯥ ꯈꯉꯏ .
"combination of the manifold in an empirical intuition, whereby perception,","ꯑꯦꯝꯄꯤꯔꯤꯀꯦꯜ ꯏꯟꯠꯌꯨꯏꯇꯤꯖ ꯑꯃꯗꯥ ꯃꯦꯅꯤꯐꯣꯜꯗ ꯀꯝꯕꯤꯅꯦꯁꯟ ꯇꯧꯕꯥ, ꯃꯗꯨꯗꯥ ꯋꯥꯈꯜ ꯈꯅꯕꯥ,"
"that is, empirical consciousness of the intuition (as phenomenon), is","ꯍꯥꯌꯕꯗꯤ ꯏꯟꯠꯌꯨꯏꯇꯤꯒꯤ ꯑꯦꯝꯄꯤꯔꯤꯀꯦꯜ ꯀꯟꯁꯆꯤꯌꯟꯁ (ꯐꯤꯅꯑꯣꯅꯦꯝ ꯑꯣꯏꯅꯥ), ꯑꯥꯏ.ꯑꯦꯁ."
possible,ꯑꯣꯏꯊꯣꯛꯄ ꯌꯥꯕ
