en,mni-Mtei
It thus became the first rice variety from Manipur and Nagaland,ꯃꯁꯤ ꯑꯁꯨꯝꯅꯥ ꯃꯅꯤꯄꯨꯔ ꯑꯃꯁꯨꯡ ꯅꯥꯒꯥꯂꯦꯟꯗꯒꯤ ꯑꯍꯥꯅꯕꯥ ꯆꯦꯡ ꯃꯈꯜ ꯑꯣꯏꯈꯤ .
It also is the 5th type of goods from Manipur and 4th from Nagaland to earn the GI tag respectively,ꯃꯁꯤꯁꯨ ꯃꯅꯤꯄꯨꯔꯗꯒꯤ ꯵ꯁꯨꯕꯥ ꯃꯈꯂꯒꯤ ꯄꯣꯠꯂꯃꯁꯤꯡꯅꯤ ꯑꯃꯁꯨꯡ ꯅꯥꯒꯥꯂꯦꯟꯗꯗꯒꯤ ꯴ꯁꯨꯕꯥ ꯑꯣꯏꯅꯥ ꯃꯊꯪꯁꯤꯠꯅꯥ ꯖꯤ.ꯑꯥꯏ.
London Frank Cass  Co. Ltd,ꯂꯟꯗꯟ ꯐ꯭ꯔꯥꯉ꯭ꯛ ꯀꯥꯁ ꯀꯣ ꯂꯤꯃꯤꯇꯦꯗꯅꯥ ꯌꯨ.ꯑꯦꯁ.
Luce G.H Htway Tin 1976 A 15th Century Inscription and Library at Pagán Burma Malalasekera Commemoration Volume,ꯂꯨꯁ ꯖꯤ.ꯑꯩꯆ.ꯑꯩꯆ.ꯇꯤ.ꯋꯥꯏ.
Colombo The Malalasekera Commemoration Volume Editorial Committee Dept of Pali and Buddhist Studies University of Ceylon pp,ꯀꯣꯂꯝꯕꯣ ꯗꯤ ꯃꯥꯂꯥꯂꯥꯁꯦꯀꯦꯔꯥ ꯀꯃꯦꯃꯣꯔꯦꯁꯟ ꯚꯣꯜꯌꯨꯝ ꯑꯦꯗꯤꯇꯣꯔꯤꯌꯜ ꯀꯝꯃꯤꯇꯤ ꯗꯤꯄꯥꯔꯇꯃꯦꯟꯇ ꯑꯣꯐ ꯄꯥꯂꯤ ꯑꯃꯁꯨꯡ ꯕꯨꯗ꯭ꯙꯤꯁ꯭ꯠ ꯁ꯭ꯇꯗꯤꯖ ꯌꯨꯅꯤꯚꯔꯁꯤꯇꯤ ꯑꯣꯐ ꯁꯤꯂꯣꯟ ꯄꯤ.ꯄꯤ.
203256 Ragini Devi 1990,꯲꯰꯳꯲꯵꯶ ꯔꯒꯤꯅꯤ ꯗꯦꯕꯤ ꯱꯹꯹꯰ꯗꯥ ꯊꯣꯀꯈꯤ꯫
Dance Dialects of India,ꯚꯥꯔꯇꯀꯤ ꯗꯥꯟꯁ ꯗꯥꯏꯂꯦꯛꯇꯁꯤꯡ .
Motilal Banarsidass,ꯃꯣꯇꯤꯂꯥꯜ ꯕꯥꯅꯥꯔꯁꯤꯗꯥꯁ .
ISBN 9788120806740,ꯑꯥꯏ.ꯑꯦꯁ.ꯕꯤ.ꯑꯦꯟ.꯹꯷꯸꯸꯱꯲꯰꯸꯰꯶꯷꯴꯰ꯗꯥ ꯊꯥꯕꯤꯔꯀꯎ꯫
Sanatomba Kangujam 2015 Interrogation into the political status of Manipur in Arambam Noni Kangujam Sanatomba eds,ꯁꯅꯥꯇꯣꯝꯕꯥ ꯀꯥꯡꯒꯨꯖꯝ ꯲꯰꯱꯵ ꯑꯔꯥꯝꯕꯥꯃꯗꯥ ꯂꯩꯕꯥ ꯃꯅꯤꯄꯨꯔꯒꯤ ꯔꯥꯖꯅꯤꯇꯤꯒꯤ ꯐꯤꯚꯃꯗꯥ ꯋꯥꯍꯪ ꯍꯪꯂꯀꯄꯥ ꯅꯣꯅꯤ ꯀꯥꯡꯒꯨꯖꯝ ꯁꯅꯥꯇꯣꯝꯕꯥ ꯑꯦꯗꯁ
Colonialism and Resistance Society and State in Manipur Routledge pp,ꯃꯅꯤꯄꯨꯔ ꯔꯧꯇꯂꯦꯖ ꯄꯤ.ꯄꯤ.ꯗꯥ ꯀꯣꯂꯣꯅꯤꯑꯦꯂꯤꯖꯝ ꯑꯃꯁꯨꯡ ꯔꯦꯖꯤꯁ꯭ꯇꯦꯟꯁ ꯁꯣꯁꯥꯏꯇꯤ ꯑꯃꯁꯨꯡ ꯔꯥꯖ꯭ꯌ
159180 ISBN 9781317270669 Saryu Doshi 1989,꯱꯵꯹꯱꯸꯰ ꯑꯥꯏ.ꯑꯦꯁ.ꯕꯤ.ꯑꯦꯟ.꯹꯷꯸꯱꯳꯱꯷꯲꯷꯰꯶꯶꯹ ꯁꯥꯔꯤꯌꯨ ꯗꯣꯁꯤ ꯱꯹꯸꯹
Dances of Manipur The Classical Tradition,ꯃꯅꯤꯄꯨꯔꯒꯤ ꯅꯥꯠꯁꯤꯡ ꯀ꯭ꯂꯥꯁꯤꯀꯦꯜ ꯇ꯭ꯔꯦꯗꯤꯁꯟ
Marg Publications,ꯃꯥꯔꯒ ꯄꯕ꯭ꯂꯤꯀꯦꯁꯅꯁꯤꯡ .
ISBN 9788185026091,ꯑꯥꯏ.ꯑꯦꯁ.ꯕꯤ.ꯑꯦꯟ.꯹꯷꯸꯸꯱꯸꯵꯰꯲꯶꯰꯹꯱
Reginald Massey 2004,ꯔꯦꯖꯤꯅꯥꯜꯗ ꯃꯦꯁꯦ ꯲꯰꯰꯴ꯗꯥ ꯊꯣꯀꯈꯤ꯫
Indias Dances Their History Technique and Repertoire,ꯏꯟꯗꯤꯌꯥꯁꯅꯥ ꯃꯈꯣꯌꯒꯤ ꯄꯨꯋꯥꯔꯤꯒꯤ ꯇꯦꯛꯅꯤꯛ ꯑꯃꯁꯨꯡ ꯔꯦꯄꯔꯇꯣꯔꯤꯗꯥ ꯅꯥꯟꯊꯣꯀꯏ .
Abhinav Publications,ꯑꯚꯤꯅꯥꯕ ꯄꯕ꯭ꯂꯤꯀꯦꯁꯅꯁꯤꯡ .
ISBN 9788170174349,ꯑꯥꯏ.ꯑꯦꯁ.ꯕꯤ.ꯑꯦꯟ.ꯒꯤ ꯹꯷꯸꯸꯱꯷꯰꯱꯷꯴꯳꯴꯹ ꯂꯩ꯫
Sudhirkumar Singh Haorongbam 2011 Socioreligious and Political Movements in Modern Manipur 193451 INFLIBNET hdl10603121665 Tarapot Phanjoubam 2003 Bleeding Manipur HarAnand Publications ISBN 9788124109021 Williams Drid 2004,ꯁꯨꯙꯤꯔꯀꯨꯃꯥꯔ ꯁꯤꯡꯍ ꯍꯥꯑꯣꯔꯣꯡꯕꯥꯝ ꯲꯰꯱꯱ ꯃꯣꯗꯔꯟ ꯃꯅꯤꯄꯨꯔꯗꯥ ꯁꯣꯁꯤꯑꯣꯔꯦꯜ ꯑꯃꯁꯨꯡ ꯄꯣꯂꯤꯇꯤꯀꯦꯜ ꯃꯨꯕꯃꯦꯟꯇꯁꯤꯡ ꯱꯹꯳꯴꯵꯱ ꯏꯅꯐ꯭ꯂꯤꯕꯅꯦꯠ ꯑꯦꯆ.ꯗꯤ.ꯑꯦꯜ.꯱꯰꯶꯰꯳꯱꯲꯱꯶꯶꯵ ꯇꯥꯔꯥꯄꯣꯠ ꯐꯥꯅꯖꯧꯕꯝ ꯲꯰꯰꯳ ꯕ꯭ꯂꯤꯗꯤꯡ ꯃꯅꯤꯄꯨꯔ ꯍꯔꯥꯅꯟꯗ ꯄꯕ꯭ꯂꯤꯀꯦꯁꯅꯁꯤꯡ ꯑꯥꯏ.ꯑꯦꯁ.ꯕꯤ.ꯑꯦꯟ.
In the Shadow of Hollywood Orientalism Authentic East Indian Dancing PDF,ꯍꯣꯂꯤꯋꯨꯗ ꯑꯣꯔꯤꯑꯦꯟꯇꯦꯂꯤꯖꯃꯒꯤ ꯁꯦꯗꯣꯡꯗꯥ ꯑꯆꯨꯝꯕꯥ ꯏꯁ꯭ꯠ ꯏꯟꯗꯤꯌꯥꯟ ꯗꯥꯟꯁꯤꯡ ꯄꯤ.ꯗꯤ.ꯑꯦꯐ.
Visual Anthropology,ꯚꯤꯖꯨꯑꯦꯜ ꯑꯦꯟꯊ꯭ꯔꯣꯄꯣꯂꯣꯖꯤ .
17 1 6998,꯱꯷ ꯱ ꯶꯹꯹꯸ꯗꯥ ꯊꯣꯀꯈꯤ꯫
S2CID 29065670,ꯑꯦꯁ꯲ꯁꯤꯗ ꯲꯹꯰꯶꯵꯶꯷꯰ ꯂꯩ꯫
Archived from the original PDF on 4 March 2016,꯲꯰꯱꯶ꯀꯤ ꯃꯥꯔꯆ ꯴ꯗꯥ ꯑꯔꯤꯖꯤꯅꯦꯜ ꯄꯤ.ꯗꯤ.ꯑꯦꯐ.
Lieberman Victor B,ꯂꯤꯕꯔꯝꯌꯥꯟ ꯚꯤꯛꯇꯔ ꯕꯤ .
2003,꯲꯰꯰꯳ꯗꯥ ꯊꯣꯀꯈꯤ꯫
Strange Parallels Southeast Asia in Global Context c,ꯁ꯭ꯠꯔꯦꯟꯖ ꯄꯦꯔꯥꯂꯦꯁ ꯁꯥꯎꯊꯏꯁ꯭ꯠ ꯑꯦꯁꯤꯌꯥ ꯏꯟ ꯒ꯭ꯂꯣꯕꯦꯜ ꯀꯟꯇꯦꯛꯁ ꯁꯤ .
8001830 volume 1 Integration on the Mainland,꯸꯰꯰꯱꯸꯳꯰ ꯚꯣꯜꯌꯨꯝ ꯱ ꯃꯦꯅꯂꯦꯟꯗꯗꯥ ꯏꯟꯇꯤꯒ꯭ꯔꯦꯁꯟ ꯇꯧꯕꯥ
Cambridge University Press,ꯀꯦꯝꯕ꯭ꯔꯤꯖ ꯌꯨꯅꯤꯕꯔꯁꯤꯇꯤ ꯄ꯭ꯔꯦꯁꯇꯥ ꯂꯩꯕꯥ ꯑꯦꯝ.
ISBN 9780521804967,ꯑꯥꯏ.ꯑꯦꯁ.ꯕꯤ.ꯑꯦꯟ.꯹꯷꯸꯰꯵꯲꯱꯸꯰꯴꯹꯶꯷ ꯂꯩ꯫
Government Official website  Official Tourism Site of Manipur General information  Geographic data related to Manipur at OpenStreetMap,ꯁꯔꯀꯥꯔꯒꯤ ꯑꯣꯐꯤꯁꯤꯑꯦꯜ ꯋꯦꯕꯁꯥꯏꯠ ꯑꯣꯐꯤꯁꯤꯑꯦꯜ ꯇꯨꯔꯤꯖꯝ ꯃꯅꯤꯄꯨꯔꯒꯤ ꯃꯐꯝ ꯑꯣꯄꯅꯁ꯭ꯠꯔꯤꯇꯃꯦꯄꯇꯥ ꯃꯅꯤꯄꯨꯔꯒꯥ ꯃꯔꯤ ꯂꯩꯅꯕꯥ ꯖꯤꯑꯣꯒ꯭ꯔꯥꯐꯤꯛ ꯗꯦꯇꯥ ꯖꯦꯅꯦꯔꯦꯜ ꯏꯅꯐꯣꯔꯃꯦꯁꯟ
Lai Haraoba Meitei ꯂꯏ ꯍꯔꯎꯕ Old Manipuri ꯂꯏ ꯍꯂꯎꯄ lit,"ꯂꯥꯏ ꯍꯥꯔꯥꯑꯣꯕꯥ ꯃꯦꯏꯇꯦꯏ ,"
MerrymakingPleasing of the deities also known as Umang Lai Haraoba is a classical ritualistic theatrical dance and music festival annually celebrated by the Meitei people to please the Umang Lai deities of the traditional Meitei religion Sanamahism predominantly in the Indian state of Manipur,"ꯃꯦꯔꯤꯃꯦꯀꯤꯡ ꯎꯃꯥꯡ ꯂꯥꯏ ꯍꯥꯔꯣꯕꯥ ꯍꯥꯌꯅꯥ ꯈꯉꯅꯕꯥ ꯗꯦꯏꯇꯤꯁꯤꯡꯒꯤ ꯅꯨꯡꯉꯥꯏꯕꯥ ꯐꯣꯡꯗꯣꯀꯄꯥ ꯑꯁꯤ ꯃꯦꯏꯇꯦꯏ ꯃꯤꯌꯥꯝꯅꯥ ꯆꯍꯤ ꯈꯨꯗꯤꯡꯒꯤ ꯄꯥꯡꯊꯣꯀꯄꯥ ꯀ꯭ꯂꯥꯁꯤꯀꯦꯜ ꯔꯤꯇꯨꯌꯦꯂꯤꯁ꯭ꯇꯤꯛ ꯊꯤꯌꯦꯇꯔ ꯗꯥꯟꯁ ꯑꯃꯁꯨꯡ ꯃ꯭ꯌꯨꯖꯤꯛ ꯐꯦꯁ꯭ꯇꯤꯕꯦꯜ ꯑꯃꯅꯤ, ꯃꯁꯤꯅꯥ ꯚꯥꯔꯇꯀꯤ ꯃꯅꯤꯄꯨꯔꯗꯥ ꯃꯔꯨ ꯑꯣꯏꯅꯥ ꯇ꯭ꯔꯦꯗꯤꯁ꯭ꯅꯦꯜ ꯃꯦꯏꯇꯦꯏ ꯙꯔꯃꯒꯤ ꯎꯃꯥꯡ ꯂꯥꯏ ꯗꯦꯏꯇꯤꯁꯤꯡꯕꯨ ꯅꯨꯡꯉꯥꯏꯍꯅꯕꯥ ꯉꯃꯒꯅꯤ ꯁꯅꯥꯃꯥꯍꯤꯖꯝ"
It is a Meitei intangible cultural heritage,ꯃꯁꯤ ꯃꯦꯏꯇꯦ ꯏꯅꯇꯦꯟꯖꯤꯕꯜ ꯀꯂꯆꯔꯦꯜ ꯍꯦꯔꯤꯇꯦꯖ ꯑꯃꯅꯤ .
Outside Manipur Lai Haraoba is also celebrated in places where the Meitei people live such as Assam Tripura Bangladesh and Myanmar,ꯃꯅꯤꯄꯨꯔ ꯂꯥꯏ ꯍꯥꯔꯣꯕꯥꯒꯤ ꯃꯄꯥꯟꯗꯥ ꯃꯦꯏꯇꯦ ꯃꯤꯁꯤꯡꯅꯥ ꯂꯩꯔꯤꯕꯥ ꯃꯐꯃꯁꯤꯡꯗꯥ ꯑꯁꯥꯝ ꯇ꯭ꯔꯤꯄꯨꯔꯥ ꯕꯉ꯭ꯒꯂꯥꯗꯦꯁ ꯑꯃꯁꯨꯡ ꯃ꯭ꯌꯥꯅꯃꯥꯔꯒꯨꯝꯕꯥ ꯃꯐꯃꯁꯤꯡꯗꯥꯁꯨ ꯄꯥꯡꯊꯣꯀꯏ
Lai Haraoba under the name Meitei Lai Haraoba is recognised as one of the state holidays by the government of Tripura,ꯃꯦꯏꯇꯦꯏ ꯂꯥꯏ ꯍꯥꯔꯣꯕꯥ ꯍꯥꯌꯕꯥ ꯃꯤꯡꯊꯣꯜ ꯑꯁꯤꯒꯤ ꯃꯈꯥꯗꯥ ꯂꯥꯏ ꯍꯥꯔꯣꯕꯥ ꯑꯁꯤ ꯇ꯭ꯔꯤꯄꯨꯔꯥ ꯁꯔꯀꯥꯔꯅꯥ ꯔꯥꯖ꯭ꯌꯒꯤ ꯁꯨꯇꯤꯁꯤꯡꯒꯤ ꯃꯅꯨꯡꯗꯥ ꯑꯃꯅꯤ ꯍꯥꯌꯅꯥ ꯁꯀꯈꯉꯂꯦ
The government of Manipur puts effort in making Lai Haraoba to be recognised by the UNESCO as well as the Sangeet Natak Akademi SNA the highest academy of performing arts in India on the Representative List of the Intangible Cultural Heritage of Humanity,ꯃꯅꯤꯄꯨꯔ ꯁꯔꯀꯥꯔꯅꯥ ꯂꯥꯏ ꯍꯥꯔꯣꯕꯥꯕꯨ ꯌꯨꯅꯦꯁ꯭ꯀꯣꯅꯥ ꯁꯀꯈꯉꯅꯕꯥ ꯍꯣꯠꯅꯔꯤ ꯑꯃꯁꯨꯡ ꯁꯉ꯭ꯒꯤꯠ ꯅꯥꯇꯛ ꯑꯀꯥꯗꯦꯃꯤ ꯑꯦꯁ.ꯑꯦꯟ.ꯑꯦ.
Lai Haraoba along with the fusion of three other performing art forms Huiyen Lallong Meitei Nata Sankirtana and Raaslila gave rise to the Sangeet Natak Akademirecognised Indian classical dance form popularly known as the Manipuri dance,ꯂꯥꯏ ꯍꯥꯔꯣꯕꯥꯒꯥ ꯂꯣꯌꯅꯅꯥ ꯑꯇꯣꯞꯄꯥ ꯄꯔꯐꯣꯃꯤꯡ ꯑꯥꯔꯠ ꯐꯔꯝ ꯑꯍꯨꯃꯒꯤ ꯐ꯭ꯌꯨꯖꯟ ꯍꯨꯏꯌꯦꯟ ꯂꯥꯂꯣꯡ ꯃꯦꯏꯇꯦꯏ ꯅꯥꯇꯥ ꯁꯅꯀꯤꯔꯇꯥꯅꯥ ꯑꯃꯁꯨꯡ ꯔꯥꯁꯂꯤꯂꯥꯅꯥ ꯃꯤꯌꯥꯝꯅꯥ ꯄꯥꯝꯅꯕꯥ ꯃꯅꯤꯄꯨꯔꯤ ꯗꯥꯟꯁ ꯍꯥꯌꯅꯥ ꯈꯉꯅꯕꯥ ꯁꯉ꯭ꯒꯤꯠ ꯅꯥꯇꯥꯛ ꯑꯦꯀꯥꯗꯦꯃꯤꯔꯤꯀꯣꯒꯅꯤꯖ ꯏꯟꯗꯤꯌꯟ ꯀ꯭ꯂꯥꯁꯤꯀꯦꯜ ꯗꯥꯟꯁ ꯐꯔꯝ
Elangbam Nilakanta Singh translates Lai Haraoba as the merry making of the gods and goddesses and many others use this meaning,ꯏꯂꯥꯡꯕꯝ ꯅꯤꯂꯥꯀꯥꯟꯇꯥ ꯁꯤꯡꯍꯅꯥ ꯂꯥꯏ ꯍꯥꯔꯣꯕꯥꯕꯨ ꯏꯁ꯭ꯕꯔ ꯑꯃꯁꯨꯡ ꯏꯁ꯭ꯕꯔꯒꯤ ꯅꯨꯡꯉꯥꯏꯕꯥ ꯐꯣꯡꯗꯣꯀꯄꯥ ꯑꯣꯏꯅꯥ ꯍꯟꯗꯣꯀꯈꯤ ꯑꯃꯁꯨꯡ ꯑꯇꯣꯞꯄꯥ ꯀꯌꯥ ꯑꯃꯅꯥ ꯑꯔꯊ ꯑꯁꯤ ꯁꯤꯖꯤꯟꯅꯩ
Saroj Nalini Parratt and John Parratt translate it as pleasing of the gods based on J,ꯁꯔꯣꯖ ꯅꯥꯂꯤꯅꯤ ꯄꯥꯔꯔꯥꯠ ꯑꯃꯁꯨꯡ ꯖꯣꯟ ꯄꯥꯔꯔꯥꯇꯅꯥ ꯃꯁꯤꯕꯨ j ꯗꯥ ꯌꯨꯝꯐꯝ ꯑꯣꯏꯕꯥ ꯏꯁ꯭ꯕꯔꯁꯤꯡꯒꯤ ꯅꯨꯡꯉꯥꯏꯕꯥ ꯍꯥꯌꯅꯥ ꯍꯟꯗꯣꯀꯄꯤꯌꯨ꯫
Shakespeares 1913 translation but they make it plural because the festival honors more than one god,ꯁꯦꯛꯁꯄꯤꯌꯔꯁ ꯱꯹꯱꯳ ꯍꯟꯗꯣꯀꯄꯥ ꯑꯗꯨꯕꯨ ꯃꯈꯣꯌꯅꯥ ꯃꯁꯤꯕꯨ ꯄ꯭ꯂꯨꯔꯥꯜ ꯑꯣꯏꯍꯜꯂꯤ ꯃꯔꯃꯗꯤ ꯀꯨꯝꯃꯩ ꯑꯁꯤꯅꯥ ꯏꯁ꯭ꯕꯔ ꯑꯃꯗꯒꯤ ꯍꯦꯟꯅꯥ ꯏꯀꯥꯌ ꯈꯨꯝꯅꯩ
Practitioners of the ritual say that the name comes from the lai hoi laoba the cry of hoi in the Meitei creation myth which marks the moment the universe is revealed,ꯔꯤꯇꯨꯌꯦꯂꯒꯤ ꯄ꯭ꯔꯦꯛꯇꯤꯁꯅꯔꯁꯤꯡꯅꯥ ꯍꯥꯌꯔꯤ ꯃꯗꯨꯗꯤ ꯃꯤꯡ ꯑꯁꯤ ꯂꯥꯏ ꯍꯣꯏ ꯂꯥꯑꯣꯕꯥꯗꯒꯤ ꯂꯥꯀꯄꯅꯤ ꯃꯗꯨꯗꯤ ꯃꯦꯏꯇꯦ ꯀ꯭ꯔꯤꯌꯦꯁꯟ ꯃꯤꯊꯇꯥ ꯍꯣꯏꯒꯤ ꯀꯞꯄꯥ ꯑꯁꯤꯅꯥ ꯌꯨꯅꯤꯚꯔꯁ ꯑꯁꯤ ꯐꯣꯡꯗꯣꯀꯄꯥ ꯃꯤꯀꯨꯞ ꯑꯗꯨꯕꯨ ꯃꯥꯔꯛ ꯇꯧꯏ
This idea is given by Ng. Kulachandra the former head of the Manipur Pandit Loishang,ꯃꯁꯤꯒꯤ ꯋꯥꯈꯜꯂꯣꯟ ꯑꯁꯤ ꯑꯦꯟ.ꯖꯤ.
Lai Haraoba Meitei ꯂꯏ ꯍꯔꯎꯕ is a ritualistic festival of the Meiteis observed since ancient times,ꯂꯥꯏ ꯍꯥꯔꯥꯑꯣꯕꯥ ꯃꯦꯏꯇꯦꯏ ꯍꯧꯕꯥ ꯑꯁꯤ ꯑꯔꯤꯕꯥ ꯃꯇꯃꯗꯒꯤ ꯍꯧꯅꯥ ꯌꯦꯡꯈꯤꯕꯥ ꯃꯦꯏꯇꯦꯁꯀꯤ ꯔꯤꯇꯨꯌꯦꯂꯤꯁ꯭ꯇꯤꯛ ꯀꯨꯝꯃꯩ ꯑꯃꯅꯤ꯫
It is a ritual enactment of the creation myth,ꯃꯁꯤ ꯁꯦꯝꯕꯤꯕꯥ ꯃꯄꯨꯒꯤ ꯔꯤꯇꯨꯌꯦꯜ ꯑꯦꯛꯇ ꯑꯃꯅꯤ .
It mirrors the entire culture of Manipur and depicts the close affinities between the hill and plain people,ꯃꯁꯤꯅꯥ ꯃꯅꯤꯄꯨꯔꯒꯤ ꯀꯂꯆꯔ ꯄꯨꯝꯅꯃꯛ ꯃꯤꯔꯔ ꯇꯧꯏ ꯑꯃꯁꯨꯡ ꯍꯤꯜ ꯑꯃꯁꯨꯡ ꯄ꯭ꯂꯦꯟ ꯃꯤꯑꯣꯏꯁꯤꯡꯒꯤ ꯃꯔꯛꯇꯥ ꯂꯩꯔꯤꯕꯥ ꯅꯛꯅꯕꯥ ꯃꯔꯤꯁꯤꯡ ꯑꯗꯨ ꯎꯠꯂꯤ
It is a combination of religious recitations traditional music and dance traditional social values and ancient cultural aspects,ꯃꯁꯤ ꯙꯔꯝꯃꯒꯤ ꯑꯣꯏꯕꯥ ꯄꯥꯎꯇꯥꯀꯁꯤꯡꯒꯤ ꯃꯔꯛꯇꯥ ꯆꯠꯅꯕꯤꯒꯤ ꯑꯣꯏꯕꯥ ꯃ꯭ꯌꯨꯖꯤꯛ ꯑꯃꯁꯨꯡ ꯅꯥꯠꯀꯤ ꯑꯣꯏꯕꯥ ꯆꯠꯅꯕꯤꯒꯤ ꯑꯣꯏꯕꯥ ꯁꯣꯁꯤꯑꯦꯜ ꯚꯦꯜꯌꯨꯁꯤꯡ ꯑꯃꯁꯨꯡ ꯑꯔꯤꯕꯥ ꯀꯂꯆꯔꯦꯜ ꯑꯦꯁ꯭ꯄꯦꯛꯇꯁꯤꯡꯒꯤ ꯀꯝꯕꯤꯅꯦꯁꯟ ꯑꯃꯅꯤ꯫
The rituals within the festival are the same except in some items or hymns such as ikouba ikourol and yakairol at the beginning and mikon thagonba ngaprum tanba at the end of the festival,ꯀꯨꯝꯃꯩ ꯑꯁꯤꯒꯤ ꯃꯅꯨꯡꯗꯥ ꯂꯩꯕꯥ ꯔꯤꯇꯨꯌꯦꯂꯁꯤꯡ ꯑꯁꯤ ꯏꯀꯣꯕꯥ ꯏꯀꯣꯔꯣꯜ ꯑꯃꯁꯨꯡ ꯌꯥꯀꯥꯏꯔꯣꯂꯒꯨꯝꯕꯥ ꯄꯣꯠꯂꯝ ꯈꯔꯗꯥ ꯅꯠꯇꯅꯥ ꯑꯃꯁꯨꯡ ꯀꯨꯝꯃꯩ ꯑꯁꯤꯒꯤ ꯑꯔꯣꯏꯕꯗꯥ ꯃꯤꯀꯣꯟ ꯊꯥꯒꯣꯅꯕ ꯉꯥꯞꯔꯥꯝ ꯇꯥꯅꯕꯥ ꯑꯁꯤ ꯅꯠꯇꯅꯥ ꯑꯃꯒꯥ ꯑꯃꯒꯥ ꯃꯥꯟꯅꯩ꯫
In the performances the evolution story with the amorous loveaffairs of Nongpok Ninghthou and Panthoibi is depicted and played equally in all kinds of lai haraoba,ꯄꯔꯐꯣꯃꯦꯟꯁꯁꯤꯡꯗꯥ ꯅꯣꯡꯃꯩ ꯅꯤꯡꯍꯊꯣ ꯑꯃꯁꯨꯡ ꯄꯥꯟꯊꯣꯏꯕꯤꯒꯤ ꯑꯦꯃꯣꯔꯁ ꯂꯚꯐꯦꯌꯔꯁꯤꯡꯒꯥ ꯂꯣꯌꯅꯅꯥ ꯏꯚꯣꯂꯨꯁꯟ ꯋꯥꯔꯤ ꯑꯁꯤ ꯃꯈꯜ ꯈꯨꯗꯤꯡꯃꯛꯀꯤ ꯂꯥꯏ ꯍꯥꯔꯣꯕꯥꯗꯥ ꯆꯞ ꯃꯥꯟꯅꯅꯥ ꯎꯠꯂꯤ ꯑꯃꯁꯨꯡ ꯁꯥꯟꯅꯔꯤ
According to folklore the gods held the first Lai Haraoba  on the Koubru Hill so that their descendants would imitate them by performing the same rites,ꯐꯣꯜꯀꯂꯣꯔꯒꯤ ꯃꯇꯨꯡ ꯏꯟꯅꯥ ꯏꯁ꯭ꯕꯔꯁꯤꯡꯅꯥ ꯀꯧꯕ꯭ꯔꯨ ꯍꯤꯂꯗꯥ ꯑꯍꯥꯅꯕꯥ ꯂꯥꯏ ꯍꯥꯔꯣꯕꯥ ꯊꯃꯈꯤ ꯃꯗꯨꯅꯥ ꯃꯈꯣꯌꯒꯤ ꯇꯨꯡꯏꯅꯕꯁꯤꯡꯅꯥ ꯃꯈꯣꯌꯕꯨ ꯆꯞ ꯃꯥꯟꯅꯕꯥ ꯊꯧꯔꯃꯁꯤꯡ ꯑꯗꯨ ꯄꯥꯡꯊꯣꯛꯇꯨꯅꯥ ꯃꯈꯣꯌꯕꯨ ꯏꯃꯤꯇꯦꯠ ꯇꯧꯒꯅꯤ
Lai Haraoba takes place at local shrines dedicated to the Umang Lai deities which are important to the traditional Meitei religion,ꯂꯥꯏ ꯍꯥꯔꯥꯑꯣꯕꯥ ꯑꯁꯤ ꯃꯐꯝ ꯑꯗꯨꯒꯤ ꯂꯥꯏꯁꯉꯁꯤꯡꯗꯥ ꯄꯥꯡꯊꯣꯀꯏ ꯃꯗꯨꯗꯤ ꯃꯁꯤ ꯇ꯭ꯔꯦꯗꯤꯁ꯭ꯅꯦꯜ ꯃꯦꯏꯇꯦ ꯙꯔꯃꯒꯤꯗꯃꯛꯇꯥ ꯃꯔꯨ ꯑꯣꯏꯕꯥ ꯎꯃꯥꯡ ꯂꯥꯏ ꯗꯦꯕꯇꯥꯁꯤꯡꯗꯥ ꯀꯠꯊꯣꯛꯂꯤ
The festival doesnt have fixed dates but happens between February and May or June,ꯀꯨꯝꯃꯩ ꯑꯁꯤ ꯂꯦꯞꯄꯥ ꯂꯩꯇꯕꯥ ꯇꯥꯡꯁꯤꯡ ꯂꯩꯇꯦ ꯑꯗꯨꯕꯨ ꯐꯦꯕ꯭ꯔꯨꯋꯥꯔꯤ ꯑꯃꯁꯨꯡ ꯃꯦ ꯅꯠꯔꯒꯥ ꯖꯨꯟ ꯊꯥꯒꯤ ꯃꯔꯛꯇꯥ ꯊꯣꯀꯏ꯫
Each shrine chooses its own dates for the festival,ꯂꯥꯏꯁꯉ ꯈꯨꯗꯤꯡꯃꯛꯅꯥ ꯀꯨꯝꯃꯩꯒꯤꯗꯃꯛ ꯃꯁꯥꯒꯤ ꯑꯣꯏꯕꯥ ꯇꯥꯡꯁꯤꯡ ꯈꯅꯒꯠꯂꯤ .
The festival can last from three days to over a month depending on the shrine,ꯀꯨꯝꯃꯩ ꯑꯁꯤ ꯂꯥꯏꯁꯉꯒꯤ ꯃꯇꯨꯡ ꯏꯟꯅꯥ ꯅꯨꯃꯤꯠ ꯍꯨꯝꯅꯤꯗꯒꯤ ꯊꯥ ꯑꯃꯒꯤ ꯃꯊꯛꯇꯥ ꯆꯠꯄꯥ ꯌꯥꯏ .
The dates and length of the festival can be different for each shrine,ꯀꯨꯝꯃꯩ ꯑꯁꯤꯒꯤ ꯇꯥꯡ ꯑꯃꯁꯨꯡ ꯂꯝꯕꯤ ꯑꯁꯤ ꯂꯥꯏꯁꯉ ꯈꯨꯗꯤꯡꯃꯛꯀꯤ ꯑꯣꯏꯅꯥ ꯇꯣꯉꯥꯅꯕꯥ ꯑꯣꯏꯕꯥ ꯌꯥꯏ .
The Lai Haraoba is also called the Umang Lai Haraoba named after the Umang Lai deities honored during the festival,ꯂꯥꯏ ꯍꯥꯔꯥꯑꯣꯕꯥ ꯑꯁꯤ ꯀꯨꯝꯃꯩ ꯑꯁꯤꯒꯤ ꯃꯅꯨꯡꯗꯥ ꯏꯀꯥꯌꯈꯨꯝꯅꯕꯥ ꯎꯠꯄꯥ ꯎꯃꯥꯡ ꯂꯥꯏ ꯗꯦꯕꯇꯥꯁꯤꯡꯒꯤ ꯃꯃꯤꯡ ꯊꯣꯅꯕꯥ ꯎꯃꯥꯡ ꯂꯥꯏ ꯍꯥꯔꯣꯕꯥ ꯍꯥꯌꯅꯥꯁꯨ ꯀꯧꯏ
These deities are seen as protectors of the areas where the shrines are located,ꯍꯥꯌꯔꯤꯕꯥ ꯗꯦꯕꯇꯥꯁꯤꯡ ꯑꯁꯤ ꯂꯥꯏꯁꯉꯁꯤꯡ ꯂꯩꯕꯥ ꯃꯐꯃꯁꯤꯡꯒꯤ ꯄ꯭ꯔꯣꯇꯦꯛꯇꯔ ꯑꯣꯏꯅꯥ ꯎꯕꯥ ꯐꯪꯏ .
The festival takes place at these shrines and the whole community helps with the preparations,ꯀꯨꯝꯃꯩ ꯑꯁꯤ ꯂꯥꯏꯁꯉꯁꯤꯡ ꯑꯁꯤꯗꯥ ꯄꯥꯡꯊꯣꯀꯏ ꯑꯃꯁꯨꯡ ꯈꯨꯟꯅꯥꯏ ꯄꯨꯝꯕꯅꯥ ꯁꯦꯝ ꯁꯥꯕꯗꯥ ꯃꯇꯦꯡ ꯄꯥꯡꯏ .
The Umang Lai group includes over 300 deities such as ancestors legendary forefathers and other important gods in the traditional Meitei religion Sanamahism,"ꯎꯃꯥꯡ ꯂꯥꯏꯒꯤ ꯀꯥꯡꯂꯨꯞ ꯑꯁꯤꯗꯥ ꯏꯄꯥ-ꯏꯄꯨꯁꯤꯡ ꯂꯤꯖꯦꯟꯗꯥꯔꯤ ꯐꯣꯔꯦꯐꯥꯔꯁꯤꯡ ꯑꯃꯁꯨꯡ ꯑꯇꯣꯞꯄꯥ ꯃꯔꯨꯑꯣꯏꯕꯥ ꯏꯁ꯭ꯕꯔꯁꯤꯡꯒꯨꯝꯕꯥ ꯗꯦꯕꯇꯥ ꯳꯰꯰ ꯍꯦꯟꯅꯥ ꯌꯥꯑꯣꯔꯤ, ꯃꯁꯤꯗꯥ ꯇ꯭ꯔꯦꯗꯤꯁꯅꯦꯜ ꯃꯦꯏꯇꯦ ꯙꯔꯝ ꯁꯅꯥꯃꯥꯍꯤꯖꯝ"
The rituals of Lai Haraoba honor a male and a female deity called Lainingthou and LairembiLairemma,ꯂꯥꯏ ꯍꯥꯔꯥꯑꯣꯕꯥꯒꯤ ꯊꯧꯔꯃꯁꯤꯡ ꯑꯁꯤꯅꯥ ꯅꯨꯄꯥ ꯑꯃꯁꯨꯡ ꯅꯨꯄꯤ ꯗꯦꯕꯇꯥ ꯑꯃꯕꯨ ꯂꯥꯏꯅꯤꯡꯊꯧ ꯑꯃꯁꯨꯡ ꯂꯥꯏꯔꯦꯝꯕꯤꯂꯥꯏꯝ ꯍꯥꯌꯅꯥ ꯀꯧꯏ꯫
The rituals focus on creation,ꯔꯤꯇꯨꯌꯦꯂꯁꯤꯡ ꯑꯁꯤꯅꯥ ꯁꯦꯝꯕꯤꯕꯥ ꯃꯄꯨꯗꯥ ꯃꯤꯠꯌꯦꯡ ꯊꯝꯂꯤ .
The Meitei people believe that the supreme god created the cosmos,ꯃꯦꯏꯇꯦ ꯃꯤꯌꯥꯝꯅꯥ ꯊꯥꯖꯩ ꯃꯗꯨꯗꯤ ꯁꯨꯞꯔꯤꯝ ꯏꯁ꯭ꯕꯔꯅꯥ ꯀꯣꯁ꯭ꯃꯣꯁ ꯁꯦꯃꯈꯤ ꯫
He is called Tengbanba Mapu or Taibangpanba Mapu or Atiya Sidaba,ꯃꯍꯥꯀꯄꯨ ꯇꯦꯡꯕꯥꯅꯕꯥ ꯃꯥꯄꯨ ꯅꯠꯔꯒꯥ ꯇꯥꯏꯕꯪꯄꯥꯅꯕ ꯃꯥꯄꯨ ꯅꯠꯔꯒꯥ ꯑꯥꯇꯤꯌꯥ ꯁꯤꯗꯥꯕꯥ ꯍꯥꯌꯅꯥ ꯀꯧꯏ꯫
Some creation stories start with these gods while others go back to Atingkok and Amamba,ꯁ꯭ꯔ꯭ꯏꯁ꯭ꯇꯤꯒꯤ ꯋꯥꯔꯤ ꯈꯔꯗꯤ ꯏꯁ꯭ꯕꯔꯁꯤꯡ ꯑꯁꯤꯗꯒꯤ ꯍꯧꯔꯀꯏ ꯑꯗꯨꯒꯥ ꯑꯇꯩ ꯈꯔꯅꯥ ꯑꯦꯇꯤꯡꯀꯣꯛ ꯑꯃꯁꯨꯡ ꯑꯃꯝꯕꯥꯗꯥ ꯍꯜꯂꯀꯏ
Amamba is the dark place where life begins,ꯑꯃꯝꯕꯥ ꯑꯁꯤ ꯄꯨꯟꯁꯤ ꯍꯧꯔꯀꯄꯥ ꯑꯃꯝꯕꯥ ꯃꯐꯝꯅꯤ .
Four types of Lai Haraoba are prevalent in the Meitei society namely Kanglei Haraoba Moirang Haraoba Kakching Haraoba and Chakpa Haraoba,ꯂꯥꯏ ꯍꯥꯔꯥꯑꯣꯕꯥ ꯃꯈꯜ ꯃꯔꯤ ꯑꯁꯤ ꯃꯦꯏꯇꯦ ꯁꯣꯁꯥꯏꯇꯤ ꯍꯥꯌꯕꯗꯤ ꯀꯥꯡꯂꯦꯏ ꯍꯔꯥꯑꯣꯕꯥ ꯃꯣꯏꯔꯥꯡ ꯍꯔꯥꯑꯣꯕꯥ ꯀꯥꯛꯆꯤꯡ ꯍꯥꯔꯥꯑꯣꯕꯥ ꯑꯃꯁꯨꯡ ꯆꯛꯄꯥ ꯍꯔꯥꯑꯣꯕꯥ
Kanglei Haraoba is performed mainly in Imphal and the nearby towns,ꯀꯥꯡꯂꯦꯏ ꯍꯥꯔꯣꯕꯥ ꯑꯁꯤ ꯃꯔꯨꯑꯣꯏꯅꯥ ꯏꯝꯐꯥꯜ ꯑꯃꯁꯨꯡ ꯃꯅꯥꯛ ꯅꯀꯄꯥ ꯁꯍꯔꯁꯤꯡꯗꯥ ꯄꯥꯡꯊꯣꯀꯏ
Moirang Haraoba is only in Moirang Kakching Haraoba is held in Kakching and Chakpa Haraoba is celebrated at Andro Phayeng Sekmai Koutruk Khuukhul Leimaram and Tairenpokpi,ꯃꯣꯏꯔꯥꯡ ꯍꯥꯔꯥꯑꯣꯕꯥ ꯑꯁꯤ ꯃꯣꯏꯔꯥꯡꯗꯥ ꯈꯛꯇꯃꯛ ꯂꯩꯔꯤ ꯀꯥꯛꯆꯤꯡ ꯍꯥꯔꯣꯕꯥ ꯑꯁꯤ ꯀꯥꯛꯆꯤꯡꯗꯥ ꯄꯥꯡꯊꯣꯀꯏ ꯑꯃꯁꯨꯡ ꯆꯛꯄꯥ ꯍꯔꯥꯑꯣꯕꯥ ꯑꯁꯤ ꯑꯦꯟꯗ꯭ꯔꯣ ꯐꯥꯌꯦꯡ ꯁꯦꯀꯃꯥꯏ ꯀꯧꯠꯔꯨꯛ ꯈꯨꯎꯀꯨꯜ ꯂꯦꯏꯃꯥꯔꯥꯝ ꯑꯃꯁꯨꯡ ꯇꯥꯏꯔꯦꯅꯄꯣꯛꯄꯤꯗꯥ ꯄꯥꯡꯊꯣꯀꯏ
One type of Lai Haraoba is Kanglei Haraoba celebrated in and around Imphal,ꯂꯥꯏ ꯍꯥꯔꯥꯑꯣꯕꯥ ꯃꯈꯜ ꯑꯃꯅꯥ ꯏꯝꯐꯥꯜ ꯑꯃꯁꯨꯡ ꯃꯁꯤꯒꯤ ꯑꯀꯣꯌꯕꯗꯥ ꯂꯩꯕꯥ ꯀꯥꯡꯂꯦꯏ ꯍꯥꯔꯥꯑꯣꯕꯥ ꯑꯁꯤ .
The name Kanglei comes from Kangla which is in the center of Imphal,ꯀꯥꯡꯂꯦꯏ ꯍꯥꯌꯕꯥ ꯃꯤꯡ ꯑꯁꯤ ꯏꯝꯐꯥꯂꯒꯤ ꯃꯅꯨꯡꯗꯥ ꯂꯩꯕꯥ ꯀꯥꯡꯂꯥꯗꯒꯤ ꯂꯥꯀꯄꯅꯤ .
The main deity worshipped is Pakhangba,ꯂꯥꯏ ꯈꯨꯔꯨꯝꯕꯥ ꯃꯔꯨꯑꯣꯏꯕꯥ ꯗꯦꯕꯇꯥ ꯑꯁꯤ ꯄꯥꯈꯥꯡꯕꯥꯅꯤ ꯫
A special part of this festival is when Khoriphaba a deity looks for a bride,ꯀꯨꯝꯃꯩ ꯑꯁꯤꯒꯤ ꯑꯈꯟꯅꯕꯥ ꯁꯔꯨꯛ ꯑꯃꯗꯤ ꯈꯣꯔꯤꯐꯥꯕꯥ ꯑꯦ ꯗꯦꯏꯇꯤꯅꯥ ꯅꯨꯄꯤꯃꯆꯥ ꯑꯃꯥ ꯊꯤꯕꯥ ꯃꯇꯃꯗꯥ ꯑꯣꯏꯒꯅꯤ
A maibi spirit medium calls on Khoriphabas spirit to choose the bride,ꯃꯥꯏꯕꯤ ꯁ꯭ꯄꯤꯔꯤꯠ ꯃꯤꯗꯤꯌꯝ ꯑꯃꯅꯥ ꯈꯣꯔꯤꯐꯥꯕꯥꯁ ꯁ꯭ꯄꯤꯔꯤꯠꯇꯥ ꯅꯨꯄꯤꯃꯆꯥ ꯑꯁꯤ ꯈꯅꯕꯒꯤ ꯃꯇꯥꯡꯗꯥ ꯀꯧꯔꯤ
The festival ends with the nongarol which shows the rise of the divine presence,ꯀꯨꯝꯃꯩ ꯑꯁꯤ ꯗꯤꯚꯥꯏꯟ ꯄ꯭ꯔꯦꯖꯦꯟꯁꯀꯤ ꯋꯥꯡꯈꯠꯂꯀꯄꯥ ꯑꯗꯨ ꯎꯠꯂꯤꯕꯥ ꯅꯟ-ꯒꯥꯔꯣꯂꯒꯥ ꯂꯣꯌꯅꯅꯥ ꯂꯣꯏꯁꯤꯜꯂꯤ꯫
Moirang Haraoba is celebrated in and around the Moirang region in the southern part of the Imphal valley,ꯃꯣꯏꯔꯥꯡ ꯍꯔꯥꯑꯣꯕꯥ ꯑꯁꯤ ꯏꯝꯐꯥꯜ ꯂꯃꯗꯃꯒꯤ ꯈꯥ ꯊꯪꯕꯥ ꯁꯔꯨꯛꯇꯥ ꯂꯩꯕꯥ ꯃꯣꯏꯔꯥꯡ ꯂꯃꯗꯃꯗꯥ ꯑꯃꯁꯨꯡ ꯃꯁꯤꯒꯤ ꯑꯀꯣꯌꯕꯗꯥ ꯄꯥꯡꯊꯣꯀꯏ
The main deity worshipped is Thangching Thangjing,ꯂꯥꯏ ꯈꯨꯔꯨꯝꯕꯥ ꯃꯔꯨꯑꯣꯏꯕꯥ ꯗꯦꯕꯇꯥ ꯑꯁꯤ ꯊꯥꯡꯆꯤꯡꯕꯥ ꯊ꯭ꯌꯥꯡꯖꯤꯡꯅꯤ꯫
In this version along with langthrei leaves a common offering in the Kanglei version leisang another evergreen plant is also offered,ꯃꯁꯤꯒꯤ ꯚꯔꯖꯟ ꯑꯁꯤꯗꯥ ꯂꯪꯊ꯭ꯔꯦꯏꯒꯥ ꯂꯣꯌꯅꯅꯥ ꯀꯥꯡꯂꯦꯏ ꯚꯔꯖꯟ ꯂꯦꯏꯁꯥꯡꯗꯥ ꯀꯃꯟ ꯑꯣꯏꯕꯥ ꯑꯣꯐꯔ ꯑꯃꯥ ꯊꯝꯂꯤ ꯑꯇꯣꯞꯄꯥ ꯑꯦꯚꯥꯔꯒ꯭ꯔꯤꯟ ꯄ꯭ꯂꯥꯟꯇ ꯑꯃꯁꯨ ꯄꯤꯔꯤ
A special part of this festival is the Khamba Thoibi classical dance,ꯀꯨꯝꯃꯩ ꯑꯁꯤꯒꯤ ꯑꯈꯟꯅꯕꯥ ꯁꯔꯨꯛ ꯑꯃꯥ ꯑꯣꯏꯅꯥ ꯈꯥꯝꯕꯥ ꯊꯣꯏꯕꯤ ꯀ꯭ꯂꯥꯁꯤꯀꯦꯜ ꯗꯥꯟꯁ
The festival ends with tengtharol a song of lamentation which marks the rise of the deities,ꯀꯨꯝꯃꯩ ꯑꯁꯤ ꯇꯦꯡꯊꯥꯔꯣꯂꯒꯥ ꯂꯣꯌꯅꯅꯥ ꯂꯣꯏꯁꯤꯅꯈꯤꯕꯥ ꯂꯦꯃꯦꯟꯇꯦꯁꯅꯒꯤ ꯏꯁꯩ ꯑꯃꯥ ꯑꯣꯏꯈꯤ ꯃꯗꯨꯅꯥ ꯗꯦꯕꯇꯥꯁꯤꯡꯒꯤ ꯋꯥꯡꯈꯠꯂꯀꯄꯥ ꯑꯗꯨ ꯐꯣꯡꯗꯣꯛꯂꯤ꯫
Chakpa Haraoba is not a separate type of the festival but a group of versions celebrated by Chakpa groups in different villages,ꯆꯛꯄꯥ ꯍꯔꯥꯑꯣꯕꯥ ꯑꯁꯤ ꯀꯨꯝꯃꯩ ꯑꯁꯤꯒꯤ ꯇꯣꯉꯥꯅꯕꯥ ꯃꯈꯂꯒꯤ ꯅꯠꯇꯦ ꯑꯗꯨꯕꯨ ꯇꯣꯉꯥꯟ ꯇꯣꯉꯥꯅꯕꯥ ꯈꯨꯉ꯭ꯒꯪꯁꯤꯡꯗꯥ ꯆꯛꯄꯥ ꯂꯨꯄꯁꯤꯡꯅꯥ ꯄꯥꯡꯊꯣꯀꯄꯥ ꯚꯔꯖꯅꯁꯤꯡꯒꯤ ꯀꯥꯡꯂꯨꯞ ꯑꯃꯅꯤ
The hand movements are simpler and the structure is less complex,ꯈꯨꯠꯅꯥ ꯆꯠꯄꯥ ꯑꯁꯤ ꯍꯦꯟꯅꯥ ꯂꯥꯏ ꯑꯃꯁꯨꯡ ꯁ꯭ꯠꯔꯀꯆꯔ ꯑꯁꯤ ꯍꯦꯟꯅꯥ ꯀꯝꯞꯂꯦꯛꯁ ꯑꯣꯏꯗꯦ .
It includes sacrificial practices,ꯃꯁꯤꯗꯥ ꯀꯠꯊꯣꯀꯄꯒꯤ ꯊꯧꯑꯣꯡꯁꯤꯡ ꯌꯥꯑꯣꯔꯤ ꯫
The main versions are from Andro Imphal East and Phayeng villages,ꯃꯔꯨꯑꯣꯏꯕꯥ ꯚꯔꯖꯅꯁꯤꯡ ꯑꯁꯤ ꯑꯦꯟꯗ꯭ꯔꯣ ꯏꯝꯐꯥꯜ ꯏꯁ꯭ꯠ ꯑꯃꯁꯨꯡ ꯐꯥꯌꯦꯡ ꯈꯨꯉ꯭ꯒꯪꯁꯤꯡꯗꯒꯤꯅꯤ
In Andro a special ritual called Numit Kappa shooting of the sun is performed which is unique to them,ꯑꯦꯟꯗ꯭ꯔꯣꯗꯥ ꯅꯨꯃꯤꯠ ꯀꯥꯞꯄꯥ ꯁꯨꯇꯤꯡ ꯑꯣꯐ ꯗ ꯁꯟ ꯀꯧꯕꯥ ꯑꯈꯟꯅꯕꯥ ꯊꯧꯔꯝ ꯑꯃꯥ ꯄꯥꯡꯊꯣꯀꯏ ꯃꯗꯨ ꯃꯈꯣꯌꯗꯥ ꯑꯈꯟꯅꯕꯥ ꯑꯣꯏꯔꯤ
The Phayeng tradition has special rituals like Lai Phagi Tounaba which are not done in other places,ꯐꯥꯌꯦꯡ ꯇ꯭ꯔꯦꯗꯤꯁꯟ ꯑꯁꯤꯗꯥ ꯑꯇꯣꯞꯄꯥ ꯃꯐꯃꯁꯤꯡꯗꯥ ꯇꯧꯗꯕꯥ ꯂꯥꯏ ꯐꯥꯒꯤ ꯇꯨꯎꯅꯥꯕꯥꯒꯨꯝꯕꯥ ꯑꯈꯟꯅꯕꯥ ꯊꯧꯔꯃꯁꯤꯡ ꯂꯩꯔꯤ
Kakching Haraoba is celebrated in the Kakching region east of Imphal,ꯀꯥꯛꯆꯤꯡ ꯍꯥꯔꯣꯕꯥ ꯑꯁꯤ ꯏꯝꯐꯥꯂꯒꯤ ꯅꯣꯡꯄꯣꯛ ꯊꯪꯕꯥ ꯁꯔꯨꯛꯇꯥ ꯂꯩꯕꯥ ꯀꯥꯛꯆꯤꯡꯕꯥ ꯂꯃꯗꯃꯗꯥ ꯄꯥꯡꯊꯣꯀꯏ꯫
A special part of the festival is the Ngaprum Tanba ritual hunting of eel on the last day,ꯀꯨꯝꯃꯩ ꯑꯁꯤꯒꯤ ꯑꯈꯟꯅꯕꯥ ꯁꯔꯨꯛ ꯑꯃꯥ ꯑꯣꯏꯔꯤꯕꯥ ꯑꯁꯤ ꯑꯔꯣꯏꯕꯥ ꯅꯨꯃꯤꯠꯇꯥ ꯏꯂꯒꯤ ꯉꯥꯞꯔꯥꯝ ꯇꯥꯅꯕꯥ ꯔꯤꯇꯨꯌꯦꯜ ꯍꯟꯇꯤꯡ ꯑꯁꯤꯅꯤ
