en,mni-Mtei
"relations, unconditioned. For pure reason leaves to the understanding","ꯃꯔꯤꯁꯤꯡ, ꯀꯟꯗꯤꯁꯟ ꯂꯩꯇꯕꯥ꯫"
everything that immediately relates to the object of intuition or rather to,ꯈꯨꯗꯛꯇꯥ ꯏꯟꯠꯌꯨꯏꯇꯤꯖꯒꯤ ꯑꯣꯕꯖꯦꯛꯇꯀꯥ ꯃꯔꯤ ꯂꯩꯅꯕꯥ ꯅꯠꯔꯒꯥ ꯃꯗꯨꯒꯤ ꯃꯍꯨꯠꯇꯥ .
their synthesis in imagination. The former restricts itself to the absolute,ꯃꯈꯣꯌꯒꯤ ꯁꯤꯟꯊꯦꯁꯤꯁ ꯑꯁꯤ ꯏꯃꯦꯖꯤꯅꯦꯁꯟꯗꯥ ꯂꯩ꯫
totality in the employment of the conceptions of the understanding and aims,ꯂꯧꯁꯤꯡ ꯑꯃꯁꯨꯡ ꯄꯥꯟꯗꯃꯁꯤꯡꯒꯤ ꯋꯥꯈꯜꯂꯣꯅꯁꯤꯡꯒꯤ ꯊꯕꯛ ꯄꯤꯕꯗꯥ ꯇꯣꯇꯦꯂꯤꯇꯤ
"at carrying out the synthetical unity which is cogitated in the category, even","ꯀꯦꯇꯦꯒꯣꯔꯤꯗꯥ ꯀꯣꯖꯤꯇꯦꯠ ꯇꯧꯔꯤꯕꯥ ꯁꯤꯟꯊꯦꯇꯤꯀꯜ ꯌꯨꯅꯤꯇꯤ ꯑꯁꯤ ꯄꯥꯡꯊꯣꯀꯄꯗꯥ, ꯐꯥꯑꯣꯕꯥ"
to the unconditioned. This unity may hence be called the rational unity of,ꯀꯟꯗꯤꯁꯟ ꯂꯩꯇꯕꯥ ꯃꯤꯑꯣꯏꯁꯤꯡꯗꯥ꯫
"phenomena, as the other, which the category expresses, may be termed the","ꯐꯦꯅꯣꯃꯦꯅꯥ, ꯑꯇꯣꯞꯄꯥ ꯑꯃꯅꯥ, ꯀꯦꯇꯦꯒꯣꯔꯤ ꯑꯁꯤꯅꯥ ꯐꯣꯡꯗꯣꯛꯂꯤꯕꯥ ꯑꯁꯤ, ꯍꯥꯌꯔꯤꯕꯥ ꯑꯁꯤ ."
"unity of the understanding. Reason, therefore, has an immediate relation to",ꯂꯧꯁꯤꯡꯒꯤ ꯑꯄꯨꯅꯕꯥ꯫
"the use of the understanding, not indeed in so far as the latter contains the","ꯂꯧꯁꯤꯡ ꯑꯁꯤ ꯁꯤꯖꯤꯟꯅꯕꯅꯥ, ꯇꯁꯦꯡꯅꯥ ꯍꯥꯌꯔꯕꯗꯥ ꯇꯨꯡꯗꯥ ꯂꯥꯀꯄꯥ ꯐꯥꯑꯣꯕꯗꯥ ꯅꯠꯇꯦ, ."
ground of possible experience (for the conception of the absolute totality of,ꯑꯣꯏꯊꯣꯀꯄꯥ ꯌꯥꯕꯥ ꯑꯦꯛꯁꯄꯔꯤꯑꯦꯟꯁꯀꯤ ꯒ꯭ꯔꯥꯎꯟꯗ (ꯃꯌꯥꯃꯒꯤ ꯑꯣꯏꯅꯥ ꯑꯦꯕꯁꯣꯜꯌꯨꯠ ꯇꯣꯇꯦꯂꯤꯇꯤꯒꯤ ꯀꯟꯁꯦꯄꯁꯅꯒꯤꯗꯃꯛꯇꯥ .
"conditions is not a conception that can be employed in experience, because","ꯀꯟꯗꯤꯁꯅꯁꯤꯡ ꯑꯁꯤ ꯑꯦꯛꯁꯄꯔꯤꯌꯦꯟꯁꯇꯥ ꯁꯤꯖꯤꯟꯅꯕꯥ ꯌꯥꯕꯥ ꯀꯟꯁꯦꯄꯁꯟ ꯑꯃꯅꯤ, ꯃꯔꯃꯗꯤ"
"no experience is unconditioned), but solely for the purpose of directing it to","ꯑꯦꯛꯁꯄꯔꯤꯑꯦꯟꯁ ꯑꯃꯠꯇꯥ ꯀꯟꯗꯤꯁꯟ ꯑꯃꯠꯇꯥ ꯂꯩꯇꯦ), ꯑꯗꯨꯕꯨ ꯃꯗꯨꯕꯨ 1000 ꯗꯥ ꯂꯃꯖꯤꯡꯕꯒꯤ ꯄꯥꯟꯗꯝ ꯑꯗꯨꯈꯛꯇꯒꯤꯗꯃꯛ꯫"
"a certain unity, of which the understanding has no conception, and the aim","ꯑꯀꯛꯅꯕꯥ ꯑꯄꯨꯅꯕꯥ ꯑꯃꯥ, ꯃꯗꯨꯒꯤ ꯃꯇꯥꯡꯗꯥ ꯂꯧꯁꯤꯡꯒꯤ ꯋꯥꯈꯜꯂꯣꯟ ꯂꯩꯇꯦ, ꯑꯃꯁꯨꯡ ꯄꯥꯟꯗꯝ ꯑꯗꯨ"
of which is to collect into an absolute whole all acts of the understanding,ꯃꯁꯤꯒꯤ ꯃꯅꯨꯡꯗꯥ ꯑꯦꯕꯁꯣꯜꯌꯨꯇꯦꯗ ꯍꯣꯜ ꯑꯃꯗꯥ ꯈꯣꯃꯖꯤꯟꯗꯨꯅꯥ ꯂꯧꯁꯤꯡꯒꯤ ꯊꯕꯛ ꯈꯨꯗꯤꯡꯃꯛ .
Hence the objective employment of the pure conceptions of reason is,ꯃꯔꯝ ꯑꯁꯤꯅꯥ ꯃꯔꯃꯒꯤ ꯑꯁꯦꯡꯕꯥ ꯋꯥꯈꯜꯂꯣꯅꯁꯤꯡꯒꯤ ꯑꯣꯕꯖꯦꯛꯇꯤꯕ ꯏꯃꯞꯂꯣꯏꯃꯦꯟꯇ ꯑꯁꯤ .
"always transcendent, while that of the pure conceptions of the","ꯃꯇꯝ ꯄꯨꯝꯅꯃꯛꯇꯥ ꯇ꯭ꯔꯥꯟꯁꯦꯟꯗꯦꯟꯇ ꯑꯣꯏꯕꯥ, ꯑꯗꯨꯒꯥ ꯃꯗꯨꯒꯤ ꯄ꯭ꯌꯨꯔ ꯀꯟꯁꯦꯄꯁꯅꯁꯤꯡ ꯑꯗꯨ ."
"understanding must, according to their nature, be always immanent,","ꯂꯧꯁꯤꯅꯕꯥ ꯑꯁꯤ ꯃꯈꯣꯌꯒꯤ ꯃꯍꯧꯁꯥꯒꯤ ꯃꯇꯨꯡ ꯏꯟꯅꯥ ꯃꯇꯝ ꯄꯨꯝꯅꯃꯛꯇꯥ ꯏꯃꯥꯅꯟꯇ ꯑꯣꯏꯒꯗꯕꯅꯤ,"
inasmuch as they are limited to possible experience,ꯃꯈꯣꯌ ꯑꯁꯤ ꯑꯣꯏꯊꯣꯀꯄꯥ ꯌꯥꯕꯥ ꯑꯦꯛꯁꯄꯔꯤꯌꯦꯟꯁꯇꯥ ꯂꯤꯃꯤꯇꯦꯗ ꯑꯣꯏꯕꯅꯥ ꯃꯔꯝ ꯑꯣꯏꯗꯨꯅꯥ .
"I understand by idea a necessary conception of reason, to which no","ꯑꯩꯍꯥꯛꯅꯥ ꯑꯥꯏꯗꯤꯌꯥꯒꯤ ꯃꯇꯨꯡ ꯏꯟꯅꯥ ꯃꯊꯧ ꯇꯥꯕꯥ ꯀꯟꯁꯦꯄꯁꯟ ꯑꯃꯥ ꯈꯉꯏ, ꯃꯗꯨꯗꯥ ꯑꯦꯟ.ꯑꯣ."
"corresponding object can be discovered in the world of sense. Accordingly,",ꯃꯔꯤ ꯂꯩꯅꯕꯥ ꯄꯣꯠꯁꯛ ꯑꯁꯤ ꯁꯦꯟꯁꯀꯤ ꯃꯥꯂꯦꯃꯗꯥ ꯈꯉꯕꯥ ꯉꯃꯒꯅꯤ꯫
the pure conceptions of reason at present under consideration are,ꯍꯧꯖꯤꯛ ꯈꯟꯅꯔꯤꯕꯥ ꯑꯁꯤꯒꯤ ꯃꯅꯨꯡꯗꯥ ꯍꯧꯖꯤꯛ ꯂꯩꯔꯤꯕꯥ ꯃꯔꯃꯒꯤ ꯄ꯭ꯌꯨꯔ ꯀꯟꯁꯦꯄꯁꯅꯁꯤꯡ ꯑꯁꯤ [...]
"transcendental ideas. They are conceptions of pure reason, for they regard",ꯇ꯭ꯔꯥꯟꯁꯦꯟꯗꯦꯟꯇꯜ ꯑꯥꯏꯗꯤꯌꯥꯁꯤꯡ꯫
all empirical cognition as determined by means of an absolute totality of,ꯑꯦꯕꯁꯣꯜꯌꯨꯇꯦꯗ ꯇꯣꯇꯦꯂꯤꯇꯤ ꯑꯃꯒꯤ ꯈꯨꯠꯊꯥꯡꯗꯥ ꯂꯦꯄꯊꯣꯀꯄꯥ ꯃꯇꯨꯡ ꯏꯟꯅꯥ ꯑꯦꯝꯄꯤꯔꯤꯀꯦꯜ ꯀꯣꯒꯅꯤꯁꯟ ꯄꯨꯝꯅꯃꯛ
"conditions. They are not mere fictions, but natural and necessary products",ꯍꯤꯔꯝꯁꯤꯡ.
"of reason, and have hence a necessary relation to the whole sphere of the","ꯃꯔꯝ ꯑꯁꯤꯅꯥ, ꯑꯃꯁꯨꯡ ꯃꯔꯝ ꯑꯁꯤꯅꯥ ."
"exercise of the understanding. And, finally, they are transcendent, and",ꯂꯧꯁꯤꯡꯒꯤ ꯑꯦꯛꯁꯔꯁꯥꯏꯖ ꯇꯧꯕꯥ꯫
"overstep the limits of all experiences, in which, consequently, no object can","ꯑꯦꯛꯁꯄꯔꯤꯑꯦꯟꯁ ꯄꯨꯝꯅꯃꯛꯀꯤ ꯂꯤꯃꯤꯠꯁꯤꯡ ꯑꯗꯨ ꯑꯣꯚꯔꯁ꯭ꯇꯦꯞ ꯇꯧꯕꯥ, ꯃꯗꯨꯗꯥ, ꯃꯗꯨꯒꯤ ꯃꯍꯩ ꯑꯣꯏꯅꯥ, ꯄꯣꯠꯁꯛ ꯑꯃꯠꯇꯥ ꯌꯥꯑꯣꯕꯥ ꯌꯥꯔꯣꯏ ."
ever be presented that would be perfectly adequate to a transcendental idea,ꯇ꯭ꯔꯥꯟꯁꯦꯟꯗꯦꯟꯇ ꯑꯣꯏꯕꯥ ꯋꯥꯈꯜꯂꯣꯟ ꯑꯃꯗꯥ ꯃꯄꯨꯡ ꯐꯥꯅꯥ ꯃꯇꯤꯛ ꯆꯥꯕꯥ ꯑꯣꯏꯒꯗꯕꯥ ꯃꯇꯝ ꯄꯨꯝꯅꯃꯛꯇꯥ ꯄ꯭ꯔꯦꯖꯦꯟꯇ ꯇꯧꯕꯥ
"When we use the word idea, we say, as regards its object (an object of the","ꯑꯩꯈꯣꯌꯅꯥ ꯋꯥꯈꯜꯂꯣꯟ ꯑꯁꯤ ꯁꯤꯖꯤꯟꯅꯔꯀꯄꯥ ꯃꯇꯃꯗꯥ, ꯑꯩꯈꯣꯌꯅꯥ ꯍꯥꯌꯔꯤ, ꯃꯁꯤꯒꯤ ꯄꯣꯠꯁꯛ ꯑꯁꯤꯒꯤ ꯃꯇꯥꯡꯗꯥ (ꯑꯃꯁꯨꯡꯒꯤ ꯄꯣꯠꯁꯛ ꯑꯃꯅꯤ)꯫"
"pure understanding), a great deal, but as regards its subject (that is, in","ꯄ꯭ꯌꯨꯔ ꯑꯣꯏꯕꯥ ꯋꯥꯈꯜꯂꯣꯟ), ꯑꯆꯧꯕꯥ ꯋꯥꯐꯝ ꯑꯃꯥ, ꯑꯗꯨꯕꯨ ꯃꯁꯤꯒꯤ ꯍꯤꯔꯝ ꯑꯁꯤꯒꯤ ꯃꯇꯥꯡꯗꯥ (ꯃꯗꯨꯗꯤ, ꯲꯰꯲꯰ꯗꯥ ."
"respect of its reality under conditions of experience), exceedingly little,","ꯑꯦꯛꯁꯄꯔꯤꯑꯦꯟꯁꯀꯤ ꯀꯟꯗꯤꯁꯅꯁꯤꯡꯒꯤ ꯃꯈꯥꯗꯥ ꯃꯁꯤꯒꯤ ꯔꯤꯑꯦꯂꯤꯇꯤ ꯑꯁꯤ ꯏꯀꯥꯌ ꯈꯨꯝꯅꯕꯥ), ꯌꯥꯝꯅꯥ ꯅꯦꯝꯅꯥ,"
"because the idea, as the conception of a maximum, can never be completely","ꯃꯔꯃꯗꯤ ꯋꯥꯈꯜꯂꯣꯟ ꯑꯁꯤ, ꯃꯦꯛꯁꯤꯃꯝ ꯑꯃꯒꯤ ꯀꯟꯁꯦꯄꯁꯟ ꯑꯣꯏꯅꯥ, ꯀꯩꯗꯧꯅꯨꯡꯗꯥ ꯃꯄꯨꯡ ꯐꯥꯅꯥ ."
"and adequately presented in concreto. Now, as in the merely speculative",ꯑꯃꯁꯨꯡ ꯀꯟꯛꯔꯦꯇꯣꯗꯥ ꯃꯇꯤꯛ ꯆꯥꯅꯥ ꯄꯤꯔꯤ꯫
"employment of reason the latter is properly the sole aim, and as in this case","ꯃꯔꯃꯒꯤ ꯊꯕꯛ ꯄꯤꯕꯥ ꯇꯨꯡꯗꯥ ꯂꯥꯀꯄꯥ ꯑꯁꯤꯅꯥ ꯃꯑꯣꯡ ꯆꯨꯝꯅꯥ ꯑꯃꯠꯇꯥ ꯑꯣꯏꯕꯥ ꯄꯥꯟꯗꯝ ꯑꯣꯏꯔꯤ, ꯑꯃꯁꯨꯡ ꯃꯁꯤꯒꯤ ꯃꯇꯥꯡꯗꯥ ꯑꯣꯏꯔꯀꯄꯒꯨꯝꯅꯥ"
"the approximation to a conception, which is never attained in practice, is the",ꯊꯧꯑꯣꯡꯗꯥ ꯀꯩꯗꯧꯉꯩꯗꯥ ꯐꯪꯗꯕꯥ ꯀꯟꯁꯦꯄꯁꯟ ꯑꯃꯒꯤ ꯑꯦꯞꯔꯣꯆ ꯑꯁꯤ .
same thing as if the conception were non-existent—it is commonly said of,ꯋꯥꯈꯜꯂꯣꯟ ꯑꯁꯤ ꯅꯟ-ꯑꯦꯁꯤꯁ꯭ꯇꯦꯟꯇ ꯑꯣꯏꯔꯕꯁꯨ ꯃꯥꯟꯅꯕꯥ ꯋꯥꯐꯝ ꯑꯃꯅꯤ—ꯃꯁꯤ ꯃꯍꯧꯁꯥꯅꯥ ꯍꯥꯌꯔꯤꯕꯁꯤꯅꯤ꯫
"the conception of this kind, “it is only an idea.” So we might very well say,","ꯑꯁꯤꯒꯨꯝꯕꯥ ꯃꯈꯂꯒꯤ ꯋꯥꯈꯜꯂꯣꯟ ꯑꯁꯤ, “ꯃꯁꯤ ꯋꯥꯈꯜꯂꯣꯟ ꯈꯛꯇꯅꯤ꯫”"
"“the absolute totality of all phenomena is only an idea,” for, as we never can","“ꯐꯤꯅꯣꯃꯦꯅꯥ ꯄꯨꯝꯅꯃꯛꯀꯤ ꯑꯦꯕꯁꯣꯜꯌꯨꯇꯦꯗ ꯇꯣꯇꯦꯂꯤꯇꯤ ꯑꯁꯤ ꯋꯥꯈꯜꯂꯣꯟ ꯑꯃꯈꯛꯇꯅꯤ,” ꯃꯔꯃꯗꯤ, ꯑꯩꯈꯣꯌꯅꯥ ꯀꯩꯗꯧꯅꯨꯡꯗꯥ ꯇꯧꯕꯥ ꯉꯃꯗꯦ"
"present an adequate representation of it, it remains for us a problem","ꯃꯁꯤꯒꯤ ꯃꯇꯤꯛ ꯆꯥꯕꯥ ꯔꯤꯞꯔꯖꯦꯟꯇꯦꯁꯟ ꯑꯃꯥ ꯄꯤꯕꯥ, ꯃꯁꯤ ꯑꯩꯈꯣꯌꯒꯤꯗꯃꯛꯇꯗꯤ ꯄ꯭ꯔꯣꯕ꯭ꯂꯦꯝ ꯑꯃꯥ ꯑꯣꯏꯅꯥ ꯂꯩꯔꯤ ."
"incapable of solution. On the other hand, as in the practical use of the",ꯁꯣꯂꯨꯁꯅꯒꯤ ꯇꯧꯕꯥ ꯉꯃꯗꯕꯥ꯫
understanding we have only to do with action and practice according to,ꯑꯩꯈꯣꯌꯅꯥ ꯃꯁꯤꯒꯤ ꯃꯇꯨꯡ ꯏꯟꯅꯥ ꯑꯦꯛꯁꯟ ꯑꯃꯁꯨꯡ ꯄ꯭ꯔꯦꯛꯇꯤꯁꯀꯥ ꯃꯔꯤ ꯂꯩꯅꯕꯥ ꯈꯛꯇꯃꯛ ꯂꯩꯔꯤ ꯍꯥꯌꯕꯥ ꯈꯉꯕꯥ꯫
"rules, an idea of pure reason can always be given really in concreto,","ꯅꯤꯌꯃꯁꯤꯡ, ꯑꯁꯦꯡꯕꯥ ꯔꯤꯖꯅꯒꯤ ꯋꯥꯈꯜꯂꯣꯟ ꯑꯃꯥ ꯃꯇꯝ ꯄꯨꯝꯅꯃꯛꯇꯥ ꯀꯅꯛꯔꯦꯇꯣꯗꯥ ꯇꯁꯦꯡꯅꯥ ꯄꯤꯕꯥ ꯌꯥꯏ,"
"although only partially, nay, it is the indispensable condition of all practical","ꯁꯔꯨꯛ ꯈꯔꯈꯛꯇꯃꯛ ꯑꯣꯏꯔꯕꯁꯨ, ꯅꯠꯇꯦ, ꯃꯁꯤ ꯄ꯭ꯔꯦꯛꯇꯤꯀꯦꯜ ꯄꯨꯝꯅꯃꯛꯀꯤ ꯇꯉꯥꯏ ꯐꯗꯕꯥ ꯀꯟꯗꯤꯁꯅꯅꯤ ."
employment of reason. The practice or execution of the idea is always,ꯃꯔꯃꯒꯤ ꯊꯕꯛ ꯄꯤꯕꯥ꯫
"limited and defective, but nevertheless within indeterminable boundaries,","ꯂꯤꯃꯤꯇꯦꯗ ꯑꯃꯁꯨꯡ ꯗꯤꯐꯦꯛꯇꯤꯚ ꯑꯣꯏꯕꯥ, ꯑꯗꯨꯕꯨ ꯑꯗꯨꯝ ꯑꯣꯏꯅꯃꯛ, ꯏꯅꯗꯦꯔꯃꯤꯅꯦꯕꯜ ꯑꯣꯏꯕꯥ ꯉꯃꯈꯩꯁꯤꯡꯒꯤ ꯃꯅꯨꯡꯗꯥ,"
consequently always under the influence of the conception of an absolute,ꯃꯔꯝ ꯑꯁꯤꯅꯥ ꯃꯇꯝ ꯄꯨꯝꯅꯃꯛꯇꯥ ꯑꯦꯕꯁꯣꯜꯌꯨꯠ ꯑꯃꯒꯤ ꯀꯟꯁꯦꯄꯁꯅꯒꯤ ꯏꯅꯐ꯭ꯂꯨꯑꯦꯟꯁꯀꯤ ꯃꯈꯥꯗꯥ .
perfection. And thus the practical idea is always in the highest degree,ꯃꯄꯨꯡ ꯐꯥꯕꯥ꯫
"fruitful, and in relation to real actions indispensably necessary. In the idea,","ꯃꯍꯩ ꯌꯥꯜꯂꯕꯥ, ꯑꯃꯁꯨꯡ ꯇꯁꯦꯡꯕꯥ ꯊꯕꯀꯁꯤꯡꯒꯥ ꯃꯔꯤ ꯂꯩꯅꯅꯥ ꯇꯉꯥꯏꯐꯗꯅꯥ ꯃꯊꯧ ꯇꯥꯕꯥ꯫"
pure reason possesses even causality and the power of producing that which,ꯄ꯭ꯌꯨꯔ ꯔꯤꯖꯟ ꯑꯁꯤ ꯐꯥꯑꯣꯕꯥ ꯀꯧꯖꯦꯂꯤꯇꯤ ꯑꯃꯁꯨꯡ ꯄꯨꯊꯣꯀꯄꯒꯤ ꯁꯛꯇꯤ ꯑꯗꯨ .
"its conception contains. Hence we cannot say of wisdom, in a disparaging",ꯃꯁꯤꯒꯤ ꯀꯟꯁꯦꯄꯁꯟ ꯑꯁꯤꯗꯥ ꯌꯥꯑꯣꯔꯤ꯫
"way, “it is only an idea.” For, for the very reason that it is the idea of the","ꯂꯝꯕꯤ, “ꯃꯁꯤ ꯋꯥꯈꯜꯂꯣꯟ ꯈꯛꯇꯅꯤ꯫”"
"necessary unity of all possible aims, it must be for all practical exertions","ꯑꯣꯏꯊꯣꯀꯄꯥ ꯌꯥꯕꯥ ꯄꯥꯟꯗꯝ ꯄꯨꯝꯅꯃꯛꯀꯤ ꯃꯊꯧ ꯇꯥꯕꯥ ꯑꯄꯨꯅꯕꯥ, ꯃꯁꯤ ꯄ꯭ꯔꯦꯛꯇꯤꯀꯦꯜ ꯑꯣꯏꯕꯥ ꯑꯦꯛꯁꯔꯁꯥꯏꯖ ꯄꯨꯝꯅꯃꯛꯀꯤꯗꯃꯛ ꯑꯣꯏꯒꯗꯕꯅꯤ"
"and endeavours the primitive condition and rule—a rule which, if not","ꯑꯃꯁꯨꯡ ꯄ꯭ꯔꯤꯃꯤꯇꯤꯕ ꯀꯟꯗꯤꯁꯟ ꯑꯃꯁꯨꯡ ꯔꯨꯜ ꯑꯁꯤ ꯍꯣꯠꯅꯔꯤ—ꯃꯁꯤꯒꯤ ꯅꯤꯌꯝ ꯑꯃꯥ, ꯀꯔꯤꯒꯨꯝꯕꯥ ꯅꯠꯇꯦ ꯀꯔꯤꯒꯨꯝꯕꯥ ꯅꯠꯇꯦ꯫"
"constitutive, is at least limitative","ꯀꯟꯁꯇꯤꯠꯌꯨꯁ꯭ꯅꯦꯜ, ꯌꯥꯃꯗ꯭ꯔꯕꯗꯥ ꯂꯤꯃꯤꯇꯦꯇꯤꯕ ꯑꯣꯏꯕꯥ ."
"Now, although we must say of the transcendental conceptions of reason,","ꯍꯧꯖꯤꯛ ꯑꯩꯈꯣꯌꯅꯥ ꯃꯔꯃꯒꯤ ꯇ꯭ꯔꯥꯟꯁꯦꯟꯗꯦꯟꯇ ꯀꯟꯁꯦꯄꯁꯅꯁꯤꯡꯒꯤ ꯃꯇꯥꯡꯗꯥ ꯍꯥꯌꯒꯗꯕꯁꯨ ꯌꯥꯏ,"
"“they are only ideas,” we must not, on this account, look upon them as","“ꯃꯈꯣꯌ ꯑꯁꯤ ꯋꯥꯈꯜꯂꯣꯟ ꯈꯛꯇꯅꯤ,” ꯑꯩꯈꯣꯌꯅꯥ, ꯃꯁꯤꯒꯤ ꯑꯦꯀꯥꯎꯟꯇ ꯑꯁꯤꯗꯥ, ꯃꯈꯣꯌꯕꯨ ."
"superfluous and nugatory. For, although no object can be determined by",ꯑꯍꯦꯅꯕꯥ ꯑꯃꯁꯨꯡ ꯅ꯭ꯌꯨꯒꯦꯇꯔꯤ ꯑꯣꯏꯕꯥ꯫
"them, they can be of great utility, unobserved and at the basis of the edifice","ꯃꯈꯣꯌꯁꯤꯡ, ꯃꯈꯣꯌꯁꯤꯡ ꯑꯁꯤ ꯑꯆꯧꯕꯥ ꯀꯥꯟꯅꯕꯥ ꯑꯃꯥ ꯑꯣꯏꯕꯥ ꯌꯥꯏ, ꯌꯦꯡꯁꯤꯟꯗꯕꯥ ꯑꯃꯁꯨꯡ ꯑꯦꯗꯤꯐꯤꯁꯀꯤ ꯌꯨꯝꯐꯃꯗꯥ ꯂꯩꯕꯥ ꯌꯥꯏ꯫"
"of the understanding, as the canon for its extended and self-consistent","ꯂꯧꯁꯤꯡꯒꯤ, ꯃꯁꯤꯒꯤ ꯑꯦꯛꯁꯇꯦꯟꯗꯦꯗ ꯑꯃꯁꯨꯡ ꯃꯁꯥꯅꯥ ꯃꯁꯥꯕꯨ ꯀꯟꯁꯤꯁ꯭ꯇꯦꯟꯇ ꯑꯣꯏꯅꯥ ꯀꯦꯅꯟ ꯑꯣꯏꯅꯥ ."
"exercise—a canon which, indeed, does not enable it to cognize more in an","ꯑꯦꯛꯁꯔꯁꯥꯏꯖ—ꯃꯁꯤꯒꯤ ꯀꯦꯅꯟ ꯑꯃꯅꯥ, ꯇꯁꯦꯡꯅꯥ ꯍꯥꯌꯔꯕꯗꯥ, ꯃꯁꯤꯕꯨ ꯍꯦꯟꯅꯥ ꯀꯣꯒꯅꯤꯖ ꯇꯧꯕꯥ ꯉꯃꯍꯟꯗꯕꯥ ꯀꯦꯅꯟ ꯑꯃꯅꯤ꯫"
"object than it would cognize by the help of its own conceptions, but which","ꯑꯣꯕꯖꯦꯛꯇꯇꯒꯤ ꯍꯦꯟꯅꯥ ꯃꯁꯤꯅꯥ ꯃꯁꯥꯒꯤ ꯑꯣꯏꯕꯥ ꯋꯥꯈꯜꯂꯣꯅꯁꯤꯡꯒꯤ ꯃꯇꯦꯡꯅꯥ ꯀꯣꯒꯅꯤꯖ ꯇꯧꯒꯅꯤ, ꯑꯗꯨꯕꯨ ꯃꯗꯨ ."
guides it more securely in its cognition. Not to mention that they perhaps,ꯃꯁꯤꯒꯤ ꯀꯣꯒꯅꯤꯁꯅꯗꯥ ꯍꯦꯟꯅꯥ ꯁꯦꯛꯌꯨꯑꯣꯔ ꯑꯣꯏꯅꯥ ꯂꯃꯖꯤꯡꯏ꯫
render possible a transition from our conceptions of nature and the non-ego,ꯑꯩꯈꯣꯌꯒꯤ ꯃꯍꯧꯁꯥ ꯑꯃꯁꯨꯡ ꯅꯟ-ꯏꯒꯣꯒꯤ ꯋꯥꯈꯜꯂꯣꯅꯁꯤꯡꯗꯒꯤ ꯇ꯭ꯔꯥꯟꯁꯤꯁꯟ ꯑꯃꯥ ꯑꯣꯏꯊꯣꯀꯄꯥ ꯌꯥꯕꯥ
"to the practical conceptions, and thus produce for even ethical ideas","ꯄ꯭ꯔꯦꯛꯇꯤꯀꯦꯜ ꯀꯟꯁꯦꯄꯁꯅꯁꯤꯡꯗꯥ, ꯑꯃꯁꯨꯡ ꯃꯁꯤꯅꯥ ꯏꯊꯤꯀꯦꯜ ꯑꯥꯏꯗꯤꯌꯥꯁꯤꯡ ꯐꯥꯑꯣꯕꯥ ꯄꯨꯊꯣꯀꯄꯗꯥ ."
"keeping, so to speak, and connection with the speculative cognitions of","ꯀꯤꯄꯤꯡ, ꯍꯥꯌꯕꯗꯤ ꯍꯥꯌꯕꯥ ꯑꯃꯁꯨꯡ ꯀꯅꯦꯛꯁꯅꯒꯥ ꯃꯔꯤ ꯂꯩꯅꯕꯥ ꯋꯥꯐꯃꯁꯤꯡꯒꯥ ꯃꯔꯤ ꯂꯩꯅꯕꯥ ꯋꯥꯐꯃꯁꯤꯡ"
reason. The explication of all this must be looked for in the sequel,ꯃꯔꯝ.
"But setting aside, in conformity with our original purpose, the","ꯑꯗꯨꯕꯨ ꯑꯩꯈꯣꯌꯒꯤ ꯑꯔꯤꯕꯥ ꯄꯥꯟꯗꯝ ꯑꯗꯨꯒꯥ ꯂꯣꯌꯅꯅꯥ, ꯃꯗꯨꯒꯤ ꯃꯇꯨꯡ ꯏꯟꯅꯥ, ."
"consideration of the practical ideas, we proceed to contemplate reason in its",ꯄ꯭ꯔꯦꯛꯇꯤꯀꯦꯜ ꯑꯥꯏꯗꯤꯌꯥꯁꯤꯡꯒꯤ ꯃꯇꯥꯡꯗꯥ ꯈꯟꯅꯔꯕꯥ ꯃꯇꯨꯡꯗꯥ ꯑꯩꯈꯣꯌꯅꯥ ꯃꯁꯤꯒꯤ ꯃꯇꯥꯡꯗꯥ ꯋꯥꯐꯝ ꯑꯁꯤ ꯈꯅꯒꯠꯅꯕꯥ ꯃꯈꯥ ꯆꯠꯊꯔꯤ꯫
"speculative use alone, nay, in a still more restricted sphere, to wit, in the","ꯁ꯭ꯄꯦꯛꯌꯨꯂꯦꯇꯤꯕ ꯌꯨꯖ ꯈꯛꯇꯃꯛ, ꯅꯠꯇꯦ, ꯍꯧꯖꯤꯀꯁꯨ ꯍꯦꯟꯅꯥ ꯑꯊꯤꯡꯕꯥ ꯊꯝꯂꯤꯕꯥ ꯁ꯭ꯐꯤꯔ ꯑꯃꯗꯥ, ꯋꯥꯏꯠ, ꯏꯟ ꯗꯤ ."
transcendental use; and here must strike into the same path which we,ꯇ꯭ꯔꯥꯟꯁꯦꯟꯗꯦꯟꯇꯜ ꯁꯤꯖꯤꯟꯅꯕꯥ;
"followed in our deduction of the categories. That is to say, we shall consider",ꯀꯦꯇꯦꯒꯣꯔꯤꯁꯤꯡ ꯑꯁꯤꯒꯤ ꯑꯩꯈꯣꯌꯒꯤ ꯗꯤꯗꯛꯁꯅꯗꯥ ꯐꯣꯂꯣ ꯇꯧꯈꯤ꯫
"the logical form of the cognition of reason, that we may see whether reason","ꯃꯔꯃꯒꯤ ꯀꯣꯒꯅꯤꯁꯅꯒꯤ ꯂꯣꯖꯤꯀꯦꯜ ꯑꯣꯏꯕꯥ ꯃꯑꯣꯡ, ꯑꯩꯈꯣꯌꯅꯥ ꯃꯔꯝ ꯑꯣꯏꯗꯨꯅꯥ ꯑꯩꯈꯣꯌꯅꯥ ꯎꯕꯥ ꯐꯪꯂꯃꯒꯅꯤ"
may not be thereby a source of conceptions which enables us to regard,ꯃꯗꯨꯅꯥ ꯑꯩꯈꯣꯌꯗꯥ ꯃꯤꯠꯌꯦꯡ ꯊꯝꯕꯥ ꯉꯃꯍꯜꯂꯤꯕꯥ ꯋꯥꯈꯜꯂꯣꯅꯁꯤꯡꯒꯤ ꯍꯧꯔꯀꯐꯝ ꯑꯃꯥ ꯑꯣꯏꯗꯕꯥ ꯌꯥꯏ .
"objects in themselves as determined synthetically à priori, in relation to one","ꯃꯁꯥꯃꯀꯄꯨ ꯂꯦꯄꯊꯣꯀꯈ꯭ꯔꯕꯥ ꯁꯤꯟꯊꯦꯇꯤꯛ ꯑꯣꯏꯅꯥ à priori, ꯑꯃꯒꯥ ꯃꯔꯤ ꯂꯩꯅꯅꯥ ꯑꯣꯕꯖꯦꯛꯇꯁꯤꯡ"
or other of the functions of reason,ꯅꯠꯔꯒꯥ ꯔꯤꯖꯅꯒꯤ ꯐꯉ꯭ꯀꯁꯅꯁꯤꯡꯒꯤ ꯃꯅꯨꯡꯗꯥ ꯑꯇꯣꯞꯄꯥ .
"Reason, considered as the faculty of a certain logical form of cognition,","ꯃꯔꯝ, ꯀꯣꯒꯅꯤꯁꯅꯒꯤ ꯑꯀꯛꯅꯕꯥ ꯂꯣꯖꯤꯀꯦꯜ ꯑꯣꯏꯕꯥ ꯃꯑꯣꯡ ꯑꯃꯒꯤ ꯐꯦꯀꯜꯇꯤ ꯑꯣꯏꯅꯥ ꯂꯧꯕꯥ,"
"is the faculty of conclusion, that is, of mediate judgement—by means of the","ꯑꯁꯤ ꯂꯣꯏꯁꯤꯅꯕꯒꯤ ꯐꯦꯀꯜꯇꯤꯅꯤ, ꯍꯥꯌꯕꯗꯤ ꯃꯦꯗꯤꯌꯝ ꯖꯖꯃꯦꯟꯇꯀꯤ—ꯃꯁꯤꯒꯤ ꯈꯨꯠꯊꯥꯡꯗꯥ ."
subsumption of the condition of a possible judgement under the condition,ꯀꯟꯗꯤꯁꯟ ꯑꯁꯤꯒꯤ ꯃꯈꯥꯗꯥ ꯑꯣꯏꯊꯣꯀꯄꯥ ꯌꯥꯕꯥ ꯖꯖꯃꯦꯟꯇ ꯑꯃꯒꯤ ꯀꯟꯗꯤꯁꯟ ꯑꯗꯨ ꯁꯕꯁꯝꯕꯤꯡ ꯇꯧꯕꯥ
of a given judgement. The given judgement is the general rule (major). The,ꯑꯄꯤꯕꯥ ꯖꯖꯃꯦꯟꯇ ꯑꯃꯒꯤ꯫
subsumption of the condition of another possible judgement under the,ꯃꯈꯥꯗꯥ ꯑꯇꯣꯞꯄꯥ ꯑꯣꯏꯊꯣꯀꯄꯥ ꯌꯥꯕꯥ ꯖꯖꯃꯦꯟꯇ ꯑꯃꯒꯤ ꯀꯟꯗꯤꯁꯟ ꯑꯗꯨ ꯁꯕꯁꯝꯕꯤꯡ ꯇꯧꯕꯥ
"condition of the rule is the minor. The actual judgement, which enounces",ꯅꯤꯌꯝ ꯑꯁꯤꯒꯤ ꯀꯟꯗꯤꯁꯟ ꯑꯁꯤ ꯃꯥꯏꯅꯣꯔꯅꯤ꯫
"the assertion of the rule in the subsumed case, is the conclusion (conclusio)","ꯁꯕꯁ꯭ꯌꯨꯝ ꯇꯧꯔꯕꯥ ꯀꯦꯁ ꯑꯗꯨꯗꯥ ꯂꯩꯔꯤꯕꯥ ꯔꯨꯜ ꯑꯗꯨꯒꯤ ꯑꯦꯁ꯭ꯄꯤꯔꯦꯁꯟ ꯑꯗꯨ, ꯀꯟꯁꯜꯌꯨꯁꯟ (ꯀꯟꯛꯂꯨꯁꯤꯑꯣ) ꯑꯗꯨꯅꯤ"
The rule predicates something generally under a certain condition. The,ꯅꯤꯌꯝ ꯑꯁꯤꯅꯥ ꯑꯀꯛꯅꯕꯥ ꯀꯟꯗꯤꯁꯟ ꯑꯃꯒꯤ ꯃꯈꯥꯗꯥ ꯂꯩꯕꯥ ꯄꯣꯠꯁꯛ ꯑꯃꯕꯨ ꯃꯍꯧꯁꯥꯅꯥ ꯐꯣꯡꯗꯣꯀꯏ꯫
condition of the rule is satisfied in some particular case. It follows that what,ꯔꯨꯜ ꯑꯁꯤꯒꯤ ꯀꯟꯗꯤꯁꯟ ꯑꯁꯤ ꯑꯀꯛꯅꯕꯥ ꯀꯦꯁ ꯈꯔꯗꯥ ꯁꯣꯏꯗꯅꯥ ꯌꯥꯑꯣꯏ꯫
was valid in general under that condition must also be considered as valid in,ꯀꯟꯗꯤꯁꯟ ꯑꯗꯨꯒꯤ ꯃꯈꯥꯗꯥ ꯖꯦꯅꯔꯦꯜ ꯑꯣꯏꯅꯥ ꯚꯦꯂꯤꯗ ꯑꯣꯏꯅꯥ ꯆꯠꯅꯔꯝꯕꯥ ꯑꯗꯨꯁꯨ ꯲꯰꯲꯰ꯗꯥ ꯚꯦꯂꯤꯗ ꯑꯣꯏꯅꯥ ꯂꯧꯒꯗꯕꯅꯤ꯫
the particular case which satisfies this condition. It is very plain that reason,ꯀꯟꯗꯤꯁꯟ ꯑꯁꯤꯕꯨ ꯁꯣꯌꯗꯅꯥ ꯐꯪꯍꯜꯂꯤꯕꯥ ꯑꯀꯛꯅꯕꯥ ꯀꯦꯁ ꯑꯗꯨ꯫
"attains to a cognition, by means of acts of the understanding which","ꯀꯣꯒꯅꯤꯁꯟ ꯑꯃꯗꯥ, ꯂꯧꯁꯤꯡꯒꯤ ꯊꯕꯀꯁꯤꯡꯒꯤ ꯈꯨꯠꯊꯥꯡꯗꯥ ꯐꯪꯂꯤꯕꯥ ꯑꯁꯤ ."
"constitute a series of conditions. When I arrive at the proposition, “All",ꯀꯟꯗꯤꯁꯅꯁꯤꯡꯒꯤ ꯁꯤꯔꯤꯖ ꯑꯃꯥ ꯁꯦꯝꯕꯥ꯫
"bodies are changeable,” by beginning with the more remote cognition (in","ꯕꯣꯗꯤꯁꯤꯡ ꯑꯁꯤ ꯍꯣꯡꯂꯛꯀꯅꯤ,” ꯍꯦꯟꯅꯥ ꯔꯤꯃꯣꯠ ꯑꯣꯏꯕꯥ ꯀꯣꯒꯅꯤꯁꯟ (in)ꯗꯒꯤ ꯍꯧꯔꯒꯥ"
"which the conception of body does not appear, but which nevertheless","ꯃꯗꯨ ꯍꯀꯆꯥꯡꯒꯤ ꯀꯟꯁꯦꯄꯁꯟ ꯑꯗꯨ ꯎꯕꯥ ꯐꯪꯗꯦ, ꯑꯗꯨꯕꯨ ꯃꯗꯨ ꯑꯣꯏꯔꯕꯁꯨ ."
"contains the condition of that conception), “All compound is changeable,”","ꯀꯟꯁꯦꯄꯁꯟ ꯑꯗꯨꯒꯤ ꯀꯟꯗꯤꯁꯟ ꯑꯗꯨ ꯌꯥꯑꯣꯔꯤ), “ꯀꯝꯄꯥꯎꯟꯗ ꯄꯨꯝꯅꯃꯛ ꯍꯣꯡꯂꯛꯀꯅꯤ,”꯫"
"by proceeding from this to a less remote cognition, which stands under the","ꯃꯁꯤꯗꯒꯤ ꯍꯦꯟꯅꯥ ꯂꯥꯞꯅꯥ ꯂꯩꯕꯥ ꯔꯤꯃꯣꯠ ꯀꯣꯒꯅꯤꯁꯟ ꯑꯃꯗꯥ ꯆꯠꯇꯨꯅꯥ, ꯃꯁꯤꯅꯥ ."
"condition of the former, “Bodies are compound,” and hence to a third,","ꯍꯥꯟꯅꯒꯤ ꯀꯟꯗꯤꯁꯟ, “ꯕꯣꯗꯤꯁꯤꯡ ꯑꯁꯤ ꯀꯝꯄꯥꯎꯟꯗꯅꯤ,” ꯑꯃꯁꯨꯡ ꯃꯔꯝ ꯑꯁꯤꯅꯥ ꯑꯍꯨꯃꯁꯨꯕꯥ ꯑꯃꯗꯥ,"
which at length connects for me the remote cognition (changeable) with the,ꯃꯁꯤꯅꯥ ꯃꯇꯝ ꯁꯥꯡꯅꯥ ꯑꯩꯒꯤꯗꯃꯛꯇꯥ ꯔꯤꯃꯣꯠ ꯀꯣꯒꯅꯤꯁꯟ (ꯆꯦꯟꯖ ꯇꯧꯕꯥ ꯌꯥꯕꯥ) ꯑꯁꯤ .
"one before me, “Consequently, bodies are changeable”—I have arrived at a","ꯑꯩꯒꯤ ꯃꯥꯡꯗꯥ ꯑꯃꯅꯥ, “ꯃꯔꯝ ꯑꯗꯨꯅꯥ, ꯍꯀꯆꯥꯡꯁꯤꯡ ꯑꯁꯤ ꯍꯣꯡꯂꯛꯂꯤ”—ꯑꯩꯍꯥꯛ ꯑꯦ."
cognition (conclusion) through a series of conditions (premisses). Now,ꯀꯟꯗꯤꯁꯅꯁꯤꯡ (ꯄ꯭ꯔꯤꯃꯤꯁ) ꯀꯌꯥꯒꯤ ꯈꯨꯠꯊꯥꯡꯗꯥ ꯀꯣꯒꯅꯤꯁꯟ (ꯀꯟꯛꯂꯨꯁꯟ)꯫
"every series, whose exponent (of the categorical or hypothetical judgement)","ꯁꯤꯔꯤꯖ ꯈꯨꯗꯤꯡꯃꯛ, ꯃꯈꯣꯌꯒꯤ ꯑꯦꯛꯁꯄꯣꯟꯇꯦꯟꯇ (ꯀꯦꯇꯦꯒꯣꯔꯤꯀꯦꯜ ꯅꯠꯠꯔꯒꯥ ꯍꯥꯏꯄꯣꯇꯦꯇꯤꯀꯜ ꯖꯖꯃꯦꯟꯇꯀꯤ)"
"is given, can be continued; consequently the same procedure of reason","ꯑꯁꯤ ꯄꯤꯔꯤ, ꯃꯈꯥ ꯇꯥꯅꯥ ꯆꯠꯊꯕꯥ ꯌꯥꯏ;"
"conducts us to the ratiocinatio polysyllogistica, which is a series of","ꯑꯩꯈꯣꯌꯕꯨ ꯔꯦꯁꯤꯑꯣꯁꯤꯅꯥꯇꯤꯑꯣ ꯄꯣꯂꯤꯁꯤꯂꯣꯖꯤꯁ꯭ꯇꯤꯀꯥꯗꯥ ꯀꯟꯗꯥꯛꯇ ꯇꯧꯏ, ꯃꯁꯤꯅꯥ ."
"syllogisms, that can be continued either on the side of the conditions (per","ꯁꯤꯂꯣꯖꯤꯖꯃꯁꯤꯡ, ꯃꯗꯨ ꯀꯟꯗꯤꯁꯅꯁꯤꯡꯒꯤ ꯃꯅꯥꯛꯇꯥ ꯅꯠꯔꯒꯥ ꯃꯈꯥ ꯆꯠꯊꯕꯥ ꯌꯥꯏ (ꯄꯥꯔ"
prosyllogismos) or of the conditioned (per episyllogismos) to an indefinite,ꯄ꯭ꯔꯣꯁꯤꯂꯣꯂꯣꯖꯤꯖꯃꯣꯁ) ꯅꯠꯠꯔꯒꯥ ꯀꯟꯗꯤꯁꯟ ꯇꯧꯔꯕꯥ (ꯄꯤꯁꯤꯂꯣꯖꯤꯖꯃꯣꯁ ꯑꯃꯗꯥ) ꯏꯅꯗꯦꯐꯤꯅꯤꯇꯦꯗ ꯑꯃꯗꯥ
extent,ꯀꯔꯤꯒꯨꯝꯕ ꯑꯃꯒꯤ ꯄꯥꯛ ꯆꯥꯎꯕ
"But we very soon perceive that the chain or series of prosyllogisms, that","ꯑꯗꯨꯕꯨ ꯑꯩꯈꯣꯌꯅꯥ ꯌꯥꯝꯅꯥ ꯊꯨꯅꯥ ꯈꯉꯕꯥ ꯉꯝꯃꯤ ꯃꯗꯨꯗꯤ ꯄ꯭ꯔꯣꯁꯤꯂꯣꯖꯤꯖꯃꯒꯤ ꯆꯦꯟ ꯅꯠꯔꯒꯥ ꯁꯤꯔꯤꯖ, ꯃꯗꯨ ."
"is, of deduced cognitions on the side of the grounds or conditions of a given","ꯑꯁꯤ, ꯑꯄꯤꯕꯥ ꯑꯃꯒꯤ ꯒ꯭ꯔꯥꯎꯟꯗ ꯅꯠꯠꯔꯒꯥ ꯀꯟꯗꯤꯁꯅꯁꯤꯡꯒꯤ ꯃꯅꯥꯛꯇꯥ ꯂꯩꯕꯥ ꯗꯤꯗ꯭ꯌꯨꯁ ꯇꯧꯔꯕꯥ ꯀꯣꯒꯅꯤꯁꯅꯁꯤꯡꯒꯤ ."
"cognition, in other words, the ascending series of syllogisms must have a","ꯀꯣꯒꯅꯤꯁꯟ, ꯑꯇꯣꯞꯄꯥ ꯋꯥꯍꯩ ꯑꯃꯗꯥ ꯍꯥꯌꯔꯕꯗꯥ, ꯁꯤꯂꯣꯖꯤꯖꯃꯒꯤ ꯍꯦꯅꯒꯠꯂꯛꯂꯤꯕꯥ ꯁꯤꯔꯤꯖ ꯑꯁꯤꯅꯥ ꯑꯃꯥ ꯂꯩꯒꯗꯕꯅꯤ꯫"
very different relation to the faculty of reason from that of the descending,ꯌꯥꯝꯅꯥ ꯇꯣꯉꯥꯅꯕꯥ ꯃꯔꯤ ꯂꯩꯅꯕꯥ ꯐꯦꯀꯜꯇꯤ ꯑꯣꯐ ꯔꯤꯖꯟ ꯑꯃꯁꯨꯡ ꯗꯤꯁꯦꯟꯗꯤꯡꯗꯒꯤ ꯍꯧꯔꯒꯥ
"series, that is, the progressive procedure of reason on the side of the","ꯁꯤꯔꯤꯖ, ꯍꯥꯌꯕꯗꯤ ꯃꯔꯃꯒꯤ ꯄ꯭ꯔꯣꯒ꯭ꯔꯦꯁꯤꯚ ꯄ꯭ꯔꯣꯁꯤꯗ꯭ꯌꯨꯔ ꯑꯁꯤ ."
"conditioned by means of episyllogisms. For, as in the former case the",ꯑꯦꯄꯤꯁꯤꯂꯣꯖꯤꯖꯃꯁꯤꯡꯒꯤ ꯈꯨꯠꯊꯥꯡꯗꯥ ꯀꯟꯗꯤꯁꯟ ꯇꯧꯕꯥ꯫
"cognition (conclusio) is given only as conditioned, reason can attain to this","ꯀꯣꯒꯅꯤꯁꯟ (ꯀꯅꯛꯂꯨꯁꯤꯑꯣ) ꯑꯁꯤ ꯀꯟꯗꯤꯁꯟ ꯑꯣꯏꯅꯥ ꯈꯛꯇꯃꯛ ꯄꯤꯔꯤ, ꯃꯔꯝ ꯑꯁꯤꯅꯥ ꯃꯁꯤ ꯐꯪꯕꯥ ꯉꯃꯒꯅꯤ꯫"
cognition only under the presupposition that all the members of the series,ꯀꯣꯒꯅꯤꯁꯟ ꯑꯁꯤ ꯄ꯭ꯔꯤꯁꯄꯁꯤꯁꯅꯒꯤ ꯃꯈꯥꯗꯥ ꯈꯛꯇꯗꯥ ꯁꯤꯔꯤꯖ ꯑꯁꯤꯒꯤ ꯃꯦꯝꯕꯔ ꯄꯨꯝꯅꯃꯛꯅꯥ .
