en,mni-Mtei
watching TV or reading a book Tranquility is anchored to,ꯇꯤ.ꯚꯤ.ꯗꯥ ꯌꯦꯡꯕꯥ ꯅꯠꯔꯒꯥ ꯂꯥꯏꯔꯤꯛ ꯑꯃꯥ ꯄꯥꯕꯥ ꯃꯇꯃꯗꯥ ꯅꯨꯡꯉꯥꯏꯕꯥ .
these clothes Each time you slip them on you feel psycho,ꯍꯥꯌꯔꯤꯕꯥ ꯄꯣꯠꯁꯀꯁꯤꯡ ꯑꯁꯤ ꯅꯍꯥꯛꯅꯥ ꯃꯈꯣꯌꯗꯨ ꯅꯍꯥꯛꯀꯤ ꯃꯊꯛꯇꯥ ꯆꯦꯟꯊꯈꯤꯕꯥ ꯃꯇꯝ ꯈꯨꯗꯤꯡꯗꯥ ꯁꯥꯏꯀꯣ
logical ease Th ey are like your second skin Youre not worried,ꯂꯣꯖꯤꯀꯦꯜ ꯏꯖ ꯊ ꯏ ꯑꯁꯤ ꯅꯍꯥꯛꯀꯤ ꯑꯅꯤꯁꯨꯕꯥ ꯁ꯭ꯀꯤꯅꯒꯨꯝꯅꯥ ꯅꯍꯥꯛꯅꯥ ꯋꯥꯈꯜ ꯋꯥꯕꯥ ꯂꯩꯇꯦ
that your tee is too tight or your jeans too short Why? Because,ꯅꯍꯥꯛꯀꯤ ꯇꯤ ꯑꯁꯤ ꯌꯥꯝꯅꯥ ꯇꯞꯅꯥ ꯆꯠꯂꯤ ꯅꯠꯠꯔꯒꯥ ꯅꯍꯥꯛꯀꯤ ꯖꯤꯟꯁ ꯑꯗꯨ ꯌꯥꯝꯅꯥ ꯀꯨꯏꯔꯦ ꯍꯥꯌꯕꯁꯤ ꯀꯔꯤꯒꯤꯅꯣ?
youve lived in them,ꯅꯍꯥꯛꯅꯥ ꯃꯈꯣꯌꯗꯥ ꯍꯤꯡꯈꯤ
Now lets talk about your new knock em dead out t You,ꯍꯧꯖꯤꯛ ꯑꯗꯣꯃꯒꯤ ꯑꯅꯧꯕꯥ ꯅꯣꯛ ꯑꯦꯝ ꯗꯦꯗ ꯑꯥꯎꯠ ꯇꯤ ꯏꯎꯒꯤ ꯃꯇꯥꯡꯗꯥ ꯋꯥꯔꯤ ꯁꯥꯔꯁꯤ
know you look like a million bucks in it However if the out t,ꯈꯉꯕꯤꯌꯨ ꯅꯍꯥꯛꯅꯥ ꯃꯁꯤꯗꯥ ꯃꯤꯂꯤꯌꯟ ꯑꯃꯥ ꯑꯣꯏꯅꯥ ꯎꯕꯥ ꯐꯪꯒꯅꯤ ꯑꯗꯨꯝ ꯑꯣꯏꯅꯃꯛ ꯀꯔꯤꯒꯨꯝꯕꯥ ꯑꯥꯎꯠ ꯇꯤ.
at ease wearing it To make a good impression you must be,ꯑꯐꯕꯥ ꯏꯝꯄꯦꯛꯇ ꯑꯃꯥ ꯁꯦꯝꯅꯕꯥ ꯏꯖ ꯑꯣꯏꯅꯥ ꯁꯣꯏꯗꯅꯥ ꯁꯣꯏꯗꯅꯥ ꯁꯣꯏꯗꯅꯥ ꯁꯣꯏꯗꯅꯥ ꯁꯣꯏꯗꯅꯥ ꯁꯣꯏꯗꯅꯥ ꯁꯣꯏꯗꯅꯥ ꯁꯣꯏꯗꯅꯥ ꯁꯣꯏꯗꯅꯥ ꯁꯣꯏꯗꯅꯥ .
relaxed in whatever youve got on your back Here is a tech,ꯔꯤꯂꯥꯛꯁꯦꯁꯟ ꯏꯟ ꯋꯤꯊ ꯋꯤꯚ ꯑꯦꯠ ꯏꯎꯔ ꯑꯣꯟ ꯏꯎꯔ ꯕꯦꯛ ꯑꯦꯖ ꯑꯦ ꯇꯦꯛ ꯇꯦꯛ
nique to do just that,ꯅꯤꯛ ꯇꯨ ꯗꯣ ꯖꯁ꯭ꯠ ꯊ꯭ꯌꯥꯠ .
14  How to Instantly Connect with Anyone,꯱꯴ ꯀꯅꯥꯒꯨꯝꯕꯥ ꯑꯃꯒꯥ ꯈꯨꯗꯛꯇꯥ ꯁꯝꯅꯒꯅꯤ .
Little Trick 4,ꯂꯤꯇꯜ ꯇ꯭ꯔꯤꯛ ꯴.
Break In Your Party Clothes,ꯅꯍꯥꯛꯀꯤ ꯄꯥꯔꯇꯤꯒꯤ ꯄꯣꯠꯂꯃꯁꯤꯡ ꯊꯨꯒꯥꯏꯕꯥ
Around the House First,ꯌꯨꯃꯒꯤ ꯑꯀꯣꯌꯕꯗꯥ ꯑꯍꯥꯅꯕꯥ ꯑꯣꯏꯅꯥ .
Give your jeans and old sweater a vacation Don your,ꯅꯍꯥꯛꯀꯤ ꯖꯤꯟꯁ ꯑꯃꯁꯨꯡ ꯑꯔꯤꯕꯥ ꯁ꯭ꯕꯌꯔ ꯑꯃꯥ ꯄꯤꯌꯨ ꯚꯦꯀꯦꯁꯟ ꯑꯃꯥ ꯅꯍꯥꯛꯀꯤ .
slick new clothes and run around the house in them,ꯑꯅꯧꯕꯥ ꯄꯣꯠꯂꯃꯁꯤꯡ ꯁꯦꯃꯖꯤꯜꯂꯨ ꯑꯃꯁꯨꯡ ꯃꯈꯣꯌꯗꯥ ꯌꯨꯃꯒꯤ ꯑꯀꯣꯌꯕꯗꯥ ꯂꯥꯟꯊꯣꯀꯎ
Watch TV in them Organize your CDs in them,ꯃꯈꯣꯌꯗꯥ ꯇꯤꯚꯤ ꯌꯦꯡꯕꯤꯌꯨ ꯃꯈꯣꯌꯗꯥ ꯅꯍꯥꯛꯀꯤ ꯁꯤꯗꯤꯁꯤꯡ ꯑꯗꯨ ꯑꯣꯔꯒꯥꯅꯥꯏꯖ ꯇꯧꯕꯤꯌꯨ
Take a nap in themespecially if theyre cotton so,ꯊꯤꯃꯁ꯭ꯄꯦꯁꯤꯑꯦꯜ ꯑꯣꯏꯅꯥ ꯀꯔꯤꯒꯨꯝꯕꯥ ꯃꯈꯣꯌꯅꯥ ꯁꯨꯇꯤ ꯑꯗꯨꯅꯥ ꯅꯦꯞ ꯑꯃꯥ ꯂꯧꯕꯤꯌꯨ So .
you see how they pass the wrinkle test After they,ꯃꯈꯣꯌꯅꯥ ꯃꯈꯣꯌꯒꯤ ꯃꯇꯨꯡꯗꯥ ꯃꯇꯧ ꯀꯔꯝꯅꯥ ꯔꯤꯡꯀꯦꯜ ꯇꯦꯁ꯭ꯠ ꯄꯥꯁ ꯇꯧꯕꯒꯦ ꯍꯥꯌꯕꯗꯨ ꯅꯍꯥꯛꯅꯥ ꯎꯕꯥ ꯐꯪꯒꯅꯤ
are cleaned they will look just as good And you will,ꯁꯦꯡꯗꯣꯛꯂꯦ ꯃꯈꯣꯌꯁꯨ ꯑꯗꯨꯃꯛ ꯐꯖꯅꯥ ꯎꯒꯅꯤ ꯑꯃꯁꯨꯡ ꯅꯍꯥꯛꯅꯥ .
look even better because you wont have that sti,ꯍꯦꯟꯅꯥ ꯐꯕꯥ ꯃꯑꯣꯡꯗꯥ ꯎꯕꯥ ꯐꯪꯕꯅꯥ ꯃꯔꯝ ꯑꯣꯏꯗꯨꯅꯥ ꯅꯍꯥꯛꯅꯥ ꯑꯗꯨꯒꯨꯝꯕꯥ ꯑꯦꯁ.ꯇꯤ.ꯑꯥꯏ.
Im wearing new clothes look,im ꯑꯅꯧꯕꯥ ꯄꯣꯠꯂꯃꯁꯤꯡ ꯌꯦꯡꯕꯥ
15,꯱꯵ ꯑꯃꯁꯨꯡ ꯱꯵.
How to Make People,ꯃꯇꯧ ꯀꯔꯝꯅꯥ ꯃꯤꯁꯤꯡ ꯑꯣꯏꯍꯅꯒꯅꯤ .
Appreciate Your,ꯑꯗꯣꯃꯒꯤ ꯊꯥꯒꯠꯄꯥ ꯐꯣꯡꯗꯣꯀꯆꯔꯤ ꯫
Introduction,ꯁꯛꯇꯥꯛꯄ
No two people hearing the same wordsat the same time,ꯃꯇꯝ ꯑꯃꯗꯥ ꯆꯞ ꯃꯥꯟꯅꯕꯥ ꯋꯥꯍꯩꯁꯤꯡ ꯇꯥꯕꯥ ꯃꯤꯑꯣꯏ ꯑꯅꯤ ꯑꯃꯠꯇꯥ ꯂꯩꯇꯦ .
from the same personever get the same sense of what some,ꯆꯞ ꯃꯥꯟꯅꯕꯥ ꯄꯔꯁꯣꯅꯦꯂꯗꯒꯤ ꯀꯔꯤꯒꯨꯝꯕꯥ ꯈꯔꯒꯤ ꯆꯞ ꯃꯥꯟꯅꯕꯥ ꯋꯥꯈꯜꯂꯣꯟ ꯑꯗꯨ ꯐꯪꯕꯤꯌꯨ
one said Every sound that comes out of someones mouth,ꯑꯃꯅꯥ ꯍꯥꯌꯈꯤ ꯀꯅꯥꯒꯨꯝꯕꯥ ꯑꯃꯒꯤ ꯃꯅꯥꯛꯇꯥ ꯊꯣꯀꯄꯥ ꯈꯣꯟꯖꯦꯜ ꯈꯨꯗꯤꯡꯃꯛ .
strikes a mine eld of each listeners buried memories associa,ꯁ꯭ꯠꯔꯥꯏꯀꯁ ꯑꯦ ꯃꯥꯏꯟ ꯑꯦꯂꯗꯅꯥ ꯇꯥꯔꯤꯕꯥ ꯃꯤꯑꯣꯏ ꯈꯨꯗꯤꯡꯃꯛꯀꯤ ꯕꯨꯔꯤꯌꯔ ꯃꯦꯃꯣꯔꯤꯁꯤꯡ ꯑꯦꯁꯣꯁꯤꯌꯥ
tions and a lifetime of emotional pleasure or pain from every,ꯇꯤꯅꯁꯤꯡ ꯑꯃꯁꯨꯡ ꯄꯨꯟꯁꯤ ꯆꯨꯞꯄꯥ ꯏꯃꯣꯁꯅꯦꯜ ꯄ꯭ꯂꯦꯁꯃꯦꯟꯇ ꯅꯠꯔꯒꯥ ꯄꯦꯏꯟ ꯈꯨꯗꯤꯡꯃꯛ .
one theyve ever met,ꯃꯈꯣꯌꯅꯥ ꯍꯧꯖꯤꯛ ꯐꯥꯑꯣꯕꯥ ꯎꯅꯈꯤꯕꯥ .
Even the order of words in a single sentence can a ect,ꯋꯥꯍꯩ ꯑꯃꯈꯛꯇꯗꯥ ꯋꯥꯍꯩꯁꯤꯡꯒꯤ ꯑꯣꯔꯗꯔ ꯐꯥꯑꯣꯕꯥ ꯏ.ꯁꯤ.ꯇꯤ.
how someone feels about the speaker For example Ive often,ꯀꯅꯥꯒꯨꯝꯕꯥ ꯑꯃꯅꯥ ꯋꯥꯉꯥꯡꯂꯣꯏ ꯑꯗꯨꯒꯤ ꯃꯔꯃꯗꯥ ꯀꯔꯝꯅꯥ ꯐꯥꯑꯣꯒꯅꯤ ꯍꯥꯌꯕꯗꯨ ꯈꯨꯗꯝ ꯑꯣꯏꯅꯥ i eve ꯑꯌꯥꯝꯕꯥ
heard a man introduce his wife Id like you to meet my wife,ꯑꯩꯒꯤ ꯅꯨꯄꯤꯒꯥ ꯎꯅꯅꯕꯥ ꯅꯨꯄꯥ ꯑꯃꯅꯥ ꯃꯍꯥꯛꯀꯤ ꯅꯨꯄꯤ ꯑꯥꯏ.ꯗꯤ.
Wilma Or a wife say Th is is my husband Harold,ꯋꯤꯂꯃꯥ ꯅꯠꯔꯒꯥ ꯅꯨꯄꯤ ꯑꯃꯅꯥ ꯍꯥꯌꯔꯤ ꯊ ꯑꯁꯤ ꯑꯩꯒꯤ ꯃꯄꯨꯔꯣꯏꯕꯥ ꯍꯦꯔꯣꯜꯗꯅꯤ꯫
Most people would ask Whats wrong with that? Can,ꯑꯌꯥꯝꯕꯥ ꯃꯤꯑꯣꯏꯁꯤꯡꯅꯥ ꯃꯗꯨꯗꯥ ꯀꯔꯤ ꯑꯔꯥꯅꯕꯥ ꯇꯧꯔꯤꯕꯅꯣ ꯍꯥꯌꯅꯥ ꯍꯪꯂꯃꯒꯅꯤ?
you guess? It will be obvious after I tell you about a bigheaded,ꯑꯗꯣꯝꯅꯥ ꯈꯜꯂꯤꯕꯔꯥ?
former boss,ꯍꯥꯟꯅꯒꯤ ꯕꯣꯁ .
Whenever this man introduced me he would arrogantly,ꯃꯤꯑꯣꯏ ꯑꯁꯤꯅꯥ ꯑꯩꯉꯣꯟꯗꯥ ꯈꯉꯍꯅꯕꯥ ꯃꯇꯝ ꯈꯨꯗꯤꯡꯗꯥ ꯃꯍꯥꯛꯅꯥ ꯑꯍꯣꯡꯕꯥ ꯄꯨꯔꯛꯇꯨꯅꯥ .
announce Th is is my assistant Leil Once it was Th is is my,ꯑꯦꯅꯥꯎꯟꯁ ꯊ ꯏꯖ ꯏꯖ ꯃꯥꯏ ꯑꯦꯁꯤꯁ꯭ꯇꯦꯟꯇ ꯂꯦꯏꯜ ꯑꯃꯨꯛ ꯍꯟꯅꯥ ꯊ ꯑꯁꯤ ꯑꯩꯒꯤ
assistant uh uh Leil,ꯑꯦꯁꯤꯁ꯭ꯇꯦꯟꯇ ꯎꯍ ꯎꯍ ꯂꯦꯏꯜ
Th e facts were correct I was indeed his assistant What,Th e facts were correct ꯑꯩꯍꯥꯛ ꯇꯁꯦꯡꯅꯥ ꯃꯍꯥꯛꯀꯤ ꯑꯦꯁꯤꯁ꯭ꯇꯦꯟꯇ ꯑꯣꯏꯅꯥ ꯀꯔꯤ ꯇꯧꯈꯤꯕꯒꯦ
stung was the order of his words He said it as though his  rst,ꯁ꯭ꯇꯨꯡ ꯑꯁꯤ ꯃꯍꯥꯛꯀꯤ ꯋꯥꯍꯩꯁꯤꯡꯒꯤ ꯑꯣꯔꯗꯔ ꯑꯣꯏꯈꯤ ꯃꯍꯥꯛꯅꯥ ꯍꯥꯌꯈꯤ ꯃꯗꯨꯗꯤ ꯃꯍꯥꯛꯀꯤ ꯑꯥꯔ.ꯑꯦꯁ.ꯇꯤ.
four words were the only essential ones and the last word my,ꯋꯥꯍꯩ ꯃꯔꯤ ꯑꯁꯤ ꯇꯉꯥꯏꯐꯗꯕꯥ ꯑꯃꯠꯇꯥ ꯑꯣꯏꯈꯤꯗꯦ ꯑꯃꯁꯨꯡ ꯑꯔꯣꯏꯕꯥ ꯋꯥꯍꯩ ꯑꯁꯤ ꯑꯩꯒꯤꯅꯤ꯫
name was optional Would it have hurt his selfimage to think,ꯃꯤꯡ ꯑꯁꯤ ꯑꯣꯄꯁꯅꯦꯜ ꯑꯣꯏꯈꯤ ꯃꯁꯤꯅꯥ ꯃꯍꯥꯛꯀꯤ ꯁꯦꯜꯐ-ꯏꯃꯦꯖꯗꯥ ꯑꯋꯥꯕꯥ ꯄꯤꯈꯤꯒꯅꯤ ꯍꯥꯌꯅꯥ ꯈꯅꯈꯤ
16  How to Instantly Connect with Anyone,꯱꯶ ꯀꯅꯥꯒꯨꯝꯕꯥ ꯑꯃꯒꯥ ꯃꯇꯧ ꯀꯔꯝꯅꯥ ꯈꯨꯗꯛꯇꯥ ꯁꯝꯅꯒꯅꯤ .
of me as a human being whom he employed as his assistant,ꯃꯍꯥꯛꯀꯤ ꯑꯦꯁꯤꯁ꯭ꯇꯦꯟꯇ ꯑꯣꯏꯅꯥ ꯊꯕꯛ ꯇꯧꯔꯝꯕꯥ ꯃꯤꯑꯣꯏꯕꯥ ꯑꯃꯥ ꯑꯣꯏꯅꯥ ꯑꯩꯕꯨ .
rather than any featherless biped who could  ll that role? I,ꯃꯗꯨꯒꯤ ꯃꯍꯨꯠꯇꯥ ꯀꯅꯥꯅꯥ ꯊꯧꯗꯥꯡ ꯑꯗꯨ ll ꯇꯧꯕꯥ ꯉꯃꯒꯅꯤ?
wished hed dismount his high horse just once to predict how,ꯋꯤꯁꯗ ꯍꯦꯗ ꯗꯤꯁꯃꯥꯎꯟꯇ ꯃꯍꯥꯛꯀꯤ ꯍꯥꯏ ꯍꯣꯔꯁ ꯁꯨꯞꯅꯇꯒꯤ ꯑꯃꯨꯀꯈꯛꯇꯪ ꯂꯥꯎꯊꯣꯀꯄꯥ ꯃꯇꯧ ꯀꯔꯝꯅꯥ .
the way he worded his sentence made me feel demeaned and dis,ꯃꯍꯥꯛꯅꯥ ꯃꯍꯥꯛꯀꯤ ꯋꯥꯍꯩ ꯑꯗꯨ ꯋꯥꯍꯩꯅꯥ ꯐꯣꯡꯗꯣꯀꯈꯤꯕꯥ ꯃꯑꯣꯡ ꯑꯗꯨꯅꯥ ꯑꯩꯉꯣꯟꯗꯥ ꯃꯤꯅꯨꯡꯁꯤ ꯂꯩꯠꯔꯕꯥ ꯑꯃꯁꯨꯡ ꯗꯤꯁ
connected from him People would have a di erent impression,ꯃꯍꯥꯛꯀꯤ ꯃꯐꯃꯗꯒꯤ ꯀꯅꯦꯛꯇ ꯇꯧꯔꯕꯥ ꯃꯤꯑꯣꯏꯁꯤꯡꯅꯥ ꯗꯤ ꯑꯦꯔꯦꯟꯇ ꯏꯝꯄꯦꯔꯦꯁꯟ ꯑꯃꯥ ꯂꯩꯒꯅꯤ .
of both of us if he had said Th is is Leil my assistant putting,ꯑꯩꯈꯣꯌ ꯑꯅꯤꯒꯤ ꯃꯅꯨꯡꯗꯥ ꯀꯔꯤꯒꯨꯝꯕꯥ ꯃꯍꯥꯛꯅꯥ ꯍꯥꯌꯔꯝꯂꯕꯗꯤ ꯊ ꯏꯖ ꯂꯦꯏꯜ ꯑꯩꯒꯤ ꯑꯦꯁꯤꯁ꯭ꯇꯦꯟꯇ ꯄꯨꯇꯤꯡ
my name  rst,ꯑꯩꯒꯤ ꯃꯤꯡ ꯑꯥꯔ.ꯑꯦꯁ.ꯇꯤ.
Whoa! Back up Leil Youre being way too sensitive,ꯋꯥꯌꯥ!
My answer is everybody is supersensitivewhen it comes,ꯑꯩꯒꯤ ꯄꯥꯎꯈꯨꯃꯗꯤ ꯃꯤꯄꯨꯝ ꯈꯨꯗꯤꯡꯃꯛ ꯑꯁꯤ ꯂꯥꯀꯄꯥ ꯃꯇꯃꯗꯥ ꯁꯨꯄꯔꯁꯦꯟꯁꯤꯇꯤꯕ ꯑꯣꯏꯔꯤ .
to themselves,ꯃꯁꯥꯃꯀꯄꯨ .
didnt have the Emotional Prediction that the CEO in the,ꯗꯤꯗꯟꯇ ꯑꯁꯤ ꯏꯃꯣꯁꯅꯦꯜ ꯄ꯭ꯔꯤꯗꯤꯛꯁꯟ ꯂꯩꯕꯥ ꯁꯤ.ꯏ.ꯑꯣ.
Introduction did,ꯏꯅꯠꯔꯣꯗ꯭ꯌꯨꯁꯟ ꯇꯧꯈꯤꯕꯥ .
Its subtle Its subliminal It takes superior sensitivity But,ꯃꯁꯤꯒꯤ ꯃꯌꯦꯛ ꯁꯦꯡꯕꯥ ꯃꯁꯤꯒꯤ ꯁꯕꯂꯤꯃꯤꯅꯦꯜ ꯑꯁꯤꯅꯥ ꯍꯦꯟꯅꯥ ꯐꯕꯥ ꯁꯦꯟꯁꯤꯇꯤꯕꯤꯇꯤ ꯂꯧꯏ ꯑꯗꯨꯕꯨ .
them feel good not only about themselves but about you,ꯃꯈꯣꯌꯅꯥ ꯃꯁꯥꯒꯤ ꯃꯔꯃꯗꯥ ꯈꯛꯇꯥ ꯅꯠꯇꯅꯥ ꯑꯗꯣꯃꯒꯤ ꯃꯔꯃꯗꯥ ꯅꯨꯡꯉꯥꯏꯕꯥ ꯐꯥꯑꯣꯏ
Th ey probably wont even be aware of whether their name,Th ey ꯅꯥ ꯃꯈꯣꯌꯒꯤ ꯃꯃꯤꯡ .
came before or after their position Th eyll just know they feel,ꯂꯥꯀꯈꯤ ꯃꯃꯥꯡꯗꯥ ꯅꯠꯔꯒꯥ ꯃꯇꯨꯡꯗꯥ ꯃꯈꯣꯌꯒꯤ ꯄꯣꯖꯤꯁꯟ th eyll just know they feel
better when theyre around you,ꯃꯈꯣꯌꯅꯥ ꯅꯍꯥꯛꯀꯤ ꯑꯀꯣꯌꯕꯗꯥ ꯂꯩꯕꯥ ꯃꯇꯃꯗꯥ ꯍꯦꯟꯅꯥ ꯐꯕꯥ .
Put Th eir Name Before Th eir Position,Th eir name th eir ꯄꯣꯖꯤꯁꯅꯒꯤ ꯃꯃꯥꯡꯗꯥ ꯊꯝꯕꯥ .
my boyfriend,ꯑꯩꯒꯤ ꯕꯣꯏꯐ꯭ꯔꯦꯟꯗ
Replace the subconscious pain prick with the pleasurepat of,ꯁꯕꯀꯟꯁꯤꯑꯦꯜ ꯄꯦꯟ ꯄ꯭ꯔꯤꯛ ꯑꯁꯤ ꯄ꯭ꯂꯦꯁꯄꯦꯠ ꯑꯗꯨꯒꯥ ꯃꯍꯨꯠ ꯁꯤꯜꯂꯨ꯫
hearing Wilma my wife,ꯋꯥ ꯇꯥꯕꯥ ꯋꯤꯂꯃꯥ ꯑꯩꯒꯤ ꯅꯨꯄꯤ
If it is not something simple like my wife stop after say,ꯀꯔꯤꯒꯨꯝꯕꯥ ꯃꯁꯤ ꯑꯩꯒꯤ ꯅꯨꯄꯤꯒꯨꯝꯕꯥ ꯏꯆꯝ ꯆꯝꯕꯥ ꯋꯥꯐꯝ ꯑꯃꯥ ꯑꯣꯏꯗ꯭ꯔꯕꯗꯤ ꯍꯥꯌꯔꯕꯥ ꯃꯇꯨꯡꯗꯥ ꯁ꯭ꯇꯞ .
ing her name Th en start a new sentence heralding her rela,ing her name th en ꯑꯅꯧꯕꯥ ꯋꯥꯍꯩ ꯄꯔꯦꯡ ꯑꯃꯥ ꯍꯦꯔꯥꯜꯗꯤꯡ ꯍꯦꯔꯥꯜꯗꯤꯡ ꯃꯍꯥꯛꯀꯤ Rela
tionship to you I dreamed of hearing Mr Pompous say Id,TIONSHIP TO YOU ꯑꯩꯅꯥ ꯁꯨꯞꯅꯇꯒꯤ ꯃꯤꯁ꯭ꯇꯔ ꯄꯣꯝꯄꯨꯁ ꯍꯥꯌꯕꯥ ꯇꯥꯕꯒꯤ ꯃꯪꯂꯥꯟ ꯇꯧꯈꯤ id
like to introduce you to Leil She is my assistant who has been,ꯂꯥꯏꯛ ꯇꯨ ꯏꯅꯠꯔꯣꯗ ꯇꯨ ꯂꯦꯏꯜ ꯃꯍꯥꯛ ꯑꯁꯤ ꯑꯩꯒꯤ ꯑꯦꯁꯤꯁ꯭ꯇꯦꯟꯇꯅꯤ ꯃꯗꯨꯗꯤ ꯃꯍꯥꯛꯅꯥ .
working for me for three months,ꯑꯩꯒꯤꯗꯃꯛ ꯊꯥ ꯑꯍꯨꯃꯒꯤ ꯊꯕꯛ ꯇꯧꯕꯥ
How to Make People Appreciate Your Introduction  17,ꯃꯤꯌꯥꯝꯅꯥ ꯑꯗꯣꯃꯒꯤ ꯏꯅꯠꯔꯣꯗ꯭ꯌꯨꯁꯟ ꯱꯷ ꯑꯁꯤ ꯃꯇꯧ ꯀꯔꯝꯅꯥ ꯊꯥꯒꯠꯀꯗꯒꯦ 17꯫
And of course I wouldnt have minded if he insisted on,ꯑꯃꯁꯨꯡ ꯇꯁꯦꯡꯅꯥ ꯑꯩꯍꯥꯛꯅꯥ ꯀꯔꯤꯒꯨꯝꯕꯥ ꯃꯍꯥꯛꯅꯥ ꯑꯀꯅꯕꯥ ꯋꯥꯐꯝ ꯊꯝꯂꯕꯗꯤ ꯑꯩꯍꯥꯛꯅꯥ ꯋꯥꯈꯜ ꯋꯥꯕꯥ ꯊꯦꯡꯅꯈꯤꯗꯦ꯫
us All the world loves a lover He forgot to add All the,ꯑꯩꯈꯣꯌ ꯄꯨꯝꯅꯃꯛ ꯃꯥꯂꯦꯝ ꯄꯨꯝꯕꯅꯥ ꯅꯨꯡꯁꯤꯖꯕꯥ ꯃꯤꯑꯣꯏ ꯑꯃꯕꯨ ꯃꯍꯥꯛꯅꯥ ꯀꯥꯑꯣꯊꯣꯀꯈꯤꯕꯥ ꯄꯨꯝꯅꯃꯛ ꯑꯁꯤ ꯄꯨꯝꯅꯃꯛ
world likes a liker,ꯋꯥꯔꯜꯗ ꯂꯥꯏꯛ ꯑꯦ ꯂꯥꯏꯀꯔ
Dale vs Leil,ꯗꯦꯜ ꯕꯅꯥꯝ ꯂꯦꯏꯜ
If Dale Carnegie were alive today he and I would duel with our,ꯀꯔꯤꯒꯨꯝꯕꯥ ꯗꯦꯜ ꯀꯥꯔꯅꯦꯒꯤꯅꯥ ꯉꯁꯤ ꯍꯤꯡꯂꯝꯂꯕꯗꯤ ꯃꯍꯥꯛ ꯑꯃꯁꯨꯡ ꯑꯩꯍꯥꯛꯅꯥ ꯑꯩꯈꯣꯌꯒꯤ ꯋꯥꯔꯤꯒꯥ ꯂꯣꯌꯅꯅꯥ ꯗꯨꯌꯦꯜ ꯇꯧꯔꯝꯂꯒꯅꯤ꯫
pens over the next Little Trick Mr Carnegies reputed hail,ꯃꯊꯪꯒꯤ ꯂꯤꯇꯜ ꯇ꯭ꯔꯤꯛ ꯑꯁꯤꯒꯤ ꯃꯇꯥꯡꯗꯥ ꯄꯦꯅꯁꯤꯡ ꯁ꯭ꯔꯤ ꯀꯥꯔꯅꯦꯖꯤꯅꯥ ꯍꯥꯌꯈꯤ
fellow well met philosophy was excellent for the 1930s and,ꯐꯦꯂꯣ ꯋꯦꯜ ꯃꯦꯠ ꯐꯤꯂꯣꯁꯣꯐꯤ ꯑꯁꯤ ꯱꯹꯳꯰ꯒꯤ ꯃꯇꯃꯗꯥ ꯌꯥꯝꯅꯥ ꯐꯕꯥ ꯑꯣꯏꯈꯤ ꯑꯃꯁꯨꯡ .
for many decades thereafter In the new millennium however,ꯑꯗꯨꯝ ꯑꯣꯏꯅꯃꯛ ꯃꯗꯨꯒꯤ ꯃꯇꯨꯡꯗꯥ ꯑꯅꯧꯕꯥ ꯃꯤꯔꯣꯜ ꯑꯁꯤꯗꯥ ꯆꯍꯤ ꯇꯔꯥꯒꯤ ꯈꯨꯖꯤꯡ ꯀꯌꯥꯒꯤ ꯑꯣꯏꯅꯥ .
many of us have had it up to our ears with hyper types who,ꯑꯩꯈꯣꯌꯒꯤ ꯃꯔꯛꯇꯥ ꯀꯌꯥ ꯑꯃꯅꯥ ꯃꯁꯤ ꯍꯥꯏꯄꯔ ꯃꯈꯂꯁꯤꯡꯒꯥ ꯂꯣꯌꯅꯅꯥ ꯑꯩꯈꯣꯌꯒꯤ ꯅꯥꯀꯣꯡ ꯐꯥꯑꯣꯕꯥ ꯂꯩꯈ꯭ꯔꯦ꯫
come on big In business and social situations we respect,ꯑꯩꯈꯣꯌꯅꯥ ꯏꯀꯥꯌꯈꯨꯝꯅꯕꯥ ꯎꯠꯄꯥ ꯕꯤꯖꯤꯅꯦꯁ ꯑꯃꯁꯨꯡ ꯁꯣꯁꯤꯌꯦꯜ ꯁꯤꯆꯨꯌꯦꯁꯟꯗꯥ ꯑꯆꯧꯕꯥ ꯃꯑꯣꯡꯗꯥ ꯂꯥꯀꯄꯤꯌꯨ
people who have a more thoughtful approach to conversing,ꯋꯥꯔꯤ ꯁꯥꯅꯕꯒꯤ ꯃꯇꯥꯡꯗꯥ ꯍꯦꯟꯅꯥ ꯋꯥꯈꯜ ꯇꯥꯕꯥ ꯃꯤꯑꯣꯏꯁꯤꯡ ꯂꯩꯕꯥ ꯃꯤꯑꯣꯏꯁꯤꯡ
If you start out too lowkey though how are they to know,ꯀꯔꯤꯒꯨꯝꯕꯥ ꯅꯍꯥꯛꯅꯥ ꯌꯥꯝꯅꯥ ꯂꯣꯏꯕꯥ ꯍꯧꯔꯛꯂꯕꯗꯤ ꯃꯈꯣꯌꯅꯥ ꯀꯔꯝꯅꯥ ꯈꯉꯒꯅꯤ .
how magni cent you are? Little Trick 5,ꯑꯗꯣꯝ ꯀꯌꯥꯗꯥ ꯃꯒꯅꯤ ꯁꯦꯟꯇꯔ ꯑꯣꯏꯔꯤꯕꯅꯣ?
Say Their Name Before Their Role,ꯃꯈꯣꯌꯒꯤ ꯊꯧꯗꯥꯡꯒꯤ ꯃꯃꯥꯡꯗꯥ ꯃꯈꯣꯌꯒꯤ ꯃꯃꯤꯡ ꯍꯥꯌꯌꯨ .
in Your Life,ꯑꯗꯣꯃꯒꯤ ꯄꯨꯟꯁꯤꯗꯥ .
Dont  aunt the position someone plays in your life,ꯀꯅꯥꯒꯨꯝꯕꯥ ꯑꯃꯅꯥ ꯅꯍꯥꯛꯀꯤ ꯄꯨꯟꯁꯤꯗꯥ ꯁꯥꯟꯅꯔꯤꯕꯥ ꯄꯣꯖꯤꯁꯟ ꯑꯗꯨ ꯑꯥꯟꯇꯤ ꯑꯥꯟꯇꯤ .
rst Introduce him as a real  eshandblood human,ꯑꯥꯔ.ꯑꯦꯁ.ꯇꯤ.ꯅꯥ ꯃꯍꯥꯀꯄꯨ ꯑꯁꯦꯡꯕꯥ ꯑꯦꯁ꯭ꯍꯦꯟꯗꯕ꯭ꯂꯗ ꯃꯤꯑꯣꯏꯕꯥ ꯑꯃꯥ ꯑꯣꯏꯅꯥ ꯏꯅꯠꯔꯣꯗ .
being who actually has a life apart from youand,Youand ꯗꯒꯤ ꯇꯣꯉꯥꯟꯅꯥ ꯂꯩꯕꯥ ꯄꯨꯟꯁꯤ ꯑꯃꯥ ꯇꯁꯦꯡꯅꯥ ꯂꯩꯔꯤꯕꯥ ꯑꯣꯏꯕꯥ
even a name to go with it! After giving his name,ꯃꯁꯤꯒꯥ ꯂꯣꯌꯅꯅꯥ ꯆꯠꯅꯕꯥ ꯃꯤꯡ ꯑꯃꯥ ꯐꯥꯑꯣꯕꯥ!
insert a verbal period Th en in a new sentence,ꯑꯅꯧꯕꯥ ꯋꯥꯍꯩ ꯄꯔꯦꯡ ꯑꯃꯗꯥ ꯋꯥꯍꯩꯒꯤ ꯑꯣꯏꯕꯥ ꯃꯇꯝ ꯑꯃꯥ ꯍꯥꯄꯀꯗꯕꯅꯤ
inform your listeners of the role he has in your life,ꯅꯍꯥꯛꯀꯤ ꯄꯨꯟꯁꯤꯗꯥ ꯂꯩꯔꯤꯕꯥ ꯊꯧꯗꯥꯡ ꯑꯗꯨꯒꯤ ꯃꯇꯥꯡꯗꯥ ꯅꯍꯥꯛꯀꯤ ꯇꯥꯔꯤꯕꯥ ꯃꯤꯁꯤꯡꯗꯥ ꯈꯉꯍꯅꯕꯤꯌꯨ
18,꯱꯸ꯗꯥ ꯂꯩꯕꯥ꯫
How to Get Them,ꯃꯈꯣꯌꯁꯤꯡ ꯑꯁꯤ ꯃꯇꯧ ꯀꯔꯝꯅꯥ ꯐꯪꯒꯗꯒꯦ .
Dying to Meet You,ꯅꯉꯒꯥ ꯎꯅꯅꯕꯥ ꯁꯤꯕꯥ .
You are going to a gathering where there will be lots of new,ꯑꯗꯣꯝꯅꯥ ꯑꯅꯧꯕꯥ ꯀꯌꯥ ꯑꯃꯥ ꯂꯩꯒꯅꯤ ꯍꯥꯌꯕꯥ ꯃꯤꯐꯝ ꯑꯃꯗꯥ ꯆꯠꯀꯅꯤ .
folks So you brush your teeth spray on deodorant shine your,ꯐꯣꯜꯀꯁ ꯃꯔꯝ ꯑꯗꯨꯅꯥ ꯅꯍꯥꯛꯅꯥ ꯅꯍꯥꯛꯀꯤ ꯇꯤꯟ ꯁꯤꯠꯄꯥ ꯁ꯭ꯞꯔꯦ ꯑꯣꯟ ꯗꯤꯑꯣꯗꯔꯟꯇ ꯁꯤꯟ ꯅꯍꯥꯛꯀꯤ
shoes and look in the mirror You like what you see But will,ꯖꯨꯇꯣ ꯑꯃꯁꯨꯡ ꯃꯤꯔꯔꯗꯥ ꯌꯦꯡꯎ ꯅꯍꯥꯛꯅꯥ ꯎꯔꯤꯕꯥ ꯑꯗꯨ ꯅꯍꯥꯛꯅꯥ ꯄꯥꯝꯃꯤ ꯑꯗꯨꯕꯨ ꯇꯧꯒꯅꯤ꯫
new acquaintances agree? Suppose you are not hot or dropdead gorgeous What,ꯑꯅꯧꯕꯥ ꯃꯔꯨꯄꯁꯤꯡꯅꯥ ꯌꯥꯔꯦ?
if looks are not your strong suit? How else can you impress,ꯀꯔꯤꯒꯨꯝꯕꯥ ꯂꯨꯀꯁꯤꯡ ꯑꯁꯤ ꯅꯍꯥꯛꯀꯤ ꯑꯆꯦꯠꯄꯥ ꯁꯨꯠ ꯑꯗꯨ ꯅꯠꯇꯦ?
them? If you dont tell them about your brilliance your amaz,ꯃꯈꯣꯏ?
ing accomplishments and your um humility how will they,ing ꯑꯦꯆꯤꯕꯃꯦꯟꯇꯁꯤꯡ ꯑꯃꯁꯨꯡ ꯅꯍꯥꯛꯀꯤ ꯎꯝ ꯏꯃꯨꯂꯤꯇꯤ ꯃꯈꯣꯌꯅꯥ ꯀꯔꯝꯅꯥ ꯇꯧꯒꯅꯤ .
know? But if you do tell them they baptize you a braggart If,ꯈꯪꯕ?
you try to slip it in by saying something smart too soon they,ꯑꯗꯣꯝꯅꯥ ꯃꯁꯤ ꯌꯥꯝꯅꯥ ꯊꯨꯅꯥ ꯁ꯭ꯃꯥꯔꯠ ꯑꯣꯏꯕꯥ ꯋꯥꯐꯝ ꯑꯃꯥ ꯍꯥꯌꯗꯨꯅꯥ ꯃꯁꯤꯕꯨ ꯂꯧꯊꯣꯛꯅꯕꯥ ꯍꯣꯠꯅꯔꯤ ꯃꯈꯣꯌꯅꯥ .
So whats someone like you with a myriad of marvelous,ꯑꯗꯨꯅꯥ ꯑꯗꯣꯃꯒꯨꯝꯕꯥ ꯀꯅꯥꯒꯨꯝꯕꯥ ꯑꯃꯅꯥ ꯑꯉꯀꯄꯥ ꯋꯥꯐꯝ ꯑꯃꯒꯥ ꯂꯣꯌꯅꯅꯥ ꯑꯗꯣꯃꯒꯨꯝꯕꯥ ꯀꯅꯥꯒꯨꯝꯕꯥ ꯑꯃꯕꯨ
qualities and exceptional achievements to do? Enter Little,ꯇꯧꯒꯗꯕꯥ ꯃꯒꯨꯅꯁꯤꯡ ꯑꯃꯁꯨꯡ ꯑꯈꯟꯅꯕꯥ ꯑꯦꯆꯤꯕꯃꯦꯟꯇꯁꯤꯡ?
Trick 6,ꯇ꯭ꯔꯤꯛ ꯶.
Have you ever listened to a lecture by some socalled celeb,ꯑꯗꯣꯝꯅꯥ ꯀꯔꯤꯒꯨꯝꯕꯥ ꯃꯇꯃꯗꯥ ꯁꯣꯀꯜ ꯁꯦꯂꯦꯕꯁ ꯈꯔꯒꯤ ꯂꯦꯀꯆꯔ ꯑꯃꯥ ꯇꯥꯕꯤꯔꯝꯂꯕꯔꯥ .
rity you never heard of? Th e introducer exaggerates endlessly,ꯔꯤꯇꯤ ꯑꯗꯣꯝꯅꯥ ꯀꯩꯗꯧꯉꯩꯗꯥ ꯇꯥꯈꯤꯗ꯭ꯔꯤꯕꯔꯥ?
about her triumphs and talents After such an in ated intro,ꯑꯁꯤꯒꯨꯝꯕꯥ ꯏꯟ ꯑꯦꯇꯦꯗ ꯏꯟꯠꯔꯣꯒꯤ ꯃꯇꯨꯡꯗꯥ ꯃꯍꯥꯛꯀꯤ ꯃꯥꯏꯄꯥꯀꯄꯥ ꯑꯃꯁꯨꯡ ꯇꯦꯂꯦꯟꯇꯁꯤꯡꯒꯤ ꯃꯇꯥꯡꯗꯥ
duction the audience is salivating to see and hear this highly,DUCTION ꯑꯁꯤ ꯌꯥꯝꯅꯥ ꯋꯥꯡꯅꯥ ꯎꯕꯥ ꯑꯃꯁꯨꯡ ꯇꯥꯕꯥ ꯉꯝꯅꯕꯥ ꯑꯣꯗꯤꯁꯟꯅꯥ ꯂꯥꯡꯇꯛꯅꯔꯤ .
esteemed individual,ꯏꯁ꯭ꯇꯤꯃꯦꯠ ꯇꯧꯔꯕꯥ ꯃꯤꯑꯣꯏ ꯑꯃꯥ .
How Does Th at Help Me? Im Not Making Any Speeches,ꯊ ꯑꯦꯠ ꯑꯁꯤꯅꯥ ꯑꯩꯉꯣꯟꯗꯥ ꯀꯔꯝꯅꯥ ꯃꯇꯦꯡ ꯄꯥꯡꯒꯅꯤ?
Yes you are! Every time you open your mouth you are in,ꯍꯣꯌ ꯅꯉꯅꯥ ꯂꯩꯔꯤꯕꯅꯤ!
essence making a speechespecially when meeting someone,ꯀꯅꯥꯒꯨꯝꯕꯥ ꯑꯃꯒꯥ ꯎꯅꯕꯗꯥ ꯋꯥ ꯉꯥꯡꯕꯥ ꯑꯃꯥ ꯁꯦꯝꯕꯥ .
new And like the socalled celebrity if somebody gives you,ꯀꯅꯥꯒꯨꯝꯕꯥ ꯑꯃꯅꯥ ꯑꯗꯣꯃꯗꯥ ꯄꯤꯔꯕꯗꯤ ꯑꯅꯧꯕꯥ ꯑꯃꯁꯨꯡ ꯁꯣꯀꯜ ꯁꯦꯂꯤꯕ꯭ꯔꯦꯇꯤ ꯂꯥꯏꯛ ꯗ ꯁꯣꯀꯜ ꯁꯦꯂꯤꯕ꯭ꯔꯦꯇꯤ
a great introduction before they meet you you have a primed,ꯑꯆꯧꯕꯥ ꯏꯅꯠꯔꯣꯗ꯭ꯌꯨꯁꯟ ꯑꯃꯥ ꯃꯈꯣꯌꯅꯥ ꯑꯗꯣꯃꯒꯥ ꯎꯅꯗ꯭ꯔꯤꯉꯩ ꯃꯃꯥꯡꯗꯥ ꯑꯗꯣꯃꯒꯤ ꯃꯐꯃꯗꯥ ꯄ꯭ꯔꯥꯏꯝ ꯑꯃꯥ ꯂꯩꯔꯤ .
audience,ꯚꯥꯕꯣꯛ
Let me tell you how I discovered this Little Trick A friend,ꯑꯩꯍꯥꯛꯅꯥ ꯃꯇꯧ ꯀꯔꯝꯅꯥ ꯃꯁꯤꯒꯤ ꯑꯄꯤꯀꯄꯥ ꯇ꯭ꯔꯤꯛ ꯑꯁꯤ ꯃꯔꯨꯞ ꯑꯃꯥ ꯑꯣꯏꯅꯥ ꯊꯤꯗꯣꯀꯈꯤꯕꯒꯦ ꯍꯥꯌꯕꯗꯨ ꯑꯩꯍꯥꯛꯅꯥ ꯍꯥꯌꯖꯒꯦ
in Chicago took me to a meeting at her chamber of commerce,ꯆꯤꯀꯥꯒꯣꯗꯥ ꯑꯩꯍꯥꯀꯄꯨ ꯃꯍꯥꯛꯀꯤ ꯆꯦꯝꯕꯔ ꯑꯣꯐ ꯀꯝꯃꯔꯁꯇꯥ ꯃꯤꯐꯝ ꯑꯃꯗꯥ ꯄꯨꯔꯀꯈꯤ
After the presentation I was talking with a member named,ꯄ꯭ꯔꯖꯦꯟꯇꯦꯁꯟ ꯑꯗꯨꯒꯤ ꯃꯇꯨꯡꯗꯥ ꯑꯩꯍꯥꯛꯅꯥ ꯃꯃꯤꯡ ꯂꯩꯔꯕꯥ ꯃꯦꯝꯕꯔ ꯑꯃꯒꯥ ꯋꯥꯔꯤ ꯁꯥꯅꯔꯝꯃꯤ꯫
Foster a HewlettPackard salesman While waiting for the,ꯉꯥꯏꯔꯤꯉꯩꯗꯥ ꯍꯦꯚꯂꯇꯄꯦꯀꯔ ꯁꯦꯂꯁꯃꯦꯟ ꯑꯃꯥ ꯐꯣꯁ꯭ꯇꯔ ꯇꯧꯕꯥ
coordinators to bring out some snacks we were discussing,ꯀꯣꯑꯣꯔꯗꯤꯅꯦꯇꯔꯁꯤꯡꯅꯥ ꯑꯩꯈꯣꯌꯅꯥ ꯈꯟꯅꯔꯝꯕꯥ ꯁ꯭ꯅꯦꯛ ꯈꯔꯥ ꯂꯧꯊꯣꯛꯅꯕꯥ .
food as hungry people often do,ꯂꯃꯍꯥꯡꯗꯥ ꯈꯣꯉ ꯍꯥꯃꯗꯕꯥ ꯃꯤꯑꯣꯏꯁꯤꯡꯒꯨꯝꯅꯥ ꯆꯥꯕꯥ .
duce you to a friend of mine a chef I know youll like him,ꯗ꯭ꯌꯨꯁ ꯏꯎ ꯇꯨ ꯑꯦ ꯐ꯭ꯔꯦꯟꯗ ꯑꯣꯐ ꯃꯥꯏꯟ ꯑꯦ ꯆꯦꯐ ꯑꯩꯅꯥ ꯈꯉꯕꯥ ꯅꯍꯥꯛꯅꯥ ꯃꯍꯥꯀꯄꯨ ꯄꯥꯝꯃꯤ꯫
Roberto does a lot of community work In fact he ran in the,ꯔꯣꯕꯔꯇꯣꯅꯥ ꯀꯝꯝꯌꯨꯅꯤꯇꯤꯒꯤ ꯊꯕꯛ ꯀꯌꯥ ꯑꯃꯥ ꯇꯧꯏ ꯇꯁꯦꯡꯅꯥ ꯃꯍꯥꯛꯅꯥ ꯔꯟ ꯇꯧꯈꯤ꯫
Chicago marathon to  ght breast cancer last year,ꯃꯃꯥꯡ ꯆꯍꯤꯗꯥ ꯆꯤꯀꯥꯒꯣ ꯃꯦꯔꯥꯊꯣꯟ ꯇꯨ ꯘ꯭ꯠ ꯕ꯭ꯔꯦꯁ꯭ꯠ ꯀꯦꯟꯁꯔ
Cool! I want to meet this athletic chef who supported breast,ꯑꯌꯤꯡꯕ!
cancer research,ꯀꯦꯟꯁꯔꯒꯤ ꯔꯤꯁꯔꯆ ꯇꯧꯕꯥ
Would it have been smooth for Roberto to tell me his,ꯔꯣꯕꯔꯇꯣꯅꯥ ꯑꯩꯉꯣꯟꯗꯥ ꯍꯥꯌꯕꯤꯔꯀꯄꯥ ꯑꯁꯤ ꯌꯥꯝꯅꯥ ꯅꯨꯡꯉꯥꯏꯕꯥ ꯋꯥꯐꯝ ꯑꯃꯥ ꯑꯣꯏꯔꯝꯂꯒꯅꯤ
impressive credentials out of the blue during the discussion? Of course not Even if Foster had sung Robertos praise dur,ꯈꯟꯅ-ꯅꯩꯅꯕꯒꯤ ꯃꯇꯃꯗꯥ ꯕ꯭ꯂꯨꯗꯒꯤ ꯊꯣꯀꯄꯥ ꯏꯝꯄꯦꯛꯇ ꯀ꯭ꯔꯦꯗꯦꯟꯁꯤꯑꯦꯂꯁꯤꯡ?
about him  rst from someone elseand meeting him after,ꯃꯍꯥꯛꯀꯤ ꯃꯔꯃꯗꯥ ꯑꯇꯣꯞꯄꯥ ꯀꯅꯥꯒꯨꯝꯕꯥ ꯑꯃꯗꯒꯤ rst ꯑꯃꯁꯨꯡ ꯃꯍꯥꯛꯀꯥ ꯎꯅꯕꯒꯤ ꯃꯇꯨꯡꯗꯥ
was the winning combination,ꯋꯥꯁ ꯋꯤꯟ ꯀꯝꯕꯤꯅꯦꯁꯟ .
You Toot My Horn and Ill Toot Yours,ꯅꯍꯥꯛꯅꯥ ꯑꯩꯒꯤ ꯁꯉ꯭ꯒꯣꯝ ꯑꯃꯁꯨꯡ ꯏꯜ ꯇꯨꯠ ꯅꯍꯥꯛꯀꯤ ꯇꯨꯠ
I never would have become wise to their game if a short time,ꯑꯩꯍꯥꯛ ꯀꯩꯗꯧꯅꯨꯡꯗꯥ ꯃꯈꯣꯌꯒꯤ ꯒꯦꯝ ꯑꯁꯤ ꯌꯥꯝꯅꯥ ꯊꯨꯅꯥ ꯌꯥꯡꯅꯥ ꯆꯠꯄꯥ ꯉꯝꯂꯃꯂꯣꯏ .
later I hadnt been standing with Roberto and a few men who,ꯃꯇꯨꯡꯗꯥ ꯑꯩꯍꯥꯛꯅꯥ ꯔꯣꯕꯔꯇꯣ ꯑꯃꯁꯨꯡ ꯅꯨꯄꯥ ꯈꯔꯒꯥ ꯂꯣꯌꯅꯅꯥ ꯂꯦꯞꯄꯥ ꯂꯩꯇꯅꯥ ꯋꯥꯔꯤ ꯁꯥꯟꯅꯈꯤꯗꯦ
20  How to Instantly Connect with Anyone,꯲꯰ ꯀꯅꯥꯒꯨꯝꯕꯥ ꯑꯃꯒꯥ ꯃꯇꯧ ꯀꯔꯝꯅꯥ ꯈꯨꯗꯛꯇꯥ ꯁꯝꯅꯒꯅꯤ .
were talking aboutwhat else?sports Th at was Robertos,ꯋꯥꯔꯤ ꯁꯥꯈꯤꯕꯁꯤ ꯀꯔꯤꯒꯤꯅꯣ?ꯁ꯭ꯄꯣꯔꯇꯁ ꯊ ꯑꯦꯠ ꯋꯥꯁ ꯔꯣꯕꯔꯇꯣꯁ .
opening Guys theres a buddy of mine standing over there,ꯑꯣꯄꯦꯅꯤꯡ ꯒꯥꯏꯁ ꯊꯦꯔꯦꯁ ꯑꯦ ꯕꯗꯗꯤ ꯑꯣꯐ ꯃꯥꯏꯒꯤ ꯃꯊꯛꯇꯥ ꯂꯦꯞꯂꯤꯕꯥ
whos headed o  to Miami for the Super Bowl in a couple of,ꯍꯨꯏꯁ ꯑꯣꯗ ꯑꯣꯗ ꯑꯣ ꯇꯨ ꯃꯤꯌꯥꯃꯤꯒꯤꯗꯃꯛ ꯁꯨꯄꯥꯔ ꯕꯣꯂꯒꯤꯗꯃꯛ ꯃꯔꯤ-ꯃꯇꯥ
weeks and hes sitting right on the 50yard line! Th e others,ꯅꯨꯃꯤꯠꯁꯤꯡ ꯑꯃꯁꯨꯡ ꯃꯍꯥꯛꯅꯥ ꯵꯰ꯒꯤ ꯂꯥꯏꯟꯗꯥ ꯊꯨꯅꯥ ꯐꯝꯂꯤ!
were obviously blown away by this marvel Yeah sure one,ꯃꯌꯦꯛ ꯁꯦꯡꯅꯥ ꯕ꯭ꯂꯣꯎꯟ ꯇꯧꯈꯤꯕꯥ ꯑꯁꯤ ꯃꯥꯔꯚꯦꯜ ꯏꯌꯦ ꯁꯣꯔ ꯋꯥꯟ
