en,mni-Mtei
know exactly what youre supposed to be doing,ꯅꯍꯥꯛꯅꯥ ꯇꯧꯒꯗꯕꯥ ꯊꯕꯛ ꯑꯗꯨ ꯇꯁꯦꯡꯅꯥ ꯈꯉꯕꯤꯌꯨ
I was supposed to be a housewife and mother living next door to my,ꯑꯩꯍꯥꯛ ꯌꯨꯃꯒꯤ ꯃꯅꯥꯛꯇꯥ ꯂꯩꯕꯥ ꯑꯃꯁꯨꯡ ꯃꯃꯥꯅꯥ ꯑꯩꯒꯤ ꯃꯅꯥꯛꯇꯥ ꯂꯩꯕꯥ ꯃꯃꯥ ꯑꯃꯥ ꯑꯣꯏꯒꯗꯧꯔꯝꯃꯤ ꯫
parents,ꯃꯃꯥꯃꯄꯥ
Everyone I ask seems to have an answer ready for this question,ꯑꯩꯅꯥ ꯍꯪꯂꯤꯕꯥ ꯃꯤꯑꯣꯏ ꯈꯨꯗꯤꯡꯃꯛꯅꯥ ꯋꯥꯍꯪ ꯑꯁꯤꯒꯤꯗꯃꯛ ꯄꯥꯎꯈꯨꯝ ꯑꯃꯥ ꯁꯦꯝ ꯁꯥꯗꯨꯅꯥ ꯂꯩꯕꯥ ꯎꯕꯥ ꯐꯪꯏ .
I was supposed to be working alongside my father at the printing,ꯑꯩꯍꯥꯛꯅꯥ ꯄ꯭ꯔꯤꯟꯇꯤꯡꯗꯥ ꯑꯩꯍꯥꯛꯀꯤ ꯏꯄꯥꯒꯥ ꯂꯣꯌꯅꯅꯥ ꯊꯕꯛ ꯇꯧꯃꯤꯟꯅꯒꯗꯧꯔꯝꯃꯤ .
I was supposed to marry old money and raise five whizbang children,ꯑꯩꯍꯥꯛꯅꯥ ꯑꯔꯤꯕꯥ ꯁꯦꯅꯐꯝ ꯑꯗꯨ ꯂꯨꯍꯣꯡꯒꯗꯕꯅꯤ ꯑꯃꯁꯨꯡ ꯍꯨꯏꯖꯕꯪꯒꯤ ꯃꯆꯥ ꯃꯉꯥ ꯈꯣꯃꯖꯤꯜꯀꯗꯕꯅꯤ .
in a mansion by the sea,ꯁꯃꯨꯗ꯭ꯔ ꯃꯄꯥꯟꯗꯥ ꯂꯩꯕꯥ ꯃꯦꯟꯁꯟ ꯑꯃꯗꯥ .
My father wanted me to be a partner in a Wall Street law firm or,ꯑꯩꯒꯤ ꯏꯄꯥꯅꯥ ꯑꯩꯕꯨ ꯋꯥꯜ ꯁ꯭ꯠꯔꯤꯠꯀꯤ ꯂꯣꯌꯁꯉ ꯑꯃꯗꯥ ꯄꯥꯔꯇꯅꯔ ꯑꯣꯏꯍꯅꯕꯥ ꯄꯥꯃꯈꯤ ꯅꯠꯔꯒꯥ .
president of a bank or a big corporationsomething big,ꯕꯦꯉ꯭ꯛ ꯑꯃꯒꯤ ꯄ꯭ꯔꯦꯁꯤꯗꯦꯟꯇ ꯅꯠꯔꯒꯥ ꯑꯆꯧꯕꯥ ꯀꯣꯔꯄꯣꯔꯦꯁꯟ ꯑꯃꯥ ꯑꯣꯏꯅꯥ ꯑꯆꯧꯕꯥ .
wonder how did you get so unlucky? Were all raised in families communities and even entire cultures that,ꯑꯗꯣꯝꯅꯥ ꯃꯇꯧ ꯀꯔꯝꯅꯥ ꯑꯁꯨꯛ ꯌꯥꯝꯅꯥ ꯂꯛꯁ꯭ꯃꯤ ꯑꯣꯏꯈꯤꯕꯒꯦ ꯍꯥꯌꯕꯗꯨ ꯈꯅꯕꯤꯌꯨ?
barrage us with messages about what they want from us Sometimes,ꯀꯔꯤꯒꯨꯝꯕꯥ ꯃꯇꯃꯗꯥ ꯃꯈꯣꯌꯅꯥ ꯑꯩꯈꯣꯌꯗꯒꯤ ꯀꯔꯤ ꯄꯥꯝꯂꯤꯕꯒꯦ ꯍꯥꯌꯕꯒꯤ ꯃꯇꯥꯡꯗꯥ ꯄꯥꯎꯖꯦꯂꯁꯤꯡꯒꯥ ꯂꯣꯌꯅꯅꯥ ꯑꯩꯈꯣꯌꯕꯨ ꯕꯦꯔꯦꯖ ꯇꯧꯕꯥ
these messages are as blatant as billboards Get married Make,ꯍꯥꯌꯔꯤꯕꯥ ꯄꯥꯎꯖꯦꯂꯁꯤꯡ ꯑꯁꯤ ꯕꯤꯂꯕꯣꯔꯗꯁꯤꯡꯅꯥ ꯂꯨꯍꯣꯡꯕꯥ ꯃꯇꯃꯗꯥ ꯌꯥꯝꯅꯥ ꯊꯨꯅꯥ ꯌꯥꯡꯅꯥ ꯆꯠꯂꯤ .
money Buy your own home Other times the messages are stealthy,ꯃꯅꯤ ꯑꯗꯣꯃꯒꯤ ꯏꯁꯥꯒꯤ ꯌꯨꯝ ꯌꯣꯅꯕꯥ ꯑꯇꯣꯞꯄꯥ ꯃꯇꯃꯗꯥ ꯄꯥꯎꯖꯦꯂꯁꯤꯡ ꯑꯗꯨ ꯆꯨꯝꯃꯤ
they sneak in Then they stay in They never come out where we can get,ꯃꯈꯣꯌꯅꯥ ꯍꯨꯔꯥꯅꯈꯤ ꯃꯗꯨꯗꯥ ꯃꯈꯣꯌꯅꯥ ꯂꯩꯔꯤ ꯃꯗꯨꯗꯤ ꯃꯈꯣꯌꯅꯥ ꯀꯩꯗꯧꯅꯨꯡꯗꯥ ꯊꯣꯛꯇꯦ ꯑꯩꯈꯣꯌꯅꯥ ꯐꯪꯒꯗꯕꯥ ꯃꯐꯝ ꯑꯗꯨꯗꯥ .
a good look at them and dismiss them or embrace them openly,ꯃꯈꯣꯌꯕꯨ ꯑꯐꯕꯥ ꯃꯑꯣꯡꯗꯥ ꯌꯦꯡꯕꯤꯌꯨ ꯑꯃꯁꯨꯡ ꯃꯈꯣꯌꯕꯨ ꯊꯥꯗꯣꯀꯄꯥ ꯅꯠꯔꯒꯥ ꯑꯃꯨꯛꯇꯪ ꯂꯧꯁꯤꯅꯖꯕꯥ .
We usually forget when and how we first received these messages,ꯑꯩꯈꯣꯌꯅꯥ ꯃꯍꯧꯁꯥꯅꯥ ꯑꯩꯈꯣꯌꯅꯥ ꯑꯍꯥꯅꯕꯥ ꯑꯣꯏꯅꯥ ꯄꯥꯎꯖꯦꯂꯁꯤꯡ ꯑꯁꯤ ꯀꯗꯥꯌꯗꯥ ꯑꯃꯁꯨꯡ ꯀꯔꯝꯅꯥ ꯐꯪꯈꯤꯕꯒꯦ ꯍꯥꯌꯕꯗꯨ ꯀꯥꯑꯣꯊꯣꯛꯂꯤ .
messages even when theyre not spoken,ꯃꯈꯣꯌꯅꯥ ꯋꯥꯔꯤ ꯁꯥꯅꯗ꯭ꯔꯤꯉꯩꯗꯥ ꯐꯥꯑꯣꯕꯥ ꯄꯥꯎꯖꯦꯂꯁꯤꯡ .
And each message we getblatant or invisiblestays inside us where,ꯑꯃꯁꯨꯡ ꯑꯩꯈꯣꯌꯅꯥ ꯒꯦꯠꯕ꯭ꯂꯦꯇꯦꯟꯇ ꯅꯠꯔꯒꯥ ꯏꯅꯚꯤꯖꯤꯕꯂꯁ꯭ꯇꯦꯁ ꯑꯩꯈꯣꯌꯒꯤ ꯃꯅꯨꯡꯗꯥ ꯂꯩꯕꯥ ꯃꯦꯁꯦꯖ ꯈꯨꯗꯤꯡꯃꯛ ꯃꯐꯝ ꯑꯗꯨꯗꯥ .
it can sit unexamined throughout our adult lives undermining our,ꯃꯁꯤꯅꯥ ꯑꯩꯈꯣꯌꯒꯤ ꯑꯦꯗꯜꯇ ꯂꯥꯏꯐ ꯄꯨꯝꯅꯃꯛꯇꯥ ꯃꯤꯠꯌꯦꯡ ꯊꯃꯗꯅꯥ ꯐꯃꯗꯨꯅꯥ ꯂꯩꯕꯥ ꯌꯥꯏ ꯑꯩꯈꯣꯌꯒꯤ .
happiness For example even if you seem to know what you want thrive,ꯍꯔꯥꯑꯣꯕꯥ ꯈꯨꯗꯝ ꯑꯣꯏꯅꯥ ꯅꯍꯥꯛꯅꯥ ꯀꯔꯤ ꯄꯥꯝꯂꯤꯕꯒꯦ ꯍꯥꯌꯕꯗꯨ ꯅꯍꯥꯛꯅꯥ ꯈꯉꯂꯕꯁꯨ thrive .
at your work and are fascinated by it you can have a nagging feeling that,ꯅꯍꯥꯛꯀꯤ ꯊꯕꯛꯇꯥ ꯑꯃꯁꯨꯡ ꯃꯁꯤꯅꯥ ꯃꯤꯠꯌꯦꯡ ꯊꯃꯍꯜꯂꯤꯕꯥ ꯑꯁꯤꯅꯥ ꯅꯍꯥꯛꯅꯥ ꯅꯥꯒꯔꯤꯀꯁꯤꯡꯒꯤ ꯐꯤꯚꯝ ꯑꯃꯥ ꯂꯩꯕꯥ ꯌꯥꯏ ꯃꯗꯨꯗꯤ .
youre not doing what youre supposed to be doing,ꯅꯍꯥꯛꯅꯥ ꯇꯧꯒꯗꯕꯥ ꯊꯕꯛ ꯑꯗꯨ ꯅꯍꯥꯛꯅꯥ ꯇꯧꯔꯣꯏꯗꯕꯥ .
Jack M who at twentynine was a journalist reporting from the,ꯖꯦꯛ ꯑꯦꯝ.ꯅꯥ ꯇꯔꯥꯅꯤꯂꯗꯥ ꯂꯩꯕꯥ ꯄꯥꯎꯃꯤ ꯑꯃꯅꯤ ꯍꯥꯌꯅꯥ ꯄꯥꯎꯃꯤ ꯑꯃꯥ ꯑꯣꯏꯈꯤꯕꯥ ꯑꯗꯨ .
battle lines in South Africa during the worst heat of the apartheid,ꯈꯥ ꯑꯐ꯭ꯔꯤꯀꯥꯗꯥ ꯂꯩꯔꯤꯕꯥ ꯂꯥꯅꯒꯤ ꯂꯥꯏꯅꯁꯤꯡ ꯑꯁꯤ ꯑꯦꯄꯥꯔꯇꯃꯦꯟꯇꯀꯤ ꯈ꯭ꯕꯥꯏꯗꯒꯤ ꯐꯠꯇꯕꯥ ꯅꯨꯡꯁꯤꯠꯀꯤ ꯃꯇꯃꯗꯥ
conflictsand loving every minute of ittold me I was supposed to,ꯀꯅꯐ꯭ꯂꯤꯛꯇꯁꯦꯟꯗ ꯂꯣꯚꯤꯡ ꯑꯦꯚꯔꯤ ꯑꯦꯚꯔꯤ ꯃꯤꯅꯤꯠ ꯑꯣꯐ ꯏꯇꯂꯣꯜꯗ ꯃꯤ ꯑꯩꯅꯥ ꯍꯥꯌꯔꯝꯃꯤ
have been a doctor Journalism was never good enough somehow,have been a doctor ꯖꯔꯅꯦꯂꯤꯖꯝ ꯑꯁꯤ ꯀꯩꯗꯧꯅꯨꯡꯗꯥ ꯑꯐꯕꯥ ꯑꯣꯏꯈꯤꯗꯦ ꯀꯔꯤꯒꯨꯝꯕꯥ ꯃꯑꯣꯡ ꯑꯃꯗꯥ
Benita B thirtysix a single woman making a very good salary on,ꯕꯦꯅꯤꯇꯥ ꯕꯤ ꯇꯔꯤꯁꯤꯛꯁ ꯅꯨꯄꯤ ꯑꯃꯅꯥ ꯌꯥꯝꯅꯥ ꯐꯕꯥ ꯁꯦꯂꯔꯤ ꯑꯃꯥ ꯁꯦꯝꯕꯥ
Wall Street said Im supposed to marry a successful person not be,ꯋꯥꯜ ꯁ꯭ꯠꯔꯤꯠꯅꯥ ꯍꯥꯌꯈꯤ ꯏꯝ ꯍꯥꯌꯅꯥ ꯈꯜꯂꯀꯄꯅꯥ ꯃꯥꯌ ꯄꯥꯛꯂꯕꯥ ꯃꯤꯑꯣꯏ ꯑꯃꯒꯥ ꯂꯨꯍꯣꯡꯒꯅꯤ ꯍꯥꯌꯅꯥ ꯈꯅꯈꯤ꯫
one,ꯑꯃ
And Susan C fortyseven the author of a respected literary novel,ꯑꯃꯁꯨꯡ ꯁꯨꯁꯥꯟ ꯁꯤ ꯐꯣꯔꯇꯤꯁꯦꯚꯦꯟ ꯏꯀꯥꯏ ꯈꯨꯝꯅꯖꯔꯕꯥ ꯁꯥꯍꯤꯠꯌꯒꯤ ꯅꯣꯚꯦꯜ ꯑꯃꯒꯤ ꯑꯏꯕꯥ
said I think I was supposed to be a great beauty Not an intellectual,ꯍꯥꯌꯈꯤ ꯑꯩꯅꯥ ꯈꯜꯂꯤ ꯑꯩꯗꯤ ꯂꯧꯁꯤꯡ ꯂꯩꯕꯥ ꯅꯠꯇꯦ ꯑꯆꯧꯕꯥ ꯐꯖꯕꯥ ꯑꯃꯥ ꯑꯣꯏꯒꯗꯕꯅꯤ .
Im frumpy Youre looking at a failure,ꯏꯝ ꯐ꯭ꯔꯝꯄꯤ ꯌꯨꯔꯦ ꯂꯨꯀꯤꯡ ꯑꯦꯠ ꯑꯦ ꯐꯦꯏꯜ
Its easy to see how hurtful Jacks Benitas and Susans supposedto,ꯃꯁꯤꯒꯤ ꯐꯖꯅꯥ ꯎꯕꯥ ꯐꯪꯕꯗꯥ ꯖꯦꯀꯁ ꯕꯦꯅꯤꯇꯥꯁ ꯑꯃꯁꯨꯡ ꯁꯨꯁꯥꯟꯁꯅꯥ ꯀꯌꯥ ꯌꯥꯝꯅꯥ ꯁꯣꯀꯍꯅꯈꯤꯕꯒꯦ ꯍꯥꯌꯕꯗꯨ
your mindeven todaythat youve created a nonstop inner monologue,ꯑꯗꯣꯃꯒꯤ ꯋꯥꯈꯜꯂꯣꯟ ꯑꯗꯨ ꯉꯁꯤꯗꯤ ꯑꯗꯣꯝꯅꯥ ꯅꯟ-ꯁ꯭ꯇꯣꯞ ꯅꯨꯡꯒꯤ ꯑꯣꯏꯕꯥ ꯃꯣꯅꯣꯂꯣꯒ ꯑꯃꯥ ꯁꯦꯃꯈꯤ
to address them You think There thatll show them or Theyll love,ꯃꯈꯣꯌꯗꯥ ꯋꯥ ꯉꯥꯡꯅꯕꯥ ꯅꯍꯥꯛꯅꯥ ꯈꯜꯂꯤ ꯃꯐꯝ ꯑꯗꯨꯗꯥ thall show them or thell love
this or Boy they must feel bad about what Im doing Id better call,ꯃꯁꯤ ꯅꯠꯔꯒꯥ ꯅꯨꯄꯥꯃꯆꯥ ꯑꯗꯨꯅꯥ ꯃꯈꯣꯌꯅꯥ ꯐꯠꯇꯕꯥ ꯐꯥꯑꯣꯒꯗꯕꯅꯤ ꯃꯗꯨꯗꯤ ꯀꯔꯤ ꯏꯝ ꯇꯧꯔꯤꯕꯥ ꯑꯥꯏ.ꯗꯤ.
and say hi What your family wanted gave meaninggood or badto,ꯑꯃꯁꯨꯡ ꯍꯥꯌꯌꯨ ꯅꯍꯥꯛꯀꯤ ꯏꯃꯨꯡꯅꯥ ꯄꯥꯃꯈꯤꯕꯥ ꯑꯗꯨ ꯄꯤꯈꯤꯕꯥ ꯑꯔꯊꯒꯨꯗ ꯅꯠꯔꯒꯥ ꯕꯥꯗꯇꯣ
Youve got to become an accountant and come into the family,ꯅꯍꯥꯛꯅꯥ ꯑꯦꯀꯥꯎꯟꯇꯦꯟꯇ ꯑꯃꯥ ꯑꯣꯏꯅꯥ ꯂꯥꯀꯄꯥ ꯑꯃꯁꯨꯡ ꯏꯃꯨꯡ ꯃꯅꯨꯡꯗꯥ ꯂꯥꯀꯄꯥ ꯐꯪꯖꯕꯥ ꯑꯁꯤ .
business Weve broken our backs to build this business and get you into,ꯕꯤꯖꯤꯅꯦꯁ ꯑꯩꯈꯣꯌꯅꯥ ꯑꯩꯈꯣꯌꯒꯤ ꯕꯦꯀꯁꯤꯡ ꯊꯨꯒꯥꯏꯗꯨꯅꯥ ꯕꯤꯖꯤꯅꯦꯁ ꯑꯁꯤ ꯁꯦꯃꯒꯠꯅꯕꯥ ꯑꯃꯁꯨꯡ ꯑꯗꯣꯃꯒꯥ ꯂꯣꯌꯅꯅꯥ ꯆꯠꯃꯤꯟꯅꯅꯕꯥ .
Carol G wanted to be an actress On her fourteenth birthday she,ꯀꯦꯔꯣꯜ ꯖꯤꯅꯥ ꯃꯍꯥꯛꯀꯤ ꯃꯔꯤꯁꯨꯕꯥ ꯃꯄꯣꯛ ꯅꯨꯃꯤꯠꯇꯥ ꯑꯦꯛꯇꯔ ꯑꯃꯥ ꯑꯣꯏꯕꯥ ꯄꯥꯃꯈꯤ꯫
announced her dream at dinner and her entire family said Youll never,ꯅꯨꯃꯤꯗꯥꯡꯒꯤ ꯆꯥꯛ ꯆꯥꯕꯥ ꯃꯇꯃꯗꯥ ꯃꯍꯥꯛꯀꯤ ꯃꯪꯂꯥꯟ ꯑꯗꯨ ꯂꯥꯎꯊꯣꯀꯈꯤ ꯑꯃꯁꯨꯡ ꯃꯍꯥꯛꯀꯤ ꯏꯃꯨꯡ ꯃꯅꯨꯡ ꯄꯨꯝꯅꯃꯛꯅꯥ ꯍꯥꯌꯈꯤ youll never
make it in acting no one does Forget it,make it in acting ꯀꯅꯥꯒꯨꯝꯕꯥ ꯑꯃꯠꯇꯅꯥ ꯃꯁꯤ ꯀꯥꯑꯣꯔꯣꯏꯗꯕꯅꯤ .
Or maybe your family didnt say anything directly they made their,ꯅꯠꯔꯒꯥ ꯅꯍꯥꯛꯀꯤ ꯏꯃꯨꯡꯅꯥ ꯍꯀꯊꯦꯡꯅꯅꯥ ꯀꯔꯤꯒꯨꯝꯕꯥ ꯑꯃꯠꯇꯥ ꯍꯥꯌꯈꯤꯗꯦ ꯃꯈꯣꯌꯅꯥ ꯃꯈꯣꯌꯒꯤ .
desires very clear instead by talking about other people,ꯑꯇꯣꯞꯄꯥ ꯃꯤꯑꯣꯏꯁꯤꯡꯒꯤ ꯃꯔꯃꯗꯥ ꯋꯥꯔꯤ ꯁꯥꯗꯨꯅꯥ ꯃꯗꯨꯒꯤ ꯃꯍꯨꯠꯇꯥ ꯌꯥꯝꯅꯥ ꯃꯌꯦꯛ ꯁꯦꯡꯅꯥ ꯑꯄꯥꯝꯕꯁꯤꯡ .
That Smith kid showed a lot of promise but he wound up very small,ꯑꯗꯨ ꯁ꯭ꯃꯤꯊ ꯀꯤꯗꯅꯥ ꯋꯥꯁꯛ ꯀꯌꯥ ꯎꯠꯈꯤ ꯑꯗꯨꯕꯨ ꯃꯍꯥꯛꯅꯥ ꯌꯥꯝꯅꯥ ꯑꯄꯤꯀꯄꯥ ꯋꯥꯎꯟꯗ ꯇꯧꯈꯤ .
time Now that Jones kid is looking greatbuying and selling buildings,ꯍꯧꯖꯤꯛ ꯃꯇꯝ ꯑꯁꯤꯗꯥ ꯖꯣꯟꯁ ꯀꯤꯗ ꯑꯁꯤ ꯌꯥꯝꯅꯥ ꯐꯖꯅꯥ ꯎꯕꯥ ꯐꯪꯂꯤ ꯑꯃꯁꯨꯡ ꯕꯤꯜꯗꯤꯡꯁꯤꯡ ꯌꯣꯜꯂꯤ
and driving around in a Mercedes At twentyseven! Its pretty clear,ꯑꯃꯁꯨꯡ ꯇꯔꯥꯅꯤꯄꯥꯂꯗꯥ ꯃꯔꯁꯤꯗꯦꯁ ꯑꯃꯗꯥ ꯗ꯭ꯔꯥꯏꯕ ꯇꯧꯕꯥ!
what kind of kid youre supposed to be,ꯀꯔꯤ ꯃꯈꯂꯒꯤ ꯀꯤꯗ youre ꯑꯣꯏꯒꯗꯒꯦ ꯍꯥꯌꯕꯗꯨ .
Or maybe your family didnt say anything at all Maybe the messages,ꯅꯠꯔꯒꯥ ꯅꯍꯥꯛꯀꯤ ꯏꯃꯨꯡꯅꯥ ꯀꯔꯤꯒꯨꯝꯕꯥ ꯑꯃꯠꯇꯥ ꯍꯥꯌꯈꯤꯕꯥ ꯌꯥꯏ ꯍꯥꯌꯕꯁꯤ ꯄꯥꯎꯖꯦꯂꯁꯤꯡ ꯑꯗꯨꯅꯤ .
you got from your family were unspoken silent ones,ꯅꯍꯥꯛꯅꯥ ꯅꯍꯥꯛꯀꯤ ꯏꯃꯨꯡꯗꯒꯤ ꯐꯪꯈꯤꯕꯁꯤꯡ ꯑꯗꯨ ꯉꯥꯡꯗꯕꯥ ꯁꯥꯏꯂꯦꯟꯇ ꯑꯣꯏꯕꯥ ꯃꯤꯑꯣꯏꯁꯤꯡꯅꯤ .
You just got the idea,ꯑꯗꯣꯝꯅꯥ ꯍꯧꯖꯤꯛ ꯋꯥꯈꯜꯂꯣꯟ ꯑꯗꯨ ꯐꯪꯂꯦ .
Many families say Do whatever you want as long as youre happy,ꯏꯃꯨꯡ ꯀꯌꯥꯅꯥ ꯍꯥꯌꯔꯤ ꯃꯗꯨꯗꯤ ꯅꯍꯥꯛꯅꯥ ꯄꯥꯝꯂꯤꯕꯥ ꯑꯗꯨ ꯅꯍꯥꯛꯅꯥ ꯅꯨꯡꯉꯥꯏꯕꯥ ꯐꯥꯑꯣꯕꯥ ꯇꯧꯕꯤꯌꯨ
But if youre from the one family in a thousand who really means Do,ꯑꯗꯨꯕꯨ ꯀꯔꯤꯒꯨꯝꯕꯥ ꯅꯍꯥꯛꯅꯥ ꯃꯤꯑꯣꯏ ꯂꯤꯁꯤꯡ ꯑꯃꯗꯥ ꯂꯩꯕꯥ ꯏꯃꯨꯡ ꯑꯃꯗꯒꯤ ꯅꯍꯥꯛꯅꯥ ꯇꯁꯦꯡꯅꯥ ꯍꯥꯌꯔꯕꯗꯤ .
what you want Im envious Unlike the rest of us you dont have to,ꯋꯥꯠ ꯏꯎ ꯋꯥꯟꯇ ꯏꯝ ꯑꯦꯅꯚꯤꯌꯁ ꯑꯅꯂꯥꯏꯛ ꯗ꯭ꯌ ꯑꯇꯩ ꯑꯩꯈꯣꯌꯒꯤ ꯑꯇꯣꯞꯄꯥ
suffer from inner conflicts while youre going about the business of,youre ꯒꯤ ꯕꯤꯖꯤꯅꯦꯁꯇꯥ ꯆꯠꯄꯥ ꯃꯇꯃꯗꯥ ꯅꯨꯡꯒꯤ ꯑꯣꯏꯕꯥ ꯂꯥꯅꯐꯃꯁꯤꯡꯅꯥ ꯑꯋꯥꯕꯥ ꯈꯥꯉꯈꯤ꯫
finding and enjoying your lifes work If youre not sure if youre from,ꯅꯍꯥꯛꯅꯥ ꯅꯍꯥꯛꯀꯤ ꯄꯨꯟꯁꯤꯕꯨ ꯊꯕꯛ ꯇꯧꯕꯥ ꯑꯃꯁꯨꯡ ꯅꯨꯡꯉꯥꯏꯅꯥ ꯄꯥꯡꯊꯣꯀꯄꯥ ꯀꯔꯤꯒꯨꯝꯕꯥ ꯅꯍꯥꯛꯅꯥ ꯃꯗꯨ ꯅꯍꯥꯛꯅꯥ ꯁꯣꯌꯗꯅꯥ ꯈꯪꯂꯃꯗ꯭ꯔꯕꯗꯤ꯫
happy striptease artist or youre happily leaving medical school and,ꯍꯦꯄꯤ ꯁ꯭ꯠꯔꯤꯄꯇꯤꯖ ꯑꯥꯔꯇꯤꯁ꯭ꯠ ꯅꯠꯔꯒꯥ ꯌꯨꯔꯦ ꯅꯨꯡꯉꯥꯏꯅꯥ ꯃꯦꯗꯤꯀꯦꯜ ꯁ꯭ꯀꯨꯜ ꯊꯥꯗꯣꯀꯄꯥ ꯑꯃꯁꯨꯡ
youll find out soon enough,ꯑꯗꯣꯝꯅꯥ ꯑꯊꯨꯕꯥ ꯃꯇꯃꯗꯥ ꯈꯉꯂꯃꯒꯅꯤ
Okay now that youve thought about how you got wind of your,ꯑꯣꯀꯦ ꯍꯧꯖꯤꯛ ꯅꯍꯥꯛꯅꯥ ꯈꯅꯈꯤꯕꯥ ꯑꯗꯨ ꯅꯍꯥꯛꯅꯥ ꯃꯇꯧ ꯀꯔꯝꯅꯥ ꯅꯍꯥꯛꯀꯤ ꯅꯨꯡꯁꯤꯠ ꯐꯪꯈꯤꯕꯒꯦ ꯍꯥꯌꯕꯗꯨ ꯅꯍꯥꯛꯀꯤ .
familys wishes take another kind of close look at that family of yours,ꯏꯃꯨꯡ ꯃꯅꯨꯡꯁꯤꯡꯅꯥ ꯑꯗꯣꯃꯒꯤ ꯏꯃꯨꯡꯒꯤ ꯑꯗꯨꯒꯨꯝꯂꯕꯥ ꯏꯃꯨꯡꯒꯤ ꯃꯤꯑꯣꯏ ꯑꯗꯨꯕꯨ ꯑꯇꯣꯞꯄꯥ ꯃꯈꯜ ꯑꯃꯒꯤ ꯂꯨꯞ ꯑꯃꯥ ꯂꯧꯕꯤꯌꯨ ꯍꯥꯌꯅꯥ ꯋꯥꯁꯀꯄꯤꯔꯤ
What did they want from you? Exercise 1 What Did They Want from Me? Take a blank sheet of paper and jot down the names of everyone in,ꯃꯈꯣꯌꯅꯥ ꯑꯗꯣꯃꯗꯒꯤ ꯀꯔꯤ ꯄꯥꯃꯈꯤꯕꯒꯦ?
your family and extended family That is write down anyone who was,ꯑꯗꯣꯃꯒꯤ ꯏꯃꯨꯡ ꯃꯅꯨꯡ ꯑꯃꯁꯨꯡ ꯑꯦꯛꯁꯇꯦꯟꯗ ꯇꯧꯔꯕꯥ ꯏꯃꯨꯡ ꯃꯅꯨꯡ ꯀꯅꯥꯒꯨꯝꯕꯥ ꯑꯃꯕꯨ ꯏꯕꯤꯔꯀꯄꯥ ꯑꯗꯨꯅꯤ .
important to you when you were growing up teachers coaches,ꯑꯗꯣꯝꯅꯥ ꯑꯣꯖꯥꯁꯤꯡꯒꯤ ꯀꯣꯆꯁꯤꯡ ꯆꯥꯑꯣꯔꯀꯄꯥ ꯃꯇꯃꯗꯥ ꯑꯗꯣꯃꯒꯤꯗꯃꯛ ꯃꯔꯨꯑꯣꯏꯕꯥ .
neighbors cousins older friends,ꯌꯨꯃꯂꯣꯟꯅꯕꯁꯤꯡꯒꯤ ꯃꯔꯨꯄꯁꯤꯡ ꯑꯍꯜ ꯑꯣꯏꯔꯕꯥ ꯃꯔꯨꯄꯁꯤꯡ
Under each persons name write down what they wanted you to do,ꯃꯤꯑꯣꯏ ꯈꯨꯗꯤꯡꯃꯛꯀꯤ ꯃꯈꯥꯗꯥ ꯃꯤꯡ ꯊꯣꯅꯕꯥ ꯃꯈꯣꯌꯅꯥ ꯅꯍꯥꯛꯅꯥ ꯇꯧꯕꯥ ꯄꯥꯃꯈꯤꯕꯥ ꯑꯗꯨ ꯏꯕꯤꯌꯨ
with your life If youve got your own family now you can make this,ꯑꯗꯣꯃꯒꯤ ꯄꯨꯟꯁꯤꯒꯥ ꯂꯣꯌꯅꯅꯥ ꯀꯔꯤꯒꯨꯝꯕꯥ ꯑꯗꯣꯝꯅꯥ ꯑꯗꯣꯃꯒꯤ ꯏꯃꯨꯡ ꯃꯅꯨꯡ ꯐꯪꯂꯕꯗꯤ ꯍꯧꯖꯤꯛ ꯑꯗꯣꯝꯅꯥ ꯃꯁꯤ ꯁꯦꯝꯕꯥ ꯉꯝꯂꯒꯅꯤ
exercise even more spicy by including your present family too Go,ꯑꯗꯣꯃꯒꯤ ꯍꯧꯖꯤꯛ ꯂꯩꯔꯤꯕꯥ ꯏꯃꯨꯡ ꯃꯅꯨꯡꯁꯨ ꯌꯥꯑꯣꯍꯟꯗꯨꯅꯥ ꯍꯦꯟꯅꯥ ꯃꯆꯤ ꯑꯣꯏꯕꯥ ꯑꯦꯛꯁꯔꯁꯥꯏꯖ ꯇꯧꯕꯥ
ahead make it a big list everyone you lived with as a kid everyone you,ꯃꯃꯥꯡꯗꯥ ꯃꯁꯤ ꯑꯆꯧꯕꯥ ꯂꯤꯁ꯭ꯠ ꯑꯃꯥ ꯑꯣꯏꯍꯅꯕꯤꯌꯨ ꯅꯍꯥꯛꯅꯥ ꯑꯉꯥꯡ ꯑꯃꯥ ꯑꯣꯏꯅꯥ ꯍꯤꯡꯈꯤꯕꯥ ꯃꯤꯑꯣꯏ ꯈꯨꯗꯤꯡꯃꯛ ꯅꯍꯥꯛꯅꯥ ꯃꯤ ꯈꯨꯗꯤꯡꯃꯛ ꯅꯍꯥꯛꯅꯥ .
live with now,ꯍꯧꯖꯤꯛ ꯍꯤꯡꯂꯤꯕꯥ
What diddo they want from you? Dont think too much Jot down your first feeling You might not be,ꯃꯈꯣꯌꯅꯥ ꯑꯗꯣꯃꯗꯒꯤ ꯀꯔꯤ ꯄꯥꯃꯈꯤꯕꯒꯦ?
absolutely sure youre right about what each person would say but you,ꯃꯄꯨꯡ ꯐꯥꯅꯥ ꯁꯣꯏꯗꯅꯥ ꯅꯍꯥꯛꯅꯥ ꯃꯤꯑꯣꯏ ꯈꯨꯗꯤꯡꯃꯛꯅꯥ ꯀꯔꯤ ꯍꯥꯌꯒꯅꯤ ꯍꯥꯌꯕꯒꯤ ꯃꯇꯥꯡꯗꯥ ꯑꯆꯨꯝꯕꯥ ꯋꯥꯐꯝ ꯑꯗꯨꯕꯨ ꯅꯍꯥꯛꯅꯥ .
know what you think is right and thats what counts with inner messages,ꯑꯗꯣꯝꯅꯥ ꯑꯆꯨꯝꯕꯥ ꯍꯥꯌꯅꯥ ꯈꯜꯂꯤꯕꯥ ꯑꯗꯨ ꯈꯉꯕꯤꯌꯨ ꯑꯃꯁꯨꯡ ꯊ꯭ꯌꯥꯠꯁ ꯀꯥꯎꯟꯇꯁ ꯋꯤꯊ ꯅꯨꯡꯒꯤ ꯄꯥꯎꯖꯦꯂꯁꯤꯡꯒꯥ ꯂꯣꯌꯅꯅꯥ
Your misinterpretations have influenced you as much as your insights,ꯑꯗꯣꯃꯒꯤ ꯑꯔꯥꯅꯕꯥ ꯋꯥꯐꯃꯁꯤꯡ ꯑꯁꯤꯅꯥ ꯑꯗꯣꯃꯗꯥ ꯑꯗꯣꯃꯒꯤ ꯋꯥꯈꯜꯂꯣꯅꯁꯤꯡ ꯑꯗꯨꯒꯨꯝꯅꯥ ꯏꯊꯤꯜ ꯄꯤꯕꯤꯔꯦ .
Think about it What did each of these people want you to do? Okay now take a look at your answer,ꯃꯁꯤꯒꯤ ꯃꯇꯥꯡꯗꯥ ꯈꯟꯊꯕꯤꯌꯨ ꯃꯤꯑꯣꯏ ꯈꯨꯗꯤꯡꯃꯛꯅꯥ ꯑꯗꯣꯃꯗꯥ ꯀꯔꯤ ꯇꯧꯕꯥ ꯄꯥꯝꯂꯤꯕꯒꯦ?
Chances are your paper looks something like this,ꯆꯥꯟꯁ ꯑꯁꯤ ꯅꯍꯥꯛꯀꯤ ꯄꯦꯄꯔ ꯑꯁꯤ ꯑꯁꯤꯒꯨꯝꯕꯥ ꯃꯈꯂꯒꯤ ꯄꯣꯠꯁꯛ ꯑꯃꯅꯤ .
MY FAMILY WANTED ME TO,ꯑꯩꯒꯤ ꯏꯃꯨꯡ ꯃꯅꯨꯡꯅꯥ ꯑꯩꯕꯨ .
MOM be careful and respectablea lawyer,ꯃꯃꯥꯅꯥ ꯆꯦꯀꯁꯤꯅꯕꯤꯌꯨ ꯑꯃꯁꯨꯡ ꯏꯀꯥꯌꯈꯨꯝꯅꯕꯥ ꯎꯠꯀꯅꯤ ꯎꯀꯤꯜ
DAD be bold and competitivean investment banker,ꯗꯥꯗꯥ ꯕꯣꯜꯗ ꯑꯃꯁꯨꯡ ꯀꯝꯄꯤꯇꯤꯇꯤꯕ ꯑꯣꯏꯕꯥ ꯏꯅꯚꯦꯁ꯭ꯇꯃꯦꯟꯇ ꯕꯦꯉ꯭ꯀꯔ
BENNY be a big hero,ꯕꯦꯅꯤ ꯕꯤ ꯑꯦ ꯕꯤꯒ ꯍꯤꯔꯣ
KAREN be invisiblenot get so much attention,ꯀꯦꯔꯦꯟ ꯕꯤ ꯏꯅꯚꯤꯖꯤꯕꯂꯅꯣꯠ ꯁꯣ ꯃꯆ ꯑꯦꯇꯦꯟꯁꯟ
GRANDMA become her constant companion,ꯗꯥꯗꯥ ꯃꯍꯥꯛꯀꯤ ꯂꯦꯞꯄꯥ ꯂꯩꯇꯕꯥ ꯃꯔꯨꯞ ꯑꯣꯏꯔꯀꯏ
You may have started making a short list and suddenly realized all,ꯑꯗꯣꯝꯅꯥ ꯁꯣꯔꯠ ꯂꯤꯁ꯭ꯠ ꯑꯃꯥ ꯁꯦꯝꯕꯥ ꯍꯧꯔꯀꯄꯥ ꯌꯥꯏ ꯑꯃꯁꯨꯡ ꯈꯉꯍꯧꯗꯅꯥ ꯄꯨꯝꯅꯃꯛ ꯈꯉꯕꯥ ꯉꯃꯒꯅꯤ
sorts of things like George J did,ꯖꯔꯖ ꯖꯦ ꯗꯤꯗꯒꯨꯝꯕꯥ ꯁꯣꯔꯇꯁꯤꯡ
Heres Georges list,ꯍꯦꯔꯦꯁ ꯖꯔꯖꯁ ꯂꯤꯁ꯭ꯠ .
FATHER Had no use for me at all but he loved opera So I got the idea I,ꯃꯄꯥꯅꯥ ꯑꯩꯒꯤꯗꯃꯛ ꯀꯥꯟꯅꯕꯥ ꯑꯃꯠꯇꯥ ꯂꯩꯈꯤꯗꯦ ꯑꯗꯨꯕꯨ ꯃꯍꯥꯛꯅꯥ ꯑꯣꯄꯦꯔꯥꯕꯨ ꯅꯨꯡꯁꯤꯖꯈꯤ ꯃꯔꯝ ꯑꯗꯨꯅꯥ ꯑꯩꯍꯥꯛꯅꯥ ꯋꯥꯈꯜꯂꯣꯟ ꯑꯗꯨ ꯐꯪꯈꯤ ꯑꯩꯍꯥꯛ
should do something with opera I married an opera singerand he,ꯑꯣꯄꯦꯔꯥꯒꯥ ꯂꯣꯌꯅꯅꯥ ꯀꯔꯤꯒꯨꯝꯕꯥ ꯈꯔꯥ ꯇꯧꯕꯥ ꯇꯥꯏ ꯑꯩꯅꯥ ꯑꯣꯄꯦꯔꯥꯒꯤ ꯏꯁꯩ ꯅꯣꯡꯃꯥꯏꯒꯤ ꯃꯤꯑꯣꯏ ꯑꯃꯒꯥ ꯂꯨꯍꯣꯡꯈꯤ꯫
finally accepted me My wife and I were badly matched and so,ꯑꯔꯣꯏꯕꯗꯥ ꯑꯩꯍꯥꯀꯄꯨ ꯌꯥꯕꯤꯔꯀꯈꯤ ꯑꯩꯍꯥꯛꯀꯤ ꯅꯨꯄꯤ ꯑꯃꯁꯨꯡ ꯑꯩꯍꯥꯛ ꯐꯠꯇꯅꯥ ꯃꯦꯆ ꯇꯧꯈꯤ ꯑꯃꯁꯨꯡ ꯃꯔꯝ ꯑꯗꯨꯅꯥ
unhappy She wanted to leave but I was terrified of letting her go I,ꯅꯨꯡꯉꯥꯏꯇꯕꯥ ꯃꯍꯥꯛꯅꯥ ꯆꯠꯄꯥ ꯄꯥꯃꯈꯤ ꯑꯗꯨꯕꯨ ꯑꯩꯅꯥ ꯃꯍꯥꯀꯄꯨ ꯊꯥꯗꯣꯀꯄꯥ ꯌꯥꯍꯅꯕꯗꯥ ꯌꯥꯝꯅꯥ ꯉꯀꯈꯤ ꯑꯩ
never really put that together before,ꯃꯃꯥꯡꯗꯥ ꯀꯩꯗꯧꯉꯩꯗꯁꯨ ꯃꯗꯨ ꯄꯨꯟꯅꯥ ꯊꯃꯈꯤꯗꯦ .
MOM She was always trying to make peace in the house Father was,ꯃꯃꯥ ꯃꯍꯥꯛꯅꯥ ꯃꯇꯝ ꯄꯨꯝꯅꯃꯛꯇꯥ ꯌꯨꯃꯒꯤ ꯃꯄꯥꯗꯥ ꯁꯥꯟꯇꯤ ꯄꯨꯔꯛꯅꯕꯥ ꯍꯣꯠꯅꯔꯝꯃꯤ
silent and angry and Mom wanted everything to look peaceful and,ꯁꯥꯏꯂꯦꯟꯇ ꯑꯃꯁꯨꯡ ꯑꯦꯉ꯭ꯒ꯭ꯔꯤ ꯑꯃꯁꯨꯡ ꯃꯃꯥꯅꯥ ꯄꯨꯝꯅꯃꯛ ꯁꯥꯟꯇꯤ ꯑꯣꯏꯅꯥ ꯎꯕꯥ ꯄꯥꯃꯈꯤ ꯑꯃꯁꯨꯡ
okay I must have gotten the idea I was supposed to make,ꯑꯣꯀꯦ ꯑꯩꯅꯥ ꯁꯣꯌꯗꯅꯥ ꯑꯩꯅꯥ ꯇꯧꯒꯗꯧꯔꯤꯕꯥ ꯋꯥꯈꯜꯂꯣꯟ ꯑꯗꯨ ꯐꯪꯂꯃꯒꯅꯤ
everything look peaceful and okay too because I got this proper,ꯄꯨꯝꯅꯃꯛ ꯑꯁꯤ ꯁꯥꯟꯇꯤ ꯂꯩꯕꯥ ꯑꯃꯁꯨꯡ ꯑꯐꯕꯥ ꯑꯣꯏꯅꯥ ꯎꯕꯥ ꯐꯪꯏ ꯃꯔꯃꯗꯤ ꯑꯩꯍꯥꯛꯅꯥ ꯃꯁꯤꯒꯤ ꯄ꯭ꯔꯣꯄꯔ ꯑꯁꯤ ꯐꯪꯈꯤ
corporate job even though I hate it Well life is peaceful all right,ꯀꯣꯔꯄꯣꯔꯦꯠ ꯖꯕ ꯑꯩꯅꯥ ꯃꯁꯤꯕꯨ ꯌꯥꯝꯅꯥ ꯅꯨꯡꯁꯤꯖꯔꯕꯁꯨ ꯄꯨꯟꯁꯤ ꯑꯁꯤ ꯁꯥꯟꯇꯤ ꯂꯩꯕꯥ ꯄꯨꯝꯅꯃꯛ ꯐꯩ
And dead as dirt,ꯑꯃꯁꯨꯡ ꯁꯤꯕꯥ ꯌꯥꯕꯥ ꯃꯑꯣꯡꯗꯥ ꯁꯤꯕꯥ .
Take another good look at your list and youll notice something else,ꯑꯗꯣꯃꯒꯤ ꯂꯤꯁ꯭ꯇꯇꯥ ꯑꯇꯣꯞꯄꯥ ꯑꯐꯕꯥ ꯌꯦꯡꯕꯤꯌꯨ ꯑꯃꯁꯨꯡ ꯑꯗꯣꯝꯅꯥ ꯑꯇꯣꯞꯄꯥ ꯋꯥꯐꯝ ꯑꯃꯥ ꯈꯉꯕꯤꯒꯅꯤ
very interesting If youre like most of us youll see theres a complicated,ꯌꯥꯝꯅꯥ ꯏꯟꯇꯔꯦꯁ꯭ꯇꯤꯡ ꯑꯣꯏꯔꯕꯗꯤ ꯀꯔꯤꯒꯨꯝꯕꯥ ꯅꯍꯥꯛꯅꯥ ꯑꯩꯈꯣꯌ ꯑꯌꯥꯝꯕꯅꯥ youll see theres a complicated
twist in your instructions you got more than one message and some of,ꯇ꯭ꯌꯨꯏꯁ꯭ꯠ ꯅꯍꯥꯛꯀꯤ ꯏꯅꯁ꯭ꯠꯔꯛꯁꯅꯁꯤꯡꯗꯥ ꯅꯍꯥꯛꯅꯥ ꯃꯦꯁꯦꯖ ꯑꯃꯗꯒꯤ ꯍꯦꯟꯅꯥ ꯐꯪꯈꯤ ꯑꯃꯁꯨꯡ ꯈꯔꯗꯤ .
the messages you got may be the exact opposites of each other Remember,ꯅꯍꯥꯛꯅꯥ ꯐꯪꯈꯤꯕꯥ ꯄꯥꯎꯖꯦꯂꯁꯤꯡ ꯑꯗꯨ ꯑꯃꯒꯥ ꯑꯃꯒꯥ ꯇꯁꯦꯡꯅꯥ ꯃꯥꯟꯅꯗꯕꯥ ꯑꯣꯏꯔꯝꯕꯥ ꯌꯥꯏ ꯅꯤꯡꯁꯤꯡꯕꯤꯌꯨ
how I was supposed to stay at home and be a jetsetting spy? Chances,ꯑꯩꯍꯥꯛ ꯃꯇꯧ ꯀꯔꯝꯅꯥ ꯌꯨꯃꯗꯥ ꯂꯩꯕꯥ ꯑꯃꯁꯨꯡ ꯖꯦꯠꯁꯦꯠ ꯁ꯭ꯄꯥꯏ ꯑꯃꯥ ꯑꯣꯏꯕꯥ ꯇꯥꯈꯤꯕꯒꯦ?
are that no person in your family wanted exactly the same thing from,ꯑꯣꯏꯔꯤꯕꯔꯥ ꯃꯗꯨꯗꯤ ꯅꯍꯥꯛꯀꯤ ꯏꯃꯨꯡꯒꯤ ꯃꯤꯑꯣꯏ ꯑꯃꯠꯇꯅꯥ ꯇꯁꯦꯡꯅꯥ ꯋꯥꯐꯝ ꯑꯃꯠꯇꯥ ꯄꯥꯃꯈꯤꯗꯦ꯫
you that the others wanted And chances are that at least one person,ꯑꯗꯣꯝꯅꯥ ꯑꯇꯣꯞꯄꯁꯤꯡꯅꯥ ꯄꯥꯝꯂꯝꯕꯥ ꯑꯃꯁꯨꯡ ꯆꯥꯟꯁꯁꯤꯡ ꯑꯗꯨ ꯌꯥꯃꯗ꯭ꯔꯕꯗꯥ ꯃꯤꯑꯣꯏ ꯑꯃꯅꯥ .
wanted something with so many builtin conflicts in it that you could,ꯃꯗꯨꯗꯥ ꯑꯁꯨꯛ ꯌꯥꯝꯅꯥ ꯕꯤꯂꯇꯤꯟ ꯀꯟꯐ꯭ꯂꯤꯛꯇꯁꯤꯡ ꯂꯩꯕꯥ ꯄꯣꯠꯁꯛ ꯑꯃꯥ ꯄꯥꯃꯈꯤ ꯃꯗꯨꯗꯤ ꯑꯗꯣꯝꯅꯥ ꯇꯧꯕꯥ ꯉꯃꯒꯅꯤ
never understand it,ꯀꯩꯗꯧꯉꯩꯗꯥ ꯂꯧꯁꯤꯅꯒꯅꯨ
Lois Ms mother said she wanted Lois to be wildly popular even,ꯂꯣꯏꯁ ꯑꯦꯝ.ꯑꯦꯁ.
famous but when Lois was a teenager her mother begged Lois not to,ꯃꯃꯤꯡ ꯂꯩꯔꯕꯥ ꯑꯗꯨꯕꯨ ꯂꯣꯏꯅꯥ ꯇꯤꯅꯑꯦꯖꯥꯔ ꯑꯣꯏꯔꯤꯉꯩꯗꯥ ꯃꯍꯥꯛꯀꯤ ꯃꯃꯥꯅꯥ ꯂꯣꯏꯁꯄꯨ ꯄꯤꯕꯤꯈꯤꯗꯦ ꯍꯥꯌꯅꯥ ꯍꯥꯌꯖꯈꯤ꯫
draw too much attention to herself How does a person get famous,ꯃꯤꯑꯣꯏ ꯑꯃꯅꯥ ꯃꯇꯧ ꯀꯔꯝꯅꯥ ꯃꯃꯤꯡ ꯆꯠꯂꯕꯒꯦ ꯍꯥꯌꯕꯗꯨ ꯃꯁꯥꯃꯀꯄꯨ ꯌꯥꯝꯅꯥ ꯄꯨꯛꯅꯤꯡ ꯆꯪꯕꯤꯌꯨ
without getting attention? Bill R also got conflicting messages I had to get married and create,ꯃꯤꯠꯌꯦꯡ ꯆꯪꯗꯅꯥ?
my own family unit and I had to stay with my parents forever Dont,ꯑꯩꯍꯥꯛꯀꯤ ꯏꯁꯥꯒꯤ ꯏꯃꯨꯡꯒꯤ ꯌꯨꯅꯤꯠ ꯑꯃꯁꯨꯡ ꯑꯩꯍꯥꯛꯅꯥ ꯃꯇꯝ ꯆꯨꯞꯄꯗꯥ ꯑꯩꯍꯥꯛꯀꯤ ꯏꯃꯥ-ꯏꯄꯥꯒꯥ ꯂꯣꯌꯅꯅꯥ ꯂꯩꯃꯤꯟꯅꯒꯗꯕꯅꯤ
you wonder where Bill was supposed to have his new family? In his,ꯕꯤꯂꯅꯥ ꯃꯍꯥꯛꯀꯤ ꯑꯅꯧꯕꯥ ꯏꯃꯨꯡ ꯃꯅꯨꯡ ꯀꯗꯥꯌꯗꯥ ꯂꯩꯒꯗꯒꯦ ꯍꯥꯌꯅꯥ ꯑꯗꯣꯝꯅꯥ ꯈꯅꯕꯤꯔꯤꯕꯔꯥ?
parents living room? These messages put us in an impossible bind Were supposed to jump,ꯃꯃꯥ-ꯃꯄꯥ ꯂꯤꯚꯤꯡ ꯔꯨꯝ?
right in and do things weve been told not to do Or that we cant do Or,right in and do things weve ꯍꯥꯌꯅꯥ ꯍꯥꯌꯈꯤꯕꯥ ꯋꯥꯐꯃꯁꯤꯡ ꯅꯠꯔꯒꯥ ꯑꯩꯈꯣꯌꯅꯥ ꯇꯧꯕꯥ ꯌꯥꯔꯣꯏ ꯅꯠꯔꯒꯥ ꯇꯧꯕꯥ ꯌꯥꯔꯣꯏ ꯍꯥꯌꯅꯥ ꯍꯥꯌꯈꯤ꯫
that were incapable of Meanwhile our minds are never where theyre,ꯃꯗꯨ ꯃꯇꯝ ꯑꯗꯨꯗꯥ ꯑꯩꯈꯣꯌꯒꯤ ꯋꯥꯈꯜ ꯑꯁꯤ ꯀꯩꯗꯧꯅꯨꯡꯗꯥ ꯃꯐꯝ ꯑꯗꯨꯗꯥ ꯂꯩꯇꯦ .
supposed to be on developing our own unique gifts When were,ꯃꯇꯝ ꯑꯗꯨꯗꯥ ꯑꯩꯈꯣꯌꯒꯤ ꯏꯁꯥꯒꯤ ꯑꯣꯏꯕꯥ ꯑꯈꯟꯅꯕꯥ ꯈꯨꯗꯣꯂꯁꯤꯡ ꯁꯦꯃꯒꯠꯄꯗꯥ ꯂꯩꯒꯅꯤ ꯍꯥꯌꯅꯥ ꯂꯧꯅꯔꯝꯃꯤ꯫
children we have a couple of very big jobs to do We have to find out,ꯑꯉꯥꯡꯁꯤꯡ ꯑꯩꯈꯣꯌꯅꯥ ꯌꯥꯝꯅꯥ ꯆꯥꯎꯕꯥ ꯊꯕꯛ ꯀꯌꯥ ꯑꯃꯥ ꯂꯩꯔꯤ ꯑꯩꯈꯣꯌꯅꯥ ꯈꯉꯖꯤꯅꯒꯗꯕꯅꯤ
