en,mni-Mtei
Seven Years Devastation  The Burmese invaded Manipur several times but the most notable one was in 1819 during the reign of King Marjit,ꯆꯍꯤ ꯷ ꯃꯥꯡꯍꯟ ꯇꯥꯀꯍꯅꯈꯤꯕꯥ ꯕꯔꯃꯥꯅꯥ ꯃꯅꯤꯄꯨꯔꯗꯥ ꯀꯌꯥ ꯌꯥꯝꯅꯥ ꯂꯥꯟꯗꯥꯈꯤ ꯑꯗꯨꯕꯨ ꯈ꯭ꯕꯥꯏꯗꯒꯤ ꯊꯣꯏꯗꯣꯀꯄꯥ ꯑꯃꯗꯤ ꯅꯤꯡꯊꯧ ꯃꯥꯔꯖꯤꯠꯀꯤ ꯃꯇꯃꯗꯥ ꯱꯸꯱꯹ꯗꯥ ꯑꯣꯏꯈꯤ
The Burmese occupied Manipur from 1819 to 1826,ꯕꯔꯃꯥꯅꯥ ꯃꯅꯤꯄꯨꯔꯕꯨ ꯱꯸꯱꯹ꯗꯒꯤ ꯱꯸꯲꯶ ꯐꯥꯑꯣꯕꯥ ꯂꯧꯈꯤ꯫
During this time Manipur was devastated and there was chaos and anarchy everywhere,ꯃꯇꯝ ꯑꯁꯤꯒꯤ ꯃꯅꯨꯡꯗꯥ ꯃꯅꯤꯄꯨꯔ ꯑꯁꯤ ꯌꯥꯝꯅꯥ ꯁꯥꯊꯤꯅꯥ ꯁꯣꯀꯈꯤ ꯑꯃꯁꯨꯡ ꯃꯐꯝ ꯈꯨꯗꯤꯡꯃꯛꯇꯥ ꯑꯔꯥꯅꯕꯥ ꯑꯃꯁꯨꯡ ꯑꯔꯥꯅꯕꯥ ꯊꯧꯑꯣꯡꯁꯤꯡ ꯂꯩꯈꯤ
This dark period is called Chahi Taret Khuntakpa Seven Years Devastation,ꯃꯁꯤꯒꯤ ꯑꯃꯝꯕꯥ ꯃꯇꯝ ꯑꯁꯤꯕꯨ ꯆꯥꯍꯤ ꯇꯥꯔꯦꯠ ꯈꯣꯟꯇꯥꯀꯄꯥ ꯍꯥꯌꯅꯥ ꯀꯧꯏ꯫
Manipuri Levy  There were exploitations of the Manipuri Levy which was the first standing army of Manipur born out of the Manipur National Struggle against the Burmese rule during the Seven Years Devastation,ꯃꯅꯤꯄꯨꯔꯤ ꯂꯦꯚꯤ ꯃꯐꯝ ꯑꯗꯨꯗꯥ ꯃꯅꯤꯄꯨꯔ ꯂꯦꯚꯤꯒꯤ ꯑꯦꯛꯁꯞꯂꯣꯏꯇꯦꯁꯟ ꯂꯩꯈꯤ ꯃꯗꯨꯗꯤ ꯃꯅꯤꯄꯨꯔꯒꯤ ꯑꯍꯥꯅꯕꯥ ꯂꯦꯡꯗꯕꯥ ꯂꯥꯟꯃꯤ ꯑꯣꯏꯈꯤ ꯃꯗꯨꯗꯤ ꯃꯅꯤꯄꯨꯔꯗꯒꯤ ꯄꯣꯀꯄꯥ ꯃꯅꯤꯄꯨꯔꯒꯤ ꯖꯥꯇꯤꯒꯤ ꯂꯥꯅꯐꯝ ꯑꯁꯤ ꯆꯍꯤ ꯷ꯀꯤ ꯃꯅꯨꯡꯗꯥ ꯕꯔꯃꯥꯒꯤ ꯂꯩꯉꯥꯛ ꯑꯁꯤꯒꯤ ꯃꯥꯌꯣꯛꯇꯥ ꯂꯩꯈꯤ
AngloManipuri War  In the year 1891 the historic AngloManipuri war Manipurs National Liberation Struggle took place,ꯑꯦꯉ꯭ꯒꯂꯣꯃꯥꯄꯤꯎꯔꯤ ꯋꯥꯔ ꯆꯍꯤ ꯱꯸꯹꯱ꯗꯥ ꯄꯨꯋꯥꯔꯤ ꯑꯣꯏꯔꯕꯥ ꯑꯦꯉ꯭ꯒꯂꯣꯃꯥꯄꯤꯎꯔꯤ ꯋꯥꯔ ꯃꯅꯤꯄꯨꯔꯁ ꯅꯦꯁ꯭ꯅꯦꯜ ꯂꯤꯕꯔꯦꯁꯟ ꯁ꯭ꯠꯔꯒꯜ ꯊꯣꯀꯈꯤ
The Manipuri soldiers showed their might in the losing battle sacrificing their lives for the motherland,ꯃꯅꯤꯄꯨꯔꯤ ꯂꯥꯟꯃꯤꯁꯤꯡꯅꯥ ꯃꯈꯣꯌꯒꯤ ꯄꯥꯉ꯭ꯒꯜ ꯑꯗꯨ ꯃꯥꯗꯔꯂꯦꯟꯗꯒꯤꯗꯃꯛ ꯃꯈꯣꯌꯒꯤ ꯄꯨꯟꯁꯤ ꯀꯠꯊꯣꯛꯇꯨꯅꯥ ꯃꯥꯏꯊꯤꯕꯥ ꯄꯤꯈꯤꯕꯥ ꯂꯥꯅꯐꯝ ꯑꯗꯨꯗꯥ ꯎꯠꯈꯤ꯫
The combat ended with a British victory,ꯂꯥꯅꯐꯝ ꯑꯁꯤ ꯕ꯭ꯔꯤꯇꯤꯁꯀꯤ ꯃꯥꯏꯄꯥꯀꯄꯥ ꯑꯃꯒꯥ ꯂꯣꯌꯅꯅꯥ ꯂꯣꯏꯁꯤꯅꯈꯤ꯫
Japanese bombing  Japanese bombing in Imphal took place several times in the history of Manipur thereby creating high casualties to the people of Manipur,ꯖꯄꯥꯟ ꯕꯣꯝꯕꯤꯡ ꯖꯄꯥꯅꯒꯤ ꯕꯣꯝꯕꯤꯡ ꯏꯝꯐꯥꯂꯗꯥ ꯕꯣꯝꯕꯤꯡ ꯇꯧꯈꯤꯕꯥ ꯑꯁꯤ ꯃꯅꯤꯄꯨꯔꯒꯤ ꯄꯨꯋꯥꯔꯤꯗꯥ ꯀꯌꯥ ꯌꯥꯝꯅꯥ ꯊꯣꯀꯈꯤꯕꯒꯦ ꯃꯗꯨꯅꯥ ꯃꯅꯤꯄꯨꯔꯒꯤ ꯃꯤꯌꯥꯃꯗꯥ ꯌꯥꯝꯅꯥ ꯁꯣꯀꯍꯅꯈꯤ
The first bombing was in the year 1942 heralding the beginning of the Second World War in Manipur,ꯑꯍꯥꯅꯕꯥ ꯕꯣꯝꯕꯤꯡ ꯑꯁꯤ ꯆꯍꯤ ꯱꯹꯴꯲ꯗꯥ ꯃꯅꯤꯄꯨꯔꯗꯥ ꯑꯅꯤꯁꯨꯕꯥ ꯃꯥꯂꯦꯃꯒꯤ ꯂꯥꯟ ꯍꯧꯕꯒꯤ ꯊꯧꯔꯝ ꯄꯥꯡꯊꯣꯀꯈꯤ
Emblem of Manipur Manipur princely state Human rights abuses in Manipur Beemer Bryce 2013,ꯃꯅꯤꯄꯨꯔ ꯃꯅꯤꯄꯨꯔ ꯔꯥꯖꯀꯨꯃꯥꯔ ꯔꯥꯖ꯭ꯌꯒꯤ ꯃꯤꯑꯣꯏꯕꯒꯤ ꯍꯀꯁꯤꯡ ꯃꯤꯑꯣꯠ-ꯃꯤꯅꯩ ꯆꯠꯊꯕꯥ ꯃꯅꯤꯄꯨꯔ ꯕꯤꯃꯔ ꯕ꯭ꯔꯥꯏꯁ ꯲꯰꯱꯳
The creole city in mainland Southeast Asia Slave gathering warfare and cultural exchange in Burma Thailand and Manipur 18th  19th c,ꯃꯦꯅꯂꯦꯟꯗꯗꯥ ꯂꯩꯕꯥ ꯀ꯭ꯔꯦꯑꯣꯜ ꯁꯤꯇꯤ ꯁꯥꯎꯊꯏꯁ꯭ꯠ ꯑꯦꯁꯤꯌꯥ ꯁ꯭ꯂꯦꯕ ꯈꯣꯃꯖꯤꯜꯂꯀꯄꯥ ꯋꯥꯔꯐꯦꯌꯔ ꯑꯃꯁꯨꯡ ꯀꯂꯆꯔꯦꯜ ꯑꯦꯛꯁꯆꯦꯟꯖ ꯈꯣꯃꯖꯤꯜꯂꯀꯄꯥ ꯕꯔꯃꯥ ꯊꯥꯏꯂꯦꯟꯗ ꯑꯃꯁꯨꯡ ꯃꯅꯤꯄꯨꯔ ꯱꯸ꯁꯨꯕꯥ ꯱꯹ꯁꯨꯕꯥ ꯁꯤ.
Thesis,ꯊꯤꯁꯤꯁ .
University of Hawaii at Manoa,ꯃꯅꯣꯌꯥꯗꯥ ꯂꯩꯕꯥ ꯍꯋꯥꯏ ꯌꯨꯅꯤꯕꯔꯁꯤꯇꯤ
ProQuest 1513230576,ꯄ꯭ꯔꯣꯛꯕꯦꯁ꯭ꯠ ꯱꯵꯱꯳꯲꯳꯰꯵꯷꯶ ꯂꯩ꯫
Harvey G,ꯍꯥꯔꯚꯦ ꯖꯤ .
E,ꯏ .
1925,꯱꯹꯲꯵ꯗꯥ ꯊꯣꯀꯈꯤ꯫
History of Burma From the Earliest Times to 10 March 1824,"ꯈ꯭ꯕꯥꯏꯗꯒꯤ ꯑꯍꯥꯅꯕꯥ ꯃꯇꯃꯗꯒꯤ ꯍꯧꯔꯒꯥ ꯃꯥꯔꯆ ꯱꯰, ꯱꯸꯲꯴ ꯐꯥꯑꯣꯕꯒꯤ ꯃꯅꯨꯡꯗꯥ ꯕꯔꯃꯥꯒꯤ ꯄꯨꯋꯥꯔꯤ"
London Frank Cass  Co. Ltd  via archive.org,ꯂꯟꯗꯟ ꯐ꯭ꯔꯥꯉ꯭ꯛ ꯀꯥꯁ ꯀꯣ ꯂꯤꯃꯤꯇꯦꯗꯅꯥ archive.org ꯒꯤ ꯈꯨꯠꯊꯥꯡꯗꯥ
Hazarika Manjil 2017,ꯍꯥꯖꯥꯔꯤꯀꯥ ꯃꯥꯅꯖꯤꯜ ꯲꯰꯱꯷
Prehistory and Archaeology of Northeast India Multidisciplinary Investigation in an Archaeological Terra Incognita,ꯑꯥꯔꯀꯤꯑꯣꯂꯣꯖꯤꯀꯦꯜ ꯇꯦꯔꯥ ꯏꯅꯀꯣꯒꯅꯤꯇꯥ ꯑꯃꯗꯥ ꯅꯣꯔꯊꯏꯁ꯭ꯠ ꯏꯟꯗꯤꯌꯥꯒꯤ ꯃꯜꯇꯤꯗꯤꯁꯤꯞꯂꯤꯅꯔꯤ ꯏꯅꯚꯦꯁ꯭ꯇꯤꯒꯦꯁꯟꯒꯤ ꯄ꯭ꯔꯤꯍꯤꯁ꯭ꯇꯔꯤ ꯑꯃꯁꯨꯡ ꯑꯥꯔꯀꯤꯑꯣꯂꯣꯖꯤ
Oxford University Press,ꯑꯣꯛꯁꯐꯣꯔꯗ ꯌꯨꯅꯤꯕꯔꯁꯤꯇꯤ ꯄ꯭ꯔꯦꯁꯇꯥ ꯂꯩꯕꯥ ꯑꯦꯝ.
ISBN 9780199474660,ꯑꯥꯏ.ꯑꯦꯁ.ꯕꯤ.ꯑꯦꯟ.꯹꯷꯸꯰꯱꯹꯹꯴꯷꯴꯶꯶꯰ ꯂꯩ꯫
Brandt Carmen 5 December 2017,ꯕ꯭ꯔꯥꯟꯗ ꯀꯥꯔꯃꯦꯟ ꯵ ꯗꯤꯁꯦꯝꯕꯔ ꯲꯰꯱꯷
Writing off domination the Chakma and Meitei script movements,ꯗꯣꯃꯤꯅꯦꯁꯟ ꯑꯣꯐ ꯗ ꯆꯀꯃꯥ ꯑꯃꯁꯨꯡ ꯃꯦꯏꯇꯦꯏ ꯁ꯭ꯛꯔꯤꯞꯇ ꯃꯨꯚꯃꯦꯟꯇꯁꯤꯡ ꯏꯕꯥ
South Asian History and Culture,ꯈꯥ ꯑꯦꯁꯤꯌꯥꯒꯤ ꯄꯨꯋꯥꯔꯤ ꯑꯃꯁꯨꯡ ꯀꯂꯆꯔ
9 116140,꯹ ꯱꯱꯶꯱꯴꯰ꯗꯥ ꯊꯣꯀꯈꯤ꯫
ISSN 19472498,ꯑꯥꯏ.ꯑꯦꯁ.ꯑꯦꯁ.ꯑꯦꯟ.ꯒꯤ ꯱꯹꯴꯷꯲꯴꯹꯸ ꯂꯩ꯫
S2CID 148911026,ꯑꯦꯁ꯲ꯁꯤꯗ ꯱꯴꯸꯹꯱꯱꯰꯲꯶ ꯂꯩ꯫
Naorem Naorem Malemsanba 2015,ꯅꯥꯑꯣꯔꯦꯝ ꯅꯥꯑꯣꯔꯦꯝ ꯃꯥꯂꯦꯃꯁꯥꯅꯕꯥ ꯲꯰꯱꯵
Centrality of body politics in Thokachanbas script and cultural revivalism in Manipur,ꯊꯣꯀꯥꯆꯅꯕꯁꯇꯥ ꯕꯣꯗꯤ ꯄꯣꯂꯤꯇꯤꯛꯁꯀꯤ ꯁꯦꯟꯠꯔꯦꯂꯤꯇꯤ ꯃꯅꯤꯄꯨꯔꯗꯥ ꯂꯩꯕꯥ ꯁ꯭ꯛꯔꯤꯞꯇ ꯑꯃꯁꯨꯡ ꯀꯂꯆꯔꯦꯜ ꯔꯤꯚꯥꯏꯚꯦꯂꯤꯖꯝ
In Noni Arambam Sanatomba Kangujam eds,ꯅꯣꯅꯤ ꯑꯔꯥꯝꯕꯥꯝ ꯁꯅꯥꯇꯣꯝꯕꯥ ꯀꯪꯒꯨꯖꯝ ꯑꯦꯗꯁ .
Colonialism and Resistance Society and State in Manipur,ꯃꯅꯤꯄꯨꯔꯗꯥ ꯀꯣꯂꯣꯅꯤꯑꯦꯂꯤꯖꯝ ꯑꯃꯁꯨꯡ ꯔꯦꯖꯤꯁ꯭ꯇꯦꯟꯁ ꯁꯣꯁꯥꯏꯇꯤ ꯑꯃꯁꯨꯡ ꯔꯥꯖ꯭ꯌ
London Routledge,ꯂꯟꯗꯅꯒꯤ ꯔꯧꯇꯂꯦꯖ .
ISBN 9781315638317,ꯑꯥꯏ.ꯑꯦꯁ.ꯕꯤ.ꯑꯦꯟ.ꯒꯤ ꯹꯷꯸꯱꯳꯱꯵꯶꯳꯸꯳꯱꯷
Parratt Saroj Nalini Arambam 2005,ꯄꯥꯔꯔꯥꯠ ꯁꯔꯣꯖ ꯅꯥꯂꯤꯅꯤ ꯑꯔꯥꯝꯕꯥꯝ ꯲꯰꯰꯵
The Court Chronicle of the Kings of Manipur The Cheitharon Kumpapa  Original Text Translation and Notes,ꯃꯅꯤꯄꯨꯔꯒꯤ ꯅꯤꯡꯊꯧꯁꯤꯡꯒꯤ ꯀꯣꯔꯠ ꯀ꯭ꯔꯣꯅꯤꯀꯜ ꯆꯦꯏꯊꯥꯔꯣꯟ ꯀꯨꯝꯄꯥꯄꯥ ꯑꯣꯔꯤꯖꯤꯅꯦꯜ ꯇꯦꯛꯁꯠ ꯇ꯭ꯔꯥꯟꯁꯂꯦꯁꯟ ꯑꯃꯁꯨꯡ ꯅꯣꯇꯁ
London Routledge,ꯂꯟꯗꯅꯒꯤ ꯔꯧꯇꯂꯦꯖ .
ISBN 0415344301,ꯑꯥꯏ.ꯑꯦꯁ.ꯕꯤ.ꯑꯦꯟ.꯰꯴꯱꯵꯳꯴꯴꯳꯰꯱ꯗꯥ ꯊꯥꯕꯤꯔꯀꯎ꯫
Post Mark W,ꯄꯣꯁ꯭ꯠ ꯃꯥꯔꯛ ꯋꯥ
Burling Robbins 2017,ꯕꯔꯂꯤꯡ ꯔꯣꯕꯤꯟꯁ ꯲꯰꯱꯷ꯇꯥ ꯐꯣꯉꯈꯤ꯫
The TibetoBurman Languages of Northeast India,ꯅꯣꯔꯊꯏꯁ꯭ꯠ ꯏꯟꯗꯤꯌꯥꯒꯤ ꯇꯤꯕꯦꯇꯣꯕꯔꯝꯌꯥꯟ ꯂꯣꯂꯁꯤꯡ
In LaPolla Randy J,ꯂꯥꯄꯣꯜꯂꯥ ꯔꯦꯟꯗꯤ ꯖꯦꯗꯥ ꯂꯩꯕꯥ ꯌꯨ.ꯑꯦꯁ.
Thurgood Graham eds,ꯊꯨꯔꯒꯨꯗ ꯒ꯭ꯔꯥꯍꯥꯝ ꯑꯦꯗꯁ .
The SinoTibetan Languages 2 ed,ꯁꯤꯅꯣꯇꯤꯕꯦꯇꯥꯟ ꯂꯣꯂꯁꯤꯡ ꯲ ꯑꯦꯗ .
Routledge,ꯔꯧꯇꯂꯦꯖ .
pp,ꯄꯤ.ꯄꯤ.
213242,꯲꯱꯳꯲꯴꯲ ꯂꯩ꯫
ISBN 9781138783324,ꯑꯥꯏ.ꯑꯦꯁ.ꯕꯤ.ꯑꯦꯟ.꯹꯷꯸꯱꯱꯳꯸꯷꯸꯳꯳꯲꯴ ꯂꯩ꯫
Sebastian Rodney 2019,ꯁꯦꯕꯥꯁ꯭ꯇꯤꯌꯥꯟ ꯔꯣꯗꯅꯤ ꯲꯰꯱꯹ꯗꯥ ꯐꯣꯉꯈꯤ꯫
Cultural Fusion in a Religious Dance Drama Building the Sacred Body in the Manipuri Rāslīlās Thesis,ꯀꯂꯆꯔꯦꯜ ꯐ꯭ꯌꯨꯖꯟ ꯏꯟ ꯑꯦ ꯙꯔꯝꯃꯒꯤ ꯅꯥꯠ ꯗ꯭ꯔꯃꯥ ꯑꯃꯥ ꯃꯅꯤꯄꯨꯔꯤ ꯔꯥꯁꯂꯤꯂꯥꯁ ꯊꯤꯁꯤꯁꯇꯥ ꯁꯦꯡꯂꯕꯥ ꯍꯀꯆꯥꯡ ꯁꯦꯃꯒꯠꯂꯤ꯫
University of Florida,ꯐ꯭ꯂꯣꯔꯤꯗꯥ ꯂꯩꯕꯥ ꯌꯨꯅꯤꯚꯔꯁꯤꯇꯤꯒꯤ ꯌꯨ.ꯑꯦꯁ.
ProQuest 2464172212,ꯄ꯭ꯔꯣꯛꯕꯦꯁ꯭ꯠ ꯲꯴꯶꯴꯱꯷꯲꯲꯱꯲ ꯂꯩ꯫
The Manipur Kingdom also known as Meckley was an ancient kingdom at the IndiaBurma frontier,ꯃꯦꯀꯂꯦ ꯍꯥꯌꯅꯥ ꯈꯉꯅꯕꯥ ꯃꯅꯤꯄꯨꯔ ꯅꯤꯡꯊꯧ ꯂꯩꯕꯥꯛ ꯑꯁꯤ ꯏꯟꯗꯤꯌꯥꯕꯔꯃꯥ ꯐ꯭ꯔꯟꯇꯤꯌꯥꯔꯗꯥ ꯂꯩꯕꯥ ꯑꯔꯤꯕꯥ ꯅꯤꯡꯊꯧ ꯂꯩꯕꯥꯛ ꯑꯃꯅꯤ .
Historically Manipur was an independent kingdom ruled by a Meitei dynasty,ꯄꯨꯋꯥꯔꯤꯒꯤ ꯃꯇꯨꯡ ꯏꯟꯅꯥ ꯃꯅꯤꯄꯨꯔ ꯑꯁꯤ ꯃꯦꯏꯇꯦꯏ ꯂꯥꯏꯅꯤꯡ ꯂꯝꯕꯤ ꯑꯃꯅꯥ ꯁꯥꯁꯟ ꯇꯧꯕꯥ ꯃꯅꯤꯡꯇꯝꯕꯥ ꯅꯤꯡꯊꯧ ꯂꯩꯕꯥꯛ ꯑꯃꯥ ꯑꯣꯏꯔꯝꯃꯤ .
But it was also invaded and ruled over by Burmese kingdom at various point of time,ꯑꯗꯨꯕꯨ ꯃꯁꯤꯁꯨ ꯂꯥꯟꯊꯦꯡꯅꯈꯤ ꯑꯃꯁꯨꯡ ꯇꯣꯉꯥꯟ ꯇꯣꯉꯥꯅꯕꯥ ꯃꯇꯃꯗꯥ ꯕꯔꯃꯥꯒꯤ ꯅꯤꯡꯊꯧ ꯂꯩꯕꯥꯛꯅꯥ ꯁꯥꯁꯟ ꯇꯧꯈꯤ
It became a protectorate of the British East India Company from 1824 and a princely state of British Raj in 1891,ꯃꯁꯤ ꯱꯸꯲꯴ꯗꯒꯤ ꯍꯧꯅꯥ ꯕ꯭ꯔꯤꯇꯤꯁ ꯏꯁ꯭ꯠ ꯏꯟꯗꯤꯌꯥ ꯀꯝꯄꯦꯅꯤꯒꯤ ꯄ꯭ꯔꯣꯇꯦꯛꯇꯣꯔꯦꯠ ꯑꯃꯥ ꯑꯣꯏꯈꯤ ꯑꯃꯁꯨꯡ ꯱꯸꯹꯱ꯗꯥ ꯕ꯭ꯔꯤꯇꯤꯁ ꯔꯥꯖꯒꯤ ꯔꯥꯖꯀꯨꯃꯥꯔꯒꯤ ꯔꯥꯖ꯭ꯌ ꯑꯃꯥ ꯑꯣꯏꯈꯤ꯫
The princely state bordered the Assam Province in the west and British Burma in the east and in the 20th century covered an area of 22327 square kilometres 8621 sq mi and contained 467 villages,ꯔꯥꯖꯀꯨꯃꯥꯔꯅꯥ ꯅꯣꯡꯆꯨꯞ ꯊꯪꯕꯥ ꯁꯔꯨꯛꯇꯥ ꯂꯩꯕꯥ ꯑꯁꯝ ꯄ꯭ꯔꯣꯚꯤꯟꯁ ꯑꯃꯁꯨꯡ ꯅꯣꯡꯄꯣꯛ ꯊꯪꯕꯥ ꯁꯔꯨꯛꯇꯥ ꯂꯩꯕꯥ ꯕ꯭ꯔꯤꯇꯤꯁ ꯕꯔꯃꯥꯒꯥ ꯉꯃꯈꯩ ꯂꯥꯟꯗꯨꯅꯥ ꯑꯃꯁꯨꯡ ꯲꯰ꯁꯨꯕꯥ ꯆꯍꯤꯆꯥꯗꯥ ꯁ꯭ꯛꯕ꯭ꯌꯥꯔ ꯀꯤꯂꯣꯃꯤꯇꯔ ꯲꯲꯳꯲꯷ ꯁ꯭ꯛꯕ꯭ꯌꯥꯔ ꯃꯥꯏꯜ ꯲꯲꯳꯲꯱ꯒꯤ ꯃꯐꯝ ꯑꯃꯥ ꯀꯣꯅꯁꯤꯅꯈꯤ ꯑꯃꯁꯨꯡ ꯈꯨꯉ꯭ꯒꯪ ꯴꯶꯷ ꯌꯥꯑꯣꯈꯤ꯫
The capital of the state was Imphal,ꯔꯥꯖ꯭ꯌ ꯑꯁꯤꯒꯤ ꯀꯦꯄꯤꯇꯦꯜ ꯑꯁꯤ ꯏꯝꯄꯥꯜ ꯑꯣꯏꯈꯤ ꯫
The early history of Manipur is composed of mythical narratives,ꯃꯅꯤꯄꯨꯔꯒꯤ ꯑꯍꯥꯅꯕꯥ ꯄꯨꯋꯥꯔꯤ ꯑꯁꯤ ꯃꯤꯇꯩꯔꯣꯅꯒꯤ ꯋꯥꯔꯤꯁꯤꯡꯅꯥ ꯁꯦꯝꯕꯅꯤ
The location of the Kangla Fort on the banks of the Imphal River is believed to be where King Pakhangba built his first palace,ꯏꯝꯐꯥꯜ ꯇꯨꯔꯦꯂꯒꯤ ꯅꯥꯀꯂꯗꯥ ꯂꯩꯕꯥ ꯀꯥꯡꯂꯥ ꯐꯣꯔꯇꯀꯤ ꯃꯐꯝ ꯑꯁꯤ ꯅꯤꯡꯊꯧ ꯄꯈꯥꯡꯕꯥꯅꯥ ꯃꯍꯥꯛꯀꯤ ꯑꯍꯥꯅꯕꯥ ꯄꯦꯂꯦꯁ ꯁꯦꯃꯈꯤꯕꯥ ꯃꯐꯝ ꯑꯗꯨꯅꯤ ꯍꯥꯌꯅꯥ ꯊꯥꯖꯅꯔꯤ
Loyumba Shinyen the written constitution of Kangleipak was formally developed by King Loiyumba 10741121 in 1110 AD,ꯂꯣꯌꯨꯝꯕꯥ ꯁꯤꯅꯤꯌꯟ ꯀꯥꯡꯂꯦꯏꯄꯥꯀꯀꯤ ꯑꯏꯕꯥ ꯁꯪꯕꯤꯙꯥꯟ ꯑꯁꯤ ꯅꯤꯡꯊꯧ ꯂꯣꯏꯌꯨꯝꯕꯥ ꯱꯰꯷꯴꯱꯱꯲꯱ꯅꯥ ꯱꯱꯱꯰ ꯑꯦ.ꯗꯤ.
He consolidated the kingdom by incorporating most of the principalities in the surrounding hills,ꯃꯍꯥꯛꯅꯥ ꯑꯀꯣꯌꯕꯗꯥ ꯂꯩꯔꯤꯕꯥ ꯍꯤꯊꯥꯡꯐꯃꯁꯤꯡꯗꯥ ꯄ꯭ꯔꯤꯟꯁꯤꯄꯥꯂꯤꯇꯤ ꯑꯌꯥꯝꯕꯕꯨ ꯌꯥꯑꯣꯍꯟꯗꯨꯅꯥ ꯅꯤꯡꯊꯧ ꯂꯩꯕꯥꯛ ꯑꯗꯨ ꯀꯅꯁꯣꯂꯤꯗꯦꯠ ꯇꯧꯈꯤ
After subjugating all the villages within their valley Kangleipak kings grew in power and began a policy of expansion beyond their territory,ꯃꯈꯣꯌꯒꯤ ꯂꯃꯗꯃꯒꯤ ꯃꯅꯨꯡꯗꯥ ꯂꯩꯕꯥ ꯈꯨꯉ꯭ꯒꯪ ꯄꯨꯝꯅꯃꯀꯄꯨ ꯃꯈꯥ ꯇꯥꯅꯥ ꯊꯨꯒꯥꯏꯔꯕꯥ ꯃꯇꯨꯡꯗꯥ ꯀꯥꯡꯂꯦꯏꯄꯥꯛ ꯅꯤꯡꯊꯧꯁꯤꯡꯒꯤ ꯁꯛꯇꯤ ꯍꯦꯅꯒꯠꯂꯀꯈꯤ ꯑꯃꯁꯨꯡ ꯃꯈꯣꯌꯒꯤ ꯂꯃꯗꯃꯒꯤ ꯃꯄꯥꯟꯗꯥ ꯄꯥꯀꯊꯣꯛ ꯆꯥꯎꯊꯣꯀꯄꯒꯤ ꯄꯣꯂꯤꯁꯤ ꯑꯃꯥ ꯍꯧꯈꯤ
In 1443 King Ningthoukhomba raided Akla present day Tamu Myanmar an area ruled by Shan people initiating a policy of Manipuri claims to the neighbouring Kabaw Valley,꯱꯴꯴꯳ꯗꯥ ꯅꯤꯡꯊꯧ ꯅꯤꯡꯊꯧꯈꯣꯃꯕꯥ ꯔꯦꯏꯗ ꯇꯧꯈꯤꯕꯥ ꯑꯛꯂꯥ ꯍꯧꯖꯤꯛ ꯃꯇꯃꯒꯤ ꯇꯥꯃꯨ ꯃ꯭ꯌꯥꯅꯃꯥꯔꯅꯥ ꯌꯨꯝꯂꯣꯟꯅꯔꯤꯕꯥ ꯀꯕꯥꯚ ꯚꯦꯂꯤꯗꯥ ꯃꯅꯤꯄꯨꯔꯤꯒꯤ ꯋꯥꯐꯝ ꯑꯃꯥ ꯂꯥꯎꯊꯣꯛꯂꯤꯕꯥ ꯁꯟ ꯃꯤꯑꯣꯏꯁꯤꯡꯅꯥ ꯁꯥꯁꯟ ꯇꯧꯕꯥ ꯃꯐꯝ ꯑꯃꯥ
The zenith of the Kangleipak State was reached under the rule of King Khagemba 15971652,ꯀꯥꯡꯂꯦꯏꯄꯥꯛ ꯔꯥꯖ꯭ꯌꯒꯤ ꯖꯦꯅꯤꯊ ꯑꯁꯤ ꯅꯤꯡꯊꯧ ꯈꯥꯒꯦꯝꯕꯥ ꯱꯵꯹꯷꯱꯶꯵꯲ꯒꯤ ꯂꯩꯉꯥꯛꯀꯤ ꯃꯈꯥꯗꯥ ꯌꯧꯈꯤ꯫
Khagembas brother Prince Shalungba was not happy about Khagembas rule so he fled to the Taraf where he allied with the local Bengali Muslim leaders,ꯈꯥꯒꯦꯃꯕꯥꯁꯀꯤ ꯃꯔꯨꯞ ꯄ꯭ꯔꯤꯟꯁ ꯁꯥꯂꯨꯡꯕꯥꯅꯥ ꯈꯥꯒꯦꯃꯕꯥꯁꯀꯤ ꯂꯩꯉꯥꯛꯀꯤ ꯃꯇꯥꯡꯗꯥ ꯅꯨꯡꯉꯥꯏꯕꯥ ꯐꯣꯡꯗꯣꯀꯈꯤꯗꯦ ꯃꯔꯝ ꯑꯗꯨꯅꯥ ꯃꯍꯥꯛꯅꯥ ꯃꯐꯝ ꯑꯗꯨꯒꯤ ꯕꯦꯉ꯭ꯒꯂꯤ ꯃꯨꯁ꯭ꯂꯤꯝ ꯂꯨꯆꯤꯡꯕꯁꯤꯡꯒꯥ ꯂꯣꯌꯅꯅꯥ ꯑꯦꯂꯥꯏꯗ ꯇꯧꯈꯤꯕꯥ ꯇꯥꯔꯥꯐꯇꯥ ꯂꯥꯟꯊꯣꯀꯈꯤ
With a contingent of Bengali Muslim soldiers led by Muhammad Sani Shalungba then attempted to invade Manipur but the soldiers were captured and made to work as labourers in Manipur,ꯃꯗꯨꯒꯤ ꯃꯇꯨꯡꯗꯥ ꯃꯨꯍꯝꯃꯗ ꯁꯅꯤ ꯁꯥꯂꯨꯡꯕꯥꯅꯥ ꯂꯨꯆꯤꯡꯕꯥ ꯕꯦꯉ꯭ꯒꯂꯤ ꯃꯨꯁ꯭ꯂꯤꯝ ꯂꯥꯟꯃꯤꯁꯤꯡꯒꯤ ꯀꯟꯇꯤꯟꯖꯦꯟꯇ ꯑꯃꯒꯥ ꯂꯣꯌꯅꯅꯥ ꯃꯅꯤꯄꯨꯔꯗꯥ ꯆꯪꯁꯤꯟꯅꯕꯥ ꯍꯣꯠꯅꯈꯤ ꯑꯗꯨꯕꯨ ꯂꯥꯟꯃꯤꯁꯤꯡꯕꯨ ꯂꯥꯟꯗꯥꯗꯨꯅꯥ ꯃꯅꯤꯄꯨꯔꯗꯥ ꯂꯦꯕꯔꯔ ꯑꯣꯏꯅꯥ ꯊꯕꯛ ꯇꯧꯅꯕꯥ ꯍꯣꯠꯅꯈꯤ꯫
These soldiers married local Meitei women and adapted to the Meitei language,ꯍꯥꯌꯔꯤꯕꯥ ꯂꯥꯟꯃꯤꯁꯤꯡ ꯑꯁꯤꯅꯥ ꯃꯐꯝ ꯑꯗꯨꯒꯤ ꯃꯦꯏꯇꯦꯌ ꯅꯨꯄꯤꯁꯤꯡꯒꯥ ꯂꯨꯍꯣꯡꯈꯤ ꯑꯃꯁꯨꯡ ꯃꯦꯏꯇꯦ ꯂꯣꯂꯗꯥ ꯑꯦꯗꯞꯇꯦꯠ ꯇꯧꯈꯤ
They introduced hookah to Manipur and founded the Meitei Pangals Manipuri Muslim community,ꯃꯈꯣꯌꯅꯥ ꯃꯅꯤꯄꯨꯔꯗꯥ ꯍꯨꯀꯥ ꯊꯥꯈꯤ ꯑꯃꯁꯨꯡ ꯃꯦꯏꯇꯦ ꯄꯥꯉ꯭ꯒꯂꯁ ꯃꯅꯤꯄꯨꯔꯤ ꯃꯨꯁ꯭ꯂꯤꯝ ꯀꯝꯝꯌꯨꯅꯤꯇꯤ ꯂꯤꯡꯈꯠꯈꯤ
It is claimed that Manipur learned the art of making gunpowder from the Chinese merchants who visited the state around 1630 and had started making rockets named Meikappi by the early 18th century,ꯃꯅꯤꯄꯨꯔꯅꯥ ꯃꯅꯤꯄꯨꯔꯅꯥ ꯆꯥꯎꯔꯥꯛꯅꯥ ꯏꯪ ꯱꯶꯳꯰ ꯒꯤ ꯃꯅꯨꯡꯗꯥ ꯔꯥꯖ꯭ꯌ ꯑꯁꯤꯗꯥ ꯂꯥꯀꯈꯤꯕꯥ ꯑꯃꯁꯨꯡ ꯱꯸ꯁꯨꯕꯥ ꯆꯍꯤꯆꯥꯒꯤ ꯑꯍꯥꯅꯕꯥ ꯆꯍꯤꯗꯥ ꯃꯦꯏꯀꯥꯞꯄꯤ ꯀꯧꯕꯥ ꯔꯣꯀꯦꯠꯁꯤꯡ ꯁꯦꯝꯕꯥ ꯍꯧꯈꯤꯕꯥ ꯆꯥꯏꯅꯥꯒꯤ ꯂꯂꯣꯅꯕꯁꯤꯡꯗꯒꯤ ꯒꯨꯟꯗꯥꯔ ꯁꯥꯕꯒꯤ ꯀꯂꯥ ꯑꯁꯤ ꯇꯃꯈꯤ ꯍꯥꯌꯅꯥ ꯂꯥꯑꯣꯊꯣꯛꯂꯤ꯫
In 1714 King Pamheiba was initiated into Gaudiya Vaishnavism by Shantidas Gosai a Bengali Hindu from Sylhet,꯱꯷꯱꯴ꯗꯥ ꯅꯤꯡꯊꯧ ꯄꯥꯝꯍꯦꯏꯕꯥ ꯑꯁꯤ ꯁꯤꯂꯍꯦꯠꯇꯒꯤ ꯁꯟꯇꯤꯗꯥꯁ ꯒꯣꯁꯥꯏ ꯑꯦ ꯕꯦꯉ꯭ꯒꯂꯤ ꯍꯤꯟꯗꯨꯅꯥ ꯒꯥꯎꯗꯤꯌꯥ ꯕꯩꯁ꯭ꯅꯕꯁꯇꯥ ꯍꯧꯗꯣꯀꯈꯤ꯫
He made the Gaudiya Vaishnava faith the state religion replacing Meitei religion made the Meitei language aka Manipuri language written in Bengali script destroying many documents of Meitei language written in Meitei script and changed his name to Garib Niwaj,ꯃꯍꯥꯛꯅꯥ ꯒꯥꯎꯗꯤꯌꯥ ꯕꯩꯁ꯭ꯅꯕ ꯊꯥꯖꯕꯥ ꯑꯁꯤ ꯔꯥꯖ꯭ꯌꯒꯤ ꯙꯔꯝꯃꯅꯥ ꯃꯦꯏꯇꯦ ꯙꯔꯝꯃꯒꯤ ꯃꯍꯨꯠ ꯁꯤꯟꯗꯨꯅꯥ ꯃꯦꯏꯇꯦꯒꯤ ꯂꯣꯜ ꯑꯁꯤ ꯕꯦꯉ꯭ꯒꯂꯤ ꯁ꯭ꯛꯔꯤꯞꯇꯇꯥ ꯏꯕꯥ ꯃꯅꯤꯄꯨꯔꯤ ꯂꯣꯜ ꯑꯁꯤ ꯃꯦꯏꯇꯦꯏ ꯂꯣꯅꯒꯤ ꯗꯣꯀꯨꯃꯦꯟꯇ ꯀꯌꯥ ꯑꯃꯥ ꯃꯦꯏꯇꯦꯏ ꯁ꯭ꯛꯔꯤꯞꯇꯇꯥ ꯏꯔꯝꯕꯥ ꯑꯃꯁꯨꯡ ꯃꯍꯥꯛꯀꯤ ꯃꯤꯡ ꯒꯔꯤꯕ ꯅꯤꯋꯥꯖ ꯍꯥꯌꯅꯥ ꯍꯣꯡꯗꯣꯀꯈꯤ
In 1724 the Sanskrit name Manipur transl,꯱꯷꯲꯴ꯗꯥ ꯁꯪꯁ꯭ꯀ꯭ꯔ꯭ꯏꯇꯀꯤ ꯃꯃꯤꯡ ꯃꯅꯤꯄꯨꯔ ꯇ꯭ꯔꯥꯟꯁꯜ
the City of Jewels was adopted as the name of the state to make the realm eponymous with Manipura of the Mahabharata,ꯖꯨꯌꯦꯂꯁꯤꯡꯒꯤ ꯁꯍꯔ ꯑꯁꯤ ꯃꯍꯥꯚꯥꯔꯇꯀꯤ ꯃꯅꯤꯄꯨꯔꯥꯒꯥ ꯂꯣꯌꯅꯅꯥ ꯂꯝ ꯏꯄꯣꯝ ꯑꯣꯏꯍꯟꯅꯕꯥ ꯔꯥꯖ꯭ꯌꯒꯤ ꯃꯤꯡ ꯑꯣꯏꯅꯥ ꯂꯧꯈꯤ
King Garib Niwaj made several incursions into Burma but made no permanent conquest,ꯅꯤꯡꯊꯧ ꯒꯔꯤꯕ ꯅꯤꯋꯥꯖꯅꯥ ꯕꯔꯃꯥꯗꯥ ꯏꯅꯛꯌꯨꯔꯁꯟ ꯀꯌꯥ ꯑꯃꯥ ꯇꯧꯈꯤ ꯑꯗꯨꯕꯨ ꯃꯇꯝ ꯆꯨꯞꯄꯒꯤ ꯑꯣꯏꯅꯥ ꯃꯥꯏꯊꯤꯕꯥ ꯄꯤꯈꯤꯗꯦ
After the death of Gharib Nawaz in 1754 Manipur was occupied by the Kingdom of Burma and the Meitei king Bhagyachandra Meitei ChingThang Khomba sought help from the British but when the British refused help he went to Ahom King Rajeswar Singha who sent a force of 40000 under Haranath Senapati Phukan to free Manipur,꯱꯷꯵꯴ꯗꯥ ꯘꯔꯕ ꯅꯋꯥꯖꯅꯥ ꯁꯤꯔꯕꯥ ꯃꯇꯨꯡꯗꯥ ꯃꯅꯤꯄꯨꯔꯕꯨ ꯕꯔꯃꯥꯒꯤ ꯅꯤꯡꯊꯧ ꯂꯩꯕꯥꯛ ꯑꯃꯁꯨꯡ ꯃꯦꯏꯇꯦꯏ ꯅꯤꯡꯊꯧ ꯚꯥꯒ꯭ꯌꯆꯟꯗ꯭ꯔꯥ ꯃꯦꯏꯇꯦꯏ ꯆꯤꯡꯊꯥꯡ ꯈꯣꯃꯕꯥꯅꯥ ꯕ꯭ꯔꯤꯇꯤꯁꯀꯤ ꯃꯇꯦꯡ ꯄꯥꯡꯈꯤ ꯑꯗꯨꯕꯨ ꯕ꯭ꯔꯤꯇꯤꯁꯁꯤꯡꯅꯥ ꯃꯇꯦꯡ ꯄꯥꯡꯗꯕꯥ ꯃꯇꯃꯗꯥ ꯃꯍꯥꯛ ꯑꯍꯣꯝ ꯅꯤꯡꯊꯧ ꯔꯥꯖꯦꯁꯋꯥꯔ ꯁꯤꯡꯍꯗꯥ ꯆꯠꯈꯤ ꯑꯃꯁꯨꯡ ꯃꯍꯥꯛꯅꯥ ꯍꯔꯥꯅꯥꯊ ꯁꯦꯅꯄꯥꯇꯤꯒꯤ ꯃꯈꯥꯗꯥ ꯂꯩꯕꯥ 40000 ꯒꯤ ꯃꯈꯥꯗꯥ ꯂꯩꯕꯥ ꯐꯣꯔꯁ ꯑꯃꯥ ꯐ꯭ꯔꯤ ꯃꯂꯄꯨꯔꯗꯥ ꯊꯥꯈꯤ꯫
A treaty of alliance was negotiated in 1762 and a military force was sent to assist Manipur,꯱꯷꯶꯲ꯗꯥ ꯑꯦꯂꯥꯏꯟꯁꯀꯤ ꯇ꯭ꯔꯤꯇꯤ ꯑꯃꯥ ꯌꯥꯅꯈꯤ ꯑꯃꯁꯨꯡ ꯃꯅꯤꯄꯨꯔꯗꯥ ꯃꯇꯦꯡ ꯄꯥꯡꯅꯕꯥ ꯃꯤꯂꯤꯇꯔꯤ ꯐꯣꯔꯁ ꯑꯃꯥ ꯊꯥꯈꯤ
The force was later recalled and then the state was left to its own devices,ꯐꯣꯔꯁ ꯑꯁꯤ ꯃꯇꯨꯡꯗꯥ ꯑꯃꯨꯛ ꯍꯟꯅꯥ ꯅꯤꯡꯁꯤꯡꯈꯤ ꯑꯃꯁꯨꯡ ꯃꯗꯨꯒꯤ ꯃꯇꯨꯡꯗꯥ ꯔꯥꯖ꯭ꯌ ꯑꯁꯤ ꯃꯁꯥꯒꯤ ꯑꯣꯏꯕꯥ ꯈꯨꯠꯂꯥꯌꯁꯤꯡꯗꯥ ꯊꯃꯈꯤ .
Manipur was invaded at the onset of the First AngloBurmese War together with Cachar and Assam,ꯀꯥꯆꯥꯔ ꯑꯃꯁꯨꯡ ꯑꯁꯃꯒꯥ ꯂꯣꯌꯅꯅꯥ ꯑꯍꯥꯅꯕꯥ ꯑꯦꯉ꯭ꯒꯂꯣꯕꯔꯃꯒꯤ ꯂꯥꯟ ꯍꯧꯔꯀꯄꯗꯥ ꯃꯅꯤꯄꯨꯔꯗꯥ ꯂꯥꯟꯗꯥꯈꯤ
Following the Burmese occupation of Manipur and of Assam in 1824 the British declared war on Burma which came to be known as the First AngloBurmese War,ꯃꯅꯤꯄꯨꯔ ꯑꯃꯁꯨꯡ ꯑꯁꯃꯒꯤ ꯕꯔꯃꯥꯅꯥ ꯱꯸꯲꯴ꯗꯥ ꯂꯧꯁꯤꯅꯈꯤꯕꯥ ꯃꯇꯨꯡꯗꯥ ꯕ꯭ꯔꯤꯇꯤꯁꯅꯥ ꯕꯔꯃꯥꯒꯤ ꯃꯇꯥꯡꯗꯥ ꯂꯥꯟ ꯂꯥꯑꯣꯊꯣꯀꯈꯤ ꯃꯗꯨꯕꯨ ꯑꯍꯥꯅꯕꯥ ꯑꯦꯉ꯭ꯒꯂꯣꯕꯔꯝ ꯋꯥꯔ ꯍꯥꯌꯅꯥ ꯈꯉꯅꯔꯀꯈꯤ꯫
The exiled Manipur prince Gambhir Singh sought British help for raising a force and the request was granted,ꯑꯦꯛꯁꯥꯏꯖ ꯇꯧꯔꯕꯥ ꯃꯅꯤꯄꯨꯔ ꯄ꯭ꯔꯤꯟꯁ ꯒꯝꯕꯤꯔ ꯁꯤꯡꯍꯅꯥ ꯐꯣꯔꯁ ꯑꯃꯥ ꯈꯣꯃꯒꯠꯄꯒꯤꯗꯃꯛ ꯕ꯭ꯔꯤꯇꯤꯁꯀꯤ ꯃꯇꯦꯡ ꯂꯧꯈꯤ ꯑꯃꯁꯨꯡ ꯍꯥꯌꯖꯕꯥ ꯑꯗꯨ ꯄꯤꯈꯤ
Sepoys and artillery were sent and British officers trained a levy of Manipuri troops for the battles that ensued,ꯁꯤꯄꯣꯏ ꯑꯃꯁꯨꯡ ꯑꯥꯔꯇꯤꯂꯥꯔꯤ ꯊꯥꯈꯤ ꯑꯃꯁꯨꯡ ꯕ꯭ꯔꯤꯇꯤꯁ ꯑꯣꯐꯤꯁꯥꯔꯁꯤꯡꯅꯥ ꯂꯥꯟ ꯁꯣꯛꯅꯕꯒꯤꯗꯃꯛ ꯃꯅꯤꯄꯨꯔꯤ ꯇ꯭ꯔꯨꯄꯁꯤꯡꯒꯤ ꯂꯦꯕꯤ ꯑꯃꯥ ꯇ꯭ꯔꯦꯅꯤꯡ ꯄꯤꯈꯤ
With British help Gambhir Singh succeeded in expulsion of Burmese from Manipur after receiving additional reinforcement he expelled the Burmese from Kabaw Valley by 1826 as well and Gambhir Singh became the king of Manipur after the war the Treaty of Yandabo was signed,ꯕ꯭ꯔꯤꯇꯤꯁꯀꯤ ꯃꯇꯦꯡꯒꯥ ꯂꯣꯌꯅꯅꯥ ꯒꯝꯚꯤꯔ ꯁꯤꯡꯍꯅꯥ ꯑꯍꯦꯅꯕꯥ ꯔꯤꯏꯅꯐꯣꯔꯁꯃꯦꯟꯇ ꯐꯪꯂꯕꯥ ꯃꯇꯨꯡꯗꯥ ꯃꯅꯤꯄꯨꯔꯗꯒꯤ ꯕꯔꯃꯤꯁꯄꯨ ꯂꯧꯊꯣꯀꯈꯤꯕꯥ ꯃꯥꯌ ꯄꯥꯀꯈꯤ ꯑꯃꯁꯨꯡ ꯃꯍꯥꯛꯅꯥ 1826 ꯐꯥꯑꯣꯕꯗꯥ ꯀꯕꯥ ꯂꯃꯗꯃꯗꯒꯤ ꯕꯔꯃꯥꯒꯤ ꯃꯤꯑꯣꯏ ꯑꯗꯨ ꯂꯧꯊꯣꯀꯈꯤ ꯑꯃꯁꯨꯡ ꯒꯝꯚꯤꯔ ꯁꯤꯡꯍꯅꯥ ꯂꯥꯟ ꯑꯗꯨꯒꯤ ꯃꯇꯨꯡꯗꯥ ꯌꯥꯟꯗꯥꯕꯣ
According to the British political agent McCulloch by the treaty of Yandabo Manipur was declared independent but being too weak by itself to remain so and its position being in a military point of view of too much importance to permit the chance of the Burmese obtaining the command of it the British government has been compelled to guard against such a chance and,ꯕ꯭ꯔꯤꯇꯤꯁꯀꯤ ꯄꯣꯂꯤꯇꯤꯀꯦꯜ ꯑꯦꯖꯦꯟꯇ ꯃꯦꯀꯀꯨꯂꯣꯆꯀꯤ ꯃꯇꯨꯡ ꯏꯟꯅꯥ ꯌꯥꯟꯗꯕꯣ ꯃꯅꯤꯄꯨꯔꯒꯤ ꯇ꯭ꯔꯤꯇꯤꯅꯥ ꯃꯅꯤꯡꯇꯝꯕꯥ ꯍꯥꯌꯅꯥ ꯂꯥꯎꯊꯣꯀꯈꯤ ꯑꯗꯨꯕꯨ ꯃꯁꯥꯅꯥ ꯃꯁꯥꯕꯨ ꯌꯥꯝꯅꯥ ꯂꯨꯅꯥ ꯂꯧꯗꯨꯅꯥ ꯂꯩ ꯍꯥꯌꯅꯥ ꯌꯥꯝꯅꯥ ꯂꯨꯕꯥ ꯑꯃꯗꯤ ꯃꯁꯤꯒꯤ ꯄꯣꯖꯤꯁꯟ ꯑꯁꯤ ꯕꯔꯃꯥꯅꯥ ꯃꯁꯤꯒꯤ ꯀꯝꯃꯥꯟꯗ ꯑꯁꯤ ꯐꯪꯕꯒꯤ ꯈꯨꯗꯣꯡꯆꯥꯕꯥ ꯑꯁꯤ ꯕ꯭ꯔꯤꯇꯤꯁ ꯁꯔꯀꯥꯔꯅꯥ ꯑꯁꯤꯒꯨꯝꯕꯥ ꯈꯨꯗꯣꯡꯆꯥꯕꯥ ꯑꯁꯤ ꯉꯥꯀꯊꯣꯛꯅꯕꯥ ꯇꯀꯁꯤꯅꯕꯥ ꯌꯥꯍꯟꯅꯕꯥ ꯌꯥꯝꯅꯥ ꯃꯔꯨ ꯑꯣꯏꯕꯥ ꯋꯥꯐꯝ ꯑꯃꯥ ꯑꯣꯏꯅꯥ ꯃꯤꯂꯤꯇꯔꯤꯒꯤ ꯃꯤꯠꯌꯦꯡꯗꯥ ꯂꯩꯕꯥ ꯑꯁꯤ ꯌꯥꯝꯅꯥ ꯂꯨꯕꯥ ꯑꯃꯅꯤ ꯍꯥꯌꯅꯥ ꯂꯥꯑꯣꯊꯣꯀꯈꯤ꯫
to retain in the country a political agent all border disputes having been settled by this officer,ꯂꯩꯕꯥꯛ ꯑꯁꯤꯗꯥ ꯄꯣꯂꯤꯇꯤꯀꯦꯜ ꯑꯦꯖꯦꯟꯇ ꯑꯃꯥ ꯊꯝꯅꯕꯥ ꯑꯣꯐꯤꯁꯔ ꯑꯁꯤꯅꯥ ꯉꯃꯈꯩꯒꯤ ꯋꯥꯊꯣꯛ ꯄꯨꯝꯅꯃꯛ ꯂꯣꯏꯁꯤꯅꯈ꯭ꯔꯦ
However the Burmese did not agree to the cession of Kabaw Valley,ꯑꯗꯨꯝ ꯑꯣꯏꯅꯃꯛ ꯕꯔꯃꯥꯅꯥ ꯀꯥꯕꯥ ꯚꯦꯂꯤꯒꯤ ꯁꯦꯁꯟ ꯑꯁꯤ ꯌꯥꯈꯤꯗꯦ .
