en,mni-Mtei
nvo of the speakers made a lasting impression. Dr. Bern-,ꯋꯥꯉꯥꯡꯂꯣꯏꯁꯤꯡꯒꯤ ꯑꯦꯟ.ꯚꯤ.ꯑꯣ.ꯅꯥ ꯂꯦꯡꯗꯕꯥ ꯏꯊꯤꯜ ꯑꯃꯥ ꯄꯤꯈꯤ꯫
hardt was a charismatic entertainer. He knew how to en-,ꯍꯥꯔꯗꯠ ꯑꯁꯤ ꯀꯦꯔꯤꯖꯃꯦꯇꯤꯛ ꯑꯦꯟꯇꯔꯇꯦꯅꯔ ꯑꯃꯥ ꯑꯣꯏꯈꯤ꯫
gage an audience and generate enthusiasm. Dr. Smith,ꯒꯦꯖ ꯑꯃꯥ ꯑꯣꯗꯤꯁꯟ ꯑꯃꯥ ꯑꯃꯁꯨꯡ ꯊꯋꯥꯏ ꯌꯥꯑꯣꯕꯥ ꯄꯣꯀꯍꯜꯂꯤ꯫
"was quiet and thoughtful, but not terribly inspiring. At","ꯅꯤꯡꯊꯤꯖꯅꯥ ꯑꯃꯁꯨꯡ ꯋꯥꯈꯜ ꯈꯟꯊꯕꯥ ꯑꯣꯏꯔꯝꯃꯤ, ꯑꯗꯨꯕꯨ ꯑꯉꯀꯄꯥ ꯃꯑꯣꯡꯗꯥ ꯏꯟꯁꯄꯤꯔꯦꯁꯟ ꯂꯩꯈꯤꯗꯦ꯫"
"first, the participants raved about the magnetic Bemhardt","ꯑꯍꯥꯅꯕꯗꯥ, ꯁꯔꯨꯛ ꯌꯥꯔꯤꯕꯁꯤꯡꯅꯥ ꯃꯦꯒ꯭ꯅꯦꯇꯤꯛ ꯕꯦꯃꯍꯥꯔꯗꯀꯤ ꯃꯇꯥꯡꯗꯥ ꯋꯥ ꯉꯥꯡꯈꯤ"
"and ioked about the boring Smith, but ultimately it was","ꯑꯃꯁꯨꯡ ꯕꯣꯔꯤꯡ ꯁ꯭ꯃꯤꯊꯀꯤ ꯃꯇꯥꯡꯗꯥ ꯑꯥꯏꯑꯣꯀꯦꯗ ꯇꯧꯈꯤ, ꯑꯗꯨꯕꯨ ꯑꯔꯣꯏꯕꯗꯥ ꯃꯁꯤ ꯑꯣꯏꯈꯤ꯫"
ttre latter who won over the group. She had been mindful,ꯒ꯭ꯔꯨꯞ ꯑꯁꯤꯒꯤ ꯃꯊꯛꯇꯥ ꯃꯥꯏ ꯄꯥꯀꯈꯤꯕꯥ ꯇꯤ.ꯇꯤ.ꯑꯥꯔ.ꯏ.
of her audience. She had taken their questions seriously,ꯃꯍꯥꯛꯀꯤ ꯑꯣꯗꯤꯁꯅꯒꯤ ꯃꯇꯥꯡꯗꯥ ꯋꯥꯐꯝ ꯀꯌꯥ ꯊꯃꯈꯤ꯫
and listened to their concerns. Dr. Bernhardt had used,ꯑꯃꯁꯨꯡ ꯃꯈꯣꯌꯒꯤ ꯑꯋꯥꯕꯁꯤꯡ ꯇꯥꯈꯤ꯫
them only as a foil for his routine,ꯃꯈꯣꯌꯁꯤꯡ ꯑꯁꯤ ꯃꯍꯥꯛꯀꯤ ꯔꯨꯇꯤꯅꯒꯤꯗꯃꯛ ꯐꯣꯏꯜ ꯑꯣꯏꯅꯥ ꯈꯛꯇꯃꯛ .
Perhaps the most notable distinction between the,ꯌꯥꯑꯣꯔꯃꯒꯗꯕꯗꯤ ꯈ꯭ꯕꯥꯏꯗꯒꯤ ꯊꯣꯏꯗꯣꯀꯄꯥ ꯈꯦꯠꯅꯕꯥ ꯑꯗꯨ .
speakers was this: Bernhardt exceeded his time limit at,ꯁ꯭ꯄꯤꯀꯔꯁꯤꯡ ꯑꯁꯤ ꯃꯁꯤꯅꯤ: ꯕꯔꯅꯍꯥꯔꯗꯅꯥ ꯃꯍꯥꯛꯀꯤ ꯃꯇꯃꯒꯤ ꯂꯤꯃꯤꯠ ꯑꯗꯨ ꯍꯦꯟꯅꯥ ꯋꯥꯡꯈꯠꯍꯅꯈꯤ꯫
every session and seemed to resent it when people started,ꯁꯦꯁꯟ ꯈꯨꯗꯤꯡꯃꯛꯇꯥ ꯑꯃꯁꯨꯡ ꯃꯤꯌꯥꯝꯅꯥ ꯍꯧꯔꯀꯄꯥ ꯃꯇꯃꯗꯥ ꯃꯁꯤꯕꯨ ꯌꯥꯝꯅꯥ ꯅꯨꯡꯉꯥꯏꯇꯕꯥ ꯐꯥꯑꯣꯈꯤ꯫
to fidget. Dr. Smith was more tuned in. At the first sign,ꯐꯤꯗꯝꯅꯤꯡꯉꯥꯏ ꯑꯣꯏꯕꯥ꯫
"of restlessness, she would suggest taking a break. She","ꯋꯥꯈꯜ ꯅꯨꯡꯉꯥꯏꯇꯕꯥ, ꯃꯍꯥꯛꯅꯥ ꯕ꯭ꯔꯦꯛ ꯑꯃꯥ ꯂꯧꯅꯕꯥ ꯄꯥꯎꯇꯥꯛ ꯄꯤꯒꯅꯤ꯫"
never wore out her welcome,ꯀꯩꯗꯧꯅꯨꯡꯗꯥ ꯃꯍꯥꯛꯀꯤ ꯇꯔꯥꯝꯅꯥ ꯑꯣꯀꯈꯤꯗꯦ .
tTsl,ꯇꯤ.ꯇꯤ.ꯑꯦꯁ.ꯑꯦꯜ.
GET OUT OF YOUR O!(/N \JgAY,ꯅꯍꯥꯛꯀꯤ ꯑꯣ!(/n \jgay)ꯗꯒꯤ ꯊꯣꯛꯂꯛꯀꯅꯤ꯫
ufhy do we keep talking when people have heard,ufhy ꯃꯤꯌꯥꯝꯅꯥ ꯇꯥꯕꯥ ꯃꯇꯃꯗꯥ ꯑꯩꯈꯣꯌꯅꯥ ꯋꯥꯔꯤ ꯁꯥꯟꯅꯗꯨꯅꯥ ꯂꯩꯔꯤ .
"enough? Vhen we badly need to be heard, our conver-",ꯃꯔꯥꯡ ꯀꯥꯏꯅ?
sation usually proceeds in three distinct phases. The first,ꯁꯦꯁꯟ ꯑꯁꯤ ꯃꯍꯧꯁꯥꯅꯥ ꯇꯣꯉꯥꯅꯕꯥ ꯐꯦꯖ ꯑꯍꯨꯃꯗꯥ ꯆꯠꯊꯩ꯫
is an effort to communicate information or express a,ꯑꯁꯤ ꯏꯅꯐꯣꯔꯃꯦꯁꯟ ꯄꯥꯎ ꯐꯥꯑꯣꯅꯅꯕꯥ ꯅꯠꯔꯒꯥ ꯐꯣꯡꯗꯣꯛꯅꯕꯥ ꯍꯣꯠꯅꯕꯥ ꯑꯃꯅꯤ꯫
"point of view. Once ttrat is accomplished, other needs",ꯄꯣꯏꯟꯇ ꯑꯣꯐ ꯚꯤꯎ꯫
"take over. In the second stage, the principal motivation",ꯂꯧꯈꯠꯂꯨ꯫
is to relieve tension. Gabbing away iustto make ourselves,ꯑꯁꯤ ꯇꯦꯟꯁꯟ ꯍꯟꯊꯍꯅꯕꯅꯤ꯫
"feel better, we repeat or rephrase what we have already","ꯍꯦꯟꯅꯥ ꯐꯕꯥ ꯐꯤꯜ ꯇꯧꯕꯥ, ꯑꯩꯈꯣꯌꯅꯥ ꯍꯥꯟꯅꯅꯥ ꯂꯩꯔꯝꯕꯥ ꯑꯗꯨ ꯍꯟꯖꯤꯟ ꯍꯟꯖꯤꯟ ꯇꯧꯕꯥ ꯅꯠꯔꯒꯥ ꯔꯤꯐ꯭ꯔꯦꯁ ꯇꯧꯕꯥ"
"said, or introduce irrelevant subiects. In the third phase","ꯍꯥꯌꯈꯤ, ꯅꯠꯔꯒꯥ ꯃꯔꯤ ꯂꯩꯅꯗꯕꯥ ꯁꯕꯕꯤꯑꯦꯛꯇꯁꯤꯡ ꯌꯥꯑꯣꯍꯅꯕꯥ꯫"
we detour into any area that might keep the listener's,ꯑꯩꯈꯣꯌꯅꯥ ꯇꯥꯔꯤꯕꯥ ꯃꯤꯑꯣꯏ ꯑꯗꯨꯒꯤ ꯃꯐꯃꯗꯥ ꯊꯝꯂꯤꯕꯥ ꯃꯐꯝ ꯑꯃꯍꯦꯛꯇꯗꯥ ꯗꯤꯇꯔ .
"attention, iust to keep from being abandoned. In sum,","ꯑꯦꯇꯦꯟꯁꯟ, ꯑꯥꯏ.ꯌꯨ.ꯑꯦꯁ.ꯇꯤ.ꯅꯥ ꯊꯥꯗꯣꯀꯄꯥ ꯌꯥꯗꯅꯕꯥ꯫"
"the motivation shifts from the need to communicate, to","ꯃꯣꯇꯤꯕꯦꯁꯟ ꯑꯁꯤ ꯄꯥꯎ ꯐꯥꯑꯣꯅꯕꯒꯤ ꯃꯊꯧ ꯇꯥꯕꯗꯒꯤ ꯍꯧꯔꯒꯥ, ."
"the need to relieve tension, to the need to retain control","ꯇꯦꯟꯁꯟ ꯍꯟꯊꯍꯅꯕꯒꯤ ꯃꯊꯧ ꯇꯥꯕꯥ, ꯀꯟꯠꯔꯣꯜ ꯔꯤꯇꯦꯟ ꯇꯧꯕꯒꯤ ꯃꯊꯧ ꯇꯥꯕꯥ"
The listener who gets dragged into phases two and,ꯐꯦꯖ ꯑꯅꯤꯗꯥ ꯗ꯭ꯔꯦꯒ ꯇꯧꯈꯤꯕꯥ ꯇꯥꯔꯤꯕꯥ ꯃꯤꯑꯣꯏ ꯑꯗꯨ ꯑꯃꯁꯨꯡ .
three is placed in the difficult position of having to find,ꯑꯍꯨꯝ ꯑꯁꯤ ꯊꯤꯕꯥ ꯃꯊꯧ ꯇꯥꯕꯒꯤ ꯑꯔꯨꯕꯥ ꯐꯤꯚꯃꯗꯥ ꯊꯝꯂꯤ꯫
"a way out without being impolite. If she can't, she ends",ꯏꯝꯄꯣꯂꯤꯠ ꯑꯣꯏꯗꯅꯥ ꯊꯣꯀꯄꯥ ꯂꯝꯕꯤ ꯑꯃꯅꯤ꯫
up wasting her time and becoming exasperated. For the,ꯃꯍꯥꯛꯀꯤ ꯃꯇꯝ ꯃꯥꯡꯍꯅꯕꯥ ꯑꯃꯁꯨꯡ ꯊꯋꯥꯏ ꯌꯥꯑꯣꯕꯥ ꯍꯦꯅꯒꯠꯂꯀꯄꯥ꯫
"overzealous speaker, the price is even higher; she stands","ꯑꯍꯦꯅꯕꯥ ꯊꯧꯅꯥ ꯂꯩꯕꯥ ꯋꯥꯉꯥꯡꯂꯣꯏ, ꯃꯃꯜ ꯑꯁꯤ ꯍꯦꯟꯅꯥ ꯋꯥꯡꯏ;"
"to lose respect, and possibly even friends","ꯏꯀꯥꯌ ꯈꯨꯝꯅꯕꯥ ꯃꯥꯡꯍꯅꯕꯥ, ꯑꯃꯁꯨꯡ ꯑꯣꯏꯊꯣꯀꯄꯥ ꯌꯥꯕꯥ ꯃꯔꯨꯄꯁꯤꯡ ꯐꯥꯑꯣꯕꯥ ."
In times of stress or excitement *te tension from,ꯁ꯭ꯠꯔꯦꯁ ꯅꯠꯠꯔꯒꯥ ꯑꯦꯛꯁꯥꯏꯇꯦꯁꯅꯒꯤ ꯃꯇꯃꯗꯥ *ꯇꯦ ꯇꯦꯟꯁꯟ 2.0.
keeping our feelings and thoughts to ourselves builds up,ꯑꯩꯈꯣꯌꯒꯤ ꯋꯥꯈꯜ ꯑꯃꯁꯨꯡ ꯋꯥꯈꯜꯂꯣꯅꯁꯤꯡ ꯑꯗꯨ ꯑꯩꯈꯣꯌ ꯏꯁꯥꯗꯥ ꯊꯝꯕꯤꯕꯥ .
"To many of us, it feels so good to unload that we forget","ꯑꯩꯈꯣꯌ ꯀꯌꯥ ꯑꯃꯗꯥ, ꯃꯁꯤ ꯑꯅꯂꯣꯗ ꯇꯧꯕꯥ ꯑꯁꯤ ꯑꯁꯨꯛ ꯌꯥꯝꯅꯥ ꯐꯕꯥ ꯐꯥꯑꯣꯏ ꯃꯗꯨꯗꯤ ꯑꯩꯈꯣꯌꯅꯥ ꯀꯥꯑꯣꯊꯣꯀꯄꯥ ."
"our manners. Ve go from dialogue to monologue,",ꯑꯩꯈꯣꯌꯒꯤ ꯂꯃꯆꯠ-ꯁꯥꯖꯠ꯫
"launching an avalanche of words, unable to stop our-","ꯋꯥꯍꯩꯁꯤꯡꯒꯤ ꯑꯦꯚꯥꯂꯦꯟꯁ ꯑꯃꯥ ꯍꯧꯗꯣꯀꯄꯥ, ꯑꯩꯈꯣꯌꯒꯤ-ꯄꯨꯟꯁꯤ ꯊꯤꯕꯥ ꯉꯃꯗꯕꯥ-"
selves before becoming tiresome or rude,ꯃꯁꯥ ꯃꯊꯟꯇꯥ ꯋꯥꯈꯜ ꯋꯥꯕꯥ ꯅꯠꯔꯒꯥ ꯑꯁꯣꯅꯕꯥ ꯑꯣꯏꯗ꯭ꯔꯤꯉꯩ ꯃꯃꯥꯡꯗꯥ .
"""Blcssed is the man who, having nothing to say,","""ꯕꯤ.ꯑꯦꯜ.ꯁꯤ.ꯑꯦꯁ.ꯑꯦꯁ.ꯏ.ꯗꯤ."
abstains from gtaing in words evifunce,evifunce ꯒꯤ ꯋꯥꯍꯩꯁꯤꯡꯗꯥ ꯖꯤ.ꯇꯤ.ꯌꯨ.ꯗꯒꯤ ꯂꯥꯄꯊꯣꯀꯄꯥ
"of the fact.""","ꯋꯥꯐꯝ ꯑꯁꯤꯒꯤ꯫"""
-GEORGE EUOT,-ꯖꯔꯖ ꯏꯎꯑꯣꯠ
"If you have this tendency, try to be aware of the","ꯀꯔꯤꯒꯨꯝꯕꯥ ꯅꯍꯥꯛꯅꯥ ꯇꯦꯟꯗꯦꯟꯁꯤ ꯑꯁꯤ ꯂꯩꯔꯕꯗꯤ, ꯃꯗꯨꯒꯤ ꯃꯇꯥꯡꯗꯥ ꯈꯪꯖꯤꯟꯅꯕꯥ ꯍꯣꯠꯅꯧ꯫"
stages of conversation and apply the brakes before you,ꯋꯥꯔꯤ ꯁꯥꯟꯅꯕꯒꯤ ꯁ꯭ꯇꯦꯖꯁꯤꯡ ꯑꯃꯁꯨꯡ ꯅꯍꯥꯛꯀꯤ ꯃꯃꯥꯡꯗꯥ ꯕ꯭ꯔꯦꯀꯁꯤꯡ ꯊꯥꯗꯣꯀꯎ
l76 l,ꯑꯦꯜ.꯷꯶ ꯑꯦꯜ.
TALKING !(/HEN NOBODY'S LISTENING,ꯋꯥꯔꯤ ꯁꯥꯅꯕꯥ !(/hen ꯀꯅꯥꯒꯨꯝꯕꯥ ꯑꯃꯠꯇꯅꯥ ꯇꯥꯕꯥ ꯉꯃꯗꯕꯥ .
enter the annoying second stage or the impertinent third,ꯑꯁꯥꯑꯣꯕꯥ ꯑꯅꯤꯁꯨꯕꯥ ꯇꯥꯉ꯭ꯀꯛ ꯅꯠꯠꯔꯒꯥ ꯏꯝꯄꯔꯇꯤꯅꯦꯟꯇ ꯑꯣꯏꯕꯥ ꯑꯍꯨꯃꯁꯨꯕꯥ ꯇꯥꯉ꯭ꯀꯛ ꯑꯗꯨꯗꯥ ꯆꯪꯎ꯫
stage. Keep an eye on the other person's body language,ꯐꯝꯄꯥꯛ.
"If she fidgets or glances at her watch, or her eyes become","ꯀꯔꯤꯒꯨꯝꯕꯥ ꯃꯍꯥꯛꯅꯥ ꯃꯍꯥꯛꯀꯤ ꯋꯥꯆꯤꯗꯥ ꯐꯤꯖꯤꯀꯦꯜ ꯅꯠꯠꯔꯒꯥ ꯃꯤꯠꯌꯦꯡ ꯊꯝꯂꯕꯗꯤ, ꯅꯠꯠꯔꯒꯥ ꯃꯍꯥꯛꯀꯤ ꯃꯤꯠꯌꯦꯡ ꯑꯗꯨ ꯌꯦꯡꯂꯕꯗꯤ ."
"less focused, she is probably trying to figure out a way to","ꯍꯦꯟꯅꯥ ꯃꯤꯠꯌꯦꯡ ꯆꯪꯗꯕꯥ, ꯃꯍꯥꯛꯅꯥ ꯁꯣꯏꯗꯅꯥ ꯂꯝꯕꯤ ꯑꯃꯥ ꯊꯤꯗꯣꯛꯅꯕꯥ ꯍꯣꯠꯅꯔꯤꯕꯅꯤ꯫"
cut you off without being discourteous. Your initial im-,ꯅꯍꯥꯀꯄꯨ ꯋꯥꯈꯜ ꯇꯥꯍꯟꯗꯅꯥ ꯀꯀꯊꯠꯂꯨ꯫
pulse might be to hold her attention by any means pos-,ꯄꯂꯁ ꯑꯣꯏꯕꯥ ꯌꯥꯏ ꯃꯗꯨꯗꯤ ꯃꯍꯥꯛꯀꯤ ꯄꯨꯛꯅꯤꯡ ꯆꯤꯡꯁꯤꯟꯅꯤꯡꯉꯥꯏ ꯑꯣꯏꯕꯥ ꯃꯑꯣꯡꯗꯥ ꯄꯣꯁ-
sible. But it's self-defeating to hold someone's aftention,ꯁꯤꯕꯜ ꯑꯣꯏꯕꯥ꯫
by holding her hostage,ꯃꯍꯥꯛꯀꯤ ꯍꯣꯁ꯭ꯇꯦꯖ ꯑꯗꯨ ꯊꯃꯗꯨꯅꯥ .
You have to decide if the relief you will get from,ꯅꯍꯥꯛꯅꯥ ꯔꯤꯂꯤꯐ ꯑꯗꯨ ꯅꯍꯥꯛꯅꯥ ꯐꯪꯒꯗꯕꯥ ꯔꯤꯂꯤꯐ ꯑꯗꯨ ꯂꯦꯄꯊꯣꯛꯀꯗꯕꯅꯤ꯫
continuing is worth the price. lfhat is the price? The,ꯃꯈꯥ ꯆꯠꯊꯕꯥ ꯑꯁꯤ ꯃꯃꯜ ꯌꯥꯝꯅꯥ ꯆꯪꯏ꯫
other person will probably tune you out or make up an,ꯑꯇꯣꯞꯄꯥ ꯃꯤꯑꯣꯏ ꯑꯃꯅꯥ ꯅꯍꯥꯀꯄꯨ ꯇ꯭ꯌꯨꯟ ꯇꯧꯒꯅꯤ ꯅꯠꯠꯔꯒꯥ ꯁꯦꯃꯒꯅꯤ .
excuse to internrpt you. You can end up feeling embar-,ꯑꯦꯛꯁꯛꯌꯨꯖ ꯇꯨ ꯏꯟꯇꯔꯔꯄꯠ ꯏꯎ꯫
"rassed, foolish or worse. If you wear out your welcome","ꯔꯁ ꯇꯧꯔꯕꯥ, ꯃꯨꯔꯈ ꯅꯠꯠꯔꯒꯥ ꯍꯦꯟꯅꯥ ꯐꯠꯇꯕꯥ꯫"
"often enough, you'll find that people ignore you, ""forget""","ꯑꯌꯥꯝꯕꯥ ꯃꯇꯃꯗꯥ, ꯅꯍꯥꯛꯅꯥ ꯎꯕꯥ ꯐꯪꯒꯅꯤ ꯃꯗꯨꯗꯤ ꯃꯤꯌꯥꯝꯅꯥ ꯅꯍꯥꯀꯄꯨ ꯃꯤꯠꯌꯦꯡ ꯊꯃꯗꯦ, ""ꯀꯥꯑꯣꯊꯣꯀꯎ""꯫"
to return your phone calls and exclude you from gath-,ꯅꯍꯥꯛꯀꯤ ꯐꯣꯟ ꯀꯣꯂꯁꯤꯡ ꯍꯜꯂꯛꯅꯕꯥ ꯑꯃꯁꯨꯡ ꯅꯍꯥꯀꯄꯨ ꯒꯥꯊ-
erings,ꯏꯔꯤꯡꯁ .
Unless your need for immediate gratification is,ꯅꯍꯥꯛꯀꯤ ꯈꯨꯗꯛꯀꯤ ꯑꯣꯏꯕꯥ ꯒ꯭ꯔꯦꯇꯤꯐꯤꯀꯦꯁꯅꯒꯤ ꯃꯊꯧ ꯇꯥꯕꯥ ꯑꯗꯨ ꯑꯣꯏꯗ꯭ꯔꯕꯗꯤ .
"stronger than your need for friends, leam to control your-","ꯅꯍꯥꯛꯀꯤ ꯃꯔꯨꯄꯁꯤꯡꯒꯤ ꯃꯊꯧ ꯇꯥꯕꯗꯒꯤ ꯍꯦꯟꯅꯥ ꯃꯄꯥꯉ꯭ꯒꯜ ꯀꯅꯕꯥ, ꯅꯍꯥꯛꯀꯤ- ꯀꯟꯠꯔꯣꯜ ꯇꯧꯅꯕꯥ ꯂꯤꯝ-"
"self. Remember, you will be appreciated and admired if",ꯝꯁꯥꯒꯤ.
you don't pressure others to keep listening when they've,ꯅꯍꯥꯛꯅꯥ ꯑꯇꯣꯞꯄꯁꯤꯡꯗꯥ ꯄ꯭ꯔꯦꯁꯔ ꯇꯧꯗꯦ ꯃꯈꯣꯌꯅꯥ ꯇꯥꯔꯀꯄꯥ ꯃꯇꯃꯗꯥ ꯇꯥꯅꯕꯥ ꯂꯦꯞꯅꯕꯥ .
heard enough. But if you use them as tension relievers,ꯃꯇꯤꯛ ꯆꯥꯅꯥ ꯇꯥꯈꯤ꯫
"(phase t""vo) and try to dominate their attention (phase","(ꯐꯦꯖ ꯇꯤ""ꯚꯣ) ꯑꯃꯁꯨꯡ ꯃꯈꯣꯌꯒꯤ ꯄꯨꯛꯅꯤꯡ ꯆꯤꯡꯁꯤꯟꯅꯕꯥ ꯍꯣꯠꯅꯕꯥ (ꯐꯦꯖ"
"three), you migfit hold on to them for the moment but","ꯑꯍꯨꯝ), ꯅꯍꯥꯛꯅꯥ ꯃꯤꯀꯨꯞ ꯑꯁꯤꯒꯤꯗꯃꯛ ꯃꯈꯣꯌꯗꯥ ꯃꯤꯒꯐꯤꯠ ꯍꯣꯜꯗ ꯇꯧꯕꯥ ꯌꯥꯏ ꯑꯗꯨꯕꯨ ."
lose them for the future,ꯇꯨꯡꯒꯤꯗꯃꯛ ꯃꯈꯣꯌꯕꯨ ꯃꯥꯡꯍꯅꯕꯥ .
USABLE INSIGHT',ꯁꯤꯖꯤꯟꯅꯕꯥ ꯌꯥꯕꯥ ꯋꯥꯈꯜꯂꯣꯟ'꯫
"When people stop listening, stop talking","ꯃꯤꯌꯥꯝꯅꯥ ꯇꯥꯕꯥ ꯂꯦꯄꯈꯤꯕꯥ ꯃꯇꯃꯗꯥ, ꯋꯥꯔꯤ ꯁꯥꯅꯕꯥ ꯂꯦꯄꯀꯅꯨ ."
your eye on the other person's body language,ꯑꯇꯣꯞꯄꯥ ꯃꯤꯑꯣꯏ ꯑꯗꯨꯒꯤ ꯍꯀꯆꯥꯡꯒꯤ ꯂꯣꯟꯗꯥ ꯅꯍꯥꯛꯀꯤ ꯃꯤꯠꯌꯦꯡ
177 l,꯱꯷꯷ ꯑꯦꯜ.
GET OUT OF YOUR OWN WAY,ꯑꯗꯣꯃꯒꯤ ꯃꯑꯣꯡ ꯃꯇꯧꯗꯒꯤ ꯊꯣꯔꯀꯎ
you would rather feel: the frustration of not com-,ꯅꯍꯥꯛꯅꯥ ꯍꯦꯟꯅꯥ ꯐꯩ ꯍꯥꯌꯅꯥ ꯈꯅꯕꯥ ꯑꯁꯤꯅꯤ: NOT COM- ꯒꯤ ꯐ꯭ꯔꯁ꯭ꯇꯦꯁꯟ
"pleting what you've started to say, or the humiliation","ꯅꯍꯥꯛꯅꯥ ꯍꯥꯌꯕꯥ ꯍꯧꯔꯀꯈꯤꯕꯥ ꯑꯗꯨ, ꯅꯠꯠꯔꯒꯥ ꯅꯨꯡꯉꯥꯏꯇꯕꯥ ꯑꯗꯨ ꯄꯤꯖꯕꯥ"
of talking when no one's listening,ꯀꯅꯥꯒꯨꯝꯕꯥ ꯑꯃꯠꯇꯅꯥ ꯇꯥꯕꯥ ꯃꯇꯃꯗꯥ ꯋꯥꯔꯤ ꯁꯥꯟꯅꯕꯒꯤ .
"turning your monologue into a dialogue, you might","ꯅꯍꯥꯛꯀꯤ ꯃꯣꯅꯣꯂꯣꯒ ꯑꯗꯨ ꯋꯥꯔꯤ ꯁꯥꯅꯕꯥ ꯑꯃꯗꯥ ꯑꯣꯟꯊꯣꯛꯂꯒꯥ, ꯅꯍꯥꯛꯅꯥ ."
extend your welcome instead of wearing it out,ꯃꯁꯤ ꯂꯣꯏꯁꯤꯅꯕꯒꯤ ꯃꯍꯨꯠꯇꯥ ꯅꯍꯥꯛꯀꯤ ꯇꯔꯥꯝꯅꯥ ꯑꯣꯀꯄꯒꯤ ꯃꯑꯣꯡ ꯑꯗꯨ ꯁꯥꯡꯗꯣꯀꯍꯜꯂꯨ .
t78 l,ꯇꯤ.꯷꯸ ꯑꯦꯜ.
When You're Not,ꯅꯍꯥꯛꯅꯥ ꯇꯧꯗꯕꯥ ꯃꯇꯃꯗꯥ .
"""Dare to be true: nothing can nud a lie: Afault,","""ꯑꯆꯨꯝꯕꯥ ꯑꯣꯏꯅꯕꯥ ꯊꯧꯅꯥ: ꯀꯔꯤꯒꯨꯝꯕꯥ ꯑꯃꯠꯇꯥ ꯂꯥꯟꯅꯥ ꯂꯃꯖꯤꯡꯕꯥ ꯉꯃꯗꯦ: ꯑꯔꯥꯅꯕꯥ,"
"which rueds it most, gratl)s two thaefut.""","ꯃꯁꯤꯅꯥ ꯈ꯭ꯕꯥꯏꯗꯒꯤ ꯌꯥꯝꯅꯥ ꯔꯨꯏꯗ ꯇꯧꯏ, ꯒ꯭ꯔꯦꯇꯜ)ꯁ ꯇꯨ ꯊꯥꯐꯨꯠ꯫"""
_GEORGEHERBERT,_ꯖꯔꯖꯍꯔꯕꯦꯠ
"John, a 43-year-old hardware store manager, was telling",ꯆꯍꯤ ꯴꯳ ꯁꯨꯔꯕꯤ ꯍꯥꯔꯗꯋꯦꯌꯔ ꯁ꯭ꯇꯣꯔ ꯃꯦꯅꯦꯖꯔ ꯑꯃꯥ ꯑꯣꯏꯔꯤꯕꯥ ꯖꯣꯟꯗꯥ ꯍꯥꯌꯔꯝꯃꯤ
"me about an upcoming visit from his parents, who lived","ꯑꯩꯍꯥꯀꯄꯨ ꯃꯍꯥꯛꯀꯤ ꯃꯃꯥ-ꯃꯄꯥꯗꯒꯤ ꯂꯥꯛꯀꯗꯧꯔꯤꯕꯥ ꯚꯤꯖꯤꯠ ꯑꯃꯒꯤ ꯃꯇꯥꯡꯗꯥ, ꯃꯈꯣꯌꯅꯥ ꯍꯤꯡꯈꯤꯕꯥ"
out of town. I asked if he was looking forward to seeing,ꯁꯍꯔꯒꯤ ꯃꯄꯥꯟꯗꯥ ꯂꯩꯕꯥ꯫
them,ꯃꯈꯣꯏ
"""It'll be fine,"" he said","ꯃꯍꯥꯛꯅꯥ ꯍꯥꯌꯈꯤ, “ꯃꯁꯤ ꯐꯩ ꯍꯥꯌꯅꯥ ꯃꯍꯥꯛꯅꯥ ꯍꯥꯌꯈꯤ꯫"
"""You don't sound very convincingr"" I replied","""ꯅꯉꯅꯥ ꯌꯥꯝꯅꯥ ꯀꯅꯚꯤꯟꯁꯤꯡ ꯑꯣꯏꯅꯥ ꯁꯣꯜꯂꯤ"" ꯑꯩꯅꯥ ꯄꯥꯎꯈꯨꯝ ꯄꯤꯈꯤ"
"""'Well, they bicker constantly, and criticize every-","""'ꯑꯐꯕꯥ, ꯃꯈꯣꯌꯅꯥ ꯂꯦꯞꯄꯥ ꯂꯩꯇꯅꯥ ꯕꯤꯀꯥꯔ ꯇꯧꯏ, ꯑꯃꯁꯨꯡ ꯀ꯭ꯔꯤꯇꯤꯀꯦꯠ ꯇꯧꯕꯥ ꯈꯨꯗꯤꯡꯃꯛ-"
"thing I do. But they're in their late seventies, so I guess",ꯑꯩꯅꯥ ꯇꯧꯕꯥ ꯊꯕꯛ꯫
"I'm lucky they're still alive.""",ꯑꯩꯍꯥꯛ ꯂꯛꯁ꯭ꯃꯤꯅꯤ ꯃꯈꯣꯌ ꯍꯧꯖꯤꯀꯁꯨ ꯍꯤꯡꯂꯤ꯫”
I pushed John to express what he really felt. He ad-,ꯑꯩꯅꯥ ꯖꯣꯟꯗꯥ ꯃꯍꯥꯛꯅꯥ ꯇꯁꯦꯡꯅꯥ ꯐꯥꯑꯣꯈꯤꯕꯥ ꯑꯗꯨ ꯐꯣꯡꯗꯣꯛꯅꯕꯥ ꯄꯨꯛꯅꯤꯡ ꯊꯧꯒꯠꯈꯤ꯫
"mitted that he couldn't stand his parents' visits. ""It drains",ꯃꯍꯥꯛꯀꯤ ꯃꯃꯥ-ꯃꯄꯥꯒꯤ ꯈꯣꯉꯆꯠꯁꯤꯡ ꯑꯗꯨ ꯂꯦꯞꯄꯥ ꯉꯃꯂꯣꯏ ꯍꯥꯌꯅꯥ ꯃꯤꯠꯌꯦꯡ ꯊꯃꯈꯤ꯫
"mer"" he said. ""Nobody enjoys it, not even them.""","ꯃꯦꯔ"" ꯍꯥꯌꯅꯥ ꯃꯍꯥꯛꯅꯥ ꯍꯥꯌꯈꯤ꯫ ""ꯀꯅꯥꯒꯨꯝꯕꯥ ꯑꯃꯠꯇꯅꯥ ꯅꯨꯡꯉꯥꯏꯕꯥ ꯐꯥꯑꯣꯗꯦ, ꯃꯈꯣꯌ ꯐꯥꯑꯣꯕꯥ ꯅꯠꯇꯦ꯫"""
John's typical response was to withdraw into a sul-,ꯌꯣꯍꯥꯅꯒꯤ ꯃꯁꯛ ꯅꯥꯏꯕꯥ ꯄꯥꯎꯈꯨꯃꯗꯤ ꯁꯨꯜ-
"len, pouty silence. His parents would ask, ""Is something","ꯂꯦꯟ, ꯄꯥꯎꯇꯤ ꯁꯥꯏꯂꯦꯟꯁ꯫"
"wrong?"" and he would say, ""No, no, f'm fine."" In most","ꯑꯔꯥꯅꯕꯥ?"" ꯑꯗꯨꯒꯥ ꯃꯍꯥꯛꯅꯥ ꯍꯥꯌꯔꯝꯃꯤ, ""ꯅꯠꯇꯦ, ꯅꯠꯇꯦ, f'm fine."""
instances he couldn't even admit to himself that,ꯏꯟꯁꯇꯦꯟꯁꯁꯤꯡ ꯃꯍꯥꯛꯅꯥ ꯃꯁꯥꯃꯀꯄꯨ ꯌꯥꯕꯥ ꯉꯃꯈꯤꯗꯦ ꯃꯗꯨꯗꯤ .
something was wrong,ꯀꯔꯤꯒꯨꯝꯕꯥ ꯈꯔꯥ ꯑꯔꯥꯅꯕꯥ ꯑꯣꯏꯈꯤ .
lTel,ꯑꯦꯜ.ꯇꯤ.ꯏ.ꯑꯦꯜ.
GET OUT OF YOUR O\UTN WAY,ꯅꯍꯥꯛꯀꯤ o\utn way ꯗꯒꯤ ꯊꯣꯛꯂꯀꯄꯥ
This sort of denial is common. Admining to yourself,ꯑꯁꯤꯒꯨꯝꯕꯥ ꯃꯈꯂꯒꯤ ꯂꯥꯟꯅꯥ ꯂꯃꯖꯤꯡꯕꯒꯤ ꯃꯑꯣꯡ ꯑꯁꯤ ꯀꯃꯟ ꯑꯣꯏ꯫
that you are upset or in pain can make you feel exposed,ꯅꯍꯥꯛꯅꯥ ꯋꯥꯈꯜ ꯅꯨꯡꯉꯥꯏꯇꯕꯥ ꯅꯠꯠꯔꯒꯥ ꯑꯋꯥꯕꯥ ꯇꯥꯔꯕꯥ ꯍꯥꯌꯕꯁꯤꯅꯥ ꯅꯍꯥꯀꯄꯨ ꯋꯥꯈꯜ ꯇꯥꯍꯜꯂꯀꯄꯥ ꯌꯥꯏ ꯍꯥꯌꯕꯁꯤ
You fear that acknowledging a bad feeling gives it more,ꯐꯠꯇꯕꯥ ꯋꯥꯈꯜ ꯑꯃꯥ ꯌꯥꯑꯣꯕꯅꯥ ꯃꯗꯨ ꯍꯦꯟꯅꯥ ꯄꯤꯔꯤ ꯍꯥꯌꯅꯥ ꯑꯗꯣꯝꯅꯥ ꯂꯥꯡꯇꯛꯅꯔꯤ .
power. The pain might get worse. You might not be able,ꯄꯥꯡꯒꯜ.
"to tolerate it. In fact, the opposite is usually true: recog-",ꯃꯁꯤ ꯊꯦꯡꯅꯅꯕꯥ꯫
nizing a feeling releases pent-up tension and makes you,ꯐꯤꯜꯂꯤꯡ ꯑꯃꯥ ꯅꯥꯏꯕꯥ ꯄꯦꯟꯇ-ꯑꯞ ꯇꯦꯟꯁꯟ ꯔꯤꯂꯤꯖ ꯇꯧꯏ ꯑꯃꯁꯨꯡ ꯅꯍꯥꯀꯄꯨ .
feel bener rather than worse,ꯍꯦꯟꯅꯥ ꯐꯠꯇꯕꯥ ꯑꯣꯏꯗꯕꯒꯤ ꯃꯍꯨꯠꯇꯥ ꯕꯦꯅꯔ ꯑꯃꯥ ꯐꯤꯜ ꯇꯧꯕꯥ
"You might also fear that you won't be able to say,","ꯅꯍꯥꯛꯅꯥ ꯍꯥꯌꯕꯥ ꯉꯃꯂꯣꯏ ꯍꯥꯌꯕꯁꯤꯁꯨ ꯅꯍꯥꯛꯅꯥ ꯀꯤꯕꯥ ꯌꯥꯏ,"
"""I feel bad"" without blaming someone. Then you'll have","ꯀꯅꯥꯒꯨꯝꯕꯥ ꯑꯃꯕꯨ ꯗꯣꯁ ꯇꯧꯗꯅꯥ ""ꯑꯩ ꯐꯠꯇꯕꯥ ꯐꯥꯑꯣꯏ""꯫"
"to either retaliate or, if you blame yourself, feel ashamed","ꯅꯠꯔꯒꯥ ꯃꯗꯨꯒꯤ ꯃꯍꯨꯠ ꯁꯤꯟꯅꯕꯥ ꯅꯠꯔꯒꯥ ꯀꯔꯤꯒꯨꯝꯕꯥ ꯅꯍꯥꯛꯅꯥ ꯅꯁꯥꯕꯨ ꯗꯣꯁ ꯇꯧꯔꯕꯗꯤ, ꯂꯖ꯭ꯖꯥ ꯂꯩꯕꯥ ꯐꯥꯑꯣꯕꯤꯌꯨ"
"You might even be forced to take action, and that pros-","ꯅꯍꯥꯛꯅꯥ ꯑꯦꯛꯁꯟ ꯂꯧꯈꯠꯅꯕꯥ ꯐꯥꯑꯣꯕꯥ ꯋꯥꯁꯀꯈꯤꯕꯥ ꯌꯥꯏ, ꯑꯃꯁꯨꯡ ꯑꯗꯨꯒꯨꯝꯕꯥ ꯄ꯭ꯔꯣꯁ-"
"pect can be frightening: ""\U7hat if I don't have the skill or","ꯄꯦꯛꯇ ꯑꯁꯤ ꯀꯤꯕꯥ ꯌꯥꯏ: ""\u7hat ꯀꯔꯤꯒꯨꯝꯕꯥ ꯑꯩꯒꯤ ꯁ꯭ꯀꯤꯜ ꯂꯩꯠꯔꯕꯗꯤ ꯅꯠꯔꯒꯥ ꯂꯩꯠꯔꯕꯗꯤ ."
"wisdom to make things better?"" you wonder. ""rVhat if I","ꯋꯥꯐꯃꯁꯤꯡ ꯍꯦꯟꯅꯥ ꯐꯒꯠꯍꯟꯅꯕꯥ ꯂꯧꯁꯤꯡ?""ꯑꯗꯣꯝꯅꯥ ꯋꯥꯍꯪ ꯍꯪꯂꯤ꯫ ""Rvhat if i"
"have to do something risky?"" It's a lot easier to exempt","ꯔꯤꯁ꯭ꯛ ꯂꯩꯕꯥ ꯊꯕꯛ ꯑꯃꯥ ꯇꯧꯕꯥ ꯇꯥꯕꯔꯥ?"""
yourself by not admitting you feel bad in the first place,ꯑꯍꯥꯅꯕꯥ ꯃꯐꯃꯗꯥ ꯅꯍꯥꯛꯅꯥ ꯐꯠꯇꯕꯥ ꯋꯥꯈꯜ ꯐꯥꯑꯣꯗꯕꯅꯥ ꯅꯍꯥꯛꯀꯤ ꯏꯁꯥꯕꯨ .
"As I told John, it's important to realize that being","ꯑꯩꯅꯥ ꯖꯣꯟꯗꯥ ꯍꯥꯌꯈꯤꯕꯒꯨꯝꯅꯥ, ꯃꯁꯤ ꯈꯉꯕꯥ ꯑꯁꯤ ꯌꯥꯝꯅꯥ ꯃꯔꯨꯑꯣꯏ ꯃꯗꯨꯗꯤ ."
"okay doesn't mean feeling okay all the time. Rather, it",ꯑꯣꯀꯦ ꯍꯥꯌꯕꯁꯤ ꯃꯇꯝ ꯄꯨꯝꯅꯃꯛꯇꯥ ꯑꯣꯀꯦ ꯐꯤꯜ ꯇꯧꯕꯥ ꯍꯥꯌꯕꯗꯨ ꯅꯠꯇꯦ꯫
means being able to experience appropriate feelings with-,ꯍꯥꯌꯕꯁꯤꯒꯥ ꯃꯇꯤꯛ ꯆꯥꯕꯥ ꯐꯤꯚꯃꯁꯤꯡ ꯊꯦꯡꯅꯕꯥ ꯉꯝꯕꯥ ꯍꯥꯌꯕꯁꯤꯅꯤ-
"out denial, self-deception or repression. Mentally healthy","ꯑꯥꯎꯠ ꯗꯤꯅꯤꯑꯦꯜ, ꯁꯦꯜꯐ-ꯗꯤꯁꯦꯄꯁꯟ ꯅꯠꯠꯔꯒꯥ ꯔꯤꯞꯔꯦꯁꯟ꯫"
people feel what they are supposed to feel: when they are,ꯃꯤꯌꯥꯝꯅꯥ ꯃꯈꯣꯌꯅꯥ ꯐꯥꯑꯣꯒꯗꯕꯥ ꯑꯗꯨ ꯐꯥꯑꯣꯔꯤ: ꯃꯇꯝ ꯑꯗꯨꯗꯥ ꯃꯈꯣꯌꯅꯥ .
"angry, they feel anger; when they are sad, they feel sad-","ꯑꯁꯥꯑꯣꯕꯥ, ꯃꯈꯣꯌꯅꯥ ꯑꯁꯥꯑꯣꯕꯥ ꯐꯥꯑꯣꯏ;"
ness. Owning up to the feeling is the first necessary step,ꯅꯦꯁ꯫
toward feeling better,ꯍꯦꯟꯅꯥ ꯐꯕꯥ ꯐꯤꯚꯝ ꯑꯃꯥ ꯂꯥꯀꯄꯥ ꯃꯇꯃꯗꯥ .
It is also important to realize that acknowledging bad,ꯃꯁꯤꯁꯨ ꯈꯉꯖꯤꯅꯕꯥ ꯑꯁꯤ ꯃꯔꯨ ꯑꯣꯏ ꯃꯗꯨꯗꯤ ꯐꯠꯇꯕꯥ ꯍꯥꯌꯕꯁꯤ .
feelings doesn't mean you have to do anything about,ꯐꯤꯜꯂꯤꯡꯁꯤꯡ ꯑꯁꯤꯅꯥ ꯑꯗꯣꯝꯅꯥ ꯀꯔꯤꯒꯨꯝꯕꯥ ꯈꯔꯥ ꯇꯧꯕꯥ ꯇꯥꯕꯅꯤ ꯍꯥꯌꯕꯗꯤ .
"them. In faa, telling yourself you feel bad actually dimin-",ꯃꯈꯣꯏ.
"ishes the need to act. It stifles the impulse to take sudden,",ꯊꯕꯛ ꯇꯧꯕꯒꯤ ꯃꯊꯧ ꯇꯥꯕꯥ ꯑꯗꯨ ꯑꯥꯏ.ꯑꯦꯁ.ꯏ.ꯑꯦꯁ.
"precipitous action, which could make things worse","ꯄ꯭ꯔꯤꯁꯤꯄꯤꯇꯦꯁ ꯑꯦꯛꯁꯟ, ꯃꯗꯨꯅꯥ ꯋꯥꯐꯃꯁꯤꯡ ꯑꯁꯤ ꯍꯦꯟꯅꯥ ꯐꯠꯆꯤꯜꯂꯀꯄꯥ ꯌꯥꯏ꯫"
I suggested to John that when his parents started to,ꯑꯩꯍꯥꯛꯅꯥ ꯖꯣꯟꯗꯥ ꯁꯖꯦꯁꯟ ꯄꯤꯈꯤ ꯃꯗꯨꯗꯤ ꯃꯍꯥꯛꯀꯤ ꯃꯃꯥ-ꯃꯄꯥꯅꯥ ꯍꯧꯔꯀꯄꯥ ꯃꯇꯃꯗꯥ .
"get to him, he should say to himself, ""I hate the way I","ꯃꯍꯥꯛꯀꯤ ꯃꯅꯥꯛꯇꯥ ꯌꯧꯔꯀꯎ, ꯃꯍꯥꯛꯅꯥ ꯃꯁꯥꯃꯀꯄꯨ ꯍꯥꯌꯒꯗꯕꯅꯤ, ""ꯑꯩꯅꯥ ꯑꯩꯒꯤ ꯂꯝꯕꯤ ꯑꯁꯤ ꯌꯥꯝꯅꯥ ꯅꯨꯡꯁꯤꯖꯩ꯫"
"feel."" He seemed puzzled but agreed to try it. The next","ꯐꯤꯜ꯫"" ꯃꯍꯥꯛ ꯋꯥꯈꯜ ꯋꯥꯕꯥ ꯃꯤꯁꯛ ꯑꯃꯥ ꯑꯣꯏꯅꯥ ꯎꯈꯤ ꯑꯗꯨꯕꯨ ꯃꯁꯤ ꯍꯣꯠꯅꯕꯗꯥ ꯌꯥꯅꯈꯤ꯫ ꯃꯊꯪꯒꯤ"
"time I saw him he said, ""As soon as I told myself 'I hate","ꯑꯩꯅꯥ ꯃꯍꯥꯀꯄꯨ ꯎꯈꯤꯕꯥ ꯃꯇꯝ ꯑꯗꯨꯗꯥ ꯃꯍꯥꯛꯅꯥ ꯍꯥꯌꯈꯤ, ""ꯑꯩꯅꯥ ꯏꯁꯥꯃꯀꯄꯨ ꯍꯥꯌꯔꯀꯄꯥ ꯃꯇꯃꯗꯥ 'ꯑꯥꯏ ꯍꯦꯠ ."
t80 l,ꯇꯤ꯸꯰ ꯑꯦꯜ.
"the way I feelr' I felt relieved."" He was able to tolerate his","ꯑꯩꯅꯥ ꯐꯤꯜ ꯇꯧꯕꯥ ꯃꯑꯣꯡ ꯑꯗꯨ ꯑꯩꯅꯥ ꯔꯤꯂꯤꯐ ꯑꯣꯏꯅꯥ ꯐꯥꯑꯣꯈꯤ꯫"""
parents without pouting or withdrawing-and without,ꯃꯃꯥ-ꯃꯄꯥꯁꯤꯡꯅꯥ ꯄꯥꯎ ꯄꯤꯕꯥ ꯅꯠꯠꯔꯒꯥ ꯂꯧꯊꯣꯀꯄꯥ-ꯑꯃꯁꯨꯡ ꯌꯥꯑꯣꯗꯕꯥ
blowing up when they continued to annoy him,ꯃꯈꯣꯌꯅꯥ ꯃꯈꯥ ꯇꯥꯅꯥ ꯃꯍꯥꯀꯄꯨ ꯅꯨꯡꯉꯥꯏꯇꯕꯥ ꯐꯥꯑꯣꯍꯅꯕꯥ ꯃꯇꯃꯗꯥ ꯐꯨꯕꯥ
"Admining to yourself that you feel bad is, of course,","ꯅꯍꯥꯛꯅꯥ ꯐꯠꯇꯕꯥ ꯐꯥꯑꯣꯔꯤ ꯍꯥꯌꯅꯥ ꯅꯍꯥꯛꯀꯤ ꯅꯁꯥꯗꯥ ꯑꯦꯗꯃꯤꯅꯤꯁ꯭ꯠ ꯇꯧꯕꯥ ꯍꯥꯌꯕꯁꯤ, ꯇꯁꯦꯡꯅꯥ,"
a prerequisite to admitting it to others. fn an effort to,ꯃꯁꯤ ꯑꯇꯣꯞꯄꯁꯤꯡꯗꯥ ꯑꯦꯗꯃꯤꯠ ꯇꯧꯕꯒꯤ ꯃꯊꯧ ꯇꯥꯕꯥ ꯑꯃꯥ꯫
"conceal your troubles, you might avoid, or lie to, the very","ꯅꯍꯥꯛꯀꯤ ꯑꯋꯥꯕꯁꯤꯡ ꯑꯗꯨ ꯂꯣꯠꯁꯤꯜꯂꯨ, ꯅꯍꯥꯛꯅꯥ ꯌꯥꯝꯅꯥ ꯋꯥꯅꯥ, ꯅꯠꯠꯔꯒꯥ ꯂꯥꯟꯅꯥ ꯂꯃꯖꯤꯡꯕꯤꯕꯥ ꯌꯥꯏ,"
people who can help you. Covering up not only keeps,ꯑꯗꯣꯃꯒꯤ ꯃꯇꯦꯡ ꯄꯥꯡꯕꯥ ꯉꯝꯕꯥ ꯃꯤꯑꯣꯏꯁꯤꯡ꯫
"you from getting help, it creates a vicious cycle: it makes","ꯅꯍꯥꯛꯅꯥ ꯃꯇꯦꯡ ꯐꯪꯕꯗꯒꯤ, ꯃꯁꯤꯅꯥ ꯚꯤꯁꯤꯌꯁ ꯁꯥꯏꯀꯜ ꯑꯃꯥ ꯁꯦꯝꯃꯤ: ꯃꯁꯤꯅꯥ ꯁꯦꯝꯃꯤ꯫"
you become agitated and defensive; the people around,ꯅꯍꯥꯛꯅꯥ ꯑꯦꯖꯤꯇꯦꯗ ꯑꯃꯁꯨꯡ ꯗꯤꯐꯦꯟꯁꯤꯚ ꯑꯣꯏꯔꯀꯏ;
you get irritated; then you feel worse because you can't,ꯅꯍꯥꯛꯅꯥ ꯏꯔꯤꯇꯦꯗ ꯑꯣꯏꯔꯀꯏ;
understand how anyone could be upset with you when,ꯀꯅꯥꯒꯨꯝꯕꯥ ꯑꯃꯅꯥ ꯑꯗꯣꯃꯒꯥ ꯀꯔꯝꯅꯥ ꯋꯥꯔꯤ ꯁꯥꯅꯒꯅꯤ ꯍꯥꯌꯕꯗꯨ ꯈꯉꯕꯤꯌꯨ
you feel so bad,ꯑꯗꯣꯝꯅꯥ ꯑꯁꯨꯛ ꯐꯠꯇꯕꯥ ꯐꯥꯑꯣꯔꯤ .
Admining that you're not okay requires a leap of,ꯑꯗꯣꯝꯅꯥ ꯑꯣꯀꯦ ꯅꯠꯇꯦ ꯍꯥꯌꯕꯥ ꯑꯦꯗꯃꯥꯏꯅꯤꯡ ꯇꯧꯕꯥ
faith. You have to believe that ttre temporary discomfort,ꯊꯥꯖꯕ ꯊꯝꯕ.
