en,mni-Mtei
"cognition; but that these angles are together equal to two right angles, is an",ꯀꯣꯒꯅꯤꯁꯟ;
"inference or conclusion. Now, as we are constantly employing this mode of",ꯏꯅꯐꯦꯟꯁ ꯅꯠꯠꯔꯒꯥ ꯀꯟꯁꯜꯌꯨꯁꯟ꯫
"thought and have thus become quite accustomed to it, we no longer remark","ꯋꯥꯈꯜ ꯑꯃꯁꯨꯡ ꯃꯔꯝ ꯑꯁꯤꯅꯥ ꯃꯁꯤꯗꯥ ꯌꯥꯝꯅꯥ ꯆꯠꯅꯔꯛꯂꯦ, ꯑꯩꯈꯣꯌꯅꯥ ꯍꯧꯖꯤꯛ ꯔꯤꯃꯥꯔꯛ ꯇꯧꯗ꯭ꯔꯦ"
"the above distinction, and, as in the case of the so-called deceptions of","ꯃꯊꯛꯇꯥ ꯄꯅꯈ꯭ꯔꯤꯕꯥ ꯈꯦꯠꯅꯕꯥ ꯑꯁꯤ, ꯑꯃꯁꯨꯡ, ꯍꯥꯌꯔꯤꯕꯥ ꯑꯁꯤꯒꯨꯝꯅꯥ, ."
"sense, consider as immediately perceived, what has really been inferred. In","ꯁꯦꯟꯁ, ꯈꯨꯗꯛꯇꯥ ꯈꯉꯂꯕꯥ, ꯇꯁꯦꯡꯅꯥ ꯀꯔꯤꯕꯨ ꯂꯧꯁꯤꯅꯈ꯭ꯔꯕꯅꯣ ꯍꯥꯌꯅꯥ ꯂꯧꯕꯤꯌꯨ꯫"
"every reasoning or syllogism, there is a fundamental proposition, afterwards","ꯔꯤꯖꯅꯦꯜ ꯅꯠꯔꯒꯥ ꯁꯤꯂꯣꯖꯤꯖꯝ ꯈꯨꯗꯤꯡꯃꯛ, ꯐꯟꯗꯥꯃꯦꯟꯇꯦꯜ ꯄ꯭ꯔꯣꯄꯣꯖꯦꯜ ꯑꯃꯥ ꯂꯩ, ꯃꯗꯨꯒꯤ ꯃꯇꯨꯡꯗꯥ ."
"a second drawn from it, and finally the conclusion, which connects the truth","ꯃꯁꯤꯗꯒꯤ ꯂꯧꯈꯤꯕꯥ ꯑꯅꯤꯁꯨꯕꯥ, ꯑꯃꯁꯨꯡ ꯑꯔꯣꯏꯕꯗꯥ ꯋꯥꯔꯦꯞ ꯑꯗꯨ, ꯃꯁꯤꯅꯥ ꯑꯆꯨꯝꯕꯥ ꯑꯗꯨꯒꯥ ꯁꯝꯅꯍꯜꯂꯤ ."
in the first with the truth in the second—and that infallibly. If the judgement,ꯑꯍꯥꯅꯕꯗꯨꯗꯥ ꯑꯅꯤꯁꯨꯕꯥ ꯑꯗꯨꯗꯥ ꯑꯆꯨꯝꯕꯥ ꯑꯗꯨꯒꯥ ꯂꯣꯌꯅꯅꯥ—ꯑꯗꯨꯒꯥ ꯃꯗꯨ ꯑꯔꯥꯅꯕꯥ ꯃꯑꯣꯡꯗꯥ꯫
concluded is so contained in the first proposition that it can be deduced,ꯂꯣꯏꯁꯤꯜꯂꯀꯄꯥ ꯑꯁꯤ ꯑꯍꯥꯅꯕꯥ ꯄ꯭ꯔꯣꯄꯣꯖꯦꯜ ꯑꯁꯤꯗꯥ ꯑꯁꯨꯝꯅꯥ ꯌꯥꯑꯣꯔꯤ ꯃꯗꯨꯗꯤ ꯃꯁꯤ ꯂꯧꯊꯣꯀꯄꯥ ꯌꯥꯏ .
"from it without the meditation of a third notion, the conclusion is called","ꯑꯍꯨꯃꯁꯨꯕꯥ ꯅꯣꯇꯤꯁ ꯑꯃꯒꯤ ꯃꯦꯗꯤꯇꯦꯁꯟ ꯌꯥꯑꯣꯗꯅꯥ, ꯋꯥꯔꯣꯏꯁꯤꯟ ꯑꯗꯨꯕꯨ ."
immediate (consequentia immediata); I prefer the term conclusion of the,ꯈꯨꯗꯛꯀꯤ ꯑꯣꯏꯕꯥ (ꯀꯟꯁꯦꯛꯌꯨꯑꯦꯟꯁꯤꯌꯥ ꯈꯨꯗꯛꯇꯥ);
"understanding. But if, in addition to the fundamental cognition, a second",ꯂꯧꯁꯤꯅꯕꯥ ꯉꯝꯕꯥ꯫
"judgement is necessary for the production of the conclusion, it is called a","ꯋꯥꯔꯣꯏꯁꯤꯟ ꯄꯨꯊꯣꯀꯄꯗꯥ ꯋꯥꯌꯦꯜ ꯄꯤꯕꯥ ꯑꯁꯤ ꯃꯊꯧ ꯇꯥꯏ, ꯃꯁꯤꯕꯨ ꯑꯦꯟ ."
"conclusion of the reason. In the proposition: All men are mortal, are",ꯃꯔꯝ ꯑꯗꯨꯅꯥ ꯂꯣꯏꯁꯤꯅꯕꯥ꯫
"contained the propositions: Some men are mortal, Nothing that is not mortal","ꯄ꯭ꯔꯣꯄꯣꯖꯦꯂꯁꯤꯡ ꯑꯗꯨ ꯌꯥꯑꯣꯈꯤ: ꯅꯨꯄꯥ ꯈꯔꯗꯤ ꯁꯤꯕꯥ ꯌꯥꯏ, ꯁꯤꯕꯥ ꯌꯥꯗꯕꯥ ꯑꯃꯠꯇꯥ ꯂꯩꯇꯦ"
"is a man, and these are therefore immediate conclusions from the first. On","ꯑꯁꯤ ꯃꯤꯑꯣꯏ ꯑꯃꯅꯤ, ꯑꯃꯁꯨꯡ ꯃꯔꯝ ꯑꯁꯤꯅꯥ ꯍꯥꯌꯔꯤꯕꯁꯤꯡ ꯑꯁꯤ ꯑꯍꯥꯅꯕꯗꯒꯤ ꯈꯨꯗꯛꯇꯥ ꯋꯥꯔꯣꯏꯁꯤꯟ ꯄꯨꯔꯛꯂꯤ꯫"
"the other hand, the proposition: all the learned are mortal, is not contained","ꯑꯃꯔꯣꯃꯗꯥ, ꯄ꯭ꯔꯣꯄꯣꯖꯦꯜ ꯑꯁꯤ: ꯇꯃꯈꯤꯕꯥ ꯄꯨꯝꯅꯃꯛ ꯑꯁꯤ ꯁꯤꯕꯥ ꯌꯥꯕꯥ, ꯌꯥꯑꯣꯗꯦ"
in the main proposition (for the conception of a learned man does not occur,ꯃꯔꯨꯑꯣꯏꯕꯥ ꯄ꯭ꯔꯣꯄꯣꯖꯦꯜ ꯑꯗꯨꯗꯥ (ꯃꯔꯃꯗꯤ ꯂꯔꯅꯤꯡ ꯃꯤꯑꯣꯏ ꯑꯃꯒꯤ ꯀꯟꯁꯦꯄꯁꯟ ꯑꯁꯤ ꯊꯣꯛꯇꯦ .
"in it), and it can be deduced from the main proposition only by means of a","ꯃꯁꯤꯗꯥ), ꯑꯃꯁꯨꯡ ꯃꯁꯤ ꯃꯔꯨꯑꯣꯏꯕꯥ ꯄ꯭ꯔꯣꯄꯣꯖꯦꯜ ꯑꯗꯨꯗꯒꯤ ꯈꯛꯇꯃꯛ ꯂꯧꯕꯥ ꯌꯥꯏ"
mediating judgement,ꯃꯦꯗꯤꯌꯤꯡ ꯖꯖꯃꯦꯟꯇ
In every syllogism I first cogitate a rule (the major) by means of the,ꯁꯤꯂꯣꯖꯤꯖꯝ ꯈꯨꯗꯤꯡꯃꯛꯇꯥ ꯑꯩꯅꯥ ꯑꯍꯥꯅꯕꯗꯥ ꯔꯨꯜ ꯑꯃꯥ (ꯃꯦꯖꯔ) ꯀꯣꯖꯤꯇꯦꯠ ꯇꯧꯗꯨꯅꯥ .
understanding. In the next place I subsume a cognition under the condition,ꯂꯧꯁꯤꯅꯕꯥ ꯉꯝꯕꯥ꯫
of the rule (and this is the minor) by means of the judgement. And finally I,ꯔꯨꯂꯒꯤ (ꯑꯗꯨꯒꯥ ꯃꯁꯤ ꯃꯥꯏꯅꯣꯔꯅꯤ) ꯋꯥꯌꯦꯜ ꯄꯤꯕꯒꯤ ꯈꯨꯠꯊꯥꯡꯗꯥ꯫
determine my cognition by means of the predicate of the rule (this is the,ꯑꯩꯒꯤ ꯀꯣꯒꯅꯤꯁꯟ ꯑꯗꯨ ꯔꯨꯜ ꯑꯗꯨꯒꯤ ꯄ꯭ꯔꯦꯗꯤꯀꯦꯠꯀꯤ ꯈꯨꯠꯊꯥꯡꯗꯥ ꯂꯦꯄꯊꯣꯀꯎ (ꯃꯁꯤꯅꯥ .
"conclusio), consequently, I determine it à priori by means of the reason. The","CONCLUSIO), ꯃꯔꯝ ꯑꯁꯤꯅꯥ, ꯑꯩꯅꯥ ꯃꯁꯤ à priori ꯑꯁꯤ ꯃꯔꯝ ꯑꯗꯨꯒꯤ ꯈꯨꯠꯊꯥꯡꯗꯥ ꯂꯦꯄꯊꯣꯀꯏ꯫"
"relations, therefore, which the major proposition, as the rule, represents","ꯃꯔꯝ ꯑꯗꯨꯅꯥ ꯃꯔꯤꯁꯤꯡ, ꯃꯗꯨ ꯑꯆꯧꯕꯥ ꯄ꯭ꯔꯣꯄꯣꯖꯦꯜ ꯑꯗꯨꯅꯥ ꯔꯨꯜ ꯑꯣꯏꯅꯥ ꯔꯤꯞꯔꯖꯦꯟꯇ ꯇꯧꯔꯤ"
"between a cognition and its condition, constitute the different kinds of","ꯀꯣꯒꯅꯤꯁꯟ ꯑꯃꯒꯥ ꯃꯁꯤꯒꯤ ꯀꯟꯗꯤꯁꯅꯒꯤ ꯃꯔꯛꯇꯥ, ꯇꯣꯉꯥꯟ-ꯇꯣꯉꯥꯅꯕꯥ ꯃꯈꯂꯒꯤ ."
"syllogisms. These are just threefold—analogously with all judgements, in",ꯁꯤꯂꯣꯖꯤꯖꯃꯁꯤꯡ꯫
so far as they differ in the mode of expressing the relation of a cognition in,ꯃꯈꯣꯌꯅꯥ ꯀꯣꯒꯅꯤꯁꯟ ꯑꯃꯒꯤ ꯃꯔꯤ ꯑꯗꯨ ꯐꯣꯡꯗꯣꯀꯄꯒꯤ ꯃꯑꯣꯡꯗꯥ ꯃꯈꯣꯌꯅꯥ ꯈꯦꯠꯅꯕꯥ ꯊꯃꯗꯅꯥ
"the understanding—namely, categorical, hypothetical, and disjunctive","ꯂꯧꯁꯤꯡ ꯑꯁꯤ—ꯃꯗꯨꯗꯤ, ꯀꯦꯇꯦꯒꯣꯔꯤꯒꯤ ꯑꯣꯏꯕꯥ, ꯍꯥꯏꯄꯣꯇꯦꯇꯤꯀꯜ ꯑꯃꯁꯨꯡ ꯗꯤꯁꯖꯟꯛꯇꯤꯚ ꯑꯣꯏꯕꯥ ."
"When as often happens, the conclusion is a judgement which may follow","ꯑꯌꯥꯝꯕꯥ ꯃꯇꯃꯗꯥ ꯊꯣꯀꯄꯥ ꯃꯇꯃꯗꯥ, ꯋꯥꯔꯣꯏꯁꯤꯟ ꯑꯁꯤ ꯆꯠꯅꯍꯅꯕꯥ ꯌꯥꯕꯥ ꯋꯥꯌꯦꯜ ꯑꯃꯅꯤ ."
"from other given judgements, through which a perfectly different object is","ꯑꯇꯣꯞꯄꯥ ꯑꯄꯤꯕꯥ ꯖꯖꯃꯦꯟꯇꯁꯤꯡꯗꯒꯤ, ꯃꯗꯨꯒꯤ ꯈꯨꯠꯊꯥꯡꯗꯥ ꯃꯄꯨꯡ ꯐꯥꯅꯥ ꯇꯣꯉꯥꯅꯕꯥ ꯄꯣꯠꯁꯛ ꯑꯃꯥ ꯑꯣꯏꯔꯤꯕꯥ ꯑꯁꯤ ."
"cogitated, I endeavour to discover in the understanding whether the","ꯀꯣꯖꯤꯇꯦꯠ ꯇꯧꯔꯕꯥ, ꯑꯩꯅꯥ ꯂꯧꯁꯤꯟꯅꯕꯥ ꯍꯣꯠꯅꯔꯤ ꯃꯗꯨꯗꯤ ."
assertion in this conclusion does not stand under certain conditions,ꯋꯥꯔꯣꯏꯁꯤꯟ ꯑꯁꯤꯒꯤ ꯃꯇꯥꯡꯗꯥ ꯋꯥꯐꯝ ꯈꯔꯥ ꯐꯣꯡꯗꯣꯀꯄꯥ ꯑꯁꯤ ꯑꯀꯛꯅꯕꯥ ꯀꯟꯗꯤꯁꯟ ꯈꯔꯒꯤ ꯃꯈꯥꯗꯥ ꯂꯩꯇꯦ .
"according to a general rule. If I find such a condition, and if the object",ꯖꯦꯅꯦꯔꯦꯜ ꯔꯨꯜ ꯑꯃꯒꯤ ꯃꯇꯨꯡ ꯏꯟꯅꯥ꯫
"mentioned in the conclusion can be subsumed under the given condition,","ꯋꯥꯔꯣꯏꯁꯤꯟ ꯑꯗꯨꯗꯥ ꯄꯅꯈ꯭ꯔꯤꯕꯥ ꯑꯁꯤ ꯄꯤꯔꯤꯕꯥ ꯀꯟꯗꯤꯁꯟ ꯑꯁꯤꯒꯤ ꯃꯈꯥꯗꯥ ꯁꯕꯁꯝꯌꯨꯠ ꯇꯧꯕꯥ ꯌꯥꯏ,"
then this conclusion follows from a rule which is also valid for other objects,ꯑꯗꯨꯗꯒꯤ ꯃꯁꯤꯒꯤ ꯋꯥꯔꯣꯏꯁꯤꯟ ꯑꯁꯤ ꯑꯇꯣꯞꯄꯥ ꯄꯣꯠꯁꯀꯁꯤꯡꯒꯤꯗꯃꯛꯇꯁꯨ ꯆꯠꯅꯕꯥ ꯌꯥꯕꯥ ꯅꯤꯌꯝ ꯑꯃꯗꯒꯤ ꯂꯥꯀꯏ .
of cognition. From this we see that reason endeavours to subject the great,ꯀꯣꯒꯅꯤꯁꯅꯒꯤ ꯃꯇꯥꯡꯗꯥ ꯋꯥꯐꯝ ꯀꯌꯥ ꯊꯃꯈꯤ꯫
variety of the cognitions of the understanding to the smallest possible,ꯂꯧꯁꯤꯡꯒꯤ ꯃꯈꯜ ꯀꯌꯥꯒꯤ ꯀꯣꯒꯅꯤꯁꯅꯁꯤꯡ ꯑꯁꯤ ꯈ꯭ꯕꯥꯏꯗꯒꯤ ꯅꯦꯝꯕꯥ ꯐꯥꯑꯣꯕꯥ .
"number of principles (general conditions), and thus to produce in it the","ꯄ꯭ꯔꯤꯟꯁꯤꯄꯂꯁꯤꯡꯒꯤ ꯃꯁꯤꯡ (ꯖꯦꯅꯦꯔꯦꯜ ꯀꯟꯗꯤꯁꯅꯁꯤꯡ), ꯑꯃꯁꯨꯡ ꯃꯔꯝ ꯑꯁꯤꯅꯥ ꯃꯁꯤꯗꯥ ꯄꯨꯊꯣꯛꯅꯕꯥ ."
highest unity,ꯈ꯭ꯕꯥꯏꯗꯒꯤ ꯋꯥꯡꯕꯥ ꯌꯨꯅꯤꯇꯤ
C. OF THE PURE USE OF REASON,ꯁꯤ.ꯒꯤ ꯃꯔꯃꯒꯤ ꯑꯁꯦꯡꯕꯥ ꯁꯤꯖꯤꯟꯅꯕꯒꯤ ꯃꯇꯥꯡꯗꯥ .
"Can we isolate reason, and, if so, is it in this case a peculiar source of","ꯑꯩꯈꯣꯌꯅꯥ ꯃꯔꯝ ꯑꯁꯤ ꯑꯥꯏꯁꯣꯂꯦꯠ ꯇꯧꯕꯥ ꯉꯃꯒꯗ꯭ꯔꯥ, ꯑꯃꯁꯨꯡ, ꯀꯔꯤꯒꯨꯝꯕꯥ ꯑꯣꯏꯔꯒꯗꯤ, ꯃꯁꯤꯒꯤ ꯀꯦꯁ ꯑꯁꯤꯗꯥ ꯃꯁꯤꯒꯤ ꯑꯈꯟꯅꯕꯥ ꯁꯣꯔꯁ ꯑꯃꯅꯤ ."
"conceptions and judgements which spring from it alone, and through which","ꯃꯁꯤꯗꯒꯤ ꯊꯣꯔꯀꯄꯥ ꯋꯥꯈꯜꯂꯣꯅꯁꯤꯡ ꯑꯃꯁꯨꯡ ꯋꯥꯌꯦꯜ ꯌꯥꯊꯪꯁꯤꯡ, ꯑꯃꯁꯨꯡ ꯃꯗꯨꯒꯤ ꯈꯨꯠꯊꯥꯡꯗꯥ ."
"it can be applied to objects; or is it merely a subordinate faculty, whose duty",ꯃꯁꯤ ꯄꯣꯠꯁꯀꯁꯤꯡꯗꯥ ꯁꯤꯖꯤꯟꯅꯕꯥ ꯌꯥꯏ;
it is to give a certain form to given cognitions—a form which is called,ꯃꯁꯤꯅꯥ ꯄꯤꯔꯤꯕꯥ ꯀꯣꯒꯅꯤꯁꯅꯁꯤꯡꯗꯥ ꯑꯀꯛꯅꯕꯥ ꯃꯑꯣꯡ ꯑꯃꯥ ꯄꯤꯕꯅꯤ—ꯃꯁꯤꯕꯨ ꯀꯧꯏ꯫
"logical, and through which the cognitions of the understanding are","ꯂꯣꯖꯤꯀꯦꯜ, ꯑꯃꯁꯨꯡ ꯃꯁꯤꯒꯤ ꯈꯨꯠꯊꯥꯡꯗꯥ ꯂꯧꯁꯤꯡꯒꯤ ꯀꯣꯒꯅꯤꯁꯅꯁꯤꯡ ꯑꯁꯤ ."
"subordinated to each other, and lower rules to higher (those, to wit, whose","ꯑꯃꯒꯥ ꯑꯃꯒꯥ ꯁꯕꯑꯣꯔꯗꯤꯅꯦꯠ ꯇꯧꯕꯥ, ꯑꯃꯁꯨꯡ ꯂꯣꯌꯔꯕꯥ ꯔꯨꯂꯁꯤꯡ ꯑꯁꯤ ꯍꯦꯟꯅꯥ ꯋꯥꯡꯕꯥ (ꯃꯈꯣꯌꯁꯤꯡ, ꯋꯥꯈꯜ ꯂꯧꯁꯤꯡ ꯂꯩꯕꯥ, ꯃꯈꯣꯌꯒꯤ ."
"condition comprises in its sphere the condition of the others), in so far as","ꯀꯟꯗꯤꯁꯟ ꯑꯁꯤꯅꯥ ꯃꯁꯤꯒꯤ ꯁ꯭ꯐꯤꯔꯗꯥ ꯑꯇꯣꯞꯄꯁꯤꯡꯒꯤ ꯀꯟꯗꯤꯁꯟ ꯑꯁꯤ ꯌꯥꯑꯣꯔꯤ), ꯃꯁꯤꯒꯤ ꯃꯇꯨꯡ ꯏꯟꯅꯥ"
this can be done by comparison? This is the question which we have at,ꯃꯁꯤ ꯆꯥꯡꯗꯝꯅꯕꯗꯥ ꯇꯧꯕꯥ ꯌꯥꯕꯔꯥ?
present to answer. Manifold variety of rules and unity of principles is a,ꯄꯥꯎꯈꯨꯝ ꯄꯤꯅꯕꯥ ꯄ꯭ꯔꯦꯖꯦꯟꯇ ꯇꯧꯕꯥ꯫
"requirement of reason, for the purpose of bringing the understanding into","ꯃꯔꯃꯒꯤ ꯃꯊꯧ ꯇꯥꯕꯥ, ꯂꯧꯁꯤꯡ ꯑꯗꯨ 1000ꯗꯥ ꯄꯨꯔꯛꯅꯕꯒꯤ ꯄꯥꯟꯗꯃꯗꯥ꯫"
"complete accordance with itself, just as understanding subjects the manifold","ꯃꯄꯨꯡ ꯐꯥꯅꯥ ꯃꯁꯥꯒꯤ ꯑꯣꯏꯕꯥ ꯃꯇꯨꯡ ꯏꯟꯅꯥ, ꯃꯇꯧ ꯑꯁꯨꯝꯅꯥ ꯂꯧꯁꯤꯅꯕꯥ ꯑꯁꯤ ꯃꯦꯅꯤꯐꯣꯜꯗꯀꯤ ꯃꯈꯥꯗꯥ ꯂꯩꯕꯒꯨꯝꯅꯥ"
"content of intuition to conceptions, and thereby introduces connection into","ꯏꯟꯠꯌꯨꯏꯇꯤꯖ ꯇꯨ ꯀꯟꯁꯦꯄꯁꯅꯁꯤꯡꯒꯤ ꯀꯟꯇꯦꯟꯇ, ꯑꯃꯁꯨꯡ ꯃꯁꯤꯅꯥ ꯃꯔꯝ ꯑꯣꯏꯗꯨꯅꯥ ꯀꯅꯦꯛꯁꯅꯒꯤ ꯃꯇꯥꯡꯗꯥ ."
"it. But this principle prescribes no law to objects, and does not contain any",ꯃꯁꯤ.
"ground of the possibility of cognizing or of determining them as such, but is","ꯃꯈꯣꯌꯁꯤꯡ ꯑꯁꯤ ꯑꯁꯤꯒꯨꯝꯕꯥ ꯃꯑꯣꯡꯗꯥ ꯂꯦꯄꯊꯣꯀꯄꯒꯤ ꯑꯣꯏꯊꯣꯀꯄꯥ ꯌꯥꯕꯒꯤ ꯃꯔꯝ ꯑꯣꯏꯔꯤꯕꯥ ꯑꯗꯨꯕꯨꯅꯤ, ꯑꯗꯨꯕꯨ ꯃꯁꯤꯅꯤ ."
merely a subjective law for the proper arrangement of the content of the,ꯁꯨꯞꯅꯒꯤ ꯀꯟꯇꯦꯟꯇꯀꯤ ꯃꯇꯥꯡꯗꯥ ꯃꯇꯤꯛ ꯆꯥꯕꯥ ꯊꯧꯔꯥꯡ ꯇꯧꯅꯕꯒꯤꯗꯃꯛ ꯁꯨꯞꯅꯒꯤ ꯁꯕ꯭ꯖꯦꯛꯇꯤꯕ ꯂꯣ ꯑꯃꯥ
"understanding. The purpose of this law is, by a comparison of the",ꯂꯧꯁꯤꯅꯕꯥ ꯉꯝꯕꯥ꯫
"conceptions of the understanding, to reduce them to the smallest possible","ꯂꯧꯁꯤꯡꯒꯤ ꯋꯥꯈꯜꯂꯣꯅꯁꯤꯡ, ꯃꯈꯣꯌꯕꯨ ꯈ꯭ꯕꯥꯏꯗꯒꯤ ꯅꯦꯝꯕꯥ ꯃꯑꯣꯡꯗꯥ ꯍꯟꯊꯍꯟꯅꯕꯥ ."
"number, although, at the same time, it does not justify us in demanding","ꯅꯝꯕꯔ, ꯑꯗꯨꯝ ꯑꯣꯏꯅꯃꯛ, ꯃꯇꯝ ꯑꯗꯨꯃꯛꯇꯗꯥ, ꯃꯁꯤꯅꯥ ꯑꯩꯈꯣꯌꯕꯨ ꯗꯤꯃꯥꯟꯗ ꯇꯧꯕꯗꯥ ꯖꯁ꯭ꯇꯤꯐꯥꯏ ꯇꯧꯗꯦ ."
from objects themselves such a uniformity as might contribute to the,ꯄꯣꯠꯁꯤꯡꯗꯒꯤ ꯃꯈꯣꯌ ꯃꯁꯥꯅꯥ ꯑꯁꯤꯒꯨꯝꯕꯥ ꯌꯨꯅꯤꯐꯣꯔꯃꯤꯇꯤ ꯑꯁꯤ .
"convenience and the enlargement of the sphere of the understanding, or in","ꯈꯨꯗꯣꯡꯆꯥꯕꯥ ꯑꯃꯁꯨꯡ ꯂꯧꯁꯤꯡꯒꯤ ꯁ꯭ꯐꯤꯔ ꯑꯁꯤ ꯍꯦꯟꯅꯥ ꯆꯥꯎꯈꯠꯍꯅꯕꯥ, ꯅꯠꯔꯒꯥ ."
expecting that it will itself thus receive from them objective validity. In one,ꯃꯁꯤꯅꯥ ꯃꯁꯥꯃꯛꯅꯥ ꯃꯈꯣꯌꯗꯒꯤ ꯑꯣꯕꯖꯦꯛꯇꯤꯕ ꯚꯦꯂꯤꯗꯤꯇꯤ ꯐꯪꯒꯅꯤ ꯍꯥꯌꯅꯥ ꯊꯥꯖꯗꯨꯅꯥ꯫
"word, the question is: “does reason in itself, that is, does pure reason","ꯋꯥꯍꯩ, ꯋꯥꯍꯪ ꯑꯁꯤꯅꯥ ꯍꯥꯌꯔꯤꯕꯁꯤꯅꯤ: “ꯃꯁꯥꯅꯥ ꯃꯁꯥꯕꯨ ꯃꯔꯝ ꯆꯥꯅꯥ ꯂꯧꯔꯤ, ꯍꯥꯌꯕꯗꯤ ꯑꯁꯦꯡꯕꯥ ꯃꯔꯝ ꯑꯃꯥ ꯑꯣꯏꯕ꯭ꯔꯥ?"
"contain à priori synthetical principles and rules, and what are those","e priori synthetical ꯄ꯭ꯔꯤꯟꯁꯤꯄꯂꯁꯤꯡ ꯑꯃꯁꯨꯡ ꯔꯨꯂꯁꯤꯡ ꯌꯥꯑꯣꯔꯤ, ꯑꯃꯁꯨꯡ ꯃꯈꯣꯌꯁꯤꯡ ꯑꯗꯨ ꯀꯔꯤꯅꯣ ."
principles?”,ꯄ꯭ꯔꯤꯟꯁꯤꯄꯂꯁꯤꯡ?”
The formal and logical procedure of reason in syllogisms gives us,ꯁꯤꯂꯣꯖꯤꯖꯃꯗꯥ ꯂꯩꯕꯥ ꯃꯔꯃꯒꯤ ꯐꯣꯔꯃꯦꯜ ꯑꯃꯁꯨꯡ ꯂꯣꯖꯤꯀꯦꯜ ꯄ꯭ꯔꯣꯁꯤꯗ꯭ꯌꯨꯔ ꯑꯁꯤꯅꯥ ꯑꯩꯈꯣꯌꯗꯥ ꯄꯤꯔꯤ
sufficient information in regard to the ground on which the transcendental,ꯇ꯭ꯔꯥꯟꯁꯦꯟꯗꯦꯟꯇꯜ ꯑꯣꯏꯅꯥ ꯄꯤꯔꯤꯕꯥ ꯒ꯭ꯔꯥꯎꯟꯗ ꯑꯗꯨꯒꯤ ꯃꯇꯥꯡꯗꯥ ꯃꯇꯤꯛ ꯆꯥꯕꯥ ꯏꯅꯐꯣꯔꯃꯦꯁꯟ
principle of reason in its pure synthetical cognition will rest,ꯃꯁꯤꯒꯤ ꯄ꯭ꯌꯨꯔ ꯁꯤꯟꯊꯦꯇꯤꯀꯜ ꯀꯣꯒꯅꯤꯁꯟꯗꯥ ꯂꯩꯕꯥ ꯃꯔꯃꯒꯤ ꯄ꯭ꯔꯤꯟꯁꯤꯄꯜ ꯑꯁꯤ ꯂꯦꯡꯗꯅꯥ ꯂꯩꯒꯅꯤ
"1. Reason, as observed in the syllogistic process, is not applicable to","1. ꯃꯔꯝ ꯑꯁꯤꯅꯥ ꯁꯤꯂꯣꯖꯤꯁ꯭ꯇꯤꯛ ꯄ꯭ꯔꯣꯁꯦꯁꯇꯥ ꯎꯕꯥ ꯐꯪꯂꯤꯕꯥ ꯃꯇꯨꯡ ꯏꯟꯅꯥ, ."
"intuitions, for the purpose of subjecting them to rules—for this is the","ꯏꯟꯠꯌꯨꯏꯁꯅꯁꯤꯡ, ꯃꯈꯣꯌꯕꯨ ꯅꯤꯌꯃꯁꯤꯡꯒꯤ ꯃꯈꯥꯗꯥ ꯊꯝꯅꯕꯒꯤ ꯄꯥꯟꯗꯃꯗꯥ—ꯃꯔꯃꯗꯤ ꯃꯁꯤꯅꯤ ꯫"
province of the understanding with its categories—but to conceptions and,ꯄ꯭ꯔꯣꯚꯤꯟꯁ ꯑꯣꯐ ꯗꯤ ꯑꯟꯗꯔꯁ꯭ꯇꯦꯟꯗꯤꯡ ꯑꯁꯤꯒꯤ ꯀꯦꯇꯦꯒꯣꯔꯤꯁꯤꯡꯒꯥ ꯂꯣꯌꯅꯅꯥ—ꯑꯗꯨꯕꯨ ꯀꯟꯁꯦꯄꯁꯅꯁꯤꯡ ꯑꯃꯁꯨꯡ
"judgements. If pure reason does apply to objects and the intuition of them, it",ꯖꯖꯃꯦꯟꯇꯁꯤꯡ꯫
"does so not immediately, but mediately—through the understanding and its","ꯃꯁꯤ ꯈꯨꯗꯛꯇꯥ ꯅꯠꯇꯦ, ꯑꯗꯨꯕꯨ ꯃꯦꯗꯤꯌꯝ ꯑꯣꯏꯅꯥ—ꯑꯄꯥꯝꯕꯥ ꯑꯗꯨꯒꯤ ꯈꯨꯠꯊꯥꯡꯗꯥ ꯑꯃꯁꯨꯡ ꯃꯁꯤꯒꯤ ."
"judgements, which have a direct relation to the senses and their intuition,","ꯖꯖꯃꯦꯟꯇꯁꯤꯡ, ꯃꯈꯣꯌꯅꯥ ꯏꯟꯗ꯭ꯔꯤꯁꯤꯡ ꯑꯃꯁꯨꯡ ꯃꯈꯣꯌꯒꯤ ꯏꯟꯠꯌꯨꯏꯇꯤꯖꯃꯒꯥ ꯍꯀꯊꯦꯡꯅꯅꯥ ꯃꯔꯤ ꯂꯩꯅꯩ,"
for the purpose of determining their objects. The unity of reason is therefore,ꯃꯈꯣꯌꯒꯤ ꯄꯣꯠꯁꯀꯁꯤꯡ ꯂꯦꯄꯊꯣꯀꯄꯒꯤ ꯄꯥꯟꯗꯃꯗꯥ꯫
"not the unity of a possible experience, but is essentially different from this","ꯑꯣꯏꯊꯣꯀꯄꯥ ꯌꯥꯕꯥ ꯑꯦꯛꯁꯄꯔꯤꯑꯦꯟꯁ ꯑꯃꯒꯤ ꯑꯄꯨꯅꯕꯥ ꯑꯗꯨ ꯅꯠꯇꯦ, ꯑꯗꯨꯕꯨ ꯃꯁꯤꯗꯒꯤ ꯇꯉꯥꯏꯐꯗꯅꯥ ꯈꯦꯠꯅꯩ ꯫"
"unity, which is that of the understanding. That everything which happens","ꯑꯄꯨꯅꯕꯥ, ꯃꯁꯤ ꯂꯧꯁꯤꯡꯒꯤꯅꯤ꯫"
"has a cause, is not a principle cognized and prescribed by reason. This","ꯃꯔꯃꯗꯤ ꯃꯔꯝ ꯑꯃꯥ ꯂꯩ, ꯃꯁꯤ ꯃꯔꯃꯒꯤ ꯃꯇꯨꯡ ꯏꯟꯅꯥ ꯀꯣꯒꯅꯤꯖ ꯇꯧꯔꯕꯥ ꯑꯃꯁꯨꯡ ꯄ꯭ꯔꯦꯁ꯭ꯛꯔꯥꯏꯕ ꯇꯧꯕꯥ ꯄ꯭ꯔꯤꯟꯁꯤꯄꯜ ꯑꯃꯅꯤ꯫"
principle makes the unity of experience possible and borrows nothing from,ꯄ꯭ꯔꯤꯟꯁꯤꯄꯂꯅꯥ ꯑꯦꯛꯁꯄꯔꯤꯑꯦꯟꯁꯀꯤ ꯑꯄꯨꯅꯕꯥ ꯑꯁꯤ ꯑꯣꯏꯊꯣꯀꯍꯜꯂꯤ ꯑꯃꯁꯨꯡ ꯃꯁꯤꯗꯒꯤ ꯀꯔꯤꯒꯨꯝꯕꯥ ꯑꯃꯠꯇꯥ ꯂꯧꯗꯦ꯫
"reason, which, without a reference to possible experience, could never have","ꯃꯔꯝ, ꯃꯗꯨ ꯑꯣꯏꯊꯣꯀꯄꯥ ꯌꯥꯕꯥ ꯑꯦꯛꯁꯄꯔꯤꯌꯦꯟꯁꯀꯤ ꯃꯇꯥꯡꯗꯥ ꯔꯤꯐꯔꯦꯟꯁ ꯑꯃꯥ ꯌꯥꯑꯣꯗꯅꯥ, ꯀꯩꯗꯧꯅꯨꯡꯗꯥ ."
produced by means of mere conceptions any such synthetical unity,ꯁꯨꯞꯅꯒꯤ ꯀꯟꯁꯦꯄꯁꯅꯒꯤ ꯈꯨꯠꯊꯥꯡꯗꯥ ꯄꯨꯊꯣꯀꯄꯥ ꯑꯁꯤꯒꯨꯝꯕꯥ ꯁꯤꯟꯊꯦꯇꯤꯛ ꯑꯣꯏꯕꯥ ꯑꯄꯨꯅꯕꯥ ꯑꯃꯠꯇꯥ
"2. Reason, in its logical use, endeavours to discover the general condition","2. ꯃꯔꯝ ꯑꯁꯤꯅꯥ, ꯃꯁꯤꯒꯤ ꯂꯣꯖꯤꯀꯦꯜ ꯑꯣꯏꯕꯥ ꯃꯑꯣꯡꯗꯥ, ꯖꯦꯅꯔꯦꯜ ꯀꯟꯗꯤꯁꯟ ꯑꯁꯤ ꯈꯉꯗꯣꯛꯅꯕꯥ ꯍꯣꯠꯅꯔꯤ"
"of its judgement (the conclusion), and a syllogism is itself nothing but a","ꯃꯁꯤꯒꯤ ꯋꯥꯌꯦꯜ (ꯋꯥꯐꯝ ꯑꯁꯤ), ꯑꯃꯁꯨꯡ ꯁꯤꯂꯣꯖꯤꯖꯝ ꯑꯃꯥ ꯃꯁꯥꯃꯛꯅꯥ ꯃꯁꯥꯃꯀꯄꯨ ꯑꯃꯠꯇꯥ ꯑꯣꯏꯅꯥ ."
judgement by means of the subsumption of its condition under a general,ꯖꯦꯅꯦꯔꯦꯜ ꯑꯃꯒꯤ ꯃꯈꯥꯗꯥ ꯃꯁꯤꯒꯤ ꯀꯟꯗꯤꯁꯟ ꯑꯁꯤ ꯁꯕꯁꯝꯄꯤꯡ ꯇꯧꯕꯒꯤ ꯈꯨꯠꯊꯥꯡꯗꯥ ꯖꯖꯃꯦꯟꯇ
rule (the major). Now as this rule may itself be subjected to the same,ꯅꯤꯌꯝ (ꯃꯦꯖꯔ)꯫
"process of reason, and thus the condition of the condition be sought (by","ꯃꯔꯃꯒꯤ ꯊꯧꯑꯣꯡ, ꯑꯃꯁꯨꯡ ꯃꯔꯝ ꯑꯁꯤꯅꯥ ꯀꯟꯗꯤꯁꯟ ꯑꯁꯤꯒꯤ ꯀꯟꯗꯤꯁꯟ ꯑꯁꯤ ꯊꯤꯕꯥ (by"
"means of a prosyllogism) as long as the process can be continued, it is very","ꯄ꯭ꯔꯣꯁꯤꯂꯣꯖꯤꯖꯝ ꯑꯃꯒꯤ ꯄꯥꯝꯕꯩꯁꯤꯡ) ꯊꯧꯑꯣꯡ ꯑꯁꯤ ꯃꯈꯥ ꯆꯠꯊꯕꯥ ꯉꯃꯗ꯭ꯔꯤꯐꯥꯑꯣꯕꯥ, ꯃꯁꯤ ꯌꯥꯝꯅꯥ ꯋꯥꯡꯏ꯫"
manifest that the peculiar principle of reason in its logical use is to find for,ꯃꯁꯤꯒꯤ ꯂꯣꯖꯤꯀꯦꯜ ꯑꯣꯏꯕꯥ ꯁꯤꯖꯤꯟꯅꯕꯗꯥ ꯃꯔꯃꯒꯤ ꯑꯈꯟꯅꯕꯥ ꯄ꯭ꯔꯤꯟꯁꯤꯄꯜ ꯑꯁꯤꯒꯤꯗꯃꯛꯇꯥ ꯊꯤꯖꯤꯟꯅꯕꯥ ꯍꯥꯌꯕꯁꯤ ꯃꯦꯅꯤꯐꯦꯁ꯭ꯠ ꯑꯣꯏ .
the conditioned cognition of the understanding the unconditioned whereby,ꯑꯟꯗꯔꯁ꯭ꯇꯦꯟꯗꯤꯡꯒꯤ ꯀꯟꯗꯤꯁꯟ ꯇꯧꯔꯕꯥ ꯀꯣꯒꯅꯤꯁꯟ ꯑꯗꯨ ꯑꯅꯀꯟꯗꯤꯁꯟ ꯑꯗꯨꯅꯥ ꯃꯔꯝ ꯑꯣꯏꯗꯨꯅꯥ .
the unity of the former is completed,ꯍꯥꯟꯅꯒꯤ ꯑꯄꯨꯅꯕꯥ ꯑꯗꯨ ꯂꯣꯏꯁꯤꯜꯂꯦ .
"But this logical maxim cannot be a principle of pure reason, unless we","ꯑꯗꯨꯕꯨ ꯃꯁꯤꯒꯤ ꯂꯣꯖꯤꯀꯦꯜ ꯃꯦꯛꯁꯤꯃꯝ ꯑꯁꯤ ꯄ꯭ꯌꯨꯔ ꯑꯣꯏꯕꯥ ꯃꯔꯃꯒꯤ ꯄ꯭ꯔꯤꯟꯁꯤꯄꯜ ꯑꯃꯥ ꯑꯣꯏꯕꯥ ꯌꯥꯔꯣꯏ, ꯑꯩꯈꯣꯌꯅꯥ ꯅꯠꯇꯅꯥ ꯑꯩꯈꯣꯌꯅꯥ ."
"admit that, if the conditioned is given, the whole series of conditions","ꯀꯔꯤꯒꯨꯝꯕꯥ ꯀꯟꯗꯤꯁꯟ ꯑꯗꯨ ꯄꯤꯔꯕꯗꯤ, ꯀꯟꯗꯤꯁꯅꯁꯤꯡꯒꯤ ꯁꯔꯨꯛ ꯄꯨꯝꯅꯃꯛ ꯑꯗꯨ ."
subordinated to one another—a series which is consequently itself,ꯑꯃꯅꯥ ꯑꯃꯒꯤ ꯃꯈꯥꯗꯥ ꯂꯩꯕꯥ—ꯃꯁꯤꯒꯤ ꯃꯍꯩ ꯑꯣꯏꯅꯥ ꯃꯁꯥꯅꯥ ꯃꯁꯥꯕꯨ .
"unconditioned—is also given, that is, contained in the object and its","ꯑꯅꯀꯟꯗꯤꯁꯟ—ꯃꯁꯤꯁꯨ ꯄꯤꯔꯤ, ꯍꯥꯌꯕꯗꯤ ꯄꯣꯠꯁꯛ ꯑꯗꯨꯗꯥ ꯌꯥꯑꯣꯔꯤꯕꯥ ꯑꯃꯁꯨꯡ ꯃꯁꯤꯒꯤ ."
connection,ꯀꯅꯦꯛꯁꯟ ꯂꯩꯕꯥ .
"But this principle of pure reason is evidently synthetical; for, analytically,",ꯑꯗꯨꯕꯨ ꯑꯁꯦꯡꯕꯥ ꯃꯔꯃꯒꯤ ꯄ꯭ꯔꯤꯟꯁꯤꯄꯜ ꯑꯁꯤ ꯃꯌꯦꯛ ꯁꯦꯡꯅꯥ ꯁꯤꯟꯊꯦꯇꯤꯀꯜ ꯑꯣꯏ;
"the conditioned certainly relates to some condition, but not to the","ꯀꯟꯗꯤꯁꯟ ꯑꯁꯤ ꯁꯣꯏꯗꯅꯥ ꯀꯟꯗꯤꯁꯟ ꯈꯔꯒꯥ ꯃꯔꯤ ꯂꯩꯅꯩ, ꯑꯗꯨꯕꯨ ."
unconditioned. From this principle also there must originate different,ꯑꯅꯀꯟꯗꯤꯁꯟ ꯂꯩꯕꯥ꯫
"synthetical propositions, of which the pure understanding is perfectly","ꯁꯤꯟꯊꯦꯇꯤꯀꯜ ꯄ꯭ꯔꯣꯄꯣꯖꯦꯂꯁꯤꯡ, ꯃꯗꯨꯒꯤ ꯃꯅꯨꯡꯗꯥ ꯄ꯭ꯌꯨꯔ ꯑꯣꯏꯕꯥ ꯋꯥꯈꯜꯂꯣꯟ ꯑꯁꯤ ꯃꯄꯨꯡ ꯐꯥꯅꯥ ."
"ignorant, for it has to do only with objects of a possible experience, the","ignorant, ꯃꯔꯃꯗꯤ ꯃꯁꯤꯅꯥ ꯑꯣꯏꯊꯣꯀꯄꯥ ꯌꯥꯕꯥ ꯑꯦꯛꯁꯄꯔꯤꯑꯦꯟꯁ ꯑꯃꯒꯤ ꯄꯣꯠꯁꯤꯡꯒꯥ ꯂꯣꯌꯅꯅꯥ ꯈꯛꯇꯃꯛ ꯇꯧꯒꯗꯕꯅꯤ, ."
"cognition and synthesis of which is always conditioned. The unconditioned,",ꯃꯁꯤꯒꯤ ꯀꯣꯒꯅꯤꯁꯟ ꯑꯃꯁꯨꯡ ꯁꯤꯟꯊꯦꯁꯤꯁ ꯑꯁꯤ ꯃꯇꯝ ꯄꯨꯝꯅꯃꯛꯇꯥ ꯀꯟꯗꯤꯁꯟ ꯇꯧꯏ꯫
"if it does really exist, must be especially considered in regard to the","ꯀꯔꯤꯒꯨꯝꯕꯥ ꯃꯁꯤ ꯇꯁꯦꯡꯅꯥ ꯂꯩꯔꯕꯗꯤ, ꯃꯔꯨꯑꯣꯏꯅꯥ ."
"determinations which distinguish it from whatever is conditioned, and will","ꯃꯁꯤꯕꯨ ꯀꯟꯗꯤꯁꯟ ꯇꯧꯔꯕꯥ ꯋꯥꯐꯃꯁꯤꯡꯗꯒꯤ ꯇꯣꯉꯥꯟꯅꯥ ꯇꯥꯍꯜꯂꯤꯕꯥ, ꯑꯃꯁꯨꯡ ꯑꯣꯏꯒꯅꯤ ꯍꯥꯌꯅꯥ ꯂꯧꯕꯥ ꯋꯥꯔꯦꯄꯁꯤꯡ"
thus afford us material for many à priori synthetical propositions,ꯑꯁꯨꯝꯅꯥ ꯑꯩꯈꯣꯌꯗꯥ ꯄ꯭ꯔꯥꯏꯑꯣꯔꯤ ꯁꯤꯟꯊꯦꯇꯤꯀꯜ ꯄ꯭ꯔꯣꯄꯣꯖꯦꯜ ꯀꯌꯥꯒꯤꯗꯃꯛ ꯃꯦꯇꯔꯤꯑꯦꯜ ꯄꯤꯕꯥ
"The principles resulting from this highest principle of pure reason will,","ꯑꯁꯦꯡꯕꯥ ꯃꯔꯝ ꯑꯁꯤꯒꯤ ꯈ꯭ꯕꯥꯏꯗꯒꯤ ꯋꯥꯡꯕꯥ ꯄ꯭ꯔꯤꯟꯁꯤꯄꯜ ꯑꯁꯤꯗꯒꯤ ꯐꯪꯂꯀꯄꯥ ꯄ꯭ꯔꯤꯟꯁꯤꯄꯂꯁꯤꯡ ꯑꯁꯤꯅꯥ,"
"however, be transcendent in relation to phenomena, that is to say, it will be","ꯑꯗꯨꯝ ꯑꯣꯏꯅꯃꯛ, ꯐꯤꯚꯃꯁꯤꯡꯒꯥ ꯃꯔꯤ ꯂꯩꯅꯅꯥ ꯇ꯭ꯔꯥꯟꯁꯦꯟꯗꯦꯟꯇ ꯑꯣꯏꯌꯨ, ꯍꯥꯌꯕꯗꯤ ꯃꯁꯤ ꯑꯣꯏꯒꯅꯤ ꯫"
impossible to make any adequate empirical use of this principle. It is,ꯄ꯭ꯔꯤꯟꯁꯤꯄꯜ ꯑꯁꯤꯒꯤ ꯃꯇꯤꯛ ꯆꯥꯕꯥ ꯑꯦꯝꯄꯤꯔꯤꯑꯦꯜ ꯑꯣꯏꯕꯥ ꯁꯤꯖꯤꯟꯅꯕꯥ ꯑꯃꯠꯇꯥ ꯇꯧꯕꯥ ꯉꯃꯗꯕꯥ꯫
"therefore completely different from all principles of the understanding, the","ꯃꯔꯝ ꯑꯗꯨꯅꯥ ꯂꯧꯁꯤꯅꯕꯒꯤ ꯄ꯭ꯔꯤꯟꯁꯤꯄꯜ ꯄꯨꯝꯅꯃꯛꯇꯒꯤ ꯃꯄꯨꯡ ꯐꯥꯅꯥ ꯈꯦꯠꯅꯕꯥ, ."
"use made of which is entirely immanent, their object and purpose being","ꯁꯤꯖꯤꯟꯅꯕꯥ ꯑꯁꯤ ꯃꯄꯨꯡ ꯐꯥꯅꯥ ꯏꯃꯥꯅꯦꯟꯇ ꯑꯣꯏ, ꯃꯈꯣꯌꯒꯤ ꯑꯣꯕꯖꯦꯛꯇ ꯑꯃꯁꯨꯡ ꯄꯥꯟꯗꯝ ꯑꯁꯤ"
merely the possibility of experience. Now our duty in the transcendental,ꯑꯦꯛꯁꯄꯔꯤꯌꯦꯟꯁꯀꯤ ꯑꯣꯏꯊꯣꯀꯄꯥ ꯌꯥꯕꯥ ꯑꯗꯨ ꯈꯛꯇꯅꯤ꯫
dialectic is as follows. To discover whether the principle that the series of,ꯗꯥꯏꯑꯦꯂꯦꯛꯇꯤꯛ ꯑꯁꯤ ꯃꯈꯥꯗꯥ ꯄꯤꯔꯤ꯫
"conditions (in the synthesis of phenomena, or of thought in general) extends","ꯀꯟꯗꯤꯁꯅꯁꯤꯡ (ꯐꯤꯅꯣꯃꯦꯅꯥꯒꯤ ꯁꯤꯟꯊꯦꯁꯤꯁꯇꯥ, ꯅꯠꯔꯒꯥ ꯃꯍꯧꯁꯥꯅꯥ ꯋꯥꯈꯜꯂꯣꯅꯒꯤ) ꯑꯁꯤ ꯍꯦꯟꯅꯥ ꯁꯥꯡꯗꯣꯀꯍꯜꯂꯤ꯫"
"to the unconditioned is objectively true, or not; what consequences result","ꯀꯟꯗꯤꯁꯟ ꯇꯧꯗꯕꯥ ꯃꯤꯑꯣꯏꯁꯤꯡꯗꯥ ꯑꯣꯕꯖꯦꯛꯇꯤꯕ ꯑꯣꯏꯅꯥ ꯑꯆꯨꯝꯕꯥ ꯑꯣꯏ, ꯅꯠꯔꯒꯥ ꯅꯠꯇꯦ;"
