en,mni-Mtei
The supervised learning optimization problem is to find the function                         g                 displaystyle g     that minimizes                        J                  g                                      R                        e             m             p                                      g                           λ         C                  g,ꯁꯨꯄꯔꯚꯥꯏꯖ ꯇꯧꯔꯕꯥ ꯂꯔꯅꯤꯡ ꯑꯣꯞꯇꯤꯃꯥꯏꯖꯦꯁꯅꯒꯤ ꯁꯃꯁ꯭ꯌꯥ ꯑꯁꯤ j g r e m p g λ c g ꯃꯤꯅꯤꯃꯝ ꯑꯣꯏꯕꯥ ꯐꯉ꯭ꯀꯁꯟ ꯖꯤ ꯗꯤꯁꯞꯂꯦꯁ꯭ꯇꯥꯏꯜ ꯖꯤ ꯊꯤꯕꯥ ꯑꯁꯤꯅꯤ꯫
displaystyle JgR_empglambda Cg.    The parameter                         λ                 displaystyle lambda      controls the biasvariance tradeoff,ꯗꯤꯁꯞꯂꯦꯁ꯭ꯇꯥꯏꯜ jgr_empglambda ꯁꯤ.ꯖꯤ.
When                         λ                  0                 displaystyle lambda 0     this gives empirical risk minimization with low bias and high variance,λ 0 displaystyle ꯂꯝꯕꯤꯗꯥ 0 ꯑꯁꯤꯅꯥ ꯂꯣ ꯕꯥꯏꯁ ꯑꯃꯁꯨꯡ ꯍꯥꯏ ꯚꯦꯔꯤꯑꯦꯟꯁꯀꯥ ꯂꯣꯌꯅꯅꯥ ꯑꯦꯝꯄꯤꯔꯤꯀꯦꯜ ꯔꯤꯁ꯭ꯛ ꯃꯤꯅꯤꯃꯥꯏꯖꯦꯁꯟ ꯄꯤꯕꯥ ꯃꯇꯃꯗꯥ
When                         λ                 displaystyle lambda      is large the learning algorithm will have high bias and low variance,λ ꯗꯤꯁꯞꯂꯦꯁ꯭ꯇꯥꯏꯜ ꯂꯃꯗꯃꯗꯥ ꯑꯆꯧꯕꯥ ꯑꯣꯏꯕꯥ ꯃꯇꯃꯗꯥ ꯂꯔꯅꯤꯡ ꯑꯦꯂꯒꯣꯔꯤꯊꯝ ꯑꯁꯤꯅꯥ ꯑꯋꯥꯡꯕꯥ ꯕꯥꯏꯁ ꯑꯃꯁꯨꯡ ꯂꯣ ꯚꯦꯔꯤꯑꯦꯟꯁ ꯂꯩꯒꯅꯤ
The value of                         λ                 displaystyle lambda      can be chosen empirically via  crossvalidation,λ DisplayStyle ꯂꯃꯗꯝ ꯑꯁꯤꯒꯤ ꯚꯦꯜꯌꯨ ꯑꯁꯤ ꯀ꯭ꯔꯣꯁꯚꯦꯂꯤꯗꯦꯁꯅꯒꯤ ꯈꯨꯠꯊꯥꯡꯗꯥ ꯑꯦꯝꯄꯤꯔꯤꯑꯦꯜ ꯑꯣꯏꯅꯥ ꯈꯅꯒꯠꯄꯥ ꯌꯥꯏ .
The complexity penalty has a Bayesian interpretation as the negative log prior probability of                         g                 displaystyle g                                      log                  P                  g                          displaystyle log Pg     in which case                         J                  g                          displaystyle Jg     is the posterior probability of                         g                 displaystyle g,ꯀꯝꯞꯂꯦꯛꯁꯇꯤꯇꯤ ꯄꯦꯅꯥꯜꯇꯤ ꯑꯁꯤꯅꯥ ꯖꯤ ꯗꯤꯁꯞꯂꯦꯁ꯭ꯇꯥꯏꯜ ꯖꯤ ꯂꯣꯒ ꯄꯤ ꯖꯤ ꯗꯤꯁꯞꯂꯦꯁ꯭ꯇꯥꯏꯜ ꯂꯣꯒ ꯄꯤ.ꯖꯤ.ꯒꯤ ꯅꯦꯒꯦꯇꯤꯕ ꯂꯣꯒ ꯄ꯭ꯔꯥꯏꯑꯣꯔꯤ ꯄ꯭ꯔꯣꯕꯤꯕꯤꯂꯤꯇꯤ ꯑꯣꯏꯅꯥ ꯕꯦꯌꯦꯁꯤꯌꯟ ꯏꯟꯇꯔꯞꯔꯤꯇꯦꯁꯟ ꯑꯃꯥ ꯂꯩ ꯃꯁꯤꯒꯤ ꯀꯦꯁ j ꯖꯤ ꯗꯤꯁꯞꯂꯦꯁ꯭ꯇꯥꯏꯜ ꯖꯦ.ꯖꯤ.
The training methods described above are discriminative training methods because they seek to find a function                         g                 displaystyle g     that discriminates well between the different output values see discriminative model,ꯃꯊꯛꯇꯥ ꯄꯅꯈ꯭ꯔꯤꯕꯥ ꯇ꯭ꯔꯦꯅꯤꯡꯒꯤ ꯃꯑꯣꯡꯁꯤꯡ ꯑꯁꯤ ꯗꯤꯁꯛꯔꯤꯃꯤꯅꯦꯇꯤꯕ ꯇ꯭ꯔꯦꯅꯤꯡ ꯃꯦꯊꯗꯁꯤꯡꯅꯤ ꯃꯔꯃꯗꯤ ꯃꯈꯣꯌꯅꯥ ꯇꯣꯉꯥꯟ ꯇꯣꯉꯥꯅꯕꯥ ꯑꯥꯎꯠꯄꯨꯠ ꯚꯦꯜꯌꯨꯁꯤꯡꯒꯤ ꯃꯔꯛꯇꯥ ꯐꯖꯅꯥ ꯈꯦꯟꯅꯕꯥ ꯊꯝꯂꯤꯕꯥ ꯐꯉ꯭ꯀꯁꯟ ꯖꯤ ꯗꯤꯁꯞꯂꯦꯁ꯭ꯇꯥꯏꯜ ꯖꯤ ꯑꯃꯥ ꯊꯤꯅꯕꯥ ꯍꯣꯠꯅꯔꯤ ꯗꯤꯁꯛꯔꯤꯃꯤꯅꯦꯇꯤꯕ ꯃꯣꯗꯦꯜ ꯌꯦꯡꯕꯤꯌꯨ
For the special case where f x y P x y displaystyle fxyPxy is a joint probability distribution and the loss function is the negative log likelihood i log P x i y i displaystyle sum _ilog Px_iy_i a risk minimization algorithm is said to perform generative training because f displaystyle f can be regarded as a generative model that explains how the data were generated,F X Y P X Y ꯗꯤꯁꯞꯂꯦꯁ꯭ꯇꯥꯏꯜ FXYPXY ꯑꯁꯤ ꯖꯣꯏꯟꯇ ꯄ꯭ꯔꯣꯕꯤꯕꯤꯂꯤꯇꯤ ꯗꯤꯁ꯭ꯠꯔꯤꯕ꯭ꯌꯨꯁꯟ ꯑꯃꯅꯤ ꯑꯃꯁꯨꯡ ꯂꯣꯁ ꯐꯉ꯭ꯀꯁꯟ ꯑꯁꯤ ꯅꯦꯒꯦꯇꯤꯕ ꯂꯣꯒ ꯂꯤꯀꯦꯂꯤꯍꯨꯗꯅꯤ ꯑꯩꯅꯥ ꯂꯣꯒ p x y i i ꯗꯤꯁ꯭ꯞꯂꯦꯁ꯭ꯇꯥꯏꯜ ꯁꯝ _ꯑꯥꯏꯂꯣꯒ px_iy_i ꯔꯤꯁ꯭ꯛ ꯃꯤꯅꯤꯃꯥꯏꯖꯦꯁꯟ ꯑꯦꯂꯒꯣꯔꯤꯊꯝ ꯑꯃꯥ ꯍꯥꯌꯕꯁꯤꯅꯥ ꯖꯦꯅꯦꯔꯦꯇꯤꯕ ꯇ꯭ꯔꯦꯅꯤꯡ ꯄꯤꯕꯅꯤ ꯍꯥꯌꯅꯥ ꯍꯥꯌꯕꯅꯥ ꯑꯦꯐ ꯗꯤꯁꯞꯂꯦꯁ꯭ꯇꯥꯏꯜ f ꯑꯁꯤ ꯗꯦꯇꯥ ꯑꯁꯤ ꯀꯔꯝꯅꯥ ꯖꯦꯅꯦꯔꯦꯠ ꯇꯧꯈꯤꯕꯒꯦ ꯍꯥꯌꯕꯗꯨ ꯃꯌꯦꯛ ꯁꯦꯡꯅꯥ ꯇꯥꯀꯄꯥ ꯌꯥꯏ ꯍꯥꯌꯅꯥ ꯍꯥꯌꯔꯤꯕꯥ ꯑꯈꯟꯅꯕꯥ ꯀꯦꯁ ꯑꯁꯤꯗꯤ ꯗꯦꯇꯥ ꯑꯁꯤ ꯀꯔꯝꯅꯥ ꯑꯣꯏꯍꯅꯈꯤꯕꯒꯦ
Generative training algorithms are often simpler and more computationally efficient than discriminative training algorithms,ꯖꯦꯅꯦꯔꯦꯇꯤꯕ ꯇ꯭ꯔꯦꯅꯤꯡ ꯑꯦꯂꯒꯣꯔꯤꯊꯃꯁꯤꯡ ꯑꯁꯤ ꯑꯌꯥꯝꯕꯅꯥ ꯗꯤꯁꯛꯔꯤꯃꯤꯅꯦꯇꯤꯕ ꯇ꯭ꯔꯦꯅꯤꯡ ꯑꯦꯂꯒꯣꯔꯤꯊꯃꯁꯤꯡꯗꯒꯤ ꯍꯦꯟꯅꯥ ꯂꯥꯏꯕꯥ ꯑꯃꯁꯨꯡ ꯀꯝꯞꯌꯨꯇꯦꯁ꯭ꯅꯦꯜ ꯑꯣꯏꯅꯥ ꯏꯐꯤꯁꯤꯌꯦꯟꯇ ꯑꯣꯏ
In some cases the solution can be computed in closed form as in naive Bayes and linear discriminant analysis,ꯀꯦꯁ ꯈꯔꯗꯗꯤ ꯁꯣꯂꯨꯁꯟ ꯑꯁꯤ ꯅꯦꯏꯕ ꯕꯦꯌꯦꯁ ꯑꯃꯁꯨꯡ ꯂꯤꯅꯤꯌꯔ ꯗꯤꯁꯛꯔꯤꯃꯤꯅꯦꯟꯇ ꯑꯦꯅꯥꯂꯥꯏꯁꯤꯁꯒꯨꯝꯅꯥ ꯀ꯭ꯂꯣꯖꯗ ꯐꯔꯃꯗꯥ ꯀꯝꯞꯌꯨꯠ ꯇꯧꯕꯥ ꯌꯥꯏ꯫
There are several ways in which the standard supervised learning problem can be generalized Semisupervised learning or weak supervision the desired output values are provided only for a subset of the training data,ꯁ꯭ꯇꯦꯟꯗꯔꯗ ꯁꯨꯄꯔꯚꯥꯏꯖ ꯇꯧꯔꯕꯥ ꯂꯔꯅꯤꯡ ꯄ꯭ꯔꯣꯕ꯭ꯂꯦꯝ ꯑꯁꯤ ꯖꯦꯅꯦꯔꯦꯂꯥꯏꯖ ꯇꯧꯕꯥ ꯌꯥꯕꯥ ꯃꯑꯣꯡ ꯀꯌꯥ ꯂꯩ ꯁꯦꯃꯤ-ꯁꯨꯄꯥꯔꯚꯥꯏꯖ ꯂꯔꯅꯤꯡ ꯅꯠꯠꯔꯒꯥ ꯋꯥꯏꯛ ꯁꯨꯄꯔꯚꯤꯖꯟ ꯑꯄꯥꯝꯕꯥ ꯑꯥꯎꯇꯄꯨꯠ ꯚꯦꯜꯌꯨꯁꯤꯡ ꯑꯁꯤ ꯇ꯭ꯔꯦꯅꯤꯡ ꯗꯦꯇꯥꯒꯤ ꯁꯕꯁꯦꯠ ꯑꯃꯈꯛꯇꯒꯤꯗꯃꯛ ꯄꯤꯔꯤ
The remaining data is unlabeled or imprecisely labeled,ꯂꯦꯃꯍꯧꯔꯤꯕꯥ ꯗꯦꯇꯥ ꯑꯗꯨ ꯂꯦꯕꯦꯜ ꯇꯧꯗꯕꯥ ꯅꯠꯠꯔꯒꯥ ꯃꯑꯣꯡ ꯆꯨꯝꯅꯥ ꯂꯦꯕꯦꯜ ꯇꯧꯕꯥ ꯌꯥꯏ .
Active learning Instead of assuming that all of the training examples are given at the start active learning algorithms interactively collect new examples typically by making queries to a human user,ꯇ꯭ꯔꯦꯅꯤꯡꯒꯤ ꯈꯨꯗꯝ ꯄꯨꯝꯅꯃꯛ ꯑꯁꯤ ꯁ꯭ꯇꯥꯔꯠ ꯑꯦꯛꯇꯤꯕ ꯂꯔꯅꯤꯡ ꯑꯦꯂꯒꯣꯔꯤꯊꯃꯁꯤꯡꯗꯥ ꯄꯤꯔꯤ ꯍꯥꯌꯅꯥ ꯂꯧꯕꯒꯤ ꯃꯍꯨꯠꯇꯥ ꯑꯦꯛꯇꯤꯕ ꯂꯔꯅꯤꯡ ꯑꯁꯤ ꯃꯤꯑꯣꯏꯕꯒꯤ ꯌꯨꯖꯔ ꯑꯃꯗꯥ ꯀ꯭ꯕꯦꯔꯤꯁꯤꯡ ꯁꯦꯃꯗꯨꯅꯥ ꯃꯍꯧꯁꯥꯅꯥ ꯑꯅꯧꯕꯥ ꯈꯨꯗꯃꯁꯤꯡ ꯏꯟꯇꯔꯦꯛꯇꯤꯕ ꯑꯣꯏꯅꯥ ꯈꯣꯃꯖꯤꯜꯂꯤ
Often the queries are based on unlabeled data which is a scenario that combines semisupervised learning with active learning,ꯑꯌꯥꯝꯕꯥ ꯃꯇꯃꯗꯥ ꯀ꯭ꯕꯦꯔꯤꯁꯤꯡ ꯑꯁꯤ ꯂꯦꯕꯦꯜ ꯇꯧꯗꯕꯥ ꯗꯦꯇꯥꯗꯥ ꯌꯨꯝꯐꯝ ꯑꯣꯏꯕꯅꯤ ꯃꯁꯤ ꯁꯦꯃꯤ-ꯁꯨꯄꯥꯔꯚꯥꯏꯖ ꯂꯔꯅꯤꯡꯒꯥ ꯑꯦꯛꯇꯤꯕ ꯂꯔꯅꯤꯡꯒꯥ ꯄꯨꯅꯁꯤꯟꯅꯗꯨꯅꯥ ꯁꯤꯅꯥꯔꯤꯑꯣ ꯑꯃꯅꯤ꯫
Structured prediction When the desired output value is a complex object such as a parse tree or a labeled graph then standard methods must be extended,ꯁ꯭ꯠꯔꯀꯆꯔꯦꯜ ꯄ꯭ꯔꯤꯗꯤꯛꯁꯟ ꯑꯁꯤ ꯑꯄꯥꯝꯕꯥ ꯑꯥꯎꯠꯄꯨꯠ ꯚꯦꯜꯌꯨ ꯑꯁꯤ ꯄꯥꯔꯁ ꯇ꯭ꯔꯤ ꯅꯠꯠꯔꯒꯥ ꯂꯦꯕꯦꯜ ꯇꯧꯔꯕꯥ ꯒ꯭ꯔꯥꯐꯒꯨꯝꯕꯥ ꯀꯝꯞꯂꯦꯛꯁ ꯑꯣꯕꯖꯦꯛꯇ ꯑꯃꯥ ꯑꯣꯏꯕꯥ ꯃꯇꯃꯗꯥ ꯁ꯭ꯇꯦꯟꯗꯔꯗ ꯃꯦꯊꯗꯁꯤꯡ ꯑꯁꯤ ꯑꯦꯛꯁꯇꯦꯟꯗ ꯇꯧꯒꯗꯕꯅꯤ
Learning to rank When the input is a set of objects and the desired output is a ranking of those objects then again the standard methods must be extended,ꯏꯅꯄꯨꯠ ꯑꯁꯤ ꯄꯣꯠꯁꯤꯡꯒꯤ ꯁꯦꯠ ꯑꯃꯥ ꯑꯣꯏꯕꯥ ꯃꯇꯃꯗꯥ ꯑꯃꯁꯨꯡ ꯑꯄꯥꯝꯕꯥ ꯑꯥꯎꯠꯄꯨꯠ ꯑꯗꯨ ꯄꯣꯠꯁꯤꯡ ꯑꯗꯨꯒꯤ ꯔꯦꯉ꯭ꯀꯤꯡ ꯑꯃꯥ ꯑꯣꯏꯔꯀꯄꯥ ꯃꯇꯃꯗꯥ ꯔꯦꯉ꯭ꯛ ꯇꯧꯕꯥ ꯇꯝꯕꯥ ꯃꯇꯨꯡꯗꯥ ꯑꯃꯨꯛ ꯍꯟꯅꯥ ꯁ꯭ꯇꯦꯟꯗꯔꯗ ꯃꯦꯊꯗꯁꯤꯡ ꯑꯗꯨ ꯑꯦꯛꯁꯇꯦꯟꯗ ꯇꯧꯒꯗꯕꯅꯤ
Analytical learning Artificial neural network Backpropagation Boosting metaalgorithm Bayesian statistics Casebased reasoning Decision tree learning Inductive logic programming Gaussian process regression Genetic programming Group method of data handling Kernel estimators Learning automata Learning classifier systems Learning vector quantization Minimum message length decision trees decision graphs etc,ꯑꯦꯅꯥꯂꯥꯏꯇꯤꯀꯦꯜ ꯂꯔꯅꯤꯡ ꯑꯥꯔꯇꯤꯐꯤꯁꯤꯑꯦꯜ ꯅ꯭ꯌꯨꯔꯜ ꯅꯦꯇꯋꯥꯔꯛ ꯕꯦꯀꯞꯔꯣꯄꯦꯒꯦꯁꯟ ꯕꯨꯁ꯭ꯇꯤꯡ ꯃꯦꯇꯥꯑꯦꯂꯒꯣꯔꯤꯊꯝ ꯕꯦꯌꯦꯁꯤꯌꯟ ꯁ꯭ꯇꯦꯇꯤꯁ꯭ꯇꯤꯛꯁ ꯀꯦꯁꯇꯥ ꯌꯨꯝꯐꯝ ꯑꯣꯏꯕꯥ ꯔꯤꯖꯅꯦꯜ ꯋꯥꯔꯦꯞ ꯂꯧꯕꯥ ꯇ꯭ꯔꯤ ꯂꯔꯅꯤꯡ ꯏꯟꯗꯛꯇꯤꯚ ꯂꯣꯖꯤꯛ ꯄ꯭ꯔꯣꯒ꯭ꯔꯥꯃꯤꯡ ꯒꯥꯎꯁꯤꯌꯟ ꯄ꯭ꯔꯣꯁꯦꯁ ꯔꯤꯒ꯭ꯔꯦꯁꯟ ꯖꯦꯅꯦꯇꯤꯛ ꯄ꯭ꯔꯣꯒ꯭ꯔꯥꯃꯤꯡ ꯒ꯭ꯔꯨꯞ ꯗꯦꯇꯥ ꯍꯦꯟꯗꯜ ꯇꯧꯕꯒꯤ ꯃꯑꯣꯡ ꯂꯔꯅꯤꯡ ꯑꯣꯇꯣꯃꯦꯇꯥ ꯂꯔꯅꯤꯡ ꯀ꯭ꯂꯥꯁꯤꯐꯥꯏꯌꯔ ꯁꯤꯁ꯭ꯇꯦꯃꯁꯤꯡ ꯇꯝꯕꯥ ꯚꯦꯛꯇꯔ ꯀ꯭ꯕꯥꯟꯇꯥꯏꯖꯦꯁꯟ ꯃꯤꯅꯤꯃꯝ ꯃꯦꯁꯦꯖ ꯂꯦꯡꯗꯕꯥ ꯋꯥꯔꯦꯞ ꯂꯧꯕꯥ ꯇ꯭ꯔꯤꯁ ꯗꯤꯁꯤꯖꯟ ꯒ꯭ꯔꯥꯐꯁꯤꯡ ꯑꯁꯤꯅꯆꯤꯡꯕꯥ
Multilinear subspace learning Naive Bayes classifier Maximum entropy classifier Conditional random field Nearest neighbor algorithm Probably approximately correct learning PAC learning Ripple down rules a knowledge acquisition methodology Symbolic machine learning algorithms Subsymbolic machine learning algorithms Support vector machines Minimum complexity machines MCM Random forests Ensembles of classifiers Ordinal classification Data preprocessing Handling imbalanced datasets Statistical relational learning Proaftn a multicriteria classification algorithm Bioinformatics Cheminformatics Quantitative structureactivity relationship Database marketing Handwriting recognition Information retrieval Learning to rank Information extraction Object recognition in computer vision Optical character recognition Spam detection Pattern recognition Speech recognition Supervised learning is a special case of downward causation in biological systems Landform classification using satellite imagery Spend classification in procurement processes Computational learning theory Inductive bias Overfitting Uncalibrated class membership probabilities Version spaces List of datasets for,ꯃꯜꯇꯤꯂꯤꯅꯦꯔ ꯁꯕꯁ꯭ꯄꯦꯁ ꯂꯔꯅꯤꯡ ꯅꯦꯏꯚ ꯕꯦꯌꯦꯁ ꯀ꯭ꯂꯥꯁꯤꯐꯥꯏꯌꯔ ꯀꯟꯗꯤꯁꯅꯦꯜ ꯔꯦꯟꯗꯝ ꯐꯤꯜꯗ ꯈ꯭ꯕꯥꯏꯗꯒꯤ ꯅꯀꯄꯥ ꯌꯨꯝꯂꯣꯟꯅꯕꯥ ꯑꯦꯂꯒꯣꯔꯤꯊꯝ ꯌꯥꯝꯅꯥ ꯊꯨꯅꯥ ꯑꯆꯨꯝꯕꯥ ꯇꯝꯕꯥ ꯄꯦꯛ ꯂꯔꯅꯤꯡ ꯔꯤꯄꯜ ꯗꯥꯎꯟ ꯔꯨꯂꯁ ꯑꯦ ꯅꯣꯂꯦꯖ ꯑꯦꯛꯕꯤꯖꯤꯁꯟ ꯃꯦꯊꯣꯗꯣꯂꯣꯖꯤ ꯁꯤꯝꯕꯣꯂꯤꯛ ꯃꯦꯁꯤꯟ ꯂꯔꯅꯤꯡ ꯑꯦꯂꯒꯣꯔꯤꯊꯃꯁꯤꯡ ꯁꯕꯁꯤꯝꯕꯣꯂꯤꯛ ꯃꯦꯁꯤꯟ ꯂꯔꯅꯤꯡ ꯑꯦꯂꯒꯣꯔꯤꯊꯃꯁꯤꯡ ꯁꯄꯣꯔꯠ ꯚꯦꯛꯇꯔ ꯃꯦꯁꯤꯅꯁꯤꯡ ꯃꯤꯅꯤꯃꯝ ꯀꯝꯞꯂꯦꯛꯁꯇꯤꯇꯤ ꯃꯦꯁꯤꯅꯁꯤꯡ ꯑꯦꯝ.ꯁꯤ.ꯑꯦꯝ.
machinelearning research Unsupervised learning Machine Learning Open Source Software MLOSS,ꯃꯦꯁꯤꯅꯂꯔꯅꯤꯡ ꯔꯤꯁꯔꯆ ꯑꯅꯁꯄꯥꯔꯚꯥꯏꯖ ꯂꯔꯅꯤꯡ ꯃꯦꯁꯤꯟ ꯂꯔꯅꯤꯡ ꯑꯣꯄꯟ ꯁꯣꯔꯁ ꯁꯣꯐꯇꯋꯦꯌꯔ ꯑꯦꯝ.ꯑꯦꯜ.ꯑꯣ.ꯑꯦꯁ.
The French Revolution French Révolution française  was a period of political and societal change in France which began with the Estates General of 1789 and ended with the Coup of 18 Brumaire on 9 November 1799,"ꯐ꯭ꯔꯥꯟꯁꯀꯤ ꯔꯤꯚꯣꯂꯨꯁꯟ ꯐ꯭ꯔꯥꯟꯁꯀꯤ ꯔꯤꯚꯣꯂꯨꯁꯟ ꯐ꯭ꯔꯥꯟꯁꯦꯁ ꯑꯁꯤ ꯐ꯭ꯔꯥꯟꯁꯇꯥ ꯔꯥꯖꯅꯤꯇꯤꯒꯤ ꯑꯃꯁꯨꯡ ꯈꯨꯟꯅꯥꯏꯒꯤ ꯑꯣꯏꯕꯥ ꯑꯍꯣꯡꯕꯥ ꯄꯨꯔꯀꯄꯒꯤ ꯃꯇꯝ ꯑꯃꯅꯤ ꯃꯗꯨ ꯱꯷꯸꯹ꯒꯤ ꯑꯦꯁ꯭ꯇꯦꯠꯁ ꯖꯦꯅꯔꯦꯂꯗꯒꯤ ꯍꯧꯈꯤ ꯑꯃꯁꯨꯡ ꯱꯸ ꯕ꯭ꯔꯨꯃꯦꯌꯔꯒꯤ ꯂꯥꯅꯐꯝ ꯑꯁꯤ ꯅꯕꯦꯝꯕꯔ ꯹, ꯱꯷꯹꯹ ꯗꯥ ꯂꯣꯏꯁꯤꯅꯈꯤ꯫"
Many of the revolutions ideas are considered fundamental principles of liberal democracy and its values remain central to modern French political discourse,ꯔꯤꯚꯣꯂꯨꯁꯅꯒꯤ ꯋꯥꯈꯜꯂꯣꯟ ꯀꯌꯥ ꯑꯁꯤ ꯂꯤꯕꯔꯜ ꯗꯦꯃꯣꯛꯔꯦꯁꯤꯒꯤ ꯐꯟꯗꯥꯃꯦꯟꯇꯦꯜ ꯄ꯭ꯔꯤꯟꯁꯤꯄꯂꯁꯤꯡꯅꯤ ꯍꯥꯌꯅꯥ ꯂꯧꯅꯩ ꯑꯃꯁꯨꯡ ꯃꯁꯤꯒꯤ ꯚꯦꯜꯌꯨꯁꯤꯡ ꯑꯁꯤ ꯃꯣꯗꯔꯟ ꯐ꯭ꯔꯦꯟꯆ ꯄꯣꯂꯤꯇꯤꯀꯦꯜ ꯗꯤꯁꯀꯣꯔꯁꯀꯤ ꯃꯔꯨ ꯑꯣꯏꯕꯥ ꯃꯆꯥꯛ ꯑꯃꯅꯤ .
The causes of the revolution were a combination of social political and economic factors which the ancien régime old regime proved unable to manage,ꯔꯤꯚꯣꯂꯨꯁꯅꯒꯤ ꯃꯔꯃꯁꯤꯡ ꯑꯁꯤ ꯁꯣꯁꯤꯑꯦꯜ ꯄꯣꯂꯤꯇꯤꯀꯦꯜ ꯑꯃꯁꯨꯡ ꯏꯀꯣꯅꯣꯃꯤꯛ ꯐꯦꯛꯇꯔꯁꯤꯡꯒꯤ ꯀꯝꯕꯤꯅꯦꯁꯟ ꯑꯃꯥ ꯑꯣꯏꯈꯤ ꯃꯗꯨ ꯑꯦꯟꯁꯤꯌꯦꯟ ꯔꯦꯖꯤꯝ ꯑꯣꯜꯗ ꯔꯦꯖꯤꯝ ꯑꯁꯤꯅꯥ ꯃꯦꯅꯦꯖ ꯇꯧꯕꯥ ꯉꯃꯗꯅꯥ ꯄ꯭ꯔꯃꯥꯟ ꯇꯧꯈꯤ
A financial crisis and widespread social distress led to the convocation of the Estates General in May 1789 its first meeting since 1614,ꯁꯦꯜ-ꯊꯨꯃꯒꯤ ꯐꯤꯕꯝ ꯐꯠꯠꯔꯕꯥ ꯑꯃꯁꯨꯡ ꯄꯥꯛ ꯁꯟꯅꯥ ​​ꯈꯨꯟꯅꯥꯏꯒꯤ ꯑꯋꯥꯕꯥ ꯊꯣꯀꯍꯅꯈꯤꯕꯥ ꯑꯁꯤꯅꯥ ꯃꯔꯝ ꯑꯣꯏꯗꯨꯅꯥ ꯱꯶꯱꯴ꯒꯤ ꯃꯇꯨꯡꯗꯥ ꯃꯦ ꯱꯷꯸꯹ꯗꯥ ꯏꯁ꯭ꯇꯦꯠꯁ ꯖꯦꯅꯦꯔꯦꯂꯒꯤ ꯑꯍꯥꯅꯕꯥ ꯃꯤꯐꯝ ꯄꯥꯡꯊꯣꯀꯈꯤ꯫
The representatives of the Third Estate broke away and reconstituted themselves as a National Assembly in June,ꯊꯥꯔꯗ ꯑꯦꯁ꯭ꯇꯦꯠꯀꯤ ꯃꯤꯍꯨꯠꯁꯤꯡꯅꯥ ꯊꯨꯒꯥꯏꯈꯤ ꯑꯃꯁꯨꯡ ꯖꯨꯟ ꯊꯥꯗꯥ ꯃꯈꯣꯌ ꯃꯁꯥꯕꯨ ꯅꯦꯁ꯭ꯅꯦꯜ ꯑꯦꯁꯦꯝꯕꯂꯤ ꯑꯃꯥ ꯑꯣꯏꯅꯥ ꯑꯃꯨꯛ ꯍꯟꯅꯥ ꯁꯦꯃꯗꯣꯀꯈꯤ꯫
The Storming of the Bastille in Paris on 14 July was followed by radical measures by the Assembly among them the abolition of feudalism state control over the Catholic Church and a declaration of rights,ꯖꯨꯂꯥꯏ ꯱꯴ꯗꯥ ꯄꯦꯔꯤꯁꯇꯥ ꯕꯦꯁ꯭ꯇꯤꯜ ꯂꯥꯟꯊꯣꯀꯈꯤꯕꯥ ꯑꯗꯨꯒꯤ ꯃꯇꯨꯡꯗꯥ ꯃꯈꯣꯌꯒꯤ ꯃꯅꯨꯡꯗꯥ ꯑꯦꯁꯦꯝꯕꯂꯤꯅꯥ ꯔꯦꯗꯤꯀꯦꯜ ꯑꯣꯏꯕꯥ ꯈꯣꯉꯊꯥꯡꯁꯤꯡ ꯂꯧꯈꯠꯈꯤ ꯑꯃꯁꯨꯡ ꯀꯦꯊꯣꯂꯤꯛ ꯁꯤꯡꯂꯨꯄꯀꯤ ꯃꯊꯛꯇꯥ ꯐ꯭ꯌꯨꯗꯂꯤꯖꯝ ꯁ꯭ꯇꯦꯠ ꯀꯟꯠꯔꯣꯜ ꯑꯃꯁꯨꯡ ꯗꯤꯛꯂꯥꯔꯦꯁꯟ ꯑꯣꯐ ꯔꯥꯏꯠꯁ
The next three years were dominated by a struggle for political control,ꯃꯊꯪꯒꯤ ꯆꯍꯤ ꯑꯍꯨꯝ ꯑꯁꯤ ꯔꯥꯖꯅꯤꯇꯤꯒꯤ ꯑꯣꯏꯕꯥ ꯀꯟꯠꯔꯣꯂꯒꯤꯗꯃꯛ ꯂꯥꯟꯊꯦꯡꯅꯕꯅꯥ ꯃꯔꯝ ꯑꯣꯏꯗꯨꯅꯥ .
King Louis XVIs attempted flight to Varennes in June 1791 further discredited the monarchy and military defeats after the outbreak of the French Revolutionary Wars in April 1792 led to an armed insurrection on 10 August 1792,"ꯀꯤꯡ ꯂꯨꯏꯁ ꯑꯦꯛꯁꯚꯤꯁꯅꯥ ꯖꯨꯟ ꯱꯷꯹꯱ ꯗꯥ ꯚꯦꯔꯦꯟꯖꯗꯥ ꯆꯠꯅꯕꯥ ꯍꯣꯠꯅꯈꯤꯕꯥ ꯑꯗꯨꯅꯥ ꯃꯔꯝ ꯑꯣꯏꯗꯨꯅꯥ ꯐ꯭ꯔꯥꯟꯁꯀꯤ ꯔꯤꯚꯣꯂꯨꯁꯅꯔꯤ ꯋꯥꯔꯁꯤꯡ ꯊꯣꯀꯈꯤꯕꯥ ꯃꯇꯨꯡꯗꯥ ꯑꯦꯞꯔꯤꯜ ꯱꯷꯹꯲ ꯗꯥ ꯑꯣꯒꯁ꯭ꯠ ꯱꯰, ꯱꯷꯹꯲ ꯗꯥ ꯈꯨꯠꯂꯥꯌ ꯂꯃꯖꯦꯜ ꯇꯥꯟꯅꯕꯒꯤ ꯊꯧꯗꯣꯛ ꯑꯃꯥ ꯊꯣꯀꯈꯤꯕꯗꯒꯤ ꯃꯣꯅꯥꯔꯀꯤ ꯑꯃꯁꯨꯡ ꯃꯤꯂꯤꯇꯔꯤꯒꯤ ꯃꯥꯏꯊꯤꯕꯥ ꯑꯗꯨ ꯃꯈꯥ ꯇꯥꯅꯥ ꯂꯥꯟꯅꯥ ꯂꯃꯖꯤꯡꯈꯤ꯫"
The monarchy was replaced by the French First Republic in September and Louis XVI was executed in January 1793,ꯁꯦꯞꯇꯦꯝꯕꯔ ꯊꯥꯗꯥ ꯐ꯭ꯔꯥꯟꯁꯀꯤ ꯑꯍꯥꯅꯕꯥ ꯔꯤꯄꯥꯕ꯭ꯂꯤꯀꯅꯥ ꯃꯍꯨꯠ ꯁꯤꯅꯈꯤ ꯑꯃꯁꯨꯡ ꯂꯨꯏꯁ ꯑꯦꯛꯁꯚꯤꯅꯥ ꯖꯅꯨꯋꯥꯔꯤ ꯱꯷꯹꯳ꯗꯥ ꯁꯤꯈꯤ꯫
After another revolt in June 1793 the constitution was suspended and political power passed from the National Convention to the Committee of Public Safety dominated by radical Jacobins led by Maximilien Robespierre,ꯖꯨꯟ ꯱꯷꯹꯳ꯗꯥ ꯑꯇꯣꯞꯄꯥ ꯂꯥꯅꯐꯝ ꯑꯃꯒꯤ ꯃꯇꯨꯡꯗꯥ ꯁꯪꯕꯤꯙꯥꯟ ꯑꯁꯤ ꯊꯤꯡꯖꯤꯅꯈꯤ ꯑꯃꯁꯨꯡ ꯄꯣꯂꯤꯇꯤꯀꯦꯜ ꯄꯥꯋꯔ ꯑꯁꯤ ꯃꯦꯛꯁꯤꯃꯂꯤꯌꯟ ꯔꯣꯕꯦꯁꯄꯤꯌꯔꯅꯥ ꯂꯨꯆꯤꯡꯕꯥ ꯔꯦꯗꯤꯀꯦꯜ ꯖꯦꯀꯣꯕꯤꯅꯁꯤꯡꯅꯥ ꯂꯨꯆꯤꯡꯕꯥ ꯄꯕ꯭ꯂꯤꯛ ꯁꯦꯐꯇꯤꯒꯤ ꯀꯝꯃꯤꯇꯤꯗꯥ ꯄꯥꯁ ꯇꯧꯈꯤ
About 16000 people were sentenced by the Revolutionary Tribunal and executed in the Reign of Terror which ended in July 1794 with the Thermidorian Reaction,ꯆꯥꯎꯔꯥꯛꯅꯥ ꯃꯤꯑꯣꯏ ꯱꯶꯰꯰꯰ꯅꯥ ꯔꯤꯚꯣꯂꯨꯁꯅꯔꯤ ꯇ꯭ꯔꯥꯏꯕ꯭ꯌꯨꯅꯦꯂꯅꯥ ꯋꯥꯌꯦꯜ ꯄꯤꯈꯤ ꯑꯃꯁꯨꯡ ꯇꯦꯔꯣꯔꯤꯖꯃꯒꯤ ꯂꯩꯉꯥꯛ ꯃꯅꯨꯡꯗꯥ ꯑꯦꯛꯁꯦꯛꯁꯟ ꯇꯧꯈꯤ ꯃꯗꯨ ꯖꯨꯂꯥꯏ ꯱꯷꯹꯴ꯗꯥ ꯊꯔꯃꯤꯗꯣꯔꯤꯌꯥꯟ ꯔꯤꯑꯦꯛꯁꯅꯒꯥ ꯂꯣꯌꯅꯅꯥ ꯂꯣꯏꯁꯤꯅꯈꯤ꯫
Weakened by external threats and internal opposition the Committee of Public Safety was replaced in November 1795 by the Directory,ꯃꯄꯥꯅꯒꯤ ꯆꯩꯊꯦꯡꯁꯤꯡ ꯑꯃꯁꯨꯡ ꯃꯅꯨꯡꯒꯤ ꯑꯣꯏꯕꯥ ꯑꯣꯄꯣꯖꯤꯁꯅꯅꯥ ꯁꯣꯀꯍꯜꯂꯕꯥ ꯀꯃꯤꯇꯤ ꯑꯣꯐ ꯄꯕ꯭ꯂꯤꯛ ꯁꯦꯐꯇꯤ ꯑꯁꯤ ꯅꯕꯦꯝꯕꯔ ꯱꯷꯹꯵ꯗꯥ ꯗꯥꯏꯔꯦꯛꯇꯣꯔꯤꯅꯥ ꯃꯍꯨꯠ ꯁꯤꯅꯈꯤ
Its instability ended in the coup of 18 Brumaire and the establishment of the Consulate with Napoleon Bonaparte as First Consul,ꯃꯁꯤꯒꯤ ꯇꯪꯗꯨ ꯂꯩꯇꯥꯗꯕꯥ ꯑꯁꯤ ꯕ꯭ꯔꯨꯃꯦꯌꯔ ꯱꯸ꯒꯤ ꯂꯥꯅꯐꯃꯗꯥ ꯂꯣꯏꯁꯤꯅꯈꯤ ꯑꯃꯁꯨꯡ ꯅꯦꯄꯣꯂꯤꯌꯟ ꯕꯣꯅꯥꯄꯥꯔꯇꯀꯥ ꯂꯣꯌꯅꯅꯥ ꯀꯟꯁꯂꯇꯦꯟꯇ ꯑꯁꯤ ꯑꯍꯥꯅꯕꯥ ꯀꯟꯁꯂꯇꯦꯟꯇ ꯑꯣꯏꯅꯥ ꯂꯤꯡꯈꯠꯈꯤ꯫
The Revolution resulted from multiple longterm and shortterm factors culminating in a social economic financial and political crisis in the late 1780s,ꯔꯤꯚꯣꯂꯨꯁꯟ ꯑꯁꯤ 1780ꯒꯤ ꯃꯌꯥꯏ ꯆꯜꯂꯀꯄꯗꯥ ꯁꯣꯁꯤꯑꯦꯜ ꯏꯀꯣꯅꯣꯃꯤꯛ ꯁꯦꯜ-ꯊꯨꯃꯒꯤ ꯑꯃꯁꯨꯡ ꯔꯥꯖꯅꯤꯇꯤꯒꯤ ꯑꯣꯏꯕꯥ ꯀ꯭ꯔꯥꯏꯁꯤꯁ ꯑꯃꯗꯥ ꯂꯣꯏꯁꯤꯅꯈꯤꯕꯥ ꯃꯁꯤꯡ ꯌꯥꯝꯂꯕꯥ ꯂꯣꯡ-ꯇꯔꯝ ꯑꯃꯁꯨꯡ ꯁꯣꯔꯠ-ꯇꯔꯝ ꯐꯦꯛꯇꯔꯁꯤꯡꯅꯥ ꯃꯔꯝ ꯑꯣꯏꯗꯨꯅꯥ ꯑꯣꯏꯈꯤꯕꯅꯤ꯫
Combined with resistance to reform by the ruling elite and indecisive policy by Louis XVI and his ministers the result was a crisis the state was unable to manage,ꯂꯨꯏꯖ ꯑꯦꯛꯁꯚꯤ ꯑꯃꯁꯨꯡ ꯃꯍꯥꯛꯀꯤ ꯃꯟꯠꯔꯤꯁꯤꯡꯅꯥ ꯂꯩꯉꯥꯛꯂꯤꯕꯥ ꯏꯂꯤꯠ ꯑꯃꯁꯨꯡ ꯋꯥꯔꯦꯞ ꯂꯧꯗꯕꯥ ꯄꯣꯂꯤꯁꯤꯅꯥ ꯔꯤꯐꯣꯔꯝ ꯇꯧꯕꯒꯤ ꯂꯥꯟꯊꯦꯡꯅꯕꯒꯥ ꯂꯣꯌꯅꯅꯥ ꯃꯁꯤꯒꯤ ꯃꯍꯩ ꯑꯣꯏꯅꯥ ꯔꯥꯖ꯭ꯌ ꯑꯁꯤꯅꯥ ꯃꯦꯅꯦꯖ ꯇꯧꯕꯥ ꯉꯃꯗꯕꯥ ꯀ꯭ꯔꯥꯏꯁꯤꯁ ꯑꯃꯥ ꯑꯣꯏꯈꯤ
Between 1715 and 1789 the French population grew from 21 to 28 million 20 of whom lived in towns or cities Paris alone having over 600000 inhabitants,꯱꯷꯱꯵ ꯑꯃꯁꯨꯡ ꯱꯷꯸꯹ꯒꯤ ꯃꯔꯛꯇꯥ ꯐ꯭ꯔꯥꯟꯁꯀꯤ ꯃꯤꯁꯤꯡ ꯑꯁꯤ ꯃꯤꯂꯤꯌꯟ ꯲꯱ꯗꯒꯤ ꯲꯸ꯗꯥ ꯍꯦꯅꯒꯠꯈꯤ ꯑꯃꯁꯨꯡ ꯃꯈꯣꯌꯒꯤ ꯃꯅꯨꯡꯗꯥ ꯲꯰ꯗꯤ ꯄꯦꯔꯤꯁ ꯈꯛꯇꯗꯥ ꯃꯤꯑꯣꯏ ꯶꯰꯰꯰꯰ ꯍꯦꯟꯅꯥ ꯂꯩꯕꯥ ꯇꯥꯎꯟ ꯅꯠꯔꯒꯥ ꯁꯍꯔꯁꯤꯡꯗꯥ ꯂꯩꯈꯤ
This was accompanied by a tripling in the size of the middle class which comprised almost 10 of the population by 1789,ꯃꯁꯤꯒꯥ ꯂꯣꯌꯅꯅꯥ ꯃꯤꯗꯜ ꯀ꯭ꯂꯥꯁꯀꯤ ꯁꯥꯏꯖꯒꯤ ꯇ꯭ꯔꯤꯄꯜ ꯑꯃꯥ ꯌꯥꯑꯣꯈꯤ ꯃꯗꯨꯗꯥ ꯱꯷꯸꯹ ꯐꯥꯑꯣꯕꯗꯥ ꯃꯤꯁꯤꯡꯒꯤ ꯆꯥꯎꯔꯥꯛꯅꯥ ꯱꯰ ꯌꯥꯑꯣꯈꯤ꯫
Despite increases in overall prosperity its benefits were largely restricted to the rentier and mercantile classes while the living standards fell for wage labourers and peasant farmers who rented their land,ꯑꯄꯨꯅꯕꯥ ꯌꯥꯏꯐ-ꯊꯧꯔꯥꯡ ꯍꯦꯅꯒꯠꯂꯛꯂꯕꯁꯨ ꯃꯁꯤꯒꯤ ꯀꯥꯟꯅꯕꯥ ꯑꯁꯤ ꯑꯌꯥꯝꯕꯅꯥ ꯔꯦꯟꯇꯦꯜ ꯑꯃꯁꯨꯡ ꯃꯔꯀꯦꯟꯇꯤꯜ ꯀ꯭ꯂꯥꯁꯁꯤꯡꯗꯥ ꯊꯃꯈꯤ ꯑꯗꯨꯒꯥ ꯃꯈꯣꯌꯒꯤ ꯂꯝ ꯚꯥꯔꯥꯗꯥ ꯂꯩꯕꯥ ꯋꯦꯖ ꯂꯦꯕꯔꯁꯤꯡ ꯑꯃꯁꯨꯡ ꯂꯧꯃꯤ ꯂꯧꯃꯤꯁꯤꯡꯒꯤ ꯍꯤꯡꯅꯕꯒꯤ ꯆꯠꯅꯕꯤꯁꯤꯡ ꯑꯁꯤ ꯍꯟꯊꯈꯤ꯫
Economic recession from 1785 combined with bad harvests in 1787 and 1788 led to high unemployment and food prices causing a financial and political crisis,꯱꯷꯸꯵ ꯑꯃꯁꯨꯡ ꯱꯷꯸꯸ꯗꯥ ꯐꯠꯇꯕꯥ ꯂꯧꯔꯣꯛꯁꯤꯡꯒꯥ ꯂꯣꯌꯅꯅꯥ ꯱꯷꯸꯵ꯗꯒꯤ ꯁꯦꯜ-ꯊꯨꯃꯒꯤ ꯐꯤꯕꯝ ꯐꯠꯇꯕꯅꯥ ꯃꯔꯝ ꯑꯣꯏꯗꯨꯅꯥ ꯊꯕꯛ ꯐꯪꯗꯕꯥ ꯑꯃꯁꯨꯡ ꯆꯥꯅꯕꯥ ꯄꯣꯠꯂꯃꯁꯤꯡꯒꯤ ꯃꯃꯜ ꯌꯥꯝꯅꯥ ꯋꯥꯡꯈꯤ ꯃꯗꯨꯅꯥ ꯃꯔꯝ ꯑꯣꯏꯔꯒꯥ ꯁꯦꯜ-ꯊꯨꯃꯒꯤ ꯑꯃꯁꯨꯡ ꯔꯥꯖꯅꯤꯇꯤꯒꯤ ꯑꯣꯏꯕꯥ ꯑꯋꯥꯕꯥ ꯑꯃꯥ ꯊꯣꯀꯍꯅꯈꯤ꯫
While the state also experienced a debt crisis the level of debt itself was not high compared with Britains,ꯔꯥꯖ꯭ꯌ ꯑꯁꯤꯅꯥ ꯁꯦꯟꯗꯣꯏꯒꯤ ꯀ꯭ꯔꯥꯏꯁꯤꯁ ꯑꯃꯁꯨ ꯊꯦꯡꯅꯈꯤꯕꯥ ꯃꯇꯃꯗꯥ ꯁꯦꯟꯗꯣꯏꯒꯤ ꯊꯥꯛ ꯑꯗꯨ ꯃꯁꯥꯃꯛ ꯕ꯭ꯔꯤꯇꯦꯅꯒꯥ ꯆꯥꯡꯗꯝꯅꯕꯗꯥ ꯋꯥꯡꯅꯥ ꯂꯩꯈꯤꯗꯦ .
A significant problem was that tax rates varied widely from one region to another were often different from the official amounts and were collected inconsistently,ꯃꯔꯨꯑꯣꯏꯕꯥ ꯁꯃꯁ꯭ꯌꯥ ꯑꯃꯗꯤ ꯇꯦꯛꯁꯀꯤ ꯆꯥꯡ ꯑꯁꯤ ꯂꯃꯗꯝ ꯑꯃꯗꯒꯤ ꯑꯇꯣꯞꯄꯥ ꯂꯃꯗꯝ ꯑꯃꯗꯥ ꯌꯥꯝꯅꯥ ꯈꯦꯠꯅꯩ ꯍꯥꯌꯕꯁꯤ ꯑꯌꯥꯝꯕꯅꯥ ꯑꯣꯐꯤꯁꯤꯑꯦꯜ ꯑꯣꯏꯕꯥ ꯁꯦꯅꯐꯃꯁꯤꯡꯗꯒꯤ ꯈꯦꯠꯅꯩ ꯑꯃꯁꯨꯡ ꯃꯈꯣꯌ ꯑꯁꯤ ꯂꯦꯞꯄꯥ ꯂꯩꯇꯅꯥ ꯈꯣꯃꯖꯤꯅꯈꯤ ꯫
Its complexity meant uncertainty over the amount contributed by any authorised tax caused resentment among all taxpayers,ꯃꯁꯤꯒꯤ ꯀꯝꯞꯂꯦꯛꯁ ꯑꯣꯏꯕꯥ ꯑꯁꯤꯅꯥ ꯑꯣꯊꯣꯔꯥꯏꯖ ꯇꯧꯔꯕꯥ ꯇꯦꯛꯁ ꯑꯃꯍꯦꯛꯇꯅꯥ ꯀꯟꯠꯔꯤꯕ꯭ꯌꯨꯠ ꯇꯧꯈꯤꯕꯥ ꯁꯦꯅꯐꯝ ꯑꯗꯨꯒꯤ ꯃꯇꯥꯡꯗꯥ ꯁꯣꯏꯗ-ꯉꯥꯃꯗꯕꯥ ꯍꯥꯌꯕꯗꯨ ꯑꯣꯏꯈꯤ ꯃꯗꯨꯅꯥ ꯇꯦꯛꯁꯄꯦꯌꯔ ꯄꯨꯝꯅꯃꯛꯀꯤ ꯃꯔꯛꯇꯥ ꯅꯨꯡꯉꯥꯏꯇꯕꯥ ꯄꯣꯀꯍꯅꯈꯤ
