en,mni-Mtei
"Social occupations frequently involve working with, communicating with, and teaching people. These","ꯁꯣꯁꯤꯑꯦꯜ ꯑꯣꯛꯌꯨꯄꯦꯁꯅꯁꯤꯡꯗꯥ ꯃꯤꯑꯣꯏ ꯑꯃꯒꯥ ꯊꯕꯛ ꯇꯧꯃꯤꯟꯅꯕꯥ, ꯄꯥꯎ ꯐꯥꯎꯗꯣꯛ-ꯐꯥꯎꯖꯤꯟ ꯇꯧꯕꯥ ꯑꯃꯁꯨꯡ ꯇꯝꯕꯤꯕꯥ ꯍꯥꯌꯕꯁꯤ ꯌꯥꯝꯅꯥ ꯇꯣꯏꯅꯥ ꯌꯥꯎꯏ꯫"
occupations often involve helping or providing service to others,ꯑꯣꯛꯌꯨꯄꯦꯁꯅꯁꯤꯡꯗꯥ ꯑꯌꯥꯝꯕꯅꯥ ꯃꯇꯦꯡ ꯄꯥꯡꯕꯥ ꯅꯠꯠꯔꯒꯥ ꯑꯇꯣꯞꯄꯁꯤꯡꯗꯥ ꯁꯔꯚꯤꯁ ꯄꯤꯕꯥ ꯑꯁꯤ ꯌꯥꯎꯏ .
"Likes to do things to help people -- like, teaching, nursing, or giving first aid, providing information;","ꯃꯤꯑꯣꯏꯕꯕꯨ ꯃꯇꯦꯡ ꯄꯥꯡꯅꯕꯥ ꯊꯕꯀꯁꯤꯡ ꯇꯧꯕꯥ ꯄꯥꯝꯃꯤ -- ꯍꯥꯌꯕꯗꯤ, ꯇꯝꯕꯤꯕꯥ, ꯅꯔꯁꯤꯡ, ꯅꯠꯠꯔꯒꯥ ꯐꯥꯔꯁ꯭ꯠ ꯑꯦꯗ ꯄꯤꯕꯥ, ꯏꯅꯐꯣꯔꯃꯦꯁꯟ ꯄꯤꯕꯥ;"
"generally avoids using machines, tools, or animals to achieve a goal;","ꯃꯍꯧꯁꯥꯅꯥ ꯄꯥꯟꯗꯝ ꯑꯃꯥ ꯐꯪꯅꯕꯥ ꯃꯦꯁꯤꯅꯁꯤꯡ, ꯈꯨꯠꯂꯥꯌꯁꯤꯡ ꯅꯠꯠꯔꯒꯥ ꯁꯥꯁꯤꯡ ꯁꯤꯖꯤꯟꯅꯕꯗꯒꯤ ꯂꯥꯞꯅꯥ ꯂꯩ;"
"Is good at teaching, counseling, nursing, or giving information;","ꯇꯝꯕꯤꯕꯥ, ꯀꯥꯎꯟꯁꯦꯂꯤꯡ ꯇꯧꯕꯥ, ꯅꯔꯁꯤꯡ ꯇꯧꯕꯥ ꯅꯠꯠꯔꯒꯥ ꯏꯅꯐꯣꯔꯃꯦꯁꯟ ꯄꯤꯕꯗꯥ ꯍꯩꯕꯥ;"
Values helping people and solving social problems; and,ꯃꯤꯑꯣꯏꯕꯕꯨ ꯃꯇꯦꯡ ꯄꯥꯡꯕꯥ ꯑꯃꯁꯨꯡ ꯈꯨꯟꯅꯥꯏꯒꯤ ꯑꯣꯏꯕꯥ ꯁꯃꯁ꯭ꯌꯥꯁꯤꯡ ꯀꯣꯀꯍꯅꯕꯗꯥ ꯚꯦꯜꯌꯨꯁꯤꯡ;
"Sees self as helpful, friendly, and trustworthy","ꯃꯁꯥꯕꯨ ꯃꯇꯦꯡ ꯄꯥꯡꯕꯤꯕꯥ, ꯃꯔꯨꯞ-ꯃꯄꯥꯡ ꯑꯣꯏꯕꯥ ꯑꯃꯁꯨꯡ ꯊꯥꯖꯕꯥ ꯌꯥꯕꯥ ꯑꯣꯏꯅꯥ ꯎꯏ꯫"
"Career Resource Network, ND Department of Career and Technical Education","ꯀꯦꯔꯤꯌꯔ ꯔꯤꯁꯣꯔꯁ ꯅꯦꯇꯋꯥꯔꯛ, ꯑꯦꯟ.ꯗꯤ.ꯒꯤ ꯀꯦꯔꯤꯌꯔ ꯑꯃꯁꯨꯡ ꯇꯦꯛꯅꯤꯀꯦꯜ ꯑꯦꯖꯨꯀꯦꯁꯟ ꯕꯤꯚꯥꯒ"
Enterprising – “Persuader”,ꯑꯦꯟꯇꯔꯞꯔꯥꯏꯖ ꯇꯧꯕꯥ – “ꯄꯥꯔꯁꯨꯗꯔ”
Enterprising occupations frequently involve starting and carrying out projects. These occupations can,ꯏꯟꯇꯔꯞꯔꯥꯏꯖ ꯑꯣꯏꯕꯥ ꯑꯣꯛꯌꯨꯄꯦꯁꯅꯁꯤꯡꯗꯥ ꯄ꯭ꯔꯣꯖꯦꯛꯇꯁꯤꯡ ꯍꯧꯕꯥ ꯑꯃꯁꯨꯡ ꯄꯥꯡꯊꯣꯀꯄꯗꯥ ꯆꯥꯡ ꯅꯥꯏꯅꯥ ꯌꯥꯎꯏ꯫
involve leading people and making decisions. Sometimes they require risk taking and often deal with,ꯃꯤꯑꯣꯏꯁꯤꯡꯕꯨ ꯂꯨꯆꯤꯡꯕꯥ ꯑꯃꯁꯨꯡ ꯋꯥꯔꯦꯞ ꯂꯧꯕꯥ ꯁꯔꯨꯛ ꯌꯥꯍꯅꯕꯥ꯫
business,ꯀꯥꯔꯕꯥꯔ
"Likes to lead and persuade people, and to sell things and ideas; generally avoids activities that","ꯃꯤꯑꯣꯏꯕꯕꯨ ꯂꯨꯆꯤꯡꯕꯥ ꯑꯃꯁꯨꯡ ꯇꯀꯁꯤꯅꯕꯥ ꯄꯥꯝꯃꯤ, ꯑꯃꯁꯨꯡ ꯄꯣꯠꯁꯤꯡ ꯑꯃꯁꯨꯡ ꯋꯥꯈꯜꯂꯣꯅꯁꯤꯡ ꯌꯣꯅꯕꯥ ꯄꯥꯝꯃꯤ;"
"require careful observation and scientific, analytical thinking;","ꯆꯦꯀꯁꯤꯟꯅꯥ ꯌꯦꯡꯁꯤꯅꯕꯥ ꯑꯃꯁꯨꯡ ꯁꯥꯏꯟꯇꯤꯐꯤꯛ ꯑꯣꯏꯕꯥ, ꯑꯦꯅꯥꯂꯥꯏꯇꯤꯀꯦꯜ ꯑꯣꯏꯕꯥ ꯋꯥꯈꯜꯂꯣꯟ ꯃꯊꯧ ꯇꯥꯏ;"
Is good at leading people and selling things or ideas;,ꯃꯤꯑꯣꯏꯕꯕꯨ ꯂꯨꯆꯤꯡꯕꯗꯥ ꯑꯃꯁꯨꯡ ꯄꯣꯠꯁꯤꯡ ꯅꯠꯠꯔꯒꯥ ꯋꯥꯈꯜꯂꯣꯅꯁꯤꯡ ꯌꯣꯅꯕꯥ ꯑꯁꯤ ꯍꯩꯕꯥ;
"Values success in politics, leadership, or business; and","ꯔꯥꯖꯅꯤꯇꯤ, ꯂꯨꯆꯤꯡꯕꯒꯤ ꯅꯠꯔꯒꯥ ꯂꯂꯣꯟ-ꯏꯇꯤꯛꯇꯥ ꯃꯥꯌ ꯄꯥꯀꯄꯒꯤ ꯃꯃꯜ ꯄꯤꯔꯤ;"
"Sees self as energetic, ambitious, and sociable","ꯁꯦꯜꯐ ꯑꯁꯤ ꯏꯅꯔꯖꯤ ꯂꯩꯕꯥ, ꯑꯦꯝꯕꯤꯁꯤꯌꯁ ꯑꯃꯁꯨꯡ ꯁꯣꯁꯤꯑꯦꯕꯜ ꯑꯣꯏꯅꯥ ꯎꯔꯤ"
Conventional – “Organizer”,ꯀꯟꯚꯦꯟꯁꯅꯦꯜ – “ꯑꯣꯔꯒꯥꯅꯥꯏꯖꯔ”
Conventional occupations frequently involve following set procedure and routines. These occupations,ꯀꯟꯚꯦꯟꯁꯅꯦꯜ ꯑꯣꯛꯌꯨꯄꯦꯁꯅꯁꯤꯡꯗꯥ ꯂꯦꯞꯄꯥ ꯂꯩꯇꯅꯥ ꯆꯠꯅꯔꯤꯕꯥ ꯄ꯭ꯔꯣꯁꯤꯗ꯭ꯌꯨꯑꯣꯔ ꯑꯃꯁꯨꯡ ꯔꯨꯇꯤꯅꯁꯤꯡ ꯑꯁꯤ ꯌꯥꯝꯅꯥ ꯇꯣꯏꯅꯥ ꯌꯥꯎꯏ꯫
can include working with data and details more than ideas. Usually there is a clear line of authority to,ꯗꯦꯇꯥ ꯑꯃꯁꯨꯡ ꯑꯀꯨꯞꯄꯥ ꯃꯔꯣꯂꯁꯤꯡꯒꯥ ꯂꯣꯌꯅꯅꯥ ꯊꯕꯛ ꯇꯧꯕꯥ ꯑꯁꯤ ꯋꯥꯈꯜꯂꯣꯅꯁꯤꯡꯗꯒꯤ ꯍꯦꯟꯅꯥ ꯌꯥꯑꯣꯕꯥ ꯌꯥꯏ꯫
follow,ꯇꯨꯡ ꯏꯅꯕ
"Likes to work with numbers, records, or machines in a set, orderly way; generally avoids ambiguous,","ꯁꯦꯠ ꯑꯃꯗꯥ, ꯑꯣꯔꯗꯔ ꯇꯧꯔꯕꯥ ꯃꯑꯣꯡꯗꯥ ꯅꯝꯕꯔ, ꯔꯦꯀꯣꯔꯗ ꯅꯠꯠꯔꯒꯥ ꯃꯦꯁꯤꯅꯁꯤꯡꯒꯥ ꯂꯣꯌꯅꯅꯥ ꯊꯕꯛ ꯇꯧꯕꯥ ꯄꯥꯝꯃꯤ;"
unstructured activities,ꯑꯅꯁ꯭ꯠꯔꯀꯆꯔꯒꯤ ꯊꯕꯛ ꯊꯧꯔꯃꯁꯤꯡ .
"Is good at working with written records and numbers in a systematic, orderly way;","ꯑꯁꯤ ꯁꯤꯁ꯭ꯇꯦꯃꯦꯇꯤꯛ ꯑꯣꯏꯕꯥ, ꯑꯣꯔꯗꯔ ꯇꯧꯔꯕꯥ ꯃꯑꯣꯡꯗꯥ ꯑꯏꯕꯥ ꯔꯦꯀꯣꯔꯗꯁꯤꯡ ꯑꯃꯁꯨꯡ ꯅꯝꯕꯔꯁꯤꯡꯒꯥ ꯂꯣꯌꯅꯅꯥ ꯊꯕꯛ ꯇꯧꯕꯗꯥ ꯍꯩꯕꯥ;"
Values success in business; and,ꯕꯤꯖꯤꯅꯦꯁꯇꯥ ꯃꯥꯌ ꯄꯥꯀꯄꯒꯤ ꯚꯦꯜꯌꯨꯁꯤꯡ;
"Sees self as orderly, and good at following a set plan","ꯁꯦꯜꯐ ꯑꯁꯤ ꯑꯣꯔꯗꯔ ꯑꯣꯏꯅꯥ ꯎꯕꯥ ꯐꯪꯏ, ꯑꯃꯁꯨꯡ ꯁꯦꯠ ꯄ꯭ꯂꯥꯟ ꯑꯃꯥ ꯉꯥꯛꯅꯥ ꯆꯠꯄꯗꯥ ꯍꯩꯕꯥ ."
What is your Holland Personality Type?,ꯅꯍꯥꯛꯀꯤ ꯍꯣꯂꯟꯗ ꯄꯔꯁꯣꯅꯦꯂꯤꯇꯤ ꯃꯈꯜ ꯑꯗꯨ ꯀꯔꯤꯅꯣ?
Log in to your www.RUReady.ND.gov account to take the Interest Profiler:,ꯏꯟꯇꯔꯦꯁ꯭ꯠ ꯄ꯭ꯔꯣꯐꯥꯏꯂꯔ ꯂꯧꯅꯕꯥ ꯅꯍꯥꯛꯀꯤ www.ruready.nd.gov ꯑꯦꯀꯥꯎꯟꯇꯇꯥ ꯂꯣꯒ ꯏꯟ ꯇꯧꯕꯤꯌꯨ:
Click the Career Planning tab,ꯀꯦꯔꯤꯌꯔ ꯄ꯭ꯂꯥꯅꯤꯡ ꯇꯦꯕ ꯑꯗꯨꯗꯥ ꯀ꯭ꯂꯤꯛ ꯇꯧꯔꯣ
Click the Learn about Yourself link,ꯂꯔꯟ ꯑꯦꯖ ꯑꯣꯐ ꯏꯎꯔꯁꯦꯜꯗ ꯂꯤꯉ꯭ꯛ ꯑꯗꯨꯗꯥ ꯀ꯭ꯂꯤꯛ ꯇꯧꯕꯤꯌꯨ
Click Interest Profiler,ꯏꯟꯇꯔꯦꯁ꯭ꯠ ꯄ꯭ꯔꯣꯐꯥꯏꯂꯔ ꯀ꯭ꯂꯤꯛ ꯇꯧꯔꯣ .
or,ꯅꯠꯇ꯭ꯔꯒ
The O*NET Interest Profiler can help you find out www.mynextmove.org/explore/ip,ꯑꯣ*ꯅꯦꯠ ꯏꯟꯇꯔꯦꯁ꯭ꯠ ꯄ꯭ꯔꯣꯐꯥꯏꯂꯔ ꯑꯁꯤꯅꯥ ꯑꯗꯣꯃꯗꯥ www.mynextmove.org/explore/ip ꯈꯉꯕꯗꯥ ꯃꯇꯦꯡ ꯄꯥꯡꯒꯅꯤ꯫
--- 16. Adolescent Mental Health Time For Action (Article) Author UNICEF.pdf ---,--- 16. ꯏꯅꯈꯠꯂꯛꯂꯤꯕꯥ ꯃꯦꯟꯇꯦꯜ ꯍꯦꯜꯊ ꯇꯥꯏꯝ ꯐꯣꯔ ꯑꯦꯛꯁꯟ (ꯑꯥꯔꯇꯤꯀꯜ) ꯑꯣꯊꯣꯔ ꯌꯨꯅꯤꯁꯦꯐ.ꯄꯤ.ꯗꯤ.ꯑꯦꯐ. ---
KNOWLEDGE SUMMARY:,ꯅꯣꯂꯦꯖꯒꯤ ꯋꯥꯔꯣꯜ:
"WOMEN’S, CHILDREN’S AND ADOLESCENTS’ HEALTH","ꯅꯨꯄꯤꯁꯤꯡ, ꯑꯉꯥꯡꯁꯤꯡ ꯑꯃꯁꯨꯡ ꯏꯅꯈꯠꯂꯛꯂꯤꯕꯁꯤꯡꯒꯤ ꯍꯀꯁꯦꯜ"
2019,꯲꯰꯱꯹ꯗꯥ ꯊꯣꯀꯈꯤ꯫
ADOLESCENT MENTAL HEALTH:,ꯑꯦꯗꯣꯂꯁꯦꯟꯇ ꯃꯦꯟꯇꯦꯜ ꯍꯦꯂꯊ:
TIME FOR ACTION,ꯑꯦꯛꯁꯅꯒꯤ ꯃꯇꯝ
Every adolescent has a right to mental health. Promotion and protection of mental health can,ꯏꯅꯈꯠꯂꯛꯂꯤꯕꯥ ꯃꯤꯑꯣꯏ ꯈꯨꯗꯤꯡꯃꯛꯅꯥ ꯃꯦꯟꯇꯦꯜ ꯍꯦꯂꯊꯀꯤ ꯍꯛ ꯂꯩ꯫
"improve quality of life, strengthen human capital, contribute to socioeconomic development and lead","ꯄꯨꯟꯁꯤꯒꯤ ꯃꯒꯨꯟ ꯐꯒꯠꯍꯅꯕꯥ, ꯃꯤꯑꯣꯏꯕꯒꯤ ꯀꯦꯄꯤꯇꯦꯜ ꯃꯄꯥꯉ꯭ꯒꯜ ꯀꯅꯈꯠꯍꯅꯕꯥ, ꯁꯣꯁꯤꯑꯣ-ꯏꯀꯣꯅꯣꯃꯤꯛ ꯗꯤꯕꯦꯂꯄꯃꯦꯟꯇꯗꯥ ꯃꯇꯦꯡ ꯄꯥꯡꯕꯥ ꯑꯃꯁꯨꯡ ꯂꯨꯆꯤꯡꯕꯥ"
"to a more equitable world.(1) Although investment in early, effective intervention for the mental","ꯍꯦꯟꯅꯥ ꯃꯥꯟꯅꯕꯥ ꯃꯥꯂꯦꯝ ꯑꯃꯗꯥ꯫(꯱) ꯃꯦꯟꯇꯦꯜ ꯑꯣꯏꯅꯥ ꯉꯟꯅꯥ, ꯏꯐꯦꯛꯇꯤꯕ ꯑꯣꯏꯕꯥ ꯏꯟꯇꯔꯚꯦꯟꯁꯅꯗꯥ ꯏꯅꯚꯦꯁ꯭ꯇꯃꯦꯟꯇ ꯇꯧꯔꯕꯁꯨ"
"health of young people was identified as a “best buy” over a decade ago, current evidence suggests",ꯅꯍꯥ ꯑꯣꯏꯔꯤꯕꯥ ꯃꯤꯑꯣꯏꯁꯤꯡꯒꯤ ꯍꯀꯁꯦꯜ ꯑꯁꯤ ꯆꯍꯤ ꯇꯔꯥꯒꯤ ꯈꯨꯖꯤꯡ ꯑꯃꯥ ꯍꯦꯟꯅꯥ ꯃꯃꯥꯡꯗꯥ “ꯈ꯭ꯕꯥꯏꯗꯒꯤ ꯐꯕꯥ ꯌꯣꯅꯕꯥ” ꯑꯃꯥ ꯑꯣꯏꯅꯥ ꯈꯉꯗꯣꯀꯈꯤ ꯍꯥꯌꯅꯥ ꯍꯧꯖꯤꯛ ꯂꯩꯔꯤꯕꯥ ꯄ꯭ꯔꯃꯥꯅꯁꯤꯡꯅꯥ ꯇꯥꯛꯂꯤ
"that adolescent mental health remains a neglected yet pressing issue.(2,3) The burden of suboptimal","ꯑꯗꯨꯒꯨꯝꯕꯥ ꯏꯅꯈꯠꯂꯛꯂꯤꯕꯥ ꯃꯦꯟꯇꯦꯜ ꯍꯦꯜꯊ ꯑꯗꯨ ꯌꯦꯡꯁꯤꯅꯕꯤꯗꯕꯥ ꯑꯗꯨꯕꯨ ꯌꯥꯝꯅꯥ ꯅꯨꯡꯉꯥꯏꯇꯕꯥ ꯋꯥꯐꯝ ꯑꯃꯥ ꯑꯣꯏꯗꯨꯅꯥ ꯂꯩꯔꯤ꯫(꯲,꯳) ꯁꯕ-ꯑꯣꯞꯇꯤꯃꯥꯂꯒꯤ ꯄꯣꯠꯂꯨꯝ"
"mental health is enormous both during adolescence and into adulthood, and it also influences the","ꯃꯦꯟꯇꯦꯜ ꯍꯦꯜꯊ ꯑꯁꯤ ꯏꯅꯈꯠꯂꯀꯄꯥ ꯃꯇꯃꯗꯥ ꯑꯃꯁꯨꯡ ꯑꯍꯜ ꯑꯣꯏꯔꯀꯄꯒꯤ ꯃꯇꯃꯗꯥ ꯌꯥꯝꯅꯥ ꯆꯥꯎꯏ, ꯑꯃꯁꯨꯡ ꯃꯁꯤꯅꯥ ."
"next generation.(4,5) This knowledge summary calls for increased attention to and action on","ꯃꯊꯪꯒꯤ ꯃꯤꯔꯣꯂꯗꯥ꯫(꯴,꯵) ꯃꯁꯤꯒꯤ ꯅꯣꯂꯦꯖ ꯁꯥꯃꯔꯤ ꯑꯁꯤꯅꯥ ꯍꯦꯟꯅꯥ ꯄꯨꯛꯅꯤꯡ ꯆꯪꯕꯥ ꯑꯃꯁꯨꯡ ꯊꯕꯛ ꯄꯥꯌꯈꯠꯅꯕꯥ ꯍꯥꯌꯔꯤ꯫"
"adolescent mental health, where everyone has a role to play","ꯑꯦꯗꯣꯂꯁꯦꯟꯇ ꯃꯦꯟꯇꯦꯜ ꯍꯦꯜꯊ, ꯃꯐꯝ ꯑꯗꯨꯗꯥ ꯃꯤꯄꯨꯝ ꯈꯨꯗꯤꯡꯃꯛꯅꯥ ꯊꯧꯗꯥꯡ ꯂꯧꯒꯗꯕꯥ ꯊꯧꯗꯥꯡ ꯑꯃꯥ ꯂꯩꯔꯤ꯫"
Why should we pay attention to adolescent mental health?,ꯀꯔꯤꯒꯤꯗꯃꯛꯇꯥ ꯑꯩꯈꯣꯌꯅꯥ ꯏꯅꯈꯠꯂꯛꯂꯤꯕꯥ ꯃꯦꯟꯇꯦꯜ ꯍꯦꯜꯊꯇꯥ ꯄꯨꯛꯅꯤꯡ ꯆꯪꯒꯗꯒꯦ?
"Mental health conditions, such as depression and anxiety, account for 16% of the global burden of disease",ꯗꯤꯞꯔꯦꯁꯟ ꯑꯃꯁꯨꯡ ꯑꯦꯟꯁꯤꯇꯤꯒꯨꯝꯕꯥ ꯃꯦꯟꯇꯦꯜ ꯍꯦꯜꯊ ꯀꯟꯗꯤꯁꯅꯁꯤꯡꯅꯥ ꯃꯥꯂꯦꯃꯒꯤ ꯑꯣꯏꯅꯥ ꯂꯥꯌꯅꯥ ꯑꯁꯤꯒꯤ ꯄꯣꯠꯂꯨꯝ ꯱꯶% ꯑꯣꯏꯔꯤ
"and injury (measured by DALYs*) among the world’s 1.2 billion adolescents (aged 10-19 years).(4,6,7) It is","ꯑꯃꯁꯨꯡ ꯃꯥꯂꯦꯃꯒꯤ ꯏꯅꯈꯠꯂꯛꯂꯤꯕꯥ ꯃꯤꯑꯣꯏ ꯕꯤꯂꯤꯌꯟ ꯱.꯲ (ꯆꯍꯤ ꯱꯰-꯱꯹)ꯒꯤ ꯃꯅꯨꯡꯗꯥ ꯑꯁꯣꯛ-ꯑꯄꯟ (ꯗꯥꯂꯤꯁ*ꯅꯥ ꯃꯥꯄꯜ)꯫(꯴,꯶,꯷) ꯃꯁꯤꯅꯤ꯫"
"estimated that 10 to 20% of adolescents experience mental health conditions, and a significant number of","ꯏꯅꯈꯠꯂꯛꯂꯤꯕꯁꯤꯡꯒꯤ ꯃꯅꯨꯡꯗꯥ 10ꯗꯒꯤ 20% ꯐꯥꯎꯕꯗꯤ ꯃꯦꯟꯇꯦꯜ ꯍꯦꯂꯊ ꯀꯟꯗꯤꯁꯅꯁꯤꯡ ꯊꯦꯡꯅꯩ ꯍꯥꯌꯅꯥ ꯄꯥꯅꯔꯤ, ꯑꯃꯁꯨꯡ ꯃꯁꯤꯡ ꯌꯥꯝꯂꯕꯥ ꯃꯁꯤꯡ ꯑꯁꯤ ."
others experience symptoms that have a negative effect on their well-being.(8) Poor adolescent mental health,ꯑꯇꯣꯞꯄꯁꯤꯡꯅꯥ ꯃꯈꯣꯌꯒꯤ ꯌꯥꯏꯐ-ꯊꯧꯔꯥꯡꯗꯥ ꯅꯦꯒꯦꯇꯤꯚ ꯏꯐꯦꯛꯇ ꯄꯤꯕꯥ ꯂꯥꯏꯑꯣꯡꯁꯤꯡ ꯊꯦꯡꯅꯩ꯫(8) ꯏꯅꯈꯠꯂꯛꯂꯤꯕꯥ ꯏꯅꯈꯠꯂꯛꯂꯤꯕꯁꯤꯡꯒꯤ ꯃꯦꯟꯇꯦꯜ ꯍꯦꯂꯊ
"is also associated with higher risk of injuries and substance use, affecting the quality and length of life.(9)","ꯑꯁꯤ ꯑꯁꯣꯛ-ꯑꯄꯟ ꯑꯃꯁꯨꯡ ꯄꯣꯠꯁꯀꯁꯤꯡ ꯁꯤꯖꯤꯟꯅꯕꯒꯤ ꯔꯤꯁ꯭ꯛ ꯍꯦꯟꯅꯥ ꯂꯩꯕꯒꯥ ꯃꯔꯤ ꯂꯩꯅꯩ, ꯃꯁꯤꯅꯥ ꯄꯨꯟꯁꯤꯒꯤ ꯃꯒꯨꯟ ꯑꯃꯁꯨꯡ ꯂꯝꯕꯤꯗꯥ ꯑꯀꯥꯌꯕꯥ ꯄꯤꯔꯤ꯫(꯹)"
"Particularly vulnerable adolescents include those living with disabilities or chronic illnesses (e.g. HIV), those","ꯃꯔꯨꯑꯣꯏꯅꯥ ꯈꯨꯗꯣꯡꯊꯤꯅꯤꯉꯥꯏ ꯑꯣꯏꯕꯥ ꯏꯅꯈꯠꯂꯛꯂꯤꯕꯁꯤꯡꯒꯤ ꯃꯅꯨꯡꯗꯥ ꯗꯤꯁꯑꯦꯕꯜ ꯑꯣꯏꯔꯕꯥ ꯅꯠꯠꯔꯒꯥ ꯀ꯭ꯔꯣꯅꯤꯛ ꯂꯥꯌꯅꯥꯁꯤꯡ (e.g. HIV) ꯂꯩꯕꯥ ꯃꯤꯑꯣꯏꯁꯤꯡ, ꯃꯈꯣꯌꯗꯨ"
"who are stigmatized and marginalized because of sexual orientation, gender identity or ethnicity, and those","ꯁꯦꯛꯁꯨꯑꯦꯜ ꯑꯣꯔꯦꯟꯇꯤꯅꯦꯁꯟ, ꯖꯦꯟꯗꯔ ꯑꯥꯏꯗꯦꯟꯇꯤꯇꯤ ꯅꯠꯠꯔꯒꯥ ꯏꯊꯅꯤꯛ, ꯑꯃꯁꯨꯡ ꯃꯈꯣꯌꯗꯨꯒꯤ ꯃꯔꯃꯗꯥ ꯋꯥꯔꯤ-ꯋꯥꯇꯥꯏ ꯁꯥꯕꯥ ꯑꯃꯁꯨꯡ ꯁꯣꯠꯊꯔꯕꯥ ꯃꯤꯑꯣꯏꯁꯤꯡ꯫"
"exposed to violence, living in poverty or in humanitarian, fragile and vulnerable settings.(9)","ꯍꯤꯡꯁꯥ, ꯂꯥꯌꯔꯕꯥ ꯅꯠꯠꯔꯒꯥ ꯍ꯭ꯌꯨꯃꯦꯅꯤꯇꯔꯤꯌꯥꯟ, ꯐ꯭ꯔꯦꯏꯖ ꯑꯣꯏꯕꯥ ꯑꯃꯁꯨꯡ ꯈꯨꯗꯣꯡꯊꯤꯅꯤꯉꯥꯏ ꯑꯣꯏꯕꯥ ꯁꯦꯇꯤꯡꯁꯤꯡꯗꯥ ꯂꯩꯕꯥ꯫(9)"
36,꯳꯶ .
"* Disability adjusted life years (DALYs) is the number of years lost due to ill-health, disability or early death","* ꯗꯤꯁꯑꯦꯕꯤꯂꯤꯇꯤ ꯑꯦꯗꯖꯁ꯭ꯠ ꯇꯧꯔꯕꯥ ꯂꯥꯏꯐ ꯏꯌꯔꯁ (DALYS) ꯍꯥꯌꯕꯁꯤ ꯑꯅꯥꯕꯥ, ꯗꯤꯁꯑꯦꯕꯤꯂꯤꯇꯤ ꯅꯠꯠꯔꯒꯥ ꯉꯟꯅꯥ ꯁꯤꯕꯅꯥ ꯃꯔꯝ ꯑꯣꯏꯗꯨꯅꯥ ꯃꯥꯡꯈꯤꯕꯥ ꯆꯍꯤꯁꯤꯡꯒꯤ ꯃꯁꯤꯡꯅꯤ꯫"
Hosted by the World Health Organization,ꯋꯥꯔꯜꯗ ꯍꯦꯜꯊ ꯑꯣꯔꯒꯅꯥꯏꯖꯦꯁꯟꯅꯥ ꯍꯣꯁ꯭ꯠ ꯇꯧꯕꯥ
Photo: © UNICEF/INDA2010-00698/Pirozzi,ꯐꯣꯇꯣ: © unicef/inda2010-00698/ꯄꯤꯔꯣꯖꯤ
Many mental health conditions commonly emerge during adolescence,ꯏꯅꯈꯠꯂꯀꯄꯥ ꯃꯇꯃꯗꯥ ꯃꯍꯧꯁꯥꯅꯥ ꯃꯦꯟꯇꯦꯜ ꯍꯦꯂꯊ ꯀꯟꯗꯤꯁꯟ ꯀꯌꯥ ꯂꯥꯀꯏ
"Globally, anxiety and depression are among the leading causes of illness","ꯃꯥꯂꯦꯃꯒꯤ ꯑꯣꯏꯅꯥ, ꯋꯥꯈꯜ ꯋꯥꯕꯥ ꯑꯃꯁꯨꯡ ꯋꯥꯈꯜ ꯅꯨꯡꯉꯥꯏꯇꯕꯥ ꯑꯁꯤ ꯑꯅꯥꯕꯒꯤ ꯃꯔꯨꯑꯣꯏꯕꯥ ꯃꯔꯃꯁꯤꯡꯒꯤ ꯃꯅꯨꯡꯗꯥ ꯑꯃꯅꯤ"
"and disability among adolescents, with higher rates among adolescent","ꯑꯃꯁꯨꯡ ꯏꯅꯈꯠꯂꯛꯂꯤꯕꯁꯤꯡꯒꯤ ꯃꯔꯛꯇꯥ ꯗꯤꯁꯑꯦꯕꯤꯂꯤꯇꯤ ꯂꯩꯕꯥ, ꯏꯅꯈꯠꯂꯛꯂꯤꯕꯁꯤꯡꯒꯤ ꯃꯔꯛꯇꯥ ꯍꯦꯟꯅꯥ ꯋꯥꯡꯕꯥ ꯔꯦꯠ ꯂꯩꯕꯥ"
"girls.(4,9) At worst, depression and other mental health conditions can","ꯅꯨꯄꯤꯃꯆꯥꯁꯤꯡ꯫(꯴,꯹) ꯈ꯭ꯕꯥꯏꯗꯒꯤ ꯐꯠꯇꯕꯥ ꯃꯇꯃꯗꯥ, ꯗꯤꯞꯔꯦꯁꯟ ꯑꯃꯁꯨꯡ ꯑꯇꯣꯞꯄꯥ ꯃꯦꯟꯇꯦꯜ ꯍꯦꯜꯊ ꯀꯟꯗꯤꯁꯅꯁꯤꯡ ."
lead to self-harm and suicide.(10) Most recent statistics show that in,ꯃꯁꯥꯅꯥ ꯃꯁꯥꯕꯨ ꯁꯣꯀꯆꯕꯥ ꯑꯃꯁꯨꯡ ꯃꯁꯥꯅꯥ ꯃꯁꯥꯕꯨ ꯁꯤꯖꯕꯒꯤ ꯊꯧꯑꯣꯡ (10) ꯈ꯭ꯕꯥꯏꯗꯒꯤ ꯅꯧꯕꯥ ꯁ꯭ꯇꯦꯇꯤꯁ꯭ꯇꯤꯀꯦꯂꯁꯤꯡꯅꯥ ꯇꯥꯛꯂꯤ ꯃꯗꯨꯗꯤ
"2016 over 60,000 adolescent deaths were due to suicide.(7) Overall,","꯲꯰꯱꯶ꯇꯥ ꯏꯅꯈꯠꯂꯛꯂꯤꯕꯥ ꯃꯤꯑꯣꯏ ꯶꯰,꯰꯰꯰ ꯍꯦꯟꯅꯥ ꯃꯁꯥꯅꯥ ꯃꯁꯥꯕꯨ ꯁꯤꯖꯕꯒꯤ ꯃꯔꯝ ꯑꯣꯏꯈꯤ꯫(꯷) ꯑꯄꯨꯅꯕꯥ ꯑꯣꯏꯅꯥ,"
the great majority of suicide deaths among adolescents occur in low-,ꯏꯅꯈꯠꯂꯛꯂꯤꯕꯁꯤꯡꯒꯤ ꯃꯔꯛꯇꯥ ꯁꯨꯏꯁꯥꯏꯗ ꯁꯤꯕꯒꯤ ꯑꯆꯧꯕꯥ ꯁꯔꯨꯛ ꯑꯁꯤ ꯂꯣ-
and middle-income countries.(4) Suicide was in the top five causes of,ꯑꯃꯁꯨꯡ ꯃꯤꯗꯜ ꯏꯅꯀꯃꯒꯤ ꯂꯩꯕꯥꯀꯁꯤꯡ꯫(꯴) ꯃꯁꯥꯅꯥ ꯃꯁꯥꯕꯨ ꯁꯤꯖꯕꯥ ꯑꯁꯤ ꯃꯀꯣꯛ ꯊꯣꯡꯕꯥ ꯃꯉꯥꯒꯤ ꯃꯅꯨꯡꯗꯥ ꯑꯣꯏꯈꯤ꯫
adolescent deaths in high-income countries and in low- and middle-,ꯁꯦꯟꯊꯣꯛ ꯌꯥꯝꯅꯥ ꯂꯩꯕꯥ ꯂꯩꯕꯥꯀꯁꯤꯡꯗꯥ ꯑꯃꯁꯨꯡ ꯂꯣ- ꯑꯃꯁꯨꯡ ꯃꯤꯗꯜ-ꯗꯥ ꯏꯅꯈꯠꯂꯛꯂꯤꯕꯤ ꯅꯨꯄꯤꯁꯤꯡꯅꯥ ꯁꯤꯍꯅꯕꯥ꯫
income countries in four of the six regions of the World Health,ꯃꯥꯂꯦꯃꯒꯤ ꯍꯀꯁꯦꯂꯒꯤ ꯂꯃꯗꯝ ꯶ꯀꯤ ꯃꯅꯨꯡꯗꯥ ꯃꯔꯤꯗꯥ ꯂꯩꯔꯤꯕꯥ ꯁꯦꯟꯊꯣꯛ ꯂꯩꯕꯥ ꯂꯩꯕꯥꯀꯁꯤꯡꯅꯥ ꯌꯨ.ꯑꯦꯁ.
"Organization (WHO).(7,9)","ꯑꯣꯔꯒꯅꯥꯏꯖꯦꯁꯟ (ꯗꯕꯜꯌꯨ.ꯑꯩꯆ.ꯑꯣ.)꯫(꯷,꯹)"
"As well as having a direct impact on adolescents, the consequences of","ꯏꯅꯈꯠꯂꯛꯂꯤꯕꯁꯤꯡꯗꯥ ꯍꯀꯊꯦꯡꯅꯅꯥ ꯏꯝꯄꯦꯛꯇ ꯇꯧꯕꯒꯥ ꯂꯣꯌꯅꯅꯥ, ꯃꯗꯨꯒꯤ ꯃꯍꯩ ꯑꯣꯏꯅꯥ ."
"poor adolescent mental health extend to adulthood, impairing both","ꯏꯅꯈꯠꯂꯛꯂꯤꯕꯁꯤꯡꯒꯤ ꯃꯦꯟꯇꯦꯜ ꯍꯦꯂꯊ ꯑꯁꯤ ꯃꯤꯔꯣꯜꯂꯤꯉꯩ ꯃꯇꯃꯗꯥ ꯍꯦꯟꯅꯥ ꯁꯥꯡꯗꯣꯀꯏ, ꯑꯅꯤꯃꯛ ꯑꯁꯤ ꯁꯣꯀꯍꯜꯂꯤ꯫"
"physical and mental health, and limiting social and economic","ꯐꯤꯖꯤꯀꯦꯜ ꯑꯃꯁꯨꯡ ꯃꯦꯟꯇꯦꯜ ꯍꯦꯂꯊ, ꯑꯃꯁꯨꯡ ꯁꯣꯁꯤꯑꯦꯜ ꯑꯃꯁꯨꯡ ꯏꯀꯣꯅꯣꯃꯤꯛ ꯂꯤꯃꯤꯠ ꯂꯩꯕꯥ"
"opportunities to live fulfilling lives.(4,11) The onset of 50% of adult","ꯃꯄꯨꯡ ꯐꯥꯕꯥ ꯄꯨꯟꯁꯤ ꯍꯤꯡꯅꯕꯒꯤ ꯈꯨꯗꯣꯡꯆꯥꯕꯁꯤꯡ꯫(꯴,꯱꯱) ꯑꯍꯜ ꯑꯣꯏꯔꯕꯥ ꯃꯤꯑꯣꯏꯁꯤꯡꯒꯤ ꯵꯰%ꯒꯤ ꯍꯧꯔꯀꯄꯥ"
"mental health conditions starts in the mid-teens, with 75% occurring by","ꯃꯦꯟꯇꯦꯜ ꯍꯦꯜꯊ ꯀꯟꯗꯤꯁꯅꯁꯤꯡ ꯑꯁꯤ ꯃꯤꯗ-ꯇꯤꯅꯁꯤꯡꯗꯥ ꯍꯧꯏ, ꯃꯁꯤꯒꯤ ꯃꯅꯨꯡꯗꯥ ꯷꯵%ꯗꯤ ꯊꯣꯀꯏ꯫"
the mid-20s.(12) Steps must be taken to enhance adolescents’ social,꯲꯰ꯒꯤ ꯃꯌꯥꯏꯗꯥ (꯱꯲) ꯏꯅꯈꯠꯂꯛꯂꯤꯕꯁꯤꯡꯒꯤ ꯁꯣꯁꯤꯑꯦꯜ ꯍꯦꯅꯒꯠꯍꯟꯅꯕꯥ ꯈꯣꯡꯊꯥꯡꯁꯤꯡ ꯂꯧꯈꯠꯀꯗꯕꯅꯤ꯫
and emotional skills and to promote enabling and nurturing environments,ꯑꯃꯁꯨꯡ ꯏꯃꯣꯁꯅꯦꯜ ꯁ꯭ꯀꯤꯂꯁꯤꯡ ꯑꯃꯁꯨꯡ ꯏꯅꯦꯕꯜ ꯑꯃꯁꯨꯡ ꯅꯔꯆꯔꯤꯡ ꯑꯦꯅꯚꯥꯏꯔꯅꯃꯦꯟꯇꯁꯤꯡ ꯄ꯭ꯔꯃꯣꯠ ꯇꯧꯅꯕꯥ
"in families, schools and communities. It is also crucial to recognize and","ꯏꯃꯨꯡ ꯃꯅꯨꯡ, ꯁ꯭ꯀꯨꯜ ꯑꯃꯁꯨꯡ ꯀꯝꯌꯨꯅꯤꯇꯤꯁꯤꯡꯗꯥ꯫"
"mitigate mental health issues early, and identify risk factors for future","ꯃꯦꯟꯇꯦꯜ ꯍꯦꯂꯊꯀꯤ ꯋꯥꯐꯃꯁꯤꯡ ꯉꯟꯅꯥ ꯍꯟꯊꯍꯅꯕꯥ, ꯑꯃꯁꯨꯡ ꯇꯨꯡꯒꯤ ꯑꯣꯏꯅꯥ ꯔꯤꯁ꯭ꯛ ꯐꯦꯛꯇꯔꯁꯤꯡ ꯈꯪꯗꯣꯀꯄꯥ"
"mental illness – including violence, neglect, abuse, school drop-out,","ꯋꯥꯈꯂꯒꯤ ꯑꯅꯥꯕꯥ – ꯍꯤꯡꯁꯥ, ꯃꯤꯄꯥꯏꯕꯥ, ꯃꯤꯍꯥꯠ-ꯃꯤꯄꯨꯟ, ꯁ꯭ꯀꯨꯜ ꯊꯥꯗꯣꯀꯄꯥ, ."
poverty and parental mental illness.(13),ꯂꯥꯌꯔꯕꯥ ꯑꯃꯁꯨꯡ ꯃꯃꯥ-ꯃꯄꯥꯒꯤ ꯋꯥꯈꯂꯒꯤ ꯑꯅꯥꯕꯥ꯫(꯱꯳)
Why is there underinvestment in adolescent,ꯀꯔꯤꯒꯤꯗꯃꯛꯇꯥ ꯏꯅꯈꯠꯂꯛꯂꯤꯕꯁꯤꯡꯗꯥ ꯑꯟꯗꯔꯏꯅꯚꯦꯁ꯭ꯇꯃꯦꯟꯇ ꯂꯩꯔꯤꯕꯅꯣ
mental health throughout the world?,ꯃꯥꯂꯦꯝ ꯄꯨꯝꯕꯗꯥ ꯃꯦꯟꯇꯦꯜ ꯍꯦꯜꯊ?
Although the overall burden of disease is lowest in young adolescents,ꯂꯥꯌꯅꯥ ꯑꯁꯤꯒꯤ ꯑꯄꯨꯅꯕꯥ ꯄꯣꯠꯂꯨꯝ ꯑꯁꯤ ꯅꯍꯥ ꯑꯣꯏꯔꯤꯕꯥ ꯏꯅꯈꯠꯂꯛꯂꯤꯕꯁꯤꯡꯗꯥ ꯈ꯭ꯕꯥꯏꯗꯒꯤ ꯅꯦꯝꯕꯥ ꯑꯣꯏꯔꯕꯁꯨ
"(aged 10-14 years), such data mask the importance of risk factors that","(ꯆꯍꯤ ꯱꯰-꯱꯴) (ꯆꯍꯤ ꯱꯰-꯱꯴), ꯑꯁꯤꯒꯨꯝꯕꯥ ꯗꯦꯇꯥ ꯑꯁꯤꯅꯥ ꯔꯤꯁ꯭ꯛ ꯐꯦꯛꯇꯔꯁꯤꯡꯒꯤ ꯃꯔꯨꯑꯣꯏꯕꯥ ꯑꯗꯨ ꯃꯥꯁ꯭ꯛ ꯇꯧꯏ꯫"
are adopted or consolidated during adolescence but have their health,ꯏꯅꯈꯠꯂꯀꯄꯥ ꯃꯇꯃꯗꯥ ꯑꯦꯗꯣꯞꯇ ꯇꯧꯕꯥ ꯅꯠꯠꯔꯒꯥ ꯀꯅꯁꯣꯂꯤꯗꯦꯠ ꯇꯧꯕꯥ ꯑꯗꯨꯕꯨ ꯃꯈꯣꯌꯒꯤ ꯍꯀꯁꯦꯜ ꯂꯩꯕꯥ
impacts later in life.(9) Taken together with the relative lack of public,ꯄꯨꯟꯁꯤꯒꯤ ꯃꯇꯨꯡꯗꯥ ꯂꯥꯀꯄꯥ ꯏꯝꯄꯦꯛꯇꯁꯤꯡ꯫(꯹) ꯃꯤꯌꯥꯃꯒꯤ ꯃꯔꯛꯇꯥ ꯌꯥꯝꯅꯥ ꯋꯥꯅꯥ ꯊꯣꯛꯇꯨꯅꯥ ꯂꯧꯈꯠꯄꯥ
"health attention to mental health, adolescent mental health has not","ꯃꯦꯟꯇꯦꯜ ꯍꯦꯜꯊꯇꯥ ꯍꯀꯁꯦꯂꯒꯤ ꯑꯣꯏꯕꯥ ꯃꯤꯠꯌꯦꯡ ꯆꯪꯕꯥ, ꯏꯅꯈꯠꯂꯛꯂꯤꯕꯥ ꯃꯦꯟꯇꯦꯜ ꯍꯦꯜꯊ"
"received the investment that it deserves, despite its enormous","ꯃꯁꯤꯒꯤ ꯌꯥꯝꯅꯥ ꯆꯥꯎꯕꯥ ꯃꯑꯣꯡꯗꯥ, ꯃꯁꯤꯒꯤ ꯃꯊꯧ ꯇꯥꯕꯥ ꯏꯅꯚꯦꯁ꯭ꯇꯃꯦꯟꯇ ꯑꯗꯨ ꯐꯪꯈꯤ"
"economic, social and personal burden. It has attracted little political","ꯏꯀꯣꯅꯣꯃꯤꯛ, ꯁꯣꯁꯤꯑꯦꯜ ꯑꯃꯁꯨꯡ ꯄꯔꯁꯣꯅꯦꯂꯒꯤ ꯄꯣꯠꯂꯨꯝ꯫"
"interest and limited funding in all income settings.(14) For example, in a","ꯏꯅꯀꯝ ꯁꯦꯇꯤꯡ ꯄꯨꯝꯅꯃꯛꯇꯥ ꯏꯟꯇꯔꯦꯁ꯭ꯠ ꯑꯃꯁꯨꯡ ꯂꯤꯃꯤꯇꯦꯗ ꯐꯟꯗꯤꯡ꯫(꯱꯴) ꯈꯨꯗꯝ ꯑꯣꯏꯅꯥ, ꯑꯦ."
sample of 132 low- and middle-income countries representing recipients,ꯔꯤꯁꯤꯄꯤꯌꯟꯇꯁꯤꯡꯒꯤ ꯃꯍꯨꯠ ꯁꯤꯜꯂꯤꯕꯥ ꯂꯣ- ꯑꯃꯁꯨꯡ ꯃꯤꯗꯜ-ꯏꯅꯀꯝ ꯂꯩꯕꯥꯛ ꯱꯳꯲ꯒꯤ ꯁꯦꯝꯄꯜ
"of US$ 24 billion (66%) of total Development Assistance for Health,","ꯍꯀꯁꯦꯂꯒꯤꯗꯃꯛꯇꯥ ꯑꯄꯨꯅꯕꯥ ꯗꯤꯕꯦꯂꯄꯃꯦꯟꯇ ꯑꯦꯁꯤꯁ꯭ꯇꯦꯟꯁꯀꯤ ꯌꯨ.ꯑꯦꯁ.ꯗꯣꯂꯔ ꯕꯤꯂꯤꯌꯟ ꯲꯴ (꯶꯶%)ꯒꯤ ꯃꯅꯨꯡꯗꯥ,"
spending on targeted assistance for young people aged 10-24 years,ꯆꯍꯤ 10-24ꯒꯤ ꯃꯅꯨꯡꯗꯥ ꯂꯩꯕꯥ ꯅꯍꯥꯁꯤꯡꯒꯤ ꯑꯣꯏꯅꯥ ꯄꯥꯟꯗꯝ ꯊꯝꯂꯤꯕꯥ ꯃꯇꯦꯡ ꯑꯗꯨꯗꯥ ꯆꯥꯗꯤꯡ ꯇꯧꯕꯥ
"was 2.2%, or US$ 528 million. Of this, adolescent mental health,","꯲.꯲% ꯑꯣꯏꯈꯤ, ꯅꯠꯔꯒꯥ ꯌꯨ.ꯑꯦꯁ.ꯗꯣꯂꯔ ꯃꯤꯂꯤꯌꯟ ꯵꯲꯸ ꯑꯣꯏꯈꯤ꯫"
"specifically depressive disorders and self-harm, was allocated around","ꯑꯀꯛꯅꯕꯥ ꯃꯑꯣꯡꯗꯥ ꯗꯤꯞꯔꯦꯁꯅꯒꯤ ꯗꯤꯁꯑꯣꯔꯗꯔꯁꯤꯡ ꯑꯃꯁꯨꯡ ꯁꯦꯜꯐ-ꯍꯥꯔꯝ, ꯑꯀꯣꯌꯕꯗꯥ ꯑꯦꯂꯣꯀꯦꯠ ꯇꯧꯈꯤ"
US$ 6 million (1.2%) – a miniscule amount compared to its,ꯌꯨ.ꯑꯦꯁ.ꯗꯣꯂꯔ ꯃꯤꯂꯤꯌꯟ ꯶ (꯱.꯲%) – ꯃꯁꯤꯒꯤ ꯃꯤꯅꯤꯁ꯭ꯀꯨꯜ ꯑꯦꯃꯥꯎꯟꯇ ꯑꯁꯤ ꯃꯁꯤꯒꯤ .
contribution to the adolescent health burden.(15) Mental health has,ꯑꯦꯗꯣꯂꯁꯦꯟꯇ ꯍꯦꯜꯊ ꯕꯣꯔꯗꯔꯗꯥ ꯀꯟꯠꯔꯤꯕ꯭ꯌꯨꯁꯟ ꯄꯤꯕꯥ꯫(꯱꯵) ꯃꯦꯟꯇꯦꯜ ꯍꯦꯜꯊꯅꯥ [...]
seen little financial and technical investment over the last decades.(5),ꯍꯧꯈꯤꯕꯥ ꯆꯍꯤ ꯇꯔꯥꯒꯤ ꯈꯨꯖꯤꯡ ꯀꯌꯥꯗꯒꯤ ꯁꯦꯜ-ꯊꯨꯃꯒꯤ ꯑꯃꯁꯨꯡ ꯇꯦꯛꯅꯤꯀꯦꯜ ꯏꯅꯚꯦꯁ꯭ꯇꯃꯦꯟꯇ ꯈꯔꯥ ꯎꯕꯥ ꯐꯪꯈꯤ꯫(꯵)
This inaction stems in part from the lack of knowledge about the,ꯃꯁꯤꯒꯤ ꯏꯅꯑꯦꯛꯁꯟ ꯑꯁꯤ ꯁꯔꯨꯛ ꯈꯔꯗꯤ ꯑꯦꯟ.ꯗꯤ.ꯑꯦ.
"cost-effectiveness of interventions, especially in low- and middle-","ꯏꯟꯇꯔꯚꯦꯟꯁꯅꯁꯤꯡꯒꯤ ꯃꯃꯜ-ꯃꯊꯨꯝ, ꯃꯔꯨꯑꯣꯏꯅꯥ ꯂꯣ- ꯑꯃꯁꯨꯡ ꯃꯤꯗꯜ-ꯗꯥ꯫"
income countries.(16),ꯁꯦꯟꯊꯣꯛ ꯂꯩꯕꯥ ꯂꯩꯕꯥꯀꯁꯤꯡ꯫(꯱꯶)
"Many countries are not well-prepared to deal with this “invisible”,","ꯂꯩꯕꯥꯛ ꯀꯌꯥꯅꯥ “ꯃꯌꯦꯛ ꯁꯦꯡꯅꯥ” ꯊꯦꯡꯅꯅꯕꯥ ꯌꯥꯝꯅꯥ ꯁꯦꯝ ꯁꯥꯗ꯭ꯔꯤ,"
stigmatized and often-ignored challenge. Mental health services as a,ꯁ꯭ꯇꯤꯒꯃꯥꯏꯖ ꯇꯧꯔꯕꯥ ꯑꯃꯁꯨꯡ ꯑꯌꯥꯝꯕꯅꯥ ꯏꯒꯅꯣꯔ ꯑꯣꯏꯕꯥ ꯆꯦꯂꯦꯟꯖ꯫
"whole, and for children and young people specifically, have long been","ꯑꯄꯨꯅꯕꯥ, ꯑꯃꯁꯨꯡ ꯑꯉꯥꯡꯁꯤꯡ ꯑꯃꯁꯨꯡ ꯅꯍꯥꯁꯤꯡꯒꯤ ꯑꯣꯏꯅꯥ ꯑꯀꯛꯅꯕꯥ ꯃꯑꯣꯡꯗꯥ, ꯃꯇꯝ ꯀꯌꯥꯒꯤ ꯃꯃꯥꯡꯗꯒꯤ ꯂꯩꯔꯛꯂꯕꯥ ."
