en,mni-Mtei
"velopment in young adulthood. Journal of Personality and Social Psychology, 84(3),",ꯅꯍꯥ ꯑꯣꯏꯔꯤꯕꯥ ꯑꯍꯜ ꯑꯣꯏꯔꯀꯄꯒꯤ ꯃꯇꯃꯗꯥ ꯚꯦꯂꯄꯃꯦꯟꯇ꯫
582-593,꯵꯸꯲-꯵꯹꯳ꯗꯥ ꯂꯩꯈꯤ꯫
"Roberts, B. W., Kuncel, N. R., Shiner, R., Caspi, A., & Goldberg, L. R. (2007). The power","ꯔꯕꯥꯔꯇꯁ, ꯕꯤ.ꯗꯕꯜꯌꯨ., ꯀꯨꯟꯁꯦꯜ, ꯑꯦꯟ.ꯑꯥꯔ., ꯁꯤꯅꯦꯔ, ꯑꯥꯔ., ꯀꯦꯁꯄꯤ, ꯑꯦ., ꯑꯃꯁꯨꯡ ꯒꯣꯜꯗꯕꯔꯒ, ꯑꯦꯜ.ꯑꯥꯔ.(꯲꯰꯰꯷)꯫"
"of personality: The comparative validity of personality traits, socioeconomic status,","ꯑꯣꯐ ꯄꯔꯁꯣꯅꯦꯂꯤꯇꯤ: ꯄꯔꯁꯣꯅꯦꯂꯤꯇꯤ ꯇ꯭ꯔꯦꯠꯁꯤꯡ, ꯁꯣꯁꯤꯑꯣ-ꯏꯀꯣꯅꯣꯃꯤꯛ ꯁ꯭ꯇꯦꯇꯁ,ꯒꯤ ꯀꯝꯄꯥꯔꯦꯇꯤꯕ ꯚꯦꯂꯤꯗꯤꯇꯤ,"
and cognitive ability for predicting important life outcomes. Perspectives on Psycho-,ꯑꯃꯁꯨꯡ ꯃꯔꯨꯑꯣꯏꯕꯥ ꯂꯥꯏꯐ ꯑꯥꯎꯠꯀꯃꯁꯤꯡ ꯂꯥꯎꯊꯣꯛꯅꯕꯒꯤꯗꯃꯛ ꯀꯣꯒꯅꯤꯇꯤꯕ ꯑꯦꯕꯤꯂꯤꯇꯤ ꯂꯩꯕꯥ꯫
"logical Science, 2, 313-345","ꯂꯣꯖꯤꯀꯦꯜ ꯁꯥꯏꯟꯁ, ꯲, ꯳꯱꯳-꯳꯴꯵ ꯂꯩ꯫"
"Roberts, B. W., & Mroczek, D. (2008). Personality trait change in adulthood. Current","ꯔꯕꯥꯔꯇꯁ, ꯕꯤ.ꯗꯕꯜꯌꯨ., ꯑꯃꯁꯨꯡ ꯃꯔꯣꯖꯦꯛ, ꯗꯤ.(꯲꯰꯰꯸)꯫"
"Directions in Psychological Science, 17, 31-35","ꯁꯥꯏꯀꯣꯂꯣꯖꯤꯀꯦꯜ ꯁꯥꯏꯟꯁꯇꯥ ꯗꯤꯔꯦꯛꯁꯅꯁꯤꯡ, ꯱꯷, ꯳꯱-꯳꯵"
"Shoda,Y., Mischel, W., & Wright, J. S. (1993). The role of situational demands and cog-","ꯁꯣꯗꯥ,ꯌ., ꯃꯤꯁꯦꯜ, ꯗꯕ꯭ꯂꯤꯎ., ꯑꯃꯁꯨꯡ ꯔꯥꯏꯠ, ꯖꯦ.ꯑꯦꯁ.(꯱꯹꯹꯳)꯫"
nitive competencies in behavior organization and personality coherence. Journal of,ꯕꯤꯍꯦꯕꯤꯌꯔ ꯑꯣꯔꯒꯥꯅꯥꯏꯖꯦꯁꯟ ꯑꯃꯁꯨꯡ ꯄꯔꯁꯣꯅꯦꯂꯤꯇꯤ ꯀꯣꯍꯔꯤꯟꯁꯇꯥ ꯅꯥꯏꯇꯤꯚ ꯀꯝꯄꯤꯇꯦꯟꯁꯤꯁꯤꯡ꯫
"Personality and Social Psychology, 65, 1023-1035","ꯄꯔꯁꯣꯅꯦꯂꯤꯇꯤ ꯑꯃꯁꯨꯡ ꯁꯣꯁꯤꯑꯦꯜ ꯁꯥꯏꯀꯣꯂꯣꯖꯤ, ꯶꯵, ꯱꯰꯲꯳-꯱꯰꯳꯵"
"Specht, J., Egloff, B., & Schmukle, S. C. (2011). Stability and change of personality","ꯁ꯭ꯄꯦꯆꯠ, ꯖꯦ., ꯑꯦꯒ꯭ꯂꯣꯐ, ꯕꯤ., ꯑꯃꯁꯨꯡ ꯁ꯭ꯕꯝꯌꯨꯀꯜ, ꯑꯦꯁ.ꯁꯤ.(꯲꯰꯱꯱)꯫"
across the life course: The impact of age and major life events on mean-level and,ꯂꯥꯏꯐ ꯀꯣꯔꯁꯀꯤ ꯃꯅꯨꯡꯗꯥ: ꯃꯤꯟ-ꯂꯦꯚꯦꯂꯗꯥ ꯆꯍꯤ ꯑꯃꯁꯨꯡ ꯑꯆꯧꯕꯥ ꯄꯨꯟꯁꯤꯒꯤ ꯊꯧꯗꯣꯀꯁꯤꯡꯒꯤ ꯏꯝꯄꯦꯛꯇ ꯑꯃꯁꯨꯡ
"rank-order stability of the Big Five. Journal of Personality and Social Psychology,",ꯕꯤꯒ ꯐꯥꯏꯕꯀꯤ ꯔꯦꯉ꯭ꯛ-ꯑꯣꯔꯗꯔ ꯁ꯭ꯇꯦꯕꯤꯂꯤꯇꯤ꯫
"101(4), 862-882","꯱꯰꯱(꯴), ꯸꯶꯲-꯸꯸꯲ ꯂꯩ꯫"
"Vazire, S., & Carlson, E. N. (2010). Self-knowledge of personality: Do people know them-","ꯋꯥꯖꯤꯔꯦ, ꯑꯦꯁ., ꯑꯃꯁꯨꯡ ꯀꯥꯔꯂꯁꯟ, ꯏ.ꯑꯦꯟ.(꯲꯰꯱꯰)꯫"
"selves? Social and Personality Psychology Compass, 4(8), 605-620",ꯃꯁꯥꯅꯥ ꯃꯁꯥꯕꯨ ꯊꯥꯖꯖꯕꯥ ꯃꯤꯑꯣꯏꯁꯤꯡ?
61,꯶꯱ ꯑꯃꯁꯨꯡ ꯑꯦꯟ.
A SIX-DAY UNIT LESSON PLAN FOR HIGH SCHOOL PSYCHOLOGY TEACHERS,ꯍꯥꯌꯔ ꯁ꯭ꯀꯨꯜ ꯁꯥꯏꯀꯣꯂꯣꯖꯤ ꯑꯣꯖꯥꯁꯤꯡꯒꯤꯗꯃꯛ ꯅꯨꯃꯤꯠ ꯶ꯅꯤꯒꯤ ꯌꯨꯅꯤꯠ ꯂꯦꯁꯟ ꯄ꯭ꯂꯥꯟ ꯑꯃꯥ
BACK TO  CONTENTS,ꯀꯟꯇꯦꯟꯇꯁꯤꯡꯗꯥ ꯍꯜꯂꯀꯎ
"Wilson, T. D. (2004). Strangers to ourselves. Cambridge: Harvard University Press","ꯋꯤꯂꯁꯟ, ꯇꯤ.ꯗꯤ.(꯲꯰꯰꯴) ꯑꯃꯁꯨꯡ ꯑꯦꯝ."
"Yarkoni, T., & Braver, T. S. (2010). Cognitive neuroscience approaches to individual","ꯌꯥꯔꯀꯣꯅꯤ, ꯇꯤ., ꯑꯃꯁꯨꯡ ꯕ꯭ꯔꯦꯚꯥꯔ, ꯇꯤ.ꯑꯦꯁ.(꯲꯰꯱꯰)꯫"
differences in working memory and executive control: Conceptual and methodologi-,ꯋꯥꯔꯀꯤꯡ ꯃꯦꯃꯣꯔꯤ ꯑꯃꯁꯨꯡ ꯑꯦꯀꯖꯤꯛꯌꯨꯇꯤꯕ ꯀꯟꯠꯔꯣꯂꯒꯤ ꯈꯦꯠꯅꯕꯥ: ꯀꯟꯁꯦꯄꯆꯨꯑꯦꯜ ꯑꯃꯁꯨꯡ ꯃꯦꯊꯣꯗꯣꯂꯣꯖꯤ-
"cal issues. In A. Gruszka, G. Matthews, & B. Szymura (Eds.), Handbook of individual",ꯀꯦꯜ ꯏꯁꯨꯁꯤꯡ꯫
"differences in cognition: Attention, memory, and executive control (pp. 87-107). New","ꯀꯣꯒꯅꯤꯁꯅꯒꯤ ꯈꯦꯠꯅꯕꯥ: ꯑꯦꯇꯦꯟꯁꯟ, ꯃꯦꯃꯣꯔꯤ, ꯑꯃꯁꯨꯡ ꯑꯦꯀꯖꯤꯛꯌꯨꯇꯤꯚ ꯀꯟꯠꯔꯣꯜ (ꯄꯦꯖ 87-107)꯫"
"York, NY: Springer Science + Business Media","ꯌꯣꯔꯛ, ꯑꯦꯟ.ꯋꯥꯏ.: ꯁ꯭ꯞꯔꯤꯡꯒꯥꯔ ꯁꯥꯏꯟꯁ + ꯕꯤꯖꯅꯦꯁ ꯃꯤꯗꯤꯌꯥ"
62,꯶꯲ ꯑꯃꯁꯨꯡ ꯑꯦꯟ.
PERSONALITY,ꯃꯤꯑꯣꯏ ꯑꯃꯒꯤ ꯃꯇꯤꯛ ꯃꯒꯨꯟ
BACK TO  CONTENTS,ꯀꯟꯇꯦꯟꯇꯁꯤꯡꯗꯥ ꯍꯜꯂꯀꯎ
APPENDIX A,ꯑꯦꯄꯦꯟꯗꯤꯛꯁ ꯑꯦ .
From the Psychoanalysis and Psychodynamic Psychology,ꯁꯥꯏꯀꯣꯑꯦꯅꯂꯤꯁꯤꯁ ꯑꯃꯁꯨꯡ ꯁꯥꯏꯀꯣꯗꯥꯏꯅꯥꯃꯤꯛ ꯁꯥꯏꯀꯣꯂꯣꯖꯤꯗꯒꯤ
TOPSS Unit Lesson Plan,ꯇꯞꯄꯁꯤꯡ ꯌꯨꯅꯤꯠ ꯂꯦꯁꯟ ꯄ꯭ꯂꯥꯟ .
Carl Jung,ꯀꯥꯔꯜ ꯖꯪ .
Carl Jung (1875-1961) began as a follower of Freud but thought Freud,ꯀꯥꯔꯜ ꯖꯪ (꯱꯸꯷꯵-꯱꯹꯶꯱) ꯑꯁꯤ ꯐ꯭ꯔꯣꯗꯀꯤ ꯐꯣꯂꯣꯋꯔ ꯑꯃꯥ ꯑꯣꯏꯅꯥ ꯍꯧꯈꯤ ꯑꯗꯨꯕꯨ ꯐ꯭ꯔꯣꯏꯗꯅꯥ ꯈꯅꯈꯤ
overemphasized sexual motivation. Jung was more interested in the influ-,ꯑꯣꯚꯔꯑꯣꯜ ꯑꯣꯏꯕꯥ ꯁꯦꯛꯁꯨꯑꯦꯜ ꯃꯣꯇꯤꯚꯦꯁꯟ꯫
"ence of the “collective unconscious,” a body of universal symbols and ex-","“ꯀꯂꯦꯛꯇꯤꯕ ꯑꯅꯀꯅꯁꯦꯟꯁ”ꯒꯤ ence, ꯌꯨꯅꯤꯚꯔꯁꯦꯜ ꯁꯤꯝꯕꯣꯂꯁꯤꯡ ꯑꯃꯁꯨꯡ ꯑꯦꯛꯁ-ꯒꯤ ꯍꯀꯆꯥꯡ ꯑꯃꯥ꯫"
periences he believed were passed through generations. Jungian psycho-,ꯃꯍꯥꯛꯅꯥ ꯊꯥꯖꯔꯝꯕꯥ ꯄꯦꯔꯤꯑꯦꯟꯁꯁꯤꯡ ꯑꯁꯤ ꯃꯤꯔꯣꯜ ꯀꯌꯥꯒꯤ ꯃꯔꯛꯇꯥ ꯆꯠꯈꯤꯕꯅꯤ꯫
analysts focus on interpreting the symbolic archetypes in patients’ dreams,ꯑꯦꯅꯥꯂꯥꯏꯇꯤꯛꯁꯁꯤꯡꯅꯥ ꯑꯅꯥꯕꯁꯤꯡꯒꯤ ꯁꯨꯞꯅꯒꯤ ꯁꯤꯝꯕꯣꯂꯤꯛ ꯑꯥꯔꯀꯤꯇꯦꯀꯆꯔꯁꯤꯡ ꯏꯟꯇꯔꯞꯔꯥꯏꯖ ꯇꯧꯕꯗꯥ ꯃꯤꯠꯌꯦꯡ ꯊꯝꯂꯤ
"and fantasies. Jung also believed females have an “animus,” or male side,",ꯑꯃꯁꯨꯡ ꯐꯦꯟꯁꯤꯖꯁꯤꯡ ꯌꯥꯑꯣꯔꯤ꯫
"and males have an “anima,” or female side. In addition, Jung emphasized",ꯑꯃꯁꯨꯡ ꯅꯨꯄꯥꯁꯤꯡꯗꯥ “ꯑꯦꯅꯤꯃꯥ” ꯅꯠꯔꯒꯥ ꯅꯨꯄꯤꯒꯤ ꯃꯐꯝ ꯑꯃꯥ ꯂꯩ꯫
"all humans have a “shadow,” the dark (evil) side of human nature","ꯃꯤꯑꯣꯏ ꯈꯨꯗꯤꯡꯃꯛꯀꯤ “ꯁꯦꯟꯗꯣ” ꯑꯃꯥ ꯂꯩ, ꯃꯤꯑꯣꯏꯕꯒꯤ ꯃꯍꯧꯁꯥꯒꯤ ꯑꯃꯝꯕꯥ (ꯐꯠꯇꯕꯥ) ꯃꯐꯝ ꯑꯃꯥ ꯂꯩ꯫"
Neo-Freudians,ꯅꯤꯑꯣ-ꯐ꯭ꯔꯤꯎꯗꯤꯌꯅꯁꯤꯡꯅꯥ ꯌꯨ.ꯑꯦꯁ.
"A. Alfred Adler (1870-1937) was an early follower of Freud, but he later","ꯑꯦ.ꯑꯦꯂꯐ꯭ꯔꯦꯗ ꯑꯦꯗꯂꯔ (꯱꯸꯷꯰-꯱꯹꯳꯷) ꯑꯁꯤ ꯐ꯭ꯔꯣꯗꯀꯤ ꯑꯍꯥꯅꯕꯥ ꯐꯣꯂꯣꯋꯔ ꯑꯃꯥ ꯑꯣꯏꯔꯝꯃꯤ, ꯑꯗꯨꯕꯨ ꯃꯍꯥꯛ ꯃꯇꯨꯡꯗꯥ"
founded his own distinct school of thought emphasizing the centrality,ꯁꯦꯟꯠꯔꯦꯂꯤꯇꯤꯗꯥ ꯑꯀꯅꯕꯥ ꯋꯥꯐꯝ ꯊꯝꯂꯤꯕꯥ ꯃꯍꯥꯛꯀꯤ ꯃꯁꯥꯒꯤ ꯑꯣꯏꯕꯥ ꯇꯣꯞ ꯇꯣꯞꯄꯥ ꯁ꯭ꯀꯨꯜ ꯑꯃꯥ ꯂꯤꯡꯈꯠꯈꯤ꯫
of inferiority feelings (the term “inferiority complex” derives from Adler),ꯏꯅꯐꯦꯔꯤꯑꯣꯔꯤꯇꯤ ꯐꯤꯜꯂꯤꯡꯁꯤꯡꯒꯤ (“ꯏꯟꯐꯦꯔꯤꯑꯣꯔꯤꯇꯤ ꯀꯃꯞꯂꯦꯛꯁ” ꯍꯥꯌꯕꯥ ꯋꯥꯍꯩ ꯑꯁꯤ ꯑꯦꯗꯂꯔꯗꯒꯤ ꯂꯧꯊꯣꯀꯏ)꯫
Adler believed an inferiority complex gives rise to the “drive for superior-,ꯑꯦꯗꯂꯔꯅꯥ ꯊꯥꯖꯈꯤ ꯃꯗꯨꯗꯤ ꯏꯅꯐꯦꯔꯤꯑꯣꯔꯤꯇꯤ ꯀꯃꯞꯂꯦꯛꯁ ꯑꯃꯅꯥ “ꯁꯨꯄꯤꯔꯤꯌꯔꯒꯤꯗꯃꯛꯇꯥ ꯗ꯭ꯔꯥꯏꯕ ꯑꯁꯤ ꯄꯤꯔꯤ-
ity” that can last a lifetime,ity” ꯍꯥꯌꯕꯁꯤ ꯄꯨꯟꯁꯤ ꯆꯨꯞꯄꯥ ꯂꯦꯡꯗꯅꯥ ꯂꯩꯕꯥ ꯌꯥꯕꯥ .
B. Karen Horney (1885-1952) was one of the earliest feminist psycho-,ꯕꯤ.ꯀꯦꯔꯦꯟ ꯍꯣꯔꯅꯤ (꯱꯸꯸꯵-꯱꯹꯵꯲) ꯑꯁꯤ ꯈ꯭ꯕꯥꯏꯗꯒꯤ ꯑꯍꯥꯅꯕꯥ ꯐꯤꯃꯤꯅꯤꯁ꯭ꯠ ꯁꯥꯏꯀꯣ-
analysts. She argued Freud’s theory of little girls’ “penis envy” under-,ꯑꯦꯅꯥꯂꯥꯏꯇꯤꯛꯁꯁꯤꯡ꯫
estimated the role of cultural influences (like sexism) that contributed,ꯀꯟꯠꯔꯤꯕ꯭ꯌꯨꯠ ꯇꯧꯈꯤꯕꯥ ꯀꯂꯆꯔꯦꯜ ꯏꯅꯐ꯭ꯂꯨꯑꯦꯟꯁꯁꯤꯡ (ꯁꯦꯛꯁꯤꯖꯝꯒꯨꯝꯕꯥ)ꯒꯤ ꯊꯧꯗꯥꯡ ꯑꯁꯤ ꯑꯦꯁ꯭ꯇꯤꯃꯦꯠ ꯇꯧꯈꯤ
to girls’ feelings of inferiority; she saw women’s strivings for power as a,ꯅꯨꯄꯤꯃꯆꯥꯁꯤꯡꯒꯤ ꯏꯅꯐꯦꯔꯤꯑꯣꯔꯤꯇꯤꯒꯤ ꯐꯤꯚꯃꯁꯤꯡꯗꯥ;
response to social inequality rather than penis envy. Horney postulated,ꯄꯦꯅꯤꯁꯀꯤ ꯏꯅꯚꯤꯖꯗꯒꯤ ꯍꯦꯟꯅꯥ ꯁꯣꯁꯤꯑꯦꯜ ꯏꯅꯛꯂꯨꯁꯤꯕꯅꯦꯁꯀꯤ ꯄꯥꯎꯈꯨꯝ꯫
"we develop “basic anxiety” early in life and, if unresolved, develop “basic",ꯑꯩꯈꯣꯌꯅꯥ ꯄꯨꯟꯁꯤꯒꯤ ꯇꯣꯏꯅꯥ “ꯕꯦꯁꯤꯛ ꯑꯦꯟꯁꯤꯇꯤ” ꯁꯦꯃꯒꯠꯂꯤ ꯑꯃꯁꯨꯡ ꯀꯔꯤꯒꯨꯝꯕꯥ ꯋꯥꯔꯣꯏꯁꯤꯟ ꯄꯨꯔꯛꯠꯔꯕꯗꯤ “ꯕꯦꯁꯤꯛ .
hostility” toward others as adults,ꯌꯦꯛꯅꯕꯥ ꯑꯣꯏꯕꯥ” ꯑꯇꯣꯞꯄꯁꯤꯡꯒꯤ ꯃꯐꯃꯗꯥ ꯑꯍꯜ ꯑꯣꯏꯔꯀꯄꯁꯤꯡ ꯑꯣꯏꯅꯥ .
APPENDIXES,ꯑꯦꯄꯦꯟꯗꯤꯛꯁꯁꯤꯡ
APPENDIX,ꯑꯦꯄꯦꯟꯗꯤꯛꯁꯇꯥ ꯂꯩꯕꯥ ꯌꯨ.ꯑꯦꯁ.
63,꯶꯳ ꯑꯃꯁꯨꯡ ꯑꯦꯟ.
A SIX-DAY UNIT LESSON PLAN FOR HIGH SCHOOL PSYCHOLOGY TEACHERS,ꯍꯥꯌꯔ ꯁ꯭ꯀꯨꯜ ꯁꯥꯏꯀꯣꯂꯣꯖꯤ ꯑꯣꯖꯥꯁꯤꯡꯒꯤꯗꯃꯛ ꯅꯨꯃꯤꯠ ꯶ꯅꯤꯒꯤ ꯌꯨꯅꯤꯠ ꯂꯦꯁꯟ ꯄ꯭ꯂꯥꯟ ꯑꯃꯥ
BACK TO  CONTENTS,ꯀꯟꯇꯦꯟꯇꯁꯤꯡꯗꯥ ꯍꯜꯂꯀꯎ
"C. Erik Erikson (1902-1994) focused on the full human life cycle, de-","ꯁꯤ.ꯑꯦꯔꯤꯛ ꯑꯦꯔꯤꯛꯁꯟ (꯱꯹꯰꯲-꯱꯹꯹꯴)ꯅꯥ ꯃꯄꯨꯡ ꯑꯣꯏꯕꯥ ꯃꯤꯑꯣꯏꯕꯒꯤ ꯄꯨꯟꯁꯤꯒꯤ ꯆꯛꯔꯗꯥ ꯃꯤꯠꯌꯦꯡ ꯊꯃꯈꯤ, ꯗꯤ-"
"scribing eight stages of psychosocial development, which are stages of","ꯁꯥꯏꯀꯣꯁꯣꯁꯤꯑꯦꯜ ꯗꯤꯚꯦꯂꯄꯃꯦꯟꯇꯒꯤ ꯁ꯭ꯇꯦꯖ 8, ꯃꯈꯣꯌꯗꯨꯒꯤ ꯁ꯭ꯇꯦꯖꯁꯤꯡ ꯑꯗꯨ"
"conflict from birth to death, in contrast to Freud’s primary emphasis on","ꯄꯣꯀꯄꯗꯒꯤ ꯁꯤꯕꯥ ꯐꯥꯑꯣꯕꯒꯤ ꯂꯥꯅꯐꯝ, ꯐ꯭ꯔꯣꯗꯅꯥ ꯃꯔꯨ ꯑꯣꯏꯕꯥ ꯃꯤꯠꯌꯦꯡ ꯊꯝꯕꯒꯥ ꯃꯥꯟꯅꯗꯅꯥ꯫"
childhood stages of psychosexual development. Erikson believed the,ꯁꯥꯏꯀꯣꯁꯦꯛꯁꯨꯑꯦꯜ ꯗꯤꯚꯦꯂꯄꯃꯦꯟꯇꯒꯤ ꯑꯉꯥꯡ ꯑꯣꯏꯔꯤꯉꯩꯒꯤ ꯁ꯭ꯇꯦꯖꯁꯤꯡ꯫
"first stage, trust versus mistrust, was the most important","ꯑꯍꯥꯅꯕꯥ ꯇꯥꯉ꯭ꯀꯛ, ꯊꯥꯖꯕꯥ ꯚꯦꯔꯁꯦꯁ ꯊꯥꯖꯗꯕꯥ ꯑꯁꯤ ꯈ꯭ꯕꯥꯏꯗꯒꯤ ꯃꯔꯨꯑꯣꯏꯕꯥ ꯑꯣꯏꯈꯤ"
APPENDIX B,ꯑꯦꯄꯦꯟꯗꯤꯛꯁ ꯕꯤ .
Additional Humanistic Theories of Personality,ꯄꯔꯁꯣꯅꯦꯂꯤꯇꯤꯒꯤ ꯑꯍꯦꯅꯕꯥ ꯍ꯭ꯌꯨꯃꯦꯅꯤꯁ꯭ꯇꯤꯛ ꯊꯤꯑꯣꯔꯤꯁꯤꯡ
Existentialism,ꯑꯦꯒꯖꯤꯕꯤꯁꯅꯦꯂꯤꯖꯝ .
Note. This is typically taught as a theory or as a treatment,ꯈꯪꯖꯤꯟꯒꯗꯕ.
Existentialism is a philosophical model that dates back to the mid-1800s,ꯑꯦꯒꯖꯤꯕꯤꯁꯅꯦꯂꯤꯖꯝ ꯑꯁꯤ ꯱꯸꯰꯰ꯒꯤ ꯃꯌꯥꯏ ꯆꯜꯂꯀꯄꯗꯒꯤ ꯆꯠꯅꯔꯀꯄꯥ ꯐꯤꯂꯣꯁꯣꯐꯤꯒꯤ ꯃꯣꯗꯦꯜ ꯑꯃꯅꯤ
"The most famous existential philosophers were Nietzsche, Sartre, and Ki-","ꯈ꯭ꯕꯥꯏꯗꯒꯤ ꯃꯃꯤꯡ ꯆꯠꯄꯥ ꯑꯦꯒꯖꯤꯕꯤꯁꯅꯦꯜ ꯐꯤꯂꯣꯁꯣꯐꯔꯁꯤꯡꯗꯤ ꯅꯤꯡꯊꯧ, ꯁꯥꯔꯠꯔꯦ ꯑꯃꯁꯨꯡ ꯀꯤ-"
erkegaard. Existentialists believe that one of the biggest challenges in life,ꯑꯦꯔꯀꯦꯒꯥꯔꯗꯇꯥ ꯂꯩꯕꯥ꯫
is accepting responsibility for your own experiences (existentialists believe,ꯑꯁꯤ ꯅꯍꯥꯛꯀꯤ ꯏꯁꯥꯒꯤ ꯑꯦꯛꯁꯄꯔꯤꯌꯦꯟꯁꯁꯤꯡꯒꯤ ꯊꯧꯗꯥꯡ ꯂꯧꯕꯥ (ꯑꯦꯛꯁꯦꯁꯤꯕꯤꯂꯤꯇꯤꯁ꯭ꯇꯁꯤꯡꯅꯥ ꯊꯥꯖꯩ
there is no outside source of meaning; each person must create meaning,ꯑꯔꯊꯒꯤ ꯃꯄꯥꯅꯒꯤ ꯁꯣꯔꯁ ꯑꯃꯠꯇꯥ ꯂꯩꯇꯦ;
"for themselves). For existentialists, only an individual’s own experience (or",ꯃꯁꯥꯒꯤꯗꯃꯛ)꯫
"phenomenology) is under his or her own control, and therefore the individ-","ꯐꯦꯅꯣꯃꯦꯅꯣꯂꯣꯖꯤ) ꯑꯁꯤ ꯃꯍꯥꯛꯀꯤ ꯃꯁꯥꯒꯤ ꯀꯟꯠꯔꯣꯂꯒꯤ ꯃꯈꯥꯗꯥ ꯂꯩ, ꯑꯃꯁꯨꯡ ꯃꯔꯝ ꯑꯁꯤꯅꯥ ꯃꯤꯑꯣꯏ ꯑꯗꯨꯅꯥ-"
ual has a responsibility to make conscious choices about how to experi-,ꯌꯨ.ꯑꯦ.ꯑꯦꯜ.ꯅꯥ ꯃꯇꯧ ꯀꯔꯝꯅꯥ ꯑꯦꯛꯁꯄꯔꯤꯌꯦꯟꯁ ꯇꯧꯒꯗꯒꯦ ꯍꯥꯌꯕꯒꯤ ꯃꯇꯥꯡꯗꯥ ꯀꯟꯁꯤꯌꯁ ꯑꯣꯏꯕꯥ ꯋꯥꯔꯦꯄꯁꯤꯡ ꯂꯧꯕꯒꯤ ꯊꯧꯗꯥꯡ ꯂꯩ-
ence his or her own life,ence ꯃꯍꯥꯛꯀꯤ ꯃꯁꯥꯒꯤ ꯄꯨꯟꯁꯤ
"For personality psychologists, the implications of this view are that there","ꯄꯔꯁꯣꯅꯦꯂꯤꯇꯤ ꯁꯥꯏꯀꯣꯂꯣꯖꯤꯁ꯭ꯇꯁꯤꯡꯒꯤ ꯑꯣꯏꯅꯗꯤ, ꯋꯥꯈꯜꯂꯣꯟ ꯑꯁꯤꯒꯤ ꯃꯇꯥꯡꯗꯥ ꯋꯥꯐꯝ ꯑꯁꯤ ꯃꯐꯝ ꯑꯗꯨꯗꯥ ꯂꯩꯔꯤ ."
are important individual differences in how people face this challenge. Un-,ꯃꯤꯌꯥꯝꯅꯥ ꯃꯇꯧ ꯀꯔꯝꯅꯥ ꯁꯤꯡꯅꯕꯥ ꯑꯁꯤ ꯊꯦꯡꯅꯕꯒꯦ ꯍꯥꯌꯕꯗꯨꯗꯥ ꯃꯤꯑꯣꯏ ꯑꯃꯒꯤ ꯃꯔꯨꯑꯣꯏꯕꯥ ꯈꯦꯠꯅꯕꯥ ꯂꯩ꯫
derstanding how a person deals with making meaning in his life and taking,ꯃꯤꯑꯣꯏ ꯑꯃꯅꯥ ꯃꯍꯥꯛꯀꯤ ꯄꯨꯟꯁꯤꯗꯥ ꯑꯔꯊ ꯄꯤꯕꯥ ꯑꯃꯁꯨꯡ ꯂꯧꯕꯒꯤ ꯃꯇꯥꯡꯗꯥ ꯀꯔꯝꯅꯥ ꯊꯦꯡꯅꯒꯅꯤ ꯍꯥꯌꯕꯗꯨ ꯗꯔꯁ꯭ꯇꯦꯟꯗꯤꯡ
control of his own phenomenology is central to understanding the person,ꯃꯍꯥꯛꯀꯤ ꯃꯁꯥꯒꯤ ꯑꯣꯏꯕꯥ ꯐꯦꯅꯣꯃꯦꯅꯣꯂꯣꯖꯤ ꯀꯟꯠꯔꯣꯜ ꯇꯧꯕꯥ ꯑꯁꯤ ꯃꯤꯑꯣꯏ ꯑꯗꯨꯕꯨ ꯂꯧꯁꯤꯅꯕꯗꯥ ꯃꯔꯨ ꯑꯣꯏ .
and his personality,ꯑꯃꯁꯨꯡ ꯃꯍꯥꯛꯀꯤ ꯄꯔꯁꯣꯅꯦꯂꯤꯇꯤ .
Positive Psychology,ꯄꯣꯖꯤꯇꯤꯕ ꯑꯣꯏꯕꯥ ꯁꯥꯏꯀꯣꯂꯣꯖꯤ .
See also the TOPSS Unit Lesson Plan on Positive Psychology,ꯄꯣꯖꯤꯇꯤꯕ ꯁꯥꯏꯀꯣꯂꯣꯖꯤꯒꯤ ꯃꯇꯥꯡꯗꯥ ꯇꯣꯄꯁ ꯌꯨꯅꯤꯠ ꯂꯦꯁꯟ ꯄ꯭ꯂꯥꯟ ꯑꯁꯤꯁꯨ ꯌꯦꯡꯕꯤꯌꯨ
"More recently, a new movement in psychology has followed in humanists’",ꯍꯟꯗꯛꯀꯤ ꯃꯇꯝ ꯑꯁꯤꯗꯥ ꯁꯥꯏꯀꯣꯂꯣꯖꯤꯒꯤ ꯑꯅꯧꯕꯥ ꯈꯣꯡꯖꯪ ꯑꯃꯥ ꯍ꯭ꯌꯨꯃꯦꯅꯤꯁ꯭ꯇꯁꯤꯡꯗꯥ ꯆꯠꯅꯔꯦ’꯫
footsteps. Positive psychology is the study of positive human experienc-,ꯈꯣꯉꯊꯥꯡꯁꯤꯡ꯫
"es, including happiness, self-actualization, leadership, compassion, and","ꯏ.ꯑꯦꯁ., ꯅꯨꯡꯉꯥꯏꯕꯥ, ꯁꯦꯜꯐ-ꯑꯦꯛꯆꯨꯑꯦꯂꯥꯏꯖꯦꯁꯟ, ꯂꯤꯗꯔꯁꯤꯞ, ꯃꯤꯅꯨꯡꯁꯤ, ꯑꯃꯁꯨꯡ ."
gratitude. This movement arose out of the feeling among many research-,ꯇꯧꯕꯤꯃꯜ ꯈꯪꯕ ꯎꯌꯄ.
ers that psychological science has focused almost exclusively on psycho-,ers that ꯁꯥꯏꯀꯣꯂꯣꯖꯤꯀꯦꯜ ꯁꯥꯏꯟꯁꯅꯥ ꯆꯥꯎꯔꯥꯛꯅꯥ ꯁꯥꯏꯀꯣ-ꯗꯥ ꯃꯄꯨꯡ ꯐꯥꯅꯥ ꯃꯤꯠꯌꯦꯡ ꯊꯝꯂꯦ꯫
pathology and malfunction. While it is important to understand why hu-,ꯄꯦꯊꯣꯂꯣꯖꯤ ꯑꯃꯁꯨꯡ ꯃꯥꯂꯐꯪꯅꯕꯒꯤ ꯊꯧꯑꯣꯡ꯫
"man beings sometimes suffer or hurt each other, the positive psychology","ꯃꯤꯑꯣꯏꯕꯥ ꯖꯤꯕꯁꯤꯡꯅꯥ ꯀꯔꯤꯒꯨꯝꯕꯥ ꯃꯇꯃꯗꯥ ꯑꯃꯒꯥ ꯑꯃꯒꯥ ꯁꯣꯛꯅ-ꯁꯝꯅꯗꯕꯥ ꯅꯠꯔꯒꯥ ꯑꯋꯥꯕꯥ ꯈꯥꯉꯕꯥ, ꯄꯣꯖꯤꯇꯤꯕ ꯑꯣꯏꯕꯥ ꯁꯥꯏꯀꯣꯂꯣꯖꯤ"
movement is committed to the idea that it is also important to understand,ꯃꯨꯚꯃꯦꯟꯇ ꯑꯁꯤ ꯃꯁꯤꯁꯨ ꯂꯧꯁꯤꯅꯕꯥ ꯑꯁꯤ ꯃꯔꯨ ꯑꯣꯏ ꯍꯥꯌꯕꯥ ꯋꯥꯈꯜꯂꯣꯟ ꯑꯗꯨꯗꯥ ꯀꯝꯃꯤꯠꯃꯦꯟꯇ ꯇꯧꯔꯤ ꯫
64,꯶꯴ ꯑꯃꯁꯨꯡ ꯑꯦꯟ.
PERSONALITY,ꯃꯤꯑꯣꯏ ꯑꯃꯒꯤ ꯃꯇꯤꯛ ꯃꯒꯨꯟ
BACK TO  CONTENTS,ꯀꯟꯇꯦꯟꯇꯁꯤꯡꯗꯥ ꯍꯜꯂꯀꯎ
"why and how humans sometimes flourish, succeed, and are good to each","ꯀꯔꯤꯒꯤꯗꯃꯛꯇꯥ ꯑꯃꯁꯨꯡ ꯃꯇꯧ ꯀꯔꯝꯅꯥ ꯃꯤꯑꯣꯏꯕꯅꯥ ꯀꯔꯤꯒꯨꯝꯕꯥ ꯃꯇꯃꯗꯥ ꯍꯦꯟꯅꯥ ꯆꯥꯎꯈꯠꯂꯛꯂꯤ, ꯃꯥꯌ ꯄꯥꯀꯏ, ꯑꯃꯁꯨꯡ ꯑꯃꯃꯃꯗꯥ ꯑꯐꯕꯥ ꯑꯣꯏꯕꯒꯦ"
"other. For personality research, this has meant complementing the study",ꯑꯇꯣꯞꯄ.
of personality disorders and personality pathology with the study of posi-,ꯄꯣꯁꯤ-ꯒꯤ ꯁ꯭ꯇꯗꯤꯒꯥ ꯂꯣꯌꯅꯅꯥ ꯄꯔꯁꯣꯅꯦꯂꯤꯇꯤ ꯗꯤꯁꯑꯣꯔꯗꯔꯁꯤꯡ ꯑꯃꯁꯨꯡ ꯄꯔꯁꯣꯅꯦꯂꯤꯇꯤ ꯄꯦꯊꯣꯂꯣꯖꯤꯒꯤ ꯃꯇꯥꯡꯗꯥ
tive personality traits (sometimes called character traits or virtues). These,ꯇꯤꯚ ꯄꯔꯁꯣꯅꯦꯂꯤꯇꯤ ꯇ꯭ꯔꯦꯇꯁꯤꯡ (ꯀꯔꯤꯒꯨꯝꯕꯥ ꯃꯇꯃꯗꯥ ꯆꯦꯛꯔꯦꯇꯔ ꯇ꯭ꯔꯦꯠ ꯅꯠꯠꯔꯒꯥ ꯚꯔꯆꯨꯑꯦꯜ ꯍꯥꯌꯅꯥ ꯀꯧꯏ)꯫
"include courage, compassion, and wisdom, among many others. It has","ꯊꯧꯅꯥ, ꯃꯤꯅꯨꯡꯁꯤ, ꯑꯃꯁꯨꯡ ꯂꯧꯁꯤꯡ, ꯑꯇꯩ ꯀꯌꯥꯒꯤ ꯃꯔꯛꯇꯥ ꯌꯥꯑꯣꯔꯤ꯫"
also meant studying the positive side of well-being to understand why,ꯃꯁꯤꯗꯁꯨ ꯅꯠꯇꯅꯥ ꯀꯔꯤꯒꯤꯗꯃꯛꯇꯥ ꯀꯔꯤꯒꯤꯗꯃꯛꯇꯥ .
some people are especially happy and fulfilled in life. One topic that has,ꯃꯤꯑꯣꯏ ꯈꯔꯗꯤ ꯃꯔꯨꯑꯣꯏꯅꯥ ꯄꯨꯟꯁꯤꯗꯥ ꯅꯨꯡꯉꯥꯏꯕꯥ ꯑꯃꯁꯨꯡ ꯃꯄꯨꯡ ꯐꯥꯕꯥ ꯑꯣꯏ꯫
received a great deal of attention from positive psychology researchers is,ꯄꯣꯖꯤꯇꯤꯕ ꯑꯣꯏꯕꯥ ꯁꯥꯏꯀꯣꯂꯣꯖꯤꯒꯤ ꯔꯤꯁꯔꯆꯔꯁꯤꯡꯗꯒꯤ ꯑꯆꯧꯕꯥ ꯄꯨꯛꯅꯤꯡ ꯆꯪꯕꯥ ꯑꯃꯥ ꯐꯪꯈꯤꯕꯥ ꯑꯁꯤ .
Ryan and Deci’s self-determination theory. This theory says that real hap-,ꯔꯥꯌꯟ ꯑꯃꯁꯨꯡ ꯗꯦꯁꯤꯒꯤ ꯁꯦꯜꯐ-ꯗꯤꯇꯔꯃꯤꯅꯦꯁꯟ ꯊꯤꯑꯣꯔꯤ꯫
"piness comes not just from pursuing pleasure (hedonia), but from fulfilling",ꯄꯥꯏꯅꯦꯁ ꯑꯁꯤ ꯁꯨꯞꯅꯒꯤ ꯅꯨꯡꯉꯥꯏꯕꯥ (ꯍꯦꯗꯣꯅꯤꯌꯥ) ꯂꯧꯕꯗꯒꯤ ꯅꯠꯇꯅꯥ ꯃꯄꯨꯡ ꯐꯥꯕꯗꯒꯤ ꯂꯥꯀꯄꯅꯤ
"our needs and goals (eudaimonia). According to self-determination theory,",ꯑꯩꯈꯣꯌꯒꯤ ꯗꯔꯀꯥꯔ ꯑꯣꯏꯕꯁꯤꯡ ꯑꯃꯁꯨꯡ ꯄꯥꯟꯗꯃꯁꯤꯡ (ꯏꯎꯗꯦꯃꯣꯅꯤꯌꯥ)꯫
human beings have a need to pursue goals they value intrinsically (things,ꯃꯤꯑꯣꯏꯕꯅꯥ ꯃꯈꯣꯌꯅꯥ ꯏꯅꯠꯔꯤꯅꯁꯤꯀꯦꯜ ꯑꯣꯏꯅꯥ ꯃꯃꯜ ꯊꯝꯂꯤꯕꯥ ꯄꯥꯟꯗꯃꯁꯤꯡ ꯑꯗꯨ ꯇꯨꯡ ꯏꯟꯅꯕꯒꯤ ꯃꯊꯧ ꯇꯥꯕꯥ ꯂꯩ (ꯋꯥꯍꯩꯁꯤꯡ ꯑꯁꯤ .
"they value for themselves, not as means to an end). Furthermore, humans","ꯃꯈꯣꯌꯅꯥ ꯃꯈꯣꯌꯒꯤꯗꯃꯛ ꯃꯃꯜ ꯊꯝꯂꯤ, ꯂꯣꯏꯁꯤꯟꯅꯕꯒꯤ ꯄꯥꯝꯕꯩ ꯑꯣꯏꯅꯥ ꯅꯠꯇꯦ)꯫"
"share three fundamental intrinsic goals: autonomy, which is the freedom to","ꯐꯟꯗꯥꯃꯦꯟꯇꯦꯜ ꯏꯟꯠꯔꯤꯅꯁꯤꯛ ꯄꯥꯟꯗꯝ ꯑꯍꯨꯝ ꯁꯦꯌꯔ ꯇꯧꯕꯤꯌꯨ: ꯑꯣꯇꯣꯅꯣꯃꯤ, ꯃꯁꯤꯅꯥ ꯅꯤꯡꯇꯝꯕꯥ"
"make your own choices; competence, which is developing skills and mas-",ꯃꯁꯥꯒꯤ ꯑꯣꯏꯕꯥ ꯋꯥꯔꯦꯞ ꯂꯧꯕꯥ;
"tering something; and relatedness, which is having meaningful relation-",ꯀꯔꯤꯒꯨꯝꯕꯥ ꯈꯔꯥ ꯇꯦꯔꯤꯡ ꯇꯧꯕꯥ;
ships with others,ꯑꯇꯣꯞꯄꯁꯤꯡꯒꯥ ꯂꯣꯌꯅꯅꯥ ꯖꯍꯥꯖꯁꯤꯡ .
Flow,ꯆꯦꯟꯊꯕ
Another topic that has received a lot of attention from the positive psy-,ꯄꯣꯖꯤꯇꯤꯕ ꯑꯣꯏꯕꯥ ꯁꯥꯏ-ꯗꯒꯤ ꯍꯦꯟꯅꯥ ꯄꯨꯛꯅꯤꯡ ꯆꯪꯈꯤꯕꯥ ꯑꯇꯣꯞꯄꯥ ꯍꯤꯔꯝ ꯑꯃꯅꯤ꯫
chology movement (but actually predates it) is Csikszentmihalyi’s concept,ꯆꯣꯂꯣꯖꯤ ꯃꯨꯕꯃꯦꯟꯇ (ꯑꯗꯨꯕꯨ ꯇꯁꯦꯡꯅꯥ ꯃꯁꯤꯒꯤ ꯃꯃꯥꯡꯗꯥ ꯂꯩꯔꯝꯕꯥ) ꯑꯁꯤ csikszentmihaly’s concept .
of flow. Flow is the state people are in when they are doing something,ꯐ꯭ꯂꯣ ꯑꯣꯐ ꯐ꯭ꯂꯣ꯫
challenging and engaging. It is the experience you have when you are so,ꯆꯦꯂꯦꯟꯖꯤꯡ ꯑꯃꯁꯨꯡ ꯑꯦꯉ꯭ꯒꯦꯖ ꯇꯧꯕꯥ꯫
"engrossed in something, working hard at it, you don’t even notice time","ꯀꯔꯤꯒꯨꯝꯕꯥ ꯑꯃꯗꯥ ꯑꯦꯅꯒ꯭ꯔꯣꯁ ꯇꯧꯕꯥ, ꯃꯗꯨꯗꯥ ꯀꯟꯅꯥ ꯍꯣꯠꯅꯕꯥ, ꯅꯍꯥꯛꯅꯥ ꯃꯇꯝ ꯐꯥꯑꯣꯕꯥ ꯈꯉꯕꯥ ꯉꯃꯗꯦ"
passing. Csikszentmihalyi believed this state was only achievable when,ꯄꯥꯁ ꯇꯧꯕꯥ꯫
doing something intrinsically enjoyable (not just enjoyable because of the,ꯏꯟꯠꯔꯤꯅꯁꯤꯀꯦꯜ ꯑꯣꯏꯅꯥ ꯅꯨꯡꯉꯥꯏꯕꯥ ꯊꯕꯛ ꯑꯃꯥ ꯇꯧꯕꯥ (ꯑꯗꯨꯝ ꯑꯣꯏꯅꯃꯛ ꯅꯨꯡꯉꯥꯏꯕꯥ ꯈꯛꯇꯃꯛ ꯅꯠꯇꯦ
outcomes it produces) and that this is the optimal experience one can,ꯃꯁꯤꯅꯥ ꯄꯨꯊꯣꯀꯄꯥ ꯑꯥꯎꯠꯀꯃꯁꯤꯡ) ꯑꯃꯁꯨꯡ ꯃꯁꯤ ꯀꯅꯥꯒꯨꯝꯕꯥ ꯑꯃꯅꯥ ꯌꯥꯕꯥ ꯌꯥꯕꯥ ꯈ꯭ꯕꯥꯏꯗꯒꯤ ꯐꯕꯥ ꯑꯦꯛꯁꯄꯔꯤꯌꯦꯟꯁꯅꯤ ꯍꯥꯌꯕꯥ
have in life. He agreed with other humanists that our phenomenology is of,ꯄꯨꯟꯁꯤꯗꯥ ꯂꯩꯕꯥ꯫
"utmost experience, and his theory of flow was a theory about how to op-","ꯈ꯭ꯕꯥꯏꯗꯒꯤ ꯍꯦꯟꯅꯥ ꯑꯦꯛꯁꯄꯔꯤꯑꯦꯟꯁ, ꯑꯃꯁꯨꯡ ꯃꯍꯥꯛꯀꯤ ꯐ꯭ꯂꯣ ꯑꯣꯐ ꯐ꯭ꯂꯣ ꯑꯁꯤ ꯃꯇꯧ ꯀꯔꯝꯅꯥ ꯑꯣꯞ-ꯑꯣꯄꯁꯅꯒꯤ ꯃꯇꯥꯡꯗꯥ ꯊꯤꯑꯣꯔꯤ ꯑꯃꯥ ꯑꯣꯏꯔꯝꯃꯤ꯫"
"timize one’s phenomenology. With respect to personality theory, flow can",ꯀꯅꯥꯒꯨꯝꯕꯥ ꯑꯃꯒꯤ ꯐꯦꯅꯣꯃꯦꯅꯣꯂꯣꯖꯤꯕꯨ ꯇꯤꯃꯤ ꯇꯧꯏ꯫
be seen as a dimension on which people differ—some people are lucky,ꯃꯤꯌꯥꯝꯅꯥ ꯈꯦꯠꯅꯕꯥ ꯊꯃꯗꯕꯥ ꯗꯥꯏꯃꯦꯟꯁꯟ ꯑꯃꯥ ꯑꯣꯏꯅꯥ ꯎꯕꯥ ꯐꯪꯕꯤꯌꯨ—ꯃꯤꯑꯣꯏ ꯈꯔꯗꯤ ꯂꯛꯁꯤꯅꯤ .
"enough to experience flow every day, whereas others may never or almost","ꯅꯨꯃꯤꯠ ꯈꯨꯗꯤꯡꯒꯤ ꯐ꯭ꯂꯣꯒꯤ ꯑꯦꯛꯁꯄꯔꯤꯌꯦꯟꯁ ꯂꯩꯕꯥ ꯃꯇꯤꯛ ꯆꯥꯕꯥ, ꯑꯗꯨꯒꯥ ꯑꯇꯣꯞꯄꯁꯤꯡꯅꯥ ꯀꯩꯗꯧꯅꯨꯡꯗꯥ ꯅꯠꯔꯒꯥ ꯆꯥꯎꯔꯥꯛꯅꯥ ."
never experience it,ꯀꯩꯗꯧꯉꯩꯗꯥ ꯃꯁꯤꯒꯤ ꯑꯦꯛꯁꯄꯔꯤꯌꯦꯟꯁ ꯂꯩꯔꯣꯏꯗꯕꯅꯤ
65,꯶꯵ ꯑꯃꯁꯨꯡ ꯑꯦꯟ.
66,꯶꯶ ꯑꯃꯁꯨꯡ ꯑꯦꯟ.
PERSONALITY,ꯃꯤꯑꯣꯏ ꯑꯃꯒꯤ ꯃꯇꯤꯛ ꯃꯒꯨꯟ
BACK TO  CONTENTS,ꯀꯟꯇꯦꯟꯇꯁꯤꯡꯗꯥ ꯍꯜꯂꯀꯎ
AMERICAN,ꯑꯃꯦꯔꯤꯀꯥꯒꯤ ꯑꯣꯏꯕꯥ ꯌꯨ.ꯑꯦꯁ.
PSYCHOLOGICAL,ꯁꯥꯏꯀꯣꯂꯣꯖꯤꯀꯦꯜ ꯑꯣꯏꯕꯥ .
ASSOCIATION,ꯂꯨꯞ
Copyright © 2014 American Psychological Association,ꯀꯥꯄꯤꯔꯥꯏꯠ © 2014 ꯑꯃꯦꯔꯤꯀꯥꯟ ꯁꯥꯏꯀꯣꯂꯣꯖꯤꯀꯦꯜ ꯑꯦꯁꯣꯁꯤꯑꯦꯁꯟ
--- 20. Personality disorders Author Mind.pdf ---,--- 20. ꯄꯔꯁꯣꯅꯦꯂꯤꯇꯤ ꯗꯤꯁꯑꯣꯔꯗꯔꯁꯤꯡ ꯑꯣꯊꯣꯔ ꯃꯥꯏꯟꯗ.ꯄꯤ.ꯗꯤ.ꯑꯦꯐ.---
© Mind 2020,© ꯃꯥꯏꯟꯗ ꯲꯰꯲꯰ .
1,꯱.
Personality disorders,ꯄꯔꯁꯣꯅꯦꯂꯤꯇꯤ ꯗꯤꯁꯑꯣꯔꯗꯔꯁꯤꯡ
"Explains personality disorders, including possible causes and how you can access",ꯑꯣꯏꯊꯣꯀꯄꯥ ꯌꯥꯕꯥ ꯃꯔꯃꯁꯤꯡ ꯑꯃꯁꯨꯡ ꯅꯍꯥꯛꯅꯥ ꯀꯔꯝꯅꯥ ꯑꯦꯛꯁꯦꯁ ꯇꯧꯕꯥ ꯌꯥꯕꯒꯦ ꯍꯥꯌꯕꯗꯨ ꯌꯥꯎꯅꯥ ꯄꯔꯁꯣꯅꯦꯂꯤꯇꯤ ꯗꯤꯁꯑꯣꯔꯗꯔꯁꯤꯡ ꯁꯟꯗꯣꯛꯅꯥ ꯇꯥꯛꯂꯤ꯫
