en,mni-Mtei
become isolated from social contact,ꯁꯣꯁꯤꯑꯦꯜ ꯀꯟꯇꯦꯛꯇꯇꯒꯤ ꯇꯣꯈꯥꯏꯅꯥ ꯂꯩꯕꯥ ꯑꯣꯏꯌꯨ .
7.Middle-aged,꯷.ꯃꯤꯗꯜ-ꯑꯦꯖ ꯑꯣꯏꯕꯥ .
adult,ꯑꯦꯗꯜꯇ ꯑꯣꯏꯕꯥ꯫
Generativity,ꯖꯦꯅꯔꯦꯇꯤꯕꯤꯇꯤ ꯂꯩꯕꯥ .
versus,ꯕꯔꯁꯁ ꯇꯧꯕꯥ
Stagnation,ꯁ꯭ꯇꯥꯒꯅꯦꯁꯟ ꯇꯧꯕꯥ
"Middle-aged adults feel an urgency to leave a mark on the world, to","ꯆꯍꯤ ꯃꯌꯥꯃꯒꯤ ꯑꯍꯂꯁꯤꯡꯅꯥ ꯃꯥꯂꯦꯃꯗꯥ ꯃꯁꯛ ꯑꯃꯥ ꯊꯝꯅꯕꯥ ꯈꯨꯗꯛꯀꯤ ꯑꯣꯏꯕꯥ ꯑꯃꯥ ꯐꯥꯑꯣꯏ, ꯲꯰꯲꯰ꯒꯤ ꯃꯅꯨꯡꯗꯥ꯫"
generate something of lasting value and worth. Finding a purpose in life,ꯂꯦꯡꯗꯕꯥ ꯚꯦꯜꯌꯨ ꯑꯃꯁꯨꯡ ꯃꯃꯜ ꯂꯩꯕꯥ ꯄꯣꯠꯁꯛ ꯑꯃꯥ ꯁꯦꯃꯒꯠꯄꯥ꯫
is a central theme. To fail at generating something significant means a,ꯑꯁꯤ ꯁꯦꯟꯠꯔꯦꯜ ꯊꯤꯝ ꯑꯃꯅꯤ꯫
person becomes stagnant and stops moving forward; this person may,ꯃꯤꯑꯣꯏ ꯑꯗꯨ ꯂꯦꯡꯗꯅꯥ ꯂꯩꯔꯀꯏ ꯑꯃꯁꯨꯡ ꯃꯥꯡꯂꯣꯃꯗꯥ ꯆꯪꯁꯤꯅꯕꯥ ꯂꯦꯄꯈꯤ;
become selfish and self-absorbed,ꯃꯁꯥꯒꯤ ꯑꯣꯏꯖꯕꯥ ꯊꯤꯕꯥ ꯑꯃꯁꯨꯡ ꯃꯁꯥꯅꯥ ꯃꯁꯥꯕꯨ ꯊꯥꯖꯕꯥ ꯊꯝꯕꯥ
8. Old adult,꯸.ꯑꯔꯤꯕꯥ ꯑꯍꯜ ꯑꯣꯏꯔꯕꯥ ꯃꯤꯑꯣꯏꯁꯤꯡ .
Integrity,ꯑꯄꯨꯟꯕ ꯁꯛꯇꯝ
versus,ꯕꯔꯁꯁ ꯇꯧꯕꯥ
Despair,ꯑꯋꯥꯕ
"In old age, it is common to look back on life and reflect on what was","ꯑꯍꯜ ꯑꯣꯏꯔꯀꯄꯗꯥ, ꯄꯨꯟꯁꯤꯒꯤ ꯃꯔꯃꯗꯥ ꯌꯦꯡꯗꯨꯅꯥ ꯂꯩꯕꯥ ꯑꯃꯁꯨꯡ ꯀꯔꯤ ꯑꯣꯏꯈꯤꯕꯒꯦ ꯍꯥꯌꯕꯗꯨ ꯔꯤꯐ꯭ꯂꯦꯛꯇ ꯇꯧꯕꯥ ꯑꯁꯤ ꯀꯃꯟ ꯑꯣꯏ꯫"
accomplished. People who feel good about what they have done build a,ꯄꯥꯡꯊꯣꯛꯄ.
"sense of integrity. For those whose evaluations are not so good, there is",ꯏꯟꯇꯤꯒ꯭ꯔꯤꯇꯤꯒꯤ ꯋꯥꯈꯜꯂꯣꯟ꯫
"despair, the feeling of regret and remorse for the life they led","ꯋꯥꯈꯜ ꯋꯥꯕꯥ, ꯃꯈꯣꯌꯅꯥ ꯂꯨꯆꯤꯡꯈꯤꯕꯥ ꯄꯨꯟꯁꯤ ꯑꯗꯨꯒꯤꯗꯃꯛ ꯅꯨꯡꯉꯥꯏꯇꯕꯥ ꯑꯃꯁꯨꯡ ꯅꯨꯡꯉꯥꯏꯇꯕꯥ ꯐꯤꯚꯝ ꯑꯃꯥ"
1.6,꯱.꯶ ꯑꯃꯁꯨꯡ ꯑꯦꯟ.
CONCEPT OF SUCCESS:,ꯃꯥꯌ ꯄꯥꯀꯄꯒꯤ ꯋꯥꯈꯜꯂꯣꯟ:
1.6.1,꯱.꯶.꯱ ꯑꯣꯏꯈꯤ꯫
DEFINITION:,ꯋꯥꯡꯟꯊꯣꯛ:
What makes a person successful? How do we recognize success?,ꯃꯤꯑꯣꯏ ꯑꯃꯕꯨ ꯃꯥꯌ ꯄꯥꯀꯄꯥ ꯉꯃꯍꯜꯂꯤꯕꯥ ꯑꯁꯤ ꯀꯔꯤꯅꯣ?
"To some people, success might mean wealth. To others, it is recognition, good health, good family,",ꯃꯤꯑꯣꯏ ꯈꯔꯒꯤ ꯑꯣꯏꯅꯗꯤ ꯃꯥꯌ ꯄꯥꯀꯄꯥ ꯍꯥꯌꯕꯁꯤ ꯁꯦꯜ-ꯊꯨꯃꯒꯤ ꯑꯔꯊ ꯑꯣꯏꯕꯥ ꯌꯥꯏ꯫
"happiness, satisfaction, and peace of mind. What this really tells us is that success is subjective. It can","ꯅꯨꯡꯉꯥꯏꯕꯥ, ꯅꯨꯡꯉꯥꯏꯕꯥ ꯑꯃꯁꯨꯡ ꯋꯥꯈꯂꯒꯤ ꯁꯥꯟꯇꯤ ꯂꯩꯕꯥ꯫"
mean different things to different people,ꯇꯣꯉꯥꯟ ꯇꯣꯉꯥꯅꯕꯥ ꯃꯤꯑꯣꯏꯁꯤꯡꯗꯥ ꯇꯣꯉꯥꯟ ꯇꯣꯉꯥꯅꯕꯥ ꯋꯥꯐꯃꯁꯤꯡ ꯃꯤꯟ .
The best definition for success is,ꯃꯥꯌ ꯄꯥꯀꯄꯒꯤ ꯈ꯭ꯕꯥꯏꯗꯒꯤ ꯐꯕꯥ ꯋꯥꯍꯟꯊꯣꯛ ꯑꯁꯤ .
“Success is the progressive realization of a worthy goal”,“ꯃꯥꯌ ꯄꯥꯀꯄꯥ ꯍꯥꯌꯕꯁꯤ ꯌꯥꯝꯅꯥ ꯃꯊꯧ ꯇꯥꯕꯥ ꯄꯥꯟꯗꯝ ꯑꯃꯒꯤ ꯄ꯭ꯔꯣꯒ꯭ꯔꯦꯁꯤꯚ ꯔꯤꯑꯦꯂꯥꯏꯖꯦꯁꯟꯅꯤ”꯫
Let's look at these definitions carefully,ꯍꯥꯌꯔꯤꯕꯥ ꯋꯥꯍꯟꯊꯣꯀꯁꯤꯡ ꯑꯁꯤ ꯆꯦꯀꯁꯤꯟꯅꯥ ꯌꯦꯡꯁꯤ .
"""Progressive"" means that success is a journey, not a destination. We never arrive. After we reach","""ꯄ꯭ꯔꯣꯒ꯭ꯔꯦꯁꯤꯚ"" ꯍꯥꯌꯕꯁꯤꯅꯥ ꯃꯥꯌ ꯄꯥꯀꯄꯥ ꯍꯥꯌꯕꯁꯤ ꯈꯣꯉꯆꯠ ꯑꯃꯅꯤ, ꯃꯐꯝ ꯑꯃꯅꯤ ꯍꯥꯌꯕꯅꯤ꯫"
"one goal, we go on to the next and the next and the next","ꯒꯣꯜ ꯑꯃꯅꯥ, ꯑꯩꯈꯣꯌꯅꯥ ꯃꯊꯪꯒꯤ ꯑꯃꯁꯨꯡ ꯃꯊꯪꯒꯤ ꯑꯃꯁꯨꯡ ꯃꯊꯪꯒꯤ ."
"""Realization"" means it is an experience. Outside forces cannot make me feel successful. I have to","""ꯔꯤꯑꯦꯂꯥꯏꯖꯦꯁꯟ"" ꯍꯥꯌꯕꯁꯤꯅꯥ ꯃꯁꯤ ꯑꯦꯛꯁꯄꯔꯤꯌꯦꯟꯁ ꯑꯃꯅꯤ ꯍꯥꯌꯕꯅꯤ꯫"
feel it within myself. It is internal not external,ꯑꯩꯒꯤ ꯃꯅꯨꯡꯗꯥ ꯐꯥꯑꯣꯕꯤꯌꯨ꯫
"""Worthy"" refers to our value system. Which way are we heading? Positive or negative?","""ꯋꯥꯔꯗ"" ꯍꯥꯌꯕꯁꯤꯅꯥ ꯑꯩꯈꯣꯌꯒꯤ ꯚꯦꯜꯌꯨ ꯁꯤꯁ꯭ꯇꯦꯝ ꯑꯁꯤꯕꯨ ꯈꯉꯍꯜꯂꯤ꯫"
Worthiness determines the quality of the journey. That is what gives meaning and fulfilment,ꯋꯥꯔꯗꯤꯅꯦꯁꯅꯥ ꯈꯣꯉꯆꯠ ꯑꯗꯨꯒꯤ ꯃꯒꯨꯟ ꯑꯗꯨ ꯂꯦꯄꯊꯣꯀꯏ꯫
Success without fulfilment is empty,ꯃꯄꯨꯡ ꯐꯥꯕꯥ ꯌꯥꯑꯣꯗꯅꯥ ꯃꯥꯌ ꯄꯥꯀꯄꯥ ꯑꯁꯤ ꯏꯪꯂꯤ .
"""Goals"" are important. Because they give us a sense of direction","""ꯒꯣꯂꯁꯤꯡ"" ꯑꯁꯤ ꯃꯔꯨꯑꯣꯏ꯫"
1.6.2,꯱.꯶.꯲.
GOALS:,ꯄꯥꯟꯗꯝꯁꯤꯡ:
Why Goals are important?,ꯀꯔꯤꯒꯤ ꯄꯥꯟꯗꯃꯁꯤꯡ ꯑꯁꯤ ꯃꯔꯨꯑꯣꯏꯕꯅꯣ?
"In a study conducted on students in the 1979 Harvard MBA program, only three percent of the",꯱꯹꯷꯹ꯒꯤ ꯍꯥꯔꯚꯥꯔꯗ ꯑꯦꯝ.ꯕꯤ.ꯑꯦ.
"graduates had written goals and plans; 13 percent had goals, but they were not in writing; and 84 percent",ꯒ꯭ꯔꯦꯖꯨꯑꯦꯠꯁꯤꯡꯅꯥ ꯄꯥꯟꯗꯝ ꯑꯃꯁꯨꯡ ꯊꯧꯔꯥꯡꯁꯤꯡ ꯏꯈꯤ;
"Ten years later, the findings revealed that 13 percent of the class who had goals were earning up",ꯆꯍꯤ ꯱꯰ꯒꯤ ꯃꯇꯨꯡꯗꯥ ꯊꯤꯖꯤꯅꯕꯒꯤ ꯊꯕꯀꯁꯤꯡ ꯑꯁꯤꯅꯥ ꯄꯥꯟꯗꯝ ꯊꯝꯂꯤꯕꯥ ꯀ꯭ꯂꯥꯁꯀꯤ ꯆꯥꯗꯥ ꯱꯳ ꯍꯦꯟꯅꯥ ꯋꯥꯡꯈꯠꯂꯛꯂꯤ ꯍꯥꯌꯕꯥ ꯐꯣꯉꯗꯣꯀꯈꯤ꯫
to 84 percent compared to those who had not set any. For the three percent who defined their goals and,ꯆꯥꯗꯥ ꯸꯴ ꯐꯥꯑꯣꯕꯥ ꯑꯃꯠꯇꯥ ꯊꯃꯈꯤꯗꯕꯥ ꯃꯤꯑꯣꯏꯁꯤꯡꯒꯥ ꯆꯥꯡꯗꯝꯅꯕꯗꯥ꯫
"wrote them down, they were earning on average, ten times as much as the other 97 percent put together","ꯃꯈꯣꯌꯁꯤꯡ ꯑꯗꯨ ꯏꯈꯤ, ꯃꯈꯣꯌꯅꯥ ꯆꯥꯡꯆꯠꯇꯥ ꯁꯦꯜ ꯇꯥꯅꯈꯤ, ꯑꯇꯣꯞꯄꯥ ꯆꯥꯗꯥ ꯹꯷ꯅꯥ ꯄꯨꯟꯅꯥ ꯊꯃꯈꯤꯕꯥ ꯑꯗꯨꯗꯒꯤ ꯁꯔꯨꯛ ꯇꯔꯥ ꯍꯦꯟꯅꯥ ꯁꯦꯜ ꯇꯥꯅꯈꯤ"
Goal Setting:,ꯄꯥꯟꯗꯝ ꯊꯝꯕꯥ: ꯱.
"Most People don't know how to set goals. Some set goals that are too general. These are, in reality,",ꯑꯌꯥꯝꯕꯥ ꯃꯤꯑꯣꯏꯁꯤꯡꯅꯥ ꯄꯥꯟꯗꯝ ꯊꯝꯕꯥ ꯈꯉꯗꯦ꯫
"fantasies common to everyone. Goals, on the other hand, are clear, written, specific, and measurable",ꯃꯤꯄꯨꯝ ꯈꯨꯗꯤꯡꯃꯛꯀꯤ ꯀꯃꯟ ꯑꯣꯏꯕꯥ ꯐꯦꯟꯁꯤꯇꯤꯁꯤꯡ꯫
"Most People fear failure. Failure hurts, but it is often necessary to experience failure in order to",ꯑꯌꯥꯝꯕꯥ ꯃꯤꯑꯣꯏꯁꯤꯡꯅꯥ ꯃꯥꯌ ꯄꯥꯀꯄꯥ ꯑꯁꯤ ꯀꯤꯔꯤ꯫
achieve the greatest success. Do not unconsciously sabotage yourself by not setting any goals in which,ꯈ꯭ꯕꯥꯏꯗꯒꯤ ꯆꯥꯎꯕꯥ ꯃꯥꯌ ꯄꯥꯀꯄꯥ ꯑꯗꯨ ꯐꯪꯕꯥ꯫
you might fail. They fear rejection. People are often afraid that if they are unsuccessful at achieving a,ꯅꯍꯥꯛꯅꯥ ꯃꯥꯌ ꯄꯥꯀꯄꯥ ꯉꯃꯒꯅꯤ꯫
"goal, others will be critical of them. This is remedied by keeping your goals to yourself at the outset; let","ꯄꯥꯟꯗꯝ, ꯑꯇꯣꯞꯄꯁꯤꯡꯅꯥ ꯃꯈꯣꯌꯒꯤ ꯃꯔꯃꯗꯥ ꯀ꯭ꯔꯤꯇꯤꯀꯦꯜ ꯑꯣꯏꯒꯅꯤ꯫"
others see your results and achievements once you've accomplished your goals,ꯑꯇꯣꯞꯄꯁꯤꯡꯅꯥ ꯅꯍꯥꯛꯀꯤ ꯄꯥꯟꯗꯃꯁꯤꯡ ꯑꯗꯨ ꯃꯄꯨꯡ ꯐꯥꯔꯕꯥ ꯃꯇꯨꯡꯗꯥ ꯅꯍꯥꯛꯀꯤ ꯔꯤꯖꯜꯇ ꯑꯃꯁꯨꯡ ꯑꯦꯆꯤꯚꯃꯦꯟꯇꯁꯤꯡ ꯑꯗꯨ ꯎꯕꯥ ꯐꯪꯏ
Some goals are called away from goals. These are usually framed in the negative. Here are a few,ꯄꯥꯟꯗꯝ ꯈꯔꯗꯤ ꯒꯣꯂꯁꯤꯡꯗꯒꯤ ꯂꯥꯞꯅꯥ ꯀꯧꯏ꯫
examples,ꯈꯨꯗꯝ ꯑꯣꯏꯅꯥ ꯄꯤꯕꯥ
•,• ꯑꯥꯏ .
I don’t want to smoke anymore,ꯑꯩꯅꯥ ꯍꯧꯖꯤꯛ ꯃꯩꯈꯨ ꯊꯥꯗꯣꯀꯄꯥ ꯄꯥꯃꯗꯦ .
•,• ꯑꯥꯏ .
I don’t want to be unfit,ꯑꯩꯅꯥ ꯑꯅꯐꯤꯠ ꯑꯣꯏꯕꯥ ꯄꯥꯃꯗꯦ .
•,• ꯑꯥꯏ .
I don’t want to be overweight,ꯑꯩꯅꯥ ꯑꯔꯨꯝꯕꯥ ꯍꯦꯟꯅꯥ ꯂꯩꯕꯥ ꯄꯥꯃꯗꯦ .
•,• ꯑꯥꯏ .
I don’t want to be broke,ꯑꯩꯅꯥ ꯕ꯭ꯔꯣꯛ ꯇꯧꯕꯥ ꯄꯥꯃꯗꯦ .
Now let’s reframe them in the positive,ꯍꯧꯖꯤꯛ ꯃꯈꯣꯌꯕꯨ ꯄꯣꯖꯤꯇꯤꯕ ꯑꯣꯏꯕꯥ ꯃꯑꯣꯡꯗꯥ ꯑꯃꯨꯛ ꯍꯟꯅꯥ ꯁꯦꯃꯗꯣꯀꯁꯤ .
•,• ꯑꯥꯏ .
I am a non smoker,ꯑꯩꯍꯥꯛ ꯅꯟ ꯁ꯭ꯃꯣꯀꯔ ꯑꯃꯅꯤ .
•,• ꯑꯥꯏ .
I am fit and healthy,ꯑꯩꯍꯥꯛ ꯐꯤꯠ ꯑꯣꯏꯅꯥ ꯂꯩꯔꯤ ꯑꯃꯁꯨꯡ ꯍꯀꯆꯥꯡ ꯐꯅꯥ ꯂꯩꯔꯤ .
•,• ꯑꯥꯏ .
I am at my ideal weight,ꯑꯩꯍꯥꯛꯅꯥ ꯑꯩꯍꯥꯛꯀꯤ ꯑꯥꯏꯗꯤꯌꯥꯜ ꯑꯣꯖꯟꯗꯥ ꯂꯩꯔꯤ .
•,• ꯑꯥꯏ .
I can cover my bills,ꯑꯩꯍꯥꯛꯅꯥ ꯑꯩꯍꯥꯛꯀꯤ ꯕꯤꯂꯁꯤꯡ ꯑꯗꯨ ꯀꯚꯔ ꯇꯧꯕꯥ ꯉꯝꯃꯤ .
Notice the difference. They are stated in the positive and take on the assumption that you have,ꯈꯦꯠꯅꯕꯥ ꯑꯗꯨ ꯈꯪꯖꯤꯅꯕꯤꯌꯨ꯫
achieved it already. By assuming “as if” your behaviour changes so that you are acting like to have,ꯍꯥꯟꯅꯗꯒꯤ ꯐꯪꯕꯥ ꯉꯃꯈꯤ꯫
already achieved what you wanted to do. What a great feeling to have even before you have got there. It,ꯍꯥꯟꯅꯅꯥ ꯑꯗꯣꯝꯅꯥ ꯇꯧꯕꯥ ꯄꯥꯝꯕꯥ ꯑꯗꯨ ꯐꯪꯕꯥ ꯉꯝꯂꯦ꯫
also bolsters your motivation,ꯑꯗꯨꯒꯥ ꯅꯍꯥꯛꯀꯤ ꯃꯣꯇꯤꯕꯦꯁꯟ ꯑꯗꯨꯁꯨ ꯍꯦꯟꯅꯥ ꯆꯦꯠꯁꯤꯂꯍꯜꯂꯤ
"So now we have determined if our goal is towards something, or away from something. We have",ꯑꯗꯨꯅꯥ ꯍꯧꯖꯤꯛ ꯑꯩꯈꯣꯌꯅꯥ ꯑꯩꯈꯣꯌꯒꯤ ꯄꯥꯟꯗꯝ ꯑꯁꯤ ꯀꯔꯤꯒꯨꯝꯕꯥ ꯑꯃꯒꯤ ꯃꯥꯌꯀꯩꯗꯥ ꯂꯩꯕꯔꯥ ꯅꯠꯔꯒꯥ ꯀꯔꯤꯒꯨꯝꯕꯥ ꯑꯃꯗꯒꯤ ꯂꯥꯞꯅꯥ ꯂꯩꯕꯔꯥ ꯍꯥꯌꯕꯗꯨ ꯂꯦꯄꯊꯣꯀꯈ꯭ꯔꯦ꯫
now stated it in the positive. This however is still not a very well detailed goal. We will now look at how,ꯍꯧꯖꯤꯛ ꯄꯣꯖꯤꯇꯤꯕ ꯑꯣꯏꯕꯥ ꯃꯑꯣꯡꯗꯥ ꯐꯣꯡꯗꯣꯀꯈꯤ꯫
we can make it more specific,ꯑꯩꯈꯣꯌꯅꯥ ꯃꯁꯤ ꯍꯦꯟꯅꯥ ꯑꯀꯛꯅꯕꯥ ꯑꯣꯏꯍꯅꯕꯥ ꯉꯃꯒꯅꯤ .
"An ideal goal should be expressed in the positive, be time bound and specific. You may also like","ꯑꯥꯏꯗꯤꯌꯥꯜ ꯄꯥꯟꯗꯝ ꯑꯃꯥ ꯄꯣꯖꯤꯇꯤꯕ ꯑꯣꯏꯕꯥ ꯃꯑꯣꯡꯗꯥ ꯐꯣꯡꯗꯣꯛꯀꯗꯕꯅꯤ, ꯃꯇꯝ ꯂꯦꯞꯄꯥ ꯑꯃꯁꯨꯡ ꯑꯀꯛꯅꯕꯥ ꯑꯣꯏꯍꯅꯒꯗꯕꯅꯤ꯫"
"to consider, how will you know when you have achieved it, what will it feel like, what will the people","ꯈꯟꯊꯕꯥ, ꯑꯗꯣꯝꯅꯥ ꯃꯁꯤ ꯀꯗꯥꯌꯗꯥ ꯐꯪꯕꯒꯦ ꯍꯥꯌꯕꯗꯨ ꯀꯔꯝꯅꯥ ꯈꯉꯒꯅꯤ, ꯃꯁꯤ ꯀꯔꯝꯅꯥ ꯑꯣꯏꯒꯅꯤ, ꯃꯤꯌꯥꯝꯅꯥ ꯀꯔꯤ ꯑꯣꯏꯒꯅꯤ ."
around you be like? What will you do to celebrate it?,ꯑꯀꯣꯏꯕꯗꯥ ꯅꯉꯕꯨ ꯃꯇꯧ ꯀꯔꯝꯅꯥ ꯂꯩꯔꯤꯕꯅꯣ?
A goal must be time bound. When do I want to have achieved it? If that’s when I want to achieve,ꯄꯥꯟꯗꯝ ꯑꯃꯥ ꯃꯇꯝ ꯂꯦꯞꯄꯥ ꯇꯥꯏ꯫
"it, then when must I start? What is the first step I need to take? Who should I tell? Should telling that","ꯃꯁꯤ, ꯑꯗꯨ ꯑꯣꯏꯔꯕꯗꯤ ꯑꯩꯅꯥ ꯀꯗꯥꯌꯗꯒꯤ ꯍꯧꯒꯗꯒꯦ?"
person be the first step? What skills or knowledge do I need to acquire along the way?,ꯃꯤꯑꯣꯏ ꯑꯗꯨ ꯑꯍꯥꯅꯕꯥ ꯈꯣꯡꯊꯥꯡ ꯑꯣꯏꯕꯤꯔꯕ꯭ꯔꯥ?
"Goal size, is the goal too big to achieve? If so then breaking it down into smaller bite sized pieces","ꯒꯣꯜ ꯁꯥꯏꯖ, ꯄꯥꯟꯗꯝ ꯑꯗꯨ ꯐꯪꯕꯗꯥ ꯌꯥꯝꯅꯥ ꯆꯥꯎꯕꯔꯥ?"
may be the right approach,ꯑꯆꯨꯝꯕꯥ ꯑꯦꯞꯔꯣꯆ ꯑꯣꯏꯕꯥ ꯌꯥꯏ .
1.6.2,꯱.꯶.꯲.
FACTORS RESPONSIBLE FOR SUCCESS:,ꯃꯥꯌ ꯄꯥꯀꯄꯒꯤ ꯗꯥꯌꯠꯕ ꯂꯧꯔꯤꯕꯥ ꯐꯦꯛꯇꯔꯁꯤꯡ:
1. Desire:,꯱.ꯑꯄꯥꯝꯕꯥ: ꯱.
The motivation to success comes from the burning desire to achieve a purpose,ꯃꯥꯌ ꯄꯥꯀꯄꯒꯤ ꯃꯣꯇꯤꯕꯦꯁꯟ ꯑꯁꯤ ꯄꯥꯟꯗꯝ ꯑꯃꯥ ꯐꯪꯅꯕꯒꯤ ꯃꯩꯈꯨ ꯆꯦꯟꯗꯕꯥ ꯑꯄꯥꯝꯕꯗꯒꯤ ꯂꯥꯀꯄꯅꯤ .
"Napoleon Hill wrote, ""Whatever the mind of man can conceive and believe, the mind can achieve.""","ꯅꯦꯄꯣꯂꯤꯌꯟ ꯍꯤꯂꯅꯥ ꯏꯈꯤ, “ꯃꯤꯑꯣꯏꯕꯒꯤ ꯋꯥꯈꯂꯅꯥ ꯈꯅꯒꯗꯕꯥ ꯑꯃꯁꯨꯡ ꯊꯥꯖꯕꯥ ꯉꯝꯕꯥ ꯑꯗꯨ, ꯋꯥꯈꯂꯅꯥ ꯐꯪꯕꯥ ꯉꯃꯒꯅꯤ꯫”"
A young man asked Socrates the secret to success. Socrates told the young man to meet him near,ꯅꯍꯥ ꯑꯃꯅꯥ ꯁꯣꯛꯔꯤꯇꯇꯥ ꯃꯥꯏꯄꯥꯀꯄꯒꯤ ꯊꯣꯏꯗꯣꯀꯄꯥ ꯋꯥꯐꯝ ꯑꯃꯥ ꯍꯪꯈꯤ꯫
the river the next morning. They met. Socrates asked the young man to walk with him toward the river,ꯃꯊꯪꯒꯤ ꯑꯌꯨꯛꯇꯥ ꯇꯨꯔꯦꯜ ꯑꯗꯨ꯫
"When the water got up to their neck, Socrates took the young man by surprise and ducked him into the",ꯏꯁꯤꯡꯅꯥ ꯃꯈꯣꯌꯒꯤ ꯀꯣꯛꯇꯥ ꯂꯥꯀꯄꯥ ꯃꯇꯃꯗꯥ ꯁꯣꯛꯔꯤꯇꯅꯥ ꯅꯍꯥ ꯑꯣꯏꯔꯤꯕꯥ ꯃꯤꯑꯣꯏ ꯑꯗꯨꯕꯨ ꯑꯉꯀꯄꯥ ꯄꯣꯀꯍꯅꯈꯤ ꯑꯃꯁꯨꯡ ꯃꯍꯥꯀꯄꯨ .
water. The boy struggled to get out but Socrates was strong and kept him there until the boy started,ꯏꯁꯤꯡ.
turning blue. Socrates pulled his head out of the water and the first thing the young man did was to gasp,ꯅꯤꯜ ꯈꯣꯡꯕꯥ꯫
"and take a deep breath of air. Socrates asked, 'What did you want the most when you were there?"" The boy",ꯑꯃꯁꯨꯡ ꯅꯨꯡꯁꯤꯠꯀꯤ ꯈꯣꯡꯖꯦꯜ ꯌꯥꯡꯅꯥ ꯁ꯭ꯕꯔ ꯍꯣꯅꯒꯗꯕꯅꯤ꯫
"replied, ""Air."" Socrates said, ""That is the secret to success. When you want success as badly as you wanted","ꯄꯥꯎꯈꯨꯝ ꯄꯤꯔꯀꯏ, ""ꯑꯦꯌꯔ꯫"""
"the air, then you will get it."" There is no other secret","ꯑꯦꯌꯔ, ꯃꯗꯨꯒꯤ ꯃꯇꯨꯡꯗꯥ ꯅꯍꯥꯛꯅꯥ ꯐꯪꯒꯅꯤ꯫"""
A burning desire is the starting point of all accomplishment. Just like a small fire cannot give,ꯃꯩꯅꯥ ꯆꯥꯀꯄꯥ ꯑꯄꯥꯝꯕꯥ ꯍꯥꯌꯕꯁꯤ ꯑꯦꯆꯤꯕꯃꯦꯟꯇ ꯄꯨꯝꯅꯃꯛꯀꯤ ꯍꯧꯔꯀꯐꯃꯅꯤ꯫
"much heat, a weak desire cannot produce great results","ꯌꯥꯝꯅꯥ ꯅꯨꯡꯉꯥꯏꯕꯥ, ꯋꯥꯈꯜ ꯋꯥꯕꯥ ꯑꯄꯥꯝꯕꯥ ꯑꯃꯅꯥ ꯑꯆꯧꯕꯥ ꯐꯂꯁꯤꯡ ꯄꯨꯔꯀꯄꯥ ꯉꯃꯗꯦ"
2. Commitment:,꯲.ꯀꯃꯤꯠꯃꯦꯟꯇ: ꯱.
Integrity and wisdom are the two pillars on which to build and keep commitments,ꯏꯟꯇꯤꯒ꯭ꯔꯤꯇꯤ ꯑꯃꯁꯨꯡ ꯋꯤꯖꯗꯝ ꯑꯁꯤ ꯀꯝꯃꯤꯠꯃꯦꯟꯇꯁꯤꯡ ꯁꯦꯃꯒꯠꯄꯥ ꯑꯃꯁꯨꯡ ꯊꯝꯅꯕꯥ ꯌꯨꯝꯕꯤ ꯑꯅꯤꯅꯤ .
"This point is best illustrated by the manager, who told one of his staff members, ""Integrity is keeping your","ꯃꯁꯤꯒꯤ ꯋꯥꯐꯝ ꯑꯁꯤ ꯃꯦꯅꯦꯖꯔꯅꯥ ꯈ꯭ꯕꯥꯏꯗꯒꯤ ꯐꯕꯥ ꯃꯑꯣꯡꯗꯥ ꯎꯠꯂꯤ, ꯃꯍꯥꯛꯅꯥ ꯃꯍꯥꯛꯀꯤ ꯁ꯭ꯇꯥꯐ ꯃꯦꯝꯕꯔ ꯑꯃꯗꯥ ꯍꯥꯌꯈꯤ, ""ꯏꯟꯠꯔꯤꯇꯤ ꯑꯁꯤ ꯅꯍꯥꯛꯀꯤ ꯊꯝꯕꯥ ꯑꯁꯤꯅꯤ"
"commitment even if you lose money and wisdom is not to make such foolish commitments.""",ꯀꯃꯤꯠꯃꯦꯟꯇ ꯑꯁꯤ ꯑꯗꯣꯝꯅꯥ ꯁꯦꯟ ꯑꯃꯁꯨꯡ ꯂꯧꯁꯤꯡ ꯃꯥꯡꯈ꯭ꯔꯕꯁꯨ ꯑꯁꯤꯒꯨꯝꯕꯥ ꯃꯈꯂꯒꯤ ꯃꯨꯔꯈ ꯀꯃꯤꯠꯃꯦꯟꯇꯁꯤꯡ ꯑꯁꯤ ꯄꯤꯕꯥ ꯅꯠꯇꯦ꯫”
Prosperity and success are the result of our thoughts and decisions. It is our decision what,ꯌꯥꯏꯐꯕꯥ ꯑꯃꯁꯨꯡ ꯃꯥꯌ ꯄꯥꯀꯄꯥ ꯑꯁꯤ ꯑꯩꯈꯣꯌꯒꯤ ꯋꯥꯈꯜꯂꯣꯟ ꯑꯃꯁꯨꯡ ꯋꯥꯔꯦꯄꯁꯤꯡꯒꯤ ꯃꯍꯩꯅꯤ꯫
thoughts will dominate our lives. Success is not an accident. It is the result of our attitude,ꯋꯥꯈꯂꯁꯤꯡꯅꯥ ꯑꯩꯈꯣꯌꯒꯤ ꯄꯨꯟꯁꯤꯗꯥ ꯍꯦꯟꯅꯥ ꯂꯨꯝꯂꯒꯅꯤ꯫
"There is a big difference between playing to win and playing not to lose. When we play to win, we",ꯃꯥꯏ ꯄꯥꯛꯅꯕꯥ ꯁꯥꯟꯅꯕꯥ ꯑꯃꯁꯨꯡ ꯃꯥꯏꯊꯤꯕꯥ ꯄꯤꯗꯅꯕꯥ ꯁꯥꯟꯅꯕꯒꯤ ꯃꯔꯛꯇꯥ ꯑꯆꯧꯕꯥ ꯈꯦꯠꯅꯕꯥ ꯑꯃꯥ ꯂꯩ꯫
"play with enthusiasm and commitment; whereas when we play not to lose, we are playing from a position",ꯊꯋꯥꯏ ꯌꯥꯑꯣꯕꯥ ꯑꯃꯁꯨꯡ ꯀꯃꯤꯠꯃꯦꯟꯇꯀꯥ ꯂꯣꯌꯅꯅꯥ ꯁꯥꯟꯅꯕꯥ;
"of weakness. When we play not to lose, we are playing to avoid failure. We all want to win, but very few",ꯋꯥꯈꯜ ꯋꯥꯕꯥ꯫
are prepared to pay the price to prepare to win. Winners condition and commit themselves to winning,ꯃꯥꯏꯄꯥꯛꯅꯕꯥ ꯁꯦꯝ ꯁꯥꯅꯕꯥ ꯃꯃꯜ ꯄꯤꯅꯕꯥ ꯁꯦꯝ ꯁꯥꯔꯤ꯫
"Playing to win comes out of inspiration, whereas playing not to lose comes out of desperation","ꯃꯥꯏ ꯄꯥꯛꯅꯕꯥ ꯁꯥꯟꯅꯕꯅꯥ ꯏꯟꯁꯄꯤꯔꯦꯁꯅꯗꯒꯤ ꯊꯣꯛꯂꯀꯏ, ꯑꯗꯨꯒꯥ ꯃꯥꯏꯊꯤꯕꯥ ꯄꯤꯗꯅꯕꯥ ꯁꯥꯟꯅꯕꯅꯥ ꯋꯥꯈꯜ ꯋꯥꯕꯥ ꯊꯦꯡꯅꯕꯗꯒꯤ ꯊꯣꯀꯏ꯫"
There are no ideal circumstances. There will never be. To reach anywhere we cannot just drift nor,ꯑꯐꯕꯥ ꯐꯤꯚꯝ ꯑꯃꯠꯇꯥ ꯂꯩꯇꯦ꯫
"lie at anchor. We need to sometimes sail with the wind and sometimes against it, but sail we must",ꯑꯦꯉ꯭ꯀꯔꯗꯥ ꯂꯩ꯫
Ask any coach or athlete what the difference between the best and the worst team is. There would be very,ꯀꯣꯆ ꯅꯠꯠꯔꯒꯥ ꯑꯦꯊꯂꯦꯠ ꯑꯃꯍꯦꯛꯇꯗꯥ ꯈ꯭ꯕꯥꯏꯗꯒꯤ ꯐꯕꯥ ꯑꯃꯁꯨꯡ ꯈ꯭ꯕꯥꯏꯗꯒꯤ ꯐꯠꯇꯕꯥ ꯇꯤꯃꯒꯤ ꯃꯔꯛꯇꯥ ꯂꯩꯔꯤꯕꯥ ꯈꯦꯠꯅꯕꯥ ꯑꯁꯤ ꯀꯔꯤꯅꯣ ꯍꯥꯌꯅꯥ ꯍꯪꯕꯤꯌꯨ꯫
"little difference in their physique, talent and ability. The biggest difference you will find is emotional","ꯃꯈꯣꯌꯒꯤ ꯐꯤꯖꯤꯀꯦꯜ, ꯇꯦꯂꯦꯟꯇ ꯑꯃꯁꯨꯡ ꯑꯦꯕꯤꯂꯤꯇꯤꯗꯥ ꯈꯦꯠꯅꯕꯥ ꯈꯔꯥ ꯂꯩ꯫"
"difference. The winning team has dedication and they make the extra effort.  To a winner, the tougher the",ꯈꯦꯟꯅꯕ.
competition,ꯆꯥꯡꯌꯦꯡꯅꯕ
3. Responsibility,꯳.ꯊꯧꯗꯥꯡ ꯳.
A duty which becomes a desire will ultimately become a delight. --George Gritter,ꯑꯄꯥꯝꯕꯥ ꯑꯃꯥ ꯑꯣꯏꯔꯀꯄꯥ ꯗ꯭ꯌꯨꯇꯤ ꯑꯃꯥ ꯑꯔꯣꯏꯕꯗꯥ ꯅꯨꯡꯉꯥꯏꯕꯥ ꯑꯃꯥ ꯑꯣꯏꯔꯒꯅꯤ꯫
People with character accept responsibilities. They make decisions and determine their own destiny in life,ꯆꯔꯤꯠꯔ ꯂꯩꯕꯥ ꯃꯤꯑꯣꯏꯁꯤꯡꯅꯥ ꯊꯧꯗꯥꯡꯁꯤꯡ ꯂꯧꯏ꯫
Accepting responsibilities involves taking risks and being accountable which is sometimes uncomfortable,ꯊꯧꯗꯥꯡꯁꯤꯡ ꯌꯥꯕꯥ ꯍꯥꯌꯕꯁꯤ ꯀꯔꯤꯒꯨꯝꯕꯥ ꯃꯇꯃꯗꯥ ꯅꯨꯡꯉꯥꯏꯇꯕꯥ ꯋꯥꯐꯝ ꯑꯃꯥ ꯑꯣꯏꯔꯤꯕꯥ ꯔꯤꯁ꯭ꯛ ꯂꯧꯕꯥ ꯑꯃꯁꯨꯡ ꯑꯦꯀꯥꯎꯟꯇꯦꯕꯜ ꯑꯣꯏꯕꯥ ꯍꯥꯌꯕꯁꯤꯅꯤ
Most people would rather stay in their comfort zone and live passive lives without accepting,ꯑꯌꯥꯝꯕꯥ ꯃꯤꯑꯣꯏꯁꯤꯡꯅꯥ ꯃꯈꯣꯌꯒꯤ ꯀꯝꯐꯣꯔꯠ ꯖꯣꯅꯗꯥ ꯂꯩꯕꯥ ꯑꯃꯁꯨꯡ ꯌꯥꯗꯅꯥ ꯄꯦꯁꯤꯐꯤꯛ ꯑꯣꯏꯕꯥ ꯄꯨꯟꯁꯤ ꯍꯤꯡꯕꯥ ꯍꯦꯟꯅꯥ ꯐꯩ꯫
responsibilities. They drift through life waiting for things to happen rather than making them happen,ꯊꯧꯗꯥꯡꯁꯤꯡ ꯂꯧꯕꯥ꯫
"Accepting responsibilities involves taking calculated, not foolish, risks. It means evaluating all the pros","ꯊꯧꯗꯥꯡꯁꯤꯡ ꯌꯥꯕꯥ ꯍꯥꯌꯕꯁꯤꯗꯥ ꯀꯦꯂꯀꯨꯂꯦꯠ ꯇꯧꯕꯥ, ꯃꯨꯔꯈ ꯑꯣꯏꯕꯥ ꯅꯠꯇꯦ, ꯔꯤꯁ꯭ꯀꯁꯤꯡ ꯂꯧꯕꯥ ꯍꯥꯌꯕꯁꯤ ꯌꯥꯎꯏ꯫"
"and cons, then taking the most appropriate decision or action. Responsible people don't think that the","ꯑꯃꯁꯨꯡ ꯀꯟꯁ, ꯃꯗꯨꯒꯤ ꯃꯇꯨꯡꯗꯥ ꯈ꯭ꯕꯥꯏꯗꯒꯤ ꯆꯨꯅꯕꯥ ꯋꯥꯔꯦꯞ ꯅꯠꯔꯒꯥ ꯑꯦꯛꯁꯟ ꯂꯧꯕꯥ꯫"
world owes them a living,ꯃꯥꯂꯦꯝ ꯑꯁꯤꯅꯥ ꯃꯈꯣꯌꯗꯥ ꯍꯤꯡꯂꯤꯕꯥ ꯑꯃꯥ ꯔ꯭ꯏꯟ ꯂꯩꯔꯤ .
4. Hard Work:,꯴.ꯑꯀꯅꯕꯥ ꯊꯕꯛ ꯇꯧꯕꯥ:
Success is not something that you run into by accident. It takes a lot of preparation and character,ꯃꯥꯌ ꯄꯥꯀꯄꯥ ꯍꯥꯌꯕꯁꯤ ꯑꯗꯣꯝꯅꯥ ꯑꯦꯛꯁꯤꯗꯦꯟꯇ ꯑꯃꯅꯥ ꯊꯦꯡꯅꯔꯤꯕꯥ ꯋꯥꯐꯝ ꯑꯃꯅꯤ꯫
Everyone likes to win but how many are willing to put in the effort and time to prepare to win? It takes,ꯃꯤꯄꯨꯝ ꯈꯨꯗꯤꯡꯃꯛꯅꯥ ꯃꯥꯏ ꯄꯥꯀꯄꯥ ꯄꯥꯝꯃꯤ ꯑꯗꯨꯕꯨ ꯃꯥꯏ ꯄꯥꯛꯅꯕꯥ ꯁꯦꯝ ꯁꯥꯅꯕꯥ ꯍꯣꯠꯅꯕꯥ ꯑꯃꯁꯨꯡ ꯃꯇꯝ ꯑꯁꯤ ꯀꯌꯥ ꯌꯥꯝꯅꯥ ꯊꯝꯅꯕꯥ ꯌꯥꯅꯤꯡꯕꯒꯦ?
sacrifice and self-discipline. There is no substitute for hard work,ꯀꯠꯊꯣꯀꯄꯥ ꯑꯃꯁꯨꯡ ꯁꯦꯜꯐ-ꯗꯤꯁꯤꯞꯂꯤꯟ ꯄꯤꯕꯥ꯫
"Henry Ford said, ""The harder you work, the luckier you get.""","ꯍꯦꯅꯔꯤ ꯐꯣꯔꯗꯅꯥ ꯍꯥꯌꯔꯀꯏ, ""ꯅꯍꯥꯛꯅꯥ ꯍꯦꯟꯅꯥ ꯀꯟꯅꯥ ꯊꯕꯛ ꯇꯧꯕꯥ ꯃꯇꯃꯗꯥ, ꯅꯍꯥꯛꯅꯥ ꯍꯦꯟꯅꯥ ꯂꯛꯁ꯭ꯃꯤ ꯐꯪꯏ꯫"""
"The world is full of willing workers, some willing to work and the others willing to let them","ꯃꯥꯂꯦꯝ ꯑꯁꯤ ꯌꯥꯝꯅꯥ ꯊꯋꯥꯏ ꯌꯥꯑꯣꯕꯥ ꯁꯤꯟꯃꯤꯁꯤꯡꯅꯥ ꯊꯜꯂꯦ, ꯈꯔꯅꯥ ꯊꯕꯛ ꯇꯧꯕꯥ ꯌꯥꯕꯥ ꯑꯃꯁꯨꯡ ꯑꯇꯣꯞꯄꯥ ꯈꯔꯅꯥ ꯃꯈꯣꯌꯕꯨ ꯌꯥꯍꯅꯕꯥ ꯄꯥꯝꯕꯥ ꯑꯁꯤ ."
“I like to work half a day. I don't care if it is the first 12 hours or the second 12 hours.”,“ꯑꯩꯍꯥꯛꯅꯥ ꯅꯨꯃꯤꯠ ꯇꯔꯦꯠꯅꯤ ꯊꯕꯛ ꯇꯧꯕꯥ ꯄꯥꯝꯃꯤ꯫ꯑꯍꯥꯅꯕꯥ ꯄꯨꯡ ꯱꯲ ꯅꯠꯔꯒꯥ ꯑꯅꯤꯁꯨꯕꯥ ꯄꯨꯡ ꯱꯲ ꯑꯣꯏꯔꯕꯁꯨ ꯑꯩꯍꯥꯛꯅꯥ ꯋꯥꯐꯝ ꯑꯃꯠꯇꯥ ꯊꯃꯗꯦ꯫”
"--Kammons Wilson, CEO of Holiday Inn","--ꯀꯝꯃꯅꯁ ꯋꯤꯂꯁꯟ, ꯍꯣꯂꯤꯗꯦ ꯏꯅꯒꯤ ꯁꯤ.ꯏ.ꯑꯣ."
"One cannot develop a capacity to do anything without hard work, just as a person cannot learn how to","ꯀꯅꯥꯒꯨꯝꯕꯥ ꯑꯃꯅꯥ ꯀꯟꯅꯥ ꯍꯣꯠꯅꯕꯥ ꯌꯥꯗꯅꯥ ꯀꯔꯤꯒꯨꯝꯕꯥ ꯑꯃꯠꯇꯥ ꯇꯧꯕꯒꯤ ꯀꯦꯄꯥꯁꯤꯇꯤ ꯑꯃꯥ ꯁꯦꯃꯒꯠꯄꯥ ꯉꯃꯗꯦ, ꯃꯤꯑꯣꯏ ꯑꯃꯅꯥ ꯃꯇꯧ ꯀꯔꯝꯅꯥ ꯇꯝꯕꯥ ꯇꯝꯂꯤꯕꯅꯣ ꯍꯥꯌꯕꯗꯨ ꯈꯉꯕꯥ ꯉꯃꯗꯦ꯫"
spell by sitting on a dictionary. Professionals make things look easy because they have mastered the,ꯗꯤꯛꯁꯅꯥꯔꯤ ꯑꯃꯗꯥ ꯐꯃꯗꯨꯅꯥ ꯁ꯭ꯄꯦꯜ ꯇꯧꯕꯥ꯫
fundamentals of whatever they do,ꯃꯈꯣꯌꯅꯥ ꯇꯧꯔꯤꯕꯥ ꯊꯕꯛ ꯈꯨꯗꯤꯡꯃꯛ .
"“If people knew how hard I had to work to gain my mastery, it wouldn't seem wonderful at all.”","“ꯀꯔꯤꯒꯨꯝꯕꯥ ꯃꯤꯌꯥꯝꯅꯥ ꯑꯩꯒꯤ ꯃꯥꯁ꯭ꯇꯔ ꯑꯁꯤ ꯐꯪꯅꯕꯥ ꯀꯌꯥ ꯌꯥꯝꯅꯥ ꯀꯟꯅꯥ ꯍꯣꯠꯅꯒꯗꯒꯦ ꯍꯥꯌꯕꯥ ꯈꯉꯂꯕꯗꯤ, ꯃꯁꯤ ꯌꯥꯝꯅꯥ ꯑꯉꯀꯄꯥ ꯑꯣꯏꯅꯥ ꯎꯕꯥ ꯐꯪꯂꯣꯏ꯫”"
--Michaelangelo,--ꯃꯥꯏꯀꯦꯜ ꯑꯦꯟꯖꯦꯂꯣ
"An executive called a company to check on a potential candidate. He asked the candidate's supervisor,",ꯑꯦꯒꯖꯤꯛꯌꯨꯇꯤꯕ ꯑꯃꯅꯥ ꯀꯝꯄꯦꯅꯤ ꯑꯃꯗꯥ ꯀꯧꯈꯤ ꯃꯗꯨꯗꯤ ꯄꯣꯇꯦꯟꯁꯤꯌꯦꯜ ꯀꯦꯟꯗꯤꯗꯦꯠ ꯑꯃꯥ ꯆꯦꯛ ꯇꯧꯅꯕꯥ꯫
"""How long has he worked for you?"" The man replied, ""Three days."" The executive said. ""But he told me","""ꯀꯔꯤ ꯀꯨꯏꯅꯥ ꯅꯉꯒꯤꯗꯃꯛ ꯊꯕꯛ ꯇꯧꯈꯤꯕꯒꯦ?"""
