en,mni-Mtei
This was particularly so in terms of the reduced role of the Catholic Church for those living in rural areas closing of the churches meant a loss of normality,ꯃꯁꯤ ꯃꯔꯨ ꯑꯣꯏꯅꯥ ꯑꯣꯏꯈꯤ ꯃꯗꯨꯗꯤ ꯀꯦꯊꯣꯂꯤꯛ ꯁꯤꯡꯂꯨꯄꯀꯤ ꯊꯧꯗꯥꯡ ꯍꯟꯊꯔꯀꯄꯒꯤ ꯃꯇꯥꯡꯗꯥ ꯁꯤꯡꯂꯨꯄꯁꯤꯡ ꯂꯣꯏꯁꯤꯅꯕꯥ ꯈꯨꯉ꯭ꯒꯪꯒꯤ ꯃꯐꯃꯁꯤꯡꯗꯥ ꯂꯩꯔꯤꯕꯥ ꯃꯤꯑꯣꯏꯁꯤꯡꯒꯤꯗꯃꯛ ꯅꯣꯔꯃꯦꯂꯤꯇꯤ ꯃꯥꯡꯈꯤꯕꯥ ꯌꯥꯏ
This sparked a counterrevolutionary movement led by women while supporting other political and social changes they opposed the dissolution of the Catholic Church and revolutionary cults like the Cult of the Supreme Being,ꯃꯁꯤꯅꯥ ꯅꯨꯄꯤꯁꯤꯡꯅꯥ ꯂꯨꯆꯤꯡꯕꯥ ꯀꯥꯎꯟꯇꯔꯔꯤꯚꯣꯂꯨꯁꯅꯔꯤ ꯃꯨꯕꯃꯦꯟꯇ ꯑꯃꯥ ꯊꯣꯀꯍꯅꯈꯤ ꯑꯗꯨꯒꯥ ꯑꯇꯣꯞꯄꯥ ꯔꯥꯖꯅꯤꯇꯤꯒꯤ ꯑꯃꯁꯨꯡ ꯈꯨꯟꯅꯥꯏꯒꯤ ꯑꯣꯏꯕꯥ ꯑꯍꯣꯡꯕꯁꯤꯡꯗꯥ ꯃꯇꯦꯡ ꯄꯥꯡꯂꯤ ꯃꯈꯣꯌꯅꯥ ꯀꯦꯊꯣꯂꯤꯛ ꯁꯤꯡꯂꯨꯄꯀꯤ ꯑꯔꯥꯅꯕꯥ ꯑꯃꯁꯨꯡ ꯔꯤꯚꯣꯂꯨꯁꯅꯔꯤ ꯀꯂꯆꯔꯁꯤꯡ ꯑꯁꯤ ꯁꯨꯞꯔꯤꯝ ꯕꯤꯌꯤꯡꯒꯤ ꯀꯂꯆꯔꯒꯨꯝꯕꯥ ꯔꯤꯚꯣꯂꯨꯁꯅꯔꯤ ꯀꯂꯆꯔꯁꯤꯡꯒꯤ ꯃꯥꯌꯣꯛꯇꯥ ꯂꯥꯟꯊꯦꯡꯅꯈꯤ꯫
Olwen Hufton argues some wanted to protect the Church from heretical changes enforced by revolutionaries viewing themselves as defenders of faith,ꯑꯣꯂꯋꯦꯟ ꯍꯨꯐꯇꯅꯅꯥ ꯋꯥꯐꯝ ꯑꯁꯤ ꯊꯝꯂꯤ ꯃꯗꯨꯗꯤ ꯈꯔꯅꯥ ꯁꯤꯡꯂꯨꯄꯄꯨ ꯊꯥꯖꯕꯥ ꯉꯥꯀꯊꯣꯀꯆꯕꯥ ꯃꯤꯑꯣꯏꯁꯤꯡꯅꯤ ꯍꯥꯌꯅꯥ ꯂꯧꯗꯨꯅꯥ ꯔꯤꯚꯣꯂꯨꯁꯅꯔꯤꯁꯤꯡꯅꯥ ꯆꯠꯅꯍꯅꯕꯥ ꯍꯦꯔꯦꯇꯤꯀꯦꯂꯒꯤ ꯑꯣꯏꯕꯥ ꯑꯍꯣꯡꯕꯁꯤꯡꯗꯒꯤ ꯉꯥꯀꯊꯣꯀꯄꯥ ꯄꯥꯃꯈꯤ꯫
Olympe de Gouges was an author whose publications emphasised that while women and men were different this should not prevent equality under the law,"ꯑꯣꯂꯤꯝꯄꯦ ꯗꯦ ꯒꯧꯁ ꯑꯁꯤ ꯑꯣꯊꯣꯔꯤꯇꯤ ꯑꯃꯅꯤ, ꯃꯍꯥꯛꯀꯤ ꯄꯕ꯭ꯂꯤꯀꯦꯁꯅꯁꯤꯡꯅꯥ ꯑꯀꯅꯕꯥ ꯋꯥꯐꯝ ꯊꯃꯈꯤ ꯃꯗꯨꯗꯤ ꯅꯨꯄꯤ ꯑꯃꯁꯨꯡ ꯅꯨꯄꯥꯁꯤꯡꯅꯥ ꯇꯣꯉꯥꯟ ꯇꯣꯉꯥꯅꯕꯥ ꯑꯣꯏꯔꯕꯁꯨ ꯃꯁꯤꯅꯥ ꯑꯥꯏꯅꯒꯤ ꯃꯈꯥꯗꯥ ꯃꯥꯟꯅꯕꯥ ꯊꯤꯡꯔꯣꯏꯗꯕꯅꯤ꯫"
In her Declaration of the Rights of Woman and of the Female Citizen she insisted women deserved rights especially in areas concerning them directly such as divorce and recognition of illegitimate children,ꯃꯍꯥꯛꯀꯤ ꯅꯨꯄꯤꯒꯤ ꯍꯀꯁꯤꯡ ꯑꯃꯁꯨꯡ ꯅꯨꯄꯤ ꯅꯥꯒꯔꯤꯛ ꯑꯗꯨꯒꯤ ꯗꯤꯛꯂꯥꯔꯦꯁꯟꯗꯥ ꯃꯍꯥꯛꯅꯥ ꯅꯨꯄꯤꯁꯤꯡꯅꯥ ꯃꯔꯨꯑꯣꯏꯅꯥ ꯃꯈꯣꯌꯒꯥ ꯃꯔꯤ ꯂꯩꯅꯕꯥ ꯂꯃꯁꯤꯡꯗꯥ ꯍꯀꯁꯤꯡ ꯇꯂꯥꯛ ꯇꯧꯕꯥ ꯑꯃꯁꯨꯡ ꯑꯥꯏꯟꯅꯥ ꯌꯥꯗꯕꯥ ꯑꯉꯥꯡꯁꯤꯡꯕꯨ ꯁꯀꯈꯉꯕꯥ ꯑꯁꯤꯅꯆꯤꯡꯕꯥ ꯍꯀꯁꯤꯡ ꯐꯪꯐꯝ ꯊꯣꯀꯏ ꯍꯥꯌꯅꯥ ꯂꯥꯎꯊꯣꯀꯈꯤꯕꯥ ꯑꯗꯨꯗꯥ
Along with other Girondists she was executed in November 1793 during the Terror,ꯑꯇꯣꯞꯄꯥ ꯖꯤꯔꯣꯟꯗꯤꯁ꯭ꯇꯁꯤꯡꯒꯥ ꯂꯣꯌꯅꯅꯥ ꯃꯍꯥꯀꯄꯨ ꯇꯦꯔꯣꯔꯤꯖꯃꯒꯤ ꯃꯇꯃꯗꯥ ꯅꯕꯦꯝꯕꯔ ꯱꯷꯹꯳ꯗꯥ ꯐꯥꯈꯤ
Madame Roland also known as Manon or Marie Roland was another important female activist whose political focus was not specifically women but other aspects of the government,"ꯃꯦꯗꯝ ꯔꯣꯂꯥꯟꯗꯅꯥ ꯃꯥꯅꯟ ꯅꯠꯔꯒꯥ ꯃꯦꯔꯤ ꯔꯣꯂꯥꯟꯗ ꯍꯥꯌꯅꯥ ꯈꯉꯅꯕꯥ ꯑꯁꯤ ꯑꯇꯣꯞꯄꯥ ꯃꯔꯨꯑꯣꯏꯕꯥ ꯅꯨꯄꯤ ꯑꯦꯛꯇꯤꯕꯤꯁ꯭ꯠ ꯑꯃꯅꯤ, ꯃꯍꯥꯛꯀꯤ ꯔꯥꯖꯅꯤꯇꯤꯒꯤ ꯑꯣꯏꯕꯥ ꯃꯤꯠꯌꯦꯡ ꯑꯁꯤ ꯑꯀꯛꯅꯕꯥ ꯅꯨꯄꯤꯁꯤꯡ ꯅꯠꯇꯦ ꯑꯗꯨꯕꯨ ꯁꯔꯀꯥꯔꯒꯤ ꯑꯇꯣꯞꯄꯥ ꯃꯁꯀꯁꯤꯡꯅꯤ"
A Girondist her personal letters to leaders of the Revolution influenced policy in addition she often hosted political gatherings of the Brissotins a political group which allowed women to join,ꯖꯤꯔꯣꯟꯗꯤꯁ꯭ꯠ ꯑꯃꯅꯥ ꯔꯤꯚꯣꯂꯨꯁꯅꯒꯤ ꯂꯨꯆꯤꯡꯕꯁꯤꯡꯗꯥ ꯄꯤꯈꯤꯕꯥ ꯃꯍꯥꯛꯀꯤ ꯄꯔꯁꯣꯅꯦꯜ ꯂꯦꯇꯔꯁꯤꯡꯅꯥ ꯄꯣꯂꯤꯁꯤꯗꯥ ꯏꯊꯤꯜ ꯄꯤꯈꯤ ꯃꯁꯤꯒꯤ ꯃꯊꯛꯇꯥ ꯃꯍꯥꯛꯅꯥ ꯑꯌꯥꯝꯕꯅꯥ ꯕ꯭ꯔꯤꯁꯣꯇꯤꯅꯁꯤꯡꯒꯤ ꯄꯣꯂꯤꯇꯤꯀꯦꯜ ꯒꯦꯗꯔꯤꯡꯁꯤꯡ ꯄꯥꯡꯊꯣꯀꯈꯤ ꯃꯗꯨꯗꯥ ꯔꯥꯖꯅꯤꯇꯤꯒꯤ ꯀꯥꯡꯂꯨꯞ ꯑꯃꯥ ꯌꯥꯑꯣꯈꯤ ꯃꯗꯨꯅꯥ ꯅꯨꯄꯤꯁꯤꯡꯕꯨ ꯌꯥꯑꯣꯕꯥ ꯌꯥꯍꯅꯈꯤ
She too was executed in November 1793,ꯃꯍꯥꯀꯁꯨ ꯅꯕꯦꯝꯕꯔ ꯱꯷꯹꯳ꯗꯥ ꯐꯥꯈꯤ꯫
The Revolution abolished many economic constraints imposed by the Ancien Régime including church tithes and feudal dues although tenants often paid higher rents and taxes,ꯔꯤꯚꯣꯂꯨꯁꯟ ꯑꯁꯤꯅꯥ ꯇꯦꯟꯗꯔꯁꯤꯡꯅꯥ ꯑꯌꯥꯝꯕꯅꯥ ꯍꯦꯟꯅꯥ ꯋꯥꯡꯕꯥ ꯚꯥꯔꯥ ꯑꯃꯁꯨꯡ ꯇꯦꯛꯁ ꯄꯤꯔꯕꯁꯨ ꯁꯤꯡꯂꯨꯄꯀꯤ ꯇꯔꯥꯒꯤ ꯑꯃꯥ ꯑꯃꯁꯨꯡ ꯐ꯭ꯌꯨꯗꯜ ꯗ꯭ꯌꯨꯁꯤꯡ ꯌꯥꯑꯣꯅꯥ ꯑꯦꯟꯁꯤꯌꯦꯟ ꯔꯦꯖꯤꯃꯅꯥ ꯄꯤꯔꯤꯕꯥ ꯁꯦꯜ-ꯊꯨꯃꯒꯤ ꯑꯊꯤꯡꯕꯥ ꯀꯌꯥ ꯂꯧꯊꯣꯀꯈꯤ꯫
All church lands were nationalised along with those owned by Royalist exiles which were used to back paper currency known as assignats and the feudal guild system eliminated,ꯁꯤꯡꯂꯨꯄꯀꯤ ꯂꯝ ꯄꯨꯝꯅꯃꯛ ꯑꯁꯤ ꯔꯣꯌꯦꯂꯤꯁ꯭ꯠ ꯑꯦꯛꯁꯥꯏꯂꯁꯤꯡꯅꯥ ꯃꯄꯨ ꯑꯣꯏꯕꯁꯤꯡꯒꯥ ꯂꯣꯌꯅꯅꯥ ꯅꯦꯁ꯭ꯅꯦꯂꯥꯏꯖ ꯇꯧꯈꯤ ꯃꯗꯨꯗꯤ ꯃꯈꯣꯌꯁꯤꯡ ꯑꯁꯤ ꯑꯦꯁꯥꯏꯅꯠ ꯍꯥꯌꯅꯥ ꯈꯉꯅꯕꯥ ꯄꯦꯄꯔ ꯀꯔꯔꯦꯟꯁꯤ ꯑꯃꯁꯨꯡ ꯐ꯭ꯌꯨꯗꯜ ꯒꯤꯜꯗ ꯁꯤꯁ꯭ꯇꯦꯝ ꯑꯁꯤ ꯂꯧꯊꯣꯀꯈꯤꯕꯅꯤ
It also abolished the highly inefficient system of tax farming whereby private individuals would collect taxes for a hefty fee,ꯃꯁꯤꯅꯥ ꯌꯥꯝꯅꯥ ꯏꯅꯑꯦꯐꯤꯁꯤꯌꯦꯟꯇ ꯑꯣꯏꯕꯥ ꯇꯦꯛꯁ ꯐꯥꯔꯃꯤꯡꯒꯤ ꯁꯤꯁ꯭ꯇꯦꯝ ꯑꯁꯤꯁꯨ ꯂꯣꯏꯁꯤꯅꯈꯤ ꯃꯗꯨꯗꯥ ꯂꯅꯥꯏ ꯃꯤꯑꯣꯏꯁꯤꯡꯅꯥ ꯌꯥꯝꯅꯥ ꯂꯨꯕꯥ ꯐꯤ ꯑꯃꯒꯤꯗꯃꯛ ꯇꯦꯛꯁ ꯂꯧꯒꯅꯤ
The government seized the foundations that had been set up starting in the 13th century to provide an annual stream of revenue for hospitals poor relief and education,ꯍꯣꯁ꯭ꯄꯤꯇꯥꯜ ꯐꯠꯇꯕꯥ ꯔꯤꯂꯤꯐ ꯑꯃꯁꯨꯡ ꯑꯦꯖꯨꯀꯦꯁꯅꯒꯤꯗꯃꯛꯇꯥ ꯆꯍꯤꯒꯤ ꯑꯣꯏꯅꯥ ꯁꯦꯟꯊꯣꯛ ꯂꯝꯕꯤ ꯑꯃꯥ ꯄꯤꯅꯕꯥ ꯱꯳ꯁꯨꯕꯥ ꯆꯍꯤꯆꯥꯗꯒꯤ ꯍꯧꯔꯒꯥ ꯂꯤꯡꯈꯠꯈꯤꯕꯥ ꯐꯥꯎꯟꯗꯦꯁꯅꯁꯤꯡ ꯑꯗꯨ ꯁꯔꯀꯥꯔꯅꯥ ꯂꯧꯈꯠꯈꯤ꯫
The state sold the lands but typically local authorities did not replace the funding and so most of the nations charitable and school systems were massively disrupted,ꯔꯥꯖ꯭ꯌ ꯑꯁꯤꯅꯥ ꯂꯃꯁꯤꯡ ꯑꯁꯤ ꯌꯣꯜꯂꯝꯃꯤ ꯑꯗꯨꯕꯨ ꯃꯍꯧꯁꯥꯅꯥ ꯂꯣꯀꯦꯜ ꯑꯣꯊꯣꯔꯤꯇꯤꯁꯤꯡꯅꯥ ꯐꯟꯗ ꯄꯤꯕꯒꯤ ꯃꯍꯨꯠ ꯁꯤꯅꯈꯤꯗꯦ ꯑꯃꯁꯨꯡ ꯃꯔꯝ ꯑꯁꯤꯅꯥ ꯂꯩꯕꯥꯛ ꯑꯌꯥꯝꯕꯅꯥ ꯆꯦꯔꯤꯇꯦꯕꯜ ꯑꯃꯁꯨꯡ ꯁ꯭ꯀꯨꯜ ꯁꯤꯁ꯭ꯇꯦꯃꯁꯤꯡꯗꯥ ꯌꯥꯝꯅꯥ ꯆꯥꯎꯅꯥ ꯑꯀꯥꯌꯕꯥ ꯄꯤꯈꯤ
Between 1790 and 1796 industrial and agricultural output dropped foreign trade plunged and prices soared forcing the government to finance expenditure by issuing ever increasing quantities assignats,꯱꯷꯹꯰ ꯑꯃꯁꯨꯡ ꯱꯷꯹꯶ꯀꯤ ꯃꯔꯛꯇꯥ ꯏꯟꯗꯁ꯭ꯠꯔꯤ ꯑꯃꯁꯨꯡ ꯑꯦꯒ꯭ꯔꯤꯀꯂꯆꯔꯦꯜ ꯑꯥꯎꯠꯄꯨꯠ ꯑꯁꯤ ꯃꯄꯥꯟ ꯂꯩꯕꯥꯛꯀꯤ ꯂꯂꯣꯟ-ꯏꯇꯤꯛ ꯍꯟꯊꯔꯀꯈꯤ ꯑꯃꯁꯨꯡ ꯃꯃꯂꯁꯤꯡ ꯑꯁꯤ ꯃꯇꯝ ꯄꯨꯝꯅꯃꯛꯇꯥ ꯍꯦꯅꯒꯠꯂꯛꯂꯤꯕꯥ ꯃꯁꯤꯡꯁꯤꯡ ꯑꯦꯁꯤꯅꯦꯠꯁꯤꯡ ꯄꯤꯗꯨꯅꯥ ꯁꯔꯀꯥꯔꯗꯥ ꯁꯦꯜ ꯊꯥꯗꯅꯕꯥ ꯋꯥꯁꯀꯈꯤ
When this resulted in escalating inflation the response was to impose price controls and persecute private speculators and traders creating a black market,ꯃꯁꯤꯅꯥ ꯏꯅꯐ꯭ꯂꯦꯁꯟ ꯍꯦꯅꯒꯠꯂꯀꯄꯒꯤ ꯃꯍꯩ ꯑꯣꯏꯕꯥ ꯃꯇꯃꯗꯥ ꯔꯦꯁ꯭ꯄꯣꯟꯁ ꯑꯁꯤ ꯃꯃꯜ ꯀꯟꯠꯔꯣꯜ ꯇꯧꯕꯥ ꯑꯃꯁꯨꯡ ꯕ꯭ꯂꯦꯛ ꯃꯥꯔꯀꯦꯠ ꯑꯃꯥ ꯁꯦꯝꯂꯤꯕꯥ ꯄ꯭ꯔꯥꯏꯕꯦꯠ ꯁ꯭ꯄꯦꯛꯌꯨꯂꯦꯇꯔꯁꯤꯡ ꯑꯃꯁꯨꯡ ꯇ꯭ꯔꯦꯗꯔꯁꯤꯡꯕꯨ ꯂꯥꯟꯅꯥ ꯂꯃꯖꯤꯡꯕꯤꯕꯥ ꯑꯁꯤꯅꯤ꯫
Between 1789 and 1793 the annual deficit increased from 10 to 64 of gross national product while annual inflation reached 3500 after a poor harvest in 1794 and the removal of price controls,꯱꯷꯸꯹ ꯑꯃꯁꯨꯡ ꯱꯷꯹꯳ꯒꯤ ꯃꯔꯛꯇꯥ ꯆꯍꯤꯒꯤ ꯑꯣꯏꯅꯥ ꯒ꯭ꯔꯣꯁ ꯅꯦꯁ꯭ꯅꯦꯜ ꯄ꯭ꯔꯗꯛꯇꯀꯤ ꯱꯰ꯗꯒꯤ ꯶꯴ꯗꯥ ꯍꯦꯅꯒꯠꯂꯀꯈꯤ ꯑꯗꯨꯒꯥ ꯆꯍꯤꯒꯤ ꯑꯣꯏꯅꯥ ꯏꯅꯐ꯭ꯂꯦꯁꯟ ꯑꯁꯤ ꯱꯷꯹꯴ꯗꯥ ꯂꯧꯔꯣꯛ ꯌꯥꯝꯅꯥ ꯁꯣꯀꯄꯗꯒꯤ ꯑꯃꯁꯨꯡ ꯃꯃꯜ ꯀꯟꯠꯔꯣꯜ ꯂꯧꯊꯣꯀꯈꯤꯕꯥ ꯃꯇꯨꯡꯗꯥ ꯳꯵꯰꯰ ꯌꯧꯈꯤ꯫
The assignats were withdrawn in 1796 but inflation continued until the introduction of the goldbased Franc germinal in 1803,ꯑꯦꯁꯤꯅꯤꯠꯁꯤꯡ ꯑꯁꯤ ꯱꯷꯹꯶ꯇꯥ ꯂꯧꯊꯣꯀꯈꯤ ꯑꯗꯨꯕꯨ ꯱꯸꯰꯳ꯗꯥ ꯒꯣꯜꯗꯕꯦꯖ ꯐ꯭ꯔꯥꯉ꯭ꯛ ꯖꯔꯃꯤꯅꯦꯜ ꯑꯁꯤ ꯆꯠꯅꯍꯅꯕꯥ ꯐꯥꯑꯣꯕꯥ ꯏꯅꯐ꯭ꯂꯦꯁꯟ ꯑꯁꯤ ꯃꯈꯥ ꯆꯠꯊꯈꯤ꯫
The French Revolution had a major impact on western history by ending feudalism in France and creating a path for advances in individual freedoms throughout Europe,ꯐ꯭ꯔꯥꯟꯁꯀꯤ ꯔꯤꯚꯣꯂꯨꯁꯟꯅꯥ ꯐ꯭ꯔꯥꯟꯁꯇꯥ ꯐ꯭ꯌꯨꯗꯂꯤꯖꯝ ꯂꯣꯏꯁꯤꯅꯈꯤꯕꯥ ꯑꯃꯁꯨꯡ ꯌꯨꯔꯣꯞ ꯄꯨꯝꯕꯗꯥ ꯃꯤꯑꯣꯏ ꯑꯃꯒꯤ ꯅꯤꯡꯇꯝꯕꯥ ꯐꯪꯅꯕꯥ ꯂꯝꯕꯤ ꯑꯃꯥ ꯁꯦꯃꯗꯨꯅꯥ ꯋꯦꯁ꯭ꯇꯔꯅꯒꯤ ꯄꯨꯋꯥꯔꯤꯗꯥ ꯑꯆꯧꯕꯥ ꯁꯥꯐꯨ ꯑꯃꯥ ꯄꯤꯈꯤ
The revolution represented the most significant challenge to political absolutism up to that point in history and spread democratic ideals throughout Europe and ultimately the world,ꯔꯤꯚꯣꯂꯨꯁꯟ ꯑꯁꯤꯅꯥ ꯄꯨꯋꯥꯔꯤꯒꯤ ꯃꯇꯝ ꯑꯗꯨ ꯐꯥꯑꯣꯕꯗꯥ ꯔꯥꯖꯅꯤꯇꯤꯒꯤ ꯑꯣꯏꯕꯥ ꯑꯦꯕꯁꯣꯜꯌꯨꯇꯤꯖꯃꯒꯤ ꯈ꯭ꯕꯥꯏꯗꯒꯤ ꯃꯔꯨꯑꯣꯏꯕꯥ ꯁꯤꯡꯅꯕꯥ ꯑꯗꯨ ꯔꯤꯞꯔꯖꯦꯟꯇ ꯇꯧꯈꯤ ꯑꯃꯁꯨꯡ ꯌꯨꯔꯣꯞ ꯄꯨꯝꯕꯗꯥ ꯑꯃꯁꯨꯡ ꯑꯔꯣꯏꯕꯗꯥ ꯃꯥꯂꯦꯝ ꯄꯨꯝꯕꯗꯥ ꯒꯅꯇꯟꯠꯔꯒꯤ ꯋꯥꯈꯜꯂꯣꯅꯁꯤꯡ ꯁꯟꯗꯣꯀꯈꯤ
Its impact on French nationalism was profound while also stimulating nationalist movements throughout Europe,ꯐ꯭ꯔꯥꯟꯁꯀꯤ ꯅꯦꯁ꯭ꯅꯦꯂꯤꯖꯃꯒꯤ ꯃꯇꯥꯡꯗꯥ ꯃꯁꯤꯒꯤ ꯏꯝꯄꯦꯛꯇ ꯑꯁꯤ ꯌꯥꯝꯅꯥ ꯂꯨꯕꯥ ꯑꯣꯏꯈꯤ ꯑꯗꯨꯒꯥ ꯌꯨꯔꯣꯞ ꯄꯨꯝꯕꯗꯥ ꯅꯦꯁ꯭ꯅꯦꯂꯤꯁ꯭ꯠ ꯃꯨꯕꯃꯦꯟꯇꯁꯤꯡꯁꯨ ꯊꯧꯒꯠꯈꯤ
Some modern historians argue the concept of the nation state was a direct consequence of the revolution,ꯃꯣꯗꯔꯟ ꯏꯇꯤꯍꯥꯁ ꯏꯕꯥ ꯈꯔꯅꯥ ꯍꯥꯌꯔꯤ ꯃꯗꯨꯗꯤ ꯅꯦꯁꯟ ꯁ꯭ꯇꯦꯇꯀꯤ ꯋꯥꯈꯜꯂꯣꯟ ꯑꯁꯤ ꯔꯤꯚꯣꯂꯨꯁꯅꯒꯤ ꯍꯀꯊꯦꯡꯅꯕꯥ ꯃꯍꯩꯅꯤ
As such the revolution is often seen as marking the start of modernity and the modern period,ꯑꯁꯤꯒꯨꯝꯕꯥ ꯃꯑꯣꯡꯗꯥ ꯔꯤꯚꯣꯂꯨꯁꯟ ꯑꯁꯤ ꯑꯌꯥꯝꯕꯅꯥ ꯃꯣꯗꯔꯅꯤꯇꯤꯒꯤ ꯍꯧꯔꯀꯐꯝ ꯑꯃꯁꯨꯡ ꯃꯣꯗꯔꯟ ꯄꯤꯔꯤꯌꯗ ꯑꯁꯤ ꯃꯥꯔꯛ ꯇꯧꯕꯥ ꯑꯣꯏꯅꯥ ꯎꯕꯥ ꯐꯪꯏ .
The longterm impact on France was profound shaping politics society religion and ideas and polarising politics for more than a century,ꯐ꯭ꯔꯥꯟꯁꯇꯥ ꯃꯇꯝ ꯁꯥꯡꯅꯥ ꯄꯤꯕꯥ ꯁꯥꯐꯨ ꯑꯁꯤ ꯌꯥꯝꯅꯥ ꯂꯨꯅꯥ ꯁꯦꯝꯕꯥ ꯄꯣꯂꯤꯇꯤꯛꯁ ꯁꯣꯁꯥꯏꯇꯤꯒꯤ ꯙꯔꯝ ꯑꯃꯁꯨꯡ ꯋꯥꯈꯜꯂꯣꯅꯁꯤꯡ ꯑꯃꯁꯨꯡ ꯄꯣꯂꯥꯔꯤꯖꯝ ꯄꯣꯂꯤꯇꯤꯛꯁ ꯑꯁꯤ ꯆꯍꯤ ꯂꯤꯁꯤꯡ ꯑꯃꯥ ꯍꯦꯟꯅꯥ ꯑꯣꯏꯈꯤ꯫
Historian François Aulard writesFrom the social point of view the Revolution consisted in the suppression of what was called the feudal system in the emancipation of the individual in greater division of landed property the abolition of the privileges of noble birth the establishment of equality the simplification of life,ꯍꯤꯁ꯭ꯇꯣꯔꯤꯌꯟ ꯐ꯭ꯔꯥꯟꯁꯀꯣꯏꯁ ꯑꯣꯂꯥꯔꯗꯅꯥ ꯁꯣꯁꯤꯑꯦꯜ ꯄꯣꯏꯟꯇ ꯑꯣꯐ ꯚꯤꯎꯗꯒꯤ ꯏꯔꯀꯏ ꯔꯤꯚꯣꯂꯨꯁꯟ ꯑꯁꯤꯅꯥ ꯂꯃꯗꯝ ꯑꯁꯤꯒꯤ ꯂꯟ-ꯊꯨꯝ ꯍꯦꯟꯅꯥ ꯈꯥꯌꯗꯣꯀꯄꯗꯥ ꯃꯤꯑꯣꯏ ꯑꯗꯨꯕꯨ ꯏꯃꯥꯟꯁꯤꯄꯦꯁꯟꯗꯥ ꯐ꯭ꯌꯨꯗꯜ ꯁꯤꯁ꯭ꯇꯦꯝ ꯍꯥꯌꯅꯥ ꯀꯧꯈꯤꯕꯥ ꯑꯗꯨ ꯊꯨꯒꯥꯏꯕꯗꯥ ꯌꯥꯑꯣꯈꯤ ꯑꯃꯁꯨꯡ ꯅꯣꯕꯦꯜ ꯕꯔꯊꯀꯤ ꯄ꯭ꯔꯤꯚꯤꯂꯦꯖꯁꯤꯡ ꯑꯗꯨ ꯂꯧꯊꯣꯀꯈꯤꯕꯥ ꯄꯨꯟꯁꯤ ꯑꯗꯨ ꯂꯥꯏꯊꯣꯀꯍꯅꯕꯥ ꯑꯁꯤꯅꯥ ꯄꯨꯟꯁꯤꯕꯨ ꯂꯥꯏꯊꯣꯀꯍꯅꯕꯥ ꯉꯃꯍꯅꯈꯤ꯫
The French Revolution differed from other revolutions in being not merely national for it aimed at benefiting all humanity.The revolution permanently crippled the power of the aristocracy and drained the wealth of the Church although the two institutions survived,ꯐ꯭ꯔꯥꯟꯁꯀꯤ ꯔꯤꯚꯣꯂꯨꯁꯟ ꯑꯁꯤ ꯑꯇꯣꯞꯄꯥ ꯔꯤꯚꯣꯂꯨꯁꯅꯁꯤꯡꯒꯥ ꯈꯦꯠꯅꯈꯤ ꯃꯗꯨꯗꯤ ꯃꯤꯑꯣꯏꯕꯥ ꯖꯥꯇꯤ ꯄꯨꯝꯅꯃꯛꯇꯥ ꯀꯥꯟꯅꯕꯥ ꯐꯪꯍꯟꯅꯕꯥ ꯄꯥꯟꯗꯝ ꯊꯝꯂꯤꯕꯥ ꯑꯥꯏ.ꯇꯤ.ꯒꯤꯗꯃꯛ ꯁꯨꯞꯅꯒꯤ ꯖꯥꯇꯤꯒꯤ ꯑꯣꯏꯕꯥ ꯋꯥꯐꯝ ꯈꯛꯇꯃꯛ ꯑꯣꯏꯈꯤꯗꯦ꯫ꯔꯤꯚꯣꯂꯨꯁꯟ ꯑꯁꯤꯅꯥ ꯑꯦꯔꯤꯁ꯭ꯇꯣꯛꯔꯦꯁꯤꯒꯤ ꯁꯛꯇꯤ ꯑꯗꯨ ꯃꯇꯝ ꯆꯨꯞꯄꯒꯤ ꯑꯣꯏꯅꯥ ꯁꯣꯀꯍꯅꯈꯤ ꯑꯃꯁꯨꯡ ꯏꯟꯁꯇꯤꯠꯌꯨꯁꯟ ꯑꯅꯤ ꯑꯁꯤ ꯍꯤꯡꯗꯨꯅꯥ ꯂꯩꯔꯕꯁꯨ ꯁꯤꯡꯂꯨꯄꯀꯤ ꯂꯟ-ꯊꯨꯝ ꯊꯨꯒꯥꯏꯈꯤ
Hanson suggests the French underwent a fundamental transformation in selfidentity evidenced by the elimination of privileges and their replacement by intrinsic human rights,ꯍꯦꯅꯁꯟꯅꯥ ꯍꯥꯌꯔꯤ ꯃꯗꯨꯗꯤ ꯐ꯭ꯔꯥꯟꯁꯅꯥ ꯄ꯭ꯔꯤꯚꯤꯂꯦꯖꯁꯤꯡ ꯂꯧꯊꯣꯀꯄꯥ ꯑꯃꯁꯨꯡ ꯃꯈꯣꯌꯒꯤ ꯃꯍꯨꯠ ꯁꯤꯟꯗꯨꯅꯥ ꯏꯟꯠꯔꯤꯅꯁꯤꯛ ꯍ꯭ꯌꯨꯃꯦꯟ ꯔꯥꯏꯠꯁꯅꯥ ꯄ꯭ꯔꯃꯥꯟ ꯇꯧꯕꯥ ꯃꯁꯥꯒꯤ ꯃꯁꯛ ꯇꯥꯀꯄꯗꯥ ꯐꯟꯗꯥꯃꯦꯟꯇꯦꯜ ꯇ꯭ꯔꯥꯟꯁꯐꯣꯔꯃꯦꯁꯟ ꯑꯃꯥ ꯊꯦꯡꯅꯈꯤ꯫
After the collapse of the First French Empire in 1815 the French public lost many of the rights and privileges earned since the revolution but remembered the participatory politics that characterised the period,꯱꯸꯱꯵ꯗꯥ ꯑꯍꯥꯅꯕꯥ ꯐ꯭ꯔꯥꯟꯁꯀꯤ ꯏꯝꯄꯥꯌꯔ ꯊꯨꯒꯥꯏꯔꯕꯥ ꯃꯇꯨꯡꯗꯥ ꯐ꯭ꯔꯥꯟꯁꯀꯤ ꯃꯤꯌꯥꯝꯅꯥ ꯔꯤꯚꯣꯂꯨꯁꯅꯒꯤ ꯃꯇꯨꯡꯗꯥ ꯐꯪꯈꯤꯕꯥ ꯍꯀꯁꯤꯡ ꯑꯃꯁꯨꯡ ꯈꯨꯗꯣꯡꯆꯥꯕꯥ ꯀꯌꯥ ꯑꯃꯥ ꯃꯥꯡꯈꯤ ꯑꯗꯨꯕꯨ ꯃꯇꯝ ꯑꯗꯨꯒꯤ ꯃꯁꯛ ꯑꯣꯏꯔꯕꯥ ꯁꯔꯨꯛ ꯌꯥꯈꯤꯕꯥ ꯔꯥꯖꯅꯤꯇꯤ ꯑꯗꯨ ꯅꯤꯡꯁꯤꯡꯈꯤ
According to Paul Hanson Revolution became a tradition and republicanism an enduring option,ꯄꯣꯜ ꯍꯦꯅꯁꯟ ꯔꯤꯚꯣꯂꯨꯁꯅꯒꯤ ꯃꯇꯨꯡ ꯏꯟꯅꯥ ꯆꯠꯅꯕꯤ ꯑꯃꯥ ꯑꯣꯏꯔꯀꯈꯤ ꯑꯃꯁꯨꯡ ꯔꯤꯄꯕ꯭ꯂꯤꯀꯅꯤꯖꯝ ꯑꯁꯤ ꯂꯦꯡꯗꯕꯥ ꯑꯣꯄꯁꯟ ꯑꯃꯥ ꯑꯣꯏꯈꯤ
The Revolution meant an end to arbitrary royal rule and held out the promise of rule by law under a constitutional order,ꯔꯤꯚꯣꯂꯨꯁꯟ ꯑꯁꯤꯅꯥ ꯑꯔꯕꯤꯠꯔꯦꯔꯤ ꯔꯣꯌꯦꯜ ꯔꯨꯜ ꯂꯣꯏꯁꯤꯅꯕꯥ ꯍꯥꯌꯕꯗꯨ ꯑꯣꯏꯈꯤ ꯑꯃꯁꯨꯡ ꯀꯟꯁꯇꯤꯠꯌꯨꯁ꯭ꯅꯦꯜ ꯑꯣꯔꯗꯔ ꯑꯃꯒꯤ ꯃꯈꯥꯗꯥ ꯔꯨꯜ ꯑꯃꯒꯤ ꯋꯥꯁꯛ ꯑꯗꯨ ꯂꯦꯄꯈꯤ꯫
Napoleon as emperor set up a constitutional system and the restored Bourbons were forced to retain one,ꯅꯦꯄꯣꯂꯤꯌꯅꯅꯥ ꯁꯝꯔꯥꯠ ꯑꯣꯏꯅꯥ ꯀꯟꯁꯇꯤꯠꯌꯨꯁ꯭ꯅꯦꯜ ꯁꯤꯁ꯭ꯇꯦꯝ ꯑꯃꯥ ꯁꯦꯃꯈꯤ ꯑꯃꯁꯨꯡ ꯑꯃꯨꯛ ꯍꯟꯅꯥ ꯁꯦꯃꯒꯠꯂꯕꯥ ꯕꯣꯔꯕꯣꯅꯁꯤꯡꯅꯥ ꯑꯃꯨꯛ ꯍꯟꯅꯥ ꯊꯝꯅꯕꯥ ꯋꯥꯁꯀꯈꯤ
After the abdication of Napoleon III in 1871 the French Third Republic was launched with a deep commitment to upholding the ideals of the Revolution,꯱꯸꯷꯱ꯗꯥ ꯅꯦꯄꯣꯂꯤꯌꯟ III ꯊꯥꯗꯣꯀꯈꯤꯕꯥ ꯃꯇꯨꯡꯗꯥ ꯐ꯭ꯔꯥꯟꯁꯀꯤ ꯇꯔꯦꯠꯁꯨꯕꯥ ꯔꯤꯄꯕ꯭ꯂꯤꯛ ꯑꯁꯤ ꯔꯤꯚꯣꯂꯨꯁꯅꯒꯤ ꯋꯥꯈꯜꯂꯣꯅꯁꯤꯡ ꯉꯥꯛꯅꯕꯥ ꯑꯊꯣꯏꯕꯥ ꯋꯥꯁꯛ ꯑꯃꯒꯥ ꯂꯣꯌꯅꯅꯥ ꯍꯧꯗꯣꯀꯈꯤ꯫
The Vichy regime 19401944 tried to undo the revolutionary heritage but retained the republic,ꯚꯤꯆꯤ ꯔꯦꯖꯤꯝ ꯱꯹꯴꯰꯱꯹꯴꯴ꯅꯥ ꯔꯤꯚꯣꯂꯨꯁꯅꯔꯤ ꯍꯦꯔꯤꯇꯦꯖ ꯑꯁꯤ ꯂꯧꯊꯣꯛꯅꯕꯥ ꯍꯣꯠꯅꯈꯤ ꯑꯗꯨꯕꯨ ꯔꯤꯄꯕ꯭ꯂꯤꯛ ꯑꯁꯤ ꯊꯃꯈꯤ
However there were no efforts by the Bourbons Vichy or any other government to restore the privileges that had been stripped away from the nobility in 1789,"ꯑꯗꯨꯝ ꯑꯣꯏꯅꯃꯛ, ꯕꯣꯔꯕꯣꯅꯁꯤꯡ ꯚꯤꯆꯤ ꯅꯠꯔꯒꯥ ꯑꯇꯣꯞꯄꯥ ꯁꯔꯀꯥꯔ ꯑꯃꯠꯇꯅꯥ ꯱꯷꯸꯹ꯗꯥ ꯅꯣꯕꯦꯂꯤꯇꯤꯗꯒꯤ ꯂꯥꯄꯊꯣꯀꯈꯤꯕꯥ ꯈꯨꯗꯣꯡꯆꯥꯕꯁꯤꯡ ꯑꯗꯨ ꯑꯃꯨꯛ ꯍꯟꯅꯥ ꯄꯨꯔꯛꯅꯕꯥ ꯍꯣꯠꯅꯈꯤꯕꯥ ꯑꯃꯠꯇꯥ ꯂꯩꯈꯤꯗꯦ꯫"
France permanently became a society of equals under the law,ꯐ꯭ꯔꯥꯟꯁ ꯑꯁꯤ ꯃꯇꯝ ꯆꯨꯞꯄꯒꯤ ꯑꯣꯏꯅꯥ ꯑꯥꯏꯅꯒꯤ ꯃꯈꯥꯗꯥ ꯃꯥꯟꯅꯕꯥ ꯈꯨꯟꯅꯥꯏ ꯑꯃꯥ ꯑꯣꯏꯔꯀꯈꯤ .
Agriculture was transformed by the Revolution,ꯑꯦꯒ꯭ꯔꯤꯀꯂꯆꯔ ꯑꯁꯤ ꯔꯤꯚꯣꯂꯨꯁꯟꯅꯥ ꯑꯣꯟꯊꯣꯀꯈꯤꯕꯥ .
With the breakup of large estates controlled by the Church and the nobility and worked by hired hands rural France became more a land of small independent farms,ꯁꯤꯡꯂꯨꯞ ꯑꯃꯁꯨꯡ ꯅꯣꯕꯦꯂꯤꯇꯤꯅꯥ ꯀꯟꯠꯔꯣꯜ ꯇꯧꯕꯥ ꯑꯃꯁꯨꯡ ꯍꯥꯏꯔ ꯇꯧꯔꯕꯥ ꯍꯦꯟꯗꯁ ꯍꯦꯟꯗꯁ ꯔꯨꯔꯦꯜ ꯐ꯭ꯔꯥꯟꯁꯅꯥ ꯀꯟꯠꯔꯣꯜ ꯇꯧꯕꯥ ꯑꯆꯧꯕꯥ ꯏꯁ꯭ꯇꯦꯠꯁꯤꯡ ꯊꯨꯒꯥꯏꯕꯒꯥ ꯂꯣꯌꯅꯅꯥ ꯈꯨꯉ꯭ꯒꯪꯒꯤ ꯐ꯭ꯔꯥꯟꯁꯀꯤ ꯑꯄꯤꯀꯄꯥ ꯃꯅꯤꯡꯇꯝꯕꯥ ꯂꯧꯎ-ꯁꯤꯡꯎꯒꯤ ꯂꯝ ꯑꯃꯥ ꯑꯣꯏꯔꯀꯈꯤ
Harvest taxes were ended such as the tithe and seigneurial dues,ꯍꯥꯔꯕꯦꯁ꯭ꯠ ꯇꯦꯛꯁꯁꯤꯡ ꯑꯁꯤ ꯇꯔꯥꯅꯤꯄꯥꯜ ꯑꯃꯁꯨꯡ ꯁꯦꯒꯅꯦꯔꯤꯌꯜ ꯗ꯭ꯌꯨꯁꯤꯡꯅꯤ .
Primogeniture was ended both for nobles and peasants thereby weakening the family patriarch and led to a fall in the birth rate since all children had a share in the family property,ꯄ꯭ꯔꯥꯏꯃꯣꯖꯦꯅꯤꯆꯔ ꯑꯁꯤ ꯅꯣꯕꯦꯜ ꯑꯃꯁꯨꯡ ꯂꯧꯃꯤ ꯑꯅꯤꯃꯛꯀꯤꯗꯃꯛ ꯂꯣꯏꯁꯤꯅꯈꯤ ꯃꯗꯨꯅꯥ ꯏꯃꯨꯡꯒꯤ ꯄꯦꯠꯔꯤꯌꯥꯔꯛ ꯑꯗꯨ ꯁꯣꯀꯍꯜꯂꯀꯈꯤ ꯑꯃꯁꯨꯡ ꯑꯉꯥꯡ ꯈꯨꯗꯤꯡꯃꯛꯅꯥ ꯏꯃꯨꯡꯒꯤ ꯂꯟ-ꯊꯨꯃꯗꯥ ꯁꯔꯨꯛ ꯑꯃꯥ ꯂꯩꯕꯅꯥ ꯃꯔꯝ ꯑꯣꯏꯗꯨꯅꯥ ꯄꯣꯀꯄꯒꯤ ꯆꯥꯡ ꯍꯟꯊꯍꯅꯈꯤ
Cobban argues the Revolution bequeathed to the nation a ruling class of landowners,ꯀꯣꯕꯟꯅꯥ ꯋꯥꯐꯝ ꯑꯁꯤ ꯊꯝꯂꯤ ꯃꯗꯨꯗꯤ ꯔꯤꯚꯣꯂꯨꯁꯟ ꯑꯁꯤꯅꯥ ꯂꯩꯕꯥꯛ ꯑꯁꯤꯗꯥ ꯂꯝ ꯂꯩꯖꯗꯕꯁꯤꯡꯒꯤ ꯂꯩꯉꯥꯛꯂꯤꯕꯥ ꯀ꯭ꯂꯥꯁ ꯑꯃꯥ ꯑꯣꯏꯔꯦ ꯍꯥꯌꯅꯥ ꯂꯥꯑꯣꯊꯣꯛꯂꯤ
Economic historians are divided on the economic impact of the Revolution,ꯁꯦꯟ-ꯊꯨꯃꯒꯤ ꯄꯨꯋꯥꯔꯤꯒꯤ ꯋꯥꯔꯤ ꯁꯥꯅꯕꯥ ꯑꯁꯤ ꯔꯤꯚꯣꯂꯨꯁꯅꯒꯤ ꯁꯦꯅꯃꯤꯠꯂꯣꯅꯒꯤ ꯏꯝꯄꯦꯛꯇꯀꯤ ꯃꯇꯥꯡꯗꯥ ꯈꯥꯌꯗꯣꯀꯏ .
One suggestion is the resulting fragmentation of agricultural holdings had a significant negative impact in the early years of 19th century then became positive in the second half of the century because it facilitated the rise in human capital investments,ꯁꯖꯦꯁꯟ ꯑꯃꯅꯥ ꯃꯔꯝ ꯑꯣꯏꯗꯨꯅꯥ ꯑꯦꯒ꯭ꯔꯤꯀꯂꯆꯔꯦꯜ ꯍꯣꯜꯗꯤꯡꯁꯤꯡꯒꯤ ꯃꯍꯩ ꯑꯣꯏꯅꯥ ꯊꯣꯀꯄꯥ ꯊꯧꯗꯣꯀꯁꯤꯡ ꯑꯁꯤꯅꯥ ꯱꯹ꯁꯨꯕꯥ ꯆꯍꯤꯆꯥꯒꯤ ꯑꯍꯥꯅꯕꯥ ꯆꯍꯤꯁꯤꯡꯗꯥ ꯃꯁꯛ ꯊꯣꯀꯄꯥ ꯅꯦꯒꯦꯇꯤꯕ ꯏꯝꯄꯦꯛꯇ ꯑꯃꯥ ꯄꯤꯈꯤ ꯃꯗꯨꯒꯤ ꯃꯇꯨꯡꯗꯥ ꯆꯍꯤ ꯂꯤꯁꯤꯡ ꯑꯁꯤꯒꯤ ꯑꯅꯤꯁꯨꯕꯥ ꯆꯍꯤꯗꯥ ꯄꯣꯖꯤꯇꯤꯕ ꯑꯣꯏꯈꯤ ꯃꯔꯃꯗꯤ ꯃꯁꯤꯅꯥ ꯍ꯭ꯌꯨꯃꯦꯟ ꯀꯦꯄꯤꯇꯦꯜ ꯏꯅꯚꯦꯁ꯭ꯇꯃꯦꯟꯇꯁꯤꯡ ꯍꯦꯅꯒꯠꯍꯅꯕꯗꯥ ꯂꯥꯏꯊꯣꯀꯍꯅꯈꯤ
Others argue the redistribution of land had an immediate positive impact on agricultural productivity before the scale of these gains gradually declined over the course of the 19th century,ꯑꯇꯣꯞꯄꯁꯤꯡꯅꯥ ꯍꯥꯌꯔꯤ ꯃꯗꯨꯗꯤ ꯱꯹ꯁꯨꯕꯥ ꯆꯍꯤꯆꯥꯒꯤ ꯃꯅꯨꯡꯗꯥ ꯇꯞꯅꯥ ꯇꯞꯅꯥ ꯍꯟꯊꯔꯛꯂꯕꯥ ꯀꯥꯟꯅꯕꯥ ꯑꯁꯤꯒꯤ ꯆꯥꯡ ꯍꯟꯊꯔꯛꯠꯔꯤꯉꯩ ꯃꯃꯥꯡꯗꯥ ꯂꯝ ꯑꯃꯨꯛ ꯍꯟꯅꯥ ꯌꯦꯟꯊꯣꯀꯄꯅꯥ ꯂꯧꯎ-ꯁꯤꯡꯎꯒꯤ ꯄꯣꯠꯊꯣꯛ ꯄꯨꯊꯣꯀꯄꯗꯥ ꯈꯨꯗꯛꯀꯤ ꯑꯣꯏꯕꯥ ꯑꯐꯕꯥ ꯁꯥꯐꯨ ꯑꯃꯥ ꯄꯤꯈꯤ꯫
In the cities entrepreneurship on a small scale flourished as restrictive monopolies privileges barriers rules taxes and guilds gave way,ꯔꯦꯁ꯭ꯠꯔꯤꯛꯇꯤꯕ ꯃꯣꯅꯣꯄꯣꯂꯤꯇꯤ ꯄ꯭ꯔꯤꯚꯤꯂꯦꯖ ꯕꯦꯔꯤꯌꯔꯁ ꯇꯦꯛꯁ ꯑꯃꯁꯨꯡ ꯒꯤꯜꯗꯁꯤꯡꯅꯥ ꯂꯝꯕꯤ ꯄꯤꯔꯀꯄꯗꯒꯤ ꯁꯍꯔꯁꯤꯡꯒꯤ ꯑꯣꯟꯠꯔꯞꯔꯤꯅꯔꯁꯤꯞ ꯑꯁꯤ ꯑꯄꯤꯀꯄꯥ ꯃꯑꯣꯡꯗꯥ ꯍꯦꯟꯅꯥ ꯆꯥꯎꯈꯠꯂꯀꯈꯤ꯫
However the British blockade virtually ended overseas and colonial trade hurting the cities and their supply chains,ꯑꯗꯨꯝ ꯑꯣꯏꯅꯃꯛ ꯕ꯭ꯔꯤꯇꯤꯁꯀꯤ ꯕ꯭ꯂꯣꯀꯦꯗ ꯑꯁꯤꯅꯥ ꯃꯄꯥꯟ ꯂꯩꯕꯥꯛꯇꯥ ꯑꯃꯁꯨꯡ ꯀꯣꯂꯣꯅꯤꯑꯦꯜ ꯇ꯭ꯔꯦꯗꯅꯥ ꯁꯍꯔꯁꯤꯡ ꯑꯃꯁꯨꯡ ꯃꯈꯣꯌꯒꯤ ꯁꯞꯂꯥꯏ ꯆꯦꯅꯁꯤꯡꯗꯥ ꯑꯋꯥꯕꯥ ꯄꯤꯗꯨꯅꯥ ꯋꯥꯔꯆꯨꯑꯦꯜ ꯑꯣꯏꯅꯥ ꯂꯣꯏꯁꯤꯅꯈꯤ
Overall the Revolution did not greatly change the French business system and probably helped freeze in place the horizons of the small business owner,ꯑꯄꯨꯅꯕꯥ ꯑꯣꯏꯅꯥ ꯔꯤꯚꯣꯂꯨꯁꯟꯅꯥ ꯐ꯭ꯔꯥꯟꯁꯀꯤ ꯕꯤꯖꯤꯅꯦꯁ ꯁꯤꯁ꯭ꯇꯦꯝ ꯑꯁꯤ ꯌꯥꯝꯅꯥ ꯍꯣꯡꯗꯣꯀꯈꯤꯗꯦ ꯑꯃꯁꯨꯡ ꯑꯄꯤꯀꯄꯥ ꯕꯤꯖꯤꯅꯦꯁ ꯑꯣꯅꯔꯒꯤ ꯍꯣꯔꯥꯏꯖꯣꯟꯁꯇꯥ ꯐ꯭ꯔꯤꯖ ꯇꯧꯕꯗꯥ ꯃꯇꯦꯡ ꯄꯥꯡꯈꯤꯕꯥ ꯑꯣꯏꯔꯝꯕꯥ ꯌꯥꯏ
