en,mni-Mtei
eye contact and scratch your head as if you are extremely,ꯃꯤꯠꯀꯤ ꯀꯟꯇꯦꯛꯇ ꯑꯃꯁꯨꯡ ꯅꯍꯥꯛꯀꯤ ꯃꯀꯣꯛ ꯑꯗꯨ ꯅꯍꯥꯛꯅꯥ ꯌꯥꯝꯅꯥ ꯌꯥꯡꯅꯥ ꯆꯦꯜꯂꯤꯕꯥ ꯃꯑꯣꯡꯗꯥ ꯁꯣꯀꯎ꯫
"perplexed. Then you say that, while you might be mis-",ꯄꯥꯔꯄꯂꯦꯛꯁ ꯇꯧꯕꯥ꯫
"taken, you seem to remember that some kind of promise","ꯂꯧꯔꯒꯥ, ꯑꯗꯣꯝꯅꯥ ꯅꯤꯡꯁꯤꯡꯕꯤꯔꯃꯒꯅꯤ ꯃꯗꯨꯗꯤ ꯃꯈꯜ ꯑꯃꯒꯤ ꯋꯥꯁꯛ ꯑꯗꯨ ."
had been made. This is a disarming way to introduce a,ꯇꯧꯔꯝꯕꯥ ꯌꯥꯏ꯫
delicate subiect when truttr is on your side but you don't,Delicate Subiect Truttr ꯑꯁꯤ ꯅꯍꯥꯛꯀꯤ ꯃꯥꯏꯀꯩꯗꯥ ꯂꯩꯕꯥ ꯃꯇꯃꯗꯥ ꯑꯗꯨꯕꯨ ꯅꯍꯥꯛꯅꯥ .
want to rub the other person's nose in it,ꯃꯗꯨꯗꯥ ꯑꯇꯣꯞꯄꯥ ꯃꯤꯑꯣꯏ ꯑꯗꯨꯒꯤ ꯅꯥꯀꯣꯡ ꯑꯗꯨ ꯁꯣꯀꯄꯥ ꯄꯥꯝꯃꯤ
A patient of mine named Mandy used the method,ꯃꯟꯗꯤ ꯀꯧꯕꯥ ꯃꯥꯏꯒꯤ ꯑꯅꯥꯕꯥ ꯑꯃꯅꯥ ꯃꯦꯊꯗ ꯑꯁꯤ ꯁꯤꯖꯤꯟꯅꯈꯤ
"with her boyfriend Tom, who had a habit of lening busi-",ꯂꯦꯅꯤꯡ ꯕꯨꯁꯤꯒꯤ ꯍꯩꯅꯕꯤ ꯂꯩꯕꯥ ꯃꯍꯥꯛꯀꯤ ꯕꯣꯏꯐ꯭ꯔꯦꯟꯗ ꯇꯝ ꯑꯗꯨꯒꯥ ꯂꯣꯌꯅꯅꯥ-
"ness interfere with romance. Once, when he canceled a",ꯅꯦꯁꯅꯥ ꯔꯣꯃꯥꯅꯟꯁꯇꯥ ꯑꯀꯥꯌꯕꯥ ꯄꯤ꯫
"long weekend at a desert spa, Tom said, ""I'll make it up","ꯗꯦꯖꯔ ꯁ꯭ꯄꯥ ꯑꯃꯗꯥ ꯂꯣꯡ ꯋꯤꯀꯦꯟꯗ ꯍꯥꯌꯅꯥ ꯇꯝꯅꯥ ꯍꯥꯌꯈꯤ, “ꯑꯩꯅꯥ ꯃꯁꯤ ꯁꯦꯃꯒꯅꯤ"
to you. Next spring my schedule will be lighter and we'll,ꯑꯗꯣꯃꯒꯤ ꯃꯐꯃꯗꯥ꯫
"go to Hawaii for a week."" As spring edged toward sum-","ꯍꯞꯇꯥ ꯑꯃꯒꯤ ꯑꯣꯏꯅꯥ ꯍꯋꯥꯏꯗꯥ ꯆꯠꯂꯨ꯫"" ꯊꯥꯒꯤ ꯈꯣꯡꯀꯥꯞ ꯂꯥꯀꯄꯥ ꯃꯇꯃꯗꯥ ꯁꯣꯝ-"
"mer with no trip in sight, Mandy grew increasingly an-","mer with no trip in sight, ꯃꯟꯗꯤꯅꯥ ꯍꯦꯟꯅꯥ ꯍꯦꯟꯅꯥ ꯍꯦꯅꯒꯠꯂꯀꯈꯤ ꯑꯃꯁꯨꯡ-"
noyed. She couldn't let Tom get away with another,ꯅꯣꯌꯦꯗ ꯇꯧꯕꯥ꯫
"broken promise, but she knew ttrat if she lost her temper","ꯕ꯭ꯔꯣꯀꯦꯟ ꯄ꯭ꯔꯣꯃꯤꯖ, ꯑꯗꯨꯕꯨ ꯃꯍꯥꯛꯅꯥ ꯃꯍꯥꯛꯀꯤ ꯋꯥꯈꯜ ꯅꯨꯡꯉꯥꯏꯇꯕꯥ ꯑꯗꯨ ꯃꯥꯡꯈꯤꯕꯥ ꯇꯥꯔꯕꯗꯤ ꯃꯍꯥꯛꯅꯥ ꯈꯉꯈꯤ"
or expressed irritation he would get defensive and accuse,ꯅꯠꯔꯒꯥ ꯐꯣꯡꯗꯣꯀꯈꯤꯕꯥ ꯏꯔꯤꯇꯦꯁꯟ ꯑꯗꯨ ꯃꯍꯥꯛꯅꯥ ꯗꯤꯐꯦꯟꯁ ꯑꯃꯁꯨꯡ ꯑꯦꯛꯁꯦꯁ ꯇꯧꯒꯅꯤ
her of being demanding,ꯃꯍꯥꯛꯀꯤ ꯗꯤꯃꯥꯟꯗ ꯇꯧꯕꯥ
"Instead, Mandy used the Columbo Defense. One",ꯃꯗꯨꯒꯤ ꯃꯍꯨꯠꯇꯥ ꯃꯟꯗꯤꯅꯥ ꯀꯣꯂꯝꯕꯣꯟ ꯗꯤꯐꯦꯟꯁ ꯁꯤꯖꯤꯟꯅꯈꯤ꯫
"night, after a lovely dinner, she said to Tom, ""You know,","ꯅꯨꯃꯤꯠ, ꯅꯨꯡꯁꯤꯔꯕꯥ ꯅꯨꯃꯤꯗꯥꯡꯒꯤ ꯆꯥꯛ ꯆꯥꯕꯥ ꯂꯣꯏꯔꯕꯥ ꯃꯇꯨꯡꯗꯥ ꯃꯍꯥꯛꯅꯥ ꯇꯃꯗꯥ ꯍꯥꯌꯔꯀꯏ, ""ꯅꯉꯅꯥ ꯈꯉꯂꯦ,"
"I'm kind of confused. Maybe my memory is off, but I",ꯑꯩꯍꯥꯛ ꯃꯈꯜ ꯑꯃꯒꯤ ꯋꯥꯈꯜ ꯋꯥꯕꯥ ꯃꯤꯑꯣꯏꯅꯤ꯫
believe you said that you were going to arrange a trip to,ꯊꯥꯖꯕꯤꯌꯨ ꯅꯍꯥꯛꯅꯥ ꯍꯥꯌꯈꯤ ꯃꯗꯨꯗꯤ ꯅꯍꯥꯛꯅꯥ ꯈꯣꯡꯆꯠ ꯑꯃꯥ ꯁꯦꯝ ꯁꯥꯒꯅꯤ
"Hawaii this spring. Do you remember that?""",ꯍꯋꯥꯏ ꯑꯁꯤ ꯍꯟꯗꯛꯀꯤ ꯀꯨꯃꯁꯤꯗꯥ ꯂꯩ꯫
"Tom knew what Mandy really meant ',Okay, you","ꯇꯝ ꯈꯉꯈꯤ ꯃꯗꯨꯗꯤ ꯃꯟꯗꯤꯅꯥ ꯇꯁꯦꯡꯅꯥ ꯀꯔꯤ ꯍꯥꯌꯔꯤꯕꯅꯣ ',ꯑꯣꯀꯦ, ꯅꯍꯥꯛ"
"made a promise. I'm not going to bitch about it, I'll iust",ꯋꯥꯁꯛ ꯑꯃꯥ ꯂꯧꯈꯤ꯫
refresh your memory and give you a chance to get your,ꯅꯍꯥꯛꯀꯤ ꯃꯦꯃꯣꯔꯤ ꯑꯗꯨ ꯔꯤꯐ꯭ꯔꯦꯁ ꯇꯧꯕꯤꯌꯨ ꯑꯃꯁꯨꯡ ꯅꯍꯥꯛꯀꯤ ꯐꯪꯅꯕꯥ ꯈꯨꯗꯣꯡꯆꯥꯕꯥ ꯑꯃꯥ ꯄꯤꯕꯤꯌꯨ
Is6],ꯑꯥꯏ.ꯑꯦꯁ.꯶] ꯒꯤ ꯃꯇꯨꯡ ꯏꯟꯅꯥ ꯄꯤꯔꯤ꯫
PUTTING UP \rITH BROKEN PROMISES,\rith broken promises ꯊꯝꯕꯥ .
"act together."" Her approach got his attention, com-","ꯄꯨꯟꯅꯥ ꯊꯕꯛ ꯇꯧꯃꯤꯟꯅꯧ꯫"" ꯃꯍꯥꯛꯀꯤ ꯑꯦꯞꯔꯣꯆꯅꯥ ꯃꯍꯥꯛꯀꯤ ꯄꯨꯛꯅꯤꯡ ꯆꯤꯡꯁꯤꯅꯈꯤ, ꯀꯝ-"
"manded his respect, and gave him no way out except to","ꯃꯍꯥꯛꯀꯤ ꯏꯀꯥꯌꯈꯨꯝꯅꯕꯥ ꯑꯗꯨ ꯃꯦꯟꯗꯦꯠ ꯇꯧꯈꯤ, ꯑꯃꯁꯨꯡ ꯃꯍꯥꯀꯄꯨ ꯊꯣꯛꯅꯕꯥ ꯂꯝꯕꯤ ꯑꯃꯠꯇꯥ ꯄꯤꯈꯤꯗꯦ, ."
"to ""remember"" the promise and belatedly make good","ꯋꯥꯁꯛ ꯑꯗꯨ ""ꯅꯤꯡꯁꯤꯡꯕꯥ"" ꯑꯃꯁꯨꯡ ꯂꯦꯞꯄꯥ ꯂꯩꯇꯅꯥ ꯑꯐꯕꯥ ꯑꯣꯏꯍꯅꯕꯥ"
on it,ꯃꯁꯤꯒꯤ ꯃꯇꯥꯡꯗꯥ .
Habitud promise-breakers usually think they can get,ꯍꯕꯤꯠ ꯄ꯭ꯔꯣꯃꯤꯖ ꯕ꯭ꯔꯦꯀꯔꯁꯤꯡꯅꯥ ꯃꯍꯧꯁꯥꯅꯥ ꯃꯈꯣꯌꯅꯥ ꯐꯪꯒꯅꯤ ꯍꯥꯌꯅꯥ ꯈꯜꯂꯤ .
"away with it. If you don't want to be a doormat, you have",ꯃꯁꯤꯒꯥ ꯂꯣꯌꯅꯅꯥ ꯂꯥꯞꯅꯥ ꯂꯩ꯫
to let them know that beuayal exacts a cost. But be pre-,ꯃꯈꯣꯌꯗꯥ ꯈꯉꯍꯟꯅꯕꯥ ꯕꯦꯎꯌꯥꯂꯅꯥ ꯃꯃꯜ ꯑꯃꯥ ꯂꯧꯏ ꯍꯥꯌꯅꯥ꯫
pared to follow through; if they call your bluff and you,ꯇꯨꯡ ꯏꯟꯅꯕꯥ ꯄꯥꯔꯦ;
"cave in, you will be breaking an unspoken promise to","ꯀꯦꯚ ꯏꯟ, ꯅꯍꯥꯛꯅꯥ ꯋꯥ ꯉꯥꯡꯗꯕꯥ ꯋꯥꯁꯛ ꯑꯃꯥ ꯊꯨꯒꯥꯏꯒꯅꯤ"
yourself,ꯅꯁꯥꯃꯛ
USABLE INSIGHT',ꯁꯤꯖꯤꯟꯅꯕꯥ ꯌꯥꯕꯥ ꯋꯥꯈꯜꯂꯣꯟ'꯫
"If they break tol many przmises, don't let them","ꯀꯔꯤꯒꯨꯝꯕꯥ ꯃꯈꯣꯌꯅꯥ przmises ꯀꯌꯥ ꯑꯃꯥ ꯇꯣꯜ ꯇꯧꯔꯕꯗꯤ, ꯃꯈꯣꯌꯕꯨ ꯌꯥꯍꯅꯒꯅꯨ ."
make any pnomises,ꯄ꯭ꯅꯣꯃꯤꯁ ꯑꯃꯠꯇꯥ ꯁꯦꯝꯕꯥ
Tnxu'rc Acnolr,ꯇꯤ.ꯑꯦꯟ.ꯑꯦꯛꯁ.ꯌꯨ.ꯑꯥꯔ.ꯁꯤ.
"When someone breaks promises repeatedly, try to","ꯀꯅꯥꯒꯨꯝꯕꯥ ꯑꯃꯅꯥ ꯋꯥꯁꯀꯄꯤꯕꯥ ꯃꯇꯃꯗꯥ, ꯍꯟꯖꯤꯟ ꯍꯟꯖꯤꯟ, ."
"make the next one binding, so you don't end up in a","ꯃꯊꯪꯒꯤ ꯋꯥꯟ ꯕꯥꯏꯟꯗꯤꯡ ꯇꯧꯕꯥ, ꯃꯔꯝ ꯑꯗꯨꯅꯥ ꯅꯍꯥꯛꯅꯥ ꯑꯦ."
bind when it's time for the payoff,ꯄꯦꯌꯣꯐꯀꯤ ꯃꯇꯝ ꯌꯧꯔꯀꯄꯥ ꯃꯇꯃꯗꯥ ꯕꯤꯟꯗ ꯇꯧꯕꯥ .
"Clarify your expectations: ""That sounds like a prom-","ꯅꯍꯥꯛꯀꯤ ꯑꯦꯛꯁꯄꯦꯛꯇꯦꯁꯅꯁꯤꯡ ꯑꯗꯨ ꯃꯌꯦꯛ ꯁꯦꯡꯅꯥ ꯇꯥꯀꯄꯤꯌꯨ: ""ꯃꯗꯨ ꯄ꯭ꯔꯣꯝ-"
"ise. If you don't come through, it's going to hurt. So,",ꯑꯥꯏ.ꯑꯦꯁ.ꯏ.
"how much should I bank on it?""","ꯑꯩꯅꯥ ꯃꯁꯤꯗꯥ ꯀꯌꯥ ꯌꯥꯝꯅꯥ ꯕꯦꯉ꯭ꯛ ꯇꯧꯒꯗꯒꯦ?"""
Don't bring up past offenses. It's a waste of time and,ꯍꯧꯈꯤꯕꯥ ꯑꯣꯐꯦꯟꯁꯁꯤꯡ ꯑꯗꯨ ꯄꯨꯔꯛꯂꯣꯏꯗꯕꯅꯤ꯫
possibly an invitation to a fight,ꯑꯣꯏꯊꯣꯀꯄꯥ ꯌꯥꯕꯥ ꯂꯥꯅꯐꯝ ꯑꯃꯒꯤ ꯏꯅꯚꯤꯇꯦꯁꯟ ꯑꯃꯥ .
"Establish a time frame: ""When can I count on this","ꯃꯇꯃꯒꯤ ꯂꯝꯕꯤ ꯑꯃꯥ ꯁꯦꯝꯃꯨ: ""ꯀꯔꯤ ꯃꯇꯃꯗꯥ ꯑꯩꯅꯥ ꯃꯁꯤꯗꯥ ꯊꯥꯖꯕꯥ ꯊꯝꯕꯥ ꯌꯥꯕꯒꯦ"
"to happen?"" If the person resists, set the deadline","to pean?"" ꯀꯔꯤꯒꯨꯝꯕꯥ ꯃꯤꯑꯣꯏ ꯑꯗꯨꯅꯥ ꯂꯥꯟꯊꯦꯡꯅꯔꯕꯗꯤ, ꯗꯦꯗꯂꯥꯏꯟ ꯑꯗꯨ ꯁꯦꯠ ꯇꯧ"
"yourselfi ""I'll remind you of it on the first of the","ꯏꯁꯥꯅꯥ ""ꯑꯩꯅꯥ ꯅꯉꯕꯨ ꯑꯍꯥꯅꯕꯥ ꯑꯣꯏꯅꯥ ꯅꯤꯡꯁꯤꯡꯍꯅꯒꯅꯤ"
"month.""","ꯊꯥ."""
ls7 l,ꯑꯦꯜ.ꯑꯦꯁ.꯷ ꯑꯦꯜ.
GET OUT OF YOUR OWN IWAY,ꯑꯗꯣꯃꯒꯤ ꯏꯁꯥꯒꯤ ꯑꯣꯏꯕꯥ iway ꯒꯤ ꯃꯅꯨꯡꯗꯒꯤ ꯊꯣꯔꯀꯎ
"If the person does not follow through, pin him down","ꯀꯔꯤꯒꯨꯝꯕꯥ ꯃꯤꯑꯣꯏ ꯑꯗꯨꯅꯥ ꯐꯣꯂꯣ-ꯑꯞ ꯇꯧꯗ꯭ꯔꯕꯗꯤ, ꯃꯍꯥꯀꯄꯨ ꯄꯤꯅꯧ"
in a nonthreatening way. \Ufit and imagination work,ꯅꯟ-ꯊ꯭ꯔꯦꯇꯤꯡ ꯑꯣꯏꯕꯥ ꯃꯑꯣꯡꯗꯥ꯫
better than confrontations or ultimatums,ꯀꯟꯐ꯭ꯔꯟꯇꯦꯁꯟ ꯅꯠꯔꯒꯥ ꯑꯂꯇꯤꯃꯦꯇꯃꯁꯤꯡꯗꯒꯤ ꯍꯦꯟꯅꯥ ꯐꯕꯥ .
"If diplomacy fails, let the person know the conse-","ꯀꯔꯤꯒꯨꯝꯕꯥ ꯗꯤꯞꯂꯣꯃꯦꯁꯤꯅꯥ ꯃꯥꯌ ꯄꯥꯛꯠꯔꯕꯗꯤ, ꯃꯤꯑꯣꯏ ꯑꯗꯨꯗꯥ ꯀꯟꯖ꯭ꯌꯨꯃꯔ ꯑꯗꯨ ꯈꯪꯍꯜꯂꯨ-"
"quences of not keeping the promise. For example,",ꯋꯥꯁꯛ ꯑꯗꯨ ꯉꯥꯀꯄꯥ ꯉꯃꯗꯕꯒꯤ ꯀ꯭ꯌꯨꯑꯦꯟꯁꯁꯤꯡ꯫
"say ""I'll start dating other menr"" or ""I'll have trouble","""ꯑꯩꯅꯥ ꯑꯇꯣꯞꯄꯥ ꯃꯦꯅꯔꯒꯥ ꯂꯣꯌꯅꯅꯥ ꯋꯥꯔꯤ ꯁꯥꯅꯕꯥ ꯍꯧꯔꯒꯅꯤ"" ꯅꯠꯔꯒꯥ ""ꯑꯩꯍꯥꯛ ꯑꯋꯥꯕꯥ ꯃꯥꯌꯣꯛꯅꯒꯅꯤ"
"trusting you again.""",ꯑꯗꯣꯃꯕꯨ ꯑꯃꯨꯛ ꯍꯟꯅꯥ ꯊꯥꯖꯕꯥ ꯊꯝꯕꯥ꯫”
"If you follow these steps, the promise-breaker might","ꯀꯔꯤꯒꯨꯝꯕꯥ ꯅꯍꯥꯛꯅꯥ ꯈꯣꯡꯊꯥꯡꯁꯤꯡ ꯑꯁꯤ ꯂꯧꯈꯠꯂꯕꯗꯤ, ꯋꯥꯁꯀꯄꯤꯕꯥ ꯃꯤꯑꯣꯏ ꯑꯗꯨꯅꯥ ."
"turn into a promise-keeper. If there is no change,",ꯄ꯭ꯔꯣꯃꯤꯖ-ꯀꯤꯄꯥꯔ ꯑꯃꯥ ꯑꯣꯏꯅꯥ ꯑꯣꯟꯊꯣꯀꯎ꯫
"however, he probably has no intention of keeping his","ꯑꯗꯨꯝ ꯑꯣꯏꯅꯃꯛ, ꯃꯍꯥꯛꯅꯥ ꯃꯍꯥꯛꯀꯤ ."
promises (as opposed to someone with good inten-,ꯋꯥꯁꯀꯁꯤꯡ (ꯑꯐꯕꯥ ꯋꯥꯈꯜ ꯂꯩꯕꯥ ꯃꯤꯑꯣꯏ ꯑꯃꯒꯤ ꯃꯍꯨꯠꯇꯥ-
tions who makes promises carelessly). You might not,tions who made making prowmss carelessly)꯫
want to accept another promise from him,ꯃꯍꯥꯛꯀꯤ ꯃꯐꯃꯗꯒꯤ ꯑꯇꯣꯞꯄꯥ ꯋꯥꯁꯛ ꯑꯃꯥ ꯌꯥꯕꯥ ꯄꯥꯝꯃꯤ
Practice what you preach. If you want people to keep,ꯅꯍꯥꯛꯅꯥ ꯁꯟꯗꯣꯛꯂꯤꯕꯥ ꯑꯗꯨ ꯄ꯭ꯔꯦꯛꯇꯤꯁ ꯇꯧ꯫
"their promises to you, make sure you keep yours","ꯃꯈꯣꯌꯅꯥ ꯑꯗꯣꯃꯗꯥ ꯋꯥꯁꯀꯈꯤꯕꯁꯤꯡ ꯑꯗꯨ, ꯑꯗꯣꯝꯅꯥ ꯑꯗꯣꯃꯒꯤ ꯃꯐꯃꯗꯥ ꯁꯣꯏꯗꯅꯥ ꯉꯥꯀꯄꯤꯌꯨ ."
Making promises you can't keep is just as self-,ꯑꯗꯣꯝꯅꯥ ꯊꯝꯕꯤꯕꯥ ꯉꯃꯗꯕꯥ ꯋꯥꯁꯀꯁꯤꯡ ꯁꯦꯝꯕꯥ ꯑꯁꯤꯁꯨ ꯑꯗꯨꯃꯛ ꯃꯁꯥꯅꯥ ꯃꯁꯥꯕꯨ .
defeating as letting promise-breakers get away with,ꯋꯥꯁꯛ-ꯋꯥꯔꯥꯜ ꯄꯥꯏꯍꯅꯕꯥ ꯃꯤꯑꯣꯏꯁꯤꯡꯅꯥ ꯂꯥꯄꯊꯣꯛꯅꯥ ꯂꯩꯕꯥ ꯃꯇꯃꯗꯥ ꯃꯥꯏꯊꯤꯕꯥ ꯄꯤꯕꯥ .
it,ꯃꯁꯤ
ts8 l,ꯇꯤ.ꯑꯦꯁ.꯸ ꯑꯦꯜ.
Tryrng to Make up While,ꯃꯦꯛ ꯑꯥꯞ ꯇꯧꯕꯥ ꯃꯇꯃꯗꯥ ꯇ꯭ꯔꯥꯏꯔꯪ .
You're Still Angry,ꯅꯉꯅꯥ ꯍꯧꯖꯤꯀꯁꯨ ꯋꯥꯈꯜ ꯅꯨꯡꯉꯥꯏꯇꯕꯥ ꯐꯥꯑꯣꯔꯤ .
"rattle of reason in the throat.""",ꯀꯣꯛꯇꯥ ꯂꯩꯕꯥ ꯃꯔꯃꯒꯤ ꯔꯦꯠꯂ꯫”
_JOHN FREDERICKBOYES,_ꯖꯣꯟ ꯐ꯭ꯔꯦꯗꯔꯤꯛꯕꯣꯌꯦꯁ
Not long after I gained some notoriety as an expeft on,ꯑꯩꯍꯥꯛꯅꯥ ꯑꯦꯛꯁꯄꯤꯐꯦꯠ ꯑꯃꯥ ꯑꯣꯏꯅꯥ ꯅꯣꯇꯣꯔꯤꯇꯤ ꯈꯔꯥ ꯐꯪꯂꯕꯥ ꯃꯇꯨꯡꯗꯥ ꯃꯇꯝ ꯈꯔꯒꯤ ꯃꯇꯨꯡꯗꯥ
"relationships, I found myself struggling with my own","ꯃꯔꯤꯁꯤꯡ, ꯑꯩꯍꯥꯛꯅꯥ ꯑꯩꯍꯥꯛꯀꯤ ꯏꯁꯥꯒꯤ ꯑꯣꯏꯕꯥ ꯋꯥꯐꯝ ꯑꯃꯥ ꯊꯦꯡꯅꯈꯤ꯫"
"marriage. After a series of minor incidents, so much re-",ꯂꯨꯍꯣꯡꯕ.
sentment had accumulated that my wife and I had be-,ꯁꯦꯟꯇꯃꯦꯟꯇꯅꯥ ꯈꯣꯃꯖꯤꯜꯂꯀꯈꯤ ꯃꯗꯨꯗꯤ ꯑꯩꯍꯥꯛꯀꯤ ꯅꯨꯄꯤ ꯑꯃꯁꯨꯡ ꯑꯩꯍꯥꯛꯀꯤ ꯅꯨꯄꯤ-ꯅꯨꯄꯤ-
come cold and hostile toward one another. At times I,ꯑꯃꯒꯥ ꯑꯃꯒꯥ ꯂꯣꯌꯅꯅꯥ ꯀꯣꯜꯗ ꯑꯃꯁꯨꯡ ꯌꯦꯛꯅꯕꯥ ꯂꯥꯀꯎ꯫
feared that I'd even stopped loving her. One night I lay,ꯑꯩꯅꯥ ꯃꯍꯥꯀꯄꯨ ꯅꯨꯡꯁꯤꯕꯥ ꯐꯥꯑꯣꯕꯥ ꯂꯦꯄꯈꯤ ꯍꯥꯌꯅꯥ ꯀꯤꯈꯤ꯫
in bed ruminating while she read a book beside me. The,ꯑꯩꯒꯤ ꯃꯅꯥꯛꯇꯥ ꯂꯩꯕꯥ ꯂꯥꯏꯔꯤꯛ ꯑꯃꯥ ꯄꯥꯕꯥ ꯃꯇꯃꯗꯥ ꯕꯦꯗ ꯔꯨꯃꯤꯅꯦꯇꯤꯡꯗꯥ꯫
atmosphere was tense. Frustrated at how long the un-,ꯑꯦꯇꯃꯣꯁ꯭ꯐꯤꯌꯥꯔ ꯑꯁꯤ ꯇꯦꯟꯁꯟ ꯑꯣꯏꯈꯤ꯫
"pleasantness had lingered, I decided it was time to make","ꯅꯨꯡꯉꯥꯏꯕꯥ ꯋꯥꯐꯝ ꯑꯃꯥ ꯂꯥꯀꯈꯤ, ꯑꯩꯅꯥ ꯋꯥꯔꯦꯞ ꯂꯧꯈꯤ ꯃꯗꯨꯗꯤ ꯃꯁꯤ ꯁꯦꯝꯅꯕꯒꯤ ꯃꯇꯝ ꯑꯣꯏꯔꯦ ."
peace. I turned toward my wife with loving intentions. I,ꯇꯪꯗꯨ ꯂꯩꯇꯥꯕ.
"wanted to make a peace offering, but what started to","ꯁꯥꯟꯇꯤꯒꯤ ꯊꯧꯔꯥꯡ ꯑꯃꯥ ꯇꯧꯕꯥ ꯄꯥꯃꯈꯤ, ꯑꯗꯨꯕꯨ ꯃꯗꯨꯗꯒꯤ ꯍꯧꯈꯤ꯫"
come out of my mouth was a declaration of war,ꯑꯩꯒꯤ ꯃꯤꯠꯀꯤ ꯃꯅꯨꯡꯗꯒꯤ ꯂꯥꯀꯄꯥ ꯑꯁꯤ ꯂꯥꯅꯒꯤ ꯂꯥꯎꯊꯣꯀꯄꯥ ꯑꯃꯅꯤ .
"I caught myself before I yelled, and shuddered si-","ꯑꯩꯅꯥ ꯂꯥꯎꯗ꯭ꯔꯤꯉꯩ ꯃꯃꯥꯡꯗꯥ ꯑꯩꯅꯥ ꯏꯁꯥꯕꯨ ꯐꯥꯈꯤ, ꯑꯃꯁꯨꯡ ꯊꯋꯥꯏ ꯌꯥꯑꯣꯅꯥ ꯁꯤ-"
"lently at this grim realization: I still loved my wife, but I","ꯂꯦꯟꯇꯂꯤ ꯑꯁꯤꯅꯥ ꯒ꯭ꯔꯤꯝ ꯔꯤꯑꯦꯂꯥꯏꯖꯦꯁꯟ ꯑꯁꯤꯗꯥ: ꯑꯩꯍꯥꯛꯅꯥ ꯍꯧꯖꯤꯀꯁꯨ ꯑꯩꯍꯥꯛꯀꯤ ꯅꯨꯄꯤꯕꯨ ꯅꯨꯡꯁꯤꯖꯩ, ꯑꯗꯨꯕꯨ ꯑꯩꯍꯥꯛ"
couldn't stop hating her. If we did not do something,ꯃꯍꯥꯀꯄꯨ ꯍꯦꯠꯅꯕꯥ ꯊꯤꯡꯕꯥ ꯉꯃꯈꯤꯗꯦ꯫
"quickly, our marriage would either self-destruct or setde","ꯊꯨꯅꯥ, ꯑꯩꯈꯣꯌꯒꯤ ꯂꯨꯍꯣꯡꯕꯥ ꯑꯁꯤ ꯃꯁꯥꯅꯥ ꯃꯁꯥꯕꯨ ꯊꯥꯖꯖꯕꯥ ꯅꯠꯔꯒꯥ ꯁꯦꯠ ꯇꯧꯕꯥ ."
into an icy detente. Yet as long as we were still angry it,ꯑꯥꯏꯁꯛꯔꯤꯝ ꯑꯃꯥ ꯑꯣꯏꯅꯥ ꯂꯧꯕꯥ꯫
tsel,ꯇ꯭ꯁꯦꯜ ꯴.
GET OUT OF YOUR OWN WAY,ꯑꯗꯣꯃꯒꯤ ꯃꯑꯣꯡ ꯃꯇꯧꯗꯒꯤ ꯊꯣꯔꯀꯎ
"would be impossible to act peaceably. ""'We have to talkr""",ꯁꯥꯟꯇꯤ ꯑꯣꯏꯅꯥ ꯊꯕꯛ ꯇꯧꯕꯥ ꯌꯥꯔꯣꯏ꯫
I said,ꯑꯩꯅꯥ ꯍꯥꯌꯈꯤ .
"""There's nothing to talk aboutr"" she replied curtly","""ꯋꯥꯐꯝ ꯑꯃꯠꯇꯥ ꯂꯩꯇꯦ"" ꯍꯥꯌꯅꯥ ꯃꯍꯥꯛꯅꯥ ꯄꯥꯎꯈꯨꯝ ꯄꯤꯔꯀꯈꯤ"
"""'We don't have a choice,"" I insisted. ""I'm scared. I","""'ꯑꯩꯈꯣꯌꯅꯥ ꯆꯌꯦꯠꯅꯕꯥ ꯑꯃꯥ ꯂꯩꯇꯦ"" ꯍꯥꯌꯅꯥ ꯑꯩꯅꯥ ꯑꯀꯅꯕꯥ ꯋꯥꯐꯝ ꯊꯃꯈꯤ꯫"
"can't stand hating you.""",ꯅꯉꯕꯨ ꯍꯦꯠꯅꯕꯗꯥ ꯂꯦꯞꯄꯥ ꯉꯃꯂꯣꯏ꯫”
"Instantly, my wife knew something had changed. I",ꯈꯨꯗꯛꯇꯥ ꯑꯩꯒꯤ ꯅꯨꯄꯤꯅꯥ ꯀꯔꯤꯒꯨꯝꯕꯥ ꯈꯔꯥ ꯍꯣꯡꯂꯛꯂꯦ ꯍꯥꯌꯕꯥ ꯈꯉꯈꯤ꯫
"was talking lo her, not a, her. ""I'm scared toor"" she con-","ꯋꯥꯁ ꯋꯥꯀꯤꯡ ꯂꯣ ꯍꯦꯔ, ꯅꯠꯇꯦ ꯑꯦ, ꯍꯦꯔ꯫"
fessed,ꯐꯦꯁ ꯇꯧꯕꯥ
Our hands found each other under the blanket. It,ꯑꯩꯈꯣꯌꯒꯤ ꯈꯨꯠꯅꯥ ꯑꯃꯒꯥ ꯑꯃꯒꯥ ꯕ꯭ꯂꯦꯉ꯭ꯀꯦꯠꯀꯤ ꯃꯈꯥꯗꯥ ꯊꯦꯡꯅꯈꯤ꯫
"was the first time we had touched in weeks. Soon, we had",ꯑꯩꯈꯣꯌꯅꯥ ꯅꯨꯃꯤꯠ ꯀꯌꯥꯅꯤ ꯊꯦꯡꯅꯈꯤꯕꯥ ꯑꯍꯥꯅꯕꯥ ꯑꯣꯏꯈꯤ꯫
"the long, honest talk we so desperately needed","ꯑꯩꯈꯣꯌꯅꯥ ꯑꯁꯨꯛ ꯌꯥꯝꯅꯥ ꯃꯊꯧ ꯇꯥꯔꯤꯕꯥ ꯁꯥꯡꯂꯕꯥ, ꯄꯨꯀꯆꯦꯜ ꯁꯦꯡꯕꯥ ꯋꯥꯔꯤ ꯑꯗꯨ"
"From that point on, I have tried to help warring cou-",ꯃꯇꯝ ꯑꯗꯨꯗꯒꯤ ꯑꯩꯍꯥꯛꯅꯥ ꯋꯥꯔꯤ ꯁꯥꯟꯅꯕꯗꯥ ꯃꯇꯦꯡ ꯄꯥꯡꯅꯕꯥ ꯍꯣꯠꯅꯈꯤ꯫
ples understand that it's futile to try to make up before,ꯄ꯭ꯂꯦꯂꯁꯤꯡꯅꯥ ꯈꯉꯏ ꯃꯗꯨꯗꯤ ꯃꯃꯥꯡꯗꯥ ꯃꯦꯛ ꯑꯥꯞ ꯇꯧꯅꯕꯥ ꯍꯣꯠꯅꯕꯥ ꯑꯁꯤ ꯑꯔꯥꯌꯕꯥ ꯑꯃꯅꯤ .
lening go of the anger inside. Trying to be loving while,ꯃꯅꯨꯡꯗꯥ ꯑꯁꯥꯑꯣꯕꯒꯤ ꯂꯦꯅꯤꯡ ꯒꯣ꯫
"still harboring haued might buy you a truce, but not gen-","ꯍꯧꯖꯤꯀꯁꯨ ꯍꯥꯔꯕꯔꯤꯡ ꯍꯥꯎꯗꯅꯥ ꯅꯍꯥꯀꯄꯨ ꯇ꯭ꯔꯨꯁ ꯑꯃꯥ ꯂꯧꯕꯥ ꯌꯥꯏ, ꯑꯗꯨꯕꯨ ꯖꯦꯟ-ꯗꯤ ꯅꯠꯇꯦ꯫"
uine peace. Hatred keeps you on guard. You get defen',ꯎꯏꯟ ꯁꯥꯟꯇꯤ ꯂꯩꯕꯥ꯫
sive over minor remarks and overreact to everything the,sive over ꯃꯥꯏꯅꯣꯔ ꯔꯤꯃꯥꯔꯀꯁꯤꯡ ꯑꯃꯁꯨꯡ ꯄꯣꯠ ꯈꯨꯗꯤꯡꯃꯛ ꯑꯣꯚꯔꯔꯤꯑꯦꯛꯇ ꯇꯧꯕꯥ
"other person does that's not totally, unequivocally posi-","ꯑꯇꯣꯞꯄꯥ ꯃꯤꯑꯣꯏ ꯑꯃꯅꯥ ꯇꯧꯔꯤꯕꯥ ꯑꯗꯨ ꯃꯄꯨꯡ ꯐꯥꯅꯥ, ꯑꯅꯤꯡꯕꯥ ꯄꯣꯁꯤꯅꯤ-"
tive. That's not exactly a recipe for intimacy. Only when,ꯇꯤ.ꯑꯥꯏ.ꯇꯤ.
you are drained of underlying negativity and come to feel,ꯑꯗꯣꯝꯅꯥ ꯑꯟꯗꯔꯂꯥꯏꯟ ꯅꯦꯒꯇꯤꯕꯤꯇꯤꯒꯤ ꯗ꯭ꯔꯦꯟ ꯇꯧꯔꯤ ꯑꯃꯁꯨꯡ ꯐꯤꯜ ꯇꯧꯅꯕꯥ ꯂꯥꯀꯏ .
"punched out emotionally can you think, ""I don't want to","ꯄꯟꯆ ꯇꯧꯔꯕꯥ ꯏꯃꯣꯁꯅꯦꯜ ꯑꯣꯏꯅꯥ ꯅꯍꯥꯛꯅꯥ ꯈꯅꯕꯥ ꯉꯃꯒꯗ꯭ꯔꯥ, ""ꯑꯩꯅꯥ ꯄꯥꯃꯗꯦ"
"hate this person anymore."" Then the rebuilding can be-","ꯃꯤꯑꯣꯏ ꯑꯁꯤꯕꯨ ꯍꯧꯖꯤꯛ ꯍꯧꯖꯤꯛ ꯍꯦꯠ ꯇꯧꯕꯤꯌꯨ꯫"" ꯑꯗꯨꯗꯒꯤ ꯑꯃꯨꯛ ꯍꯟꯅꯥ ꯁꯦꯃꯒꯠꯄꯥ ꯑꯁꯤ-"
gin on a solid foundation,ꯁꯣꯂꯤꯗ ꯐꯥꯎꯟꯗꯦꯁꯟ ꯑꯃꯗꯥ ꯖꯤꯟ .
Haued usually begins with disappointrnent. As you,ꯍꯥꯎꯗ ꯑꯁꯤ ꯃꯍꯧꯁꯥꯅꯥ ꯗꯤꯁꯑꯦꯕꯜ ꯑꯣꯏꯕꯥ ꯃꯑꯣꯡꯗꯥ ꯍꯧꯏ꯫
"discover irritating qualities in your partner, you gradudly","ꯅꯍꯥꯛꯀꯤ ꯄꯥꯔꯇꯅꯔꯗꯥ ꯏꯔꯤꯇꯦꯇꯤꯡ ꯀ꯭ꯕꯂꯤꯇꯤꯁꯤꯡ ꯈꯉꯗꯣꯀꯎ, ꯅꯍꯥꯛꯅꯥ ꯇꯞꯅꯥ ꯇꯞꯅꯥ"
"come to think, ""This is not the person I fell in love with.""","ꯂꯥꯀꯎ, ""ꯃꯁꯤ ꯑꯩꯅꯥ ꯅꯨꯡꯁꯤꯖꯕꯥ ꯃꯤꯁꯛ ꯑꯗꯨ ꯅꯠꯇꯦ꯫"""
"Initially, you hesitate to tell the other person because you","ꯑꯍꯥꯅꯕꯗꯥ, ꯅꯍꯥꯛꯅꯥ ꯑꯇꯣꯞꯄꯥ ꯃꯤꯑꯣꯏ ꯑꯗꯨꯗꯥ ꯍꯥꯌꯕꯗꯥ ꯋꯥꯈꯜ ꯂꯥꯡꯇꯛꯅꯩ ꯃꯔꯃꯗꯤ ꯅꯍꯥꯛꯅꯥ ."
don't want to hurt him. But if your feelings have no out-,ꯃꯍꯥꯀꯄꯨ ꯁꯣꯀꯍꯅꯕꯥ ꯄꯥꯃꯗꯦ꯫
"let, they build up, until you're afraid that if you admit","ꯑꯣꯏꯔꯁꯅꯨ, ꯃꯈꯣꯌꯅꯥ ꯁꯦꯃꯒꯠꯂꯨ, ꯀꯔꯤꯒꯨꯝꯕꯥ ꯅꯍꯥꯛꯅꯥ ꯌꯥꯅꯤꯡꯂꯕꯗꯤ ꯅꯍꯥꯛꯅꯥ ꯀꯤꯕꯥ ꯐꯥꯑꯣꯕꯥ ."
how upset you are the relationship could not endure. In,ꯃꯔꯤ ꯑꯁꯤ ꯀꯌꯥꯗꯥ ꯅꯨꯡꯉꯥꯏꯇꯕꯥ ꯐꯥꯑꯣꯕꯒꯦ ꯍꯥꯌꯕꯗꯨ ꯊꯦꯡꯅꯕꯥ ꯉꯃꯈꯤꯗꯦ꯫
"time, the disappointment turns to anger, and eventually","ꯃꯇꯝ, ꯅꯨꯡꯉꯥꯏꯇꯕꯥ ꯑꯁꯤ ꯑꯁꯥꯑꯣꯕꯥ ꯑꯣꯏꯔꯀꯏ, ꯑꯃꯁꯨꯡ ꯑꯔꯣꯏꯕꯗꯥ ."
the anger becomes chronic and turns into hatred,ꯑꯁꯥꯑꯣꯕꯥ ꯑꯗꯨ ꯀ꯭ꯔꯣꯅꯤꯛ ꯑꯣꯏꯔꯀꯏ ꯑꯃꯁꯨꯡ ꯌꯦꯛꯅꯕꯥ ꯑꯣꯏꯅꯥ ꯑꯣꯟꯊꯣꯀꯏ .
[60],[꯶꯰] ꯑꯃꯁꯨꯡ ꯑꯦꯟ.
TRYING TO MAKE UP ''qHILE YOU'RE STILL ANGRY,''QHILE YOU’RE STLY ANGRY ꯇꯧꯅꯕꯥ ꯍꯣꯠꯅꯕꯥ
Hating usually hurts the hater more than the one,ꯍꯦꯇꯤꯡꯅꯥ ꯃꯍꯧꯁꯥꯅꯥ ꯍꯦꯇꯔꯕꯨ ꯍꯦꯟꯅꯥ ꯁꯣꯀꯍꯜꯂꯤ .
"who is hated. I often ask couples, ""If you had to choose",ꯀꯅꯥꯅꯥ ꯍꯦꯠꯅꯔꯤꯕꯅꯣ꯫
between getting your way all the time and never having,ꯃꯇꯝ ꯄꯨꯝꯅꯃꯛꯇꯥ ꯅꯍꯥꯛꯀꯤ ꯂꯝꯕꯤ ꯐꯪꯕꯒꯤ ꯃꯔꯛꯇꯥ ꯑꯃꯁꯨꯡ ꯀꯩꯗꯧꯉꯩꯗꯥ ꯂꯩꯕꯒꯤ ꯃꯔꯛꯇꯥ .
"to feel angry toward your spouse, which would you","ꯅꯍꯥꯛꯀꯤ ꯅꯨꯄꯥ ꯅꯠꯠꯔꯒꯥ ꯅꯨꯄꯤ ꯑꯗꯨꯒꯤ ꯃꯥꯌꯀꯩꯗꯥ ꯑꯁꯥꯑꯣꯕꯥ ꯐꯥꯑꯣꯅꯕꯥ, ꯅꯍꯥꯛꯅꯥ ꯀꯔꯤ ꯇꯧꯒꯅꯤ ."
"take?"" Nearly everyone says, ""Never being angry again.""","take?"" ꯆꯥꯎꯔꯥꯛꯅꯥ ꯃꯤꯄꯨꯝ ꯈꯨꯗꯤꯡꯃꯛꯅꯥ ꯍꯥꯌꯔꯤ, ""ꯀꯩꯗꯧꯉꯩꯗꯁꯨ ꯑꯃꯨꯛ ꯍꯟꯅꯥ ꯂꯥꯡꯇꯛꯅꯔꯣꯏ꯫"""
"Deep inside, most of us know that feeling hatred is much","ꯊꯃꯣꯏꯗꯥ, ꯑꯩꯈꯣꯌ ꯑꯌꯥꯝꯕꯅꯥ ꯈꯉꯏ ꯃꯗꯨꯗꯤ ꯌꯦꯛꯅꯕꯥ ꯐꯥꯑꯣꯕꯥ ꯑꯁꯤ ꯌꯥꯝꯅꯥ ꯋꯥꯡꯏ ."
more painful than not gening our way. As one husband,ꯑꯩꯈꯣꯌꯒꯤ ꯂꯝꯕꯤꯗꯥ ꯖꯦꯅꯔꯦꯠ ꯇꯧꯗꯕꯗꯒꯤ ꯍꯦꯟꯅꯥ ꯑꯋꯥꯕꯥ꯫
"poignantly stated, ""The only thing I hate more than my","ꯊꯝꯃꯣꯌ ꯁꯣꯛꯅꯥ ꯍꯥꯌꯔꯀꯈꯤ, ""ꯑꯩꯒꯤ ꯃꯊꯛꯇꯥ ꯑꯩꯅꯥ ꯍꯦꯟꯅꯥ ꯂꯥꯡꯇꯛꯅꯔꯤꯕꯥ ꯋꯥꯐꯝ ꯑꯃꯈꯛꯇꯅꯤ꯫"
"wife is hating her.""",ꯅꯨꯄꯤꯅꯥ ꯃꯍꯥꯀꯄꯨ ꯌꯥꯝꯅꯥ ꯂꯥꯡꯇꯛꯅꯩ꯫”
"""You cannot shahc hands with a clpnched fist.""","""ꯅꯍꯥꯛꯅꯥ ꯀ꯭ꯂꯞꯟꯆ ꯐꯤꯁ꯭ꯠ ꯑꯃꯒꯥ ꯂꯣꯌꯅꯅꯥ ꯈꯨꯠ ꯊꯥꯅꯕꯥ ꯌꯥꯔꯣꯏ꯫"""
_INDIMGANDHI,_ꯏꯟꯗꯤꯃꯒꯟꯙꯤ
Can you imagine a worse fate than to come to the,ꯑꯗꯣꯝꯅꯥ ꯂꯥꯀꯄꯥ ꯑꯁꯤꯗꯒꯤ ꯍꯦꯟꯅꯥ ꯐꯠꯇꯕꯥ ꯚꯥꯒ꯭ꯌ ꯑꯃꯥ ꯈꯅꯕꯤꯕꯥ ꯉꯃꯒꯗ꯭ꯔꯥ .
end of your life and realne that you hated well but loved,ꯑꯗꯣꯃꯒꯤ ꯄꯨꯟꯁꯤ ꯑꯃꯁꯨꯡ ꯔꯤꯑꯦꯂꯅꯒꯤ ꯑꯔꯣꯏꯕꯥ ꯑꯗꯨ ꯑꯗꯣꯝꯅꯥ ꯐꯖꯅꯥ ꯌꯦꯡꯂꯃꯈꯤ ꯑꯗꯨꯕꯨ ꯅꯨꯡꯁꯤꯈꯤ
poorly? If you'd like to thaw out the cold war between,ꯂꯥꯌꯔꯕꯥ?
"you and your partner, you have to get through ttre hate","ꯑꯗꯣꯝ ꯑꯃꯁꯨꯡ ꯑꯗꯣꯃꯒꯤ ꯄꯥꯔꯇꯅꯔ, ꯑꯗꯣꯝꯅꯥ ꯇꯤ.ꯇꯤ.ꯑꯥꯔ.ꯏ."
"Fornrnately, while it might seem surprising, hatred is ac-","ꯐꯣꯔꯅꯔꯅꯥꯂꯤ, ꯃꯁꯤ ꯑꯉꯀꯄꯥ ꯑꯣꯏꯅꯥ ꯎꯕꯥ ꯐꯪꯂꯕꯁꯨ, ꯌꯦꯛꯅꯕꯥ ꯑꯁꯤ ꯑꯦ.ꯁꯤ.-"
tually easier to overcome than the loss of love. When love,ꯅꯨꯡꯁꯤꯕꯥ ꯃꯥꯡꯈꯤꯕꯗꯒꯤ ꯍꯦꯟꯅꯥ ꯇꯨꯜꯂꯤ ꯂꯥꯟꯊꯣꯀꯄꯗꯥ ꯍꯦꯟꯅꯥ ꯂꯥꯌꯕꯥ꯫
"really dies, it cannot be resurrected by an act of will. But","ꯇꯁꯦꯡꯅꯥ ꯁꯤꯕꯥ, ꯃꯁꯤ ꯋꯤꯂꯒꯤ ꯊꯕꯛ ꯑꯃꯅꯥ ꯍꯤꯡꯒꯠꯍꯅꯕꯥ ꯉꯃꯗꯦ꯫"
"if it has merely been obscured by a cloud of hate, it can","ꯀꯔꯤꯒꯨꯝꯕꯥ ꯃꯁꯤ ꯁꯨꯞꯅꯇꯒꯤ ꯍꯦꯠꯅ-ꯆꯩꯅꯕꯥ ꯑꯃꯅꯥ ꯁꯨꯞꯅꯇꯒꯤ ꯀꯨꯃꯊꯔꯀꯄꯥ ꯑꯣꯏꯔꯕꯗꯤ, ꯃꯁꯤꯅꯥ ."
shine again once the hate has dissipated,ꯍꯦꯠ ꯑꯗꯨ ꯂꯧꯊꯣꯛꯂꯕꯥ ꯃꯇꯨꯡꯗꯥ ꯑꯃꯨꯛ ꯍꯟꯅꯥ ꯃꯉꯥꯜ ꯄꯤꯌꯨ .
USABLE INSIGHT',ꯁꯤꯖꯤꯟꯅꯕꯥ ꯌꯥꯕꯥ ꯋꯥꯈꯜꯂꯣꯟ'꯫
"Relationships end nnt because yuu stop loving, but","ꯔꯤꯂꯦꯁꯅꯁꯤꯄꯁꯤꯡ ꯂꯣꯏꯔꯦ nnt ꯃꯔꯃꯗꯤ ꯌꯨꯅꯥ ꯅꯨꯡꯁꯤꯕꯥ ꯂꯦꯄꯍꯜꯂꯤ, ꯑꯗꯨꯕꯨ ."
because you can't stnp hating each ntheL,ꯃꯔꯃꯗꯤ ꯅꯍꯥꯛꯅꯥ nthel ꯈꯨꯗꯤꯡꯃꯛ stnp ꯍꯦꯇꯤꯡ ꯇꯧꯕꯥ ꯉꯃꯗꯦ .
"them a fantasy life in your mind. Imagine a hateful,",ꯃꯈꯣꯌꯁꯤꯡ ꯑꯗꯨ ꯅꯍꯥꯛꯀꯤ ꯋꯥꯈꯂꯗꯥ ꯐꯦꯟꯁꯤ ꯂꯥꯏꯐ ꯑꯃꯅꯤ꯫
[61 ],[61] ꯒꯤ ꯃꯇꯨꯡ ꯏꯟꯅꯥ ꯑꯦꯟ.
GET OUT OF YOUR OWN WAY,ꯑꯗꯣꯃꯒꯤ ꯃꯑꯣꯡ ꯃꯇꯧꯗꯒꯤ ꯊꯣꯔꯀꯎ
vengeful action that matches your feeling and play it,ꯅꯍꯥꯛꯀꯤ ꯐꯤꯜꯂꯤꯡ ꯑꯃꯁꯨꯡ ꯃꯁꯤꯒꯥ ꯃꯥꯟꯅꯕꯥ ꯚꯦꯟꯖ꯭ꯌꯨꯜ ꯑꯦꯛꯁꯟ
out mentally. Doing this can help you feel less out of,ꯃꯦꯟꯇꯦꯜ ꯑꯣꯏꯅꯥ ꯑꯥꯎꯠ ꯇꯧꯕꯥ꯫
control,ꯂꯥꯛꯁꯤꯟꯕ
"feel on the surface, but don't stop until you get to the","ꯃꯊꯛꯇꯥ ꯐꯤꯜ ꯇꯧꯕꯤꯌꯨ, ꯑꯗꯨꯕꯨ ꯅꯍꯥꯛꯅꯥ ꯌꯧꯔꯛꯠꯔꯤꯕꯐꯥꯎꯕꯥ ꯂꯦꯄꯀꯅꯨ꯫"
vulnerability that underlies the hostility. Emotions,ꯌꯦꯛꯅꯕꯥ ꯑꯗꯨꯒꯤ ꯃꯈꯥ ꯄꯣꯜꯂꯤꯕꯥ ꯚꯂꯅꯦꯔꯦꯕꯤꯂꯤꯇꯤ꯫
are built on layers. Beneath hatred is usually anger;,ꯑꯁꯤ ꯂꯦꯌꯔꯁꯤꯡꯗꯥ ꯁꯥꯕꯅꯤ꯫
