en,mni-Mtei
Good time management enables you to work smarter – not harder – so that you get more done in,ꯑꯐꯕꯥ ꯃꯇꯃꯒꯤ ꯃꯦꯅꯦꯖꯃꯦꯟꯇꯅꯥ ꯅꯍꯥꯀꯄꯨ ꯍꯦꯟꯅꯥ ꯁ꯭ꯃꯥꯔꯠ ꯑꯣꯏꯅꯥ ꯊꯕꯛ ꯇꯧꯕꯥ ꯉꯃꯍꯜꯂꯤ – ꯍꯦꯟꯅꯥ ꯀꯟꯅꯥ ꯍꯣꯠꯅꯕꯥ ꯅꯠꯇꯦ – ꯃꯗꯨꯅꯥ ꯅꯍꯥꯛꯅꯥ ꯍꯦꯟꯅꯥ ꯐꯕꯥ ꯊꯕꯛ ꯇꯧꯕꯥ ꯉꯃꯍꯜꯂꯤ꯫
"less time, even when time is tight and pressures are high","ꯃꯇꯝ ꯍꯟꯊꯕꯥ, ꯃꯇꯝ ꯀꯨꯏꯅꯥ ꯆꯠꯄꯥ ꯑꯃꯁꯨꯡ ꯄ꯭ꯔꯦꯁꯔ ꯋꯥꯡꯕꯥ ꯃꯇꯃꯗꯁꯨ"
Failing to manage your time damages your effectiveness and causes stress,ꯅꯍꯥꯛꯀꯤ ꯃꯇꯃꯒꯤ ꯑꯃꯥꯡ-ꯑꯇꯥꯁꯤꯡ ꯃꯦꯅꯦꯖ ꯇꯧꯕꯥ ꯉꯃꯗꯕꯥ ꯅꯍꯥꯛꯀꯤ ꯏꯐꯦꯛꯇ ꯑꯃꯁꯨꯡ ꯁ꯭ꯠꯔꯦꯁ ꯊꯣꯀꯍꯜꯂꯤ
4.7.1,꯴.꯷.꯱ ꯑꯣꯏꯈꯤ꯫
Steps in Time Management:,ꯃꯇꯝ ꯂꯦꯞꯄꯒꯤ ꯈꯣꯡꯊꯥꯡꯁꯤꯡ:
Time Management includes:,ꯃꯇꯝ ꯂꯦꯞꯄꯗꯥ ꯌꯥꯑꯣꯔꯤꯕꯁꯤꯡꯗꯤ:
1,꯱.
Effective Planning,ꯏꯐꯦꯛꯇꯤꯕ ꯑꯣꯏꯕꯥ ꯄ꯭ꯂꯥꯅꯤꯡ ꯇꯧꯕꯥ
2,꯲ ꯑꯃꯁꯨꯡ ꯲.
Setting goals and objectives,ꯄꯥꯟꯗꯝ ꯑꯃꯁꯨꯡ ꯄꯥꯟꯗꯃꯁꯤꯡ ꯊꯝꯕꯥ .
3,꯳ ꯑꯃꯁꯨꯡ ꯳.
Setting deadlines,ꯗꯦꯗꯂꯥꯏꯅꯁꯤꯡ ꯁꯦꯠ ꯇꯧꯕꯥ
4,꯴ ꯑꯃꯁꯨꯡ ꯴.
Delegation of responsibilities,ꯊꯧꯗꯥꯡꯁꯤꯡꯒꯤ ꯗꯦꯂꯤꯒꯦꯁꯟ .
5,꯵ ꯑꯃꯁꯨꯡ ꯵.
Prioritizing activities as per their importance,ꯃꯈꯣꯌꯒꯤ ꯃꯔꯨꯑꯣꯏꯕꯥ ꯃꯇꯨꯡ ꯏꯟꯅꯥ ꯊꯕꯛ ꯊꯧꯔꯃꯁꯤꯡꯗꯥ ꯃꯔꯨ ꯑꯣꯏꯕꯥ ꯄꯤꯕꯥ
6,꯶ ꯑꯃꯁꯨꯡ ꯶.
Spending the right time on the right activity,ꯑꯆꯨꯝꯕꯥ ꯊꯕꯛꯇꯥ ꯑꯆꯨꯝꯕꯥ ꯃꯇꯝ ꯀꯥꯌꯊꯣꯀꯄꯥ
1. Effective Planning:,꯱.ꯏꯐꯦꯛꯇꯤꯕ ꯄ꯭ꯂꯥꯅꯤꯡ ꯇꯧꯕꯥ: ꯱.
Plan your day well in advance. Prepare a to do List or a “Task Plan”. Sort down the important activities,ꯅꯍꯥꯛꯀꯤ ꯅꯨꯃꯤꯠ ꯑꯗꯨ ꯃꯇꯤꯛ ꯆꯥꯅꯥ ꯍꯥꯟꯅꯥ ꯊꯧꯔꯥꯡ ꯇꯧꯕꯤꯌꯨ꯫
that need to be done in a single day against the time that should be allocated to each activity. High Priority,ꯃꯗꯨ ꯑꯦꯛꯇꯤꯚꯤꯇꯤ ꯈꯨꯗꯤꯡꯃꯛꯇꯥ ꯑꯦꯂꯣꯀꯦꯠ ꯇꯧꯒꯗꯕꯥ ꯃꯇꯃꯒꯤ ꯃꯇꯨꯡ ꯏꯟꯅꯥ ꯅꯨꯃꯤꯠ ꯑꯃꯗꯥ ꯇꯧꯕꯥ ꯃꯊꯧ ꯇꯥꯏ꯫
work should come on top followed by those which do not need much of your importance at the moment,ꯊꯕꯛ ꯑꯁꯤ ꯃꯊꯛꯇꯥ ꯄꯤꯒꯗꯕꯅꯤ ꯑꯃꯁꯨꯡ ꯃꯗꯨꯒꯤ ꯃꯇꯨꯡꯗꯥ ꯍꯧꯖꯤꯛꯀꯤ ꯃꯇꯝ ꯑꯁꯤꯗꯥ ꯑꯗꯣꯃꯒꯤ ꯃꯔꯨꯑꯣꯏꯕꯥ ꯀꯌꯥ ꯃꯊꯧ ꯇꯥꯗꯦ ꯍꯥꯌꯅꯥ .
2. Setting Goals and Objectives:,2. ꯄꯥꯟꯗꯝ ꯑꯃꯁꯨꯡ ꯄꯥꯟꯗꯃꯁꯤꯡ ꯊꯝꯕꯥ:
Working without goals and targets in an organization would be similar to a situation where the captain of,ꯑꯣꯔꯒꯅꯥꯏꯖꯦꯁꯟ ꯑꯃꯗꯥ ꯄꯥꯟꯗꯝ ꯑꯃꯁꯨꯡ ꯄꯥꯟꯗꯃꯁꯤꯡ ꯌꯥꯑꯣꯗꯅꯥ ꯊꯕꯛ ꯇꯧꯕꯥ ꯑꯁꯤ ꯀꯦꯞꯇꯦꯟ ꯳ꯒꯤ ꯀꯦꯞꯇꯦꯟ ꯑꯗꯨꯅꯥ [...]
"the ship loses his way in the sea. Yes, you would be lost. Set targets for yourself and make sure they are",ꯖꯍꯥꯖ ꯑꯗꯨꯅꯥ ꯁꯃꯨꯗ꯭ꯔꯗꯥ ꯃꯍꯥꯛꯀꯤ ꯂꯝꯕꯤ ꯃꯥꯡꯍꯜꯂꯤ꯫
realistic ones and achievable,ꯔꯤꯑꯦꯂꯤꯁ꯭ꯇꯤꯛ ꯑꯣꯏꯕꯥ ꯑꯃꯁꯨꯡ ꯑꯦꯆꯤꯕ ꯇꯧꯕꯥ ꯌꯥꯕꯥ .
3. Setting Deadlines:,꯳.ꯗꯦꯗꯂꯥꯏꯅꯁꯤꯡ ꯁꯦꯠ ꯇꯧꯕꯥ:
Set deadlines for yourself and strive hard to complete tasks ahead of the deadlines. Do not wait for your,ꯅꯍꯥꯛꯀꯤꯗꯃꯛꯇꯥ ꯗꯦꯗꯂꯥꯏꯅꯁꯤꯡ ꯂꯦꯄꯊꯣꯀꯎ ꯑꯃꯁꯨꯡ ꯗꯦꯗꯂꯥꯏꯅꯁꯤꯡꯒꯤ ꯃꯃꯥꯡꯗꯥ ꯊꯕꯀꯁꯤꯡ ꯃꯄꯨꯡ ꯐꯥꯍꯟꯅꯕꯥ ꯀꯟꯅꯥ ꯍꯣꯠꯅꯧ꯫
superiors to ask you every time. Learn to take ownership of work. One person who can best set the,ꯃꯇꯝ ꯈꯨꯗꯤꯡꯃꯛꯇꯥ ꯑꯗꯣꯃꯗꯥ ꯍꯪꯅꯕꯥ ꯁꯨꯄꯔꯤꯌꯔꯁꯤꯡꯅꯥ꯫
deadlines is you yourself. Ask yourself how much time needs to be devoted to a particular task and for,ꯗꯦꯗꯂꯥꯏꯅꯁꯤꯡ ꯑꯁꯤ ꯅꯍꯥꯛ ꯅꯁꯥꯃꯛꯅꯤ꯫
how many days. Use a planner to mark the important dates against the set deadlines,ꯀꯌꯥ ꯅꯨꯃꯤꯠ ꯀꯌꯥ꯫
4. Delegation of Responsibilities:,꯴.ꯊꯧꯗꯥꯡꯁꯤꯡꯒꯤ ꯗꯦꯂꯤꯒꯦꯁꯟ:
Learn to say “NO” at workplace. Don’t do everything on your own. There are other people as well. One,ꯊꯕꯛ ꯃꯐꯃꯗꯥ “ꯅꯠꯇꯦ” ꯍꯥꯌꯕꯥ ꯇꯃꯁꯤꯜꯂꯨ꯫
should not accept something which he knows is difficult for him. The roles and responsibilities must be,ꯃꯍꯥꯛꯅꯥ ꯈꯉꯂꯤꯕꯥ ꯋꯥꯐꯝ ꯑꯃꯥ ꯃꯍꯥꯛꯀꯤꯗꯃꯛꯇꯥ ꯌꯥꯝꯅꯥ ꯂꯨꯕꯥ ꯑꯣꯏꯔꯣꯏꯗꯕꯅꯤ꯫
delegated as per interest and specialization of employees for them to finish tasks within deadlines. A,ꯃꯈꯣꯌꯅꯥ ꯑꯔꯣꯏꯕꯥ ꯃꯇꯃꯒꯤ ꯃꯅꯨꯡꯗꯥ ꯊꯕꯀꯁꯤꯡ ꯂꯣꯏꯁꯤꯟꯅꯕꯥ ꯏꯃꯞꯂꯣꯌꯤꯁꯤꯡꯒꯤ ꯏꯟꯇꯔꯦꯁ꯭ꯠ ꯑꯃꯁꯨꯡ ꯁ꯭ꯄꯦꯁꯤꯑꯦꯂꯥꯏꯖꯦꯁꯅꯒꯤ ꯃꯇꯨꯡ ꯏꯟꯅꯥ ꯄꯤꯕꯥ꯫
person who does not have knowledge about something needs more time than someone who knows the,ꯀꯔꯤꯒꯨꯝꯕꯥ ꯋꯥꯐꯝ ꯑꯃꯒꯤ ꯃꯇꯥꯡꯗꯥ ꯂꯧꯁꯤꯡ ꯂꯩꯇꯕꯥ ꯃꯤꯑꯣꯏ ꯑꯗꯨꯅꯥ ꯈꯉꯂꯕꯥ ꯃꯤꯑꯣꯏ ꯑꯃꯗꯒꯤ ꯍꯦꯟꯅꯥ ꯃꯇꯝ ꯃꯊꯧ ꯇꯥꯏ꯫
work well,ꯐꯖꯅꯥ ꯊꯕꯛ ꯇꯧꯕꯥ
5. Prioritizing Tasks:,꯵.ꯆꯟꯅꯕꯥ ꯊꯕꯀꯁꯤꯡꯗꯥ ꯃꯔꯨ ꯑꯣꯏꯕꯥ ꯄꯤꯕꯥ:
Prioritize the tasks as per their importance and urgency. Know the difference between important and,ꯃꯈꯣꯌꯒꯤ ꯃꯔꯨꯑꯣꯏꯕꯥ ꯑꯃꯁꯨꯡ ꯈꯨꯗꯛꯀꯤ ꯑꯣꯏꯕꯥ ꯃꯇꯨꯡ ꯏꯟꯅꯥ ꯊꯕꯀꯁꯤꯡ ꯑꯗꯨ ꯃꯔꯨ ꯑꯣꯏꯅꯥ ꯂꯧꯕꯥ꯫
"urgent work. Identify which tasks should be done within a day, which all should be done within a month",ꯈꯨꯗꯛꯀꯤ ꯑꯣꯏꯕꯥ ꯊꯕꯛ ꯇꯧꯕꯥ꯫
and so on. Tasks which are most important should be done earlier,ꯑꯃꯁꯨꯡ ꯃꯈꯥ ꯇꯥꯅꯥ ꯆꯠꯊꯔꯤ꯫
6. Spending the right time on right activity:,꯶.ꯑꯆꯨꯝꯕꯥ ꯊꯕꯛ ꯊꯧꯔꯃꯁꯤꯡꯗꯥ ꯑꯆꯨꯝꯕꯥ ꯃꯇꯝ ꯊꯥꯗꯕꯥ:
Develop the habit of doing the right thing at the right time. Work done at the wrong time is not of much,ꯑꯆꯨꯝꯕꯥ ꯊꯕꯛ ꯑꯗꯨ ꯑꯆꯨꯝꯕꯥ ꯃꯑꯣꯡꯗꯥ ꯇꯧꯕꯒꯤ ꯍꯩꯅꯕꯤ ꯁꯦꯃꯒꯠꯄꯥ꯫
use. Don’t waste a complete day on something which can be done in an hour or so. Also keep some time,ꯁꯤꯖꯤꯟꯅꯕ.
separate for your personal calls or checking updates on Facebook or Twitter. After all human being is not,ꯅꯍꯥꯛꯀꯤ ꯄꯔꯁꯣꯅꯦꯜ ꯀꯣꯂꯁꯤꯡ ꯅꯠꯠꯔꯒꯥ ꯐꯦꯁꯕꯨꯛ ꯅꯠꯠꯔꯒꯥ ꯇꯨꯏꯇꯥꯔꯗꯥ ꯑꯄꯗꯦꯠꯁꯤꯡ ꯆꯦꯛ ꯇꯧꯕꯒꯤꯗꯃꯛ ꯇꯣꯉꯥꯟꯅꯥ ꯊꯝꯃꯨ꯫
a machine,ꯃꯦꯁꯤꯟ ꯑꯃꯥ .
4.7.2,꯴.꯷.꯲ ꯑꯣꯏꯈꯤ꯫
Advantages of Time Management:,ꯃꯇꯝ ꯂꯦꯞꯄꯒꯤ ꯀꯥꯟꯅꯕꯁꯤꯡ:
1. Reduction in stress level: The reduction in stress level is main content of time management. If you,1. ꯁ꯭ꯠꯔꯦꯁꯀꯤ ꯊꯥꯛ ꯍꯟꯊꯍꯅꯕꯥ: ꯁ꯭ꯠꯔꯦꯁꯀꯤ ꯊꯥꯛ ꯍꯟꯊꯍꯅꯕꯥ ꯑꯁꯤ ꯃꯇꯝ ꯂꯦꯞꯄꯒꯤ ꯃꯔꯨꯑꯣꯏꯕꯥ ꯃꯆꯥꯛ ꯑꯃꯅꯤ꯫
follow time management properly then you will get better result. Even you can relax yourself while,ꯃꯇꯝ ꯂꯦꯞꯄꯥ ꯑꯁꯤ ꯃꯑꯣꯡ ꯆꯨꯝꯅꯥ ꯇꯨꯡ ꯏꯟꯗꯨꯅꯥ ꯆꯠꯂꯨ ꯃꯗꯨꯒꯤ ꯃꯇꯨꯡꯗꯥ ꯅꯍꯥꯛꯅꯥ ꯍꯦꯟꯅꯥ ꯐꯕꯥ ꯐꯜ ꯐꯪꯒꯅꯤ꯫
enjoying your work. Stress leads to spoiling of work schedule and distur1bed work schedule can never,ꯑꯗꯣꯃꯒꯤ ꯊꯕꯛ ꯑꯗꯨ ꯅꯨꯡꯉꯥꯏꯅꯥ ꯄꯥꯡꯊꯣꯀꯄꯥ꯫
provide best results. The result will come undoubtedly but no one can say it will be best or worst,ꯈ꯭ꯕꯥꯏꯗꯒꯤ ꯐꯕꯥ ꯐꯂꯁꯤꯡ ꯄꯤꯕꯥ꯫
2. Provides focus on the task: The time management initially provides relief from stress and later helps,2. ꯊꯕꯛ ꯑꯗꯨꯗꯥ ꯃꯤꯠꯌꯦꯡ ꯊꯝꯕꯥ: ꯃꯇꯝ ꯂꯦꯞꯄꯥ ꯑꯁꯤꯅꯥ ꯑꯍꯥꯅꯕꯗꯥ ꯁ꯭ꯠꯔꯦꯁꯇꯒꯤ ꯔꯤꯂꯤꯐ ꯄꯤ ꯑꯃꯁꯨꯡ ꯃꯇꯨꯡꯗꯥ ꯃꯇꯦꯡ ꯄꯥꯡꯏ
you in focusing your target and performance in task. A focused person becomes successful in less time as,ꯅꯍꯥꯛꯅꯥ ꯅꯍꯥꯛꯀꯤ ꯄꯥꯟꯗꯝ ꯑꯃꯁꯨꯡ ꯄꯔꯐꯣꯃꯦꯟꯁ ꯑꯗꯨ ꯊꯕꯛꯇꯥ ꯐꯣꯀꯁ ꯇꯧꯕꯗꯥ꯫
compared to those who do more struggle for getting their target in life. The people always desire to have,ꯄꯨꯟꯁꯤꯗꯥ ꯃꯈꯣꯌꯒꯤ ꯄꯥꯟꯗꯝ ꯐꯪꯅꯕꯥ ꯍꯦꯟꯅꯥ ꯂꯥꯟꯊꯦꯡꯅꯔꯤꯕꯥ ꯃꯤꯑꯣꯏꯁꯤꯡꯒꯥ ꯆꯥꯡꯗꯝꯅꯕꯗꯥ꯫
successful and enjoyable life and that can be obtained by keeping a focused view about everything and,ꯃꯥꯌ ꯄꯥꯛꯂꯕꯥ ꯑꯃꯁꯨꯡ ꯅꯨꯡꯉꯥꯏꯕꯥ ꯄꯨꯟꯁꯤ ꯑꯃꯁꯨꯡ ꯃꯗꯨ ꯄꯨꯝꯅꯃꯛꯀꯤ ꯃꯇꯥꯡꯗꯥ ꯃꯤꯠꯌꯦꯡ ꯊꯝꯕꯥ ꯃꯤꯠꯌꯦꯡ ꯑꯃꯥ ꯊꯃꯗꯨꯅꯥ ꯐꯪꯍꯅꯕꯥ ꯉꯃꯒꯅꯤ ꯑꯃꯁꯨꯡ
every step,ꯈꯣꯡꯊꯥꯡ ꯈꯨꯗꯤꯡꯃꯛ .
3. Decrease procrastination: There is much duration in life and it also brings fluctuation. The particular,3. ꯄ꯭ꯔꯣꯛꯔꯦꯁ꯭ꯇꯤꯅꯦꯁꯟ ꯍꯟꯊꯍꯅꯕꯥ: ꯄꯨꯟꯁꯤꯗꯥ ꯃꯇꯝ ꯌꯥꯝꯅꯥ ꯆꯪꯏ ꯑꯃꯁꯨꯡ ꯃꯁꯤꯅꯥ ꯐ꯭ꯂꯨꯛꯇꯦꯁꯟꯁꯨ ꯄꯨꯔꯀꯏ꯫
point in adopting time management is the ability to predict the results and control the situations. Managing,ꯃꯇꯝ ꯂꯦꯞꯄꯗꯥ ꯑꯦꯗꯣꯞꯇ ꯇꯧꯕꯒꯤ ꯄꯣꯏꯟꯇ ꯑꯁꯤ ꯔꯤꯖꯜꯇꯁꯤꯡ ꯑꯗꯨ ꯂꯥꯎꯊꯣꯀꯄꯥ ꯑꯃꯁꯨꯡ ꯐꯤꯚꯃꯁꯤꯡ ꯀꯟꯠꯔꯣꯜ ꯇꯧꯕꯥ ꯉꯝꯕꯅꯤ꯫
"time isn’t something that requires extra skills, the only need is to have some knowledge about how to and","ꯃꯇꯝ ꯑꯁꯤ ꯑꯍꯦꯅꯕꯥ ꯁ꯭ꯀꯤꯜ ꯃꯊꯧ ꯇꯥꯕꯥ ꯋꯥꯐꯝ ꯑꯃꯅꯤ, ꯃꯁꯤꯒꯤ ꯑꯃꯠꯇꯥ ꯉꯥꯏꯔꯕꯥ ꯃꯊꯧ ꯇꯥꯕꯥ ꯑꯁꯤ ꯀꯔꯝꯅꯥ ꯇꯧꯒꯅꯤ ꯑꯃꯁꯨꯡ ꯃꯇꯧ ꯀꯔꯝꯅꯥ ꯇꯧꯒꯅꯤ ꯍꯥꯌꯕꯒꯤ ꯃꯇꯥꯡꯗꯥ ꯂꯧꯁꯤꯡ ꯈꯔꯥ ꯂꯩꯕꯅꯤ ꯑꯃꯁꯨꯡ ."
be dedicated to implement it within your day to day activities,ꯃꯁꯤ ꯅꯍꯥꯛꯀꯤ ꯅꯨꯃꯤꯠ ꯈꯨꯗꯤꯡꯒꯤ ꯑꯣꯏꯕꯥ ꯊꯕꯛ ꯊꯧꯔꯃꯁꯤꯡꯒꯤ ꯃꯅꯨꯡꯗꯥ ꯏꯃꯞꯂꯤꯃꯦꯟꯇ ꯇꯧꯅꯕꯥ ꯀꯠꯊꯣꯛꯂꯕꯥ
4. Gain self-confidence: Self-confidence plays a vital role in human life and self-confident people always,4. ꯃꯁꯥꯅꯥ ꯃꯁꯥꯕꯨ ꯊꯥꯖꯕꯥ ꯍꯦꯅꯒꯠꯍꯅꯕꯥ: ꯃꯁꯥꯅꯥ ꯃꯁꯥꯕꯨ ꯊꯥꯖꯕꯥ ꯊꯝꯕꯥ ꯑꯁꯤꯅꯥ ꯃꯤꯑꯣꯏꯕꯒꯤ ꯄꯨꯟꯁꯤꯗꯥ ꯑꯃꯁꯨꯡ ꯃꯁꯥꯅꯥ ꯃꯁꯥꯕꯨ ꯊꯥꯖꯕꯥ ꯃꯤꯑꯣꯏꯁꯤꯡꯗꯥ ꯃꯇꯝ ꯄꯨꯝꯅꯃꯛꯇꯥ ꯃꯔꯨꯑꯣꯏꯕꯥ ꯊꯧꯗꯥꯡ ꯂꯧꯔꯤ
have better life than dependent persons. The feel usually comes when you plan your work properly and,ꯗꯤꯄꯦꯟꯗꯦꯟꯇ ꯑꯣꯏꯕꯥ ꯃꯤꯑꯣꯏꯁꯤꯡꯗꯒꯤ ꯍꯦꯟꯅꯥ ꯐꯕꯥ ꯄꯨꯟꯁꯤ ꯂꯩꯕꯥ꯫
"take decisions on time for betterment. “Time management never takes your time, rather provides you extra",ꯍꯦꯟꯅꯥ ꯐꯕꯥ ꯑꯣꯏꯅꯕꯒꯤꯗꯃꯛ ꯃꯇꯝ ꯆꯥꯅꯥ ꯋꯥꯔꯦꯄꯁꯤꯡ ꯂꯧꯕꯥ꯫
time.” A person can do anything with confidence and self trust leads a human being to the next level,"ꯃꯇꯝ."""
5. A way to the goal: Everybody has a desire to achieve his/her goal in life and dream to get a relaxing,5. ꯄꯥꯟꯗꯝ ꯑꯗꯨꯒꯤ ꯃꯑꯣꯡ ꯑꯃꯥ: ꯃꯤꯄꯨꯝ ꯈꯨꯗꯤꯡꯃꯛꯀꯤ ꯄꯨꯟꯁꯤ ꯑꯃꯁꯨꯡ ꯃꯪꯂꯥꯟ ꯑꯗꯨ ꯃꯪꯐꯥꯑꯣꯅꯍꯟꯅꯕꯥ ꯃꯍꯥꯛꯀꯤ ꯄꯥꯟꯗꯝ ꯑꯗꯨ ꯐꯪꯅꯕꯒꯤ ꯑꯄꯥꯝꯕꯥ ꯂꯩ
future after attaining target. Managing time allots you time where it has the most impact. Time,ꯇꯥꯔꯒꯦꯠ ꯐꯪꯂꯕꯥ ꯃꯇꯨꯡꯗꯥ ꯇꯨꯡꯒꯤ꯫
"management allows every human to spend time on the things that matter most to them. In this process,",ꯃꯦꯅꯦꯖꯃꯦꯟꯇꯅꯥ ꯃꯤꯑꯣꯏꯕꯥ ꯈꯨꯗꯤꯡꯃꯀꯄꯨ ꯃꯈꯣꯌꯗꯥ ꯈ꯭ꯕꯥꯏꯗꯒꯤ ꯃꯔꯨ ꯑꯣꯏꯕꯥ ꯋꯥꯐꯃꯁꯤꯡꯗꯥ ꯃꯇꯝ ꯀꯥꯌꯊꯣꯀꯄꯥ ꯉꯃꯍꯜꯂꯤ꯫
time management has a positive aspect to perform and people consider the scheduling a better option,ꯃꯇꯝ ꯂꯦꯞꯄꯥ ꯑꯁꯤꯅꯥ ꯄꯥꯡꯊꯣꯛꯀꯗꯕꯥ ꯄꯣꯖꯤꯇꯤꯕ ꯑꯣꯏꯕꯥ ꯃꯑꯣꯡ ꯑꯃꯥ ꯂꯩ ꯑꯃꯁꯨꯡ ꯃꯤꯌꯥꯝꯅꯥ ꯁꯦꯗ꯭ꯌꯨꯜ ꯇꯧꯕꯥ ꯑꯁꯤ ꯍꯦꯟꯅꯥ ꯐꯕꯥ ꯑꯣꯄꯁꯟ ꯑꯃꯥ ꯑꯣꯏꯅꯥ ꯂꯧꯏ
6. Challenge your productivity: The capacity of everybody is similar just only habits differentiate in,꯶.ꯑꯗꯣꯃꯒꯤ ꯄ꯭ꯔꯗꯛꯇꯤꯕꯤꯇꯤꯗꯥ ꯁꯤꯡꯅꯕꯥ ꯄꯤꯕꯥ: ꯃꯤꯄꯨꯝ ꯈꯨꯗꯤꯡꯃꯛꯀꯤ ꯀꯦꯄꯥꯁꯤꯇꯤ ꯑꯁꯤ ꯃꯥꯟꯅꯕꯥ ꯑꯣꯏꯔꯤ ꯁꯨꯞꯅꯇꯒꯤ ꯍꯦꯕꯤꯠ ꯈꯛꯇꯅꯥ ꯈꯦꯠꯅꯕꯥ
"results. The people who score 100 out of 100 are also human not robots, the thing is that they follow their",ꯃꯍꯩꯁꯤꯡ.
dreams. The condition turns turtle with your determination when you are planning for your next meeting,ꯃꯪꯂꯥꯅꯁꯤꯡ꯫
as all the tasks are listed in to-do list. You can use priorities while setting up the task execution sequence,ꯊꯕꯛ ꯄꯨꯝꯅꯃꯛ ꯑꯁꯤ ꯇꯨ-ꯗꯨ ꯂꯤꯁ꯭ꯇꯇꯥ ꯂꯤꯁ꯭ꯠ ꯇꯧꯕꯒꯨꯝꯅꯥ꯫
"Productivity is a challenge to face, as the process of productivity puts human being on the heels. It’s a race","ꯄ꯭ꯔꯗꯛꯇꯤꯕꯤꯇꯤ ꯑꯁꯤ ꯊꯦꯡꯅꯕꯗꯥ ꯁꯤꯡꯅꯕꯥ ꯑꯃꯅꯤ, ꯃꯔꯃꯗꯤ ꯄꯣꯠꯊꯣꯛ ꯄꯨꯊꯣꯀꯄꯒꯤ ꯊꯧꯑꯣꯡ ꯑꯁꯤꯅꯥ ꯃꯤꯑꯣꯏꯕꯕꯨ ꯍꯤꯂꯗꯥ ꯊꯝꯂꯤ꯫"
"which has to be won by all not by any single. In short, it is a great thing to adopt but also demands the",ꯃꯗꯨ ꯄꯨꯝꯅꯃꯛꯅꯥ ꯃꯥꯏ ꯄꯥꯀꯄꯥ ꯇꯥꯏ ꯅꯠꯇꯕꯥ ꯑꯃꯠꯇꯥ ꯂꯩꯇꯦ꯫
capacity to handle the pressure,ꯄ꯭ꯔꯦꯁꯔ ꯑꯗꯨ ꯍꯦꯟꯗꯜ ꯇꯧꯕꯥ ꯉꯝꯕꯒꯤ ꯀꯦꯄꯥꯁꯤꯇꯤ ꯑꯗꯨ .
7. Have an instinct for achievement: Achievement of a task is different whereas bang a series of success,꯷.ꯑꯦꯆꯤꯕꯃꯦꯟꯇꯀꯤꯗꯃꯛ ꯏꯟꯁꯇꯤꯠꯌꯨꯠ ꯑꯃꯥ ꯂꯩꯕꯥ: ꯊꯕꯛ ꯑꯃꯥ ꯑꯦꯆꯤꯕꯃꯦꯟꯇ ꯇꯧꯕꯥ ꯑꯁꯤ ꯇꯣꯉꯥꯜꯂꯤ ꯑꯗꯨꯒꯥ ꯕꯦꯡ ꯑꯦ ꯁꯤꯔꯤꯖ ꯃꯥꯏꯄꯥꯀꯄꯒꯤ ꯊꯧꯔꯝ ꯑꯃꯥ
"is totally different task. A series of success falls in our kitty only then, when we make our efforts in a",ꯑꯁꯤ ꯃꯄꯨꯡ ꯐꯥꯅꯥ ꯇꯣꯉꯥꯅꯕꯥ ꯊꯕꯛ ꯑꯃꯅꯤ꯫
predefined way. Discipline and self-improvement are mandatory. The communication tools available in,ꯄ꯭ꯔꯤꯗꯤꯐꯥꯏꯗ ꯑꯣꯏꯕꯥ ꯃꯑꯣꯡꯗꯥ꯫
"variety support, synchronous as fixing meeting time in form of web conferencing and asynchronous with","ꯚꯦꯔꯤꯑꯦꯇꯤ ꯁꯄꯣꯔꯠ, ꯋꯦꯕ ꯀꯅꯐꯔꯦꯟꯁꯤꯡꯒꯤ ꯃꯑꯣꯡꯗꯥ ꯃꯤꯐꯃꯒꯤ ꯃꯇꯝ ꯐꯤꯛꯁ ꯇꯧꯕꯥ ꯑꯃꯁꯨꯡ ꯑꯦꯁꯤꯅꯛꯔꯣꯟ ꯑꯣꯏꯅꯥ ꯁꯤꯅꯛꯔꯣꯟ ꯑꯣꯏꯅꯥ"
no fixed time to contribute as discussion board in form of interaction. The achievement comes with,ꯏꯟꯇꯔꯦꯛꯁꯅꯒꯤ ꯃꯑꯣꯡꯗꯥ ꯗꯤꯁ꯭ꯀꯁꯟ ꯕꯣꯔꯗ ꯑꯣꯏꯅꯥ ꯀꯟꯠꯔꯤꯕ꯭ꯌꯨꯠ ꯇꯧꯅꯕꯥ ꯐꯤꯛꯁ ꯇꯧꯕꯥ ꯃꯇꯝ ꯂꯩꯇꯦ꯫
hardworking and dedicated behavior. Everyone has to adopt time management if they desire to have the,ꯊꯕꯛ ꯀꯟꯅꯥ ꯁꯨꯕꯥ ꯑꯃꯁꯨꯡ ꯀꯠꯊꯣꯀꯄꯥ ꯂꯃꯆꯠ-ꯁꯥꯖꯠ꯫
taste of success,ꯃꯥꯌ ꯄꯥꯀꯄꯒꯤ ꯃꯁꯛ ꯊꯣꯀꯄꯥ .
8. Time to relax and do recreational activities: Recreation in this era of rush is a blessing and,8. ꯅꯨꯡꯉꯥꯏꯅꯥ ꯂꯩꯅꯕꯥ ꯑꯃꯁꯨꯡ ꯅꯨꯡꯉꯥꯏꯅꯕꯥ ꯊꯕꯛ ꯊꯧꯔꯃꯁꯤꯡ ꯇꯧꯕꯒꯤ ꯃꯇꯝ: ꯔꯁ꯭ꯃꯤꯒꯤ ꯃꯇꯝ ꯑꯁꯤꯗꯥ ꯅꯨꯡꯉꯥꯏꯕꯥ ꯐꯣꯡꯗꯣꯀꯄꯥ ꯑꯁꯤ ꯊꯧꯖꯥꯜ ꯑꯃꯅꯤ ꯑꯃꯁꯨꯡ
everybody wants it but only few can grab it. Never miss any event. No need to worry about missing events,ꯃꯤꯄꯨꯝ ꯈꯨꯗꯤꯡꯃꯛꯅꯥ ꯄꯥꯝꯃꯤ ꯑꯗꯨꯕꯨ ꯃꯤꯑꯣꯏ ꯈꯔꯈꯛꯇꯅꯥ ꯃꯁꯤꯕꯨ ꯂꯧꯁꯤꯅꯕꯥ ꯉꯃꯒꯅꯤ꯫
as workday is scheduled with reminders and alerts for urgent events. The blessed ones are those who do,ꯊꯕꯛ ꯅꯨꯃꯤꯠ ꯑꯁꯤ ꯈꯨꯗꯛꯀꯤ ꯑꯣꯏꯕꯥ ꯊꯧꯗꯣꯀꯁꯤꯡꯒꯤꯗꯃꯛ ꯔꯤꯃꯥꯏꯟꯗꯔꯁꯤꯡ ꯑꯃꯁꯨꯡ ꯑꯦꯂꯔꯇꯁꯤꯡꯒꯥ ꯂꯣꯌꯅꯅꯥ ꯁꯦꯝ ꯁꯥꯗꯨꯅꯥ ꯂꯩ꯫
work on time and adopt a time table in their life to do day-to-day chaos. The relaxed life gives motivation,ꯃꯇꯝ ꯆꯥꯅꯥ ꯊꯕꯛ ꯇꯧꯕꯤꯌꯨ ꯑꯃꯁꯨꯡ ꯅꯨꯃꯤꯠ ꯈꯨꯗꯤꯡꯒꯤ ꯑꯔꯥꯅꯕꯥ ꯇꯧꯅꯕꯥ ꯃꯈꯣꯌꯒꯤ ꯄꯨꯟꯁꯤꯗꯥ ꯃꯇꯃꯒꯤ ꯇꯦꯕꯜ ꯑꯃꯥ ꯑꯦꯗꯣꯞꯇ ꯇꯧꯕꯤꯌꯨ꯫
to human being and put them on the way of success. The recreational activities also give family life a,ꯃꯤꯑꯣꯏꯕꯗꯥ ꯑꯃꯁꯨꯡ ꯃꯈꯣꯌꯕꯨ ꯃꯥꯌ ꯄꯥꯀꯄꯒꯤ ꯂꯝꯕꯤꯗꯥ ꯊꯝꯃꯨ꯫
boost. People feel more connected to their families. The one and the only thing to keep in mind is relations,ꯈꯨꯃꯥꯡ ꯆꯥꯎꯁꯤꯜꯍꯟꯕ.
need time and love to boom,ꯃꯇꯝ ꯑꯃꯁꯨꯡ ꯅꯨꯡꯁꯤꯕꯥ ꯃꯊꯧ ꯇꯥꯏ ꯕꯨꯝ
9. Financial Soundness: The success brings financial benefits with itself. A human is always financially,꯹.ꯐꯥꯏꯅꯥꯟꯁꯤꯑꯦꯜ ꯁꯣꯎꯟꯗꯅꯦꯁ: ꯃꯥꯌ ꯄꯥꯀꯄꯥ ꯑꯁꯤꯅꯥ ꯃꯁꯥꯒꯥ ꯂꯣꯌꯅꯅꯥ ꯁꯦꯜ-ꯊꯨꯃꯒꯤ ꯀꯥꯟꯅꯕꯥ ꯄꯤꯔꯤ꯫
sound if he/ she have planned his/ her life properly and they maintain a time table of their personal and,ꯀꯔꯤꯒꯨꯝꯕꯥ ꯃꯍꯥꯛꯅꯥ ꯃꯍꯥꯛꯀꯤ ꯄꯨꯟꯁꯤꯕꯨ ꯃꯑꯣꯡ ꯆꯨꯝꯅꯥ ꯊꯧꯔꯥꯡ ꯇꯧꯔꯕꯗꯤ ꯑꯃꯁꯨꯡ ꯃꯈꯣꯌꯅꯥ ꯃꯈꯣꯌꯒꯤ ꯄꯔꯁꯣꯅꯦꯜ ꯑꯃꯁꯨꯡ
professional life. The lifelong learning experience promotes the empowerment of individuals with the,ꯄ꯭ꯔꯣꯐꯦꯁ꯭ꯅꯦꯜ ꯑꯣꯏꯕꯥ ꯄꯨꯟꯁꯤ꯫
knowledge. They can research and find information. The interpretation in it with sharing provides students,ꯂꯧꯁꯤꯡ.
opportunities to get network connectivity,ꯅꯦꯇꯋꯥꯔꯛ ꯀꯅꯦꯛꯇꯤꯕꯤꯇꯤ ꯐꯪꯅꯕꯒꯤ ꯈꯨꯗꯣꯡꯆꯥꯕꯁꯤꯡ
10. Become Healthy: The health is a blessing for human and it can be achieved by proper maintenance,10. ꯍꯀꯆꯥꯡ ꯐꯅꯥ ꯂꯩꯌꯨ: ꯍꯀꯁꯦꯜ ꯑꯁꯤ ꯃꯤꯑꯣꯏꯕꯒꯤꯗꯃꯛ ꯊꯧꯖꯥꯜ ꯑꯃꯅꯤ ꯑꯃꯁꯨꯡ ꯃꯁꯤ ꯃꯑꯣꯡ ꯆꯨꯝꯅꯥ ꯃꯦꯟꯇꯦꯅꯦꯟꯁ ꯇꯧꯗꯨꯅꯥ ꯐꯪꯕꯥ ꯉꯃꯒꯅꯤ
Time management is also helpful in making human life healthy; as if a person will adopt scheduling in his,ꯃꯇꯝ ꯂꯦꯞꯄꯥ ꯑꯁꯤꯅꯥ ꯃꯤꯑꯣꯏꯕꯒꯤ ꯄꯨꯟꯁꯤꯕꯨ ꯍꯀꯆꯥꯡ ꯐꯅꯥ ꯂꯩꯍꯅꯕꯗꯁꯨ ꯃꯇꯦꯡ ꯄꯥꯡꯏ;
"life then he will definitely save sometime for doing exercise and other health related works. So, he/ she",ꯃꯗꯨꯒꯤ ꯃꯇꯨꯡꯗꯥ ꯃꯍꯥꯛꯅꯥ ꯑꯦꯛꯁꯔꯁꯥꯏꯖ ꯑꯃꯁꯨꯡ ꯑꯇꯣꯞꯄꯥ ꯍꯀꯁꯦꯂꯒꯥ ꯃꯔꯤ ꯂꯩꯅꯕꯥ ꯊꯕꯀꯁꯤꯡ ꯇꯧꯕꯒꯤꯗꯃꯛ ꯃꯇꯝ ꯈꯔꯒꯤ ꯑꯣꯏꯅꯥ ꯁꯣꯏꯗꯅꯥ ꯀꯅꯕꯥ ꯉꯃꯒꯅꯤ꯫
"will become healthy definitely. Once you have decided to plan your time, you have to discipline yourself",ꯍꯀꯆꯥꯡ ꯐꯅꯥ ꯂꯩꯔꯒꯅꯤ꯫
and work on self-improvement with health as a key factor,ꯑꯃꯁꯨꯡ ꯃꯔꯨꯑꯣꯏꯕꯥ ꯐꯦꯛꯇꯔ ꯑꯃꯥ ꯑꯣꯏꯅꯥ ꯍꯀꯁꯦꯂꯒꯥ ꯂꯣꯌꯅꯅꯥ ꯁꯦꯜꯐ-ꯏꯝꯞꯔꯨꯕꯃꯦꯟꯇꯀꯤ ꯊꯕꯛ ꯇꯧꯕꯥ
4.7.3,꯴.꯷.꯳ ꯑꯣꯏꯈꯤ꯫
Disadvantages of Time Management:,ꯃꯇꯝ ꯂꯦꯞꯄꯒꯤ ꯈꯨꯗꯣꯡꯆꯥꯗꯕꯁꯤꯡ:
It can be pretty hard for someone who doesn’t embrace punctuality and value time. There are very few,ꯃꯇꯝ ꯆꯨꯞꯄꯗꯥ ꯌꯥꯑꯣꯕꯥ ꯑꯃꯁꯨꯡ ꯃꯇꯝ ꯂꯦꯞꯄꯥ ꯉꯃꯗꯕꯥ ꯃꯤꯑꯣꯏ ꯑꯃꯒꯤꯗꯃꯛ ꯌꯥꯝꯅꯥ ꯂꯨꯕꯥ ꯑꯣꯏꯕꯥ ꯌꯥꯏ꯫
downsides to time management. The main disadvantage is of more consumption of time in making,ꯃꯇꯝ ꯂꯦꯞꯄꯒꯤ ꯃꯇꯥꯡꯗꯥ ꯗꯣꯎꯅꯁꯥꯏꯗꯁꯤꯡ꯫
up plans which easily turns out to be against. It can make human life mechanical too,ꯐꯖꯅꯥ ꯃꯥꯌꯣꯛꯅꯔꯤꯕꯥ ꯑꯁꯤ ꯐꯖꯅꯥ ꯊꯣꯛꯂꯀꯄꯥ ꯄ꯭ꯂꯥꯅꯁꯤꯡ꯫
1. Non-clear Objectives: The productive behavior is definitely one of the main goals in time,1. ꯅꯟ-ꯀ꯭ꯂꯤꯌꯔ ꯑꯣꯕꯖꯦꯛꯇꯤꯕꯁꯤꯡ: ꯄꯣꯠꯊꯣꯛ ꯂꯩꯕꯥ ꯂꯃꯆꯠ-ꯁꯥꯖꯠ ꯑꯁꯤ ꯁꯣꯏꯗꯅꯥ ꯃꯇꯃꯒꯤ ꯃꯔꯨꯑꯣꯏꯕꯥ ꯄꯥꯟꯗꯃꯁꯤꯡꯒꯤ ꯃꯅꯨꯡꯗꯥ ꯑꯃꯅꯤ
"management. Sometimes, it leads to non-clear objectives which usually struck people for worse. An",ꯁꯦꯟꯅꯔꯤꯕ ꯃꯤꯑꯣꯏ.
"unaware person doesn’t know what to do? If you are not being able to do better management of workload,",ꯑꯁꯣꯅꯕꯥ ꯃꯤꯑꯣꯏ ꯑꯗꯨꯅꯥ ꯀꯔꯤ ꯇꯧꯒꯗꯒꯦ ꯍꯥꯌꯕꯥ ꯈꯉꯗꯦ?
you will get more struck in non-done tasks in no time,ꯑꯗꯣꯝꯅꯥ ꯃꯇꯝ ꯑꯃꯠꯇꯗꯥ ꯅꯟ-ꯗꯣꯟ ꯇꯥꯁ꯭ꯀꯁꯤꯡꯗꯥ ꯍꯦꯟꯅꯥ ꯁ꯭ꯠꯔꯛ ꯐꯪꯒꯅꯤ
2. Mismanagement: Organized results to less rework and mistakes but excess organizing craze leaves a,2. ꯃꯤꯁꯃꯦꯅꯦꯖꯃꯦꯟꯇ: ꯑꯣꯔꯒꯥꯅꯥꯏꯖ ꯇꯧꯔꯕꯥ ꯔꯤꯖꯜꯇꯁꯤꯡꯅꯥ ꯑꯃꯨꯛ ꯍꯟꯅꯥ ꯊꯕꯛ ꯇꯧꯕꯥ ꯑꯃꯁꯨꯡ ꯑꯁꯣꯏ-ꯑꯉꯥꯝ ꯌꯥꯑꯣꯗꯕꯥ ꯑꯗꯨꯕꯨ ꯑꯍꯦꯅꯕꯥ ꯑꯣꯔꯒꯥꯅꯥꯏꯖ ꯇꯧꯕꯒꯤ ꯀ꯭ꯔꯦꯖꯅꯥ ꯑꯦ.
"person in blunder. The items, details, and instructions are if forgotten then leads to extra work and a blame",ꯕ꯭ꯂꯨꯟꯗꯔꯗꯥ ꯂꯩꯕꯥ ꯃꯤꯑꯣꯏ꯫
of mismanagement. A person has to do a task more times if he forgets something. It will lead to fatigue,ꯃꯤꯁꯃꯦꯅꯦꯖꯃꯦꯟꯇꯀꯤ ꯃꯇꯥꯡꯗꯥ ꯋꯥꯐꯝ ꯊꯃꯈꯤ꯫
and it happens because of predictive behavior,ꯑꯃꯁꯨꯡ ꯃꯁꯤ ꯄ꯭ꯔꯤꯗꯤꯛꯇꯤꯚ ꯕꯤꯍꯦꯕꯤꯌꯔꯅꯥ ꯃꯔꯝ ꯑꯣꯏꯗꯨꯅꯥ ꯊꯣꯀꯏ .
"3. Can’t say “no”: You might have forgotten an appointment, or missed deadline and all happened","3. “ꯅꯠꯇꯦ” ꯍꯥꯌꯕꯥ ꯉꯃꯗꯦ: ꯅꯍꯥꯛꯅꯥ ꯑꯦꯄꯣꯏꯟꯇꯃꯦꯟꯇ ꯑꯃꯥ ꯀꯥꯑꯣꯊꯣꯀꯄꯥ ꯌꯥꯏ, ꯅꯠꯔꯒꯥ ꯗꯦꯗꯂꯥꯏꯟ ꯊꯥꯗꯣꯀꯄꯥ ꯌꯥꯏ ꯑꯃꯁꯨꯡ ꯄꯨꯝꯅꯃꯛ ꯊꯣꯀꯈꯤ"
because of working on others task as saying ‘no’ will be tough for you. Such crazy situations incline life,ꯃꯔꯃꯗꯤ ꯑꯇꯣꯞꯄꯁꯤꯡꯗꯥ ꯊꯕꯛ ꯇꯧꯕꯅꯥ ꯃꯔꯝ ꯑꯣꯏꯗꯨꯅꯥ ‘ꯅꯠꯇꯦ’ ꯍꯥꯌꯕꯁꯤ ꯅꯍꯥꯛꯀꯤꯗꯃꯛꯇꯥ ꯑꯔꯨꯕꯥ ꯑꯣꯏꯒꯅꯤ꯫
friction. You can avoid creating such problems by planning and preparing exactly. Nobody can create,ꯐ꯭ꯔꯤꯛꯁꯟ ꯇꯧꯕꯥ꯫
more time but it can be used in better way by managing time undoubtedly. It’s always better to keep back,ꯃꯇꯝ ꯍꯦꯟꯅꯥ ꯂꯩ ꯑꯗꯨꯕꯨ ꯃꯁꯤ ꯃꯇꯝ ꯍꯦꯟꯅꯥ ꯃꯦꯅꯦꯖ ꯇꯧꯗꯨꯅꯥ ꯍꯦꯟꯅꯥ ꯐꯕꯥ ꯃꯑꯣꯡꯗꯥ ꯁꯤꯖꯤꯟꯅꯕꯥ ꯌꯥꯏ꯫
because people simply can’t say no to anyone,ꯃꯔꯃꯗꯤ ꯃꯤꯌꯥꯝꯅꯥ ꯁꯨꯞꯅꯇꯒꯤ ꯀꯅꯥꯒꯨꯝꯕꯥ ꯑꯃꯠꯇꯗꯥ ꯍꯥꯌꯕꯥ ꯉꯃꯗꯦ .
