en,mni-Mtei
a primary social role for the adolescent. Adolescents be-,ꯏꯅꯈꯠꯂꯛꯂꯤꯕꯁꯤꯡꯒꯤꯗꯃꯛꯇꯥ ꯄ꯭ꯔꯥꯏꯃꯥꯔꯤ ꯁꯣꯁꯤꯑꯦꯜ ꯔꯣꯜ ꯑꯃꯥ꯫
"gin to have short, intense “love” relationships, while","ꯖꯤꯟ ꯑꯁꯤ ꯁꯣꯔꯠ, ꯏꯟꯇꯦꯟꯁꯟ “ꯅꯨꯡꯁꯤꯕꯥ” ꯃꯔꯤ ꯂꯩꯅꯕꯥ, ꯂꯩꯔꯤꯉꯩꯗꯥ꯫"
looking for the “ideal” partner. It is not uncommon,“ꯑꯥꯏꯗꯤꯌꯥꯜ” ꯄꯥꯔꯇꯅꯔ ꯑꯗꯨ ꯊꯤꯕꯥ꯫
for adolescents to have crushes on adults during this,ꯏꯅꯈꯠꯂꯛꯂꯤꯕꯁꯤꯡꯅꯥ ꯃꯁꯤꯒꯤ ꯃꯅꯨꯡꯗꯥ ꯑꯍꯂꯁꯤꯡꯗꯥ ꯀ꯭ꯔꯥꯁꯁꯤꯡ ꯂꯩꯅꯕꯒꯤꯗꯃꯛ .
stage. Family conﬂict is likely to be at its peak. As adoles-,ꯐꯝꯄꯥꯛ.
"cents’ independent functioning increases, adolescents","ꯁꯦꯟꯇꯔꯁꯤꯡꯒꯤ ꯃꯅꯤꯡꯇꯝꯕꯥ ꯊꯕꯛ ꯊꯧꯔꯃꯁꯤꯡ ꯍꯦꯅꯒꯠꯂꯀꯄꯥ, ꯏꯅꯈꯠꯂꯛꯂꯤꯕꯁꯤꯡ"
"may examine their personal experiences, relate their expe-","ꯃꯈꯣꯌꯒꯤ ꯄꯔꯁꯣꯅꯦꯜ ꯑꯦꯛꯁꯄꯔꯤꯑꯦꯟꯁꯁꯤꯡ ꯑꯗꯨ ꯌꯦꯡꯁꯤꯅꯕꯥ ꯌꯥꯏ, ꯃꯈꯣꯌꯒꯤ ꯑꯦꯛꯁꯄꯦ-"
"rience to others, and develop a concern for others","ꯑꯇꯣꯞꯄꯁꯤꯡꯗꯥ ꯔꯤꯌꯦꯟꯁ ꯇꯧꯕꯥ, ꯑꯃꯁꯨꯡ ꯑꯇꯣꯞꯄꯁꯤꯡꯒꯤꯗꯃꯛ ꯋꯥꯈꯜ ꯋꯥꯕꯥ ꯑꯃꯥ ꯁꯦꯃꯒꯠꯄꯥ"
"By late adolescence (ages 18-21 years), adolescents","ꯂꯦꯠ ꯏꯅꯈꯠꯂꯀꯄꯥ ꯃꯇꯃꯗꯥ (ꯆꯍꯤ 18-21), ꯏꯅꯈꯠꯂꯛꯂꯤꯕꯁꯤꯡ"
have developed a separate identity from parents. Simulta-,ꯃꯃꯥ-ꯃꯄꯥꯁꯤꯡꯗꯒꯤ ꯇꯣꯉꯥꯅꯕꯥ ꯃꯁꯛ ꯑꯃꯥ ꯁꯦꯃꯒꯠꯂꯦ꯫
"neously, adolescents may move away from their peer","ꯅꯧꯅꯥ ꯄꯣꯀꯄꯥ, ꯏꯅꯈꯠꯂꯛꯂꯤꯕꯁꯤꯡꯅꯥ ꯃꯈꯣꯌꯒꯤ ꯃꯔꯨꯄꯁꯤꯡꯗꯒꯤ ꯂꯥꯞꯅꯥ ꯂꯩꯕꯥ ꯌꯥꯏ"
group and strive to achieve adult status. Adolescent con-,ꯒ꯭ꯔꯨꯞ ꯑꯃꯁꯨꯡ ꯑꯦꯗꯜꯇ ꯁ꯭ꯇꯦꯇꯁ ꯐꯪꯅꯕꯥ ꯍꯣꯠꯅꯕꯥ꯫
ﬂict with parents may very well decline during this stage,ꯃꯃꯥ-ꯃꯄꯥꯁꯤꯡꯒꯥ ꯂꯣꯌꯅꯅꯥ ꯐ꯭ꯂꯦꯛꯇꯔ ꯑꯁꯤ ꯁ꯭ꯇꯦꯖ ꯑꯁꯤꯒꯤ ꯃꯅꯨꯡꯗꯥ ꯌꯥꯝꯅꯥ ꯐꯖꯅꯥ ꯍꯟꯊꯔꯀꯄꯥ ꯌꯥꯏ
As adolescents begin to enter more permanent relation-,ꯏꯅꯈꯠꯂꯛꯂꯤꯕꯁꯤꯡꯅꯥ ꯍꯦꯟꯅꯥ ꯄꯔꯃꯦꯅꯦꯟꯇ ꯑꯣꯏꯕꯥ ꯃꯔꯤ ꯑꯃꯥ ꯆꯪꯂꯀꯄꯥ ꯍꯧꯔꯀꯄꯒꯥ ꯂꯣꯌꯅꯅꯥ-
"ships, they establish responsible behavior and their per-","ꯖꯍꯥꯖꯁꯤꯡ, ꯃꯈꯣꯌꯅꯥ ꯗꯥꯌꯠꯕ ꯂꯩꯕꯥ ꯂꯃꯆꯠ-ꯁꯥꯖꯠ ꯑꯃꯁꯨꯡ ꯃꯈꯣꯌꯒꯤ ꯄꯔ-"
sonal value system matures,ꯁꯣꯅꯥꯜ ꯚꯦꯜꯌꯨ ꯁꯤꯁ꯭ꯇꯦꯝ ꯑꯁꯤ ꯄꯤꯀꯄꯥ .
Pediatric health care professionals should be aware,ꯄꯦꯗꯤꯑꯦꯠꯔꯤꯛ ꯍꯦꯂꯊ ꯀꯦꯌꯔ ꯄ꯭ꯔꯣꯐꯦꯁꯅꯦꯂꯁꯤꯡꯅꯥ ꯈꯪꯖꯤꯅꯒꯗꯕꯅꯤ
that most adolescents seek independence in a gradual,ꯑꯌꯥꯝꯕꯥ ꯏꯅꯈꯠꯂꯛꯂꯤꯕꯁꯤꯡꯅꯥ ꯇꯞꯅꯥ ꯇꯞꯅꯥ ꯅꯤꯡꯇꯝꯕꯥ ꯐꯪꯅꯕꯥ ꯍꯣꯠꯅꯔꯤ ꯍꯥꯌꯕꯥ
"fashion, and a sudden shift from parents can be a warning","ꯐꯦꯁꯟ, ꯑꯃꯁꯨꯡ ꯃꯃꯥ-ꯃꯄꯥꯁꯤꯡꯗꯒꯤ ꯈꯉꯍꯧꯗꯅꯥ ꯂꯥꯀꯄꯥ ꯑꯁꯤꯅꯥ ꯆꯦꯀꯁꯤꯅꯋꯥ ꯑꯃꯥ ꯑꯣꯏꯕꯥ ꯌꯥꯏ ."
sign that the adolescent needs help in transitioning. In,ꯏꯅꯈꯠꯂꯛꯂꯤꯕꯥ ꯃꯤꯑꯣꯏ ꯑꯗꯨꯅꯥ ꯇ꯭ꯔꯥꯟꯁꯤꯁꯟ ꯇꯧꯕꯗꯥ ꯃꯇꯦꯡ ꯃꯊꯧ ꯇꯥꯏ ꯍꯥꯌꯅꯥ ꯁꯥꯏꯟ ꯇꯧ꯫
"fact, some studies have demonstrated that 11-year-old","ꯇꯁꯦꯡꯕꯗꯤ, ꯁ꯭ꯇꯗꯤ ꯈꯔꯅꯥ ꯆꯍꯤ ꯱꯱ ꯁꯨꯔꯕꯥ ꯃꯤꯑꯣꯏ ꯑꯃꯥ ꯑꯣꯏꯅꯥ ꯌꯨ.ꯑꯦꯁ."
girls spend 68% of their time with family and 22% with,ꯅꯨꯄꯤꯃꯆꯥꯁꯤꯡꯅꯥ ꯃꯈꯣꯌꯒꯤ ꯃꯇꯃꯒꯤ ꯶꯸%ꯗꯤ ꯏꯃꯨꯡ ꯃꯅꯨꯡꯒꯥ ꯂꯣꯌꯅꯅꯥ ꯆꯠꯂꯤ ꯑꯃꯁꯨꯡ ꯲꯲%ꯅꯥ ꯁꯤꯖꯤꯟꯅꯩ꯫
"friends compared with 46% and 44%, respectively, in",ꯃꯔꯨꯄꯁꯤꯡꯅꯥ ꯃꯊꯪꯁꯤꯠꯅꯥ ꯴꯶% ꯑꯃꯁꯨꯡ ꯴꯴%ꯒꯥ ꯆꯥꯡꯗꯝꯅꯕꯗꯥ ꯌꯨ.ꯑꯦꯁ.
18-year-old girls. Anticipatory guidance for parents,ꯆꯍꯤ ꯱꯸ ꯁꯨꯔꯕꯤ ꯅꯨꯄꯤꯃꯆꯥꯁꯤꯡ꯫
about the emerging needs of independence will help,ꯅꯤꯡꯇꯝꯕꯒꯤ ꯊꯣꯔꯛꯂꯤꯕꯥ ꯗꯔꯀꯥꯔ ꯑꯣꯏꯕꯁꯤꯡꯒꯤ ꯃꯇꯥꯡꯗꯥ ꯃꯇꯦꯡ ꯄꯥꯡꯒꯅꯤ ꯫
to inform parents about this important developmental,ꯃꯔꯨꯑꯣꯏꯕꯥ ꯆꯥꯎꯈꯠ-ꯊꯧꯔꯥꯡ ꯑꯁꯤꯒꯤ ꯃꯇꯥꯡꯗꯥ ꯃꯃꯥ-ꯃꯄꯥꯁꯤꯡꯗꯥ ꯈꯉꯍꯅꯕꯥ
"stage, provide guidance in promoting independence","ꯁ꯭ꯇꯦꯖ, ꯅꯤꯡꯇꯝꯕꯥ ꯌꯣꯀꯈꯠꯄꯗꯥ ꯂꯃꯖꯤꯡ-ꯂꯃꯇꯥꯛ ꯄꯤꯕꯥ"
"in a safe setting, and alleviate some of the problems ex-","ꯁꯦꯐ ꯑꯣꯏꯕꯥ ꯁꯦꯇꯤꯡ ꯑꯃꯗꯥ, ꯑꯃꯁꯨꯡ ꯄ꯭ꯔꯣꯕ꯭ꯂꯦꯝ ꯈꯔꯗꯤ ꯀꯣꯀꯍꯅꯕꯥ ꯑꯦꯛꯁ-"
perienced in the family. Development of clinic policies,ꯏꯃꯨꯡ ꯑꯗꯨꯗꯥ ꯄꯦꯔꯤꯑꯦꯟꯁ ꯇꯧꯈꯤ꯫
"that promote an adolescent’s need for privacy, conﬁ-","ꯃꯗꯨꯅꯥ ꯏꯅꯈꯠꯂꯛꯂꯤꯕꯥ ꯃꯤꯑꯣꯏ ꯑꯃꯒꯤ ꯄ꯭ꯔꯥꯏꯚꯦꯁꯤꯒꯤ ꯃꯊꯧ ꯇꯥꯕꯥ ꯑꯗꯨ ꯄ꯭ꯔꯃꯣꯠ ꯇꯧꯔꯤ, ꯀꯟꯐꯤ-"
"dentiality, and involvement in decision-making can","ꯗꯦꯟꯇꯤꯌꯂꯤꯇꯤ, ꯑꯃꯁꯨꯡ ꯋꯥꯔꯦꯞ ꯂꯧꯕꯗꯥ ꯁꯔꯨꯛ ꯌꯥꯕꯥ ꯑꯁꯤ ."
aid in this transition,ꯇ꯭ꯔꯥꯟꯁꯤꯁꯟ ꯑꯁꯤꯗꯥ ꯃꯇꯦꯡ ꯄꯥꯡꯕꯥ
The second task of adolescence is for youth to develop,ꯏꯅꯈꯠꯂꯀꯄꯒꯤ ꯑꯅꯤꯁꯨꯕꯥ ꯊꯕꯛ ꯑꯁꯤ ꯅꯍꯥꯁꯤꯡꯅꯥ ꯆꯥꯎꯈꯠꯍꯅꯕꯅꯤ .
a sense of identity. Identity relates to one’s sense of self. It,ꯑꯥꯏꯗꯦꯟꯇꯤꯇꯤꯒꯤ ꯋꯥꯈꯜꯂꯣꯟ ꯑꯃꯥ꯫
can be divided into 2 areas: self-concept and self-esteem,ꯃꯐꯝ ꯲ꯗꯥ ꯈꯥꯌꯗꯣꯀꯄꯥ ꯌꯥꯏ: ꯁꯦꯜꯐ-ꯀꯟꯁꯦꯞꯇ ꯑꯃꯁꯨꯡ ꯁꯦꯜꯐ-ꯏꯁ꯭ꯇꯤꯝ
Self-concept refers to an adolescent’s perception of self—,ꯁꯦꯜꯐ-ꯀꯟꯁꯦꯞꯇ ꯍꯥꯌꯕꯁꯤ ꯏꯅꯈꯠꯂꯛꯂꯤꯕꯥ ꯃꯤꯑꯣꯏ ꯑꯃꯒꯤ ꯃꯁꯥꯒꯤ ꯑꯣꯏꯕꯥ ꯋꯥꯈꯜꯂꯣꯟ ꯑꯗꯨꯕꯨ ꯈꯪꯅꯩ—
"one’s talents, goals, and life experiences. It can also relate","ꯀꯅꯥꯒꯨꯝꯕꯥ ꯑꯃꯒꯤ ꯇꯦꯂꯦꯟꯇ, ꯄꯥꯟꯗꯃꯁꯤꯡ ꯑꯃꯁꯨꯡ ꯄꯨꯟꯁꯤꯒꯤ ꯑꯦꯛꯁꯄꯔꯤꯌꯦꯟꯁꯁꯤꯡ꯫"
"to identity as part of ethnic, religious, and sexual identity","ꯏꯊꯅꯤꯛ, ꯙꯔꯃꯒꯤ ꯑꯃꯁꯨꯡ ꯁꯦꯛꯁꯨꯑꯦꯜ ꯑꯥꯏꯗꯦꯟꯇꯤꯇꯤꯒꯤ ꯁꯔꯨꯛ ꯑꯃꯥ ꯑꯣꯏꯅꯥ ꯑꯥꯏꯗꯦꯟꯇꯤꯇꯤ ꯄꯤꯕꯥ"
groups. Self-esteem relates to how one evaluates self-,ꯀꯥꯡꯂꯨꯄꯁꯤꯡ꯫
worth,ꯃꯃꯜ ꯂꯩꯕ
adolescent medicine,ꯑꯦꯗꯣꯂꯁꯦꯟꯇ ꯃꯦꯗꯤꯁꯤꯟ .
psychosocial development,ꯁꯥꯏꯀꯣꯁꯣꯁꯤꯑꯦꯜ ꯗꯤꯚꯦꯂꯄꯃꯦꯟꯇ
Pediatrics in Review Vol.34 No.8 August 2013 355,ꯄꯦꯗꯤꯑꯦꯠꯔꯤꯀꯁ ꯏꯟ ꯔꯤꯚꯤꯌꯨ ꯚꯣꯜꯌꯨꯝ ꯳꯴ ꯅꯪ.꯸ ꯑꯣꯒꯁ꯭ꯠ ꯲꯰꯱꯳ ꯳꯵꯵
"In 1950, Erikson described the psychosocial crisis that",꯱꯹꯵꯰ꯗꯥ ꯑꯦꯔꯤꯛꯁꯟꯅꯥ ꯁꯥꯏꯀꯣꯁꯣꯁꯤꯑꯦꯜ ꯀ꯭ꯔꯥꯏꯁꯤꯁ ꯑꯗꯨ ꯐꯣꯡꯗꯣꯀꯈꯤ ꯃꯗꯨꯗꯤ .
was occurring during this stage as “identity vs. role con-,ꯁ꯭ꯇꯦꯖ ꯑꯁꯤꯒꯤ ꯃꯅꯨꯡꯗꯥ “ꯑꯥꯏꯗꯦꯟꯇꯤꯇꯤ ꯕꯅꯥꯝ ꯔꯣꯜ ꯀꯟ-
fusion” (13-19 years). As adolescents transition into,ꯐ꯭ꯌꯨꯖꯟ” (ꯆꯍꯤ 13-19)꯫ ꯏꯅꯈꯠꯂꯛꯂꯤꯕꯁꯤꯡꯅꯥ 2.0ꯗꯥ ꯇ꯭ꯔꯥꯟꯁꯤꯁꯟ ꯇꯧꯔꯀꯄꯒꯥ ꯂꯣꯌꯅꯅꯥ꯫
"adults, they start to think about their roles in adulthood","ꯑꯦꯗꯜꯇꯁꯤꯡ, ꯃꯈꯣꯌꯅꯥ ꯑꯦꯗꯜꯇ ꯑꯣꯏꯕꯥ ꯃꯇꯃꯗꯥ ꯃꯈꯣꯌꯒꯤ ꯊꯧꯗꯥꯡꯁꯤꯡꯒꯤ ꯃꯇꯥꯡꯗꯥ ꯈꯅꯕꯥ ꯍꯧꯔꯦ"
"Initially, it is common for adolescents to experience role","ꯑꯍꯥꯅꯕꯗꯥ, ꯏꯅꯈꯠꯂꯛꯂꯤꯕꯁꯤꯡꯅꯥ ꯊꯧꯗꯥꯡ ꯂꯧꯕꯥ ꯍꯥꯌꯕꯁꯤ ꯌꯥꯝꯅꯥ ꯀꯃꯟ ꯑꯣꯏ꯫"
confusion about their identity and describe mixed ideas,ꯃꯈꯣꯌꯒꯤ ꯑꯥꯏꯗꯦꯟꯇꯤꯇꯤꯒꯤ ꯃꯇꯥꯡꯗꯥ ꯋꯥꯈꯜ ꯋꯥꯕꯥ ꯑꯃꯁꯨꯡ ꯃꯤꯛꯁ ꯇꯧꯔꯕꯥ ꯋꯥꯈꯜꯂꯣꯅꯁꯤꯡ ꯐꯣꯡꯗꯣꯀꯄꯥ
and feelings about the speciﬁc ways in which they feel,ꯑꯃꯁꯨꯡ ꯃꯈꯣꯌꯅꯥ ꯐꯥꯑꯣꯔꯤꯕꯥ ꯑꯀꯛꯅꯕꯥ ꯃꯑꯣꯡꯁꯤꯡꯒꯤ ꯃꯇꯥꯡꯗꯥ ꯐꯤꯜꯂꯤꯡꯁꯤꯡ .
"they ﬁt into society. As a result, they may experiment with",ꯃꯈꯣꯌꯅꯥ ꯈꯨꯟꯅꯥꯏꯗꯥ ꯐꯤꯠ ꯑꯣꯏꯅꯥ ꯂꯩ꯫
a range of behaviors and activities to sort out this identity,ꯃꯁꯤꯒꯤ ꯑꯥꯏꯗꯦꯟꯇꯤꯇꯤ ꯑꯁꯤ ꯁꯣꯔꯠ ꯇꯧꯅꯕꯥ ꯂꯃꯆꯠ-ꯁꯥꯖꯠ ꯑꯃꯁꯨꯡ ꯊꯕꯛ ꯊꯧꯔꯃꯁꯤꯡꯒꯤ ꯔꯦꯟꯖ ꯑꯃꯥ
Adolescents may experiment with different peer groups,ꯏꯅꯈꯠꯂꯛꯂꯤꯕꯁꯤꯡꯅꯥ ꯇꯣꯉꯥꯟ-ꯇꯣꯉꯥꯅꯕꯥ ꯄꯤꯌꯔ ꯒ꯭ꯔꯨꯄꯁꯤꯡꯗꯥ ꯑꯦꯛꯁꯄꯔꯤꯃꯦꯟꯇ ꯇꯧꯕꯥ ꯌꯥꯏ
or different styles of dress or behavior as a way of search-,ꯅꯠꯔꯒꯥ ꯇꯣꯉꯥꯟ ꯇꯣꯉꯥꯅꯕꯥ ꯃꯑꯣꯡꯒꯤ ꯄꯣꯠꯂꯃꯁꯤꯡ ꯅꯠꯔꯒꯥ ꯂꯃꯆꯠ-ꯁꯥꯖꯠꯀꯤ ꯃꯑꯣꯡ ꯑꯃꯥ ꯑꯣꯏꯅꯥ-
ing for their identity. Some degree of rebellion away from,ꯃꯈꯣꯌꯒꯤ ꯑꯥꯏꯗꯦꯟꯇꯤꯇꯤꯒꯤꯗꯃꯛ ꯏꯅꯒ ꯇꯧꯕꯥ꯫
the family’s image is part of the adolescent’s search for,ꯏꯃꯨꯡꯒꯤ ꯏꯃꯦꯖ ꯑꯁꯤ ꯏꯅꯈꯠꯂꯛꯂꯤꯕꯥ ꯃꯤꯑꯣꯏ ꯑꯗꯨꯅꯥ ꯊꯤꯖꯤꯅꯕꯒꯤ ꯁꯔꯨꯛ ꯑꯃꯅꯤ .
identity,ꯁꯛꯇꯥꯛ
Erikson described that an adolescent’s inability to set-,ꯑꯦꯔꯤꯛꯁꯟꯅꯥ ꯏꯅꯈꯠꯂꯛꯂꯤꯕꯥ ꯃꯤꯑꯣꯏ ꯑꯃꯅꯥ ꯁꯦꯠ ꯇꯧꯕꯥ ꯉꯃꯗꯕꯥ-
tle on an identity or career path can result in identity cri-,ꯑꯥꯏꯗꯦꯟꯇꯤꯇꯤ ꯅꯠꯠꯔꯒꯥ ꯀꯦꯔꯤꯌꯔꯒꯤ ꯄꯥꯊ ꯑꯃꯗꯥ ꯂꯩꯕꯥ TLE ꯑꯁꯤꯅꯥ ꯑꯥꯏꯗꯦꯟꯇꯤꯇꯤ ꯀ꯭ꯔꯤ-
"sis. Although this stage likely lasts for a short period,",ꯁꯤꯁ ꯍꯥꯌꯅꯥ ꯈꯉꯅꯕꯥ꯫
because of the current extension of adolescence and,ꯍꯧꯖꯤꯛ ꯏꯅꯈꯠꯂꯀꯄꯒꯤ ꯆꯥꯡ ꯑꯃꯁꯨꯡ [...]
"young adulthood, with more youth obtaining advanced","ꯅꯍꯥ ꯑꯣꯏꯔꯤꯕꯥ ꯑꯍꯜ ꯑꯣꯏꯔꯀꯄꯒꯤ ꯃꯇꯝ, ꯅꯍꯥꯁꯤꯡꯅꯥ ꯍꯦꯟꯅꯥ ꯑꯍꯣꯡꯕꯥ ꯄꯨꯔꯀꯄꯥ ꯉꯝꯕꯥ"
"degrees or vocational training, it may take more time","ꯗꯤꯒ꯭ꯔꯤꯁꯤꯡ ꯅꯠꯠꯔꯒꯥ ꯚꯣꯀꯦꯁꯅꯦꯜ ꯇ꯭ꯔꯦꯅꯤꯡ, ꯃꯁꯤꯗꯥ ꯃꯇꯝ ꯍꯦꯟꯅꯥ ꯆꯪꯂꯕꯥ ꯌꯥꯏ"
for youth to establish their identity. Adolescents with,ꯅꯍꯥꯁꯤꯡꯅꯥ ꯃꯈꯣꯌꯒꯤ ꯑꯥꯏꯗꯦꯟꯇꯤꯇꯤ ꯂꯤꯡꯈꯠꯅꯕꯥ꯫
a chronic illness may have a harder time developing a pos-,ꯀ꯭ꯔꯣꯅꯤꯛ ꯂꯥꯌꯅꯥ ꯑꯃꯅꯥ ꯄꯣꯁ- ꯑꯃꯥ ꯁꯦꯃꯒꯠꯄꯗꯥ ꯍꯦꯟꯅꯥ ꯑꯔꯨꯕꯥ ꯃꯇꯝ ꯑꯃꯥ ꯂꯩꯕꯥ ꯌꯥꯏ꯫
itive identity or self-image because of the impact of the,ꯑꯥꯏ.ꯇꯤ.ꯑꯥꯏ.ꯚꯤ.ꯒꯤ ꯑꯥꯏꯗꯦꯟꯇꯤꯇꯤ ꯅꯠꯔꯒꯥ ꯁꯦꯜꯐ-ꯏꯃꯦꯖ ꯑꯁꯤꯅꯥ ꯃꯔꯝ ꯑꯣꯏꯗꯨꯅꯥ .
illness on body image and the limited ability to achieve,ꯍꯀꯆꯥꯡꯒꯤ ꯏꯃꯦꯖꯗꯥ ꯑꯅꯥꯕꯥ ꯑꯃꯁꯨꯡ ꯑꯦꯆꯤꯚꯃꯦꯟꯇ ꯇꯧꯕꯥ ꯉꯝꯕꯥ ꯌꯥꯝꯅꯥ ꯅꯦꯝꯕꯥ ꯑꯦꯕꯤꯂꯤꯇꯤ
independence. Pediatric health care professionals can,ꯅꯤꯡꯇꯝꯕꯥ꯫
support adolescent identity development by encouraging,ꯄꯨꯛꯅꯤꯡ ꯊꯧꯒꯠꯇꯨꯅꯥ ꯑꯦꯗꯣꯂꯁꯦꯟꯇ ꯑꯥꯏꯗꯦꯟꯇꯤꯇꯤ ꯗꯤꯚꯦꯂꯄꯃꯦꯟꯇ ꯁꯄꯣꯔꯠ ꯇꯧꯕꯥ
parents to allow adolescents to have the space and time to,ꯃꯃꯥ-ꯃꯄꯥꯁꯤꯡꯅꯥ ꯏꯅꯈꯠꯂꯛꯂꯤꯕꯁꯤꯡꯗꯥ ꯃꯐꯝ ꯑꯃꯁꯨꯡ ꯃꯇꯝ ꯂꯦꯞꯄꯥ ꯌꯥꯍꯟꯅꯕꯥ .
independently make health care decisions and to partic-,ꯃꯁꯥ ꯃꯊꯟꯇꯥ ꯍꯦꯜꯊ ꯀꯦꯌꯔꯒꯤ ꯋꯥꯔꯦꯄꯁꯤꯡ ꯂꯧꯕꯥ ꯑꯃꯁꯨꯡ ꯁꯔꯨꯛ ꯌꯥꯕꯥ-
ipate in and explore a range of activities that can promote,ꯑꯥꯏ.ꯄꯤ.ꯑꯦ.ꯇꯤ.ꯏ.ꯗꯥ ꯑꯃꯁꯨꯡ ꯄ꯭ꯔꯃꯣꯠ ꯇꯧꯕꯥ ꯌꯥꯕꯥ ꯊꯕꯛ ꯊꯧꯔꯝ ꯀꯌꯥ ꯑꯃꯥ ꯊꯤꯖꯤꯜꯂꯨ꯫
this development,ꯃꯁꯤꯒꯤ ꯆꯥꯎꯈꯠꯄꯥ ꯑꯁꯤ [...]
Inadequate development of self-identity can result,ꯃꯁꯥꯒꯤ ꯑꯣꯏꯕꯥ ꯃꯁꯛ-ꯃꯑꯣꯡ ꯃꯇꯤꯛ ꯆꯥꯗꯅꯥ ꯆꯥꯎꯈꯠꯂꯀꯄꯒꯤ ꯃꯍꯩ ꯑꯣꯏꯕꯥ ꯌꯥꯏ
in poor self-esteem in the adolescent. Poor self-image,ꯏꯅꯈꯠꯂꯛꯂꯤꯕꯥ ꯃꯤꯑꯣꯏ ꯑꯗꯨꯗꯥ ꯂꯥꯌꯔꯕꯥ ꯁꯦꯜꯐ-ꯏꯁ꯭ꯇꯤꯃꯗꯥ꯫
and esteem have been associated with poor adjust-,ꯑꯃꯁꯨꯡ ꯏꯁ꯭ꯇꯤꯃꯦꯠ ꯑꯁꯤ ꯑꯦꯗꯖꯁ꯭ꯠ-ꯑꯦꯗꯖꯁ꯭ꯠ-ꯑꯦꯗꯖꯁ꯭ꯠ-ꯑꯦꯗꯖꯁ꯭ꯠ-ꯑꯦꯗꯖꯁ꯭ꯠ-
"ment (depression or suicide), school underachieve-","ment (ꯗꯤꯞꯔꯦꯁꯟ ꯅꯠꯔꯒꯥ ꯁꯨꯏꯁꯥꯏꯗ), ꯁ꯭ꯀꯨꯜ ꯑꯟꯗꯔꯑꯦꯆꯤꯚ-"
"ment, substance use, and other risk-taking behaviors","ꯃꯦꯟꯇ, ꯁꯕ꯭ꯁꯇꯦꯟꯁ ꯁꯤꯖꯤꯟꯅꯕꯥ, ꯑꯃꯁꯨꯡ ꯑꯇꯩ ꯔꯤꯁ꯭ꯛ ꯂꯧꯕꯒꯤ ꯂꯃꯆꯠ-ꯁꯥꯖꯠꯁꯤꯡ"
Educating parents about the importance of praise,ꯃꯃꯥ-ꯃꯄꯥꯁꯤꯡꯗꯥ ꯊꯥꯒꯠꯄꯥ ꯐꯣꯡꯗꯣꯀꯄꯒꯤ ꯃꯔꯨꯑꯣꯏꯕꯒꯤ ꯃꯇꯥꯡꯗꯥ ꯈꯉꯍꯅꯕꯥ
and acceptance during this stage may be helpful to en-,ꯑꯃꯁꯨꯡ ꯑꯦꯛꯁꯦꯞꯇꯦꯟꯁ ꯑꯁꯤꯅꯥ ꯁ꯭ꯇꯦꯖ ꯑꯁꯤꯒꯤ ꯃꯅꯨꯡꯗꯥ ꯑꯦꯟ-
sure that adolescents emerge from it with a secure,ꯁꯣꯌꯗꯅꯥ ꯍꯥꯌꯔꯕꯗꯥ ꯏꯅꯈꯠꯂꯛꯂꯤꯕꯁꯤꯡꯅꯥ ꯃꯗꯨꯗꯒꯤ ꯁꯦꯛꯌꯨꯑꯣꯔ ꯑꯣꯏꯕꯥ ꯃꯤꯑꯣꯏ ꯑꯃꯒꯥ ꯂꯣꯌꯅꯅꯥ ꯊꯣꯔꯀꯏ꯫
identity,ꯁꯛꯇꯥꯛ
The ability for future orientation is the third area,ꯇꯨꯡꯒꯤ ꯑꯣꯔꯤꯑꯦꯟꯇꯦꯁꯅꯒꯤ ꯇꯧꯕꯥ ꯉꯝꯕꯁꯤꯡ ꯑꯁꯤ ꯑꯍꯨꯃꯁꯨꯕꯥ ꯃꯐꯝ ꯑꯣꯏꯔꯤ .
of adolescent psychosocial development. This stage,ꯑꯦꯗꯣꯂꯁꯦꯟꯇ ꯁꯥꯏꯀꯣꯁꯣꯁꯤꯑꯦꯜ ꯗꯤꯚꯦꯂꯄꯃꯦꯟꯇꯒꯤ꯫
usually occurs during late adolescence (ages 18-21,ꯃꯍꯧꯁꯥꯅꯥ ꯂꯦꯃꯍꯧꯔꯤꯕꯥ ꯏꯅꯈꯠꯂꯀꯄꯥ ꯃꯇꯃꯗꯥ (ꯆꯍꯤ 18-21) ꯊꯣꯀꯏ꯫
years). Youth have gained the cognitive maturity that,ꯆꯍꯤꯁꯤꯡ).
is necessary to develop realistic goals pertaining to,ꯑꯁꯤ ꯃꯔꯤ ꯂꯩꯅꯕꯥ ꯔꯤꯑꯦꯂꯤꯁ꯭ꯇꯤꯛ ꯑꯣꯏꯕꯥ ꯄꯥꯟꯗꯃꯁꯤꯡ ꯁꯦꯃꯒꯠꯅꯕꯥ ꯃꯊꯧ ꯇꯥꯏ ꯫
"future vocation or career, have developed a sense of","ꯇꯨꯡꯒꯤ ꯚꯣꯀꯦꯁꯟ ꯅꯠꯔꯒꯥ ꯀꯦꯔꯤꯌꯔ, ꯑꯁꯤꯒꯤ ꯋꯥꯈꯜꯂꯣꯟ ꯑꯃꯥ ꯁꯦꯃꯒꯠꯂꯦ꯫"
"self-identity, and are most likely reﬁning their moral,","ꯁꯦꯜꯐ-ꯑꯥꯏꯗꯦꯟꯇꯤꯇꯤ, ꯑꯃꯁꯨꯡ ꯃꯈꯣꯌꯒꯤ ꯃꯣꯔꯦꯜ ꯑꯗꯨ ꯈ꯭ꯕꯥꯏꯗꯒꯤ ꯌꯥꯝꯅꯥ ꯔꯤꯐꯥꯏꯟ ꯇꯧꯕꯥ ꯌꯥꯏ,"
"religious, and sexual values. It is during this time that","ꯙꯔꯃꯒꯤ ꯑꯣꯏꯕꯥ, ꯑꯃꯁꯨꯡ ꯁꯦꯛꯁꯨꯑꯦꯜ ꯚꯦꯜꯌꯨꯁꯤꯡ꯫"
youth also expect to be treated as an adult. As auton-,ꯅꯍꯥꯁꯤꯡꯅꯁꯨ ꯑꯍꯜ ꯑꯣꯏꯔꯕꯥ ꯃꯤꯑꯣꯏ ꯑꯃꯥ ꯑꯣꯏꯅꯥ ꯂꯧꯒꯅꯤ ꯍꯥꯌꯅꯥ ꯊꯥꯖꯩ꯫
"omy increases, youth are given more responsibility","ꯑꯣꯃꯤ ꯍꯦꯅꯒꯠꯂꯀꯏ, ꯅꯍꯥꯁꯤꯡꯗꯥ ꯍꯦꯟꯅꯥ ꯊꯧꯗꯥꯡ ꯄꯤꯔꯤ"
They are also provided with more access to alcohol,ꯃꯈꯣꯌꯗꯥ ꯌꯨ ꯊꯀꯄꯒꯤ ꯈꯨꯗꯣꯡꯆꯥꯕꯥ ꯍꯦꯟꯅꯥ ꯐꯪꯍꯅꯕꯁꯨ ꯌꯥꯑꯣꯔꯤ ꯫
and drugs,ꯑꯃꯁꯨꯡ ꯗ꯭ꯔꯒꯁꯤꯡ .
Emotional and Social Development,ꯏꯃꯣꯁꯅꯦꯜ ꯑꯃꯁꯨꯡ ꯁꯣꯁꯤꯑꯦꯜ ꯗꯤꯚꯦꯂꯄꯃꯦꯟꯇ
Adolescence is also characterized by the development of,ꯑꯦꯗꯣꯂꯁꯦꯟꯁ ꯑꯁꯤ 1000ꯒꯤ ꯃꯇꯥꯡꯗꯁꯨ ꯃꯁꯛ ꯇꯥꯛꯂꯤ꯫
emotional and social competence. Emotional compe-,ꯏꯃꯣꯁꯅꯦꯜ ꯑꯃꯁꯨꯡ ꯁꯣꯁꯤꯑꯦꯜ ꯀꯝꯄꯤꯇꯦꯟꯁꯟ꯫
"tence relates to the ability to manage emotions, whereas","ꯇꯦꯟꯁꯟ ꯑꯁꯤ ꯏꯃꯣꯁꯅꯁꯤꯡ ꯃꯦꯅꯦꯖ ꯇꯧꯕꯥ ꯉꯝꯕꯒꯤ ꯁꯛꯇꯤꯒꯥ ꯃꯔꯤ ꯂꯩꯅꯩ, ꯑꯗꯨꯕꯨ ."
social competence focuses on one’s ability to relate effec-,ꯁꯣꯁꯤꯑꯦꯜ ꯀꯝꯄꯤꯇꯦꯟꯁ ꯑꯁꯤꯅꯥ ꯀꯅꯥꯒꯨꯝꯕꯥ ꯑꯃꯒꯤ ꯏꯐꯦꯛ-ꯑꯦꯐꯦꯛꯁꯅꯒꯥ ꯃꯔꯤ ꯂꯩꯅꯕꯥ ꯇꯧꯕꯥ ꯉꯝꯕꯗꯥ ꯃꯤꯠꯌꯦꯡ ꯊꯝꯂꯤ-
"tively with others. During this process, adolescents be-",ꯇꯤꯕꯂꯤ ꯑꯇꯣꯞꯄꯁꯤꯡꯒꯥ ꯂꯣꯌꯅꯅꯥ꯫
come more aware of being able to identify and label,ꯃꯁꯛ ꯈꯪꯗꯣꯀꯄꯥ ꯑꯃꯁꯨꯡ ꯂꯦꯕꯦꯜ ꯇꯧꯕꯥ ꯉꯝꯕꯒꯤ ꯃꯇꯥꯡꯗꯥ ꯍꯦꯟꯅꯥ ꯈꯪꯖꯤꯅꯕꯥ ꯂꯥꯀꯎ
their own feelings and the feelings of others,ꯃꯈꯣꯌꯒꯤ ꯃꯁꯥꯒꯤ ꯑꯣꯏꯕꯥ ꯋꯥꯈꯜꯂꯣꯟ ꯑꯃꯁꯨꯡ ꯑꯇꯣꯞꯄꯒꯤ ꯋꯥꯈꯜꯂꯣꯅꯁꯤꯡ
The rate of emotional and cognitive development does,ꯏꯃꯣꯁꯅꯦꯜ ꯑꯃꯁꯨꯡ ꯀꯣꯒꯅꯤꯇꯤꯕ ꯗꯤꯕꯦꯂꯄꯃꯦꯟꯇꯀꯤ ꯆꯥꯡ ꯑꯁꯤ .
not parallel the rate of physical maturation. Dr Deborah,ꯐꯤꯖꯤꯀꯦꯜ ꯃꯦꯆ꯭ꯌꯨꯔꯦꯁꯅꯒꯤ ꯆꯥꯡ ꯑꯁꯤ ꯄꯦꯔꯥꯂꯥꯏꯖ ꯑꯣꯏꯗꯦ꯫
"Yurgelun-Todd, director of Neuropsychology and Cog-","ꯌꯨꯔꯒꯦꯂꯨꯟ-ꯇꯣꯗ, ꯅ꯭ꯌꯨꯔꯣꯁꯥꯏꯀꯣꯂꯣꯖꯤ ꯑꯃꯁꯨꯡ ꯀꯣꯒ-ꯒꯤ ꯗꯥꯏꯔꯦꯛꯇꯔ"
"nitive Neuroimaging at McLean Hospital in Belmont,","ꯕꯦꯂꯃꯣꯟꯇꯀꯤ ꯃꯦꯀꯂꯤꯟ ꯍꯣꯁ꯭ꯄꯤꯇꯥꯂꯗꯥ ꯅꯥꯏꯇꯣꯝ ꯂꯩꯕꯥ ꯅ꯭ꯌꯨꯔꯣꯏꯃꯦꯖꯤꯡ,"
"Massachusetts, compared magnetic resonance images","ꯃꯥꯁꯥꯆꯨꯁꯦꯇꯁ, ꯃꯦꯒ꯭ꯅꯦꯇꯤꯛ ꯔꯤꯖꯣꯅꯦꯟꯁ ꯏꯃꯦꯖꯁꯤꯡ ꯆꯥꯡꯗꯝꯅꯕꯥ"
of adults and teenagers to demonstrate how cognitive de-,ꯑꯍꯂꯁꯤꯡ ꯑꯃꯁꯨꯡ ꯇꯤꯟ-ꯀꯥꯡꯁꯤꯡꯒꯤ ꯃꯔꯛꯇꯥ ꯃꯇꯧ ꯀꯔꯝꯅꯥ ꯀꯣꯒꯅꯤꯇꯤꯕ ꯗꯤ-
velopment does not occur simultaneously with emotional,ꯚꯦꯂꯄꯃꯦꯟꯇ ꯑꯁꯤ ꯏꯃꯣꯁꯅꯦꯂꯒꯥ ꯂꯣꯌꯅꯅꯥ ꯃꯇꯝ ꯑꯃꯠꯇꯗꯥ ꯊꯣꯛꯇꯦ꯫
"development in adolescents. Unlike in the adult brain,",ꯏꯅꯈꯠꯂꯛꯂꯤꯕꯁꯤꯡꯗꯥ ꯆꯥꯎꯈꯠꯄꯥ ꯄꯨꯔꯀꯄꯥ꯫
where both the limbic area of the brain (emotion center),ꯃꯐꯝ ꯑꯗꯨꯗꯥ ꯕ꯭ꯔꯦꯅꯒꯤ ꯂꯤꯝꯕꯤꯛ ꯑꯦꯔꯤꯌꯥ (ꯏꯃꯣꯁꯟ ꯁꯦꯟꯇꯔ) ꯑꯅꯤꯃꯛ .
and the prefrontal cortex (judgment and reasoning cen-,ꯑꯃꯁꯨꯡ ꯄ꯭ꯔꯤꯐ꯭ꯔꯟꯇꯦꯜ ꯀꯣꯔꯇꯦꯛꯁ (ꯖꯖꯃꯦꯟꯇ ꯑꯃꯁꯨꯡ ꯔꯤꯖꯅꯦꯜ ꯁꯦꯟ-
ter) are enhanced when viewing images that expressed,ter) ꯑꯁꯤ ꯐꯣꯡꯗꯣꯀꯈꯤꯕꯥ ꯏꯃꯦꯖꯁꯤꯡ ꯑꯗꯨ ꯌꯦꯡꯕꯥ ꯃꯇꯃꯗꯥ ꯍꯦꯟꯅꯥ ꯐꯒꯠꯍꯜꯂꯤ꯫
"fear, in the adolescent brain, after seeing the same images,","ꯑꯀꯤꯕꯥ, ꯏꯅꯈꯠꯂꯛꯂꯤꯕꯥ ꯕ꯭ꯔꯦꯅꯗꯥ, ꯆꯞ ꯃꯥꯟꯅꯕꯥ ꯏꯃꯦꯖꯁꯤꯡ ꯑꯗꯨ ꯎꯔꯕꯥ ꯃꯇꯨꯡꯗꯥ,"
"the limbic area is enhanced, with almost no activity in the","ꯂꯤꯝꯕꯤꯛ ꯑꯦꯔꯤꯌꯥ ꯑꯁꯤ ꯍꯦꯟꯅꯥ ꯐꯒꯠꯍꯜꯂꯤ, ꯃꯁꯤꯗꯥ ꯆꯥꯎꯔꯥꯛꯅꯥ ꯑꯦꯛꯇꯤꯚꯤꯇꯤ ꯑꯃꯠꯇꯥ ꯂꯩꯇꯦ꯫"
prefrontal cortex. Such emotional-cognitive asynchrony,ꯄ꯭ꯔꯤꯐ꯭ꯔꯟꯇꯜ ꯀꯣꯔꯇꯦꯛꯁ꯫
can result in adolescents misinterpreting other’s feelings,ꯏꯅꯈꯠꯂꯛꯂꯤꯕꯁꯤꯡꯅꯥ ꯑꯇꯣꯞꯄꯒꯤ ꯐꯤꯚꯃꯁꯤꯡꯕꯨ ꯂꯥꯟꯅꯥ ꯂꯃꯖꯤꯡꯕꯤꯕꯥ ꯌꯥꯏ
"and emotions, whereas emotional-physical asynchrony","ꯑꯃꯁꯨꯡ ꯏꯃꯣꯁꯅꯁꯤꯡ, ꯑꯗꯨꯒꯥ ꯏꯃꯣꯁꯅꯦꯜ-ꯐꯤꯖꯤꯀꯦꯜ ꯑꯦꯁꯤꯅꯛꯔꯣꯅꯤ"
can result in adolescents being treated as older than their,ꯏꯅꯈꯠꯂꯛꯂꯤꯕꯁꯤꯡꯕꯨ ꯃꯈꯣꯌꯒꯤ 100ꯗꯒꯤ ꯍꯦꯟꯅꯥ ꯑꯍꯜ ꯑꯣꯏꯔꯕꯥ ꯃꯤꯑꯣꯏꯁꯤꯡ ꯑꯣꯏꯅꯥ ꯂꯧꯕꯥ ꯌꯥꯏ꯫
emotional stage of development,ꯗꯤꯕꯦꯂꯄꯃꯦꯟꯇꯀꯤ ꯏꯃꯣꯁꯅꯦꯜ ꯁ꯭ꯇꯦꯖ
Early rapid pubertal development in girls and boys may,ꯅꯨꯄꯤꯃꯆꯥꯁꯤꯡ ꯑꯃꯁꯨꯡ ꯅꯨꯄꯥꯃꯆꯥꯁꯤꯡꯗꯥ ꯉꯟꯅꯥ ꯌꯥꯝꯅꯥ ꯊꯨꯅꯥ ꯄ꯭ꯌꯨꯕꯔꯇꯦꯜ ꯗꯤꯚꯦꯂꯄꯃꯦꯟꯇ ꯇꯧꯕꯥ ꯌꯥꯏ
signiﬁcantly affect body image and social performance,ꯕꯣꯗꯤ ꯏꯃꯦꯖ ꯑꯃꯁꯨꯡ ꯁꯣꯁꯤꯑꯦꯜ ꯄꯔꯐꯣꯃꯦꯟꯁꯇꯥ ꯌꯥꯝꯅꯥ ꯆꯥꯎꯅꯥ ꯁꯣꯀꯍꯜꯂꯤ
Early maturing boys are often perceived as older and more,ꯉꯟꯅꯥ ꯃꯦꯆ꯭ꯌꯨꯔ ꯑꯣꯏꯕꯥ ꯅꯨꯄꯥꯃꯆꯥꯁꯤꯡ ꯑꯁꯤ ꯑꯌꯥꯝꯕꯅꯥ ꯑꯍꯜ ꯑꯣꯏꯔꯕꯥ ꯑꯃꯁꯨꯡ ꯍꯦꯟꯅꯥ ꯋꯥꯡꯕꯥ ꯃꯤꯑꯣꯏꯁꯤꯡꯅꯤ ꯍꯥꯌꯅꯥ ꯂꯧꯅꯩ꯫
"responsible. In general, they perform better on team sports",ꯊꯧꯗꯥꯡ ꯂꯩꯕ.
"than boys who mature late and, as a result, may be more",ꯊꯦꯟ ꯕꯣꯏꯁ ꯋꯤꯊ ꯄꯤꯛꯂꯤꯕꯥ ꯑꯃꯁꯨꯡ ꯃꯁꯤꯒꯤ ꯃꯍꯩ ꯑꯣꯏꯅꯥ ꯍꯦꯟꯅꯥ ꯐꯕꯥ ꯑꯣꯏꯕꯥ ꯌꯥꯏ꯫
"popular and seen as class leaders. However, timing and du-",ꯃꯤꯌꯥꯝꯅꯥ ꯄꯥꯝꯅꯕꯥ ꯑꯃꯁꯨꯡ ꯀ꯭ꯂꯥꯁꯀꯤ ꯂꯨꯆꯤꯡꯕꯁꯤꯡ ꯑꯣꯏꯅꯥ ꯎꯕꯥ꯫
"ration of puberty appear to matter. In a study by Ge et al,",ꯃꯤꯔꯣꯜꯂꯤꯉꯩꯒꯤ ꯔꯦꯁꯟ ꯑꯁꯤ ꯃꯔꯨꯑꯣꯏꯕꯥ ꯑꯣꯏꯅꯥ ꯎꯕꯥ ꯐꯪꯏ꯫
boys who were physically more developed in seventh,ꯐꯤꯖꯤꯀꯦꯜ ꯑꯣꯏꯅꯥ ꯷ꯁꯨꯕꯥ ꯆꯍꯤꯗꯥ ꯍꯦꯟꯅꯥ ꯆꯥꯎꯈꯠꯂꯕꯥ ꯅꯨꯄꯥꯃꯆꯥꯁꯤꯡ
"grade, compared with their less physically developed peers,","ꯒ꯭ꯔꯦꯗ, ꯃꯈꯣꯌꯒꯤ ꯐꯤꯖꯤꯀꯦꯜ ꯑꯣꯏꯅꯥ ꯆꯥꯎꯈꯠꯄꯥ ꯃꯔꯨꯄꯁꯤꯡꯒꯥ ꯆꯥꯡꯗꯝꯅꯕꯗꯥ, ."
manifested more externalized hostile feelings and internal-,ꯍꯦꯟꯅꯥ ꯑꯦꯛꯁꯇꯔꯅꯦꯂꯥꯏꯖ ꯇꯧꯔꯕꯥ ꯌꯦꯛꯅꯕꯥ ꯑꯣꯏꯕꯥ ꯐꯤꯚꯃꯁꯤꯡ ꯑꯃꯁꯨꯡ ꯏꯟꯇꯔꯅꯦꯜ-
ized distress symptoms in grades 8 through 10. Early mat-,ꯒ꯭ꯔꯦꯗ 8ꯗꯒꯤ 10 ꯐꯥꯎꯕꯒꯤ ꯃꯅꯨꯡꯗꯥ ꯂꯩꯕꯥ ꯑꯥꯏꯖꯗ ꯗꯤꯁ꯭ꯠꯔꯤꯁ ꯁꯤꯝꯄꯇꯃꯁꯤꯡ꯫
uration may predispose girls to social disadvantage. Early,ꯌꯨꯔꯦꯁꯅꯅꯥ ꯅꯨꯄꯤꯃꯆꯥꯁꯤꯡꯕꯨ ꯁꯣꯁꯤꯑꯦꯜ ꯗꯤꯁꯑꯦꯕꯤꯂꯤꯇꯤꯗꯥ ꯄ꯭ꯔꯤꯗꯤꯁꯄꯣꯖ ꯇꯧꯕꯥ ꯌꯥꯏ꯫
maturation has been identiﬁed as a risk factor for conduct,ꯃꯦꯆ꯭ꯌꯨꯔꯦꯁꯟ ꯑꯁꯤ ꯀꯟꯗꯥꯛꯇꯀꯤ ꯔꯤꯁ꯭ꯛ ꯐꯦꯛꯇꯔ ꯑꯃꯥ ꯑꯣꯏꯅꯥ ꯈꯉꯗꯣꯀꯈ꯭ꯔꯦ
"problems, depression, early substance use, poor body im-","ꯄ꯭ꯔꯣꯕ꯭ꯂꯦꯃꯁꯤꯡ, ꯗꯤꯞꯔꯦꯁꯟ, ꯉꯟꯅꯥ ꯄꯣꯠ-ꯆꯩ ꯁꯤꯖꯤꯟꯅꯕꯥ, ꯍꯀꯆꯥꯡ ꯐꯅꯥ ꯂꯩꯇꯕꯥ-"
"age, pregnancy, and early sexual initiation","ꯆꯍꯤ, ꯃꯤꯔꯣꯅꯕꯥ, ꯑꯃꯁꯨꯡ ꯉꯟꯅꯥ ꯁꯦꯛꯁꯨꯑꯦꯜ ꯏꯅꯁ꯭ꯇꯤꯠꯌꯨꯁꯟ ꯄꯤꯕꯥ"
Management or self-regulation of emotions is an im-,ꯏꯃꯣꯁꯅꯁꯤꯡꯒꯤ ꯃꯦꯅꯦꯖꯃꯦꯟꯇ ꯅꯠꯔꯒꯥ ꯁꯦꯜꯐ-ꯔꯦꯒꯨꯂꯦꯁꯟ ꯑꯁꯤ ꯏꯝ-
portant process in any adolescent. Research has found that,ꯏꯅꯈꯠꯂꯛꯂꯤꯕꯥ ꯃꯤꯑꯣꯏ ꯑꯃꯍꯦꯛꯇꯗꯥ ꯄꯣꯔꯇꯦꯟꯇ ꯄ꯭ꯔꯣꯁꯦꯁ꯫
an increased level of testosterone during puberty can result,ꯄꯤꯖ-ꯄꯤꯊꯛ ꯇꯧꯕꯥ ꯃꯇꯃꯗꯥ ꯇꯦꯁ꯭ꯇꯣꯁ꯭ꯇꯦꯔꯣꯅꯒꯤ ꯆꯥꯡ ꯍꯦꯅꯒꯠꯂꯀꯄꯒꯤ ꯃꯍꯩ ꯑꯣꯏꯕꯥ ꯌꯥꯏ
