en,mni-Mtei
"agedness, Linda advanced into the room, coquettishly smiling","ꯑꯦꯖꯦꯗꯅꯦꯁ, ꯂꯤꯟꯗꯥ ꯔꯨꯃꯗꯥ ꯆꯉꯁꯤꯜꯂꯀꯈꯤ, ꯀꯣꯀꯦꯠ ꯑꯣꯏꯅꯥ ꯃꯤꯠꯀꯨꯞ ꯅꯥꯍꯨꯝ ꯁꯤꯡꯅꯥ ꯂꯩꯔꯤ"
"her broken and discoloured smile, and rolling as she walked,","ꯃꯍꯥꯛꯀꯤ ꯁꯣꯀꯄꯥ ꯑꯃꯁꯨꯡ ꯃꯆꯨ ꯁꯪꯂꯕꯥ ꯃꯤꯠꯌꯦꯡ ꯑꯗꯨ, ꯑꯃꯁꯨꯡ ꯃꯍꯥꯛꯅꯥ ꯆꯠꯂꯤꯉꯩꯗꯥ ꯔꯣꯜ ꯇꯧꯕꯥ,"
"with what was meant to be a voluptuous undulation, her",ꯚꯣꯂꯨꯞꯇꯨꯁ ꯎꯟꯗꯨꯂꯦꯁꯟ ꯑꯃꯥ ꯑꯣꯏꯅꯥ ꯂꯧꯈꯤꯕꯥ ꯑꯗꯨꯒꯥ ꯂꯣꯌꯅꯅꯥ ꯃꯍꯥꯛꯀꯤ .
enormous haunches. Bernard walked beside her,ꯑꯆꯧꯕꯥ ꯍꯧꯅꯆꯤꯡꯕꯁꯤꯡ꯫
"‘There he is,’ he said, pointing at the Director",‘ꯃꯐꯃꯗꯨꯗꯥ ꯃꯍꯥꯛ ꯂꯩꯔꯤ’ ꯍꯥꯌꯅꯥ ꯃꯍꯥꯛꯅꯥ ꯗꯥꯏꯔꯦꯛꯇꯔꯗꯥ ꯃꯤꯠꯌꯦꯡ ꯊꯝꯂꯒꯥ ꯍꯥꯌꯈꯤ
‘Did you think I didn’t recognize him?’ Linda asked indignantly;,‘ꯑꯩꯅꯥ ꯃꯍꯥꯀꯄꯨ ꯈꯉꯂꯃꯗꯕꯔꯥ ꯍꯥꯌꯅꯥ ꯅꯉꯅꯥ ꯈꯜꯂꯝꯕꯔꯥ?’ ꯂꯤꯟꯗꯥ ꯌꯥꯝꯅꯥ ꯅꯨꯡꯉꯥꯏꯇꯅꯥ ꯍꯪꯏ;
"then, turning to the Director, ‘Of course I knew you; Tomakin, I","ꯑꯗꯨꯗꯒꯤ, ꯗꯥꯏꯔꯦꯛꯇꯔꯗꯥ ꯂꯥꯀꯄꯥ, ‘ꯑꯆꯨꯝꯕꯅꯤ ꯑꯩꯅꯥ ꯅꯉꯕꯨ ꯈꯉꯂꯝꯃꯤ;"
"should have known you anywhere, among a thousand. But","ꯑꯗꯣꯝ ꯃꯐꯝ ꯑꯃꯗꯥ, ꯂꯤꯁꯤꯡ ꯑꯃꯒꯤ ꯃꯔꯛꯇꯥ ꯈꯉꯍꯅꯒꯗꯕꯅꯤ꯫"
perhaps you’ve forgotten me. Don’t you remember? Don’t you,ꯅꯉꯅꯥ ꯑꯩꯕꯨ ꯀꯥꯑꯣꯊꯣꯀꯈ꯭ꯔꯕꯅꯤ꯫
"remember, Tomakin? Your Linda.’ She stood looking at him, her","ꯅꯤꯡꯁꯤꯡꯕꯤꯌꯨ, ꯇꯣꯃꯥꯀꯤꯟ?"
176,꯱꯷꯶ ꯑꯃꯁꯨꯡ ꯑꯦꯟ.
"head on one side, still smiling, but with a smile that became","ꯃꯥꯌꯀꯩ ꯑꯃꯗꯥ ꯃꯀꯣꯛ, ꯍꯧꯖꯤꯀꯁꯨ ꯃꯤꯠꯀꯨꯞ ꯑꯃꯒꯥ ꯂꯣꯌꯅꯅꯥ, ꯑꯗꯨꯕꯨ ꯃꯤꯠꯀꯨꯞ ꯑꯃꯒꯥ ꯂꯣꯌꯅꯅꯥ"
"progressively, in face of the Director’s expression of petrified","ꯄ꯭ꯔꯣꯒ꯭ꯔꯦꯁꯤꯚ ꯑꯣꯏꯅꯥ, ꯗꯥꯏꯔꯦꯛꯇꯔꯅꯥ ꯄꯦꯠꯔꯣꯐꯥꯏꯗ ꯇꯧꯕꯒꯤ ꯃꯇꯥꯡꯗꯥ ꯋꯥꯐꯝ ꯀꯌꯥ ꯊꯃꯈꯤ"
"disgust, less and less self-confident, that wavered and finally","ꯗꯤꯁꯒꯁ꯭ꯠ, ꯂꯦꯁ ꯑꯃꯁꯨꯡ ꯂꯦꯁ ꯁꯦꯜꯐ-ꯀꯅꯐꯤꯗꯦꯟꯇ, ꯃꯗꯨ ꯋꯥꯏꯔꯞ ꯇꯧꯈꯤ ꯑꯃꯁꯨꯡ ꯑꯔꯣꯏꯕꯗꯥ"
"went out. ‘Don’t you remember, Tomakin?’ she repeated in a",ꯊꯣꯀꯈꯤ꯫
"voice that trembled. Her eyes were anxious, agonized. The",ꯈꯣꯟꯖꯦꯜ ꯑꯗꯨ ꯇꯞꯅꯥ ꯇꯞꯅꯥ ꯂꯥꯀꯈꯤ꯫
blotched and sagging face twitched grotesquely into the,ꯕ꯭ꯂꯣꯆ ꯇꯧꯔꯕꯥ ꯑꯃꯁꯨꯡ ꯁꯦꯒꯤꯡ ꯐꯦꯁ ꯇꯨꯏꯆ ꯒ꯭ꯔꯣꯇꯦꯁ꯭ꯛ ꯑꯣꯏꯅꯥ ꯏꯟ .
grimace of extreme grief. ‘Tomakin!’ She held out her arms,ꯑꯀꯅꯕꯥ ꯒ꯭ꯔꯤꯐꯀꯤ ꯒ꯭ꯔꯤꯃꯁ꯫
Some one began to titter,ꯀꯅꯥꯒꯨꯝꯕꯥ ꯑꯃꯅꯥ ꯇꯤꯇꯔ ꯇꯧꯕꯥ ꯍꯧꯔꯀꯈꯤ꯫
"‘What’s the meaning,’ began the Director, ‘of this monstrous . . .’","‘ꯋꯥꯠ ꯗ ꯃꯤꯅꯤꯡ’, ‘ꯑꯣꯐ ꯑꯁꯤꯒꯤ ꯃꯅꯁ꯭ꯠꯔꯣꯁ ."
"‘Tomakin!’ She ran forward, her blanket trailing behind her,","‘ꯇꯣꯃꯥꯀꯤꯟ!’ ꯃꯍꯥꯛꯅꯥ ꯃꯥꯡꯂꯣꯃꯗꯥ ꯆꯪꯁꯤꯜꯂꯒꯥ, ꯃꯍꯥꯛꯀꯤ ꯃꯇꯨꯡꯗꯥ ꯃꯍꯥꯛꯀꯤ ꯀꯝꯕꯜ ꯑꯗꯨ ꯇꯨꯡꯗꯥ ꯂꯥꯀꯄꯥ,"
threw her,ꯊ꯭ꯔꯦꯎ ꯍꯦꯔ .
"arms round his neck, hid her face on his chest. A howl of","ꯈꯨꯠꯁꯥ ꯍꯩꯕꯥ ꯃꯍꯥꯛꯀꯤ ꯀꯣꯛ ꯅꯣꯟꯖꯗꯨꯅꯥ, ꯃꯍꯥꯛꯀꯤ ꯃꯀꯣꯀꯊꯣꯡꯕꯗꯨ ꯂꯣꯠꯁꯤꯜꯂꯀꯏ꯫"
laughter went up irrepressibly,ꯂꯥꯎꯊꯣꯀꯄꯥ ꯑꯁꯤ ꯏꯔꯦꯞꯔꯦꯁꯟ ꯑꯣꯏꯅꯥ ꯍꯦꯅꯒꯠꯂꯀꯈꯤ
"Red in the face, he tried to disengage himself from her",ꯂꯥꯂꯍꯧꯕꯥ ꯃꯇꯨꯡꯗꯥ ꯃꯍꯥꯛꯅꯥ ꯃꯁꯥꯕꯨ ꯃꯍꯥꯛꯀꯤ ꯃꯐꯃꯗꯒꯤ ꯂꯥꯄꯊꯣꯛꯅꯕꯥ ꯍꯣꯠꯅꯈꯤ꯫
"embrace. Desperately she clung. ‘But I’m Linda, I’m Linda.’ The",ꯀꯣꯟꯁꯤꯟꯕ.
"laughter drowned her voice. ‘You made me have a baby,’ she",ꯅꯣꯀꯄꯥ ꯑꯁꯤ ꯃꯍꯥꯛꯀꯤ ꯈꯣꯟꯖꯦꯜ ꯑꯗꯨ ꯏꯁꯤꯡꯗꯥ ꯆꯦꯟꯊꯈꯤ꯫
screamed above the uproar. There was a sudden and appalling,ꯈꯣꯝꯂꯥꯡꯒꯤ ꯃꯊꯛꯇꯥ ꯂꯥꯎꯕꯥ꯫
"hush; eyes floated uncomfortably, not knowing where to look",ꯍꯨꯁ ꯇꯧꯕꯥ;
"The Director went suddenly pale, stopped struggling and stood,","ꯗꯥꯏꯔꯦꯛꯇꯔꯅꯥ ꯈꯉꯍꯧꯗꯅꯥ ꯊꯨꯅꯥ ꯌꯥꯡꯅꯥ ꯆꯠꯈꯤ, ꯂꯥꯟꯊꯦꯡꯅꯈꯤ ꯑꯃꯁꯨꯡ ꯂꯦꯞꯂꯝꯃꯤ,"
his,ꯃꯍꯥꯛꯀꯤ
"hands on her wrists, staring down at her, horrified. ‘Yes, a","ꯃꯍꯥꯛꯀꯤ ꯃꯈꯨꯠꯇꯥ ꯈꯨꯠ ꯍꯥꯃꯗꯣꯀꯄꯥ, ꯃꯍꯥꯛꯀꯤ ꯃꯊꯛꯇꯥ ꯃꯤꯠꯌꯦꯡ ꯊꯝꯂꯒꯥ, ꯌꯥꯝꯅꯥ ꯉꯀꯄꯥ꯫"
baby—and I was its mother.’ She flung the obscenity like a,ꯕꯦꯕꯤ—ꯑꯗꯨꯒꯥ ꯑꯩꯁꯨ ꯃꯁꯤꯒꯤ ꯃꯃꯥ ꯑꯣꯏꯈꯤ꯫’ ꯃꯍꯥꯛꯅꯥ ꯑꯁꯪꯕꯥ ꯑꯗꯨ ꯐꯣꯡꯗꯣꯀꯈꯤꯕꯒꯨꯝ꯫
"challenge into the outraged silence; then, suddenly breaking",ꯑꯁꯥꯑꯣꯕꯥ ꯋꯥꯈꯜ ꯅꯨꯡꯉꯥꯏꯇꯕꯥ ꯑꯗꯨꯗꯥ ꯆꯦꯂꯦꯟꯖ ꯇꯧꯕꯥ;
177,꯱꯷꯷ ꯑꯃꯁꯨꯡ ꯑꯦꯟ.
"away from him, ashamed, ashamed, covered her face with her","ꯃꯍꯥꯛꯀꯤ ꯃꯐꯃꯗꯒꯤ ꯂꯥꯞꯅꯥ, ꯂꯥꯡꯇꯛꯅꯅꯥ, ꯂꯥꯡꯇꯛꯅꯅꯥ, ꯃꯍꯥꯛꯀꯤ ꯃꯐꯃꯗꯥ ꯃꯍꯥꯛꯀꯤ ꯃꯐꯝ ꯑꯗꯨ ꯊꯨꯒꯥꯏꯈꯤ"
"hands, sobbing. ‘It wasn’t my fault, Tomakin. Because I always","ꯈꯨꯠ, ꯅꯣꯀꯄꯥ꯫"
"did my drill, didn’t I? Didn’t I? Always . . . I don’t know how . . . If","ꯑꯩꯒꯤ ꯗ꯭ꯔꯥꯏꯜ ꯑꯗꯨ ꯇꯧꯈꯤꯕꯔꯥ, ꯅꯠꯇꯦ?"
"you knew how awful, Tomakin . . . But he was a comfort to me,","ꯑꯗꯣꯝꯅꯥ ꯈꯉꯕꯤꯔꯤꯕꯥ ꯑꯗꯨꯅꯤ ꯀꯌꯥꯗꯥ ꯑꯉꯀꯄꯥ, ꯇꯣꯃꯥꯀꯤꯟ ."
"all the same.’ Turning towards the door, ‘John!’ she called","ꯄꯨꯝꯅꯃꯛ ꯑꯗꯨꯃꯛ꯫’ ꯊꯣꯉꯅꯥꯑꯣꯗꯨꯗꯥ ꯂꯥꯀꯄꯥ, ‘ꯖꯣꯟ!’ ꯃꯍꯥꯛꯅꯥ ꯀꯧꯈꯤ"
‘John!’,‘ꯖꯣꯟ!’ ꯍꯥꯌꯅꯥ ꯐꯣꯉꯗꯣꯀꯈꯤ꯫
"He came in at once, paused for a moment just inside the door,","ꯃꯍꯥꯛ ꯑꯃꯨꯛ ꯍꯟꯅꯥ ꯂꯥꯀꯈꯤ, ꯊꯣꯉꯅꯥꯑꯣ ꯃꯅꯨꯡꯗꯥ ꯃꯤꯀꯨꯞ ꯑꯃꯥ ꯂꯦꯞꯂꯒꯥ,"
"looked round, then soft on his moccasined feet strode quickly","ꯒꯣꯜꯗ ꯑꯣꯏꯅꯥ ꯎꯈꯤ, ꯃꯗꯨꯒꯤ ꯃꯇꯨꯡꯗꯥ ꯃꯍꯥꯛꯀꯤ ꯃꯣꯀꯥꯁꯤꯟ ꯇꯧꯔꯕꯥ ꯈꯣꯡꯗꯥ ꯇꯞꯅꯥ ꯇꯞꯅꯥ ꯈꯣꯡꯅꯥ ꯆꯠꯈꯤ"
"across the room, fell on his knees in front of the Director, and","ꯔꯨꯃꯒꯤ ꯃꯄꯥꯟꯗꯥ, ꯗꯥꯏꯔꯦꯛꯇꯔꯒꯤ ꯃꯃꯥꯡꯗꯥ ꯃꯍꯥꯛꯀꯤ ꯈꯨꯎꯗꯥ ꯆꯦꯟꯊꯈꯤ, ꯑꯃꯁꯨꯡ ."
said in a clear voice: ‘My father!’,ꯃꯌꯦꯛ ꯁꯦꯡꯅꯥ ꯈꯣꯟꯖꯦꯜ ꯑꯃꯗꯥ ꯍꯥꯌꯔꯀꯏ: ‘ꯑꯩꯒꯤ ꯏꯄꯥ!’꯫
The word (for ‘father’ was not so much obscene as—with its,ꯋꯥꯍꯩ ꯑꯁꯤ (ꯃꯔꯃꯒꯤꯗꯃꯛ ‘ꯐꯥꯗꯥꯔ’ꯅꯥ ꯑꯁꯨꯛ ꯌꯥꯝꯅꯥ ꯑꯁꯪꯕꯥ ꯑꯣꯏꯈꯤꯗꯦ—ꯃꯗꯨꯒꯥ ꯂꯣꯌꯅꯅꯥ .
connotation of something at one remove from the,ꯀꯅꯣꯇꯦꯁꯟ ꯑꯣꯐ ꯁꯣꯃꯊ ꯑꯦꯠ ꯋꯥꯟ ꯔꯤꯃꯨꯚ ꯐ꯭ꯔꯝ ꯗꯤ .
loathsomeness and moral obliquity of child-bearing—merely,ꯑꯉꯥꯡ ꯄꯣꯀꯄꯒꯤ ꯂꯃꯆꯠ-ꯁꯥꯖꯠ ꯑꯃꯁꯨꯡ ꯂꯃꯆꯠ-ꯁꯥꯖꯠꯀꯤ ꯑꯣꯕꯂꯤꯛꯌꯨꯏꯇꯤ—ꯈꯨꯗꯝ ꯑꯣꯏꯅꯥ
"gross, a scatological rather than a pornographic impropriety),","ꯒ꯭ꯔꯣꯁ, ꯄꯣꯔꯅꯣꯒ꯭ꯔꯥꯐꯤꯛ ꯏꯝꯞꯔꯣꯞꯔꯤꯌꯦꯁꯟ ꯑꯃꯒꯤ ꯃꯍꯨꯠꯇꯥ ꯁ꯭ꯀꯦꯇꯣꯂꯣꯖꯤꯀꯦꯜ ꯑꯃꯥ),"
the comically smutty word relieved what had become a quite,ꯀꯝꯃꯤꯀꯂꯤ ꯁ꯭ꯃꯨꯇꯤ ꯋꯥꯍꯩ ꯑꯁꯤꯅꯥ ꯌꯥꯝꯅꯥ ꯐꯕꯥ ꯑꯃꯥ ꯑꯣꯏꯔꯀꯈꯤꯕꯥ ꯑꯗꯨ ꯔꯤꯂꯤꯐ ꯇꯧꯈꯤ ꯫
"intolerable tension. Laughter broke out, enormous, almost",ꯏꯅꯇꯣꯂꯦꯕꯜ ꯇꯦꯟꯁꯟ ꯂꯩꯕꯥ꯫
"hysterical, peal after peal, as though it would never stop. My","ꯍꯤꯁ꯭ꯇꯔꯤꯀꯦꯜ, ꯄꯤꯂꯒꯤ ꯃꯇꯨꯡꯗꯥ ꯄꯤꯜ, ꯃꯁꯤ ꯀꯩꯗꯧꯉꯩꯗꯥ ꯊꯤꯡꯂꯣꯏꯗꯕꯥ ꯃꯑꯣꯡꯗꯥ꯫"
"father—and it was the Director! My father! Oh, Ford, oh Ford!",ꯃꯄꯥ—ꯑꯗꯨꯒꯥ ꯃꯁꯤ ꯗꯤꯔꯦꯛꯇꯔ ꯑꯣꯏꯈꯤ!
That was really too good. The whooping and the roaring,ꯃꯗꯨ ꯇꯁꯦꯡꯅꯥ ꯌꯥꯝꯅꯥ ꯐꯕꯥ ꯑꯣꯏꯈꯤ꯫
"renewed themselves, faces seemed on the point of","ꯃꯁꯥꯃꯀꯄꯨ ꯔꯤꯟꯌꯨ ꯇꯧꯈꯤ, ꯐꯦꯁꯁꯤꯡ ꯑꯁꯤ ꯄꯣꯏꯟꯇ ꯑꯗꯨꯗꯥ ꯎꯕꯥ ꯐꯪꯈꯤ ꯫"
"disintegration, tears were streaming. Six more test-tubes of","ꯗꯤꯁꯤꯟꯇꯦꯒ꯭ꯔꯦꯁꯟ, ꯃꯤꯠꯀꯨꯞ ꯅꯥꯍꯨꯝ ꯁꯤꯡꯅꯥ ꯂꯩꯔꯝꯃꯤ꯫"
spermatozoa were upset. My father!,ꯁ꯭ꯄꯥꯔꯃꯇꯣꯖꯣꯌꯥꯅꯥ ꯅꯨꯡꯉꯥꯏꯇꯕꯥ ꯐꯥꯑꯣꯈꯤ꯫
"Pale, wild-eyed, the Director glared about him in an agony of","ꯄꯥꯂꯦ, ꯋꯥꯏꯜꯗ-ꯑꯥꯏꯗ, ꯗꯥꯏꯔꯦꯛꯇꯔꯅꯥ ꯃꯍꯥꯛꯀꯤ ꯃꯔꯃꯗꯥ ꯃꯤꯠꯌꯦꯡ ꯊꯃꯈꯤ"
178,꯱꯷꯸ ꯑꯃꯁꯨꯡ ꯑꯦꯟ.
"My father! The laughter, which had shown signs of dying away,",ꯑꯩꯒꯤ ꯏꯄꯥ!
broke out again more loudly than ever. He put his hands over,ꯍꯥꯟꯅꯗꯒꯤ ꯍꯦꯟꯅꯥ ꯌꯥꯝꯅꯥ ꯋꯥꯅꯥ ꯑꯃꯨꯛ ꯍꯟꯅꯥ ꯕ꯭ꯔꯦꯛ ꯇꯧꯈꯤ꯫
his ears and rushed out of the room,ꯃꯍꯥꯛꯀꯤ ꯅꯥꯀꯣꯡ ꯑꯃꯁꯨꯡ ꯔꯨꯃꯗꯒꯤ ꯊꯣꯔꯀꯈꯤ
179,꯱꯷꯹ ꯑꯃꯁꯨꯡ ꯑꯦꯟ.
C H A P T E R XI,ꯁꯤ ꯑꯩꯆ ꯑꯦ ꯄꯤ ꯇꯤ ꯏ ꯑꯥꯔ XI .
"AFTER the scene in the Fertilizing Room, all upper-caste London","ꯐꯔꯇꯤꯂꯥꯏꯖꯔ ꯔꯨꯃꯗꯥ ꯂꯩꯕꯥ ꯃꯐꯝ ꯑꯗꯨꯒꯤ ꯃꯇꯨꯡꯗꯥ, ꯄꯨꯝꯅꯃꯛ ꯑꯋꯥꯡ ꯀꯥꯁ꯭ꯠ ꯂꯟꯗꯟ"
knees before the Director of Hatcheries and Conditioning—or,ꯍꯦꯆꯔꯤ ꯑꯃꯁꯨꯡ ꯀꯟꯗꯤꯁꯅꯒꯤ ꯗꯥꯏꯔꯦꯛꯇꯔꯒꯤ ꯃꯃꯥꯡꯗꯥ ꯈꯨꯎꯁꯤꯡ—ꯅꯠꯔꯒꯥ .
"rather the ex-Director, for the poor man had resigned","ꯃꯗꯨꯒꯤ ꯃꯍꯨꯠꯇꯥ ꯑꯦꯛꯁ-ꯗꯥꯏꯔꯦꯛꯇꯔ, ꯃꯔꯃꯗꯤ ꯂꯥꯌꯔꯕꯥ ꯃꯤꯑꯣꯏ ꯑꯗꯨꯅꯥ ꯔꯤꯖꯥꯏꯟ ꯇꯧꯈꯤ"
immediately afterwards and never set foot inside the Centre,ꯈꯨꯗꯛꯇꯥ ꯃꯗꯨꯒꯤ ꯃꯇꯨꯡꯗꯥ ꯑꯃꯁꯨꯡ ꯀꯩꯗꯧꯉꯩꯗꯥ ꯁꯦꯟꯇꯔꯒꯤ ꯃꯅꯨꯡꯗꯥ ꯈꯣꯡ ꯊꯥꯡꯖꯤꯜꯂꯣꯏꯗꯕꯅꯤ
again— had flopped down and called him (the joke was almost,ꯑꯃꯨꯛ ꯍꯟꯅꯥ— ꯐ꯭ꯂꯣꯞ ꯗꯥꯎꯟ ꯇꯧꯔꯒꯥ ꯃꯍꯥꯀꯄꯨ ꯀꯧꯈꯤ (ꯖꯣꯛ ꯑꯗꯨ ꯆꯥꯎꯔꯥꯛꯅꯥ ꯑꯣꯏꯈꯤ ꯆꯥꯎꯔꯥꯛꯅꯥ .
"too good to be true!) ‘my father.’ Linda, on the contrary, cut no","TOO GOOD TO BE TRUE!) ‘ꯑꯩꯒꯤ ꯏꯄꯥ꯫’ ꯂꯤꯟꯗꯥ, ꯃꯗꯨꯒꯤ ꯃꯇꯨꯡ ꯏꯟꯅꯥ, ꯀꯠꯊꯣꯀꯄꯥ"
ice; nobody had the smallest desire to see Linda. To say one,ꯚꯔꯞ;
was a mother—that was past a joke: it was an obscenity,ꯃꯃꯥ ꯑꯃꯥ ꯑꯣꯏꯔꯝꯃꯤ—ꯃꯗꯨ ꯖꯣꯀꯁ ꯑꯃꯥ ꯑꯣꯏꯈꯤ: ꯃꯁꯤ ꯑꯁꯪꯕꯥ ꯑꯃꯅꯤ
"Moreover, she wasn’t a real savage, had been hatched out of a","ꯃꯁꯤꯗꯁꯨ ꯅꯠꯇꯅꯥ, ꯃꯍꯥꯛ ꯑꯁꯦꯡꯕꯥ ꯁꯦꯚꯦꯖ ꯑꯃꯥ ꯑꯣꯏꯈꯤꯗꯦ, ꯑꯃꯗꯒꯤ ꯍꯦꯠꯆꯈꯤꯕꯥ ꯑꯗꯨ ."
bottle and conditioned like any one else: so couldn’t have really,ꯕꯣꯇꯜ ꯑꯃꯁꯨꯡ ꯑꯇꯣꯞꯄꯥ ꯀꯅꯥꯒꯨꯝꯕꯥ ꯑꯃꯒꯨꯝ ꯀꯟꯗꯤꯁꯟ ꯇꯧꯕꯥ: ꯃꯔꯝ ꯑꯗꯨꯅꯥ ꯇꯁꯦꯡꯅꯥ ꯇꯧꯕꯥ ꯉꯃꯈꯤꯗꯦ
quaint ideas. Finally,ꯑꯉꯀꯄꯥ ꯋꯥꯈꯜꯂꯣꯅꯁꯤꯡ꯫
—and this was by far the strongest reason for people’s not,—ꯑꯗꯨꯒꯥ ꯃꯁꯤ ꯌꯥꯝꯅꯥ ꯂꯥꯞꯅꯥ ꯃꯤꯌꯥꯃꯒꯤ ꯈ꯭ꯕꯥꯏꯗꯒꯤ ꯃꯄꯥꯉ꯭ꯒꯜ ꯀꯅꯕꯥ ꯃꯔꯝ ꯑꯣꯏꯈꯤ
wanting to see poor Linda—there was her appearance. Fat;,ꯂꯥꯌꯔꯕꯥ ꯂꯤꯟꯗꯥ ꯎꯕꯥ ꯄꯥꯃꯗꯨꯅꯥ—ꯃꯍꯥꯛꯀꯤ ꯃꯑꯣꯡ ꯃꯇꯧ ꯑꯗꯨ ꯂꯩꯔꯝꯃꯤ꯫
"having lost her youth; with bad teeth, and a blotched",ꯃꯍꯥꯛꯀꯤ ꯅꯍꯥ ꯑꯣꯏꯔꯤꯉꯩ ꯃꯇꯝ ꯑꯗꯨ ꯃꯥꯡꯍꯅꯈꯤꯕꯥ;
"complexion, and that figure (Ford!)—you simply couldn’t look at","ꯀꯝꯞꯂꯦꯛꯁꯟ, ꯑꯃꯁꯨꯡ ꯐꯤꯒꯔ ꯑꯗꯨ (ꯐꯣꯔꯗ!)—ꯑꯗꯣꯝꯅꯥ ꯁꯨꯞꯅꯇꯒꯤ ꯌꯦꯡꯕꯥ ꯉꯃꯈꯤꯗꯦ"
"her without feeling sick, yes, positively sick. So the best people","ꯃꯍꯥꯛꯀꯤ ꯑꯅꯥꯕꯥ ꯐꯥꯑꯣꯗꯅꯥ, ꯍꯣꯌ, ꯄꯣꯖꯤꯇꯤꯕ ꯑꯣꯏꯅꯥ ꯑꯅꯥꯕꯥ꯫"
"were quite determined not to see Linda. And Linda, for her part,",ꯂꯤꯟꯗꯥ ꯎꯕꯥ ꯐꯪꯗꯅꯕꯥ ꯌꯥꯝꯅꯥ ꯋꯥꯔꯦꯞ ꯂꯧꯈꯤ꯫
had no desire to see them. The return to civilization was for her,ꯃꯈꯣꯌꯕꯨ ꯎꯕꯒꯤ ꯑꯄꯥꯝꯕꯥ ꯂꯩꯔꯃꯗꯦ꯫
"the return to soma, was the possibility of lying in bed and taking","ꯁꯣꯃꯥꯗꯥ ꯍꯜꯂꯀꯄꯥ, ꯐꯃꯨꯡꯗꯥ ꯂꯩꯕꯥ ꯑꯃꯁꯨꯡ ꯂꯧꯕꯒꯤ ꯑꯣꯏꯊꯣꯀꯄꯥ ꯂꯩ ꯍꯥꯌꯕꯁꯤꯅꯤ ."
"holiday after holiday, without ever having to come back to a","ꯁꯨꯇꯤꯒꯤ ꯃꯇꯨꯡꯗꯥ ꯁꯨꯇꯤ ꯂꯧꯕꯥ, ꯀꯩꯗꯧꯉꯩꯗꯁꯨ ꯑꯃꯨꯛ ꯍꯟꯅꯥ ꯂꯥꯀꯄꯥ ꯃꯊꯧ ꯇꯥꯗꯅꯥ"
"headache or a fit of vomiting, without ever being made to feel","ꯍꯦꯗ-ꯑꯦꯛ ꯅꯠꯠꯔꯒꯥ ꯐꯤꯇꯁ ꯑꯣꯐ ꯚꯣꯏꯇꯤꯡ, ꯀꯩꯗꯧꯉꯩꯗꯥ ꯐꯤꯜ ꯇꯧꯕꯥ ꯌꯥꯍꯟꯗꯅꯥ"
"as you always felt after peyotl, as though you’d done something","ꯑꯗꯣꯝꯅꯥ ꯃꯇꯝ ꯄꯨꯝꯅꯃꯛꯇꯥ ꯄꯦꯌꯣꯠꯀꯤ ꯃꯇꯨꯡꯗꯥ ꯐꯥꯑꯣꯈꯤꯕꯒꯨꯝ, ꯑꯗꯣꯝꯅꯥ ꯀꯔꯤꯒꯨꯝꯕꯥ ꯈꯔꯥ ꯇꯧꯈꯤꯕꯒꯨꯝ ."
so shamefully anti-social that you could never hold up your,ꯑꯁꯨꯛ ꯌꯥꯝꯅꯥ ꯂꯥꯡꯇꯛꯅꯅꯥ ꯑꯦꯟꯇꯤ-ꯁꯣꯁꯤꯑꯦꯜ ꯑꯣꯏꯅꯥ ꯑꯗꯣꯝꯅꯥ ꯀꯩꯗꯧꯅꯨꯡꯗꯥ ꯑꯗꯣꯃꯒꯤ ꯊꯃꯣꯏꯗꯥ ꯊꯃꯖꯤꯅꯕꯥ ꯉꯝꯂꯣꯏ꯫
180,꯱꯸꯰ ꯑꯃꯁꯨꯡ ꯑꯦꯟ.
head again. Soma played none of these unpleasant tricks. The,ꯑꯃꯨꯛ ꯍꯟꯅꯥ ꯃꯀꯣꯛ꯫
"holiday it gave was perfect and, if the morning after was","ꯁꯨꯇꯤꯒꯤ ꯃꯇꯃꯗꯥ ꯃꯁꯤꯅꯥ ꯄꯤꯈꯤꯕꯥ ꯑꯗꯨ ꯃꯄꯨꯡ ꯐꯥꯅꯥ ꯂꯩꯈꯤ ꯑꯃꯁꯨꯡ, ꯀꯔꯤꯒꯨꯝꯕꯥ ꯑꯌꯨꯛ ꯑꯗꯨ ꯑꯣꯏꯔꯕꯗꯤ ."
"disagreeable, it was so, not intrinsically, but only by comparison","ꯌꯥꯅꯤꯡꯗꯕꯥ ꯐꯣꯡꯗꯣꯀꯄꯥ, ꯃꯁꯤ ꯑꯁꯨꯝꯅꯥ ꯑꯣꯏꯈꯤ, ꯏꯟꯠꯔꯤꯅꯁꯤꯀꯦꯜ ꯑꯣꯏꯅꯥ ꯅꯠꯇꯦ, ꯑꯗꯨꯕꯨ ꯆꯥꯡꯗꯝꯅꯕꯗꯥ ꯈꯛꯇꯃꯛ ꯑꯣꯏꯈꯤ"
with the joys of the holiday. The remedy was to make the,ꯁꯨꯇꯤꯒꯤ ꯅꯨꯡꯉꯥꯏꯕꯁꯤꯡꯒꯥ ꯂꯣꯌꯅꯅꯥ꯫
"holiday continuous. Greedily she clamoured for ever larger, ever",ꯁꯨꯇꯤꯒꯤ ꯃꯇꯝ ꯂꯦꯞꯄꯥ꯫
more frequent doses. Dr. Shaw at first demurred; then let her,ꯍꯦꯟꯅꯥ ꯀꯃꯟ ꯑꯣꯏꯕꯥ ꯗꯣꯖꯁꯤꯡ꯫
have what she wanted. She took as much as twenty grammes a,ꯃꯍꯥꯛꯅꯥ ꯄꯥꯃꯖꯕꯥ ꯑꯗꯨ ꯂꯩꯕꯤꯌꯨ꯫
day,ꯅꯨꯃꯤꯠ
"‘Which will finish her off in a month or two,’ the doctor confided",‘ꯃꯁꯤꯅꯥ ꯃꯍꯥꯀꯄꯨ ꯊꯥ ꯑꯃꯒꯥ ꯑꯅꯤꯗꯥ ꯂꯣꯏꯁꯤꯅꯒꯅꯤ’ ꯍꯥꯌꯅꯥ ꯗꯣꯛꯇꯔꯅꯥ ꯐꯣꯡꯗꯣꯀꯈꯤ
to Bernard. ‘One day the respiratory centre will be paralysed,ꯕꯔꯅꯥꯔꯗꯇꯥ ꯄꯤꯈꯤ꯫
No more breathing. Finished. And a good thing too. If we could,ꯁ꯭ꯕꯔ ꯍꯣꯅꯕꯥ ꯋꯥꯕꯥ ꯍꯧꯔꯔꯣꯏ꯫
"rejuvenate, of course it would be different. But we can’t.’","ꯔꯤꯖꯨꯚꯦꯅꯦꯠ ꯇꯧꯕꯤꯌꯨ, ꯇꯁꯦꯡꯅꯥ ꯃꯁꯤ ꯇꯣꯉꯥꯅꯕꯥ ꯑꯣꯏꯒꯅꯤ꯫"
"Surprisingly, as every one thought (for on soma-holiday Linda","ꯑꯉꯀꯄꯥ ꯑꯣꯏꯅꯥ, ꯃꯤ ꯈꯨꯗꯤꯡꯃꯛꯅꯥ ꯈꯜꯂꯝꯕꯒꯨꯝꯅꯥ (ꯐꯣꯔ ꯑꯣꯟ ꯁꯣꯃꯥ-ꯍꯣꯂꯤꯗꯦ ꯂꯤꯟꯗꯥ"
"was most conveniently out of the way), John raised objections","ꯈ꯭ꯕꯥꯏꯗꯒꯤ ꯈꯨꯗꯣꯡꯆꯥꯕꯥ ꯃꯑꯣꯡꯗꯥ ꯂꯝꯕꯤꯗꯒꯤ ꯂꯥꯞꯅꯥ ꯂꯩꯈꯤ), ꯌꯣꯍꯥꯟꯅꯥ ꯑꯣꯕꯖꯦꯛꯁꯅꯁꯤꯡ ꯋꯥꯡꯈꯠꯍꯅꯈꯤ"
‘But aren’t you shortening her life by giving her so much?’,‘ ꯑꯗꯨꯕꯨ ꯅꯉꯅꯥ ꯃꯍꯥꯛꯀꯤ ꯄꯨꯟꯁꯤꯕꯨ ꯑꯁꯨꯛ ꯌꯥꯝꯅꯥ ꯄꯤꯖꯗꯨꯅꯥ ꯁꯣꯟꯊꯔꯕꯔꯥ ?
"‘In one sense, yes,’ Dr. Shaw admitted. ‘But in another we’re","‘ꯑꯋꯥꯕꯥ ꯑꯃꯗꯥ, ꯍꯣꯌ’ ꯍꯥꯌꯅꯥ ꯗꯥꯛꯇꯔ ꯁꯥꯑꯣꯅꯥ ꯌꯥꯖꯈꯤ꯫"
actually,ꯇꯁꯦꯡꯕ
"lengthening it.’ The young man stared, uncomprehending",lenging it.’ ꯅꯍꯥ ꯑꯣꯏꯔꯤꯕꯥ ꯃꯤꯑꯣꯏ ꯑꯗꯨꯅꯥ ꯃꯤꯠꯌꯦꯡ ꯊꯝꯂꯒꯥ ꯌꯦꯡꯂꯃꯗꯦ
"‘Soma may make you lose a few years in time,’ the doctor went",‘ꯁꯣꯃꯥꯅꯥ ꯅꯍꯥꯀꯄꯨ ꯃꯇꯃꯒꯤ ꯃꯇꯨꯡ ꯏꯟꯅꯥ ꯆꯍꯤ ꯈꯔꯥ ꯃꯥꯡꯍꯅꯕꯥ ꯌꯥꯏ’ ꯍꯥꯌꯅꯥ ꯗꯣꯛꯇꯔꯅꯥ ꯆꯠꯈꯤ
"on. ‘But think of the enormous, immeasurable durations it can",ꯑꯣꯟ ꯇꯧꯕꯥ꯫
give you out of time. Every soma-holiday is a bit of what our,ꯃꯇꯃꯒꯤ ꯃꯇꯨꯡ ꯏꯟꯅꯥ ꯄꯤꯕꯤꯌꯨ꯫
ancestors used to call eternity.’,ꯏꯄꯥ-ꯏꯄꯨꯁꯤꯡꯅꯥ ꯃꯇꯝ ꯆꯨꯞꯄꯒꯤ ꯑꯣꯏꯅꯥ ꯀꯧꯔꯝꯃꯤ꯫’
181,꯱꯸꯱ꯗꯥ ꯊꯣꯀꯈꯤ꯫
"John began to understand. ‘Eternity was in our lips and eyes,’",ꯌꯣꯍꯥꯟꯅꯥ ꯂꯧꯁꯤꯅꯕꯥ ꯍꯧꯔꯀꯈꯤ꯫
he murmured,ꯃꯍꯥꯛꯅꯥ ꯋꯥꯔꯤ ꯁꯥꯅꯈꯤ ꯫
‘Eh?’,‘ꯏꯍ?’ ꯍꯥꯌꯅꯥ ꯐꯣꯉꯗꯣꯀꯈꯤ꯫
"‘Nothing,’","'ꯀꯔꯤꯝꯇ ꯅꯠꯇꯕ,'"
"‘Of course,’ Dr. Shaw went on, ‘you can’t allow people to go","‘ꯑꯆꯨꯝꯕꯅꯤ,’ ꯗꯥꯛꯇꯔ ꯁꯥꯑꯣꯅꯥ ꯃꯈꯥ ꯇꯥꯅꯥ ꯍꯥꯌꯔꯀꯈꯤ, ‘ꯅꯍꯥꯛꯅꯥ ꯃꯤ ꯆꯠꯄꯥ ꯌꯥꯔꯣꯏ ."
popping off into eternity if they’ve got any serious work to do,ꯀꯔꯤꯒꯨꯝꯕꯥ ꯃꯈꯣꯌꯅꯥ ꯇꯧꯒꯗꯕꯥ ꯑꯀꯅꯕꯥ ꯊꯕꯛ ꯑꯃꯥ ꯐꯪꯂꯕꯗꯤ ꯏꯇꯤꯍꯥꯁꯤꯛ ꯑꯣꯏꯕꯥ ꯃꯑꯣꯡꯗꯥ ꯄꯣꯄꯊꯣꯛꯇꯨꯅꯥ .
But as she hasn’t got any serious work . . .’,ꯑꯗꯨꯕꯨ ꯃꯍꯥꯛꯅꯥ ꯑꯆꯧꯕꯥ ꯊꯕꯛ ꯑꯃꯠꯇꯥ ꯐꯪꯈꯤꯗꯦ .
"‘All the same,’ John persisted, ‘I don’t believe it’s right.’","‘ꯑꯜ ꯑꯃꯃꯝ,’ ꯖꯣꯖꯣꯅꯥ ꯂꯦꯞꯄꯥ ꯂꯩꯇꯅꯥ ꯍꯥꯌꯔꯀꯈꯤ, ‘ꯑꯩꯅꯥ ꯊꯥꯖꯗꯦ’ ꯍꯥꯌꯕꯁꯤ ꯆꯨꯝꯃꯤ꯫"
"The doctor shrugged his shoulders. ‘Well, of course, if you prefer",ꯗꯣꯛꯇꯔꯅꯥ ꯃꯍꯥꯛꯀꯤ ꯈꯨꯠꯁꯥꯁꯤꯡ ꯑꯗꯨ ꯊꯨꯒꯥꯏꯈꯤ꯫
to have her screaming mad all the time . . .’,ꯃꯇꯝ ꯄꯨꯝꯅꯃꯛꯇꯥ ꯃꯍꯥꯛꯀꯤ ꯈꯣꯟꯖꯦꯜ ꯊꯣꯀꯄꯥ .
In the end John was forced to give in. Linda got her soma,"ꯑꯔꯣꯏꯕꯗꯥ ꯌꯣꯍꯥꯟꯅꯥ ꯌꯥꯑꯣꯕꯥ ꯌꯥꯈꯤ, ꯂꯤꯟꯗꯥ ꯃꯍꯥꯛꯀꯤ ꯁꯣꯃꯥ ꯐꯪꯈꯤ꯫"
Thenceforward she remained in her little room on the thirty-,ꯃꯗꯨꯗꯒꯤ ꯃꯍꯥꯛ ꯇꯔꯥꯅꯤꯄꯥꯜ ꯁꯨꯔꯀꯄꯗꯥ ꯃꯍꯥꯛꯀꯤ ꯑꯄꯤꯀꯄꯥ ꯔꯨꯃꯗꯥ ꯂꯩꯈꯤ
"seventh floor of Bernard’s apartment house, in bed, with the","ꯕꯔꯅꯥꯔꯗꯀꯤ ꯑꯦꯄꯥꯔꯇꯃꯦꯟꯇ ꯍꯥꯎꯁꯀꯤ ꯷ꯁꯨꯕꯥ ꯐ꯭ꯂꯣꯔ, ꯐꯃꯨꯡꯗꯥ ꯂꯩꯕꯥ, ."
"radio and television always on, and the patchouli tap just","ꯔꯦꯗꯤꯑꯣ ꯑꯃꯁꯨꯡ ꯇꯦꯂꯤꯚꯤꯖꯟ ꯃꯇꯝ ꯄꯨꯝꯅꯃꯛꯇꯥ ꯑꯣꯟꯊꯣꯛꯂꯤ, ꯑꯃꯁꯨꯡ ꯄꯥꯆꯧꯂꯤ ꯇꯦꯞ ꯑꯁꯤ ꯁꯨꯞꯅꯇꯒꯤ ."
"dripping, and the soma tablets within reach of her hand— there","ꯗ꯭ꯔꯤꯞ ꯇꯧꯕꯥ, ꯑꯃꯁꯨꯡ ꯃꯍꯥꯛꯀꯤ ꯈꯨꯠꯁꯥꯒꯤ ꯃꯅꯥꯛꯇꯥ ꯂꯩꯕꯥ ꯁꯣꯃꯥ ꯇꯦꯕꯂꯁꯤꯡ— ꯃꯐꯝ ꯑꯗꯨꯗꯥ"
"she remained; and yet wasn’t there at all, was all the time away,",ꯃꯍꯥꯛ ꯂꯦꯄꯈꯤ;
"infinitely far away, on holiday; on holiday in some other world,","ꯂꯣꯏꯕꯥ ꯅꯥꯏꯗꯅꯥ ꯂꯥꯞꯅꯥ ꯂꯩꯕꯥ, ꯁꯨꯇꯤꯒꯤ ꯃꯇꯃꯗꯥ;"
where the music of the radio was a labyrinth of sonorous,ꯃꯐꯝ ꯑꯗꯨꯗꯥ ꯔꯦꯗꯤꯑꯣꯒꯤ ꯃ꯭ꯌꯨꯖꯤꯛ ꯑꯁꯤ ꯁꯣꯅꯣꯔꯣꯁꯀꯤ ꯂꯦꯕꯤꯔꯤꯟꯊ ꯑꯃꯥ ꯑꯣꯏꯔꯝꯃꯤ .
"colours, a sliding, palpitating labyrinth, that led (by what","ꯃꯆꯨꯁꯤꯡ, ꯁ꯭ꯂꯥꯏꯗꯤꯡ ꯑꯃꯥ, ꯄꯥꯂꯄꯤꯇꯦꯇꯤꯡ ꯂꯦꯕꯤꯔꯤꯟꯊ, ꯃꯗꯨ ꯑꯦꯜ.ꯏ.ꯗꯤ.(ꯀꯔꯤꯅꯥ ."
beautifully inevitable windings) to a bright centre of absolute,ꯐꯖꯅꯥ ꯇꯉꯥꯏꯐꯗꯕꯥ ꯋꯥꯏꯟꯗꯤꯡꯁꯤꯡ) ꯑꯁꯤ ꯑꯦꯕꯁꯣꯜꯌꯨꯇꯀꯤ ꯃꯉꯥꯜ ꯌꯥꯑꯣꯕꯥ ꯁꯦꯟꯇꯔ ꯑꯃꯗꯥ
conviction; where the dancing images of the television box were,ꯋꯥꯌꯦꯜ ꯄꯤꯕꯥ;
the performers in some indescribably delicious all-singing feely;,ꯐꯣꯡꯗꯣꯀꯄꯥ ꯉꯃꯗꯕꯥ ꯃꯆꯤꯟ-ꯃꯅꯥꯑꯣ ꯑꯣꯏꯕꯥ ꯑꯜ-ꯁꯤꯡ ꯐꯤꯜ ꯈꯔꯗꯥ ꯄꯔꯐꯣꯔꯃꯔꯁꯤꯡ;
"where the dripping patchouli was more than scent—was the sun,","ꯃꯐꯝ ꯑꯗꯨꯗꯥ ꯗ꯭ꯔꯤꯄꯤꯡ ꯄꯥꯆꯧꯂꯤꯅꯥ ꯃꯍꯤꯛ ꯍꯦꯟꯅꯥ ꯌꯥꯑꯣꯔꯝꯃꯤ—ꯅꯨꯃꯤꯠ ꯑꯗꯨꯅꯤ,"
"was a million sexophones, was Popé making love, only much","ꯋꯥꯁ ꯑꯦ ꯃꯤꯂꯤꯌꯟ ꯁꯦꯛꯁꯣꯐꯣꯟ, ꯋꯥꯁ ꯄꯣꯞ ꯃꯦꯀꯤꯡ ꯂꯥꯚ, ꯁꯨꯞꯅꯇꯒꯤ ꯌꯥꯝꯅꯥ"
"more so, incomparably more, and without end","ꯍꯦꯟꯅꯥ, ꯆꯥꯡꯗꯝꯅꯕꯥ ꯌꯥꯗꯕꯥ ꯃꯑꯣꯡꯗꯥ, ꯑꯃꯁꯨꯡ ꯂꯣꯏꯕꯥ ꯅꯥꯏꯗꯅꯥ"
182,꯱꯸꯲ꯗꯥ ꯊꯣꯀꯈꯤ꯫
"‘No, we can’t rejuvenate. But I’m very glad,’ Dr. Shaw had","‘ꯅꯠꯇꯦ, ꯑꯩꯈꯣꯌꯅꯥ ꯅꯧꯅꯥ ꯁꯦꯃꯒꯠꯄꯥ ꯉꯃꯗꯦ꯫"
"concluded, ‘to have had this opportunity to see an example of","ꯂꯣꯏꯁꯤꯜꯂꯀꯄꯗꯥ, ‘ꯇꯨꯡꯗꯥ ꯈꯨꯗꯝ ꯑꯃꯥ ꯌꯦꯡꯅꯕꯒꯤ ꯈꯨꯗꯣꯡꯆꯥꯕꯥ ꯑꯁꯤ ꯐꯪꯂꯕꯅꯤꯅꯥ ."
senility in a human being. Thank you so much for calling me in.’,ꯃꯤꯑꯣꯏꯕꯥ ꯑꯃꯗꯥ ꯁꯦꯅꯤꯂꯤꯇꯤ ꯂꯩꯕꯥ꯫
He shook Bernard warmly by the hand,ꯃꯍꯥꯛꯅꯥ ꯕꯦꯔꯅꯥꯔꯗꯄꯨ ꯈꯨꯠꯅꯥ ꯆꯦꯠꯅꯥ ꯊꯃꯈꯤ
"It was John, then, they were all after. And as it was only through","ꯃꯗꯨ ꯌꯣꯍꯥꯅꯅꯤ, ꯃꯗꯨꯒꯤ ꯃꯇꯨꯡꯗꯥ, ꯃꯈꯣꯌ ꯄꯨꯝꯅꯃꯛ ꯃꯇꯨꯡꯗꯥ ꯂꯩꯔꯝꯃꯤ꯫"
"Bernard, his accredited guardian, that John could be seen,","ꯕꯔꯅꯥꯔꯗ, ꯃꯍꯥꯛꯀꯤ ꯑꯦꯛꯔꯦꯗꯤꯇꯦꯗ ꯒꯥꯔꯖꯤꯌꯥꯟ, ꯖꯣꯟꯗꯥ ꯎꯕꯥ ꯐꯪꯒꯅꯤ,"
"Bernard now found himself, for the first time in his life, treated","ꯕꯔꯅꯥꯔꯗꯅꯥ ꯍꯧꯖꯤꯛ ꯃꯁꯥꯃꯀꯄꯨ, ꯃꯍꯥꯛꯀꯤ ꯄꯨꯟꯁꯤꯗꯥ ꯑꯍꯥꯅꯕꯥ ꯑꯣꯏꯅꯥ ꯂꯥꯌꯦꯡꯈꯤꯕꯥ ꯑꯗꯨ ꯐꯪꯂꯦ꯫"
"not merely normally, but as a person of outstanding","ꯁꯨꯞꯅꯒꯤ ꯅꯣꯔꯃꯦꯜ ꯑꯣꯏꯅꯥ, ꯑꯗꯨꯕꯨ ꯃꯁꯛ ꯊꯣꯀꯄꯥ ꯃꯤꯑꯣꯏ ꯑꯃꯥ ꯑꯣꯏꯅꯥ ."
importance. There was no more talk of the alcohol in his blood-,ꯃꯔꯨꯑꯣꯏꯕꯥ꯫
"surrogate, no gibes at his personal appearance. Henry Foster","ꯁꯔꯣꯒꯦꯠ, ꯃꯍꯥꯛꯀꯤ ꯂꯅꯥꯏꯒꯤ ꯑꯣꯏꯕꯥ ꯃꯑꯣꯡꯗꯥ ꯒꯤꯕ ꯑꯃꯠꯇꯥ ꯂꯩꯇꯦ꯫"
went out of his way to be friendly; Benito Hoover made him a,ꯃꯔꯨꯞ ꯑꯣꯏꯕꯒꯤ ꯂꯝꯕꯤꯗꯒꯤ ꯂꯥꯞꯅꯥ ꯂꯩꯈꯤ;
present of six packets of sex- hormone chewing-gum; the,ꯁꯦꯛꯁ- ꯍꯣꯔꯃꯣꯟ ꯆ꯭ꯌꯨꯏꯪ-ꯒꯃꯒꯤ ꯄꯦꯀꯦꯠ ꯶ꯀꯤ ꯄ꯭ꯔꯦꯖꯦꯟꯇ;
