en,mni-Mtei
"32. Happy are the Kshatriyas, O Arjuna, who are called upon to fight in such a battle that","꯳꯲.ꯅꯨꯡꯉꯥꯏꯕꯥ ꯑꯁꯤ ꯀ꯭ꯁꯠꯔꯤꯌꯁꯤꯡꯅꯤ, ꯍꯦ ꯑꯔꯖꯨꯟ, ꯃꯈꯣꯌꯅꯥ ꯑꯁꯤꯒꯨꯝꯕꯥ ꯂꯥꯟ ꯑꯃꯗꯥ ꯂꯥꯟꯊꯦꯡꯅꯅꯕꯥ ꯀꯧꯔꯤ ꯃꯗꯨꯗꯤ ."
comes of itself as an open door to heaven!,ꯁ꯭ꯕꯔꯒꯒꯤ ꯑꯍꯥꯡꯕꯥ ꯊꯣꯡ ꯑꯃꯥ ꯑꯣꯏꯅꯥ ꯃꯁꯥ ꯃꯊꯟꯇꯥ ꯂꯥꯀꯏ!
COMMENTARY: The scriptures declare that if a warrior dies for a righteous cause on the,ꯀꯃꯦꯟꯇꯔꯤ: ꯁꯥꯁ꯭ꯠꯔꯅꯥ ꯂꯥꯎꯊꯣꯀꯏ ꯃꯗꯨꯗꯤ ꯀꯔꯤꯒꯨꯝꯕꯥ ꯂꯥꯟꯃꯤ ꯑꯃꯅꯥ ꯑꯆꯨꯝꯕꯥ ꯃꯔꯝ ꯑꯃꯒꯤꯗꯃꯛ ꯁꯤꯔꯕꯗꯤ .
battlefield he at once ascends to heaven,ꯂꯥꯅꯐꯝ ꯑꯁꯤ ꯃꯍꯥꯛꯅꯥ ꯈꯨꯗꯛꯇꯥ ꯁ꯭ꯕꯔꯒꯗꯥ ꯆꯠꯂꯤ .
Atha chettwam imam dharmyam samgraamam na karishyasi;,ꯑꯥꯊꯥ ꯆ꯭ꯌꯥꯠꯇꯋꯥꯝ ꯏꯃꯥꯝ ꯙꯔꯝꯌꯝ ꯁꯝꯔꯥꯝꯝ ꯅꯥ ꯀꯔꯤꯁꯤꯌꯁꯤ;
Tatah swadharmam keertim cha hitwaa paapam avaapsyasi,ꯇꯥꯇꯥꯍ ꯁ꯭ꯕꯥꯙꯔꯝꯃꯝ ꯀꯤꯔꯇꯤꯝ ꯆꯥ ꯍꯤꯇꯋꯥꯌꯥ ꯄꯥꯄꯝ ꯑꯚꯥꯄꯁ꯭ꯌꯥꯁꯤ
"33. But, if thou wilt not fight in this righteous war, then, having abandoned thine duty and","33. ꯑꯗꯨꯕꯨ, ꯀꯔꯤꯒꯨꯝꯕꯥ ꯅꯍꯥꯛꯅꯥ ꯑꯆꯨꯝꯕꯥ ꯂꯥꯟ ꯑꯁꯤꯗꯥ ꯂꯥꯟꯊꯦꯡꯅꯔꯣꯏꯗꯕꯅꯤ, ꯃꯗꯨꯒꯤ ꯃꯇꯨꯡꯗꯥ, ꯅꯍꯥꯛꯀꯤ ꯗ꯭ꯌꯨꯇꯤ ꯑꯃꯁꯨꯡ ."
"fame, thou shalt incur sin","ꯃꯤꯡꯆꯠ, ꯅꯍꯥꯛꯅꯥ ꯄꯥꯞ ꯇꯧꯔꯀꯄꯅꯤ"
Akeertim chaapi bhootaani kathayishyanti te’vyayaam;,ꯑꯀꯦꯔꯇꯤꯝ ꯆꯥꯌꯥꯄꯤ ꯚꯨꯇꯥꯅꯤ ꯀꯥꯊꯥꯌꯁꯤꯌꯥꯟꯇꯤ ꯇꯦ’ꯕ꯭ꯌꯌꯥꯌꯝ;
Sambhaavitasya chaakeertir maranaad atirichyate,ꯁꯥꯃꯚꯥꯚꯤꯇꯥꯁ꯭ꯌꯥ ꯆꯥꯀꯦꯌꯔꯇꯤꯔ ꯃꯔꯥꯅꯥꯗ ꯑꯥꯇꯤꯔꯤꯆ꯭ꯌꯥꯇꯦ
"34. People, too, will recount thy everlasting dishonour; and to one who has been honoured,","꯳꯴.ꯃꯤꯑꯣꯏꯕꯁꯨ, ꯅꯍꯥꯛꯀꯤ ꯂꯣꯝꯕꯥ ꯅꯥꯏꯗꯕꯥ ꯏꯀꯥꯌꯈꯨꯝꯅꯕꯥ ꯑꯗꯨ ꯑꯃꯨꯛ ꯍꯟꯅꯥ ꯐꯣꯡꯗꯣꯛꯀꯅꯤ;"
dishonour is worse than death,ꯗꯤꯁꯣꯅꯔ ꯑꯁꯤ ꯁꯤꯕꯗꯒꯤ ꯍꯦꯟꯅꯥ ꯐꯠꯇꯕꯥ ꯑꯣꯏꯔꯤ .
Bhayaad ranaad uparatam mamsyante twaam mahaarathaah;,ꯚꯌꯥꯗ ꯔꯥꯅꯥꯗ ꯎꯄꯔꯥꯇꯝ ꯃꯃꯁ꯭ꯌꯥꯟꯇꯦ ꯇꯋꯥꯝ ꯃꯍꯥꯔꯥꯊꯥꯍ;
Yeshaam cha twam bahumato bhootwaa yaasyasi laaghavam,ꯌꯦꯁꯥꯝ ꯆꯥ ꯇꯋꯥꯝ ꯕꯥꯍꯨꯃꯥꯇꯣ ꯚꯨꯇꯋꯥꯌꯥ ꯌꯥꯁꯌꯁꯤ ꯂꯘꯕꯝ
35. The great car-warriors will think that thou hast withdrawn from the battle through fear;,꯳꯵.ꯑꯆꯧꯕꯥ ꯒꯥꯔꯤ-ꯋꯥꯔꯤꯌꯔꯁꯤꯡꯅꯥ ꯅꯍꯥꯛꯅꯥ ꯑꯀꯤꯕꯒꯤ ꯈꯨꯠꯊꯥꯡꯗꯥ ꯂꯥꯟ ꯑꯗꯨꯗꯒꯤ ꯂꯥꯄꯊꯣꯀꯈꯤ ꯍꯥꯌꯅꯥ ꯈꯜꯂꯒꯅꯤ;
and thou wilt be lightly held by them who have thought much of thee,ꯑꯃꯁꯨꯡ ꯅꯍꯥꯛꯅꯥ ꯃꯈꯣꯌꯒꯤ ꯃꯔꯃꯗꯥ ꯌꯥꯝꯅꯥ ꯋꯥꯅꯥ ꯈꯜꯂꯝꯕꯥ ꯃꯈꯣꯌꯅꯥ ꯂꯥꯏꯅꯥ ꯊꯝꯕꯤꯒꯅꯤ꯫
Avaachyavaadaamshcha bahoon vadishyanti tavaahitaah;,ꯑꯚꯥꯆ꯭ꯌꯕꯗꯃꯁ꯭ꯆ ꯕꯥꯍꯨꯟ ꯕꯗꯤꯁ꯭ꯌꯥꯟꯇꯤ ꯇꯥꯚꯥꯍꯤꯇꯥꯍ;
Nindantastava saamarthyam tato duhkhataram nu kim,ꯅꯤꯟꯗꯁ꯭ꯇꯥꯚꯥ ꯁꯥꯃꯔꯠꯌꯝ ꯇꯥꯇꯣ ꯗꯨꯍꯈꯥꯇꯔꯥꯝ ꯅꯨ ꯀꯤꯝ
"36. Thy enemies also, cavilling at thy power, will speak many abusive words. What is more","꯳꯶.ꯅꯍꯥꯛꯀꯤ ꯌꯦꯛꯅꯕꯁꯤꯡꯁꯨ, ꯅꯍꯥꯛꯀꯤ ꯁꯛꯇꯤꯗꯥ ꯀꯦꯚꯤꯂꯤꯡ ꯇꯧꯕꯥ, ꯂꯥꯟꯅꯥ ꯋꯥꯍꯩ ꯀꯌꯥ ꯉꯥꯡꯒꯅꯤ꯫"
painful than this!,ꯃꯁꯤꯗꯒꯤ ꯍꯦꯟꯅꯥ ꯑꯋꯥꯕꯥ!
Hato vaa praapsyasi swargam jitwaa vaa bhokshyase maheem;,ꯍꯥꯇꯣ ꯋꯥꯌꯥ ꯄ꯭ꯔꯄꯁ꯭ꯌꯁꯤ ꯁ꯭ꯕꯔꯒ ꯖꯤꯠꯋꯥ ꯋꯥꯌꯥ ꯚꯣꯛꯁꯍ꯭ꯌꯥꯁꯦ ꯃꯍꯤꯝ;
Tasmaad uttishtha kaunteya yuddhaaya kritanishchayah,ꯇꯥꯁꯃꯥꯗ ꯎꯠꯇꯤꯁ꯭ꯊꯥ ꯀꯥꯎꯟꯇꯦꯌꯥ ꯌꯨꯗ꯭ꯙꯥꯌꯥ ꯀ꯭ꯔ꯭ꯏꯠꯅꯁ꯭ꯆꯌꯥꯍ
"37. Slain, thou wilt obtain heaven; victorious, thou wilt enjoy the earth; therefore, stand up,","37. ꯁꯤꯕꯥ, ꯅꯍꯥꯛꯅꯥ ꯁ꯭ꯕꯔꯒ ꯐꯪꯕꯤꯌꯨ;"
"O son of Kunti, resolved to fight!","o ꯀꯨꯟꯇꯤꯒꯤ ꯃꯆꯥꯅꯨꯄꯥ, ꯂꯥꯟꯊꯦꯡꯅꯅꯕꯥ ꯋꯥꯔꯦꯞ ꯂꯧꯈꯤ!"
Sukhaduhkhe same kritwaa laabhaalaabhau jayaajayau;,ꯁꯨꯈꯥꯗꯨꯍ꯭ꯈꯦ ꯁꯦꯝ ꯀ꯭ꯔ꯭ꯏꯠꯋꯥ ꯂꯥꯚꯥꯂꯥꯑꯚꯧ ꯖꯌꯖꯌꯥꯎ;
Tato yuddhaaya yujyaswa naivam paapamavaapsyasi,ꯇꯥꯇꯣ ꯌꯨꯗ꯭ꯙꯥꯌꯥ ꯌꯨꯖ꯭ꯌꯁꯋꯥ ꯅꯕꯝ ꯄꯥꯄꯃꯥꯚꯥꯄꯁ꯭ꯌꯁꯤ
23,꯲꯳ ꯑꯃꯁꯨꯡ ꯲꯳꯫
BHAGAVAD GITA,ꯚꯒꯕꯠ ꯒꯤꯇꯥ
"38. Having made pleasure and pain, gain and loss, victory and defeat the same, engage thou","38. ꯅꯨꯡꯉꯥꯏꯕꯥ ꯑꯃꯁꯨꯡ ꯑꯋꯥꯕꯥ, ꯀꯥꯟꯅꯕꯥ ꯑꯃꯁꯨꯡ ꯃꯥꯉꯕꯥ, ꯃꯥꯏꯄꯥꯀꯄꯥ ꯑꯃꯁꯨꯡ ꯆꯞ ꯃꯥꯟꯅꯕꯥ ꯃꯥꯏꯊꯤꯕꯥ ꯄꯤꯔꯕꯥ, ꯅꯍꯥꯛꯅꯥ ."
in battle for the sake of battle; thus thou shalt not incur sin,ꯂꯥꯅꯒꯤꯗꯃꯛ ꯂꯥꯅꯐꯃꯗꯥ;
COMMENTARY: This is the Yoga of equanimity or the doctrine of poise in action. If a,ꯀꯃꯦꯟꯇꯔꯤ: ꯃꯁꯤ ꯏꯀꯨꯏꯇꯤꯒꯤ ꯌꯣꯒ ꯅꯠꯔꯒꯥ ꯗꯣꯛꯠꯔꯤꯟ ꯑꯣꯐ ꯄꯣꯏꯖ ꯏꯟ ꯑꯦꯛꯁꯅꯅꯤ꯫
"person performs actions with the above mental attitude, he will not reap the fruits of such actions","ꯃꯤꯑꯣꯏ ꯑꯗꯨꯅꯥ ꯃꯊꯛꯇꯥ ꯄꯅꯈ꯭ꯔꯤꯕꯥ ꯋꯥꯈꯜꯂꯣꯟ ꯑꯁꯤꯒꯥ ꯂꯣꯌꯅꯅꯥ ꯑꯦꯛꯁꯅꯁꯤꯡ ꯄꯥꯡꯊꯣꯀꯏ, ꯃꯍꯥꯛꯅꯥ ꯑꯁꯤꯒꯨꯝꯕꯥ ꯊꯕꯀꯁꯤꯡ ꯑꯁꯤꯒꯤ ꯃꯍꯩꯁꯤꯡ ꯑꯗꯨ ꯐꯪꯂꯣꯏ"
Eshaa te’bhihitaa saankhye buddhir yoge twimaam shrinu;,ꯑꯦꯁꯥꯌꯥ ꯇꯦ’ꯚꯤꯍꯤꯇꯥ ꯁꯥꯅꯈꯦ ꯕꯨꯗ꯭ꯙꯤꯔ ꯌꯣꯒꯦ ꯇ꯭ꯕꯤꯃꯥꯝ ꯁ꯭ꯔꯤꯅꯨ;
Buddhyaa yukto yayaa paartha karma bandham prahaasyasi,ꯕꯨꯗ꯭ꯙꯌꯥ ꯌꯨꯛꯇꯣ ꯌꯥꯌꯥ ꯄꯥꯔꯊꯥ ꯀꯔꯝ ꯕꯟꯗꯝ ꯄ꯭ꯔꯍꯥꯁꯌꯁꯤ
"39. This which has been taught to thee, is wisdom concerning Sankhya. Now listen to","꯳꯹.ꯑꯗꯣꯃꯗꯥ ꯇꯝꯕꯤꯈꯤꯕꯥ ꯑꯁꯤ, ꯁꯪꯈ꯭ꯌꯥꯒꯤ ꯃꯇꯥꯡꯗꯥ ꯂꯧꯁꯤꯡꯅꯤ꯫"
"wisdom concerning Yoga, endowed with which, O Arjuna, thou shalt cast off the bonds of action!","ꯌꯣꯒꯒꯥ ꯃꯔꯤ ꯂꯩꯅꯕꯥ ꯂꯧꯁꯤꯡ, ꯃꯗꯨꯒꯥ ꯂꯣꯌꯅꯅꯥ, ꯍꯦ ꯑꯔꯖꯨꯅꯥ, ꯅꯍꯥꯛꯅꯥ ꯑꯦꯛꯁꯅꯒꯤ ꯕꯣꯟꯗꯁꯤꯡ ꯊꯥꯗꯣꯀꯈꯤ!"
Nehaabhikramanaasho’sti pratyavaayo na vidyate;,ꯅꯦꯍꯥꯚꯤꯛꯔꯃꯥꯅꯁꯣ’ꯁ꯭ꯇꯤ ꯄ꯭ꯔꯠꯌꯕꯌꯣ ꯅꯥ ꯚꯤꯗ꯭ꯌꯥꯠ;
Swalpam apyasya dharmasya traayate mahato bhayaat,ꯁ꯭ꯕꯥꯂꯄꯥꯝ ꯑꯞꯌꯁ꯭ꯌ ꯙꯔꯃꯁ꯭ꯌ ꯇ꯭ꯔꯥꯌꯥꯌꯦꯠ ꯃꯍꯥꯇꯣ ꯚꯌꯥꯠ
"40. In this there is no loss of effort, nor is there any harm (the production of contrary results","꯴꯰.ꯃꯁꯤꯗꯥ ꯍꯣꯠꯅꯕꯥ ꯑꯃꯥ ꯃꯥꯡꯈꯤꯕꯥ ꯂꯩꯇꯦ, ꯅꯠꯔꯒꯥ ꯑꯋꯥꯕꯥ ꯑꯃꯠꯇꯥ ꯂꯩꯇꯦ (ꯀꯟꯠꯔꯔꯤ ꯔꯤꯖꯜꯇꯁꯤꯡ ꯄꯨꯊꯣꯀꯄꯗꯥ ."
or transgression). Even a little of this knowledge (even a little practice of this Yoga) protects one,ꯅꯠꯠꯔꯒꯥ ꯇ꯭ꯔꯥꯟꯁꯒ꯭ꯔꯦꯁꯟ ꯇꯧꯕꯥ)꯫
from great fear,ꯑꯆꯧꯕꯥ ꯑꯀꯤꯕꯥ ꯑꯃꯗꯒꯤ
COMMENTARY: In Karma Yoga (selfless action) even a little effort brings immediate,ꯀꯃꯦꯟꯇꯔꯤ: ꯀꯔꯃꯥ ꯌꯣꯒ (ꯁꯦꯜꯐꯂꯦꯁ ꯑꯦꯛꯁꯟ)ꯗꯥ ꯈꯔꯥ ꯍꯣꯠꯅꯕꯅꯥ ꯈꯨꯗꯛꯇꯥ ꯄꯨꯔꯀꯏ
purification of the heart. Purification of the heart leads to fearlessness,ꯊꯝꯃꯣꯌꯒꯤ ꯁꯨꯡꯗꯣꯀꯄꯥ꯫
Vyavasaayaatmikaa buddhir ekeha kurunandana;,ꯋ꯭ꯌꯥꯚꯥꯁꯥꯌꯥꯠꯃꯤꯀꯥ ꯕꯨꯗ꯭ꯙꯤꯔ ꯑꯦꯀꯦꯍꯥ ꯀꯨꯔꯨꯅꯥꯟꯗꯅꯥ;
Bahushaakhaa hyanantaashcha buddhayo’vyavasaayinaam,ꯕꯥꯍꯨꯁꯥꯌꯥꯈꯥꯌꯥ ꯍꯤꯌꯥꯅꯇꯥꯁ꯭ꯆꯥ ꯕꯨꯗ꯭ꯙꯌꯣ’ꯕ꯭ꯌꯕꯁꯥꯌꯅꯥꯝ
"41. Here, O joy of the Kurus, there is a single one-pointed determination! Many-branched","꯴꯱.ꯃꯐꯝ ꯑꯁꯤꯗꯥ, ꯍꯦ ꯀꯨꯔꯨꯁꯤꯡꯒꯤ ꯍꯔꯥꯑꯣꯕꯥ, ꯋꯥꯟ-ꯄꯣꯏꯟꯇ ꯗꯤꯇꯔꯃꯤꯅꯦꯁꯟ ꯑꯃꯥ ꯂꯩꯔꯤ!"
and endless are the thoughts of the irresolute,ꯑꯃꯁꯨꯡ ꯂꯣꯏꯕꯥ ꯅꯥꯏꯗꯕꯥ ꯑꯁꯤ ꯑꯥꯏꯔꯦꯁꯣꯜꯌꯨꯇꯀꯤ ꯋꯥꯈꯜꯂꯣꯅꯁꯤꯡꯅꯤ .
Yaam imaam pushpitaam vaacham pravadantyavipashchitah;,ꯌꯥꯝ ꯏꯃꯥꯝ ꯄꯨꯁꯄꯤꯇꯝ ꯋꯥꯆꯝ ꯄ꯭ꯔꯕꯗꯟꯠꯌꯚꯤꯄꯥꯁ꯭ꯆꯤꯇꯥꯍ;
Vedavaadarataah paartha naanyad asteeti vaadinah,ꯕꯦꯗꯥꯚꯥꯗꯥꯔꯥꯇꯥꯍ ꯄꯥꯔꯊꯥ ꯅꯥꯅꯌꯥꯗ ꯑꯁ꯭ꯇꯦꯇꯤ ꯋꯥꯗꯤꯅꯥꯍ
"42. Flowery speech is uttered by the unwise, who take pleasure in the eulogising words of","꯴꯲.ꯐ꯭ꯂꯥꯑꯣꯌꯥꯔ ꯁ꯭ꯄꯤꯆ ꯑꯁꯤ ꯂꯧꯁꯤꯡ ꯂꯩꯇꯕꯥ ꯃꯤꯑꯣꯏꯁꯤꯡꯅꯥ ꯐꯣꯡꯗꯣꯀꯏ, ꯃꯈꯣꯌꯅꯥ ꯏꯎꯂꯣꯖꯤꯛ ꯑꯣꯏꯕꯥ ꯋꯥꯍꯩꯁꯤꯡꯗꯥ ꯅꯨꯡꯉꯥꯏꯕꯥ ꯂꯧꯏ꯫"
"the Vedas, O Arjuna, saying: “There is nothing else!”","ꯕꯦꯗꯁꯤꯡ, ꯑꯣ ꯑꯔꯖꯨꯟ, ꯍꯥꯌꯔꯒꯥ: “ꯑꯇꯣꯞꯄꯥ ꯑꯃꯠꯇꯥ ꯂꯩꯇꯦ!”"
COMMENTARY: Unwise people who lack discrimination place great stress upon the,ꯀꯃꯦꯟꯇꯔꯤ: ꯈꯦꯟꯅꯕꯥ ꯂꯩꯇꯕꯥ ꯃꯤꯑꯣꯏꯁꯤꯡꯅꯥ ꯈꯦꯟꯅꯕꯥ ꯊꯃꯗꯕꯥ ꯃꯤꯑꯣꯏꯁꯤꯡꯅꯥ ꯑꯆꯧꯕꯥ ꯁ꯭ꯠꯔꯦꯁ ꯂꯩꯍꯜꯂꯤ .
Karma Kanda or ritualistic portion of the Vedas which lays down specific rules for specific actions,ꯀꯔꯝ ꯀꯥꯟꯗꯥ ꯅꯠꯔꯒꯥ ꯑꯀꯛꯅꯕꯥ ꯊꯕꯀꯁꯤꯡꯒꯤꯗꯃꯛ ꯑꯀꯛꯅꯕꯥ ꯀꯥꯡꯂꯣꯅꯁꯤꯡ ꯊꯝꯂꯤꯕꯥ ꯕꯦꯗꯀꯤ ꯔꯤꯇꯨꯌꯦꯂꯤꯁ꯭ꯇꯤꯛ ꯑꯣꯏꯕꯥ ꯁꯔꯨꯛ
for the attainment of specific fruit. They extol these actions and rewards unduly,ꯑꯀꯛꯅꯕꯥ ꯃꯍꯩ ꯃꯔꯣꯡꯁꯤꯡ ꯐꯪꯅꯕꯒꯤꯗꯃꯛ꯫
Kaamaatmaanah swargaparaa janmakarmaphalapradaam;,ꯀꯥꯃꯥꯇꯃꯥꯅꯍ ꯁ꯭ꯕꯥꯔꯒꯥꯄꯥꯔꯥ ꯖꯟꯃꯥꯀꯔꯃꯐꯂꯥꯞꯔꯗꯥꯝ;
Kriyaavisheshabahulaam bhogaishwaryagatim prati,kriyaavishesabahulaam ꯚꯣꯒꯥꯏꯁ꯭ꯕꯔꯒꯥꯇꯤꯝ ꯄ꯭ꯔꯇꯤ
"43. Full of desires, having heaven as their goal, they utter speech which promises birth as the","꯴꯳.ꯑꯄꯥꯝꯕꯁꯤꯡꯅꯥ ꯊꯜꯂꯕꯥ, ꯁ꯭ꯕꯔꯒ ꯑꯁꯤ ꯃꯈꯣꯌꯒꯤ ꯄꯥꯟꯗꯝ ꯑꯣꯏꯅꯥ ꯂꯧꯗꯨꯅꯥ, ꯃꯈꯣꯌꯅꯥ ꯋꯥ ꯉꯥꯡꯕꯥ ꯑꯗꯨ ꯋꯥꯁꯀꯈꯤ ꯃꯗꯨꯗꯤ ꯃꯈꯣꯌꯅꯥ ꯄꯣꯛꯂꯤ ꯍꯥꯌꯅꯥ ꯋꯥꯁꯀꯈꯤ ꯃꯗꯨꯗꯤ"
"reward of one’s actions, and prescribe various specific actions for the attainment of pleasure and","ꯀꯅꯥꯒꯨꯝꯕꯥ ꯑꯃꯒꯤ ꯊꯕꯀꯁꯤꯡꯒꯤ ꯃꯅꯥ ꯄꯤꯕꯥ, ꯑꯃꯁꯨꯡ ꯅꯨꯡꯉꯥꯏꯕꯥ ꯐꯪꯅꯕꯒꯤꯗꯃꯛ ꯇꯣꯉꯥꯟ ꯇꯣꯉꯥꯅꯕꯥ ꯑꯀꯛꯅꯕꯥ ꯊꯕꯀꯁꯤꯡ ꯂꯦꯄꯊꯣꯀꯄꯥ ꯑꯃꯁꯨꯡ"
power,ꯄꯥꯡꯒꯜ
Bhogaishwarya prasaktaanaam tayaapahritachetasaam;,ꯚꯣꯒꯥꯏꯁ꯭ꯕꯔꯌ ꯄ꯭ꯔꯁꯀꯇꯥꯅꯝ ꯇꯥꯌꯥꯑꯥꯄꯥꯍꯔꯤꯇꯥꯆꯦꯇꯥꯁꯥꯝ;
24,꯲꯴ ꯑꯃꯁꯨꯡ ꯲꯴.
SANKHYA YOGA,ꯁꯪꯈ꯭ꯌ ꯌꯣꯒ
Vyavasaayaatmikaa buddhih samaadhau na vidheeyate,ꯋ꯭ꯌꯥꯚꯥꯁꯥꯌꯥꯇꯃꯤꯀꯥꯌꯥ ꯕꯨꯗ꯭ꯙꯤꯍ ꯁꯃꯥꯗꯍꯧ ꯅꯥ ꯚꯤꯙꯦꯌꯦꯌꯇꯦ
"44. For those who are much attached to pleasure and to power, whose minds are drawn away","꯴꯴.ꯅꯨꯡꯉꯥꯏꯕꯥ ꯑꯃꯁꯨꯡ ꯁꯛꯇꯤꯒꯥ ꯌꯥꯝꯅꯥ ꯃꯔꯤ ꯂꯩꯅꯕꯥ ꯃꯤꯑꯣꯏꯁꯤꯡꯒꯤꯗꯃꯛ, ꯃꯈꯣꯌꯒꯤ ꯋꯥꯈꯜ ꯑꯗꯨ ꯂꯧꯊꯣꯛꯇꯨꯅꯥ ."
"by such teaching, that determinate faculty is not manifest that is steadily bent on meditation and","ꯑꯁꯤꯒꯨꯝꯕꯥ ꯇꯝꯕꯤꯕꯥ ꯑꯁꯤꯅꯥ, ꯑꯗꯨꯒꯨꯝꯕꯥ ꯗꯤꯇꯔꯃꯤꯅꯦꯠ ꯐꯦꯀꯜꯇꯤ ꯑꯁꯤ ꯃꯦꯗꯤꯇꯦꯁꯟꯗꯥ ꯂꯦꯞꯄꯥ ꯂꯩꯇꯅꯥ ꯂꯦꯡꯗꯅꯥ ꯂꯩꯔꯤꯕꯥ ꯃꯌꯦꯛ ꯁꯦꯡꯗꯦ ꯑꯃꯁꯨꯡ ."
Samadhi (the state of Superconsciousness),ꯁꯃꯥꯙꯤ (ꯁꯨꯄꯥꯔꯀꯟꯁꯤꯑꯦꯟꯁꯀꯤ ꯐꯤꯚꯝ)
Traigunyavishayaa vedaa nistraigunyo bhavaarjuna;,TRAIGUNYAVISHAYA VADAA ꯅꯤꯁ꯭ꯠꯔꯥꯒꯨꯟꯌꯣ ꯚꯥꯕꯥꯔꯖꯨꯅꯥ;
Nirdwandwo nityasatwastho niryogakshema aatmavaan,ꯅꯤꯔꯗꯋꯥꯟꯗꯋꯣ ꯅꯤꯠꯌꯥꯁꯥꯇꯋꯥꯁꯊꯣ ꯅꯤꯔꯌꯣꯒꯛꯁꯦꯃꯥ ꯑꯥꯇꯃꯥꯚꯥꯟ
"45. The Vedas deal with the three attributes (of Nature); be thou above these three attributes,",꯴꯵.ꯕꯦꯗꯁꯤꯡꯅꯥ ꯑꯦꯠꯔꯤꯕ꯭ꯌꯨꯠ ꯑꯍꯨꯝ (ꯃꯍꯧꯁꯥꯒꯤ);
O Arjuna! Free yourself from the pairs of opposites and ever remain in the quality of Sattwa,ꯑꯣ ꯑꯔꯖꯨꯅꯥ!
"(goodness), freed from the thought of acquisition and preservation, and be established in the Self","(ꯑꯐꯕꯥ), ꯑꯦꯛꯕꯤꯖꯤꯁꯟ ꯑꯃꯁꯨꯡ ꯄ꯭ꯔꯤꯖꯥꯔꯕ ꯇꯧꯕꯒꯤ ꯋꯥꯈꯂꯗꯒꯤ ꯅꯥꯟꯊꯣꯀꯍꯅꯕꯥ, ꯑꯃꯁꯨꯡ ꯃꯁꯥꯗꯥ ꯂꯤꯡꯈꯠꯄꯥ"
COMMENTARY: Guna means attribute or quality. It is substance as well as quality,ꯀꯃꯦꯟꯇꯔꯤ: ꯒꯨꯅꯥ ꯍꯥꯌꯕꯁꯤ ꯑꯦꯠꯔꯤꯕ꯭ꯌꯨꯠ ꯅꯠꯔꯒꯥ ꯀ꯭ꯕꯥꯂꯤꯇꯤ ꯍꯥꯌꯕꯅꯤ꯫
"Nature is made up of three Gunas—Sattwa (purity, light, harmony), Rajas (passion, restlessness,","ꯃꯍꯧꯁꯥ ꯑꯁꯤ ꯒꯨꯟ ꯑꯍꯨꯝꯅꯥ ꯁꯦꯝꯕꯅꯤ—ꯁꯠꯇꯋꯥ (ꯄ꯭ꯌꯨꯔꯤꯇꯤ, ꯃꯉꯥꯜ, ꯍꯥꯔꯃꯣꯅꯤ), ꯔꯥꯖꯥꯁ (ꯄꯥꯝꯕꯤ, ꯋꯥꯈꯜ ꯅꯨꯡꯉꯥꯏꯇꯕꯥ,"
"motion), and Tamas (inertia, darkness). The pairs of opposites are pleasure and pain, heat and cold,","ꯃꯣꯁꯟ), ꯑꯃꯁꯨꯡ ꯇꯥꯃꯥꯁ (ꯏꯅꯦꯔꯇꯤꯌꯥ, ꯑꯃꯝꯕꯥ)꯫"
"gain and loss, victory and defeat, honour and dishonour, praise and censure","ꯒꯦꯏꯟ ꯑꯃꯁꯨꯡ ꯃꯥꯉꯕꯥ, ꯃꯥꯏꯄꯥꯀꯄꯥ ꯑꯃꯁꯨꯡ ꯃꯥꯏꯊꯤꯕꯥ, ꯏꯀꯥꯌꯈꯨꯝꯅꯕꯥ ꯑꯃꯁꯨꯡ ꯏꯀꯥꯌꯈꯨꯝꯅꯕꯥ, ꯊꯥꯒꯠꯄꯥ ꯑꯃꯁꯨꯡ ꯁꯦꯟꯁꯔ ꯇꯧꯕꯥ"
Yaavaanartha udapaane sarvatah samplutodake;,yaavaanartath ꯎꯗꯥꯄꯥꯅꯦ ꯁꯔꯕꯇꯥꯍ ꯁꯥꯃꯞꯂꯨꯇꯣꯗꯥꯀꯦ;
Taavaan sarveshu vedeshu braahmanasya vijaanatah,ꯇꯥꯚꯥꯟ ꯁꯔꯕꯦꯁꯨ ꯕꯦꯗꯦꯁꯨ ꯕ꯭ꯔꯍ꯭ꯃꯅꯁ꯭ꯌ ꯕꯤꯖꯌꯥꯅꯥꯇꯥꯍ
"46. To the Brahmana who has known the Self, all the Vedas are of as much use as is a","꯴꯶.ꯃꯁꯥꯕꯨ ꯈꯉꯖꯕꯥ ꯕ꯭ꯔꯍ꯭ꯃꯅꯗꯥ, ꯕꯦꯗ ꯄꯨꯝꯅꯃꯛ ꯑꯁꯤ ꯌꯥꯝꯅꯥ ꯁꯤꯖꯤꯟꯅꯕꯥ ꯌꯥꯕꯥ ꯃꯑꯣꯡꯗꯥ ꯑꯣꯏꯔꯤ ꯫"
reservoir of water in a place where there is a flood,ꯏꯁꯤꯡ ꯏꯆꯥꯎ ꯊꯣꯀꯄꯥ ꯃꯐꯝ ꯑꯃꯗꯥ ꯏꯁꯤꯡꯒꯤ ꯔꯤꯖꯔꯕꯔ
"COMMENTARY: Only for a sage who has realised the Self are the Vedas of no use,","ꯀꯃꯦꯟꯇꯔꯤ: ꯁꯦꯜꯐ ꯑꯁꯤ ꯈꯉꯂꯕꯥ ꯔ꯭ꯏꯁꯤ ꯑꯃꯈꯛꯇꯒꯤꯗꯃꯛꯇꯅꯤ, ꯃꯁꯤ ꯅꯣ ꯌꯨꯖꯔꯒꯤ ꯕꯦꯗꯅꯤ,"
"because he is in possession of knowledge of the Self. This does not, however, mean that the Vedas",ꯃꯔꯃꯗꯤ ꯃꯍꯥꯛꯅꯥ ꯃꯁꯥꯒꯤ ꯃꯔꯃꯗꯥ ꯈꯉꯕꯒꯤ ꯃꯄꯨ ꯑꯣꯏꯔꯤ꯫
are useless. They are useful for neophytes or aspirants who have just started on the spiritual path,ꯑꯁꯤ ꯀꯥꯟꯅꯕꯥ ꯂꯩꯇꯦ꯫
Karmanyevaadhikaaraste maa phaleshu kadaachana;,ꯀꯔꯃꯟꯌꯦꯚꯥꯙꯤꯀꯥꯔꯥꯁ꯭ꯇꯦ ꯃꯥ ꯐꯂꯦꯁꯨ ꯀꯗꯥꯆꯅꯥ;
Maa karmaphalahetur bhoor maa te sango’stwakarmani,ꯃꯥ ꯀꯔꯃꯥꯐꯥꯂꯥꯍꯦꯇꯨꯔ ꯚꯨꯔ ꯃꯥ ꯇꯦ ꯁꯥꯉ꯭ꯒꯣ’ꯁ꯭ꯇꯋꯥꯀꯔꯃꯥꯅꯤ
"47. Thy right is to work only, but never with its fruits; let not the fruits of actions be thy","꯴꯷.ꯅꯍꯥꯛꯀꯤ ꯍꯛ ꯑꯁꯤ ꯊꯕꯛ ꯈꯛꯇꯃꯛ ꯇꯧꯕꯅꯤ, ꯑꯗꯨꯕꯨ ꯀꯩꯗꯧꯅꯨꯡꯗꯥ ꯃꯁꯤꯒꯤ ꯃꯍꯩꯁꯤꯡꯒꯥ ꯂꯣꯌꯅꯅꯥ ꯊꯕꯛ ꯇꯧꯕꯅꯤ;"
"motive, nor let thy attachment be to inaction","ꯃꯣꯇꯤꯕ, ꯅꯠꯔꯒꯥ ꯅꯍꯥꯛꯀꯤ ꯑꯦꯇꯦꯆꯃꯦꯟꯇ ꯑꯗꯨ ꯏꯅꯑꯦꯛꯁꯅꯗꯥ ꯌꯥꯑꯣꯍꯅꯒꯗꯕꯅꯤ ."
COMMENTARY: Actions done with expectation of its rewards bring bondage. If you do,ꯀꯃꯦꯟꯇꯔꯤ: ꯃꯁꯤꯒꯤ ꯃꯅꯥꯁꯤꯡ ꯑꯁꯤꯒꯤ ꯑꯦꯛꯁꯄꯦꯛꯇꯦꯁꯅꯒꯥ ꯂꯣꯌꯅꯅꯥ ꯇꯧꯕꯥ ꯊꯕꯀꯁꯤꯡꯅꯥ ꯕꯣꯟꯗꯦꯖ ꯄꯨꯔꯀꯏ꯫
"not thirst for them, you get purification of heart and ultimately knowledge of the Self","ꯃꯈꯣꯌꯒꯤꯗꯃꯛꯇꯥ ꯇꯀꯈꯥꯌꯕꯥ ꯅꯠꯇꯦ, ꯅꯍꯥꯛꯅꯥ ꯊꯝꯃꯣꯌꯒꯤ ꯄ꯭ꯌꯨꯔꯤꯐꯤꯀꯦꯁꯟ ꯐꯪꯏ ꯑꯃꯁꯨꯡ ꯑꯔꯣꯏꯕꯗꯥ ꯃꯁꯥꯒꯤ ꯃꯔꯃꯗꯥ ꯈꯉꯕꯥ ."
Yogasthah kuru karmaani sangam tyaktwaa dhananjaya;,ꯌꯣꯒꯁ꯭ꯊꯥꯍ ꯀꯨꯔꯨ ꯀꯔꯃꯅꯤ ꯁꯉ꯭ꯒꯝ ꯇ꯭ꯌꯥꯌꯀꯇꯋꯥ ꯙꯅꯟꯖꯌꯥ;
Siddhyasiddhyoh samo bhootwaa samatwam yoga uchyate,ꯁꯤꯗ꯭ꯗ꯭ꯙꯤꯗ꯭ꯙꯟꯍꯍ ꯁꯥꯃꯣ ꯚꯨꯇꯋꯥ ꯁꯃꯇꯋꯥꯝ ꯌꯣꯒ ꯎꯆꯤꯌꯥꯇꯦ
"48. Perform action, O Arjuna, being steadfast in Yoga, abandoning attachment and","꯴꯸.ꯑꯦꯛꯁꯟ ꯄꯥꯡꯊꯣꯀꯄꯥ, ꯑꯣ ꯑꯔꯖꯨꯅꯥ, ꯌꯣꯒꯗꯥ ꯂꯦꯞꯄꯥ ꯂꯩꯇꯅꯥ ꯆꯠꯄꯥ, ꯑꯦꯇꯦꯆꯃꯦꯟꯇ ꯊꯥꯗꯣꯀꯄꯥ ꯑꯃꯁꯨꯡ"
balanced in success and failure! Evenness of mind is called Yoga,ꯃꯥꯌ ꯄꯥꯀꯄꯥ ꯑꯃꯁꯨꯡ ꯃꯥꯌꯊꯤꯕꯗꯥ ꯕꯦꯂꯦꯟꯁ ꯇꯧꯕꯥ!
Doorena hyavaram karma buddhiyogaad dhananjaya;,ꯗꯣꯔꯅꯦꯅꯥ ꯍꯤꯌꯥꯕꯔꯥꯝ ꯀꯔꯝ ꯕꯨꯗ꯭ꯙꯤꯌꯣꯒꯗ ꯙꯅꯟꯖꯌꯥ;
Buddhau sharanamanwiccha kripanaah phalahetavah,ꯕꯨꯗ꯭ꯙꯧ ꯁꯔꯅꯥꯃꯅꯕꯤꯆ ꯀ꯭ꯔ꯭ꯏꯄꯥꯅꯥꯍ ꯐꯂꯥꯍꯦꯇꯥꯕꯥꯍ
25,꯲꯵ ꯑꯃꯁꯨꯡ ꯲꯵.
BHAGAVAD GITA,ꯚꯒꯕꯠ ꯒꯤꯇꯥ
"49. Far lower than the Yoga of wisdom is action, O Arjuna! Seek thou refuge in wisdom;","꯴꯹.ꯋꯥꯏꯖꯗꯃꯒꯤ ꯌꯣꯒꯗꯒꯤ ꯌꯥꯝꯅꯥ ꯍꯦꯟꯅꯥ ꯅꯦꯝꯕꯥ ꯑꯦꯛꯁꯟ, ꯑꯣ ꯑꯔꯖꯨꯟ!"
wretched are they whose motive is the fruit,ꯑꯋꯥꯕꯥ ꯇꯥꯔꯕꯥ ꯃꯈꯣꯌꯁꯤꯡ ꯑꯗꯨ ꯃꯈꯣꯌꯒꯤ ꯃꯣꯇꯤꯕ ꯑꯣꯏꯕꯥ ꯃꯍꯩ ꯑꯗꯨꯅꯤ .
COMMENTARY: Actions done with evenness of mind is the Yoga of wisdom. Actions,ꯀꯃꯦꯟꯇꯔꯤ: ꯋꯥꯈꯂꯒꯤ ꯏꯚꯦꯟꯁꯀꯥ ꯂꯣꯌꯅꯅꯥ ꯇꯧꯕꯥ ꯊꯕꯀꯁꯤꯡ ꯑꯁꯤ ꯂꯧꯁꯤꯡꯒꯤ ꯌꯣꯒꯅꯤ꯫
performed by one who expects their fruits are far inferior to the Yoga of wisdom wherein the seeker,ꯃꯈꯣꯌꯒꯤ ꯃꯍꯩ ꯃꯔꯣꯡꯁꯤꯡ ꯑꯗꯨ ꯊꯥꯖꯕꯥ ꯌꯥꯕꯥ ꯌꯣꯒꯗꯒꯤ ꯌꯥꯝꯅꯥ ꯍꯦꯟꯅꯥ ꯅꯦꯝꯃꯤ ꯍꯥꯌꯅꯥ ꯊꯥꯖꯕꯥ ꯃꯤꯑꯣꯏ ꯑꯃꯅꯥ ꯄꯥꯡꯊꯣꯀꯄꯥ ꯃꯐꯝ ꯑꯗꯨꯗꯥ ꯊꯤꯔꯤꯕꯥ ꯃꯤꯑꯣꯏ ꯑꯗꯨꯅꯥ .
"does not seek the fruits. The former leads to bondage, and is the cause of birth and death",ꯃꯍꯩꯁꯤꯡ ꯑꯗꯨ ꯊꯤꯗꯦ꯫
Buddhiyukto jahaateeha ubhe sukrita dushkrite;,ꯕꯨꯗ꯭ꯙꯤꯌꯨꯛꯇꯣ ꯖꯍꯥꯇꯦꯍꯥ ꯎꯕꯦ ꯁꯨꯛꯔꯤꯇꯥ ꯗꯨꯁ꯭ꯛꯔꯤꯇꯦ;
Tasmaad yogaaya yujyaswa yogah karmasu kaushalam,ꯇꯥꯁꯃꯥꯗ ꯌꯣꯒꯥꯌꯥ ꯌꯨꯖ꯭ꯌꯁꯋꯥ ꯌꯣꯒꯥꯍ ꯀꯔꯃꯁꯨ ꯀꯧꯁꯂꯥꯝ
"50. Endowed with wisdom (evenness of mind), one casts off in this life both good and evil","50. ꯂꯧꯁꯤꯡ (ꯋꯥꯈꯂꯒꯤ ꯈꯣꯉꯆꯠ)ꯅꯥ ꯄꯤꯕꯥ, ꯀꯅꯥꯒꯨꯝꯕꯥ ꯑꯃꯅꯥ ꯄꯨꯟꯁꯤ ꯑꯁꯤꯗꯥ ꯑꯐꯕꯥ ꯑꯃꯁꯨꯡ ꯐꯠꯇꯕꯥ ꯑꯅꯤꯃꯛ ꯊꯥꯗꯣꯀꯏ"
"deeds; therefore, devote thyself to Yoga; Yoga is skill in action",ꯊꯕꯀꯁꯤꯡ;
COMMENTARY: Actions which are of a binding nature lose that nature when performed,ꯀꯃꯦꯟꯇꯔꯤ: ꯑꯦꯛꯁꯅꯁꯤꯡ ꯑꯁꯤ ꯕꯥꯏꯟꯗꯤꯡ ꯅꯦꯆꯔꯒꯤ ꯑꯣꯏꯕꯥ ꯑꯦꯛꯁꯅꯁꯤꯡ ꯑꯗꯨ ꯄꯥꯡꯊꯣꯀꯄꯥ ꯃꯇꯃꯗꯥ ꯃꯍꯧꯁꯥ ꯑꯗꯨ ꯃꯥꯡꯍꯜꯂꯤ
with equanimity of mind,ꯋꯥꯈꯂꯒꯤ ꯏꯀꯥꯌꯈꯨꯝꯅꯕꯥ ꯌꯥꯑꯣꯅꯥ .
Karmajam buddhiyuktaa hi phalam tyaktwaa maneeshinah;,ꯀꯔꯃꯖꯥꯝ ꯕꯨꯗ꯭ꯙꯤꯌꯨꯛꯇꯥ ꯍꯤ ꯐꯂꯝ ꯇ꯭ꯌꯥꯌꯀꯇꯋꯥ ꯃꯅꯤꯁꯤꯅꯥꯍ;
Janmabandha vinirmuktaah padam gacchantyanaamayam,ꯖꯅꯃꯥꯕꯟꯙ ꯚꯤꯅꯤꯔꯃꯨꯛꯇꯥꯍ ꯄꯥꯗꯝ ꯒꯆ꯭ꯆꯟꯠꯌꯅꯥꯃꯌꯝ
"51. The wise, possessed of knowledge, having abandoned the fruits of their actions, and","51. ꯂꯧꯁꯤꯡ ꯂꯩꯕꯥ ꯂꯧꯁꯤꯡ ꯂꯩꯕꯥ, ꯃꯈꯣꯌꯒꯤ ꯊꯕꯀꯁꯤꯡꯒꯤ ꯃꯍꯩꯁꯤꯡ ꯊꯥꯗꯣꯀꯄꯥ, ꯑꯃꯁꯨꯡ ."
"being freed from the fetters of birth, go to the place which is beyond all evil","ꯄꯣꯀꯄꯒꯤ ꯐꯦꯇꯔꯁꯤꯡꯗꯒꯤ ꯅꯥꯟꯊꯣꯛꯇꯨꯅꯥ, ꯐꯠꯇꯕꯥ ꯄꯨꯝꯅꯃꯛꯀꯤ ꯃꯊꯛꯇꯥ ꯂꯩꯕꯥ ꯃꯐꯝ ꯑꯗꯨꯗꯥ ꯆꯠꯂꯨ"
COMMENTARY: Clinging to the fruits of actions is the cause of rebirth. Man has to take a,ꯀꯃꯦꯟꯇꯔꯤ: ꯊꯕꯀꯁꯤꯡꯒꯤ ꯃꯍꯩꯁꯤꯡꯗꯥ ꯂꯦꯞꯄꯥ ꯑꯁꯤꯅꯥ ꯑꯃꯨꯛ ꯍꯟꯅꯥ ꯄꯣꯀꯄꯒꯤ ꯃꯔꯝ ꯑꯣꯏꯔꯤ꯫
"body to enjoy them. If actions are done for the sake of God, without desire for the fruits, one is",ꯃꯈꯣꯌꯁꯤꯡ ꯑꯁꯤ ꯅꯨꯡꯉꯥꯏꯅꯕꯥ ꯍꯀꯆꯥꯡ꯫
released from the bonds of birth and death and attains to immortal bliss,ꯄꯣꯀꯄꯥ ꯑꯃꯁꯨꯡ ꯁꯤꯕꯒꯤ ꯃꯔꯤꯗꯒꯤ ꯊꯥꯗꯣꯀꯈ꯭ꯔꯕꯥ ꯑꯃꯁꯨꯡ ꯑꯁꯤꯕꯥ ꯅꯨꯡꯉꯥꯏꯕꯗꯥ ꯐꯪꯕꯤꯕꯥ .
Yadaa te mohakalilam buddhir vyatitarishyati;,ꯌꯥꯗꯥ ꯇꯦ ꯃꯣꯍꯥꯀꯥꯂꯤꯂꯝ ꯕꯨꯗ꯭ꯙꯤꯔ ꯕ꯭ꯌꯇꯤꯇꯥꯔꯁꯌꯇꯤ;
Tadaa gantaasi nirvedam shrotavyasya shrutasya cha,ꯇꯥꯗꯥꯑꯥ ꯒꯟꯇꯥꯁꯤ ꯅꯤꯔꯚꯦꯗꯝ ꯁ꯭ꯔꯣꯠꯋ꯭ꯌꯁ꯭ꯌ ꯁ꯭ꯔꯨꯠꯁꯌ ꯆꯥ
"52. When thy intellect crosses beyond the mire of delusion, then thou shalt attain to","꯵꯲.ꯅꯍꯥꯛꯀꯤ ꯋꯥꯈꯂꯅꯥ ꯃꯤꯔꯩꯕꯥꯛ ꯃꯆꯥꯒꯤ ꯃꯊꯛꯇꯥ ꯂꯥꯟꯊꯣꯀꯄꯥ ꯃꯇꯃꯗꯥ, ꯃꯗꯨꯒꯤ ꯃꯇꯨꯡꯗꯥ ꯅꯍꯥꯛꯅꯥ ꯁꯣꯏꯗꯅꯥ ꯌꯧꯔꯛꯀꯅꯤ"
indifference as to what has been heard and what has yet to be heard,ꯀꯔꯤ ꯇꯥꯈꯤꯕꯒꯦ ꯑꯃꯁꯨꯡ ꯍꯧꯖꯤꯛ ꯐꯥꯑꯣꯕꯥ ꯇꯥꯕꯥ ꯐꯪꯗ꯭ꯔꯤꯕꯒꯦ ꯍꯥꯌꯕꯒꯤ ꯃꯇꯥꯡꯗꯥ ꯋꯥꯈꯜ ꯋꯥꯕꯥ
COMMENTARY: The mire of delusion is identification of the Self with the body and,ꯀꯃꯦꯟꯇꯔꯤ: ꯃꯤꯔꯩꯕꯥꯛꯀꯤ ꯃꯤꯔꯩꯕꯥꯛ ꯑꯁꯤ ꯍꯀꯆꯥꯡꯒꯥ ꯂꯣꯌꯅꯅꯥ ꯃꯁꯥꯕꯨ ꯃꯁꯛ ꯈꯉꯗꯣꯀꯄꯅꯤ ꯑꯃꯁꯨꯡ .
mind,ꯋꯥꯈꯜ
Shrutivipratipannaa te yadaa sthaasyati nishchalaa;,ꯁ꯭ꯔꯨꯇꯤꯚꯤꯞꯔꯇꯤꯄꯥꯟꯅꯥ ꯇꯦ ꯌꯥꯗꯥ ꯁ꯭ꯊꯥꯁꯌꯇꯤ ꯅꯤꯁꯆꯂꯥ;
Samaadhaavachalaa buddhistadaa yogam avaapsyasi,ꯁꯃꯥꯙꯋꯆꯂꯥꯌꯥ ꯕꯨꯗ꯭ꯙꯤꯁ꯭ꯇꯥꯗ ꯌꯣꯒꯝ ꯑꯚꯥꯄꯁ꯭ꯌꯁꯤ
"53. When thy intellect, perplexed by what thou hast heard, shall stand immovable and","꯵꯳.ꯅꯍꯥꯛꯅꯥ ꯇꯥꯈꯤꯕꯥ ꯋꯥꯐꯝ ꯑꯗꯨꯅꯥ ꯋꯥꯈꯜ ꯋꯥꯕꯥ ꯍꯧꯔꯀꯄꯥ ꯃꯇꯃꯗꯥ, ꯂꯦꯞꯄꯥ ꯂꯩꯇꯅꯥ ꯂꯦꯞꯂꯒꯅꯤ ꯑꯃꯁꯨꯡ ."
"steady in the Self, then thou shalt attain Self-realisation","ꯃꯁꯥꯗꯥ ꯂꯦꯞꯄꯥ ꯂꯩꯇꯅꯥ, ꯃꯗꯨꯒꯤ ꯃꯇꯨꯡꯗꯥ ꯅꯍꯥꯛꯅꯥ ꯃꯁꯥꯅꯥ ꯃꯁꯥꯕꯨ ꯊꯥꯖꯍꯅꯕꯥ ꯉꯃꯒꯅꯤ"
Arjuna Uvaacha:,ꯑꯔꯖꯨꯟ ꯎꯋꯥꯆ꯭ꯌꯥ:
Sthitaprajnasya kaa bhaashaa samaadhisthasya keshava;,ꯁ꯭ꯊꯤꯇꯥꯞꯔꯖꯟꯁꯌ ꯀꯥꯑꯥ ꯚꯁꯥꯍ ꯁꯃꯥꯗꯍꯤꯁ꯭ꯇꯁ꯭ꯌ ꯀꯦꯁꯥꯕ;
Sthitadheeh kim prabhaasheta kimaaseeta vrajeta kim,ꯁ꯭ꯊꯤꯇꯥꯙꯤꯍ ꯀꯤꯝ ꯄ꯭ꯔꯚꯥꯁꯦꯇꯥ ꯀꯤꯃꯥꯁꯦꯇꯥ ꯋ꯭ꯔꯥꯖꯦꯇꯥ ꯀꯤꯝ
Arjuna said:,ꯑꯔꯖꯨꯟꯅꯥ ꯍꯥꯌꯈꯤ:
26,꯲꯶ ꯑꯃꯁꯨꯡ ꯑꯦꯟ.
SANKHYA YOGA,ꯁꯪꯈ꯭ꯌ ꯌꯣꯒ
