en,mni-Mtei
environment into electrical activity or nerve impulses. The chemical,ꯏꯂꯦꯛꯠꯔꯤꯀꯦꯜ ꯑꯦꯛꯇꯤꯚꯤꯇꯤ ꯅꯠꯠꯔꯒꯥ ꯅꯔꯚ ꯏꯝꯄꯂꯁꯁꯤꯡꯗꯥ ꯑꯦꯅꯚꯥꯏꯔꯅꯃꯦꯟꯇ꯫
substances in the synapses and the neurons transmit nerve impulses to,ꯁꯤꯅꯦꯄꯁꯇꯥ ꯂꯩꯕꯥ ꯄꯣꯠꯁꯀꯁꯤꯡ ꯑꯃꯁꯨꯡ ꯅ꯭ꯌꯨꯔꯣꯅꯁꯤꯡꯅꯥ ꯅꯔꯚ ꯏꯝꯄꯂꯁꯁꯤꯡ ꯑꯁꯤ 1.0ꯗꯥ ꯇ꯭ꯔꯥꯟꯁꯃꯤꯠ ꯇꯧꯏ꯫
the brain; and from the brain to target organs,ꯕ꯭ꯔꯦꯟ ꯑꯗꯨ;
Any child’s speed of reaction to environmental stimulation will depend,ꯑꯉꯥꯡ ꯑꯃꯍꯦꯛꯇꯒꯤ ꯑꯀꯣꯌꯔꯣꯅꯒꯤ ꯁ꯭ꯇꯤꯝꯌꯨꯂꯦꯁꯅꯒꯤ ꯔꯤꯑꯦꯛꯁꯟ ꯑꯗꯨꯒꯤ ꯈꯣꯡꯖꯦꯜ ꯑꯗꯨ ꯃꯈꯥ ꯄꯣꯜꯂꯤ
on the nature of the chemical substances that transmit messages in the,꯲꯰꯲꯰ꯗꯥ ꯄꯥꯎꯖꯦꯂꯁꯤꯡ ꯊꯥꯔꯤꯕꯥ ꯀꯦꯃꯤꯀꯦꯜ ꯄꯣꯠꯁꯀꯁꯤꯡꯒꯤ ꯃꯑꯣꯡ ꯃꯇꯧꯒꯤ ꯃꯇꯥꯡꯗꯥ .
nervous system.   Genes instruct the making of chemical substances in,ꯅꯔꯚꯁ ꯁꯤꯁ꯭ꯇꯦꯝ꯫
"the nervous system.   In other words, genes determine any child’s speed",ꯅꯔꯚꯁ ꯁꯤꯁ꯭ꯇꯦꯝ ꯑꯁꯤ꯫
"of reaction to environmental stimulation. Therefore, the efficiency of",ꯑꯀꯣꯌꯔꯣꯅꯒꯤ ꯁ꯭ꯇꯤꯝꯌꯨꯂꯦꯁꯅꯒꯤ ꯔꯤꯑꯦꯛꯁꯅꯒꯤ꯫
the functioning of the nervous system is genetically determined,ꯅꯔꯚ ꯁꯤꯁ꯭ꯇꯦꯃꯒꯤ ꯃꯊꯧ ꯇꯧꯕꯥ ꯑꯁꯤ ꯖꯤꯅꯦꯇꯤꯛ ꯑꯣꯏꯅꯥ ꯂꯦꯄꯊꯣꯀꯏ .
One can see how the malfunctioning of some of the sensory organs (for,ꯀꯅꯥꯒꯨꯝꯕꯥ ꯑꯃꯅꯥ ꯃꯇꯧ ꯀꯔꯝꯅꯥ ꯁꯦꯟꯁꯔꯤ ꯑꯣꯔꯒꯥꯟ ꯈꯔꯒꯤ ꯃꯥꯂꯐꯪꯁꯟ (for) ꯑꯗꯨ ꯎꯕꯥ ꯐꯪꯒꯅꯤ
"example, long sightedness and short sightedness of the visual organ)","ꯈꯨꯗꯝ ꯑꯣꯏꯅꯥ, ꯚꯤꯖꯨꯑꯦꯜ ꯑꯣꯔꯒꯥꯟ ꯑꯁꯤꯒꯤ ꯁꯥꯡꯂꯕꯥ ꯎꯕꯥ ꯑꯃꯁꯨꯡ ꯁꯔꯨꯛ ꯌꯥꯕꯥ)"
attributed to genetic makeup.   Malfunctioning of sensory organs leads,ꯖꯤꯅꯦꯇꯤꯛ ꯃꯦꯀꯑꯥꯄꯇꯥ ꯌꯨꯝꯐꯝ ꯑꯣꯏꯕꯥ꯫
to perceptual impairment. This has implications for the child’s,ꯄꯔꯁꯦꯄꯆꯨꯑꯦꯜ ꯏꯝꯄꯥꯌꯔꯃꯦꯟꯇꯗꯥ꯫
"behaviour, school adjustment, and achievement","ꯂꯃꯆꯠ-ꯁꯥꯖꯠ, ꯁ꯭ꯀꯨꯜ ꯑꯦꯗꯖꯁ꯭ꯇꯃꯦꯟꯇ, ꯑꯃꯁꯨꯡ ꯑꯦꯆꯤꯚꯃꯦꯟꯇ"
The Endocrine System,ꯑꯦꯟꯗꯣꯛꯔꯥꯏꯟ ꯁꯤꯁ꯭ꯇꯦꯝ ꯑꯁꯤꯅꯥ ꯑꯦꯟ.ꯗꯤ.ꯑꯦ.
The endocrine system consists of the ductless glands. These glands,ꯑꯦꯅꯗꯣꯛꯔꯤꯟ ꯁꯤꯁ꯭ꯇꯦꯝ ꯑꯁꯤ ꯗꯛꯇꯂꯦꯁ ꯒ꯭ꯜꯌꯥꯟꯗꯁꯤꯡꯅꯥ ꯁꯦꯝꯕꯅꯤ꯫
secrete chemical substances (hormones or enzymes) that regulate body,ꯍꯀꯆꯥꯡꯕꯨ ꯔꯤꯒꯨꯂꯦꯠ ꯇꯧꯕꯥ ꯀꯦꯃꯤꯀꯦꯜ ꯄꯣꯠꯁꯀꯁꯤꯡ (ꯍꯔꯃꯣꯟ ꯅꯠꯠꯔꯒꯥ ꯑꯦꯅꯖꯥꯏꯃꯁꯤꯡ) ꯊꯥꯗꯣꯀꯎ꯫
chemistry and activities. Among the import ductless glands are:,ꯀꯦꯃꯤꯁ꯭ꯠꯔꯤ ꯑꯃꯁꯨꯡ ꯑꯦꯛꯇꯤꯕꯤꯇꯤꯁꯤꯡ꯫
The Pituitary Gland:,ꯄꯤꯇꯨꯏꯇꯔꯤ ꯒ꯭ꯜꯌꯥꯟꯗ ꯑꯁꯤ:
The pituitary gland known as the master gland. It secretes the hormone,ꯃꯥꯁ꯭ꯇꯔ ꯒ꯭ꯜꯌꯥꯟꯗ ꯍꯥꯌꯅꯥ ꯈꯉꯅꯕꯥ ꯄꯤꯇꯨꯏꯇꯔꯤ ꯒ꯭ꯜꯌꯥꯟꯗ꯫
"that controls all other glands. Primarily, the pituitary gland secretes the",ꯃꯗꯨꯅꯥ ꯑꯇꯣꯞꯄꯥ ꯒ꯭ꯜꯌꯥꯟꯗ ꯄꯨꯝꯅꯃꯛ ꯀꯟꯠꯔꯣꯜ ꯇꯧꯏ꯫
growth hormone that regulates the physical growth of the body parts,ꯍꯀꯆꯥꯡꯒꯤ ꯁꯔꯨꯀꯁꯤꯡꯒꯤ ꯐꯤꯖꯤꯀꯦꯜ ꯒ꯭ꯔꯣꯊ ꯔꯤꯒꯨꯂꯦꯠ ꯇꯧꯕꯥ ꯒ꯭ꯔꯣꯊ ꯍꯣꯔꯃꯣꯟ
The Thyroid Gland:,ꯊꯥꯌꯔꯣꯏꯗ ꯒ꯭ꯜꯌꯥꯟꯗ ꯑꯁꯤ:
"The thyroid gland secretes the hormone, thyroxin. This hormone is","ꯊꯥꯌꯔꯣꯏꯗ ꯒ꯭ꯜꯌꯥꯟꯗ ꯑꯁꯤꯅꯥ ꯍꯣꯔꯃꯣꯟ, ꯊꯥꯏꯔꯣꯏꯗ ꯊꯥꯗꯣꯀꯏ꯫"
responsible for the control of food metabolism and the sensitivity of the,ꯐꯨꯗ ꯃꯦꯇꯥꯕꯣꯂꯤꯖꯝ ꯀꯟꯠꯔꯣꯜ ꯇꯧꯕꯥ ꯑꯃꯁꯨꯡ ꯁꯦꯟꯁꯤꯇꯤꯕꯤꯇꯤꯒꯤ ꯗꯥꯌꯠꯕ ꯂꯧꯕꯥ .
nerves,ꯅꯔꯚꯁꯤꯡ .
The Adrenal Gland:,ꯑꯦꯗ꯭ꯔꯤꯅꯜ ꯒ꯭ꯜꯌꯥꯟꯗ ꯑꯁꯤ:
This gland secretes the hormone commonly known as the emergency,ꯃꯁꯤꯒꯤ ꯒ꯭ꯜꯌꯥꯟꯗ ꯑꯁꯤꯅꯥ ꯃꯍꯧꯁꯥꯅꯥ ꯏꯃꯔꯖꯦꯟꯁꯤ ꯍꯥꯌꯅꯥ ꯈꯉꯅꯕꯥ ꯍꯣꯔꯃꯣꯟ ꯑꯁꯤ ꯊꯥꯗꯣꯀꯏ .
hormone.   This hormone controls the body systems that regulate the,ꯍꯣꯔꯃꯣꯟ꯫
body’s reactions to changes and danger signals,ꯑꯍꯣꯡꯕꯁꯤꯡ ꯑꯃꯁꯨꯡ ꯈꯨꯗꯣꯡꯊꯤꯅꯤꯉꯥꯏ ꯑꯣꯏꯕꯥ ꯁꯤꯒꯅꯦꯂꯁꯤꯡꯗꯥ ꯍꯀꯆꯥꯡꯒꯤ ꯔꯤꯑꯦꯛꯁꯅꯁꯤꯡ
PED121,ꯄꯤ.ꯏ.ꯗꯤ.꯱꯲꯱ ꯑꯃꯁꯨꯡ ꯑꯦꯟ.
CHILDHOOD AND ADOLESCENT PSYCHOLOGY,ꯑꯉꯥꯡ ꯑꯣꯏꯔꯤꯉꯩ ꯑꯃꯁꯨꯡ ꯏꯅꯈꯠꯂꯛꯂꯤꯕꯥ ꯁꯥꯏꯀꯣꯂꯣꯖꯤ
36,꯳꯶ .
The Pancreas:,ꯄꯦꯅꯛꯔꯤꯑꯦꯖ ꯑꯁꯤ: ꯱.
The pancreas secretes the hormone known as bile. This hormone regulates,ꯄꯦꯅꯛꯔꯤꯑꯦꯖ ꯑꯁꯤꯅꯥ ꯕꯥꯏꯜ ꯍꯥꯌꯅꯥ ꯈꯪꯅꯕꯥ ꯍꯣꯔꯃꯣꯟ ꯑꯗꯨ ꯊꯥꯗꯣꯀꯏ꯫
sugar metabolism and sugar levels in the tissues and the bloodstream,ꯇꯤꯁ꯭ꯌꯨꯁꯤꯡ ꯑꯃꯁꯨꯡ ꯏꯒꯤ ꯈꯣꯡꯖꯦꯂꯗꯥ ꯆꯤꯅꯤꯒꯤ ꯃꯦꯇꯥꯕꯣꯂꯤꯖꯝ ꯑꯃꯁꯨꯡ ꯆꯤꯅꯤꯒꯤ ꯆꯥꯡ
The Gonads:,ꯒꯣꯅꯥꯗꯁꯤꯡ ꯑꯁꯤ: ꯱.
"For males, the gonad is the testes, which produce the male gametes or","ꯅꯨꯄꯥꯁꯤꯡꯒꯤ ꯑꯣꯏꯅꯗꯤ, ꯒꯣꯅꯥꯗ ꯑꯁꯤ ꯇꯦꯁ꯭ꯇꯦꯁꯅꯤ, ꯃꯈꯣꯌꯅꯥ ꯅꯨꯄꯥ ꯒꯦꯃꯦꯇꯁꯤꯡ ꯅꯠꯠꯔꯒꯥ ."
"male sex cells. For females, the gonad is the ovary.   The ovary controls",ꯅꯨꯄꯥꯒꯤ ꯁꯦꯛꯁ ꯁꯦꯂꯁꯤꯡ꯫
the maturation of the female sex cells or the ova. The gonads also regulate,ꯅꯨꯄꯤ ꯁꯦꯛꯁ ꯁꯦꯂꯁꯤꯡ ꯅꯠꯠꯔꯒꯥ ꯑꯣ.ꯚꯤ.ꯑꯦ.
the development of secondary sexual characteristics,ꯁꯦꯀꯦꯟꯗꯔꯤ ꯁꯦꯛꯁꯀꯤ ꯃꯑꯣꯡ ꯃꯇꯧꯁꯤꯡ ꯁꯦꯃꯒꯠꯄꯥ
Hyper-activity or hypo-activity of any of these glands will hamper body,ꯍꯥꯌꯔꯤꯕꯥ ꯒ꯭ꯜꯌꯥꯟꯗꯁꯤꯡ ꯑꯁꯤꯒꯤ ꯃꯅꯨꯡꯗꯥ ꯑꯃꯍꯦꯛꯇꯒꯤ ꯍꯥꯏꯄꯔ-ꯑꯦꯛꯇꯤꯚꯤꯇꯤ ꯅꯠꯠꯔꯒꯥ ꯍꯥꯏꯄꯣ-ꯑꯦꯛꯇꯤꯚꯤꯇꯤꯅꯥ ꯍꯀꯆꯥꯡꯗꯥ ꯑꯀꯥꯌꯕꯥ ꯄꯤꯒꯅꯤ
"systems activities. Logically, therefore, malfunctioning of the endocrine",ꯁꯤꯁ꯭ꯇꯦꯃꯁꯤꯡꯒꯤ ꯊꯕꯛ ꯊꯧꯔꯃꯁꯤꯡ꯫
system will hamper normal growth and development of the child. This,ꯁꯤꯁ꯭ꯇꯦꯃꯅꯥ ꯑꯉꯥꯡ ꯑꯗꯨꯒꯤ ꯅꯣꯔꯃꯦꯜ ꯒ꯭ꯔꯣꯊ ꯑꯃꯁꯨꯡ ꯗꯤꯚꯦꯂꯄꯃꯦꯟꯇꯗꯥ ꯑꯀꯥꯌꯕꯥ ꯄꯤꯒꯅꯤ꯫
will in turn hamper normal behaviour and adjustment,ꯃꯊꯪ ꯃꯊꯪ ꯅꯣꯔꯃꯦꯜ ꯑꯣꯏꯕꯥ ꯂꯃꯆꯠ-ꯁꯥꯖꯠ ꯑꯃꯁꯨꯡ ꯑꯦꯗꯖꯁ꯭ꯇꯃꯦꯟꯇꯗꯥ ꯑꯀꯥꯌꯕꯥ ꯄꯤꯒꯅꯤ
The genes instruct the making of the enzymes or hormones of the,ꯖꯤꯅꯁꯤꯡ ꯑꯁꯤꯅꯥ ꯑꯦꯟ.ꯑꯦ.ꯖꯤ.ꯒꯤ ꯑꯦꯅꯖꯥꯏꯃꯁꯤꯡ ꯅꯠꯠꯔꯒꯥ ꯍꯣꯔꯃꯣꯅꯁꯤꯡ ꯁꯦꯝꯅꯕꯥ ꯌꯥꯊꯪ ꯄꯤꯔꯤ꯫
"endocrine system. Therefore, the level of functioning of the endocrine",ꯑꯦꯅꯗꯣꯛꯔꯤꯟ ꯁꯤꯁ꯭ꯇꯦꯝ꯫
system has a biological origin. The endocrine system contributes,ꯁꯤꯁ꯭ꯇꯦꯝ ꯑꯁꯤ ꯕꯥꯏꯑꯣꯂꯣꯖꯤꯀꯦꯜ ꯑꯣꯔꯤꯖꯤꯟ ꯑꯃꯥ ꯂꯩ꯫
significantly to human behaviour,ꯃꯤꯑꯣꯏꯕꯒꯤ ꯂꯃꯆꯠ-ꯁꯥꯖꯠꯇꯥ ꯃꯔꯨ ꯑꯣꯏꯕꯥ .
Self-Assessment Exercises,ꯁꯦꯜꯐ-ꯑꯦꯁꯦꯁꯃꯦꯟꯇ ꯑꯦꯛꯁꯔꯁꯥꯏꯖꯁꯤꯡ .
1,꯱.
The basic unit of human life is the -------- which  organise into,ꯃꯤꯑꯣꯏꯕꯒꯤ ꯄꯨꯟꯁꯤꯒꯤ ꯕꯦꯁꯤꯛ ꯌꯨꯅꯤꯠ ꯑꯁꯤ -------- ꯑꯁꯤ ꯑꯣꯔꯒꯅꯥꯏꯖ ꯇꯧꯕꯥ .
groups to form different structures such as: A organs  B. muscles,ꯒ꯭ꯔꯨꯄꯁꯤꯡꯅꯥ ꯇꯣꯉꯥꯟ-ꯇꯣꯉꯥꯅꯕꯥ ꯁ꯭ꯠꯔꯀꯆꯔꯁꯤꯡ ꯁꯦꯝꯅꯕꯥ ꯍꯥꯌꯕꯗꯤ: A Organs B. ꯃꯁꯂꯁꯤꯡ
C. tissues  D. cell,ꯁꯤ.ꯒꯤ ꯇꯤꯁ꯭ꯌꯨꯁꯤꯡ ꯗꯤ.
2,꯲ ꯑꯃꯁꯨꯡ ꯲.
The nucleus contains ---------- chromosomes arranged in 23 pairs,ꯅ꯭ꯌꯨꯛꯂꯤꯌꯁꯇꯥ ------------ ꯀ꯭ꯔꯣꯃꯣꯖꯣꯃꯁꯤꯡ ꯑꯁꯤ ꯄꯦꯌꯥꯔ ꯲꯳ꯗꯥ ꯁꯦꯃꯖꯤꯜꯂꯤ .
A. 46  B. 45   C. 40    D 48,ꯑꯦ. ꯴꯶ ꯕꯤ. ꯴꯵ ꯁꯤ.꯴꯰ ꯗꯤ ꯴꯸ .
3,꯳ ꯑꯃꯁꯨꯡ ꯳.
A dominant trait is only dominant when in a --------condition   A,ꯗꯣꯃꯤꯅꯦꯟꯇ ꯇ꯭ꯔꯦꯠ ꯑꯃꯅꯥ ꯗꯣꯃꯤꯅꯦꯟꯇ ꯑꯣꯏꯕꯥ ꯃꯇꯃꯗꯥ ꯈꯛꯇꯗꯥ ꯗꯣꯃꯤꯅꯦꯟꯇ ꯑꯣꯏꯕꯥ ꯌꯥꯏ --------ꯀꯟꯗꯤꯁꯟ A .
homozygous       B. heterozygous C. genotype   D phenotype,ꯍꯣꯃꯣꯖꯥꯏꯒꯣꯁ ꯕꯤ.ꯍꯦꯇꯦꯔꯣꯖꯥꯏꯒꯣꯁ ꯁꯤ.ꯖꯤꯅꯣꯇꯥꯏꯞ ꯗꯤ ꯐꯦꯅꯣꯇꯥꯏꯞ
4,꯴ ꯑꯃꯁꯨꯡ ꯴.
The -------is a disorder produced by the presence of one extra,-------ꯑꯍꯦꯅꯕꯥ ꯑꯃꯥ ꯂꯩꯕꯅꯥ ꯄꯨꯊꯣꯀꯄꯥ ꯗꯤꯁꯑꯣꯔꯗꯔ ꯑꯃꯅꯤ .
chromosome on the 21st pair A) Down syndrome B. Klinefelter’s,꯲꯱ꯁꯨꯕꯥ ꯄꯦꯌꯥꯔꯗꯥ ꯂꯩꯕꯥ ꯀ꯭ꯔꯣꯃꯣꯖꯣꯝ ꯀ) ꯗꯥꯎꯟ ꯁꯤꯟꯗꯣꯝ ꯕꯤ.
Syndrome  C. Turner’s syndrome   D. Turner’s syndrome,ꯁꯤꯟꯗꯣꯝ ꯁꯤ.ꯇꯔꯅꯔ’ꯁ ꯁꯤꯟꯗꯣꯝ ꯗꯤ.ꯇꯔꯅꯔꯁ ꯁꯤꯟꯗꯣꯝ
5,꯵ ꯑꯃꯁꯨꯡ ꯵.
The pituitary gland known as the ----------A. ductless gland B,----------ꯑꯦ ꯍꯥꯌꯅꯥ ꯈꯉꯅꯕꯥ ꯄꯤꯇꯨꯏꯇꯔꯤ ꯒ꯭ꯜꯌꯥꯟꯗ꯫
master gland  C. thyroxin    D. gonad,ꯃꯥꯁ꯭ꯇꯔ ꯒ꯭ꯜꯌꯥꯟꯗ ꯁꯤ.ꯊꯥꯏꯔꯣꯛꯁꯤꯟ ꯗꯤ.ꯒꯣꯅꯥꯗ
4.4,꯴.꯴ ꯑꯣꯏꯈꯤ꯫
Summary,ꯁꯝꯂꯞꯄ ꯋꯥꯔꯣꯜ
This unit is about heredity. We examined how genes operate either,ꯃꯁꯤꯒꯤ ꯌꯨꯅꯤꯠ ꯑꯁꯤ ꯍꯦꯔꯤꯗꯤꯇꯤꯒꯤ ꯃꯇꯥꯡꯗꯥ ꯑꯣꯏꯔꯤ꯫
dominantly or recessively. We discussed dominant genes in relation to,ꯗꯣꯃꯤꯅꯦꯟꯇ ꯑꯣꯏꯅꯥ ꯅꯠꯠꯔꯒꯥ ꯔꯤꯁꯦꯁꯤꯕꯜ ꯑꯣꯏꯅꯥ꯫
how they express themselves both in the heterozygous and homozygous,ꯃꯈꯣꯌꯅꯥ ꯃꯇꯧ ꯀꯔꯝꯅꯥ ꯃꯈꯣꯌ ꯃꯁꯥꯕꯨ ꯍꯦꯇꯦꯔꯣꯖꯥꯏꯒꯣꯁ ꯑꯃꯁꯨꯡ ꯍꯣꯃꯣꯖꯥꯏꯒꯣꯁ ꯑꯅꯤꯃꯛꯇꯥ ꯐꯣꯡꯗꯣꯀꯄꯒꯦ .
conditions. We described genotype and phenotype,ꯍꯤꯔꯝꯁꯤꯡ.
You must have learnt that genes do not cause behaviour but instruct,ꯖꯤꯅꯁꯤꯡꯅꯥ ꯂꯃꯆꯠ-ꯁꯥꯖꯠ ꯊꯣꯀꯍꯟꯗꯦ ꯑꯗꯨꯕꯨ ꯇꯝꯕꯤꯔꯤ ꯍꯥꯌꯕꯥ ꯅꯍꯥꯛꯅꯥ ꯈꯉꯂꯃꯒꯅꯤ .
chemicals that cause behaviour. We stated that genetic abnormalities are,ꯂꯃꯆꯠ-ꯁꯥꯖꯠ ꯊꯣꯀꯍꯜꯂꯤꯕꯥ ꯀꯦꯃꯤꯀꯦꯂꯁꯤꯡ꯫
"caused by damaged genes. Finally, we explained that genes direct the",ꯑꯃꯥꯡ-ꯑꯇꯥ ꯊꯣꯀꯄꯥ ꯖꯤꯅꯁꯤꯡꯅꯥ ꯊꯣꯀꯍꯅꯕꯥ꯫
chemicals that regulate nervous system and endocrine system activities,ꯅꯔꯚ ꯁꯤꯁ꯭ꯇꯦꯝ ꯑꯃꯁꯨꯡ ꯑꯦꯟꯗꯣꯛꯔꯥꯏꯟ ꯁꯤꯁ꯭ꯇꯦꯃꯒꯤ ꯊꯕꯛ ꯊꯧꯔꯃꯁꯤꯡ ꯔꯤꯒꯨꯂꯦꯠ ꯇꯧꯕꯥ ꯀꯦꯃꯤꯀꯦꯂꯁꯤꯡ
PED121,ꯄꯤ.ꯏ.ꯗꯤ.꯱꯲꯱ ꯑꯃꯁꯨꯡ ꯑꯦꯟ.
MODULE 1,ꯃꯣꯗ꯭ꯌꯨꯜ ꯱.
37,꯳꯷ ꯑꯃꯁꯨꯡ ꯑꯦꯟ.
4.5,꯴.꯵ ꯑꯣꯏꯈꯤ꯫
References/Further Readings/Web Sources,ꯔꯤꯐꯔꯦꯟꯁꯁꯤꯡ/ꯃꯈꯥ ꯇꯥꯕꯥ ꯔꯤꯗꯤꯡꯁꯤꯡ/ꯋꯦꯕ ꯁꯣꯔꯁꯁꯤꯡ
"Kolb, B. (1995). Brain Plasticity and Behaviour. Mahwah, NJ: Eribaum","ꯀꯣꯂꯕ, ꯕꯤ.(꯱꯹꯹꯵) ꯑꯃꯁꯨꯡ ꯑꯦꯝ."
"Plomin, R., De Fries, J.C., McClearn, G.E. (1990). Behavioural","ꯄ꯭ꯂꯣꯃꯤꯟ, ꯑꯥꯔ., ꯗꯦ ꯐ꯭ꯔꯥꯏꯁ, ꯖꯦ.ꯁꯤ., ꯃꯦꯀꯛꯂꯤꯌꯔꯟ, ꯖꯤ.ꯏ."
Genetics: A Primer (2nd ed.). New York: Freeman,ꯖꯦꯅꯦꯇꯤꯛꯁ: ꯄ꯭ꯔꯥꯏꯃꯔ ꯑꯃꯥ (꯲ꯁꯨꯕꯥ ꯑꯦꯗ.)꯫
PED121,ꯄꯤ.ꯏ.ꯗꯤ.꯱꯲꯱ ꯑꯃꯁꯨꯡ ꯑꯦꯟ.
CHILDHOOD AND ADOLESCENT PSYCHOLOGY,ꯑꯉꯥꯡ ꯑꯣꯏꯔꯤꯉꯩ ꯑꯃꯁꯨꯡ ꯏꯅꯈꯠꯂꯛꯂꯤꯕꯥ ꯁꯥꯏꯀꯣꯂꯣꯖꯤ
38,꯳꯸ ꯑꯃꯁꯨꯡ ꯑꯦꯟ.
4.6  Possible Answers to Self-Assessment Exercise(s),꯴.꯶ ꯁꯦꯜꯐ-ꯑꯦꯁꯦꯁꯃꯦꯟꯇ ꯑꯦꯛꯁꯔꯁꯥꯏꯖ(ꯁꯤꯡ)ꯒꯤ ꯑꯣꯏꯊꯣꯀꯄꯥ ꯌꯥꯕꯥ ꯄꯥꯎꯈꯨꯃꯁꯤꯡ
Self-Assessment Exercises,ꯁꯦꯜꯐ-ꯑꯦꯁꯦꯁꯃꯦꯟꯇ ꯑꯦꯛꯁꯔꯁꯥꯏꯖꯁꯤꯡ .
1,꯱.
D,ꯗꯤ .
2,꯲ ꯑꯃꯁꯨꯡ ꯲.
A,ꯑꯃ
"3,","꯳, ꯳."
A,ꯑꯃ
4,꯴ ꯑꯃꯁꯨꯡ ꯴.
A,ꯑꯃ
5,꯵ ꯑꯃꯁꯨꯡ ꯵.
B,ꯕꯤ .
PED121,ꯄꯤ.ꯏ.ꯗꯤ.꯱꯲꯱ ꯑꯃꯁꯨꯡ ꯑꯦꯟ.
MODULE 1,ꯃꯣꯗ꯭ꯌꯨꯜ ꯱.
39,꯳꯹ ꯑꯃꯁꯨꯡ ꯑꯦꯟ.
UNIT 5,ꯌꯨꯅꯤꯠ ꯵.
ENVIRONMENTAL,ꯑꯀꯣꯏꯕꯒꯤ ꯑꯀꯣꯏꯕꯗꯥ ꯂꯩꯕꯥ ꯌꯨ.ꯑꯦꯁ.
BASIS,ꯕꯦꯁꯤꯁ ꯳.
HUMAN,ꯃꯤꯑꯣꯏꯕ
BEHAVIOUR,ꯂꯤꯆꯠ ꯁꯥꯖꯠ
Unit Structure,ꯌꯨꯅꯤꯠꯀꯤ ꯁ꯭ꯠꯔꯀꯆꯔ ꯑꯁꯤ .
5.1,꯵.꯱ ꯑꯃꯁꯨꯡ ꯑꯦꯟ.
Introduction,ꯁꯛꯇꯥꯛꯄ
5.2     Learning Outcomes,꯵.꯲ ꯇꯝꯅꯕꯒꯤ ꯐꯂꯁꯤꯡ .
5.3     Titles of the Main Sections,꯵.꯳ ꯃꯔꯨꯑꯣꯏꯕꯥ ꯁꯦꯛꯁꯅꯁꯤꯡꯒꯤ ꯇꯥꯏꯇꯦꯂꯁꯤꯡ .
5.3.1   The Physical Environment,꯵.꯳.꯱ꯒꯤ ꯐꯤꯖꯤꯀꯦꯜ ꯑꯦꯅꯚꯥꯏꯔꯅꯃꯦꯟꯇ .
5.3.2    Psychosocial Environment,꯵.꯳.꯲ ꯁꯥꯏꯀꯣꯁꯣꯁꯤꯑꯦꯜ ꯑꯦꯅꯚꯥꯏꯔꯅꯃꯦꯟꯇ
5.4      Summary,꯵.꯴ ꯒꯤ ꯋꯥꯔꯣꯜ
5.5      References/Further Readings/Web Sources,꯵.꯵ ꯔꯤꯐꯔꯦꯟꯁꯁꯤꯡ/ꯃꯈꯥ ꯇꯥꯕꯥ ꯔꯤꯗꯤꯡꯁꯤꯡ/ꯋꯦꯕ ꯁꯣꯔꯁꯁꯤꯡ
5.6,꯵.꯶ ꯑꯣꯏꯈꯤ꯫
Possible Answers to Self-Assessment Exercise,ꯁꯦꯜꯐ-ꯑꯦꯁꯦꯁꯃꯦꯟꯇ ꯑꯦꯛꯁꯔꯁꯥꯏꯖ ꯇꯧꯕꯒꯤ ꯑꯣꯏꯊꯣꯀꯄꯥ ꯌꯥꯕꯥ ꯄꯥꯎꯈꯨꯃꯁꯤꯡ
5.1,꯵.꯱ ꯑꯃꯁꯨꯡ ꯑꯦꯟ.
Introduction,ꯁꯛꯇꯥꯛꯄ
Two general factors determine human behaviour. They are heredity and,ꯖꯦꯅꯦꯔꯦꯜ ꯐꯦꯛꯇꯔ ꯑꯅꯤꯅꯥ ꯃꯤꯑꯣꯏꯕꯒꯤ ꯂꯃꯆꯠ-ꯁꯥꯖꯠ ꯂꯦꯄꯊꯣꯀꯏ꯫
environment. We discussed the factor of heredity and other biological,ꯑꯀꯣꯏꯕꯒꯤ ꯐꯤꯚꯝ.
aspects of heredity in Unit 4. Heredity provides the raw materials while,"ꯌꯨꯅꯤꯠ ꯴ꯗꯥ ꯍꯦꯔꯤꯗꯤꯇꯤꯒꯤ ꯃꯁꯀꯁꯤꯡ, ꯍꯦꯔꯤꯇꯦꯖ ꯑꯁꯤꯅꯥ ꯔꯣ ꯃꯦꯇꯔꯤꯌꯦꯂꯁꯤꯡ ꯑꯁꯤ ꯄꯤꯔꯤ ꯑꯃꯁꯨꯡ ."
the environment is the cook who prepares the actual menu,ꯑꯀꯣꯌꯕꯁꯤ ꯇꯁꯦꯡꯅꯥ ꯃꯦꯅꯨ ꯁꯦꯝ ꯁꯥꯕꯥ ꯀꯨꯛ ꯑꯗꯨꯅꯤ .
The environment plays a crucial part in determining human behaviour,ꯃꯤꯑꯣꯏꯕꯒꯤ ꯂꯃꯆꯠ-ꯁꯥꯖꯠ ꯂꯦꯄꯊꯣꯀꯄꯗꯥ ꯑꯀꯣꯌꯔꯣꯟ ꯑꯁꯤꯅꯥ ꯃꯔꯨꯑꯣꯏꯕꯥ ꯊꯧꯗꯥꯡ ꯂꯧꯔꯤ
It interacts in a complex and intricate manner with hereditary forces to,ꯃꯁꯤꯅꯥ ꯍꯦꯔꯤꯇꯦꯖ ꯐꯣꯔꯁꯁꯤꯡꯒꯥ ꯂꯣꯌꯅꯅꯥ ꯀꯝꯞꯂꯦꯛꯁ ꯑꯃꯁꯨꯡ ꯏꯟꯠꯔꯤꯀꯦꯠ ꯑꯣꯏꯕꯥ ꯃꯑꯣꯡꯗꯥ ꯏꯟꯇꯔꯦꯛꯇ ꯇꯧꯏ꯫
produce what manifests as human behaviour,ꯃꯤꯑꯣꯏꯕꯒꯤ ꯂꯃꯆꯠ-ꯁꯥꯖꯠ ꯑꯣꯏꯅꯥ ꯃꯁꯛ ꯇꯥꯀꯄꯥ ꯑꯗꯨ ꯄꯨꯊꯣꯀꯄꯥ .
Environment is important for physical growth; it is important for,ꯐꯤꯖꯤꯀꯦꯜ ꯒ꯭ꯔꯣꯊꯀꯤꯗꯃꯛ ꯑꯀꯣꯌꯔꯣꯟ ꯑꯁꯤ ꯃꯔꯨꯑꯣꯏ;
"development, and learning. To some extent, even maturation may be","ꯗꯤꯕꯦꯂꯄꯃꯦꯟꯇ, ꯑꯃꯁꯨꯡ ꯂꯔꯅꯤꯡ꯫"
delayed if the environment is not cooperating,ꯀꯔꯤꯒꯨꯝꯕꯥ ꯑꯀꯣꯌꯕꯅꯥ ꯃꯇꯦꯡ ꯄꯥꯡꯂꯃꯗ꯭ꯔꯕꯗꯤ ꯊꯦꯡꯊꯕꯥ .
"In this unit, we discuss the various aspects of the child’s environment",ꯌꯨꯅꯤꯠ ꯑꯁꯤꯗꯥ ꯑꯩꯈꯣꯌꯅꯥ ꯑꯉꯥꯡꯒꯤ ꯑꯀꯣꯌꯕꯒꯤ ꯐꯤꯕꯃꯒꯤ ꯇꯣꯉꯥꯟ ꯇꯣꯉꯥꯅꯕꯥ ꯃꯁꯀꯁꯤꯡ ꯈꯟꯅꯔꯤ
"that significantly effect on the child’s growth, development, learning and","ꯑꯉꯥꯡ ꯑꯗꯨꯒꯤ ꯒ꯭ꯔꯣꯊ, ꯗꯤꯚꯦꯂꯄꯃꯦꯟꯇ, ꯂꯔꯅꯤꯡ ꯑꯃꯁꯨꯡ ꯂꯔꯅꯤꯡꯗꯥ ꯃꯁꯛ ꯊꯣꯀꯄꯥ ꯏꯐꯦꯛꯇ ꯑꯗꯨ ."
behaviour,ꯂꯤꯆꯠ ꯁꯥꯖꯠ
The outlined critical elements in the physical and logical environment,ꯐꯤꯖꯤꯀꯦꯜ ꯑꯃꯁꯨꯡ ꯂꯣꯖꯤꯀꯦꯜ ꯑꯦꯅꯚꯥꯏꯔꯅꯃꯦꯟꯇꯇꯥ ꯑꯥꯎꯠꯂꯥꯏꯟ ꯇꯧꯔꯕꯥ ꯃꯔꯨ ꯑꯣꯏꯕꯥ ꯃꯆꯥꯀꯁꯤꯡ
We also discuss the psychosocial environment of the child,ꯑꯩꯈꯣꯌꯅꯥ ꯑꯉꯥꯡ ꯑꯗꯨꯒꯤ ꯁꯥꯏꯀꯣꯁꯣꯁꯤꯑꯦꯜ ꯑꯦꯅꯚꯥꯏꯔꯅꯃꯦꯟꯇꯀꯤ ꯃꯇꯥꯡꯗꯁꯨ ꯈꯟꯅꯔꯤ
5.2.       Learning Outcomes,꯵.꯲ ꯑꯃꯁꯨꯡ ꯑꯦꯟ.
"By the end of this unit, you should be able to:","ꯌꯨꯅꯤꯠ ꯑꯁꯤꯒꯤ ꯑꯔꯣꯏꯕꯗꯥ, ꯅꯍꯥꯛꯅꯥ ꯃꯈꯥꯗꯥ ꯄꯤꯔꯤꯕꯁꯤꯡꯁꯤ ꯇꯧꯕꯥ ꯉꯃꯒꯗꯕꯅꯤ:"
Describe the critical aspects of the physical environment of the,ꯒꯤ ꯐꯤꯖꯤꯀꯦꯜ ꯑꯦꯅꯚꯥꯏꯔꯅꯃꯦꯟꯇꯀꯤ ꯃꯔꯨꯑꯣꯏꯕꯥ ꯃꯁꯀꯁꯤꯡ ꯑꯗꯨ ꯐꯣꯡꯗꯣꯀꯄꯤꯌꯨ꯫
child that impact on development and learning,ꯗꯤꯚꯦꯂꯄꯃꯦꯟꯇ ꯑꯃꯁꯨꯡ ꯂꯔꯅꯤꯡꯗꯥ ꯏꯝꯄꯦꯛꯇ ꯇꯧꯔꯤꯕꯥ ꯑꯉꯥꯡ
Outline the various aspects of the child’s psychosocial environment,ꯑꯉꯥꯡ ꯑꯗꯨꯒꯤ ꯁꯥꯏꯀꯣꯁꯣꯁꯤꯑꯦꯜ ꯑꯦꯅꯚꯥꯏꯔꯅꯃꯦꯟꯇꯀꯤ ꯇꯣꯉꯥꯟ-ꯇꯣꯉꯥꯅꯕꯥ ꯃꯁꯀꯁꯤꯡ ꯑꯗꯨ ꯐꯣꯡꯗꯣꯀꯄꯤꯌꯨ꯫
that contribute in determining behaviour,ꯂꯃꯆꯠ-ꯁꯥꯖꯠ ꯂꯦꯄꯊꯣꯀꯄꯗꯥ ꯃꯇꯦꯡ ꯄꯥꯡꯂꯤꯕꯥ
PED121,ꯄꯤ.ꯏ.ꯗꯤ.꯱꯲꯱ ꯑꯃꯁꯨꯡ ꯑꯦꯟ.
CHILDHOOD AND ADOLESCENT PSYCHOLOGY,ꯑꯉꯥꯡ ꯑꯣꯏꯔꯤꯉꯩ ꯑꯃꯁꯨꯡ ꯏꯅꯈꯠꯂꯛꯂꯤꯕꯥ ꯁꯥꯏꯀꯣꯂꯣꯖꯤ
40,꯴꯰ ꯑꯃꯁꯨꯡ ꯴.
Discuss the importance of stimulating the environment for child,ꯑꯉꯥꯡꯒꯤꯗꯃꯛ ꯑꯀꯣꯌꯔꯣꯟ ꯍꯦꯅꯒꯠꯍꯅꯕꯒꯤ ꯃꯔꯨꯑꯣꯏꯕꯥ ꯑꯗꯨ ꯈꯟꯅ-ꯅꯩꯅꯕꯥ
growth and development,ꯆꯥꯎꯈꯠꯄꯥ ꯑꯃꯁꯨꯡ ꯆꯥꯎꯈꯠꯄꯥ .
5.3  Titles of the Main Sections,꯵.꯳ ꯃꯔꯨꯑꯣꯏꯕꯥ ꯁꯦꯛꯁꯅꯁꯤꯡꯒꯤ ꯇꯥꯏꯇꯦꯂꯁꯤꯡ .
5.3.1 The Physical Environment,꯵.꯳.꯱ꯒꯤ ꯐꯤꯖꯤꯀꯦꯜ ꯑꯦꯅꯚꯥꯏꯔꯅꯃꯦꯟꯇ .
The physical environment of the child is all the concrete animate and,ꯑꯉꯥꯡ ꯑꯗꯨꯒꯤ ꯐꯤꯖꯤꯀꯦꯜ ꯑꯦꯅꯚꯥꯏꯔꯅꯃꯦꯟꯇ ꯑꯁꯤ ꯀꯪꯛꯔꯤꯠ ꯑꯦꯅꯤꯃꯦꯠ ꯄꯨꯝꯅꯃꯛꯅꯤ ꯑꯃꯁꯨꯡ .
inanimate objects within the child’s experiential reach. These are living,ꯑꯉꯥꯡ ꯑꯗꯨꯒꯤ ꯑꯦꯛꯁꯄꯤꯔꯤꯑꯦꯟꯁꯤꯑꯦꯜ ꯔꯤꯆ꯭ꯁꯀꯤ ꯃꯅꯨꯡꯗꯥ ꯂꯩꯕꯥ ꯏꯅꯑꯦꯅꯤꯃꯦꯇꯦꯗ ꯑꯣꯕꯖꯦꯛꯇꯁꯤꯡ꯫
things and the non-living things that the child can have direct,ꯄꯣꯠꯁꯤꯡ ꯑꯃꯁꯨꯡ ꯑꯉꯥꯡ ꯑꯗꯨꯅꯥ ꯍꯀꯊꯦꯡꯅꯅꯥ ꯂꯩꯕꯥ ꯌꯥꯕꯥ ꯍꯤꯡꯗꯕꯥ ꯄꯣꯠꯁꯀꯁꯤꯡ .
acquaintance,ꯈꯪꯅꯕ
Living things with which a child can have direct concrete experience,ꯑꯉꯥꯡ ꯑꯃꯅꯥ ꯍꯀꯊꯦꯡꯅꯅꯥ ꯀꯪꯛꯔꯤꯠ ꯑꯦꯛꯁꯄꯤꯔꯤꯑꯦꯟꯁ ꯂꯩꯕꯥ ꯌꯥꯕꯥ ꯄꯣꯠꯁꯀꯁꯤꯡ ꯍꯤꯡꯕꯥ
"include human beings  parents, siblings, peers, neighbours. They also","ꯃꯤꯑꯣꯏꯕꯒꯤ ꯃꯃꯥ-ꯃꯄꯥ, ꯃꯆꯤꯟ-ꯃꯅꯥꯑꯣ, ꯃꯔꯨꯄꯁꯤꯡ, ꯌꯨꯃꯂꯣꯟꯅꯕꯁꯤꯡ ꯌꯥꯑꯣꯔꯤ꯫"
include domestic and wild animals. Domestic animals may include,ꯗꯣꯃꯦꯁ꯭ꯇꯤꯛ ꯑꯃꯁꯨꯡ ꯋꯥꯏꯜꯗ ꯑꯦꯅꯤꯃꯦꯂꯁꯤꯡ ꯌꯥꯎꯍꯅꯕꯥ꯫
"cows, goats, dogs, chicken and other pet animals. Wild animals may","ꯁꯟ-ꯏꯔꯣꯏꯁꯤꯡ, ꯉꯥ, ꯌꯨꯃꯁꯥ, ꯉꯥ ꯑꯃꯁꯨꯡ ꯑꯇꯩ ꯄꯣꯠꯁꯀꯁꯤꯡ꯫"
"include rats, monkeys, birds of the air, insects, and other pests; then","ꯌꯥꯑꯣꯔꯤꯕꯁꯤꯡ ꯑꯗꯨꯗꯤ ꯔꯦꯠꯁꯤꯡ, ꯉꯥꯁꯤꯡ, ꯅꯨꯡꯁꯤꯠꯀꯤ ꯎꯆꯦꯀꯁꯤꯡ, ꯄꯣꯠꯁꯀꯁꯤꯡ, ꯑꯃꯁꯨꯡ ꯑꯇꯣꯞꯄꯥ ꯄꯣꯠꯁꯀꯁꯤꯡ;"
plants,ꯄꯥꯝꯕꯤꯁꯤꯡ
Non-living things a child may have direct concrete experience with,ꯑꯉꯥꯡ ꯑꯃꯅꯥ ꯍꯀꯊꯦꯡꯅꯅꯥ ꯀꯪꯛꯔꯤꯠ ꯑꯦꯛꯁꯄꯔꯤꯑꯦꯟꯁ ꯂꯩꯕꯥ ꯌꯥꯕꯥ ꯅꯟ-ꯂꯤꯚꯤꯡ ꯋꯥꯐꯃꯁꯤꯡ
"include food and feeding materials, clothing, toys, farm implements,","ꯆꯥꯅꯕꯥ ꯑꯃꯁꯨꯡ ꯄꯤꯖꯕꯒꯤ ꯃꯆꯥꯀꯁꯤꯡ, ꯄꯣꯠꯂꯃꯁꯤꯡ, ꯁꯥꯟꯅꯄꯣꯠꯁꯤꯡ, ꯂꯧꯎ-ꯁꯤꯡꯎꯒꯤ ꯊꯕꯀꯁꯤꯡ, ."
"radio and television, book materials, and others.   There are also houses","ꯔꯦꯗꯤꯑꯣ ꯑꯃꯁꯨꯡ ꯇꯦꯂꯤꯚꯤꯖꯟ, ꯂꯥꯏꯔꯤꯛ ꯃꯆꯥꯀꯁꯤꯡ, ꯑꯃꯁꯨꯡ ꯑꯇꯩꯁꯤꯡ꯫"
"for different purposes, and places for different purposes","ꯇꯣꯉꯥꯟ ꯇꯣꯉꯥꯅꯕꯥ ꯄꯥꯟꯗꯃꯁꯤꯡꯒꯤꯗꯃꯛ, ꯑꯃꯁꯨꯡ ꯇꯣꯉꯥꯟ ꯇꯣꯉꯥꯅꯕꯥ ꯄꯥꯟꯗꯃꯁꯤꯡꯒꯤꯗꯃꯛ ꯃꯐꯃꯁꯤꯡ"
Physical objects and persons in the child’s environment are not,ꯐꯤꯖꯤꯀꯦꯜ ꯑꯣꯕꯖꯦꯛꯇꯁꯤꯡ ꯑꯃꯁꯨꯡ ꯑꯉꯥꯡ ꯑꯗꯨꯒꯤ ꯑꯀꯣꯌꯕꯗꯥ ꯂꯩꯕꯥ ꯃꯤꯑꯣꯏꯁꯤꯡ ꯑꯁꯤ .
important just because they are there either as accumulated property or as,ꯃꯔꯨꯑꯣꯏꯕꯥ ꯃꯔꯃꯗꯤ ꯃꯈꯣꯌ ꯑꯁꯤ ꯑꯦꯛꯌꯨꯃꯨꯂꯦꯇꯦꯗ ꯄ꯭ꯔꯣꯄꯔꯇꯤ ꯑꯣꯏꯅꯥ ꯅꯠꯔꯒꯥ ꯑꯦ.ꯑꯦꯁ.
"just artefacts. Psychologically speaking, physical things in the child’s",ꯁꯨꯞꯅꯒꯤ ꯑꯥꯔꯇꯤꯐꯦꯛꯇꯁꯤꯡ꯫
environment are important to the extent that they engender growth and,ꯑꯀꯣꯌꯔꯣꯟ ꯑꯁꯤ ꯃꯈꯣꯌꯅꯥ ꯒ꯭ꯔꯣꯊ ꯑꯃꯁꯨꯡ 100000000000000000000000000000000000000000000000 ꯐꯥꯎꯕꯒꯤ ꯃꯅꯨꯡꯗꯥ 2.
development. Physical things are important to growth and development,ꯆꯥꯎꯈꯠꯄ.
if the child can access them and perform actions on them,ꯀꯔꯤꯒꯨꯝꯕꯥ ꯑꯉꯥꯡ ꯑꯗꯨꯅꯥ ꯃꯈꯣꯌꯕꯨ ꯑꯦꯛꯁꯦꯁ ꯇꯧꯕꯥ ꯉꯝꯂꯕꯗꯤ ꯑꯃꯁꯨꯡ ꯃꯈꯣꯌꯗꯥ ꯑꯦꯛꯁꯅꯁꯤꯡ ꯄꯥꯡꯊꯣꯀꯄꯥ ꯉꯝꯂꯕꯗꯤ꯫
"A child’s actions on objects of experience may include sucking, biting,","ꯑꯦꯛꯁꯄꯔꯤꯑꯦꯟꯁꯀꯤ ꯑꯣꯕꯖꯦꯛꯇꯁꯤꯡꯗꯥ ꯑꯉꯥꯡ ꯑꯃꯒꯤ ꯑꯦꯛꯁꯅꯁꯤꯡ ꯑꯁꯤ ꯌꯥꯎꯕꯥ ꯌꯥꯏ, ꯃꯈꯣꯌꯗꯨ ꯆꯨꯃꯊꯣꯀꯄꯥ, ꯁꯣꯀꯄꯥ, ."
"chewing, feeling, cuddling, dismantling, assembling, and others actions","ꯆ꯭ꯌꯨꯏꯪ, ꯐꯤꯜꯂꯤꯡ, ꯀꯗꯂꯤꯡ, ꯗꯤꯁꯃꯟꯇꯦꯜ, ꯑꯦꯁꯦꯝꯕꯂꯤꯡ, ꯑꯃꯁꯨꯡ ꯑꯇꯩ ꯑꯦꯛꯁꯅꯁꯤꯡ"
a child performs on objects of knowledge help the child to name them,ꯑꯉꯥꯡ ꯑꯃꯅꯥ ꯂꯧꯁꯤꯡꯒꯤ ꯄꯣꯠꯁꯀꯁꯤꯡꯗꯥ ꯊꯕꯛ ꯇꯧꯏ ꯑꯉꯥꯡ ꯑꯗꯨꯕꯨ ꯃꯈꯣꯌꯒꯤ ꯃꯃꯤꯡ ꯊꯣꯅꯕꯗꯥ ꯃꯇꯦꯡ ꯄꯥꯡꯏ꯫
"discover their texture, and their uses","ꯃꯈꯣꯌꯒꯤ ꯇꯦꯛꯁꯆꯔ, ꯑꯃꯁꯨꯡ ꯃꯈꯣꯌꯒꯤ ꯁꯤꯖꯤꯟꯅꯐꯃꯁꯤꯡ ꯈꯉꯗꯣꯀꯎ"
"The child, for example, learns that some objects are smooth, some are","ꯈꯨꯗꯝ ꯑꯣꯏꯅꯥ, ꯑꯉꯥꯡ ꯑꯗꯨꯅꯥ ꯄꯣꯠꯁꯛ ꯈꯔꯗꯤ ꯂꯦꯡꯗꯅꯥ ꯂꯩ ꯍꯥꯌꯕꯥ ꯈꯪꯏ, ꯈꯔꯗꯤ ."
"soft, some brittle, some course, some rattle, some are sweet, only by","ꯇꯔꯨ ꯇꯅꯥꯅꯕꯥ, ꯈꯔꯥ ꯕ꯭ꯔꯤꯇꯤꯜ, ꯈꯔꯥ ꯀꯣꯔꯁ, ꯈꯔꯅꯥ ꯔꯦꯠꯂ, ꯈꯔꯗꯤ ꯃꯆꯤꯟꯖꯥꯛ, only"
"touching, feeling, shaking, or tasting them","ꯃꯈꯣꯌꯕꯨ ꯊꯨꯃꯖꯤꯅꯕꯥ, ꯋꯥꯈꯜ ꯇꯥꯕꯥ, ꯈꯣꯡ ꯍꯥꯝꯕꯥ ꯅꯠꯠꯔꯒꯥ ꯇꯦꯁ꯭ꯠ ꯇꯧꯕꯥ"
