en,mni-Mtei
"way, ‘Won’t some of you come for a drive? I’ve been working","ꯋꯦ, ‘ꯅꯉꯒꯤ ꯃꯔꯛꯇꯒꯤ ꯈꯔꯗꯤ ꯗ꯭ꯔꯥꯏꯕꯀꯤꯗꯃꯛ ꯂꯥꯀꯄꯥ ꯅꯠꯇꯦ?"
"away at mathematics till my head is in a muddle, and I’m going","ꯑꯩꯒꯤ ꯃꯀꯣꯛ ꯑꯁꯤ ꯃꯔꯥꯜ ꯑꯃꯗꯥ ꯂꯩꯕꯥ ꯐꯥꯑꯣꯕꯥ ꯃꯦꯊꯃꯦꯇꯤꯛꯁꯇꯥ ꯂꯥꯞꯅꯥ ꯂꯩ, ꯑꯃꯁꯨꯡ ꯑꯩꯅꯥ ꯆꯠꯂꯤ ."
"to freshen my wits by a brisk turn. It’s a dull day, but the air isn’t",ꯑꯩꯒꯤ ꯋꯥꯈꯂꯁꯤꯡꯕꯨ ꯌꯥꯝꯅꯥ ꯊꯨꯅꯥ ꯌꯥꯡꯅꯥ ꯆꯦꯅꯕꯥ ꯉꯝꯅꯕꯥ꯫
"bad, and I’m going to","ꯐꯠꯇꯕꯥ, ꯑꯃꯁꯨꯡ ꯑꯩꯅꯥ ꯆꯠꯀꯅꯤ ."
276,꯲꯷꯶ ꯑꯃꯁꯨꯡ ꯑꯦꯟ.
"take Brooke home, so it will be gay inside, if it isn’t out. Come,","ꯕ꯭ꯔꯨꯛ ꯌꯨꯃꯗꯥ ꯄꯨꯔꯀꯎ, ꯃꯔꯝ ꯑꯗꯨꯅꯥ ꯃꯁꯤ ꯃꯅꯨꯡꯗꯥ ꯒꯦ ꯑꯣꯏꯒꯅꯤ, ꯀꯔꯤꯒꯨꯝꯕꯥ ꯃꯗꯨ ꯊꯣꯛꯂꯛꯇꯕꯥ ꯑꯣꯏꯔꯕꯗꯤ꯫"
"Jo, you and Beth will go, won’t you?’","ꯖꯣ, ꯅꯉ ꯑꯃꯁꯨꯡ ꯕꯦꯠꯅꯥ ꯆꯠꯀꯅꯤ, ꯅꯠꯇꯦ?’"
‘Of course we will.’,‘ꯑꯆꯨꯝꯕꯅꯤ ꯑꯩꯈꯣꯌꯅꯥ ꯇꯧꯒꯅꯤ꯫’
"‘Much obliged, but I’m busy.’ And Meg whisked out her","‘ꯌꯥꯝꯅꯥ ꯑꯣꯕꯂꯤꯒꯦꯁꯟ ꯇꯧꯕꯥ, ꯑꯗꯨꯕꯨ ꯑꯩꯗꯤ ꯌꯥꯝꯅꯥ ꯋꯥꯅꯥ ꯊꯣꯀꯏ꯫’ ꯑꯃꯁꯨꯡ ꯃꯦꯒꯅꯥ ꯃꯍꯥꯀꯄꯨ ꯍꯨꯏꯁ ꯇꯧꯈꯤ"
"workbasket, for she had agreed with her mother that it was","ꯋꯥꯔꯀꯕꯥꯁ꯭ꯀꯦꯠ, ꯃꯔꯃꯗꯤ ꯃꯍꯥꯛꯅꯥ ꯃꯍꯥꯛꯀꯤ ꯃꯃꯥꯒꯥ ꯌꯥꯅꯕꯥ ꯄꯨꯔꯀꯈꯤ ꯃꯗꯨꯗꯤ ꯃꯁꯤꯅꯤ ."
"best, for her at least, not to drive too often with the young","ꯈ꯭ꯕꯥꯏꯗꯒꯤ ꯐꯕꯥ, ꯌꯥꯃꯗ꯭ꯔꯕꯗꯥ ꯃꯍꯥꯛꯀꯤꯗꯃꯛꯇꯗꯤ, ꯅꯍꯥ ꯑꯣꯏꯔꯤꯕꯥ ꯃꯤꯑꯣꯏꯁꯤꯡꯒꯥ ꯂꯣꯌꯅꯅꯥ ꯑꯌꯥꯝꯕꯥ ꯃꯇꯃꯗꯥ ꯒꯥꯔꯤ ꯊꯧꯕꯥ ꯌꯥꯔꯣꯏ꯫"
gentleman,ꯖꯦꯟꯇꯂꯃꯦꯟ .
"‘We three will be ready in a minute,’ cried Amy, running away to",‘ꯑꯩꯈꯣꯌ ꯑꯍꯨꯝ ꯃꯤꯅꯤꯠ ꯑꯃꯗꯥ ꯁꯦꯝ ꯁꯥꯗꯨꯅꯥ ꯂꯩꯒꯅꯤ’ ꯍꯥꯌꯅꯥ ꯑꯦꯃꯤꯅꯥ ꯀꯞꯂꯒꯥ ꯂꯥꯀꯈꯤ
wash her hands,ꯃꯍꯥꯛꯀꯤ ꯈꯨꯠ ꯍꯥꯃꯗꯣꯀꯄꯥ
"‘Can I do anything for you, Madam Mother?’ asked Laurie,","‘ꯑꯩꯅꯥ ꯅꯉꯒꯤꯗꯃꯛ ꯀꯔꯤꯒꯨꯝꯕꯥ ꯈꯔꯥ ꯇꯧꯕꯥ ꯉꯃꯒꯗ꯭ꯔꯥ, ꯃꯦꯗꯝ ꯃꯥꯗꯥ?’ ꯂꯧꯔꯤꯅꯥ ꯍꯪꯈꯤ,"
leaning over Mrs. March’s chair with the affectionate look and,ꯅꯨꯡꯁꯤꯖꯔꯕꯥ ꯃꯤꯠꯌꯦꯡ ꯑꯗꯨꯒꯥ ꯂꯣꯌꯅꯅꯥ ꯁ꯭ꯔꯤꯃꯇꯤ ꯃꯥꯔꯆꯀꯤ ꯆꯦꯌꯥꯔꯒꯤ ꯃꯊꯛꯇꯥ ꯂꯦꯞꯄꯥ ꯑꯃꯁꯨꯡ
tone he always gave her,ꯇꯣꯟ ꯃꯍꯥꯛꯅꯥ ꯃꯇꯝ ꯄꯨꯝꯅꯃꯛꯇꯥ ꯃꯍꯥꯀꯄꯨ ꯄꯤꯖꯈꯤ
"‘No, thank you, except call at the office, if you’ll be so kind,","‘ꯅꯠꯇꯦ, ꯊꯥꯒꯠꯆꯔꯤ, ꯑꯣꯐꯤꯁꯇꯥ ꯀꯜ ꯇꯧꯕꯥ ꯅꯠꯇꯅꯥ, ꯀꯔꯤꯒꯨꯝꯕꯥ ꯅꯍꯥꯛꯅꯥ ꯑꯁꯨꯛ ꯌꯥꯝꯅꯥ ꯃꯤꯅꯨꯡꯁꯤ ꯂꯩꯔꯕꯗꯤ,"
"dear. It’s our day for a letter, and the postman hasn’t been",ꯅꯨꯡꯁꯤꯔꯕ.
"Father is as regular as the sun, but there’s some delay on the","ꯃꯄꯥ ꯑꯁꯤ ꯅꯨꯃꯤꯠꯀꯤ ꯃꯇꯨꯡ ꯏꯟꯅꯥ ꯔꯦꯒꯨꯂꯥꯔ ꯑꯣꯏ, ꯑꯗꯨꯕꯨ ꯲꯰꯲꯰ꯒꯤ ꯃꯇꯥꯡꯗꯥ ꯊꯦꯡꯊꯕꯥ ꯈꯔꯥ ꯂꯩ꯫"
"way, perhaps.’","ꯂꯝꯕꯤ, ꯌꯥꯑꯣꯔꯃꯒꯅꯤ꯫’"
"A sharp ring interrupted her, and a minute after Hannah came","ꯁꯥꯔꯞ ꯔꯤꯡ ꯑꯃꯅꯥ ꯃꯍꯥꯀꯄꯨ ꯊꯨꯒꯥꯏꯈꯤ, ꯑꯃꯁꯨꯡ ꯍꯥꯟꯅꯥ ꯂꯥꯀꯈꯤꯕꯥ ꯃꯤꯅꯤꯠ ꯑꯃꯒꯤ ꯃꯇꯨꯡꯗꯥ"
in with a letter,ꯆꯤꯊꯤ ꯑꯃꯒꯥ ꯂꯣꯌꯅꯅꯥ .
"‘It’s one of them horrid telegraph things, mum,’ she said,","‘ꯃꯁꯤ ꯃꯈꯣꯌꯒꯤ ꯃꯅꯨꯡꯗꯥ ꯑꯃꯅꯤ ꯍꯣꯔꯤꯗ ꯇꯦꯂꯤꯒ꯭ꯔꯥꯐ ꯄꯣꯠꯁꯤꯡ, ꯃꯃꯥ’ ꯍꯥꯌꯅꯥ ꯃꯍꯥꯛꯅꯥ ꯍꯥꯌꯈꯤ,"
handling it as if she was afraid it would explode and do some,ꯃꯁꯤ ꯄꯣꯠꯁꯛ ꯑꯃꯅꯥ ꯁꯣꯀꯍꯅꯒꯅꯤ ꯑꯃꯁꯨꯡ ꯈꯔꯥ ꯇꯧꯒꯅꯤ ꯍꯥꯌꯅꯥ ꯀꯤꯕꯥ ꯃꯑꯣꯡꯗꯥ ꯍꯦꯟꯗꯜ ꯇꯧꯕꯥ
damage,ꯑꯁꯣꯛ ꯑꯄꯟ ꯅꯪꯕ
277,꯲꯷꯷ ꯑꯃꯁꯨꯡ ꯑꯦꯟ.
"At the word ‘telegraph’, Mrs. March snatched it, read the two","‘ꯇꯦꯂꯤꯒ꯭ꯔꯥꯐ’ ꯍꯥꯌꯕꯥ ꯋꯥꯍꯩ ꯑꯁꯤꯗꯥ ꯁ꯭ꯔꯤꯃꯇꯤ ꯃꯥꯔꯆꯅꯥ ꯃꯁꯤ ꯂꯧꯊꯣꯀꯈꯤ, ꯑꯅꯤ ꯑꯁꯤ ꯄꯥꯕꯤꯌꯨ"
"lines it contained, and dropped back into her chair as white as if","ꯃꯁꯤꯗꯥ ꯌꯥꯑꯣꯔꯤꯕꯥ ꯂꯥꯏꯅꯁꯤꯡ, ꯑꯃꯁꯨꯡ ꯃꯍꯥꯛꯀꯤ ꯆꯦꯌꯥꯔꯗꯥ ꯑꯃꯨꯛ ꯍꯟꯅꯥ ꯊꯨꯒꯥꯏꯗꯨꯅꯥ ꯋꯥꯏꯇꯦꯄꯀꯤ ꯃꯇꯨꯡ ꯏꯟꯅꯥ ."
the little paper had sent a bullet to her heart,ꯑꯄꯤꯀꯄꯥ ꯄꯦꯄꯔ ꯑꯗꯨꯅꯥ ꯃꯍꯥꯛꯀꯤ ꯊꯝꯃꯣꯌꯗꯥ ꯕꯨꯂꯦꯠ ꯑꯃꯥ ꯊꯥꯔꯀꯈꯤ .
"Laurie dashed downstairs for water, while Meg and Hannah","ꯂꯧꯔꯤꯅꯥ ꯃꯈꯥꯗꯥ ꯏꯁꯤꯡ ꯇꯨꯡꯁꯤꯅꯈꯤ, ꯑꯗꯨꯒꯥ ꯃꯦꯒ ꯑꯃꯁꯨꯡ ꯍꯥꯟꯅꯥ"
"supported her, and Jo read aloud, in a frightened voice","ꯃꯍꯥꯀꯄꯨ ꯁꯄꯣꯔꯠ ꯇꯧꯈꯤ, ꯑꯃꯁꯨꯡ ꯖꯣꯅꯥ ꯌꯥꯝꯅꯥ ꯋꯥꯅꯥ ꯄꯥꯈꯤ, ꯊꯋꯥꯏ ꯌꯥꯑꯣꯕꯥ ꯈꯣꯟꯖꯦꯜ ꯑꯃꯗꯥ"
Mrs. March:,ꯁ꯭ꯔꯤꯃꯇꯤ ꯃꯥꯔꯆ:
Your husband is very ill. Come at once,ꯅꯍꯥꯛꯀꯤ ꯃꯄꯨꯔꯣꯏꯕꯥ ꯌꯥꯝꯅꯥ ꯂꯥꯌꯅꯥ ꯅꯥꯔꯦ꯫
S. HALE,ꯑꯦꯁ ꯍꯥꯂꯦ .
"Blank Hospital, Washington","ꯕ꯭ꯂꯦꯉ꯭ꯛ ꯍꯣꯁ꯭ꯄꯤꯇꯥꯜ, ꯋꯥꯁꯤꯡꯇꯟꯗꯥ ꯂꯩꯕꯥ ꯌꯨ.ꯑꯦꯁ."
"How still the room was as they listened breathlessly, how","ꯃꯈꯣꯌꯅꯥ ꯊꯋꯥꯏ ꯌꯥꯑꯣꯅꯥ ꯇꯥꯕꯥ ꯃꯇꯃꯗꯥ ꯔꯨꯝ ꯑꯗꯨ ꯀꯌꯥꯗꯥ ꯍꯧꯖꯤꯀꯁꯨ ꯑꯣꯏꯈꯤ, ꯃꯇꯧ ꯀꯔꯝꯅꯥ"
"strangely the day darkened outside, and how suddenly the","ꯑꯆꯝꯕꯥ ꯃꯑꯣꯡꯗꯥ ꯃꯄꯥꯟꯗꯥ ꯊꯣꯀꯄꯥ ꯅꯨꯃꯤꯠ ꯑꯗꯨ, ꯑꯃꯁꯨꯡ ꯀꯌꯥꯗꯥ ꯈꯉꯍꯧꯗꯅꯥ ꯅꯨꯃꯤꯠ ꯑꯗꯨ ."
"whole world seemed to change, as the girls gathered about","ꯃꯥꯂꯦꯝ ꯄꯨꯝꯕꯅꯥ ꯍꯣꯡꯂꯛꯂꯤꯕꯥ ꯃꯑꯣꯡꯗꯥ, ꯅꯨꯄꯤꯃꯆꯥꯁꯤꯡꯅꯥ ꯇꯤꯅꯈꯤꯕꯥ ꯃꯇꯃꯗꯥ ."
"their mother, feeling as if all the happiness and support of their","ꯃꯈꯣꯌꯒꯤ ꯃꯃꯥ, ꯃꯈꯣꯌꯒꯤ ꯅꯨꯡꯉꯥꯏꯕꯥ ꯑꯃꯁꯨꯡ ꯁꯄꯣꯔꯠ ꯄꯨꯝꯅꯃꯛ ꯑꯣꯏꯅꯥ ꯐꯥꯑꯣꯔꯀꯄꯒꯨꯝ꯫"
lives was about to be taken from them,ꯄꯨꯟꯁꯤꯁꯤꯡ ꯑꯗꯨ ꯃꯈꯣꯌꯗꯒꯤ ꯂꯧꯔꯀꯄꯥ ꯌꯥꯏ .
"Mrs. March was herself again directly, read the message over,","ꯁ꯭ꯔꯤꯃꯇꯤ ꯃꯥꯔꯆꯅꯥ ꯃꯁꯥꯃꯛ ꯑꯃꯨꯛ ꯍꯟꯅꯥ ꯍꯀꯊꯦꯡꯅꯅꯥ ꯑꯣꯏꯈꯤ, ꯄꯥꯎꯖꯦꯜ ꯑꯗꯨ ꯑꯃꯨꯛ ꯍꯟꯅꯥ ꯄꯥꯕꯤꯌꯨ,"
"and stretched out her arms to her daughters, saying, in a tone","ꯑꯃꯁꯨꯡ ꯃꯍꯥꯛꯀꯤ ꯃꯈꯨꯠꯁꯤꯡ ꯑꯗꯨ ꯃꯍꯥꯛꯀꯤ ꯃꯆꯥꯅꯨꯄꯤꯁꯤꯡꯗꯥ ꯊꯥꯡꯒꯠꯈꯤ, ꯍꯥꯌꯗꯨꯅꯥ, ꯈꯣꯟꯖꯦꯜ ꯑꯃꯗꯥ"
"they never forgot, ‘I shall go at once, but it may be too late. Oh,","ꯃꯈꯣꯌꯅꯥ ꯀꯩꯗꯧꯅꯨꯡꯗꯥ ꯀꯥꯑꯣꯈꯤꯗꯦ, ‘ꯑꯩꯅꯥ ꯈꯨꯗꯛꯇꯥ ꯆꯠꯀꯅꯤ, ꯑꯗꯨꯕꯨ ꯌꯥꯝꯅꯥ ꯊꯦꯡꯊꯕꯥ ꯑꯣꯏꯔꯝꯕꯥ ꯌꯥꯏ꯫"
"children, children, help me to bear it!’","ꯑꯉꯥꯡꯁꯤꯡ, ꯑꯉꯥꯡꯁꯤꯡ, ꯑꯩꯉꯣꯟꯗꯥ ꯃꯇꯦꯡ ꯄꯥꯡꯕꯤꯌꯨ!’"
278,꯲꯷꯸ ꯑꯃꯁꯨꯡ ꯑꯦꯟ.
For several minutes there was nothing but the sound of sobbing,ꯃꯤꯅꯤꯠ ꯀꯌꯥ ꯆꯨꯞꯅꯥ ꯁꯣꯕ ꯇꯧꯕꯒꯤ ꯃꯈꯣꯜ ꯑꯗꯨ ꯅꯠꯇꯅꯥ ꯀꯔꯤꯁꯨ ꯂꯩꯔꯃꯗꯦ .
"in the room, mingled with broken words of comfort, tender","ꯔꯨꯃꯗꯥ, ꯅꯨꯡꯉꯥꯏꯕꯒꯤ ꯋꯥꯍꯩꯁꯤꯡꯒꯥ ꯂꯣꯌꯅꯅꯥ ꯃꯤꯅꯝꯕꯥ, ꯇꯦꯟꯗꯔ"
"assurances of help, and hopeful whispers that died away in","ꯃꯇꯦꯡ ꯄꯥꯡꯕꯒꯤ ꯊꯥꯖꯕꯥ ꯄꯤꯕꯥ, ꯑꯃꯁꯨꯡ 2019ꯗꯥ ꯁꯤꯈꯤꯕꯥ ꯑꯥꯁꯥ ꯂꯩꯕꯥ ꯋꯥꯐꯃꯁꯤꯡ"
"tears. Poor Hannah was the first to recover, and with",ꯄꯤꯔꯥꯡ.
unconscious wisdom she set all the rest a,ꯑꯅꯀꯅꯁꯤꯌꯦꯟꯇ ꯋꯥꯏꯖꯗꯝ ꯃꯍꯥꯛꯅꯥ ꯁꯦꯠ ꯑꯣꯜ ꯗ꯭ꯌ ꯔꯦꯁ꯭ꯠ ꯑꯦ .
"good example, for with her, work was panacea for most","ꯑꯐꯕꯥ ꯈꯨꯗꯝ, ꯃꯔꯃꯗꯤ ꯃꯍꯥꯛꯀꯥ ꯂꯣꯌꯅꯅꯥ, ꯊꯕꯛ ꯑꯁꯤ ꯑꯌꯥꯝꯕꯒꯤꯗꯃꯛ ꯄꯦꯅꯥꯁꯤꯌꯥ ꯑꯣꯏꯈꯤ꯫"
afflictions,ꯑꯋꯥꯕꯁꯤꯡ ꯑꯁꯤ .
"‘The Lord keep the dear man! I won’t waste no time a- cryin’,",‘ꯏꯕꯨꯡꯉꯣꯅꯥ ꯅꯨꯡꯁꯤꯖꯔꯕꯥ ꯃꯤꯑꯣꯏ ꯑꯗꯨꯕꯨ ꯉꯥꯀꯄꯤꯌꯨ!
"but git your things ready right away, mum,’ she said heartily, as","ꯑꯗꯨꯕꯨ ꯒꯤꯠ ꯅꯍꯥꯛꯀꯤ ꯄꯣꯠꯁꯀꯁꯤꯡ ꯑꯗꯨ ꯈꯨꯗꯛꯇꯥ ꯁꯦꯝ ꯁꯥꯔꯦ, ꯃꯃꯥ,’ ꯃꯍꯥꯛꯅꯥ ꯊꯝꯃꯣꯌ ꯁꯦꯡꯅꯥ ꯍꯥꯌꯈꯤ, as"
"she wiped her face on her apron, gave her mistress a warm","ꯃꯍꯥꯛꯅꯥ ꯃꯍꯥꯛꯀꯤ ꯑꯦꯞꯔꯣꯅꯗꯥ ꯃꯍꯥꯛꯀꯤ ꯃꯐꯝ ꯑꯗꯨ ꯊꯨꯒꯥꯏꯈꯤ, ꯃꯍꯥꯛꯀꯤ ꯃꯤꯁ꯭ꯠꯔꯤꯗꯥ ꯋꯥꯔꯝ ꯑꯃꯥ ꯄꯤꯈꯤ"
"shake of the hand with her own hard one, and went away to","ꯃꯁꯥꯒꯤ ꯑꯀꯅꯕꯥ ꯑꯃꯒꯥ ꯂꯣꯌꯅꯅꯥ ꯈꯨꯠꯁꯥ ꯍꯩꯕꯥ, ꯑꯃꯁꯨꯡ ꯆꯠꯈꯤ꯫"
work like three women in one,ꯑꯃꯗꯥ ꯅꯨꯄꯤ ꯑꯍꯨꯃꯒꯨꯝ ꯊꯕꯛ ꯇꯧꯕꯥ .
"‘She’s right, there’s no time for tears now. Be calm, girls, and let","‘ꯑꯩꯍꯥꯛ ꯆꯨꯝꯃꯤ, ꯍꯧꯖꯤꯛ ꯃꯤꯠꯀꯨꯞ ꯑꯃꯠꯇꯥ ꯂꯩꯇꯦ꯫"
me think.’,ꯑꯩꯅꯥ ꯈꯜꯂꯤ꯫’
"They tried to be calm, poor things, as their mother sat up,","ꯃꯈꯣꯌꯅꯥ ꯅꯤꯡꯊꯤꯖꯅꯥ ꯂꯩꯅꯕꯥ ꯍꯣꯠꯅꯈꯤ, ꯂꯥꯌꯔꯕꯥ ꯄꯣꯠꯁꯀꯁꯤꯡ, ꯃꯈꯣꯌꯒꯤ ꯃꯃꯥꯅꯥ ꯐꯃꯗꯨꯅꯥ ꯂꯩꯔꯤꯉꯩꯗꯥ,"
"looking pale but steady, and put away her grief to think and","ꯌꯦꯡꯕꯗꯥ ꯌꯥꯝꯅꯥ ꯂꯨꯕꯥ ꯑꯗꯨꯕꯨ ꯂꯦꯡꯗꯅꯥ ꯂꯩꯕꯥ, ꯑꯃꯁꯨꯡ ꯃꯍꯥꯛꯀꯤ ꯑꯋꯥꯕꯥ ꯑꯗꯨ ꯋꯥꯈꯜ ꯈꯅꯕꯥ ꯑꯃꯁꯨꯡ ."
plan for them,ꯃꯈꯣꯌꯒꯤꯗꯃꯛ ꯄ꯭ꯂꯥꯟ ꯇꯧꯕꯥ
"‘Where’s Laurie?’ she asked presently, when she had collected","‘ꯀꯗꯥꯌꯗꯥ ꯂꯧꯔꯤ?’ ꯃꯍꯥꯛꯅꯥ ꯍꯧꯖꯤꯛ ꯍꯪꯈꯤ, ꯃꯍꯥꯛꯅꯥ ꯈꯣꯃꯖꯤꯜꯂꯀꯄꯥ ꯃꯇꯃꯗꯥ"
her thoughts and decided on the first duties to be done,ꯃꯍꯥꯛꯀꯤ ꯋꯥꯈꯜꯂꯣꯅꯁꯤꯡ ꯑꯃꯁꯨꯡ ꯇꯧꯒꯗꯕꯥ ꯑꯍꯥꯅꯕꯥ ꯊꯧꯗꯥꯡꯁꯤꯡ ꯑꯗꯨ ꯋꯥꯔꯦꯞ ꯂꯧꯈꯤ ꯫
"‘Here, ma’am. Oh, let me do something!’ cried the boy, hurrying","‘ꯍꯦꯔꯦ, ꯃꯥ’ꯃ꯫"
"from the next room whither he had withdrawn, feeling that their",ꯃꯊꯪꯒꯤ ꯔꯨꯃꯗꯒꯤ ꯃꯍꯥꯛꯅꯥ ꯂꯧꯊꯣꯀꯈꯤꯕꯥ ꯃꯇꯃꯗꯥ ꯃꯈꯣꯌꯒꯤ .
first sorrow was too sacred for even his friendly eyes to see,ꯑꯍꯥꯅꯕꯥ ꯁꯣꯀꯄꯥ ꯑꯁꯤ ꯃꯍꯥꯛꯀꯤ ꯃꯔꯨꯞ ꯑꯣꯏꯕꯥ ꯃꯤꯠꯌꯦꯡ ꯐꯥꯑꯣꯕꯥ ꯌꯥꯝꯅꯥ ꯁꯦꯡꯅꯥ ꯎꯕꯥ ꯐꯪꯈꯤꯗꯦ
279,꯲꯷꯹ ꯑꯃꯁꯨꯡ ꯑꯦꯟ.
‘Send a telegram saying I will come at once. The next train goes,‘ꯑꯩꯍꯥꯛ ꯑꯃꯨꯛ ꯍꯟꯅꯥ ꯂꯥꯛꯀꯅꯤ ꯍꯥꯌꯅꯥ ꯇꯦꯂꯤꯒ꯭ꯔꯥꯝ ꯑꯃꯥ ꯊꯥꯕꯤꯌꯨ꯫
early in the morning. I’ll take that.’,ꯑꯌꯨꯛ ꯑꯉꯅꯕꯗꯥ꯫
"‘What else? The horses are ready. I can go anywhere, do",‘ꯑꯇꯣꯞꯄꯥ ꯀꯔꯤꯅꯣ?
"anything,’ he said, looking ready to fly to the ends of the earth","ꯀꯔꯤꯒꯨꯝꯕꯥ ꯑꯃꯠꯇꯥ,’ ꯃꯍꯥꯛꯅꯥ ꯍꯥꯌꯈꯤ, ꯄ꯭ꯔ꯭ꯏꯊꯤꯕꯤꯒꯤ ꯑꯔꯣꯏꯕꯗꯥ ꯎꯔꯨꯕꯥ ꯌꯥꯅꯕꯥ ꯁꯦꯝ ꯁꯥꯗꯨꯅꯥ ꯂꯩꯕꯥ꯫"
"‘Leave a note at Aunt March’s. Jo, give me that pen and paper.’",‘ꯑꯟꯇꯤ ꯃꯥꯔꯆ’ꯗꯥ ꯅꯣꯠ ꯑꯃꯥ ꯊꯥꯗꯣꯀꯎ꯫
"Tearing off the blank side of one of her newly copied pages, Jo","ꯃꯍꯥꯛꯀꯤ ꯅꯧꯅꯥ ꯀꯣꯄꯤ ꯇꯧꯔꯕꯥ ꯄꯦꯖ ꯑꯃꯒꯤ ꯑꯁꯪꯕꯥ ꯃꯐꯝ ꯑꯗꯨ ꯂꯧꯊꯣꯛꯂꯒꯥ, ꯖꯣ"
"drew the table before her mother, well knowing that money for",ꯒꯤꯗꯃꯛ ꯁꯦꯜ ꯑꯗꯨ ꯌꯥꯝꯅꯥ ꯐꯖꯅꯥ ꯈꯉꯂꯗꯨꯅꯥ ꯃꯍꯥꯛꯀꯤ ꯃꯃꯥꯒꯤ ꯃꯃꯥꯡꯗꯥ ꯇꯦꯕꯜ ꯑꯗꯨ ꯁꯦꯃꯈꯤ꯫
"the long, sad journey must be borrowed, and feeling as if she","ꯁꯥꯡꯂꯕꯥ, ꯑꯋꯥꯕꯥ ꯈꯣꯉꯆꯠ ꯑꯗꯨ ꯂꯧꯁꯤꯅꯒꯗꯕꯅꯤ, ꯑꯃꯁꯨꯡ ꯃꯍꯥꯛꯅꯥ ꯃꯗꯨꯒꯨꯝꯅꯥ ꯐꯥꯑꯣꯍꯅꯒꯗꯕꯅꯤ꯫"
could do anything to add to a little to the sum for her father,ꯃꯍꯥꯛꯀꯤ ꯃꯄꯥꯒꯤꯗꯃꯛ ꯁꯣꯝ ꯑꯗꯨꯗꯥ ꯈꯔꯥ ꯍꯥꯄꯆꯤꯟꯅꯕꯥ ꯀꯔꯤꯒꯨꯝꯕꯥ ꯈꯔꯥ ꯇꯧꯕꯥ ꯉꯃꯒꯅꯤ
"‘Now go, dear, but don’t kill yourself driving at a desperate","‘ꯍꯧꯖꯤꯛ ꯆꯠꯂꯨ, ꯅꯨꯡꯁꯤꯔꯕꯥ, ꯑꯗꯨꯕꯨ ꯅꯁꯥꯕꯨ ꯌꯥꯝꯅꯥ ꯋꯥꯅꯥ ꯂꯃꯖꯤꯡꯕꯤꯒꯅꯨ"
pace. There is no need of that.’,ꯈꯣꯡꯊꯥꯡ.
"Mrs. March’s warning was evidently thrown away, for five","ꯁ꯭ꯔꯤꯃꯇꯤ ꯃꯥꯔꯆꯀꯤ ꯋꯥꯔꯣꯜ ꯑꯗꯨ ꯃꯌꯦꯛ ꯁꯦꯡꯅꯥ ꯊꯥꯗꯣꯀꯈꯤ, ꯃꯉꯥꯒꯤꯗꯃꯛ"
"minutes later Laurie tore by the window on his own fleet horse,","ꯃꯤꯅꯤꯠ ꯈꯔꯒꯤ ꯃꯇꯨꯡꯗꯥ ꯂꯧꯔꯤꯅꯥ ꯃꯍꯥꯛꯀꯤ ꯃꯁꯥꯒꯤ ꯐ꯭ꯂꯤꯠ ꯍꯣꯔꯁꯇꯥ ꯊꯣꯡꯅꯥꯑꯣ ꯃꯅꯥꯛꯇꯥ ꯆꯦꯟꯊꯈꯤ,"
riding as if for his life,ꯃꯍꯥꯛꯀꯤ ꯄꯨꯟꯁꯤꯒꯤꯗꯃꯛ ꯑꯣꯏꯅꯥ ꯊꯧꯕꯥ .
"‘Jo, run to the rooms, and tell Mrs. King that I can’t come. On","‘ꯖꯣ, ꯔꯨꯃꯗꯥ ꯂꯥꯀꯎ, ꯑꯃꯁꯨꯡ ꯁ꯭ꯔꯤꯃꯇꯤ ꯀꯤꯡꯗꯥ ꯑꯩ ꯂꯥꯀꯄꯥ ꯌꯥꯔꯣꯏ ꯍꯥꯌꯅꯥ ꯍꯥꯌꯌꯨ꯫"
"the way get these things. I’ll put them down, they’ll be needed",ꯋꯥꯐꯃꯁꯤꯡ ꯑꯁꯤ ꯐꯪꯕꯒꯤ ꯃꯑꯣꯡ꯫
and I must go prepared for nursing. Hospital stores are not,ꯑꯃꯁꯨꯡ ꯑꯩꯍꯥꯛꯅꯥ ꯅꯔꯁꯤꯡꯒꯤꯗꯃꯛꯇꯥ ꯁꯦꯝ ꯁꯥꯗꯨꯅꯥ ꯆꯠꯀꯗꯕꯅꯤ꯫
"always good. Beth, go and ask Mr. Laurence for a couple of",ꯃꯇꯝ ꯄꯨꯝꯅꯃꯛꯇꯥ ꯑꯐꯕꯥ꯫
bottles of old wine. I’m not too proud to beg for Father. He shall,ꯑꯔꯤꯕꯥ ꯋꯥꯏꯅꯦꯁꯀꯤ ꯕꯣꯇꯂꯁꯤꯡ꯫
"have the best of everything. Amy, tell Hannah to get down the",ꯄꯣꯠ ꯈꯨꯗꯤꯡꯃꯛꯀꯤ ꯈ꯭ꯕꯥꯏꯗꯒꯤ ꯐꯕꯥ ꯑꯗꯨ ꯂꯩꯕꯤꯌꯨ꯫
"black trunk, and Meg, come and help me find my things, for I’m","ꯕ꯭ꯂꯦꯛ ꯇ꯭ꯔꯉ꯭ꯛ, ꯑꯃꯁꯨꯡ ꯃꯦꯒ, ꯂꯥꯀꯎ ꯑꯃꯁꯨꯡ ꯑꯩꯒꯤ ꯄꯣꯠꯁꯀꯁꯤꯡ ꯊꯤꯕꯗꯥ ꯃꯇꯦꯡ ꯄꯥꯡꯕꯤꯌꯨ, ꯃꯔꯃꯗꯤ ꯑꯩꯅꯥ ."
half bewildered.’,ꯍꯥꯐ ꯋꯥꯈꯜ ꯋꯥꯕꯥ꯫’
280,꯲꯸꯰ ꯑꯃꯁꯨꯡ ꯑꯦꯟ.
"Writing, thinking, and directing all at once might well bewilder","ꯏꯕꯥ, ꯋꯥꯈꯜ ꯈꯅꯕꯥ, ꯑꯃꯁꯨꯡ ꯑꯃꯨꯛ ꯍꯟꯅꯥ ꯂꯃꯖꯤꯡ-ꯂꯃꯇꯥꯀꯄꯥ ꯑꯁꯤ ꯌꯥꯝꯅꯥ ꯋꯥꯅꯥ ꯋꯥꯅꯥ ꯊꯣꯀꯄꯥ ꯌꯥꯏ"
"the poor lady, and Meg begged her to sit quietly in her room for","ꯂꯥꯌꯔꯕꯥ ꯂꯦꯗꯤ, ꯑꯃꯁꯨꯡ ꯃꯦꯒꯅꯥ ꯃꯍꯥꯀꯄꯨ ꯃꯍꯥꯛꯀꯤ ꯔꯨꯃꯗꯥ ꯇꯞꯅꯥ ꯇꯞꯅꯥ ꯐꯃꯗꯨꯅꯥ ꯂꯩꯅꯕꯥ ꯍꯥꯌꯖꯈꯤ"
"a little while, and let them work","ꯃꯇꯝ ꯈꯔꯒꯤ ꯑꯣꯏꯅꯥ, ꯑꯃꯁꯨꯡ ꯃꯈꯣꯌꯅꯥ ꯊꯕꯛ ꯇꯧꯕꯥ ꯌꯥꯍꯜꯂꯨ ."
"Everyone scattered like leaves before a gust of wind, and the","ꯃꯤ ꯈꯨꯗꯤꯡꯃꯛ ꯅꯨꯡꯁꯤꯠꯀꯤ ꯈꯣꯡꯖꯦꯂꯒꯤ ꯃꯃꯥꯡꯗꯥ ꯄꯥꯝꯕꯤꯒꯨꯝꯅꯥ ꯁꯟꯗꯣꯀꯈꯤ, ꯑꯃꯁꯨꯡ ."
"quiet, happy household was broken up as suddenly as if the","ꯊꯨꯅꯥ ꯌꯥꯡꯅꯥ, ꯅꯨꯡꯉꯥꯏꯕꯥ ꯌꯨꯝ ꯑꯃꯥ ꯈꯉꯍꯧꯗꯅꯥ ꯊꯨꯒꯥꯏꯔꯀꯈꯤꯕꯒꯨꯝ ."
paper had been an evil spell,ꯀꯥꯒꯖ ꯑꯁꯤ ꯐꯠꯇꯕꯥ ꯁ꯭ꯄꯦꯜ ꯑꯃꯥ ꯑꯣꯏꯔꯝꯃꯤ .
"Mr. Laurence came hurrying back with Beth, bringing every","ꯁ꯭ꯔꯤ ꯂꯧꯔꯦꯟꯁꯅꯥ ꯕꯦꯊꯀꯥ ꯂꯣꯌꯅꯅꯥ ꯊꯨꯅꯥ ꯍꯜꯂꯀꯈꯤ, ꯈꯨꯗꯤꯡꯃꯛ ꯄꯨꯔꯀꯈꯤ꯫"
"comfort the kind old gentleman could think of for the invalid,","ꯀꯝꯐꯣꯔꯠ ꯗꯤ ꯀꯤꯟꯗ ꯑꯣꯜꯗ ꯖꯦꯟꯇꯂꯃꯦꯟ ꯐꯣꯔ ꯑꯦꯅꯥꯔꯂꯤꯗ, ꯐꯣꯔ ꯗꯤꯚꯥꯂꯤꯗ,"
and friendliest promises of protection for the girls during the,ꯑꯃꯁꯨꯡ ꯅꯨꯄꯤꯃꯆꯥꯁꯤꯡꯒꯤꯗꯃꯛ ꯉꯥꯛ-ꯁꯦꯅꯕꯒꯤ ꯈ꯭ꯕꯥꯏꯗꯒꯤ ꯃꯔꯨꯞ-ꯃꯄꯥꯡ ꯑꯣꯏꯕꯥ ꯋꯥꯁꯀꯁꯤꯡ .
"mother’s absence, which comforted her very much. There was","ꯃꯃꯥꯒꯤ ꯂꯩꯇꯕꯥ, ꯃꯗꯨꯅꯥ ꯃꯍꯥꯀꯄꯨ ꯌꯥꯝꯅꯥ ꯅꯨꯡꯉꯥꯏꯍꯅꯈꯤ꯫"
"nothing he didn’t offer, from his own dressing gown to himself","ꯃꯍꯥꯛꯅꯥ ꯄꯤꯗꯕꯥ ꯋꯥꯐꯝ ꯑꯃꯠꯇꯥ, ꯃꯍꯥꯛꯀꯤ ꯃꯁꯥꯒꯤ ꯑꯣꯏꯕꯥ ꯗ꯭ꯔꯦꯁꯤꯡ ꯒꯥꯎꯟꯗꯒꯤ ꯃꯁꯥꯃꯀꯄꯨ ."
as escort. But the last was impossible. Mrs. March would not,ꯑꯦꯁ꯭ꯀꯣꯔꯠ ꯑꯣꯏꯅꯥ꯫
"hear of the old gentleman’s undertaking the long journey, yet an","ꯑꯔꯤꯕꯥ ꯖꯦꯟꯇꯂꯃꯦꯅꯅꯥ ꯁꯥꯡꯂꯕꯥ ꯈꯣꯉꯆꯠ ꯑꯗꯨꯒꯤ ꯃꯇꯥꯡꯗꯥ ꯇꯥꯕꯤꯌꯨ, ꯑꯗꯨꯝ ꯑꯣꯏꯅꯃꯛ ꯑꯦꯟ."
"expression of relief was visible when he spoke of it, for anxiety","ꯃꯍꯥꯛꯅꯥ ꯃꯁꯤꯒꯤ ꯃꯇꯥꯡꯗꯥ ꯋꯥ ꯉꯥꯡꯂꯕꯥ ꯃꯇꯃꯗꯥ ꯔꯤꯂꯤꯐꯀꯤ ꯑꯦꯛꯁꯞꯔꯦꯁꯟ ꯎꯕꯥ ꯐꯪꯈꯤ, ꯋꯥꯈꯜ ꯅꯨꯡꯉꯥꯏꯇꯕꯒꯤꯗꯃꯛ"
"ill fits one for traveling. He saw the look, knit his heavy",ꯏꯜ ꯐꯤꯠ ꯏꯟ ꯇ꯭ꯔꯥꯚꯦꯂꯤꯡꯒꯤꯗꯃꯛ꯫
"eyebrows, rubbed his hands, and marched abruptly away,","ꯃꯃꯤꯠꯁꯤꯡ, ꯃꯍꯥꯛꯀꯤ ꯈꯨꯠꯁꯥꯁꯤꯡ ꯑꯗꯨ ꯀꯨꯄꯁꯤꯜꯂꯒꯥ ꯈꯉꯍꯧꯗꯅꯥ ꯂꯥꯞꯅꯥ ꯆꯠꯈꯤ,"
saying he’d be back directly. No one had time to think of him,ꯃꯍꯥꯛ ꯍꯀꯊꯦꯡꯅꯅꯥ ꯍꯜꯂꯛꯀꯅꯤ ꯍꯥꯌꯅꯥ ꯍꯥꯌꯔꯀꯈꯤ꯫
"again till, as Meg ran through the entry, with a pair of rubbers in","ꯑꯃꯨꯛ ꯍꯟꯅꯥ ꯇꯤꯜ, ꯃꯦꯒꯅꯥ ꯑꯦꯟꯠꯔꯤ ꯑꯗꯨꯒꯤ ꯃꯅꯨꯡꯗꯥ ꯆꯦꯅꯈꯤ, ꯔꯕ꯭ꯕꯔ ꯄꯦꯌꯥꯔ ꯑꯃꯥ ꯌꯥꯑꯣꯔꯤ꯫"
"one hand and a cup of tea in the other, she came suddenly","ꯈꯨꯠ ꯑꯃꯅꯥ ꯑꯃꯁꯨꯡ ꯑꯇꯣꯞꯄꯥ ꯈꯨꯠ ꯑꯃꯗꯥ ꯆꯥ ꯀꯞ ꯑꯃꯥ, ꯃꯍꯥꯛ ꯈꯉꯍꯧꯗꯅꯥ ꯂꯥꯀꯈꯤ"
upon Mr. Brooke,ꯁ꯭ꯔꯤ ꯕ꯭ꯔꯨꯀꯀꯤ ꯃꯊꯛꯇꯥ .
"‘I’m very sorry to hear of this, Miss March,’ he said, in the kind,","‘ꯑꯩꯍꯥꯛ ꯌꯥꯝꯅꯥ ꯅꯨꯡꯉꯥꯏꯇꯕꯥ ꯐꯥꯑꯣꯏ, ꯃꯤꯁ ꯃꯥꯔꯆ’ ꯍꯥꯌꯅꯥ ꯃꯍꯥꯛꯅꯥ ꯍꯥꯌꯈꯤ, ꯃꯈꯜ ꯑꯗꯨꯗꯥ,"
quiet tone which sounded very pleasantly to her perturbed,ꯃꯍꯥꯛꯀꯤ ꯄꯔꯇꯨꯔꯕꯦꯗꯇꯥ ꯌꯥꯝꯅꯥ ꯅꯨꯡꯉꯥꯏꯅꯥ ꯁꯣꯜꯂꯤꯕꯥ ꯀ꯭ꯕꯥꯏꯠ ꯇꯣꯟ
spirit. ‘I came to offer myself as escort to your mother. Mr,ꯏꯊꯤꯜ.
281,꯲꯸꯱ ꯑꯃꯁꯨꯡ ꯑꯦꯟ.
"Laurence has commissions for me in Washington, and it will","ꯂꯧꯔꯦꯟꯁꯅꯥ ꯑꯩꯒꯤꯗꯃꯛ ꯋꯥꯁꯤꯡꯇꯟꯗꯥ ꯀꯃꯤꯁꯅꯁꯤꯡ ꯂꯩꯔꯤ, ꯑꯃꯁꯨꯡ ꯃꯁꯤꯅꯥ ."
give me real satisfaction to be of service to her there.’,ꯃꯐꯝ ꯑꯗꯨꯗꯥ ꯃꯍꯥꯛꯀꯤ ꯁꯦꯕꯥ ꯇꯧꯅꯕꯥ ꯑꯩꯉꯣꯟꯗꯥ ꯑꯁꯦꯡꯕꯥ ꯅꯨꯡꯉꯥꯏꯕꯥ ꯄꯤꯕꯤꯌꯨ꯫’
"Down dropped the rubbers, and the tea was very near following,","ꯗꯥꯎꯟ ꯔꯕ꯭ꯕꯔꯁꯤꯡ ꯊꯥꯗꯣꯀꯈꯤ, ꯑꯃꯁꯨꯡ ꯆꯥ ꯑꯁꯤ ꯌꯥꯝꯅꯥ ꯅꯛꯅꯥ ꯂꯩꯔꯝꯃꯤ,"
"as Meg put out her hand, with a face so full of gratitude that Mr","ꯃꯦꯒꯅꯥ ꯃꯍꯥꯛꯀꯤ ꯈꯨꯠ ꯊꯥꯔꯀꯄꯒꯨꯝ, ꯑꯁꯨꯛ ꯌꯥꯝꯅꯥ ꯊꯥꯒꯠꯄꯥ ꯐꯣꯡꯗꯣꯀꯄꯥ ꯃꯐꯝ ꯑꯃꯒꯥ ꯂꯣꯌꯅꯅꯥ ꯑꯦꯝ.ꯑꯥꯔ."
Brooke would have felt repaid for a much greater sacrifice than,ꯕ꯭ꯔꯨꯀꯅꯥ ꯍꯦꯟꯅꯥ ꯆꯥꯎꯕꯥ ꯀꯠꯊꯣꯀꯄꯥ ꯑꯃꯒꯤꯗꯃꯛ ꯔꯤꯄꯦꯌꯔ ꯇꯧꯕꯥ ꯐꯥꯑꯣꯔꯝꯂꯒꯅꯤ ꯫
the trifling one of time and comfort which he was about to take,ꯃꯍꯥꯛꯅꯥ ꯂꯧꯈꯠꯀꯗꯧꯔꯤꯕꯥ ꯃꯇꯝ ꯑꯃꯁꯨꯡ ꯅꯨꯡꯉꯥꯏꯕꯒꯤ ꯇ꯭ꯔꯤꯐꯦꯜ ꯇꯧꯕꯥ .
"‘How kind you all are! Mother will accept, I’m sure, and it will be",‘ꯑꯗꯣꯝ ꯄꯨꯝꯅꯃꯛ ꯀꯌꯥꯗꯥ ꯃꯤꯅꯨꯡꯁꯤ ꯂꯩꯠꯔꯕꯗꯤ!
such a relief to know that she has someone to take care of her,ꯃꯍꯥꯛꯀꯤ ꯌꯦꯡꯁꯤꯅꯕꯤꯕꯥ ꯃꯤꯑꯣꯏ ꯑꯃꯥ ꯂꯩ ꯍꯥꯌꯕꯥ ꯈꯉꯕꯗꯥ ꯑꯁꯤꯒꯨꯝꯕꯥ ꯔꯤꯂꯤꯐ ꯑꯃꯅꯤ꯫
"Thank you very, very much!’","ꯌꯥꯝꯅꯥ, ꯌꯥꯝꯅꯥ ꯊꯥꯒꯠꯆꯔꯤ!’"
"Meg spoke earnestly, and forgot herself entirely till something in","ꯃꯦꯒꯅꯥ ꯊꯋꯥꯏ ꯌꯥꯑꯣꯅꯥ ꯋꯥ ꯉꯥꯡꯈꯤ, ꯑꯃꯁꯨꯡ ꯃꯁꯥꯃꯀꯄꯨ ꯃꯄꯨꯡ ꯐꯥꯅꯥ ꯀꯥꯑꯣꯊꯣꯀꯈꯤ ꯃꯗꯨꯗꯤ ꯲꯰꯲꯰ꯒꯤ ꯃꯅꯨꯡꯗꯥ ꯀꯔꯤꯒꯨꯝꯕꯥ ꯈꯔꯥ ꯐꯥꯑꯣꯕꯥ꯫"
the brown eyes looking down at her made her remember the,ꯃꯍꯥꯀꯄꯨ ꯌꯦꯡꯂꯒꯥ ꯌꯦꯡꯂꯤꯕꯥ ꯑꯉꯧꯕꯥ ꯃꯤꯠꯌꯦꯡ ꯑꯗꯨꯅꯥ ꯃꯍꯥꯀꯄꯨ ꯅꯤꯡꯁꯤꯡꯍꯅꯈꯤ .
"cooling tea, and lead the way into the parlor, saying she would","ꯆꯥ ꯀꯨꯜ ꯇꯧꯕꯥ, ꯑꯃꯁꯨꯡ ꯄꯥꯔꯂꯔꯗꯥ ꯂꯝꯕꯤ ꯂꯨꯆꯤꯡꯗꯨꯅꯥ ꯃꯍꯥꯛꯅꯥ ꯍꯥꯌꯒꯅꯤ"
call her mother,ꯃꯍꯥꯛꯀꯤ ꯃꯃꯥꯗꯥ ꯀꯜ ꯇꯧꯕꯤꯌꯨ
Everything was arranged by the time Laurie returned with a,ꯂꯣꯔꯤꯅꯥ ꯍꯜꯂꯀꯄꯥ ꯃꯇꯃꯗꯥ ꯄꯨꯝꯅꯃꯛ ꯊꯧꯔꯥꯡ ꯇꯧꯈꯤ ꯫
"note from Aunt March, enclosing the desired sum, and a few","ꯑꯟꯇꯤ ꯃꯥꯔꯆꯇꯒꯤ ꯅꯣꯠ, ꯑꯄꯥꯝꯕꯥ ꯁꯦꯅꯐꯝ ꯑꯗꯨ ꯂꯣꯏꯁꯤꯅꯕꯥ, ꯑꯃꯁꯨꯡ ꯈꯔꯥ"
"lines repeating what she had often said before, that she had","ꯃꯍꯥꯛꯅꯥ ꯑꯌꯥꯝꯕꯅꯥ ꯃꯃꯥꯡꯗꯥ ꯍꯥꯌꯈꯤꯕꯥ ꯑꯗꯨ ꯍꯟꯖꯤꯟ ꯍꯟꯖꯤꯟ ꯍꯥꯌꯕꯥ ꯂꯥꯏꯅꯁꯤꯡ, ꯃꯍꯥꯛꯅꯥ ."
"always told them it was absurd for March to go into the army,","ꯃꯇꯝ ꯄꯨꯝꯅꯃꯛꯇꯥ ꯃꯈꯣꯌꯗꯥ ꯍꯥꯌꯔꯝꯃꯤ ꯃꯗꯨꯗꯤ ꯃꯥꯔꯆ ꯑꯁꯤ ꯂꯥꯟꯃꯤꯗꯥ ꯆꯠꯄꯥ ꯑꯁꯤ ꯑꯔꯥꯅꯕꯥ ꯑꯃꯅꯤ,"
"always predicted that no good would come of it, and she hoped","ꯃꯇꯝ ꯄꯨꯝꯅꯃꯛꯇꯥ ꯂꯥꯎꯊꯣꯀꯈꯤ ꯃꯗꯨꯗꯤ ꯃꯁꯤꯗꯒꯤ ꯑꯐꯕꯥ ꯑꯃꯠꯇꯥ ꯂꯥꯛꯂꯣꯏ, ꯑꯃꯁꯨꯡ ꯃꯍꯥꯛꯅꯥ ꯑꯥꯁꯥ ꯇꯧꯈꯤ"
they would take her advice the next time. Mrs. March put the,ꯃꯈꯣꯌꯅꯥ ꯃꯊꯪꯒꯤ ꯃꯇꯃꯗꯥ ꯃꯍꯥꯛꯀꯤ ꯄꯥꯎꯇꯥꯛ ꯂꯧꯒꯅꯤ꯫
"note in the fire, the money in her purse, and went on with her","ꯃꯩꯗꯥ ꯅꯣꯠ ꯇꯧꯕꯤꯌꯨ, ꯃꯍꯥꯛꯀꯤ ꯄꯣꯔꯆꯔꯗꯥ ꯂꯩꯔꯤꯕꯥ ꯁꯦꯅꯐꯝ ꯑꯗꯨ, ꯑꯃꯁꯨꯡ ꯃꯍꯥꯛꯀꯥ ꯂꯣꯌꯅꯅꯥ ꯃꯈꯥ ꯆꯠꯊꯈꯤ꯫"
"preparations, with her lips folded tightly in a way which Jo","ꯁꯦꯝ ꯁꯥꯕꯥ, ꯃꯍꯥꯛꯀꯤ ꯃꯃꯤꯠꯁꯤꯡ ꯑꯗꯨ ꯆꯦꯠꯅꯥ ꯆꯦꯠꯅꯥ ꯊꯃꯗꯨꯅꯥ ꯖꯣꯖꯣ ."
would have understood if she had been there,ꯀꯔꯤꯒꯨꯝꯕꯥ ꯃꯍꯥꯛꯅꯥ ꯃꯐꯝ ꯑꯗꯨꯗꯥ ꯂꯩꯔꯝꯂꯕꯗꯤ ꯂꯧꯁꯤꯅꯈꯤꯒꯅꯤ .
282,꯲꯸꯲ ꯑꯃꯁꯨꯡ ꯑꯦꯟ.
"The short afternoon wore away. All other errands were done,",ꯑꯇꯦꯅꯕꯥ ꯅꯨꯃꯤꯠ ꯑꯗꯨ ꯂꯣꯏꯁꯤꯅꯈꯤ꯫
