en,mni-Mtei
If you are seeking any important alliance arrive,ꯀꯔꯤꯒꯨꯝꯕꯥ ꯅꯍꯥꯛꯅꯥ ꯃꯔꯨꯑꯣꯏꯕꯥ ꯑꯦꯂꯥꯏꯟꯁ ꯑꯃꯥ ꯍꯦꯛꯇꯥ ꯂꯥꯀꯄꯥ ꯇꯥꯔꯕꯗꯤ .
early at the gathering and hover around the sides like,ꯃꯤ ꯇꯤꯅꯕꯥ ꯃꯇꯃꯗꯥ ꯇꯣꯌꯅꯥ ꯑꯃꯁꯨꯡ ꯃꯌꯥꯃꯒꯥ ꯃꯥꯟꯅꯅꯥ ꯍꯨꯔꯥꯅꯕꯥ .
a helicopter Th en when you spot that important,ꯑꯗꯣꯝꯅꯥ ꯃꯔꯨꯑꯣꯏꯕꯥ ꯑꯗꯨ ꯎꯕꯥ ꯃꯇꯃꯗꯥ ꯍꯦꯂꯤꯀꯣꯞꯇꯔ ꯑꯃꯥ .
someone make a speedy landing in the seat right,ꯀꯅꯥꯒꯨꯝꯕꯥ ꯑꯃꯅꯥ ꯁꯤꯠꯇꯥ ꯌꯥꯝꯅꯥ ꯊꯨꯅꯥ ꯂꯦꯟꯗ ꯇꯧꯕꯥ ꯌꯥꯏ ꯔꯥꯏꯠ .
next to him,ꯃꯍꯥꯛꯀꯤ ꯃꯅꯥꯛꯇꯥ .
Keep your bodily parking spot in mind whatever,ꯅꯍꯥꯛꯀꯤ ꯍꯀꯆꯥꯡꯒꯤ ꯄꯥꯔꯀꯤꯡꯒꯤ ꯃꯐꯝ ꯑꯗꯨ ꯀꯔꯤꯒꯨꯝꯕꯥ ꯑꯃꯥ ꯋꯥꯈꯂꯗꯥ ꯊꯝꯃꯨ
you are searching for Where you deposit your,ꯅꯍꯥꯛꯅꯥ ꯅꯍꯥꯛꯀꯤ ꯗꯤꯄꯣꯖꯤꯠ ꯇꯧꯔꯤꯕꯥ ꯃꯐꯝ ꯑꯗꯨ ꯅꯍꯥꯛꯅꯥ ꯈꯪꯖꯤꯅꯕꯤꯔꯤ꯫
bottom can change your bottom line,ꯕꯣꯇꯣꯝ ꯑꯁꯤ ꯅꯍꯥꯛꯀꯤ ꯕꯣꯠꯇꯝ ꯂꯥꯏꯟ ꯑꯗꯨ ꯍꯣꯡꯗꯣꯀꯄꯥ ꯌꯥꯏ .
58,꯵꯸ ꯑꯃꯁꯨꯡ ꯑꯦꯟ.
How to Make a Great,ꯃꯇꯧ ꯀꯔꯝꯅꯥ ꯑꯆꯧꯕꯥ ꯑꯃꯥ ꯑꯣꯏꯍꯅꯒꯅꯤ .
Last Impression,ꯂꯥꯁ꯭ꯠ ꯏꯝꯄꯦꯁꯟ
You are pacing the waiting room of the personnel department,ꯑꯗꯣꯝꯅꯥ ꯄꯔꯁꯣꯅꯦꯜ ꯗꯤꯄꯥꯔꯇꯃꯦꯟꯇꯀꯤ ꯋꯦꯇꯤꯡ ꯔꯨꯃꯗꯥ ꯄꯦꯁꯤꯡ ꯇꯧꯔꯤ .
before an interview for an entrylevel job in the industry you,ꯏꯟꯗꯁ꯭ꯠꯔꯤꯗꯥ ꯑꯦꯟꯠꯔꯤꯂꯦꯚꯦꯂꯒꯤ ꯊꯕꯛ ꯑꯃꯥ ꯄꯥꯡꯊꯣꯛꯅꯕꯥ ꯏꯟꯇꯔꯚ꯭ꯌꯨ ꯑꯃꯒꯤ ꯃꯃꯥꯡꯗꯥ ꯌꯨ.ꯑꯦꯁ.
have always dreamed of You hear the words youve been wait,ꯃꯇꯝ ꯄꯨꯝꯅꯃꯛꯇꯥ ꯃꯪꯂꯥꯟ ꯇꯧꯗꯨꯅꯥ ꯂꯩꯌꯨ ꯅꯍꯥꯛꯅꯥ ꯉꯥꯏꯔꯤꯕꯥ ꯋꯥꯍꯩꯁꯤꯡ ꯑꯗꯨ ꯇꯥꯕꯤꯌꯨ
ing for Ms Samuels will see you now You clear your throat,ing for ms samuels ꯅꯥ ꯍꯧꯖꯤꯛ ꯅꯍꯥꯀꯄꯨ ꯎꯒꯅꯤ ꯅꯍꯥꯛꯅꯥ ꯅꯍꯥꯛꯀꯤ ꯀꯣꯛ ꯀ꯭ꯂꯤꯌꯥꯔ ꯇꯧꯕꯥ
push back your hair and mumble a nervous Th ank you to,ꯅꯍꯥꯛꯀꯤ ꯈꯣꯡꯎꯞ ꯑꯗꯨ ꯍꯟꯖꯤꯟ ꯍꯟꯖꯤꯟ ꯄꯨꯊꯣꯀꯎ ꯑꯃꯁꯨꯡ ꯅꯔꯚꯁ th ank ꯅꯍꯥꯛꯅꯥ ꯃꯗꯨ ꯅꯤꯡꯁꯤꯡꯕꯤꯌꯨ
the receptionist Youre as tense as a turkey in November,ꯔꯤꯁꯦꯄꯁꯟ ꯇꯧꯔꯤꯕꯥ ꯃꯤꯑꯣꯏ ꯑꯗꯨꯅꯥ ꯅꯕꯦꯝꯕꯔꯗꯥ ꯇꯨꯔꯀꯤ ꯑꯣꯏꯅꯥ ꯇꯦꯟꯁꯟ ꯑꯣꯏꯅꯥ ꯌꯨꯔꯦ .
Th e moment you cross the threshold Ms Samuels smiles,Th e moment you cross the ꯊ꯭ꯔꯦꯁꯍꯣꯜꯗ ꯃꯤꯁ ꯁꯦꯃꯨꯌꯦꯂꯁ ꯁ꯭ꯃꯥꯏꯂꯁ
stands up and walks around her big desk toward you with,ꯂꯦꯞꯇꯨꯅꯥ ꯑꯃꯁꯨꯡ ꯃꯍꯥꯛꯀꯤ ꯑꯆꯧꯕꯥ ꯗꯦꯁ꯭ꯛ ꯑꯗꯨꯒꯤ ꯃꯅꯥꯛꯇꯥ ꯆꯠꯇꯨꯅꯥ ꯅꯍꯥꯛꯀꯤ ꯃꯥꯏꯀꯩꯗꯥ ꯆꯠꯂꯤ
her hand out She says Welcome Please have a seat Settling,ꯃꯍꯥꯛꯀꯤ ꯍꯦꯟꯗ ꯑꯥꯎꯠ ꯃꯍꯥꯛꯅꯥ ꯍꯥꯌꯔꯤ ꯇꯔꯥꯝꯅꯥ ꯑꯣꯀꯆꯔꯤ ꯄ꯭ꯂꯤꯖꯅꯥ ꯁꯤꯠ ꯁꯦꯇꯜ ꯑꯃꯥ ꯂꯩꯕꯤꯌꯨ
in behind her desk she says Ive read your rsum and have,in behind her desk ꯃꯍꯥꯛꯅꯥ ꯍꯥꯌꯔꯤ ꯑꯩꯅꯥ ꯅꯍꯥꯛꯀꯤ rsum ꯄꯥꯔꯤ ꯑꯃꯁꯨꯡ have
been looking forward to meeting you,ꯑꯗꯣꯃꯒꯥ ꯎꯅꯅꯕꯥ ꯉꯥꯏꯗꯨꯅꯥ ꯂꯩꯔꯤ .
Whoa! Your con dence soars You chat amicably You,ꯋꯥꯌꯥ!
answer her questions accurately Th e woman on the throne is,ꯃꯍꯥꯛꯀꯤ ꯋꯥꯍꯪꯁꯤꯡ ꯑꯗꯨ ꯑꯆꯨꯝꯕꯥ ꯃꯑꯣꯡꯗꯥ th e woman on the ston ꯗꯥ ꯄꯥꯎꯈꯨꯝ ꯄꯤꯕꯥ
obviously impressed,ꯃꯌꯦꯛ ꯁꯦꯡꯅꯥ ꯏꯝꯞꯔꯦꯁ ꯇꯧꯈꯤꯕꯥ
Now youre really  ying high,ꯍꯧꯖꯤꯛ ꯌꯨꯔꯦ ꯇꯁꯦꯡꯅꯥ ꯌꯤꯡ ꯍꯥꯏ
But as the interview ends so does her smile Instead of,ꯑꯗꯨꯕꯨ ꯏꯟꯇꯔꯚ꯭ꯌꯨ ꯑꯗꯨ ꯂꯣꯏꯁꯤꯜꯂꯀꯄꯒꯥ ꯂꯣꯌꯅꯅꯥ ꯃꯍꯥꯛꯀꯤ ꯃꯤꯠꯌꯦꯡ ꯑꯗꯨꯁꯨ ꯃꯗꯨꯒꯤ ꯃꯍꯨꯠꯇꯥ .
standing to see you out shes shu  ing through papers With a,standing to see you out ꯁꯦꯁ ꯁꯨ ing ꯒꯤ ꯈꯨꯠꯊꯥꯡꯗꯥ ꯄꯦꯄꯔꯁꯤꯡꯒꯥ ꯂꯣꯌꯅꯅꯥ
disinterested voice and no eye contact she murmurs Th ank,ꯗꯤꯁꯏꯟꯇꯔꯁ꯭ꯇꯦꯗ ꯚꯣꯏꯁ ꯑꯃꯁꯨꯡ ꯅꯣ ꯑꯥꯏ ꯀꯟꯇꯦꯛꯇ ꯁꯦ ꯃꯨꯔꯃꯨꯔꯁ th ank
you for coming Goodbye,ꯑꯗꯣꯝꯅꯥ ꯒꯨꯗꯕꯥꯏ ꯂꯥꯀꯄꯒꯤꯗꯃꯛ .
How to Make a Great Last Impression  59,ꯑꯆꯧꯕꯥ ꯑꯔꯣꯏꯕꯥ ꯏꯝꯄꯦꯛꯇ ꯑꯃꯥ ꯃꯇꯧ ꯀꯔꯝꯅꯥ ꯁꯦꯃꯒꯅꯤ ꯵꯹
You crash Your head is reeling What did you do wrong? She was so warm at  rst and now    nothing,ꯅꯍꯥꯛꯅꯥ ꯅꯍꯥꯛꯀꯤ ꯃꯀꯣꯛ ꯑꯗꯨ ꯔꯤꯂꯤꯡ ꯇꯧꯔꯤꯕꯁꯤ ꯅꯍꯥꯛꯅꯥ ꯀꯔꯤ ꯑꯔꯥꯅꯕꯥ ꯇꯧꯈꯤꯕꯒꯦ?
Driving home you feel like a human malfunction,ꯌꯨꯃꯗꯥ ꯗ꯭ꯔꯥꯏꯚꯤꯡ ꯇꯧꯕꯥ ꯅꯍꯥꯛꯅꯥ ꯃꯤꯑꯣꯏꯕꯒꯤ ꯃꯥꯂꯐꯟꯁ ꯑꯃꯥ ꯑꯣꯏꯅꯥ ꯐꯥꯑꯣꯔꯤ
Much much later that night just like a worm regrows,ꯌꯥꯝꯅꯥ ꯇꯨꯡꯗꯥ ꯅꯨꯃꯤꯠ ꯑꯗꯨꯗꯥ ꯋꯥꯔꯝ ꯑꯃꯥ ꯑꯃꯨꯛ ꯍꯟꯅꯥ ꯔꯤꯒ꯭ꯔꯣ ꯇꯧꯕꯒꯨꯝꯅꯥ
the missing part when cut in half your survival instinct starts,ꯅꯍꯥꯛꯀꯤ ꯁꯔꯚꯥꯏꯚꯜ ꯏꯟꯁꯇꯤꯠꯌꯨꯠ ꯑꯗꯨ ꯇꯉꯈꯥꯏ ꯑꯃꯗꯥ ꯀꯥꯄꯁꯤꯅꯕꯥ ꯃꯇꯃꯗꯥ ꯃꯥꯡꯈꯤꯕꯥ ꯁꯔꯨꯛ ꯑꯗꯨ ꯍꯧꯔꯀꯏ
mending your severed ego You wake up the next morning,ꯃꯊꯪꯒꯤ ꯑꯌꯨꯛꯇꯥ ꯅꯍꯥꯛꯅꯥ ꯋꯥꯈꯜ ꯋꯥꯕꯥ ꯍꯧꯔꯀꯄꯥ ꯃꯇꯃꯗꯥ ꯅꯍꯥꯛꯀꯤ ꯁꯦꯐ ꯇꯧꯔꯕꯥ ꯏꯒꯣ ꯑꯗꯨ ꯃꯦꯟꯗꯤꯡ ꯇꯧꯕꯥ
loathing the person who slashed it,ꯃꯗꯨ ꯂꯧꯊꯣꯀꯈꯤꯕꯥ ꯃꯤꯑꯣꯏ ꯑꯗꯨ ꯂꯣꯠꯁꯤꯅꯕꯥ .
Did Ms Samuels consciously try to make you feel like a,ꯑꯦꯝ.ꯑꯦꯁ.ꯁꯦꯃꯨꯌꯦꯂꯁꯅꯥ ꯀꯟꯁꯤꯌꯦꯟꯇ ꯑꯣꯏꯅꯥ ꯅꯍꯥꯀꯄꯨ ꯋꯥꯈꯜ ꯇꯥꯍꯟꯅꯕꯥ ꯍꯣꯠꯅꯈꯤꯕꯥ ꯑꯗꯨ .
worm? Of course not,ꯇꯤꯟ?
Maybe she had a lot of work to do Perhaps she had an,ꯌꯥꯑꯣꯔꯃꯒꯗ꯭ꯔꯥ ꯃꯍꯥꯛꯅꯥ ꯇꯧꯒꯗꯕꯥ ꯊꯕꯛ ꯀꯌꯥ ꯑꯃꯥ ꯂꯩꯔꯃꯒꯅꯤ ꯃꯍꯥꯛꯅꯥ ꯑꯃꯥ ꯂꯩꯔꯝꯕꯥ ꯌꯥꯏ .
important call to make Possibly    conceivably    feasi,ꯑꯣꯏꯊꯣꯀꯄꯥ ꯌꯥꯕꯥ ꯃꯑꯣꯡꯗꯥ ꯋꯥꯈꯜ ꯋꯥꯕꯥ ꯊꯣꯀꯍꯟꯅꯕꯥ ꯃꯔꯨꯑꯣꯏꯕꯥ ꯀꯜ
bly    perchance    It could be anything Only one thing is,bly perchance ꯃꯁꯤ ꯀꯔꯤꯒꯨꯝꯕꯥ ꯑꯃꯠꯇꯥ ꯑꯣꯏꯕꯥ ꯌꯥꯏ ꯋꯥꯐꯝ ꯑꯃꯈꯛꯇꯅꯤ
sure Ms Samuels was not a big cat,ꯁꯣꯏꯗꯅꯥ ꯑꯦꯝ.ꯑꯦꯁ.ꯁꯦꯃꯨꯌꯦꯂꯁ ꯑꯁꯤ ꯑꯆꯧꯕꯥ ꯀꯦꯠ ꯑꯃꯥ ꯑꯣꯏꯈꯤꯗꯦ .
We have de ned people with EP as being aware of them,ꯑꯩꯈꯣꯌꯅꯥ ꯏ.ꯄꯤ.ꯒꯥ ꯂꯣꯌꯅꯅꯥ ꯃꯤꯑꯣꯏꯁꯤꯡꯕꯨ ꯃꯈꯣꯌꯒꯤ ꯃꯔꯃꯗꯥ ꯈꯉꯕꯥ ꯑꯣꯏꯅꯥ ꯗꯤ ꯅꯦꯗ ꯇꯧꯔꯦ .
selves their surroundings the current situation and other,ꯃꯁꯥꯅꯥ ꯃꯁꯥꯕꯨ ꯃꯈꯣꯌꯒꯤ ꯑꯀꯣꯌꯕꯗꯥ ꯂꯩꯔꯤꯕꯥ ꯐꯤꯚꯝ ꯑꯃꯁꯨꯡ ꯑꯇꯣꯞꯄꯥ
people Th ey make a concerted e ort to harmonize all four,ꯃꯤꯑꯣꯏꯁꯤꯡ ꯊ ꯏꯅꯥ ꯃꯔꯤ ꯄꯨꯝꯅꯃꯛ ꯍꯥꯔꯃꯣꯅꯤꯖ ꯇꯧꯅꯕꯥ ꯀꯟꯁꯔꯇꯦꯗ ꯏ ꯑꯣꯔꯠ ꯑꯃꯥ ꯁꯦꯝꯕꯥ
Ms Samuels lost on all counts,ꯃꯤꯁ ꯁꯦꯃꯨꯌꯦꯂꯁꯅꯥ ꯀꯥꯎꯟꯇ ꯈꯨꯗꯤꯡꯃꯛꯇꯥ ꯃꯥꯏꯊꯤꯕꯥ ꯄꯤꯈꯤ
Th emselves,ꯃꯈꯣꯏ ꯃꯁꯥꯃꯛ
She wasnt sensitive to her role visvis you,ꯃꯍꯥꯛꯅꯥ ꯃꯍꯥꯛꯀꯤ ꯊꯧꯗꯥꯡ ꯑꯗꯨꯗꯥ ꯁꯦꯟꯁꯤꯇꯤꯕ ꯑꯣꯏꯈꯤ visvis you
Ms S didnt realize you might perceive her as the woman,ms s didnt reailing ꯅꯍꯥꯛꯅꯥ ꯃꯍꯥꯀꯄꯨ ꯅꯨꯄꯤ ꯑꯣꯏꯅꯥ ꯂꯧꯕꯥ ꯌꯥꯏ ꯍꯥꯌꯅꯥ ꯂꯧꯕꯥ ꯌꯥꯏ꯫
who holds your entire professional life in her hands,ꯀꯅꯥꯅꯥ ꯅꯍꯥꯛꯀꯤ ꯄ꯭ꯔꯣꯐꯦꯁꯅꯦꯜ ꯂꯥꯏꯐꯄꯨ ꯃꯍꯥꯛꯀꯤ ꯈꯨꯠꯇꯥ ꯊꯝꯂꯤꯕꯅꯣ
Th eir surroundings,Th eir ꯑꯀꯣꯌꯕꯗꯥ ꯂꯩꯕꯥ .
She didnt sense that sitting,ꯃꯍꯥꯛꯅꯥ ꯐꯝꯂꯤꯕꯥ ꯑꯗꯨ ꯈꯉꯈꯤꯗꯦ .
behind her big desk across from you was daunting People,ꯅꯉꯒꯤ ꯃꯅꯥꯛꯇꯥ ꯂꯩꯕꯥ ꯃꯍꯥꯛꯀꯤ ꯑꯆꯧꯕꯥ ꯗꯦꯁ꯭ꯀꯀꯤ ꯃꯇꯨꯡꯗꯥ ꯃꯤꯁꯤꯡꯅꯥ ꯌꯥꯝꯅꯥ ꯋꯥꯅꯥ ꯊꯣꯀꯈꯤ .
who are sensitive to your emotions move chairs so there are,ꯑꯗꯣꯃꯒꯤ ꯏꯃꯣꯁꯅꯁꯤꯡꯗꯥ ꯁꯦꯟꯁꯤꯇꯤꯕ ꯑꯣꯏꯕꯥ ꯃꯤꯑꯣꯏꯁꯤꯡꯅꯥ ꯆꯦꯌꯥꯔꯁꯤꯡ ꯆꯠꯂꯤ ꯃꯔꯝ ꯑꯗꯨꯅꯥ ꯂꯩꯔꯤ .
no obstructions between you,ꯑꯗꯣꯃꯒꯤ ꯃꯔꯛꯇꯥ ꯑꯀꯥꯌꯕꯥ ꯑꯃꯠꯇꯥ ꯂꯩꯇꯦ .
Th e current situation,Th e ꯍꯧꯖꯤꯛ ꯂꯩꯔꯤꯕꯥ ꯐꯤꯚꯝ ꯑꯁꯤ .
She knew of course that she,ꯃꯍꯥꯛꯅꯥ ꯈꯉꯂꯃꯈꯤ ꯃꯗꯨꯗꯤ ꯃꯍꯥꯛꯅꯥ .
was interviewing you for a job But thats where it stopped,ꯊꯕꯛ ꯑꯃꯥ ꯇꯧꯅꯕꯥ ꯅꯉꯣꯟꯗꯥ ꯏꯟꯇꯔꯚ꯭ꯌꯨ ꯇꯧꯔꯝꯃꯤ ꯑꯗꯨꯕꯨ ꯃꯗꯨ ꯃꯐꯝ ꯑꯗꯨꯗꯥ ꯊꯃꯈꯤ .
Big cats understand the magnitude of the occasion for,ꯑꯆꯧꯕꯥ ꯀꯦꯇꯁꯤꯡꯅꯥ ꯊꯧꯔꯝ ꯑꯁꯤꯒꯤ ꯃꯦꯒ꯭ꯅꯤꯆꯨꯗ ꯑꯁꯤ .
you Th ey know the implications of their actions and your,ꯅꯍꯥꯛꯅꯥ ꯃꯈꯣꯌꯒꯤ ꯊꯕꯀꯁꯤꯡ ꯑꯃꯁꯨꯡ ꯅꯍꯥꯛꯀꯤ .
possible interpretations,ꯑꯣꯏꯊꯣꯀꯄꯥ ꯌꯥꯕꯥ ꯏꯟꯇꯔꯞꯔꯤꯇꯦꯁꯅꯁꯤꯡ .
60  How to Instantly Connect with Anyone,꯶꯰ ꯃꯇꯧ ꯀꯔꯝꯅꯥ ꯈꯨꯗꯛꯇꯥ ꯀꯅꯥꯒꯨꯝꯕꯥ ꯑꯃꯒꯥ ꯀꯔꯝꯅꯥ ꯁꯝꯅꯒꯅꯤ .
Other people,ꯑꯇꯣꯞꯄꯥ ꯃꯤꯑꯣꯏꯁꯤꯡ .
Here is where Ms Samuels really lost,ꯃꯐꯝ ꯑꯁꯤꯗꯥ ꯃꯤꯁ ꯁꯦꯃꯨꯌꯦꯂꯁꯅꯥ ꯇꯁꯦꯡꯅꯥ ꯃꯥꯡꯈꯤꯕꯥ ꯃꯐꯝ ꯑꯗꯨ .
it She was immune to the thousands of signals you gave,ꯃꯁꯤ ꯃꯍꯥꯛꯅꯥ ꯑꯗꯣꯝꯅꯥ ꯄꯤꯈꯤꯕꯥ ꯁꯤꯒꯅꯦꯜ ꯂꯤꯁꯤꯡ ꯀꯌꯥꯗꯒꯤ ꯏꯝꯝꯌꯨꯟ ꯑꯣꯏꯈꯤ .
o that we all give o every minute of interacting She,o ꯑꯩꯈꯣꯌ ꯄꯨꯝꯅꯃꯛꯅꯥ ꯄꯤꯔꯤꯕꯥ ꯃꯤꯅꯤꯠ ꯈꯨꯗꯤꯡꯃꯛ ꯏꯟꯇꯔꯦꯛꯇ ꯇꯧꯕꯒꯤ ꯁꯦ
the beginning and how her smile melted it away She didnt,ꯍꯧꯔꯀꯐꯝ ꯑꯃꯁꯨꯡ ꯃꯍꯥꯛꯀꯤ ꯃꯤꯠꯌꯦꯡ ꯑꯗꯨꯅꯥ ꯃꯗꯨꯕꯨ ꯀꯔꯝꯅꯥ ꯁꯣꯀꯍꯅꯈꯤꯕꯒꯦ ꯍꯥꯌꯕꯗꯨ ꯃꯍꯥꯛꯅꯥ ꯇꯧꯈꯤꯗꯦ
notice your pride when you answered her questions nor,ꯅꯍꯥꯛꯅꯥ ꯃꯍꯥꯛꯀꯤ ꯋꯥꯍꯪꯁꯤꯡꯒꯤ ꯄꯥꯎꯈꯨꯝ ꯄꯤꯔꯀꯄꯥ ꯃꯇꯃꯗꯥ ꯅꯍꯥꯛꯀꯤ ꯆꯥꯎꯊꯣꯀꯆꯕꯥ ꯑꯗꯨ ꯈꯪꯖꯤꯅꯕꯤꯌꯨ꯫
detect your devastation at her lukewarm dismissal If Ms,ꯀꯔꯤꯒꯨꯝꯕꯥ ꯑꯦꯝ.ꯑꯦꯁ.ꯅꯥ ꯀꯔꯤꯒꯨꯝꯕꯥ ꯑꯦꯝ.ꯑꯦꯁ.
Samuels had had an ounce of EP she would have sounded,ꯁꯦꯝꯌꯨꯂꯁꯅꯥ ꯏ.ꯄꯤ.
equally as enthusiastic if not more as she said goodbye,ꯆꯞ ꯃꯥꯟꯅꯕꯥ ꯃꯑꯣꯡꯗꯥ ꯊꯋꯥꯏ ꯌꯥꯑꯣꯕꯥ ꯑꯣꯏꯔꯕꯗꯤ ꯃꯍꯥꯛꯅꯥ ꯒꯨꯗꯕꯥꯏ ꯍꯥꯌꯈꯤꯕꯥ ꯑꯗꯨꯒꯨꯝꯅꯥ ꯍꯦꯟꯅꯥ .
A big cat makes people feel good about themselves even if,ꯑꯆꯧꯕꯥ ꯀꯦꯠ ꯑꯃꯅꯥ ꯃꯤꯑꯣꯏꯕꯕꯨ ꯃꯁꯥꯒꯤ ꯃꯔꯃꯗꯥ ꯅꯨꯡꯉꯥꯏꯕꯥ ꯐꯥꯑꯣꯍꯜꯂꯤ ꯀꯔꯤꯒꯨꯝꯕꯥ .
they dont get the job,ꯃꯈꯣꯌꯅꯥ ꯊꯕꯛ ꯑꯗꯨ ꯐꯪꯗꯦ .
Why Are People So Obsessed with Th eir,ꯀꯔꯤꯒꯤꯗꯃꯛꯇꯥ ꯃꯤꯑꯣꯏꯁꯤꯡꯅꯥ ꯊ ꯏꯌꯔꯗꯥ ꯑꯁꯨꯛ ꯌꯥꯝꯅꯥ ꯂꯨꯅꯥ ꯇꯧꯔꯤꯕꯅꯣ
First Impression but Seldom Th eir Last? Have you heard of the Von Restor  e ect? Hedwig Von Restor,ꯑꯍꯥꯅꯕꯥ ꯏꯝꯄꯦꯔꯦꯁꯟ ꯑꯗꯨꯕꯨ ꯌꯥꯝꯅꯥ ꯊꯨꯅꯥ th eir ꯂꯥꯁ꯭ꯠ?
was a German physicianpsychologist who proved that the last,ꯑꯁꯤ ꯖꯔꯃꯅꯤꯒꯤ ꯐꯤꯖꯤꯁꯤꯌꯟ ꯁꯥꯏꯀꯣꯂꯣꯖꯤꯁ꯭ꯠ ꯑꯃꯅꯤ ꯑꯃꯁꯨꯡ ꯃꯍꯥꯛꯅꯥ ꯄ꯭ꯔꯃꯥꯟ ꯇꯧꯈꯤꯕꯥ ꯑꯗꯨ .
item on a list has a longlasting e ect Last impressions are,ꯂꯤꯁ꯭ꯠ ꯑꯃꯗꯥ ꯂꯩꯕꯥ ꯑꯥꯏꯇꯦꯝ ꯑꯁꯤꯅꯥ ꯂꯣꯡ-ꯂꯥꯏꯔꯕꯥ ꯏ.ꯏ.ꯁꯤ.ꯇꯤ.
thus almost as memorable as  rst Trial lawyers use this Von,ꯑꯁꯨꯝꯅꯥ ꯆꯥꯎꯔꯥꯛꯅꯥ ꯅꯤꯡꯁꯤꯡꯅꯤꯡꯉꯥꯏ ꯑꯣꯏꯕꯥ ꯃꯑꯣꯡꯗꯥ ꯑꯥꯔ.ꯑꯦꯁ.ꯇꯤ.ꯒꯤ ꯇ꯭ꯔꯥꯏꯑꯦꯜ ꯂꯣꯌꯁꯉꯁꯤꯡ ꯑꯁꯤ ꯚꯣꯟ ꯑꯁꯤ ꯁꯤꯖꯤꯟꯅꯔꯤ
Restor  e ect to set murderers free or send them to the electric,ꯔꯤꯁ꯭ꯇꯣꯔ ꯏ.ꯁꯤ.ꯇꯤ.ꯅꯥ ꯈꯨꯅꯥꯏꯒꯤ ꯃꯤꯑꯣꯏꯁꯤꯡ ꯐ꯭ꯔꯤ ꯑꯣꯏꯅꯥ ꯊꯝꯅꯕꯥ ꯅꯠꯔꯒꯥ ꯏꯂꯦꯛꯠꯔꯤꯛꯇꯥ ꯊꯥꯅꯕꯥ .
chair by saving their most powerful arguments for last,ꯃꯈꯣꯌꯒꯤ ꯈ꯭ꯕꯥꯏꯗꯒꯤ ꯃꯄꯥꯉ꯭ꯒꯜ ꯀꯅꯕꯥ ꯑꯥꯔꯒꯨꯃꯦꯟꯇꯁꯤꯡ ꯑꯗꯨ ꯑꯔꯣꯏꯕꯥ ꯑꯣꯏꯅꯥ ꯁꯦꯚ ꯇꯧꯗꯨꯅꯥ ꯆꯦꯌꯔ .
Motivational speakers punch their pillows at night trying,ꯃꯣꯇꯤꯚꯦꯁꯅꯦꯜ ꯁ꯭ꯄꯤꯀꯔꯁꯤꯡꯅꯥ ꯑꯌꯨꯛꯇꯥ ꯃꯈꯣꯌꯒꯤ ꯇꯥꯉ꯭ꯀꯀꯁꯤꯡꯗꯥ ꯄꯟꯗꯨꯅꯥ ꯂꯩꯔꯤ
to come up with the perfect  nale to their speechone to,ꯃꯈꯣꯌꯒꯤ ꯁ꯭ꯄꯤꯆꯅꯗꯥ ꯃꯄꯨꯡ ꯐꯥꯕꯥ ꯅꯥꯂꯦ ꯑꯃꯥ ꯂꯥꯀꯄꯥ ꯑꯁꯤ .
bring the applauding audience to their feet,ꯊꯥꯒꯠꯅꯤꯡꯉꯥꯏ ꯑꯣꯏꯕꯥ ꯑꯣꯗꯤꯁꯟ ꯑꯗꯨ ꯃꯈꯣꯌꯒꯤ ꯈꯣꯡꯗꯥ ꯄꯨꯔꯀꯎ .
Take a tip from these pros and pay attention to your pas,ꯄ꯭ꯔꯣꯁꯁꯤꯡ ꯑꯁꯤꯗꯒꯤ ꯇꯤꯞ ꯑꯃꯥ ꯂꯧꯕꯤꯌꯨ ꯑꯃꯁꯨꯡ ꯅꯍꯥꯛꯀꯤ ꯄꯥꯁꯁꯤꯡꯗꯥ ꯄꯨꯛꯅꯤꯡ ꯆꯪꯕꯤꯌꯨ
that for a big friendship or professional boost your good,ꯑꯗꯨ ꯑꯆꯧꯕꯥ ꯃꯔꯨꯞ-ꯃꯄꯥꯡ ꯑꯣꯏꯕꯥ ꯅꯠꯔꯒꯥ ꯄ꯭ꯔꯣꯐꯦꯁ꯭ꯅꯦꯜ ꯑꯃꯥ ꯑꯣꯏꯅꯕꯒꯤꯗꯃꯛ ꯑꯗꯣꯃꯒꯤ ꯑꯐꯕꯥ ꯑꯗꯨ ꯍꯦꯟꯅꯥ ꯆꯦꯠꯁꯤꯂꯍꯜꯂꯦ .
bye must match or preferably be bigger than your hello,ꯕꯥꯏ ꯑꯁꯤ ꯑꯗꯣꯃꯒꯤ ꯍꯦꯂꯣꯗꯒꯤ ꯍꯦꯟꯅꯥ ꯆꯥꯎꯕꯥ ꯅꯠꯔꯒꯥ ꯍꯦꯟꯅꯥ ꯐꯕꯥ ꯑꯣꯏꯒꯗꯕꯅꯤ
Just as a job applicant wants the interviewer to be every bit,ꯊꯕꯛ ꯑꯦꯞꯂꯤꯀꯥꯟꯇ ꯑꯃꯅꯥ ꯏꯟꯇꯔꯚ꯭ꯌꯨ ꯇꯧꯔꯤꯕꯥ ꯃꯤꯑꯣꯏ ꯑꯗꯨ ꯕꯤꯠ ꯈꯨꯗꯤꯡꯃꯛ ꯑꯣꯏꯍꯅꯕꯥ ꯄꯥꯝꯂꯤꯕꯒꯨꯝꯅꯥ
as enthusiastic at the end of the discussion as at the beginning,ꯍꯧꯔꯀꯄꯗꯥ ꯃꯇꯧ ꯑꯁꯨꯝꯅꯥ ꯈꯟꯅ-ꯅꯩꯅꯕꯒꯤ ꯑꯔꯣꯏꯕꯗꯥ ꯊꯋꯥꯏ ꯌꯥꯑꯣꯕꯥ ꯑꯣꯏꯅꯥ .
How to Make a Great Last Impression  61,ꯃꯇꯧ ꯀꯔꯝꯅꯥ ꯑꯆꯧꯕꯥ ꯑꯔꯣꯏꯕꯥ ꯏꯝꯄꯦꯛꯇ ꯑꯃꯥ ꯁꯦꯃꯒꯅꯤ ꯶꯱
we want people to like us even more after we talk to them If,ꯑꯩꯈꯣꯌꯅꯥ ꯃꯈꯣꯌꯒꯥ ꯋꯥꯔꯤ ꯁꯥꯅꯔꯕꯥ ꯃꯇꯨꯡꯗꯥ ꯃꯤꯌꯥꯝꯅꯥ ꯑꯩꯈꯣꯌꯕꯨ ꯍꯦꯟꯅꯥ ꯄꯥꯝꯅꯕꯥ ꯄꯥꯝꯃꯤ ꯀꯔꯤꯒꯨꯝꯕꯥ .
they dont sound as warm or warmer we suspect we disap,ꯃꯈꯣꯌꯅꯥ ꯋꯥꯔꯝ ꯅꯠꯔꯒꯥ ꯋꯥꯔꯃꯔ ꯑꯣꯏꯅꯥ ꯁꯣꯜꯂꯤ ꯍꯥꯌꯅꯥ ꯑꯩꯈꯣꯌꯅꯥ ꯆꯤꯡꯅꯕꯥ ꯐꯥꯑꯣꯏ ꯑꯩꯈꯣꯌꯅꯥ ꯗꯤꯁꯞ .
pointed them in this last contact,ꯃꯈꯣꯌꯁꯤꯡ ꯑꯁꯤ ꯑꯔꯣꯏꯕꯥ ꯀꯟꯇꯦꯛꯇ ꯑꯁꯤꯗꯥ ꯄꯣꯏꯟꯇ ꯇꯧꯈꯤ
Th e Origin of Little Trick 18,th e ꯂꯤꯇꯜ ꯇ꯭ꯔꯤꯛ ꯱꯸ꯒꯤ ꯍꯧꯔꯀꯐꯝ꯫
Th e technique of leaving a great last impression blossomed,Th e ꯇꯦꯛꯅꯤꯛ ꯑꯣꯐ ꯂꯤꯚꯤꯠ ꯑꯦ ꯒ꯭ꯔꯦꯠ ꯂꯥꯁ꯭ꯠ ꯏꯝꯄꯦꯁꯟ ꯕ꯭ꯂꯣꯁꯝ
from a small seeda seed that still annoys me like its stuck,ꯍꯧꯖꯤꯛ ꯐꯥꯑꯣꯕꯥ ꯃꯁꯤꯒꯤ ꯁ꯭ꯇꯨꯛ ꯑꯁꯤꯒꯨꯝꯅꯥ ꯑꯩꯕꯨ ꯅꯨꯡꯉꯥꯏꯇꯕꯥ ꯐꯥꯑꯣꯍꯜꯂꯤꯕꯥ ꯑꯄꯤꯀꯄꯥ ꯁꯤꯗꯥ ꯁꯤꯗ ꯑꯃꯗꯒꯤ
between my teeth,ꯑꯩꯒꯤ ꯈꯣꯡꯒꯤ ꯃꯔꯛꯇꯥ .
Whenever Im on a trip my dear friend Phil Perry and I,ꯃꯇꯝ ꯑꯃꯗꯥ ꯏꯝ ꯑꯣꯟ ꯑꯦ ꯇ꯭ꯔꯤꯞ ꯑꯩꯒꯤ ꯅꯨꯡꯁꯤꯖꯔꯕꯥ ꯃꯔꯨꯞ ꯐꯤꯜ ꯄꯦꯔꯤ ꯑꯃꯁꯨꯡ ꯑꯩ
often chat on the phone I call him when Im on the road and,ꯑꯌꯥꯝꯕꯥ ꯃꯇꯃꯗꯥ ꯐꯣꯅꯗꯥ ꯆꯦꯠꯅꯥ ꯋꯥꯔꯤ ꯁꯥꯟꯅꯔꯤ ꯑꯩꯅꯥ ꯃꯍꯥꯀꯄꯨ ꯂꯝꯕꯤꯗꯥ ꯆꯠꯂꯤꯉꯩꯗꯥ iM on the road on the road and
enjoy his Hello Leil! Its great to hear your voice How are,ꯃꯍꯥꯛꯀꯤ ꯍꯦꯂꯣ ꯂꯦꯏꯜ ꯑꯗꯨ ꯅꯨꯡꯉꯥꯏꯕꯤꯌꯨ!
you? Hows your trip going? Lots of warmth Lots of energy,ꯑꯗꯣꯝ?
Lots of friendliness,ꯐ꯭ꯔꯦꯟꯗꯂꯤ ꯑꯣꯏꯕꯥ ꯋꯥꯐꯝ ꯀꯌꯥ .
As we are ready to hang up however his enthusiasm nose,ꯑꯩꯈꯣꯌꯅꯥ ꯍꯦꯉ꯭ꯒꯠꯍꯟꯅꯕꯥ ꯁꯦꯝ ꯁꯥꯔꯀꯄꯒꯨꯝ ꯑꯗꯨꯝ ꯑꯣꯏꯅꯃꯛ ꯃꯍꯥꯛꯀꯤ ꯊꯋꯥꯏ ꯌꯥꯑꯣꯕꯥ ꯅꯥꯀꯣꯡ
dives He mutters a quick Gbye Click He could just as,ꯗꯥꯏꯚꯁ ꯃꯍꯥꯛꯅꯥ ꯀꯨꯏꯛ gbye ꯀ꯭ꯂꯤꯛ ꯑꯃꯥ ꯃꯨꯠꯇꯔ ꯇꯧꯏ ꯃꯍꯥꯛꯅꯥ ꯇꯧꯕꯥ ꯌꯥꯏ just as as
Ms Samuels did Its just that neither understands how a lively,ꯑꯦꯝ.ꯑꯦꯁ.ꯁꯦꯃꯨꯌꯦꯂꯁꯅꯥ ꯃꯁꯤꯒꯤ ꯑꯆꯨꯝꯕꯥ ꯑꯗꯨ ꯇꯧꯈꯤ ꯃꯗꯨꯗꯤ ꯃꯇꯧ ꯀꯔꯝꯅꯥ ꯂꯥꯏꯕꯛ ꯐꯕꯥ ꯑꯃꯅꯥ ꯃꯇꯧ ꯀꯔꯝꯅꯥ ꯈꯉꯕꯥ ꯉꯃꯒꯅꯤ
hello and a lackluster goodbye a ect someone Subconsciously,ꯍꯦꯂꯣ ꯑꯃꯁꯨꯡ ꯑꯦ ꯂꯦꯛꯀꯂꯁ꯭ꯇꯔ ꯒꯨꯗꯕꯥꯏ ꯑꯦ ꯏꯛꯇ ꯀꯅꯥꯒꯨꯝꯕꯥ ꯑꯃꯅꯥ ꯁꯕꯀꯟꯁꯤꯌꯦꯜ ꯑꯣꯏꯅꯥ
they feel they disappointed you,ꯃꯈꯣꯌꯅꯥ ꯅꯈꯣꯌꯕꯨ ꯅꯨꯡꯉꯥꯏꯇꯕꯥ ꯐꯥꯑꯣꯍꯜꯂꯤ .
Verbalizing your delight is even better Dont leave it to,ꯑꯗꯣꯃꯒꯤ ꯍꯔꯥꯑꯣꯕꯥ ꯑꯗꯨ ꯋꯥꯍꯩꯅꯥ ꯐꯣꯡꯗꯣꯀꯄꯥ ꯑꯁꯤ ꯍꯦꯟꯅꯥ ꯐꯩ dont leved it to
chance Practice a few upbeat goodies to juice up your good,ꯆꯥꯟꯁ ꯄ꯭ꯔꯦꯛꯇꯤꯁ ꯇꯧꯕꯥ ꯑꯗꯣꯃꯒꯤ ꯑꯐꯕꯥ ꯖꯨꯁ ꯇꯧꯅꯕꯥ ꯑꯄꯦꯅꯕꯥ ꯒꯨꯗꯁꯤꯡ ꯈꯔꯥ ꯄ꯭ꯔꯦꯛꯇꯤꯁ ꯇꯧꯕꯥ
byes in person on the phone or in your email which well,ꯕꯥꯏꯁꯤꯡ ꯑꯗꯨ ꯐꯣꯅꯗꯥ ꯅꯠꯠꯔꯒꯥ ꯅꯍꯥꯛꯀꯤ ꯏꯃꯦꯏꯂꯗꯥ ꯃꯁꯥꯅꯥ ꯃꯁꯥꯕꯨ ꯌꯥꯝꯅꯥ ꯐꯖꯅꯥ .
talk about in Part Nine And dont forget to use their name,ꯁꯔꯨꯛ ꯑꯅꯤꯗꯥ ꯋꯥꯔꯤ ꯁꯥꯕꯤꯌꯨ ꯑꯃꯁꯨꯡ ꯃꯈꯣꯌꯒꯤ ꯃꯤꯡ ꯁꯤꯖꯤꯟꯅꯕꯥ ꯀꯥꯑꯣꯔꯣꯏꯗꯕꯅꯤ
each time Here are some examples,ꯃꯇꯝ ꯈꯨꯗꯤꯡꯃꯛꯇꯥ ꯃꯐꯝ ꯑꯁꯤꯗꯥ ꯈꯨꯗꯝ ꯈꯔꯥ ꯄꯤꯔꯤ .
Saying goodbye after having met and chatted with,ꯋꯥꯔꯤ ꯁꯥꯅꯔꯕꯥ ꯃꯇꯨꯡꯗꯥ ꯒꯨꯗꯕꯥꯏ ꯍꯥꯌꯕꯥ
someone,ꯀꯅꯥꯒꯨꯝꯕ ꯑꯃ
I really enjoyed meeting you Marisol! Gian Im glad Joshua introduced us! 62  How to Instantly Connect with Anyone,ꯑꯩꯍꯥꯛꯅꯥ ꯅꯈꯣꯌꯒꯥ ꯎꯅꯕꯗꯥ ꯇꯁꯦꯡꯅꯥ ꯅꯨꯡꯉꯥꯏꯕꯥ ꯐꯥꯑꯣꯈꯤ!
Now you encounter a friend or acquaintance on the street,ꯍꯧꯖꯤꯛ ꯑꯗꯣꯝꯅꯥ ꯂꯝꯕꯤꯗꯥ ꯃꯔꯨꯞ ꯑꯃꯥ ꯅꯠꯔꯒꯥ ꯃꯔꯨꯞ ꯑꯃꯥ ꯊꯦꯡꯅꯔꯤ .
or at a party,ꯅꯠꯔꯒꯥ ꯄꯥꯔꯇꯤ ꯑꯃꯗꯥ .
Im so pleased we ran into each other Renee! Good bumping into you Brendan! At the end of a meeting or evening with a friend,ꯏꯝ ꯁꯣ ꯞꯂꯤꯗ ꯑꯩꯈꯣꯌꯅꯥ ꯑꯃꯒꯥ ꯑꯃꯒꯥ ꯔꯦꯅꯦꯒꯥ ꯊꯦꯡꯅꯈꯤ!
I had such fun talking with you Tania! When youre about to hang up on the phone,ꯑꯩꯍꯥꯛꯅꯥ ꯑꯗꯣꯃꯒꯥ ꯋꯥꯔꯤ ꯁꯥꯅꯈꯤꯕꯥ ꯑꯗꯨ ꯇꯥꯅꯤꯌꯥꯒꯥ ꯂꯣꯌꯅꯅꯥ ꯑꯁꯨꯛ ꯌꯥꯝꯅꯥ ꯅꯨꯡꯉꯥꯏꯈꯤ!
Gabriella great talking to you! Im glad your trip is,ꯒꯦꯕ꯭ꯔꯤꯌꯦꯂꯥ ꯑꯗꯣꯃꯒꯥ ꯋꯥꯔꯤ ꯁꯥꯅꯕꯥ ꯑꯆꯧꯕꯥ!
going well and looking forward to seeing you when,ꯐꯅꯥ ꯆꯠꯄꯥ ꯑꯃꯁꯨꯡ ꯑꯗꯣꯃꯕꯨ ꯀꯗꯥꯌꯗꯥ ꯎꯅꯅꯕꯥ ꯉꯥꯏꯗꯨꯅꯥ ꯂꯩꯔꯤ .
you get back,ꯑꯗꯣꯝꯅꯥ ꯑꯃꯨꯛ ꯍꯟꯅꯥ ꯐꯪꯒꯅꯤ .
Incidentally Phil now gives me a huge goodbye ever,ꯊꯧꯗꯣꯛ ꯑꯃꯅꯥ ꯐꯤꯜ ꯍꯧꯖꯤꯛ ꯑꯩꯉꯣꯟꯗꯥ ꯍꯧꯖꯤꯛ ꯐꯥꯑꯣꯕꯥ ꯑꯆꯧꯕꯥ ꯒꯨꯗꯕꯥꯏ ꯑꯃꯥ ꯄꯤꯔꯤ
since I showed him this chapter for permission to use his,ꯃꯔꯃꯗꯤ ꯑꯩꯅꯥ ꯃꯍꯥꯀꯄꯨ ꯃꯍꯥꯛꯀꯤ .
name,ꯃꯤꯡ
Little Trick 18,ꯂꯤꯇꯜ ꯇ꯭ꯔꯤꯛ ꯱꯸ .
Make Your Bye as Big as Your Hi,ꯅꯍꯥꯛꯀꯤ ꯕꯥꯏ ꯑꯗꯨ ꯅꯍꯥꯛꯀꯤ ꯍꯥꯏꯕꯒꯨꯝꯅꯥ ꯑꯆꯧꯕꯥ ꯑꯣꯏꯍꯅꯕꯤꯌꯨ
Th e next time you meet someone make a note of,th e ꯃꯊꯪꯒꯤ ꯃꯇꯃꯗꯥ ꯅꯍꯥꯛꯅꯥ ꯀꯅꯥꯒꯨꯝꯕꯥ ꯑꯃꯒꯥ ꯎꯅꯔꯀꯄꯥ ꯃꯇꯃꯗꯥ ꯅꯣꯠ ꯑꯃꯥ ꯁꯦꯝꯃꯨ
how enthusiastic you sounded when you said hello,ꯅꯍꯥꯛꯅꯥ ꯍꯦꯂꯣ ꯍꯥꯌꯔꯀꯄꯥ ꯃꯇꯃꯗꯥ ꯅꯍꯥꯛꯅꯥ ꯀꯌꯥꯗꯥ ꯊꯋꯥꯏ ꯌꯥꯑꯣꯕꯤꯈꯤꯕꯒꯦ ꯍꯥꯌꯕꯗꯨ
Th en when it comes time to say goodbye boost,Th en ꯃꯇꯝ ꯂꯥꯀꯄꯥ ꯃꯇꯃꯗꯥ ꯒꯨꯗꯕꯥꯏ ꯕꯨꯁ꯭ꯠ ꯍꯥꯌꯕꯥ
your energy level up a tad higher If appropriate tell,ꯀꯔꯤꯒꯨꯝꯕꯥ ꯃꯇꯤꯛ ꯆꯥꯕꯥ ꯑꯣꯏꯔꯕꯗꯤ ꯅꯍꯥꯛꯀꯤ ꯑꯦꯅꯔꯖꯤꯒꯤ ꯂꯦꯚꯦꯜ ꯑꯗꯨ ꯇꯥꯗ ꯍꯦꯟꯅꯥ ꯋꯥꯡꯈꯠꯄꯥ
the person of your pleasure,ꯅꯍꯥꯛꯀꯤ ꯅꯨꯡꯉꯥꯏꯕꯒꯤ ꯃꯤꯑꯣꯏ ꯑꯗꯨ .
A lively goodbye is like a warm kiss at the end of,ꯂꯥꯏꯕꯂꯤ ꯒꯨꯗꯕꯥꯏ ꯑꯃꯥ ꯍꯥꯌꯕꯁꯤꯒꯤ ꯑꯔꯣꯏꯕꯗꯥ ꯋꯥꯔꯝ ꯀꯤꯁ ꯑꯃꯒꯨꯝꯅꯥ .
the evening A lethargic lowenergy one sounds like,ꯅꯨꯃꯤꯗꯥꯡꯋꯥꯏꯔꯃꯗꯥ ꯂꯦꯊꯥꯔꯖꯤꯛ ꯂꯣꯋꯦꯅꯔꯖꯤ ꯑꯃꯥ ꯁꯣꯜꯂꯤ
a kisso,ꯑꯦ ꯀꯤꯁꯣ ꯑꯃꯥ
PART THREE,ꯁꯔꯨꯛ ꯑꯍꯨꯝ ꯊꯣꯀꯄꯒꯤ ꯑꯃꯥ .
TWELVE LITTLE TRICKS,ꯇꯔꯥꯅꯤꯄꯥꯜ ꯂꯤꯇꯜ ꯇ꯭ꯔꯤꯀꯁ
to Develop an Extraordinary,ꯑꯆꯝꯕꯥ ꯊꯕꯛ ꯑꯃꯥ ꯁꯦꯃꯒꯠꯅꯕꯥ .
Gift of Gab,ꯒꯤꯐꯠ ꯑꯣꯐ ꯒ꯭ꯌꯥꯕ .
This page intentionally left blank,ꯄꯦꯖ ꯑꯁꯤꯅꯥ ꯏꯅꯇꯦꯟꯁꯅꯦꯜ ꯑꯣꯏꯅꯥ ꯕ꯭ꯂꯦꯉ꯭ꯛ ꯊꯥꯗꯣꯀꯈꯤ
65,꯶꯵ ꯑꯃꯁꯨꯡ ꯑꯦꯟ.
How to Get Lively,ꯃꯇꯧ ꯀꯔꯝꯅꯥ ꯂꯥꯏꯕꯂꯤ ꯐꯪꯒꯅꯤ .
Conversation Going with,ꯋꯥꯔꯤ ꯁꯥꯅꯕꯥ ꯑꯗꯨꯒꯥ ꯂꯣꯌꯅꯅꯥ ꯋꯥꯔꯤ ꯁꯥꯅꯕꯥ
People Youve Just Met,ꯍꯧꯖꯤꯛ ꯍꯧꯖꯤꯛ ꯃꯤꯑꯣꯏꯁꯤꯡꯒꯥ ꯎꯅꯈꯤꯕꯥ ꯃꯤꯑꯣꯏꯁꯤꯡ .
People with the gift of gab have that Midas touch of being,ꯒꯦꯕꯀꯤ ꯈꯨꯗꯣꯜ ꯂꯩꯕꯥ ꯃꯤꯑꯣꯏꯁꯤꯡꯅꯥ ꯃꯤꯗꯥ ꯇꯆ ꯇꯧꯕꯥ ꯑꯁꯤ ꯂꯩꯔꯤ .
most noticeable quality is how quickly they connect with the,ꯈ꯭ꯕꯥꯏꯗꯒꯤ ꯍꯦꯟꯅꯥ ꯅꯣꯛꯅꯤꯡꯉꯥꯏ ꯑꯣꯏꯕꯥ ꯃꯒꯨꯟ ꯑꯁꯤ ꯃꯈꯣꯌꯅꯥ ꯀꯌꯥ ꯌꯥꯝꯅꯥ ꯊꯨꯅꯥ ꯀꯅꯦꯛꯇ ꯇꯧꯕꯒꯦ ꯍꯥꯌꯕꯁꯤꯅꯤ꯫
dozens of people we all encounter dailysalesclerks ticket,ꯑꯩꯈꯣꯌ ꯄꯨꯝꯅꯃꯛꯅꯥ ꯅꯨꯃꯤꯠ ꯈꯨꯗꯤꯡꯒꯤ ꯊꯦꯡꯅꯔꯤꯕꯥ ꯃꯤꯑꯣꯏ ꯗꯔꯖꯟ ꯀꯌꯥ ꯑꯃꯥ ꯊꯦꯡꯅꯩSalesLerks ꯇꯤꯀꯦꯠ
