en,mni-Mtei
bet you wish you felt that way about something Well you do You just,ꯕꯦꯠ ꯅꯍꯥꯛꯅꯥ ꯋꯥꯁꯀꯈꯤ ꯃꯗꯨꯗꯤ ꯅꯍꯥꯛꯅꯥ ꯀꯔꯤꯒꯨꯝꯕꯥ ꯑꯃꯒꯤ ꯃꯇꯥꯡꯗꯥ ꯑꯗꯨꯒꯨꯝꯕꯥ ꯃꯑꯣꯡꯗꯥ ꯐꯥꯑꯣꯔꯀꯄꯥ ꯑꯗꯨ ꯅꯍꯥꯛꯅꯥ ꯇꯧꯔꯤꯕꯥ ꯑꯗꯨ ꯅꯍꯥꯛꯅꯥ ꯈꯛꯇꯃꯛ [...]
have to forget whatever you were taught about meaningful work and,ꯑꯔꯊ ꯂꯩꯕꯥ ꯊꯕꯛꯀꯤ ꯃꯇꯥꯡꯗꯥ ꯅꯍꯥꯛꯅꯥ ꯇꯝꯕꯤꯈꯤꯕꯥ ꯑꯗꯨ ꯀꯥꯑꯣꯊꯣꯛꯀꯗꯕꯅꯤ ꯑꯃꯁꯨꯡ .
start noticing whatever has meaning to you,ꯑꯗꯣꯃꯒꯤꯗꯃꯛꯇꯥ ꯑꯔꯊ ꯂꯩꯕꯥ ꯋꯥꯐꯝ ꯑꯃꯥ ꯍꯦꯛꯇꯥ ꯈꯉꯕꯥ ꯍꯧꯔꯀꯎ
Real meaning your kind of meaning is as pure and unique as you,ꯑꯁꯦꯡꯕꯥ ꯑꯔꯊ ꯅꯍꯥꯛꯀꯤ ꯃꯈꯂꯒꯤ ꯑꯔꯊ ꯑꯁꯤ ꯑꯗꯣꯃꯒꯨꯝꯅꯥ ꯁꯨꯃꯍꯠꯄꯥ ꯑꯃꯁꯨꯡ ꯑꯈꯟꯅꯕꯥ ꯑꯣꯏꯔꯤ .
were as a child We do not know where it comes from Like your,ꯑꯉꯥꯡ ꯑꯣꯏꯔꯤꯉꯩꯗꯥ ꯑꯩꯈꯣꯌꯅꯥ ꯃꯁꯤ ꯀꯗꯥꯌꯗꯒꯤ ꯂꯥꯀꯄꯅꯣ ꯍꯥꯌꯕꯥ ꯈꯉꯗꯦ ꯅꯈꯣꯌꯒꯤ ꯃꯇꯧꯒꯨꯝ .
identity it just seems to be there It doesnt have to be created just,ꯑꯥꯏꯗꯦꯟꯇꯤꯇꯤ ꯑꯁꯤ ꯁꯨꯞꯅꯇꯒꯤ ꯃꯐꯝ ꯑꯗꯨꯗꯥ ꯂꯩꯕꯥ ꯎꯕꯥ ꯐꯪꯏ ꯃꯁꯤ ꯁꯨꯞꯅꯇꯒꯤ ꯁꯦꯃꯒꯠꯄꯥ ꯃꯊꯧ ꯇꯥꯗꯦ
discovered Personal meaning connects your deepest gifts with the rest,ꯊꯤꯖꯤꯅꯈꯤꯕꯥ ꯄꯔꯁꯣꯅꯦꯜ ꯃꯤꯅꯤꯡꯅꯥ ꯑꯗꯣꯃꯒꯤ ꯈ꯭ꯕꯥꯏꯗꯒꯤ ꯂꯨꯔꯕꯥ ꯈꯨꯗꯣꯂꯁꯤꯡꯒꯥ ꯑꯇꯣꯞꯄꯁꯤꯡꯒꯥ ꯁꯝꯅꯍꯜꯂꯤ
of the world Whether you turn out to be a gardener or a builder a,ꯃꯥꯂꯦꯃꯒꯤ ꯑꯣꯏꯅꯥ ꯑꯗꯣꯝꯅꯥ ꯒꯥꯔꯗꯦꯅꯔ ꯑꯃꯥ ꯑꯣꯏꯅꯥ ꯂꯥꯀꯄꯥ ꯅꯠꯔꯒꯥ ꯕꯤꯜꯗꯔ ꯑꯃꯥ ꯑꯣꯏꯅꯥ ꯂꯥꯀꯄꯥ ꯑꯁꯤ .
filmmaker or a doctorwhen youre doing the right work you will feel,ꯐꯤꯜꯃ ꯃꯦꯀꯔ ꯅꯠꯔꯒꯥ ꯗꯣꯛꯇꯔ ꯑꯃꯅꯥ ꯅꯍꯥꯛꯅꯥ ꯑꯆꯨꯝꯕꯥ ꯊꯕꯛ ꯇꯧꯕꯥ ꯃꯇꯃꯗꯥ ꯅꯍꯥꯛꯅꯥ ꯐꯥꯑꯣꯒꯅꯤ
connected both to your soul and to the world outside you A gardener,ꯑꯗꯣꯃꯒꯤ ꯊꯋꯥꯏ ꯑꯃꯁꯨꯡ ꯑꯗꯣꯃꯒꯤ ꯃꯄꯥꯟꯗꯥ ꯂꯩꯕꯥ ꯃꯥꯂꯦꯝ ꯑꯁꯤꯒꯥ ꯂꯣꯌꯅꯅꯥ ꯕꯥꯒꯥꯟ ꯑꯃꯥ ꯑꯅꯤꯃꯛ ꯁꯝꯅꯍꯜꯂꯦ
feels hes creating beauty and has reverence for nature A builder or,feels hes beaving beauty ꯑꯃꯁꯨꯡ haven reverence for nature a builder or
filmmaker feels shes using her best abilities to create something to,ꯐꯤꯜꯃ ꯃꯦꯀꯔꯅꯥ ꯃꯍꯥꯛꯀꯤ ꯈ꯭ꯕꯥꯏꯗꯒꯤ ꯐꯕꯥ ꯇꯧꯕꯥ ꯉꯝꯕꯁꯤꯡ ꯁꯤꯖꯤꯟꯅꯗꯨꯅꯥ ꯀꯔꯤꯒꯨꯝꯕꯥ ꯈꯔꯥ ꯁꯦꯃꯒꯠꯅꯕꯥ ꯐꯤꯜ ꯇꯧꯏ
delight the world A doctor feels hes using his best skills and brains to,ꯗꯤꯂꯥꯏꯠ ꯃꯥꯂꯦꯝ ꯑꯁꯤ ꯗꯣꯛꯇꯔ ꯑꯃꯅꯥ ꯃꯍꯥꯛꯀꯤ ꯈ꯭ꯕꯥꯏꯗꯒꯤ ꯐꯕꯥ ꯁ꯭ꯀꯤꯂꯁꯤꯡ ꯑꯃꯁꯨꯡ ꯕ꯭ꯔꯦꯅꯁꯤꯡ ꯁꯤꯖꯤꯟꯅꯗꯨꯅꯥ ꯃꯍꯥꯛꯅꯥ ꯐꯥꯑꯣꯔꯤ
heal people,ꯃꯤꯁꯤꯡꯕꯨ ꯐꯒꯠꯍꯅꯕꯥ
The very first step to finding work that fits you is to understand the,ꯑꯗꯣꯃꯒꯥ ꯆꯨꯅꯕꯥ ꯊꯕꯛ ꯊꯤꯕꯒꯤ ꯈ꯭ꯕꯥꯏꯗꯒꯤ ꯑꯍꯥꯅꯕꯥ ꯈꯣꯡꯊꯥꯡꯗꯤ .
connection between doing what you love and doing something worth,ꯅꯍꯥꯛꯅꯥ ꯅꯨꯡꯁꯤꯖꯕꯥ ꯑꯗꯨ ꯇꯧꯕꯥ ꯑꯃꯁꯨꯡ ꯃꯃꯜ ꯂꯩꯕꯥ ꯊꯕꯛ ꯑꯃꯥ ꯇꯧꯕꯒꯤ ꯃꯔꯛꯇꯥ ꯀꯅꯦꯛꯁꯟ
doing something that has meaning,ꯑꯔꯊ ꯂꯩꯕꯥ ꯊꯕꯛ ꯑꯃꯥ ꯇꯧꯕꯥ .
Because they are one and the same thing,ꯃꯔꯃꯗꯤ ꯃꯈꯣꯌ ꯑꯁꯤ ꯑꯃꯒꯥ ꯑꯃꯒꯥ ꯃꯥꯟꯅꯩ .
a long vacation as your lifes goal Even in retirement even when youre,ꯅꯍꯥꯛꯀꯤ ꯄꯨꯟꯁꯤꯒꯤ ꯄꯥꯟꯗꯝ ꯑꯣꯏꯅꯥ ꯁꯥꯡꯂꯕꯥ ꯁꯨꯇꯤ ꯑꯃꯥ ꯅꯍꯥꯛꯅꯥ ꯔꯤꯇꯥꯌꯥꯔꯃꯦꯟꯇ ꯇꯧꯔꯕꯁꯨ ꯅꯍꯥꯛꯅꯥ ꯌꯨ.ꯑꯥꯔ.ꯏ.
only looking to get off the fast track and smell the roses you should be,ꯐꯥꯁ꯭ꯠ ꯇ꯭ꯔꯦꯛ ꯑꯗꯨꯗꯒꯤ ꯂꯥꯞꯅꯥ ꯂꯩꯅꯕꯥ ꯑꯃꯁꯨꯡ ꯅꯍꯥꯛꯅꯥ ꯑꯣꯏꯒꯗꯕꯥ ꯒꯣꯂꯥꯄꯁꯤꯡ ꯑꯗꯨ ꯃꯍꯤꯛ ꯆꯦꯜꯂꯛꯅꯕꯥ ꯈꯛꯇꯃꯛ ꯌꯦꯡꯂꯤ .
pushing past what you merely enjoy into what has real meaning to you,ꯑꯗꯣꯃꯒꯤꯗꯃꯛꯇꯥ ꯑꯁꯦꯡꯕꯥ ꯑꯔꯊ ꯂꯩꯕꯥ ꯋꯥꯐꯝ ꯑꯗꯨꯗꯥ ꯑꯗꯣꯝꯅꯥ ꯁꯨꯞꯅꯇꯒꯤ ꯅꯨꯡꯉꯥꯏꯕꯥ ꯐꯥꯑꯣꯔꯤꯕꯥ ꯑꯗꯨ ꯄꯥꯁ꯭ꯠ ꯑꯣꯏꯅꯥ ꯄꯨꯁꯤꯜꯂꯀꯄꯥ
When something really matters to you you must bring it into your life,ꯀꯔꯤꯒꯨꯝꯕꯥ ꯋꯥꯐꯝ ꯑꯃꯅꯥ ꯑꯗꯣꯃꯒꯤꯗꯃꯛꯇꯥ ꯇꯁꯦꯡꯅꯥ ꯃꯔꯨ ꯑꯣꯏꯕꯥ ꯃꯇꯃꯗꯥ ꯑꯗꯣꯝꯅꯥ ꯃꯗꯨ ꯑꯗꯣꯃꯒꯤ ꯄꯨꯟꯁꯤꯗꯥ ꯄꯨꯔꯀꯄꯥ ꯇꯥꯏ .
Without an activity that really matters to you youre going to feel,ꯑꯗꯣꯃꯒꯤꯗꯃꯛꯇꯥ ꯇꯁꯦꯡꯅꯥ ꯃꯔꯨ ꯑꯣꯏꯕꯥ ꯑꯦꯛꯇꯤꯕꯤꯇꯤ ꯑꯃꯥ ꯌꯥꯑꯣꯗꯅꯥ ꯅꯍꯥꯛꯅꯥ ꯐꯤꯜ ꯇꯧꯕꯥ ꯆꯠꯀꯅꯤ .
empty even if youve set yourself up in Paradise and are living the life,ꯀꯔꯤꯒꯨꯝꯕꯥ ꯅꯍꯥꯛꯅꯥ ꯅꯁꯥꯕꯨ ꯄꯥꯔꯥꯗꯥꯏꯁꯇꯥ ꯊꯝꯂꯕꯁꯨ ꯑꯃꯁꯨꯡ ꯄꯨꯟꯁꯤ ꯍꯤꯡꯂꯤꯕꯥ ꯑꯣꯏꯔꯕꯁꯨ ꯏꯪꯅꯥ ꯂꯩꯕꯥ .
of the rich and famous If youre not involved in something you truly,ꯀꯔꯤꯒꯨꯝꯕꯥ ꯅꯍꯥꯛꯅꯥ ꯇꯁꯦꯡꯅꯥ ꯀꯔꯤꯒꯨꯝꯕꯥ ꯑꯃꯗꯥ ꯁꯔꯨꯛ ꯌꯥꯗ꯭ꯔꯕꯗꯤ ꯏꯅꯥꯛ ꯈꯨꯅꯕꯥ ꯑꯃꯁꯨꯡ ꯃꯃꯤꯡ ꯆꯠꯂꯕꯥ ꯃꯤꯑꯣꯏꯁꯤꯡꯒꯤ ꯃꯔꯃꯗꯥ .
care about anyplace can seem like a prison,ꯃꯐꯝ ꯑꯃꯠꯇꯗꯥ ꯌꯦꯡꯁꯤꯅꯕꯥ ꯑꯁꯤ ꯖꯦꯜ ꯑꯃꯥ ꯑꯣꯏꯅꯥ ꯎꯕꯥ ꯌꯥꯏ .
And thats not all,ꯑꯃꯁꯨꯡ ꯃꯗꯨ ꯄꯨꯝꯅꯃꯛ .
If you think its selfish to put yourself first like this think again,ꯀꯔꯤꯒꯨꯝꯕꯥ ꯅꯍꯥꯛꯅꯥ ꯃꯁꯤꯒꯤ ꯃꯁꯥꯒꯤ ꯑꯣꯏꯖꯕꯥ ꯊꯤꯕꯥ ꯑꯁꯤ ꯃꯁꯥꯅꯥ ꯃꯁꯥꯕꯨ ꯑꯍꯥꯅꯕꯥ ꯑꯣꯏꯅꯥ ꯊꯃꯖꯒꯦ ꯍꯥꯌꯅꯥ ꯈꯜꯂꯕꯗꯤ ꯑꯃꯨꯛ ꯍꯟꯅꯥ ꯈꯟꯊꯕꯤꯌꯨ
because when youre doing work you love its a gift to the world as well! Picasso wasnt trying to help anybody For that matter Einstein wasnt,ꯃꯔꯃꯗꯤ ꯅꯍꯥꯛꯅꯥ ꯊꯕꯛ ꯇꯧꯕꯥ ꯃꯇꯃꯗꯥ ꯅꯍꯥꯛꯅꯥ ꯃꯁꯤꯒꯤ ꯃꯥꯂꯦꯝ ꯑꯁꯤꯕꯨꯁꯨ ꯅꯨꯡꯁꯤꯖꯩ!
either not when he was working on the theory of relativity They just,ꯅꯠꯔꯒꯥ ꯃꯍꯥꯛꯅꯥ ꯔꯤꯂꯦꯇꯤꯕꯤꯇꯤꯒꯤ ꯊꯤꯑꯣꯔꯤꯗꯥ ꯊꯕꯛ ꯇꯧꯕꯥ ꯃꯇꯃꯗꯥ ꯅꯠꯇꯦ ꯃꯈꯣꯌꯅꯥ ꯁꯨꯞꯅꯇꯒꯤ .
wanted to do their work That work seemed very important to them and,ꯃꯈꯣꯌꯒꯤ ꯊꯕꯛ ꯇꯧꯕꯥ ꯄꯥꯃꯈꯤ ꯃꯗꯨꯗꯤ ꯊꯕꯛ ꯑꯁꯤ ꯃꯈꯣꯌꯒꯤꯗꯃꯛꯇꯥ ꯌꯥꯝꯅꯥ ꯃꯔꯨꯑꯣꯏꯕꯥ ꯑꯣꯏꯅꯥ ꯎꯈꯤ ꯑꯃꯁꯨꯡ .
they couldnt get their minds off it Their efforts were personal self,ꯃꯈꯣꯌꯅꯥ ꯃꯈꯣꯌꯒꯤ ꯋꯥꯈꯂꯗꯒꯤ ꯂꯧꯊꯣꯀꯄꯥ ꯉꯃꯈꯤꯗꯦ ꯃꯈꯣꯌꯒꯤ ꯍꯣꯠꯅꯖꯃꯜ ꯑꯗꯨ ꯄꯔꯁꯣꯅꯦꯜ ꯁꯦꯜꯐ .
absorbed even selfishor at least no ones welfare was in mind when,ꯑꯦꯕꯁꯣꯔꯕꯦꯗ ꯏꯚꯦꯟꯇ ꯁꯦꯜꯐꯁꯔ ꯌꯥꯃꯗ꯭ꯔꯕꯗꯥ ꯀꯅꯥꯒꯨꯝꯕꯥ ꯑꯃꯒꯤ ꯋꯦꯂꯐꯦꯌꯔ ꯑꯃꯠꯇꯥ ꯋꯥꯈꯂꯗꯥ ꯂꯩꯈꯤꯗꯦ
they worked Even the saviors of this world have some kind of personal,ꯃꯈꯣꯌꯅꯥ ꯃꯥꯂꯦꯝ ꯑꯁꯤꯒꯤ ꯉꯥꯀꯄꯤꯕꯥ ꯐꯥꯑꯣꯕꯥ ꯊꯕꯛ ꯇꯧꯈꯤ ꯃꯈꯜ ꯑꯃꯒꯤ ꯄꯔꯁꯣꯅꯦꯜ .
vision theyre fulfilling when they go out to help the sick or to heal the,ꯚꯤꯖꯟ ꯃꯈꯣꯌꯅꯥ ꯑꯅꯥꯕꯥ ꯃꯤꯑꯣꯏꯁꯤꯡꯕꯨ ꯃꯇꯦꯡ ꯄꯥꯡꯅꯕꯥ ꯅꯠꯔꯒꯥ ꯐꯒꯠꯍꯟꯅꯕꯥ ꯆꯠꯄꯥ ꯃꯇꯃꯗꯥ ꯃꯄꯨꯡ ꯐꯥꯍꯅꯕꯥ
planet They are listening to their own urgencies not just trying to be,ꯄ꯭ꯂꯥꯅꯦꯠ ꯃꯈꯣꯌꯅꯥ ꯃꯁꯥꯒꯤ ꯈꯨꯗꯛꯀꯤ ꯑꯣꯏꯕꯥ ꯋꯥꯐꯃꯁꯤꯡ ꯇꯥꯔꯤꯕꯁꯤ ꯁꯨꯞꯅꯇꯒꯤ ꯑꯣꯏꯅꯕꯥ ꯍꯣꯠꯅꯕꯅꯤ꯫
good people Its time to dismantle the myth that says you must choose,ꯑꯐꯕꯥ ꯃꯤꯑꯣꯏꯁꯤꯡꯅꯥ ꯃꯁꯤꯒꯤ ꯃꯇꯝ ꯑꯁꯤ ꯅꯍꯥꯛꯅꯥ ꯈꯅꯒꯗꯕꯅꯤ ꯍꯥꯌꯅꯥ ꯍꯥꯌꯔꯤꯕꯥ ꯃꯤꯠꯌꯦꯡ ꯑꯗꯨ ꯂꯧꯊꯣꯛꯅꯕꯥ .
between pleasing yourself and doing something meaningful,ꯅꯁꯥꯕꯨ ꯅꯨꯡꯉꯥꯏꯍꯅꯕꯥ ꯑꯃꯁꯨꯡ ꯑꯔꯊ ꯊꯣꯀꯄꯥ ꯊꯕꯛ ꯑꯃꯥ ꯇꯧꯕꯒꯤ ꯃꯔꯛꯇꯥ .
To do one you must do the other,ꯑꯃꯅꯥ ꯇꯧꯅꯕꯥ ꯅꯍꯥꯛꯅꯥ ꯑꯇꯣꯞꯄꯥ ꯊꯕꯛ ꯑꯗꯨ ꯇꯧꯒꯗꯕꯅꯤ꯫
To do great work you have to be in love And with worklove as,ꯑꯆꯧꯕꯥ ꯊꯕꯛ ꯑꯃꯥ ꯇꯧꯅꯕꯒꯤꯗꯃꯛ ꯑꯗꯣꯝꯅꯥ ꯅꯨꯡꯁꯤꯖꯕꯥ ꯑꯃꯁꯨꯡ ꯋꯥꯔꯀꯂꯣꯡꯒꯥ ꯂꯣꯌꯅꯅꯥ ꯂꯩꯒꯗꯕꯅꯤ꯫
is exciting and fulfilling you cant do whats right you have to do,ꯑꯁꯤ ꯄꯨꯛꯅꯤꯡ ꯊꯧꯒꯠꯅꯤꯡꯉꯥꯏ ꯑꯣꯏꯕꯥ ꯑꯃꯁꯨꯡ ꯃꯄꯨꯡ ꯐꯥꯕꯥ ꯅꯍꯥꯛꯅꯥ ꯇꯧꯕꯥ ꯉꯃꯗꯦ ꯋꯥꯠꯁ ꯔꯥꯏꯠ ꯅꯍꯥꯛꯅꯥ ꯇꯧꯒꯗꯕꯥ
whats right for you In the long run its the most generous thing you can,whats for you for long run its ꯈ꯭ꯕꯥꯏꯗꯒꯤ ꯌꯥꯝꯅꯥ ꯃꯤꯅꯨꯡꯁꯤ ꯂꯩꯕꯥ ꯋꯥꯐꯝ ꯑꯃꯥ ꯑꯗꯣꯝꯅꯥ ꯇꯧꯕꯥ ꯉꯃꯒꯅꯤ꯫
do It can be heartwarming to think you owe it to the world to do what,ꯇꯧꯕꯥ ꯑꯁꯤ ꯑꯗꯣꯝꯅꯥ ꯃꯥꯂꯦꯃꯗꯥ ꯔ꯭ꯏꯟ ꯄꯤꯔꯤ ꯍꯥꯌꯅꯥ ꯈꯅꯕꯥ ꯑꯁꯤ ꯊꯝꯃꯣꯌ ꯁꯣꯛꯅꯤꯡꯉꯥꯏ ꯑꯣꯏꯕꯥ ꯌꯥꯏ
youre best at and what you love most It gives you the rightby giving,youre best at and what you what love most ꯃꯁꯤꯅꯥ ꯅꯍꯥꯀꯄꯨ ꯄꯤꯔꯤꯕꯥ ꯂꯝꯕꯤ ꯑꯗꯨ ꯄꯤꯔꯤ
you the obligationto do it,ꯑꯗꯣꯝꯅꯥ ꯃꯁꯤ ꯇꯧꯕꯒꯤ ꯑꯣꯕꯂꯤꯒꯦꯁꯟ ꯑꯗꯨ .
Do you know how it feels to do work you love? I asked around and got,ꯑꯗꯣꯝꯅꯥ ꯅꯨꯡꯁꯤꯖꯕꯥ ꯊꯕꯛ ꯇꯧꯕꯥ ꯑꯁꯤ ꯀꯔꯝꯅꯥ ꯐꯥꯑꯣꯒꯅꯤ ꯍꯥꯌꯕꯗꯨ ꯑꯗꯣꯝꯅꯥ ꯈꯉꯕꯤꯔꯤꯕꯔꯥ?
these answers,ꯍꯥꯌꯔꯤꯕꯥ ꯄꯥꯎꯈꯨꯃꯁꯤꯡ ꯑꯁꯤ .
It fills you up uses everything youve got,ꯃꯁꯤꯅꯥ ꯅꯍꯥꯀꯄꯨ ꯐꯤꯜꯂꯤ ꯑꯞ ꯌꯨꯖ ꯏꯊꯠ ꯏꯎꯚ ꯒꯠ .
I love my work because its always a stretch and its always new,ꯑꯩꯍꯥꯛꯅꯥ ꯑꯩꯍꯥꯛꯀꯤ ꯊꯕꯛ ꯑꯁꯤ ꯅꯨꯡꯁꯤꯖꯩ ꯃꯔꯃꯗꯤ ꯃꯁꯤ ꯃꯇꯝ ꯄꯨꯝꯅꯃꯛꯇꯥ ꯁ꯭ꯠꯔꯦꯠ ꯑꯃꯅꯤ ꯑꯃꯁꯨꯡ ꯃꯁꯤꯒꯤ ꯃꯇꯝ ꯄꯨꯝꯅꯃꯛꯇꯥ ꯑꯅꯧꯕꯥ .
I know I love what Im doing when I forget the clock,ꯑꯩꯅꯥ ꯈꯉꯏ ꯑꯩꯅꯥ ꯘꯗꯤ ꯀꯥꯑꯣꯊꯣꯀꯄꯥ ꯃꯇꯃꯗꯥ ꯏꯝ ꯇꯧꯕꯥ ꯑꯁꯤ ꯅꯨꯡꯁꯤꯖꯩ .
It feels honest Hard honest work Like a fireman or a farmer,ꯃꯁꯤ ꯄꯨꯀꯆꯦꯜ ꯁꯦꯡꯕꯥ ꯀꯟꯅꯥ ꯄꯨꯀꯆꯦꯜ ꯁꯦꯡꯕꯥ ꯊꯕꯛ ꯑꯃꯥ ꯑꯣꯏꯅꯥ ꯐꯥꯑꯣꯔꯤ ꯃꯗꯨꯗꯤ ꯃꯩ ꯊꯥꯕꯥ ꯃꯤꯑꯣꯏ ꯑꯃꯥ ꯅꯠꯠꯔꯒꯥ ꯂꯧꯃꯤ ꯑꯃꯒꯨꯝ .
When I love my work Im the owner Im in business for myself To,ꯑꯩꯅꯥ ꯑꯩꯒꯤ ꯊꯕꯛ ꯑꯁꯤ ꯅꯨꯡꯁꯤꯖꯕꯥ ꯃꯇꯃꯗꯥ ꯏꯝ ꯑꯗꯨ ꯑꯣꯅꯔ ꯏꯝ ꯏꯟ ꯕꯤꯖꯅꯦꯁ ꯐꯣꯔ ꯏꯁꯥꯒꯤꯗꯃꯛ
really give my best I have to feel that way even if Im actually,ꯇꯁꯦꯡꯅꯥ ꯑꯩꯒꯤ ꯈ꯭ꯕꯥꯏꯗꯒꯤ ꯐꯕꯥ ꯑꯗꯨ ꯄꯤꯌꯨ ꯑꯩꯅꯥ ꯇꯁꯦꯡꯅꯥ ꯐꯥꯑꯣꯒꯗꯕꯅꯤ ꯑꯗꯨꯕꯨ ꯏꯝ ꯇꯁꯦꯡꯅꯥ
being paid by someone else,ꯑꯇꯣꯞꯄꯥ ꯀꯅꯥꯒꯨꯝꯕꯥ ꯑꯃꯅꯥ ꯁꯦꯜ ꯄꯤꯕꯥ
Nice work if you can get it isnt it? You can get it The path well be taking in these pages may seem,ꯅꯨꯡꯉꯥꯏꯔꯕꯥ ꯊꯕꯛ ꯀꯔꯤꯒꯨꯝꯕꯥ ꯅꯍꯥꯛꯅꯥ ꯃꯁꯤ ꯐꯪꯕꯥ ꯉꯝꯂꯕꯗꯤ ꯃꯁꯤꯅꯤ?
roundabout to you at first but it leads finally to work you love So free,ꯑꯍꯥꯅꯕꯗꯥ ꯑꯗꯣꯃꯒꯤ ꯃꯐꯃꯗꯥ ꯔꯎꯟꯗꯕꯎꯠ ꯇꯧꯕꯥ ꯑꯗꯨꯕꯨ ꯃꯁꯤꯅꯥ ꯑꯔꯣꯏꯕꯗꯥ ꯊꯕꯛꯇꯥ ꯂꯨꯆꯤꯡꯏ ꯅꯍꯥꯛꯅꯥ ꯅꯨꯡꯁꯤꯖꯕꯥ ꯑꯗꯨꯅꯥ ꯐ꯭ꯔꯤ ꯑꯣꯏꯅꯥ
yourself up from any restrictions to your imagination and get ready to,ꯑꯗꯣꯃꯒꯤ ꯏꯃꯦꯖꯃꯦꯟꯇꯇꯥ ꯑꯊꯤꯡꯕꯥ ꯑꯃꯥ ꯍꯦꯛꯇꯥ ꯂꯩꯔꯒꯥ ꯑꯗꯣꯃꯒꯤ ꯏꯁꯥꯕꯨ .
do some freewheeling fantasizing Were going to have a little fun,ꯐ꯭ꯔꯤ ꯍꯨꯏꯜ ꯈꯔꯥ ꯇꯧꯕꯥ ꯐꯦꯟꯁꯤꯖꯤꯡ ꯈꯔꯥ ꯅꯨꯡꯉꯥꯏꯕꯥ ꯐꯣꯡꯗꯣꯀꯈꯤꯕꯥ ꯌꯥꯏ
GET A JOB,ꯊꯕꯛ ꯑꯃꯥ ꯐꯪꯕꯤꯌꯨ
Exercise 2 The Job from Heaven or Hell! Yes I said job For this exercise we wont need to do anything as,ꯑꯦꯛꯁꯔꯁꯥꯏꯖ ꯲ ꯁ꯭ꯕꯔꯒ ꯅꯠꯔꯒꯥ ꯅꯣꯔꯣꯗꯒꯤ ꯊꯕꯛ ꯑꯗꯨ!
ambitious as find meaningful work This is a twopart exercise and it,ꯑꯦꯝꯕꯤꯁꯤꯌꯁ ꯑꯦꯖ ꯐꯥꯏꯟꯗ ꯃꯤꯅꯤꯡꯐꯨꯜ ꯋꯥꯔꯛ ꯑꯁꯤ ꯁꯔꯨꯛ ꯑꯅꯤꯒꯤ ꯑꯦꯛꯁꯔꯁꯥꯏꯖ ꯑꯃꯅꯤ ꯑꯃꯁꯨꯡ ꯃꯁꯤ
doesnt matter which part you do first If you can start with Part A,ꯀꯔꯤꯒꯨꯝꯕꯥ ꯅꯍꯥꯛꯅꯥ ꯄꯥꯔꯠ ꯑꯦꯗꯒꯤ ꯍꯧꯕꯥ ꯉꯝꯂꯕꯗꯤ ꯅꯍꯥꯛꯅꯥ ꯑꯍꯥꯅꯕꯥ ꯑꯣꯏꯅꯥ ꯇꯧꯔꯤꯕꯥ ꯁꯔꯨꯛ ꯑꯗꯨ ꯀꯅꯥꯅꯣ ꯍꯥꯌꯕꯗꯨꯗꯤ ꯃꯔꯨ ꯑꯣꯏꯗꯦ꯫
Part A The Job from Heaven,ꯄꯥꯔꯠ ꯑꯦ ꯗ ꯖꯕ ꯐ꯭ꯔꯝ ꯍꯦꯚꯟ
Let your imagination run free and give yourself the gift of designing,ꯅꯍꯥꯛꯀꯤ ꯏꯃꯦꯖꯃꯦꯟꯇ ꯑꯗꯨ ꯐ꯭ꯔꯤ ꯑꯣꯏꯅꯥ ꯆꯠꯍꯅꯕꯤꯌꯨ ꯑꯃꯁꯨꯡ ꯅꯍꯥꯛꯅꯥ ꯃꯁꯥꯃꯀꯄꯨ ꯗꯤꯖꯥꯏꯟ ꯇꯧꯕꯒꯤ ꯈꯨꯗꯣꯜ ꯄꯤꯕꯤꯌꯨ
the worlds most perfect job Create your own hours your own activities,ꯃꯥꯂꯦꯃꯒꯤ ꯈ꯭ꯕꯥꯏꯗꯒꯤ ꯃꯄꯨꯡ ꯐꯥꯕꯥ ꯊꯕꯛ ꯑꯁꯤꯅꯥ ꯅꯍꯥꯛꯀꯤ ꯏꯁꯥꯒꯤ ꯄꯨꯡꯁꯤꯡ ꯅꯍꯥꯛꯀꯤ ꯏꯁꯥꯒꯤ ꯊꯕꯛ ꯊꯧꯔꯃꯁꯤꯡ ꯁꯦꯝꯃꯨ
your most desirable environment Dont limit yourself with reality or,ꯅꯍꯥꯛꯀꯤ ꯈ꯭ꯕꯥꯏꯗꯒꯤ ꯄꯥꯝꯅꯕꯥ ꯑꯦꯅꯚꯥꯏꯔꯅꯃꯦꯟꯇ ꯑꯗꯨ ꯔꯤꯑꯦꯂꯤꯇꯤ ꯅꯠꯠꯔꯒꯥ .
practicality because this is Fantasy Time The only limitation is this It,ꯄ꯭ꯔꯦꯛꯇꯤꯀꯦꯂꯤꯇꯤ ꯃꯔꯃꯗꯤ ꯃꯁꯤ ꯐꯦꯟꯁꯤ ꯇꯥꯏꯃꯅꯤ ꯂꯤꯃꯤꯇꯦꯁꯟ ꯑꯁꯤ ꯃꯁꯤꯅꯤ ꯃꯁꯤ ꯃꯁꯤꯅꯤ .
must be a job not a life That is it has to have tasks in it hours to keep,ꯃꯊꯧ ꯇꯥꯏ ꯊꯕꯛ ꯑꯃꯥ ꯑꯣꯏꯔꯣꯏꯗꯕꯥ ꯄꯨꯟꯁꯤ ꯑꯃꯥ ꯍꯥꯌꯕꯗꯤ ꯃꯁꯤꯅꯥ ꯊꯝꯅꯕꯒꯤꯗꯃꯛ ꯑꯥꯏ.ꯇꯤ.ꯒꯤ ꯄꯨꯡꯁꯤꯡꯗꯥ ꯊꯕꯀꯁꯤꯡ ꯂꯩꯒꯗꯕꯅꯤ꯫
and some kind of remuneration After that you can run wild You can,ꯑꯃꯁꯨꯡ ꯃꯈꯜ ꯑꯃꯒꯤ ꯔꯤꯌꯨꯅꯦꯔꯦꯁꯟ ꯃꯗꯨꯒꯤ ꯃꯇꯨꯡꯗꯥ ꯅꯍꯥꯛꯅꯥ ꯋꯥꯏꯜꯗ ꯑꯣꯏꯅꯥ ꯆꯠꯄꯥ ꯌꯥꯏ ꯅꯍꯥꯛꯅꯥ ꯇꯧꯕꯥ ꯌꯥꯏ .
decide that you want to be a cowhand during the week who gets picked,ꯋꯥꯔꯦꯞ ꯂꯧꯔꯦ ꯃꯗꯨꯗꯤ ꯅꯍꯥꯛꯅꯥ ꯅꯨꯃꯤꯠ ꯑꯗꯨꯒꯤ ꯃꯅꯨꯡꯗꯥ ꯀꯅꯥꯅꯥ ꯂꯧꯒꯅꯤ ꯍꯥꯌꯅꯥ ꯋꯥꯔꯦꯞ ꯂꯧꯕꯤꯌꯨ
up each weekend by helicopter and taken to a luxurious spa and makes,ꯍꯦꯂꯤꯀꯣꯞꯇꯔꯅꯥ ꯅꯨꯃꯤꯠ ꯍꯨꯝꯅꯤ ꯈꯨꯗꯤꯡꯒꯤ ꯑꯞ ꯇꯧꯗꯨꯅꯥ ꯂꯛꯀꯔ ꯁ꯭ꯄꯥ ꯑꯃꯗꯥ ꯂꯧꯈꯠꯇꯨꯅꯥ ꯁꯦꯝꯕꯥ
documentary films on winter vacation,ꯋꯤꯟꯇꯔ ꯚꯦꯀꯦꯁꯟꯗꯥ ꯗꯣꯀꯨꯃꯦꯟꯇꯦꯔꯤ ꯐꯤꯜꯃꯁꯤꯡ
Remember to include those important categories what where and,ꯃꯔꯨꯑꯣꯏꯕꯥ ꯀꯦꯇꯦꯒꯣꯔꯤꯁꯤꯡ ꯑꯗꯨ ꯀꯔꯤ ꯃꯐꯝ ꯑꯃꯁꯨꯡ .
with whom? What would you be doing all day? Would you be shouting through a,ꯀꯅꯥꯒꯥ ꯂꯣꯌꯅꯅꯥ?
bullhorn on a movie set biking or bargaining designing or building or,ꯕꯨꯂꯍꯣꯔꯟ ꯑꯣꯟ ꯑꯦ ꯃꯨꯚꯤꯠ ꯁꯦꯠ ꯕꯥꯏꯀꯤꯡ ꯅꯠꯠꯔꯒꯥ ꯕꯥꯔꯒꯦꯏꯅꯤꯡ ꯗꯤꯖꯥꯏꯟ ꯇꯧꯕꯥ ꯅꯠꯠꯔꯒꯥ ꯕꯤꯜꯗꯤꯡ ꯇꯧꯕꯥ ꯅꯠꯠꯔꯒꯥ
iceskating or saving somebody? Would you be singing bass in Boris,ꯑꯥꯏꯁꯀꯦꯇꯤꯡ ꯅꯠꯔꯒꯥ ꯀꯅꯥꯒꯨꯝꯕꯥ ꯑꯃꯕꯨ ꯁꯦꯚꯤꯡ ꯇꯧꯕꯥ?
Godunov or giving a speech to thousands of cheering people? Would you,ꯒꯣꯗꯨꯅꯣꯚ ꯅꯠꯔꯒꯥ ꯊꯋꯥꯏ ꯌꯥꯑꯣꯕꯥ ꯃꯤꯑꯣꯏ ꯂꯤꯁꯤꯡ ꯀꯌꯥꯗꯥ ꯋꯥ ꯉꯥꯡꯕꯥ?
have a clipboard and be walking around your own factory making sure,ꯀ꯭ꯂꯤꯄꯕꯣꯔꯗ ꯑꯃꯥ ꯂꯩꯌꯨ ꯑꯃꯁꯨꯡ ꯅꯍꯥꯛꯀꯤ ꯏꯁꯥꯒꯤ ꯐꯦꯛꯇꯔꯤꯗꯥ ꯁꯣꯏꯗꯅꯥ ꯆꯠꯂꯨ
your fabrics are being woven and printed to perfection? Where would you be doing this job? Describe the environment Would,ꯅꯈꯣꯌꯒꯤ ꯐꯤꯔꯣꯂꯁꯤꯡ ꯑꯗꯨ ꯃꯄꯨꯡ ꯐꯥꯅꯥ ꯁꯦꯃꯖꯤꯜꯂꯤ ꯑꯃꯁꯨꯡ ꯄ꯭ꯔꯤꯟꯇ ꯇꯧꯔꯤꯕꯔꯥ?
you prefer a cozy cottage with a roaring fireplace Antarctica midtown,ꯑꯗꯣꯝꯅꯥ ꯔꯣꯌꯔꯤꯡ ꯐꯥꯏꯌꯔꯞꯂꯦꯁ ꯑꯦꯟꯇꯥꯔꯀꯇꯤꯀꯥ ꯃꯤꯗꯇꯥꯎꯟ ꯑꯃꯥ ꯌꯥꯑꯣꯕꯥ ꯅꯨꯡꯉꯥꯏꯔꯕꯥ ꯀꯣꯇꯦꯖ ꯑꯃꯥ ꯍꯦꯟꯅꯥ ꯄꯥꯝꯃꯤ
Manhattan or a huge Kentucky farm where youre breeding Arabian,ꯃꯦꯅꯍꯥꯇꯟ ꯅꯠꯠꯔꯒꯥ ꯑꯆꯧꯕꯥ ꯀꯦꯟꯇꯨꯀꯤ ꯐꯥꯔꯝ ꯑꯃꯥ ꯅꯍꯥꯛꯅꯥ ꯕ꯭ꯔꯤꯗꯤꯡ ꯇꯧꯔꯤꯕꯥ ꯑꯔꯕꯤꯌꯥꯟ
horses? Youve had enough of jobs that didnt satisfy or please you Now let,ꯍꯨꯏꯁꯤꯡ?
yourself go Go to that secret corner of your brain where you are a,ꯅꯍꯥꯛꯀꯤ ꯕ꯭ꯔꯦꯅꯒꯤ ꯑꯗꯨꯒꯨꯝꯕꯥ ꯒꯣꯄꯟ ꯀꯣꯟꯅꯥ ꯆꯠꯂꯨ ꯅꯍꯥꯛꯅꯥ ꯂꯩꯔꯤꯕꯥ ꯃꯐꯝ ꯑꯗꯨꯗꯥ ꯆꯠꯂꯨ .
femmefatale starquarterback mom or the rainforestsaving gardener of,ꯐꯦꯃꯃꯦꯐꯦꯇꯥꯜ ꯁ꯭ꯇꯥꯔꯛꯕꯥꯇꯔꯕꯦꯛ ꯃꯝ ꯅꯠꯔꯒꯥ ꯔꯦꯅꯐꯣꯔꯔꯦꯁ꯭ꯇꯁꯦꯚꯤꯡ ꯒꯥꯔꯗꯦꯅꯔ ꯑꯣꯐ
the planet,ꯒ꯭ꯔꯍ ꯑꯁꯤ .
And dont forget to say who would be with you Remember this is a,ꯑꯃꯁꯨꯡ ꯑꯗꯣꯃꯒꯥ ꯂꯣꯌꯅꯅꯥ ꯀꯅꯥꯒꯥ ꯂꯣꯌꯅꯅꯥ ꯂꯩꯃꯤꯟꯅꯒꯅꯤ ꯍꯥꯌꯕꯥ ꯀꯥꯑꯣꯔꯣꯏꯗꯕꯅꯤ ꯃꯁꯤꯅꯤ ꯃꯁꯤ ꯑꯃꯥ .
job so you need to imagine all the people youd love to be working with,ꯊꯕꯛ ꯑꯗꯨꯅꯥ ꯑꯗꯣꯝꯅꯥ ꯌꯨ.ꯌꯨ.ꯗꯤ.
your boss coworker employee business partner or right hand,ꯅꯍꯥꯛꯀꯤ ꯕꯁ ꯀꯣꯑꯣꯔꯀꯔ ꯏꯃꯞꯂꯣꯌꯤ ꯕꯤꯖꯅꯦꯁ ꯄꯥꯔꯇꯅꯔ ꯅꯠꯠꯔꯒꯥ ꯔꯥꯏꯠ ꯍꯦꯟꯗ
helperor competitor for that matter Would you like to have a team of,ꯋꯥꯐꯝ ꯑꯗꯨꯒꯤꯗꯃꯛ ꯍꯦꯜꯄꯦꯔ ꯀꯝꯄꯤꯇꯤꯇꯔꯅꯥ ꯑꯗꯣꯝꯅꯥ ꯇꯤꯝ ꯑꯃꯥ ꯂꯩꯕꯥ ꯄꯥꯝꯕꯤꯕꯔꯥ
assistants who carry out every wish perfectly and pick up after you,ꯋꯥꯁꯛ ꯈꯨꯗꯤꯡꯃꯛ ꯃꯄꯨꯡ ꯐꯥꯅꯥ ꯄꯥꯡꯊꯣꯛꯂꯤꯕꯥ ꯑꯃꯁꯨꯡ ꯑꯗꯣꯃꯒꯤ ꯃꯇꯨꯡꯗꯥ ꯂꯧꯈꯠꯂꯤꯕꯥ ꯑꯦꯁꯤꯁ꯭ꯇꯦꯟꯇꯁꯤꯡꯅꯥ .
without a complaint? Or a genius coach or mentor who wouldnt let you,ꯀꯃꯞꯂꯦꯟꯇ ꯑꯃꯥ ꯌꯥꯑꯣꯗꯅꯥ?
rest until youd given your very best? Or the best smartest funniest,ꯅꯍꯥꯛꯀꯤ ꯈ꯭ꯕꯥꯏꯗꯒꯤ ꯐꯕꯥ ꯑꯗꯨ ꯅꯍꯥꯛꯅꯥ ꯄꯤꯕꯥ ꯐꯥꯎꯕꯥ ꯂꯦꯡꯗꯅꯥ ꯂꯩꯌꯨ?
most cooperative teammates imaginable to work with you on a project? This exercise usually causes an explosion of enthusiasm when I assign,ꯄ꯭ꯔꯣꯖꯦꯛꯇ ꯑꯃꯗꯥ ꯑꯗꯣꯃꯒꯥ ꯂꯣꯌꯅꯅꯥ ꯊꯕꯛ ꯇꯧꯃꯤꯟꯅꯅꯕꯥ ꯈꯅꯒꯗꯕꯥ ꯑꯌꯥꯝꯕꯥ ꯀꯣꯑꯣꯄꯔꯦꯇꯤꯕ ꯇꯤꯃꯒꯤ ꯃꯔꯨꯄꯁꯤꯡ?
it in my workshops So much of our time is spent at work and so little of,ꯃꯁꯤ ꯑꯩꯒꯤ ꯋꯥꯔꯀꯁꯣꯄꯁꯤꯡꯗꯥ ꯑꯩꯈꯣꯌꯒꯤ ꯃꯇꯝ ꯀꯌꯥ ꯑꯃꯥ ꯊꯕꯛꯇꯥ ꯂꯣꯏꯔꯦ ꯑꯃꯁꯨꯡ ꯑꯁꯨꯛ ꯌꯥꯝꯅꯥ ꯅꯦꯝꯃꯤ .
that time seems gratifying Most groups I work with spill over with,ꯃꯇꯝ ꯑꯗꯨꯅꯥ ꯑꯩꯍꯥꯛꯅꯥ ꯁ꯭ꯄꯤꯜ ꯑꯣꯚꯔꯒꯥ ꯂꯣꯌꯅꯅꯥ ꯊꯕꯛ ꯇꯧꯔꯤꯕꯥ ꯑꯌꯥꯝꯕꯥ ꯀꯥꯡꯂꯨꯄꯁꯤꯡ ꯑꯗꯨ ꯒ꯭ꯔꯦꯇꯤꯐꯥꯏ ꯇꯧꯕꯥ ꯎꯕꯥ ꯐꯪꯏ꯫
Thank God Its Fridaytype relief when they get to do this exercise,ꯃꯈꯣꯌꯅꯥ ꯑꯦꯛꯁꯔꯁꯥꯏꯖ ꯑꯁꯤ ꯇꯧꯕꯥ ꯃꯇꯃꯗꯥ ꯏꯁ꯭ꯕꯔꯕꯨ ꯊꯥꯒꯠꯆꯔꯤ ꯃꯁꯤꯒꯤ ꯐ꯭ꯔꯥꯏꯗꯦꯇꯥꯏꯞ ꯔꯤꯂꯤꯐ
I always get a kick out of their responses and I think you will too,ꯑꯩꯍꯥꯛꯅꯥ ꯃꯇꯝ ꯄꯨꯝꯅꯃꯛꯇꯥ ꯃꯈꯣꯌꯒꯤ ꯄꯥꯎꯈꯨꯃꯁꯤꯡꯗꯒꯤ ꯀꯤꯛ ꯑꯃꯥ ꯐꯪꯏ ꯑꯃꯁꯨꯡ ꯑꯩꯍꯥꯛꯅꯥ ꯈꯜꯂꯤ ꯅꯈꯣꯌꯁꯨ .
Adrienne fortyfour a lawyer for a corporation I want cameras and,ꯑꯦꯗ꯭ꯔꯤꯟ ꯐꯣꯔꯇꯤꯐꯣꯔ ꯑꯃꯥ ꯀꯣꯔꯄꯣꯔꯦꯁꯟ ꯑꯃꯒꯤꯗꯃꯛ ꯎꯀꯤꯜ ꯑꯃꯥ ꯑꯩꯅꯥ ꯀꯦꯃꯦꯔꯥ ꯑꯃꯁꯨꯡ .
a firstrate crew and lots of money at my beck and call and Id,ꯑꯩꯒꯤ ꯕꯦꯛ ꯑꯃꯁꯨꯡ ꯀꯣꯜ ꯑꯃꯁꯨꯡ ꯑꯥꯏ.ꯗꯤ.ꯗꯥ ꯑꯍꯥꯅꯕꯥ ꯀ꯭ꯔꯨ ꯑꯃꯁꯨꯡ ꯁꯦꯜ ꯌꯥꯝꯅꯥ ꯂꯩꯕꯥ
document everything up and down the entire length of the Amazon,ꯑꯦꯃꯥꯖꯣꯅꯒꯤ ꯂꯝꯕꯤ ꯄꯨꯝꯅꯃꯛ ꯃꯊꯛꯇꯥ ꯑꯃꯁꯨꯡ ꯃꯈꯥꯗꯥ ꯗꯣꯀꯨꯃꯦꯟꯇ ꯇꯧꯕꯥ
Riverand then move up to the highlands of Peru! Bernice twentynine years old and a freelance writer said I just,ꯃꯗꯨꯒꯤ ꯃꯇꯨꯡꯗꯥ ꯔꯤꯚꯔꯟꯗꯅꯥ ꯄꯦꯔꯨꯒꯤ ꯍꯥꯏꯂꯦꯟꯗꯁꯤꯡꯗꯥ ꯆꯠꯂꯨ!
want to show up at some big downtown office every morning with a,ꯑꯌꯨꯛ ꯈꯨꯗꯤꯡꯒꯤ ꯑꯆꯧꯕꯥ ꯗꯥꯎꯅꯇꯥꯎꯟ ꯑꯣꯐꯤꯁ ꯈꯔꯗꯥ ꯎꯠꯄꯥ ꯄꯥꯝꯃꯤ
desk and secretary and a computer and modem and telephones and,ꯗꯦꯁ꯭ꯛ ꯑꯃꯁꯨꯡ ꯁꯦꯛꯔꯦꯇꯔꯤ ꯑꯃꯁꯨꯡ ꯀꯝꯞꯌꯨꯇꯔ ꯑꯃꯗꯤ ꯃꯣꯗꯦꯝ ꯑꯃꯁꯨꯡ ꯇꯦꯂꯤꯐꯣꯟ ꯑꯃꯁꯨꯡ
stamps and copy machines and faxes and lots of people around all doing,ꯁ꯭ꯇꯥꯝꯄ ꯑꯃꯁꯨꯡ ꯀꯣꯄꯤ ꯃꯦꯁꯤꯅꯁꯤꯡ ꯑꯃꯁꯨꯡ ꯐꯦꯛꯁꯁꯤꯡ ꯑꯃꯁꯨꯡ ꯑꯀꯣꯌꯕꯗꯥ ꯂꯩꯔꯤꯕꯥ ꯃꯤꯑꯣꯏ ꯀꯌꯥ ꯑꯃꯅꯥ ꯇꯧꯔꯤꯕꯥ ꯄꯨꯝꯅꯃꯛ
their work and I want to do only my own fiction writing there But I want,ꯃꯈꯣꯌꯒꯤ ꯊꯕꯛ ꯑꯃꯁꯨꯡ ꯑꯩꯍꯥꯛꯅꯥ ꯃꯐꯝ ꯑꯗꯨꯗꯥ ꯑꯩꯍꯥꯛꯀꯤ ꯏꯁꯥꯒꯤ ꯐꯤꯛꯁꯟ ꯏꯕꯥ ꯈꯛꯇꯃꯛ ꯇꯧꯕꯥ ꯄꯥꯝꯃꯤ ꯑꯗꯨꯕꯨ ꯑꯩꯍꯥꯛꯅꯥ ꯄꯥꯝꯃꯤ
Philip twentyseven a legal proofreader I want my own caf on a,ꯐꯤꯂꯤꯞ ꯇꯔꯥꯅꯤꯄꯥꯜ ꯂꯤꯒꯦꯜ ꯄ꯭ꯔꯨꯐꯔꯤꯗꯔ ꯑꯃꯥ ꯑꯩꯅꯥ ꯑꯩꯒꯤ ꯏꯁꯥꯒꯤ ꯁꯤ.ꯑꯦ.ꯑꯦꯐ.
company came up with this Im the head of a unit in my company,ꯀꯝꯄꯦꯅꯤ ꯑꯁꯤ ꯑꯩꯒꯤ ꯀꯝꯄꯦꯅꯤꯗꯥ ꯂꯩꯕꯥ ꯌꯨꯅꯤꯠ ꯑꯃꯒꯤ ꯃꯀꯣꯛ ꯑꯣꯏꯅꯥ ꯂꯥꯀꯈꯤꯕꯅꯤ꯫
and I have a crackerjack team working with me Everyone from the file,ꯑꯃꯁꯨꯡ ꯑꯩꯒꯤ ꯐꯥꯏꯂꯗꯒꯤ ꯃꯤꯄꯨꯝ ꯈꯨꯗꯤꯡꯃꯛ ꯑꯩꯒꯥ ꯂꯣꯌꯅꯅꯥ ꯊꯕꯛ ꯇꯧꯃꯤꯟꯅꯔꯤꯕꯥ ꯀ꯭ꯔꯦꯀꯔꯖꯦꯛ ꯇꯤꯝ ꯑꯃꯥ ꯂꯩꯔꯤ .
