en,mni-Mtei
The Temples facade faces south and its ground plan is square covering an area of 10m2,ꯇꯦꯝꯄꯂꯁꯤꯡꯒꯤ ꯐꯦꯁ ꯑꯁꯤ ꯈꯥ ꯊꯪꯕꯥ ꯃꯥꯏꯀꯩꯗꯥ ꯌꯦꯡꯏ ꯑꯃꯁꯨꯡ ꯃꯁꯤꯒꯤ ꯒ꯭ꯔꯥꯎꯟꯗ ꯄ꯭ꯂꯥꯟ ꯑꯁꯤ 10m2ꯒꯤ ꯃꯐꯝ ꯑꯃꯥ ꯀꯣꯅꯁꯤꯜꯂꯤ꯫
On the 15th of December 2015 in Imphal a fortnightly magazine named Nongsaba was launched under the motto Journalism for change,꯲꯰꯱꯵ꯒꯤ ꯗꯤꯁꯦꯝꯕꯔ ꯱꯵ꯗꯥ ꯏꯝꯐꯥꯂꯗꯥ ꯅꯨꯃꯤꯠ ꯑꯅꯤꯒꯤ ꯑꯣꯏꯕꯥ ꯃꯦꯒꯥꯖꯤꯟ ꯑꯃꯥ ꯅꯣꯡꯁꯥꯕꯥ ꯀꯧꯕꯥ ꯃꯣꯇꯣ ꯖꯔꯅꯦꯂꯤꯖꯝ ꯐꯣꯔ ꯆꯦꯟꯖꯒꯤ ꯃꯈꯥꯗꯥ ꯍꯧꯗꯣꯀꯈꯤ
The publication focuses on the sociopolitical economy education unemployment art and culture science sports beauty health entertainment etc,ꯄꯕ꯭ꯂꯤꯀꯦꯁꯟ ꯑꯁꯤꯅꯥ ꯁꯣꯁꯤꯑꯣ-ꯄꯣꯂꯤꯇꯤꯀꯦꯜ ꯏꯀꯣꯅꯣꯃꯤ ꯑꯦꯖꯨꯀꯦꯁꯟ ꯑꯅꯏꯃꯞꯂꯣꯏꯃꯦꯟꯇ ꯑꯥꯔꯠ ꯑꯃꯁꯨꯡ ꯀꯂꯆꯔ ꯁꯥꯏꯟꯁ ꯁ꯭ꯄꯣꯔꯇꯁ ꯕꯤꯎꯇꯤ ꯍꯦꯜꯊ ꯑꯦꯟꯇꯔꯇꯦꯅꯃꯦꯟꯇ ꯑꯁꯤꯅꯆꯤꯡꯕꯗꯥ ꯃꯤꯠꯌꯦꯡ ꯊꯝꯂꯤ꯫
The ancient legend of Khamba and Thoibi Meitei Khamba Thoibi is a classic as well as one of the epic cycles of incarnations of Meitei mythology and folklore that is originated from Ancient Moirang kingdom of Ancient Kangleipak early Manipur,ꯈꯥꯝꯕꯥ ꯑꯃꯁꯨꯡ ꯊꯣꯏꯕꯤ ꯃꯦꯏꯇꯦꯏ ꯈꯝꯕꯥ ꯊꯣꯏꯕꯤꯒꯤ ꯑꯔꯤꯕꯥ ꯋꯥꯔꯤ ꯑꯁꯤ ꯀ꯭ꯂꯥꯁꯤꯛ ꯑꯃꯅꯤ ꯑꯃꯁꯨꯡ ꯃꯁꯤꯒꯥ ꯂꯣꯌꯅꯅꯥ ꯑꯔꯤꯕꯥ ꯀꯥꯡꯂꯦꯏꯄꯥꯛ ꯑꯍꯥꯅꯕꯥ ꯃꯅꯤꯄꯨꯔꯒꯤ ꯑꯔꯤꯕꯥ ꯃꯣꯏꯔꯥꯡ ꯀꯤꯡꯗꯃꯗꯒꯤ ꯍꯧꯔꯀꯄꯥ ꯃꯦꯏꯇꯦ ꯃꯥꯏꯊꯣꯂꯣꯖꯤ ꯑꯃꯁꯨꯡ ꯐꯣꯜꯀꯂꯣꯔꯒꯤ ꯏꯄꯤꯛ ꯁꯥꯏꯀꯂꯁꯤꯡꯒꯤ ꯃꯅꯨꯡꯗꯥ ꯑꯃꯅꯤ꯫
It is referred to as the national romantic legend of Manipur by Indian scholar Suniti Kumar Chatterjee,ꯃꯁꯤꯕꯨ ꯚꯥꯔꯇꯀꯤ ꯁ꯭ꯀꯣꯂꯥꯔ ꯁꯨꯅꯤꯇꯤ ꯀꯨꯃꯥꯔ ꯆꯇꯔꯖꯤꯅꯥ ꯁꯦꯝꯕꯥ ꯅꯦꯁ꯭ꯅꯦꯜ ꯔꯣꯃꯥꯟꯇꯤꯛ ꯂꯤꯖꯦꯟꯗ ꯑꯣꯐ ꯃꯅꯤꯄꯨꯔ ꯍꯥꯌꯅꯥ ꯀꯧꯏ꯫
Among the countless retelling editions of the epic story is Khamba Thoibi Sheireng Meitei ꯈꯝꯕ ꯊꯏꯕ ꯁꯔꯡ an eightvolume 39000line epic poem composed by Hijam Angangha and published in 1940,ꯏꯄꯤꯛ ꯋꯥꯔꯤꯒꯤ ꯃꯁꯤꯡ ꯊꯤꯉꯃꯗ꯭ꯔꯕꯥ ꯔꯤꯇꯦꯂꯤꯡ ꯑꯦꯗꯤꯁꯅꯁꯤꯡꯒꯤ ꯃꯅꯨꯡꯗꯥ ꯈꯕꯥ ꯊꯣꯏꯕꯤ ꯁꯦꯏꯔꯦꯡ ꯃꯦꯏꯇꯦꯏ ̊ ꯍꯤꯖꯥꯝ ꯑꯉ꯭ꯀꯥꯅꯥ ꯁꯦꯝꯕꯥ ꯑꯃꯁꯨꯡ ꯱꯹꯴꯰ꯗꯥ ꯐꯣꯡꯈꯤꯕꯥ ꯸ꯚꯣꯜꯌꯨꯝ ꯳꯹꯰꯰꯰ꯂꯥꯏꯟ ꯏꯄꯤꯛ ꯁꯩꯔꯦꯡ ꯑꯃꯥ꯫
It was written in Pena Saisak folk ballad style and has been called the national epic of Manipur,ꯃꯁꯤ ꯄꯦꯅꯥ ꯁꯩꯁꯥꯛ ꯐꯣꯛ ꯕꯦꯜꯂꯦꯗ ꯁ꯭ꯇꯥꯏꯂꯗꯥ ꯏꯈꯤꯕꯅꯤ ꯑꯃꯁꯨꯡ ꯃꯁꯤꯕꯨ ꯃꯅꯤꯄꯨꯔꯒꯤ ꯅꯦꯁ꯭ꯅꯦꯜ ꯏꯄꯤꯛ ꯍꯥꯌꯅꯥ ꯀꯧꯅꯈ꯭ꯔꯦ
The classic tale of Khamba and Thoibi became an Assamese classic as well after being translated into Assamese language as Khamba Thoibir Sadhukatha by Assamese author and anthropologist Rajanikanta Bordoloi 18691939,ꯈꯕꯥ ꯑꯃꯁꯨꯡ ꯊꯣꯏꯕꯤꯒꯤ ꯀ꯭ꯂꯥꯁꯤꯛ ꯇꯦꯜ ꯑꯁꯤ ꯑꯁꯥꯃꯒꯤ ꯑꯏꯕꯥ ꯑꯃꯁꯨꯡ ꯑꯦꯟꯊ꯭ꯔꯣꯄꯣꯂꯣꯖꯤꯁ꯭ꯠ ꯔꯥꯖꯥꯅꯤꯀꯥꯟꯇꯥ ꯕꯣꯔꯗꯂꯣꯏꯅꯥ 18691939ꯅꯥ ꯈꯕꯥ ꯊꯣꯏꯕꯤꯔ ꯁꯙꯨꯀꯥꯊꯥ ꯍꯥꯌꯅꯥ ꯑꯁꯥꯃꯒꯤ ꯂꯣꯟꯗꯥ ꯍꯟꯗꯣꯀꯄꯒꯤ ꯃꯇꯨꯡꯗꯥ ꯑꯁꯥꯃꯒꯤ ꯀ꯭ꯂꯥꯁꯤꯛ ꯑꯃꯥ ꯑꯣꯏꯔꯀꯈꯤ꯫
According to legend Keke Moirang was created by the God Thangching,ꯂꯤꯖꯦꯟꯗꯔꯒꯤ ꯃꯇꯨꯡ ꯏꯟꯅꯥ ꯀꯦꯀꯦ ꯃꯣꯏꯔꯥꯡ ꯑꯁꯤ ꯏꯁ꯭ꯕꯔꯅꯥ ꯁꯦꯝꯕꯤꯕꯥ ꯃꯄꯨꯅꯥ ꯁꯦꯃꯈꯤꯕꯅꯤ꯫
The first King of Moirang was Iwang Fang Fang Ponglenhanba who was born of Moirang Leima Nangban Chanu Meirapanjenlei,ꯃꯣꯏꯔꯥꯡꯒꯤ ꯑꯍꯥꯅꯕꯥ ꯅꯤꯡꯊꯧ ꯑꯁꯤ ꯃꯣꯏꯔꯥꯡ ꯂꯦꯏꯃꯥ ꯅꯥꯡꯕꯟ ꯆꯅꯨ ꯃꯦꯏꯔꯥꯄꯥꯟꯖꯦꯅꯂꯦꯏꯗꯒꯤ ꯄꯣꯀꯈꯤꯕꯥ ꯏꯋꯥꯡ ꯐꯥꯡ ꯄꯣꯡꯂꯦꯅꯍꯥꯅꯕꯅꯤ꯫
He attacked tribal villages brought Thanga under his rule and fixed his boundaries to the north where the Luwang King bore sway,ꯃꯍꯥꯛꯅꯥ ꯇ꯭ꯔꯥꯏꯕꯦꯜ ꯈꯨꯉ꯭ꯒꯪꯁꯤꯡꯗꯥ ꯂꯥꯟꯗꯥꯗꯨꯅꯥ ꯃꯍꯥꯛꯀꯤ ꯂꯩꯉꯥꯛꯀꯤ ꯃꯈꯥꯗꯥ ꯊꯥꯉ꯭ꯒꯥꯕꯨ ꯄꯨꯔꯀꯈꯤ ꯑꯃꯁꯨꯡ ꯃꯍꯥꯛꯀꯤ ꯉꯃꯈꯩꯁꯤꯡ ꯑꯗꯨ ꯂꯨꯋꯥꯡ ꯀꯤꯡ ꯕꯣꯔ ꯁ꯭ꯕꯦꯗꯥ ꯂꯩꯕꯥ ꯅꯣꯡꯄꯣꯛ ꯊꯪꯕꯥ ꯁꯔꯨꯛꯇꯥ ꯐꯤꯛꯁ ꯇꯧꯈꯤ
He brought in captives and buried the heads of his fallen enemies in the Kangla or Royal enclosure,ꯃꯍꯥꯛꯅꯥ ꯂꯥꯟꯃꯤꯒꯤ ꯂꯥꯟꯃꯤꯁꯤꯡ ꯄꯨꯔꯀꯈꯤ ꯑꯃꯁꯨꯡ ꯃꯍꯥꯛꯀꯤ ꯊꯣꯡ ꯂꯣꯜꯂꯕꯥ ꯌꯦꯛꯅꯕꯁꯤꯡꯒꯤ ꯃꯀꯣꯀꯁꯤꯡ ꯑꯗꯨ ꯀꯪꯒ꯭ꯂꯥ ꯅꯠꯔꯒꯥ ꯔꯥꯖ꯭ꯌꯒꯤ ꯑꯦꯅꯛꯂꯣꯖꯔꯗꯥ ꯊꯃꯈꯤ꯫
After some time the God Thangching began to think that the King and his subjects were so prosperous that they were likely to forget their duties to him and on the advice of seven gods the Yakhong Lai he decided to frighten the King and his people,ꯃꯇꯝ ꯈꯔꯒꯤ ꯃꯇꯨꯡꯗꯥ ꯏꯁ꯭ꯕꯔꯅꯥ ꯊꯥꯡꯆꯤꯡꯗꯨꯅꯥ ꯅꯤꯡꯊꯧ ꯑꯃꯁꯨꯡ ꯃꯍꯥꯛꯀꯤ ꯄ꯭ꯔꯖꯥꯁꯤꯡꯅꯥ ꯑꯁꯨꯛ ꯌꯥꯝꯅꯥ ꯅꯨꯡꯉꯥꯏꯈꯤ ꯍꯥꯌꯅꯥ ꯈꯅꯕꯥ ꯍꯧꯈꯤ ꯃꯗꯨꯗꯤ ꯃꯈꯣꯌꯅꯥ ꯃꯍꯥꯛꯀꯤ ꯊꯧꯗꯥꯡꯁꯤꯡ ꯑꯗꯨ ꯀꯥꯑꯣꯊꯣꯀꯄꯥ ꯉꯃꯒꯅꯤ ꯑꯃꯁꯨꯡ ꯏꯁ꯭ꯕꯔ ꯷ꯀꯤ ꯄꯥꯎꯇꯥꯛ ꯃꯇꯨꯡ ꯏꯟꯅꯥ ꯌꯥꯈꯪ ꯂꯥꯏ ꯍꯥꯌꯅꯥ ꯃꯍꯥꯛꯅꯥ ꯅꯤꯡꯊꯧ ꯑꯃꯁꯨꯡ ꯃꯍꯥꯛꯀꯤ ꯃꯤꯌꯥꯃꯕꯨ ꯂꯥꯟꯅꯥ ꯂꯃꯖꯤꯡꯅꯕꯥ ꯋꯥꯔꯦꯞ ꯂꯧꯈꯤ꯫
One night there were mysterious sounds heard,ꯅꯨꯃꯤꯠ ꯑꯃꯗꯥ ꯑꯉꯀꯄꯥ ꯈꯣꯟꯖꯦꯂꯁꯤꯡ ꯇꯥꯕꯥ ꯐꯪꯈꯤ
At first the Kings soldiers found nothing but when the sounds were heard again they discovered that the Yakhong Lai had raised a storm that had destroyed the Khuyal Leikhong,ꯑꯍꯥꯅꯕꯗꯥ ꯅꯤꯡꯊꯧꯁꯤꯡꯒꯤ ꯂꯥꯟꯃꯤꯁꯤꯡꯅꯥ ꯀꯔꯤꯁꯨ ꯐꯪꯈꯤꯗꯦ ꯑꯗꯨꯕꯨ ꯈꯣꯟꯖꯦꯂꯁꯤꯡ ꯑꯗꯨ ꯑꯃꯨꯛ ꯍꯟꯅꯥ ꯇꯥꯕꯥ ꯃꯇꯃꯗꯥ ꯃꯈꯣꯌꯅꯥ ꯈꯉꯂꯀꯈꯤ ꯃꯗꯨꯗꯤ ꯌꯥꯈꯟ ꯂꯥꯏꯅꯥ ꯈꯨꯜꯌ ꯂꯦꯏꯈꯣꯡꯕꯨ ꯃꯥꯡꯍꯟ ꯇꯥꯀꯍꯅꯈꯤꯕꯥ ꯅꯣꯡꯂꯩ ꯅꯨꯡꯁꯤꯠ ꯑꯃꯥ ꯄꯨꯊꯣꯀꯈꯤ꯫
The Kings advisors asked him to summon the famous maibi Santhong Mari Mai Langjeng Langmei Thouba,ꯅꯤꯡꯊꯧꯁꯤꯡꯒꯤ ꯑꯦꯗꯚꯥꯏꯖꯔꯁꯤꯡꯅꯥ ꯃꯍꯥꯀꯄꯨ ꯃꯃꯤꯡ ꯂꯩꯔꯕꯥ ꯃꯥꯏꯕꯤ ꯁꯥꯟꯊꯣꯡ ꯃꯥꯔꯤ ꯃꯥꯏ ꯂ꯭ꯌꯥꯡꯖꯦꯡ ꯂꯪꯃꯦꯏ ꯊꯣꯎꯕꯥ ꯀꯧꯅꯕꯥ ꯍꯥꯌꯖꯈꯤ
She was working in the fields but came running,ꯃꯍꯥꯛ ꯂꯧꯕꯨꯛꯇꯥ ꯊꯕꯛ ꯇꯧꯔꯝꯃꯤ ꯑꯗꯨꯕꯨ ꯂꯥꯟꯊꯦꯡꯅꯈꯤ
The King demanded that she restore the Khuyal Leikhong and threatened to kill her if she failed,ꯅꯤꯡꯊꯧꯅꯥ ꯃꯍꯥꯀꯄꯨ ꯈꯨꯌꯥꯜ ꯂꯦꯏꯈꯣꯡ ꯑꯃꯨꯛ ꯍꯟꯅꯥ ꯄꯨꯔꯛꯅꯕꯥ ꯍꯥꯌꯖꯈꯤ ꯑꯃꯁꯨꯡ ꯀꯔꯤꯒꯨꯝꯕꯥ ꯃꯍꯥꯛꯅꯥ ꯃꯥꯌ ꯄꯥꯛꯠꯔꯕꯗꯤ ꯃꯍꯥꯀꯄꯨ ꯍꯥꯠꯅꯕꯥ ꯆꯩꯔꯥꯛ ꯄꯤꯈꯤ
The maibi persuaded the seven gods to teach her a hymn that would restore the Khuyal Leikhong and they ordered her to convey a message to the King,ꯃꯥꯏꯕꯤꯅꯥ ꯏꯁ꯭ꯕꯔ ꯷ꯇꯥ ꯃꯍꯥꯀꯄꯨ ꯈꯨꯜ ꯂꯦꯏꯈꯣꯡ ꯑꯃꯨꯛ ꯍꯟꯅꯥ ꯄꯨꯔꯛꯀꯗꯕꯥ ꯂꯥꯏꯁꯣꯜ ꯑꯃꯥ ꯇꯝꯕꯤꯅꯕꯥ ꯌꯥꯊꯪ ꯄꯤꯈꯤ ꯑꯃꯁꯨꯡ ꯃꯈꯣꯌꯅꯥ ꯃꯍꯥꯀꯄꯨ ꯅꯤꯡꯊꯧꯗꯥ ꯄꯥꯎꯖꯦꯜ ꯑꯃꯥ ꯄꯤꯅꯕꯥ ꯌꯥꯊꯪ ꯄꯤꯈꯤ
When she went to the Khuyal Leikhong she met the god Pakhangba,ꯃꯍꯥꯛꯅꯥ ꯈꯨꯌꯥꯜ ꯂꯦꯏꯈꯣꯡꯗꯥ ꯆꯠꯄꯥ ꯃꯇꯃꯗꯥ ꯃꯍꯥꯛꯅꯥ ꯏꯁ꯭ꯕꯔ ꯄꯈꯥꯡꯕꯥꯒꯥ ꯎꯅꯈꯤ
She raised the edifice by singing the hymn and delivered message to the King which directed that all the maibas and maibis of the country  should sleep in the temple of Thangching wearing their sacred clothes which they did,ꯃꯍꯥꯛꯅꯥ ꯂꯥꯏꯁꯣꯜ ꯏꯁꯩ ꯁꯀꯇꯨꯅꯥ ꯏꯗꯤꯐꯤꯁ ꯑꯁꯤ ꯋꯥꯡꯈꯠꯍꯅꯈꯤ ꯑꯃꯁꯨꯡ ꯅꯤꯡꯊꯧꯗꯥ ꯄꯥꯎꯖꯦꯜ ꯄꯤꯈꯤ ꯃꯗꯨꯗꯤ ꯃꯈꯣꯌꯅꯥ ꯇꯧꯈꯤꯕꯥ ꯃꯈꯣꯌꯒꯤ ꯁꯦꯡꯂꯕꯥ ꯄꯣꯠꯂꯃꯁꯤꯡ ꯑꯗꯨ ꯊꯃꯗꯨꯅꯥ ꯂꯩꯕꯥꯛ ꯑꯁꯤꯒꯤ ꯃꯩꯕꯥ ꯑꯃꯁꯨꯡ ꯃꯩꯕꯥ ꯄꯨꯝꯅꯃꯛꯅꯥ ꯊꯥꯡꯆꯤꯡꯒꯤ ꯃꯟꯗꯤꯔꯗꯥ ꯇꯨꯝꯀꯗꯕꯅꯤ ꯍꯥꯌꯅꯥ ꯌꯥꯊꯪ ꯄꯤꯈꯤ꯫
There in their dreams they were instructed to divide the people into sections according to the duties they would perform,ꯃꯐꯝ ꯑꯗꯨꯗꯥ ꯃꯈꯣꯌꯒꯤ ꯃꯪꯂꯥꯅꯁꯤꯡꯗꯥ ꯃꯈꯣꯌꯅꯥ ꯄꯥꯡꯊꯣꯛꯀꯗꯕꯥ ꯊꯧꯗꯥꯡꯁꯤꯡꯒꯤ ꯃꯇꯨꯡ ꯏꯟꯅꯥ ꯃꯤꯌꯥꯃꯕꯨ ꯁꯦꯛꯁꯅꯁꯤꯡꯗꯥ ꯈꯥꯌꯗꯣꯛꯅꯕꯥ ꯌꯥꯊꯪ ꯄꯤꯈꯤ
Then the village offices were created and their order of precedence fixed,ꯑꯗꯨꯗꯒꯤ ꯈꯨꯉ꯭ꯒꯪꯒꯤ ꯑꯣꯐꯤꯁꯁꯤꯡ ꯁꯦꯃꯈꯤ ꯑꯃꯁꯨꯡ ꯃꯈꯣꯌꯒꯤ ꯑꯣꯔꯗꯔ ꯑꯣꯐ ꯄ꯭ꯔꯤꯁꯦꯗꯟꯁ ꯐꯤꯛꯁ ꯇꯧꯈꯤ .
The maibas chanted the name of the god and the maibis rang the bell,ꯃꯥꯏꯕꯥꯁꯅꯥ ꯏꯁ꯭ꯕꯔꯒꯤ ꯃꯃꯤꯡ ꯀꯧꯈꯤ ꯑꯃꯁꯨꯡ ꯃꯥꯏꯕꯤꯁꯤꯡꯅꯥ ꯕꯦꯜ ꯊꯥꯈꯤ
Then when they had told the King about their dreams they were bidden to do as the god had said,ꯑꯗꯨꯗꯒꯤ ꯃꯈꯣꯌꯅꯥ ꯅꯤꯡꯊꯧꯗꯥ ꯃꯈꯣꯌꯒꯤ ꯃꯪꯂꯥꯅꯁꯤꯡꯒꯤ ꯃꯔꯃꯗꯥ ꯍꯥꯌꯔꯀꯄꯥ ꯃꯇꯃꯗꯥ ꯃꯈꯣꯌꯅꯥ ꯏꯁ꯭ꯕꯔꯅꯥ ꯍꯥꯌꯈꯤꯕꯥ ꯑꯗꯨꯒꯨꯝꯅꯥ ꯇꯧꯅꯕꯥ ꯌꯥꯊꯪ ꯄꯤꯔꯀꯈꯤꯕꯥ ꯃꯇꯝ ꯑꯗꯨꯗꯥ
The King then died and was succeeded by his son Telheiba,ꯃꯗꯨꯒꯤ ꯃꯇꯨꯡꯗꯥ ꯅꯤꯡꯊꯧ ꯑꯗꯨ ꯁꯤꯈꯤ ꯑꯃꯁꯨꯡ ꯃꯍꯥꯛꯀꯤ ꯃꯇꯨꯡꯗꯥ ꯃꯍꯥꯛꯀꯤ ꯃꯆꯥꯅꯨꯄꯥ ꯇꯦꯂꯍꯦꯕꯥ
133  The Story of Khamba and Thoibi an 1877 English language prose version written by G,꯱꯳꯳ ꯈꯕꯥ ꯑꯃꯁꯨꯡ ꯊꯣꯏꯕꯤꯒꯤ ꯋꯥꯔꯤ ꯑꯁꯤ ꯖꯤꯅꯥ ꯏꯕꯥ ꯏꯪ ꯱꯸꯷꯷ ꯒꯤ ꯏꯪꯂꯤꯁ ꯂꯦꯉ꯭ꯒꯨꯌꯦꯖ ꯄ꯭ꯔꯣꯖ ꯚꯔꯖꯟ ꯑꯃꯅꯤ꯫
Damant published in The Indian Antiquary,ꯚꯥꯔꯇꯀꯤ ꯑꯦꯟꯇꯤꯛꯕꯦꯔꯤꯗꯥ ꯐꯣꯡꯈꯤꯕꯥ ꯗꯥꯃꯟꯇ
Khamba and Thoibi an English language prose version that appears in T,ꯈꯕꯥ ꯑꯃꯁꯨꯡ ꯊꯣꯏꯕꯤ ꯏꯪꯂꯤꯁ ꯂꯦꯉ꯭ꯒꯨꯌꯦꯖ ꯄ꯭ꯔꯣꯖ ꯚꯔꯖꯟ ꯑꯃꯅꯤ ꯃꯗꯨꯗꯥ ꯇꯤ.
C,ꯁꯤ .
Hodsns 1908 book The Meitheis,ꯍꯣꯗꯁꯅꯁ ꯱꯹꯰꯸ ꯂꯥꯏꯔꯤꯛ The MeiTheis
Khamba Thoibi Sheireng a 1940 Meitei language epic poem by Hijam Anganghal Khamba Thoibi and Poems on Manipur a 1963 English language poetry work by Vimala Raina,ꯈꯕꯥ ꯊꯣꯏꯕꯤ ꯁꯦꯏꯔꯪ ꯑꯦ ꯱꯹꯴꯰ ꯃꯦꯏꯇꯦꯏ ꯂꯦꯉ꯭ꯒꯨꯌꯦꯖ ꯏꯄꯤꯛ ꯁꯩꯔꯦꯡ ꯍꯤꯖꯥꯝ ꯑꯉ꯭ꯀꯥꯡꯍꯜ ꯈꯕꯥ ꯊꯣꯏꯕꯤ ꯑꯃꯁꯨꯡ ꯃꯅꯤꯄꯨꯔꯗꯥ ꯁꯩꯔꯦꯡ ꯑꯃꯥ ꯱꯹꯶꯳ꯒꯤ ꯏꯪꯂꯤꯁ ꯂꯣꯂꯒꯤ ꯁꯩꯔꯦꯡꯒꯤ ꯊꯕꯛ ꯚꯤꯃꯥꯂꯥ ꯔꯥꯏꯅꯥ
Khamba and Thoibi The Unscaled Height of Love a 1976 English language prose by N,ꯈꯕꯥ ꯑꯃꯁꯨꯡ ꯊꯣꯏꯕꯤ ꯗꯤ ꯑꯅꯁ꯭ꯀꯦꯜ ꯍꯥꯏꯠ ꯑꯣꯐ ꯂꯚ ꯑꯦ ꯱꯹꯷꯶ ꯑꯦ ꯱꯹꯷꯶ ꯏꯪꯂꯤꯁ ꯂꯦꯉ꯭ꯒꯨꯌꯦꯖ ꯄ꯭ꯔꯣꯖ ꯕꯥꯏ ꯑꯦꯟ
Tombi Singh Khamba Thoibigi Wari Amasung Mahakavya a Meiteilanguage prose version by Khwairakpam Chaoba,ꯇꯣꯝꯕꯤ ꯁꯤꯡꯍ ꯈꯕꯥ ꯊꯣꯏꯕꯤꯒꯤ ꯋꯥꯔꯤ ꯑꯃꯥ ꯑꯃꯁꯨꯡ ꯃꯍꯥꯀꯥꯕ꯭ꯌ ꯑꯦ ꯃꯦꯏꯇꯤꯂꯥꯉ꯭ꯒꯨꯌꯦꯖ ꯄ꯭ꯔꯣꯖ ꯚꯔꯖꯟ ꯑꯁꯤ khwairakpam Chaoba
being presented a memento of a painting depicting Khuman Khamba capturing the Bull by Dr. Shivinder Singh Sidhu the then Governor of Manipur and Okram Ibobi Singh the then Chief Minister of Manipur on the occasion of the foundation stone laying ceremony of three projects National Sports University Convention Center and,ꯄ꯭ꯔꯣꯖꯦꯛꯇ ꯑꯍꯨꯃꯒꯤ ꯐꯥꯎꯟꯗꯦꯁꯟ ꯁ꯭ꯇꯣꯟ ꯂꯦꯌꯤꯡ ꯁꯦꯔꯤꯃꯣꯅꯤꯒꯤ ꯊꯧꯔꯃꯗꯥ ꯃꯇꯝ ꯑꯗꯨꯒꯤ ꯃꯅꯤꯄꯨꯔꯒꯤ ꯒꯕꯔꯅꯔ ꯑꯃꯁꯨꯡ ꯑꯣꯀꯔꯥꯝ ꯏꯕꯣꯕꯤ ꯁꯤꯡꯍꯅꯥ ꯃꯇꯝ ꯑꯗꯨꯒꯤ ꯃꯅꯤꯄꯨꯔꯒꯤ ꯃꯨꯈ꯭ꯌ ꯃꯟꯠꯔꯤ ꯑꯣꯏꯔꯤꯕꯥ ꯑꯣꯀꯔꯥꯝ ꯏꯕꯣꯕꯤ ꯁꯤꯡꯍꯕꯨ ꯈꯣꯝꯃꯥꯟ ꯊꯕꯥꯕꯨ ꯀꯦꯄꯆꯔ ꯇꯧꯔꯤꯕꯥ ꯈꯣꯎꯃꯥꯟ ꯊꯕꯥ ꯑꯗꯨ ꯎꯠꯂꯤꯕꯥ ꯄꯦꯟꯇꯤꯡ ꯑꯃꯒꯤ ꯃꯦꯃꯦꯟꯇꯣ ꯑꯃꯥ ꯄꯤꯔꯀꯄꯥ
Manipur Institute of Technology 2 December 2006 Kao Faba Meitei ꯀꯎ ꯐꯕ is a 2020 Meitei language Shumang Kumhei based on the story of the capture of bull by Khuman Khamba produced by Western Cultural Association in Manipur,ꯃꯅꯤꯄꯨꯔ ꯏꯟꯁꯇꯤꯠꯌꯨꯠ ꯑꯣꯐ ꯇꯦꯛꯅꯣꯂꯣꯖꯤ ꯲ ꯗꯤꯁꯦꯝꯕꯔ ꯲꯰꯰꯶ ꯀꯥꯑꯣ ꯐꯥꯕꯥ ꯃꯦꯏꯇꯦꯏ 2020 ꯃꯅꯤꯄꯨꯔꯗꯥ ꯋꯦꯁ꯭ꯇꯔꯟ ꯀꯂꯆꯔꯦꯜ ꯑꯦꯁꯣꯁꯤꯑꯦꯁꯟꯅꯥ ꯄꯨꯊꯣꯀꯄꯥ ꯈꯣꯝꯌꯥꯟ ꯊꯕꯥ ꯕꯨꯜ ꯊꯥꯕꯒꯤ ꯋꯥꯔꯤꯗꯥ ꯌꯨꯝꯐꯝ ꯑꯣꯏꯕꯥ ꯲꯰꯲꯰ꯒꯤ ꯃꯦꯏꯇꯦꯏ ꯂꯣꯂꯒꯤ ꯁꯨꯃꯥꯡ ꯀꯨꯃꯍꯦꯏ
Kao the sacred bull is a 2011 Meitei opera produced by the Laihui Ensemble based on the story of the capture of the bull by Khuman Khamba,ꯀꯥꯑꯣ ꯗꯤ ꯁꯦꯛꯔꯦꯗ ꯕꯨꯜ ꯑꯁꯤ ꯈꯣꯝꯌꯥꯟ ꯈꯥꯝꯕꯥꯅꯥ ꯕꯨꯜ ꯀꯦꯄꯆꯔ ꯇꯧꯕꯒꯤ ꯋꯥꯔꯤꯗꯥ ꯌꯨꯝꯐꯝ ꯑꯣꯏꯕꯥ ꯂꯥꯏꯍꯨꯏ ꯑꯦꯅꯁꯦꯝꯕꯂꯅꯥ ꯄꯨꯊꯣꯀꯄꯥ ꯲꯰꯱꯱ꯒꯤ ꯃꯦꯏꯇꯦ ꯑꯣꯄꯦꯔꯥ ꯑꯃꯅꯤ꯫
Khambana Kao Phaba painting Meitei ꯈꯝꯕꯅ ꯀꯎ ꯐꯕ lit,"ꯈꯕꯥꯅꯥ ꯀꯥꯑꯣ ꯐꯥꯕꯥ ꯄꯦꯏꯟꯇꯤꯡ ꯃꯦꯏꯇꯦꯏ , ꯙ꯭ꯌꯥꯌ"
Khamba capturing the bull an oil painting by Manipuri artists M Betombi Singh and Gopal Sharma,ꯈꯕꯥꯅꯥ ꯃꯅꯤꯄꯨꯔꯤ ꯑꯥꯔꯇꯤꯁ꯭ꯇꯁꯤꯡꯒꯤ ꯑꯣꯏꯅꯥ ꯁꯟ-ꯏꯔꯣꯏ ꯑꯃꯥ ꯑꯣꯏꯜ ꯄꯦꯟꯇꯤꯡ ꯇꯧꯕꯥ ꯑꯦꯝ ꯕꯦꯇꯣꯝꯕꯤ ꯁꯤꯡꯍ ꯑꯃꯁꯨꯡ ꯒꯣꯄꯥꯜ ꯁꯔꯃꯥ
Khamba Khamnu Meitei ꯈꯝꯕ ꯈꯝꯅ is a 1995 Meitei language feature film produced by Chandam Shyamacharan for C.S.Films Imphal Productions written by Th. Nodia and directed by Ch. Shyamacharan,ꯈꯕꯥ ꯈꯍꯥꯅꯨ ꯃꯦꯏꯇꯦꯏ 1995 ꯒꯤ ꯃꯦꯏꯇꯦꯏ ꯂꯣꯂꯒꯤ ꯐꯤꯆꯔ ꯐꯤꯜꯃ ꯑꯃꯥ ꯑꯣꯏꯅꯥ ꯊ.
Khamba Thoibi Meitei ꯈꯝꯕ ꯊꯏꯕ is a 1997 Meitei language feature film based on the epic story by Hijam Anganghal produced by Moirangthem Nilamani Singh for Anjana Films and directed by M,ꯈꯕꯥ ꯊꯣꯏꯕꯤ ꯃꯦꯏꯇꯦꯏ 1997 ꯃꯦꯏꯇꯦꯏ ꯂꯣꯂꯒꯤ ꯐꯤꯆꯔ ꯐꯤꯜꯃ ꯑꯁꯤ ꯃꯣꯏꯔꯥꯡꯊꯝ ꯅꯤꯂꯥꯃꯥꯅꯤ ꯁꯤꯡꯍꯅꯥ ꯑꯟꯖꯥꯅꯥ ꯐꯤꯜꯃꯁꯤꯡꯒꯤꯗꯃꯛ ꯑꯃꯁꯨꯡ m ꯅꯥ ꯂꯃꯖꯤꯡꯗꯨꯅꯥ ꯄꯨꯊꯣꯀꯄꯥ ꯍꯤꯖꯥꯝ ꯑꯉ꯭ꯒꯥꯡꯍꯥꯂꯅꯥ ꯁꯦꯝꯕꯥ ꯏꯄꯤꯛ ꯋꯥꯔꯤꯗꯥ ꯌꯨꯝꯐꯝ ꯑꯣꯏꯕꯥ ꯱꯹꯹꯷ ꯒꯤ ꯃꯦꯏꯇꯦꯏꯒꯤ ꯐꯤꯆꯔ ꯐꯤꯜꯃ ꯑꯃꯅꯤ꯫
Nilamani Singh,ꯅꯤꯂꯥꯃꯅꯤ ꯁꯤꯡꯍ
Langon Meitei ꯂꯡꯉꯟ is a Meitei language feature film based on the epic of Khamba and Thoibi,ꯂꯪꯒꯣꯟ ꯃꯦꯏꯇꯦꯏ ꯈꯦꯏꯇꯦꯏ ꯈ꯭ꯔ꯭ꯏꯁ꯭ꯠ ꯑꯃꯁꯨꯡ ꯊꯣꯏꯕꯤꯒꯤ ꯏꯄꯤꯀꯇꯥ ꯌꯨꯝꯐꯝ ꯑꯣꯏꯕꯥ ꯃꯦꯏꯇꯦꯏ ꯂꯦꯉ꯭ꯒꯨꯌꯦꯖ ꯐꯤꯆꯔ ꯐꯤꯜꯃ ꯑꯃꯅꯤ꯫
Moirang Sai Meitei ꯃꯏꯔꯡ ꯁꯏ is a traditional form Meitei performance that tellss the story of Khamba and Thoibi in song and dance,Moirang Sai Meitei ꯈꯦꯏꯇꯤ ꯈꯦꯏꯇꯦꯏꯅꯥ ꯏꯁꯩ ꯑꯃꯁꯨꯡ ꯅꯥꯠꯀꯤ ꯋꯥꯔꯤ ꯂꯤꯕꯥ ꯇ꯭ꯔꯦꯗꯤꯁꯅꯦꯜ ꯐꯔꯝ ꯃꯦꯏꯇꯦꯏ ꯄꯔꯐꯣꯃꯦꯟꯁ ꯑꯃꯅꯤ꯫
Festival of Moirang Shai Meitei ꯃꯏꯔꯡ ꯁꯏ ꯀꯝꯍ is a cultural event that aims to popularize the unique culture of the Meitei people at grassroots level particularly in preserving and promoting Moirang Sai,"ꯃꯣꯏꯔꯥꯡ ꯁꯩ ꯃꯦꯏꯇꯦꯏ , ꯋꯥꯍꯟꯊꯣꯀꯁꯤꯡ, ꯃꯔꯨ ꯑꯣꯏꯅꯥ ꯃꯣꯏꯔꯦꯡ ꯁꯥꯏꯕꯨ ꯉꯥꯛ-ꯁꯦꯅꯕꯗꯥ ꯑꯃꯁꯨꯡ ꯌꯣꯀꯈꯠꯄꯗꯥ ꯃꯔꯨ ꯑꯣꯏꯅꯥ ꯒ꯭ꯔꯥꯁꯔꯨꯠꯀꯤ ꯃꯤꯑꯣꯏꯁꯤꯡꯒꯤ ꯑꯈꯟꯅꯕꯥ ꯀꯂꯆꯔ ꯑꯁꯤ ꯃꯤꯌꯥꯝꯅꯥ ꯄꯥꯝꯅꯕꯥ ꯑꯣꯏꯍꯟꯅꯕꯥ ꯄꯥꯟꯗꯝ ꯊꯝꯂꯤꯕꯥ ꯀꯂꯆꯔꯦꯜ ꯊꯧꯔꯝ ꯑꯃꯅꯤ꯫"
Numit Kappa Akongjamba and Phouoibi Henjunaha and Lairoulembi Khuyol Haoba and Yaithing Konu Kadeng Thangjahanba and Tonu Laijinglembi Ura Naha Khongjomba and Pidonnu Wanglen Pungdingheiba and Sappa Chanu Silheibi,ꯅꯨꯃꯤꯠ ꯀꯥꯞꯄꯥ ꯑꯀꯣꯡꯖꯥꯝꯕꯥ ꯑꯃꯁꯨꯡ ꯐꯣꯧꯑꯣꯏꯕꯤ ꯍꯦꯟꯖꯨꯅꯥꯍꯥ ꯑꯃꯁꯨꯡ ꯂꯥꯏꯔꯨꯂꯦꯃꯕꯤ ꯈꯨꯌꯣꯜ ꯍꯥꯑꯣꯕꯥ ꯑꯃꯁꯨꯡ ꯌꯥꯏꯊꯤꯡ ꯀꯣꯅꯨ ꯀꯥꯗꯦꯡ ꯊꯥꯖꯍꯥꯅꯕꯥ ꯑꯃꯁꯨꯡ ꯇꯣꯅꯨ ꯂꯥꯏꯖꯤꯡꯂꯦꯝꯕꯤ ꯎꯔꯥ ꯅꯥꯍꯥ ꯈꯣꯡꯖꯣꯝꯕꯥ ꯑꯃꯁꯨꯡ ꯄꯤꯗꯣꯟꯅꯨ ꯋꯥꯡꯂꯦ ꯄꯨꯡꯗꯤꯡꯍꯦꯕꯥ ꯑꯃꯁꯨꯡ ꯁꯞꯄꯥ ꯆꯥꯅꯨ ꯁꯤꯜꯍꯦꯕꯤ
Moirang Meitei moi.rāŋ is a town in the Indian state of Manipur best known for the tentatively listed UNESCO World Heritage Sites of the Keibul Lamjao Conservation Area KLCA covering Keibul Lamjao National Park KLNP the worlds only floating national park the buffer of Loktak Lake 140 sq km and,ꯃꯣꯏꯔꯥꯡ ꯃꯦꯏꯇꯦ ꯃꯣꯏ.ꯔꯂꯥ ꯑꯁꯤ ꯚꯥꯔꯇꯀꯤ ꯃꯅꯤꯄꯨꯔ ꯔꯥꯖ꯭ꯌꯒꯤ ꯁꯍꯔ ꯑꯃꯅꯤ ꯈ꯭ꯕꯥꯏꯗꯒꯤ ꯃꯃꯤꯡ ꯆꯠꯄꯥ ꯌꯨꯅꯦꯁ꯭ꯀꯣꯒꯤ ꯃꯥꯂꯦꯃꯒꯤ ꯍꯦꯔꯤꯇꯦꯖ ꯁꯥꯏꯠꯁꯤꯡꯒꯤꯗꯃꯛꯇꯥ ꯈ꯭ꯕꯥꯏꯗꯒꯤ ꯃꯃꯤꯡ ꯆꯠꯄꯥ ꯀꯦꯏꯕꯨꯜ ꯂꯃꯖꯥꯑꯣ ꯀꯟꯖꯔꯕꯦꯁꯟ ꯑꯦꯔꯤꯌꯥ ꯀꯦ.ꯑꯦꯜ.ꯁꯤ.ꯑꯦ.
Pumlen Pat 43 sq,ꯄꯝꯂꯦꯟ ꯄꯦꯠ ꯴꯳ ꯁ꯭ꯛꯕ꯭ꯌꯥꯔ .
km,ꯀꯦ.ꯑꯦꯝ.
It is best known for the being the place of origin of the ancient epic legend of Khamba and Thoibi one of the seven epic cycles of incarnations of Meitei mythology and folklore,ꯃꯁꯤ ꯈ꯭ꯕꯥꯏꯗꯒꯤ ꯃꯃꯤꯡ ꯆꯠꯂꯤꯕꯁꯤ ꯈꯝꯕꯥ ꯑꯃꯁꯨꯡ ꯊꯣꯏꯕꯤꯒꯤ ꯑꯔꯤꯕꯥ ꯏꯄꯤꯛ ꯂꯤꯖꯦꯟꯗ ꯑꯣꯐ ꯗ ꯑꯔꯤꯕꯥ ꯏꯄꯤꯛ ꯂꯤꯖꯦꯟꯗ ꯑꯁꯤ ꯃꯦꯏꯇꯦꯏ ꯃꯥꯏꯊꯣꯂꯣꯖꯤ ꯑꯃꯁꯨꯡ ꯐꯣꯜꯀꯂꯣꯔꯒꯤ ꯏꯄꯤꯛ ꯁꯥꯏꯀꯜ ꯷ꯀꯤ ꯃꯅꯨꯡꯗꯥ ꯑꯃꯅꯤ꯫
Nationwide it is also famous for the INA War Museum in the INA Martyrs Memorial Complex where Colonel Shaukat Malik of the Indian National Army hoisted the Tricolour for the first time on Indian soil on 14 April 1944,ꯂꯩꯕꯥꯛ ꯁꯤꯅꯕꯥ ꯊꯨꯡꯅꯥ ꯃꯁꯤ ꯏꯅꯥ ꯃꯥꯔꯇꯤꯌꯔꯁ ꯃꯦꯃꯣꯔꯤꯌꯦꯜ ꯀꯃꯞꯂꯦꯛꯁꯇꯥ ꯂꯩꯕꯥ ꯏꯅꯥ ꯋꯥꯔ ꯃ꯭ꯌꯨꯖꯤꯌꯃꯒꯤꯗꯃꯛꯇꯁꯨ ꯃꯃꯤꯡ ꯆꯠꯂꯤ ꯃꯐꯝ ꯑꯗꯨꯗꯥ ꯚꯥꯔꯇꯀꯤ ꯅꯦꯁ꯭ꯅꯦꯜ ꯑꯥꯔꯃꯤꯒꯤ ꯀꯔꯅꯦꯜ ꯁꯧꯀꯥꯠ ꯃꯥꯂꯤꯀꯅꯥ ꯱꯹꯴꯴ꯒꯤ ꯑꯦꯞꯔꯤꯜ ꯱꯴ꯗꯥ ꯚꯥꯔꯇꯀꯤ ꯂꯩꯃꯥꯌꯗꯥ ꯑꯍꯥꯅꯕꯥ ꯑꯣꯏꯅꯥ ꯃꯆꯨ ꯑꯍꯨꯃꯒꯤ ꯐꯤꯔꯥꯜ ꯄꯥꯏꯍꯅꯈꯤ
It is situated approximately 45 km 28 mi south of the state capital Imphal,ꯃꯁꯤ ꯔꯥꯖ꯭ꯌꯒꯤ ꯀꯦꯄꯤꯇꯦꯜ ꯏꯝꯐꯥꯂꯗꯒꯤ ꯈꯥ ꯊꯪꯕꯥ ꯁꯔꯨꯛꯇꯥ ꯆꯥꯎꯔꯥꯛꯅꯥ ꯀꯤꯂꯣꯃꯤꯇꯔ ꯲꯸ ꯂꯥꯞꯅꯥ ꯂꯩ .
It has an area of 269 km2 104 sq mi with a population of 62187 in 67 villages,ꯃꯁꯤꯒꯤ ꯃꯐꯝ ꯑꯁꯤ ꯀꯤꯂꯣꯃꯤꯇꯔ ꯲꯶꯹ ꯁꯥꯡꯕꯥ ꯁ꯭ꯛꯕ꯭ꯌꯥꯔ ꯃꯥꯏꯜ ꯱꯰꯴ꯅꯤ ꯑꯃꯁꯨꯡ ꯃꯁꯤꯒꯤ ꯃꯤꯁꯤꯡ ꯑꯁꯤ ꯈꯨꯉ꯭ꯒꯪ ꯶꯷ꯗꯥ ꯂꯩ꯫
There are 12 Panchayats in this block,ꯕ꯭ꯂꯣꯛ ꯑꯁꯤꯗꯥ ꯄꯟꯆꯥꯌꯠ ꯱꯲ ꯂꯩꯔꯤ .
Historically the town of Moirang is famous for the ancient temple of the deity Thangching Thangjing and the legendary love story of Khamba Thoibi,ꯄꯨꯋꯥꯔꯤꯒꯤ ꯃꯇꯨꯡ ꯏꯟꯅꯥ ꯃꯣꯏꯔꯥꯡ ꯁꯍꯔ ꯑꯁꯤ ꯗꯦꯕꯇꯥ ꯊꯥꯡꯆꯤꯡꯒꯤ ꯑꯔꯤꯕꯥ ꯃꯟꯗꯤꯔ ꯑꯃꯁꯨꯡ ꯈꯥꯝꯕꯥ ꯊꯣꯏꯕꯤꯒꯤ ꯂꯤꯖꯦꯟꯗꯥꯔꯤ ꯂꯥꯚ ꯋꯥꯔꯤꯒꯤꯗꯃꯛ ꯃꯃꯤꯡ ꯆꯠꯂꯤ꯫
In a village named Ngangkhaleikai the old cloth used by Khamba and Nongban are still preserved,ꯉꯥꯡꯈꯥꯂꯦꯏꯀꯥꯏ ꯀꯧꯕꯥ ꯈꯨꯉ꯭ꯒꯪ ꯑꯃꯗꯥ ꯈꯥꯝꯕꯥ ꯑꯃꯁꯨꯡ ꯅꯣꯡꯂꯩ ꯅꯨꯡꯁꯤꯠꯅꯥ ꯁꯤꯖꯤꯟꯅꯔꯤꯕꯥ ꯑꯔꯤꯕꯥ ꯐꯤ ꯑꯁꯤ ꯍꯧꯖꯤꯛ ꯐꯥꯑꯣꯕꯥ ꯉꯥꯛꯇꯨꯅꯥ ꯊꯝꯂꯤ
The epic story of KhambaThoibi begins between a beautiful princess name Thoibi daughter of Wangon Ningthou Chingkhu Naha Telheiba and an orphan man named Khuman Khamba,ꯈꯥꯝꯕꯥꯊꯣꯏꯕꯤꯒꯤ ꯏꯄꯤꯛ ꯋꯥꯔꯤ ꯑꯁꯤ ꯋꯥꯡꯒꯣ ꯅꯤꯡꯊꯧ ꯆꯤꯡꯈꯨ ꯅꯥꯍꯥ ꯇꯦꯂꯍꯦꯏꯕꯥꯒꯤ ꯃꯆꯥꯅꯨꯄꯤ ꯊꯣꯏꯕꯤꯒꯤ ꯐꯖꯔꯕꯥ ꯔꯥꯖꯀꯨꯃꯥꯔ ꯑꯃꯒꯤ ꯃꯔꯛꯇꯥ ꯍꯧꯏ ꯑꯃꯁꯨꯡ ꯈꯣꯃꯥꯟ ꯈꯕꯥ ꯀꯧꯕꯥ ꯑꯉꯥꯡ ꯑꯃꯒꯤ ꯃꯔꯛꯇꯥ ꯍꯧꯏ꯫
Khamba was raised up by her own sister when both their parents died when they were very young,ꯈꯕꯥ ꯑꯁꯤ ꯃꯁꯥꯒꯤ ꯃꯔꯨꯞ ꯑꯃꯅꯥ ꯌꯣꯀꯄꯤꯈꯤ ꯃꯗꯨꯗꯤ ꯃꯈꯣꯌꯒꯤ ꯃꯃꯥ-ꯃꯄꯥ ꯑꯅꯤꯃꯛ ꯌꯥꯝꯅꯥ ꯅꯍꯥ ꯑꯣꯏꯔꯤꯉꯩꯗꯥ ꯁꯤꯈꯤꯕꯅꯤ
Khamnu used to go around the village for pounding grain and lend a hand to others household works at her young age,ꯈꯥꯃꯅꯨꯅꯥ ꯈꯨꯉ꯭ꯒꯪꯒꯤ ꯃꯐꯝ ꯀꯌꯥꯗꯥ ꯆꯠꯇꯨꯅꯥ ꯆꯦꯡ ꯊꯥꯅꯕꯥ ꯑꯃꯁꯨꯡ ꯃꯍꯥꯛꯀꯤ ꯅꯍꯥ ꯑꯣꯏꯔꯤꯕꯥ ꯆꯍꯤꯗꯥ ꯌꯨꯃꯒꯤ ꯊꯕꯀꯁꯤꯡ ꯑꯇꯣꯞꯄꯁꯤꯡꯗꯥ ꯄꯤꯔꯝꯃꯤ
In ancient times the king of Moirang was considered as the most powerful among the seven clan kings of Manipur,ꯑꯔꯤꯕꯥ ꯃꯇꯃꯗꯥ ꯃꯣꯏꯔꯥꯡꯒꯤ ꯅꯤꯡꯊꯧ ꯑꯁꯤ ꯃꯅꯤꯄꯨꯔꯒꯤ ꯀ꯭ꯂꯥꯟ ꯅꯤꯡꯊꯧ ꯷ꯀꯤ ꯃꯅꯨꯡꯗꯥ ꯈ꯭ꯕꯥꯏꯗꯒꯤ ꯃꯄꯥꯉ꯭ꯒꯜ ꯀꯅꯕꯥ ꯑꯣꯏꯅꯥ ꯂꯧꯅꯔꯝꯃꯤ꯫
Till the end of KhambaThoibi era the Burmese King paid the annual war reparations money to the Moirang king,ꯈꯥꯝꯕꯥꯊꯣꯏꯕꯤꯒꯤ ꯃꯇꯝ ꯂꯣꯏꯔꯀꯄꯐꯥꯑꯣꯕꯥ ꯕꯔꯃꯥꯒꯤ ꯅꯤꯡꯊꯧꯅꯥ ꯆꯍꯤꯒꯤ ꯑꯣꯏꯕꯥ ꯋꯥꯔ ꯔꯤꯄꯦꯔꯦꯁꯅꯁꯤꯡꯒꯤ ꯁꯦꯅꯐꯝ ꯑꯗꯨ ꯃꯣꯏꯔꯥꯡ ꯅꯤꯡꯊꯧꯗꯥ ꯄꯤꯈꯤ
During World War II Moirang was the headquarters of Indian National Army INA,ꯃꯥꯂꯦꯃꯒꯤ ꯂꯥꯟꯖꯥꯎ ꯑꯅꯤꯁꯨꯕꯒꯤ ꯃꯇꯃꯗꯥ ꯃꯣꯏꯔꯥꯡ ꯑꯁꯤ ꯏꯟꯗꯤꯌꯟ ꯅꯦꯁ꯭ꯅꯦꯜ ꯑꯥꯔꯃꯤ ꯑꯥꯏ.ꯑꯦꯟ.ꯑꯦ.
