en,mni-Mtei
Adrishtapoorvam hrishito’smi drishtwaa,ꯑꯗ꯭ꯔꯤꯁ꯭ꯇꯥꯄꯨꯔꯚꯥꯝ ꯍ꯭ꯔ꯭ꯏꯁꯤꯇꯣ’ꯁ꯭ꯃꯤ ꯗ꯭ꯔꯤꯁꯋꯥꯌꯥ
Bhayena cha pravyathitam mano me;,ꯚꯌꯅꯥ ꯆꯥ ꯄ꯭ꯔꯚ꯭ꯌꯊꯤꯇꯝ ꯃꯅꯣ ꯑꯩ;
Tadeva me darshaya deva roopam,ꯇꯥꯗꯦꯕ ꯑꯩ ꯗꯔꯁꯥꯌꯥ ꯗꯦꯕ ꯔꯨꯄꯥꯝ
Praseeda devesha jagannivaasa,ꯄ꯭ꯔꯁꯤꯗꯥ ꯗꯦꯕꯦꯁꯥ ꯖꯒꯅꯚꯥꯁꯥ
"45. I am delighted, having seen what has never been seen before; and yet my mind is",꯴꯵.ꯃꯃꯥꯡꯗꯥ ꯎꯈꯤꯗ꯭ꯔꯤꯕꯥ ꯑꯗꯨ ꯎꯔꯕꯥ ꯃꯇꯨꯡꯗꯥ ꯑꯩꯍꯥꯛ ꯅꯨꯡꯉꯥꯏꯕꯥ ꯐꯥꯑꯣꯏ;
"distressed with fear. Show me that (previous) form only, O God! Have mercy, O God of gods! O",ꯑꯀꯤꯕꯅꯥ ꯁꯣꯀꯍꯜꯂꯕꯥ꯫
abode of the universe!,ꯌꯨꯅꯤꯚꯔꯁꯀꯤ ꯑꯦꯕꯣꯗ!
Kireetinam gadinam chakrahastam,ꯀꯤꯔꯦꯇꯤꯅꯥꯝ ꯒꯥꯗꯤꯅꯥꯝ ꯆꯛꯔꯍꯁ꯭ꯇꯝ
Icchaami twaam drashtumaham tathaiva;,ꯏꯆ꯭ꯆꯃꯤ ꯇꯋꯥꯝ ꯗ꯭ꯔꯁꯇꯨꯃꯥꯍꯝ ꯇꯥꯊꯥꯏꯚꯥ;
Tenaiva roopena chaturbhujena,ꯇꯦꯅꯥꯏꯚꯥ ꯔꯨꯄꯦꯅꯥ ꯆꯇꯨꯔꯚꯨꯖꯦꯅꯥ
Sahasrabaaho bhava vishwamoorte,ꯁꯥꯍꯥꯁꯔꯕꯥꯍꯣ ꯚꯥꯕ ꯕꯤꯁ꯭ꯕꯥꯃꯨꯔꯇꯦ
"46. I desire to see Thee as before, crowned, bearing a mace, with the discus in hand, in Thy","46. ​​ꯑꯩꯅꯥ ꯅꯉꯕꯨ ꯍꯥꯟꯅꯒꯨꯝ ꯎꯕꯥ ꯄꯥꯝꯃꯤ, ꯀꯨꯃꯊꯔꯀꯄꯥ, ꯃꯦꯁ ꯑꯃꯥ ꯂꯧꯕꯥ, ꯈꯨꯠꯇꯥ ꯂꯩꯕꯥ ꯗꯤꯁ꯭ꯀꯁꯀꯥ ꯂꯣꯌꯅꯅꯥ, ꯅꯍꯥꯛꯀꯤ ."
"former form only, having four arms, O thousand-armed, Cosmic Form (Being)!","ꯍꯥꯟꯅꯒꯤ ꯃꯑꯣꯡ ꯈꯛꯇꯃꯛ, ꯈꯨꯠ ꯃꯔꯤ ꯂꯩꯕꯥ, ꯍꯦ ꯂꯤꯁꯤꯡ-ꯈꯨꯠ, ꯀꯣꯁ꯭ꯃꯤꯛꯀꯤ ꯃꯑꯣꯡ (ꯍꯧꯖꯤꯛ ꯂꯩꯔꯤꯕꯥ)!"
Sri Bhagavaan Uvaacha:,ꯁ꯭ꯔꯤ ꯚꯒꯕꯥꯟ ꯎꯋꯥꯆ꯭ꯌꯥ:
Mayaa prasannena tavaarjunedam,ꯃꯥꯌꯥ ꯄ꯭ꯔꯁꯥꯟꯅꯦꯅꯥ ꯇꯥꯚꯥꯔꯖꯨꯅꯦꯗꯝ
Roopam param darshitamaatmayogaat;,ꯔꯨꯄꯥꯝ ꯄꯔꯝ ꯗꯔꯁꯤꯇꯥꯃꯥꯇꯃꯥꯌꯣꯒꯠ;
Tejomayam vishwamanantamaadyam,ꯇꯦꯖꯣꯃꯥꯌꯝ ꯕꯤꯁ꯭ꯕꯥꯃꯟꯇꯥꯃꯥꯗꯝ
Yanme twadanyena na drishtapoorvam,ꯌꯥꯅꯦꯝ ꯇꯋꯥꯗꯥꯅꯦꯅꯥ ꯅꯥ ꯗ꯭ꯔꯤꯁꯁ꯭ꯇꯥꯄꯨꯔꯚꯥꯝ
The Blessed Lord said:,ꯊꯧꯖꯥꯜ ꯍꯩꯕꯥ ꯃꯄꯨꯅꯥ ꯍꯥꯌꯈꯤ:
"47. O Arjuna, this Cosmic Form has graciously been shown to thee by Me by My own Yogic","47. ꯑꯣ ꯑꯔꯖꯨꯅꯥ, ꯃꯁꯤꯒꯤ ꯀꯣꯁ꯭ꯃꯤꯛꯀꯤ ꯃꯑꯣꯡ ꯑꯁꯤ ꯑꯩꯒꯤ ꯏꯁꯥꯒꯤ ꯌꯣꯒꯅꯥ ꯅꯍꯥꯛꯀꯤ ꯃꯐꯃꯗꯥ ꯊꯧꯖꯥꯜ ꯍꯩꯅꯥ ꯎꯠꯈ꯭ꯔꯦ"
"power; full of splendour, primeval, and infinite, this Cosmic Form of Mine has never been seen",ꯄꯥꯡꯒꯜ;
before by anyone other than thyself,ꯃꯃꯥꯡꯗꯥ ꯅꯍꯥꯛꯅꯥ ꯅꯁꯥꯒꯤ ꯑꯣꯏꯕꯥ ꯑꯇꯣꯞꯄꯥ ꯀꯅꯥꯒꯨꯝꯕꯥ ꯑꯃꯅꯥ .
Na vedayajnaadhyayanairna daanair,ꯑꯦꯟ.ꯑꯦ.ꯚꯤ.ꯗꯥꯌꯥꯖꯅꯥꯙ꯭ꯌꯥꯌꯅꯥꯏꯔꯅꯥ ꯗꯥꯅꯥꯏꯔ
Na cha kriyaabhirna tapobhirugraih;,ꯅꯥ ꯆꯥ ꯀ꯭ꯔ꯭ꯏꯌꯥꯚꯤꯔꯅꯥ ꯇꯥꯄꯥꯑꯣꯚꯤꯔꯨꯒ꯭ꯔꯍ;
Evam roopah shakya aham nriloke,ꯏꯚꯥꯝ ꯔꯨꯄꯥꯍ ꯁꯛꯌꯥ ꯑꯍꯥꯝ ꯅ꯭ꯔꯤꯂꯣꯛ
Drashtum twadanyena karupraveera,ꯗ꯭ꯔꯁꯇꯨꯝ ꯇꯋꯥꯗꯥꯅꯤꯌꯦꯅꯥ ꯀꯔꯨꯞꯔꯥꯚꯦꯔꯥ
"48. Neither by the study of the Vedas and sacrifices, nor by gifts, nor by rituals, nor by","꯴꯸.ꯕꯦꯗꯁꯤꯡ ꯑꯃꯁꯨꯡ ꯀꯠꯊꯣꯀꯄꯁꯤꯡꯒꯤ ꯃꯔꯃꯗꯥ ꯇꯃꯕꯥ, ꯅꯠꯔꯒꯥ ꯈꯨꯗꯣꯂꯁꯤꯡꯅꯥ, ꯅꯠꯔꯒꯥ ꯔꯤꯇꯨꯌꯦꯂꯁꯤꯡꯅꯥ, ꯅꯠꯔꯒꯥ ꯔꯤꯇꯨꯌꯦꯂꯁꯤꯡꯅꯥ ꯄꯤꯕꯥ ꯅꯠꯔꯒꯥ ꯄꯤ.ꯑꯦꯝ."
"severe austerities, can I be seen in this form in the world of men by any other than thyself, O great","ꯑꯀꯅꯕꯥ ꯇꯄꯊꯕꯥ, ꯑꯩꯅꯥ ꯃꯤꯑꯣꯏꯕꯒꯤ ꯃꯥꯂꯦꯃꯗꯥ ꯃꯤꯑꯣꯏꯕꯒꯤ ꯃꯥꯂꯦꯃꯁꯤꯗꯥ ꯃꯁꯥꯅꯥ ꯃꯁꯥꯕꯨ ꯌꯥꯝꯅꯥ ꯅꯨꯡꯁꯤꯖꯕꯥ ꯅꯠꯇꯅꯥ ꯑꯇꯣꯞꯄꯥ ꯑꯃꯅꯥ ꯎꯕꯥ ꯐꯪꯒꯅꯤ, o ꯑꯆꯧꯕꯥ ."
hero of the Kurus (Arjuna)!,ꯀꯨꯔꯨꯁꯤꯡꯒꯤ ꯍꯤꯔꯣ (ꯑꯔꯖꯨꯟ)!
Maa te vyathaa maa cha vimoodhabhaavo,ꯃꯥ ꯇꯦ ꯋ꯭ꯌꯥꯊꯥ ꯃꯥ ꯆꯥ ꯚꯤꯃꯨꯙꯚꯥꯚꯣ
Drishtwaa roopam ghorameedringmamedam;,ꯗ꯭ꯔꯤꯁꯋꯥꯌꯥ ꯔꯨꯄꯣꯝ ꯘꯣꯔꯥꯃꯤꯗꯔꯤꯡꯃꯃꯦꯗꯝ;
Vyapetabheeh preetamanaah punastwam,ꯋ꯭ꯌꯥꯄꯦꯇꯥꯚꯤꯍ ꯄ꯭ꯔꯤꯇꯅꯥꯍ ꯄꯨꯅꯥꯁ꯭ꯇꯋꯥꯝ
Tadeva me roopamidam prapashya,ꯇꯥꯗꯦꯕ ꯃꯦ ꯔꯨꯄꯥꯃꯤꯗꯥꯝ ꯄ꯭ꯔꯄꯥꯁ꯭ꯌꯥ
93,꯹꯳ ꯑꯃꯁꯨꯡ ꯑꯦꯟ.
BHAGAVAD GITA,ꯚꯒꯕꯠ ꯒꯤꯇꯥ
49. Be not afraid nor bewildered on seeing such a terrible form of Mine as this; with thy fear,꯴꯹.ꯑꯩꯒꯤ ꯑꯁꯤꯒꯨꯝꯕꯥ ꯑꯀꯤꯕꯥ ꯄꯣꯀꯍꯅꯕꯥ ꯃꯑꯣꯡ ꯑꯁꯤ ꯎꯕꯗꯥ ꯂꯥꯡꯇꯛꯅꯕꯥ ꯅꯠꯔꯒꯥ ꯋꯥꯈꯜ ꯋꯥꯕꯥ ꯑꯣꯏꯔꯣꯏꯗꯕꯅꯤ;
"entirely dispelled and with a gladdened heart, now behold again this former form of Mine","ꯃꯄꯨꯡ ꯐꯥꯅꯥ ꯂꯧꯊꯣꯀꯄꯥ ꯑꯃꯁꯨꯡ ꯅꯨꯡꯉꯥꯏꯕꯥ ꯊꯝꯃꯣꯌ ꯑꯃꯒꯥ ꯂꯣꯌꯅꯅꯥ, ꯍꯧꯖꯤꯛ ꯑꯃꯨꯛ ꯍꯟꯅꯥ ꯌꯦꯡꯕꯤꯌꯨ ꯑꯩꯒꯤ ꯍꯥꯟꯅꯒꯤ ꯃꯑꯣꯡ ꯑꯁꯤ"
Sanjaya Uvaacha:,ꯁꯟꯖꯌꯥ ꯎꯋꯥꯆ꯭ꯌꯥ:
Swakam roopam darshayaamaasa bhooyah;,ꯁ꯭ꯕꯀꯝ ꯔꯨꯄꯥꯝ ꯗꯔꯁꯌꯥꯃꯥꯁꯥ ꯚꯨꯌꯍ;
Aashwaasayaamaasa cha bheetamenam,ꯑꯥꯁꯋꯥꯁꯌꯥꯌꯥꯃꯥꯁꯥ ꯆꯥ ꯚꯤꯇꯥꯃꯦꯅꯝ
Bhootwaa punah saumyavapurmahaatmaa,ꯚꯨꯇꯋꯥꯌꯥ ꯄꯨꯅꯥꯍ ꯁꯧꯃꯌꯥꯕꯄꯨꯔꯃꯥꯍꯇꯃꯥꯌꯥ
Sanjaya said:,ꯁꯟꯖꯌꯅꯥ ꯍꯥꯌꯈꯤ:
"50. Having thus spoken to Arjuna, Krishna again showed His own form; and the great soul",꯵꯰.ꯑꯁꯨꯝꯅꯥ ꯑꯔꯖꯨꯅꯒꯥ ꯋꯥꯔꯤ ꯁꯥꯅꯔꯕꯥ ꯃꯇꯨꯡꯗꯥ ꯀ꯭ꯔ꯭ꯏꯁ꯭ꯅꯅꯥ ꯑꯃꯨꯛ ꯍꯟꯅꯥ ꯃꯁꯥꯒꯤ ꯑꯣꯏꯕꯥ ꯃꯑꯣꯡ ꯎꯠꯈꯤ;
"(Krishna), assuming His gentle form, consoled him who was terrified (Arjuna)","(ꯀ꯭ꯔ꯭ꯏꯁ꯭ꯟ), ꯃꯍꯥꯛꯀꯤ ꯃꯤꯅꯨꯡꯁꯤ ꯂꯩꯕꯥ ꯃꯑꯣꯡ ꯑꯗꯨ ꯂꯧꯗꯨꯅꯥ, ꯃꯍꯥꯀꯄꯨ ꯊꯋꯥꯏ ꯌꯥꯑꯣꯍꯅꯈꯤꯕꯥ (ꯑꯔꯖꯨꯟ) ꯃꯍꯥꯀꯄꯨ ꯅꯨꯡꯉꯥꯏꯍꯅꯈꯤ꯫"
Arjuna Uvaacha:,ꯑꯔꯖꯨꯟ ꯎꯋꯥꯆ꯭ꯌꯥ:
Drishtwedam maanusham roopam tava saumyam janaardana;,ꯗ꯭ꯔꯤꯁ꯭ꯇꯋꯦꯗꯝ ꯃꯥꯅꯨꯁꯝ ꯔꯨꯄꯣꯝ ꯇꯥꯚꯥ ꯁꯧꯃꯌꯝ ꯖꯔꯅꯥꯔꯗꯅꯥ;
Idaaneemasmi samvrittah sachetaah prakritim gatah,ꯏꯗꯥꯅꯦꯏꯃꯁ꯭ꯃꯤ ꯁꯝꯚ꯭ꯔ꯭ꯏꯠꯇꯥꯍ ꯁꯆꯦꯇꯥꯍ ꯄ꯭ꯔꯀ꯭ꯔ꯭ꯏꯇꯤꯝ ꯒꯇꯥꯍ
Arjuna said:,ꯑꯔꯖꯨꯟꯅꯥ ꯍꯥꯌꯈꯤ:
"51. Having seen this Thy gentle human form, O Krishna, now I am composed and restored","꯵꯱.ꯅꯍꯥꯛꯀꯤ ꯃꯤꯅꯨꯡꯁꯤ ꯂꯩꯕꯥ ꯃꯤꯑꯣꯏꯕꯒꯤ ꯃꯑꯣꯡ ꯑꯁꯤ ꯎꯔꯕꯥ ꯃꯇꯨꯡꯗꯥ, ꯍꯦ ꯀ꯭ꯔ꯭ꯏꯁ꯭ꯟ, ꯍꯧꯖꯤꯛ ꯑꯩꯍꯥꯛ ꯀꯝꯄꯣꯖ ꯇꯧꯔꯦ ꯑꯃꯁꯨꯡ ꯑꯃꯨꯛ ꯍꯟꯅꯥ ꯁꯦꯃꯒꯠꯂꯦ꯫"
to my own nature!,ꯑꯩꯒꯤ ꯏꯁꯥꯒꯤ ꯑꯣꯏꯕꯥ ꯃꯑꯣꯡꯗꯥ!
Sri Bhagavaan Uvaacha:,ꯁ꯭ꯔꯤ ꯚꯒꯕꯥꯟ ꯎꯋꯥꯆ꯭ꯌꯥ:
Sudurdarshamidam roopam drishtavaanasi yanmama;,ꯁꯨꯗꯨꯔꯗꯥꯔꯁ꯭ꯃꯤꯗꯥꯝ ꯔꯨꯄꯣꯝ ꯗ꯭ꯔꯤꯁꯁ꯭ꯇꯥꯚꯥꯅꯥꯁꯤ ꯌꯥꯅꯃꯥꯃꯥ;
Devaa apyasya roopasya nityam darshanakaangkshinah,ꯗꯦꯚꯥ ꯑꯞꯌꯁ꯭ꯌ ꯔꯨꯄꯥꯁꯌ ꯅꯤꯠꯌꯝ ꯗꯔꯁꯥꯅꯥꯀꯥꯡꯀꯁꯤꯅꯥꯍ
The Blessed Lord said:,ꯊꯧꯖꯥꯜ ꯍꯩꯕꯥ ꯃꯄꯨꯅꯥ ꯍꯥꯌꯈꯤ:
52. Very hard indeed it is to see this form of Mine which thou hast seen. Even the gods are,꯵꯲.ꯇꯁꯦꯡꯅꯥ ꯌꯥꯝꯅꯥ ꯀꯟꯅꯥ ꯍꯣꯠꯅꯕꯥ ꯑꯁꯤ ꯅꯍꯥꯛꯅꯥ ꯎꯈꯤꯕꯥ ꯑꯩꯒꯤ ꯃꯑꯣꯡ ꯑꯁꯤ ꯎꯕꯅꯤ꯫
ever longing to behold it,ꯃꯁꯤ ꯌꯦꯡꯅꯕꯥ ꯃꯇꯝ ꯄꯨꯝꯅꯃꯛꯇꯥ ꯂꯥꯡꯇꯛꯅꯕꯥ .
Naa ham vedairna tapasaa na daanena na chejyayaa;,ꯅꯥꯌꯥ ꯍꯥꯝ ꯚꯦꯗꯥꯏꯔꯅꯥ ꯇꯥꯄꯥꯁꯥ ꯅꯥ ꯗꯥꯅꯦꯅꯥ ꯅꯥ ꯆꯦꯖ꯭ꯌꯌꯥ;
Shakya evamvidho drashtum drishtavaanasi maam yathaa,ꯁꯥꯛꯌꯥ ꯏꯚꯥꯃꯚꯤꯙꯣ ꯗ꯭ꯔꯁꯇꯨꯝ ꯗ꯭ꯔꯤꯁꯁ꯭ꯇꯥꯚꯥꯅꯥꯁꯤ ꯃꯥꯝ ꯌꯥꯊꯥꯑꯥ
"53. Neither by the Vedas, nor by austerity, nor by gift, nor by sacrifice, can I be seen in this","꯵꯳.ꯕꯦꯗꯁꯤꯡꯅꯥ ꯅꯠꯔꯒꯥ ꯇꯄꯊꯕꯥ ꯅꯠꯔꯒꯥ ꯄꯤꯖꯕꯅꯥ ꯅꯠꯔꯒꯥ ꯀꯠꯊꯣꯀꯄꯒꯤ ꯃꯇꯨꯡ ꯏꯟꯅꯥ, ꯃꯁꯤꯗꯥ ꯑꯩꯍꯥꯛ ꯎꯕꯥ ꯐꯪꯖꯕꯥ ꯑꯁꯤ ."
form as thou hast seen Me (so easily),ꯐꯣꯔꯝ ꯐꯣꯔꯝ ꯅꯍꯥꯛꯅꯥ ꯑꯩꯕꯨ ꯎꯈꯤꯕꯥ ꯑꯗꯨꯒꯨꯝꯅꯥ (ꯑꯁꯨꯛ ꯌꯥꯝꯅꯥ ꯐꯖꯅꯥ)
Bhaktyaa twananyayaa shakyam aham evamvidho’rjuna;,ꯚꯛꯇꯤꯌꯥ ꯇꯋꯥꯅꯅꯌꯌꯥ ꯁꯛꯌꯝ ꯑꯍꯝ ꯏꯚꯥꯃꯕꯤꯗꯣ’ꯔꯖꯨꯅꯥ;
Jnaatum drashtum cha tattwena praveshtum cha parantapa,jnaatum drastum cha tattwena pravestum cha ꯄꯥꯔꯥꯟꯇꯥꯄꯥ
"54. But by single-minded devotion can I, of this form, be known and seen in reality and also","꯵꯴.ꯑꯗꯨꯕꯨ ꯁꯤꯉ꯭ꯒꯜ-ꯃꯥꯏꯟꯗ ꯚꯛꯇꯤꯅꯥ i, ꯃꯁꯤꯒꯤ ꯃꯑꯣꯡ ꯑꯁꯤꯒꯤ, ꯔꯤꯑꯦꯂꯤꯇꯤꯗꯥ ꯈꯉꯕꯥ ꯑꯃꯁꯨꯡ ꯎꯕꯥ ꯉꯝꯕꯥ ꯑꯃꯁꯨꯡ ꯃꯁꯤꯒꯥ ꯂꯣꯌꯅꯅꯥ"
"entered into, O Arjuna!","ꯌꯥꯑꯣꯔꯦ, ꯑꯣ ꯑꯔꯖꯨꯅꯥ!"
Matkarmakrinmatparamo madbhaktah sangavarjitah;,ꯃꯇꯀꯔꯃꯀ꯭ꯔ꯭ꯏꯅꯃꯇꯄꯥꯔꯥꯃꯣ ꯃꯗꯚꯛꯇꯥꯍ ꯁꯉ꯭ꯒꯕꯔꯖꯤꯇꯥꯍ;
Nirvairah sarvabhooteshu yah sa maameti paandava,ꯅꯤꯔꯚꯥꯏꯔꯥꯍ ꯁꯔꯚꯥꯚꯨꯇꯦꯁꯨ ꯌꯥꯍ ꯁꯥ ꯃꯥꯃꯦꯇꯤ ꯄꯌꯥꯟꯗꯥꯕ
94,꯹꯴ ꯂꯩ꯫
THE YOGA OF THE VISION OF THE COSMIC FORM,ꯀꯣꯁ꯭ꯃꯤꯛꯀꯤ ꯃꯑꯣꯡ ꯃꯇꯧꯒꯤ ꯚꯤꯖꯅꯒꯤ ꯌꯣꯒ .
"55. He who does all actions for Me, who looks upon Me as the Supreme, who is devoted to","꯵꯵.ꯑꯩꯒꯤꯗꯃꯛ ꯊꯕꯛ ꯄꯨꯝꯅꯃꯛ ꯇꯧꯔꯤꯕꯥ, ꯑꯩꯕꯨ ꯁꯨꯞꯔꯤꯝ ꯑꯣꯏꯅꯥ ꯌꯦꯡꯂꯤꯕꯥ ꯃꯤꯑꯣꯏ ꯑꯗꯨꯅꯥ, ꯃꯍꯥꯛꯅꯥ ."
"Me, who is free from attachment, who bears enmity towards no creature, he comes to Me, O","ꯑꯩ, ꯑꯦꯇꯦꯆꯃꯦꯟꯇꯇꯒꯤ ꯐ꯭ꯔꯤ ꯑꯣꯏꯕꯥ, ꯖꯤꯕ ꯑꯃꯠꯇꯒꯤ ꯃꯥꯌꯀꯩꯗꯥ ꯌꯦꯛꯅꯕꯥ ꯂꯧꯕꯥ, ꯃꯍꯥꯛꯅꯥ ꯑꯩꯉꯣꯟꯗꯥ ꯂꯥꯀꯏ, ꯑꯣ ."
Arjuna!,ꯑꯔꯖꯨꯟ!
COMMENTARY: This is the essence of the whole teaching of the Gita. He who practises,ꯀꯃꯦꯟꯇꯔꯤ: ꯃꯁꯤ ꯒꯤꯇꯥꯒꯤ ꯑꯄꯨꯅꯕꯥ ꯇꯝꯕꯤꯕꯒꯤ ꯃꯔꯨꯑꯣꯏꯕꯥ ꯑꯗꯨꯅꯤ꯫
this teaching attains supreme bliss and immortality. Such a one realises Him and enters into His,ꯃꯁꯤꯒꯤ ꯇꯝꯕꯤꯕꯥ ꯑꯁꯤꯅꯥ ꯑꯊꯣꯏꯕꯥ ꯅꯨꯡꯉꯥꯏꯕꯥ ꯑꯃꯁꯨꯡ ꯑꯁꯤꯕꯥ ꯌꯥꯝꯅꯥ ꯐꯪꯏ꯫
"Being, becoming completely one with Him. This verse contains the summary of the entire Gita","ꯍꯤꯡꯕꯥ, ꯃꯍꯥꯛꯀꯥ ꯃꯄꯨꯡ ꯐꯥꯅꯥ ꯑꯃꯠꯇꯥ ꯑꯣꯏꯕꯥ꯫"
philosophy,ꯋꯥꯉꯨꯂꯣꯜ
Hari Om Tat Sat,ꯍꯔꯤ ꯑꯣꯝ ꯇꯥꯠ ꯁꯒꯣ
Iti Srimad Bhagavadgeetaasoopanishatsu Brahmavidyaayaam,iti ꯁ꯭ꯔꯤꯃꯗ ꯚꯒꯕꯗ꯭ꯒꯤꯇꯥꯁꯨꯄꯦꯅꯤꯁꯥꯠꯁꯨ ꯕ꯭ꯔꯍ꯭ꯃꯕꯤꯗꯌꯥꯌꯥꯌꯝ
Yogashaastre Sri Krishnaarjunasamvaade,ꯌꯣꯒꯁꯥꯁ꯭ꯠꯔꯦ ꯁ꯭ꯔꯤ ꯀ꯭ꯔ꯭ꯏꯁ꯭ꯅꯔꯖꯨꯅꯥꯁꯃꯚꯥꯗꯦ
Vishwaroopa Darshanayogo Naama Ekaadasho’dhyaayah,ꯕꯤꯁ꯭ꯕꯔꯨꯄꯥ ꯗꯥꯔꯁꯥꯅꯥꯌꯣꯒꯣ ꯅꯥꯃꯥ ꯑꯦꯀꯥꯗꯥꯁꯣ’ꯙ꯭ꯌꯥꯌꯥꯍ
"Thus in the Upanishads of the glorious Bhagavad Gita, the science of the Eternal, the","ꯑꯁꯨꯝꯅꯥ ꯃꯁꯛ ꯅꯥꯏꯕꯥ ꯚꯒꯕꯠ ꯒꯤꯇꯥꯒꯤ ꯎꯄꯅꯤꯁꯗꯁꯤꯡꯗꯥ, ꯏꯇꯔꯅꯦꯂꯒꯤ ꯁꯥꯏꯟꯁ, ꯗꯤ."
"scripture of Yoga, the dialogue between Sri Krishna and Arjuna, ends the eleventh discourse","ꯌꯣꯒꯒꯤ ꯁꯥꯁ꯭ꯠꯔ, ꯁ꯭ꯔꯤ ꯀ꯭ꯔ꯭ꯏꯁ꯭ꯟ ꯑꯃꯁꯨꯡ ꯑꯔꯖꯨꯅꯒꯤ ꯃꯔꯛꯇꯥ ꯂꯩꯔꯤꯕꯥ ꯋꯥꯔꯤ ꯁꯥꯅꯕꯥ ꯑꯁꯤꯅꯥ ꯑꯦꯂꯦꯚꯦꯟꯇ ꯗꯤꯁꯀꯣꯔꯁ ꯑꯁꯤ ꯂꯣꯏꯁꯤꯜꯂꯤ"
entitled:,ꯀꯥꯟꯅꯕ ꯐꯪꯐꯝ ꯊꯣꯛꯄ ꯃꯤꯑꯣꯏ:
“The Yoga of the Vision of the Cosmic Form”,“ꯀꯣꯁ꯭ꯃꯤꯛꯀꯤ ꯃꯑꯣꯡ ꯃꯇꯧꯒꯤ ꯃꯤꯠꯌꯦꯡꯒꯤ ꯌꯣꯒ”
XII,XII ꯒꯤ ꯃꯇꯨꯡ ꯏꯟꯅꯥ ꯑꯦꯟ.
THE YOGA OF DEVOTION,ꯚꯛꯇꯤꯒꯤ ꯌꯣꯒ .
Summary of Twelfth Discourse,ꯇꯔꯦꯠꯁꯨꯕꯥ ꯗꯤꯁꯀꯣꯔꯁꯀꯤ ꯋꯥꯔꯣꯜ
The twelfth discourse indicates that the path of devotion is easier than the path of,ꯇꯔꯦꯠꯁꯨꯕꯥ ꯗꯤꯁꯀꯣꯔꯁ ꯑꯁꯤꯅꯥ ꯇꯥꯛꯂꯤ ꯃꯗꯨꯗꯤ ꯚꯛꯇꯤꯒꯤ ꯂꯝꯕꯤ ꯑꯁꯤ ꯂꯝꯕꯤꯗꯒꯤ ꯍꯦꯟꯅꯥ ꯂꯥꯌꯕꯥ ꯑꯣꯏ ꯍꯥꯌꯕꯥ ꯇꯥꯀꯏ꯫
knowledge. In this path the aspirant worships God in His Cosmic Form of the Supreme Personality,ꯂꯧꯁꯤꯡ.
"He develops a loving relationship with Him, adores Him, remembers Him and chants His glories","ꯃꯍꯥꯛꯅꯥ ꯃꯍꯥꯛꯀꯥ ꯅꯨꯡꯁꯤꯅꯅꯥ ꯂꯩꯃꯤꯟꯅꯕꯥ ꯃꯔꯤ ꯑꯃꯥ ꯁꯦꯃꯒꯠꯂꯤ, ꯃꯍꯥꯀꯄꯨ ꯅꯨꯡꯁꯤꯖꯩ, ꯃꯍꯥꯀꯄꯨ ꯅꯤꯡꯁꯤꯡꯂꯤ ꯑꯃꯁꯨꯡ ꯃꯍꯥꯛꯀꯤ ꯃꯁꯀꯁꯤꯡ ꯑꯗꯨ ꯂꯥꯑꯣꯊꯣꯀꯏ"
and Name. He thus effects union with the Lord and attains not only His formless aspect but also the,ꯑꯃꯁꯨꯡ ꯃꯤꯡ꯫
Lord as the manifest universe,ꯄ꯭ꯔꯚꯨ ꯑꯣꯏꯅꯥ ꯃꯦꯅꯤꯐꯦꯁ꯭ꯠ ꯌꯨꯅꯤꯚꯔꯁ ꯑꯣꯏꯅꯥ .
"The path of knowledge, whereby the aspirant meditates on the formless Brahman, is more","ꯖ꯭ꯅꯥꯅꯒꯤ ꯂꯝꯕꯤ, ꯃꯗꯨꯗꯥ ꯑꯦꯁ꯭ꯄꯤꯔꯦꯟꯇꯅꯥ ꯐꯔꯃꯂꯦꯁ ꯕ꯭ꯔꯍ꯭ꯃꯟꯗꯥ ꯙ꯭ꯌꯥꯟ ꯇꯧꯕꯥ ꯑꯁꯤ ꯍꯦꯟꯅꯥ ."
difficult as he has to give up his attachment to the body from the very beginning. He has to have,ꯃꯍꯥꯛꯅꯥ ꯍꯧꯔꯀꯄꯗꯒꯤ ꯍꯀꯆꯥꯡꯗꯥ ꯃꯍꯥꯛꯀꯤ ꯑꯦꯇꯦꯆꯃꯦꯟꯇ ꯑꯗꯨ ꯊꯥꯗꯣꯀꯄꯥ ꯃꯊꯧ ꯇꯥꯕꯅꯥ ꯃꯔꯝ ꯑꯣꯏꯗꯨꯅꯥ ꯑꯔꯨꯕꯥ꯫
dispassion for the things of the world,ꯃꯥꯂꯦꯃꯒꯤ ꯋꯥꯐꯃꯁꯤꯡꯒꯤꯗꯃꯛ ꯃꯤꯅꯨꯡꯁꯤ ꯂꯩꯠꯔꯕꯥ .
How to practise devotion? Krishna asks Arjuna to fix his entire mind on Him. As often as,ꯃꯇꯧ ꯀꯔꯝꯅꯥ ꯚꯛꯇꯤꯒꯤ ꯊꯕꯛ ꯇꯧꯒꯅꯤ?
the mind wanders it should be brought back to the Lord. If this process of concentration is difficult,ꯋꯥꯈꯂꯅꯥ ꯂꯥꯟꯊꯦꯡꯅꯔꯤ ꯃꯗꯨꯗꯤ ꯃꯁꯤ ꯏꯕꯨꯡꯉꯣꯗꯥ ꯑꯃꯨꯛ ꯍꯟꯅꯥ ꯄꯨꯔꯛꯀꯗꯕꯅꯤ꯫
"he should dedicate all his actions to Him, feeling that it is His power that activates everything. If this","ꯃꯍꯥꯛꯅꯥ ꯃꯍꯥꯛꯀꯤ ꯑꯦꯛꯁꯟ ꯄꯨꯝꯅꯃꯛ ꯃꯍꯥꯀꯄꯨ ꯀꯠꯊꯣꯛꯀꯗꯕꯅꯤ, ꯃꯍꯥꯛꯅꯥ ꯄꯨꯝꯅꯃꯀꯄꯨ ꯑꯦꯛꯇꯤꯕ ꯑꯣꯏꯍꯜꯂꯤꯕꯥ ꯃꯍꯥꯛꯀꯤ ꯁꯛꯇꯤ ꯑꯗꯨꯅꯤ ꯍꯥꯌꯅꯥ ꯈꯅꯒꯗꯕꯅꯤ꯫"
"also is beyond his ability, he should offer all his actions to the Lord, abandoning the desire for their","ꯑꯗꯨꯒꯥ ꯃꯍꯥꯛꯀꯤ ꯇꯧꯕꯥ ꯉꯝꯕꯁꯤꯡꯒꯤ ꯃꯊꯛꯇꯥ, ꯃꯍꯥꯛꯅꯥ ꯃꯍꯥꯛꯀꯤ ꯊꯕꯛ ꯈꯨꯗꯤꯡꯃꯛ ꯏꯕꯨꯡꯉꯣꯗꯥ ꯄꯤꯒꯗꯕꯅꯤ, ꯃꯈꯣꯌꯒꯤ ꯑꯄꯥꯝꯕꯥ ꯑꯗꯨ ꯊꯥꯗꯣꯛꯇꯨꯅꯥ ꯆꯠꯀꯗꯕꯅꯤ꯫"
fruits. He should take complete refuge in Him. The devotee who surrenders himself to the Lord,ꯃꯍꯩ-ꯃꯔꯣꯡꯁꯤꯡ꯫
attains perfect peace,ꯃꯄꯨꯡ ꯐꯥꯕꯥ ꯁꯥꯟꯇꯤ ꯐꯪꯍꯅꯕꯥ .
The Lord goes on to describe the qualities that a true devotee possesses. He neither attaches,ꯏꯕꯨꯡꯉꯣ ꯃꯍꯥꯛꯅꯥ ꯃꯈꯥ ꯇꯥꯅꯥ ꯑꯆꯨꯝꯕꯥ ꯚꯛꯇ ꯑꯃꯅꯥ ꯂꯩꯔꯤꯕꯥ ꯃꯒꯨꯅꯁꯤꯡ ꯑꯗꯨ ꯐꯣꯡꯗꯣꯀꯏ꯫
himself to anything nor does he have any aversion to things. He has a balanced mind under all,ꯃꯁꯥꯃꯀꯄꯨ ꯀꯔꯤꯒꯨꯝꯕꯥ ꯑꯃꯗꯥ ꯅꯠꯔꯒꯥ ꯃꯍꯥꯛꯅꯥ ꯄꯣꯠꯁꯤꯡꯒꯤ ꯃꯇꯥꯡꯗꯥ ꯌꯥꯝꯅꯥ ꯂꯥꯡꯇꯛꯅꯕꯥ ꯑꯃꯠꯇꯥ ꯂꯩꯇꯦ꯫
95,꯹꯵ ꯑꯃꯁꯨꯡ ꯑꯦꯟ.
BHAGAVAD GITA,ꯚꯒꯕꯠ ꯒꯤꯇꯥ
"circumstances. He is not agitated by the happenings of the world, nor does he himself cause any",ꯇꯥꯟꯖꯥ.
agitation in others. He is perfectly desireless and rejoices in the Lord within. He sees equality,ꯑꯇꯣꯞꯄꯁꯤꯡꯗꯥ ꯑꯦꯖꯤꯇꯦꯁꯟ ꯇꯧꯕꯥ꯫
"everywhere, being untouched by sorrow, fear, honour as also dishonour. He is perfectly content as","ꯃꯐꯝ ꯈꯨꯗꯤꯡꯃꯛꯇꯥ, ꯑꯋꯥꯕꯥ, ꯑꯀꯤꯕꯥ, ꯏꯀꯥꯌꯈꯨꯝꯅꯕꯥ ꯑꯁꯤꯅꯥ ꯑꯁꯣꯅꯕꯥ ꯑꯣꯏꯗꯕꯥ ꯑꯁꯤꯅꯥ ꯏꯀꯥꯌꯈꯨꯝꯅꯕꯥ ꯑꯣꯏꯅꯥ ꯂꯧꯔꯤ꯫"
he has surrendered his entire being to the Lord,ꯃꯍꯥꯛꯅꯥ ꯃꯍꯥꯛꯀꯤ ꯄꯨꯟꯁꯤ ꯃꯄꯨꯡ ꯐꯥꯅꯥ ꯏꯕꯨꯡꯉꯣꯗꯥ ꯁꯔꯦꯟꯗꯔ ꯇꯧꯈ꯭ꯔꯦ .
Arjuna Uvaacha:,ꯑꯔꯖꯨꯟ ꯎꯋꯥꯆ꯭ꯌꯥ:
Evam satatayuktaa ye bhaktaastwaam paryupaasate;,ꯏꯚꯥꯝ ꯁꯇꯥꯌꯛꯇꯥ ꯌꯦ ꯚꯀꯇꯥꯁ꯭ꯇꯋꯥꯝ ꯄꯥꯔꯤꯎꯄꯥꯁꯥꯇꯦ;
Ye chaapyaksharamavyaktam teshaam ke yogavittamaah,ꯌꯦ ꯆꯥꯌꯥꯄꯤꯀꯁꯥꯔꯥꯃꯕ꯭ꯌꯠꯇꯝ ꯇꯦꯁꯥꯝ ꯀꯦ ꯌꯣꯒꯥꯕꯤꯠꯇꯥꯃꯥꯍ
Arjuna said:,ꯑꯔꯖꯨꯟꯅꯥ ꯍꯥꯌꯈꯤ:
"1. Those devotees who, ever steadfast, thus worship Thee and those also who worship the","1. ꯚꯛꯇꯁꯤꯡ ꯑꯗꯨꯅꯥ, ꯃꯇꯝ ꯄꯨꯝꯅꯃꯛꯇꯥ ꯂꯦꯞꯄꯥ ꯂꯩꯇꯅꯥ, ꯑꯁꯨꯝꯅꯥ ꯅꯍꯥꯀꯄꯨ ꯈꯨꯔꯨꯃꯖꯔꯤ ꯑꯃꯁꯨꯡ ꯃꯈꯣꯌꯕꯨꯁꯨ ꯈꯨꯔꯨꯃꯖꯔꯤꯕꯁꯤꯡ ꯑꯗꯨꯕꯨꯁꯨ ꯈꯨꯔꯨꯃꯖꯔꯤꯕꯁꯤꯡ ꯑꯗꯨꯁꯨ꯫"
Imperishable and the Unmanifested—which of them are better versed in Yoga?,ꯏꯝꯄꯦꯔꯦꯁꯦꯕꯜ ꯑꯃꯁꯨꯡ ꯑꯅꯃꯅꯤꯐꯦꯁ꯭ꯠ ꯑꯣꯏꯕꯥ—ꯃꯈꯣꯌꯒꯤ ꯃꯅꯨꯡꯗꯥ ꯀꯅꯥꯅꯥ ꯌꯣꯒꯗꯥ ꯍꯦꯟꯅꯥ ꯍꯩꯊꯣꯏ-ꯁꯤꯡꯊꯣꯏꯕꯒꯦ?
COMMENTARY: The twelfth discourse indicates that Bhakti Yoga is much easier than,ꯀꯃꯦꯟꯇꯔꯤ: ꯇꯔꯦꯠꯁꯨꯕꯥ ꯗꯤꯁꯀꯣꯔꯁ ꯑꯁꯤꯅꯥ ꯇꯥꯛꯂꯤ ꯃꯗꯨꯗꯤ ꯚꯛꯇꯤ ꯌꯣꯒ ꯑꯁꯤ ꯌꯥꯝꯅꯥ ꯂꯥꯏꯅꯥ .
Jnana Yoga or the Yoga of knowledge,ꯖ꯭ꯅꯥꯟ ꯌꯣꯒ ꯅꯠꯔꯒꯥ ꯅꯣꯂꯦꯖꯒꯤ ꯌꯣꯒ
Sri Bhagavaan Uvaacha:,ꯁ꯭ꯔꯤ ꯚꯒꯕꯥꯟ ꯎꯋꯥꯆ꯭ꯌꯥ:
Mayyaaveshya mano ye maam nityayuktaa upaasate;,ꯃꯥꯌꯥꯌꯥꯕꯦꯁ꯭ꯌꯥ ꯃꯅꯣ ꯌꯦ ꯃꯥꯝ ꯅꯤꯇꯤꯌꯛꯇꯥ ꯎꯄꯥꯁꯦꯇꯦ;
Shraddhayaa parayopetaaste me yuktatamaa mataah,ꯁ꯭ꯔꯗ꯭ꯙꯌꯥꯌꯥ ꯄꯥꯔꯥꯌꯣꯄꯦꯇꯥꯁ꯭ꯇꯦ ꯃꯤ ꯌꯨꯛꯇꯥꯇꯥꯃꯥ ꯃꯥꯇꯥꯍ
The Blessed Lord said:,ꯊꯧꯖꯥꯜ ꯍꯩꯕꯥ ꯃꯄꯨꯅꯥ ꯍꯥꯌꯈꯤ:
"2. Those who, fixing their minds on Me, worship Me, ever steadfast and endowed with","2. ꯑꯩꯒꯤ ꯃꯊꯛꯇꯥ ꯃꯈꯣꯌꯒꯤ ꯋꯥꯈꯜ ꯆꯨꯃꯊꯣꯛꯇꯨꯅꯥ, ꯃꯇꯝ ꯄꯨꯝꯅꯃꯛꯇꯥ ꯂꯦꯞꯄꯥ ꯂꯩꯇꯅꯥ ꯑꯃꯁꯨꯡ ꯑꯦꯅꯗꯣꯎꯖ ꯇꯧꯔꯤꯕꯥ ꯃꯤꯑꯣꯏꯁꯤꯡ ꯑꯗꯨꯅꯥ ."
"supreme faith, these are the best in Yoga in My opinion","ꯁꯨꯞꯔꯤꯝ ꯐꯦꯏꯊ, ꯍꯥꯌꯔꯤꯕꯁꯤꯡ ꯑꯁꯤ ꯑꯩꯒꯤ ꯋꯥꯈꯜꯂꯣꯅꯗꯥ ꯌꯣꯒꯗꯥ ꯈ꯭ꯕꯥꯏꯗꯒꯤ ꯐꯕꯅꯤ"
Ye twaksharamanirdeshyamavyaktam paryupaasate;,ꯌꯦ ꯇ꯭ꯋꯥꯛꯁꯔꯥꯃꯥꯅꯤꯔꯗꯦꯁ꯭ꯊꯥꯃꯕꯌꯀꯇꯝ ꯄꯥꯔꯤꯎꯄꯥꯁꯥꯇꯦ;
Sarvatragamachintyam cha kootasthamachalam dhruvam,ꯁꯔꯚꯥꯠꯔꯥꯒꯥꯆꯤꯅꯠꯌꯝ ꯆꯥ ꯀꯨꯇꯥꯁ꯭ꯇꯊꯥꯃꯥꯆꯂꯝ ꯙꯨꯔꯨꯝ
"3. Those who worship the imperishable, the indefinable, the unmanifested, the omnipresent,","3. ꯏꯝꯄꯦꯔꯤꯁꯦꯕꯜ, ꯏꯅꯗꯦꯐꯥꯏꯅꯦꯕꯜ, ꯑꯅꯃꯅꯤꯐꯦꯁ꯭ꯠ, ꯑꯣꯃꯅꯤꯞꯔꯦꯖꯦꯟꯇ, ꯅꯤꯡꯖꯔꯤꯕꯥ ꯃꯤꯁꯤꯡ, ꯃꯤꯅꯝꯕꯥ ꯉꯥꯛꯇꯅꯤ,"
"the unthinkable, the eternal and the immovable,","ꯋꯥꯈꯜ ꯈꯟꯊꯕꯥ ꯉꯃꯗꯕꯥ, ꯂꯣꯝꯕꯥ ꯅꯥꯏꯗꯕꯥ ꯑꯃꯁꯨꯡ ꯏꯃꯃꯣꯕꯦꯕꯜ ꯑꯣꯏꯕꯥ, ."
Samniyamyendriyagraamam sarvatra samabuddhayah;,ꯁꯝꯅꯤꯌꯥꯃꯤꯌꯦꯅꯗ꯭ꯔꯤꯌꯥꯒ꯭ꯔꯥꯃꯝ ꯁꯔꯕꯠꯔ ꯁꯝꯕꯨꯗ꯭ꯙ꯭ꯌꯥꯍ;
Te praapnuvanti maameva sarvabhootahite rataah,ꯇꯦ ꯄ꯭ꯔꯄꯅꯨꯚꯥꯟꯇꯤ ꯃꯥꯃꯦꯚꯥ ꯁꯔꯚꯚꯨꯇꯥꯍꯤꯇꯦ ꯔꯇꯥꯍ
"4. Having restrained all the senses, even-minded everywhere, intent on the welfare of all","꯴.ꯃꯐꯝ ꯈꯨꯗꯤꯡꯃꯛꯇꯥ ꯐꯥꯑꯣꯕꯥ ꯋꯥꯈꯜ ꯋꯥꯕꯥ, ꯄꯨꯝꯅꯃꯛꯀꯤ ꯌꯥꯏꯐꯅꯕꯥ ꯋꯥꯈꯜ ꯊꯝꯂꯤꯕꯥ ꯏꯟꯗ꯭ꯔꯤ ꯄꯨꯝꯅꯃꯛ ꯊꯤꯡꯖꯤꯟꯗꯨꯅꯥ ꯊꯝꯕꯥ꯫"
beings—verily they also come unto Me,ꯖꯤꯕꯁꯤꯡ—ꯇꯁꯦꯡꯅꯥ ꯃꯈꯣꯌꯁꯨ ꯑꯩꯉꯣꯟꯗꯥ ꯂꯥꯀꯏ
Klesho’dhikatarasteshaam avyaktaasaktachetasaam;,ꯀ꯭ꯂꯦꯁꯣ’ꯙꯤꯀꯥꯇꯥꯔꯥꯁ꯭ꯇꯦꯁꯝ ꯑꯕ꯭ꯌꯀꯇꯥꯁꯛꯇꯥꯆꯦꯇꯥꯁꯝ;
Avyaktaa hi gatirduhkham dehavadbhiravaapyate,ꯑꯕ꯭ꯌꯛꯇꯥ ꯍꯤ ꯒꯇꯤꯔꯗꯨꯍꯈꯥꯝ ꯗꯦꯍꯕꯗ꯭ꯚꯗ꯭ꯕꯤꯔꯥꯚꯥꯑꯥꯄꯥꯌꯇꯦ
5. Greater is their trouble whose minds are set on the Unmanifested; for the goal—the,5. ꯍꯦꯟꯅꯥ ꯆꯥꯎꯕꯥ ꯃꯈꯣꯌꯒꯤ ꯑꯋꯥꯕꯥ ꯑꯁꯤ ꯃꯈꯣꯌꯒꯤ ꯋꯥꯈꯜ ꯑꯗꯨ ꯑꯅꯃꯅꯤꯐꯦꯁ꯭ꯠ ꯑꯣꯏꯕꯁꯤꯡꯗꯥ ꯂꯦꯞꯂꯤ;
Unmanifested—is very difficult for the embodied to reach,ꯑꯅꯃꯅꯤꯐꯦꯁ꯭ꯠ ꯑꯣꯏꯕꯥ—ꯃꯁꯤꯒꯤ ꯃꯅꯨꯡꯗꯥ ꯌꯥꯑꯣꯔꯤꯕꯥ ꯃꯤꯑꯣꯏꯁꯤꯡꯒꯤꯗꯃꯛꯇꯥ ꯌꯥꯝꯅꯥ ꯂꯨꯕꯥ ꯑꯃꯅꯤ
96,꯹꯶ .
THE YOGA OF DEVOTION,ꯚꯛꯇꯤꯒꯤ ꯌꯣꯒ .
COMMENTARY: The embodied—those who identify themselves with their bodies. The,ꯀꯃꯦꯟꯇꯔꯤ: ꯑꯦꯝꯕꯣꯗꯤꯗꯁꯤꯡ—ꯃꯈꯣꯌꯒꯤ ꯍꯀꯆꯥꯡꯒꯥ ꯃꯔꯤ ꯂꯩꯅꯕꯥ ꯃꯤꯑꯣꯏꯁꯤꯡ꯫
imperishable Self is very hard to reach for those who are attached to their bodies. Their restless,ꯏꯝꯄꯦꯔꯤꯁꯦꯕꯜ ꯁꯦꯜꯐ ꯑꯁꯤ ꯃꯈꯣꯌꯒꯤ ꯍꯀꯆꯥꯡꯒꯥ ꯁꯝꯅꯔꯤꯕꯥ ꯃꯤꯑꯣꯏꯁꯤꯡꯒꯤꯗꯃꯛ ꯌꯧꯕꯥ ꯌꯥꯝꯅꯥ ꯂꯨꯏ꯫
minds will not be able to get fixed on the attributeless Self,ꯋꯥꯈꯂꯁꯤꯡꯅꯥ ꯑꯦꯠꯔꯤꯕꯤꯎꯠꯂꯦꯁ ꯁꯦꯜꯐꯇꯥ ꯐꯤꯛꯁ ꯇꯧꯕꯥ ꯉꯃꯂꯣꯏ .
Ye tu sarvaani karmaani mayi sannyasya matparaah;,ꯌꯦ ꯇꯨ ꯁꯔꯕꯌꯥꯅꯤ ꯀꯔꯃꯥꯅꯤ ꯃꯌ ꯁꯟꯟꯌꯁꯌ ꯃꯠꯄꯥꯔꯥꯍ;
Ananyenaiva yogena maam dhyaayanta upaasate,ꯑꯅꯟꯌꯦꯅꯥꯏꯚꯥ ꯌꯣꯒꯦꯅꯥ ꯃꯥꯝ ꯙ꯭ꯌꯥꯌꯥꯌꯟꯇ ꯎꯄꯥꯁꯥꯇꯦ
"6. But to those who worship Me, renouncing all actions in Me, regarding Me as the supreme","6. ꯑꯗꯨꯕꯨ ꯑꯩꯕꯨ ꯅꯤꯡꯖꯔꯤꯕꯥ ꯃꯤꯁꯤꯡꯗꯥ, ꯑꯩꯒꯤ ꯃꯐꯃꯗꯥ ꯂꯩꯔꯤꯕꯥ ꯊꯕꯛ ꯈꯨꯗꯤꯡꯃꯛ ꯊꯥꯗꯣꯛꯇꯨꯅꯥ, ꯑꯩꯕꯨ ꯁꯨꯞꯔꯤꯝ ꯑꯣꯏꯅꯥ ꯂꯧꯔꯤ ."
"goal, meditating on Me with single-minded Yoga,","ꯄꯥꯟꯗꯝ, ꯋꯥꯈꯜ ꯑꯃꯈꯛꯇꯪ ꯌꯣꯒꯒꯥ ꯂꯣꯌꯅꯅꯥ ꯑꯩꯉꯣꯟꯗꯥ ꯙ꯭ꯌꯥꯟ ꯇꯧꯕꯥ,"
Teshaamaham samuddhartaa mrityusamsaarasaagaraat;,ꯇꯦꯁꯥꯃꯍꯝ ꯁꯃꯨꯗ꯭ꯙꯔꯇꯥ ꯃ꯭ꯔ꯭ꯏꯠꯁꯨꯁꯃꯁꯥꯔꯥꯁꯌꯥꯒꯔꯠ;
Bhavaami nachiraat paartha mayyaaveshitachetasaam,ꯚꯕꯃꯤ ꯅꯥꯆꯤꯔꯠ ꯄꯥꯔꯊꯥ ꯃꯌꯥꯌꯥꯕꯦꯁꯤꯇꯥꯆꯦꯇꯥꯁꯥꯝ
"7. To those whose minds are set on Me, O Arjuna, verily I become ere long the saviour out","꯷.ꯑꯩꯉꯣꯟꯗꯥ ꯋꯥꯈꯜ ꯊꯝꯂꯤꯕꯥ ꯃꯤꯑꯣꯏꯁꯤꯡꯒꯤ ꯃꯐꯃꯗꯥ, ꯑꯣ ꯑꯔꯖꯨꯅꯥ, ꯇꯁꯦꯡꯅꯥ ꯑꯩꯍꯥꯛ ꯏꯔꯦ ꯂꯣꯡ ꯗ ꯁꯦꯚꯤꯌꯔ ꯑꯥꯎꯠ ꯑꯣꯏꯔꯀꯏ"
