en,mni-Mtei
which we represent to ourselves the existence of things in the phenomenal,ꯃꯗꯨ ꯑꯩꯈꯣꯌꯅꯥ ꯑꯩꯈꯣꯌ ꯏꯁꯥꯅꯥ ꯏꯁꯥꯕꯨ ꯔꯤꯞꯔꯖꯦꯟꯇ ꯇꯧꯔꯤ ꯃꯗꯨꯗꯤ ꯄꯣꯠꯁꯤꯡ ꯑꯁꯤ ꯐꯤꯅꯣꯃꯦꯅꯦꯂꯗꯥ ꯂꯩꯔꯤ .
world,ꯃꯥꯂꯦꯝ
"[31] Persius, Satirae, iii.83-84","[31] ꯄꯥꯔꯁꯤꯌꯥꯁ, ꯁꯇꯤꯔꯦ, iii.83-84 ꯗꯥ ꯌꯥꯑꯣꯔꯤ꯫"
"The determinations of a substance, which are only particular modes of its","ꯄꯣꯠꯁꯛ ꯑꯃꯒꯤ ꯗꯤꯇꯔꯃꯤꯅꯦꯁꯅꯁꯤꯡ, ꯃꯈꯣꯌꯁꯤꯡ ꯑꯁꯤ ꯃꯁꯤꯒꯤ ꯑꯀꯛꯅꯕꯥ ꯃꯑꯣꯡ ꯈꯛꯇꯅꯤ꯫"
"existence, are called accidents. They are always real, because they concern","ꯂꯩꯔꯤꯕꯥ, ꯑꯦꯛꯁꯤꯗꯦꯟꯇ ꯍꯥꯌꯅꯥ ꯀꯧꯏ꯫"
"the existence of substance (negations are only determinations, which","ꯄꯕ꯭ꯂꯤꯀꯦꯁꯟ ꯂꯩꯕꯥ (ꯅꯦꯒꯦꯁꯅꯁꯤꯡ ꯑꯁꯤ ꯗꯤꯇꯔꯃꯤꯅꯦꯁꯟ ꯈꯛꯇꯅꯤ, ꯃꯈꯣꯌꯁꯤꯡ ꯑꯁꯤ ."
"express the non-existence of something in the substance). Now, if to this",ꯄꯣꯠꯁꯛ ꯑꯗꯨꯗꯥ ꯀꯔꯤꯒꯨꯝꯕꯥ ꯑꯃꯒꯤ ꯂꯩꯇꯕꯥ ꯑꯗꯨ ꯐꯣꯡꯗꯣꯀꯄꯥ)꯫
"real in the substance we ascribe a particular existence (for example, to","ꯔꯤꯑꯦꯂꯗꯥ ꯑꯩꯈꯣꯌꯅꯥ ꯑꯀꯛꯅꯕꯥ ꯍꯤꯡꯕꯒꯤ ꯃꯑꯣꯡ ꯑꯃꯥ (ꯈꯨꯗꯝ ꯑꯣꯏꯅꯥ, ꯲꯰꯲꯰ꯗꯥ)꯫"
"motion as an accident of matter), this existence is called inherence, in","ꯃꯣꯁꯟ ꯑꯦꯖ ꯑꯦ ꯑꯦꯛꯁꯤꯗꯦꯟꯇ ꯑꯣꯐ ꯃꯦꯇꯔ), ꯃꯁꯤꯒꯤ ꯑꯦꯛꯁꯦꯁꯤꯕꯤꯂꯤꯇꯤ ꯑꯁꯤ ꯏꯅꯍꯦꯔꯤꯟꯁ ꯍꯥꯌꯅꯥ ꯀꯧꯏ, ꯲꯰꯲꯰ꯗꯥ꯫"
"contradistinction to the existence of substance, which we call subsistence",ꯑꯩꯈꯣꯌꯅꯥ ꯁꯕꯁꯤꯗꯤꯁ ꯍꯥꯌꯅꯥ ꯀꯧꯔꯤꯕꯥ ꯄꯣꯠꯁꯛ ꯑꯃꯥ ꯂꯩꯕꯗꯥ ꯀꯟꯠꯔꯗꯤꯁ꯭ꯇꯤꯟꯁꯟ .
"But hence arise many misconceptions, and it would be a more accurate and","ꯑꯗꯨꯕꯨ ꯃꯔꯝ ꯑꯁꯤꯅꯥ ꯑꯔꯥꯅꯕꯥ ꯋꯥꯈꯜꯂꯣꯟ ꯀꯌꯥ ꯂꯥꯀꯏ, ꯑꯃꯁꯨꯡ ꯃꯁꯤ ꯍꯦꯟꯅꯥ ꯑꯆꯨꯝꯕꯥ ꯑꯃꯁꯨꯡ ."
just mode of expression to designate the accident only as the mode in which,ꯑꯦꯛꯁꯤꯗꯦꯟꯇ ꯑꯗꯨ ꯈꯛꯇꯃꯛ ꯃꯁꯛ ꯈꯪꯗꯣꯛꯅꯕꯥ ꯑꯦꯛꯁꯞꯔꯦꯁꯟ ꯃꯣꯗ ꯑꯣꯐ ꯑꯦꯛꯁꯞꯔꯦꯁꯟ ꯑꯁꯤ 2019ꯗꯥ ꯑꯣꯏꯒꯅꯤ꯫
"the existence of a substance is positively determined. Meanwhile, by reason",ꯄꯣꯠꯁꯛ ꯑꯃꯥ ꯂꯩꯕꯒꯤ ꯆꯥꯡ ꯑꯁꯤ ꯄꯣꯖꯤꯇꯤꯕ ꯑꯣꯏꯅꯥ ꯂꯦꯄꯊꯣꯀꯏ꯫
"of the conditions of the logical exercise of our understanding, it is","ꯑꯩꯈꯣꯌꯒꯤ ꯂꯧꯁꯤꯡꯒꯤ ꯂꯣꯖꯤꯀꯦꯜ ꯑꯦꯛꯁꯔꯁꯥꯏꯖꯒꯤ ꯀꯟꯗꯤꯁꯅꯁꯤꯡꯒꯤ ꯃꯇꯥꯡꯗꯥ, ꯃꯁꯤ ."
"impossible to avoid separating, as it were, that which in the existence of a","ꯍꯥꯌꯕꯗꯤ, ꯍꯥꯌꯕꯗꯤ, ꯍꯥꯌꯕꯗꯤ, ꯍꯥꯌꯕꯗꯤ ꯑꯦ-ꯑꯦꯁꯤꯕꯤꯂꯤꯇꯤꯗꯥ ꯑꯦꯁꯤꯁ꯭ꯇꯦꯟꯁꯇꯥ ꯇꯣꯈꯥꯏꯅꯥ ꯊꯝꯕꯥ ꯌꯥꯔꯣꯏ꯫"
"substance is subject to change, whilst the substance remains, and regarding","ꯄꯕ꯭ꯂꯤꯀꯦꯁꯟ ꯑꯁꯤ ꯍꯣꯡꯂꯛꯂꯤ, ꯑꯗꯨꯒꯥ ꯄꯣꯠꯁꯛ ꯑꯗꯨ ꯂꯩꯔꯤ, ꯑꯃꯁꯨꯡ ꯃꯁꯤꯒꯤ ꯃꯇꯥꯡꯗꯥ"
it in relation to that which is properly permanent and radical. On this,ꯃꯁꯤ ꯃꯑꯣꯡ ꯆꯨꯝꯅꯥ ꯄꯔꯃꯦꯅꯦꯟꯇ ꯑꯃꯁꯨꯡ ꯔꯦꯗꯤꯀꯦꯜ ꯑꯣꯏꯕꯥ ꯑꯗꯨꯒꯥ ꯃꯔꯤ ꯂꯩꯅꯅꯥ꯫
"account, this category of substance stands under the title of relation, rather","ꯑꯦꯀꯥꯎꯟꯇ, ꯁꯁ꯭ꯇꯦꯟꯁꯀꯤ ꯀꯦꯇꯦꯒꯣꯔꯤ ꯑꯁꯤ ꯔꯤꯂꯦꯁꯅꯁꯤꯄꯀꯤ ꯃꯤꯡꯊꯣꯂꯒꯤ ꯃꯈꯥꯗꯥ ꯂꯩ, ꯃꯗꯨꯒꯤ ꯃꯍꯨꯠꯇꯥ ."
because it is the condition thereof than because it contains in itself any,ꯃꯔꯃꯗꯤ ꯃꯁꯤꯒꯤ ꯀꯟꯗꯤꯁꯅꯅꯤ ꯍꯥꯌꯕꯁꯤꯗꯒꯤ ꯍꯦꯟꯅꯥ ꯃꯁꯤꯒꯤ ꯀꯟꯗꯤꯁꯅꯅꯤ .
relation,ꯃꯔꯤ ꯂꯩꯅꯕꯥ .
"Now, upon this notion of permanence rests the proper notion of the","ꯍꯧꯖꯤꯛ, ꯄꯔꯃꯥꯅꯦꯟꯁꯀꯤ ꯋꯥꯈꯜꯂꯣꯟ ꯑꯁꯤꯒꯤ ꯃꯇꯨꯡ ꯏꯟꯅꯥ ꯑꯦꯟ.ꯗꯤ.ꯑꯦ."
conception change. Origin and extinction are not changes of that which,ꯀꯟꯁꯦꯄꯁꯟ ꯍꯣꯡꯂꯀꯄꯥ꯫
"originates or becomes extinct. Change is but a mode of existence, which",ꯑꯣꯔꯤꯖꯤꯅꯦꯜ ꯅꯠꯠꯔꯒꯥ ꯑꯦꯛꯁꯇꯤꯅꯁꯟ ꯑꯣꯏꯔꯀꯏ꯫
follows on another mode of existence of the same object; hence all that,ꯆꯞ ꯃꯥꯟꯅꯕꯥ ꯄꯣꯠꯁꯛ ꯑꯃꯒꯤ ꯂꯩꯔꯤꯕꯥ ꯑꯇꯣꯞꯄꯥ ꯃꯑꯣꯡ ꯑꯃꯒꯤ ꯃꯇꯨꯡ ꯏꯟꯅꯥ ꯆꯠꯂꯤ;
"changes is permanent, and only the condition thereof changes. Now since","ꯑꯍꯣꯡꯕꯁꯤꯡ ꯑꯁꯤ ꯃꯇꯝ ꯆꯨꯞꯄꯒꯤ ꯑꯣꯏꯅꯥ ꯂꯩ, ꯑꯃꯁꯨꯡ ꯃꯁꯤꯒꯤ ꯐꯤꯚꯝ ꯑꯁꯤ ꯈꯛꯇꯃꯛ ꯍꯣꯡꯏ꯫"
"this mutation affects only determinations, which can have a beginning or an","ꯃꯁꯤꯒꯤ ꯃ꯭ꯌꯨꯇꯦꯁꯟ ꯑꯁꯤꯅꯥ ꯗꯤꯇꯔꯃꯤꯅꯦꯁꯟ ꯈꯛꯇꯗꯥ ꯑꯀꯥꯌꯕꯥ ꯄꯤꯔꯤ, ꯃꯗꯨꯗꯥ ꯍꯧꯔꯀꯐꯝ ꯑꯃꯥ ꯅꯠꯔꯒꯥ ꯑꯦ.ꯑꯦꯟ."
"end, we may say, employing an expression which seems somewhat","ꯂꯣꯏꯁꯤꯜꯂꯨ, ꯑꯩꯈꯣꯌꯅꯥ ꯍꯥꯌꯕꯥ ꯌꯥꯏ, ꯈꯔꯥ ꯈꯔꯥ ꯎꯕꯥ ꯉꯝꯕꯥ ꯑꯦꯛꯁꯞꯔꯦꯁꯟ ꯑꯃꯥ ꯁꯤꯖꯤꯟꯅꯗꯨꯅꯥ ."
paradoxical: “Only the permanent (substance) is subject to change; the,ꯄꯦꯔꯥꯗꯣꯛꯁꯤꯀꯦꯜ: “ꯄꯔꯃꯦꯅꯦꯟꯇ (ꯁꯕꯁ꯭ꯇꯦꯟꯁ) ꯈꯛꯇꯃꯛ ꯍꯣꯡꯕꯒꯤ ꯃꯈꯥ ꯄꯣꯜꯂꯤ;
"mutable suffers no change, but rather alternation, that is, when certain","ꯃ꯭ꯌꯨꯇꯦꯕꯂꯅꯥ ꯑꯍꯣꯡꯕꯥ ꯑꯃꯠꯇꯥ ꯃꯥꯌꯣꯛꯅꯗꯦ, ꯃꯗꯨꯒꯤ ꯃꯍꯨꯠꯇꯥ ꯑꯣꯜꯇꯔꯅꯦꯁꯟ, ꯍꯥꯌꯕꯗꯤ ꯑꯀꯛꯅꯕꯥ ꯃꯇꯃꯗꯥ"
"determinations cease, others begin.”","ꯗꯤꯇꯔꯃꯤꯅꯦꯁꯅꯁꯤꯡ ꯂꯣꯏꯔꯦ, ꯑꯇꯣꯞꯄꯁꯤꯡꯅꯥ ꯍꯧꯔꯀꯏ꯫”"
"Change, when, cannot be perceived by us except in substances, and","ꯍꯣꯡꯂꯛꯂꯤꯕꯥ, ꯃꯇꯝ ꯑꯗꯨꯗꯥ, ꯑꯩꯈꯣꯌꯅꯥ ꯄꯣꯠꯁꯀꯁꯤꯡꯗꯥ ꯅꯠꯇꯅꯥ ꯑꯩꯈꯣꯌꯅꯥ ꯈꯉꯕꯥ ꯉꯃꯗꯕꯥ, ꯑꯃꯁꯨꯡ ."
"origin or extinction in an absolute sense, that does not concern merely a","ꯑꯣꯔꯤꯖꯤꯟ ꯅꯠꯔꯒꯥ ꯑꯦꯛꯁꯇꯤꯅꯁꯟ ꯑꯁꯤ ꯑꯦꯕꯁꯣꯜꯌꯨꯇꯦꯗ ꯁꯦꯟꯁ ꯑꯃꯗꯥ, ꯃꯗꯨ ꯁꯨꯞꯅꯒꯤ ꯑꯦ."
"determination of the permanent, cannot be a possible perception, for it is","ꯄꯔꯃꯥꯅꯦꯟꯇ ꯑꯗꯨ ꯂꯦꯄꯊꯣꯀꯄꯥ, ꯑꯣꯏꯊꯣꯀꯄꯥ ꯌꯥꯕꯥ ꯋꯥꯈꯜꯂꯣꯟ ꯑꯃꯥ ꯑꯣꯏꯕꯥ ꯌꯥꯔꯣꯏ, ꯃꯔꯃꯗꯤ ꯃꯁꯤ"
this very notion of the permanent which renders possible the representation,ꯔꯤꯞꯔꯖꯦꯟꯇꯦꯁꯟ ꯑꯁꯤ ꯑꯣꯏꯊꯣꯀꯄꯥ ꯌꯥꯕꯥ ꯄꯤꯔꯤꯕꯥ ꯄꯔꯃꯥꯅꯦꯟꯇ ꯑꯁꯤꯒꯤ ꯌꯥꯝꯅꯥ ꯅꯣꯇꯤꯁ ꯑꯁꯤ .
"of a transition from one state into another, and from non-being to being,","ꯔꯥꯖ꯭ꯌ ꯑꯃꯗꯒꯤ ꯔꯥꯖ꯭ꯌ ꯑꯃꯗꯥ ꯇ꯭ꯔꯥꯟꯁꯤꯁꯟ ꯇꯧꯕꯥ, ꯑꯃꯁꯨꯡ ꯅꯟ-ꯕꯤꯌꯤꯡꯗꯥ ꯂꯩꯕꯥ,"
"which, consequently, can be empirically cognized only as alternating","ꯃꯗꯨ, ꯃꯔꯝ ꯑꯁꯤꯅꯥ, ꯑꯦꯝꯄꯤꯔꯤꯑꯦꯜ ꯑꯣꯏꯅꯥ ꯑꯣꯂꯇꯔꯅꯦꯇꯤꯕ ꯑꯣꯏꯅꯥ ꯈꯛꯇꯃꯛ ꯀꯣꯒꯅꯤꯖ ꯇꯧꯕꯥ ꯌꯥꯏ ."
determinations of that which is permanent. Grant that a thing absolutely,ꯃꯇꯝ ꯆꯨꯞꯄꯒꯤ ꯑꯣꯏꯅꯥ ꯂꯩꯔꯤꯕꯥ ꯑꯗꯨꯒꯤ ꯗꯤꯇꯔꯃꯤꯅꯦꯁꯅꯁꯤꯡ꯫
begins to be; we must then have a point of time in which it was not. But,ꯍꯧꯔꯀꯏ;
"how and by what can we fix and determine this point of time, unless by that","ꯃꯇꯧ ꯀꯔꯝꯅꯥ ꯑꯃꯁꯨꯡ ꯀꯔꯤꯅꯥ ꯑꯩꯈꯣꯌꯅꯥ ꯃꯇꯃꯒꯤ ꯄꯣꯏꯟꯇ ꯑꯁꯤ ꯐꯤꯛꯁ ꯇꯧꯕꯥ ꯑꯃꯁꯨꯡ ꯂꯦꯄꯊꯣꯀꯄꯥ ꯉꯃꯒꯅꯤ, ꯃꯗꯨꯒꯤ ꯃꯇꯨꯡ ꯏꯟꯅꯥ"
which already exists? For a void time—preceding—is not an object of,ꯍꯥꯟꯅꯗꯒꯤ ꯂꯩꯔꯛꯂꯕꯥ?
perception; but if we connect this beginning with objects which existed,ꯃꯤꯑꯣꯏ ꯑꯃꯒꯤ ꯃꯤꯠꯌꯦꯡ;
"previously, and which continue to exist till the object in question in question","ꯃꯃꯥꯡꯗꯥ, ꯑꯃꯁꯨꯡ ꯋꯥꯍꯪ ꯑꯣꯏꯅꯥ ꯂꯥꯀꯄꯥ ꯄꯣꯠꯁꯛ ꯑꯗꯨ ꯐꯥꯑꯣꯕꯥ ꯃꯈꯥ ꯇꯥꯅꯥ ꯂꯩꯔꯤ ."
"begins to be, then the latter can only be a determination of the former as the","ꯍꯧꯔꯀꯏ, ꯃꯗꯨꯒꯤ ꯃꯇꯨꯡꯗꯥ ꯇꯨꯡꯗꯥ ꯂꯥꯀꯄꯥ ꯑꯁꯤꯅꯥ ꯍꯥꯟꯅꯒꯤ ꯋꯥꯔꯦꯞ ꯑꯃꯥ ꯈꯛꯇꯃꯛ ꯑꯣꯏꯕꯥ ꯌꯥꯏ ."
"permanent. The same holds good of the notion of extinction, for this",ꯃꯇꯝ ꯆꯨꯞꯄꯒꯤ.
"presupposes the empirical representation of a time, in which a phenomenon","ꯃꯇꯝ ꯑꯃꯒꯤ ꯑꯦꯝꯄꯤꯔꯤꯀꯦꯜ ꯔꯤꯞꯔꯖꯦꯟꯇꯦꯁꯟ ꯑꯗꯨ ꯄ꯭ꯔꯤꯁꯄꯄꯁ ꯇꯧꯏ, ꯃꯗꯨꯗꯥ ꯐꯤꯚꯝ ꯑꯃꯥ ."
no longer exists,ꯍꯧꯖꯤꯛ ꯂꯩꯠꯔꯦ .
Substances (in the world of phenomena) are the substratum of all,ꯄꯣꯠꯁꯀꯁꯤꯡ (ꯐꯤꯅꯣꯃꯦꯅꯥꯒꯤ ꯃꯥꯂꯦꯃꯗꯥ) ꯑꯁꯤ ꯄꯨꯝꯅꯃꯛꯀꯤ ꯁꯕꯁ꯭ꯠꯔꯦꯇꯃꯅꯤ꯫
"determinations of time. The beginning of some, and the ceasing to be of",ꯃꯇꯃꯒꯤ ꯋꯥꯔꯦꯄꯁꯤꯡ ꯂꯧꯕꯥ꯫
"other substances, would utterly do away with the only condition of the","ꯑꯇꯣꯞꯄꯥ ꯄꯣꯠꯁꯀꯁꯤꯡ, ꯒꯤ ꯑꯃꯠꯇꯥ ꯉꯥꯏꯔꯕꯥ ꯀꯟꯗꯤꯁꯟ ꯑꯗꯨ ꯃꯄꯨꯡ ꯐꯥꯅꯥ ꯂꯣꯏꯁꯤꯅꯒꯅꯤ꯫"
empirical unity of time; and in that case phenomena would relate to two,ꯃꯇꯃꯒꯤ ꯑꯦꯝꯄꯤꯔꯤꯀꯦꯜ ꯌꯨꯅꯤꯇꯤ;
"different times, in which, side by side, existence would pass; which is","ꯇꯣꯉꯥꯟ ꯇꯣꯉꯥꯅꯕꯥ ꯃꯇꯃꯁꯤꯡ, ꯃꯗꯨꯗꯥ, ꯁꯥꯏꯗ ꯕꯥꯏ ꯁꯥꯏꯗ, ꯑꯦꯛꯁꯦꯁꯤꯕꯤꯂꯤꯇꯤ ꯑꯁꯤ ꯂꯣꯏꯒꯅꯤ;"
absurd. For there is only one time in which all different times must be,ꯃꯊꯣꯡ ꯍꯨꯛꯇꯕ.
"placed, not as coexistent, but as successive","ꯊꯃꯈꯤꯕꯥ, ꯀꯣ-ꯑꯦꯛꯁꯤꯁ꯭ꯇꯦꯟꯇ ꯑꯣꯏꯅꯥ ꯅꯠꯇꯅꯥ, ꯇꯨꯡꯗꯥ ꯂꯥꯀꯄꯥ ꯑꯣꯏꯅꯥ ."
"Accordingly, permanence is a necessary condition under which alone","ꯃꯁꯤꯒꯤ ꯃꯇꯨꯡ ꯏꯟꯅꯥ, ꯄꯔꯃꯥꯅꯦꯟꯁ ꯑꯁꯤ ꯃꯊꯧ ꯇꯥꯕꯥ ꯀꯟꯗꯤꯁꯟ ꯑꯃꯅꯤ ꯃꯗꯨꯒꯤ ꯃꯈꯥꯗꯥ ꯃꯁꯥ ꯃꯊꯟꯇꯥ ."
"phenomena, as things or objects, are determinable in a possible experience",ꯐꯤꯚꯃꯁꯤꯡ ꯅꯠꯠꯔꯒꯥ ꯄꯣꯠꯁꯤꯡ ꯑꯣꯏꯅꯥ ꯐꯤꯚꯃꯁꯤꯡ ꯑꯁꯤ ꯑꯣꯏꯊꯣꯀꯄꯥ ꯌꯥꯕꯥ ꯑꯦꯛꯁꯄꯔꯤꯌꯦꯟꯁ ꯑꯃꯗꯥ ꯂꯦꯄꯊꯣꯀꯄꯥ ꯌꯥꯏ .
"But as regards the empirical criterion of this necessary permanence, and","ꯑꯗꯨꯕꯨ ꯃꯊꯧ ꯇꯥꯕꯥ ꯄꯔꯃꯥꯅꯦꯟꯁ ꯑꯁꯤꯒꯤ ꯑꯦꯝꯄꯤꯔꯤꯀꯦꯜ ꯀ꯭ꯔꯥꯏꯇꯦꯔꯤꯌꯥꯒꯤ ꯃꯇꯥꯡꯗꯥ, ꯑꯃꯁꯨꯡ ."
"with it of the substantiality of phenomena, we shall find sufficient",ꯃꯁꯤꯒꯤ ꯃꯄꯨꯡ ꯑꯣꯏꯕꯥ ꯐꯤꯚꯃꯁꯤꯡꯒꯤ ꯃꯇꯥꯡꯗꯥ ꯑꯩꯈꯣꯌꯅꯥ ꯃꯇꯤꯛ ꯆꯥꯕꯥ .
opportunity to speak in the sequel,ꯁꯤꯛꯌꯨꯏꯂꯗꯥ ꯋꯥ ꯉꯥꯡꯕꯒꯤ ꯈꯨꯗꯣꯡꯆꯥꯕꯥ .
B. SECOND ANALOGY,ꯕꯤ.ꯒꯤ ꯑꯅꯤꯁꯨꯕꯥ ꯑꯦꯅꯥꯂꯣꯖꯤ
Principle of the Succession of Time According to the Law of Causality,ꯀꯥꯎꯖꯂꯤꯇꯤꯒꯤ ꯑꯥꯏꯅꯒꯤ ꯃꯇꯨꯡ ꯏꯟꯅꯥ ꯃꯇꯃꯒꯤ ꯃꯇꯨꯡ ꯏꯟꯅꯥ ꯆꯠꯅꯕꯒꯤ ꯄ꯭ꯔꯤꯟꯁꯤꯄꯜ .
All changes take place according to the law of the connection of Cause and,ꯑꯍꯣꯡꯕꯥ ꯄꯨꯝꯅꯃꯛ ꯑꯁꯤ ꯃꯔꯃꯒꯤ ꯀꯅꯦꯛꯁꯅꯒꯤ ꯑꯥꯏꯅꯒꯤ ꯃꯇꯨꯡ ꯏꯟꯅꯥ ꯄꯥꯡꯊꯣꯀꯏ ꯑꯃꯁꯨꯡ .
Effect,ꯆꯩꯊꯦꯡ
PROOF,ꯁꯥꯈꯤ
"(That all phenomena in the succession of time are only changes, that is, a","(ꯃꯗꯨꯒꯤ ꯃꯇꯨꯡꯗꯥ ꯂꯥꯀꯄꯥ ꯐꯤꯚꯝ ꯄꯨꯝꯅꯃꯛ ꯑꯁꯤ ꯑꯍꯣꯡꯕꯥ ꯈꯛꯇꯅꯤ, ꯍꯥꯌꯕꯗꯤ ꯑꯦ."
"successive being and non-being of the determinations of substance, which is","ꯁꯕ꯭ꯁꯇꯦꯟꯁꯀꯤ ꯗꯤꯇꯔꯃꯤꯅꯦꯁꯅꯁꯤꯡꯒꯤ ꯃꯇꯨꯡ ꯏꯟꯅꯥ ꯆꯠꯄꯥ ꯑꯃꯁꯨꯡ ꯅꯟ-ꯕꯤꯌꯤꯡ ꯇꯧꯕꯥ, ꯃꯗꯨꯗꯤ ."
permanent; consequently that a being of substance itself which follows on,ꯃꯇꯝ ꯆꯨꯞꯄꯒꯤ;
"the non-being thereof, or a non-being of substance which follows on the","ꯃꯁꯤꯒꯤ ꯅꯟ-ꯕꯤꯌꯤꯡ, ꯅꯠꯔꯒꯥ ꯃꯈꯥꯗꯥ ꯄꯤꯔꯤꯕꯥ ꯄꯣꯠꯁꯛ ꯑꯁꯤꯒꯤ ꯃꯇꯨꯡ ꯏꯟꯅꯥ ꯆꯠꯄꯥ ꯑꯁꯤ ."
"being thereof, in other words, that the origin or extinction of substance","ꯃꯗꯨꯒꯤ ꯃꯊꯛꯇꯥ ꯂꯩꯕꯥ, ꯑꯇꯣꯞꯄꯥ ꯋꯥꯍꯩ ꯑꯃꯗꯥ ꯍꯥꯌꯔꯕꯗꯥ, ꯄꯣꯠꯁꯛ ꯑꯗꯨꯒꯤ ꯍꯧꯔꯀꯐꯝ ꯅꯠꯔꯒꯥ ꯑꯦꯛꯁꯇꯤꯅꯁꯟ ꯑꯗꯨ ."
"itself, is impossible—all this has been fully established in treating of the","ꯃꯁꯥꯃꯛ, ꯑꯣꯏꯊꯣꯀꯄꯥ ꯉꯃꯗꯕꯥ ꯑꯃꯅꯤ—ꯃꯁꯤ ꯄꯨꯝꯅꯃꯛ ꯑꯁꯤ ꯂꯥꯌꯦꯡꯕꯗꯥ ꯃꯄꯨꯡ ꯐꯥꯅꯥ ꯂꯦꯄꯊꯣꯀꯈ꯭ꯔꯦ꯫"
foregoing principle. This principle might have been expressed as follows:,ꯃꯃꯥꯡꯒꯤ ꯄ꯭ꯔꯤꯟꯁꯤꯄꯜ꯫
“All alteration (succession) of phenomena is merely change”; for the,“ꯐꯤꯅꯒꯤ ꯑꯣꯂꯇꯔꯦꯁꯟ (ꯃꯥꯏꯄꯥꯀꯄꯥ) ꯄꯨꯝꯅꯃꯛ ꯑꯁꯤ ꯁꯨꯞꯅꯒꯤ ꯑꯍꯣꯡꯕꯥ ꯈꯛꯇꯅꯤ”;
"changes of substance are not origin or extinction, because the conception of","ꯁꯁ꯭ꯇꯦꯟꯁꯀꯤ ꯑꯍꯣꯡꯕꯁꯤꯡ ꯑꯁꯤ ꯑꯣꯔꯤꯖꯤꯟ ꯅꯠꯔꯒꯥ ꯑꯦꯛꯁꯇꯤꯅꯁꯟ ꯅꯠꯇꯦ, ꯃꯔꯃꯗꯤ ꯃꯁꯤꯒꯤ ꯀꯟꯁꯦꯄꯁꯟ ꯑꯁꯤ ."
change presupposes the same subject as existing with two opposite,ꯆꯦꯟꯖ ꯑꯁꯤꯅꯥ ꯑꯣꯄꯣꯖꯤꯇꯤꯕ ꯑꯅꯤꯒꯥ ꯂꯣꯌꯅꯅꯥ ꯂꯩꯔꯤꯕꯥ ꯑꯗꯨꯒꯥ ꯃꯥꯟꯅꯕꯥ ꯁꯕꯖꯦꯛꯇ ꯑꯗꯨ ꯄ꯭ꯔꯤꯁꯄꯄꯁꯔꯤ .
"determinations, and consequently as permanent. After this premonition, we","ꯗꯤꯇꯔꯃꯤꯅꯦꯁꯅꯁꯤꯡ, ꯑꯃꯁꯨꯡ ꯃꯗꯨꯒꯤ ꯃꯍꯩ ꯑꯣꯏꯅꯥ ꯄꯔꯃꯦꯅꯦꯟꯇ ꯑꯣꯏꯅꯥ꯫"
shall proceed to the proof.),ꯄ꯭ꯔꯨꯐ ꯑꯗꯨꯗꯥ ꯆꯪꯁꯤꯜꯂꯨ꯫)
"I perceive that phenomena succeed one another, that is to say, a state of","ꯑꯩꯅꯥ ꯈꯉꯏ ꯃꯗꯨꯗꯤ ꯐꯤꯚꯃꯁꯤꯡ ꯑꯁꯤ ꯑꯃꯒꯥ ꯑꯃꯒꯥ ꯃꯥꯌ ꯄꯥꯀꯏ, ꯍꯥꯌꯕꯗꯤ ꯔꯥꯖ꯭ꯌꯒꯤ ꯐꯤꯚꯝ ꯑꯃꯥ꯫"
"things exists at one time, the opposite of which existed in a former state. In","ꯃꯇꯝ ꯑꯃꯗꯥ ꯄꯣꯠꯁꯤꯡ ꯂꯩ, ꯃꯗꯨꯒꯤ ꯑꯣꯟꯅ-ꯇꯩꯅꯕꯥ ꯑꯗꯨ ꯍꯥꯟꯅꯒꯤ ꯔꯥꯖ꯭ꯌ ꯑꯃꯗꯥ ꯂꯩꯔꯝꯃꯤ꯫"
"this case, then, I really connect together two perceptions in time. Now",ꯑꯗꯨ ꯑꯣꯏꯔꯕꯗꯤ ꯀꯦꯁ ꯑꯁꯤ ꯑꯩꯍꯥꯛꯅꯥ ꯇꯁꯦꯡꯅꯥ ꯃꯇꯃꯒꯤ ꯃꯇꯨꯡ ꯏꯟꯅꯥ ꯋꯥꯈꯜꯂꯣꯟ ꯑꯅꯤ ꯄꯨꯟꯅꯥ ꯁꯝꯅꯍꯜꯂꯤ꯫
"connection is not an operation of mere sense and intuition, but is the","ꯀꯅꯦꯛꯁꯟ ꯑꯁꯤ ꯁꯨꯞꯅꯒꯤ ꯁꯦꯟꯁ ꯑꯃꯁꯨꯡ ꯏꯟꯠꯌꯨꯏꯇꯤꯖꯒꯤ ꯑꯣꯄꯔꯦꯁꯟ ꯅꯠꯇꯦ, ꯑꯗꯨꯕꯨ ꯃꯁꯤ ."
"product of a synthetical faculty of imagination, which determines the","ꯏꯃꯦꯖꯤꯅꯦꯁꯅꯒꯤ ꯁꯤꯟꯊꯦꯇꯤꯀꯜ ꯐꯦꯀꯜꯇꯤ ꯑꯃꯒꯤ ꯄꯣꯠꯊꯣꯛ, ꯃꯁꯤꯅꯥ ꯋꯥꯔꯦꯞ ꯂꯧꯔꯦ ꯫"
internal sense in respect of a relation of time. But imagination can connect,ꯃꯇꯃꯒꯤ ꯃꯔꯤ ꯑꯃꯒꯤ ꯃꯇꯥꯡꯗꯥ ꯏꯟꯇꯔꯅꯦꯜ ꯁꯦꯟꯁ꯫
"these two states in two ways, so that either the one or the other may","ꯍꯥꯌꯔꯤꯕꯥ ꯔꯥꯖ꯭ꯌ ꯑꯅꯤ ꯑꯁꯤꯅꯥ ꯃꯑꯣꯡ ꯑꯅꯤꯗꯥ, ꯃꯔꯝ ꯑꯗꯨꯅꯥ ꯑꯃꯅꯥ ꯅꯠꯠꯔꯒꯥ ꯑꯃꯅꯥ ."
"antecede in time; for time in itself cannot be an object of perception, and",ꯃꯇꯃꯒꯤ ꯃꯇꯨꯡ ꯏꯟꯅꯥ ꯑꯦꯟꯇꯦꯁꯦꯗꯦ;
what in an object precedes and what follows cannot be empirically,ꯄꯣꯠꯁꯛ ꯑꯃꯗꯥ ꯀꯔꯤ ꯄ꯭ꯔꯤꯁꯤꯖ ꯇꯧꯕꯒꯦ ꯑꯃꯁꯨꯡ ꯃꯈꯥꯗꯥ ꯄꯤꯔꯤꯕꯥ ꯑꯁꯤ ꯑꯦꯝꯄꯤꯔꯤꯑꯦꯜ ꯑꯣꯏꯅꯥ ꯑꯣꯏꯕꯥ ꯌꯥꯔꯣꯏ .
"determined in relation to it. I am only conscious, then, that my imagination",ꯃꯁꯤꯒꯥ ꯃꯔꯤ ꯂꯩꯅꯅꯥ ꯂꯦꯄꯊꯣꯀꯄꯥ꯫
places one state before and the other after; not that the one state antecedes,ꯔꯥꯖ꯭ꯌ ꯑꯃꯅꯥ ꯃꯃꯥꯡꯗꯥ ꯑꯃꯁꯨꯡ ꯑꯇꯣꯞꯄꯥ ꯑꯃꯅꯥ ꯃꯇꯨꯡꯗꯥ ꯊꯝꯂꯤ;
"the other in the object. In other words, the objective relation of the",ꯑꯇꯣꯞꯄꯥ ꯑꯃꯅꯥ ꯄꯣꯠꯁꯛ ꯑꯗꯨꯗꯥ ꯂꯩ꯫
successive phenomena remains quite undetermined by means of mere,ꯇꯨꯡꯗꯥ ꯂꯥꯛꯀꯗꯕꯥ ꯐꯤꯚꯃꯁꯤꯡ ꯑꯁꯤ ꯁꯨꯞꯅꯒꯤ ꯃꯤꯠꯌꯦꯡ ꯆꯪꯗꯅꯥ ꯌꯥꯝꯅꯥ ꯂꯦꯞꯄꯥ ꯂꯩꯇꯅꯥ ꯂꯦꯞꯂꯤ꯫
"perception. Now in order that this relation may be cognized as determined,",ꯃꯤꯑꯣꯏ ꯑꯃꯒꯤ ꯃꯤꯠꯌꯦꯡ.
the relation between the two states must be so cogitated that it is thereby,ꯔꯥꯖ꯭ꯌ ꯑꯅꯤ ꯑꯁꯤꯒꯤ ꯃꯔꯛꯇꯥ ꯂꯩꯔꯤꯕꯥ ꯃꯔꯤ ꯑꯁꯤ ꯑꯁꯨꯛ ꯌꯥꯝꯅꯥ ꯀꯣꯖꯤꯇꯦꯗ ꯑꯣꯏꯒꯗꯕꯅꯤ ꯃꯗꯨꯗꯤ ꯃꯁꯤꯅꯥ ꯃꯔꯝ ꯑꯣꯏꯗꯨꯅꯥ [...]
"determined as necessary, which of them must be placed before and which","ꯃꯊꯧ ꯇꯥꯕꯒꯤ ꯃꯇꯨꯡ ꯏꯟꯅꯥ ꯂꯦꯄꯊꯣꯀꯄꯥ, ꯃꯈꯣꯌꯒꯤ ꯃꯅꯨꯡꯗꯥ ꯀꯔꯝꯕꯥ ꯑꯃꯅꯥ ꯃꯃꯥꯡꯗꯥ ꯊꯃꯒꯗꯒꯦ ꯑꯃꯁꯨꯡ ꯀꯅꯥꯕꯨ ."
"after, and not conversely. But the conception which carries with it a","ꯃꯇꯨꯡꯗꯥ, ꯑꯃꯁꯨꯡ ꯃꯗꯨꯒꯤ ꯃꯇꯨꯡ ꯏꯟꯅꯥ ꯅꯠꯇꯦ꯫"
"necessity of synthetical unity, can be none other than a pure conception of","ꯁꯤꯟꯊꯦꯇꯤꯀꯜ ꯌꯨꯅꯤꯇꯤꯒꯤ ꯇꯉꯥꯏꯐꯗꯕꯥ, ꯲꯰꯲꯰ꯒꯤ ꯄ꯭ꯌꯨꯔ ꯀꯟꯁꯦꯄꯁꯟ ꯅꯠꯇꯕꯥ ꯑꯇꯣꯞꯄꯥ ꯑꯃꯠꯇꯥ ꯑꯣꯏꯕꯥ ꯌꯥꯔꯣꯏ꯫"
the understanding which does not lie in mere perception; and in this case it,ꯁꯨꯞꯅꯒꯤ ꯋꯥꯈꯜ ꯈꯅꯕꯥ ꯉꯃꯗꯕꯥ ꯋꯥꯈꯜꯂꯣꯟ ꯑꯗꯨ;
"is the conception of “the relation of cause and effect,” the former of which","ꯑꯁꯤ “ꯃꯔꯝ ꯑꯃꯁꯨꯡ ꯏꯐꯦꯛꯇꯀꯤ ꯃꯔꯤ” ꯍꯥꯌꯕꯁꯤꯒꯤ ꯋꯥꯈꯜꯂꯣꯟ ꯑꯁꯤꯅꯤ, ꯃꯁꯤꯒꯤ ꯃꯅꯨꯡꯗꯥ ꯍꯥꯟꯅꯒꯤ ."
"determines the latter in time, as its necessary consequence, and not as","ꯇꯨꯡꯗꯥ ꯂꯥꯀꯄꯥ ꯑꯁꯤ ꯃꯇꯃꯒꯤ ꯃꯇꯨꯡ ꯏꯟꯅꯥ ꯂꯦꯄꯊꯣꯀꯏ, ꯃꯁꯤꯒꯤ ꯃꯊꯧ ꯇꯥꯕꯥ ꯐꯜ ꯑꯣꯏꯅꯥ, ꯑꯃꯁꯨꯡ ꯃꯗꯨꯒꯨꯝꯅꯥ ꯅꯠꯇꯦ꯫"
something which might possibly antecede (or which might in some cases,ꯑꯦꯟꯇꯤꯁꯦꯗꯦ (ꯅꯠꯔꯒꯥ ꯀꯦꯁ ꯈꯔꯗꯥ) ꯑꯣꯏꯕꯥ ꯌꯥꯕꯥ ꯋꯥꯐꯝ ꯑꯃꯥ
not be perceived to follow). It follows that it is only because we subject the,ꯇꯨꯡ ꯏꯟꯅꯕꯥ ꯂꯧꯁꯤꯅꯕꯥ ꯌꯥꯗꯕꯥ)꯫
"sequence of phenomena, and consequently all change, to the law of","ꯐꯤꯚꯃꯁꯤꯡꯒꯤ ꯁꯤꯛꯕꯦꯟꯁ, ꯑꯃꯁꯨꯡ ꯃꯁꯤꯒꯤ ꯃꯍꯩ ꯑꯣꯏꯅꯥ ꯄꯨꯝꯅꯃꯛ ꯍꯣꯡꯏ, ꯃꯁꯤꯒꯤ ꯑꯥꯏꯅꯗꯥ ."
"causality, that experience itself, that is, empirical cognition of phenomena,","causality, that experience ꯃꯁꯥꯃꯛ, ꯍꯥꯌꯕꯗꯤ ꯐꯦꯅꯣꯃꯦꯅꯥꯒꯤ ꯑꯦꯝꯄꯤꯔꯤꯀꯦꯜ ꯀꯣꯒꯅꯤꯁꯟ,"
"becomes possible; and consequently, that phenomena themselves, as objects",ꯑꯣꯏꯊꯣꯀꯄꯥ ꯌꯥꯕꯥ ꯑꯣꯏꯔꯀꯏ;
"of experience, are possible only by virtue of this law","of experience, ꯑꯁꯤ ꯑꯥꯏꯟ ꯑꯁꯤꯒꯤ ꯃꯇꯨꯡ ꯏꯟꯅꯥ ꯈꯛꯇꯃꯛ ꯑꯣꯏꯊꯣꯀꯄꯥ ꯌꯥꯏ ."
Our apprehension of the manifold of phenomena is always successive,ꯐꯤꯚꯃꯁꯤꯡꯒꯤ ꯃꯈꯜ ꯀꯌꯥꯒꯤ ꯑꯩꯈꯣꯌꯒꯤ ꯑꯀꯤꯕꯥ ꯑꯁꯤ ꯃꯇꯝ ꯄꯨꯝꯅꯃꯛꯇꯥ ꯇꯨꯡꯗꯥ ꯂꯥꯀꯄꯥ ꯌꯥꯏ .
The representations of parts succeed one another. Whether they succeed one,ꯁꯔꯨꯀꯁꯤꯡꯒꯤ ꯔꯤꯞꯔꯖꯦꯟꯇꯦꯁꯅꯁꯤꯡ ꯑꯁꯤ ꯑꯃꯒꯥ ꯑꯃꯒꯥ ꯃꯥꯏ ꯄꯥꯀꯏ꯫
"another in the object also, is a second point for reflection, which was not","ꯄꯣꯠꯁꯛ ꯑꯗꯨꯒꯤꯁꯨ ꯑꯇꯣꯞꯄꯥ ꯑꯃꯅꯥ, ꯔꯤꯐ꯭ꯂꯦꯛꯁꯅꯒꯤ ꯑꯅꯤꯁꯨꯕꯥ ꯄꯣꯏꯟꯇꯅꯤ, ꯃꯗꯨ ."
contained in the former. Now we may certainly give the name of object to,ꯍꯥꯟꯅꯒꯤ ꯃꯑꯣꯡꯗꯥ ꯌꯥꯑꯣꯔꯤ꯫
"everything, even to every representation, so far as we are conscious thereof;","ꯄꯨꯝꯅꯃꯛ, ꯔꯤꯞꯔꯖꯦꯟꯇꯦꯁꯟ ꯈꯨꯗꯤꯡꯃꯛꯇꯥ ꯐꯥꯑꯣꯕꯥ, ꯑꯩꯈꯣꯌꯅꯥ ꯃꯗꯨꯒꯤ ꯃꯔꯃꯗꯥ ꯈꯉꯕꯥ ꯐꯥꯑꯣꯕꯥ;"
"but what this word may mean in the case of phenomena, not merely in so","ꯑꯗꯨꯕꯨ ꯋꯥꯍꯩ ꯑꯁꯤꯅꯥ ꯐꯤꯚꯃꯁꯤꯡꯒꯤ ꯃꯇꯥꯡꯗꯥ ꯀꯔꯤ ꯍꯥꯌꯕꯥ ꯉꯃꯒꯅꯤ, ꯁꯨꯞꯅꯇꯒꯤ ꯑꯦꯁ.ꯑꯣ."
"far as they (as representations) are objects, but only in so far as they","ꯃꯈꯣꯌꯅꯥ (ꯔꯤꯞꯔꯦꯖꯦꯟꯇꯦꯁꯟ ꯑꯣꯏꯅꯥ) ꯄꯣꯠꯁꯤꯡꯅꯤ, ꯑꯗꯨꯕꯨ ꯃꯈꯣꯌ ꯑꯁꯤ ꯑꯁꯨꯛ ꯌꯥꯝꯅꯥ ꯂꯥꯞꯅꯥ ꯂꯩꯕꯈꯛꯇꯅꯤ꯫"
"indicate an object, is a question requiring deeper consideration. In so far as","ꯄꯣꯠꯁꯛ ꯑꯃꯥ ꯇꯥꯀꯄꯥ, ꯍꯥꯌꯕꯁꯤ ꯍꯦꯟꯅꯥ ꯂꯨꯝꯅꯥ ꯂꯧꯕꯥ ꯋꯥꯍꯪ ꯑꯃꯅꯤ꯫"
"they, regarded merely as representations, are at the same time objects of","ꯃꯈꯣꯌꯁꯤꯡ ꯑꯁꯤ, ꯁꯨꯞꯅꯒꯤ ꯔꯤꯞꯔꯖꯦꯟꯇꯦꯁꯟ ꯑꯣꯏꯅꯥ ꯂꯧꯔꯒꯥ, ꯃꯇꯝ ꯑꯗꯨꯃꯛꯇꯗꯥ ꯑꯣꯕꯖꯦꯛꯇꯁꯤꯡ ꯑꯁꯤ ."
"consciousness, they are not to be distinguished from apprehension, that is,","ꯀꯟꯁꯇꯤꯠꯌꯨꯁꯟ, ꯃꯈꯣꯌꯁꯤꯡ ꯑꯁꯤ ꯑꯦꯞꯔꯦꯟꯇꯤꯖꯅꯗꯒꯤ ꯈꯦꯠꯅꯕꯥ ꯊꯃꯒꯗꯕꯅꯤ, ꯍꯥꯌꯕꯗꯤ ."
"reception into the synthesis of imagination, and we must therefore say:","ꯏꯃꯦꯖꯤꯅꯦꯁꯅꯒꯤ ꯁꯤꯟꯊꯦꯁꯤꯁꯇꯥ ꯔꯤꯁꯦꯄꯁꯟ ꯇꯧꯕꯥ, ꯑꯃꯁꯨꯡ ꯃꯔꯝ ꯑꯁꯤꯅꯥ ꯑꯩꯈꯣꯌꯅꯥ ꯍꯥꯌꯒꯗꯕꯗꯤ:"
“The manifold of phenomena is always produced successively in the mind.”,“ꯐꯤꯅꯒꯤ ꯃꯈꯜ ꯑꯁꯤ ꯃꯇꯝ ꯄꯨꯝꯅꯃꯛꯇꯥ ꯋꯥꯈꯂꯗꯥ ꯊꯪꯟ-ꯊꯪꯅꯅꯥ ꯄꯨꯊꯣꯀꯏ꯫”
"If phenomena were things in themselves, no man would be able to",ꯀꯔꯤꯒꯨꯝꯕꯥ ꯐꯤꯚꯃꯁꯤꯡ ꯑꯁꯤ ꯃꯁꯥ ꯃꯊꯟꯇꯥ ꯄꯣꯠꯁꯤꯡ ꯑꯣꯏꯔꯝꯂꯕꯗꯤ ꯃꯤꯑꯣꯏ ꯑꯃꯠꯇꯅꯥ .
conjecture from the succession of our representations how this manifold is,ꯑꯩꯈꯣꯌꯒꯤ ꯔꯤꯞꯔꯖꯦꯟꯇꯦꯁꯅꯁꯤꯡꯒꯤ ꯃꯇꯨꯡ ꯏꯟꯅꯥ ꯃꯁꯤꯒꯤ ꯃꯦꯅꯤꯐꯣꯜꯗ ꯑꯁꯤ ꯀꯔꯝꯅꯥ ꯑꯣꯏꯕꯒꯦ ꯍꯥꯌꯕꯗꯨ ꯀꯟꯖꯦꯛꯁꯟ .
connected in the object; for we have to do only with our representations,ꯄꯣꯠꯁꯛ ꯑꯗꯨꯗꯥ ꯁꯝꯅꯍꯅꯕꯥ;
"How things may be in themselves, without regard to the representations","ꯃꯇꯧ ꯀꯔꯝꯅꯥ ꯋꯥꯐꯃꯁꯤꯡ ꯑꯁꯤ ꯃꯁꯥ ꯃꯊꯟꯇꯥ ꯂꯩꯒꯗꯒꯦ, ꯔꯤꯞꯔꯖꯦꯟꯇꯦꯁꯅꯁꯤꯡ ꯑꯗꯨ ꯌꯦꯡꯗꯅꯥ ."
"through which they affect us, is utterly beyond the sphere of our cognition","ꯃꯈꯣꯌꯅꯥ ꯑꯩꯈꯣꯌꯗꯥ ꯁꯣꯀꯍꯜꯂꯤꯕꯥ ꯑꯁꯤꯒꯤ ꯈꯨꯠꯊꯥꯡꯗꯥ, ꯑꯩꯈꯣꯌꯒꯤ ꯀꯣꯒꯅꯤꯁꯅꯒꯤ ꯂꯃꯗꯥ ꯃꯄꯨꯡ ꯐꯥꯅꯥ ꯃꯄꯥꯟꯗꯥ ꯂꯩꯔꯤ ."
"Now although phenomena are not things in themselves, and are","ꯍꯧꯖꯤꯛ ꯐꯤꯚꯝ ꯑꯁꯤ ꯃꯁꯥ ꯃꯊꯟꯇꯥ ꯄꯣꯠꯁꯤꯡ ꯑꯣꯏꯗ꯭ꯔꯕꯁꯨ, ꯑꯃꯁꯨꯡ ."
