en,mni-Mtei
connection between the muscles that move the eyes and nerve impulses,ꯃꯤꯠ ꯑꯃꯁꯨꯡ ꯅꯔꯚꯀꯤ ꯏꯝꯄꯂꯁꯁꯤꯡ ꯂꯧꯊꯣꯀꯄꯥ ꯃꯁꯂꯁꯤꯡꯒꯤ ꯃꯔꯛꯇꯥ ꯂꯩꯕꯥ ꯀꯅꯦꯛꯁꯟ
PED121,ꯄꯤ.ꯏ.ꯗꯤ.꯱꯲꯱ ꯑꯃꯁꯨꯡ ꯑꯦꯟ.
CHILDHOOD AND ADOLESCENT PSYCHOLOGY,ꯑꯉꯥꯡ ꯑꯣꯏꯔꯤꯉꯩ ꯑꯃꯁꯨꯡ ꯏꯅꯈꯠꯂꯛꯂꯤꯕꯥ ꯁꯥꯏꯀꯣꯂꯣꯖꯤ
50,꯵꯰ ꯑꯃꯁꯨꯡ ꯵꯰꯫
"in the brain. By four weeks of age, an infant can follow a dangling object",ꯕ꯭ꯔꯦꯅꯗꯥ ꯂꯩ꯫
"with its eyes. At four months, the same baby can simultaneously hold and",ꯃꯁꯤꯒꯤ ꯃꯤꯠꯌꯦꯡꯒꯥ ꯂꯣꯌꯅꯅꯥ꯫
look at a rattle. This means that the eyes and the hands are doing,ꯔꯦꯠ ꯑꯃꯥ ꯌꯦꯡꯎ꯫
teamwork. Motor development therefore describes more effective control,ꯇꯤꯃꯋꯥꯔꯛ ꯇꯧꯕꯥ꯫
and coordination of body organs and systems. Researches categorise,ꯑꯃꯁꯨꯡ ꯕꯣꯗꯤ ꯑꯣꯔꯒꯥꯟ ꯑꯃꯁꯨꯡ ꯁꯤꯁ꯭ꯇꯦꯃꯁꯤꯡꯒꯤ ꯀꯣꯑꯣꯔꯗꯤꯅꯦꯁꯟ ꯇꯧꯕꯥ꯫
"motor development into three areas: postural control, ability to stand","ꯃꯣꯇꯣꯔ ꯗꯤꯚꯦꯂꯄꯃꯦꯟꯇ ꯑꯁꯤ ꯃꯐꯝ ꯑꯍꯨꯃꯗꯥ ꯄꯤꯕꯥ: ꯄꯣꯁ꯭ꯠꯌꯨꯔꯦꯜ ꯀꯟꯠꯔꯣꯜ, ꯂꯦꯞꯄꯥ ꯉꯝꯕꯥ"
"upright; locomotive control, ability to move around; and manual control,",ꯑꯞꯄꯔꯥꯏꯠ ꯑꯣꯏꯕꯥ;
"ability to manipulate objects (Keogh, and Sugden, 1985)","ꯄꯣꯠꯁꯀꯁꯤꯡ ꯃꯦꯅꯤꯄꯨꯂꯦꯠ ꯇꯧꯕꯥ ꯉꯝꯕꯥ (ꯀꯦꯑꯣꯒ, ꯑꯃꯁꯨꯡ ꯁꯨꯒꯗꯦꯟ, ꯱꯹꯸꯵)"
1.3.2 Trends in Physical Growth and Motor Development,꯱.꯳.꯲ ꯐꯤꯖꯤꯀꯦꯜ ꯒ꯭ꯔꯣꯊ ꯑꯃꯁꯨꯡ ꯃꯣꯇꯣꯔ ꯗꯤꯕꯦꯂꯄꯃꯦꯟꯇꯀꯤ ꯇ꯭ꯔꯦꯟꯗꯁꯤꯡ
We shall discuss the trends in physical growth and motor development,ꯑꯩꯈꯣꯌꯅꯥ ꯐꯤꯖꯤꯀꯦꯜ ꯒ꯭ꯔꯣꯊ ꯑꯃꯁꯨꯡ ꯃꯣꯇꯣꯔ ꯗꯤꯕꯦꯂꯄꯃꯦꯟꯇꯀꯤ ꯇ꯭ꯔꯦꯟꯗꯁꯤꯡꯒꯤ ꯃꯇꯥꯡꯗꯥ ꯈꯟꯅꯒꯅꯤ ꯫
under the following sub-topics,ꯃꯈꯥꯗꯥ ꯄꯤꯔꯤꯕꯥ ꯁꯕ-ꯇꯣꯄꯤꯀꯁꯤꯡ ꯑꯁꯤꯒꯤ ꯃꯈꯥꯗꯥ .
1.3.3     Physical Growth,꯱.꯳.꯳ ꯍꯀꯆꯥꯡ ꯆꯥꯎꯈꯠꯄꯥ .
"Physical growth follows a predictable pattern. That is, growth obeys",ꯐꯤꯖꯤꯀꯦꯜ ꯒ꯭ꯔꯣꯊ ꯑꯁꯤ ꯊꯥꯖꯕꯥ ꯌꯥꯕꯥ ꯃꯑꯣꯡ ꯑꯃꯒꯤ ꯃꯇꯨꯡ ꯏꯟꯅꯥ ꯆꯠꯂꯤ꯫
two developmental principles. These principles of development are:,ꯗꯤꯕꯦꯂꯄꯃꯦꯟꯇ ꯄ꯭ꯔꯤꯟꯁꯤꯄꯜ ꯑꯅꯤ꯫
"cephalocaudal principle, and proximodistal principle","ꯁꯦꯐꯥꯂꯣꯀꯣꯗꯜ ꯄ꯭ꯔꯤꯟꯁꯤꯄꯜ, ꯑꯃꯁꯨꯡ ꯄ꯭ꯔꯣꯛꯁꯤꯃꯣꯗꯤꯁ꯭ꯇꯦꯜ ꯄ꯭ꯔꯤꯟꯁꯤꯄꯜ"
The cephalocaudal principle states that growth and development proceed,ꯁꯦꯐꯥꯂꯣꯀꯣꯗꯜ ꯄ꯭ꯔꯤꯟꯁꯤꯄꯂꯅꯥ ꯍꯥꯌꯔꯤ ꯃꯗꯨꯗꯤ ꯒ꯭ꯔꯣꯊ ꯑꯃꯁꯨꯡ ꯗꯤꯕꯦꯂꯄꯃꯦꯟꯇ ꯄ꯭ꯔꯣꯁꯤꯗ꯭ꯌꯨꯔ .
from head (cephalo) and move downwards to the feet (candal for tail),ꯃꯀꯣꯛ (Cephalo)ꯗꯒꯤ ꯃꯈꯥ ꯊꯪꯕꯥ ꯁꯔꯨꯛꯇꯥ (cantand for tail) ꯐꯥꯎꯕꯥ ꯃꯈꯥ ꯊꯪꯕꯥ ꯃꯐꯃꯗꯥ ꯆꯠꯂꯨ꯫
This is why the head of a new-born is bigger and heavier than the rest of,ꯃꯁꯤꯅꯥ ꯃꯔꯝ ꯑꯣꯏꯗꯨꯅꯥ ꯑꯅꯧꯕꯥ ꯄꯣꯀꯄꯥ ꯃꯤꯑꯣꯏ ꯑꯃꯒꯤ ꯃꯀꯣꯛ ꯑꯁꯤ ꯑꯇꯣꯞꯄꯥ .
"the body. All the human brain cells are there at birth. After birth, the",ꯍꯀꯆꯥꯡ ꯑꯗꯨ꯫
brain cells do not divide further or regenerate,ꯕ꯭ꯔꯦꯟ ꯁꯦꯂꯁꯤꯡ ꯑꯁꯤ ꯃꯈꯥ ꯇꯥꯅꯥ ꯈꯥꯌꯗꯣꯀꯄꯥ ꯅꯠꯠꯔꯒꯥ ꯔꯤꯖꯦꯅꯦꯔꯦꯠ ꯇꯧꯕꯥ ꯉꯃꯗꯦ꯫
The proximodistal principle states that growth and development proceed,ꯄ꯭ꯔꯣꯛꯁꯤꯃꯣꯗꯤꯁ꯭ꯇꯦꯜ ꯄ꯭ꯔꯤꯟꯁꯤꯄꯂꯅꯥ ꯍꯥꯌꯔꯤ ꯃꯗꯨꯗꯤ ꯒ꯭ꯔꯣꯊ ꯑꯃꯁꯨꯡ ꯗꯤꯕꯦꯂꯄꯃꯦꯟꯇꯅꯥ ꯃꯈꯥ ꯆꯠꯊꯔꯤ .
from the centre of the body and move outward to the periphery or the,ꯍꯀꯆꯥꯡꯒꯤ ꯁꯦꯟꯇꯔꯗꯒꯤ ꯑꯃꯁꯨꯡ ꯃꯄꯥꯟꯗꯥ ꯆꯠꯄꯥ ꯄꯦꯔꯤꯐꯦꯔꯦꯜ ꯅꯠꯠꯔꯒꯥ .
outermost parts of the body. The major internal organs of the body – the,ꯍꯀꯆꯥꯡꯒꯤ ꯃꯄꯥꯟꯊꯪꯕꯥ ꯁꯔꯨꯀꯁꯤꯡ꯫
"lungs, the heart, the liver are complete and functional at birth. They","ꯂꯪꯁ, ꯍꯥꯔꯠ, ꯂꯤꯚꯔ ꯑꯁꯤ ꯄꯣꯀꯄꯗꯥ ꯃꯄꯨꯡꯐꯥꯅꯥ ꯑꯃꯁꯨꯡ ꯐꯉ꯭ꯀꯁꯅꯦꯜ ꯑꯣꯏ꯫"
show very slight increases after birth. The arms and legs continue to,ꯄꯣꯀꯄꯒꯤ ꯃꯇꯨꯡꯗꯥ ꯌꯥꯝꯅꯥ ꯍꯟꯊꯔꯀꯄꯥ ꯎꯠꯄꯥ꯫
increase until late adolescence,ꯂꯦꯡ-ꯑꯣꯠꯄꯗꯥ ꯏꯅꯈꯠꯂꯀꯄꯥ ꯐꯥꯎꯕꯥ ꯍꯦꯅꯒꯠꯍꯅꯒꯗꯕꯅꯤ꯫
Physical growth is more rapid in the first year of a child’s life. According,ꯑꯉꯥꯡ ꯑꯃꯒꯤ ꯄꯨꯟꯁꯤꯒꯤ ꯑꯍꯥꯅꯕꯥ ꯆꯍꯤꯗꯥ ꯐꯤꯖꯤꯀꯦꯜ ꯒ꯭ꯔꯣꯊ ꯑꯁꯤ ꯍꯦꯟꯅꯥ ꯌꯥꯡꯅꯥ ꯆꯠꯂꯤ꯫
"to Durojaiye (1976), the average birth weight of the African child is 2.5","ꯗꯨꯔꯣꯖꯥꯏꯌꯦ (1976)ꯗꯥ, ꯑꯐ꯭ꯔꯤꯀꯥꯒꯤ ꯑꯉꯥꯡ ꯑꯗꯨꯒꯤ ꯆꯥꯡꯆꯠꯇꯥ ꯄꯣꯀꯄꯒꯤ ꯑꯔꯨꯝꯕꯥ ꯑꯁꯤ 2.5ꯅꯤ꯫"
"kg; and the average height is 0.5m.   By the end of the first year of life,",ꯀꯦ.ꯖꯤ.ꯗꯥ ꯂꯩꯕꯥ;
the average weight would have reached 7.5 kg (3 times) while the average,ꯆꯥꯡꯆꯠꯇꯥ ꯑꯣꯏꯕꯥ ꯑꯔꯨꯝꯕꯥ ꯑꯁꯤ ꯀꯤꯂꯣꯒ꯭ꯔꯥꯝ ꯷.꯵ (ꯃꯇꯝ ꯳) ꯌꯧꯔꯝꯂꯒꯅꯤ ꯑꯗꯨꯒꯥ ꯆꯥꯡꯆꯠꯇꯥ
"height would be about 0.75m (half as much). By the end of two years, a",ꯑꯋꯥꯡꯕꯥ ꯑꯁꯤ ꯆꯥꯎꯔꯥꯛꯅꯥ 0.75m (ꯍꯥꯌꯕꯗꯤ ꯌꯥꯝꯅꯥ ꯋꯥꯡꯏ) ꯑꯣꯏꯒꯅꯤ꯫
child reaches approximately half their adult height,ꯑꯉꯥꯡ ꯑꯗꯨꯅꯥ ꯃꯈꯣꯌꯒꯤ ꯑꯦꯗꯜꯇ ꯍꯥꯏꯠ ꯑꯗꯨ ꯆꯥꯎꯔꯥꯛꯅꯥ ꯁꯔꯨꯛ ꯑꯍꯨꯝ ꯊꯣꯀꯄꯒꯤ ꯑꯃꯥ ꯌꯧꯏ
"A noticeable pattern in human growth is that it is characterised by spurts,","ꯃꯤꯑꯣꯏꯕꯒꯤ ꯆꯥꯎꯈꯠꯄꯗꯥ ꯅꯣꯛꯅꯤꯡꯉꯥꯏ ꯑꯣꯏꯕꯥ ꯃꯑꯣꯡ ꯑꯃꯗꯤ ꯃꯁꯤꯒꯤ ꯃꯁꯛ ꯊꯣꯀꯄꯥ ꯃꯑꯣꯡ ꯑꯁꯤꯅꯤ, ꯃꯁꯤ"
"plateaux, and peaks.   There are periods of very rapid growth, slow","ꯄ꯭ꯂꯦꯇꯐꯣꯔꯝ, ꯑꯃꯁꯨꯡ ꯄꯤꯀꯁꯤꯡ꯫"
"growth, and rounding off. Human growth does not take place steadily","ꯒ꯭ꯔꯣꯊ, ꯑꯃꯁꯨꯡ ꯔꯎꯟꯗ ꯑꯣꯐ ꯇꯧꯕꯥ꯫"
Lampl Veldhius and Johnson (1992) discovered that infants and toddlers,ꯂꯃꯞꯜ ꯚꯦꯂꯙꯤꯌꯁ ꯑꯃꯁꯨꯡ ꯖꯣꯅꯁꯟ (1992)ꯅꯥ ꯏꯅꯐꯦꯟꯇ ꯑꯃꯁꯨꯡ ꯈꯣꯝꯂꯥꯡ ꯏꯅꯕꯤꯕꯥ ꯑꯉꯥꯡꯁꯤꯡꯗꯥ ꯌꯨ.ꯑꯦꯁ.
"grow in spurts, not steadily. Their research findings indicated that babies","ꯁ꯭ꯄꯨꯔꯇꯁꯤꯡꯗꯥ ꯍꯦꯅꯒꯠꯂꯀꯏ, ꯂꯦꯞꯄꯥ ꯂꯩꯇꯅꯥ ꯍꯦꯅꯒꯠꯎ꯫"
"can grow as much as 0.01m in a day, and then go for days or weeks","ꯅꯨꯃꯤꯠ ꯑꯃꯗꯥ 0.01m ꯐꯥꯎꯕꯥ ꯍꯦꯅꯒꯠꯄꯥ ꯌꯥꯏ, ꯑꯃꯁꯨꯡ ꯃꯗꯨꯒꯤ ꯃꯇꯨꯡꯗꯥ ꯅꯨꯃꯤꯠ ꯅꯠꯠꯔꯒꯥ ꯅꯨꯃꯤꯠ ꯀꯌꯥꯅꯤ ꯆꯠꯄꯥ ꯌꯥꯏ꯫"
without any growth,ꯒ꯭ꯔꯣꯊ ꯑꯃꯠꯇꯥ ꯌꯥꯑꯣꯗꯅꯥ .
PED121,ꯄꯤ.ꯏ.ꯗꯤ.꯱꯲꯱ ꯑꯃꯁꯨꯡ ꯑꯦꯟ.
MODULE 2,ꯃꯣꯗ꯭ꯌꯨꯜ ꯲.
51,꯵꯱ ꯑꯃꯁꯨꯡ ꯑꯦꯟ.
"Between the ages of 3 years and 6 years, rapid physical growth continues","ꯆꯍꯤ ꯳ ꯑꯃꯁꯨꯡ ꯆꯍꯤ ꯶ꯀꯤ ꯃꯔꯛꯇꯥ, ꯌꯥꯝꯅꯥ ꯊꯨꯅꯥ ꯍꯀꯆꯥꯡ ꯆꯥꯎꯈꯠꯄꯥ ꯃꯈꯥ ꯆꯠꯊꯔꯤ"
"Children within this period gain on the average 0.1m in height, and 2.9","ꯃꯇꯝ ꯑꯁꯤꯒꯤ ꯃꯅꯨꯡꯗꯥ ꯂꯩꯕꯥ ꯑꯉꯥꯡꯁꯤꯡꯅꯥ ꯆꯥꯡꯆꯠꯇꯥ ꯃꯤꯇꯔ 0.1ꯒꯤ ꯆꯥꯡꯗꯥ ꯍꯦꯅꯒꯠꯂꯀꯏ, ꯑꯃꯁꯨꯡ 2.9."
"kilogrammes in weight per year (Durojaiye, 1976). Between the ages of","ꯆꯍꯤ ꯑꯃꯗꯥ ꯑꯔꯨꯝꯕꯥ ꯀꯤꯂꯣꯒ꯭ꯔꯥꯃꯁꯤꯡ (ꯗꯨꯔꯣꯖꯥꯏꯌꯦ, 1976)꯫"
"6 years and 12 years, growth proceeds at a very slow rate. The average","ꯆꯍꯤ ꯶ ꯑꯃꯁꯨꯡ ꯆꯍꯤ ꯱꯲, ꯒ꯭ꯔꯣꯊ ꯑꯁꯤ ꯌꯥꯝꯅꯥ ꯇꯞꯅꯥ ꯇꯞꯅꯥ ꯆꯠꯊꯔꯤ꯫"
annual increase in height is about 0.06m. The annual increase in weight,ꯆꯍꯤ ꯈꯨꯗꯤꯡꯒꯤ ꯑꯋꯥꯡꯕꯥ ꯑꯁꯤ ꯆꯥꯎꯔꯥꯛꯅꯥ 0.06m ꯑꯣꯏ꯫
is about 2 kg,ꯑꯁꯤ ꯆꯥꯎꯔꯥꯛꯅꯥ ꯀꯤꯂꯣꯒ꯭ꯔꯥꯝ ꯲ .
"At puberty, the period of physical growth and development that brings","ꯄ꯭ꯌꯨꯕꯔꯇꯤꯗꯥ, ꯐꯤꯖꯤꯀꯦꯜ ꯒ꯭ꯔꯣꯊ ꯑꯃꯁꯨꯡ ꯗꯤꯚꯦꯂꯄꯃꯦꯟꯇꯒꯤ ꯃꯇꯝ ꯑꯁꯤꯅꯥ ꯄꯨꯔꯀꯄꯥ"
"to an end childhood and enables the child to achieve adult physical size,","ꯑꯉꯥꯡ ꯑꯣꯏꯔꯤꯉꯩꯗꯥ ꯑꯃꯁꯨꯡ ꯑꯉꯥꯡ ꯑꯗꯨꯕꯨ ꯑꯍꯜ ꯑꯣꯏꯔꯕꯥ ꯍꯀꯆꯥꯡꯒꯤ ꯁꯥꯏꯖ ꯑꯃꯥ ꯐꯪꯍꯅꯕꯥ ꯉꯃꯍꯜꯂꯤ,"
growth spurt reappears. The average age children enter puberty is 12,ꯒ꯭ꯔꯣꯊ ꯁ꯭ꯄꯔꯠ ꯑꯃꯨꯛ ꯍꯟꯅꯥ ꯂꯥꯀꯏ꯫
years. This marks the beginning of adolescence. The period of,ꯆꯍꯤꯁꯤꯡ.
adolescence is between 12 years and 20 years.   It is characterised by,ꯏꯅꯈꯠꯂꯀꯄꯥ ꯃꯇꯝ ꯑꯁꯤ ꯆꯍꯤ 12 ꯑꯃꯁꯨꯡ ꯆꯍꯤ 20ꯒꯤ ꯃꯔꯛꯇꯥ ꯂꯩ꯫
rapid and dramatic changes in growth,ꯒ꯭ꯔꯣꯊꯇꯥ ꯌꯥꯝꯅꯥ ꯊꯨꯅꯥ ꯑꯃꯁꯨꯡ ꯌꯥꯝꯅꯥ ꯆꯥꯎꯅꯥ ꯑꯍꯣꯡꯕꯥ ꯂꯥꯀꯄꯥ
The adolescent period is also characterised by increased growth of the,ꯏꯅꯈꯠꯂꯛꯂꯤꯕꯥ ꯃꯇꯝ ꯑꯁꯤꯒꯤ ꯃꯇꯥꯡꯗꯁꯨ ꯍꯦꯟꯅꯥ ꯆꯥꯎꯈꯠꯂꯀꯄꯅꯥ ꯃꯔꯝ ꯑꯣꯏꯗꯨꯅꯥ ꯑꯦꯟ.ꯗꯤ.ꯑꯦ.
internal organs of the body. There is an increase in the size and capacity,ꯍꯀꯆꯥꯡꯒꯤ ꯃꯅꯨꯡꯒꯤ ꯑꯣꯏꯕꯥ ꯑꯣꯔꯒꯥꯅꯁꯤꯡ꯫
"of the lungs. The size of the heart doubles, and the total volume of blood",ꯂꯪꯁꯀꯤ꯫
in the body increases. There is a noticeable increase in the capacity of,ꯍꯀꯆꯥꯡꯗꯥ ꯍꯦꯅꯒꯠꯂꯀꯏ꯫
"the digestive system (Berger, 1986)","ꯗꯥꯏꯖꯦꯁ꯭ꯇꯤꯕ ꯁꯤꯁ꯭ꯇꯦꯝ (ꯕꯔꯒꯔ, ꯱꯹꯸꯶) ꯑꯁꯤ ꯌꯥꯑꯣꯔꯤ꯫"
1.3.4 Motor Development,꯱.꯳.꯴ ꯃꯣꯇꯣꯔ ꯗꯤꯕꯦꯂꯄꯃꯦꯟꯇ .
"Motor development follows a sequential, systematic and predictable","ꯃꯣꯇꯣꯔ ꯗꯤꯕꯦꯂꯄꯃꯦꯟꯇ ꯑꯁꯤ ꯁꯤꯛꯕꯦꯟꯁꯤꯑꯦꯜ, ꯁꯤꯁ꯭ꯇꯦꯃꯦꯇꯤꯛ ꯑꯃꯁꯨꯡ ꯄ꯭ꯔꯤꯗꯤꯛꯇꯦꯕꯜ ꯑꯣꯏꯕꯥ ꯑꯃꯒꯤ ꯃꯇꯨꯡ ꯏꯟꯅꯥ ꯆꯠꯂꯤ"
trend. It follows a definite sequence – the cephalo-canal principle,ꯆꯠꯅꯕꯤ.
"Motor control is achieved first in the head, then the arms, hands, upper","ꯃꯣꯇꯣꯔ ꯀꯟꯠꯔꯣꯜ ꯑꯁꯤ ꯑꯍꯥꯅꯕꯗꯥ ꯃꯀꯣꯛꯇꯥ, ꯃꯗꯨꯒꯤ ꯃꯇꯨꯡꯗꯥ ꯈꯨꯠꯁꯥ, ꯈꯨꯠ, ꯃꯊꯛ ꯊꯪꯕꯥ ꯁꯔꯨꯛꯇꯥ ꯐꯪꯕꯥ ꯉꯝꯃꯤ꯫"
"part of the trunk, lower part of the trunk, and finally the legs and feet","ꯇ꯭ꯔꯉ꯭ꯀꯀꯤ ꯁꯔꯨꯛ ꯑꯃꯥ, ꯇ꯭ꯔꯉ꯭ꯀꯀꯤ ꯃꯈꯥ ꯊꯪꯕꯥ ꯁꯔꯨꯛ, ꯑꯃꯁꯨꯡ ꯑꯔꯣꯏꯕꯗꯥ ꯈꯣꯡ ꯑꯃꯁꯨꯡ ꯈꯣꯡꯎꯞ"
"(Hurlock, 1972; Shirly, 1933).   Thus, infants first lift their heads; then","(ꯍꯔꯂꯣꯛ, ꯱꯹꯷꯲; ꯁꯤꯔꯂꯤ, ꯱꯹꯳꯳)꯫"
gain control of the shoulders; then sit up; then stand before they finally,ꯈꯨꯎꯒꯤ ꯀꯟꯠꯔꯣꯜ ꯂꯧꯕꯥ;
walk,ꯆꯠꯄ
Motor control also proceeds in the proximodistal direction. The child,ꯃꯣꯇꯣꯔ ꯀꯟꯠꯔꯣꯂꯁꯨ ꯄ꯭ꯔꯣꯛꯁꯤꯃꯣꯗꯤꯁ꯭ꯇꯦꯜ ꯗꯤꯔꯦꯛꯁꯟꯗꯥ ꯆꯠꯊꯔꯤ꯫
gains control of the structures nearest the centre of the body before those,ꯒꯦꯏꯅꯁꯤꯡ ꯑꯗꯨꯒꯤ ꯃꯃꯥꯡꯗꯥ ꯍꯀꯆꯥꯡꯒꯤ ꯁꯦꯟꯇꯔꯒꯤ ꯈ꯭ꯕꯥꯏꯗꯒꯤ ꯅꯀꯄꯥ ꯁ꯭ꯠꯔꯀꯆꯔꯁꯤꯡꯒꯤ ꯀꯟꯠꯔꯣꯜ .
"at the periphery.   For example, the child gains control of the muscles in",ꯄꯦꯔꯤꯐꯦꯔꯦꯂꯗꯥ ꯂꯩꯕꯥ꯫
the arms earlier than the muscles in the fingers,ꯈꯨꯠꯁꯥꯁꯤꯡꯗꯥ ꯂꯩꯔꯤꯕꯥ ꯃꯁꯂꯁꯤꯡꯗꯒꯤ ꯍꯦꯟꯅꯥ ꯉꯟꯅꯥ ꯈꯨꯠꯁꯥꯁꯤꯡ ꯑꯗꯨ .
"In general, motor control proceeds from gross manifestation to specific","ꯃꯍꯧꯁꯥꯅꯥ, ꯃꯣꯇꯣꯔ ꯀꯟꯠꯔꯣꯜ ꯑꯁꯤ ꯒ꯭ꯔꯣꯁ ꯃꯦꯅꯤꯐꯦꯁ꯭ꯇꯦꯁꯅꯗꯒꯤ ꯑꯀꯛꯅꯕꯥ ꯑꯣꯏꯅꯥ ꯆꯠꯊꯔꯤ꯫"
"or fine control. At birth, the child has little control of the chest and the",ꯅꯠꯠꯔꯒꯥ ꯐꯥꯏꯟ ꯀꯟꯠꯔꯣꯜ ꯇꯧꯕꯥ꯫
"arms. However, within four months, the child can hold themselves up",ꯑꯥꯔꯃꯁ ꯍꯥꯌꯅꯥ ꯈꯉꯅꯕꯥ꯫
"while face down, using their arms as props. Thereafter, the infant can sit","ꯐꯦꯁ ꯗꯥꯎꯟ ꯇꯧꯔꯤꯉꯩꯗꯥ, ꯃꯈꯣꯌꯒꯤ ꯈꯨꯠꯁꯥꯁꯤꯡ ꯑꯗꯨ ꯄ꯭ꯔꯣꯄꯔ ꯑꯣꯏꯅꯥ ꯁꯤꯖꯤꯟꯅꯗꯨꯅꯥ꯫"
"up with support. Then, the child can hold on to an object and rollover",ꯁꯄꯣꯔꯇꯀꯥ ꯂꯣꯌꯅꯅꯥ ꯑꯞ ꯇꯧꯕꯥ꯫
"These activities involve large-muscle control, and gross motor skills","ꯍꯥꯌꯔꯤꯕꯥ ꯊꯕꯀꯁꯤꯡ ꯑꯁꯤꯗꯥ ꯑꯆꯧꯕꯥ ꯃꯁꯜ ꯀꯟꯠꯔꯣꯜ ꯇꯧꯕꯥ, ꯑꯃꯁꯨꯡ ꯒ꯭ꯔꯣꯁ ꯃꯣꯇꯣꯔ ꯁ꯭ꯀꯤꯂꯁꯤꯡ ꯌꯥꯑꯣꯕꯥ ."
Activities that involve the use of small-muscle groups appear followed,ꯑꯄꯤꯀꯄꯥ ꯃꯁꯜ ꯀꯥꯡꯂꯨꯄꯁꯤꯡ ꯁꯤꯖꯤꯟꯅꯕꯥ ꯌꯥꯕꯥ ꯊꯕꯛ ꯊꯧꯔꯃꯁꯤꯡ ꯑꯁꯤ ꯇꯨꯡ ꯏꯟꯗꯨꯅꯥ ꯆꯠꯂꯤ
"by gross motor skills. By 10 months of age, the child can grasp an object",ꯒ꯭ꯔꯣꯁ ꯃꯣꯇꯣꯔ ꯁ꯭ꯀꯤꯂꯁꯤꯡꯅꯥ ꯄꯤꯕꯥ꯫
"between their fingers and the palm. By the first year, the child is able to",ꯃꯈꯣꯌꯒꯤ ꯃꯈꯨꯠ ꯑꯃꯁꯨꯡ ꯃꯈꯨꯠꯀꯤ ꯃꯔꯛꯇꯥ꯫
pick up small objects without dropping them. Activities that involve,ꯑꯄꯤꯀꯄꯥ ꯄꯣꯠꯁꯀꯁꯤꯡ ꯑꯗꯨ ꯊꯥꯗꯣꯛꯂꯒꯥ ꯂꯧꯈꯠꯂꯨ꯫
PED121,ꯄꯤ.ꯏ.ꯗꯤ.꯱꯲꯱ ꯑꯃꯁꯨꯡ ꯑꯦꯟ.
CHILDHOOD AND ADOLESCENT PSYCHOLOGY,ꯑꯉꯥꯡ ꯑꯣꯏꯔꯤꯉꯩ ꯑꯃꯁꯨꯡ ꯏꯅꯈꯠꯂꯛꯂꯤꯕꯥ ꯁꯥꯏꯀꯣꯂꯣꯖꯤ
52,꯵꯲ ꯑꯃꯁꯨꯡ ꯑꯦꯟ.
small-muscle groups are called fine motor skills. Fine motor skills are,ꯑꯄꯤꯀꯄꯥ ꯃꯁꯜ ꯒ꯭ꯔꯨꯄꯁꯤꯡ ꯑꯁꯤ ꯐꯥꯏꯅꯦꯜ ꯃꯣꯇꯣꯔ ꯁ꯭ꯀꯤꯜ ꯍꯥꯌꯅꯥ ꯀꯧꯏ꯫
"required for reaching and manipulating objects, such as in grasping,","ꯄꯣꯠꯁꯀꯁꯤꯡ ꯌꯧꯕꯥ ꯑꯃꯁꯨꯡ ꯃꯦꯅꯤꯄꯨꯂꯦꯠ ꯇꯧꯅꯕꯒꯤꯗꯃꯛ ꯃꯊꯧ ꯇꯥꯕꯥ, ꯍꯥꯌꯕꯗꯤ ꯒ꯭ꯔꯦꯁꯄꯤꯡ,"
"throwing, writing, catching, and using tools","ꯊꯣꯡ-ꯊꯥꯀꯄꯥ, ꯏꯕꯥ, ꯂꯧꯁꯤꯅꯕꯥ ꯑꯃꯁꯨꯡ ꯈꯨꯠꯂꯥꯌꯁꯤꯡ ꯁꯤꯖꯤꯟꯅꯕꯥ"
1.3.5 Factors,꯱.꯳.꯵ꯒꯤ ꯐꯦꯛꯇꯔꯁꯤꯡ ꯌꯥꯑꯣꯔꯤ꯫
Affecting,ꯑꯦꯐꯦꯛꯇ ꯇꯧꯕꯥ
Physical,ꯍꯛꯆꯥꯡꯒꯤ ꯑꯣꯏꯕ
Growth,ꯁꯥꯍꯧ ꯂꯩꯕ
and,ꯑꯃꯁꯨꯡ
Motor,ꯃꯣꯇꯔ ꯑꯁꯤ ꯌꯥꯑꯣꯔꯤ꯫
Development,ꯆꯥꯎꯈꯠꯄ
Two major factors influence physical growth and motor development,ꯑꯆꯧꯕꯥ ꯐꯦꯛꯇꯔ ꯑꯅꯤꯅꯥ ꯐꯤꯖꯤꯀꯦꯜ ꯒ꯭ꯔꯣꯊ ꯑꯃꯁꯨꯡ ꯃꯣꯇꯣꯔ ꯗꯤꯕꯦꯂꯄꯃꯦꯟꯇꯗꯥ ꯁꯥꯐꯨ ꯄꯤꯔꯤ
"They are genetic factors, and environmental factors","ꯃꯈꯣꯌꯁꯤꯡ ꯑꯁꯤ ꯖꯤꯅꯦꯇꯤꯛ ꯐꯦꯛꯇꯔꯁꯤꯡꯅꯤ, ꯑꯃꯁꯨꯡ ꯑꯀꯣꯌꯕꯒꯤ ꯐꯤꯕꯃꯒꯤ ꯐꯦꯛꯇꯔꯁꯤꯡꯅꯤ ꯫"
1,꯱.
Genetic Factors,ꯖꯤꯅꯦꯇꯤꯛ ꯐꯦꯛꯇꯔꯁꯤꯡ .
Everybody inherits a set of genes from the parents. Genes contribute,ꯃꯤꯄꯨꯝ ꯈꯨꯗꯤꯡꯃꯛꯅꯥ ꯃꯃꯥ-ꯃꯄꯥꯁꯤꯡꯗꯒꯤ ꯖꯤꯅꯒꯤ ꯁꯦꯠ ꯑꯃꯥ ꯏꯅꯍꯦꯔꯤ ꯇꯧꯏ꯫
significantly to physical growth and motor development. Genes,ꯐꯤꯖꯤꯀꯦꯜ ꯒ꯭ꯔꯣꯊ ꯑꯃꯁꯨꯡ ꯃꯣꯇꯣꯔ ꯗꯤꯚꯦꯂꯄꯃꯦꯟꯇꯗꯥ ꯃꯔꯨꯑꯣꯏꯕꯥ꯫
determine the child’s potential for growth and development. The,ꯑꯉꯥꯡ ꯑꯗꯨꯒꯤ ꯒ꯭ꯔꯣꯊ ꯑꯃꯁꯨꯡ ꯗꯤꯚꯦꯂꯄꯃꯦꯟꯇꯒꯤ ꯄꯣꯇꯦꯟꯁꯤꯑꯦꯜ ꯑꯗꯨ ꯂꯦꯄꯊꯣꯀꯄꯥ꯫
"eventual height a child attains, the skeletal formation, the general","ꯏꯚꯦꯟꯠꯌꯨꯑꯦꯜ ꯍꯥꯏꯠ ꯑꯃꯥ ꯑꯉꯥꯡ ꯑꯃꯅꯥ ꯐꯪꯏ, ꯁ꯭ꯀꯦꯂꯦꯇꯜ ꯐꯣꯔꯃꯦꯁꯟ, ꯖꯦꯅꯦꯔꯦꯜ"
"musculature, and neural system   coordination depend, largely, on their","ꯃꯁꯜ, ꯑꯃꯁꯨꯡ ꯅ꯭ꯌꯨꯔꯜ ꯁꯤꯁ꯭ꯇꯦꯝ ꯀꯣꯑꯣꯔꯗꯤꯅꯦꯁꯟ ꯑꯁꯤ, ꯃꯈꯣꯌꯒꯤ ꯃꯊꯛꯇꯥ, ꯃꯈꯣꯌꯒꯤ ꯃꯊꯛꯇꯥ, ꯃꯈꯣꯌꯒꯤ ."
"inherited potential (Thomas, 1991). The rate of maturation of bodily","ꯏꯅꯍꯦꯔꯤꯇꯦꯗ ꯄꯣꯇꯦꯟꯁꯤꯑꯦꯜ (ꯊꯣꯃꯥꯁ, 1991)꯫"
structures and the muscles determine the rate of physical growth and,ꯁ꯭ꯠꯔꯀꯆꯔꯁꯤꯡ ꯑꯃꯁꯨꯡ ꯃꯁꯂꯁꯤꯡꯅꯥ ꯐꯤꯖꯤꯀꯦꯜ ꯒ꯭ꯔꯣꯊꯀꯤ ꯆꯥꯡ ꯂꯦꯄꯊꯣꯀꯏ ꯑꯃꯁꯨꯡ .
"motor control. The rate of maturation is wired. Genetically Thus, the kind",ꯃꯣꯇꯣꯔ ꯀꯟꯠꯔꯣꯜ ꯇꯧꯕꯥ꯫
of motor skills an individual develops depend on genetic potentiality,of motor skills ꯃꯤꯑꯣꯏ ꯑꯃꯅꯥ ꯁꯦꯃꯒꯠꯄꯥ ꯖꯤꯅꯦꯇꯤꯛ ꯄꯣꯇꯦꯟꯁꯤꯌꯦꯂꯗꯥ ꯃꯈꯥ ꯄꯣꯜꯂꯤ .
Hormonal functioning is an aspect of genetic factor in proper,ꯍꯣꯔꯃꯣꯅꯒꯤ ꯊꯕꯛ ꯇꯧꯕꯥ ꯍꯥꯌꯕꯁꯤ ꯃꯑꯣꯡ ꯆꯨꯝꯅꯥ ꯖꯤꯅꯦꯇꯤꯛ ꯐꯦꯛꯇꯔꯒꯤ ꯃꯁꯛ ꯑꯃꯅꯤ .
functioning of the growth controlling hormonal glands is necessary for,ꯒ꯭ꯔꯣꯊ ꯀꯟꯠꯔꯣꯂꯤꯡ ꯍꯣꯔꯃꯣꯟ ꯒ꯭ꯜꯌꯥꯟꯗꯁꯤꯡꯒꯤ ꯃꯊꯧ ꯇꯧꯕꯥ ꯑꯁꯤ ꯃꯊꯧ ꯇꯥꯏ
normal physical growth and motor development. Malfunctioning of,ꯅꯣꯔꯃꯦꯜ ꯐꯤꯖꯤꯀꯦꯜ ꯒ꯭ꯔꯣꯊ ꯑꯃꯁꯨꯡ ꯃꯣꯇꯣꯔ ꯗꯤꯚꯦꯂꯄꯃꯦꯟꯇ꯫
growth controlling hormonal glands may lead to stunted growth or,ꯒ꯭ꯔꯣꯊ ꯀꯟꯠꯔꯣꯜ ꯇꯧꯕꯥ ꯍꯣꯔꯃꯣꯟ ꯒ꯭ꯜꯌꯥꯟꯗꯁꯤꯡꯅꯥ ꯁ꯭ꯇꯟꯇ ꯒ꯭ꯔꯣꯊ ꯅꯠꯠꯔꯒꯥ .
overgrowth,ꯑꯣꯚꯔꯒ꯭ꯔꯥꯎꯟꯗ ꯇꯧꯕꯥ
2,꯲ ꯑꯃꯁꯨꯡ ꯲.
Environmental Factors,ꯑꯀꯣꯌꯕꯒꯤ ꯐꯤꯕꯃꯒꯤ ꯃꯇꯥꯡꯗꯥ ꯋꯥꯐꯝ ꯀꯌꯥ ꯊꯃꯈꯤ꯫
Many aspects of the environment can affect physical growth and motor,ꯑꯀꯣꯌꯔꯣꯅꯒꯤ ꯃꯁꯛ ꯀꯌꯥꯅꯥ ꯐꯤꯖꯤꯀꯦꯜ ꯒ꯭ꯔꯣꯊ ꯑꯃꯁꯨꯡ ꯃꯣꯇꯣꯔꯗꯥ ꯁꯣꯀꯍꯅꯕꯥ ꯌꯥꯏ꯫
development. They include nutritional,ꯆꯥꯎꯈꯠꯄ.
"status,","ꯊꯥꯛ,"
health,ꯍꯛꯁꯦꯜ
"status,","ꯊꯥꯛ,"
"psychological or emotional state, and training/practice be seriously","ꯁꯥꯏꯀꯣꯂꯣꯖꯤꯀꯦꯜ ꯅꯠꯠꯔꯒꯥ ꯏꯃꯣꯁꯅꯦꯜ ꯁ꯭ꯇꯦꯠ, ꯑꯃꯁꯨꯡ ꯇ꯭ꯔꯦꯅꯤꯡ/ꯄ꯭ꯔꯦꯛꯇꯤꯁ ꯑꯁꯤ ꯌꯥꯝꯅꯥ ꯂꯨꯅꯥ ꯂꯧꯕꯥ ꯌꯥꯏ꯫"
affected,ꯁꯣꯀꯍꯜꯂꯕꯥ .
Nutritional Status,ꯅ꯭ꯌꯨꯠꯔꯤꯁꯅꯒꯤ ꯐꯤꯚꯝ .
Every child requires food nutrients provided in the needed proportion,ꯑꯉꯥꯡ ꯈꯨꯗꯤꯡꯃꯛꯅꯥ ꯃꯊꯧ ꯇꯥꯕꯥ ꯆꯥꯡꯗꯥ ꯄꯤꯔꯤꯕꯥ ꯐꯨꯗ ꯅ꯭ꯌꯨꯠꯔꯤꯑꯦꯟꯇꯁꯤꯡ ꯃꯊꯧ ꯇꯥꯏ
for them to realise their genetic potential for physical growth and,ꯃꯈꯣꯌꯅꯥ ꯃꯈꯣꯌꯒꯤ ꯍꯀꯆꯥꯡ ꯆꯥꯎꯈꯠꯅꯕꯥ ꯃꯈꯣꯌꯒꯤ ꯖꯦꯅꯦꯇꯤꯛ ꯄꯣꯇꯦꯟꯁꯤꯑꯦꯜ ꯑꯃꯁꯨꯡ [...]
"development. If there is significant lack of food nutrients, and the child",ꯆꯥꯎꯈꯠꯄ.
"is severely malnourished, physical growth and motor development will","ꯑꯁꯤ ꯌꯥꯝꯅꯥ ꯃꯆꯤ ꯑꯣꯏꯕꯥ ꯆꯤꯟꯖꯥꯛ ꯐꯪꯗꯕꯥ, ꯍꯀꯆꯥꯡ ꯆꯥꯎꯈꯠꯄꯥ ꯑꯃꯁꯨꯡ ꯃꯣꯇꯣꯔ ꯗꯤꯕꯦꯂꯄꯃꯦꯟꯇꯅꯥ ."
"be seriously, affected .their physical growth or will be delay in the","ꯁꯤꯔꯤꯌꯁ ꯑꯣꯏꯅꯥ, ꯁꯣꯀꯍꯜꯂꯕꯥ .ꯃꯈꯣꯌꯒꯤ ꯍꯀꯆꯥꯡ ꯆꯥꯎꯈꯠꯄꯥ ꯅꯠꯔꯒꯥ ꯲꯰꯲꯰ꯗꯥ ꯊꯦꯡꯊꯕꯥ ꯑꯣꯏꯒꯅꯤ꯫"
appearance of important motor skills or they may fail ultimately,ꯃꯔꯨꯑꯣꯏꯕꯥ ꯃꯣꯇꯣꯔ ꯁ꯭ꯀꯤꯂꯁꯤꯡꯒꯤ ꯃꯑꯣꯡ ꯃꯇꯧ ꯅꯠꯠꯔꯒꯥ ꯃꯈꯣꯌꯅꯥ ꯑꯔꯣꯏꯕꯗꯥ ꯃꯥꯌ ꯄꯥꯀꯄꯥ ꯉꯃꯗꯕꯥ ꯌꯥꯏ
Health Status,ꯍꯀꯁꯦꯂꯒꯤ ꯐꯤꯚꯝ ꯑꯁꯤ .
Good health is a pre-condition for normal physical growth and motor,ꯑꯐꯕꯥ ꯍꯀꯁꯦꯜ ꯍꯥꯌꯕꯁꯤ ꯅꯣꯔꯃꯦꯜ ꯑꯣꯏꯕꯥ ꯐꯤꯖꯤꯀꯦꯜ ꯒ꯭ꯔꯣꯊ ꯑꯃꯁꯨꯡ ꯃꯣꯇꯣꯔꯒꯤ ꯄ꯭ꯔꯤ-ꯀꯟꯗꯤꯁꯟ ꯑꯃꯅꯤ꯫
"development. If a child’s health is severely poor and long duration,",ꯆꯥꯎꯈꯠꯄ.
physical growth and motor development will suffer.   There may be loss,ꯐꯤꯖꯤꯀꯦꯜ ꯒ꯭ꯔꯣꯊ ꯑꯃꯁꯨꯡ ꯃꯣꯇꯣꯔ ꯗꯤꯚꯦꯂꯄꯃꯦꯟꯇꯅꯥ ꯑꯋꯥꯕꯥ ꯃꯥꯌꯣꯛꯅꯒꯅꯤ꯫
in weight and reduction in growth rate. Severe ill health can result in,ꯑꯔꯨꯝꯕꯥ ꯑꯃꯁꯨꯡ ꯒ꯭ꯔꯣꯊ ꯔꯦꯠ ꯍꯟꯊꯍꯅꯕꯥ꯫
PED121,ꯄꯤ.ꯏ.ꯗꯤ.꯱꯲꯱ ꯑꯃꯁꯨꯡ ꯑꯦꯟ.
MODULE 2,ꯃꯣꯗ꯭ꯌꯨꯜ ꯲.
53,꯵꯳ ꯑꯃꯁꯨꯡ ꯑꯦꯟ.
distortion in the growth of bones. These may lead to hampered size at,ꯁꯔꯨ ꯇꯥꯡꯁꯤꯡꯒꯤ ꯆꯥꯎꯈꯠꯄꯗꯥ ꯗꯤꯁ꯭ꯇꯔꯁꯟ ꯂꯩꯕꯥ꯫
maturity of the skeleton,ꯁ꯭ꯀꯦꯂꯦꯇꯅꯒꯤ ꯃꯦꯆ꯭ꯌꯨꯔꯤꯇꯤ ꯂꯩꯕꯥ .
Psychological or Emotional State,ꯁꯥꯏꯀꯣꯂꯣꯖꯤꯀꯦꯜ ꯅꯠꯠꯔꯒꯥ ꯏꯃꯣꯁꯅꯦꯜ ꯁ꯭ꯇꯦꯠ
Findings from research studies suggest that emotional disturbance,ꯔꯤꯁꯔꯆ ꯁ꯭ꯇꯗꯤꯁꯤꯡꯗꯒꯤ ꯐꯪꯂꯀꯄꯥ ꯋꯥꯐꯃꯁꯤꯡꯅꯥ ꯇꯥꯛꯂꯤ ꯃꯗꯨꯗꯤ ꯏꯃꯣꯁꯅꯦꯜ ꯗꯤꯁ꯭ꯇꯔꯕꯦꯟꯁ
"arising from repeated parental conflict or divorce, maltreatment, child","ꯍꯟꯖꯤꯟ ꯍꯟꯖꯤꯟ ꯃꯃꯥ-ꯃꯄꯥꯒꯤ ꯂꯥꯅꯐꯝ ꯅꯠꯠꯔꯒꯥ ꯇꯂꯥꯛ, ꯃꯥꯂꯠꯔꯤꯇꯃꯦꯟꯇ, ꯑꯉꯥꯡ"
"abuse and neglect, overcrowding, and other negative emotion-inducing","ꯑꯦꯕ꯭ꯌꯨꯖ ꯑꯃꯁꯨꯡ ꯅꯦꯒꯂꯦꯛꯇ, ꯃꯤ ꯌꯥꯝꯅꯥ ꯇꯤꯅꯕꯥ, ꯑꯃꯁꯨꯡ ꯑꯇꯩ ꯅꯦꯒꯦꯇꯤꯚ ꯏꯃꯣꯁꯟ-ꯏꯟꯗꯨꯁꯤꯡ"
circumstances may make children lose weight without being ill. Evidence,ꯐꯤꯚꯃꯁꯤꯡꯅꯥ ꯑꯉꯥꯡꯁꯤꯡꯕꯨ ꯑꯅꯥꯕꯥ ꯌꯥꯎꯗꯅꯥ ꯑꯔꯨꯝꯕꯥ ꯍꯟꯊꯍꯅꯕꯥ ꯌꯥꯏ꯫
shows that children from broken and highly stressful homes manifest,ꯁꯣꯟꯊꯔꯕꯥ ꯑꯃꯁꯨꯡ ꯌꯥꯝꯅꯥ ꯋꯥꯅꯥ ꯊꯣꯀꯄꯥ ꯌꯨꯃꯁꯤꯡꯗꯒꯤ ꯂꯥꯀꯄꯥ ꯑꯉꯥꯡꯁꯤꯡꯅꯥ ꯃꯁꯛ ꯇꯥꯛꯂꯤ ꯍꯥꯌꯕꯥ ꯎꯠꯂꯤ꯫
slower rate in physical growth and motor development,ꯐꯤꯖꯤꯀꯦꯜ ꯒ꯭ꯔꯣꯊ ꯑꯃꯁꯨꯡ ꯃꯣꯇꯣꯔ ꯗꯤꯚꯦꯂꯄꯃꯦꯟꯇꯗꯥ ꯇꯞꯅꯥ ꯇꯞꯅꯥ ꯔꯦꯠ ꯄꯤꯕꯥ
Training/Practice,ꯇ꯭ꯔꯦꯅꯤꯡ/ꯄ꯭ꯔꯦꯛꯇꯤꯁ .
"Maturation is the basis of development of motor control. However, the",ꯃꯦꯆ꯭ꯌꯨꯔꯦꯁꯟ ꯍꯥꯌꯕꯁꯤ ꯃꯣꯇꯣꯔ ꯀꯟꯠꯔꯣꯜ ꯗꯤꯚꯦꯂꯄꯃꯦꯟꯇꯒꯤ ꯌꯨꯝꯐꯝ ꯑꯣꯏ꯫
refinement and improvement of fine motor skills require considerable,ꯔꯤꯐꯥꯏꯅꯤꯡ ꯑꯃꯁꯨꯡ ꯐꯥꯏꯅꯦꯜ ꯃꯣꯇꯣꯔ ꯁ꯭ꯀꯤꯂꯁꯤꯡ ꯐꯒꯠꯍꯅꯕꯥ ꯑꯁꯤ ꯌꯥꯝꯅꯥ ꯆꯥꯎꯅꯥ ꯃꯊꯧ ꯇꯥꯏ
training and practice. Training and practice produce star performance,ꯇ꯭ꯔꯦꯅꯤꯡ ꯑꯃꯁꯨꯡ ꯄ꯭ꯔꯦꯛꯇꯤꯁ ꯇꯧꯕꯥ꯫
"exhibited in sports and athletics such as running, jumping, throwing,","ꯔꯟ ꯇꯧꯕꯥ, ꯂꯥꯞꯅꯥ ꯆꯠꯄꯥ, ꯊꯣꯡ-ꯊꯥꯀꯄꯥ, ꯁꯥꯟꯅ-ꯈꯣꯠꯅꯕꯥ ꯑꯃꯁꯨꯡ ꯁꯥꯟꯅ-ꯈꯣꯠꯅꯕꯥ ꯑꯃꯁꯨꯡ ꯑꯦꯊꯂꯦꯇꯤꯛꯁꯇꯥ ꯑꯦꯀꯖꯤꯕꯤꯁꯟ ꯇꯧꯕꯥ"
