en,mni-Mtei
Thus we cogitate—and necessarily—a given time completely elapsed up,ꯑꯁꯨꯝꯅꯥ ꯑꯩꯈꯣꯌꯅꯥ ꯀꯣꯖꯤꯇꯦꯠ ꯇꯧꯏ—ꯑꯗꯨꯒꯥ ꯇꯉꯥꯏꯐꯗꯅꯥ—ꯑꯄꯤꯕꯥ ꯃꯇꯝ ꯑꯃꯥ ꯃꯄꯨꯡ ꯐꯥꯅꯥ ꯂꯣꯏꯔꯦ
"to a given moment, although that time is not determinable by us. But as",ꯃꯇꯝ ꯑꯗꯨ ꯑꯩꯈꯣꯌꯅꯥ ꯂꯦꯄꯊꯣꯀꯄꯥ ꯉꯃꯗ꯭ꯔꯕꯁꯨ ꯑꯄꯤꯀꯄꯥ ꯃꯤꯀꯨꯞ ꯑꯃꯗꯥ꯫
"regards time future, which is not the condition of arriving at the present, in",ꯍꯧꯖꯤꯛ ꯂꯩꯔꯤꯕꯥ ꯃꯇꯝ ꯑꯁꯤꯗꯥ ꯌꯧꯔꯀꯄꯒꯤ ꯐꯤꯚꯝ ꯅꯠꯇꯕꯥ ꯃꯇꯃꯒꯤ ꯇꯨꯡꯒꯤ ꯐꯤꯕꯃꯒꯤ ꯃꯇꯥꯡꯗꯥ ꯋꯥꯐꯝ ꯀꯌꯥ ꯊꯝꯂꯤ꯫
order to conceive it; it is quite indifferent whether we consider future time,ꯃꯁꯤ ꯃꯤꯔꯣꯅꯕꯥ ꯌꯥꯅꯕꯥ ꯑꯣꯔꯗꯔ ꯇꯧꯕꯥ;
"as ceasing at some point, or as prolonging itself to infinity. Take, for","ꯃꯇꯝ ꯈꯔꯒꯤ ꯑꯣꯏꯅꯥ ꯂꯦꯄꯈꯤꯕꯥ ꯑꯗꯨꯒꯨꯝꯅꯥ, ꯅꯠꯔꯒꯥ ꯃꯁꯥꯃꯀꯄꯨ ꯏꯅꯐꯤꯅꯤꯇꯤꯗꯥ ꯁꯥꯡꯗꯣꯀꯍꯅꯕꯥ ꯑꯗꯨꯒꯨꯝꯅꯥ꯫"
"example, the series m, n, o, in which n is given as conditioned in relation to","ꯈꯨꯗꯝ ꯑꯣꯏꯅꯥ, ꯁꯤꯔꯤꯖ M, N, O, ꯃꯗꯨꯗꯥ N ꯑꯁꯤ 1.0."
"m, but at the same time as the condition of o, and let the series proceed","m, ꯑꯗꯨꯕꯨ ꯃꯇꯝ ꯑꯗꯨꯃꯛꯇꯗꯥ ꯑꯣꯒꯤ ꯀꯟꯗꯤꯁꯟ ꯑꯗꯨꯒꯥ ꯂꯣꯌꯅꯅꯥ, ꯑꯃꯁꯨꯡ ꯁꯤꯔꯤꯖ ꯑꯁꯤ ꯆꯠꯊꯕꯥ ꯌꯥꯍꯜꯂꯨ ."
"upwards from the conditioned n to m (l, k, i, etc.), and also downwards","ꯀꯟꯗꯤꯁꯟ ꯇꯧꯔꯕꯥ N ꯗꯒꯤ M (L, K, I, ꯑꯁꯤꯅꯆꯤꯡꯕꯥ) ꯐꯥꯎꯕꯒꯤ ꯃꯊꯛꯇꯥ ꯂꯩꯕꯥ, ꯑꯃꯁꯨꯡ ꯃꯈꯥꯗꯁꯨ"
"from the condition n to the conditioned o (p, q, r, etc.)—I must presuppose","ꯀꯟꯗꯤꯁꯟ n ꯗꯒꯤ ꯀꯟꯗꯤꯁꯟ ꯂꯩꯕꯥ O (P, Q, R, ꯑꯁꯤꯅꯆꯤꯡꯕꯥ) ꯐꯥꯑꯣꯕꯥ—ꯑꯩꯍꯥꯛꯅꯥ ꯄ꯭ꯔꯤꯁꯄꯄꯣꯖ ꯇꯧꯒꯗꯕꯅꯤ"
"the former series, to be able to consider n as given, and n is according to","ꯍꯥꯟꯅꯒꯤ ꯁꯤꯔꯤꯖ ꯑꯁꯤ, ꯑꯦꯟ.ꯏ.ꯅꯥ ꯄꯤꯕꯥ ꯑꯣꯏꯅꯥ ꯂꯧꯕꯥ ꯌꯥꯕꯥ, ꯑꯃꯁꯨꯡ ꯑꯦꯟ."
reason (the totality of conditions) possible only by means of that series. But,ꯃꯔꯝ (ꯀꯟꯗꯤꯁꯅꯒꯤ ꯇꯣꯇꯦꯂꯤꯇꯤ) ꯑꯁꯤ ꯁꯤꯔꯤꯖ ꯑꯗꯨꯒꯤ ꯈꯨꯠꯊꯥꯡꯗꯥ ꯈꯛꯇꯃꯛ ꯑꯣꯏꯊꯣꯀꯄꯥ ꯌꯥꯏ꯫
"its possibility does not rest on the following series o, p, q, r, which for this","ꯃꯁꯤꯒꯤ ꯑꯣꯏꯊꯣꯀꯄꯥ ꯌꯥꯕꯥ ꯑꯁꯤ ꯃꯈꯥꯗꯥ ꯄꯤꯔꯤꯕꯥ ꯁꯤꯔꯤꯖ ꯑꯣ, ꯄꯤ, ꯀꯤꯎ, ꯑꯥꯔ."
"reason cannot be regarded as given, but only as capable of being given","ꯃꯔꯝ ꯑꯁꯤ ꯄꯤꯔꯤꯕꯥ ꯑꯣꯏꯅꯥ ꯂꯧꯕꯥ ꯌꯥꯔꯣꯏ, ꯑꯗꯨꯕꯨ ꯄꯤꯕꯥ ꯉꯝꯕꯥ ꯑꯣꯏꯅꯥ ꯈꯛꯇꯃꯛ ꯂꯧꯕꯥ ꯌꯥꯔꯣꯏ꯫"
(dabilis),(ꯗꯦꯕꯤꯂꯤꯁ) ꯑꯃꯁꯨꯡ ꯑꯦꯝ.
I shall term the synthesis of the series on the side of the conditions—from,ꯑꯩꯍꯥꯛꯅꯥ ꯀꯟꯗꯤꯁꯅꯁꯤꯡꯒꯤ ꯃꯥꯏꯀꯩꯗꯥ ꯁꯤꯔꯤꯖ ꯑꯁꯤꯒꯤ ꯁꯤꯟꯊꯦꯁꯤꯁ ꯍꯥꯌꯅꯥ ꯀꯧꯒꯅꯤ—ꯃꯗꯨꯗꯒꯤ꯫
that nearest to the given phenomenon up to the more remote—regressive;,ꯍꯦꯟꯅꯥ ꯂꯥꯞꯅꯥ ꯂꯩꯕꯥ—ꯔꯤꯒ꯭ꯔꯦꯁꯤꯕ ꯐꯥꯑꯣꯕꯥ ꯄꯤꯔꯤꯕꯥ ꯐꯤꯚꯝ ꯑꯗꯨꯒꯥ ꯈ꯭ꯕꯥꯏꯗꯒꯤ ꯅꯀꯄꯥ ꯑꯗꯨ;
"that which proceeds on the side of the conditioned, from the immediate","ꯀꯟꯗꯤꯁꯅꯒꯤ ꯃꯅꯥꯛꯇꯥ ꯆꯠꯊꯔꯤꯕꯥ ꯑꯗꯨ, ꯈꯨꯗꯛꯀꯤ ꯑꯣꯏꯕꯥ ."
"consequence to the more remote, I shall call the progressive synthesis. The","ꯀꯟꯁꯤꯀꯤꯎꯟꯁ ꯇꯨ ꯍꯦꯟꯅꯥ ꯔꯤꯃꯣꯠ, ꯑꯩꯅꯥ ꯄ꯭ꯔꯣꯒ꯭ꯔꯦꯁꯤꯚ ꯁꯤꯟꯊꯦꯁꯤꯁ ꯍꯥꯌꯅꯥ ꯀꯧꯒꯅꯤ꯫"
"former proceeds in antecedentia, the latter in consequentia. The","ꯍꯥꯟꯅꯒꯤ ꯄ꯭ꯔꯣꯁꯤꯗ꯭ꯌꯨꯔ ꯑꯁꯤ ꯑꯦꯟꯇꯤꯁꯦꯗꯦꯟꯇꯤꯌꯥꯗꯥ, ꯇꯨꯡꯗꯥ ꯂꯥꯀꯄꯥ ꯑꯁꯤ ꯀꯟꯁꯦꯛꯌꯨꯑꯦꯟꯁꯤꯌꯥꯗꯥ ꯂꯩ꯫"
cosmological ideas are therefore occupied with the totality of the regressive,ꯃꯔꯝ ꯑꯁꯤꯅꯥ ꯀꯣꯁ꯭ꯃꯣꯂꯣꯖꯤꯀꯦꯜ ꯑꯥꯏꯗꯤꯌꯥꯁꯤꯡ ꯑꯁꯤ ꯔꯤꯒ꯭ꯔꯦꯁꯤꯕꯀꯤ ꯇꯣꯇꯦꯂꯤꯇꯤꯒꯥ ꯂꯣꯌꯅꯅꯥ ꯂꯩꯔꯤ .
"synthesis, and proceed in antecedentia, not in consequentia. When the latter","ꯁꯤꯟꯊꯦꯁꯤꯁ, ꯑꯃꯁꯨꯡ ꯀꯟꯁꯦꯛꯌꯨꯑꯦꯟꯁꯤꯌꯥꯗꯥ ꯅꯠꯇꯅꯥ ꯑꯦꯟꯇꯤꯁꯦꯗꯦꯟꯁꯇꯥ ꯆꯪꯁꯤꯜꯂꯨ꯫"
"takes place, it is an arbitrary and not a necessary problem of pure reason;","ꯊꯣꯀꯏ, ꯃꯁꯤ ꯑꯔꯕꯤꯠꯔꯦꯔꯤ ꯑꯃꯅꯤ ꯑꯃꯁꯨꯡ ꯑꯁꯦꯡꯕꯥ ꯃꯔꯃꯒꯤ ꯃꯊꯧ ꯇꯥꯕꯥ ꯄ꯭ꯔꯣꯕ꯭ꯂꯦꯝ ꯑꯃꯅꯤ;"
"for we require, for the complete understanding of what is given in a","ꯃꯔꯃꯗꯤ ꯑꯩꯈꯣꯌꯅꯥ ꯃꯊꯧ ꯇꯥꯔꯤ, ꯲꯰꯲꯰ꯗꯥ ꯄꯤꯔꯤꯕꯥ ꯑꯗꯨꯒꯤ ꯃꯄꯨꯡ ꯐꯥꯅꯥ ꯈꯉꯅꯕꯒꯤꯗꯃꯛ"
"phenomenon, not the consequences which succeed, but the grounds or","ꯐꯤꯚꯝ, ꯃꯥꯌ ꯄꯥꯀꯄꯥ ꯉꯃꯗꯕꯥ ꯐꯂꯁꯤꯡ ꯑꯗꯨ ꯅꯠꯇꯦ, ꯑꯗꯨꯕꯨ ."
principles which precede,ꯄ꯭ꯔꯤꯟꯁꯤꯄꯂꯁꯤꯡꯒꯤ ꯃꯃꯥꯡꯗꯥ .
In order to construct the table of ideas in correspondence with the table of,ꯒꯤ ꯇꯦꯕꯂꯒꯥ ꯂꯣꯌꯅꯅꯥ ꯋꯥꯔꯤ ꯁꯥꯅꯕꯥ ꯋꯥꯈꯜꯂꯣꯅꯁꯤꯡꯒꯤ ꯇꯦꯕꯜ ꯑꯗꯨ ꯁꯦꯃꯒꯠꯅꯕꯥ .
"categories, we take first the two primitive quanta of all our intuitions, time","ꯀꯦꯇꯦꯒꯣꯔꯤꯁꯤꯡ, ꯑꯩꯈꯣꯌꯅꯥ ꯑꯍꯥꯅꯕꯗꯥ ꯑꯩꯈꯣꯌꯒꯤ ꯏꯟꯠꯌꯨꯏꯇꯤ ꯄꯨꯝꯅꯃꯛꯀꯤ ꯄ꯭ꯔꯤꯃꯤꯇꯤꯕ ꯀ꯭ꯕꯥꯟꯇꯝ ꯑꯅꯤ ꯂꯧꯏ, ꯃꯇꯝ"
"and space. Time is in itself a series (and the formal condition of all series),",ꯑꯃꯁꯨꯡ ꯁ꯭ꯄꯦꯁ ꯂꯩ꯫
"and hence, in relation to a given present, we must distinguish à priori in it","ꯑꯃꯁꯨꯡ ꯃꯔꯝ ꯑꯁꯤꯅꯥ, ꯄꯤꯔꯤꯕꯥ ꯍꯧꯖꯤꯛꯀꯤ ꯃꯇꯝ ꯑꯁꯤꯒꯥ ꯃꯔꯤ ꯂꯩꯅꯅꯥ, ꯑꯩꯈꯣꯌꯅꯥ ꯃꯁꯤꯗꯥ à priori ꯑꯁꯤ ꯈꯦꯠꯅꯕꯥ ꯊꯃꯒꯗꯕꯅꯤ ."
the antecedentia as conditions (time past) from the consequentia (time,ꯀꯟꯁꯦꯛꯌꯨꯑꯦꯟꯁꯤꯌꯥ (ꯃꯇꯝ)ꯗꯒꯤ ꯀꯟꯗꯤꯁꯟ ꯑꯣꯏꯅꯥ ꯑꯦꯟꯇꯤꯁꯤꯗꯦꯟꯇꯤꯌꯥ (ꯃꯇꯝ ꯀꯨꯏꯅꯥ) .
"future). Consequently, the transcendental idea of the absolute totality of the",ꯇꯨꯡꯂꯝꯆꯠ).
"series of the conditions of a given conditioned, relates merely to all past","ꯑꯄꯤꯕꯥ ꯀꯟꯗꯤꯁꯟ ꯑꯃꯒꯤ ꯀꯟꯗꯤꯁꯅꯁꯤꯡꯒꯤ ꯁꯤꯔꯤꯖ, ꯁꯨꯞꯅꯒꯤ ꯍꯧꯈꯤꯕꯥ ꯃꯇꯝ ꯄꯨꯝꯅꯃꯛꯇꯥ ꯃꯔꯤ ꯂꯩꯅꯩ"
"time. According to the idea of reason, the whole past time, as the condition",ꯃꯇꯝ.
"of the given moment, is necessarily cogitated as given. But, as regards","ꯄꯤꯔꯤꯕꯥ ꯃꯇꯝ ꯑꯁꯤꯒꯤ, ꯇꯉꯥꯏꯐꯗꯅꯥ ꯄꯤꯔꯤꯕꯥ ꯑꯗꯨꯒꯨꯝꯅꯥ ꯀꯣꯖꯤꯇꯦꯗ ꯑꯣꯏ꯫"
"space, there exists in it no distinction between progressus and regressus; for","ꯁ꯭ꯄꯦꯁ, ꯃꯁꯤꯗꯥ ꯄ꯭ꯔꯣꯒ꯭ꯔꯦꯁꯁ ꯑꯃꯁꯨꯡ ꯔꯤꯒ꯭ꯔꯦꯁꯀꯤ ꯃꯔꯛꯇꯥ ꯈꯦꯠꯅꯕꯥ ꯑꯃꯠꯇꯥ ꯂꯩꯇꯦ;"
it is an aggregate and not a series—its parts existing together at the same,ꯃꯁꯤ ꯑꯦꯒ꯭ꯔꯤꯒꯦꯠ ꯑꯃꯅꯤ ꯑꯃꯁꯨꯡ ꯁꯤꯔꯤꯖ ꯑꯃꯅꯤ—ꯃꯁꯤꯒꯤ ꯁꯔꯨꯀꯁꯤꯡ ꯑꯁꯤ ꯆꯞ ꯃꯥꯟꯅꯕꯥ ꯃꯇꯃꯗꯥ ꯄꯨꯟꯅꯥ ꯂꯩꯔꯤꯕꯥ ꯁꯔꯨꯀꯁꯤꯡꯅꯤ꯫
time. I can consider a given point of time in relation to past time only as,ꯃꯇꯝ.
"conditioned, because this given moment comes into existence only through","ꯀꯟꯗꯤꯁꯟ ꯇꯧꯔꯕꯥ, ꯃꯔꯃꯗꯤ ꯃꯁꯤꯒꯤ ꯑꯄꯤꯕꯥ ꯃꯣꯃꯦꯟꯇ ꯑꯁꯤ ꯁꯨꯞꯅꯇꯒꯤ ꯑꯣꯏꯅꯥ ꯂꯥꯀꯏ"
the past time rather through the passing of the preceding time. But as the,ꯍꯧꯈꯤꯕꯥ ꯃꯇꯝ ꯑꯗꯨꯗꯥ ꯃꯗꯨꯒꯤ ꯃꯍꯨꯠꯇꯥ ꯃꯃꯥꯡꯒꯤ ꯃꯇꯝ ꯑꯗꯨ ꯂꯣꯏꯁꯤꯟꯅꯕꯥ꯫
"parts of space are not subordinated, but co-ordinated to each other, one part","ꯁ꯭ꯄꯦꯁꯀꯤ ꯁꯔꯨꯀꯁꯤꯡ ꯑꯁꯤ ꯃꯈꯥꯗꯥ ꯂꯩꯕꯥ ꯅꯠꯇꯦ, ꯑꯃꯒꯥ ꯑꯃꯒꯥ ꯀꯣ-ꯑꯣꯔꯗꯤꯅꯦꯠ ꯇꯧꯕꯥ, ꯁꯔꯨꯛ ꯑꯃꯥ"
cannot be the condition of the possibility of the other; and space is not in,ꯑꯇꯣꯞꯄꯥ ꯑꯃꯒꯤ ꯑꯣꯏꯊꯣꯀꯄꯥ ꯌꯥꯕꯒꯤ ꯀꯟꯗꯤꯁꯟ ꯑꯣꯏꯕꯥ ꯌꯥꯔꯣꯏ;
"itself, like time, a series. But the synthesis of the manifold parts of space—","ꯃꯁꯥꯃꯛ, ꯃꯇꯃꯒꯨꯝ, ꯁꯤꯔꯤꯖ ꯑꯃꯥ꯫"
(the syntheses whereby we apprehend space)—is nevertheless successive; it,(ꯑꯩꯈꯣꯌꯅꯥ ꯁ꯭ꯄꯦꯁ ꯑꯁꯤ ꯂꯧꯁꯤꯜꯂꯤꯕꯥ ꯁꯤꯟꯊꯦꯁꯤꯁꯁꯤꯡ)—ꯑꯗꯨꯝ ꯑꯣꯏꯅꯃꯛ ꯇꯨꯡꯗꯥ ꯂꯥꯀꯄꯥ;
"takes place, therefore, in time, and contains a series. And as in this series of","ꯃꯔꯝ ꯑꯗꯨꯅꯥ ꯃꯇꯃꯒꯤ ꯃꯇꯨꯡ ꯏꯟꯅꯥ ꯊꯣꯀꯏ, ꯑꯃꯁꯨꯡ ꯃꯁꯤꯗꯥ ꯁꯤꯔꯤꯖ ꯑꯃꯥ ꯌꯥꯑꯣꯏ꯫"
"aggregated spaces (for example, the feet in a rood), beginning with a given","ꯑꯦꯒ꯭ꯔꯤꯒꯦꯠ ꯇꯧꯔꯕꯥ ꯁ꯭ꯄꯦꯁꯁꯤꯡ (ꯈꯨꯗꯝ ꯑꯣꯏꯅꯥ, ꯈꯣꯡ ꯑꯗꯨ ꯔꯨꯗ ꯑꯃꯗꯥ), ꯑꯄꯤꯕꯥ ꯑꯃꯗꯒꯤ ꯍꯧꯏ꯫"
"portion of space, those which continue to be annexed form the condition of","ꯁ꯭ꯄꯦꯁꯀꯤ ꯁꯔꯨꯛ ꯑꯃꯥ, ꯃꯈꯥ ꯇꯥꯅꯥ ꯑꯦꯟꯁꯦꯁ ꯇꯧꯔꯤꯕꯥ ꯑꯁꯤꯅꯥ ꯲꯰꯲꯰ꯒꯤ ꯀꯟꯗꯤꯁꯟ ꯑꯁꯤ ꯁꯦꯝꯃꯤ꯫"
the limits of the former—the measurement of a space must also be regarded,ꯍꯥꯟꯅꯒꯤ ꯂꯤꯃꯤꯠꯁꯤꯡ—ꯁ꯭ꯄꯦꯁ ꯑꯃꯒꯤ ꯃꯥꯄꯜ ꯑꯁꯤꯁꯨ ꯂꯧꯒꯗꯕꯅꯤ .
as a synthesis of the series of the conditions of a given conditioned. It,ꯑꯄꯤꯕꯥ ꯀꯟꯗꯤꯁꯟ ꯑꯃꯒꯤ ꯀꯟꯗꯤꯁꯅꯁꯤꯡꯒꯤ ꯁꯤꯔꯤꯖ ꯑꯁꯤꯒꯤ ꯁꯤꯟꯊꯦꯁꯤꯁ ꯑꯃꯥ ꯑꯣꯏꯅꯥ꯫
"differs, however, in this respect from that of time, that the side of the","ꯑꯗꯨꯝ ꯑꯣꯏꯅꯃꯛ, ꯃꯁꯤꯒꯤ ꯃꯇꯥꯡꯗꯥ ꯃꯇꯃꯒꯤ ꯃꯇꯨꯡ ꯏꯟꯅꯥ ꯈꯦꯠꯅꯩ, ꯃꯗꯨꯗꯤ ."
conditioned is not in itself distinguishable from the side of the condition;,ꯀꯟꯗꯤꯁꯟ ꯑꯁꯤ ꯃꯁꯥ ꯃꯊꯟꯇꯥ ꯀꯟꯗꯤꯁꯅꯒꯤ ꯃꯄꯥꯟꯊꯪꯕꯥ ꯁꯔꯨꯛ ꯑꯗꯨꯗꯒꯤ ꯈꯦꯠꯅꯕꯥ ꯊꯃꯕꯥ ꯌꯥꯗꯦ;
"and, consequently, regressus and progressus in space seem to be identical","ꯑꯃꯁꯨꯡ, ꯃꯁꯤꯒꯤ ꯃꯍꯩ ꯑꯣꯏꯅꯥ, ꯁ꯭ꯄꯦꯁꯇꯥ ꯔꯤꯒ꯭ꯔꯦꯁ ꯑꯃꯁꯨꯡ ꯄ꯭ꯔꯣꯒ꯭ꯔꯦꯁꯁ ꯑꯁꯤ ꯃꯥꯟꯅꯕꯥ ꯑꯣꯏꯅꯥ ꯎꯕꯥ ꯐꯪꯏ"
"But, inasmuch as one part of space is not given, but only limited, by and","ꯑꯗꯨꯕꯨ, ꯁ꯭ꯄꯦꯁꯀꯤ ꯁꯔꯨꯛ ꯑꯃꯥ ꯄꯤꯕꯥ ꯅꯠꯇꯦ, ꯑꯗꯨꯕꯨ ꯁꯨꯞꯅꯇꯒꯤ ꯂꯤꯃꯤꯇꯦꯗ ꯑꯣꯏꯕꯥ, ꯑꯃꯁꯨꯡ"
"through another, we must also consider every limited space as conditioned,","ꯑꯇꯣꯞꯄꯥ ꯑꯃꯒꯤ ꯈꯨꯠꯊꯥꯡꯗꯥ ꯑꯩꯈꯣꯌꯅꯥ ꯂꯤꯃꯤꯇꯦꯗ ꯁ꯭ꯄꯦꯁ ꯈꯨꯗꯤꯡꯃꯀꯁꯨ ꯀꯟꯗꯤꯁꯟ ꯑꯣꯏꯅꯥ ꯂꯧꯒꯗꯕꯅꯤ,"
in so far as it presupposes some other space as the condition of its,ꯃꯁꯤꯒꯤ ꯃꯅꯨꯡꯗꯥ ꯃꯁꯤꯅꯥ ꯑꯇꯣꯞꯄꯥ ꯁ꯭ꯄꯦꯁ ꯑꯃꯥ ꯄ꯭ꯔꯤꯁꯄꯄꯁ ꯇꯧꯕꯥ ꯃꯇꯃꯗꯥ ꯃꯁꯤꯒꯤ ꯀꯟꯗꯤꯁꯟ ꯑꯁꯤ .
"limitation, and so on. As regards limitation, therefore, our procedure in","ꯂꯤꯃꯤꯇꯦꯁꯟ, ꯑꯁꯤꯅꯆꯤꯡꯕꯥ꯫"
"space is also a regressus, and the transcendental idea of the absolute totality","ꯁ꯭ꯄꯦꯁ ꯑꯁꯤꯁꯨ ꯔꯤꯒ꯭ꯔꯦꯁ ꯑꯃꯅꯤ, ꯑꯃꯁꯨꯡ ꯑꯦꯕꯁꯣꯜꯌꯨꯠ ꯇꯣꯇꯦꯂꯤꯇꯤꯒꯤ ꯇ꯭ꯔꯥꯟꯁꯦꯟꯗꯦꯟꯇꯜ ꯑꯥꯏꯗꯤꯌꯥ ꯑꯁꯤ ."
of the synthesis in a series of conditions applies to space also; and I am,ꯀꯟꯗꯤꯁꯅꯁꯤꯡꯒꯤ ꯁꯤꯔꯤꯖ ꯑꯃꯗꯥ ꯁꯤꯟꯊꯦꯁꯤꯁꯀꯤ ꯃꯇꯥꯡꯗꯥ ꯁ꯭ꯄꯦꯁꯇꯥꯁꯨ ꯆꯠꯅꯩ;
entitled to demand the absolute totality of the phenomenal synthesis in,꯲꯰꯲꯰ꯗꯥ ꯐꯦꯅꯣꯃꯦꯅꯦꯜ ꯁꯤꯟꯊꯦꯁꯤꯁꯀꯤ ꯑꯦꯕꯁꯣꯜꯌꯨꯇꯦꯗ ꯇꯣꯇꯦꯂꯤꯇꯤ ꯑꯗꯨ ꯗꯤꯃꯥꯟꯗ ꯇꯧꯕꯒꯤ ꯍꯛ ꯂꯩ꯫
space as well as in time. Whether my demand can be satisfied is a question,ꯁ꯭ꯄꯦꯁ ꯑꯗꯨꯒꯥ ꯂꯣꯌꯅꯅꯥ ꯃꯇꯃꯒꯤ ꯃꯇꯨꯡ ꯏꯟꯅꯥ꯫
to be answered in the sequel,ꯁꯤꯛꯌꯨꯏꯂꯗꯥ ꯄꯥꯎꯈꯨꯝ ꯄꯤꯕꯥ
"Secondly, the real in space—that is, matter—is conditioned. Its internal","ꯑꯅꯤꯁꯨꯕꯗꯥ, ꯁ꯭ꯄꯦꯁꯇꯥ ꯂꯩꯔꯤꯕꯥ ꯑꯁꯦꯡꯕꯥ ꯑꯗꯨ—ꯃꯗꯨꯗꯤ ꯃꯦꯇꯔꯅꯤ – ꯀꯟꯗꯤꯁꯟ ꯇꯧꯏ꯫"
"conditions are its parts, and the parts of parts its remote conditions; so that","ꯀꯟꯗꯤꯁꯅꯁꯤꯡ ꯑꯁꯤ ꯃꯁꯤꯒꯤ ꯁꯔꯨꯀꯁꯤꯡꯅꯤ, ꯑꯃꯁꯨꯡ ꯃꯁꯤꯒꯤ ꯁꯔꯨꯀꯁꯤꯡꯒꯤ ꯁꯔꯨꯀꯁꯤꯡ ꯑꯁꯤ ꯃꯁꯤꯒꯤ ꯔꯤꯃꯣꯠ ꯀꯟꯗꯤꯁꯅꯁꯤꯡꯅꯤ;"
"in this case we find a regressive synthesis, the absolute totality of which is a","ꯃꯁꯤꯒꯤ ꯀꯦꯁ ꯑꯁꯤꯗꯥ ꯑꯩꯈꯣꯌꯅꯥ ꯔꯤꯒ꯭ꯔꯦꯁꯤꯕ ꯁꯤꯟꯊꯦꯁꯤꯁ ꯑꯃꯥ ꯐꯪꯏ, ꯃꯗꯨꯒꯤ ꯑꯦꯕꯁꯣꯜꯌꯨꯇꯦꯗ ꯇꯣꯇꯦꯂꯤꯇꯤ ꯑꯁꯤ ꯑꯦ ."
demand of reason. But this cannot be obtained otherwise than by a complete,ꯔꯤꯖꯅꯦꯂꯒꯤ ꯗꯤꯃꯥꯟꯗ꯫
"division of parts, whereby the real in matter becomes either nothing or that","ꯄꯥꯔꯇꯁꯤꯡꯒꯤ ꯗꯤꯚꯤꯖꯟ, ꯃꯗꯨꯗꯥ ꯔꯤꯌꯦꯜ ꯏꯟ ꯃꯦꯇꯔ ꯑꯁꯤ ꯀꯔꯤꯁꯨ ꯑꯣꯏꯔꯀꯏ ꯅꯠꯔꯒꯥ ꯑꯗꯨ ꯑꯣꯏꯔꯀꯏ ."
"which is not matter, that is to say, the simple. Consequently we find here","ꯃꯁꯤ ꯋꯥꯐꯝ ꯅꯠꯇꯦ, ꯍꯥꯌꯕꯗꯤ ꯁꯤꯝꯄꯜ꯫"
also a series of conditions and a progress to the unconditioned,ꯑꯗꯨꯒꯥ ꯀꯟꯗꯤꯁꯟ ꯀꯌꯥ ꯑꯃꯥ ꯑꯃꯁꯨꯡ ꯑꯅꯀꯟꯗꯤꯁꯟꯗꯥ ꯄ꯭ꯔꯣꯒ꯭ꯔꯦꯁ ꯑꯃꯥ .
"Thirdly, as regards the categories of a real relation between phenomena,","ꯑꯍꯨꯃꯁꯨꯕꯥ, ꯐꯤꯚꯃꯁꯤꯡꯒꯤ ꯃꯔꯛꯇꯥ ꯂꯩꯔꯤꯕꯥ ꯇꯁꯦꯡꯕꯥ ꯃꯔꯤ ꯑꯃꯒꯤ ꯀꯦꯇꯦꯒꯣꯔꯤꯁꯤꯡꯒꯤ ꯃꯇꯥꯡꯗꯥ ꯍꯥꯌꯔꯕꯗꯥ,"
the category of substance and its accidents is not suitable for the formation,ꯁꯕ꯭ꯁꯇꯦꯟꯁꯀꯤ ꯀꯦꯇꯦꯒꯣꯔꯤ ꯑꯃꯁꯨꯡ ꯃꯁꯤꯒꯤ ꯑꯦꯛꯁꯤꯗꯦꯟꯇꯁꯤꯡ ꯑꯁꯤ ꯁꯦꯃꯒꯠꯄꯗꯥ ꯆꯨꯃꯗ꯭ꯔꯤꯡꯅꯥ .
"of a transcendental idea; that is to say, reason has no ground, in regard to it,",ꯇ꯭ꯔꯥꯟꯁꯦꯟꯗꯦꯟꯇꯜ ꯑꯥꯏꯗꯤꯌꯥ ꯑꯃꯒꯤ;
to proceed regressively with conditions. For accidents (in so far as they,ꯀꯟꯗꯤꯁꯅꯁꯤꯡꯒꯥ ꯂꯣꯌꯅꯅꯥ ꯔꯤꯒ꯭ꯔꯦꯁꯤꯕ ꯑꯣꯏꯅꯥ ꯆꯠꯊꯕꯥ꯫
"inhere in a substance) are co-ordinated with each other, and do not","ꯏꯅꯍꯦꯔꯦ ꯏꯟ ꯑꯦ ꯁꯁ꯭ꯇꯦꯟꯁ) ꯑꯁꯤ ꯑꯃꯒꯥ ꯑꯃꯒꯥ ꯀꯣ-ꯑꯣꯔꯗꯤꯅꯦꯠ ꯇꯧꯏ, ꯑꯃꯁꯨꯡ ."
"constitute a series. And, in relation to substance, they are not properly",ꯁꯤꯔꯤꯖ ꯑꯃꯥ ꯁꯦꯝꯕꯥ꯫
"subordinated to it, but are the mode of existence of the substance itself. The","ꯃꯁꯤꯒꯤ ꯃꯈꯥꯗꯥ ꯂꯩꯕꯥ, ꯑꯗꯨꯕꯨ ꯄꯣꯠꯁꯛ ꯑꯗꯨꯒꯤ ꯃꯁꯥꯒꯤ ꯑꯣꯏꯕꯥ ꯃꯑꯣꯡꯅꯤ꯫"
conception of the substantial might nevertheless seem to be an idea of the,ꯑꯗꯨꯝ ꯑꯣꯏꯅꯃꯛ ꯃꯁꯛ ꯊꯣꯀꯄꯥ ꯑꯣꯏꯕꯥ ꯌꯥꯕꯥ ꯋꯥꯈꯜꯂꯣꯅꯒꯤ ꯋꯥꯈꯜꯂꯣꯟ ꯑꯁꯤ ꯋꯥꯐꯝ ꯑꯁꯤꯒꯤ ꯋꯥꯈꯜꯂꯣꯟ ꯑꯃꯥ ꯑꯣꯏꯅꯥ ꯎꯕꯥ ꯐꯪꯏ꯫
"transcendental reason. But, as this signifies nothing more than the",ꯇ꯭ꯔꯥꯟꯁꯦꯟꯗꯦꯟꯇꯜ ꯑꯣꯏꯕꯥ ꯃꯔꯝ꯫
"conception of an object in general, which subsists in so far as we cogitate in","ꯃꯍꯧꯁꯥꯅꯥ ꯄꯣꯠꯁꯛ ꯑꯃꯒꯤ ꯀꯟꯁꯦꯄꯁꯟ, ꯃꯗꯨ ꯑꯩꯈꯣꯌꯅꯥ ꯀꯣꯖꯤꯇꯦꯠ ꯇꯧꯕꯥ ꯃꯇꯃꯗꯥ ꯌꯥꯝꯅꯥ ꯋꯥꯡꯅꯥ ꯂꯦꯞꯂꯤ꯫"
it merely a transcendental subject without any predicates; and as the,ꯃꯁꯤ ꯁꯨꯞꯅꯇꯒꯤ ꯄ꯭ꯔꯦꯗꯤꯀꯦꯠ ꯑꯃꯠꯇꯥ ꯂꯩꯇꯕꯥ ꯇ꯭ꯔꯥꯟꯁꯦꯟꯗꯦꯟꯇꯜ ꯁꯕꯖꯦꯛꯇ ꯑꯃꯈꯛꯇꯅꯤ;
question here is of an unconditioned in the series of phenomena—it is clear,ꯃꯐꯝ ꯑꯁꯤꯗꯥ ꯋꯥꯍꯪ ꯑꯁꯤ ꯐꯤꯚꯃꯁꯤꯡꯒꯤ ꯁꯤꯔꯤꯖ ꯑꯁꯤꯗꯥ ꯀꯟꯗꯤꯁꯟ ꯂꯩꯇꯕꯥ ꯑꯃꯅꯤ—ꯃꯁꯤ ꯃꯌꯦꯛ ꯁꯦꯡꯏ
that the substantial can form no member thereof. The same holds good of,ꯃꯗꯨꯗꯤ ꯁꯁ꯭ꯇꯦꯅꯦꯕꯜ ꯑꯁꯤꯅꯥ ꯃꯗꯨꯒꯤ ꯃꯦꯝꯕꯔ ꯑꯃꯠꯇꯥ ꯁꯦꯝꯕꯥ ꯉꯃꯗꯦ꯫
"substances in community, which are mere aggregates and do not form a","ꯀꯝꯝꯌꯨꯅꯤꯇꯤꯗꯥ ꯂꯩꯕꯥ ꯄꯣꯠꯁꯀꯁꯤꯡ, ꯃꯈꯣꯌꯁꯤꯡ ꯑꯁꯤ ꯁꯨꯞꯅꯒꯤ ꯑꯦꯒ꯭ꯔꯤꯒꯦꯇꯔꯁꯤꯡꯅꯤ ꯑꯃꯁꯨꯡ ꯑꯦ."
series. For they are not subordinated to each other as conditions of the,ꯄꯔꯤꯡ.
"possibility of each other; which, however, may be affirmed of spaces, the",ꯑꯃꯒꯥ ꯑꯃꯒꯥ ꯑꯣꯏꯊꯣꯀꯄꯥ ꯌꯥꯕꯥ;
"limits of which are never determined in themselves, but always by some","ꯃꯁꯤꯒꯤ ꯂꯤꯃꯤꯠꯁꯤꯡ ꯑꯁꯤ ꯀꯩꯗꯧꯅꯨꯡꯗꯥ ꯃꯁꯥ ꯃꯊꯟꯇꯥ ꯂꯦꯄꯆꯕꯥ ꯉꯃꯗꯦ, ꯑꯗꯨꯕꯨ ꯃꯇꯝ ꯄꯨꯝꯅꯃꯛꯇꯥ ꯈꯔꯅꯥ ."
"other space. It is, therefore, only in the category of causality that we can",ꯑꯇꯣꯞꯄꯥ ꯁ꯭ꯄꯦꯁ ꯑꯃꯥ ꯂꯩ꯫
"find a series of causes to a given effect, and in which we ascend from the","ꯑꯄꯤꯕꯥ ꯏꯐꯦꯛꯇ ꯑꯃꯒꯤ ꯃꯔꯃꯗꯥ ꯃꯔꯝ ꯀꯌꯥ ꯑꯃꯥ ꯊꯤꯕꯤꯌꯨ, ꯑꯃꯁꯨꯡ ꯃꯗꯨꯗꯥ ꯑꯩꯈꯣꯌꯅꯥ ."
"latter, as the conditioned, to the former as the conditions, and thus answer","ꯇꯨꯡꯗꯥ, ꯀꯟꯗꯤꯁꯟ ꯑꯣꯏꯅꯥ, ꯍꯥꯟꯅꯒꯤ ꯀꯟꯗꯤꯁꯟ ꯑꯣꯏꯅꯥ, ꯑꯃꯁꯨꯡ ꯃꯁꯤꯅꯥ ꯄꯥꯎꯈꯨꯝ ꯄꯤꯕꯥ"
the question of reason,ꯃꯔꯃꯒꯤ ꯋꯥꯍꯪ ꯑꯁꯤ .
"Fourthly, the conceptions of the possible, the actual, and the necessary do","ꯃꯔꯤꯁꯨꯕꯗꯥ, ꯑꯣꯏꯊꯣꯀꯄꯥ ꯌꯥꯕꯥ, ꯇꯁꯦꯡꯕꯥ ꯑꯃꯁꯨꯡ ꯃꯊꯧ ꯇꯥꯕꯥ ꯗꯣꯒꯤ ꯋꯥꯈꯜꯂꯣꯅꯁꯤꯡ"
not conduct us to any series—excepting only in so far as the contingent in,ꯑꯩꯈꯣꯌꯕꯨ ꯁꯤꯔꯤꯖ ꯑꯃꯠꯇꯗꯥ ꯀꯟꯗꯥꯛꯇ ꯇꯧꯔꯣꯏꯗꯕꯅꯤ—ꯃꯗꯨꯗꯥ ꯀꯟꯇꯤꯟꯖꯦꯟꯇ ꯐꯥꯑꯣꯕꯥ ꯈꯛꯇꯗꯥ ꯅꯠꯇꯅꯥ꯫
"existence must always be regarded as conditioned, and as indicating,","ꯂꯩꯔꯤꯕꯥ ꯑꯁꯤ ꯃꯇꯝ ꯄꯨꯝꯅꯃꯛꯇꯥ ꯀꯟꯗꯤꯁꯟ ꯂꯩꯕꯥ ꯑꯣꯏꯅꯥ ꯂꯧꯒꯗꯕꯅꯤ, ꯑꯃꯁꯨꯡ ꯏꯟꯗꯤꯀꯦꯇꯤꯡ ꯑꯣꯏꯅꯥ ꯂꯧꯒꯗꯕꯅꯤ, ."
"according to a law of the understanding, a condition, under which it is","ꯂꯧꯁꯤꯡꯒꯤ ꯑꯥꯏꯟ ꯑꯃꯒꯤ ꯃꯇꯨꯡ ꯏꯟꯅꯥ, ꯀꯟꯗꯤꯁꯟ ꯑꯃꯒꯤ ꯃꯇꯨꯡ ꯏꯟꯅꯥ, ꯃꯁꯤꯒꯤ ꯃꯈꯥꯗꯥ ꯃꯁꯤ ."
"necessary to rise to a higher, till in the totality of the series, reason arrives at","ꯃꯊꯧ ꯇꯥꯕꯥ ꯍꯦꯟꯅꯥ ꯋꯥꯡꯕꯥ ꯑꯃꯗꯥ, ꯁꯤꯔꯤꯖ ꯑꯁꯤꯒꯤ ꯑꯄꯨꯅꯕꯥ ꯑꯣꯏꯅꯥ, ꯃꯔꯝ ꯑꯗꯨꯅꯥ ꯌꯧꯔꯛꯂꯕꯥ ꯃꯇꯨꯡꯗꯥ꯫"
unconditioned necessity,ꯑꯅꯀꯟꯗꯤꯁꯟ ꯂꯩꯕꯥ ꯇꯉꯥꯏꯐꯗꯕꯥ .
"There are, accordingly, only four cosmological ideas, corresponding with","ꯃꯁꯤꯒꯤ ꯃꯇꯨꯡ ꯏꯟꯅꯥ, ꯀꯣꯁ꯭ꯃꯣꯂꯣꯖꯤꯀꯦꯜ ꯑꯣꯏꯕꯥ ꯋꯥꯈꯜꯂꯣꯟ ꯃꯔꯤ ꯈꯛꯇꯃꯛ ꯂꯩꯔꯤ, ꯃꯗꯨꯒꯥ ꯃꯥꯟꯅꯕꯥ ."
the four titles of the categories. For we can select only such as necessarily,ꯀꯦꯇꯦꯒꯣꯔꯤꯁꯤꯡꯒꯤ ꯇꯥꯏꯇꯦꯜ ꯃꯔꯤ꯫
furnish us with a series in the synthesis of the manifold,ꯃꯦꯅꯤꯐꯣꯜꯗꯀꯤ ꯁꯤꯟꯊꯦꯁꯤꯁꯇꯥ ꯁꯤꯔꯤꯖ ꯑꯃꯥ ꯑꯩꯈꯣꯌꯗꯥ ꯄꯤꯕꯤꯌꯨ
1,꯱.
The absolute Completeness,ꯃꯄꯨꯡ ꯐꯥꯕꯥ ꯃꯄꯨꯡ ꯐꯥꯕꯥ .
of the,ꯒꯤ ꯃꯅꯨꯡꯗꯥ ꯂꯩꯕꯥ .
COMPOSITION,ꯃꯆꯜ
of the given totality of all phenomena,ꯐꯤꯚꯝ ꯄꯨꯝꯅꯃꯛꯀꯤ ꯑꯄꯤꯕꯥ ꯇꯣꯇꯦꯂꯤꯇꯤꯒꯤ ꯃꯇꯥꯡꯗꯥ .
2,꯲ ꯑꯃꯁꯨꯡ ꯲.
The absolute Completeness,ꯃꯄꯨꯡ ꯐꯥꯕꯥ ꯃꯄꯨꯡ ꯐꯥꯕꯥ .
of the,ꯒꯤ ꯃꯅꯨꯡꯗꯥ ꯂꯩꯕꯥ .
DIVISION,ꯗꯤꯕꯤꯖꯅꯒꯤ ꯃꯇꯥꯡꯗꯥ ꯌꯨ.ꯑꯦꯁ.
of given totality in a phenomenon,ꯐꯤꯚꯝ ꯑꯃꯗꯥ ꯄꯤꯔꯤꯕꯥ ꯇꯣꯇꯦꯂꯤꯇꯤꯒꯤ ꯃꯇꯥꯡꯗꯥ .
3,꯳ ꯑꯃꯁꯨꯡ ꯳.
The absolute Completeness,ꯃꯄꯨꯡ ꯐꯥꯕꯥ ꯃꯄꯨꯡ ꯐꯥꯕꯥ .
of the,ꯒꯤ ꯃꯅꯨꯡꯗꯥ ꯂꯩꯕꯥ .
ORIGINATION,ꯑꯣꯔꯤꯖꯤꯅꯦꯁꯟ ꯇꯧꯕꯥ
of a phenomenon,ꯐꯤꯚꯝ ꯑꯃꯒꯤ ꯃꯇꯥꯡꯗꯥ .
4,꯴ ꯑꯃꯁꯨꯡ ꯴.
The absolute Completeness,ꯃꯄꯨꯡ ꯐꯥꯕꯥ ꯃꯄꯨꯡ ꯐꯥꯕꯥ .
of the DEPENDENCE of the EXISTENCE,ꯂꯩꯔꯤꯕꯥ ꯑꯁꯤꯒꯤ ꯃꯈꯥ ꯄꯣꯅꯕꯥ ꯑꯁꯤꯒꯤ ꯃꯇꯥꯡꯗꯥ .
of what is changeable in a phenomenon,ꯐꯤꯚꯝ ꯑꯃꯗꯥ ꯍꯣꯡꯂꯛꯂꯤꯕꯥ ꯑꯁꯤꯒꯤ ꯃꯇꯥꯡꯗꯥ .
"We must here remark, in the first place, that the idea of absolute totality","ꯑꯩꯈꯣꯌꯅꯥ ꯃꯐꯝ ꯑꯁꯤꯗꯥ ꯔꯤꯃꯥꯔꯛ ꯇꯧꯒꯗꯕꯅꯤ, ꯑꯍꯥꯅꯕꯥ ꯃꯐꯃꯗꯥ, ꯑꯦꯕꯁꯣꯜꯌꯨꯇꯦꯗ ꯇꯣꯇꯦꯂꯤꯇꯤꯒꯤ ꯋꯥꯈꯜꯂꯣꯟ ꯑꯗꯨ ."
"relates to nothing but the exposition of phenomena, and therefore not to the","ꯐꯤꯚꯃꯁꯤꯡꯒꯤ ꯑꯦꯛꯁꯄꯣꯖꯤꯁꯟ ꯅꯠꯇꯕꯥ ꯑꯇꯣꯞꯄꯥ ꯑꯃꯠꯇꯥꯒꯥ ꯃꯔꯤ ꯂꯩꯅꯩ, ꯑꯃꯁꯨꯡ ꯃꯔꯝ ꯑꯁꯤꯅꯥ ."
"pure conception of a totality of things. Phenomena are here, therefore,",ꯄꯣꯠꯁꯤꯡꯒꯤ ꯇꯣꯇꯦꯂꯤꯇꯤ ꯑꯃꯒꯤ ꯄ꯭ꯌꯨꯔ ꯀꯟꯁꯦꯄꯁꯟ꯫
"regarded as given, and reason requires the absolute completeness of the","ꯄꯤꯔꯤꯕꯥ ꯑꯣꯏꯅꯥ ꯂꯧꯔꯤꯕꯥ, ꯑꯃꯁꯨꯡ ꯃꯔꯝ ꯑꯁꯤꯅꯥ ꯃꯄꯨꯡ ꯐꯥꯕꯥ ꯃꯄꯨꯡ ꯐꯥꯕꯥ ꯃꯊꯧ ꯇꯥꯏ ."
"conditions of their possibility, in so far as these conditions constitute a","ꯃꯈꯣꯌꯒꯤ ꯑꯣꯏꯊꯣꯀꯄꯥ ꯌꯥꯕꯁꯤꯡꯒꯤ ꯀꯟꯗꯤꯁꯅꯁꯤꯡ, ꯍꯧꯖꯤꯛ ꯐꯥꯑꯣꯕꯗꯥ ꯀꯟꯗꯤꯁꯅꯁꯤꯡ ꯑꯁꯤꯅꯥ ꯑꯦ ."
"series—consequently an absolutely (that is, in every respect) complete",ꯁꯤꯔꯤꯖ—ꯃꯁꯤꯒꯤ ꯃꯍꯩ ꯑꯣꯏꯅꯥ ꯃꯄꯨꯡ ꯐꯥꯅꯥ (ꯃꯗꯨꯗꯤ ꯃꯇꯥꯡ ꯈꯨꯗꯤꯡꯃꯛꯇꯥ) ꯃꯄꯨꯡ ꯐꯥꯕꯥ
"synthesis, whereby a phenomenon can be explained according to the laws","ꯁꯤꯟꯊꯦꯁꯤꯁ, ꯃꯗꯨꯗꯥ ꯐꯤꯚꯝ ꯑꯃꯥ ꯑꯥꯏꯅꯁꯤꯡꯒꯤ ꯃꯇꯨꯡ ꯏꯟꯅꯥ ꯃꯌꯦꯛ ꯁꯦꯡꯅꯥ ꯇꯥꯀꯄꯥ ꯌꯥꯏ ."
of the understanding,ꯂꯧꯁꯤꯡꯒꯤ ꯃꯇꯥꯡꯗꯥ ꯋꯥꯐꯝ ꯀꯌꯥ ꯊꯃꯈꯤ꯫
"Secondly, it is properly the unconditioned alone that reason seeks in this","ꯑꯅꯤꯁꯨꯕꯗꯥ, ꯃꯔꯝ ꯆꯥꯅꯥ ꯀꯟꯗꯤꯁꯟ ꯂꯩꯇꯕꯥ ꯈꯛꯇꯅꯥ ꯃꯔꯝ ꯑꯣꯏꯗꯨꯅꯥ ꯃꯁꯤꯗꯥ ꯊꯤꯔꯤꯕꯥ ."
"serially and regressively conducted synthesis of conditions. It wishes, to",ꯀꯟꯗꯤꯁꯅꯁꯤꯡꯒꯤ ꯁꯤꯔꯤꯑꯦꯜ ꯑꯃꯁꯨꯡ ꯔꯤꯒ꯭ꯔꯦꯁꯤꯕ ꯑꯣꯏꯅꯥ ꯁꯤꯟꯊꯦꯁꯤꯁ ꯇꯧꯕꯥ꯫
"speak in another way, to attain to completeness in the series of premisses, so","ꯑꯇꯣꯞꯄꯥ ꯃꯑꯣꯡ ꯑꯃꯗꯥ ꯋꯥ ꯉꯥꯡꯕꯤꯌꯨ, ꯄ꯭ꯔꯤꯃꯤꯁꯅꯁꯤꯡꯒꯤ ꯁꯤꯔꯤꯖ ꯑꯁꯤꯗꯥ ꯃꯄꯨꯡ ꯐꯥꯕꯥ ꯑꯗꯨ ꯐꯪꯅꯕꯥ, ꯃꯔꯝ ꯑꯗꯨꯅꯥ"
