en,mni-Mtei
6 Service user involvement................................................................................................................................58,6 ꯁꯔꯚꯤꯁ ꯌꯨꯖꯔ ꯏꯅꯚꯣꯂꯕꯃꯦꯟꯇ.................................................................................................................................................
What are the types of service user involvement? ..........................................................................................59,ꯁꯔꯚꯤꯁ ꯌꯨꯖꯔ ꯏꯅꯚꯣꯂꯕꯃꯦꯟꯇꯀꯤ ꯃꯈꯂꯁꯤꯡ ꯑꯁꯤ ꯀꯔꯤꯅꯣ?
What are the principles of good service user involvement? .........................................................................62,ꯑꯐꯕꯥ ꯁꯔꯚꯤꯁ ꯌꯨꯖꯔ ꯏꯅꯚꯣꯂꯕꯃꯦꯟꯇꯀꯤ ꯄ꯭ꯔꯤꯟꯁꯤꯄꯂꯁꯤꯡ ꯑꯁꯤ ꯀꯔꯤꯅꯣ?
What are the challenges associated with service user involvement? ..........................................................64,ꯁꯔꯚꯤꯁ ꯌꯨꯖꯔ ꯏꯅꯚꯣꯂꯕꯃꯦꯟꯇꯀꯥ ꯃꯔꯤ ꯂꯩꯅꯕꯥ ꯁꯤꯡꯅꯕꯁꯤꯡ ꯑꯗꯨ ꯀꯔꯤꯅꯣ?
What are the benefits associated with service user involvement? ..............................................................64,ꯁꯔꯚꯤꯁ ꯌꯨꯖꯔ ꯏꯅꯚꯣꯂꯕꯃꯦꯟꯇꯀꯥ ꯃꯔꯤ ꯂꯩꯅꯕꯥ ꯀꯥꯟꯅꯕꯁꯤꯡ ꯑꯗꯨ ꯀꯔꯤ ꯀꯔꯤꯅꯣ?
7 Surviving or thriving at work? What helps staff?........................................................................................66,꯷ ꯊꯕꯛꯇꯥ ꯍꯤꯡꯗꯨꯅꯥ ꯂꯩꯕꯥ ꯅꯠꯔꯒꯥ ꯊꯋꯥꯏ ꯌꯥꯑꯣꯕꯥ?
Wellbeing and burnout....................................................................................................................................68,ꯋꯦꯂꯕꯤꯡ ꯑꯃꯁꯨꯡ ꯕꯔꯅꯑꯥꯎꯠ........................................................................................................................................
What do you need in order to do this work?..................................................................................................69,ꯊꯕꯛ ꯑꯁꯤ ꯇꯧꯅꯕꯒꯤꯗꯃꯛꯇꯥ ꯑꯗꯣꯝꯅꯥ ꯀꯔꯤ ꯃꯊꯧ ꯇꯥꯔꯤꯕꯒꯦ?..............................................................................................................................................
Developing your capacity to work with people with personality disorders..................................................70,ꯄꯔꯁꯣꯅꯦꯂꯤꯇꯤ ꯗꯤꯁꯑꯣꯔꯗꯔ ꯂꯩꯕꯥ ꯃꯤꯑꯣꯏꯁꯤꯡꯒꯥ ꯊꯕꯛ ꯇꯧꯃꯤꯟꯅꯕꯒꯤ ꯑꯗꯣꯃꯒꯤ ꯀꯦꯄꯥꯁꯤꯇꯤ ꯑꯗꯨ ꯁꯦꯃꯒꯠꯄꯥ.......................................................꯷꯰
Working in teams ..............................................................................................................................................71,ꯇꯤꯃꯁꯤꯡꯗꯥ ....................................... ꯷꯱...꯷꯱...꯷꯱ ꯱.
Appendix 1: Specific psychological therapies which may be available,ꯑꯦꯄꯦꯟꯗꯤꯛꯁ 1: ꯑꯀꯛꯅꯕꯥ ꯁꯥꯏꯀꯣꯂꯣꯖꯤꯀꯦꯜ ꯊꯦꯔꯥꯄꯤꯁꯤꯡ ꯌꯥꯎꯕꯥ ꯌꯥꯏ
for people with personality disorders.............................................................................................76,ꯄꯔꯁꯣꯅꯦꯂꯤꯇꯤ ꯗꯤꯁꯑꯣꯔꯗꯔ ꯂꯩꯕꯥ ꯃꯤꯑꯣꯏꯁꯤꯡꯒꯤ ꯑꯣꯏꯅꯥ................................................................................................................꯷꯶
Appendix 2: References and resources ..............................................................................................................79,ꯑꯦꯄꯦꯟꯗꯤꯛꯁ ꯲: ꯔꯦꯐꯥꯔꯦꯟꯁ ꯑꯃꯁꯨꯡ ꯔꯤꯁꯣꯔꯁꯁꯤꯡ ....................................................................................................
"At the same time, the government has",ꯃꯇꯝ ꯑꯗꯨꯃꯛꯇꯗꯥ ꯁꯔꯀꯥꯔꯅꯥ [...]
provided additional funding for,ꯒꯤꯗꯃꯛꯇꯥ ꯑꯍꯦꯅꯕꯥ ꯐꯟꯗ ꯄꯤꯕꯥ
specialist and innovative services and,ꯁ꯭ꯄꯦꯁꯤꯑꯦꯂꯤꯁ꯭ꯠ ꯑꯃꯁꯨꯡ ꯑꯅꯧꯕꯥ ꯁꯔꯚꯤꯁꯁꯤꯡ ꯑꯃꯁꯨꯡ ꯑꯦꯝ.ꯑꯦꯁ.ꯑꯦꯝ.ꯏ.
the publication of guidance documents,ꯒꯥꯏꯗꯂꯥꯏꯟ ꯗꯣꯀꯨꯃꯦꯟꯇꯁꯤꯡ ꯐꯣꯉꯕꯥ
about workforce development and,ꯋꯥꯔꯀꯐꯣꯔꯁ ꯗꯤꯕꯦꯂꯄꯃꯦꯟꯇꯀꯤ ꯃꯇꯥꯡꯗꯥ ꯑꯃꯁꯨꯡ [...]
commissioning of services for people,ꯃꯤꯑꯣꯏꯁꯤꯡꯒꯤꯗꯃꯛ ꯁꯔꯚꯤꯁ ꯀꯃꯤꯁꯟ ꯇꯧꯕꯥ
with personality disorder,ꯄꯔꯁꯣꯅꯦꯂꯤꯇꯤ ꯗꯤꯁꯑꯣꯔꯗꯔꯒꯥ ꯂꯣꯌꯅꯅꯥ .
In 2003 the Department of Health,꯲꯰꯰꯳ꯗꯥ ꯍꯀꯁꯦꯜ ꯕꯤꯚꯥꯒꯅꯥ ꯌꯨ.ꯑꯦꯁ.
published No Longer a Diagnosis of,ꯐꯣꯡꯂꯕꯥ ꯃꯇꯨꯡꯗꯥ ꯐꯣꯉꯈꯤꯕꯥ
"Exclusion,a guidance document which","ꯑꯦꯛꯁꯛꯂꯨꯁꯟ, ꯒꯥꯏꯗꯂꯥꯏꯟ ꯗꯣꯀꯨꯃꯦꯟꯇ ꯑꯃꯥ ."
highlighted the failure of mainstream,ꯃꯦꯅꯁ꯭ꯠꯔꯤꯃꯒꯤ ꯃꯥꯌ ꯄꯥꯀꯄꯥ ꯑꯗꯨ ꯐꯣꯡꯗꯣꯀꯈꯤ ꯫
mental health services to identify and,ꯃꯦꯟꯇꯦꯜ ꯍꯦꯜꯊ ꯁꯔꯚꯤꯁꯁꯤꯡ ꯃꯁꯛ ꯈꯉꯗꯣꯛꯅꯕꯥ ꯑꯃꯁꯨꯡ .
provide appropriate treatment for those,ꯃꯈꯣꯌꯁꯤꯡ ꯑꯗꯨꯒꯤꯗꯃꯛ ꯃꯇꯤꯛ ꯆꯥꯕꯥ ꯂꯥꯌꯦꯡ ꯄꯤꯕꯥ
with personality disorder or other complex,ꯄꯔꯁꯣꯅꯦꯂꯤꯇꯤ ꯗꯤꯁꯑꯣꯔꯗꯔ ꯅꯠꯠꯔꯒꯥ ꯑꯇꯩ ꯀꯃꯞꯂꯦꯛꯁ ꯑꯃꯒꯥ ꯂꯣꯌꯅꯅꯥ .
psycho- social disorders.A programme,ꯁꯥꯏꯀꯣ- ꯁꯣꯁꯤꯑꯦꯜ ꯗꯤꯁꯑꯣꯔꯗꯔꯁꯤꯡ꯫ꯄ꯭ꯔꯣꯒ꯭ꯔꯥꯝ ꯑꯃꯥ
to develop 11 community personality,ꯀꯝꯌꯨꯅꯤꯇꯤ ꯄꯔꯁꯣꯅꯦꯂꯤꯇꯤ ꯱꯱ ꯁꯦꯃꯒꯠꯄꯥ .
disorder services was established in,ꯗꯤꯁꯑꯣꯔꯗꯔ ꯁꯔꯚꯤꯁꯁꯤꯡ ꯑꯁꯤ ꯲꯰꯲꯰ꯗꯥ ꯂꯤꯡꯈꯠꯈꯤ꯫
2005 with the aim of testing new,꯲꯰꯰꯵ꯗꯥ ꯑꯅꯧꯕꯥ ꯇꯦꯁ꯭ꯠ ꯇꯧꯕꯒꯤ ꯄꯥꯟꯗꯃꯒꯥ ꯂꯣꯌꯅꯅꯥ ꯑꯦꯟ.ꯗꯤ.ꯑꯦ.
service models and evaluating their,ꯁꯔꯚꯤꯁ ꯃꯣꯗꯦꯂꯁꯤꯡ ꯑꯃꯁꯨꯡ ꯃꯈꯣꯌꯒꯤ ꯏꯚꯥꯂꯨꯑꯦꯁꯟ ꯇꯧꯕꯥ
effectiveness.The majority of these,ꯏꯐꯦꯛꯇꯤꯕꯅꯦꯁ꯫ꯃꯁꯤꯒꯤ ꯃꯅꯨꯡꯗꯥ ꯑꯌꯥꯝꯕꯅꯥ ꯑꯦꯝ.ꯑꯦꯁ.ꯑꯦꯝ.ꯏ.
pilot services have since transferred,ꯄꯥꯏꯂꯣꯠ ꯁꯔꯕꯤꯁꯁꯤꯡ ꯑꯁꯤ ꯃꯇꯝ ꯑꯗꯨꯗꯒꯤ ꯇ꯭ꯔꯥꯟꯁꯐꯔ ꯇꯧꯈꯤ
into mainstream local provision and,ꯃꯦꯅꯁ꯭ꯠꯔꯤꯝ ꯂꯣꯀꯦꯜ ꯄ꯭ꯔꯣꯚꯤꯖꯅꯗꯥ ꯑꯃꯁꯨꯡ ꯑꯦꯟ.ꯗꯤ.ꯑꯦ.
have led to steady growth in personality,ꯄꯔꯁꯣꯅꯦꯂꯤꯇꯤꯗꯥ ꯂꯦꯞꯄꯥ ꯂꯩꯇꯅꯥ ꯆꯥꯎꯈꯠꯄꯥ ꯄꯨꯔꯛꯂꯦ ꯫
disorder services across the UK,ꯌꯨ.ꯀꯦ.ꯒꯤ ꯃꯐꯝ ꯄꯨꯝꯅꯃꯛꯇꯥ ꯂꯩꯕꯥ ꯗꯤꯁꯑꯣꯔꯗꯔ ꯁꯔꯚꯤꯁꯁꯤꯡ
Breaking the Cycle of Rejection:The,ꯔꯤꯖꯦꯛꯁꯅꯒꯤ ꯆꯛꯔ ꯑꯁꯤ ꯊꯨꯒꯥꯏꯕꯥ:ꯗꯤ.
Personality Disorder Capabilities,ꯄꯔꯁꯣꯅꯦꯂꯤꯇꯤ ꯗꯤꯁꯑꯣꯔꯗꯔ ꯀꯦꯄꯦꯕꯤꯂꯤꯇꯤꯁꯤꯡ
"Framework,published in 2004,","ꯐ꯭ꯔꯦꯃꯋꯥꯔꯛ, ꯲꯰꯰꯴ꯗꯥ ꯐꯣꯡꯈꯤꯕꯥ, ."
launched a major education and,ꯑꯆꯧꯕꯥ ꯑꯦꯖꯨꯀꯦꯁꯟ ꯑꯃꯥ ꯍꯧꯗꯣꯀꯈꯤ ꯑꯃꯁꯨꯡ [...]
training initiative to improve the,ꯍꯦꯟꯅꯥ ꯐꯒꯠꯍꯟꯅꯕꯥ ꯇ꯭ꯔꯦꯅꯤꯡ ꯏꯅꯤꯁꯤꯌꯦꯇꯤꯕꯁꯤꯡ .
"awareness,capability and competence","ꯑꯦꯋꯦꯌꯔꯅꯦꯁ,ꯀꯦꯄꯦꯕꯤꯂꯤꯇꯤ ꯑꯃꯁꯨꯡ ꯀꯝꯄꯤꯇꯦꯟꯁꯟ ."
"of workforces across health,social care","ꯑꯣꯐ ꯋꯥꯔꯀꯐꯣꯔꯁ ꯑꯦꯛꯔꯣꯁ ꯍꯦꯜꯊ,ꯁꯣꯁꯤꯑꯦꯜ ꯀꯦꯌꯔ"
and criminal justice.A partnership,ꯑꯃꯁꯨꯡ ꯀ꯭ꯔꯤꯃꯤꯅꯦꯜ ꯖꯁ꯭ꯇꯤꯁ.ꯄꯥꯔꯇꯅꯔꯁꯤꯞ ꯑꯃꯥ
between the Institute for Mental,ꯏꯟꯁꯇꯤꯠꯌꯨꯠ ꯐꯣꯔ ꯃꯦꯟꯇꯦꯜ .
"Health Nottingham,Emergence","ꯍꯦꯜꯊ ꯅꯣꯇꯤꯡꯍꯝ,ꯏꯃꯔꯖꯦꯟꯁꯤ"
"(formerly Borderline UK),the Tavistock","(ꯍꯥꯟꯅꯒꯤ ꯕꯣꯔꯗꯔꯂꯥꯏꯟ ꯌꯨ.ꯀꯦ.),ꯗꯤ ꯇꯥꯚꯤꯁ꯭ꯇꯣꯛ"
and Portman NHS Trust and the Open,ꯑꯃꯁꯨꯡ ꯄꯣꯔꯇꯃꯦꯟ ꯑꯦꯟ.ꯑꯩꯆ.ꯑꯦꯁ.ꯀꯤ ꯇ꯭ꯔꯁ꯭ꯠ ꯑꯃꯁꯨꯡ ꯗꯤ ꯑꯣꯄꯦꯟ .
University established the Knowledge,ꯌꯨꯅꯤꯚꯔꯁꯤꯇꯤꯅꯥ ꯂꯧꯁꯤꯡ ꯑꯁꯤ ꯂꯤꯡꯈꯠꯈꯤ ꯫
and Understanding Framework (KUF),ꯑꯃꯁꯨꯡ ꯑꯟꯗꯔꯁ꯭ꯇꯦꯟꯗꯤꯡ ꯐ꯭ꯔꯦꯃꯋꯥꯔꯛ (KUF) .
which now offers a comprehensive,ꯃꯁꯤꯅꯥ ꯍꯧꯖꯤꯛ ꯃꯄꯨꯡ ꯐꯥꯕꯥ ꯑꯃꯥ ꯄꯤꯔꯤ ꯫
education and training programme for,ꯒꯤꯗꯃꯛ ꯑꯦꯖꯨꯀꯦꯁꯟ ꯑꯃꯁꯨꯡ ꯇ꯭ꯔꯦꯅꯤꯡ ꯄ꯭ꯔꯣꯒ꯭ꯔꯥꯝ
staff working with people with,ꯁ꯭ꯇꯥꯐꯁꯤꯡꯒꯥ ꯂꯣꯌꯅꯅꯥ ꯊꯕꯛ ꯇꯧꯃꯤꯟꯅꯔꯤꯕꯥ ꯁ꯭ꯇꯥꯐꯁꯤꯡꯅꯥ ꯑꯦꯝ.ꯑꯦꯁ.ꯑꯦꯝ.ꯏ.
personality disorder,ꯄꯔꯁꯣꯅꯦꯂꯤꯇꯤ ꯗꯤꯁꯑꯣꯔꯗꯔ ꯂꯩꯕꯥ
"These initiatives, supported by NICE","ꯍꯥꯌꯔꯤꯕꯥ ꯊꯧꯔꯥꯡꯁꯤꯡ ꯑꯁꯤ, ꯑꯦꯟ.ꯑꯥꯏ.ꯁꯤ."
Guidance on Borderline and Antisocial,ꯕꯣꯔꯗꯔꯂꯥꯏꯟ ꯑꯃꯁꯨꯡ ꯑꯦꯟꯇꯤꯁꯣꯁꯤꯑꯦꯂꯒꯤ ꯃꯇꯥꯡꯗꯥ ꯒꯥꯏꯗꯂꯥꯏꯅꯁꯤꯡ
"PD in 2009, have opened the door to","ꯄꯤ.ꯗꯤ.ꯗꯥ ꯲꯰꯰꯹ꯗꯥ, ꯌꯨ.ꯑꯦꯁ."
service development and most,ꯁꯔꯚꯤꯁ ꯗꯤꯕꯦꯂꯄꯃꯦꯟꯇ ꯑꯃꯁꯨꯡ ꯑꯌꯥꯝꯕꯥ .
"importantly, workforce training",ꯃꯔꯨꯑꯣꯏꯅꯥ ꯋꯥꯔꯀꯐꯣꯔꯁ ꯇ꯭ꯔꯦꯅꯤꯡ
initiatives to ensure that services can,ꯁꯔꯚꯤꯁꯁꯤꯡ ꯑꯁꯤ ꯁꯣꯏꯗꯅꯥ ꯐꯪꯍꯟꯅꯕꯥ ꯊꯧꯔꯥꯡꯁꯤꯡ .
better provide for those with complex,ꯀꯃꯞꯂꯦꯛꯁ ꯂꯩꯕꯥ ꯃꯤꯑꯣꯏꯁꯤꯡꯒꯤꯗꯃꯛ ꯍꯦꯟꯅꯥ ꯐꯕꯥ ꯄꯤꯕꯥ
psychological difficulties,ꯁꯥꯏꯀꯣꯂꯣꯖꯤꯀꯦꯂꯒꯤ ꯑꯣꯏꯕꯥ ꯑꯋꯥꯕꯥ .
Meeting the Challenge – making a,ꯁꯤꯡꯅꯕꯥ ꯑꯁꯤ ꯊꯦꯡꯅꯕꯥ – ꯑꯃꯥ ꯁꯦꯝꯕꯥ .
difference serves as a companion guide,ꯈꯦꯟꯅꯕꯥ ꯑꯁꯤꯅꯥ ꯀꯝꯄꯦꯅꯤꯌꯟ ꯒꯥꯏꯗ ꯑꯃꯥ ꯑꯣꯏꯅꯥ ꯊꯕꯛ ꯇꯧꯏ .
to Working with Personality Disordered,ꯄꯔꯁꯣꯅꯦꯂꯤꯇꯤ ꯗꯤꯁꯑꯣꯔꯗꯔꯒꯥ ꯂꯣꯌꯅꯅꯥ ꯊꯕꯛ ꯇꯧꯕꯥ
"Offenders,published in 2011.This present","ꯑꯣꯐꯦꯟꯗꯔꯁꯤꯡ,꯲꯰꯱꯱ꯗꯥ ꯐꯣꯡꯈꯤꯕꯥ꯫ꯃꯁꯤ ꯍꯧꯖꯤꯛ"
Guide is intended for community,ꯒꯥꯏꯗꯂꯥꯏꯟ ꯑꯁꯤ ꯀꯝꯝꯌꯨꯅꯤꯇꯤꯒꯤꯗꯃꯛ ꯁꯦꯃꯈꯤꯕꯅꯤ .
"practitioners, and aims to bring","ꯄ꯭ꯔꯦꯛꯇꯤꯁꯅꯔꯁꯤꯡ, ꯑꯃꯁꯨꯡ ꯄꯨꯔꯛꯅꯕꯥ ꯄꯥꯟꯗꯝ ꯊꯝꯂꯤ"
up-to-date thinking about personality,ꯄꯔꯁꯣꯅꯦꯂꯤꯇꯤꯒꯤ ꯃꯇꯥꯡꯗꯥ ꯃꯇꯃꯒꯥ ꯆꯥꯟꯅꯕꯥ ꯋꯥꯈꯜ ꯈꯅꯕꯥ
disorder into the daily work of,ꯒꯤ ꯅꯨꯃꯤꯠ ꯈꯨꯗꯤꯡꯒꯤ ꯑꯣꯏꯕꯥ ꯊꯕꯛꯇꯥ ꯗꯤꯁꯑꯣꯔꯗꯔ ꯑꯁꯤ .
thousands of staff working across,ꯃꯐꯝ ꯀꯌꯥꯗꯥ ꯊꯕꯛ ꯇꯧꯔꯤꯕꯥ ꯁ꯭ꯇꯥꯐ ꯂꯤꯁꯤꯡ ꯀꯌꯥꯅꯥ [...]
health and social care services.Their,ꯍꯀꯁꯦꯜ ꯑꯃꯁꯨꯡ ꯁꯣꯁꯤꯑꯦꯜ ꯀꯦꯌꯔ ꯁꯔꯚꯤꯁꯁꯤꯡ꯫ꯃꯈꯣꯌꯒꯤ .
committed work deserves support,ꯀꯝꯃꯤꯠꯃꯦꯟꯇ ꯋꯥꯔꯛ ꯑꯁꯤ ꯁꯄꯣꯔꯠ ꯇꯧꯕꯥ ꯌꯥꯏ .
"Nick Benefield,","ꯅꯤꯛ ꯕꯦꯅꯦꯐꯤꯜꯗ, ꯳."
"Programme Director, Department","ꯄ꯭ꯔꯣꯒ꯭ꯔꯥꯝ ꯗꯥꯏꯔꯦꯛꯇꯔ, ꯗꯤꯄꯥꯔꯇꯃꯦꯟꯇ"
of Health Personality Disorder,ꯍꯦꯜꯊ ꯄꯔꯁꯣꯅꯦꯂꯤꯇꯤ ꯗꯤꯁꯑꯣꯔꯗꯔꯒꯤ ꯃꯇꯥꯡꯗꯥ ꯋꯥꯐꯝ ꯊꯃꯈꯤ꯫
"Programme, 2004-2014","ꯄ꯭ꯔꯣꯒ꯭ꯔꯥꯝ, ꯲꯰꯰꯴-꯲꯰꯱꯴ꯗꯥ ꯊꯣꯀꯈꯤ꯫"
Foreword,ꯃꯃꯥꯡꯒꯤ ꯋꯥꯔꯣꯜ
The last ten years have seen major changes in the way health and,ꯍꯧꯈꯤꯕꯥ ꯆꯍꯤ ꯇꯔꯥ ꯑꯁꯤꯗꯥ ꯍꯀꯁꯦꯂꯒꯤ ꯑꯣꯏꯕꯥ ꯃꯑꯣꯡꯗꯥ ꯑꯆꯧꯕꯥ ꯑꯍꯣꯡꯕꯥ ꯀꯌꯥ ꯎꯕꯥ ꯐꯪꯂꯦ ꯑꯃꯁꯨꯡ [...]
social care services work with people with the complex psycho-social,ꯁꯣꯁꯤꯑꯦꯜ ꯀꯦꯌꯔ ꯁꯔꯚꯤꯁꯁꯤꯡꯅꯥ ꯀꯃꯞꯂꯦꯛꯁ ꯁꯥꯏꯀꯣ-ꯁꯣꯁꯤꯑꯦꯜ ꯂꯩꯕꯥ ꯃꯤꯑꯣꯏꯁꯤꯡꯒꯥ ꯊꯕꯛ ꯇꯧꯃꯤꯟꯅꯔꯤ
difficulties known as personality disorder. Great strides have been,ꯄꯔꯁꯣꯅꯦꯂꯤꯇꯤ ꯗꯤꯁꯑꯣꯔꯗꯔ ꯍꯥꯌꯅꯥ ꯈꯪꯅꯕꯥ ꯈꯨꯗꯣꯡꯆꯥꯗꯕꯁꯤꯡ꯫
made in developing new treatment interventions to support people,ꯃꯤꯑꯣꯏꯕꯗꯥ ꯃꯇꯦꯡ ꯄꯥꯡꯅꯕꯥ ꯑꯅꯧꯕꯥ ꯂꯥꯌꯦꯡ ꯆꯠꯊꯕꯥ ꯏꯟꯇꯔꯚꯦꯟꯁꯅꯁꯤꯡ ꯁꯦꯃꯒꯠꯄꯗꯥ ꯁꯦꯝꯕꯥ
in leading more fulfilling lives,ꯍꯦꯟꯅꯥ ꯃꯄꯨꯡ ꯐꯥꯕꯥ ꯄꯨꯟꯁꯤ ꯍꯤꯡꯕꯗꯥ .
2,꯲ ꯑꯃꯁꯨꯡ ꯲.
Executive summary,ꯑꯦꯒꯖꯤꯛꯌꯨꯇꯤꯕ ꯁꯥꯃꯔꯤ
"It’s not personality disorder unless someone’s difficulties are persistent,","ꯃꯁꯤ ꯀꯅꯥꯒꯨꯝꯕꯥ ꯑꯃꯒꯤ ꯑꯋꯥꯕꯁꯤꯡ ꯑꯁꯤ ꯂꯦꯡꯗꯅꯥ ꯂꯩꯠꯔꯕꯗꯤ ꯄꯔꯁꯣꯅꯦꯂꯤꯇꯤ ꯗꯤꯁꯑꯣꯔꯗꯔ ꯅꯠꯇꯦ,"
pervasive and problematic. Personality difficulties affect the way an,ꯄꯥꯔꯚꯥꯁꯤꯕ ꯑꯃꯁꯨꯡ ꯄ꯭ꯔꯣꯕ꯭ꯂꯦꯃꯦꯇꯤꯛ ꯑꯣꯏꯕꯥ꯫
"individual characteristically feels about themselves and others, and","ꯃꯤꯑꯣꯏ ꯑꯃꯅꯥ ꯃꯁꯥꯒꯤ ꯑꯃꯁꯨꯡ ꯑꯇꯣꯞꯄꯁꯤꯡꯒꯤ ꯃꯔꯃꯗꯥ ꯃꯁꯛ ꯊꯣꯛꯅꯥ ꯐꯥꯑꯣꯔꯤ, ꯑꯃꯁꯨꯡ ."
may be evident in recurring problems in their relationship with others,ꯑꯇꯣꯞꯄꯁꯤꯡꯒꯥ ꯂꯩꯅꯔꯤꯕꯥ ꯃꯔꯤꯗꯥ ꯍꯟꯖꯤꯟ ꯍꯟꯖꯤꯟ ꯊꯣꯀꯄꯥ ꯁꯃꯁ꯭ꯌꯥꯁꯤꯡꯗꯥ ꯃꯌꯦꯛ ꯁꯦꯡꯅꯥ ꯎꯕꯥ ꯐꯪꯒꯅꯤ
Personality disorder may be apparent,ꯄꯔꯁꯣꯅꯦꯂꯤꯇꯤ ꯗꯤꯁꯑꯣꯔꯗꯔ ꯑꯁꯤ ꯃꯌꯦꯛ ꯁꯦꯡꯅꯥ ꯎꯕꯥ ꯐꯪꯒꯅꯤ ꯫
in the person’s account of their,ꯃꯤꯑꯣꯏ ꯑꯗꯨꯒꯤ ꯑꯦꯀꯥꯎꯟꯇꯇꯥ ꯃꯈꯣꯌꯒꯤ .
"problems, their history, difficulties in","ꯄ꯭ꯔꯣꯕ꯭ꯂꯦꯃꯁꯤꯡ, ꯃꯈꯣꯌꯒꯤ ꯄꯨꯋꯥꯔꯤ, ꯑꯋꯥꯕꯥ ꯇꯥꯔꯕꯥ"
"engaging with services, or the way in","ꯁꯔꯚꯤꯁꯁꯤꯡꯒꯥ ꯂꯣꯌꯅꯅꯥ ꯑꯦꯉ꯭ꯒꯦꯖ ꯇꯧꯕꯥ, ꯅꯠꯔꯒꯥ ꯲꯰꯲꯰ꯒꯤ ꯃꯅꯨꯡꯗꯥ ꯂꯩꯕꯥ ꯂꯝꯕꯤꯁꯤꯡ꯫"
which staff or services,ꯀꯅꯥꯒꯨꯝꯕꯥ ꯁ꯭ꯇꯥꯐ ꯅꯠꯔꯒꯥ ꯁꯔꯕꯤꯁꯁꯤꯡ .
characteristically respond to them,ꯃꯈꯣꯌꯗꯥ ꯃꯁꯛ ꯊꯣꯛꯅꯥ ꯄꯥꯎꯈꯨꯝ ꯄꯤꯕꯥ
While there are sometimes,ꯀꯔꯤꯒꯨꯝꯕꯥ ꯃꯇꯃꯗꯥ ꯂꯩꯔꯤꯉꯩꯗꯥ .
benefits to establishing a formal,ꯐꯣꯔꯃꯦꯜ ꯑꯃꯥ ꯂꯤꯡꯈꯠꯄꯗꯥ ꯀꯥꯟꯅꯕꯥ ꯄꯤꯕꯥ
"diagnosis, this can be stigmatising","ꯗꯥꯏꯒ꯭ꯅꯣꯁꯤꯁ, ꯃꯁꯤ ꯁ꯭ꯇꯤꯒꯃꯇꯥꯏꯖ ꯇꯧꯕꯥ ꯌꯥꯏ ."
"For most workers in the field, it is",ꯂꯝ ꯑꯁꯤꯗꯥ ꯂꯩꯔꯤꯕꯥ ꯁꯤꯟꯃꯤ ꯑꯌꯥꯝꯕꯒꯤ ꯑꯣꯏꯅꯥ ꯃꯁꯤ [...]
more helpful to work with the service,ꯁꯔꯚꯤꯁ ꯑꯁꯤꯒꯥ ꯂꯣꯌꯅꯅꯥ ꯊꯕꯛ ꯇꯧꯕꯗꯥ ꯍꯦꯟꯅꯥ ꯃꯇꯦꯡ ꯄꯥꯡꯕꯤꯌꯨ
user to arrive at a formulation of,ꯌꯨꯖꯔꯒꯤ ꯐꯣꯔꯃꯨꯂꯦꯁꯟ ꯑꯃꯗꯥ ꯌꯧꯔꯛꯅꯕꯥ ꯌꯨꯖꯔ꯫
their difficulties,ꯃꯈꯣꯌꯒꯤ ꯑꯋꯥꯕꯁꯤꯡ ꯑꯗꯨ .
There is no single pathway to,꯲꯰꯲꯰ꯒꯤ ꯂꯝꯕꯤ ꯑꯃꯠꯇꯥ ꯂꯩꯇꯦ꯫
developing personality difficulties or,ꯄꯔꯁꯣꯅꯦꯂꯤꯇꯤꯒꯤ ꯈꯨꯗꯣꯡꯆꯥꯗꯕꯁꯤꯡ ꯁꯦꯃꯒꯠꯄꯥ ꯅꯠꯔꯒꯥ .
disorders. Difficult experiences in,ꯗꯤꯁꯑꯣꯔꯗꯔꯁꯤꯡ꯫
childhood can combine with biological,ꯑꯉꯥꯡ ꯑꯣꯏꯔꯤꯉꯩꯒꯤ ꯃꯇꯝ ꯑꯁꯤ ꯕꯥꯏꯑꯣꯂꯣꯖꯤꯀꯦꯂꯒꯥ ꯂꯣꯌꯅꯅꯥ ꯄꯨꯟꯅꯥ ꯆꯠꯃꯤꯟꯅꯕꯥ ꯌꯥꯏ꯫
vulnerability and social disadvantage,ꯚꯂꯅꯦꯔꯦꯕꯤꯂꯤꯇꯤ ꯑꯃꯁꯨꯡ ꯁꯣꯁꯤꯑꯦꯜ ꯗꯤꯁꯑꯦꯕꯤꯂꯤꯇꯤ
to create a life course that leads to,ꯂꯝꯕꯤꯗꯥ ꯆꯠꯂꯤꯕꯥ ꯂꯥꯏꯐ ꯀꯣꯔꯁ ꯑꯃꯥ ꯁꯦꯝꯅꯕꯥ .
personality disorder,ꯄꯔꯁꯣꯅꯦꯂꯤꯇꯤ ꯗꯤꯁꯑꯣꯔꯗꯔ ꯂꯩꯕꯥ
Even though personality difficulties,ꯄꯔꯁꯣꯅꯦꯂꯤꯇꯤꯒꯤ ꯑꯋꯥꯕꯥ ꯑꯣꯏꯔꯕꯁꯨ .
"may be longstanding, there is a","ꯃꯇꯝ ꯁꯥꯡꯅꯥ ꯂꯩꯔꯀꯄꯥ ꯌꯥꯏ, ꯃꯁꯤꯗꯥ ."
great deal that can be done to,ꯑꯆꯧꯕꯥ ꯋꯥꯐꯝ ꯑꯃꯥ .
help people,ꯃꯤꯑꯣꯏꯕꯗꯥ ꯃꯇꯦꯡ ꯄꯥꯡꯕꯤꯌꯨ
A helpful stance towards someone,ꯀꯅꯥꯒꯨꯝꯕꯥ ꯑꯃꯒꯤ ꯃꯐꯃꯗꯥ ꯃꯇꯦꯡ ꯑꯣꯏꯕꯥ ꯋꯥꯈꯜꯂꯣꯟ ꯑꯃꯥ .
with personality disorder is to be,ꯄꯔꯁꯣꯅꯦꯂꯤꯇꯤ ꯗꯤꯁꯑꯣꯔꯗꯔꯒꯥ ꯂꯣꯌꯅꯅꯥ ꯑꯥꯏ.ꯑꯦꯁ.
"curious and compassionate, trying to","ꯀ꯭ꯌꯨꯔꯤꯌꯁ ꯑꯃꯁꯨꯡ ꯀꯝꯄꯥꯁꯤꯅꯦꯠ ꯑꯣꯏꯕꯥ, ꯍꯣꯠꯅꯕꯥ"
understand what the person is,ꯃꯤꯑꯣꯏ ꯑꯗꯨ ꯀꯔꯤꯅꯣ ꯍꯥꯌꯕꯗꯨ ꯈꯉꯕꯤꯌꯨ .
"experiencing, and what is affecting","ꯑꯦꯛꯁꯄꯔꯤꯑꯦꯟꯁ ꯇꯧꯕꯥ, ꯑꯃꯁꯨꯡ ꯀꯔꯤꯅꯥ ꯁꯣꯀꯍꯜꯂꯤꯕꯒꯦ ꯍꯥꯌꯕꯗꯨ"
their present feelings and behaviour,ꯃꯈꯣꯌꯒꯤ ꯍꯧꯖꯤꯛ ꯂꯩꯔꯤꯕꯥ ꯐꯤꯚꯝ ꯑꯃꯁꯨꯡ ꯂꯃꯆꯠ-ꯁꯥꯖꯠ
Symptoms such as self harm,ꯁꯦꯜꯐ ꯍꯥꯔꯝꯒꯨꯝꯕꯥ ꯂꯥꯏꯑꯣꯡꯁꯤꯡ
require workers to deal in an effective,ꯁꯤꯟꯃꯤꯁꯤꯡꯅꯥ ꯏꯐꯦꯛꯇꯤꯕ ꯑꯣꯏꯕꯥ .
"way with risk and injury, while also","ꯔꯤꯁ꯭ꯛ ꯑꯃꯁꯨꯡ ꯑꯁꯣꯛ-ꯑꯄꯅꯁꯤꯡꯒꯥ ꯂꯣꯌꯅꯅꯥ, ꯃꯁꯤꯒꯥ ꯂꯣꯌꯅꯅꯥ ."
remaining concerned about what has,ꯀꯔꯤ ꯂꯩꯔꯤꯕꯒꯦ ꯍꯥꯌꯕꯒꯤ ꯃꯇꯥꯡꯗꯥ ꯋꯥꯈꯜ ꯋꯥꯕꯥ ꯂꯦꯞꯄꯥ ꯂꯩꯇꯅꯥ
led the person to harm themselves,ꯃꯤꯑꯣꯏ ꯑꯗꯨꯕꯨ ꯃꯁꯥꯃꯀꯄꯨ ꯑꯁꯣꯛ ꯑꯄꯟ ꯅꯪꯍꯟꯗꯅꯕꯥ ꯂꯨꯆꯤꯡꯈꯤ
Service users with personality,ꯄꯔꯁꯣꯅꯦꯂꯤꯇꯤ ꯂꯩꯕꯥ ꯁꯔꯚꯤꯁ ꯌꯨꯖꯔꯁꯤꯡ
disorders who may have experienced,ꯊꯦꯡꯅꯔꯀꯄꯥ ꯌꯥꯕꯥ ꯗꯤꯁꯑꯣꯔꯗꯔꯁꯤꯡ
"neglect, rejection or maltreatment,","ꯅꯦꯒꯂꯦꯛꯇ, ꯔꯤꯖꯦꯛꯁꯟ ꯅꯠꯠꯔꯒꯥ ꯃꯥꯂꯠꯔꯤꯇꯃꯦꯟꯇ, ."
both within their families growing up,ꯃꯈꯣꯌꯒꯤ ꯏꯃꯨꯡ ꯃꯅꯨꯡꯒꯤ ꯃꯅꯨꯡꯗꯥ ꯑꯅꯤꯃꯛ ꯆꯥꯎꯈꯠꯂꯀꯄꯅꯤ
and later when they have sought,ꯑꯃꯁꯨꯡ ꯃꯇꯨꯡꯗꯥ ꯃꯈꯣꯌꯅꯥ ꯊꯤꯖꯤꯜꯂꯀꯄꯥ ꯃꯇꯃꯗꯥ .
"help, may be wary of accessing help","ꯃꯇꯦꯡ, ꯃꯇꯦꯡ ꯄꯥꯡꯕꯗꯥ ꯆꯦꯀꯁꯤꯅꯕꯥ ꯌꯥꯏ"
Becoming involved in services –,ꯁꯔꯚꯤꯁꯁꯤꯡꯗꯥ ꯁꯔꯨꯛ ꯌꯥꯕꯥ – .
"planning, evaluation, and delivery","ꯄ꯭ꯂꯥꯅꯤꯡ, ꯏꯚꯥꯂꯨꯑꯦꯁꯟ, ꯑꯃꯁꯨꯡ ꯗꯦꯂꯤꯕꯔꯤ"
– are all ways that service users,– ꯄꯨꯝꯅꯃꯛ ꯑꯁꯤ ꯁꯔꯚꯤꯁ ꯌꯨꯖꯔꯁꯤꯡꯅꯥ [...]
can make a highly valuable,ꯌꯥꯝꯅꯥ ꯃꯃꯜ ꯂꯩꯕꯥ ꯑꯃꯥ ꯑꯣꯏꯍꯅꯕꯥ ꯉꯃꯒꯅꯤ
contribution and may discover new,ꯀꯟꯠꯔꯤꯕ꯭ꯌꯨꯁꯟ ꯑꯃꯁꯨꯡ ꯑꯅꯧꯕꯥ ꯗꯤꯁ꯭ꯀꯣꯚꯔ ꯇꯧꯕꯥ ꯌꯥꯏ .
skills and talents,ꯁ꯭ꯀꯤꯜ ꯑꯃꯁꯨꯡ ꯇꯦꯂꯦꯟꯇꯁꯤꯡ .
Engaging with a person with,ꯃꯤꯑꯣꯏ ꯑꯃꯒꯥ ꯂꯣꯌꯅꯅꯥ ꯑꯦꯉ꯭ꯒꯦꯖ ꯇꯧꯕꯥ
serious personality difficulties,ꯁꯤꯔꯤꯌꯁ ꯄꯔꯁꯣꯅꯦꯂꯤꯇꯤꯒꯤ ꯑꯋꯥꯕꯥ .
can impact on staff emotionally,ꯁ꯭ꯇꯥꯐꯁꯤꯡꯗꯥ ꯏꯃꯣꯁꯅꯦꯜ ꯑꯣꯏꯅꯥ ꯏꯝꯄꯦꯛꯇ ꯇꯧꯕꯥ ꯌꯥꯏ
Look after yourself. Seek,ꯅꯁꯥꯕꯨ ꯌꯦꯡꯁꯤꯅꯕꯤꯌꯨ꯫
psychologically informed supervision,ꯁꯥꯏꯀꯣꯂꯣꯖꯤꯀꯦꯜ ꯑꯣꯏꯅꯥ ꯏꯅꯐꯣꯔꯝ ꯇꯧꯔꯕꯥ ꯁꯨꯄꯔꯚꯤꯖꯟ ꯑꯃꯥ .
"and support, take time out to","ꯑꯃꯁꯨꯡ ꯁꯄꯣꯔꯠ ꯇꯧꯕꯥ, ꯇꯦꯛ ꯇꯥꯏꯝ ꯑꯥꯎꯇꯇꯥ ."
"reflect, be realistic about change,","ꯔꯤꯐ꯭ꯂꯦꯛꯇ ꯇꯧꯕꯥ, ꯑꯍꯣꯡꯕꯥ ꯄꯨꯔꯀꯄꯒꯤ ꯃꯇꯥꯡꯗꯥ ꯔꯤꯑꯦꯂꯤꯁ꯭ꯇꯤꯛ ꯑꯣꯏꯕꯥ,"
and celebrate real progress,ꯑꯃꯁꯨꯡ ꯑꯁꯦꯡꯕꯥ ꯄ꯭ꯔꯣꯒ꯭ꯔꯦꯁ ꯁꯦꯂꯦꯕ꯭ꯔꯦꯠ ꯇꯧꯕꯥ
3,꯳ ꯑꯃꯁꯨꯡ ꯳.
Introduction,ꯁꯛꯇꯥꯛꯄ
All frontline workers will encounter people who might be seen,ꯐ꯭ꯔꯟꯇꯂꯥꯏꯟ ꯋꯥꯔꯀꯔ ꯈꯨꯗꯤꯡꯃꯛꯅꯥ ꯎꯕꯥ ꯐꯪꯒꯗꯕꯥ ꯃꯤꯑꯣꯏꯁꯤꯡꯒꯥ ꯊꯦꯡꯅꯒꯅꯤ
to have a personality disorder.Someone’s personality is their,ꯄꯔꯁꯣꯅꯦꯂꯤꯇꯤ ꯗꯤꯁꯑꯣꯔꯗꯔ ꯑꯃꯥ ꯂꯩꯕꯥ꯫ꯀꯅꯥꯒꯨꯝꯕꯥ ꯑꯃꯒꯤ ꯄꯔꯁꯣꯅꯦꯂꯤꯇꯤ ꯑꯁꯤ ꯃꯈꯣꯌꯒꯤꯅꯤ꯫
"characteristic patterns of thinking,feeling and behaving that","ꯋꯥꯈꯜ ꯈꯅꯕꯥ,ꯐꯤꯜ ꯇꯧꯕꯥ ꯑꯃꯁꯨꯡ ꯂꯃꯆꯠ ꯁꯥꯖꯠꯀꯤ ꯃꯁꯛ ꯊꯣꯀꯄꯥ ꯃꯑꯣꯡꯁꯤꯡ ꯑꯗꯨ ."
remain fairly consistent across situations and over time,ꯐꯤꯚꯃꯁꯤꯡꯒꯤ ꯃꯔꯛꯇꯥ ꯑꯃꯁꯨꯡ ꯃꯇꯃꯒꯤ ꯃꯇꯨꯡ ꯏꯟꯅꯥ ꯃꯇꯤꯛ ꯆꯥꯅꯥ ꯂꯦꯞꯄꯥ ꯂꯩꯇꯅꯥ ꯂꯩꯌꯨ꯫
‘Personality disorder’is the term used within mental health,‘ꯄꯔꯁꯣꯅꯦꯂꯤꯇꯤ ꯗꯤꯁꯑꯣꯔꯗꯔ’ ꯍꯥꯌꯕꯁꯤ ꯃꯦꯟꯇꯦꯜ ꯍꯦꯂꯊꯀꯤ ꯃꯅꯨꯡꯗꯥ ꯁꯤꯖꯤꯟꯅꯔꯤꯕꯥ ꯋꯥꯍꯩꯅꯤ꯫
services to describe longstanding difficulties in how an,ꯃꯇꯧ ꯀꯔꯝꯅꯥ ꯃꯇꯝ ꯁꯥꯡꯅꯥ ꯑꯋꯥꯕꯥ ꯇꯥꯔꯕꯁꯤꯡ ꯑꯗꯨ ꯐꯣꯡꯗꯣꯛꯅꯕꯥ ꯁꯔꯚꯤꯁꯁꯤꯡ .
"individual thinks and feels about themselves and others,and","ꯃꯤꯑꯣꯏ ꯑꯃꯅꯥ ꯃꯈꯣꯌ ꯃꯁꯥꯒꯤ ꯑꯃꯁꯨꯡ ꯑꯇꯣꯞꯄꯒꯤ ꯃꯔꯃꯗꯥ ꯈꯜꯂꯤ ꯑꯃꯁꯨꯡ ꯋꯥꯈꯜ ꯈꯜꯂꯤ,ꯑꯗꯨꯒꯥ ."
consequently how they behave in relation to other people,ꯃꯔꯝ ꯑꯁꯤꯅꯥ ꯃꯈꯣꯌꯅꯥ ꯑꯇꯣꯞꯄꯥ ꯃꯤꯑꯣꯏꯁꯤꯡꯒꯥ ꯃꯔꯤ ꯂꯩꯅꯅꯥ ꯃꯇꯧ ꯀꯔꯝꯅꯥ ꯂꯃꯆꯠ ꯁꯥꯖꯠ ꯆꯠꯀꯅꯤ
Sometimes it is our own,ꯀꯔꯤꯒꯨꯝꯕꯥ ꯃꯇꯃꯗꯥ ꯑꯩꯈꯣꯌꯒꯤ ꯏꯁꯥꯒꯤ ꯑꯣꯏꯕꯥ .
reaction to a service user,ꯁꯔꯚꯤꯁ ꯌꯨꯖꯔ ꯑꯃꯗꯥ ꯔꯤꯑꯦꯛꯁꯟ ꯇꯧꯕꯥ
1,꯱.
that alerts us to the fact that,ꯃꯗꯨꯅꯥ ꯑꯩꯈꯣꯌꯗꯥ ꯋꯥꯐꯝ ꯑꯁꯤꯒꯤ ꯃꯇꯥꯡꯗꯥ ꯈꯉꯍꯜꯂꯤ ꯃꯗꯨꯗꯤ .
this person struggles with,ꯃꯤꯑꯣꯏ ꯑꯁꯤꯅꯥ ꯂꯥꯟꯊꯦꯡꯅꯔꯤ ꯫
relationships. We may find,ꯃꯔꯤ ꯂꯩꯅꯕꯥ ꯋꯥꯐꯃꯁꯤꯡ꯫
ourselves feeling,ꯑꯩꯈꯣꯌ ꯏꯁꯥꯅꯥ ꯏꯁꯥꯕꯨ ꯐꯤꯜꯂꯤꯡ ꯇꯧꯕꯥ .
uncharacteristically,ꯃꯑꯣꯡ ꯆꯨꯝꯅꯥ ꯑꯅꯀꯄꯥ ꯃꯑꯣꯡꯗꯥ ꯑꯦꯝ.ꯑꯦꯁ.ꯑꯦꯝ.ꯏ.
"frustrated with someone,","ꯀꯅꯥꯒꯨꯝꯕꯥ ꯑꯃꯒꯥ ꯂꯣꯌꯅꯅꯥ ꯐ꯭ꯔꯁ꯭ꯇꯦꯠ ꯇꯧꯕꯥ,"
or eager to help and ‘rescue’,ꯅꯠꯠꯔꯒꯥ ꯃꯇꯦꯡ ꯄꯥꯡꯅꯕꯥ ꯑꯃꯁꯨꯡ ‘ꯔꯦꯁ꯭ꯛꯌꯨ’ ꯇꯧꯅꯕꯥ ꯋꯥꯁꯛ ꯆꯦꯠꯄꯥ꯫
"them from their difficulties,","ꯃꯈꯣꯌꯒꯤ ꯑꯋꯥꯕꯁꯤꯡꯗꯒꯤ ꯃꯈꯣꯌꯕꯨ, ."
or feeling we have to tip toe,ꯅꯠꯔꯒꯥ ꯑꯩꯈꯣꯌꯅꯥ ꯇꯤꯞ ꯇꯣꯏ ꯇꯧꯕꯥ ꯇꯥꯕꯅꯤ ꯍꯥꯌꯅꯥ ꯐꯥꯑꯣꯔꯤ .
around them for fear of,ꯃꯈꯣꯌꯒꯤ ꯑꯀꯣꯌꯕꯗꯥ ꯑꯀꯤꯕꯥ ꯂꯩꯕꯅꯥ .
provoking them. Sometimes,ꯃꯈꯣꯌꯕꯨ ꯊꯧꯅꯥ ꯍꯥꯞꯄꯤ꯫
these reactions are to do with,ꯍꯥꯌꯔꯤꯕꯥ ꯔꯤꯑꯦꯛꯁꯅꯁꯤꯡ ꯑꯁꯤ .
"our own issues, but","ꯑꯩꯈꯣꯌꯒꯤ ꯏꯁꯥꯒꯤ ꯑꯣꯏꯕꯥ ꯋꯥꯐꯃꯁꯤꯡ, ꯑꯗꯨꯕꯨ [...]"
sometimes it signals that this,ꯀꯔꯤꯒꯨꯝꯕꯥ ꯃꯇꯃꯗꯥ ꯃꯁꯤꯅꯥ ꯁꯤꯒꯅꯦꯜ ꯇꯧꯏ ꯃꯗꯨꯗꯤ ꯃꯁꯤ .
service user has personality,ꯁꯔꯚꯤꯁ ꯌꯨꯖꯔꯅꯥ ꯄꯔꯁꯣꯅꯦꯂꯤꯇꯤ ꯂꯩ꯫
