en,mni-Mtei
"8. With the mind not moving towards any other thing, made steadfast by the method of","8. ꯋꯥꯈꯂꯅꯥ ꯑꯇꯣꯞꯄꯥ ꯋꯥꯐꯝ ꯑꯃꯒꯤ ꯃꯥꯌꯀꯩꯗꯥ ꯆꯪꯁꯤꯅꯗꯅꯥ, ꯂꯦꯞꯄꯥ ꯂꯩꯇꯅꯥ ꯁꯦꯃꯈꯤꯕꯥ"
"habitual meditation, and constantly meditating, one goes to the Supreme Person, the Resplendent,","ꯍꯦꯕꯤꯇꯦꯜ ꯃꯦꯗꯤꯇꯦꯁꯟ, ꯑꯃꯁꯨꯡ ꯂꯦꯞꯄꯥ ꯂꯩꯇꯅꯥ ꯃꯦꯗꯤꯇꯦꯁꯟ ꯇꯧꯕꯥ, ꯀꯅꯥꯒꯨꯝꯕꯥ ꯑꯃꯅꯥ ꯈ꯭ꯕꯥꯏꯗꯒꯤ ꯋꯥꯡꯕꯥ ꯃꯤꯑꯣꯏ ꯑꯗꯨꯗꯥ ꯆꯠꯂꯤ, ꯔꯤꯁ꯭ꯞꯂꯦꯟꯗꯦꯟꯇ,"
O Arjuna!,ꯑꯣ ꯑꯔꯖꯨꯅꯥ!
Kavim puraanamanushaasitaaram,ꯀꯕꯤꯝ ꯄꯨꯔꯥꯅꯥꯃꯥꯅꯨꯁꯥꯁꯤꯇꯥꯔꯥꯝ
Anoraneeyaamsam anusmaredyah;,ꯑꯅꯣꯔꯦꯟꯌꯃꯁꯥꯝ ꯑꯅꯨꯁ꯭ꯃꯔꯦꯗꯍ;
Sarvasya dhaataaram achintyaroopam,ꯁꯔꯕꯁ꯭ꯌ ꯙꯥꯇꯔꯥꯝ ꯑꯆꯤꯟꯇꯤꯌꯥꯔꯨꯄꯣꯝ
Aadityavarnam tamasah parastaat,ꯑꯥꯗꯤꯠꯌꯕꯔꯅꯝ ꯇꯥꯃꯥꯁꯍ ꯄꯔꯥꯁ꯭ꯇꯥꯠ
67,꯶꯷ ꯑꯃꯁꯨꯡ ꯑꯦꯟ.
BHAGAVAD GITA,ꯚꯒꯕꯠ ꯒꯤꯇꯥ
"9. Whosoever meditates on the Omniscient, the Ancient, the ruler (of the whole world),","9. ꯀꯅꯥꯒꯨꯝꯕꯥ ꯑꯃꯅꯥ ꯑꯣꯃꯅꯤꯁꯤꯌꯦꯟꯇ, ꯑꯔꯤꯕꯥ, ꯁꯥꯁꯟ ꯇꯧꯕꯥ (ꯃꯥꯂꯦꯝ ꯄꯨꯝꯕꯒꯤ)ꯗꯥ ꯙ꯭ꯌꯥꯟ ꯇꯧꯔꯤꯕꯥ ꯀꯅꯥꯒꯨꯝꯕꯥ ꯑꯃꯅꯥ꯫"
"minuter than an atom, the supporter of all, of inconceivable form, effulgent like the sun and beyond","ꯑꯦꯇꯣꯝ ꯑꯃꯗꯒꯤ ꯍꯦꯟꯅꯥ ꯃꯤꯅꯤꯠ, ꯄꯨꯝꯅꯃꯛꯀꯤ ꯁꯄꯣꯔꯇꯔ, ꯋꯥꯈꯜ ꯈꯟꯊꯕꯥ ꯉꯃꯗꯕꯥ ꯃꯑꯣꯡꯒꯤ, ꯅꯨꯃꯤꯠꯀꯤ ꯃꯉꯥꯂꯒꯨꯝꯕꯥ ꯏꯐꯨꯠ ꯑꯣꯏꯕꯥ"
"the darkness of ignorance,","ꯏꯒꯅꯣꯔꯤꯒꯤ ꯑꯃꯝꯕꯥ, ."
Prayaanakaale manasaachalena,ꯄ꯭ꯔꯌꯥꯅꯥꯀꯥꯂꯦ ꯃꯅꯁꯥꯆꯂꯦꯅꯥ
Bhaktyaa yukto yogabalena chaiva;,ꯚꯛꯇꯤꯌꯥ ꯌꯨꯛꯇꯣ ꯌꯣꯒꯥꯕꯥꯂꯦꯅꯥ ꯆꯥꯏꯕꯥ;
Bhruvormadhye praanamaaveshya samyak,ꯚꯔꯨꯚꯔꯃꯥꯙ꯭ꯌ ꯄ꯭ꯔꯅꯥꯃꯥꯌꯥꯚꯦꯁ꯭ꯌ ꯁꯃꯤꯛ
Sa tam param purusham upaiti divyam,ꯁꯥ ꯇꯥꯝ ꯄꯔꯝ ꯄꯨꯔꯨꯁꯝ ꯎꯄꯥꯏꯇꯤ ꯗꯤꯕ꯭ꯌꯝ
"10. At the time of death, with unshaken mind, endowed with devotion and by the power of","10. ꯁꯤꯕꯥ ꯃꯇꯃꯗꯥ, ꯚꯛꯇꯤ ꯑꯃꯁꯨꯡ ꯚꯛꯇꯤꯒꯤ ꯁꯛꯇꯤꯅꯥ ꯄꯤꯕꯥ ꯋꯥꯈꯂꯒꯥ ꯂꯣꯌꯅꯅꯥ꯫"
"Yoga, fixing the whole life-breath in the middle of the two eyebrows, he reaches that resplendent","ꯌꯣꯒ, ꯂꯥꯏꯐ-ꯕ꯭ꯔꯦꯊ ꯄꯨꯝꯕꯥ ꯐꯤꯛꯁ ꯇꯧꯗꯨꯅꯥ ꯃꯃꯤꯠ ꯑꯅꯤꯒꯤ ꯃꯔꯛꯇꯥ ꯃꯍꯥꯛꯅꯥ ꯑꯗꯨꯒꯨꯝꯕꯥ ꯔꯦꯁ꯭ꯞꯂꯦꯟꯗꯦꯟꯇ ꯑꯗꯨ ꯌꯧꯔꯀꯏ"
Supreme Person,ꯁꯨꯞꯔꯤꯝ ꯄꯔꯁꯟ
Yadaksharam vedavido vadanti,ꯌꯥꯗꯀꯁ꯭ꯔꯥꯝ ꯚꯦꯗꯥꯚꯤꯗꯣ ꯋꯥꯗꯟꯇꯤ
Vishanti yadyatayo veetaraagaah;,ꯕꯤꯁꯥꯟꯇꯤ ꯌꯥꯗ꯭ꯌꯇꯌꯣ ꯕꯤꯇꯥꯔꯥꯒꯥꯍ;
Yadicchanto brahmacharyam charanti,ꯌꯥꯗꯤꯆꯟꯇꯣ ꯕ꯭ꯔꯍ꯭ꯃꯆꯔꯝ ꯆꯔꯥꯟꯇꯤ
Tatte padam samgrahena pravakshye,ꯇꯥꯠꯇꯦ ꯄꯥꯗꯝ ꯁꯃꯒ꯭ꯔꯦꯍꯦꯅꯥ ꯄ꯭ꯔꯚꯥꯀꯁ꯭ꯌ
"11. That which is declared imperishable by those who know the Vedas, that which the","꯱꯱.ꯕꯦꯗꯁꯤꯡ ꯈꯉꯕꯥ ꯃꯤꯑꯣꯏꯁꯤꯡꯅꯥ ꯌꯥꯗꯕꯥ ꯌꯥꯗꯕꯥ ꯍꯥꯌꯅꯥ ꯂꯥꯑꯣꯊꯣꯀꯄꯥ ꯑꯗꯨ, ꯃꯗꯨ ."
"self-controlled (ascetics) and passion-free enter, that desiring which celibacy is practised—that","ꯁꯦꯜꯐ-ꯀꯟꯠꯔꯣꯜ ꯇꯧꯕꯥ (ꯑꯦꯁ꯭ꯁꯤꯛꯁ) ꯑꯃꯁꯨꯡ ꯄꯦꯁꯟ-ꯐ꯭ꯔꯤ ꯑꯦꯟꯇꯔ, ꯀꯅꯥꯒꯨꯝꯕꯥ ꯁꯦꯂꯤꯕꯦꯁꯤ ꯄ꯭ꯔꯦꯛꯇꯤꯁ ꯇꯧꯔꯤꯕꯥ ꯑꯗꯨ ꯄꯥꯝꯂꯤꯕꯥ ꯑꯗꯨ—ꯃꯗꯨ"
goal I will declare to thee in brief,ꯄꯥꯟꯗꯝ ꯑꯩꯅꯥ ꯊꯤꯖꯤꯟ ꯍꯨꯃꯖꯤꯅꯒꯅꯤ
Sarvadwaaraani samyamya mano hridi nirudhya cha;,ꯁꯔꯕꯗ꯭ꯕꯥꯔꯥꯅꯤ ꯁꯝꯌꯝꯌ ꯃꯅꯣ ꯍꯔꯤꯗꯤ ꯅꯤꯔꯨꯙ꯭ꯌꯥ ꯆꯥ;
Moordhnyaadhaayaatmanah praanamaasthito yogadhaaranaam,ꯃꯨꯔꯙꯟꯌꯗꯍꯌꯥꯠꯃꯥꯅꯍ ꯄ꯭ꯔꯅꯥꯃꯥꯁ꯭ꯇꯤꯇꯣ ꯌꯣꯒꯙꯥꯔꯥꯅꯥꯝ
"12. Having closed all the gates, confined the mind in the heart and fixed the life-breath in the","12. ꯒꯦꯠ ꯄꯨꯝꯅꯃꯛ ꯊꯨꯒꯥꯏꯔꯕꯥ ꯃꯇꯨꯡꯗꯥ, ꯋꯥꯈꯜ ꯑꯗꯨ ꯊꯝꯃꯣꯌꯗꯥ ꯊꯃꯗꯨꯅꯥ ꯑꯃꯁꯨꯡ ꯂꯥꯏꯐ-ꯕ꯭ꯔꯦꯊ ꯑꯗꯨ ꯐꯤꯛꯁ ꯇꯧꯗꯨꯅꯥ ꯊꯃꯈꯤ꯫"
"head, engaged in the practice of concentration,","ꯃꯀꯣꯛ, ꯀꯟꯁꯦꯟꯠꯔꯦꯁꯅꯒꯤ ꯄ꯭ꯔꯦꯛꯇꯤꯁꯇꯥ ꯌꯥꯑꯣꯕꯥ, ."
Omityekaaksharam brahma vyaaharan maamanusmaran;,ꯑꯣꯃꯤꯇꯤꯀꯥꯀꯁ꯭ꯔꯥꯝ ꯕ꯭ꯔꯍ꯭ꯃꯥ ꯋ꯭ꯌꯥꯍꯔꯟ ꯃꯥꯃꯥꯅꯨꯁꯃꯔꯟ;
Yah prayaati tyajan deham sa yaati paramaam gatim,ꯌꯥꯍ ꯄ꯭ꯔꯌꯥꯇꯤ ꯇ꯭ꯌꯥꯖꯟ ꯗꯦꯍꯝ ꯁꯥ ꯌꯥꯇꯤ ꯄꯔꯃꯥꯝ ꯒꯇꯤꯝ
"13. Uttering the monosyllable Om—the Brahman—remembering Me always, he who","13. ꯃꯣꯅꯣꯁꯤꯂꯦꯕꯜ ꯑꯣꯝ—ꯕ꯭ꯔꯍ꯭ꯃꯥꯟ—ꯑꯩꯕꯨ ꯃꯇꯝ ꯄꯨꯝꯅꯃꯛꯇꯥ ꯅꯤꯡꯁꯤꯡꯍꯅꯕꯥ, ꯃꯍꯥꯛꯅꯥ ꯀꯅꯥ"
"departs thus, leaving the body, attains to the supreme goal","ꯑꯁꯨꯝꯅꯥ ꯆꯠꯂꯤ, ꯍꯀꯆꯥꯡ ꯊꯥꯗꯣꯛꯇꯨꯅꯥ, ꯈ꯭ꯕꯥꯏꯗꯒꯤ ꯋꯥꯡꯕꯥ ꯄꯥꯟꯗꯝ ꯑꯗꯨ ꯐꯪꯒꯅꯤ"
Ananyachetaah satatam yo maam smarati nityashah;,ꯑꯅꯟꯌꯥꯆꯦꯇꯥꯍ ꯁꯇꯥꯇꯥꯝ ꯌꯣ ꯃꯥꯝ ꯁ꯭ꯃꯨꯔꯥꯇꯤ ꯅꯤꯠꯌꯁꯥꯍ;
Tasyaaham sulabhah paartha nityayuktasya yoginah,ꯇꯥꯁꯌꯍꯝ ꯁꯨꯂꯥꯚꯥꯍ ꯄꯥꯔꯊꯥ ꯅꯤꯇꯤꯌꯛꯇꯁ꯭ꯌ ꯌꯣꯒꯤꯅꯥꯍ
14. I am easily attainable by that ever-steadfast Yogi who constantly and daily remembers,14. ꯑꯩꯍꯥꯛ ꯂꯦꯞꯄꯥ ꯂꯩꯇꯅꯥ ꯑꯃꯁꯨꯡ ꯅꯨꯃꯤꯠ ꯈꯨꯗꯤꯡꯒꯤ ꯅꯤꯡꯁꯤꯡꯂꯤꯕꯥ ꯃꯇꯝ ꯄꯨꯝꯅꯃꯛꯇꯥ ꯂꯦꯞꯄꯥ ꯂꯩꯇꯅꯥ ꯌꯣꯒꯤ ꯑꯗꯨꯅꯥ ꯐꯖꯅꯥ ꯐꯪꯖꯕꯥ ꯉꯃꯒꯅꯤ꯫
"Me (for a long time), not thinking of anything else (with a single or one-pointed mind), O Partha","ꯑꯩ (ꯃꯇꯝ ꯁꯥꯡꯅꯥ), ꯑꯇꯣꯞꯄꯥ ꯋꯥꯐꯝ ꯑꯃꯠꯇꯥ ꯈꯟꯊꯗꯅꯥ (ꯃꯈꯜ ꯑꯃꯈꯛꯇꯪꯒꯤ ꯋꯥꯈꯜ ꯂꯩꯕꯥ), ꯑꯣ ꯄꯥꯔꯊꯥ"
(Arjuna)!,(ꯑꯔꯖꯨꯟ)!
COMMENTARY: Constantly remembering the Lord throughout one’s life is the easiest,ꯀꯃꯦꯟꯇꯔꯤ: ꯀꯅꯥꯒꯨꯝꯕꯥ ꯑꯃꯒꯤ ꯄꯨꯟꯁꯤ ꯆꯨꯞꯄꯥ ꯏꯕꯨꯡꯉꯣꯕꯨ ꯂꯦꯞꯄꯥ ꯂꯩꯇꯅꯥ ꯅꯤꯡꯁꯤꯡꯕꯥ ꯑꯁꯤꯅꯥ ꯈ꯭ꯕꯥꯏꯗꯒꯤ ꯂꯥꯌꯕꯥ ꯑꯣꯏꯔꯤ
way of attaining Him,ꯃꯍꯥꯀꯄꯨ ꯐꯪꯍꯅꯕꯒꯤ ꯃꯑꯣꯡ .
Maamupetya punarjanma duhkhaalayamashaashwatam;,ꯃꯥꯃꯨꯄꯦꯠꯌ ꯄꯨꯅꯥꯔꯖꯅꯃꯥ ꯗꯨꯍꯈꯥꯂꯌꯥꯃꯁꯥꯁ꯭ꯕꯇꯝ;
Naapnuvanti mahaatmaanah samsiddhim paramaam gataah,ꯅꯥꯄꯅꯨꯚꯥꯟꯇꯤ ꯃꯍꯥꯠꯃꯅꯍ ꯁꯝꯁꯤꯗ꯭ꯙꯤꯝ ꯄꯔꯃꯥꯝ ꯒꯇꯥꯍ
68,꯶꯸ ꯑꯃꯁꯨꯡ ꯑꯦꯟ.
THE YOGA OF THE IMPERISHABLE BRAHMAN,ꯏꯝꯄꯦꯔꯤꯁꯦꯕꯜ ꯕ꯭ꯔꯍ꯭ꯃꯅꯒꯤ ꯌꯣꯒ .
"15. Having attained Me these great souls do not again take birth (here), which is the place of",15. ꯑꯩꯕꯨ ꯌꯧꯍꯅꯕꯤꯔꯕꯥ ꯃꯇꯨꯡꯗꯥ ꯑꯆꯧꯕꯥ ꯊꯋꯥꯌꯁꯤꯡ ꯑꯁꯤꯅꯥ ꯑꯃꯨꯛ ꯍꯟꯅꯥ ꯄꯣꯀꯄꯥ ꯉꯃꯗꯦ (ꯃꯐꯃꯁꯤꯗꯥ)꯫
pain and is non-eternal; they have reached the highest perfection (liberation),ꯑꯅꯥꯕꯥ ꯑꯃꯁꯨꯡ ꯅꯟ-ꯏꯇꯔꯅꯦꯜ ꯑꯣꯏ;
Aabrahmabhuvanaallokaah punaraavartino’rjuna;,ꯑꯥꯕ꯭ꯔꯥꯍ꯭ꯃꯚꯨꯕꯅꯑꯦꯂꯣꯀꯥꯍ ꯄꯨꯅꯔꯥꯕꯔꯇꯤꯅꯣ’ꯔꯖꯨꯟ;
Maamupetya tu kaunteya punarjanma na vidyate,ꯃꯥꯃꯨꯄꯦꯠꯌꯥ ꯇꯨ ꯀꯥꯎꯟꯇꯦꯌꯥ ꯄꯨꯅꯥꯔꯖꯅꯃꯥ ꯅꯥ ꯚꯤꯗ꯭ꯌꯥꯠ
"16. (All) the worlds, including the world of Brahma, are subject to return again, O Arjuna!","16. (ꯄꯨꯝꯅꯃꯛ) ꯕ꯭ꯔꯍ꯭ꯃꯥꯒꯤ ꯃꯥꯂꯦꯝ ꯌꯥꯑꯣꯅꯥ ꯃꯥꯂꯦꯃꯁꯤꯡ ꯑꯁꯤ ꯑꯃꯨꯛ ꯍꯟꯅꯥ ꯍꯜꯂꯛꯅꯕꯒꯤ ꯃꯈꯥ ꯄꯣꯜꯂꯤ, ꯑꯣ ꯑꯔꯖꯨꯟ!"
"But he who reaches Me, O son of Kunti, has no rebirth!","ꯑꯗꯨꯕꯨ ꯑꯩꯉꯣꯟꯗꯥ ꯌꯧꯍꯅꯕꯥ ꯉꯝꯕꯥ ꯃꯤ ꯑꯗꯨꯅꯥ, ꯍꯦ ꯀꯨꯟꯇꯤꯒꯤ ꯃꯆꯥꯅꯨꯄꯥ, ꯑꯃꯨꯛ ꯍꯟꯅꯥ ꯄꯣꯀꯄꯥ ꯂꯩꯇꯦ!"
Sahasrayugaparyantam aharyad brahmano viduh;,ꯁꯥꯍꯥꯁꯔꯧꯒꯨꯄꯔꯤꯌꯥꯟꯇꯥꯝ ꯑꯍꯔꯤꯌꯥꯗ ꯕ꯭ꯔꯍ꯭ꯃꯅꯣ ꯚꯤꯗꯨꯍ;
Raatrim yugasahasraantaam te’horaatravido janaah,ꯔꯥꯌꯠꯔꯤꯝ ꯌꯨꯒꯥꯁꯥꯍꯥꯁꯔꯥꯅꯇꯥꯝ ꯇꯦ’ꯍꯣꯔꯥꯠꯔꯥꯚꯤꯗꯣ ꯖꯅꯥꯍ
"17. Those who know the day of Brahma, which is of a duration of a thousand Yugas (ages),","17. ꯕ꯭ꯔꯍ꯭ꯃꯥꯒꯤ ꯅꯨꯃꯤꯠ ꯑꯁꯤ ꯈꯉꯕꯥ ꯃꯤꯑꯣꯏꯁꯤꯡꯅꯤ, ꯃꯈꯣꯌꯁꯤꯡ ꯑꯁꯤ ꯌꯨꯒ ꯂꯤꯁꯤꯡ ꯑꯃꯥ (ꯆꯍꯤ) ꯂꯤꯁꯤꯡ ꯑꯃꯥ ꯑꯣꯏꯔꯤ꯫"
"and the night, which is also of a thousand Yugas’ duration, they know day and night","ꯑꯃꯁꯨꯡ ꯅꯨꯃꯤꯠ, ꯃꯁꯤꯁꯨ ꯌꯨꯒꯥꯒꯤ ꯃꯇꯝ ꯂꯤꯁꯤꯡ ꯑꯃꯒꯤ ꯃꯇꯃꯒꯤ ꯑꯣꯏꯕꯥ, ꯃꯈꯣꯌꯅꯥ ꯑꯌꯨꯛ-ꯅꯨꯡꯊꯤꯂꯒꯤ ꯃꯇꯃꯗꯥ ꯈꯉꯏ ."
Avyaktaadvyaktayah sarvaah prabhavantyaharaagame;,ꯑꯕ꯭ꯌꯛꯇꯥꯑꯥꯗꯕ꯭ꯌꯛꯇꯥꯌꯥꯍ ꯁꯔꯋꯥꯍ ꯄ꯭ꯔꯚꯥꯕꯟꯇꯤꯍꯔꯥꯒꯥꯃꯦ;
18. From the unmanifested all the manifested (worlds) proceed at the coming of the “day”;,18. ꯑꯅꯃꯅꯤꯐꯦꯁ꯭ꯠ ꯇꯧꯔꯕꯥ ꯃꯤꯑꯣꯏ ꯄꯨꯝꯅꯃꯛꯅꯥ “ꯅꯨꯃꯤꯠ” ꯂꯥꯀꯄꯥ ꯃꯇꯃꯗꯥ ꯆꯠꯊꯔꯀꯄꯥ ꯃꯌꯦꯛ ꯁꯦꯡꯕꯥ (ꯃꯥꯂꯦꯝ) ꯄꯨꯝꯅꯃꯛ;
at the coming of the “night” they dissolve verily into that alone which is called the unmanifested,“ꯅꯨꯃꯤꯠ” ꯂꯥꯀꯄꯥ ꯃꯇꯃꯗꯥ ꯃꯈꯣꯌꯅꯥ ꯇꯁꯦꯡꯅꯥ ꯃꯗꯨ ꯈꯛꯇꯗꯥ ꯁꯣꯟꯊꯍꯜꯂꯤ ꯃꯗꯨꯕꯨ ꯑꯅꯃꯅꯤꯐꯦꯁ꯭ꯠ ꯍꯥꯌꯅꯥ ꯀꯧꯏ꯫
COMMENTARY: Coming of the “day’ is the commencement of creation. Coming of the,ꯀꯃꯦꯟꯇꯔꯤ: “ꯅꯨꯃꯤꯠ’ ꯑꯁꯤ ꯂꯥꯀꯄꯥ ꯑꯁꯤ ꯁꯦꯝꯕꯤꯕꯥ ꯃꯄꯨꯅꯤ꯫
“night” is the commencement of dissolution,“ꯅꯨꯃꯤꯠ” ꯍꯥꯌꯕꯁꯤ ꯗꯤꯁꯁꯜꯌꯨꯁꯟ ꯍꯧꯕꯥ ꯍꯥꯌꯕꯁꯤꯅꯤ .
Bhootagraamah sa evaayam bhootwaa bhootwaa praleeyate;,ꯚꯨꯇꯥꯒ꯭ꯔꯥꯃꯥꯍ ꯁꯥ ꯏꯚꯥꯌꯝ ꯚꯨꯇꯋꯥꯌꯥ ꯚꯨꯇꯋꯥ ꯄ꯭ꯔꯥꯂꯦꯏꯌꯦꯠ;
"19. This same multitude of beings, born again and again, is dissolved, helplessly, O Arjuna,","19. ꯍꯟꯖꯤꯟ ꯍꯟꯖꯤꯟ ꯄꯣꯀꯄꯥ ꯖꯤꯕꯁꯤꯡꯒꯤ ꯆꯞ ꯃꯥꯟꯅꯕꯥ ꯃꯁꯤꯡ ꯑꯁꯤ, ꯃꯇꯦꯡ ꯄꯥꯡꯗꯅꯥ, ꯑꯣ ꯑꯔꯖꯨꯟ,"
"(into the unmanifested) at the coming of the night, and comes forth at the coming of the day!","(ꯑꯅꯃꯅꯤꯐꯦꯁ꯭ꯠ ꯇꯧꯕꯥ) ꯅꯨꯃꯤꯠꯀꯤ ꯂꯥꯛꯀꯗꯧꯔꯤꯕꯥ ꯃꯇꯃꯗꯥ, ꯑꯃꯁꯨꯡ ꯅꯨꯃꯤꯠꯀꯤ ꯂꯥꯛꯀꯗꯧꯔꯤꯕꯥ ꯃꯇꯝ ꯑꯗꯨꯗꯥ ꯂꯥꯀꯏ!"
Parastasmaat tu bhaavo’nyo’vyakto’vyaktaatsanaatanah;,ꯄꯥꯔꯥꯁ꯭ꯇꯥꯁꯃꯥꯠ ꯇꯨ ꯚꯥꯚꯣ’ꯅꯤꯌꯣ’ꯕ꯭ꯌꯛꯇꯣ’ꯕ꯭ꯌꯛꯇꯥꯠꯁꯥꯅꯥꯇꯥꯇꯥꯅꯍ;
Yah sa sarveshu bhooteshu nashyatsu na vinashyati,ꯌꯥꯍ ꯁꯥ ꯁꯔꯕꯦꯁꯨ ꯚꯨꯇꯦꯁꯨ ꯅꯥꯁ꯭ꯌꯠꯁꯨ ꯅꯥ ꯚꯤꯅꯥꯁ꯭ꯌꯥꯇꯤ
"20. But verily there exists, higher than the unmanifested, another unmanifested Eternal who","20. ꯑꯗꯨꯕꯨ ꯇꯁꯦꯡꯅꯃꯛ ꯃꯐꯝ ꯑꯗꯨꯗꯥ ꯂꯩꯔꯤ, ꯑꯅꯃꯅꯤꯐꯦꯁ꯭ꯇꯦꯗꯇꯒꯤ ꯍꯦꯟꯅꯥ ꯋꯥꯡꯕꯥ, ꯑꯇꯣꯞꯄꯥ ꯃꯤꯅꯤꯐꯦꯁ꯭ꯇꯦꯗ ꯂꯣꯝꯕꯥ ꯅꯥꯏꯗꯕꯥ ꯗꯕꯜꯌꯨ.ꯑꯩꯆ.ꯑꯣ."
is not destroyed when all beings are destroyed,ꯖꯤꯕ ꯄꯨꯝꯅꯃꯛ ꯃꯥꯡꯍꯟ ꯇꯥꯀꯍꯅꯕꯥ ꯃꯇꯃꯗꯥ ꯃꯥꯡꯍꯟ ꯇꯥꯀꯍꯅꯕꯥ ꯅꯠꯇꯦ .
"COMMENTARY: Another unmanifested Eternal refers to Para Brahman, which is","ꯀꯃꯦꯟꯇꯔꯤ: ꯑꯇꯣꯞꯄꯥ ꯑꯅꯃꯅꯤꯐꯦꯁ꯭ꯠ ꯏꯇꯔꯅꯦꯜ ꯑꯁꯤꯅꯥ ꯄꯥꯔꯥ ꯕ꯭ꯔꯍ꯭ꯃꯕꯨ ꯈꯉꯍꯜꯂꯤ, ꯃꯁꯤꯅꯤ"
"distinct from the unmanifested (primordial Nature), and which is of quite a different nature. It is","ꯑꯅꯃꯅꯤꯐꯦꯁ꯭ꯠ (ꯄ꯭ꯔꯥꯏꯃꯣꯔꯗꯤꯌꯜ ꯅꯦꯆꯔ)ꯗꯒꯤ ꯇꯣꯉꯥꯅꯕꯥ, ꯑꯃꯁꯨꯡ ꯃꯁꯤ ꯌꯥꯝꯅꯥ ꯇꯣꯉꯥꯅꯕꯥ ꯃꯑꯣꯡꯒꯤ ꯑꯣꯏꯕꯥ꯫"
superior to Hiranyagarbha (the creative Intelligence) and the unmanifested Nature because It is,ꯍꯤꯔꯟꯌꯒꯔꯚ (ꯀ꯭ꯔꯤꯌꯦꯇꯤꯕ ꯏꯟꯇꯦꯂꯤꯖꯦꯟꯁ) ꯑꯃꯁꯨꯡ ꯑꯅꯃꯦꯅꯤꯐꯦꯁ꯭ꯠ ꯅꯦꯆꯔꯗꯒꯤ ꯍꯦꯟꯅꯥ ꯐꯕꯥ ꯃꯔꯝꯅꯥ ꯃꯁꯤꯅꯤ ꯃꯔꯃꯗꯤ ꯃꯁꯤꯅꯤ꯫
their cause. It is not destroyed when all beings from Brahma down to a blade of grass are destroyed,ꯃꯈꯣꯌꯒꯤ ꯃꯔꯝ꯫
Avyakto’kshara ityuktastamaahuh paramaam gatim;,ꯑꯚ꯭ꯌꯥꯛꯇꯣ’ꯀꯁꯥꯔꯥ ꯏꯇꯤꯎꯛꯇꯥꯁ꯭ꯇꯃꯥꯍꯨꯍ ꯄꯔꯃꯥꯝ ꯒꯇꯤꯝ;
Yam praapya na nivartante taddhaama paramam mama,ꯌꯥꯝ ꯄ꯭ꯔꯌꯥꯄꯤꯌ ꯅꯥ ꯅꯤꯕꯔꯇꯥꯟꯇꯦ ꯇꯥꯗ꯭ꯙꯃꯥ ꯄꯔꯃꯝ ꯃꯥꯃꯥ
69,꯶꯹ ꯑꯃꯁꯨꯡ ꯑꯦꯟ.
BHAGAVAD GITA,ꯚꯒꯕꯠ ꯒꯤꯇꯥ
"21. What is called the Unmanifested and the Imperishable, That they say is the highest goal",21. ꯃꯈꯣꯌꯅꯥ ꯍꯥꯌꯔꯤꯕꯥ ꯑꯁꯤ ꯈ꯭ꯕꯥꯏꯗꯒꯤ ꯋꯥꯡꯕꯥ ꯄꯥꯟꯗꯃꯅꯤ ꯍꯥꯌꯅꯥ ꯍꯥꯌꯔꯤꯕꯥ ꯑꯁꯤ ꯑꯅꯃꯅꯤꯐꯦꯁ꯭ꯠ ꯑꯃꯁꯨꯡ ꯏꯝꯄꯦꯔꯦꯕꯜ ꯍꯥꯌꯅꯥ ꯀꯧꯔꯤꯕꯥ ꯑꯁꯤ .
(path). They who reach It do not return (to this cycle of births and deaths). That is My highest abode,(ꯂꯝꯕꯤ).
(place or state),(ꯃꯐꯝ ꯅꯠꯔꯒꯥ ꯔꯥꯖ꯭ꯌ)
Purushah sa parah paartha bhaktyaa labhyastwananyayaa;,ꯄꯨꯔꯨꯁꯍ ꯁꯥ ꯄꯔꯍ ꯄꯌꯥꯔꯊꯥ ꯚꯛꯠꯌ ꯂꯕꯥꯁ꯭ꯇꯋꯥꯅꯅꯌꯌꯥ;
Yasyaantahsthaani bhootaani yena sarvamidam tatam,ꯌꯥꯁꯌꯥꯟꯇꯍꯁ꯭ꯇꯨꯅꯤ ꯚꯨꯇꯥꯅꯤ ꯌꯦꯅꯥ ꯁꯔꯚꯃꯤꯗꯥꯝ ꯇꯥꯇꯥꯝ
"22. That highest Purusha, O Arjuna, is attainable by unswerving devotion to Him alone","22. ꯈ꯭ꯕꯥꯏꯗꯒꯤ ꯋꯥꯡꯕꯥ ꯄꯨꯔꯨꯁ, ꯍꯦ ꯑꯔꯖꯨꯟ, ꯃꯍꯥꯛ ꯈꯛꯇꯗꯥ ꯚꯛꯇꯤ ꯄꯤꯗꯅꯥ ꯐꯪꯒꯅꯤ"
within whom all beings dwell and by whom all this is pervaded,ꯖꯤꯕ ꯄꯨꯝꯅꯃꯛ ꯂꯩꯔꯤꯕꯥ ꯑꯃꯁꯨꯡ ꯃꯁꯤ ꯄꯨꯝꯅꯃꯛ ꯑꯁꯤ ꯌꯥꯝꯅꯥ ꯅꯤꯡꯊꯤꯅꯥ ꯂꯩꯕꯥ ꯃꯤꯑꯣꯏ ꯑꯃꯅꯤ꯫
Yatra kaale twanaavrittim aavrittim chaiva yoginah;,ꯌꯥꯠꯔꯥ ꯀꯥꯂꯦ ꯇꯋꯥꯅꯥꯚ꯭ꯔ꯭ꯏꯠꯇꯤꯝ ꯑꯥꯚ꯭ꯔ꯭ꯏꯠꯇꯤꯝ ꯆꯥꯏꯕꯥ ꯌꯣꯒꯤꯅꯥꯍ;
Prayaataa yaanti tam kaalam vakshyaami bharatarshabha,ꯄ꯭ꯔꯌꯥꯇꯥꯌꯥ ꯌꯥꯌꯥꯟꯇꯤ ꯇꯥꯝ ꯀꯂꯥꯝ ꯋꯛꯁ꯭ꯌꯥꯃꯤ ꯚꯥꯔꯇꯔꯁꯥꯚꯥ
"23. Now I will tell thee, O chief of the Bharatas, the times departing at which the Yogis will","23. ꯍꯧꯖꯤꯛ ꯑꯩꯅꯥ ꯅꯉꯣꯟꯗꯥ ꯍꯥꯌꯒꯅꯤ, ꯍꯦ ꯚꯥꯔꯇꯥꯁꯀꯤ ꯆꯤꯐ, ꯌꯣꯒꯤꯁꯤꯡꯅꯥ ꯆꯠꯀꯗꯕꯥ ꯃꯇꯝ ꯑꯗꯨ"
return or not return!,ꯍꯜꯂꯀꯄꯥ ꯅꯠꯔꯒꯥ ꯍꯜꯂꯀꯄꯥ!
Agnijyotirahah shuklah shanmaasaa uttaraayanam;,ꯑꯒ꯭ꯅꯤꯖꯌꯣꯇꯤꯔꯥꯍꯥꯍ ꯁꯨꯛꯂꯍ ꯁꯅꯃꯥꯁ ꯎꯠꯇꯔꯥꯌꯅꯝ;
Tatra prayaataa gacchanti brahma brahmavido janaah,ꯇꯥꯠꯔꯥ ꯄ꯭ꯔꯌꯥꯇꯥ ꯒꯥꯆꯆꯟꯇꯤ ꯕ꯭ꯔꯍ꯭ꯃꯥ ꯕ꯭ꯔꯍ꯭ꯃꯕꯤꯗꯣ ꯖꯅꯥꯍ
"24. Fire, light, daytime, the bright fortnight, the six months of the northern path of the sun","24. ꯃꯩ, ꯃꯉꯥꯜ, ꯅꯨꯃꯤꯗꯥꯡꯒꯤ ꯃꯇꯝ, ꯃꯉꯥꯜ ꯌꯥꯑꯣꯕꯥ ꯅꯨꯃꯤꯠ, ꯅꯨꯃꯤꯠꯀꯤ ꯅꯣꯡꯄꯣꯛ ꯊꯪꯕꯥ ꯂꯝꯕꯤꯒꯤ ꯊꯥ ꯶"
"(northern solstice)—departing then (by these), men who know Brahman go to Brahman","(ꯅꯣꯔꯊ ꯁꯣꯂꯁ꯭ꯇꯤꯁ)—ꯃꯗꯨꯗꯒꯤ (ꯃꯁꯤꯅꯥ) ꯆꯠꯈꯤꯕꯥ, ꯕ꯭ꯔꯍ꯭ꯝꯅꯥ ꯕ꯭ꯔꯍ꯭ꯃꯕꯨ ꯈꯉꯕꯥ ꯅꯨꯄꯥꯁꯤꯡꯅꯥ ꯕ꯭ꯔꯍ꯭ꯃꯥꯅꯗꯥ ꯆꯠꯂꯨ"
Dhoomo raatristathaa krishnah shanmaasaa dakshinaayanam;,ꯙꯨꯃꯣ ꯔꯥꯌꯥꯠꯔꯤꯁ꯭ꯇꯥꯇꯥ ꯀ꯭ꯔ꯭ꯏꯁ꯭ꯅꯍ ꯁꯅꯃꯥꯁꯥꯗꯥ ꯗꯛꯁꯤꯅꯥꯌꯥꯌꯅꯝ;
Tatra chaandramasam jyotir yogee praapya nivartate,ꯇꯥꯠꯔꯥ ꯆꯟꯗ꯭ꯔꯃꯥꯁꯝ ꯖ꯭ꯌꯣꯇꯤꯔ ꯌꯣꯒꯤ ꯄ꯭ꯔꯌꯥꯄꯤꯌꯥ ꯅꯤꯚꯥꯔꯇꯦꯠ
"25. Attaining to the lunar light by smoke, night-time, the dark fortnight or the six months of","25. ꯃꯩꯅꯥ ꯆꯥꯀꯄꯥ, ꯅꯨꯃꯤꯗꯥꯡꯒꯤ ꯃꯇꯃꯗꯥ, ꯗꯥꯔꯛ ꯐꯣꯔꯇꯅꯥꯏꯠ ꯅꯠꯠꯔꯒꯥ ꯊꯥ ꯶ꯀꯤ ꯊꯥꯒꯤ ꯃꯉꯥꯂꯅꯥ ꯊꯜꯂꯕꯥ ꯃꯉꯥꯜ ꯑꯗꯨ ꯐꯪꯍꯅꯕꯥ꯫"
"the southern path of the sun (the southern solstice), the Yogi returns","ꯅꯨꯃꯤꯠꯀꯤ ꯈꯥ ꯊꯪꯕꯥ ꯂꯝꯕꯤ (ꯈꯥ ꯊꯪꯕꯥ ꯁꯣꯂꯁ꯭ꯇꯤꯁ), ꯌꯣꯒꯤ ꯔꯤꯇꯔꯟ"
Shuklakrishne gatee hyete jagatah shaashwate mate;,ꯁꯨꯛꯂꯀ꯭ꯔ꯭ꯏꯁ꯭ꯅꯦ ꯒꯦꯠ ꯍꯦꯏꯠ ꯖꯒꯇꯥꯍ ꯁꯥꯁ꯭ꯕꯇꯦ ꯃꯦꯠ;
Ekayaa yaatyanaavrittim anyayaa’vartate punah,ekayaa yaatyanaavrittim anyayaa’vartate ꯄꯨꯅꯥꯍ
26. The bright and the dark paths of the world are verily thought to be eternal; by the one,26. ꯃꯥꯂꯦꯃꯒꯤ ꯃꯉꯥꯜ ꯑꯃꯁꯨꯡ ꯑꯃꯝꯕꯥ ꯂꯝꯕꯤꯁꯤꯡ ꯑꯁꯤ ꯇꯁꯦꯡꯅꯥ ꯂꯣꯝꯕꯥ ꯅꯥꯏꯗꯕꯥ ꯑꯣꯏꯒꯅꯤ ꯍꯥꯌꯅꯥ ꯈꯜꯂꯤ;
"(the bright path) a person goes not to return again, and by the other (the dark path) he returns","(ꯃꯉꯥꯜ ꯌꯥꯑꯣꯕꯥ ꯂꯝꯕꯤ) ꯃꯤꯑꯣꯏ ꯑꯃꯅꯥ ꯑꯃꯨꯛ ꯍꯟꯅꯥ ꯍꯜꯂꯛꯂꯣꯏꯗꯕꯅꯤ ꯍꯥꯌꯅꯥ ꯆꯠꯂꯤ, ꯑꯃꯁꯨꯡ ꯑꯇꯣꯞꯄꯥ (ꯑꯟꯙ꯭ꯔ ꯂꯝꯕꯤ) ꯑꯗꯨꯅꯥ ꯃꯍꯥꯛꯅꯥ ꯍꯜꯂꯀꯏ"
COMMENTARY: The bright path is the path to the gods taken by devotees. The dark path,ꯀꯃꯦꯟꯇꯔꯤ: ꯃꯉꯥꯜ ꯌꯥꯑꯣꯕꯥ ꯂꯝꯕꯤ ꯑꯁꯤ ꯚꯛꯇꯁꯤꯡꯅꯥ ꯂꯧꯕꯥ ꯏꯁ꯭ꯕꯔꯁꯤꯡꯒꯤ ꯂꯝꯕꯤꯅꯤ꯫
is of the manes taken by those who perform sacrifices or charitable acts with the expectation of,ꯑꯁꯤ ꯀꯠꯊꯣꯀꯄꯥ ꯅꯠꯔꯒꯥ ꯆꯦꯔꯤꯇꯦꯕꯜ ꯑꯦꯛꯇꯁꯤꯡ ꯇꯧꯔꯤꯕꯥ ꯃꯤꯑꯣꯏꯁꯤꯡꯅꯥ ꯂꯧꯈꯤꯕꯥ ꯂꯧꯃꯤꯁꯤꯡꯅꯥ ꯂꯧꯈꯤꯕꯅꯤ ꯫
rewards,ꯃꯅꯥꯁꯤꯡ .
Naite sritee paartha jaanan yogee muhyati kashchana;,ꯅꯥꯏꯠ ꯁ꯭ꯔꯤꯄꯤ ꯄꯥꯔꯊꯥ ꯖꯥꯅꯟ ꯌꯣꯒꯤ ꯃꯨꯍ꯭ꯌꯥꯇꯤ ꯀꯁ꯭ꯆꯅꯥ;
Tasmaat sarveshu kaaleshu yogayukto bhavaarjuna,ꯇꯥꯁꯃꯥꯠ ꯁꯔꯕꯦꯁꯨ ꯀꯥꯂꯦꯁꯨ ꯌꯣꯒꯥꯌꯨꯛꯇꯣ ꯚꯥꯕꯥꯔꯖꯨꯅꯥ
"27. Knowing these paths, O Arjuna, no Yogi is deluded! Therefore, at all times be steadfast","27. ꯂꯝꯕꯤꯁꯤꯡ ꯑꯁꯤ ꯈꯉꯂꯗꯨꯅꯥ, ꯍꯦ ꯑꯔꯖꯨꯟ, ꯌꯣꯒꯤ ꯑꯃꯠꯇꯥ ꯂꯧꯁꯤꯅꯗꯦ!"
in Yoga,ꯌꯣꯒꯗꯥ .
Vedeshu yajneshu tapahsu chaiva,ꯚꯦꯗꯦꯁꯨ ꯌꯥꯖꯅꯦꯁꯨ ꯇꯥꯄꯍꯁꯨ ꯆꯥꯏꯕꯥ
Daaneshu yat punyaphalam pradishtam:,ꯗꯥꯅꯦꯁꯨ ꯌꯥꯠ ꯄꯨꯟꯌꯐꯂꯝ ꯄ꯭ꯔꯗꯤꯁ꯭ꯇꯝ:
70,꯷꯰ ꯑꯃꯁꯨꯡ ꯑꯦꯟ.
THE YOGA OF THE IMPERISHABLE BRAHMAN,ꯏꯝꯄꯦꯔꯤꯁꯦꯕꯜ ꯕ꯭ꯔꯍ꯭ꯃꯅꯒꯤ ꯌꯣꯒ .
Atyeti tatsarvam idam viditwaa,ꯑꯇꯤꯇꯤ ꯇꯥꯠꯁꯥꯔꯕꯝ ꯏꯗꯝ ꯚꯤꯗꯤꯠꯋꯥꯌꯥ
Yogee param sthaanamupaiti chaadyam,ꯌꯣꯒꯤ ꯄꯔꯝ ꯁ꯭ꯠꯌꯥꯅꯥꯃꯨꯄꯥꯏꯇꯤ ꯆꯥꯌꯥꯌꯥꯝ
28. Whatever fruits or merits is declared (in the scriptures) to accrue from (the study of) the,28. ꯃꯍꯩ ꯃꯔꯣꯡ ꯅꯠꯔꯒꯥ ꯃꯦꯔꯤꯠꯇꯥ ꯀꯔꯤꯒꯨꯝꯕꯥ ꯑꯃꯥ ꯂꯥꯑꯣꯊꯣꯀꯄꯥ (ꯁꯥꯁ꯭ꯠꯔꯁꯤꯡꯗꯥ) ꯑꯁꯤ (ꯃꯍꯩ ꯃꯔꯣꯡꯒꯤ)ꯗꯒꯤ ꯂꯥꯀꯄꯥ ꯌꯥꯏ ꯍꯥꯌꯅꯥ ꯂꯥꯎꯊꯣꯀꯄꯥ (ꯁꯥꯁ꯭ꯠꯔꯁꯤꯡꯗꯥ) .
"Vedas, (the performance of) sacrifices, (the practice of) austerities, and (the offering of)","ꯕꯦꯗꯁꯤꯡ, (ꯗꯤ ꯄꯔꯐꯣꯃꯦꯟꯁ ꯑꯣꯐ) ꯀꯠꯊꯣꯀꯄꯥ, (ꯆꯠꯊꯣꯛ-ꯆꯠꯁꯤꯟ ꯇꯧꯕꯥ) ꯇꯁꯦꯡꯕꯥ, ꯑꯃꯁꯨꯡ (ꯑꯃꯁꯨꯡ)"
"gifts—beyond all these goes the Yogi, having known this; and he attains to the supreme primeval","ꯈꯨꯗꯣꯂꯄꯣꯠꯁꯤꯡ—ꯃꯁꯤ ꯄꯨꯝꯅꯃꯛ ꯑꯁꯤꯒꯤ ꯃꯊꯛꯇꯥ ꯌꯣꯒꯤ ꯆꯠꯂꯤ, ꯃꯁꯤ ꯈꯉꯂꯗꯨꯅꯥ;"
(first or ancient) Abode,(ꯑꯍꯥꯅꯕꯥ ꯅꯠꯔꯒꯥ ꯑꯔꯤꯕꯥ) ꯂꯩꯐꯝ
Hari Om Tat Sat,ꯍꯔꯤ ꯑꯣꯝ ꯇꯥꯠ ꯁꯒꯣ
Iti Srimad Bhagavadgeetaasoopanishatsu Brahmavidyaayaam,iti ꯁ꯭ꯔꯤꯃꯗ ꯚꯒꯕꯗ꯭ꯒꯤꯇꯥꯁꯨꯄꯦꯅꯤꯁꯥꯠꯁꯨ ꯕ꯭ꯔꯍ꯭ꯃꯕꯤꯗꯌꯥꯌꯥꯌꯝ
Yogashaastre Sri Krishnaarjunasamvaade,ꯌꯣꯒꯁꯥꯁ꯭ꯠꯔꯦ ꯁ꯭ꯔꯤ ꯀ꯭ꯔ꯭ꯏꯁ꯭ꯅꯔꯖꯨꯅꯥꯁꯃꯚꯥꯗꯦ
Aksharabrahmayogo Naama Ashtamo’dhyaayah,ꯑꯛꯁꯔꯥꯕ꯭ꯔꯍꯃꯌꯣꯒꯣ ꯅꯥꯃꯥ ꯑꯁ꯭ꯇꯥꯃꯣ’ꯙ꯭ꯌꯥꯌꯥꯍ
"Thus in the Upanishads of the glorious Bhagavad Gita, the science of the Eternal, the","ꯑꯁꯨꯝꯅꯥ ꯃꯁꯛ ꯅꯥꯏꯕꯥ ꯚꯒꯕꯠ ꯒꯤꯇꯥꯒꯤ ꯎꯄꯅꯤꯁꯗꯁꯤꯡꯗꯥ, ꯏꯇꯔꯅꯦꯂꯒꯤ ꯁꯥꯏꯟꯁ, ꯗꯤ."
"scripture of Yoga, the dialogue between Sri Krishna and Arjuna, ends the eighth discourse entitled:","ꯌꯣꯒꯒꯤ ꯁꯥꯁ꯭ꯠꯔ, ꯁ꯭ꯔꯤ ꯀ꯭ꯔ꯭ꯏꯁ꯭ꯟ ꯑꯃꯁꯨꯡ ꯑꯔꯖꯨꯅꯒꯤ ꯃꯔꯛꯇꯥ ꯂꯩꯔꯤꯕꯥ ꯋꯥꯔꯤ ꯁꯥꯅꯕꯥ ꯑꯁꯤꯅꯥ ꯑꯍꯨꯃꯁꯨꯕꯥ ꯋꯥꯔꯣꯜ ꯑꯗꯨ ꯂꯣꯏꯁꯤꯜꯂꯤ ꯃꯗꯨꯗꯤ ꯃꯗꯨꯒꯤ ꯃꯃꯤꯡꯗꯤ:"
“The Yoga Of the Imperishable Brahman”,“ꯏꯝꯄꯦꯔꯦꯁꯦꯕꯜ ꯕ꯭ꯔꯍ꯭ꯃꯅꯒꯤ ꯌꯣꯒ”
THE YOGA OF THE KINGLY SCIENCE & THE KINGLY,ꯅꯤꯡꯊꯧꯒꯤ ꯁꯥꯏꯟꯁ & ꯅꯤꯡꯊꯧꯒꯤ ꯌꯣꯒ .
SECRET,ꯑꯔꯣꯟ ꯑꯊꯨꯞ
Summary of Ninth Discourse,ꯑꯅꯤꯁꯨꯕꯥ ꯋꯥꯉꯥꯡꯂꯣꯏꯒꯤ ꯋꯥꯔꯣꯜ
"Observing that Arjuna was a qualified aspirant and endowed with faith, Krishna declares to",ꯑꯔꯖꯨꯟ ꯑꯁꯤ ꯀ꯭ꯕꯥꯂꯤꯐꯥꯏꯗ ꯑꯣꯏꯕꯥ ꯑꯦꯁ꯭ꯄꯤꯔꯦꯟꯇ ꯑꯃꯅꯤ ꯑꯃꯁꯨꯡ ꯊꯥꯖꯕꯒꯥ ꯂꯣꯌꯅꯅꯥ ꯄꯤꯔꯝꯕꯥ ꯑꯗꯨ ꯌꯦꯡꯂꯒꯥ ꯀ꯭ꯔ꯭ꯏꯁ꯭ꯅꯅꯥ ꯂꯥꯑꯣꯊꯣꯀꯏ
him the sovereign knowledge and sovereign secret that is to be known by direct experience. He adds,ꯃꯍꯥꯀꯄꯨ ꯍꯀꯊꯦꯡꯅꯅꯥ ꯑꯦꯛꯁꯄꯔꯤꯌꯦꯟꯁꯅꯥ ꯈꯉꯒꯗꯕꯥ ꯁꯣꯚꯔꯦꯟ ꯅꯣꯂꯦꯖ ꯑꯃꯁꯨꯡ ꯁꯣꯚꯔꯦꯟ ꯁꯤꯛꯔꯦꯠ ꯑꯗꯨ꯫
that without faith in this knowledge man fails to reach God and is reborn to suffer,ꯖ꯭ꯅꯥꯟ ꯑꯁꯤꯒꯤ ꯃꯇꯥꯡꯗꯥ ꯊꯥꯖꯕꯥ ꯌꯥꯑꯣꯗꯅꯥ ꯃꯤꯑꯣꯏꯕꯅꯥ ꯏꯁ꯭ꯕꯔꯗꯥ ꯌꯧꯕꯥ ꯉꯃꯗꯕꯥ ꯑꯃꯁꯨꯡ ꯑꯋꯥꯕꯥ ꯈꯥꯉꯕꯥ ꯉꯃꯗꯕꯥ ꯑꯗꯨ ꯑꯃꯨꯛ ꯍꯟꯅꯥ ꯄꯣꯀꯄꯥ ꯉꯃꯗꯕꯥ .
"Now the Lord proceeds to describe His nature as the eternal, all-comprehensive Truth. He is","ꯍꯧꯖꯤꯛ ꯏꯕꯨꯡꯉꯣꯅꯥ ꯃꯍꯥꯛꯀꯤ ꯃꯍꯧꯁꯥꯕꯨ ꯂꯣꯝꯕꯥ ꯅꯥꯏꯗꯕꯥ, ꯄꯨꯝꯅꯃꯛ ꯌꯥꯑꯣꯕꯥ ꯑꯆꯨꯝꯕꯥ ꯍꯥꯌꯅꯥ ꯐꯣꯡꯗꯣꯛꯅꯕꯥ ꯆꯠꯂꯤ꯫"
"everything that is invisible and visible. He pervades everything that exists. He creates everything,",ꯎꯕꯥ ꯐꯪꯗꯕꯥ ꯑꯃꯁꯨꯡ ꯎꯕꯥ ꯉꯝꯕꯥ ꯄꯨꯝꯅꯃꯛ꯫
"sustains everything, and when final dissolution takes place, absorbs everything into Himself. He","ꯄꯨꯝꯅꯃꯀꯄꯨ ꯂꯦꯡꯗꯅꯥ ꯊꯝꯃꯤ, ꯑꯃꯁꯨꯡ ꯑꯔꯣꯏꯕꯥ ꯗꯤꯁꯁꯜꯌꯨꯁꯟ ꯊꯣꯀꯄꯥ ꯃꯇꯃꯗꯥ, ꯄꯨꯝꯅꯃꯛ ꯃꯁꯥꯃꯀꯄꯨ ꯁꯣꯀꯍꯜꯂꯤ꯫"
manifests them again when the next creation begins. All beings who are ignorant of this knowledge,ꯃꯊꯪꯒꯤ ꯁ꯭ꯔ꯭ꯏꯁ꯭ꯇꯤ ꯍꯧꯔꯀꯄꯥ ꯃꯇꯃꯗꯥ ꯃꯈꯣꯌꯕꯨ ꯑꯃꯨꯛ ꯍꯟꯅꯥ ꯃꯁꯛ ꯇꯥꯀꯏ꯫
