en,mni-Mtei
and get an ice cream as soon as she even considers it It may not look,ꯑꯃꯁꯨꯡ ꯑꯥꯏꯁꯛꯔꯤꯝ ꯑꯃꯥ ꯂꯧꯔꯒꯥ ꯃꯍꯥꯛꯅꯥ ꯃꯁꯤꯕꯨ ꯐꯥꯑꯣꯕꯥ ꯈꯜꯂꯕꯥ ꯃꯇꯨꯡꯗꯥ ꯃꯁꯤ ꯎꯕꯥ ꯐꯪꯗꯕꯥ ꯌꯥꯏ .
very dangerous but its the first step to breaking all Judys rules of,ꯌꯥꯝꯅꯥ ꯈꯨꯗꯣꯡꯊꯤꯅꯤꯡꯉꯥꯏ ꯑꯣꯏꯕꯥ ꯑꯗꯨꯕꯨ ꯃꯁꯤꯒꯤ ꯑꯍꯥꯅꯕꯥ ꯈꯣꯡꯊꯥꯡ ꯑꯁꯤ ꯖꯨꯗꯤꯁ ꯄꯨꯝꯅꯃꯛ ꯊꯨꯒꯥꯏꯕꯒꯤ ꯑꯍꯥꯅꯕꯥ ꯈꯣꯡꯊꯥꯡꯅꯤ꯫
safety Once shes comfortable with tiny steps shell be able to devise,ꯁꯦꯐꯇꯤ ꯑꯃꯨꯛ ꯍꯟꯅꯥ ꯁꯦꯁ ꯀꯝꯐꯣꯔꯇꯦꯕꯜ ꯋꯤꯊ ꯇꯤꯟ ꯁ꯭ꯇꯦꯄꯁ ꯁꯦꯜ ꯕꯤ ꯕꯤ ꯑꯦꯕꯜ ꯗꯤꯚꯤꯖ
bolder stepsand take them,ꯕꯣꯜꯗꯔ ꯑꯣꯏꯕꯥ ꯈꯣꯡꯊꯥꯡꯁꯤꯡ ꯑꯃꯁꯨꯡ ꯃꯈꯣꯌꯕꯨ ꯂꯧꯈꯠꯀꯗꯕꯅꯤ .
Cindy started looking for a job in the career counseling department of,ꯁꯤꯟꯗꯤꯒꯤ ꯀꯦꯔꯤꯌꯔ ꯀꯥꯎꯟꯁꯦꯂꯤꯡ ꯕꯤꯚꯥꯒꯇꯥ ꯊꯕꯛ ꯑꯃꯥ ꯊꯤꯕꯥ ꯍꯧꯈꯤ꯫
a community college in the town she wants to move to she also makes,ꯃꯍꯥꯛꯅꯥ ꯆꯠꯄꯥ ꯄꯥꯝꯂꯤꯕꯥ ꯇꯥꯎꯟ ꯑꯗꯨꯗꯥ ꯂꯩꯕꯥ ꯀꯝꯝꯌꯨꯅꯤꯇꯤ ꯀꯣꯂꯦꯖ ꯑꯃꯅꯥ ꯃꯍꯥꯛꯅꯥ ꯁꯦꯝꯕꯥ .
herself look at the local want ads Because shell have to stay in touch,ꯃꯁꯥꯃꯛꯅꯥ ꯂꯣꯀꯦꯜ ꯋꯥꯟꯇ ꯑꯦꯗꯁꯤꯡ ꯌꯦꯡꯕꯤꯌꯨ ꯃꯔꯃꯗꯤ ꯁꯦꯂꯅꯥ ꯄꯥꯎ ꯐꯥꯑꯣꯅꯒꯗꯕꯅꯤ
with all the corporate opportunities in the area in order to develop a,ꯑꯃꯥ ꯁꯦꯃꯒꯠꯅꯕꯥ ꯃꯐꯝ ꯑꯗꯨꯗꯥ ꯂꯩꯔꯤꯕꯥ ꯀꯣꯔꯄꯣꯔꯦꯠꯀꯤ ꯈꯨꯗꯣꯡꯆꯥꯕꯥ ꯄꯨꯝꯅꯃꯛꯀꯥ ꯂꯣꯌꯅꯅꯥ .
program she can sell to the community colleges one of these days she,ꯄ꯭ꯔꯣꯒ꯭ꯔꯥꯝ ꯃꯍꯥꯛꯅꯥ ꯀꯝꯝꯌꯨꯅꯤꯇꯤ ꯀꯣꯂꯦꯖꯁꯤꯡꯗꯥ ꯌꯣꯅꯕꯥ ꯌꯥꯒꯅꯤ ꯅꯨꯃꯤꯠꯁꯤꯡ ꯑꯁꯤꯒꯤ ꯃꯅꯨꯡꯗꯥ ꯑꯃꯥ ꯃꯍꯥꯛꯅꯥ .
may find a job thats so right for her shell keep it for herself,may foind a job thats so right for her shell keep it for for ꯃꯁꯥ
Everyone who chose safety over adventure needs to practice taking tiny,ꯑꯦꯗꯚꯦꯟꯆꯔꯒꯤ ꯃꯍꯨꯠꯇꯥ ꯁꯦꯐꯇꯤ ꯈꯅꯈꯤꯕꯥ ꯃꯤꯑꯣꯏ ꯈꯨꯗꯤꯡꯃꯛꯅꯥ ꯇꯤꯅꯤ ꯂꯧꯕꯒꯤ ꯄ꯭ꯔꯦꯛꯇꯤꯁ ꯇꯧꯕꯥ ꯃꯊꯧ ꯇꯥꯏ .
steps in an adventurous direction So set a goal no matter how tentative,ꯑꯦꯗꯚꯦꯟꯆꯔ ꯑꯣꯏꯕꯥ ꯃꯥꯏꯀꯩ ꯑꯃꯗꯥ ꯈꯣꯡꯊꯥꯡꯁꯤꯡ ꯑꯗꯨꯅꯥ ꯀꯌꯥ ꯌꯥꯝꯅꯥ ꯇꯦꯟꯇꯦꯇꯤꯕ ꯑꯣꯏꯔꯕꯁꯨ ꯄꯥꯟꯗꯝ ꯑꯃꯥ ꯊꯝꯃꯨ
and start the planning process Decide to become an actor or learn,ꯑꯃꯁꯨꯡ ꯄ꯭ꯂꯥꯅꯤꯡ ꯄ꯭ꯔꯣꯁꯦꯁ ꯍꯧꯗꯣꯀꯄꯥ ꯑꯦꯛꯇꯔ ꯑꯃꯥ ꯑꯣꯏꯅꯕꯥ ꯅꯠꯔꯒꯥ ꯇꯝꯅꯕꯥ ꯋꯥꯔꯦꯞ ꯂꯧꯕꯥ
karate or go camping Dont worry too much about whether or not you,ꯀꯥꯔꯥꯇꯦ ꯅꯠꯔꯒꯥ ꯒꯣ ꯀꯦꯝꯄ ꯇꯧꯕꯥ ꯅꯍꯥꯛꯅꯥ ꯌꯥꯝꯅꯥ ꯋꯥꯅꯥ ꯋꯥꯅꯥ ꯋꯥꯅꯥ ꯋꯥꯔꯤ ꯁꯥꯟꯅꯗꯦ ꯅꯠꯔꯒꯥ ꯅꯠꯇꯦ ꯍꯥꯌꯕꯒꯤ ꯃꯇꯥꯡꯗꯥ ꯌꯥꯝꯅꯥ ꯋꯥꯅꯥ ꯋꯥꯅꯥ ꯋꯥ ꯉꯥꯡꯗꯦ
actually achieve this goal Taking steps in any new direction is,ꯇꯁꯦꯡꯅꯥ ꯄꯥꯟꯗꯝ ꯑꯁꯤ ꯐꯪꯕꯥ ꯑꯅꯧꯕꯥ ꯃꯥꯌꯀꯩ ꯑꯃꯍꯦꯛꯇꯗꯥ ꯈꯣꯡꯊꯥꯡꯁꯤꯡ ꯂꯧꯈꯠꯄꯥ ꯑꯁꯤ .
adventurous All you really want to do is start behaving in new ways at,ꯑꯦꯗꯚꯦꯟꯆꯔ ꯑꯣꯏꯕꯥ ꯑꯗꯣꯝꯅꯥ ꯇꯁꯦꯡꯅꯥ ꯇꯧꯕꯥ ꯄꯥꯝꯕꯥ ꯑꯁꯤ ꯑꯅꯧꯕꯥ ꯃꯑꯣꯡꯗꯥ ꯂꯃꯆꯠ ꯁꯥꯖꯠ ꯆꯠꯄꯥ ꯍꯧꯕꯅꯤ꯫
the lowest risk possible,ꯈ꯭ꯕꯥꯏꯗꯒꯤ ꯅꯦꯝꯕꯥ ꯔꯤꯁ꯭ꯛ ꯑꯁꯤ .
Write up a list of what youll have to do to get to your goal Dont set a,ꯅꯍꯥꯛꯀꯤ ꯄꯥꯟꯗꯝ ꯑꯗꯨꯗꯥ ꯌꯧꯅꯕꯒꯤꯗꯃꯛ ꯅꯍꯥꯛꯅꯥ ꯇꯧꯒꯗꯕꯥ ꯊꯕꯛ ꯑꯗꯨꯒꯤ ꯂꯤꯁ꯭ꯠ ꯑꯃꯥ ꯏꯕꯤꯌꯨ Dont Set A
time limit on achieving any goals or subgoals just put them in the right order,ꯄꯥꯟꯗꯝ ꯅꯠꯠꯔꯒꯥ ꯁꯕꯒꯣꯜ ꯑꯃꯠꯇꯥ ꯐꯪꯗꯕꯒꯤ ꯃꯇꯃꯒꯤ ꯂꯤꯃꯤꯠ ꯑꯗꯨ ꯁꯨꯞꯅꯒꯤ ꯑꯆꯨꯝꯕꯥ ꯑꯣꯔꯗꯔꯗꯥ ꯊꯝꯃꯨ
There are tips about how to do planning in Chapter 6 I Want Too,ꯆꯦꯞꯇꯔ ꯶ꯇꯥ ꯄ꯭ꯂꯥꯅꯤꯡ ꯇꯧꯕꯥ ꯃꯇꯧ ꯀꯔꯝꯅꯥ ꯇꯧꯒꯗꯒꯦ ꯍꯥꯌꯕꯒꯤ ꯃꯇꯥꯡꯗꯥ ꯋꯥꯐꯝ ꯀꯌꯥ ꯂꯩꯔꯤ .
Many Things,ꯋꯥꯐꯝ ꯀꯌꯥ ꯑꯃꯥ .
Dont leave your Sure Thing just yet First begin to practice taking the,ꯗꯣꯟꯇ ꯂꯤꯚ ꯏꯌꯣꯔ ꯁꯣꯔ ꯊꯤꯡꯛ ꯈꯖꯤꯛꯇꯪ ꯍꯧꯖꯤꯛ ꯐꯥꯑꯣꯕꯗꯥ ꯑꯍꯥꯅꯕꯥ ꯑꯣꯏꯅꯥ ꯄ꯭ꯔꯦꯛꯇꯤꯁ ꯇꯧꯕꯥ ꯍꯧꯔꯦ
small steps doing the things youve avoided doing before experiencing,ꯑꯄꯤꯀꯄꯥ ꯈꯣꯡꯊꯥꯡꯁꯤꯡ ꯅꯍꯥꯛꯅꯥ ꯊꯦꯡꯅꯗ꯭ꯔꯤꯉꯩ ꯃꯃꯥꯡꯗꯥ ꯅꯍꯥꯛꯅꯥ ꯇꯧꯕꯗꯒꯤ ꯂꯥꯄꯊꯣꯛꯂꯕꯥ ꯊꯕꯀꯁꯤꯡ ꯇꯧꯅꯕꯥ
the little risks and the little adventures until your love of doing what,ꯑꯄꯤꯀꯄꯥ ꯔꯤꯁ꯭ꯀꯁꯤꯡ ꯑꯃꯁꯨꯡ ꯑꯄꯤꯀꯄꯥ ꯑꯦꯗꯚꯦꯟꯆꯔꯁꯤꯡ ꯑꯗꯨ ꯅꯍꯥꯛꯅꯥ ꯇꯧꯕꯥ ꯅꯨꯡꯁꯤꯕꯥ ꯑꯗꯨ ꯐꯥꯑꯣꯕꯥ
you want and your experience at taking risks makes you confident,ꯑꯗꯣꯝꯅꯥ ꯄꯥꯝꯂꯤꯕꯥ ꯑꯃꯁꯨꯡ ꯔꯤꯁ꯭ꯛ ꯂꯧꯕꯒꯤ ꯑꯦꯛꯁꯄꯔꯤꯌꯦꯟꯁꯅꯥ ꯑꯗꯣꯃꯗꯥ ꯊꯥꯖꯕꯥ ꯊꯝꯂꯤ
enough to feel that living your biggest dream is only one more little,ꯑꯗꯣꯃꯒꯤ ꯈ꯭ꯕꯥꯏꯗꯒꯤ ꯆꯥꯎꯕꯥ ꯃꯪꯂꯥꯟ ꯑꯗꯨ ꯍꯤꯡꯂꯤ ꯍꯥꯌꯕꯥ ꯐꯥꯑꯣꯕꯥ ꯃꯇꯤꯛ ꯆꯥꯔꯦ
risky step,ꯔꯤꯁ꯭ꯛ ꯂꯩꯕꯥ ꯈꯣꯡꯊꯥꯡ
Some people have made big intellectual strides without ever leaving,ꯃꯤꯑꯣꯏ ꯈꯔꯅꯥ ꯀꯩꯗꯧꯅꯨꯡꯗꯥ ꯆꯠꯍꯟꯗꯅꯥ ꯑꯆꯧꯕꯥ ꯋꯥꯈꯂꯒꯤ ꯈꯣꯡꯊꯥꯡꯁꯤꯡ ꯂꯧꯈꯠꯈ꯭ꯔꯦ .
their Sure Thing jobs,ꯃꯈꯣꯌꯒꯤ ꯁꯣꯌꯗꯕꯥ ꯊꯕꯀꯁꯤꯡ .
Wallace Stevens was one of the greatest American poets of the,ꯋꯥꯂꯦꯁ ꯁ꯭ꯇꯦꯚꯦꯟꯁ ꯑꯁꯤ ꯈ꯭ꯕꯥꯏꯗꯒꯤ ꯆꯥꯎꯕꯥ ꯑꯃꯦꯔꯤꯀꯥꯒꯤ ꯀꯕꯤꯁꯤꯡꯒꯤ ꯃꯅꯨꯡꯗꯥ ꯑꯃꯅꯤ꯫
twentieth century He played it safe too by holding down a very safe job,ꯆꯍꯤ ꯇꯔꯥꯒꯤ ꯈꯨꯖꯤꯡ ꯑꯃꯥ ꯃꯍꯥꯛꯅꯥ ꯌꯥꯝꯅꯥ ꯁꯥꯐꯕꯥ ꯊꯕꯛ ꯑꯃꯥ ꯊꯃꯗꯨꯅꯥ ꯃꯁꯤꯁꯨ ꯁꯥꯐꯅꯥ ꯁꯥꯟꯅꯈꯤ
in an insurance companyand writing great poetry on his own time,ꯏꯟꯁꯨꯔꯦꯟꯁ ꯀꯝꯄꯦꯅꯤ ꯑꯃꯗꯥ ꯑꯃꯁꯨꯡ ꯃꯁꯥꯒꯤ ꯃꯇꯃꯗꯥ ꯑꯆꯧꯕꯥ ꯁꯩꯔꯦꯡ ꯏꯕꯥ
And my hero Albert Einstein was a patent clerk and liked it just fine,ꯑꯃꯁꯨꯡ ꯑꯩꯒꯤ ꯍꯤꯔꯣ ꯑꯦꯂꯕꯥꯔꯠ ꯑꯥꯏꯅꯁ꯭ꯇꯤꯟ ꯑꯁꯤ ꯄꯦꯇꯦꯟꯇ ꯀ꯭ꯂꯥꯔꯛ ꯑꯃꯥ ꯑꯣꯏꯔꯝꯃꯤ ꯑꯃꯁꯨꯡ ꯃꯁꯤ ꯌꯥꯝꯅꯥ ꯐꯖꯅꯥ ꯄꯥꯝꯃꯤ
There was a man named Cornelius Hirschberg who worked at a job he,"ꯀꯣꯔꯅꯦꯂꯤꯌꯁ ꯍꯤꯔꯁꯕꯔꯒ ꯀꯧꯕꯥ ꯃꯤꯑꯣꯏ ꯑꯃꯥ ꯂꯩꯔꯃꯏ, ꯃꯍꯥꯛꯅꯥ ꯊꯕꯛ ꯑꯃꯗꯥ ꯊꯕꯛ ꯇꯧꯈꯤ"
spent an hour on the subway going to work and an hour corning home,ꯊꯕꯛꯇꯥ ꯆꯠꯅꯕꯥ ꯁꯕꯋꯦ ꯑꯃꯁꯨꯡ ꯄꯨꯡ ꯑꯃꯥ ꯀꯣꯔꯅꯤꯡ ꯍꯣꯝꯗꯥ ꯄꯨꯡ ꯑꯃꯥ ꯂꯦꯄꯈꯤ
He wasnt crazy about the work or the people or even the pay although,ꯃꯍꯥꯛꯅꯥ ꯊꯕꯛ ꯅꯠꯔꯒꯥ ꯃꯤꯌꯥꯃꯒꯤ ꯃꯔꯃꯗꯥ ꯅꯠꯔꯒꯥ ꯄꯦ ꯑꯗꯨꯕꯨ ꯐꯥꯑꯣꯕꯥ ꯄꯥꯒꯜ ꯇꯧꯈꯤꯗꯦ꯫
he managed to raise a family quite adequately But Cornelius loved his,ꯃꯍꯥꯛꯅꯥ ꯏꯃꯨꯡ ꯑꯃꯥ ꯌꯥꯝꯅꯥ ꯃꯇꯤꯛ ꯆꯥꯅꯥ ꯌꯣꯀꯈꯠꯄꯥ ꯉꯃꯈꯤ ꯑꯗꯨꯕꯨ ꯀꯣꯔꯅꯦꯂꯤꯌꯁꯅꯥ ꯃꯍꯥꯛꯀꯤ .
job because it left him completely free to do what he loved most in the,ꯊꯕꯛ ꯃꯔꯃꯗꯤ ꯃꯁꯤꯅꯥ ꯃꯍꯥꯀꯄꯨ ꯃꯍꯥꯛꯅꯥ ꯈ꯭ꯕꯥꯏꯗꯒꯤ ꯅꯨꯡꯁꯤꯖꯕꯥ ꯑꯗꯨ ꯇꯧꯅꯕꯥ ꯃꯄꯨꯡ ꯐꯥꯅꯥ ꯅꯤꯡꯇꯝꯕꯥ ꯄꯤꯈꯤ ꯫
world,ꯃꯥꯂꯦꯝ
He read on the subway to and from work each day for fortyfive years,ꯃꯍꯥꯛꯅꯥ ꯆꯍꯤ ꯴꯵ꯒꯤ ꯑꯣꯏꯅꯥ ꯅꯨꯃꯤꯠ ꯈꯨꯗꯤꯡꯒꯤ ꯊꯕꯛꯇꯥ ꯆꯠꯄꯥ ꯑꯃꯁꯨꯡ ꯆꯠꯄꯥ ꯁꯕꯋꯦꯗꯥ ꯄꯥꯈꯤ
and he became a learned man In his book The Priceless Gift Simon,ꯑꯃꯁꯨꯡ ꯃꯍꯥꯛꯅꯥ ꯃꯍꯥꯛꯀꯤ ꯂꯥꯏꯔꯤꯛ The Priceles Gift Simon ꯗꯥ ꯂꯧꯁꯤꯡ ꯂꯩꯕꯥ ꯃꯤꯑꯣꯏ ꯑꯃꯥ ꯑꯣꯏꯔꯀꯈꯤ꯫
Schuster NY 1960 he wrote of his life I do my duty earning bread,Schuster NY 1960 ꯃꯍꯥꯛꯅꯥ ꯃꯍꯥꯛꯀꯤ ꯄꯨꯟꯁꯤꯒꯤ ꯃꯔꯃꯗꯥ ꯏꯈꯤ ꯑꯩꯅꯥ ꯑꯩꯒꯤ ꯗ꯭ꯌꯨꯇꯤ ꯑꯦꯔꯟ ꯕ꯭ꯔꯦꯗ
Reading and thinking are my own So now I show you how you can,ꯄꯥꯕꯥ ꯑꯃꯁꯨꯡ ꯋꯥꯈꯜ ꯈꯅꯕꯥ ꯑꯁꯤ ꯑꯩꯒꯤꯅꯤ ꯃꯔꯝ ꯑꯗꯨꯅꯥ ꯍꯧꯖꯤꯛ ꯑꯩꯅꯥ ꯅꯈꯣꯌꯗꯥ ꯅꯍꯥꯛꯅꯥ ꯀꯔꯝꯅꯥ ꯇꯧꯕꯥ ꯉꯃꯒꯅꯤ ꯍꯥꯌꯕꯗꯨ ꯎꯠꯂꯤ
delight yourself as I have delighted myself all my life long in a noble,ꯑꯩꯍꯥꯛꯅꯥ ꯏꯁꯥꯕꯨ ꯅꯣꯕꯦꯜ ꯑꯃꯗꯥ ꯃꯇꯝ ꯁꯥꯡꯅꯥ ꯑꯩꯍꯥꯛꯀꯤ ꯄꯨꯟꯁꯤ ꯆꯨꯞꯄꯥ ꯅꯨꯡꯉꯥꯏꯕꯥ ꯐꯥꯑꯣꯖꯔꯀꯄꯥ ꯃꯇꯃꯗꯥ ꯑꯗꯣꯝ ꯏꯁꯥꯃꯀꯄꯨ ꯅꯨꯡꯉꯥꯏꯍꯅꯕꯤꯌꯨ
world of song color form ideas and truth To think a thing outwhat a,ꯋꯥꯔꯜꯗ ꯑꯣꯐ ꯁꯣꯡ ​​ꯀꯂꯔ ꯐꯣꯔꯝ ꯑꯥꯏꯗꯤꯌꯥ ꯑꯃꯁꯨꯡ ꯇ꯭ꯔꯨꯊ ꯇꯨ ꯈꯟꯊꯕꯥ ꯋꯥꯐꯝ ꯑꯃꯥ ꯑꯥꯎꯠꯋꯥꯠ ꯑꯃꯥ꯫
joy! To see a new truth or a new beautyyou can have this so far as I,ꯅꯨꯡꯉꯥꯏꯕ!
have had it,ꯍꯥꯚ ꯏꯠ .
Y,ꯋꯥꯏ .
FIVE,ꯃꯉꯥ
Fear of Success Leaving the Ones You Love Behind,ꯅꯍꯥꯛꯅꯥ ꯅꯨꯡꯁꯤꯖꯕꯥ ꯃꯤꯑꯣꯏꯁꯤꯡ ꯑꯗꯨ ꯊꯥꯗꯣꯛꯇꯨꯅꯥ ꯃꯥꯌꯄꯥꯀꯄꯒꯤ ꯑꯀꯤꯕꯥ ꯂꯩ
OUVE got a problem a lot of people wish they had you fear,ouve got a problem ꯃꯤꯑꯣꯏ ꯀꯌꯥ ꯑꯃꯅꯥ ꯃꯈꯣꯌꯅꯥ ꯅꯍꯥꯀꯄꯨ ꯑꯀꯤꯕꯥ ꯐꯥꯑꯣꯍꯅꯈꯤ ꯍꯥꯌꯅꯥ ꯋꯥꯁꯀꯈꯤ
success Most people dont have to fear success because they,ꯃꯥꯌ ꯄꯥꯀꯄꯥ ꯑꯌꯥꯝꯕꯥ ꯃꯤꯑꯣꯏꯁꯤꯡꯅꯥ ꯃꯥꯌ ꯄꯥꯀꯄꯥ ꯑꯁꯤ ꯀꯤꯕꯥ ꯃꯊꯧ ꯇꯥꯗꯦ ꯃꯔꯃꯗꯤ ꯃꯈꯣꯌꯅꯥ .
dont think theyre in any real danger of getting it To them it,ꯃꯈꯣꯌꯗꯥ ꯌꯧꯍꯅꯕꯒꯤ ꯑꯁꯦꯡꯕꯥ ꯈꯨꯗꯣꯡꯊꯤꯕꯥ ꯑꯃꯠꯇꯥ ꯂꯩꯇꯦ ꯍꯥꯌꯅꯥ ꯈꯜꯂꯣꯏꯗꯕꯅꯤ
looks like you have a luxurious fear like the fear of enormous wealth,ꯑꯆꯧꯕꯥ ꯂꯟ-ꯊꯨꯃꯒꯤ ꯑꯀꯤꯕꯥ ꯑꯁꯤꯒꯨꯝꯕꯥ ꯂꯛꯀꯔꯕꯥ ꯑꯀꯤꯕꯥ ꯑꯃꯥ ꯂꯩꯕꯒꯨꯝ ꯎꯕꯥ ꯐꯪꯏ .
They dont appreciate how painful it is for you to keep dropping the,ꯃꯈꯣꯌꯅꯥ ꯊꯥꯒꯠꯄꯥ ꯐꯣꯡꯗꯣꯀꯆꯔꯤ ꯃꯗꯨꯗꯤ ꯑꯗꯣꯝꯅꯥ ꯂꯦꯞꯄꯥ ꯂꯩꯇꯅꯥ ꯊꯥꯗꯣꯀꯄꯥ ꯑꯁꯤ ꯀꯌꯥꯗꯥ ꯑꯋꯥꯕꯥ ꯑꯣꯏꯕꯒꯦ ꯍꯥꯌꯕꯗꯨ꯫
ball just when you were about to carry it across the line They dont,ꯕꯜꯕ ꯈꯛꯇꯗꯥ ꯅꯍꯥꯛꯅꯥ ꯃꯗꯨ ꯂꯥꯏꯟ ꯑꯗꯨꯒꯤ ꯃꯄꯥꯟꯗꯥ ꯄꯨꯕꯥ ꯍꯧꯔꯀꯄꯥ ꯃꯇꯃꯗꯥ ꯃꯈꯣꯌꯅꯥ ꯇꯧꯗꯦ .
understand why someone with your abilities keeps messing up terrific,ꯀꯔꯤꯒꯤꯗꯃꯛꯇꯥ ꯅꯍꯥꯛꯀꯤ ꯇꯧꯕꯥ ꯉꯝꯕꯁꯤꯡ ꯂꯩꯕꯥ ꯀꯅꯥꯒꯨꯝꯕꯥ ꯑꯃꯅꯥ ꯑꯉꯀꯄꯥ ꯃꯑꯣꯡꯗꯥ ꯃꯤꯄꯥꯏꯕꯥ ꯄꯣꯀꯍꯜꯂꯤꯕꯅꯣ ꯍꯥꯌꯕꯗꯨ ꯈꯉꯕꯤꯌꯨ
opportunities Its a mystery to you too,ꯈꯨꯗꯣꯡꯆꯥꯕꯁꯤꯡ ꯑꯁꯤ ꯑꯗꯣꯃꯒꯤꯗꯃꯛꯇꯁꯨ ꯃꯁꯤꯒꯤ ꯃꯤꯁ꯭ꯠꯔꯤ ꯑꯃꯅꯤ .
You know youre gifted because you get noticed Youve been offered,ꯑꯗꯣꯝꯅꯥ ꯈꯉꯕꯤꯔꯤꯕꯥ ꯑꯗꯨꯅꯤ youre gifted ꯃꯔꯃꯗꯤ ꯑꯗꯣꯝꯅꯥ ꯈꯉꯕꯤꯔꯀꯏ youve been offered
a lot of chances and the people whove offered them werent wrong,ꯆꯥꯟꯁ ꯀꯌꯥ ꯑꯃꯥ ꯑꯃꯁꯨꯡ ꯃꯈꯣꯌꯗꯥ ꯄꯤꯔꯤꯕꯥ ꯃꯤꯑꯣꯏꯁꯤꯡꯅꯥ ꯑꯔꯥꯅꯕꯥ ꯇꯧꯈꯤꯗꯦ .
They saw what you were capable of,ꯃꯈꯣꯌꯅꯥ ꯑꯗꯣꯝꯅꯥ ꯇꯧꯕꯥ ꯉꯝꯕꯥ ꯑꯗꯨ ꯎꯈꯤ ꯫
Yet whenever you get near what you want something happensyou,ꯑꯗꯨꯕꯨ ꯅꯍꯥꯛꯅꯥ ꯄꯥꯝꯂꯤꯕꯥ ꯑꯗꯨ ꯅꯍꯥꯛꯅꯥ ꯃꯅꯥꯛꯇꯥ ꯂꯥꯀꯄꯥ ꯃꯇꯃꯗꯥ ꯀꯔꯤꯒꯨꯝꯕꯥ ꯈꯔꯥ ꯊꯣꯛꯂꯛꯀꯅꯤ
lose focus at a crucial moment and turn your energy to something,ꯃꯔꯨꯑꯣꯏꯕꯥ ꯃꯇꯝ ꯑꯃꯗꯥ ꯃꯤꯠꯌꯦꯡ ꯆꯪꯗꯕꯥ ꯑꯃꯁꯨꯡ ꯅꯍꯥꯛꯀꯤ ꯏꯅꯔꯖꯤ ꯑꯗꯨ ꯀꯔꯤꯒꯨꯝꯕꯥ ꯑꯃꯗꯥ ꯑꯣꯟꯊꯣꯀꯄꯥ
unimportant or your mood mysteriously drops and you get tired just,ꯑꯅꯏꯝꯄꯣꯔꯇꯦꯟꯇ ꯅꯠꯔꯒꯥ ꯅꯍꯥꯛꯀꯤ ꯃꯨꯗ ꯃꯤꯁ꯭ꯠꯔꯤꯌꯜ ꯑꯣꯏꯅꯥ ꯗ꯭ꯔꯣꯞ ꯇꯧꯏ ꯑꯃꯁꯨꯡ ꯅꯍꯥꯛꯅꯥ ꯇꯞꯅꯥ ꯇꯞꯅꯥ ꯂꯥꯀꯏ
when you need energy the most,ꯑꯗꯣꯝꯅꯥ ꯏꯅꯔꯖꯤ ꯃꯊꯧ ꯇꯥꯔꯀꯄꯥ ꯃꯇꯃꯗꯥ ꯈ꯭ꯕꯥꯏꯗꯒꯤ ꯌꯥꯝꯅꯥ .
Sometimes instead of sabotaging yourself directly you simply lose,ꯀꯔꯤꯒꯨꯝꯕꯥ ꯃꯇꯃꯗꯥ ꯃꯁꯥꯃꯀꯄꯨ ꯍꯀꯊꯦꯡꯅꯅꯥ ꯁꯦꯕꯣꯠ ꯇꯧꯕꯒꯤ ꯃꯍꯨꯠꯇꯥ ꯅꯍꯥꯛꯅꯥ ꯁꯨꯞꯅꯇꯒꯤ ꯃꯥꯡꯖꯔꯤꯕꯅꯤ
sight of what youre doing This job is leading nowhere I might as well,ꯊꯕꯛ ꯑꯁꯤ ꯇꯧꯔꯤꯕꯥ ꯅꯍꯥꯛꯅꯥ ꯀꯔꯤ ꯇꯧꯔꯤꯕꯒꯦ ꯍꯥꯌꯕꯗꯨ ꯎꯕꯥ ꯐꯪꯕꯁꯤ ꯃꯐꯝ ꯑꯃꯠꯇꯗꯥ ꯆꯠꯂꯤꯕꯅꯤ ꯑꯩꯁꯨ .
quit Lisa Q said oddly discouraged after enjoying three months at a,ꯊꯥ ꯑꯍꯨꯃꯒꯤ ꯅꯨꯡꯉꯥꯏꯕꯥ ꯂꯧꯔꯕꯥ ꯃꯇꯨꯡꯗꯥ ꯂꯤꯁꯥ ꯀ꯭ꯌꯨꯅꯥ ꯍꯥꯌꯈꯤꯕꯗꯥ ꯑꯆꯝꯕꯥ ꯃꯑꯣꯡꯗꯥ ꯋꯥꯈꯜ ꯋꯥꯕꯥ ꯊꯣꯀꯈꯤ꯫
fabulous job that would have led Straight to her dream career She,ꯐꯦꯕ꯭ꯌꯨꯜ ꯑꯣꯏꯕꯥ ꯊꯕꯛ ꯑꯗꯨꯅꯥ ꯃꯍꯥꯛꯀꯤ ꯃꯪꯂꯥꯅꯒꯤ ꯀꯦꯔꯤꯌꯔꯗꯥ ꯍꯀꯊꯦꯡꯅꯅꯥ ꯂꯃꯖꯤꯡꯕꯤꯔꯝꯂꯒꯅꯤ ꯃꯍꯥꯛꯅꯥ .
started taking long weekends and began to miss important meetings At,ꯂꯣꯡ ꯋꯤꯀꯦꯟꯗ ꯂꯧꯕꯥ ꯍꯧꯈꯤ ꯑꯃꯁꯨꯡ ꯃꯔꯨꯑꯣꯏꯕꯥ ꯃꯤꯐꯃꯁꯤꯡꯗꯥ .
first Lisa had plenty of excuses but one day she realized she really had,ꯑꯍꯥꯅꯕꯥ ꯂꯤꯁꯥꯅꯥ ꯑꯦꯛꯁꯛꯌꯨꯖ ꯌꯥꯝꯅꯥ ꯂꯩꯔꯝꯃꯤ ꯑꯗꯨꯕꯨ ꯅꯨꯃꯤꯠ ꯑꯃꯗꯥ ꯃꯍꯥꯛꯅꯥ ꯇꯁꯦꯡꯅꯥ ꯈꯉꯂꯀꯈꯤ ꯃꯗꯨꯗꯤ ꯃꯍꯥꯛꯅꯥ ꯇꯁꯦꯡꯅꯥ .
no idea why she was acting so strangely,ꯀꯔꯤꯒꯤꯗꯃꯛꯇꯥ ꯃꯍꯥꯛꯅꯥ ꯑꯉꯀꯄꯥ ꯃꯑꯣꯡꯗꯥ ꯑꯦꯛꯇꯤꯕ ꯑꯣꯏꯔꯤꯕꯅꯣ ꯍꯥꯌꯕꯒꯤ ꯋꯥꯈꯜꯂꯣꯟ ꯑꯃꯠꯇꯥ ꯂꯩꯇꯦ
Something was behind Lisas incomprehensible behavior Somethings,ꯀꯔꯤꯒꯨꯝꯕꯥ ꯈꯔꯥ ꯂꯤꯁꯥꯁ ꯏꯅꯀꯃꯞꯔꯦꯍꯦꯟꯁꯤꯕꯜ ꯕꯤꯍꯦꯕꯤꯌꯔꯒꯤ ꯃꯇꯨꯡꯗꯥ ꯀꯔꯤꯒꯨꯝꯕꯥ ꯈꯔꯥ
behind yours And youve got to find out what that something is,ꯅꯍꯥꯛꯀꯤ ꯃꯇꯨꯡꯗꯥ ꯑꯃꯁꯨꯡ ꯅꯍꯥꯛꯅꯥ ꯃꯗꯨ ꯀꯔꯤꯅꯣ ꯍꯥꯌꯕꯗꯨ ꯈꯉꯕꯥ ꯉꯃꯒꯅꯤ ꯃꯗꯨꯗꯤ ꯀꯔꯤꯒꯨꯝꯕꯥ ꯑꯃꯠꯇꯥ .
because what you dont know is hurting you,ꯃꯔꯃꯗꯤ ꯑꯗꯣꯝꯅꯥ ꯈꯉꯕꯤꯔꯤꯕꯥ ꯑꯗꯨꯅꯥ ꯑꯗꯣꯃꯗꯥ ꯑꯋꯥꯕꯥ ꯄꯤꯔꯤ
Take a careful look at your life and youll probably see a history of,ꯑꯗꯣꯃꯒꯤ ꯄꯨꯟꯁꯤꯕꯨ ꯆꯦꯀꯁꯤꯟꯅꯥ ꯌꯦꯡꯕꯤꯌꯨ ꯑꯃꯁꯨꯡ ꯑꯗꯣꯝꯅꯥ ꯌꯥꯝꯅꯥ ꯊꯨꯅꯥ ꯄꯨꯋꯥꯔꯤ ꯑꯃꯥ ꯎꯕꯥ ꯐꯪꯂꯃꯒꯅꯤ꯫
missed opportunities that stretches all the way back to your childhood,ꯑꯗꯣꯃꯒꯤ ꯑꯉꯥꯡ ꯑꯣꯏꯔꯤꯉꯩꯒꯤ ꯃꯇꯃꯗꯥ ꯂꯝꯕꯤ ꯄꯨꯝꯅꯃꯛ ꯂꯥꯟꯊꯣꯛꯂꯤꯕꯥ ꯃꯤꯁ ꯑꯣꯄꯔꯆꯨꯅꯤꯇꯤꯁꯤꯡ
Your past wont determine your future if you can find out why you,ꯑꯗꯣꯃꯒꯤ ꯍꯧꯈꯤꯕꯥ ꯃꯇꯝ ꯑꯗꯨꯅꯥ ꯑꯗꯣꯃꯒꯤ ꯇꯨꯡꯒꯤ ꯐꯤꯕꯝ ꯂꯦꯄꯊꯣꯛꯂꯣꯏ ꯀꯔꯤꯒꯨꯝꯕꯥ ꯑꯗꯣꯝꯅꯥ ꯀꯔꯤꯒꯤꯗꯃꯛꯇꯥ ꯈꯉꯂꯃꯒꯅꯤ ꯍꯥꯌꯕꯗꯨ ꯈꯉꯕꯥ ꯉꯝꯂꯕꯗꯤ
have such an odd relationship with success And thats what Id like you,ꯃꯥꯌ ꯄꯥꯀꯄꯒꯥ ꯂꯣꯌꯅꯅꯥ ꯑꯁꯤꯒꯨꯝꯕꯥ ꯑꯆꯝꯕꯥ ꯃꯔꯤ ꯑꯃꯥ ꯂꯩ ꯑꯃꯁꯨꯡ thats what id like you
to begin doing right now,ꯍꯧꯖꯤꯛ ꯇꯧꯕꯥ ꯍꯧꯅꯕꯒꯤꯗꯃꯛ .
Exercise 1 Backing Away from Success,ꯑꯦꯛꯁꯔꯁꯥꯏꯖ ꯱ ꯃꯥꯌ ꯄꯥꯀꯄꯗꯒꯤ ꯕꯦꯛ ꯇꯧꯕꯥ
At the top left margin of a piece of paper write the earliest age you,ꯄꯦꯄꯔ ꯑꯃꯒꯤ ꯃꯊꯛꯀꯤ ꯂꯦꯃꯍꯧꯔꯤꯕꯥ ꯃꯥꯔꯖꯤꯟ ꯑꯗꯨꯗꯥ ꯈ꯭ꯕꯥꯏꯗꯒꯤ ꯑꯍꯥꯅꯕꯥ ꯆꯍꯤ ꯑꯗꯨ ꯏꯌꯨ
think might be relevant to your fearofsuccess chronology If youre not,ꯀꯔꯤꯒꯨꯝꯕꯥ ꯅꯍꯥꯛꯅꯥ ꯅꯠꯇꯕꯥ ꯑꯣꯏꯔꯕꯗꯤ ꯅꯍꯥꯛꯀꯤ FearOfSuccess ꯀ꯭ꯔꯣꯅꯣꯂꯣꯖꯤꯒꯥ ꯃꯔꯤ ꯂꯩꯅꯕꯥ ꯑꯣꯏꯕꯥ ꯌꯥꯏ ꯍꯥꯌꯅꯥ ꯈꯜꯂꯨ꯫
sure write 5 Years Old Continue down the page putting a number for,ꯁꯣꯌꯗꯅꯥ ꯏꯒꯅꯤ ꯆꯍꯤ ꯵ ꯁꯨꯔꯕꯤ ꯃꯈꯥ ꯆꯠꯊꯔꯀꯎ ꯄꯦꯖ ꯑꯁꯤ ꯃꯈꯥ ꯆꯠꯊꯕꯤꯌꯨ ꯅꯝꯕꯔ ꯑꯃꯥ ꯊꯃꯗꯨꯅꯥ
every five years up to the present Alongside each age write down,ꯆꯍꯤ ꯃꯉꯥ ꯈꯨꯗꯤꯡꯒꯤ ꯍꯧꯖꯤꯛ ꯐꯥꯑꯣꯕꯒꯤ ꯑꯣꯏꯅꯥ ꯆꯍꯤ ꯈꯨꯗꯤꯡꯒꯤ ꯋꯥꯔꯤ ꯁꯥꯅꯕꯥ
anything you remember doing to avoid getting something you really,ꯑꯗꯣꯝꯅꯥ ꯇꯁꯦꯡꯅꯥ ꯀꯔꯤꯒꯨꯝꯕꯥ ꯑꯃꯥ ꯐꯪꯗꯅꯕꯥ ꯇꯧꯈꯤꯕꯥ ꯑꯗꯨ ꯑꯗꯣꯝꯅꯥ ꯅꯤꯡꯁꯤꯡꯕꯤꯔꯃꯒꯅꯤ
any highlights of that year as they occur to you You may be in for some,ꯆꯍꯤ ꯑꯗꯨꯒꯤ ꯍꯥꯏꯂꯥꯏꯠ ꯑꯃꯠꯇꯥ ꯃꯈꯣꯌꯅꯥ ꯑꯗꯣꯃꯒꯤ ꯃꯐꯃꯗꯥ ꯂꯥꯀꯄꯥ ꯃꯇꯃꯗꯥ ꯑꯗꯣꯝꯅꯥ ꯈꯟꯗꯨꯅꯥ ꯂꯩꯕꯥ ꯌꯥꯏ꯫
surprises,ꯑꯉꯀꯄꯁꯤꯡ
Heres what Beverly thirtyone an office manager in a real estate,ꯍꯦꯔꯦꯁ ꯋꯥꯠ ꯕꯦꯚꯥꯔꯂꯤ ꯊ꯭ꯌꯥꯔꯇꯤꯑꯣꯟ ꯔꯤꯌꯦꯜ ꯏꯁ꯭ꯇꯦꯠ ꯑꯃꯗꯥ ꯑꯣꯐꯤꯁ ꯃꯦꯅꯦꯖꯔ ꯑꯃꯥ ꯑꯣꯏꯅꯥ .
firm remembered,ꯐꯔꯝ ꯔꯤꯃꯦꯝꯕꯔ ꯇꯧꯈꯤ ꯫
5 years old I did whatever I wanted I learned to read! No problems,ꯆꯍꯤ ꯵ ꯁꯨꯔꯕꯤ ꯑꯩꯅꯥ ꯄꯥꯃꯖꯕꯥ ꯈꯨꯗꯤꯡꯃꯛ ꯑꯩꯅꯥ ꯄꯥꯕꯥ ꯇꯃꯈꯤ!
10 My brother got to be very mean to me He stopped being my,꯱꯰ ꯑꯩꯒꯤ ꯃꯔꯨꯞ ꯑꯁꯤ ꯑꯩꯉꯣꯟꯗꯥ ꯌꯥꯝꯅꯥ ꯃꯤꯅꯨꯡꯁꯤ ꯂꯩꯕꯥ ꯐꯪꯈꯤ ꯃꯍꯥꯛꯅꯥ ꯑꯩꯒꯤ ꯑꯣꯏꯕꯥ ꯂꯦꯄꯈꯤ꯫
friend I played private games in my room I tried to keep out of the,ꯃꯔꯨꯞ ꯑꯩꯅꯥ ꯑꯩꯒꯤ ꯔꯨꯃꯗꯥ ꯄ꯭ꯔꯥꯏꯚꯦꯠ ꯒꯦꯃꯁꯤꯡ ꯁꯥꯟꯅꯈꯤ ꯑꯩꯅꯥ ꯍꯣꯠꯅꯈꯤꯕꯥ ꯑꯗꯨ .
spotlight,ꯁ꯭ꯄꯣꯇꯂꯥꯏꯠ ꯴.
At school I talked too much to my friends in class and got in trouble,ꯁ꯭ꯀꯨꯂꯗꯥ ꯑꯩꯍꯥꯛꯅꯥ ꯀ꯭ꯂꯥꯁꯇꯥ ꯑꯩꯍꯥꯛꯀꯤ ꯃꯔꯨꯄꯁꯤꯡꯒꯥ ꯌꯥꯝꯅꯥ ꯋꯥꯔꯤ ꯁꯥꯅꯈꯤ ꯑꯃꯁꯨꯡ ꯑꯋꯥꯕꯥ ꯇꯥꯔꯀꯈꯤ
with my teacher I tried to be quiet in class but I kept forgetting I,ꯑꯩꯒꯤ ꯑꯣꯖꯥꯒꯥ ꯂꯣꯌꯅꯅꯥ ꯑꯩꯅꯥ ꯀ꯭ꯂꯥꯁꯇꯥ ꯅꯤꯡꯊꯤꯖꯅꯥ ꯂꯩꯅꯕꯥ ꯍꯣꯠꯅꯈꯤ ꯑꯗꯨꯕꯨ ꯑꯩꯅꯥ ꯂꯦꯞꯄꯥ ꯂꯩꯇꯅꯥ ꯑꯩ .
started feeling that people who didnt smile at me didnt like me I tried,ꯑꯩꯉꯣꯟꯗꯥ ꯃꯤꯠꯌꯦꯡ ꯊꯃꯈꯤꯗꯕꯥ ꯃꯤꯑꯣꯏꯁꯤꯡꯅꯥ ꯑꯩꯕꯨ ꯌꯥꯝꯅꯥ ꯄꯥꯝꯅꯈꯤ ꯍꯥꯌꯅꯥ ꯐꯥꯑꯣꯕꯥ ꯍꯧꯔꯀꯈꯤ .
to be funny so everyone would laugh,ꯃꯤꯄꯨꯝ ꯈꯨꯗꯤꯡꯃꯛ ꯅꯣꯛꯅꯒꯅꯤ ꯍꯥꯌꯅꯥ ꯅꯨꯡꯉꯥꯏꯕꯥ ꯋꯥꯐꯝ ꯑꯃꯥ
15 I was crazy about boys They didnt want to date brainy girls so I,꯱꯵ ꯑꯩꯅꯥ ꯅꯨꯄꯥꯃꯆꯥꯁꯤꯡꯒꯤ ꯃꯔꯃꯗꯥ ꯄꯥꯒꯜ ꯑꯣꯏꯈꯤ ꯃꯈꯣꯌꯅꯥ ꯕ꯭ꯔꯦꯟ ꯅꯨꯄꯤꯃꯆꯥꯁꯤꯡꯒꯥ ꯂꯣꯌꯅꯅꯥ ꯋꯥꯔꯤ ꯁꯥꯅꯕꯥ ꯄꯥꯃꯈꯤ ꯃꯔꯝ ꯑꯗꯨꯅꯥ ꯑꯩ
tried acting stupid around them but I always got interested in what they,ꯃꯈꯣꯌꯒꯤ ꯑꯀꯣꯌꯕꯗꯥ ꯁ꯭ꯇꯨꯄꯤꯗ ꯑꯦꯛꯇꯤꯡ ꯇꯧꯅꯕꯥ ꯍꯣꯠꯅꯈꯤ ꯑꯗꯨꯕꯨ ꯑꯩꯍꯥꯛꯅꯥ ꯃꯇꯝ ꯄꯨꯝꯅꯃꯛꯇꯥ ꯃꯈꯣꯌꯅꯥ ꯀꯔꯤꯗꯥ ꯄꯨꯛꯅꯤꯡ ꯆꯪꯈꯤꯕꯒꯦ
were talking about and forgot to keep my mouth shut I felt I lacked,ꯋꯥꯔꯤ ꯁꯥꯈꯤ ꯑꯃꯁꯨꯡ ꯑꯩꯒꯤ ꯃꯤꯠ ꯊꯃꯖꯤꯅꯕꯥ ꯀꯥꯑꯣꯈꯤ ꯑꯩꯅꯥ ꯂꯩꯈꯤ ꯍꯥꯌꯅꯥ ꯐꯥꯑꯣꯈꯤ .
whatever it was that made boys love you,ꯅꯨꯄꯥꯃꯆꯥꯁꯤꯡꯅꯥ ꯅꯉꯕꯨ ꯅꯨꯡꯁꯤꯍꯅꯈꯤꯕꯥ ꯑꯗꯨ ꯀꯔꯤꯒꯨꯝꯕꯥ ꯑꯃꯥ ꯑꯣꯏꯔꯕꯁꯨ .
20 I went to college and finally became popular but I wasnt happy,꯲꯰ ꯑꯩꯍꯥꯛ ꯀꯣꯂꯦꯖꯇꯥ ꯇꯃꯈꯤ ꯑꯃꯁꯨꯡ ꯑꯔꯣꯏꯕꯗꯥ ꯃꯤꯌꯥꯝꯅꯥ ꯄꯥꯝꯅꯕꯥ ꯑꯣꯏꯈꯤ ꯑꯗꯨꯕꯨ ꯑꯩꯍꯥꯛ ꯅꯨꯡꯉꯥꯏꯕꯥ ꯐꯥꯑꯣꯈꯤꯗꯦ
about it The boys didnt seem to really like me they were just,ꯃꯁꯤꯒꯤ ꯃꯇꯥꯡꯗꯥ ꯅꯨꯄꯥꯃꯆꯥꯁꯤꯡꯅꯥ ꯑꯩꯕꯨ ꯇꯁꯦꯡꯅꯥ ꯅꯨꯡꯁꯤꯖꯕꯥ ꯎꯕꯥ ꯐꯪꯈꯤꯗꯦ ꯃꯈꯣꯌꯅꯥ ꯁꯨꯞꯅꯇꯒꯤ .
pressuring me for sex I guess I wanted somebody to really fall in love,ꯑꯩꯕꯨ ꯁꯦꯛꯁꯀꯤꯗꯃꯛ ꯄ꯭ꯔꯦꯁꯔ ꯄꯤꯕꯥ ꯑꯩꯅꯥ ꯈꯜꯂꯤ ꯑꯩꯅꯥ ꯀꯅꯥꯒꯨꯝꯕꯥ ꯑꯃꯅꯥ ꯇꯁꯦꯡꯅꯥ ꯅꯨꯡꯁꯤꯕꯗꯥ ꯁꯣꯀꯄꯥ ꯄꯥꯃꯈꯤ꯫
with me,ꯑꯩꯒꯥ ꯂꯣꯌꯅꯅꯥ .
For the first time I did badly in school and found myself losing interest,ꯑꯍꯥꯅꯕꯥ ꯑꯣꯏꯅꯥ ꯑꯩꯍꯥꯛꯅꯥ ꯁ꯭ꯀꯨꯂꯗꯥ ꯐꯠꯇꯕꯥ ꯊꯕꯛ ꯇꯧꯈꯤ ꯑꯃꯁꯨꯡ ꯃꯁꯥꯅꯥ ꯌꯥꯅꯥ ꯏꯟꯇꯔꯦꯁ꯭ꯠ ꯃꯥꯡꯈꯤꯕꯥ ꯎꯈꯤ꯫
in classwork I just couldnt see the point in studying anymore,ꯀ꯭ꯂꯥꯁꯋꯔꯀꯇꯥ ꯑꯩꯍꯥꯛꯅꯥ ꯍꯧꯖꯤꯛ ꯇꯃꯖꯕꯒꯤ ꯋꯥꯐꯝ ꯑꯗꯨ ꯎꯕꯥ ꯐꯪꯈꯤꯗꯦ
Later when I finally graduated I was kind of depressed I could have,ꯃꯇꯨꯡꯗꯥ ꯑꯩꯅꯥ ꯑꯔꯣꯏꯕꯗꯥ ꯒ꯭ꯔꯦꯖꯨꯑꯦꯠ ꯂꯣꯏꯔꯕꯥ ꯃꯇꯨꯡꯗꯥ ꯑꯩꯅꯥ ꯃꯈꯜ ꯑꯃꯒꯤ ꯋꯥꯈꯜ ꯋꯥꯕꯥ ꯊꯦꯡꯅꯈꯤ ꯑꯩꯅꯥ ꯂꯩꯕꯥ ꯉꯃꯈꯤ꯫
gone to graduate school but didnt bother I could never figure out what,ꯒ꯭ꯔꯦꯖꯨꯑꯦꯠ ꯁ꯭ꯀꯨꯂꯗꯥ ꯆꯠꯈꯤ ꯑꯗꯨꯕꯨ ꯌꯥꯑꯣꯈꯤꯗꯦ ꯑꯩꯅꯥ ꯀꯩꯗꯧꯉꯩꯗꯁꯨ ꯈꯉꯕꯥ ꯉꯃꯈꯤꯗꯦ ꯃꯗꯨꯗꯤ ꯀꯔꯤ .
I wanted to study,ꯑꯩꯍꯥꯛꯅꯥ ꯃꯍꯩ ꯇꯝꯕꯥ ꯄꯥꯃꯈꯤ ꯫
25 After a series of parttime jobs I took a job as an office manager,꯲꯵ ꯄꯥꯔꯇꯇꯥꯏꯝ ꯖꯕꯁꯀꯤ ꯁꯤꯔꯤꯖ ꯑꯃꯥ ꯂꯣꯏꯔꯕꯥ ꯃꯇꯨꯡꯗꯥ ꯑꯩꯅꯥ ꯑꯣꯐꯤꯁ ꯃꯦꯅꯦꯖꯔ ꯑꯃꯥ ꯑꯣꯏꯅꯥ ꯊꯕꯛ ꯑꯃꯥ ꯂꯧꯈꯤ
Ive been doing that ever since,ꯑꯩꯍꯥꯛꯅꯥ ꯃꯗꯨꯗꯒꯤ ꯍꯧꯅꯥ ꯃꯗꯨ ꯇꯧꯗꯨꯅꯥ ꯂꯥꯛꯂꯤ꯫
