en,mni-Mtei
Lexical semantics What is the computational meaning of individual words in context Distributional semantics How can we learn semantic representations from data Named entity recognition NER Given a stream of text determine which items in the text map to proper names such as people or places and what the type of each such name is e.g. person location organization,ꯂꯦꯛꯁꯤꯀꯦꯜ ꯁꯦꯃꯦꯟꯇꯤꯛꯁ ꯀꯟꯇꯦꯛꯁꯇꯥ ꯃꯤꯑꯣꯏ ꯑꯃꯒꯤ ꯋꯥꯍꯩꯁꯤꯡꯒꯤ ꯀꯝꯞꯌꯨꯇꯦꯁ꯭ꯅꯦꯜ ꯃꯤꯅꯤꯡ ꯑꯁꯤ ꯀꯔꯤꯅꯣ ꯍꯥꯌꯕꯗꯨ ꯗꯤꯁ꯭ꯠꯔꯤꯕ꯭ꯌꯨꯁꯅꯦꯜ ꯁꯦꯃꯦꯟꯇꯤꯀꯁꯤꯡꯗꯥ ꯑꯩꯈꯣꯌꯅꯥ ꯇꯦꯛꯁꯀꯤ ꯁ꯭ꯠꯔꯤꯝ ꯑꯃꯥ ꯄꯤꯕꯥ ꯑꯦꯟꯇꯤꯇꯤ ꯔꯤꯀꯣꯒꯅꯤꯁꯟ ꯅꯦꯔ ꯍꯥꯌꯅꯥ ꯃꯃꯤꯡ ꯊꯣꯅꯕꯥ ꯗꯦꯇꯥꯗꯒꯤ ꯁꯦꯃꯦꯟꯇꯤꯛ ꯔꯤꯞꯔꯖꯦꯟꯇꯦꯁꯅꯁꯤꯡ ꯑꯁꯤ ꯀꯔꯝꯅꯥ ꯇꯃꯒꯅꯤ ꯇꯦꯛꯁ ꯃꯦꯄꯇꯥ ꯃꯤꯑꯣꯏ ꯅꯠꯔꯒꯥ ꯃꯐꯃꯁꯤꯡꯒꯨꯝꯕꯥ ꯃꯊꯧ ꯇꯥꯕꯥ ꯃꯤꯡꯁꯤꯡ ꯑꯃꯁꯨꯡ ꯑꯁꯤꯒꯨꯝꯕꯥ ꯃꯤꯡ ꯈꯨꯗꯤꯡꯃꯛꯀꯤ ꯃꯈꯜ ꯑꯁꯤ ꯏ.ꯖꯤ.
Although capitalization can aid in recognizing named entities in languages such as English this information cannot aid in determining the type of named entity and in any case is often inaccurate or insufficient,ꯀꯦꯄꯤꯇꯦꯂꯥꯏꯖꯦꯁꯟꯅꯥ ꯏꯪꯂꯤꯁꯒꯨꯝꯕꯥ ꯂꯣꯂꯁꯤꯡꯗꯥ ꯃꯃꯤꯡ ꯂꯩꯔꯕꯥ ꯑꯦꯟꯇꯤꯇꯤꯁꯤꯡ ꯈꯉꯗꯣꯀꯄꯗꯥ ꯃꯇꯦꯡ ꯄꯥꯡꯕꯥ ꯉꯝꯂꯕꯁꯨ ꯏꯅꯐꯣꯔꯃꯦꯁꯟ ꯑꯁꯤꯅꯥ ꯃꯃꯤꯡ ꯂꯩꯔꯕꯥ ꯑꯦꯟꯇꯤꯇꯤꯒꯤ ꯃꯈꯜ ꯑꯗꯨ ꯂꯦꯄꯊꯣꯀꯄꯗꯥ ꯃꯇꯦꯡ ꯄꯥꯡꯕꯥ ꯉꯃꯗꯦ ꯑꯃꯁꯨꯡ ꯀꯔꯤꯒꯨꯝꯕꯥ ꯃꯑꯣꯡ ꯑꯃꯠꯇꯗꯥ ꯑꯆꯨꯝꯕꯥ ꯅꯠꯔꯒꯥ ꯃꯄꯨꯡ ꯐꯥꯗꯕꯥ ꯑꯣꯏꯗꯦ꯫
For example the first letter of a sentence is also capitalized and named entities often span several words only some of which are capitalized,ꯈꯨꯗꯝ ꯑꯣꯏꯅꯥ ꯋꯥꯍꯩ ꯑꯃꯒꯤ ꯑꯍꯥꯅꯕꯥ ꯑꯛꯁꯔ ꯑꯁꯤꯁꯨ ꯀꯦꯄꯤꯇꯦꯂꯥꯏꯖ ꯇꯧꯏ ꯑꯃꯁꯨꯡ ꯃꯃꯤꯡ ꯊꯣꯅꯕꯥ ꯑꯦꯟꯇꯤꯇꯤꯁꯤꯡ ꯑꯁꯤ ꯑꯌꯥꯝꯕꯅꯥ ꯋꯥꯍꯩ ꯀꯌꯥ ꯑꯃꯥ ꯌꯥꯑꯣꯏ ꯃꯗꯨꯒꯤ ꯃꯅꯨꯡꯗꯥ ꯈꯔꯈꯛꯇꯃꯛ ꯀꯦꯄꯤꯇꯦꯂꯥꯏꯖ ꯇꯧꯏ꯫
Furthermore many other languages in nonWestern scripts e.g. Chinese or Arabic do not have any capitalization at all and even languages with capitalization may not consistently use it to distinguish names,ꯃꯁꯤꯒꯤ ꯃꯊꯛꯇꯥ ꯅꯟ-ꯋꯦꯁ꯭ꯇꯔꯟ ꯁ꯭ꯛꯔꯤꯞꯇꯁꯤꯡꯗꯥ ꯑꯇꯣꯞꯄꯥ ꯂꯣꯜ ꯀꯌꯥ ꯑꯃꯥ ꯈꯨꯗꯝ ꯑꯣꯏꯅꯥ ꯌꯨ.ꯑꯦꯁ.
For example German capitalizes all nouns regardless of whether they are names and French and Spanish do not capitalize names that serve as adjectives,ꯈꯨꯗꯝ ꯑꯣꯏꯅꯥ ꯖꯔꯃꯅꯤꯅꯥ ꯅꯣꯡꯃꯒꯤ ꯑꯣꯏꯕꯥ ꯋꯥꯍꯩ ꯄꯨꯝꯅꯃꯛ ꯀꯦꯄꯤꯇꯦꯂꯥꯏꯖ ꯇꯧꯏ ꯃꯈꯣꯌ ꯃꯤꯡ ꯑꯣꯏꯔꯕꯁꯨ ꯑꯃꯁꯨꯡ ꯐ꯭ꯔꯦꯟꯆ ꯑꯃꯁꯨꯡ ꯁ꯭ꯄꯦꯅꯤꯁꯅꯥ ꯑꯦꯖꯦꯛꯇꯤꯚ ꯑꯣꯏꯅꯥ ꯊꯕꯛ ꯇꯧꯕꯥ ꯃꯤꯡꯁꯤꯡ ꯀꯦꯄꯤꯇꯦꯂꯥꯏꯖ ꯇꯧꯗꯦ
Another name for this task is token classification,ꯊꯕꯛ ꯑꯁꯤꯒꯤ ꯑꯇꯣꯞꯄꯥ ꯃꯃꯤꯡ ꯑꯃꯗꯤ ꯇꯣꯀꯦꯟ ꯀ꯭ꯂꯥꯁꯤꯐꯤꯀꯦꯁꯟ ꯑꯁꯤꯅꯤ꯫
Sentiment analysis see also Multimodal sentiment analysis Sentiment analysis is a computational method used to identify and classify the emotional intent behind text,ꯁꯦꯟꯇꯤꯃꯦꯟꯇ ꯑꯦꯅꯥꯂꯥꯏꯁꯤꯁ ꯑꯁꯤꯁꯨ ꯌꯦꯡꯕꯤꯌꯨ ꯃꯜꯇꯤꯃꯣꯗꯦꯜ ꯁꯦꯟꯇꯤꯃꯦꯟꯇ ꯑꯦꯅꯥꯂꯥꯏꯁꯤꯁ ꯁꯦꯟꯇꯤꯃꯦꯟꯇ ꯑꯦꯅꯥꯂꯥꯏꯁꯤꯁ ꯑꯁꯤ ꯇꯦꯛꯁꯀꯤ ꯃꯇꯨꯡꯗꯥ ꯂꯩꯔꯤꯕꯥ ꯏꯃꯣꯁꯅꯦꯜ ꯏꯟꯇꯦꯟꯇ ꯑꯗꯨ ꯈꯉꯗꯣꯛꯅꯕꯥ ꯑꯃꯁꯨꯡ ꯀ꯭ꯂꯥꯁꯤꯐꯥꯏ ꯇꯧꯅꯕꯥ ꯁꯤꯖꯤꯟꯅꯕꯥ ꯀꯝꯞꯌꯨꯇꯦꯁ꯭ꯅꯦꯜ ꯃꯦꯊꯗ ꯑꯃꯅꯤ꯫
This technique involves analyzing text to determine whether the expressed sentiment is positive negative or neutral,ꯇꯦꯛꯅꯤꯛ ꯑꯁꯤꯅꯥ ꯐꯣꯡꯗꯣꯛꯂꯤꯕꯥ ꯁꯦꯟꯇꯤꯃꯦꯟꯇ ꯑꯁꯤ ꯄꯣꯖꯤꯇꯤꯕ ꯑꯣꯏꯕꯥ ꯅꯦꯒꯦꯇꯤꯕ ꯅꯠꯔꯒꯥ ꯅ꯭ꯌꯨꯠꯔꯤꯜ ꯑꯣꯏꯕꯔꯥ ꯍꯥꯌꯕꯗꯨ ꯈꯉꯗꯣꯛꯅꯕꯥ ꯇꯦꯛꯁ ꯑꯦꯅꯥꯂꯥꯏꯖ ꯇꯧꯕꯥ ꯌꯥꯑꯣꯔꯤ꯫
Models for sentiment classification typically utilize inputs such as word ngrams Term FrequencyInverse Document Frequency TFIDF features handgenerated features or employ deep learning models designed to recognize both longterm and shortterm dependencies in text sequences,ꯁꯦꯟꯇꯤꯃꯦꯟꯇ ꯀ꯭ꯂꯥꯁꯤꯐꯤꯀꯦꯁꯅꯒꯤꯗꯃꯛ ꯃꯣꯗꯦꯂꯁꯤꯡ ꯑꯁꯤ ꯃꯍꯧꯁꯥꯅꯥ ꯋꯥꯍꯩ ꯅ꯭ꯒ꯭ꯔꯥꯃꯁꯤꯡ ꯇꯔꯝ ꯐ꯭ꯔꯤꯛꯕꯦꯟꯁꯤ ꯏꯅꯚꯥꯔꯁ ꯗꯣꯀꯨꯃꯦꯟꯇ ꯐ꯭ꯔꯤꯛꯕꯦꯟꯁꯤ ꯇꯤ.ꯑꯦꯐ.ꯑꯥꯏ.ꯗꯤ.ꯑꯦꯐ.ꯒꯨꯝꯕꯥ ꯏꯅꯄꯨꯠꯁꯤꯡ ꯁꯤꯖꯤꯟꯅꯗꯨꯅꯥ ꯍꯦꯟꯗꯖꯦꯅꯦꯔꯦꯠ ꯇꯧꯔꯕꯥ ꯐꯤꯆꯔꯁꯤꯡ ꯁꯤꯖꯤꯟꯅꯩ ꯅꯠꯠꯔꯒꯥ ꯇꯦꯛꯁ ꯁꯤꯛꯕꯦꯟꯁꯁꯤꯡꯗꯥ ꯂꯣꯡ-ꯇꯔꯝ ꯑꯃꯁꯨꯡ ꯁꯣꯔꯇꯇꯔꯝ ꯗꯤꯄꯦꯟꯗꯦꯟꯁꯤ ꯑꯅꯤꯃꯛ ꯈꯉꯗꯣꯛꯅꯕꯥ ꯗꯤꯖꯥꯏꯟ ꯇꯧꯕꯥ ꯗꯤꯞ ꯂꯔꯅꯤꯡ ꯃꯣꯗꯦꯂꯁꯤꯡ ꯁꯤꯖꯤꯟꯅꯕꯥ
The applications of sentiment analysis are diverse extending to tasks such as categorizing customer reviews on various online platforms,ꯁꯦꯟꯇꯤꯃꯦꯟꯇ ꯑꯦꯅꯥꯂꯥꯏꯁꯤꯁꯀꯤ ꯑꯦꯞꯂꯤꯀꯦꯁꯅꯁꯤꯡ ꯑꯁꯤ ꯇꯣꯉꯥꯟ ꯇꯣꯉꯥꯅꯕꯥ ꯑꯣꯅꯂꯥꯏꯟ ꯄ꯭ꯂꯦꯠꯐꯣꯔꯃꯁꯤꯡꯗꯥ ꯀꯁ꯭ꯇꯃꯔ ꯔꯤꯚꯤꯌꯨꯁꯤꯡ ꯀꯦꯇꯦꯒꯣꯔꯤ ꯇꯧꯕꯥ ꯑꯁꯤꯒꯨꯝꯕꯥ ꯊꯕꯀꯁꯤꯡꯗꯥ ꯌꯧꯍꯜꯂꯤ
Terminology extraction The goal of terminology extraction is to automatically extract relevant terms from a given corpus,ꯇꯦꯔꯃꯤꯅꯣꯂꯣꯖꯤ ꯑꯦꯛꯁꯠꯔꯥꯛꯁꯟ ꯇꯦꯔꯃꯤꯅꯣꯂꯣꯖꯤ ꯑꯦꯛꯁꯠꯔꯥꯛꯁꯅꯒꯤ ꯄꯥꯟꯗꯃꯗꯤ ꯑꯄꯤꯕꯥ ꯀꯣꯔꯄꯁ ꯑꯃꯗꯒꯤ ꯃꯔꯤ ꯂꯩꯅꯕꯥ ꯇꯔꯃꯁꯤꯡ ꯃꯁꯥ ꯃꯊꯟꯇꯥ ꯑꯦꯛꯁꯠꯔꯥꯛꯇ ꯇꯧꯕꯅꯤ
Wordsense disambiguation WSD Many words have more than one meaning we have to select the meaning which makes the most sense in context,wordsense disambiguation wsd ꯋꯥꯍꯩ ꯀꯌꯥꯗꯥ ꯑꯃꯗꯒꯤ ꯍꯦꯟꯅꯥ ꯂꯩ ꯃꯗꯨꯗꯤ ꯑꯩꯈꯣꯌꯅꯥ ꯑꯔꯊ ꯑꯗꯨ ꯈꯅꯒꯗꯕꯅꯤ ꯃꯗꯨꯅꯥ ꯀꯟꯇꯦꯛꯁꯇꯥ ꯈ꯭ꯕꯥꯏꯗꯒꯤ ꯍꯦꯟꯅꯥ ꯋꯥꯍꯟꯊꯣꯛ ꯄꯤꯔꯤ
For this problem we are typically given a list of words and associated word senses e.g. from a dictionary or an online resource such as WordNet,ꯃꯁꯤꯒꯤ ꯁꯃꯁ꯭ꯌꯥ ꯑꯁꯤꯒꯤꯗꯃꯛꯇꯥ ꯑꯩꯈꯣꯌꯗꯥ ꯃꯍꯧꯁꯥꯅꯥ ꯋꯥꯍꯩꯁꯤꯡ ꯑꯃꯁꯨꯡ ꯃꯔꯤ ꯂꯩꯅꯕꯥ ꯋꯥꯍꯩ ꯁꯦꯟꯁꯁꯤꯡꯒꯤ ꯂꯤꯁ꯭ꯠ ꯑꯃꯥ ꯄꯤꯔꯤ ꯈꯨꯗꯝ ꯑꯣꯏꯅꯥ ꯌꯨ.ꯑꯦꯁ.
Entity linking Many wordstypically proper namesrefer to named entities here we have to select the entity a famous individual a location a company etc,ꯑꯦꯟꯇꯤꯇꯤ ꯑꯦꯟꯇꯤꯇꯤ ꯀꯌꯥ ꯂꯤꯉ꯭ꯛ ꯇꯧꯕꯥ ꯌꯥꯕꯥ ꯄ꯭ꯔꯣꯄꯔ ꯅꯦꯃꯁ ꯍꯥꯌꯅꯥ ꯃꯤꯡꯊꯣꯅꯕꯥ ꯑꯦꯟꯇꯤꯇꯤꯁꯤꯡꯒꯤ ꯃꯇꯥꯡꯗꯥ ꯍꯥꯌꯕꯤꯌꯨ ꯃꯐꯝ ꯑꯁꯤꯗꯥ ꯑꯩꯈꯣꯌꯅꯥ ꯃꯃꯤꯡ ꯂꯩꯔꯕꯥ ꯃꯤꯑꯣꯏ ꯑꯃꯥ ꯈꯅꯒꯗꯕꯅꯤ ꯃꯐꯝ ꯑꯃꯥ ꯀꯝꯄꯦꯅꯤ ꯑꯃꯥ ꯑꯁꯤꯅꯆꯤꯡꯕꯥ
which is referred to in context,ꯃꯁꯤ ꯀꯟꯇꯦꯛꯁꯇꯥ ꯄꯅꯈ꯭ꯔꯦ .
Relationship extraction Given a chunk of text identify the relationships among named entities e.g. who is married to whom,ꯔꯤꯂꯦꯁꯅꯁꯤꯞ ꯑꯦꯛꯁꯠꯔꯥꯛꯁꯟ ꯇꯦꯛꯁꯀꯤ ꯁꯔꯨꯛ ꯑꯃꯥ ꯄꯤꯕꯥ ꯃꯃꯤꯡ ꯂꯩꯔꯕꯥ ꯑꯦꯟꯇꯤꯇꯤꯁꯤꯡꯒꯤ ꯃꯔꯛꯇꯥ ꯂꯩꯔꯤꯕꯥ ꯃꯔꯤꯁꯤꯡ ꯈꯨꯗꯝ ꯑꯣꯏꯅꯥ ꯌꯨ.ꯑꯦꯁ.
Semantic parsing Given a piece of text typically a sentence produce a formal representation of its semantics either as a graph e.g. in AMR parsing or in accordance with a logical formalism e.g. in DRT parsing,ꯁꯦꯃꯦꯟꯇꯤꯛ ꯄꯥꯔꯁꯤꯡ ꯄꯤꯕꯥ ꯋꯥꯍꯩ ꯑꯃꯒꯤ ꯁꯔꯨꯛ ꯑꯃꯥ ꯃꯍꯧꯁꯥꯅꯥ ꯋꯥꯍꯩ ꯑꯃꯅꯥ ꯃꯁꯤꯒꯤ ꯁꯦꯃꯦꯟꯇꯤꯀꯁꯤꯡꯒꯤ ꯐꯣꯔꯃꯦꯜ ꯑꯣꯏꯕꯥ ꯔꯤꯞꯔꯖꯦꯟꯇꯦꯁꯟ ꯑꯃꯥ ꯒ꯭ꯔꯥꯐ ꯑꯃꯥ ꯑꯣꯏꯅꯥ ꯅꯠꯠꯔꯒꯥ e.g.
This challenge typically includes aspects of several more elementary NLP tasks from semantics e.g. semantic role labelling wordsense disambiguation and can be extended to include fullfledged discourse analysis e.g. discourse analysis coreference see Natural language understanding below,ꯃꯁꯤꯒꯤ ꯁꯤꯡꯅꯕꯥ ꯑꯁꯤꯅꯥ ꯃꯍꯧꯁꯥꯅꯥ ꯁꯦꯃꯦꯟꯇꯤꯀꯁꯤꯡꯗꯒꯤ ꯍꯦꯟꯅꯥ ꯏꯂꯤꯃꯦꯟꯇꯔꯤ ꯑꯦꯟ.ꯑꯦꯜ.ꯄꯤ.ꯒꯤ ꯊꯕꯛ ꯀꯌꯥꯒꯤ ꯑꯦꯁ꯭ꯄꯦꯛꯇꯁꯤꯡ ꯌꯥꯑꯣꯔꯤ ꯈꯨꯗꯝ ꯑꯣꯏꯅꯥ ꯌꯨ.ꯚꯤ.
Semantic role labelling see also implicit semantic role labelling below Given a single sentence identify and disambiguate semantic predicates e.g. verbal frames then identify and classify the frame elements semantic roles,ꯁꯦꯃꯦꯟꯇꯤꯛ ꯔꯣꯜ ꯂꯦꯕꯦꯂꯤꯡ ꯑꯁꯤꯁꯨ ꯌꯦꯡꯕꯤꯌꯨ ꯃꯈꯥꯗꯥ ꯄꯤꯔꯤꯕꯥ ꯏꯝꯞꯂꯤꯁꯤꯠ ꯁꯦꯃꯦꯟꯇꯤꯛ ꯔꯣꯜ ꯂꯦꯕꯦꯂꯤꯡ ꯑꯁꯤ ꯃꯈꯥꯗꯥ ꯄꯤꯔꯤꯕꯥ ꯋꯥꯍꯩ ꯑꯃꯈꯛꯇꯅꯥ ꯁꯦꯃꯦꯟꯇꯤꯛ ꯄ꯭ꯔꯦꯗꯤꯀꯦꯠꯁꯤꯡ ꯈꯉꯗꯣꯀꯄꯥ ꯑꯃꯁꯨꯡ ꯗꯤꯁꯑꯦꯕꯤꯃꯦꯠ ꯇꯧꯕꯥ ꯏ.ꯖꯤ.
Coreference resolution Given a sentence or larger chunk of text determine which words mentions refer to the same objects entities,ꯀꯣꯔꯐꯦꯔꯦꯟꯁ ꯔꯤꯖꯣꯂꯨꯁꯟ ꯋꯥꯍꯩ ꯑꯃꯥ ꯅꯠꯔꯒꯥ ꯇꯦꯛꯁꯀꯤ ꯑꯆꯧꯕꯥ ꯁꯔꯨꯛ ꯑꯃꯥ ꯄꯤꯕꯥ ꯋꯥꯍꯩ ꯄꯔꯦꯡꯁꯤꯡ ꯑꯗꯨ ꯀꯔꯝꯕꯥ ꯋꯥꯍꯩꯁꯤꯡꯅꯥ ꯄꯜꯂꯤꯕꯒꯦ ꯍꯥꯌꯕꯗꯨ ꯆꯞ ꯃꯥꯟꯅꯕꯥ ꯄꯣꯠꯁꯀꯁꯤꯡꯒꯤ ꯑꯦꯟꯇꯤꯇꯤꯁꯤꯡ ꯑꯗꯨ ꯇꯥꯀꯏ .
Anaphora resolution is a specific example of this task and is specifically concerned with matching up pronouns with the nouns or names to which they refer,ꯑꯦꯅꯥꯐꯣꯔꯥ ꯔꯤꯖꯣꯂꯨꯁꯟ ꯑꯁꯤ ꯊꯕꯛ ꯑꯁꯤꯒꯤ ꯑꯀꯛꯅꯕꯥ ꯈꯨꯗꯝ ꯑꯃꯅꯤ ꯑꯃꯁꯨꯡ ꯃꯁꯤꯅꯥ ꯑꯀꯛꯅꯕꯥ ꯃꯑꯣꯡꯗꯥ ꯄ꯭ꯔꯣꯅꯣꯅꯣꯃꯁꯤꯡ ꯑꯁꯤ ꯃꯈꯣꯌꯅꯥ ꯔꯤꯐꯔ ꯇꯧꯔꯤꯕꯥ ꯅ꯭ꯌꯨꯖ ꯅꯠꯠꯔꯒꯥ ꯃꯤꯡꯁꯤꯡꯒꯥ ꯃꯥꯟꯅꯕꯥ ꯌꯥꯍꯅꯕꯗꯥ ꯃꯤꯠꯌꯦꯡ ꯊꯝꯂꯤ꯫
The more general task of coreference resolution also includes identifying socalled bridging relationships involving referring expressions,ꯀꯣꯔꯐꯦꯔꯦꯟꯁ ꯔꯤꯖꯣꯂꯨꯁꯅꯒꯤ ꯍꯦꯟꯅꯥ ꯖꯦꯅꯦꯔꯦꯜ ꯑꯣꯏꯕꯥ ꯊꯕꯛ ꯑꯁꯤꯅꯥ ꯔꯤꯐꯔ ꯇꯧꯕꯥ ꯑꯦꯛꯁꯞꯔꯦꯁꯅꯁꯤꯡ ꯌꯥꯑꯣꯕꯥ ꯁꯣꯀꯜ ꯕ꯭ꯔꯤꯖꯤꯡꯒꯤ ꯃꯔꯤꯁꯤꯡ ꯈꯉꯗꯣꯀꯄꯁꯨ ꯌꯥꯑꯣꯔꯤ꯫
For example in a sentence such as He entered Johns house through the front door the front door is a referring expression and the bridging relationship to be identified is the fact that the door being referred to is the front door of Johns house rather than of some other structure that might also be referred to,ꯈꯨꯗꯝ ꯑꯣꯏꯅꯥ ꯃꯍꯥꯛꯅꯥ ꯃꯃꯥꯡꯒꯤ ꯊꯣꯡꯗꯥ ꯖꯣꯅꯁ ꯍꯥꯎꯁꯇꯥ ꯆꯉꯂꯀꯈꯤꯕꯥ ꯑꯁꯤꯒꯨꯝꯕꯥ ꯋꯥꯍꯩ ꯑꯃꯗꯥ ꯃꯃꯥꯡꯒꯤ ꯊꯣꯡ ꯑꯗꯨ ꯔꯤꯐꯔ ꯇꯧꯕꯥ ꯌꯥꯕꯥ ꯋꯥꯐꯝ ꯑꯃꯅꯤ ꯑꯃꯁꯨꯡ ꯃꯁꯛ ꯈꯪꯗꯣꯛꯀꯗꯕꯥ ꯕ꯭ꯔꯤꯗꯤꯡ ꯔꯤꯂꯦꯁꯅꯁꯤꯞ ꯑꯗꯨꯗꯤ ꯔꯤꯐꯔ ꯇꯧꯔꯤꯕꯥ ꯊꯣꯡ ꯑꯗꯨ ꯑꯇꯣꯞꯄꯥ ꯁ꯭ꯠꯔꯀꯆꯔ ꯑꯃꯒꯤ ꯃꯍꯨꯠꯇꯥ ꯖꯣꯟꯁ ꯍꯥꯎꯁꯀꯤ ꯃꯃꯥꯡꯒꯤ ꯊꯣꯡꯅꯤ ꯍꯥꯌꯕꯁꯤꯁꯨ ꯔꯤꯐꯔ ꯇꯧꯕꯥ ꯌꯥꯕꯥ ꯑꯃꯅꯤ꯫
Discourse analysis This rubric includes several related tasks,ꯗꯤꯁꯀꯣꯔꯁ ꯑꯦꯅꯥꯂꯥꯏꯁꯤꯁ ꯔꯨꯕ꯭ꯔꯤꯛ ꯑꯁꯤꯗꯥ ꯃꯔꯤ ꯂꯩꯅꯕꯥ ꯊꯕꯛ ꯀꯌꯥ ꯌꯥꯑꯣꯔꯤ
One task is discourse parsing i.e. identifying the discourse structure of a connected text i.e. the nature of the discourse relationships between sentences e.g. elaboration explanation contrast,ꯊꯕꯛ ꯑꯃꯗꯤ ꯗꯤꯁꯀꯣꯔꯁ ꯄꯥꯔꯁꯤꯡ ꯍꯥꯌꯕꯗꯤ ꯀꯅꯦꯛꯇ ꯇꯧꯔꯕꯥ ꯇꯦꯛꯁ ꯑꯃꯒꯤ ꯗꯤꯁꯀꯣꯔꯁ ꯁ꯭ꯠꯔꯀꯆꯔ ꯈꯉꯗꯣꯀꯄꯥ ꯍꯥꯌꯕꯗꯤ ꯁꯦꯟꯁꯅꯁꯤꯡꯒꯤ ꯃꯔꯛꯇꯥ ꯂꯩꯔꯤꯕꯥ ꯗꯤꯁꯀꯣꯔꯁꯀꯤ ꯃꯔꯤꯁꯤꯡꯒꯤ ꯃꯑꯣꯡ ꯑꯁꯤ ꯈꯨꯗꯝ ꯑꯣꯏꯅꯥ ꯌꯨ.ꯑꯦꯁ.
Another possible task is recognizing and classifying the speech acts in a chunk of text e.g. yesno question content question statement assertion etc,ꯑꯇꯣꯞꯄꯥ ꯑꯣꯏꯊꯣꯀꯄꯥ ꯌꯥꯕꯥ ꯊꯕꯛ ꯑꯃꯗꯤ ꯋꯥꯍꯩꯒꯤ ꯑꯦꯛꯇꯁꯤꯡ ꯑꯗꯨ ꯇꯦꯛꯁꯀꯤ ꯁꯔꯨꯛ ꯑꯃꯗꯥ ꯈꯉꯗꯣꯀꯄꯥ ꯑꯃꯁꯨꯡ ꯀ꯭ꯂꯥꯁꯤꯐꯥꯏ ꯇꯧꯕꯅꯤ ꯈꯨꯗꯝ ꯑꯣꯏꯅꯥ ꯌꯨ.ꯑꯦꯁ.
Implicit semantic role labelling Given a single sentence identify and disambiguate semantic predicates e.g. verbal frames and their explicit semantic roles in the current sentence see Semantic role labelling above,ꯏꯝꯞꯂꯤꯁꯤꯠ ꯁꯦꯃꯦꯟꯇꯤꯛ ꯔꯣꯜ ꯂꯦꯕꯦꯂꯤꯡ ꯄꯤꯕꯥ ꯋꯥꯍꯩ ꯑꯃꯈꯛꯇꯃꯛ ꯄꯤꯕꯥ ꯁꯦꯃꯦꯟꯇꯤꯛ ꯄ꯭ꯔꯦꯗꯤꯀꯦꯠꯁꯤꯡ ꯃꯁꯛ ꯈꯪꯗꯣꯀꯄꯥ ꯑꯃꯁꯨꯡ ꯗꯤꯁꯑꯦꯕꯤꯃꯦꯠ ꯇꯧꯕꯥ ꯈꯨꯗꯝ ꯑꯣꯏꯅꯥ ꯌꯨ.ꯚꯤ.
Then identify semantic roles that are not explicitly realized in the current sentence classify them into arguments that are explicitly realized elsewhere in the text and those that are not specified and resolve the former against the local text,ꯃꯗꯨꯒꯤ ꯃꯇꯨꯡꯗꯥ ꯍꯧꯖꯤꯛ ꯂꯩꯔꯤꯕꯥ ꯁꯦꯟꯁꯟ ꯑꯁꯤꯗꯥ ꯃꯌꯦꯛ ꯁꯦꯡꯅꯥ ꯔꯤꯑꯦꯂꯥꯏꯖ ꯇꯧꯗꯕꯥ ꯁꯦꯃꯦꯟꯇꯤꯛ ꯔꯣꯂꯁꯤꯡ ꯈꯉꯗꯣꯀꯎ ꯃꯈꯣꯌꯕꯨ ꯇꯦꯛꯁꯀꯤ ꯑꯇꯣꯞꯄꯥ ꯃꯐꯝ ꯑꯃꯗꯥ ꯃꯌꯦꯛ ꯁꯦꯡꯅꯥ ꯔꯤꯑꯦꯂꯥꯏꯖ ꯇꯧꯔꯕꯥ ꯑꯥꯔꯒꯨꯃꯦꯟꯇꯁꯤꯡꯗꯥ ꯀ꯭ꯂꯥꯁꯤꯐꯥꯏ ꯇꯧꯏ ꯑꯃꯁꯨꯡ ꯃꯗꯨꯕꯨ ꯂꯦꯄꯊꯣꯛꯂꯃꯗꯕꯥ ꯑꯃꯁꯨꯡ ꯍꯥꯟꯅꯒꯤ ꯑꯗꯨꯕꯨ ꯂꯣꯀꯦꯜ ꯇꯦꯛꯁꯀꯤ ꯃꯥꯌꯣꯛꯇꯥ ꯔꯤꯖꯣꯂꯕ ꯇꯧꯕꯥ
A closely related task is zero anaphora resolution i.e. the extension of coreference resolution to prodrop languages,ꯌꯥꯝꯅꯥ ꯅꯛꯅꯥ ꯃꯔꯤ ꯂꯩꯅꯕꯥ ꯊꯕꯛ ꯑꯃꯗꯤ ꯖꯤꯔꯣ ꯑꯦꯅꯥꯐꯣꯔꯥ ꯔꯤꯖꯣꯂꯨꯁꯟ ꯍꯥꯌꯕꯗꯤ ꯄ꯭ꯔꯣꯗ꯭ꯔꯣꯞ ꯂꯣꯂꯁꯤꯡꯗꯥ ꯀꯣꯔꯐꯦꯔꯦꯟꯁ ꯔꯤꯖꯣꯂꯨꯁꯅꯒꯤ ꯑꯦꯛꯁꯇꯦꯟꯁꯟ ꯑꯁꯤꯅꯤ
Recognizing textual entailment Given two text fragments determine if one being true entails the other entails the others negation or allows the other to be either true or false,ꯇꯦꯛꯁꯠ ꯐ꯭ꯔꯦꯒꯃꯦꯟꯇ ꯑꯅꯤ ꯄꯤꯕꯥ ꯇꯦꯛꯁꯇꯥꯏꯜ ꯑꯦꯅꯇꯦꯂꯃꯦꯟꯇ ꯑꯃꯥ ꯈꯉꯗꯣꯀꯄꯥ ꯍꯥꯌꯕꯁꯤ ꯑꯇꯣꯞꯄꯥ ꯑꯃꯅꯥ ꯑꯇꯣꯞꯄꯥ ꯑꯃꯕꯨ ꯑꯇꯣꯞꯄꯁꯤꯡꯒꯤ ꯅꯦꯒꯦꯁꯟ ꯌꯥꯑꯣꯕꯔꯥ ꯅꯠꯔꯒꯥ ꯑꯇꯣꯞꯄꯥ ꯑꯃꯕꯨ ꯑꯆꯨꯝꯕꯥ ꯅꯠꯔꯒꯥ ꯑꯔꯥꯅꯕꯥ ꯑꯣꯏꯍꯅꯕꯥ ꯌꯥꯍꯜꯂꯤꯕꯔꯥ ꯍꯥꯌꯕꯗꯨ ꯂꯦꯄꯊꯣꯀꯏ .
Topic segmentation and recognition Given a chunk of text separate it into segments each of which is devoted to a topic and identify the topic of the segment,ꯇꯣꯄꯤꯛ ꯁꯦꯒꯃꯦꯟꯇꯦꯁꯟ ꯑꯃꯁꯨꯡ ꯔꯤꯀꯣꯒꯅꯤꯁꯟ ꯇꯦꯛꯁꯀꯤ ꯁꯔꯨꯛ ꯑꯃꯥ ꯄꯤꯕꯥ ꯑꯁꯤ ꯁꯦꯒꯃꯦꯟꯇꯁꯤꯡꯗꯥ ꯇꯣꯉꯥꯟꯅꯥ ꯈꯥꯌꯗꯣꯀꯏ ꯑꯃꯁꯨꯡ ꯃꯈꯣꯌ ꯈꯨꯗꯤꯡꯃꯛ ꯑꯁꯤ ꯍꯤꯔꯝ ꯑꯃꯗꯥ ꯀꯠꯊꯣꯛꯂꯤ ꯑꯃꯁꯨꯡ ꯁꯦꯒꯃꯦꯟꯇ ꯑꯗꯨꯒꯤ ꯍꯤꯔꯝ ꯑꯗꯨ ꯈꯉꯗꯣꯀꯏ
Argument mining The goal of argument mining is the automatic extraction and identification of argumentative structures from natural language text with the aid of computer programs,ꯑꯥꯔꯒꯨꯃꯦꯟꯇ ꯃꯥꯏꯅꯤꯡ ꯑꯥꯔꯒꯨꯃꯦꯟꯇ ꯃꯥꯏꯅꯤꯡꯒꯤ ꯄꯥꯟꯗꯝ ꯑꯁꯤ ꯀꯝꯞꯌꯨꯇꯔ ꯄ꯭ꯔꯣꯒ꯭ꯔꯥꯃꯁꯤꯡꯒꯤ ꯃꯇꯦꯡꯒꯥ ꯂꯣꯌꯅꯅꯥ ꯅꯦꯆꯔꯦꯜ ꯂꯦꯉ꯭ꯒꯨꯌꯦꯖ ꯇꯦꯛꯁꯇꯒꯤ ꯑꯥꯔꯒꯨꯃꯦꯟꯇꯦꯇꯤꯕ ꯁ꯭ꯠꯔꯀꯆꯔꯁꯤꯡ ꯑꯣꯇꯣꯃꯦꯇꯤꯛ ꯑꯣꯏꯅꯥ ꯂꯧꯊꯣꯀꯄꯥ ꯑꯃꯁꯨꯡ ꯈꯉꯗꯣꯀꯄꯥ ꯑꯁꯤꯅꯤ꯫
Such argumentative structures include the premise conclusions the argument scheme and the relationship between the main and subsidiary argument or the main and counterargument within discourse,ꯑꯁꯤꯒꯨꯝꯕꯥ ꯑꯥꯔꯒꯨꯃꯦꯟꯇꯦꯇꯤꯕ ꯁ꯭ꯠꯔꯀꯆꯔꯁꯤꯡ ꯑꯁꯤꯗꯥ ꯄ꯭ꯔꯤꯃꯤꯖꯝ ꯀꯟꯁꯂꯇꯦꯁꯅꯁꯤꯡ ꯑꯁꯤ ꯑꯥꯔꯒꯨꯃꯦꯟꯇ ꯁ꯭ꯀꯤꯝ ꯑꯃꯁꯨꯡ ꯃꯦꯟ ꯑꯃꯁꯨꯡ ꯁꯕꯁꯤꯗꯤꯌꯔꯤ ꯑꯥꯔꯒꯨꯃꯦꯟꯇ ꯅꯠꯔꯒꯥ ꯗꯤꯁꯀꯣꯔꯁꯀꯤ ꯃꯅꯨꯡꯗꯥ ꯃꯔꯨ ꯑꯣꯏꯕꯥ ꯑꯃꯁꯨꯡ ꯀꯥꯎꯟꯇꯔꯑꯥꯔꯒꯨꯃꯦꯟꯇꯒꯤ ꯃꯔꯛꯇꯥ ꯂꯩꯔꯤꯕꯥ ꯃꯔꯤ ꯑꯗꯨ ꯌꯥꯑꯣꯔꯤ꯫
Automatic summarization text summarization Produce a readable summary of a chunk of text,ꯑꯣꯇꯣꯃꯦꯇꯤꯛ ꯁꯃꯥꯔꯤꯖꯦꯁꯟ ꯇꯦꯛꯁꯠ ꯁꯃꯥꯔꯤꯖꯃꯅꯥ ꯇꯦꯛꯁꯠ ꯑꯃꯒꯤ ꯁꯔꯨꯛ ꯑꯃꯒꯤ ꯔꯤꯗ ꯇꯧꯕꯥ ꯌꯥꯕꯥ ꯁꯃꯖꯤꯟꯅꯐꯝ ꯑꯃꯥ ꯄꯨꯊꯣꯀꯏ .
Often used to provide summaries of the text of a known type such as research papers articles in the financial section of a newspaper,ꯑꯌꯥꯝꯕꯅꯥ ꯄꯥꯎ-ꯆꯦ ꯑꯃꯒꯤ ꯐꯥꯏꯅꯥꯟꯁꯤꯑꯦꯜ ꯁꯦꯛꯁꯅꯗꯥ ꯂꯩꯕꯥ ꯔꯤꯁꯔꯆ ꯄꯦꯄꯔꯁꯤꯡꯒꯤ ꯑꯥꯔꯇꯤꯀꯂꯁꯤꯡꯒꯨꯝꯕꯥ ꯈꯉꯅꯔꯕꯥ ꯃꯈꯜ ꯑꯃꯒꯤ ꯇꯦꯛꯁꯀꯤ ꯋꯥꯔꯣꯂꯁꯤꯡ ꯄꯤꯅꯕꯒꯤꯗꯃꯛ ꯁꯤꯖꯤꯟꯅꯩ꯫
Grammatical error correction Grammatical error detection and correction involves a great bandwidth of problems on all levels of linguistic analysis phonologyorthography morphology syntax semantics pragmatics,"ꯒ꯭ꯔꯥꯃꯦꯇꯤꯛ ꯑꯦꯔꯥꯔ ꯀ꯭ꯔꯤꯀꯦꯁꯟ ꯒ꯭ꯔꯥꯃꯦꯇꯤꯛ ꯑꯦꯔꯥꯔ ꯗꯤꯇꯦꯛꯁꯟ ꯑꯃꯁꯨꯡ ꯀꯣꯔꯔꯦꯛꯁꯟ ꯑꯁꯤꯅꯥ ꯂꯤꯉ꯭ꯒꯨꯏꯁ꯭ꯇꯤꯛ ꯑꯦꯅꯥꯂꯥꯏꯁꯤꯁꯀꯤ ꯊꯥꯛ ꯈꯨꯗꯤꯡꯃꯛꯇꯥ ꯁꯃꯁ꯭ꯌꯥꯁꯤꯡꯒꯤ ꯑꯆꯧꯕꯥ ꯕꯦꯟꯗꯋꯤꯊ ꯑꯃꯥ ꯌꯥꯑꯣꯏ, ꯐꯣꯅꯣꯂꯣꯖꯤꯑꯣꯔꯊꯣꯒ꯭ꯔꯥꯐꯤ ꯃꯣꯔꯐꯣꯂꯣꯖꯤ ꯁꯤꯟꯇꯦꯛꯁ ꯁꯦꯃꯦꯟꯇꯤꯛꯁ ꯄ꯭ꯔꯦꯒꯃꯦꯇꯤꯛꯁ"
Grammatical error correction is impactful since it affects hundreds of millions of people that use or acquire English as a second language,ꯒ꯭ꯔꯥꯃꯦꯇꯤꯛ ꯑꯦꯔꯥꯔ ꯀ꯭ꯔꯤꯀꯦꯁꯟ ꯑꯁꯤ ꯏꯝꯄꯦꯛꯇ ꯇꯧꯏ ꯃꯔꯃꯗꯤ ꯃꯁꯤꯅꯥ ꯏꯪꯂꯤꯁ ꯑꯁꯤ ꯑꯅꯤꯁꯨꯕꯥ ꯂꯣꯜ ꯑꯣꯏꯅꯥ ꯁꯤꯖꯤꯟꯅꯕꯥ ꯅꯠꯠꯔꯒꯥ ꯂꯧꯁꯤꯅꯕꯥ ꯃꯤꯑꯣꯏ ꯃꯤꯂꯤꯌꯟ ꯂꯤꯁꯤꯡ ꯀꯌꯥꯗꯥ ꯁꯣꯀꯍꯜꯂꯤ꯫
It has thus been subject to a number of shared tasks since 2011,ꯃꯁꯤ ꯑꯁꯨꯝꯅꯥ ꯲꯰꯱꯱ꯗꯒꯤ ꯍꯧꯅꯥ ꯁꯦꯌꯔ ꯇꯧꯔꯕꯥ ꯇꯥꯁ꯭ꯛ ꯀꯌꯥ ꯑꯃꯒꯤ ꯃꯈꯥꯗꯥ ꯂꯩꯔꯛꯂꯤ꯫
As far as orthography morphology syntax and certain aspects of semantics are concerned and due to the development of powerful neural language models such as GPT2 this can now 2019 be considered a largely solved problem and is being marketed in various commercial applications,ꯑꯣꯔꯊꯣꯒ꯭ꯔꯥꯐꯤ ꯃꯣꯔꯐꯣꯂꯣꯖꯤ ꯁꯤꯟꯇꯦꯛꯁ ꯑꯃꯁꯨꯡ ꯁꯦꯃꯦꯟꯇꯤꯀꯀꯤ ꯑꯀꯛꯅꯕꯥ ꯃꯁꯀꯁꯤꯡꯒꯤ ꯃꯇꯥꯡꯗꯥ ꯍꯥꯌꯔꯕꯗꯥ ꯑꯃꯁꯨꯡ ꯖꯤ.ꯄꯤ.ꯇꯤ.꯲ꯒꯨꯝꯕꯥ ꯁꯛꯇꯤ ꯂꯩꯕꯥ ꯅ꯭ꯌꯨꯔꯜ ꯂꯦꯉ꯭ꯒꯨꯌꯦꯖ ꯃꯣꯗꯦꯂꯁꯤꯡ ꯁꯦꯃꯒꯠꯄꯅꯥ ꯃꯔꯝ ꯑꯣꯏꯗꯨꯅꯥ ꯍꯧꯖꯤꯛꯇꯤ ꯲꯰꯱꯹ ꯑꯁꯤ ꯃꯌꯥꯃꯒꯤ ꯑꯣꯏꯅꯥ ꯁꯣꯜꯕ ꯇꯧꯕꯥ ꯌꯥꯕꯥ ꯁꯃꯁ꯭ꯌꯥ ꯑꯃꯥ ꯑꯣꯏꯅꯥ ꯂꯧꯕꯥ ꯌꯥꯔꯦ ꯑꯃꯁꯨꯡ ꯇꯣꯉꯥꯟ ꯇꯣꯉꯥꯅꯕꯥ ꯀꯝꯃꯔꯁꯤꯑꯦꯜ ꯑꯦꯞꯂꯤꯀꯦꯁꯅꯁꯤꯡꯗꯥ ꯃꯥꯔꯀꯦꯠ ꯇꯧꯔꯤ
Logic translation Translate a text from a natural language into formal logic,ꯂꯣꯖꯤꯛ ꯍꯟꯗꯣꯀꯄꯥ ꯃꯍꯧꯁꯥꯒꯤ ꯂꯣꯟ ꯑꯃꯗꯒꯤ ꯋꯥꯍꯩ ꯑꯃꯥ ꯐꯣꯔꯃꯦꯜ ꯂꯣꯖꯤꯀꯇꯥ ꯍꯟꯗꯣꯀꯄꯥ
Machine translation MT Automatically translate text from one human language to another,ꯃꯦꯁꯤꯟ ꯇ꯭ꯔꯥꯟꯁꯂꯦꯁꯟ mt ꯑꯣꯇꯣꯃꯦꯇꯦꯗ ꯑꯣꯏꯅꯥ ꯇꯦꯛꯁꯠ ꯑꯁꯤ ꯃꯤꯑꯣꯏꯕꯒꯤ ꯂꯣꯟ ꯑꯃꯗꯒꯤ ꯑꯇꯣꯞꯄꯥ ꯑꯃꯗꯥ ꯍꯟꯗꯣꯀꯄꯥ
This is one of the most difficult problems and is a member of a class of problems colloquially termed AIcomplete i.e. requiring all of the different types of knowledge that humans possess grammar semantics facts about the real world etc,ꯃꯁꯤ ꯈ꯭ꯕꯥꯏꯗꯒꯤ ꯑꯔꯨꯕꯥ ꯁꯃꯁ꯭ꯌꯥꯁꯤꯡꯒꯤ ꯃꯅꯨꯡꯗꯥ ꯑꯃꯅꯤ ꯑꯃꯁꯨꯡ ꯃꯁꯤ ꯀꯣꯂꯣꯀꯤ ꯑꯣꯏꯅꯥ ꯑꯦ.ꯑꯥꯏ.ꯀꯝꯞꯂꯤꯠ ꯍꯥꯌꯅꯥ ꯀꯧꯕꯥ ꯁꯃꯁ꯭ꯌꯥꯁꯤꯡꯒꯤ ꯀ꯭ꯂꯥꯁ ꯑꯃꯒꯤ ꯃꯦꯝꯕꯔ ꯑꯃꯅꯤ ꯍꯥꯌꯕꯗꯤ ꯃꯤꯑꯣꯏꯕꯅꯥ ꯇꯁꯦꯡꯕꯥ ꯃꯥꯂꯦꯝ ꯑꯁꯤꯒꯤ ꯃꯇꯥꯡꯗꯥ ꯒ꯭ꯔꯥꯃꯥꯔ ꯁꯦꯃꯦꯟꯇꯤꯛꯁ ꯐꯦꯛꯇꯔꯁꯤꯡ ꯂꯩꯕꯥ ꯇꯣꯉꯥꯟ ꯇꯣꯉꯥꯅꯕꯥ ꯃꯈꯂꯒꯤ ꯂꯧꯁꯤꯡ ꯄꯨꯝꯅꯃꯛ ꯃꯊꯧ ꯇꯥꯕꯥ
to solve properly,ꯃꯑꯣꯡ ꯆꯨꯝꯅꯥ ꯁꯣꯜꯕ ꯇꯧꯅꯕꯥ .
Naturallanguage understanding NLU Convert chunks of text into more formal representations such as firstorder logic structures that are easier for computer programs to manipulate,ꯅꯦꯆꯔꯦꯂꯂꯦꯉ꯭ꯒꯨꯌꯦꯖ ꯑꯦꯟ.ꯑꯦꯜ.ꯌꯨ.ꯅꯥ ꯇꯦꯛꯁꯀꯤ ꯆꯉ꯭ꯀꯁꯤꯡ ꯑꯁꯤ ꯀꯝꯞꯌꯨꯇꯔ ꯄ꯭ꯔꯣꯒ꯭ꯔꯥꯃꯁꯤꯡꯅꯥ ꯃꯦꯅꯤꯄꯨꯂꯦꯠ ꯇꯧꯕꯗꯥ ꯍꯦꯟꯅꯥ ꯂꯥꯌꯕꯥ ꯐꯥꯔꯁ꯭ꯇꯑꯣꯔꯗꯔ ꯂꯣꯖꯤꯛ ꯁ꯭ꯠꯔꯀꯆꯔꯒꯨꯝꯕꯥ ꯍꯦꯟꯅꯥ ꯐꯣꯔꯃꯦꯜ ꯑꯣꯏꯕꯥ ꯔꯤꯞꯔꯖꯦꯟꯇꯦꯁꯅꯁꯤꯡꯗꯥ ꯑꯣꯟꯊꯣꯀꯄꯥ
Natural language understanding involves the identification of the intended semantic from the multiple possible semantics which can be derived from a natural language expression which usually takes the form of organized notations of natural language concepts,ꯅꯦꯆꯔꯦꯜ ꯂꯦꯉ꯭ꯒꯨꯌꯦꯖ ꯑꯟꯗꯔꯁ꯭ꯇꯦꯟꯗꯤꯡ ꯍꯥꯌꯕꯁꯤꯗꯥ ꯃꯍꯧꯁꯥꯅꯥ ꯃꯍꯧꯁꯥꯒꯤ ꯂꯣꯂꯒꯤ ꯋꯥꯈꯜꯂꯣꯅꯁꯤꯡꯒꯤ ꯑꯣꯔꯒꯥꯅꯥꯏꯖ ꯇꯧꯔꯕꯥ ꯅꯣꯇꯦꯁꯅꯁꯤꯡꯒꯤ ꯃꯑꯣꯡꯗꯥ ꯂꯧꯕꯥ ꯌꯥꯕꯥ ꯃꯍꯧꯁꯥꯒꯤ ꯂꯣꯜ ꯑꯦꯛꯁꯞꯔꯦꯁꯟ ꯑꯃꯗꯒꯤ ꯂꯧꯕꯥ ꯌꯥꯕꯥ ꯑꯣꯏꯊꯣꯀꯄꯥ ꯌꯥꯕꯥ ꯁꯦꯃꯦꯟꯇꯤꯀꯁꯤꯡꯗꯒꯤ ꯏꯅꯗꯦꯟꯗꯦꯗ ꯁꯦꯃꯦꯟꯇꯤꯛ ꯑꯁꯤ ꯃꯁꯛ ꯈꯪꯗꯣꯀꯄꯥ ꯌꯥꯎꯏ꯫
