en,mni-Mtei
‘Now bring in the children.’,‘ꯍꯧꯖꯤꯛ ꯑꯉꯥꯡꯁꯤꯡ ꯄꯨꯔꯀꯎ’꯫
"They hurried out of the room and returned in a minute or two,","ꯃꯈꯣꯌꯅꯥ ꯔꯨꯃꯗꯒꯤ ꯌꯥꯝꯅꯥ ꯊꯨꯅꯥ ꯊꯣꯀꯈꯤ ꯑꯃꯁꯨꯡ ꯃꯤꯅꯤꯠ ꯑꯃꯗꯥ ꯅꯠꯔꯒꯥ ꯑꯅꯤꯗꯥ ꯍꯜꯂꯀꯈꯤ,"
"each pushing a kind of tall dumb-waiter laden, on all its four","ꯈꯨꯗꯤꯡꯃꯛꯅꯥ ꯃꯈꯜ ꯑꯃꯒꯤ ꯂꯝꯕꯥ ꯗꯝꯕ-ꯋꯦꯇꯔ ꯂꯥꯗꯦꯟ ꯄꯨꯁꯤꯜꯂꯀꯄꯥ, ꯃꯁꯤꯒꯤ ꯃꯔꯤ ꯑꯁꯤ ꯄꯨꯝꯅꯃꯛꯇꯥ ."
"wire-netted shelves, with eight- month-old babies, all exactly","ꯋꯥꯏꯔ-ꯅꯦꯠ ꯇꯧꯔꯕꯥ ꯁꯦꯂꯐꯃꯁꯤꯡ, ꯊꯥ ꯸ ꯁꯨꯔꯕꯥ ꯑꯉꯥꯡꯁꯤꯡꯒꯥ ꯂꯣꯌꯅꯅꯥ, ꯄꯨꯝꯅꯃꯛ ꯑꯁꯤ ꯇꯁꯦꯡꯅꯥ"
"alike (a Bokanovsky Group, it was evident) and all (since their","ꯑꯦꯂꯥꯏꯛ (ꯕꯣꯀꯥꯅꯣꯚꯁ꯭ꯀꯤ ꯀꯥꯡꯂꯨꯞ ꯑꯃꯥ, ꯃꯁꯤ ꯃꯌꯦꯛ ꯁꯦꯡꯅꯥ ꯎꯕꯥ ꯐꯪꯈꯤ) ꯑꯃꯁꯨꯡ ꯄꯨꯝꯅꯃꯛ (ꯃꯈꯣꯌꯒꯤ ꯃꯔꯛꯇꯥ ꯃꯈꯣꯌꯒꯤ ."
caste was Delta) dressed in khaki,ꯀꯥꯁ꯭ꯠ ꯋꯥꯁ ꯗꯦꯜꯇꯥ) ꯗ꯭ꯔꯦꯁ ꯏꯟ ꯈꯥꯀꯤ
‘Put them down on the floor.’ The infants were unloaded,‘ꯃꯈꯣꯌꯕꯨ ꯐ꯭ꯂꯣꯔꯗꯥ ꯊꯝꯃꯨ꯫’ ꯑꯉꯥꯡꯁꯤꯡ ꯑꯗꯨ ꯑꯅꯂꯣꯗ ꯇꯧꯈꯤ꯫
‘Now turn them so that they can see the flowers and books.’,‘ꯍꯧꯖꯤꯛ ꯃꯈꯣꯌꯕꯨ ꯐꯨꯜ ꯑꯃꯁꯨꯡ ꯂꯥꯏꯔꯤꯀꯁꯤꯡ ꯌꯦꯡꯕꯥ ꯉꯝꯅꯕꯥ ꯂꯥꯀꯎ’꯫
"Turned, the babies at once fell silent, then began to crawl","ꯇꯨꯡꯗꯥ, ꯑꯉꯥꯡꯁꯤꯡ ꯑꯗꯨ ꯑꯃꯨꯛ ꯍꯟꯅꯥ ꯇꯞꯅꯥ ꯇꯞꯅꯥ ꯁꯣꯀꯈꯤ, ꯃꯗꯨꯒꯤ ꯃꯇꯨꯡꯗꯥ ꯀ꯭ꯔꯣꯜ ꯇꯧꯕꯥ ꯍꯧꯈꯤ"
"towards those clusters of sleek colours, those shapes so gay","ꯑꯗꯨꯒꯨꯝꯕꯥ ꯀ꯭ꯂꯁ꯭ꯇꯔꯁꯤꯡ ꯑꯗꯨꯒꯤ ꯃꯥꯌꯀꯩꯗꯥ ꯁꯦꯡꯂꯕꯥ ꯃꯆꯨꯒꯤ ꯃꯐꯃꯁꯤꯡ, ꯃꯗꯨꯒꯤ ꯃꯑꯣꯡꯁꯤꯡ ꯑꯗꯨꯅꯥ ꯃꯔꯝ ꯑꯣꯏꯗꯨꯅꯥ ꯒꯦ ."
"and brilliant on the white pages. As they approached, the sun",ꯑꯃꯁꯨꯡ ꯑꯉꯧꯕꯥ ꯄꯦꯖꯁꯤꯡꯗꯥ ꯃꯌꯦꯛ ꯁꯦꯡꯅꯥ ꯎꯕꯥ ꯐꯪꯏ꯫
came out of a momentary eclipse behind a cloud. The roses,ꯅꯣꯡꯂꯩ ꯅꯨꯡꯁꯤꯠ ꯑꯃꯒꯤ ꯃꯇꯨꯡꯗꯥ ꯊꯨꯅꯥ ꯌꯥꯡꯅꯥ ꯂꯥꯀꯄꯥ ꯒ꯭ꯔꯍꯟ ꯑꯃꯗꯒꯤ ꯊꯣꯔꯀꯈꯤ꯫
flamed up as though with a sudden passion from within; a new,ꯃꯅꯨꯡꯗꯒꯤ ꯈꯉꯍꯧꯗꯅꯥ ꯄꯥꯁꯟ ꯑꯃꯒꯥ ꯂꯣꯌꯅꯅꯥ ꯃꯩꯁꯥ ꯂꯥꯀꯈꯤ;
and profound significance seemed to suffuse the shining pages,ꯑꯃꯁꯨꯡ ꯄ꯭ꯔꯣꯐꯥꯏꯗ ꯁꯤꯒꯅꯦꯟꯁꯅꯥ ꯃꯉꯥꯜ ꯊꯣꯀꯄꯥ ꯄꯦꯖꯁꯤꯡ ꯑꯗꯨ ꯊꯨꯒꯥꯏꯕꯥ ꯎꯈꯤ .
of the books. From the ranks of the crawling babies came little,ꯂꯥꯏꯔꯤꯀꯁꯤꯡꯒꯤ ꯃꯇꯥꯡꯗꯥ ꯋꯥꯐꯝ ꯀꯌꯥ ꯊꯃꯈꯤ꯫
"squeals of excitement, gurgles and","ꯑꯦꯛꯁꯥꯏꯇꯦꯁꯟ, ꯒꯨꯔꯒꯜ ꯑꯃꯁꯨꯡ ."
twitterings of pleasure,ꯅꯨꯡꯉꯥꯏꯕꯒꯤ ꯇꯨꯏꯇꯥꯔꯁꯤꯡ
The Director rubbed his hands. ‘Excellent!’ he said. ‘It might,ꯗꯥꯏꯔꯦꯛꯇꯔꯅꯥ ꯃꯍꯥꯛꯀꯤ ꯈꯨꯠ ꯊꯥꯈꯤ꯫
almost have been done on purpose.’,ꯆꯥꯎꯔꯥꯛꯅꯥ ꯄꯥꯟꯗꯝ ꯊꯃꯗꯨꯅꯥ ꯇꯧꯈ꯭ꯔꯦ꯫’
The swiftest crawlers were already at their goal. Small hands,ꯈ꯭ꯕꯥꯏꯗꯒꯤ ꯌꯥꯝꯅꯥ ꯊꯨꯅꯥ ꯀ꯭ꯔꯣꯂꯔꯁꯤꯡ ꯑꯁꯤ ꯍꯥꯟꯅꯅꯥ ꯃꯈꯣꯌꯒꯤ ꯄꯥꯟꯗꯝ ꯑꯗꯨꯗꯥ ꯂꯩꯔꯝꯃꯤ꯫
"reached out uncertainly, touched, grasped, unpetaling the","reach out deforty, ꯊꯦꯠ, ꯒ꯭ꯔꯦꯁꯗ, ꯑꯅꯄꯦꯇꯥꯂꯤꯡ ꯗꯤ ."
24,꯲꯴ ꯑꯃꯁꯨꯡ ꯲꯴.
"transfigured roses, crumpling the illuminated pages of the","ꯇ꯭ꯔꯥꯟꯁꯐꯤꯒꯔ ꯇꯧꯔꯕꯥ ꯒꯣꯂꯥꯄꯁꯤꯡ, ꯏꯂꯨꯃꯤꯅꯦꯇꯦꯗ ꯄꯦꯖꯁꯤꯡ ꯑꯗꯨ ꯀꯨꯄꯁꯤꯟꯗꯨꯅꯥ ꯊꯝꯕꯥ ꯌꯥꯏ꯫"
"books. The Director waited until all were happily busy. Then,",ꯂꯥꯏꯔꯤꯀꯁꯤꯡ꯫
"‘Watch carefully,’ he said. And, lifting his hand, he gave the",‘ꯌꯦꯀꯆꯥꯡꯅꯥ ꯌꯦꯡꯕꯤꯌꯨ’ ꯍꯥꯌꯅꯥ ꯃꯍꯥꯛꯅꯥ ꯍꯥꯌꯈꯤ꯫
signal,ꯁꯤꯒꯅꯦꯜ ꯑꯁꯤ .
"The Head Nurse, who was standing by a switchboard at the","ꯍꯦꯗ ꯅꯔꯁ, ꯃꯍꯥꯛꯅꯥ ꯁꯨꯏꯆꯕꯣꯔꯗ ꯑꯃꯗꯥ ꯂꯦꯞꯂꯤꯕꯥ ꯑꯗꯨ ."
"other end of the room, pressed down a little lever","ꯔꯨꯃꯒꯤ ꯑꯇꯣꯞꯄꯥ ꯃꯌꯥꯌ ꯑꯃꯥ, ꯂꯤꯚꯔ ꯈꯔꯥ ꯄꯤꯊꯀꯄꯥ ."
"There was a violent explosion. Shriller and ever shriller, a siren",ꯍꯤꯡꯁꯥꯒꯤ ꯊꯧꯗꯣꯛ ꯑꯃꯥ ꯊꯣꯀꯈꯤ꯫
Alarm bells maddeningly sounded,ꯑꯦꯂꯥꯔꯝ ꯕꯦꯂꯁꯤꯡ ꯃꯔꯥꯜ ꯂꯩꯖꯗ꯭ꯔꯕꯥ ꯈꯣꯟꯖꯦꯜ
"The children started, screamed; their faces were distorted with","ꯑꯉꯥꯡꯁꯤꯡ ꯑꯗꯨ ꯍꯧꯔꯀꯈꯤ, ꯂꯥꯎꯈꯤ;"
terror,ꯇꯦꯔꯣꯔꯤꯁ꯭ꯠ ꯑꯃꯥ ꯑꯣꯏꯅꯥ ꯑꯦꯝ.
"‘And now,’ the Director shouted (for the noise was deafening),","‘ꯑꯗꯨꯒꯥ ꯍꯧꯖꯤꯛ,’ ꯗꯥꯏꯔꯦꯛꯇꯔꯅꯥ ꯂꯥꯎꯔꯀꯏ (ꯃꯔꯃꯗꯤ ꯅꯣꯡꯃꯩ ꯀꯥꯞꯄꯥ ꯌꯥꯏ),"
‘now we proceed to rub in the lesson with a mild electric shock.’,‘ꯍꯧꯖꯤꯛ ꯑꯩꯈꯣꯌꯅꯥ ꯂꯥꯏꯁꯉꯗꯥ ꯌꯥꯝꯅꯥ ꯂꯥꯏꯅꯥ ꯏꯂꯦꯛꯠꯔꯤꯛ ꯁꯣꯛ ꯑꯃꯒꯥ ꯂꯣꯌꯅꯅꯥ ꯁꯣꯛꯅ-ꯁꯝꯅꯍꯜꯂꯤ꯫’
"He waved his hand again, and the Head Nurse pressed a","ꯃꯍꯥꯛꯅꯥ ꯑꯃꯨꯛ ꯍꯟꯅꯥ ꯈꯨꯠ ꯊꯥꯈꯤ, ꯑꯃꯁꯨꯡ ꯍꯦꯗ ꯅꯔꯁꯅꯥ ꯄ꯭ꯔꯦꯁ ꯑꯃꯥ ꯊꯥꯈꯤ꯫"
second lever. The screaming of the babies suddenly changed its,ꯑꯅꯤꯁꯨꯕꯥ ꯂꯤꯚꯔ꯫
"tone. There was something desperate, almost insane, about the",ꯇꯣꯟ ꯇꯧꯕꯥ꯫
sharp spasmodic yelps to which they now gave utterance. Their,ꯍꯧꯖꯤꯛ ꯃꯈꯣꯌꯅꯥ ꯋꯥꯍꯩ ꯄꯤꯔꯀꯄꯥ ꯁꯥꯐꯕꯥ ꯁ꯭ꯄꯥꯁ꯭ꯃꯣꯗꯤꯛ ꯌꯦꯜꯄꯁꯤꯡ꯫
little bodies twitched and stiffened; their limbs moved jerkily as,ꯂꯤꯇꯜ ꯕꯣꯗꯤꯁꯤꯡ ꯑꯁꯤ ꯇꯞꯅꯥ ꯇꯞꯅꯥ ꯁꯣꯀꯆꯤꯜꯂꯀꯈꯤ;
if to the tug of unseen wires,ꯀꯔꯤꯒꯨꯝꯕꯥ ꯎꯕꯥ ꯐꯪꯗꯕꯥ ꯋꯥꯏꯔꯄꯁꯤꯡꯒꯤ ꯇꯒꯗꯥ ꯀꯔꯤꯒꯨꯝꯕꯥ .
"‘We can electrify that whole strip of floor,’ bawled the Director","‘ꯑꯩꯈꯣꯌꯅꯥ ꯐ꯭ꯂꯣꯔꯒꯤ ꯁ꯭ꯠꯔꯤꯞ ꯄꯨꯝꯅꯃꯛ ꯑꯗꯨ ꯏꯂꯦꯛꯠꯔꯤꯐꯤꯀꯦꯁꯟ ꯇꯧꯕꯥ ꯌꯥꯏ,’ ꯍꯥꯌꯅꯥ ꯗꯥꯏꯔꯦꯛꯇꯔꯅꯥ ꯋꯥ ꯉꯥꯡꯈꯤ"
"in explanation. ‘But that’s enough,’ he signalled to the nurse",ꯃꯌꯦꯛ ꯁꯦꯡꯅꯥ ꯇꯥꯀꯄꯥ꯫
"The explosions ceased, the bells stopped ringing, the shriek of","ꯄꯣꯠ ꯄꯨꯊꯣꯛ ꯄꯨꯁꯤꯟ ꯇꯧꯕꯥ ꯂꯦꯄꯈꯤ, ꯕꯦꯂꯁꯤꯡꯅꯥ ꯁꯣꯀꯄꯥ ꯂꯦꯄꯈꯤ, ꯈꯣꯟꯖꯦꯂꯒꯤ ꯈꯣꯟꯖꯦꯜ"
the siren died down from tone to tone into silence. The stiffly,ꯁꯥꯏꯔꯦꯟ ꯑꯗꯨ ꯇꯣꯟ ꯇꯧꯗꯨꯅꯥ ꯇꯣꯟ ꯇꯧꯗꯨꯅꯥ ꯊꯨꯅꯥ ꯌꯥꯡꯅꯥ ꯁꯤꯈꯤ꯫
"twitching bodies relaxed, and what had become the sob and","ꯇ꯭ꯌꯨꯏꯆꯤꯡ ꯕꯣꯗꯤꯁꯤꯡ ꯔꯤꯂꯥꯛꯁ ꯇꯧꯈꯤ, ꯑꯃꯁꯨꯡ ꯀꯔꯤ ꯑꯣꯏꯈꯤꯕꯒꯦ ꯑꯃꯁꯨꯡ ꯑꯦꯁ.ꯑꯣ.ꯕꯤ."
25,꯲꯵ ꯑꯃꯁꯨꯡ ꯲꯵.
yelp of infant maniacs broadened out once more into a normal,ꯌꯦꯜꯄ ꯑꯣꯐ ꯏꯅꯐꯦꯟꯇ ꯃꯦꯅꯤꯌꯥꯀꯁꯤꯡ ꯑꯁꯤ ꯑꯃꯨꯛ ꯍꯟꯅꯥ ꯅꯣꯔꯃꯦꯜ ꯑꯃꯗꯥ ꯄꯥꯀꯊꯣꯛ ꯆꯥꯎꯊꯣꯀꯍꯅꯈꯤ
howl of ordinary terror,ꯑꯔꯗꯤꯅꯥꯔꯤ ꯇꯦꯔꯣꯔꯤꯖꯃꯒꯤ ꯍꯥꯎꯜ .
‘Offer them the flowers and the books again.’,‘ꯃꯈꯣꯌꯗꯥ ꯐꯨꯜ ꯑꯃꯁꯨꯡ ꯂꯥꯏꯔꯤꯀꯁꯤꯡ ꯑꯃꯨꯛ ꯍꯟꯅꯥ ꯄꯤꯌꯨ’꯫
"The nurses obeyed; but at the approach of the roses, at the",ꯅꯔꯁꯁꯤꯡꯅꯥ ꯉꯥꯛꯅꯥ ꯆꯠꯈꯤ;
mere sight of those gaily-coloured images of pussy and cock-a-,ꯁꯨꯞꯅꯒꯤ ꯎꯕꯥ ꯐꯪꯂꯤꯕꯥ ꯑꯗꯨꯒꯨꯝꯂꯕꯥ ꯒꯦꯏꯂꯤ-ꯀꯂꯔ ꯏꯃꯦꯖꯁꯤꯡ ꯑꯗꯨ ꯄꯨꯁꯤ ꯑꯃꯁꯨꯡ ꯀꯣꯛ-ꯑꯦ-
"doodle-doo and baa-baa black sheep, the infants shrank away","ꯗꯨꯗꯜ-ꯗꯨ ꯑꯃꯁꯨꯡ ꯕꯥ-ꯕꯥ-ꯕꯥ ꯕ꯭ꯂꯦꯛ ꯁꯤꯞ, ꯑꯉꯥꯡꯁꯤꯡꯅꯥ ꯂꯥꯟꯊꯣꯀꯈꯤ"
in horror; the volume of their howling suddenly increased,ꯍꯣꯔꯔꯗꯥ;
"‘Observe,’ said the Director triumphantly, ‘observe.’","‘ꯑꯣꯕꯖꯥꯔꯚ’ ꯍꯥꯌꯅꯥ ꯗꯥꯏꯔꯦꯛꯇꯔꯅꯥ ꯃꯥꯏ ꯄꯥꯛꯅꯥ ꯍꯥꯌꯈꯤ, ‘ꯑꯣꯕꯖꯥꯔꯚ’꯫"
"Books and loud noises, flowers and electric shocks—already in","ꯂꯥꯏꯔꯤꯛ ꯑꯃꯁꯨꯡ ꯑꯀꯅꯕꯥ ꯈꯣꯟꯖꯦꯂꯁꯤꯡ, ꯐꯨꯜ ꯑꯃꯁꯨꯡ ꯏꯂꯦꯛꯠꯔꯤꯛ ꯁꯣꯀꯄꯁꯤꯡ—ꯍꯥꯌꯕꯗꯤ ꯍꯥꯟꯅꯅꯥ ."
the infant mind these couples were compromisingly linked; and,ꯏꯅꯐꯦꯟꯇ ꯃꯥꯏꯟꯗ ꯑꯁꯤ ꯃꯄꯨꯔꯣꯏꯕꯁꯤꯡ ꯑꯁꯤꯅꯥ ꯀꯝꯞꯔꯣꯃꯥꯏꯖ ꯑꯣꯏꯅꯥ ꯃꯔꯤ ꯂꯩꯅꯈꯤ;
after two hundred repetitions of the same or a similar lesson,ꯆꯞ ꯃꯥꯟꯅꯕꯥ ꯅꯠꯔꯒꯥ ꯃꯥꯟꯅꯕꯥ ꯂꯥꯏꯁꯣꯟ ꯑꯃꯒꯤ ꯔꯤꯄꯤꯇꯦꯁꯟ ꯂꯤꯁꯤꯡ ꯑꯅꯤꯒꯤ ꯃꯇꯨꯡꯗꯥ .
"would be wedded indissolubly. What man has joined, nature is",ꯌꯥꯝꯅꯥ ꯂꯨꯕꯥ ꯃꯑꯣꯡꯗꯥ ꯂꯨꯍꯣꯡꯒꯅꯤ꯫
powerless to put asunder,ꯄꯥꯋꯔꯂꯦꯁ ꯇꯨ ꯄꯨꯠ ꯑꯦꯁ꯭ꯟꯗꯔ .
‘They’ll grow up with what the psychologists used to call an,‘ꯃꯈꯣꯌꯅꯥ ꯁꯥꯏꯀꯣꯂꯣꯖꯤꯁ꯭ꯇꯁꯤꯡꯅꯥ ꯀꯧꯔꯝꯕꯥ ꯑꯗꯨꯒꯥ ꯂꯣꯌꯅꯅꯥ ꯆꯥꯎꯈꯠꯂꯛꯀꯅꯤ .
“instinctive” hatred of books and flowers. Reflexes unalterably,ꯂꯥꯏꯔꯤꯛ ꯑꯃꯁꯨꯡ ꯐꯨꯂꯁꯤꯡꯒꯤ “ꯏꯟꯁꯇꯤꯠꯌꯨꯁꯅꯦꯜ” ꯌꯦꯛꯅꯕꯥ꯫
conditioned. They’ll be safe from books and botany all their,ꯀꯟꯗꯤꯁꯟ ꯇꯧꯔꯕꯥ꯫
lives.’ The Director turned to his nurses. ‘Take them away again.’,ꯄꯨꯟꯁꯤ꯫’ ꯗꯥꯏꯔꯦꯛꯇꯔꯅꯥ ꯃꯍꯥꯛꯀꯤ ꯅꯔꯁꯁꯤꯡꯗꯥ ꯂꯥꯀꯈꯤ꯫
"Still yelling, the khaki babies were loaded on to their dumb-","ꯍꯧꯖꯤꯀꯁꯨ ꯂꯥꯎꯊꯣꯛꯂꯒꯥ, ꯈꯥꯀꯤ ꯑꯉꯥꯡꯁꯤꯡꯅꯥ ꯃꯈꯣꯌꯒꯤ ꯃꯃꯤꯠꯁꯤꯡ ꯑꯗꯨ ꯂꯣꯗ ꯇꯧꯈꯤ-"
waiters and,ꯑꯣꯌꯦꯇꯔꯁꯤꯡ ꯑꯃꯁꯨꯡ ꯑꯦꯝ.
"wheeled out, leaving behind them the smell of sour milk and a","ꯍꯨꯏꯜ ꯑꯥꯎꯠ, ꯃꯈꯣꯌꯒꯤ ꯃꯇꯨꯡꯗꯥ ꯁꯣꯔ ꯃꯤꯜꯀ ꯑꯃꯁꯨꯡ ꯑꯦ ."
most welcome silence,ꯈ꯭ꯕꯥꯏꯗꯒꯤ ꯇꯔꯥꯝꯅꯥ ꯑꯣꯀꯄꯥ ꯁꯥꯏꯂꯦꯟꯁ
One of the students held up his hand; and though he could see,ꯃꯍꯩꯔꯣꯏ ꯑꯃꯅꯥ ꯃꯍꯥꯛꯀꯤ ꯈꯨꯠ ꯊꯥꯈꯤ;
quite well why you couldn’t have lower-caste people wasting the,ꯌꯥꯝꯅꯥ ꯐꯖꯅꯥ ꯀꯔꯤꯒꯤꯗꯃꯛ ꯑꯗꯣꯝꯅꯥ ꯂꯣꯌꯔꯕꯥ ꯀꯥꯁ꯭ꯠ ꯃꯤꯑꯣꯏꯁꯤꯡꯅꯥ ꯃꯥꯡꯍꯟ ꯇꯥꯀꯍꯅꯈꯤꯗ꯭ꯔꯤꯕꯅꯣ .
26,꯲꯶ ꯑꯃꯁꯨꯡ ꯑꯦꯟ.
"Community’s time over books, and that there was always the","ꯀꯝꯌꯨꯅꯤꯇꯤꯒꯤ ꯂꯥꯏꯔꯤꯀꯁꯤꯡꯒꯤ ꯃꯇꯥꯡꯗꯥ ꯃꯇꯝ, ꯑꯃꯁꯨꯡ ꯃꯇꯝ ꯄꯨꯝꯅꯃꯛꯇꯥ ꯂꯩꯔꯝꯕꯥ ꯑꯗꯨ ."
risk of their reading something which might undesirably de-,ꯃꯈꯣꯌꯅꯥ ꯄꯥꯕꯒꯤ ꯔꯤꯁ꯭ꯛ ꯑꯁꯤ ꯑꯄꯥꯝꯕꯥ ꯃꯑꯣꯡꯗꯥ ꯗꯤ--
"condition one of their reflexes, yet . . . well, he couldn’t","ꯃꯈꯣꯌꯒꯤ ꯔꯤꯐ꯭ꯂꯦꯛꯁꯅꯁꯤꯡꯒꯤ ꯃꯅꯨꯡꯗꯥ ꯑꯃꯥ ꯀꯟꯗꯤꯁꯟ ꯇꯧꯕꯥ, ꯑꯗꯨꯝ ꯑꯣꯏꯅꯃꯛ ."
understand about the flowers. Why go to the trouble of making,ꯐꯨꯂꯒꯤ ꯃꯔꯃꯗꯥ ꯈꯉꯕꯤꯌꯨ꯫
it psychologically impossible for Deltas to like flowers?,ꯗꯦꯜꯇꯥꯁꯤꯡꯅꯥ ꯐꯨꯂꯕꯨ ꯄꯥꯝꯕꯥ ꯑꯁꯤ ꯁꯥꯏꯀꯣꯂꯣꯖꯤꯀꯦꯜ ꯑꯣꯏꯅꯥ ꯑꯣꯏꯊꯣꯀꯄꯥ ꯉꯃꯗꯕꯥ?
Patiently the D.H.C. explained. If the children were made to,ꯄꯦꯁꯦꯟꯇ ꯑꯣꯏꯅꯥ ꯗꯤ.ꯑꯩꯆ.ꯁꯤ.
"scream at the sight of a rose, that was on grounds of high","ꯒꯣꯂꯥꯞ ꯑꯃꯥ ꯎꯕꯗꯥ ꯂꯥꯎꯕꯥ, ꯃꯗꯨ ꯑꯋꯥꯡꯕꯥ ꯃꯐꯃꯗꯥ ꯂꯩꯕꯥ ."
economic policy. Not so very long ago (a century or,ꯏꯀꯣꯅꯣꯃꯤꯛ ꯄꯣꯂꯤꯁꯤ꯫
"thereabouts), Gammas, Deltas, even Epsilons, had been","ꯃꯐꯝ ꯑꯗꯨꯗꯥ), ꯒꯥꯃꯥ, ꯗꯦꯜꯇꯥ, ꯑꯦꯄꯁꯤꯂꯣꯟ ꯐꯥꯑꯣꯕꯥ, ."
conditioned to like flowers—flowers in particular and wild nature,ꯀꯟꯗꯤꯁꯟ ꯇꯧꯔꯕꯥ ꯐꯨꯂꯁꯤꯡ—ꯃꯔꯨꯑꯣꯏꯅꯥ ꯐꯨꯂꯁꯤꯡ ꯑꯃꯁꯨꯡ ꯋꯥꯏꯜꯗ ꯅꯦꯆꯔ
in general. The idea was to make them want to be going out,ꯃꯍꯧꯁꯥꯅꯥ꯫
"into the country at every available opportunity, and so compel","ꯂꯩꯕꯥꯛ ꯑꯁꯤꯗꯥ ꯂꯩꯔꯤꯕꯥ ꯈꯨꯗꯣꯡꯆꯥꯕꯥ ꯈꯨꯗꯤꯡꯃꯛꯇꯥ, ꯑꯃꯁꯨꯡ ꯃꯔꯝ ꯑꯁꯤꯅꯥ ꯀꯝꯄꯤꯜ ꯇꯧꯕꯥ"
them to consume transport,ꯃꯈꯣꯌꯅꯥ ꯇ꯭ꯔꯥꯟꯁꯄꯣꯔꯠ ꯁꯤꯖꯤꯟꯅꯅꯕꯥ .
‘And didn’t they consume transport?’ asked the student. ‘Quite a,‘ꯑꯗꯨꯒꯥ ꯃꯈꯣꯌꯅꯥ ꯇ꯭ꯔꯥꯟꯁꯄꯣꯔꯠ ꯁꯤꯖꯤꯟꯅꯈꯤꯕꯔꯥ?’ ꯃꯍꯩꯔꯣꯌ ꯑꯗꯨꯅꯥ ꯍꯪꯈꯤ꯫
"lot,’ the D.H.C. replied. ‘But nothing else.’","ꯂꯣꯠ,’ ꯗꯤ.ꯑꯩꯆ.ꯁꯤ."
"Primroses and landscapes, he pointed out, have one grave","ꯄ꯭ꯔꯥꯏꯃꯔꯣꯖ ꯑꯃꯁꯨꯡ ꯂꯦꯟꯗꯁ꯭ꯀꯦꯄꯁꯤꯡ, ꯃꯍꯥꯛꯅꯥ ꯄꯅꯈꯤ ꯃꯗꯨꯗꯤ ꯃꯐꯝ ꯑꯃꯥ ꯂꯩ ."
defect: they are gratuitous. A love of nature keeps no factories,ꯑꯁꯣꯌꯕꯥ: ꯃꯈꯣꯌ ꯑꯁꯤ ꯒ꯭ꯔꯦꯇꯨꯏꯠ ꯑꯣꯏ꯫
"busy. It was decided to abolish the love of nature, at any rate",ꯊꯕꯛ ꯆꯤꯟꯕ.
"among the lower classes; to abolish the love of nature, but not",ꯂꯣꯌꯔꯕꯥ ꯀ꯭ꯂꯥꯁꯁꯤꯡꯒꯤ ꯃꯔꯛꯇꯥ;
the tendency to consume transport. For of course it was,ꯇ꯭ꯔꯥꯟꯁꯄꯣꯔꯠ ꯁꯤꯖꯤꯟꯅꯕꯒꯤ ꯇꯦꯟꯗꯦꯟꯁꯤ꯫
"essential that they should keep on going to the country, even","ꯃꯈꯣꯌꯅꯥ ꯂꯩꯕꯥꯛ ꯑꯁꯤꯗꯥ ꯃꯈꯥ ꯇꯥꯅꯥ ꯆꯠꯊꯒꯗꯕꯅꯤ ꯍꯥꯌꯅꯥ ꯇꯉꯥꯏ ꯐꯗꯕꯥ ꯑꯣꯏꯔꯦ, ꯐꯥꯑꯣꯕꯥ"
though they hated it. The problem was to find an economically,ꯃꯈꯣꯌꯅꯥ ꯃꯁꯤꯕꯨ ꯌꯥꯝꯅꯥ ꯂꯥꯡꯇꯛꯅꯔꯕꯁꯨ꯫
sounder reason for consuming transport than a mere affection,ꯁꯨꯞꯅꯒꯤ ꯅꯨꯡꯁꯤꯕꯗꯒꯤ ꯍꯦꯟꯅꯥ ꯇ꯭ꯔꯥꯟꯁꯄꯣꯔꯠ ꯀꯟꯖ꯭ꯌꯨꯝ ꯇꯧꯕꯒꯤ ꯍꯦꯟꯅꯥ ꯋꯥꯡꯕꯥ ꯃꯔꯝ
for primroses and landscapes. It was duly found,ꯄ꯭ꯔꯥꯏꯃꯔꯣꯖ ꯑꯃꯁꯨꯡ ꯂꯦꯟꯗꯁ꯭ꯀꯦꯄꯁꯤꯡꯒꯤꯗꯃꯛ꯫
27,꯲꯷ ꯑꯃꯁꯨꯡ ꯲꯷.
"‘We condition the masses to hate the country,’ concluded the",‘ꯑꯩꯈꯣꯌꯅꯥ ꯂꯩꯕꯥꯛ ꯑꯁꯤꯕꯨ ꯂꯥꯟꯅꯥ ꯂꯃꯖꯤꯡꯅꯕꯥ ꯃꯤꯌꯥꯃꯗꯥ ꯀꯟꯗꯤꯁꯟ ꯄꯤꯔꯤ’ ꯍꯥꯌꯅꯥ ꯂꯣꯏꯁꯤꯅꯈꯤ꯫
Director. ‘But simultaneously we condition them to love all,ꯂꯝꯖꯤꯡ ꯂꯝꯇꯥꯛꯄ ꯃꯤꯑꯣꯏ.
"country sports. At the same time, we see to it that all country",ꯂꯩꯕꯥꯛ ꯑꯁꯤꯒꯤ ꯁꯥꯟꯅꯄꯣꯠꯁꯤꯡ꯫
sports shall entail the use of elaborate apparatus. So that they,ꯁꯥꯟꯅ-ꯈꯣꯠꯅꯕꯗꯥ ꯌꯥꯝꯅꯥ ꯂꯨꯕꯥ ꯑꯦꯄꯥꯔꯇꯃꯦꯟꯇꯁꯤꯡ ꯁꯤꯖꯤꯟꯅꯕꯥ ꯌꯥꯎꯒꯗꯕꯅꯤ꯫
consume manufactured articles as well as transport. Hence,ꯃꯦꯟꯌꯨꯐꯦꯀꯆꯔ ꯇꯧꯔꯕꯥ ꯑꯥꯔꯇꯤꯀꯂꯁꯤꯡꯒꯥ ꯂꯣꯌꯅꯅꯥ ꯇ꯭ꯔꯥꯟꯁꯄꯣꯔꯇꯁꯨ ꯀꯟꯖꯨꯝ ꯇꯧꯕꯥ꯫
those electric shocks.’,ꯑꯗꯨꯒꯨꯝꯕꯥ ꯏꯂꯦꯛꯠꯔꯤꯛ ꯁꯣꯛꯁꯤꯡ ꯑꯗꯨ꯫’
"‘I see,’ said the student, and was silent, lost in admiration","‘ꯑꯩꯅꯥ ꯎꯔꯤ,’ ꯍꯥꯌꯅꯥ ꯃꯍꯩꯔꯣꯌ ꯑꯗꯨꯅꯥ ꯍꯥꯌꯈꯤ, ꯑꯃꯁꯨꯡ ꯇꯞꯅꯥ ꯇꯞꯅꯥ ꯂꯥꯀꯈꯤ, ꯑꯦꯗꯃꯤꯔꯦꯁꯟꯗꯥ ꯃꯥꯡꯈꯤ"
"There was a silence; then, clearing his throat, ‘Once upon a",ꯅꯤꯡꯊꯤꯖꯅꯥ ꯂꯩꯈꯤ;
"time,’ the Director began, ‘while Our Ford was still on earth,","ꯃꯇꯝ,’’ ꯗꯥꯏꯔꯦꯛꯇꯔꯅꯥ ꯍꯧꯗꯣꯀꯈꯤ, ‘ꯑꯩꯈꯣꯌꯒꯤ ꯐꯣꯔꯗ ꯑꯁꯤ ꯍꯧꯖꯤꯀꯁꯨ ꯄ꯭ꯔ꯭ꯏꯊꯤꯕꯤꯗꯥ ꯂꯩꯔꯤ,"
there was a little boy called Reuben Rabinovitch. Reuben was,ꯔꯨꯕꯦꯟ ꯔꯕꯤꯅꯣꯚꯤꯆ ꯀꯧꯕꯥ ꯑꯄꯤꯀꯄꯥ ꯅꯨꯄꯥꯃꯆꯥ ꯑꯃꯥ ꯂꯩꯔꯝꯃꯤ꯫
the child of Polish-speaking parents.’ The Director interrupted,ꯄꯣꯂꯤꯁ ꯂꯣꯜ ꯉꯥꯡꯕꯥ ꯃꯃꯥ-ꯃꯄꯥꯒꯤ ꯃꯆꯥꯅꯤ꯫’ ꯗꯥꯏꯔꯦꯛꯇꯔꯅꯥ ꯋꯥꯍꯪ ꯍꯪꯈꯤ꯫
"himself. ‘You know what Polish is, I suppose?’",ꯃꯁꯥꯃꯛ꯫
‘A dead language.’,‘ꯑꯗꯨꯕꯨ ꯁꯤꯕꯥ ꯌꯥꯕꯥ ꯂꯣꯜ ꯑꯃꯥ’꯫
"‘Like French and German,’ added another student, officiously","‘ꯐ꯭ꯔꯦꯟꯆ ꯑꯃꯁꯨꯡ ꯖꯔꯃꯅꯤꯒꯨꯝꯅꯥ,’ ꯑꯇꯣꯞꯄꯥ ꯃꯍꯩꯔꯣꯌ ꯑꯃꯅꯥ ꯃꯈꯥ ꯇꯥꯅꯥ ꯍꯥꯌꯈꯤ, ꯑꯣꯐꯤꯁꯤꯌꯦꯜ ꯑꯣꯏꯅꯥ"
showing off his learning,ꯃꯍꯥꯛꯀꯤ ꯂꯔꯅꯤꯡ ꯑꯗꯨ ꯎꯠꯄꯥ
‘And “parent?”?’ questioned the D.H.C,‘ꯑꯗꯨꯒꯥ “ꯄꯦꯔꯦꯟꯇ?”?’ ꯍꯥꯌꯅꯥ ꯗꯤ.ꯑꯩꯆ.ꯁꯤ.
There was an uneasy silence. Several of the boys blushed. They,ꯅꯨꯡꯉꯥꯏꯇꯕꯥ ꯋꯥꯐꯝ ꯑꯃꯥ ꯂꯥꯀꯈꯤ꯫
had not yet learned to draw the significant but often very fine,ꯍꯧꯖꯤꯛ ꯐꯥꯑꯣꯕꯥ ꯃꯔꯨ ꯑꯣꯏꯕꯥ ꯑꯗꯨ ꯂꯧꯕꯥ ꯇꯃꯈꯤꯗ꯭ꯔꯤ ꯑꯗꯨꯕꯨ ꯑꯌꯥꯝꯕꯅꯥ ꯌꯥꯝꯅꯥ ꯐꯖꯕꯥ .
"distinction between smut and pure science. One, at last, had the",ꯁ꯭ꯃꯨꯠ ꯑꯃꯁꯨꯡ ꯄ꯭ꯌꯨꯔ ꯁꯥꯏꯟꯁꯀꯤ ꯃꯔꯛꯇꯥ ꯂꯩꯕꯥ ꯈꯦꯠꯅꯕꯥ꯫
courage to raise a hand,ꯈꯨꯠ ꯊꯥꯅꯕꯥ ꯊꯧꯅꯥ ꯐꯕꯥ .
‘Human beings used to be . . .’ he hesitated; the blood rushed to,‘ꯃꯤꯑꯣꯏꯕꯥ ꯖꯤꯕꯁꯤꯡ ꯑꯁꯤ .
"his cheeks. ‘Well, they used to be viviparous.’",ꯃꯍꯥꯛꯀꯤ ꯊꯝꯃꯣꯌꯁꯤꯡ꯫
28,꯲꯸ ꯑꯃꯁꯨꯡ ꯲꯸꯫
‘Quite right.’ The Director nodded approvingly. ‘And when the,‘ꯌꯥꯝꯅꯥ ꯆꯨꯝꯃꯤ꯫’ ꯗꯥꯏꯔꯦꯛꯇꯔꯅꯥ ꯑꯌꯥꯕꯥ ꯄꯤꯔꯒꯥ ꯅꯣꯀꯈꯤ꯫
babies were decanted . . .’,ꯑꯉꯥꯡꯁꯤꯡ ꯑꯗꯨ ꯗꯤꯀꯦꯟꯇꯦꯗ ꯇꯧꯈꯤ .
"‘ “Born”,’ came the correction","‘ “ꯕꯣꯔꯟ”, ’ ꯀꯣꯔꯦꯛꯁꯟ ꯂꯥꯀꯈꯤ ."
"‘Well, then they were the parents—I mean, not the babies, of","‘ꯑꯗꯨꯕꯨ, ꯃꯗꯨꯒꯤ ꯃꯇꯨꯡꯗꯥ ꯃꯈꯣꯌꯅꯥ ꯃꯃꯥ-ꯃꯄꯥ ꯑꯣꯏꯔꯝꯃꯤ—ꯑꯩꯅꯥ ꯍꯥꯌꯕꯗꯤ ꯑꯉꯥꯡꯁꯤꯡ ꯅꯠꯇꯦ,"
course; the other ones.’ The poor boy was overwhelmed with,ꯂꯝꯕꯤ;
confusion,ꯆꯃꯝꯅꯕ
"‘In brief,’ the Director summed up, ‘the parents were the father","‘ꯏꯟ ꯕ꯭ꯔꯤꯐ’, ꯗꯥꯏꯔꯦꯛꯇꯔꯅꯥ ꯋꯥꯐꯝ ꯑꯁꯤ ꯂꯣꯏꯁꯤꯅꯈꯤ, ‘ꯃꯃꯥ-ꯃꯄꯥꯁꯤꯡ ꯑꯁꯤ ꯃꯄꯥ ꯑꯗꯨꯅꯤ"
and the mother.’ The smut that was really science fell with a,ꯑꯃꯁꯨꯡ ꯃꯃꯥ꯫’ ꯇꯁꯦꯡꯅꯥ ꯁꯥꯏꯟꯁ ꯑꯣꯏꯔꯝꯕꯥ ꯁ꯭ꯃꯨꯠ ꯑꯗꯨ ꯑꯃꯒꯥ ꯂꯣꯌꯅꯅꯥ ꯁꯣꯀꯈꯤ꯫
"crash into the boys’ eye- avoiding silence. ‘Mother,’ he repeated",ꯅꯨꯄꯥꯃꯆꯥꯁꯤꯡꯒꯤ ꯃꯤꯠꯇꯥ ꯀ꯭ꯔꯌꯥꯁ ꯇꯧꯕꯥ- ꯇꯞꯅꯥ ꯇꯞꯅꯥ ꯂꯥꯀꯄꯥ꯫
"loudly rubbing in the science; and, leaning back in his chair,",ꯁꯥꯏꯟꯁꯇꯥ ꯌꯥꯝꯅꯥ ꯋꯥꯅꯥ ꯁꯣꯀꯄꯥ;
"‘These,’ he said gravely, ‘are unpleasant facts; I know it. But,","‘ꯃꯈꯣꯌꯁꯤꯡ ꯑꯁꯤ,’ ꯃꯍꯥꯛꯅꯥ ꯌꯥꯝꯅꯥ ꯂꯨꯅꯥ ꯍꯥꯌꯈꯤ, ‘ꯅꯨꯡꯉꯥꯏꯇꯕꯥ ꯋꯥꯐꯃꯁꯤꯡꯅꯤ;"
"then, most historical facts are unpleasant.’","ꯑꯗꯨꯗꯒꯤ, ꯑꯌꯥꯝꯕꯥ ꯄꯨꯋꯥꯔꯤꯒꯤ ꯑꯣꯏꯕꯥ ꯋꯥꯐꯃꯁꯤꯡꯗꯤ ꯅꯨꯡꯉꯥꯏꯇꯕꯥ ꯋꯥꯐꯝꯅꯤ꯫’"
"He returned to Little Reuben—to Little Reuben, in whose room,","ꯃꯍꯥꯛ ꯂꯤꯇꯜ ꯔꯨꯕꯦꯅꯗꯥ ꯍꯜꯂꯀꯈꯤ—ꯃꯈꯣꯌꯒꯤ ꯔꯨꯃꯗꯥ ꯂꯩꯕꯥ ꯂꯤꯇꯜ ꯔꯨꯕꯦꯅꯗꯥ,"
"one evening, by an oversight, his father and mother (crash,","ꯅꯨꯃꯤꯠ ꯑꯃꯗꯥ, ꯑꯣꯚꯔꯁꯥꯏꯠ ꯑꯃꯅꯥ, ꯃꯍꯥꯛꯀꯤ ꯃꯄꯥ ꯑꯃꯁꯨꯡ ꯃꯃꯥ (ꯀ꯭ꯔꯦꯁ, ."
crash!) happened to leave the radio turned on,ꯀ꯭ꯔꯌꯥꯁ!) ꯊꯣꯀꯈꯤꯕꯅꯤ ꯔꯦꯗꯤꯑꯣ ꯊꯥꯗꯨꯅꯥ ꯑꯣꯟꯊꯣꯀꯄꯥ
(‘For you must remember that in those days of gross viviparous,(ꯃꯔꯃꯗꯤ ꯅꯍꯥꯛꯅꯥ ꯅꯤꯡꯁꯤꯡꯒꯗꯕꯅꯤ ꯃꯗꯨꯗꯤ ꯅꯨꯃꯤꯠꯁꯤꯡ ꯑꯗꯨꯗꯥ ꯒ꯭ꯔꯣꯁ ꯚꯤꯚꯤꯄꯦꯔꯥꯁꯀꯤ ꯅꯨꯃꯤꯠꯁꯤꯡ ꯑꯗꯨꯗꯥ .
"reproduction, children were always brought up by their parents","ꯔꯤꯞꯔꯗꯛꯁꯟ, ꯑꯉꯥꯡꯁꯤꯡ ꯑꯁꯤ ꯃꯇꯝ ꯄꯨꯝꯅꯃꯛꯇꯥ ꯃꯈꯣꯌꯒꯤ ꯃꯃꯥ-ꯃꯄꯥꯁꯤꯡꯅꯥ ꯌꯣꯀꯄꯤꯈꯤ"
and not in State Conditioning Centres.’),ꯑꯃꯁꯨꯡ ꯔꯥꯖ꯭ꯌꯒꯤ ꯀꯟꯗꯤꯁꯟ ꯁꯦꯟꯇꯔꯁꯤꯡꯗꯥ ꯅꯠꯇꯦ꯫’)
"While the child was asleep, a broadcast programme from","ꯑꯉꯥꯡ ꯑꯗꯨꯅꯥ ꯇꯨꯝꯂꯤꯉꯩꯗꯥ, ꯕ꯭ꯔꯣꯗꯀꯥꯁ꯭ꯠ ꯄ꯭ꯔꯣꯒ꯭ꯔꯥꯝ ꯑꯃꯥ"
London suddenly started to come through; and the next,ꯂꯟꯗꯟ ꯈꯉꯍꯧꯗꯅꯥ ꯂꯥꯀꯄꯥ ꯍꯧꯔꯀꯈꯤ;
"morning, to the astonishment of his crash and crash (the more","ꯑꯌꯨꯛ, ꯃꯍꯥꯛꯀꯤ ꯀ꯭ꯔꯌꯥꯁ ꯑꯃꯁꯨꯡ ꯀ꯭ꯔꯌꯥꯁꯀꯤ ꯑꯉꯀꯄꯥ ꯃꯑꯣꯡ ꯑꯗꯨꯗꯥ (ꯃꯈꯥ ꯇꯥꯅꯥ ."
daring of the boys ventured to grin at one another) Little,ꯗꯦꯔꯤꯡ ꯑꯣꯐ ꯗ ꯕꯣꯏꯁ ꯚꯦꯟꯆꯔ ꯇꯧꯗꯨꯅꯥ ꯑꯃꯒꯥ ꯑꯃꯒꯥ ꯋꯥꯔꯤ ꯁꯥꯟꯅꯈꯤ) ꯂꯤꯇꯜ
Reuben woke up repeating word for word a long lecture by that,ꯔꯧꯕꯦꯟ ꯋꯥꯀꯦ ꯑꯥꯞ ꯔꯤꯄꯤꯇꯤꯡ ꯋꯥꯔꯗ ꯐꯣꯔ ꯋꯥꯔꯗ ꯑꯃꯥ ꯁꯥꯡꯂꯕꯥ ꯂꯦꯀꯆꯔ ꯑꯃꯥ ꯑꯗꯨꯅꯥ .
curious old writer (‘one of the very few whose works have been,ꯀ꯭ꯌꯨꯔꯤꯌꯁ ꯑꯣꯜꯗ ꯔꯥꯏꯇꯔ (‘ꯑꯗꯨꯒꯤ ꯋꯥꯔꯤꯁꯤꯡ ꯑꯗꯨꯒꯤ ꯃꯅꯨꯡꯗꯥ ꯑꯃꯅꯤ ꯃꯈꯣꯌꯒꯤ ꯋꯥꯔꯤꯁꯤꯡ ꯑꯗꯨ .
"permitted to come down to us’), George Bernard Shaw, who","ꯑꯩꯈꯣꯌꯗꯥ ꯂꯥꯀꯄꯥ ꯑꯌꯥꯕꯥ ꯄꯤꯔꯕꯥ’), ꯖꯔꯖ ꯕꯔꯅꯥꯔꯗ ꯁꯧ, ꯗꯕꯜꯌꯨ.ꯑꯩꯆ.ꯑꯣ."
29,꯲꯹ ꯑꯃꯁꯨꯡ ꯑꯦꯟ.
"was speaking, according to a well- authenticated tradition,","ꯋꯥ ꯉꯥꯡꯂꯝꯃꯤ, ꯌꯥꯝꯅꯥ ꯐꯖꯅꯥ ꯑꯣꯊꯦꯟꯇꯤꯀꯦꯠ ꯇꯧꯔꯕꯥ ꯆꯠꯅꯕꯤ ꯑꯃꯒꯤ ꯃꯇꯨꯡ ꯏꯟꯅꯥ, ."
"about his own genius. To Little Reuben’s wink and snigger, this",ꯃꯍꯥꯛꯀꯤ ꯃꯁꯥꯒꯤ ꯖꯤꯅꯤꯁꯀꯤ ꯃꯇꯥꯡꯗꯥ꯫
"lecture was, of course, perfectly incomprehensible and,","ꯂꯦꯀꯆꯔ ꯑꯁꯤ, ꯇꯁꯦꯡꯅꯥ, ꯃꯄꯨꯡ ꯐꯥꯅꯥ ꯂꯧꯁꯤꯅꯕꯥ ꯉꯃꯗꯕꯥ ꯑꯃꯁꯨꯡ,"
"imagining that their child had suddenly gone mad, they sent for",ꯃꯈꯣꯌꯒꯤ ꯑꯉꯥꯡ ꯑꯗꯨ ꯈꯉꯍꯧꯗꯅꯥ ꯋꯥꯈꯜ ꯋꯥꯕꯥ ꯍꯧꯔꯀꯈꯤ ꯍꯥꯌꯅꯥ ꯏꯃꯥꯖꯤꯅꯦꯁꯟ ꯇꯧꯗꯨꯅꯥ ꯃꯈꯣꯌꯅꯥ ꯊꯥꯔꯀꯈꯤ
"a doctor. He, fortunately, understood English, recognized the",ꯗꯣꯛꯇꯔ ꯑꯃꯥ꯫
discourse as that which Shaw had broadcasted the previous,ꯗꯤꯁ꯭ꯀꯣꯔꯁ ꯑꯦꯖ ꯀꯅꯥꯒꯤ ꯁꯧꯒꯠꯈꯤꯕꯒꯦ ꯍꯥꯌꯕꯗꯨ ꯃꯃꯥꯡꯒꯤ .
"evening, realized the significance of what had happened, and","ꯅꯨꯃꯤꯗꯥꯡꯋꯥꯏꯔꯝ, ꯊꯣꯀꯈꯤꯕꯥ ꯊꯧꯗꯣꯛ ꯑꯗꯨꯒꯤ ꯃꯔꯨꯑꯣꯏꯕꯥ ꯑꯗꯨ ꯈꯉꯂꯀꯈꯤ, ꯑꯃꯁꯨꯡ ."
