en,mni-Mtei
"Atman. He finds that the bliss of the Atman is incomparable, that there is no gain greater than the",ꯑꯥꯠꯃꯥꯟ ꯍꯥꯌꯅꯥ ꯀꯧꯏ꯫
"Self. Having thus attained perfect union with the Self, the Yogi no more descends into ignorance or",ꯝꯁꯥꯒꯤ.
delusion. He does not relish any more the pleasures of the senses,ꯗꯤꯜꯌꯨꯁꯟ ꯇꯧꯕꯥ꯫
Lord Krishna again emphasises that the concentration of the mind on the Atman should be,ꯚꯒꯕꯥꯟ ꯀ꯭ꯔ꯭ꯏꯁ꯭ꯅꯅꯥ ꯑꯃꯨꯛ ꯍꯟꯅꯥ ꯑꯀꯅꯕꯥ ꯋꯥꯐꯝ ꯊꯝꯂꯤ ꯃꯗꯨꯗꯤ ꯑꯠꯃꯥꯅꯗꯥ ꯋꯥꯈꯂꯒꯤ ꯀꯟꯁꯦꯟꯠꯔꯦꯁꯟ ꯑꯁꯤ ꯑꯣꯏꯒꯗꯕꯅꯤ
like a steady flame in a windless place. This ultimately leads to the vision of the Lord in all beings,ꯅꯨꯡꯁꯤꯠ ꯌꯥꯑꯣꯗꯕꯥ ꯃꯐꯝ ꯑꯃꯗꯥ ꯂꯦꯞꯄꯥ ꯂꯩꯇꯅꯥ ꯃꯩꯁꯥꯒꯨꯝꯅꯥ꯫
and creatures. Arjuna is doubtful whether it is at all possible to engage the mind steadily on the,ꯑꯃꯁꯨꯡ ꯖꯤꯕꯁꯤꯡ꯫
"higher Self, as its very nature seems to be one of restlessness. Krishna assures him that the practice","ꯍꯦꯟꯅꯥ ꯋꯥꯡꯕꯥ ꯁꯦꯜꯐ, ꯃꯔꯃꯗꯤ ꯃꯁꯤꯒꯤ ꯃꯑꯣꯡ ꯃꯇꯧ ꯑꯁꯤ ꯋꯥꯈꯜ ꯅꯨꯡꯉꯥꯏꯇꯕꯥ ꯑꯃꯅꯤ ꯍꯥꯌꯅꯥ ꯂꯧꯅꯩ꯫"
can succeed through Vairagya (dispassion) and constant effort,ꯕꯩꯔꯥꯒ꯭ꯌꯥ (ꯗꯤꯁꯄꯦꯁꯟ) ꯑꯃꯁꯨꯡ ꯂꯦꯞꯇꯅꯥ ꯍꯣꯠꯅꯕꯒꯤ ꯈꯨꯠꯊꯥꯡꯗꯥ ꯃꯥꯌ ꯄꯥꯀꯄꯥ ꯉꯃꯒꯅꯤ
Arjuna wishes to know the fate of the aspirant who fails to realise the Supreme in spite of his,ꯑꯔꯖꯨꯟꯅꯥ ꯃꯍꯥꯛꯀꯤ ꯃꯐꯃꯗꯥ ꯁꯨꯞꯔꯤꯝꯕꯔꯕꯨ ꯈꯉꯕꯥ ꯉꯃꯗꯕꯥ ꯑꯦꯁ꯭ꯄꯤꯔꯦꯟꯇ ꯑꯗꯨꯒꯤ ꯚꯥꯒ꯭ꯌ ꯑꯗꯨ ꯈꯉꯕꯥ ꯄꯥꯝꯂꯤ꯫
faith and sincerity. Krishna tells him that the accumulated power of his Yogic practices will assure,ꯊꯥꯖꯕꯥ ꯑꯃꯁꯨꯡ ꯄꯨꯀꯆꯦꯜ ꯁꯦꯡꯕꯥ꯫
"him a better birth in the future, with more favourable conditions for Sadhana. The aspirant will then","ꯃꯍꯥꯀꯄꯨ ꯇꯨꯡꯗꯥ ꯍꯦꯟꯅꯥ ꯐꯕꯥ ꯄꯣꯀꯄꯥ, ꯁꯥꯙꯅꯥꯒꯤꯗꯃꯛ ꯍꯦꯟꯅꯥ ꯐꯕꯥ ꯐꯤꯚꯃꯁꯤꯡ ꯂꯩꯕꯥ꯫"
be compelled to carry on his Yogic practices with greater vigour and faith and will finally achieve,ꯃꯍꯥꯛꯀꯤ ꯌꯣꯒꯒꯤ ꯊꯧꯑꯣꯡꯁꯤꯡ ꯑꯁꯤ ꯍꯦꯟꯅꯥ ꯊꯧꯅꯥ ꯑꯃꯁꯨꯡ ꯊꯥꯖꯕꯒꯥ ꯂꯣꯌꯅꯅꯥ ꯃꯈꯥ ꯆꯠꯊꯅꯕꯥ ꯇꯀꯁꯤꯅꯕꯥ ꯑꯃꯁꯨꯡ ꯑꯔꯣꯏꯕꯗꯥ ꯐꯪꯕꯥ ꯉꯃꯒꯅꯤ
God-realisation,ꯏꯁ꯭ꯕꯔ-ꯔꯤꯑꯦꯂꯥꯏꯖꯦꯁꯟ
Krishna concludes that the Yogi—one who has attained union with the Supreme Lord—is,ꯀ꯭ꯔ꯭ꯏꯁ꯭ꯅꯅꯥ ꯂꯣꯏꯁꯤꯜꯂꯤ ꯃꯗꯨꯗꯤ ꯌꯣꯒꯤ ꯑꯁꯤ – ꯁꯨꯞꯔꯤꯝ ꯂꯔꯗꯅꯒꯥ ꯂꯣꯌꯅꯅꯥ ꯌꯨꯃꯐꯝ ꯑꯣꯏꯕꯥ ꯑꯃꯥ ꯑꯣꯏꯔꯤꯕꯥ ꯑꯁꯤ – ꯑꯁꯤꯅꯤ ꯫
"superior to the ascetics, to the men of book knowledge and the men of action, as the latter have not","ꯇꯄꯁ꯭ꯌꯥ ꯇꯧꯕꯁꯤꯡꯗꯒꯤ ꯍꯦꯟꯅꯥ ꯐꯕꯥ, ꯂꯥꯏꯔꯤꯛ ꯖ꯭ꯅꯥꯅꯒꯤ ꯃꯤꯑꯣꯏꯁꯤꯡ ꯑꯃꯁꯨꯡ ꯊꯕꯛ ꯇꯧꯕꯒꯤ ꯃꯤꯑꯣꯏꯁꯤꯡ ꯐꯥꯑꯣꯕꯥ, ꯃꯔꯃꯗꯤ ꯇꯨꯡꯗꯥ ꯂꯥꯀꯄꯥ ꯃꯤꯑꯣꯏꯁꯤꯡꯅꯥ ."
transcended ignorance and merged in the Self,ꯇ꯭ꯔꯥꯟꯁꯦꯟꯗ ꯏꯒꯅꯣꯔꯦꯟꯁ ꯑꯃꯁꯨꯡ ꯃꯁꯥꯗꯥ ꯃꯔꯤ ꯂꯩꯅꯍꯅꯕꯥ .
Sri Bhagavaan Uvaacha:,ꯁ꯭ꯔꯤ ꯚꯒꯕꯥꯟ ꯎꯋꯥꯆ꯭ꯌꯥ:
Anaashritah karmaphalam kaaryam karma karoti yah;,ꯑꯅꯥꯁ꯭ꯔꯥꯏꯇꯥꯍ ꯀꯔꯃꯐꯂꯝ ꯀꯔꯝ ꯀꯔꯝ ꯀꯔꯣꯇꯤ ꯌꯥꯍ;
Sa sannyaasi cha yogee cha na niragnirna chaakriyah,ꯁꯥ ꯁꯟꯟꯌꯥꯁꯤ ꯆꯥ ꯌꯣꯒꯤ ꯆꯥ ꯅꯥ ꯅꯤꯔꯥꯒ꯭ꯅꯤꯅꯥ ꯆꯥꯀꯔꯤꯌꯍ
The Blessed Lord said:,ꯊꯧꯖꯥꯜ ꯍꯩꯕꯥ ꯃꯄꯨꯅꯥ ꯍꯥꯌꯈꯤ:
1. He who performs his bounden duty without depending on the fruits of his actions—he is a,1. ꯃꯍꯥꯛꯀꯤ ꯊꯕꯀꯁꯤꯡꯒꯤ ꯃꯍꯩ ꯃꯔꯣꯡꯁꯤꯡꯒꯤ ꯃꯈꯥ ꯄꯣꯟꯅꯥ ꯃꯍꯥꯛꯀꯤ ꯕꯣꯎꯟꯗ ꯗ꯭ꯌꯨꯇꯤ ꯄꯥꯡꯊꯣꯀꯄꯥ ꯃꯤꯑꯣꯏ ꯑꯗꯨ—ꯃꯍꯥꯛ ꯑꯁꯤꯅꯤ
"Sannyasin and a Yogi, not he who is without fire and without action","ꯁꯟꯟꯌꯥꯁꯤꯟ ꯑꯃꯁꯨꯡ ꯌꯣꯒꯤ ꯑꯃꯥ, ꯃꯩ ꯌꯥꯑꯣꯗꯅꯥ ꯑꯃꯁꯨꯡ ꯑꯦꯛꯁꯟ ꯌꯥꯑꯣꯗꯅꯥ ꯂꯩꯕꯥ ꯃꯍꯥꯛ ꯑꯗꯨ ꯅꯠꯇꯦ꯫"
Yam sannyaasamiti praahuryogam tam viddhi paandava;,ꯌꯥꯝ ꯁꯟꯟꯌꯥꯁꯃꯤꯇꯤ ꯄ꯭ꯔꯍꯨꯔꯌꯣꯒꯝ ꯇꯥꯝ ꯕꯤꯗ꯭ꯙꯤ ꯄꯌꯥꯟꯗꯕ;
Na hyasannyastasankalpo yogee bhavati kashchana,ꯅꯥ ꯍ꯭ꯌꯥꯁꯥꯟꯅꯤꯌꯥꯁ꯭ꯇꯥꯁꯅꯀꯂꯄꯣ ꯌꯣꯒꯤ ꯚꯕꯇꯤ ꯀꯁ꯭ꯆꯅꯥ
52,꯵꯲ ꯑꯃꯁꯨꯡ ꯑꯦꯟ.
THE YOGA OF MEDITATION,ꯃꯦꯗꯤꯇꯦꯁꯅꯒꯤ ꯌꯣꯒ .
"2. Do thou, O Arjuna, know Yoga to be that which they call renunciation; no one verily","2. ꯅꯍꯥꯛꯅꯥ, ꯍꯦ ꯑꯔꯖꯨꯟ, ꯌꯣꯒꯕꯨ ꯃꯈꯣꯌꯅꯥ ꯔꯤꯟꯌꯨꯁꯟ ꯍꯥꯌꯅꯥ ꯀꯧꯕꯥ ꯑꯗꯨꯅꯤ ꯍꯥꯌꯅꯥ ꯈꯉꯕꯤꯌꯨ;"
becomes a Yogi who has not renounced thoughts!,ꯋꯥꯈꯜ ꯊꯥꯗꯣꯀꯄꯥ ꯉꯃꯗꯕꯥ ꯌꯣꯒꯤ ꯑꯃꯥ ꯑꯣꯏꯔꯀꯏ!
COMMENTARY: Lord Krishna eulogises Karma Yoga here because it is a means or a,ꯀꯃꯦꯟꯇꯔꯤ: ꯚꯒꯕꯥꯟ ꯀ꯭ꯔ꯭ꯏꯁ꯭ꯅꯅꯥ ꯃꯐꯝ ꯑꯁꯤꯗꯥ ꯀꯔꯝ ꯌꯣꯒꯕꯨ ꯏꯎꯂꯣꯒ ꯇꯧꯏ ꯃꯔꯃꯗꯤ ꯃꯁꯤ ꯄꯥꯝꯕꯩ ꯑꯃꯅꯤ ꯅꯠꯔꯒꯥ ꯑꯦ .
stepping stone to the Yoga of meditation. In order to encourage the practice of Karma Yoga it is,ꯃꯦꯗꯤꯇꯦꯁꯅꯒꯤ ꯌꯣꯒꯗꯥ ꯈꯣꯡ ꯊꯥꯡꯖꯤꯅꯕꯥ꯫
stated here that it is Sannyasa,ꯃꯐꯝ ꯑꯁꯤꯗꯥ ꯍꯥꯌꯈꯤ ꯃꯗꯨꯗꯤ ꯃꯁꯤ ꯁꯟꯟꯌꯥꯁꯥꯅꯤ .
Aarurukshormuneryogam karma kaaranamuchyate;,aarurukshormuneryogam ꯀꯔꯝ ꯀꯥꯔꯥꯅꯥꯃꯨꯆ꯭ꯌꯥꯇꯦ;
Yogaaroodhasya tasyaiva shamah kaaranamuchyate,ꯌꯣꯒꯌꯥꯔꯨꯗꯁ꯭ꯌ ꯇꯥꯁ꯭ꯌꯚꯥ ꯁꯥꯃꯥꯍ ꯀꯥꯔꯥꯅꯥꯃꯨꯆ꯭ꯌꯥꯇꯦ
"3. For a sage who wishes to attain to Yoga, action is said to be the means; for the same sage","3. ꯌꯣꯒ ꯇꯧꯕꯥ ꯄꯥꯝꯕꯥ ꯔ꯭ꯏꯁꯤ ꯑꯃꯒꯤꯗꯃꯛ, ꯊꯕꯛ ꯑꯁꯤ ꯄꯥꯝꯕꯩꯅꯤ ꯍꯥꯌꯅꯥ ꯍꯥꯌꯅꯩ;"
"who has attained to Yoga, inaction (quiescence) is said to be the means",ꯌꯣꯒꯒꯥ ꯃꯔꯤ ꯂꯩꯅꯕꯥ ꯃꯤꯑꯣꯏ ꯑꯃꯥ ꯑꯣꯏꯔꯤꯕꯥ ꯏꯅꯑꯦꯛꯁꯟ (ꯀ꯭ꯕꯥꯁ) ꯑꯁꯤ ꯄꯥꯝꯕꯩꯅꯤ ꯍꯥꯌꯅꯥ ꯍꯥꯌꯔꯤ꯫
Yadaa hi nendriyaartheshu na karmaswanushajjate;,ꯌꯥꯗꯥ ꯍꯤ ꯅꯦꯟꯗ꯭ꯔꯤꯌꯥꯑꯥꯔꯊꯦꯁꯨ ꯅꯥ ꯀꯔꯃꯁ꯭ꯕꯟꯌꯨꯁꯖꯖꯇꯦ;
Sarvasankalpasannyaasee yogaaroodhas tadochyate,ꯁꯔꯚꯥꯁꯅꯀꯂꯄꯥꯁꯥꯅꯟꯌꯌꯥꯁꯦ ꯌꯣꯒꯥꯔꯣꯗꯁ ꯇꯥꯗꯣꯆ꯭ꯌꯥꯇꯦ
"4. When a man is not attached to the sense-objects or to actions, having renounced all","꯴.ꯅꯨꯄꯥ ꯑꯃꯅꯥ ꯁꯦꯟꯁ-ꯑꯣꯕꯖꯦꯛꯇꯁꯤꯡ ꯅꯠꯔꯒꯥ ꯑꯦꯛꯁꯅꯁꯤꯡꯗꯥ ꯌꯥꯑꯣꯗꯕꯥ ꯃꯇꯃꯗꯥ, ꯄꯨꯝꯅꯃꯛ ꯊꯥꯗꯣꯛꯂꯕꯥ ꯃꯇꯨꯡꯗꯥ ."
"thoughts, then he is said to have attained to Yoga","ꯋꯥꯈꯜꯂꯣꯅꯁꯤꯡ, ꯃꯗꯨꯒꯤ ꯃꯇꯨꯡꯗꯥ ꯃꯍꯥꯛꯅꯥ ꯌꯣꯒ ꯇꯧꯕꯥ ꯉꯃꯈꯤ ꯍꯥꯌꯅꯥ ꯍꯥꯌꯅꯩ ."
Uddharedaatmanaatmaanam naatmaanamavasaadayet;,ꯎꯗ꯭ꯙꯦꯔꯗꯥꯇꯃꯅꯃꯅꯃꯅꯝ ꯅꯥꯇꯃꯥꯅꯥꯃꯥꯚꯥꯁꯥꯗꯌꯠ;
Atmaiva hyaatmano bandhuraatmaiva ripuraatmanah,ꯑꯠꯃꯥꯏꯚꯥ ꯍꯤꯌꯥꯇꯃꯥꯅꯣ ꯕꯟꯙꯨꯔꯥꯇꯃꯥꯏꯚꯥ ꯔꯤꯄꯨꯔꯥꯇꯃꯥꯅꯥꯍ
"5. Let a man lift himself by his own Self alone; let him not lower himself, for this self alone",5. ꯃꯤꯑꯣꯏ ꯑꯃꯅꯥ ꯃꯁꯥꯃꯀꯄꯨ ꯃꯁꯥꯅꯥ ꯃꯁꯥꯕꯨ ꯂꯧꯊꯣꯀꯆꯕꯥ ꯉꯃꯖꯒꯗꯕꯅꯤ;
is the friend of oneself and this self alone is the enemy of oneself,ꯑꯁꯤ ꯃꯁꯥꯒꯤ ꯃꯔꯨꯄꯅꯤ ꯑꯃꯁꯨꯡ ꯃꯁꯤꯒꯤ ꯃꯁꯥꯒꯤ ꯑꯣꯏꯖꯕꯥ ꯑꯁꯤ ꯈꯛꯇꯅꯥ ꯃꯁꯥꯒꯤ ꯑꯣꯏꯕꯥ ꯌꯦꯛꯅꯕꯥ ꯑꯣꯏꯔꯤ .
Bandhuraatmaa’tmanastasya yenaatmaivaatmanaa jitah;,ꯕꯟꯙꯨꯔꯥꯇꯃꯥ’ꯇꯃꯅꯁ꯭ꯇꯁ꯭ꯌ ꯌꯦꯅꯇꯃꯩꯚꯥꯇꯃꯥꯅꯥꯍ ꯖꯤꯇꯥꯍ;
Anaatmanastu shatrutwe vartetaatmaiva shatruvat,ꯑꯅꯥꯇꯃꯥꯅꯥꯁ꯭ꯇꯨ ꯁꯥꯠꯔꯨꯠꯋꯦ ꯕꯔꯇꯦꯇꯥꯇꯃꯩꯕꯥ ꯁꯔꯨꯕꯠ
"6. The self is the friend of the self for him who has conquered himself by the Self, but to the","6. ꯃꯁꯥꯅꯥ ꯃꯁꯥꯕꯨ ꯃꯥꯌꯊꯤꯕꯥ ꯄꯤꯖꯈꯤꯕꯥ ꯃꯍꯥꯛꯀꯤꯗꯃꯛ ꯃꯁꯥꯒꯤ ꯃꯔꯨꯞ ꯑꯗꯨꯅꯤ, ꯑꯗꯨꯕꯨ ."
"unconquered self, this self stands in the position of an enemy like the (external) foe","ꯃꯥꯌꯊꯣꯡ ꯌꯥꯑꯣꯗꯕꯥ ꯁꯦꯜꯐ, ꯃꯁꯤꯒꯤ ꯁꯦꯜꯐ ꯑꯁꯤꯅꯥ (ꯃꯄꯥꯅꯒꯤ) ꯌꯦꯛꯅꯕꯥ ꯑꯃꯒꯤ ꯃꯐꯃꯗꯥ ꯂꯦꯞꯂꯤ"
Jitaatmanah prashaantasya paramaatmaa samaahitah;,ꯖꯤꯇꯥꯇꯃꯥꯅꯥꯍ ꯄ꯭ꯔꯁꯥꯟꯇꯁ꯭ꯌ ꯄꯔꯃꯥꯇꯃꯥ ꯁꯃꯥꯍꯤꯇꯥꯍ;
Sheetoshna sukha duhkheshu tathaa maanaapamaanayoh,ꯁꯤꯇꯣꯁ꯭ꯅꯥ ꯁꯨꯈꯥ ꯗꯨꯍꯈꯁꯨꯁꯨ ꯇꯥꯊꯥꯑꯥ ꯃꯅꯥꯄꯥꯃꯥꯅꯥꯌꯍ
"7. The Supreme Self of him who is self-controlled and peaceful is balanced in cold and heat,","7. ꯃꯁꯥꯅꯥ ꯃꯁꯥꯕꯨ ꯉꯥꯀꯊꯣꯀꯆꯕꯥ ꯑꯃꯁꯨꯡ ꯁꯥꯟꯇꯤ ꯂꯩꯕꯥ ꯃꯤꯑꯣꯏ ꯑꯗꯨꯒꯤ ꯈ꯭ꯕꯥꯏꯗꯒꯤ ꯋꯥꯡꯕꯥ ꯁꯦꯜꯐ ꯑꯗꯨ ꯀꯣꯜꯗ ꯑꯃꯁꯨꯡ ꯍꯤꯇꯇꯥ ꯕꯦꯂꯦꯟꯁ ꯑꯣꯏ,"
"pleasure and pain, as also in honour and dishonour","ꯅꯨꯡꯉꯥꯏꯕꯥ ꯑꯃꯁꯨꯡ ꯑꯋꯥꯕꯥ, ꯃꯁꯤꯒꯥ ꯂꯣꯌꯅꯅꯥ ꯏꯀꯥꯌ ꯈꯨꯝꯅꯕꯥ ꯑꯃꯁꯨꯡ ꯏꯀꯥꯌꯈꯨꯝꯅꯕꯥ ꯑꯣꯏꯅꯥ ."
Jnaana vijnaana triptaatmaa kootastho vijitendriyah;,ꯖ꯭ꯅꯥꯅꯥ ꯕꯤꯖꯅꯥꯅꯥ ꯇ꯭ꯔꯤꯇꯥꯇꯃꯥ ꯀꯨꯇꯥꯁ꯭ꯇꯣ ꯚꯤꯖꯤꯇꯦꯟꯗ꯭ꯔꯤꯌꯥꯍ;
Yuktah ityuchyate yogee samaloshtaashmakaanchanah,ꯌꯨꯛꯇꯥꯍ ꯏꯇꯤꯎꯆꯤꯌꯥꯇꯦ ꯌꯣꯒꯤ ꯁꯃꯥꯂꯣꯁꯇꯥꯁꯃꯥꯀꯥꯅꯆꯥꯅꯍ
"8. The Yogi who is satisfied with the knowledge and the wisdom (of the Self), who has",8. ꯂꯧꯁꯤꯡ ꯑꯃꯁꯨꯡ ꯂꯧꯁꯤꯡ (ꯃꯁꯥꯒꯤ)ꯗꯥ ꯅꯨꯡꯉꯥꯏꯕꯥ ꯄꯣꯀꯄꯥ ꯌꯣꯒꯤ
"conquered the senses, and to whom a clod of earth, a piece of stone and gold are the same, is said to","ꯏꯟꯗ꯭ꯔꯤꯁꯤꯡ ꯑꯁꯤ ꯃꯥꯏꯊꯤꯕꯥ ꯄꯤꯈꯤ, ꯑꯃꯁꯨꯡ ꯀꯅꯥꯒꯤꯗꯃꯛ ꯄ꯭ꯔ꯭ꯏꯊꯤꯕꯤꯒꯤ ꯀ꯭ꯂꯣꯗ ꯑꯃꯥ, ꯁꯤꯜ ꯑꯃꯗꯤ ꯁꯅꯥꯒꯤ ꯄꯣꯠꯁꯛ ꯑꯃꯅꯥ ꯑꯃꯒꯥ ꯑꯃꯒꯥ ꯃꯥꯟꯅꯩ ꯍꯥꯌꯅꯥ ꯍꯥꯌꯔꯤ꯫"
"be harmonised (that is, is said to have attained the state of Nirvikalpa Samadhi)","be ꯍꯥꯔꯃꯣꯅꯤꯖ (ꯑꯗꯨꯗꯤ, ꯅꯤꯔꯚꯤꯀꯂꯄꯥ ꯁꯃꯥꯙꯤꯒꯤ ꯐꯤꯚꯝ ꯐꯪꯂꯦ ꯍꯥꯌꯅꯥ ꯍꯥꯌꯅꯩ)꯫"
Suhrinmitraary udaaseena madhyastha dweshya bandhushu;,ꯁꯨꯍꯔꯤꯅꯃꯤꯠꯔꯥꯔꯤ ꯎꯗꯥꯁꯦꯅꯥ ꯃꯙ꯭ꯙ ꯗ꯭ꯕꯦꯁ꯭ꯌ ꯕꯟꯙꯨꯁꯨ;
Saadhushwapi cha paapeshu samabuddhirvishishyate,ꯁꯥꯙꯨꯁ꯭ꯕꯄꯤ ꯆꯥ ꯄꯥꯌꯥꯄꯦꯁꯨ ꯁꯃꯕꯨꯗ꯭ꯙꯤꯔꯕꯤꯁꯤꯁ꯭ꯌꯇꯦ
53,꯵꯳ ꯑꯃꯁꯨꯡ ꯑꯦꯟ.
BHAGAVAD GITA,ꯚꯒꯕꯠ ꯒꯤꯇꯥ
"9. He who is of the same mind to the good-hearted, friends, enemies, the indifferent, the","꯹.ꯑꯐꯕꯥ ꯊꯝꯃꯣꯌ, ꯃꯔꯨꯄꯁꯤꯡ, ꯌꯦꯛꯅꯕꯥ, ꯃꯤꯅꯨꯡꯁꯤ ꯂꯩꯠꯔꯕꯥ ꯃꯤꯑꯣꯏꯁꯤꯡꯒꯥ ꯆꯞ ꯃꯥꯟꯅꯕꯥ ꯋꯥꯈꯜ ꯂꯩꯕꯥ ꯃꯤꯑꯣꯏ꯫"
"neutral, the hateful, the relatives, the righteous and the unrighteous, excels","ꯅ꯭ꯌꯨꯠꯔꯤꯜ, ꯍꯦꯇꯦꯐꯨꯜ, ꯃꯔꯤ-ꯃꯇꯥꯁꯤꯡ, ꯔꯥꯏꯇꯁ ꯑꯃꯁꯨꯡ ꯑꯅꯔꯥꯏꯠ, ꯑꯦꯛꯁꯦꯂꯁꯤꯡ"
Yogee yunjeeta satatamaatmaanam rahasi sthitah;,ꯌꯣꯒꯤ ꯌꯨꯟꯖꯤꯠ ꯁꯇꯇꯃꯥꯇꯃꯥꯅꯝ ꯔꯍꯁꯤ ꯁ꯭ꯊꯤꯇꯥꯍ;
"10. Let the Yogi try constantly to keep the mind steady, remaining in solitude, alone, with","10. ꯌꯣꯒꯤꯅꯥ ꯋꯥꯈꯜ ꯑꯁꯤ ꯂꯦꯞꯄꯥ ꯂꯩꯇꯅꯥ ꯍꯣꯠꯅꯕꯤꯌꯨ, ꯁꯣꯂꯤꯠꯌꯨꯁꯟꯗꯥ ꯂꯩꯗꯨꯅꯥ, ꯃꯁꯥ ꯃꯊꯟꯇꯥ,"
"the mind and the body controlled, and free from hope and greed","ꯋꯥꯈꯜ ꯑꯃꯁꯨꯡ ꯍꯀꯆꯥꯡꯅꯥ ꯀꯟꯠꯔꯣꯜ ꯇꯧꯕꯥ, ꯑꯃꯁꯨꯡ ꯑꯥꯁꯥ ꯑꯃꯁꯨꯡ ꯂꯣꯚꯤꯗꯒꯤ ꯐ꯭ꯔꯤ ꯑꯣꯏꯕꯥ ."
Shuchau deshe pratishthaapya sthiramaasanamaatmanah;,ꯁꯨꯆꯧ ꯗꯦꯁꯦ ꯄ꯭ꯔꯇꯤꯁ꯭ꯊꯥꯞꯌ ꯁ꯭ꯊꯤꯔꯥꯃꯥꯁꯅꯃꯇꯃꯥꯅꯍ;
Naatyucchritam naatineecham chailaajinakushottaram,ꯅꯥꯇ꯭ꯌꯨꯛꯆꯔꯇꯥꯝ ꯅꯥꯇꯤꯅꯤꯑꯦꯆꯝ ꯆꯩꯂꯥꯖꯤꯅꯥꯀꯨꯁꯣꯠꯇꯥꯔꯝ
"11. In a clean spot, having established a firm seat of his own, neither too high nor too low,","11. ꯁꯦꯡꯂꯕꯥ ꯃꯐꯝ ꯑꯃꯗꯥ, ꯃꯁꯥꯒꯤ ꯑꯣꯏꯕꯥ ꯑꯆꯦꯠꯄꯥ ꯐꯃꯐꯝ ꯑꯃꯥ ꯂꯤꯡꯈꯠꯂꯕꯥ, ꯌꯥꯝꯅꯥ ꯋꯥꯡꯅꯥ ꯅꯠꯔꯒꯥ ꯌꯥꯝꯅꯥ ꯅꯦꯝꯕꯥ,"
"made of a cloth, a skin and kusha grass, one over the other,","ꯐꯤ ꯑꯃꯅꯥ ꯁꯦꯝꯕꯥ, ꯈꯣꯡ ꯑꯃꯁꯨꯡ ꯀꯨꯁꯥ ꯃꯍꯩ ꯃꯔꯣꯡ, ꯑꯃꯅꯥ ꯑꯃꯒꯤ ꯃꯊꯛꯇꯥ,"
Tatraikaagram manah kritwaa yatachittendriyakriyah;,ꯇꯥꯠꯔꯥꯏꯀꯥꯑꯒ꯭ꯔꯥꯝ ꯃꯅꯥꯅꯥꯍ ꯀ꯭ꯔ꯭ꯏꯠꯋꯥꯌꯥ ꯌꯥꯇꯥꯆꯤꯇꯦꯟꯗ꯭ꯔꯤꯌꯀꯔꯤꯌꯍ;
Upavishyaasane yunjyaadyogamaatmavishuddhaye,ꯎꯄꯚꯤꯁ꯭ꯌꯥꯁꯥꯟ ꯌꯨꯡꯖꯌꯗꯌꯣꯒꯃꯥꯇꯃꯥꯚꯤꯁꯨꯗ꯭ꯙꯌꯦ
"12. There, having made the mind one-pointed, with the actions of the mind and the senses","12. ꯃꯐꯝ ꯑꯗꯨꯗꯥ, ꯋꯥꯈꯜ ꯑꯗꯨ ꯋꯥꯟ-ꯄꯣꯏꯟꯇ ꯇꯧꯔꯕꯥ ꯃꯇꯨꯡꯗꯥ, ꯋꯥꯈꯂꯒꯤ ꯊꯕꯀꯁꯤꯡꯒꯥ ꯂꯣꯌꯅꯅꯥ ꯑꯃꯁꯨꯡ ꯁꯦꯟꯁꯁꯤꯡꯒꯥ ꯂꯣꯌꯅꯅꯥ ."
"controlled, let him, seated on the seat, practise Yoga for the purification of the self","ꯀꯟꯠꯔꯣꯜ ꯇꯧꯕꯥ, ꯃꯍꯥꯀꯄꯨ, ꯁꯤꯠꯇꯥ ꯐꯃꯗꯨꯅꯥ ꯂꯩꯕꯥ, ꯁꯦꯜꯐꯀꯤ ꯁꯨꯡꯗꯣꯛꯅꯕꯒꯤꯗꯃꯛ ꯌꯣꯒ ꯇꯧꯕꯥ"
Samam kaayashirogreevam dhaarayannachalam sthirah;,ꯁꯃꯝ ꯀꯥꯌꯥꯁꯤꯔꯣꯒ꯭ꯔꯤꯚꯝ ꯙꯥꯔꯥꯌꯅꯆꯂꯝ ꯁ꯭ꯊꯤꯔꯥꯍ;
Samprekshya naasikaagram swam dishashchaanavalokayan,ꯁꯥꯝꯞꯔꯦꯛꯁ꯭ꯌꯥ ꯅꯥꯁꯤꯀꯥꯑꯒ꯭ꯔꯥꯝ ꯁ꯭ꯕꯥꯝ ꯗꯤꯁꯁꯆ꯭ꯆꯅꯚꯥꯂꯣꯀꯥꯌꯥꯟ
"13. Let him firmly hold his body, head and neck erect and perfectly still, gazing at the tip of","13. ꯃꯍꯥꯛꯅꯥ ꯃꯍꯥꯛꯀꯤ ꯍꯀꯆꯥꯡ, ꯃꯀꯣꯛ ꯑꯃꯁꯨꯡ ꯃꯊꯛ ꯊꯪꯕꯥ ꯁꯔꯨꯛꯇꯥ ꯆꯦꯠꯅꯥ ꯆꯦꯠꯅꯥ ꯊꯃꯒꯗꯕꯅꯤ ꯑꯃꯁꯨꯡ ꯃꯄꯨꯡ ꯐꯥꯅꯥ ꯂꯦꯡꯗꯅꯥ ꯂꯩꯍꯜꯂꯨ, ."
"his nose, without looking around","ꯃꯍꯥꯛꯀꯤ ꯅꯥꯀꯣꯡ, ꯑꯀꯣꯌꯕꯗꯥ ꯌꯦꯡꯗꯅꯥ ."
Prashaantaatmaa vigatabheer brahmachaarivrate sthitah;,ꯄ꯭ꯔꯁꯥꯅꯇꯥꯇꯃꯥ ꯚꯤꯒꯥꯇꯥꯚꯤꯔ ꯕ꯭ꯔꯍ꯭ꯃꯆꯥꯔꯤꯚꯠ ꯁ꯭ꯊꯤꯇꯥꯍ;
Manah samyamya macchitto yukta aaseeta matparah,ꯃꯅꯍ ꯁꯝꯌꯝꯌ ꯃꯆꯤꯠꯇꯣ ꯌꯨꯛꯇ ꯑꯥꯁꯤꯇꯥ ꯃꯠꯄꯥꯔꯥꯍ
"14. Serene-minded, fearless, firm in the vow of a Brahmachari, having controlled the mind,","14. ꯋꯥꯈꯜ ꯀꯟꯠꯔꯣꯜ ꯇꯧꯔꯕꯥ ꯕ꯭ꯔꯍ꯭ꯃꯆꯔꯤ ꯑꯃꯒꯤ ꯋꯥꯁꯛ ꯑꯗꯨꯗꯥ ꯁꯦꯔꯤꯟ-ꯃꯥꯏꯟꯗ, ꯐꯤꯌꯥꯔꯂꯦꯁ, ꯐꯔꯝ, ꯋꯥꯈꯂꯕꯨ ꯀꯟꯠꯔꯣꯜ ꯇꯧꯗꯨꯅꯥ,"
"thinking of Me and balanced in mind, let him sit, having Me as his supreme goal","ꯑꯩꯒꯤ ꯋꯥꯈꯜ ꯈꯅꯕꯥ ꯑꯃꯁꯨꯡ ꯋꯥꯈꯂꯗꯥ ꯕꯦꯂꯦꯟꯁ ꯇꯧꯕꯥ, ꯃꯍꯥꯀꯄꯨ ꯐꯃꯍꯅꯕꯥ, ꯑꯩꯕꯨ ꯃꯍꯥꯛꯀꯤ ꯈ꯭ꯕꯥꯏꯗꯒꯤ ꯋꯥꯡꯕꯥ ꯄꯥꯟꯗꯝ ꯑꯣꯏꯅꯥ ꯂꯧꯕꯥ"
Yunjannevam sadaa’tmaanam yogee niyatamaanasah;,ꯌꯨꯅꯖꯥꯅꯦꯚꯥꯝ ꯁꯥꯗꯥꯑꯥ’ꯇꯃꯅꯝ ꯌꯣꯒꯤ ꯅꯤꯌꯇꯃꯥꯅꯥꯁꯥꯍ;
Shaantim nirvaanaparamaam matsamsthaamadhigacchati,ꯁꯟꯇꯝ ꯅꯤꯔꯕꯥꯅꯄꯔꯥꯃꯥꯝ ꯃꯠꯁꯃꯁ꯭ꯊꯥꯃꯙꯤꯒꯆ꯭ꯆꯇꯤ
"15. Thus, always keeping the mind balanced, the Yogi, with the mind controlled, attains to","15. ꯑꯁꯨꯝꯅꯥ, ꯃꯇꯝ ꯄꯨꯝꯅꯃꯛꯇꯥ ꯋꯥꯈꯜ ꯑꯗꯨ ꯕꯦꯂꯦꯟꯁ ꯑꯣꯏꯅꯥ ꯊꯃꯗꯨꯅꯥ, ꯌꯣꯒꯤ, ꯋꯥꯈꯜ ꯀꯟꯠꯔꯣꯜ ꯇꯧꯗꯨꯅꯥ,"
"the peace abiding in Me, which culminates in liberation","ꯑꯩꯉꯣꯟꯗꯥ ꯂꯩꯔꯤꯕꯥ ꯁꯥꯟꯇꯤ ꯑꯗꯨ, ꯃꯗꯨ ꯂꯤꯕꯔꯦꯁꯟꯗꯥ ꯃꯄꯨꯡ ꯐꯥꯍꯜꯂꯤ ."
Naatyashnatastu yogo’sti nachaikaantamanashnatah;,ꯅꯥꯇꯌꯥꯁ꯭ꯅꯥꯇꯥꯁ꯭ꯇꯨ ꯌꯣꯒꯣ’ꯁ꯭ꯇꯤ ꯅꯥꯆꯥꯏꯀꯥꯟꯇꯃꯅꯁꯅꯇꯥꯍ;
Na chaatiswapnasheelasya jaagrato naiva chaarjuna,ꯅꯥ ꯆꯥꯇꯤꯁꯋꯥꯄꯅꯁꯦꯂꯁ꯭ꯌꯥ ꯖꯥꯒ꯭ꯔꯥꯇꯣ ꯅꯥꯏꯕꯥ ꯆꯌꯥꯔꯖꯨꯅꯥ
"16. Verily Yoga is not possible for him who eats too much, nor for him who does not eat at","16. ꯇꯁꯦꯡꯅꯥ ꯌꯣꯒ ꯑꯁꯤ ꯌꯥꯝꯅꯥ ꯆꯥꯔꯤꯕꯥ ꯃꯤꯑꯣꯏ ꯑꯗꯨꯒꯤꯗꯃꯛ, ꯅꯠꯔꯒꯥ ꯆꯥꯗꯕꯥ ꯃꯤꯑꯣꯏ ꯑꯗꯨꯒꯤꯗꯃꯛ ꯑꯣꯏꯊꯣꯛꯂꯣꯏ꯫"
"all; nor for him who sleeps too much, nor for him who is (always) awake, O Arjuna!",ꯄꯨꯝꯅꯃꯛ;
Yuktaahaaravihaarasya yuktacheshtasya karmasu;,ꯌꯨꯛꯇꯥꯍꯥꯔꯥꯕꯤꯍꯥꯔꯥꯁ꯭ꯌ ꯌꯨꯛꯇꯥꯆꯦꯁ꯭ꯠꯌ ꯀꯔꯃꯁꯨ;
54,꯵꯴ ꯑꯃꯁꯨꯡ ꯑꯦꯟ.
THE YOGA OF MEDITATION,ꯃꯦꯗꯤꯇꯦꯁꯅꯒꯤ ꯌꯣꯒ .
Yuktaswapnaavabodhasya yogo bhavati duhkhahaa,ꯌꯨꯛꯇꯁꯋꯥꯞꯅꯥꯚꯥꯕꯣꯙꯁ꯭ꯌ ꯌꯣꯒꯣ ꯚꯕꯇꯤ ꯗꯨꯍꯈꯥꯍꯥꯍ
17. Yoga becomes the destroyer of pain for him who is always moderate in eating and,17. ꯌꯣꯒ ꯑꯁꯤ ꯃꯇꯝ ꯄꯨꯝꯅꯃꯛꯇꯥ ꯆꯥꯕꯗꯥ ꯃꯌꯥꯌ ꯑꯣꯏꯕꯥ ꯃꯤꯑꯣꯏ ꯑꯃꯥ ꯑꯣꯏꯔꯤꯕꯥ ꯃꯍꯥꯛꯀꯤꯗꯃꯛ ꯑꯋꯥꯕꯥ ꯃꯥꯡꯍꯟ ꯇꯥꯀꯍꯅꯕꯥ ꯑꯣꯏꯔꯀꯏ ꯑꯃꯁꯨꯡ .
"recreation (such as walking, etc.), who is moderate in exertion in actions, who is moderate in sleep","ꯔꯤꯛꯔꯤꯌꯦꯁꯟ (ꯆꯀꯤꯡ, ꯑꯁꯤꯅꯆꯤꯡꯕꯥ), ꯑꯦꯛꯁꯅꯗꯥ ꯃꯌꯥꯌ ꯑꯣꯏꯕꯥ ꯃꯑꯣꯡꯗꯥ ꯊꯕꯛ ꯇꯧꯕꯥ, ꯇꯨꯝꯕꯥ ꯃꯇꯃꯗꯥ ꯃꯌꯥꯃꯒꯤ ꯑꯣꯏꯕꯥ"
and wakefulness,ꯑꯃꯁꯨꯡ ꯋꯥꯈꯜ ꯋꯥꯕꯥ .
Yadaa viniyatam chittamaatmanyevaavatishthate;,ꯌꯥꯗꯥ ꯚꯤꯅꯤꯌꯇꯝ ꯆꯤꯠꯇꯥꯃꯥꯇꯃꯥꯅꯌꯦꯚꯥꯋꯥꯇꯤꯁ꯭ꯊꯥꯠ;
Nihsprihah sarvakaamebhyo yukta ityuchyate tadaa,ꯅꯤꯍꯁꯞꯔꯤꯍꯥ ꯁꯔꯚꯥꯀꯥꯃꯦꯕꯤꯌꯣ ꯌꯨꯛꯇ ꯏꯇꯤꯎꯆꯤꯌꯥꯇꯦ ꯇꯥꯗꯥꯌꯥ
"18. When the perfectly controlled mind rests in the Self only, free from longing for the","18. ꯃꯄꯨꯡ ꯐꯥꯅꯥ ꯀꯟꯠꯔꯣꯜ ꯇꯧꯕꯥ ꯋꯥꯈꯜ ꯑꯗꯨꯅꯥ ꯁꯦꯜꯐ ꯈꯛꯇꯗꯥ ꯂꯦꯞꯄꯥ ꯃꯇꯃꯗꯥ, ꯂꯣꯡꯒꯤꯡꯗꯒꯤ ꯐ꯭ꯔꯤ ꯑꯣꯏꯕꯥ ꯃꯇꯃꯗꯥ꯫"
"objects of desire, then it is said: “He is united.”","ꯑꯄꯥꯝꯕꯒꯤ ꯄꯣꯠꯂꯃꯁꯤꯡ, ꯃꯗꯨꯒꯤ ꯃꯇꯨꯡꯗꯥ ꯍꯥꯌꯔꯝꯃꯤ: “ꯃꯍꯥꯛ ꯑꯃꯠꯇꯥ ꯑꯣꯏꯅꯥ ꯄꯨꯟꯁꯤꯜꯂꯦ꯫”"
COMMENTARY: Without union with the Self neither harmony nor balance nor Samadhi,ꯀꯃꯦꯟꯇꯔꯤ: ꯁꯦꯜꯐꯀꯥ ꯂꯣꯌꯅꯅꯥ ꯌꯨꯅꯤꯌꯟ ꯌꯥꯑꯣꯗꯅꯥ ꯍꯥꯔꯃꯣꯅꯤ ꯅꯠꯔꯒꯥ ꯕꯦꯂꯦꯟꯁ ꯅꯠꯔꯒꯥ ꯁꯃꯥꯙꯤ
is possible,ꯑꯁꯤ ꯑꯣꯏꯊꯣꯀꯄꯥ ꯌꯥꯏ ꯫
Yathaa deepo nivaatastho nengate sopamaa smritaa;,ꯌꯥꯊꯥꯌꯥ ꯗꯤꯄꯣ ꯅꯤꯚꯥꯇꯥꯁ꯭ꯇꯣ ꯅꯦꯅꯒꯦꯠ ꯁꯣꯄꯥꯃꯥ ꯁ꯭ꯃꯔꯤꯇꯥ;
Yogino yatachittasya yunjato yogamaatmanah,ꯌꯣꯒꯤꯅꯣ ꯌꯥꯇꯥꯆꯤꯠꯁꯌ ꯌꯨꯟꯖꯥꯇꯣ ꯌꯣꯒꯥꯃꯥꯇꯃꯥꯅꯍ
19. As a lamp placed in a windless spot does not flicker—to such is compared the Yogi of,19. ꯅꯨꯡꯁꯤꯠ ꯌꯥꯑꯣꯗꯕꯥ ꯃꯐꯝ ꯑꯃꯗꯥ ꯊꯝꯂꯤꯕꯥ ꯂꯦꯝꯄ ꯑꯃꯅꯥ ꯐꯤꯜꯀ ꯇꯧꯗꯅꯥ—ꯑꯁꯨꯝꯅꯥ ꯃꯁꯤꯒꯤ ꯌꯣꯒꯤ ꯑꯁꯤ .
"controlled mind, practising Yoga in the Self (or absorbed in the Yoga of the Self)","ꯀꯟꯠꯔꯣꯜ ꯇꯧꯔꯕꯥ ꯋꯥꯈꯜ, ꯃꯁꯥꯗꯥ ꯌꯣꯒ ꯇꯧꯕꯥ (ꯅꯠꯔꯒꯥ ꯃꯁꯥꯒꯤ ꯌꯣꯒꯗꯥ ꯌꯥꯑꯣꯕꯥ)"
COMMENTARY: This is a beautiful simile which Yogis often quote when they talk of,ꯀꯃꯦꯟꯇꯔꯤ: ꯃꯁꯤ ꯐꯖꯔꯕꯥ ꯁꯤꯃꯤꯜ ꯑꯃꯅꯤ ꯃꯗꯨꯗꯤ ꯌꯣꯒꯤꯁꯤꯡꯅꯥ ꯑꯌꯥꯝꯕꯅꯥ ꯋꯥꯔꯤ ꯁꯥꯕꯥ ꯃꯇꯃꯗꯥ ꯀꯣꯠ ꯇꯧꯏ꯫
concentration or one-pointedness of mind,ꯀꯟꯁꯦꯟꯠꯔꯦꯁꯟ ꯅꯠꯠꯔꯒꯥ ꯋꯥꯟ-ꯄꯣꯏꯟꯇꯅꯦꯁ ꯑꯣꯐ ꯃꯥꯏꯟꯗ
Yatroparamate chittam niruddham yogasevayaa;,ꯌꯥꯠꯔꯣꯄꯥꯔꯥꯃꯦꯠ ꯆꯤꯠꯇꯝ ꯅꯤꯔꯨꯗ꯭ꯙꯝ ꯌꯣꯒꯥꯁꯦꯚꯥꯌꯥ;
Yatra chaivaatmanaa’tmaanam pashyannaatmani tushyati,ꯌꯥꯠꯔꯥ ꯆꯩꯚꯥꯇꯃꯥꯅꯥ’ꯇꯃꯅꯝ ꯄꯁ꯭ꯌꯅꯥꯇꯃꯅꯤ ꯇꯨꯁ꯭ꯌꯇꯤ
"20. When the mind, restrained by the practice of Yoga, attains to quietude, and when, seeing","20. ꯌꯣꯒꯒꯤ ꯆꯠꯅꯕꯤꯅꯥ ꯉꯥꯀꯊꯣꯛꯂꯕꯥ ꯋꯥꯈꯂꯅꯥ ꯀꯨꯏꯅꯥ ꯆꯠꯄꯥ ꯃꯇꯃꯗꯥ, ꯀꯗꯥꯌꯗꯥ, ꯎꯔꯒꯥ"
"the Self by the Self, he is satisfied in his own Self,","ꯃꯁꯥꯅꯥ ꯃꯁꯥꯕꯨ ꯊꯥꯖꯖꯕꯥ ꯃꯤꯑꯣꯏ ꯑꯗꯨꯅꯥ ꯃꯁꯥꯒꯤ ꯑꯣꯏꯖꯕꯥ ꯊꯤꯗꯅꯥ ꯇꯔꯥꯝꯅꯥ ꯑꯣꯀꯆꯔꯤ,"
Sukhamaatyantikam yattad buddhi graahyamateendriyam;,ꯁꯨꯈꯥꯃꯌꯥꯠꯌꯥꯟꯇꯀꯝ ꯌꯥꯠꯇꯗ ꯕꯨꯗ꯭ꯙ ꯒ꯭ꯔꯥꯍ꯭ꯌꯥꯃꯥꯇꯦꯅꯗ꯭ꯔꯤꯌꯝ;
Vetti yatra na chaivaayam sthitashchalati tattwatah,ꯚꯦꯠꯇꯤ ꯌꯥꯠꯔꯥ ꯅꯥ ꯆꯩꯕꯥꯌꯥꯝ ꯁ꯭ꯊꯤꯇꯥꯁ꯭ꯆꯂꯥꯇꯤ ꯇꯠꯇꯋꯥꯇꯥꯍ
21. When he (the Yogi) feels that infinite bliss which can be grasped by the (pure) intellect,21. ꯃꯍꯥꯛꯅꯥ (ꯌꯣꯒꯤ)ꯅꯥ (ꯄꯨꯡ) ꯋꯥꯈꯜ ꯂꯧꯁꯤꯡꯅꯥ ꯂꯧꯁꯤꯅꯕꯥ ꯉꯝꯕꯥ ꯏꯅꯐꯤꯅꯤꯠ ꯕ꯭ꯂꯤꯁ ꯑꯗꯨ ꯐꯥꯑꯣꯔꯀꯄꯥ ꯃꯇꯃꯗꯥ꯫
"and which transcends the senses, and, established wherein he never moves from the Reality,","ꯑꯃꯁꯨꯡ ꯃꯁꯤꯅꯥ ꯏꯟꯗ꯭ꯔꯤꯁꯤꯡꯕꯨ ꯇ꯭ꯔꯥꯟꯁꯦꯟꯁ ꯇꯧꯏ, ꯑꯃꯁꯨꯡ, ꯂꯤꯡꯈꯠꯈꯤꯕꯥ ꯃꯐꯝ ꯑꯗꯨꯗꯥ ꯃꯍꯥꯛꯅꯥ ꯀꯩꯗꯧꯅꯨꯡꯗꯥ ꯔꯤꯑꯦꯂꯤꯇꯤꯗꯒꯤ ꯆꯠꯈꯤꯗꯦ,"
Yam labdhwaa chaaparam laabham manyate naadhikam tatah;,ꯌꯥꯝ ꯂꯥꯕ꯭ꯙ꯭ꯋꯥ ꯆꯥꯄꯔꯥꯝ ꯂꯕꯍꯝ ꯃꯅꯤꯌꯥꯇꯦ ꯅꯥꯙꯤꯀꯝ ꯇꯥꯇꯥꯍ;
Yasmin sthito na duhkhena gurunaapi vichaalyate,ꯌꯥꯁꯃꯤꯟ ꯁ꯭ꯊꯤꯇꯣ ꯅꯥ ꯗꯨꯍ꯭ꯈꯦꯅꯥ ꯒꯨꯔꯨꯅꯥꯄꯤ ꯚꯤꯆꯥꯌꯥꯜꯌꯥꯠ
"22. Which, having obtained, he thinks there is no other gain superior to it; wherein","꯲꯲.ꯃꯗꯨ ꯐꯪꯂꯕꯥ ꯃꯇꯨꯡꯗꯥ, ꯃꯍꯥꯛꯅꯥ ꯈꯜꯂꯤ ꯃꯗꯨꯗꯤ ꯃꯁꯤꯗꯒꯤ ꯍꯦꯟꯅꯥ ꯐꯕꯥ ꯑꯇꯣꯞꯄꯥ ꯒꯦꯏꯟ ꯑꯃꯠꯇꯥ ꯂꯩꯇꯦ;"
"established, he is not moved even by heavy sorrow,—","ꯂꯤꯡꯈꯠꯂꯛꯂꯤꯕꯥ, ꯃꯍꯥꯀꯄꯨ ꯑꯀꯅꯕꯥ ꯑꯋꯥꯕꯥ ꯐꯥꯑꯣꯕꯥ ꯆꯠꯄꯥ ꯅꯠꯇꯦ,—"
Tam vidyaad duhkhasamyogaviyogam yogasamjnitam;,ꯇꯥꯝ ꯕꯤꯗ꯭ꯌꯥꯗ ꯗꯨꯍꯈꯥꯁꯃꯌꯣꯒꯚꯤꯌꯣꯒꯝ ꯌꯣꯒꯥꯁꯃꯖꯅꯤꯇꯥꯝ;
Sa nishchayena yoktavyo yogo’nirvinna chetasaa,ꯁꯥ ꯅꯤꯁꯆꯥꯌꯦꯅꯥ ꯌꯣꯛꯇꯥꯚꯌꯣ ꯌꯣꯒꯣ’ꯅꯤꯔꯚꯤꯟꯅꯥ ꯆꯦꯇꯥꯁꯥꯌꯥ
55,꯵꯵ ꯑꯃꯁꯨꯡ ꯑꯦꯟ.
BHAGAVAD GITA,ꯚꯒꯕꯠ ꯒꯤꯇꯥ
"23. Let that be known by the name of Yoga, the severance from union with pain. This Yoga","23. ꯃꯗꯨ ꯌꯣꯒꯒꯤ ꯃꯃꯤꯡ, ꯑꯋꯥꯕꯒꯥ ꯂꯣꯌꯅꯅꯥ ꯌꯨꯅꯤꯌꯅꯗꯒꯤ ꯂꯥꯀꯄꯥ ꯁꯦꯚꯔꯦꯟꯁꯅꯥ ꯈꯉꯍꯅꯕꯤꯌꯨ꯫"
