en,mni-Mtei
lescents with different type or severity of disability are more,ꯇꯣꯉꯥꯟ-ꯇꯣꯉꯥꯅꯕꯥ ꯃꯈꯂꯒꯤ ꯅꯠꯠꯔꯒꯥ ꯗꯤꯁꯑꯦꯕꯤꯂꯤꯇꯤꯒꯤ ꯁꯦꯚꯤꯔꯤꯇꯤ ꯂꯩꯕꯥ ꯂꯦꯁꯦꯟꯇꯁꯤꯡ ꯑꯁꯤ ꯍꯦꯟꯅꯥ ꯋꯥꯡꯏ꯫
likely to experience signs of depression and anxiety. Many chil-,ꯋꯥꯈꯜ ꯅꯨꯡꯉꯥꯏꯇꯕꯥ ꯑꯃꯁꯨꯡ ꯋꯥꯈꯜ ꯆꯔꯥꯡꯅꯕꯥ ꯂꯩꯕꯒꯤ ꯈꯨꯗꯃꯁꯤꯡ ꯊꯦꯡꯅꯕꯥ ꯌꯥꯏ꯫
dren and adults who have lifelong developmental disorders also,ꯗ꯭ꯔꯦꯟ ꯑꯃꯁꯨꯡ ꯄꯨꯟꯁꯤ ꯆꯨꯞꯄꯒꯤ ꯑꯣꯏꯅꯥ ꯗꯤꯚꯦꯂꯄꯃꯦꯟꯇ ꯗꯤꯁꯑꯣꯔꯗꯔ ꯂꯩꯕꯥ ꯑꯦꯗꯜꯇꯁꯤꯡꯗꯁꯨ
have co-occurring mental illness and behavioral difﬁculties [28],ꯀꯣ-ꯑꯣꯀꯔ ꯃꯦꯟꯇꯦꯜ ꯂꯥꯌꯅꯥ ꯑꯃꯁꯨꯡ ꯂꯃꯆꯠ-ꯁꯥꯖꯠꯀꯤ ꯑꯋꯥꯕꯥ ꯂꯩꯕꯥ [28]
While determining the underlying cause of such difﬁculties or,ꯑꯁꯤꯒꯨꯝꯕꯥ ꯑꯋꯥꯕꯥ ꯑꯁꯤꯒꯤ ꯃꯈꯥ ꯄꯣꯜꯂꯤꯕꯥ ꯃꯔꯝ ꯑꯗꯨ ꯂꯦꯄꯊꯣꯛꯂꯕꯥ ꯃꯇꯃꯗꯥ ꯅꯠꯠꯔꯒꯥ .
"their developmental trajectory can be highly challenging, and is","ꯃꯈꯣꯌꯒꯤ ꯗꯤꯚꯦꯂꯄꯃꯦꯟꯇ ꯇ꯭ꯔꯦꯖꯦꯛꯇꯔꯤ ꯑꯁꯤ ꯌꯥꯝꯅꯥ ꯆꯦꯂꯦꯟꯖ ꯑꯣꯏꯕꯥ ꯌꯥꯏ, ꯑꯃꯁꯨꯡ ꯃꯁꯤ ."
"outside the scope of this paper, some of this variability is likely to","ꯄꯦꯄꯔ ꯑꯁꯤꯒꯤ ꯁ꯭ꯀꯣꯄꯀꯤ ꯃꯄꯥꯟꯗꯥ, ꯚꯦꯔꯤꯑꯦꯕꯤꯂꯤꯇꯤ ꯑꯁꯤꯒꯤ ꯃꯅꯨꯡꯗꯥ ꯈꯔꯗꯤ ."
be due to shared causes. The increased vulnerability of children,ꯁꯦꯌꯔ ꯇꯧꯔꯕꯥ ꯃꯔꯃꯁꯤꯡꯅꯥ ꯃꯔꯝ ꯑꯣꯏꯗꯨꯅꯥ ꯑꯣꯏꯌꯨ꯫
and adolescents with disabilities to psychosocial distress has also,ꯑꯃꯁꯨꯡ ꯁꯥꯏꯀꯣꯁꯣꯁꯤꯑꯦꯜ ꯗꯤꯁ꯭ꯠꯔꯤꯁꯅꯒꯤ ꯗꯤꯁꯑꯦꯕꯤꯂꯤꯇꯤ ꯂꯩꯕꯥ ꯏꯅꯈꯠꯂꯛꯂꯤꯕꯁꯤꯡꯗꯁꯨ .
"been widely reported. For example, anxiety disorders have been",ꯄꯥꯛ ꯁꯟꯅꯥ ​​ꯔꯤꯄꯣꯔꯠ ꯇꯧꯔꯀꯈꯤ꯫
found to be common among children with developmental and,ꯗꯤꯚꯦꯂꯄꯃꯦꯟꯇ ꯑꯃꯁꯨꯡ ꯗꯤꯚꯦꯂꯄꯃꯦꯟꯇ ꯂꯩꯕꯥ ꯑꯉꯥꯡꯁꯤꯡꯒꯤ ꯃꯔꯛꯇꯥ ꯀꯃꯟ ꯑꯣꯏꯕꯥ ꯑꯣꯏꯅꯥ ꯎꯕꯥ ꯐꯪꯏ꯫
cognitive disabilities [29]. Children with depression often expe-,ꯀꯣꯒꯅꯤꯇꯤꯚ ꯗꯤꯁꯑꯦꯕꯤꯂꯤꯇꯤꯁꯤꯡ [29]꯫
"rience difﬁculties building and maintaining social relationships,","RIENCE DIFFICTILTIES ꯁꯣꯁꯤꯑꯦꯜ ꯔꯤꯂꯦꯁꯅꯁꯤꯄꯁꯤꯡ ꯁꯦꯃꯒꯠꯄꯥ ꯑꯃꯁꯨꯡ ꯉꯥꯛꯇꯨꯅꯥ ꯊꯝꯕꯥ,"
"have problems with anxiety, and emotional and cognitive chal-","ꯋꯥꯈꯜ ꯆꯔꯥꯡꯅꯕꯥ, ꯑꯃꯁꯨꯡ ꯏꯃꯣꯁꯅꯦꯜ ꯑꯃꯁꯨꯡ ꯀꯣꯒꯅꯤꯇꯤꯚ ꯆꯜ-"
"lenges [30]. Increased exposure to stigma, discrimination,",ꯂꯦꯡꯁꯤꯡ [꯳꯰] ꯍꯥꯌꯅꯥ ꯃꯤꯡꯊꯣꯅꯈꯤ꯫
"exclusion, and other negative environmental factors can severely","ꯑꯦꯛꯁꯛꯂꯨꯁꯟ, ꯑꯃꯁꯨꯡ ꯑꯇꯩ ꯅꯦꯒꯦꯇꯤꯚ ꯑꯣꯏꯕꯥ ꯑꯀꯣꯌꯔꯣꯅꯒꯤ ꯐꯦꯛꯇꯔꯁꯤꯡꯅꯥ ꯌꯥꯝꯅꯥ ꯁꯥꯊꯤꯅꯥ ꯁꯣꯀꯍꯅꯕꯥ ꯌꯥꯏ꯫"
affect self-esteem and lead to further isolation. In some in-,ꯁꯦꯜꯐ-ꯏꯁ꯭ꯇꯤꯃꯗꯥ ꯑꯀꯥꯌꯕꯥ ꯄꯤꯌꯨ ꯑꯃꯁꯨꯡ ꯃꯈꯥ ꯇꯥꯅꯥ ꯑꯥꯏꯁꯣꯂꯦꯁꯟ ꯊꯣꯀꯍꯜꯂꯤ꯫
"stances, the relationships between different functional difﬁ-","ꯁ꯭ꯇꯦꯟꯁꯁꯤꯡ, ꯇꯣꯉꯥꯟ-ꯇꯣꯉꯥꯅꯕꯥ ꯐꯉ꯭ꯀꯁꯅꯦꯜ ꯗꯤꯐꯤꯁꯤꯌꯔꯁꯤꯡꯒꯤ ꯃꯔꯛꯇꯥ ꯂꯩꯔꯤꯕꯥ ꯃꯔꯤꯁꯤꯡ-"
"culties can be causal. For example, hearing loss can impair",ꯀꯂꯇꯤꯁꯤꯡ ꯑꯁꯤ ꯀꯧꯖꯜ ꯑꯣꯏꯕꯥ ꯌꯥꯏ꯫
"children’s ability to communicate, learn, build interpersonal","ꯑꯉꯥꯡꯁꯤꯡꯅꯥ ꯄꯥꯎ ꯐꯥꯑꯣꯅꯕꯥ, ꯇꯝꯕꯥ, ꯏꯟꯇꯔꯄꯔꯁꯣꯅꯦꯜ ꯁꯦꯃꯒꯠꯄꯥ ꯉꯝꯕꯒꯤ ꯊꯧꯅꯥ"
"connections, or control behavior, which, in turn, can harm their","ꯀꯅꯦꯛꯁꯅꯁꯤꯡ, ꯅꯠꯠꯔꯒꯥ ꯀꯟꯠꯔꯣꯜ ꯕꯤꯍꯦꯕꯤꯌꯔ, ꯃꯗꯨꯅꯥ ꯃꯈꯣꯌꯒꯤ ꯃꯊꯛꯇꯥ ꯃꯈꯣꯌꯒꯤ ."
psychosocial well-being and cause a reduction in quality of life,ꯁꯥꯏꯀꯣꯁꯣꯁꯤꯑꯦꯜ ꯋꯦꯂꯐꯦꯌꯔ ꯑꯃꯁꯨꯡ ꯄꯨꯟꯁꯤꯒꯤ ꯃꯒꯨꯟ ꯍꯟꯊꯍꯅꯕꯥ
[31]. Children with physical impairments can feel excluded or,[꯳꯱] ꯒꯤ ꯃꯇꯨꯡ ꯏꯟꯅꯥ꯫
"lonely [32], and children with memory and concentration prob-","ꯂꯣꯟꯂꯤ [32], ꯑꯃꯁꯨꯡ ꯃꯦꯃꯣꯔꯤ ꯑꯃꯁꯨꯡ ꯀꯟꯁꯦꯟꯠꯔꯦꯁꯟ ꯂꯩꯕꯥ ꯑꯉꯥꯡꯁꯤꯡ ꯄ꯭ꯔꯣꯕ-"
"lems can experience challenges in self-care, learning, and inter-","ꯂꯦꯃꯁꯤꯡꯅꯥ ꯁꯦꯜꯐ-ꯀꯦꯌꯔ, ꯂꯔꯅꯤꯡ, ꯑꯃꯁꯨꯡ ꯏꯟꯇꯔ-ꯗꯥ ꯁꯤꯡꯅꯕꯥ ꯀꯌꯥ ꯊꯦꯡꯅꯕꯥ ꯉꯃꯒꯅꯤ꯫"
personal relationships [33e35]. These vulnerabilities can be,ꯄꯔꯁꯣꯅꯦꯂꯒꯤ ꯑꯣꯏꯕꯥ ꯃꯔꯤꯁꯤꯡ [33E35]꯫
compounded by the limited availability and barriers in accessing,ꯂꯤꯃꯤꯇꯦꯗ ꯑꯦꯕꯦꯂꯤꯕꯤꯂꯤꯇꯤ ꯑꯃꯁꯨꯡ ꯑꯦꯛꯁꯦꯁ ꯇꯧꯕꯗꯥ ꯊꯦꯡꯅꯔꯤꯕꯥ ꯑꯊꯤꯡꯕꯁꯤꯡꯅꯥ ꯀꯝꯄꯥꯎꯟꯗ ꯇꯧꯕꯥ
"quality mental health services and psychosocial support, which","ꯀ꯭ꯕꯥꯂꯤꯇꯤ ꯂꯩꯕꯥ ꯃꯦꯟꯇꯦꯜ ꯍꯦꯜꯊ ꯁꯔꯚꯤꯁꯁꯤꯡ ꯑꯃꯁꯨꯡ ꯁꯥꯏꯀꯣꯁꯣꯁꯤꯑꯦꯜ ꯁꯄꯣꯔꯠ, ꯃꯈꯣꯌꯁꯤꯡ ꯑꯁꯤ ."
in turn can create additional functional difﬁculties. Outdated,ꯃꯊꯪ ꯃꯅꯥꯎ ꯅꯥꯏꯅꯥ ꯑꯍꯦꯅꯕꯥ ꯐꯉ꯭ꯀꯁꯅꯦꯜ ꯗꯤꯐꯤꯁꯤꯑꯦꯟꯁꯤꯁꯤꯡ ꯁꯦꯝꯕꯥ ꯌꯥꯏ꯫
health-care models and poor understanding of the needs of,ꯍꯦꯜꯊ-ꯀꯦꯌꯔ ꯃꯣꯗꯦꯂꯁꯤꯡ ꯑꯃꯁꯨꯡ ꯃꯊꯧ ꯇꯥꯕꯁꯤꯡꯒꯤ ꯃꯇꯥꯡꯗꯥ ꯌꯥꯝꯅꯥ ꯂꯨꯅꯥ ꯈꯉꯕꯥ
children and adolescents with different types of difﬁculties can,ꯇꯣꯉꯥꯟ-ꯇꯣꯉꯥꯅꯕꯥ ꯃꯈꯂꯒꯤ ꯗꯤꯐꯤꯁꯤꯑꯦꯟꯁꯤꯁꯤꯡ ꯂꯩꯕꯥ ꯑꯉꯥꯡꯁꯤꯡ ꯑꯃꯁꯨꯡ ꯏꯅꯈꯠꯂꯛꯂꯤꯕꯁꯤꯡꯅꯥ .
also prevent the timely delivery of adequate interventions,ꯃꯇꯤꯛ ꯆꯥꯕꯥ ꯏꯟꯇꯔꯚꯦꯟꯁꯅꯁꯤꯡ ꯃꯇꯝ ꯆꯥꯅꯥ ꯌꯧꯍꯅꯕꯗꯁꯨ ꯃꯇꯦꯡ ꯄꯥꯡꯕꯤꯌꯨ
One strength of this study is that it relies on internationally,ꯁ꯭ꯇꯗꯤ ꯑꯁꯤꯒꯤ ꯄꯥꯉ꯭ꯒꯜ ꯑꯃꯗꯤ ꯃꯁꯤꯅꯥ ꯏꯟꯇꯔꯅꯦꯁ꯭ꯅꯦꯜ ꯑꯣꯏꯅꯥ ꯊꯥꯖꯕꯥ ꯊꯝꯂꯤ ꯫
comparable data collected through a previously validated in-,ꯃꯃꯥꯡꯗꯥ ꯚꯦꯂꯤꯗꯦꯠ ꯇꯧꯔꯕꯥ ꯏꯟ-ꯒꯤ ꯈꯨꯠꯊꯥꯡꯗꯥ ꯈꯣꯃꯖꯤꯜꯂꯀꯄꯥ ꯆꯥꯡꯗꯝꯅꯕꯥ ꯌꯥꯕꯥ ꯗꯦꯇꯥ
"strument, the CFM, to obtain information on children’s mani-","ꯁ꯭ꯠꯔꯨꯃꯦꯟꯇ, ꯁꯤ.ꯑꯦꯐ.ꯑꯦꯝ., ꯑꯉꯥꯡꯁꯤꯡꯒꯤ ꯃꯅꯤ-"
festation,ꯐꯦꯁ꯭ꯇꯦꯁꯟ ꯇꯧꯕꯥ
anxiety,ꯆꯔꯥꯡꯅꯕ
and,ꯑꯃꯁꯨꯡ
"depression,","ꯋꯥꯈꯜ ꯑꯋꯥꯕ ꯈꯟꯖꯤꯟꯕ,"
and,ꯑꯃꯁꯨꯡ
the,ꯒꯤ ꯃꯇꯨꯡ ꯏꯟꯅꯥ .
functional,ꯐꯉ꯭ꯀꯁ꯭ꯅꯦꯜ ꯑꯣꯏꯕꯥ .
difﬁculties they experience across several domains. The data,ꯗꯣꯃꯦꯟ ꯀꯌꯥꯒꯤ ꯃꯔꯛꯇꯥ ꯃꯈꯣꯌꯅꯥ ꯊꯦꯡꯅꯔꯤꯕꯥ ꯗꯤꯐꯤꯁꯤꯑꯦꯟꯁꯤꯁꯤꯡ꯫
were collected as part of MICS that were implemented in a,ꯑꯁꯤ ꯑꯦꯝ.ꯑꯥꯏ.ꯁꯤ.ꯁꯤꯡꯒꯤ ꯁꯔꯨꯛ ꯑꯃꯥ ꯑꯣꯏꯅꯥ ꯈꯣꯃꯖꯤꯅꯈꯤ ꯃꯈꯣꯌꯁꯤꯡ ꯑꯗꯨ ꯑꯦ.
"standardized and consistent way, which makes it possible to do","ꯁ꯭ꯇꯦꯟꯗꯔꯗꯥꯏꯖ ꯇꯧꯔꯕꯥ ꯑꯃꯁꯨꯡ ꯀꯟꯁꯤꯁ꯭ꯇꯦꯟꯇ ꯑꯣꯏꯕꯥ ꯃꯑꯣꯡꯗꯥ, ꯃꯁꯤꯅꯥ ꯇꯧꯕꯥ ꯉꯃꯍꯜꯂꯤ"
cross-country comparisons,ꯀ꯭ꯔꯣꯁ-ꯀꯟꯠꯔꯤ ꯆꯥꯡꯗꯝꯅꯕꯥ
Our study covers a large number of countries with sufﬁcient,ꯑꯩꯈꯣꯌꯒꯤ ꯁ꯭ꯇꯗꯤ ꯑꯁꯤꯅꯥ ꯃꯇꯤꯛ ꯆꯥꯕꯥ ꯂꯩꯕꯥꯛ ꯃꯁꯤꯡ ꯌꯥꯝꯅꯥ ꯂꯩꯕꯥ ꯂꯩꯕꯥꯛ ꯃꯁꯤꯡ ꯌꯥꯝꯅꯥ ꯀꯣꯅꯁꯤꯜꯂꯤ ꯫
"sample size to support the analysis. However, the cross-sectional",ꯑꯦꯅꯥꯂꯥꯏꯁꯤꯁ ꯑꯁꯤꯕꯨ ꯃꯇꯦꯡ ꯄꯥꯡꯅꯕꯥ ꯁꯦꯝꯄꯂꯒꯤ ꯆꯥꯡ꯫
nature of the data makes it impossible to establish causation,ꯗꯦꯇꯥꯒꯤ ꯃꯑꯣꯡ ꯃꯇꯧ ꯑꯁꯤꯅꯥ ꯀꯧꯖꯦꯁꯟ ꯂꯤꯡꯈꯠꯄꯥ ꯉꯃꯗꯕꯥ ꯑꯣꯏꯍꯜꯂꯤ .
"between the variables studied, and the direction of the effects","ꯁ꯭ꯇꯗꯤ ꯇꯧꯈꯤꯕꯥ ꯚꯦꯔꯤꯑꯦꯕꯂꯁꯤꯡꯒꯤ ꯃꯔꯛꯇꯥ, ꯑꯃꯁꯨꯡ ꯏꯐꯦꯛꯇꯁꯤꯡꯒꯤ ꯃꯥꯌꯀꯩꯒꯤ ꯃꯔꯛꯇꯥ ."
cannot be determined for the reported associations. This might,ꯔꯤꯄꯣꯔꯠ ꯇꯧꯔꯕꯥ ꯑꯦꯁꯣꯁꯤꯑꯦꯁꯅꯁꯤꯡꯒꯤꯗꯃꯛꯇꯥ ꯂꯦꯄꯊꯣꯀꯄꯥ ꯉꯃꯗꯦ꯫
be especially relevant when interpreting some of the reported,ꯔꯤꯄꯣꯔꯠ ꯇꯧꯔꯀꯄꯥ ꯈꯔꯒꯤ ꯏꯟꯇꯔꯞꯔꯤꯇꯦꯠ ꯇꯧꯕꯥ ꯃꯇꯃꯗꯥ ꯃꯔꯨꯑꯣꯏꯅꯥ ꯃꯔꯤ ꯂꯩꯅꯕꯥ ꯑꯣꯏꯌꯨ .
associations for the domains related to cognitive functioning,ꯀꯣꯒꯅꯤꯇꯤꯕ ꯐꯉ꯭ꯀꯁꯅꯒꯥ ꯃꯔꯤ ꯂꯩꯅꯕꯥ ꯗꯣꯃꯦꯅꯁꯤꯡꯒꯤꯗꯃꯛ ꯑꯦꯁꯣꯁꯤꯑꯦꯁꯅꯁꯤꯡ
"(learning, concentrating, remembering) and behavioral control,","(ꯂꯔꯅꯤꯡ, ꯀꯟꯁꯦꯟꯠꯔꯦꯇꯤꯡ, ꯔꯤꯃꯦꯝꯕꯔ ꯇꯧꯕꯥ) ꯑꯃꯁꯨꯡ ꯂꯃꯆꯠ-ꯁꯥꯖꯠ ꯀꯟꯠꯔꯣꯜ ꯇꯧꯕꯥ,"
"as difﬁculties in these domains can be caused, worsened, or","ꯗꯣꯃꯦꯅꯁꯤꯡ ꯑꯁꯤꯗꯥ ꯂꯩꯔꯤꯕꯥ ꯑꯋꯥꯕꯥ ꯑꯁꯤꯅꯥ ꯃꯔꯝ ꯑꯣꯏꯗꯨꯅꯥ, ꯍꯦꯟꯅꯥ ꯐꯒꯠꯂꯀꯄꯥ ꯌꯥꯏ ꯅꯠꯠꯔꯒꯥ ."
"reciprocally inﬂuenced by both depression and anxiety [35,36]","ꯗꯤꯞꯔꯦꯁꯟ ꯑꯃꯁꯨꯡ ꯑꯦꯟꯁꯤꯇꯤ ꯑꯅꯤꯃꯛꯅꯥ ꯑꯃꯒꯥ ꯑꯃꯒꯥ ꯏꯅꯐ꯭ꯂꯨꯑꯦꯟꯁ ꯇꯧꯕꯥ [35,36]꯫"
Results presented in this study should only be considered as,ꯁ꯭ꯇꯗꯤ ꯑꯁꯤꯗꯥ ꯄꯤꯔꯤꯕꯥ ꯔꯤꯖꯜꯇꯁꯤꯡ ꯑꯁꯤ ꯁꯨꯞꯅꯇꯒꯤ .
an indication of common and relevant signs of depression and,ꯗꯤꯞꯔꯦꯁꯟ ꯑꯃꯁꯨꯡ ꯃꯔꯤ ꯂꯩꯅꯕꯥ ꯀꯃꯟ ꯑꯃꯁꯨꯡ ꯃꯔꯤ ꯂꯩꯅꯕꯥ ꯈꯨꯗꯃꯁꯤꯡꯒꯤ ꯏꯟꯗꯤꯀꯦꯁꯟ ꯑꯃꯥ
"anxiety among adolescents, rather than as a proxy for a clinical","ꯏꯅꯈꯠꯂꯛꯂꯤꯕꯁꯤꯡꯒꯤ ꯃꯔꯛꯇꯥ ꯋꯥꯈꯜ ꯆꯔꯥꯡꯅꯕꯥ, ꯀ꯭ꯂꯤꯅꯤꯀꯦꯜ ꯑꯃꯒꯤꯗꯃꯛ ꯄ꯭ꯔꯣꯛꯁꯤ ꯑꯃꯥ ꯑꯣꯏꯅꯥ ꯂꯧꯕꯗꯒꯤ ꯍꯦꯟꯅꯥ꯫"
diagnosis. The results are based on two questions that identify,ꯗꯥꯏꯑꯦꯒ꯭ꯅꯣꯁꯤꯁ ꯇꯧꯕꯥ꯫
children and adolescents with difﬁculties managing emotions as,ꯑꯉꯥꯡꯁꯤꯡ ꯑꯃꯁꯨꯡ ꯏꯅꯈꯠꯂꯛꯂꯤꯕꯁꯤꯡꯅꯥ ꯏꯃꯣꯁꯅꯁꯤꯡ ꯃꯦꯅꯦꯖ ꯇꯧꯔꯤꯕꯥ ꯗꯤꯐꯤꯁꯤꯑꯦꯟꯁꯤꯁꯤꯡ ꯂꯩꯕꯥ .
"manifested by worry, sadness, or anxiety that are frequent and at","ꯋꯥꯈꯜ ꯋꯥꯕꯥ, ꯋꯥꯈꯜ ꯅꯨꯡꯉꯥꯏꯇꯕꯥ ꯅꯠꯠꯔꯒꯥ ꯋꯥꯈꯜ ꯆꯔꯥꯡꯅꯕꯥ ꯑꯁꯤꯅꯥ ꯃꯔꯝ ꯑꯣꯏꯗꯨꯅꯥ ꯃꯁꯛ ꯈꯪꯗꯣꯀꯏ ꯃꯗꯨꯗꯤ ꯃꯈꯣꯌ"
a level of intensity that places them at a higher risk for negative,ꯃꯈꯣꯌꯕꯨ ꯅꯦꯒꯦꯇꯤꯚ ꯑꯣꯏꯅꯥ ꯍꯦꯟꯅꯥ ꯋꯥꯡꯕꯥ ꯔꯤꯁ꯭ꯛ ꯑꯃꯗꯥ ꯊꯝꯂꯤꯕꯥ ꯏꯟꯇꯦꯟꯁꯤꯇꯤꯒꯤ ꯊꯥꯛ ꯑꯃꯥ .
F. de Castro et al. / Journal of Adolescent Health 72 (2023) S79eS87,ꯑꯦꯐ.ꯗꯤ ꯀꯥꯁ꯭ꯇꯔ ꯑꯦꯠ.ꯑꯦꯜ.
S85,ꯑꯦꯁ꯸꯵ ꯂꯩ꯫
mental health outcomes. Such signs are reported by mothers (or,ꯃꯦꯟꯇꯦꯜ ꯍꯦꯜꯊꯀꯤ ꯐꯂꯁꯤꯡ꯫
primary caregivers). Cognitive testing of both questions indicated,ꯄ꯭ꯔꯥꯏꯃꯥꯔꯤ ꯀꯦꯌꯔ ꯂꯧꯕꯥ ꯃꯤꯑꯣꯏꯁꯤꯡ)꯫
that mothers were able to match the questions into perceived,ꯃꯃꯥꯁꯤꯡꯅꯥ ꯋꯥꯍꯪꯁꯤꯡ ꯑꯗꯨ ꯂꯧꯁꯤꯅꯕꯥ ꯉꯃꯈꯤꯕꯥ ꯑꯗꯨ .
"problems of pronounced nature, rather than transitory or less","ꯇ꯭ꯔꯥꯟꯁꯤꯇꯣꯔꯤ ꯅꯠꯠꯔꯒꯥ ꯍꯦꯟꯅꯥ ꯅꯦꯝꯕꯥ ꯃꯑꯣꯡꯗꯥ, ꯄ꯭ꯔꯣꯅꯣꯅꯣꯟꯁ ꯅꯦꯆꯔꯒꯤ ꯄ꯭ꯔꯣꯕ꯭ꯂꯦꯃꯁꯤꯡ"
salient emotional manifestations [14] Further testing on the cut-,ꯁꯦꯂꯤꯌꯦꯟꯇ ꯏꯃꯣꯁꯅꯦꯜ ꯃꯦꯅꯤꯐꯦꯁ꯭ꯇꯦꯁꯅꯁꯤꯡ [14] ꯃꯈꯥ ꯇꯥꯅꯥ ꯇꯦꯁ꯭ꯠ ꯇꯧꯕꯥ-
score used for these questions also indicated that the “daily”,ꯋꯥꯍꯪꯁꯤꯡ ꯑꯁꯤꯒꯤꯗꯃꯛꯇꯥ ꯁꯤꯖꯤꯟꯅꯔꯤꯕꯥ ꯁ꯭ꯀꯣꯔ ꯑꯁꯤꯅꯥ “ꯅꯨꯃꯤꯠ ꯈꯨꯗꯤꯡꯒꯤ” ꯍꯥꯌꯕꯁꯤꯁꯨ ꯇꯥꯀꯈꯤ ꯫
response performed better at identifying these children with,ꯔꯦꯁ꯭ꯄꯣꯟꯁ ꯑꯁꯤꯅꯥ ꯑꯉꯥꯡꯁꯤꯡ ꯑꯁꯤꯕꯨ ꯃꯁꯛ ꯈꯉꯗꯣꯀꯄꯗꯥ ꯍꯦꯟꯅꯥ ꯐꯕꯥ ꯃꯑꯣꯡꯗꯥ ꯄꯥꯡꯊꯣꯀꯈꯤ꯫
better precision,ꯍꯦꯟꯅꯥ ꯐꯕꯥ ꯄ꯭ꯔꯤꯁꯤꯁꯟ .
and led,ꯑꯃꯁꯨꯡ ꯑꯦꯜ.ꯏ.ꯗꯤ.
to,ꯒꯤ ꯃꯇꯨꯡ ꯏꯟꯅꯥ .
fewer false,ꯑꯔꯥꯅꯕꯥ ꯍꯟꯊꯕꯥ
positive answers,ꯄꯣꯖꯤꯇꯤꯕ ꯑꯣꯏꯕꯥ ꯄꯥꯎꯈꯨꯃꯁꯤꯡ
compared to the “weekly” response option [15]. These two,“ꯅꯨꯃꯤꯠ ꯈꯨꯗꯤꯡꯒꯤ” ꯔꯦꯁ꯭ꯄꯣꯟꯁ ꯑꯣꯄꯁꯅꯒꯥ ꯆꯥꯡꯗꯝꯅꯕꯗꯥ [15]꯫
"questions, however, do not cover the range of possible mani-","ꯑꯗꯨꯝ ꯑꯣꯏꯅꯃꯛ, ꯋꯥꯍꯪꯁꯤꯡ ꯑꯁꯤꯅꯥ ꯑꯣꯏꯊꯣꯀꯄꯥ ꯌꯥꯕꯥ ꯃꯅꯤ-"
"festations of depression or anxiety. For example, irritability,",ꯗꯤꯞꯔꯦꯁꯟ ꯅꯠꯠꯔꯒꯥ ꯑꯦꯟꯁꯤꯇꯤꯒꯤ ꯐꯦꯁ꯭ꯇꯦꯁꯅꯁꯤꯡ꯫
"psychosomatic and sleep disorders, as well as fatigue and","ꯁꯥꯏꯀꯣꯁꯣꯃꯦꯇꯤꯛ ꯑꯃꯁꯨꯡ ꯁ꯭ꯂꯤꯞ ꯗꯤꯁꯑꯣꯔꯗꯔꯁꯤꯡ, ꯂꯣꯌꯅꯅꯥ ꯐꯤꯠꯅꯦꯁ ꯑꯃꯁꯨꯡ"
anhedonia are important manifestations of depression and,ꯑꯦꯟꯍꯦꯗꯣꯅꯤꯌꯥ ꯑꯁꯤ ꯗꯤꯞꯔꯦꯁꯅꯒꯤ ꯃꯔꯨꯑꯣꯏꯕꯥ ꯃꯁꯀꯁꯤꯡꯅꯤ ꯑꯃꯁꯨꯡ .
"anxiety in young persons, which are not identiﬁed by the two","ꯅꯍꯥ ꯑꯣꯏꯔꯤꯕꯥ ꯃꯤꯑꯣꯏꯁꯤꯡꯗꯥ ꯋꯥꯈꯜ ꯆꯔꯥꯡꯅꯕꯥ, ꯃꯈꯣꯌ ꯑꯅꯤꯅꯥ ꯃꯁꯛ ꯈꯪꯗꯣꯀꯄꯥ ꯉꯃꯗꯦ"
"questions in the CFM. A further limitation in this respect is that,",ꯁꯤ.ꯑꯦꯐ.ꯑꯦꯝ.ꯗꯥ ꯂꯩꯕꯥ ꯋꯥꯍꯪꯁꯤꯡ꯫
"like the other questions in the module, the two questions on","ꯃꯣꯗ꯭ꯌꯨꯜ ꯑꯁꯤꯗꯥ ꯂꯩꯔꯤꯕꯥ ꯑꯇꯣꯞꯄꯥ ꯋꯥꯍꯪꯁꯤꯡꯒꯨꯝꯅꯥ, ꯲꯰꯲꯰ꯒꯤ ꯃꯇꯥꯡꯗꯥ ꯋꯥꯍꯪ ꯑꯅꯤ ꯑꯁꯤꯁꯨ [...]"
depression and anxiety intend to measure signs and symptoms,ꯗꯤꯞꯔꯦꯁꯟ ꯑꯃꯁꯨꯡ ꯑꯦꯟꯁꯤꯇꯤꯅꯥ ꯈꯨꯗꯝ ꯑꯃꯁꯨꯡ ꯂꯥꯏꯑꯣꯡꯁꯤꯡ ꯌꯦꯡꯁꯤꯟꯅꯕꯥ ꯋꯥꯔꯦꯞ ꯂꯧꯔꯦ
that can occur across a broad age group covering both childhood,ꯃꯗꯨ ꯑꯉꯥꯡ ꯑꯣꯏꯔꯤꯉꯩꯒꯤ ꯃꯇꯝ ꯑꯅꯤꯃꯛ ꯀꯣꯅꯁꯤꯜꯂꯤꯕꯥ ꯄꯥꯛ ꯆꯥꯎꯔꯕꯥ ꯆꯍꯤ ꯀꯥꯡꯂꯨꯞ ꯑꯃꯒꯤ ꯃꯅꯨꯡꯗꯥ ꯊꯣꯀꯄꯥ ꯌꯥꯏ .
as well as early and late adolescence. This may limit the ability of,ꯂꯣꯌꯅꯅꯥ ꯉꯟꯅꯥ ꯑꯃꯁꯨꯡ ꯂꯦꯞꯇꯅꯥ ꯏꯅꯈꯠꯂꯀꯄꯥ꯫
the measure to capture some signs that may be more prevalent at,꯲꯰꯲꯰ꯗꯥ ꯍꯦꯟꯅꯥ ꯆꯠꯅꯔꯀꯄꯥ ꯌꯥꯕꯥ ꯈꯨꯗꯝ ꯈꯔꯥ ꯂꯧꯁꯤꯟꯅꯕꯥ ꯈꯣꯡꯊꯥꯡ ꯑꯁꯤ .
"certain ages [36]. Likewise, the use of two single questions may",ꯑꯀꯛꯅꯕꯥ ꯆꯍꯤꯁꯤꯡ [꯳꯶]꯫
also be insufﬁcient to measure certain signs that present varia-,ꯃꯁꯤꯗꯁꯨ ꯅꯠꯇꯅꯥ ꯚꯦꯔꯤꯑꯦꯖ ꯇꯧꯔꯤꯕꯥ ꯑꯀꯛꯅꯕꯥ ꯁꯥꯏꯅꯁꯤꯡ ꯑꯗꯨ ꯃꯥꯄꯂꯒꯤ ꯃꯇꯥꯡꯗꯥ ꯃꯇꯤꯛ ꯆꯥꯗꯕꯥ ꯑꯣꯏꯌꯨ-
"tion by sex [37], which may explain why we have only identiﬁed","tion by sex [37], ꯃꯁꯤꯅꯥ ꯑꯩꯈꯣꯌꯅꯥ ꯀꯔꯤꯒꯤꯗꯃꯛꯇꯥ ꯃꯁꯛ ꯈꯉꯗꯣꯀꯈꯤꯕꯅꯣ ꯍꯥꯌꯕꯗꯨ ꯈꯉꯍꯅꯕꯥ ꯉꯃꯒꯅꯤ"
marginally signiﬁcant differences between adolescent boys and,ꯏꯅꯈꯠꯂꯛꯂꯤꯕꯤ ꯅꯨꯄꯥꯃꯆꯥꯁꯤꯡ ꯑꯃꯁꯨꯡ 1000ꯒꯤ ꯃꯔꯛꯇꯥ ꯌꯥꯝꯅꯥ ꯅꯦꯝꯅꯥ ꯂꯩꯕꯥ ꯈꯦꯠꯅꯕꯁꯤꯡ꯫
girls. This type of limitations is common in large-scale multitopic,ꯅꯨꯄꯤꯃꯆꯥꯁꯤꯡ꯫
surveys where inevitable trade-offs between aspects of sample,ꯁꯦꯝꯄꯂꯒꯤ ꯃꯁꯀꯁꯤꯡꯒꯤ ꯃꯔꯛꯇꯥ ꯇꯉꯥꯏꯐꯗꯕꯥ ꯇ꯭ꯔꯦꯗ-ꯑꯣꯐꯁꯤꯡ ꯂꯩꯕꯥ ꯁꯔꯚꯦꯁꯤꯡ
coverage and content coverage have implications in terms of the,ꯀꯣꯚꯔꯦꯖ ꯑꯃꯁꯨꯡ ꯀꯟꯇꯦꯟꯇ ꯀꯚꯔꯦꯖ ꯑꯁꯤꯅꯥ .
number of indicators that can be measured and the level of detail,ꯂꯦꯄꯊꯣꯀꯄꯥ ꯌꯥꯕꯥ ꯏꯟꯗꯤꯀꯦꯇꯔꯁꯤꯡꯒꯤ ꯃꯁꯤꯡ ꯑꯃꯁꯨꯡ ꯑꯀꯨꯞꯄꯥ ꯃꯔꯣꯂꯁꯤꯡꯒꯤ ꯊꯥꯛ
and granularity in the information collected,ꯑꯃꯁꯨꯡ ꯈꯣꯃꯖꯤꯜꯂꯀꯄꯥ ꯏꯅꯐꯣꯔꯃꯦꯁꯅꯁꯤꯡꯗꯥ ꯒ꯭ꯔꯦꯅꯨꯂꯦꯔꯤꯇꯤ
The CFM relies on mothers/primary caregivers to provide,ꯁꯤ.ꯑꯦꯐ.ꯑꯦꯝ.ꯅꯥ ꯄꯤꯒꯗꯕꯥ ꯃꯃꯥꯁꯤꯡ/ꯄ꯭ꯔꯥꯏꯃꯔꯤ ꯀꯦꯌꯔ ꯂꯧꯔꯤꯕꯥ ꯃꯤꯑꯣꯏꯁꯤꯡꯗꯥ ꯊꯥꯖꯕꯥ ꯊꯝꯂꯤ꯫
answers rather than asking children directly. This approach is in,ꯑꯉꯥꯡꯁꯤꯡꯗꯥ ꯍꯀꯊꯦꯡꯅꯅꯥ ꯍꯪꯕꯒꯤ ꯃꯍꯨꯠꯇꯥ ꯄꯥꯎꯈꯨꯃꯁꯤꯡ꯫
part justiﬁed by logistical considerations of large-scale house-,ꯑꯆꯧꯕꯥ ꯌꯨꯃꯒꯤ ꯂꯣꯖꯤꯁ꯭ꯇꯤꯛ ꯑꯣꯏꯕꯥ ꯋꯥꯈꯜꯂꯣꯅꯁꯤꯡꯅꯥ ꯃꯔꯝ ꯑꯣꯏꯗꯨꯅꯥ ꯁꯔꯨꯛ ꯈꯔꯗꯤ-
"hold surveys, where mothers/primary caregivers tend to be used","ꯄꯥꯡꯊꯣꯀꯄꯥ ꯁꯔꯚꯦꯁꯤꯡ, ꯃꯐꯝ ꯑꯗꯨꯗꯥ ꯃꯃꯥꯁꯤꯡ/ꯄ꯭ꯔꯥꯏꯃꯔꯤ ꯀꯦꯌꯔ ꯂꯧꯔꯤꯕꯥ ꯃꯤꯑꯣꯏꯁꯤꯡꯅꯥ ꯁꯤꯖꯤꯟꯅꯕꯥ ꯌꯥꯕꯥ ."
as informants to multiple indicators covering very broad age,ꯌꯥꯝꯅꯥ ꯄꯥꯛ-ꯆꯥꯎꯕꯥ ꯆꯍꯤ ꯀꯌꯥ ꯀꯣꯅꯁꯤꯜꯂꯤꯕꯥ ꯃꯜꯇꯤꯄꯜ ꯏꯟꯗꯤꯀꯦꯇꯔꯁꯤꯡꯗꯥ ꯏꯅꯐꯣꯔꯃꯦꯟꯇꯁꯤꯡ ꯑꯣꯏꯅꯥ .
groups. Even when older children might be able to answer by,ꯀꯥꯡꯂꯨꯄꯁꯤꯡ꯫
"themselves, information on younger children would still require","ꯃꯈꯣꯌ ꯃꯁꯥꯅꯥ, ꯅꯍꯥ ꯑꯣꯏꯔꯤꯕꯥ ꯑꯉꯥꯡꯁꯤꯡꯒꯤ ꯃꯔꯃꯗꯥ ꯏꯅꯐꯣꯔꯃꯦꯁꯟ ꯍꯧꯖꯤꯀꯁꯨ ꯃꯊꯧ ꯇꯥꯒꯅꯤ"
parental report and the resulting indicators would mix data from,ꯃꯃꯥ-ꯃꯄꯥꯒꯤ ꯔꯤꯄꯣꯔꯠ ꯑꯃꯁꯨꯡ ꯃꯁꯤꯗꯒꯤ ꯊꯣꯛꯂꯀꯄꯥ ꯏꯟꯗꯤꯀꯦꯇꯔꯁꯤꯡ ꯑꯁꯤꯅꯥ ꯳.
"two different informants, which is not recommended. Likewise,","ꯇꯣꯉꯥꯟ-ꯇꯣꯉꯥꯅꯕꯥ ꯏꯅꯐꯣꯔꯃꯔ ꯑꯅꯤ, ꯃꯗꯨ ꯔꯦꯀꯃꯦꯟꯗ ꯇꯧꯗꯦ꯫"
parental report is needed to ensure data are collected about all,ꯄꯨꯝꯅꯃꯛ ꯑꯁꯤꯒꯤ ꯃꯇꯥꯡꯗꯥ ꯗꯦꯇꯥ ꯈꯣꯃꯖꯤꯜꯂꯀꯄꯥ ꯁꯣꯌꯗꯅꯥ ꯑꯣꯏꯍꯟꯅꯕꯥ ꯃꯃꯥ-ꯃꯄꯥꯒꯤ ꯔꯤꯄꯣꯔꯠ ꯃꯊꯧ ꯇꯥꯏ꯫
"children in the household, including those who may not be able","ꯌꯨꯃꯗꯥ ꯂꯩꯕꯥ ꯑꯉꯥꯡꯁꯤꯡ, ꯌꯥꯎꯗꯕꯥ ꯑꯉꯥꯡꯁꯤꯡ ꯌꯥꯎꯅꯥ,"
to answer questions due to an impairment or to consent to the,ꯑꯁꯣꯅꯕꯥ ꯑꯃꯅꯥ ꯃꯔꯝ ꯑꯣꯏꯗꯨꯅꯥ ꯋꯥꯍꯪꯁꯤꯡꯒꯤ ꯄꯥꯎꯈꯨꯝ ꯄꯤꯅꯕꯥ ꯅꯠꯔꯒꯥ ꯑꯌꯥꯕꯥ ꯄꯤꯗꯕꯒꯤ ꯃꯇꯥꯡꯗꯥ ꯋꯥꯐꯝ ꯀꯌꯥ ꯊꯃꯈꯤ꯫
"interview process due to their young age. Despite this, collecting",ꯃꯈꯣꯌꯒꯤ ꯅꯍꯥ ꯑꯣꯏꯔꯤꯕꯥ ꯆꯍꯤ ꯑꯁꯤꯅꯥ ꯃꯔꯝ ꯑꯣꯏꯗꯨꯅꯥ ꯏꯟꯇꯔꯚ꯭ꯌꯨꯒꯤ ꯊꯧꯑꯣꯡ꯫
information from caregivers has certain limitations which are,ꯀꯦꯌꯔ ꯂꯧꯔꯤꯕꯥ ꯃꯤꯑꯣꯏꯁꯤꯡꯅꯥ ꯑꯀꯛꯅꯕꯥ ꯂꯤꯃꯤꯇꯦꯁꯅꯁꯤꯡ ꯂꯩ ꯍꯥꯌꯕꯁꯤꯅꯤ ꯃꯗꯨꯗꯤ ꯃꯈꯣꯌ ꯑꯁꯤ .
similar to those of other studies that use proxy respondents,ꯄ꯭ꯔꯣꯛꯁꯤ ꯔꯦꯁ꯭ꯄꯣꯟꯗꯦꯟꯇꯁꯤꯡ ꯁꯤꯖꯤꯟꯅꯔꯤꯕꯥ ꯑꯇꯣꯞꯄꯥ ꯁ꯭ꯇꯗꯤꯁꯤꯡꯒꯥ ꯃꯥꯟꯅꯅꯥ
Parents or caregivers may be unaware of the difﬁculties experi-,ꯃꯃꯥ-ꯃꯄꯥꯁꯤꯡ ꯅꯠꯠꯔꯒꯥ ꯀꯦꯌꯔ ꯂꯧꯔꯤꯕꯥ ꯃꯤꯑꯣꯏꯁꯤꯡꯅꯥ ꯑꯋꯥꯕꯥ ꯇꯥꯔꯕꯥ ꯃꯇꯃꯗꯥ ꯃꯈꯣꯌꯅꯥ ꯈꯪꯗꯕꯥ ꯌꯥꯏ-ꯑꯦꯛꯁꯄꯤꯔꯤꯑꯦꯜ-
"enced by the adolescent, or there might be disagreement in","ꯏꯅꯈꯠꯂꯛꯂꯤꯕꯥ ꯃꯤꯑꯣꯏ ꯑꯗꯨꯅꯥ ꯑꯦꯟꯁꯦꯁ ꯇꯧꯔꯕꯥ, ꯅꯠꯠꯔꯒꯥ 1.0."
relation to the severity of existing difﬁculties. Disagreement,ꯍꯧꯖꯤꯛ ꯂꯩꯔꯤꯕꯥ ꯗꯤꯐꯤꯁꯤꯑꯦꯟꯁꯤꯁꯤꯡꯒꯤ ꯃꯑꯣꯡ ꯃꯇꯧꯒꯥ ꯃꯔꯤ ꯂꯩꯅꯕꯥ꯫
between parental and child report of mental health issues can be,ꯃꯦꯟꯇꯦꯜ ꯍꯦꯂꯊ ꯏꯁꯨꯁꯤꯡꯒꯤ ꯃꯃꯥ-ꯃꯄꯥ ꯑꯃꯁꯨꯡ ꯑꯉꯥꯡꯒꯤ ꯃꯔꯛꯇꯥ ꯔꯤꯄꯣꯔꯠ ꯇꯧꯕꯥ ꯌꯥꯏ꯫
"associated with the respondents’ characteristics, nature of the","ꯔꯦꯁ꯭ꯄꯣꯟꯗꯦꯟꯇꯁꯤꯡꯒꯤ ꯃꯑꯣꯡ ꯃꯇꯧꯒꯥ ꯃꯔꯤ ꯂꯩꯅꯕꯥ, ꯃꯑꯣꯡ ꯃꯇꯧꯒꯤ ꯃꯑꯣꯡ ꯃꯇꯧ꯫"
"reported disorder, including its etiology, parent-child relation-","ꯔꯤꯄꯣꯔꯠ ꯇꯧꯔꯀꯄꯥ ꯗꯤꯁꯑꯣꯔꯗꯔ, ꯃꯁꯤꯒꯤ ꯏꯇꯤꯂꯣꯖꯤ, ꯃꯃꯥ-ꯃꯄꯥ-ꯃꯆꯥꯒꯤ ꯃꯔꯤ-"
"ship aspects, and overall sociocultural setting [38]. That said, the","ꯖꯍꯥꯖꯒꯤ ꯃꯁꯀꯁꯤꯡ, ꯑꯃꯁꯨꯡ ꯑꯄꯨꯅꯕꯥ ꯁꯣꯁꯤꯑꯣ-ꯀꯂꯆꯔꯦꯜ ꯁꯦꯇꯤꯡ [38]꯫"
CFM was designed to overcome some of the limitations related to,ꯁꯤ.ꯑꯦꯐ.ꯑꯦꯝ.
asking questions on disability and reduce some potential biases,ꯗꯤꯁꯑꯦꯕꯤꯂꯤꯇꯤꯒꯤ ꯃꯇꯥꯡꯗꯥ ꯋꯥꯍꯪ ꯍꯪꯕꯤꯌꯨ ꯑꯃꯁꯨꯡ ꯄꯣꯇꯦꯟꯁꯤꯑꯦꯜ ꯕꯥꯏꯑꯦꯖ ꯈꯔꯗꯤ ꯍꯟꯊꯍꯜꯂꯤ
by,ꯗ꯭ꯕꯥꯔꯥ .
focusing,ꯐꯣꯀꯁ ꯇꯧꯕꯥ
on,on ꯒꯤ ꯃꯊꯛꯇꯥ ꯂꯩꯕꯥ꯫
the,ꯒꯤ ꯃꯇꯨꯡ ꯏꯟꯅꯥ .
ability,ꯇꯧꯕ ꯉꯝꯕ
to,ꯒꯤ ꯃꯇꯨꯡ ꯏꯟꯅꯥ .
perform,ꯄꯥꯡꯊꯣꯛꯄ
basic,ꯇꯉꯥꯏ ꯐꯗꯕ
activities,ꯊꯕꯛ ꯊꯧꯔꯡꯁꯤꯡ
and manifestations of certain behaviors that can be observed in,ꯑꯃꯁꯨꯡ ꯑꯀꯛꯅꯕꯥ ꯂꯃꯆꯠ-ꯁꯥꯖꯠꯀꯤ ꯃꯑꯣꯡ-ꯃꯇꯧꯁꯤꯡ ꯑꯗꯨ 10000ꯗꯥ ꯎꯕꯥ ꯐꯪꯒꯗꯕꯥ ꯃꯑꯣꯡ-ꯃꯇꯧꯁꯤꯡ ꯑꯗꯨꯒꯤ ꯃꯁꯛ ꯇꯥꯀꯄꯁꯤꯡ꯫
day-to-day life. The questions were extensively tested with,ꯅꯨꯃꯤꯠ ꯈꯨꯗꯤꯡꯒꯤ ꯄꯨꯟꯁꯤ꯫
respondents in different countries and from diverse socio-,ꯇꯣꯉꯥꯟ ꯇꯣꯉꯥꯅꯕꯥ ꯂꯩꯕꯥꯀꯁꯤꯡꯗꯥ ꯑꯃꯁꯨꯡ ꯇꯣꯉꯥꯟ ꯇꯣꯉꯥꯅꯕꯥ ꯁꯣꯁꯤꯑꯣ-
"demographic and cultural backgrounds, and wording was","ꯗꯦꯃꯣꯒ꯭ꯔꯥꯐꯤꯛ ꯑꯃꯁꯨꯡ ꯀꯂꯆꯔꯦꯜ ꯕꯦꯀꯒ꯭ꯔꯥꯎꯟꯗꯁꯤꯡ, ꯑꯃꯁꯨꯡ ꯋꯥꯍꯩꯁꯤꯡ ꯑꯁꯤ ."
adjusted to elicit responses that accurately reﬂect the experi-,ꯑꯦꯛꯁꯄꯔꯤ-ꯑꯦꯂꯤꯁꯤꯠ ꯔꯦꯁ꯭ꯄꯣꯟꯁꯁꯤꯡ ꯑꯁꯤ ꯑꯆꯨꯝꯕꯥ ꯃꯑꯣꯡꯗꯥ ꯔꯤꯐ꯭ꯂꯦꯛꯇ ꯇꯧꯅꯕꯥ ꯑꯦꯗꯖꯁ꯭ꯠ ꯇꯧꯔꯕꯥ
ences of the child. Questions have also been tested for agreement,ꯑꯉꯥꯡ ꯑꯗꯨꯒꯤ ꯑꯦꯅꯁꯦꯁꯁꯤꯡ꯫
"between parental and child report, and while agreement tends to","ꯃꯃꯥ-ꯃꯄꯥ ꯑꯃꯁꯨꯡ ꯑꯉꯥꯡꯒꯤ ꯔꯤꯄꯣꯔꯇꯀꯤ ꯃꯔꯛꯇꯥ, ꯑꯃꯁꯨꯡ ꯌꯥꯅꯆꯦ ꯑꯁꯤꯅꯥ ꯇꯦꯟꯗꯔ ꯇꯧꯕꯥ ꯃꯇꯃꯗꯥ"
