en,mni-Mtei
mine Real adventure lifts your heart opens your mind and makes you,ꯃꯥꯏꯅꯥ ꯑꯁꯦꯡꯕꯥ ꯑꯦꯗꯚꯦꯟꯆꯔꯅꯥ ꯅꯍꯥꯛꯀꯤ ꯊꯝꯃꯣꯌꯕꯨ ꯂꯤꯐꯠ ꯇꯧꯏ ꯅꯍꯥꯛꯀꯤ ꯋꯥꯈꯜ ꯑꯗꯨ ꯍꯥꯡꯗꯣꯀꯏ ꯑꯃꯁꯨꯡ ꯅꯍꯥꯀꯄꯨ ꯑꯣꯏꯍꯜꯂꯤ
catch your breath And thats not the same for any two people What I,ꯅꯍꯥꯛꯀꯤ ꯁ꯭ꯕꯔ ꯍꯣꯅꯕꯥ ꯑꯗꯨ ꯂꯧꯈꯠꯂꯨ ꯑꯃꯁꯨꯡ ꯊ꯭ꯌꯥꯇꯁ ꯅꯠ ꯗ꯭ꯌꯥꯝ ꯑꯦꯅꯔꯁ ꯐꯣꯔ ꯃꯤ ꯑꯅꯤ ꯀꯔꯤ i
was doing was basing my notion of the fully lived life on my escape,ꯑꯩꯒꯤ ꯑꯦꯁ꯭ꯀꯦꯞ ꯑꯁꯤꯗꯥ ꯃꯄꯨꯡ ꯐꯥꯅꯥ ꯍꯤꯡꯂꯤꯕꯥ ꯄꯨꯟꯁꯤꯒꯤ ꯑꯩꯒꯤ ꯋꯥꯈꯜꯂꯣꯟ ꯑꯗꯨ ꯕꯦꯁꯤꯡ ꯇꯧꯔꯝꯂꯒꯅꯤ
dreams,ꯃꯪꯂꯥꯟ ꯇꯧꯕꯥ
Escape dreams are different from real dreams,ꯑꯦꯁ꯭ꯀꯦꯞ ꯃꯪꯂꯥꯅꯁꯤꯡ ꯑꯁꯤ ꯑꯁꯦꯡꯕꯥ ꯃꯪꯂꯥꯅꯁꯤꯡꯗꯒꯤ ꯇꯣꯉꯥꯜꯂꯤ .
Theyre like escape hatches They constitute a brief vacation from,ꯃꯈꯣꯌꯅꯥ ꯑꯦꯁ꯭ꯀꯦꯞ ꯍꯦꯆꯁꯤꯡ ꯂꯥꯏꯛ ꯃꯈꯣꯌꯅꯥ ꯊꯤꯖꯤꯜꯂꯤꯕꯥ ꯁꯨꯇꯤ
reality and we seem to need them We have escape dreams sometimes,ꯔꯤꯑꯦꯂꯤꯇꯤ ꯑꯃꯁꯨꯡ ꯑꯩꯈꯣꯌꯅꯥ ꯃꯈꯣꯌꯒꯤ ꯃꯊꯧ ꯇꯥꯕꯥ ꯎꯕꯥ ꯐꯪꯏ ꯑꯩꯈꯣꯌꯅꯥ ꯀꯔꯤꯒꯨꯝꯕꯥ ꯃꯇꯃꯗꯥ ꯃꯪꯂꯥꯅꯁꯤꯡꯗꯒꯤ ꯂꯥꯄꯊꯣꯛꯅꯥ ꯂꯩꯔꯤ .
when were on our way to work or when we hear about the lives of the,ꯑꯩꯈꯣꯌꯒꯤ ꯊꯕꯛꯀꯤ ꯂꯝꯕꯤꯗꯥ ꯀꯗꯥꯌꯗꯥ ꯂꯩꯔꯝꯕꯒꯦ ꯅꯠꯔꯒꯥ ꯑꯩꯈꯣꯌꯅꯥ ꯀꯗꯥꯌꯗꯥ ꯇꯥꯈꯤꯕꯒꯦ ꯍꯥꯌꯕꯗꯨ
rich and famous Then we sail off into being an astronaut or a rock star,ꯔꯤꯆ ꯑꯃꯁꯨꯡ ꯃꯃꯤꯡ ꯂꯩꯔꯕꯥ ꯑꯗꯨꯗꯒꯤ ꯑꯩꯈꯣꯌꯅꯥ ꯑꯦꯁ꯭ꯠꯔꯣꯅꯣꯠ ꯅꯠꯔꯒꯥ ꯔꯣꯛ ꯁ꯭ꯇꯥꯔ ꯑꯃꯥ ꯑꯣꯏꯅꯥ ꯆꯦꯜꯂꯤ .
or a sailor on the high seas I dont think we take these escape dreams,ꯅꯠꯔꯒꯥ ꯑꯋꯥꯡꯕꯥ ꯁꯃꯨꯗ꯭ꯔꯗꯥ ꯂꯩꯕꯥ ꯅꯥꯒꯔꯤꯛ ꯑꯃꯥ ꯑꯩꯅꯥ ꯈꯜꯂꯤ ꯑꯩꯈꯣꯌꯅꯥ ꯑꯦꯁ꯭ꯀꯦꯞ ꯗ꯭ꯔꯤꯃꯁꯤꯡ ꯑꯁꯤ ꯂꯧꯏ
very seriously and in fact theyre not real passions just momentary,ꯌꯥꯝꯅꯥ ꯁꯤꯔꯤꯌꯁ ꯑꯣꯏꯅꯥ ꯑꯃꯁꯨꯡ ꯇꯁꯦꯡꯅꯥ ꯃꯈꯣꯌꯅꯥ ꯑꯁꯦꯡꯕꯥ ꯄꯦꯁꯅꯁꯤꯡ ꯈꯛꯇꯃꯛ ꯃꯣꯃꯦꯟꯇꯔꯤ
flights of the imagination But lets take a good look at them because,ꯏꯃꯦꯖꯤꯅꯦꯁꯅꯒꯤ ꯐ꯭ꯂꯥꯏꯠꯁꯤꯡ ꯑꯗꯨꯕꯨ ꯃꯈꯣꯌꯕꯨ ꯑꯐꯕꯥ ꯃꯑꯣꯡꯗꯥ ꯌꯦꯡꯁꯤ ꯃꯔꯃꯗꯤ
they hold some important information about your life,ꯃꯈꯣꯌꯅꯥ ꯅꯍꯥꯛꯀꯤ ꯄꯨꯟꯁꯤꯒꯤ ꯃꯔꯃꯗꯥ ꯃꯔꯨꯑꯣꯏꯕꯥ ꯏꯅꯐꯣꯔꯃꯦꯁꯟ ꯈꯔꯥ ꯊꯝꯂꯤ
Exercise 1 What Are Your Escape Dreams? Do you imagine having millions of dollars batting a home run in,ꯑꯦꯛꯁꯔꯁꯥꯏꯖ 1 ꯅꯍꯥꯛꯀꯤ ꯑꯦꯁ꯭ꯀꯦꯞ ꯃꯪꯂꯥꯅꯁꯤꯡ ꯑꯗꯨ ꯀꯔꯤꯅꯣ?
Yankee Stadium being seduced by the most attractive human being,ꯌꯥꯅꯀꯤ ꯁ꯭ꯇꯦꯗꯤꯌꯝ ꯑꯁꯤ ꯈ꯭ꯕꯥꯏꯗꯒꯤ ꯄꯨꯛꯅꯤꯡ ꯆꯤꯡꯁꯤꯟꯅꯤꯡꯉꯥꯏ ꯑꯣꯏꯕꯥ ꯃꯤꯑꯣꯏ ꯑꯃꯅꯥ ꯂꯃꯖꯤꯡꯕꯤꯕꯥ
alive? Let yourself go Just make sure theyre true fantasies and not,ꯑꯍꯤꯡꯕ?
practical in any way,ꯃꯑꯣꯡ ꯑꯃꯠꯇꯗꯥ ꯄ꯭ꯔꯦꯛꯇꯤꯀꯦꯜ ꯑꯣꯏꯕꯥ .
Joe I imagine being a fighter pilot in a great hot jet plane shooting,ꯖꯣ ꯑꯩꯅꯥ ꯈꯜꯂꯤ ꯑꯆꯧꯕꯥ ꯍꯣꯠ ꯖꯦꯠ ꯄ꯭ꯂꯦꯟ ꯁꯨꯇꯤꯡ ꯑꯃꯗꯥ ꯐꯥꯏꯇꯔ ꯄꯥꯏꯂꯣꯠ ꯑꯃꯥ ꯑꯣꯏꯅꯥ .
down a really dangerous enemy,ꯇꯁꯦꯡꯅꯥ ꯈꯨꯗꯣꯡꯊꯤꯅꯤꯉꯥꯏ ꯑꯣꯏꯕꯥ ꯌꯦꯛꯅꯕꯥ ꯑꯃꯥ .
Gert I just watch lives of the rich and famous Its not their goodies,gert ꯑꯩꯅꯥ ꯈꯖꯤꯛꯇꯪ ꯌꯦꯡꯂꯤꯕꯁꯤꯡ ꯑꯗꯨ ꯔꯤꯆ ꯑꯃꯁꯨꯡ ꯃꯃꯤꯡ ꯂꯩꯔꯕꯥ ꯃꯤꯑꯣꯏꯁꯤꯡꯒꯤ ꯄꯨꯟꯁꯤꯅꯤ ꯃꯁꯤꯒꯤ ꯃꯈꯣꯌꯒꯤ ꯒꯨꯗꯁꯤꯡ ꯑꯗꯨ ꯅꯠꯇꯦ꯫
that impress me its their certainty their carefree attitude They have,that impress me its their shortity ꯃꯈꯣꯌꯒꯤ ꯀꯦꯌꯔꯐ꯭ꯔꯤ ꯑꯦꯇꯤꯆꯨꯗ ꯃꯈꯣꯌꯅꯥ ꯂꯩꯔꯤꯕꯥ
fun and they dont worry,ꯐꯟ ꯑꯃꯁꯨꯡ ꯃꯈꯣꯌꯅꯥ ꯋꯥꯈꯜ ꯋꯥꯕꯥ .
Moe I imagine being a woodsman and a tracker I dont know of what,moe ꯑꯩꯅꯥ ꯏꯃꯥꯖꯤꯟ ꯎꯗꯁꯃꯦꯟ ꯑꯃꯥ ꯑꯣꯏꯕꯥ ꯑꯃꯁꯨꯡ ꯇ꯭ꯔꯦꯀꯥꯔ ꯑꯃꯥ ꯑꯣꯏꯅꯥ ꯑꯩꯅꯥ ꯀꯔꯤ ꯈꯉꯏ ꯃꯗꯨꯗꯤ ꯀꯔꯤ .
I dont want to kill any animals Maybe I track the habits of some,ꯑꯩꯅꯥ ꯁꯥ-ꯁꯟ ꯑꯃꯠꯇꯥ ꯍꯥꯠꯄꯥ ꯄꯥꯃꯗꯦ ꯑꯩꯅꯥ ꯈꯔꯒꯤ ꯂꯃꯆꯠ-ꯁꯥꯖꯠ ꯇ꯭ꯔꯦꯛ ꯇꯧꯕꯥ ꯌꯥꯏ
animal or something And I live in a cabin and read a lot and then I go,ꯑꯦꯅꯤꯃꯦꯜ ꯅꯠꯔꯒꯥ ꯀꯔꯤꯒꯨꯝꯕꯥ ꯑꯃꯠꯇꯥ ꯑꯃꯁꯨꯡ ꯑꯩꯅꯥ ꯀꯦꯕꯤꯟ ꯑꯃꯗꯥ ꯂꯩꯔꯤ ꯑꯃꯁꯨꯡ ꯌꯥꯝꯅꯥ ꯄꯥꯔꯤ ꯑꯃꯁꯨꯡ ꯃꯗꯨꯒꯤ ꯃꯇꯨꯡꯗꯥ ꯑꯩꯅꯥ ꯆꯠꯂꯤ
to a local roadside gas station and restaurant on the Alaska Highway and,ꯑꯂꯥꯁ꯭ꯀꯥ ꯍꯥꯏꯋꯦꯗꯥ ꯂꯩꯕꯥ ꯂꯣꯀꯦꯜ ꯔꯣꯗꯁꯥꯏꯗ ꯒ꯭ꯌꯥꯁ ꯁ꯭ꯇꯦꯁꯟ ꯑꯃꯁꯨꯡ ꯔꯦꯁ꯭ꯇꯣꯔꯦꯟꯇ ꯑꯃꯗꯥ ꯑꯃꯁꯨꯡ ꯌꯨ.ꯑꯦꯁ.
talk to everybody and drink coffee,ꯃꯤꯄꯨꯝ ꯈꯨꯗꯤꯡꯃꯛꯀꯥ ꯋꯥꯔꯤ ꯁꯥꯅꯕꯤꯌꯨ ꯑꯃꯁꯨꯡ ꯀꯣꯐꯤ ꯊꯀꯄꯤꯌꯨ
May Making movies of Borneo of cannibals! Kelly Just getting on a plane first class putting my feet up and,ꯃꯦ ꯁꯦꯝꯕꯥ ꯃꯨꯚꯤꯁꯤꯡ ꯕꯣꯔꯅꯤꯑꯣ ꯑꯣꯐ ꯀꯦꯅꯤꯕꯦꯜ!
getting served champagne flying far away,ꯌꯥꯝꯅꯥ ꯂꯥꯞꯅꯥ ꯎꯔꯤꯕꯥ ꯁꯦꯕꯥ ꯇꯧꯕꯥ ꯆꯦꯝꯄꯤꯌꯟ
Sue Living in a mountaintop monastery where everything is clear and,ꯄꯨꯝꯅꯃꯛ ꯃꯌꯦꯛ ꯁꯦꯡꯅꯥ ꯎꯕꯥ ꯐꯪꯂꯤꯕꯥ ꯃꯥꯎꯟꯇꯟꯇꯣꯞ ꯃꯣꯅꯥꯁ꯭ꯠꯔꯤ ꯑꯃꯗꯥ ꯂꯩꯕꯥ ꯁꯨꯏ ꯑꯃꯁꯨꯡ
quiet So quiet,ꯅꯤꯡꯊꯤꯖꯅꯥ ꯂꯩꯕꯥ
What about you? What did you say? That escape dream holds a powerful clue to something you really,ꯑꯗꯣꯝꯗꯤ ꯀꯝꯗꯧꯕ?
need Its like a photo film negative of your life Whatever in your life is,need its like a Photo film negative of your life ꯑꯗꯣꯃꯒꯤ ꯄꯨꯟꯁꯤꯗꯥ ꯀꯔꯤꯒꯨꯝꯕꯥ ꯑꯃꯠꯇꯥ .
missing wherever a blank spot exists it shows up in this fantasy Joe,ꯕ꯭ꯂꯦꯉ꯭ꯛ ꯁ꯭ꯄꯣꯠ ꯑꯃꯥ ꯂꯩꯕꯥ ꯃꯐꯝ ꯑꯃꯗꯥ ꯃꯥꯡꯈꯤꯕꯥ ꯃꯁꯤꯅꯥ ꯐꯦꯟꯁꯤ ꯖꯣꯏ ꯑꯁꯤꯗꯥ ꯎꯠꯂꯤ
the fighter pilot needs some freedom and power Gert envies the self,ꯐꯥꯏꯇꯔ ꯄꯥꯏꯂꯣꯠꯅꯥ ꯅꯤꯡꯇꯝꯕꯥ ꯑꯃꯁꯨꯡ ꯁꯛꯇꯤ ꯈꯔꯥ ꯃꯊꯧ ꯇꯥꯏ ꯒꯦꯔꯇꯅꯥ ꯁꯦꯜꯐ .
confidence and worryfree lives of the rich and famous Moe needs a,ꯊꯥꯖꯕꯥ ꯑꯃꯁꯨꯡ ꯋꯥꯈꯜ ꯅꯨꯡꯉꯥꯏꯇꯕꯥ ꯄꯨꯟꯁꯤꯁꯤꯡ ꯑꯁꯤ ꯁꯦꯜ ꯌꯥꯝꯅꯥ ꯇꯥꯅꯕꯥ ꯑꯃꯁꯨꯡ ꯃꯃꯤꯡ ꯂꯩꯔꯕꯥ ꯃꯣꯏꯒꯤ ꯃꯊꯧ ꯇꯥꯏ
hideaway thats close to nature and he needs time and he needs friends,hideaway thats close to nature ꯑꯃꯁꯨꯡ ꯃꯍꯥꯛꯅꯥ ꯃꯇꯝ ꯃꯊꯧ ꯇꯥꯏ ꯑꯃꯁꯨꯡ ꯃꯍꯥꯛꯅꯥ ꯃꯔꯨꯄꯁꯤꯡ ꯃꯊꯧ ꯇꯥꯏ
who like to hang out and talk He doesnt really need to go to Alaska if,ꯀꯅꯥꯅꯥ ꯍꯦꯉ꯭ꯒꯠꯂꯒꯥ ꯋꯥꯔꯤ ꯁꯥꯟꯅꯕꯥ ꯄꯥꯝꯂꯤꯕꯒꯦ ꯃꯍꯥꯛꯅꯥ ꯇꯁꯦꯡꯅꯥ ꯑꯂꯥꯁ꯭ꯀꯥꯗꯥ ꯆꯠꯄꯥ ꯃꯊꯧ ꯇꯥꯗꯦ ꯀꯔꯤꯒꯨꯝꯕꯥ .
he doesnt want to,ꯃꯍꯥꯛꯅꯥ ꯄꯥꯃꯗꯦ .
We should all search our escape dreams because they send clues about,ꯑꯩꯈꯣꯌ ꯄꯨꯝꯅꯃꯛꯅꯥ ꯑꯩꯈꯣꯌꯒꯤ ꯑꯦꯁ꯭ꯀꯦꯞ ꯃꯪꯂꯥꯅꯁꯤꯡ ꯑꯗꯨ ꯃꯪꯐꯥꯑꯣꯅꯍꯅꯒꯗꯕꯅꯤ ꯃꯔꯃꯗꯤ ꯃꯈꯣꯌꯅꯥ ꯀ꯭ꯂꯨꯁꯤꯡ ꯑꯗꯨ .
whats wrong with our lives And then we should do something about,ꯑꯩꯈꯣꯌꯒꯤ ꯄꯨꯟꯁꯤꯗꯥ ꯀꯔꯤ ꯑꯔꯥꯅꯕꯥ ꯇꯧꯒꯅꯤ ꯑꯃꯁꯨꯡ ꯃꯗꯨꯒꯤ ꯃꯇꯨꯡꯗꯥ ꯑꯩꯈꯣꯌꯅꯥ ꯀꯔꯤꯒꯨꯝꯕꯥ ꯈꯔꯥ ꯇꯧꯒꯗꯕꯅꯤ .
whats missing Because if you dont use that information to improve your,whats missing ꯃꯔꯃꯗꯤ ꯀꯔꯤꯒꯨꯝꯕꯥ ꯅꯍꯥꯛꯅꯥ ꯏꯅꯐꯣꯔꯃꯦꯁꯟ ꯑꯗꯨ ꯅꯍꯥꯛꯀꯤ ꯐꯒꯠꯍꯟꯅꯕꯥ ꯁꯤꯖꯤꯟꯅꯔꯣꯏꯗꯕꯥ ꯑꯣꯏꯔꯕꯗꯤ꯫
life youre using escape dreams to help you avoid life Use them as a pointer,ꯄꯨꯟꯁꯤ ꯅꯍꯥꯛꯅꯥ ꯑꯦꯁ꯭ꯀꯦꯞ ꯁꯨꯞꯅꯒꯤ ꯁꯤꯖꯤꯟꯅꯗꯨꯅꯥ ꯅꯍꯥꯀꯄꯨ ꯄꯨꯟꯁꯤꯗꯒꯤ ꯂꯥꯄꯊꯣꯀꯍꯅꯕꯗꯥ ꯃꯇꯦꯡ ꯄꯥꯡꯒꯅꯤ ꯃꯈꯣꯌꯁꯤꯡ ꯑꯗꯨ ꯄꯣꯏꯟꯇꯔ ꯑꯃꯥ ꯑꯣꯏꯅꯥ ꯁꯤꯖꯤꯟꯅꯕꯤꯌꯨ
to the next step of your life and you wont be needing them much after,ꯑꯗꯣꯃꯒꯤ ꯄꯨꯟꯁꯤꯒꯤ ꯃꯊꯪꯒꯤ ꯈꯣꯡꯊꯥꯡꯗꯥ ꯑꯃꯁꯨꯡ ꯑꯗꯣꯝꯅꯥ ꯃꯈꯣꯌꯕꯨ ꯌꯥꯝꯅꯥ ꯃꯊꯧ ꯇꯥꯔꯣꯏ ꯑꯃꯁꯨꯡ .
that,ꯃꯗꯨ
Escape dreaming is so grand that in a million years youd never,ꯑꯦꯁ꯭ꯀꯦꯞ ꯗ꯭ꯔꯤꯃꯤꯡ ꯑꯁꯤ ꯑꯁꯨꯛ ꯌꯥꯝꯅꯥ ꯒ꯭ꯔꯦꯟꯗ ꯑꯣꯏꯔꯤ ꯃꯗꯨꯗꯤ ꯆꯍꯤ ꯂꯤꯁꯤꯡ ꯑꯃꯗꯥ ꯌꯨ.ꯗꯤ.
seriously consider doing what you dream about That makes it just,ꯁꯤꯔꯤꯌꯁ ꯑꯣꯏꯅꯥ ꯈꯟꯅꯕꯤꯌꯨ ꯃꯗꯨꯒꯤ ꯃꯇꯥꯡꯗꯥ ꯅꯍꯥꯛꯅꯥ ꯃꯉꯣꯟꯗꯥ ꯁꯨꯞꯅꯒꯤ ꯊꯕꯛ ꯑꯗꯨ ꯇꯧꯅꯕꯥ ꯁꯨꯞꯅꯒꯤ .
another safe activity and youre already too safe Thats not all Escape,ꯑꯇꯣꯞꯄꯥ ꯁꯦꯐ ꯑꯦꯛꯇꯤꯕꯤꯇꯤ ꯑꯃꯗꯤ ꯌꯨꯔꯦ ꯍꯥꯟꯅꯅꯥ ꯌꯥꯝꯅꯥ ꯁꯦꯐ ꯑꯣꯏꯕꯥ thats not all escape
dreaming keeps you from feeling confined and restless with your real,ꯁꯨꯞꯅꯒꯤ ꯅꯍꯥꯛꯀꯤ ꯑꯁꯦꯡꯕꯥ ꯑꯃꯁꯨꯡ ꯋꯥꯈꯜ ꯅꯨꯡꯉꯥꯏꯇꯕꯥ ꯐꯥꯑꯣꯍꯟꯗꯕꯥ ꯑꯃꯁꯨꯡ ꯋꯥꯈꯜ ꯅꯨꯡꯉꯥꯏꯇꯕꯥ ꯐꯥꯑꯣꯍꯟꯗꯕꯥ
life Like a painkiller it can keep you comfortable while youre stuck and,ꯂꯥꯏꯐ ꯂꯥꯏꯛ ꯑꯦ ꯄꯦꯏꯟ ꯀꯤꯂꯥꯔ ꯃꯁꯤꯅꯥ ꯅꯍꯥꯀꯄꯨ ꯅꯨꯡꯉꯥꯏꯅꯥ ꯂꯩꯍꯅꯕꯥ ꯉꯃꯒꯅꯤ ꯅꯍꯥꯛꯅꯥ ꯂꯦꯞꯄꯥ ꯃꯇꯃꯗꯥ ꯑꯃꯁꯨꯡ .
stop you from changing,ꯅꯍꯥꯛꯅꯥ ꯍꯣꯡꯗꯣꯀꯄꯥ ꯊꯤꯡꯕꯤꯌꯨ .
Were going for the big stuff Were going for your real dreams,ꯑꯆꯧꯕꯥ ꯄꯣꯠꯂꯃꯁꯤꯡꯒꯤꯗꯃꯛ ꯆꯠꯈꯤꯕꯥ ꯑꯗꯨ ꯑꯗꯣꯃꯒꯤ ꯑꯁꯦꯡꯕꯥ ꯃꯪꯂꯥꯅꯁꯤꯡꯒꯤꯗꯃꯛ ꯆꯠꯂꯤ
REAL DREAMS,ꯑꯁꯦꯡꯕꯥ ꯃꯪꯂꯥꯅꯁꯤꯡ
Real dreams arent escapist at all The only reason I call them dreams,ꯑꯁꯦꯡꯕꯥ ꯃꯪꯂꯥꯅꯁꯤꯡ ꯑꯁꯤ ꯑꯩꯅꯥ ꯃꯈꯣꯌꯕꯨ ꯁꯨꯞꯅꯒꯤ ꯀꯧꯔꯤꯕꯥ ꯑꯃꯠꯇꯥ ꯉꯥꯏꯔꯕꯥ ꯃꯔꯝ ꯑꯁꯤꯅꯤ
is because theyre in the future When they arrive theyll be very real,ꯃꯔꯃꯗꯤ ꯃꯈꯣꯌꯅꯥ ꯇꯨꯡꯗꯥ ꯂꯥꯀꯄꯥ ꯃꯇꯃꯗꯥ ꯇꯨꯡꯗꯥ ꯃꯈꯣꯌꯅꯥ ꯌꯥꯝꯅꯥ ꯇꯁꯦꯡꯕꯥ ꯑꯣꯏꯒꯅꯤ .
indeed Where escape dreams are shallow real dreams are deep and,ꯇꯁꯦꯡꯅꯃꯛ ꯑꯦꯁ꯭ꯀꯦꯞ ꯃꯪꯂꯥꯅꯁꯤꯡ ꯑꯁꯤ ꯌꯥꯝꯅꯥ ꯂꯨꯕꯥ ꯃꯪꯂꯥꯅꯁꯤꯡ ꯑꯗꯨ ꯑꯁꯦꯡꯕꯥ ꯃꯪꯂꯥꯅꯁꯤꯡ ꯑꯁꯤ ꯌꯥꯝꯅꯥ ꯂꯨꯏ ꯑꯃꯁꯨꯡ .
utterly unique to each of us You rarely see a movie made about real,ꯑꯩꯈꯣꯌ ꯈꯨꯗꯤꯡꯃꯛꯀꯤ ꯃꯄꯨꯡ ꯐꯥꯅꯥ ꯑꯈꯟꯅꯕꯥ ꯑꯃꯥ ꯅꯍꯥꯛꯅꯥ ꯌꯥꯝꯅꯥ ꯊꯦꯡꯅꯥ ꯎꯕꯥ ꯐꯪꯏ ꯃꯗꯨꯗꯤ ꯑꯁꯦꯡꯕꯥ ꯃꯔꯃꯗꯥ ꯁꯦꯝꯕꯥ ꯁꯤꯅꯦꯃꯥ ꯑꯃꯥ
dreams because deep down each of us wants personal pleasures that,ꯃꯪꯂꯥꯅꯁꯤꯡ ꯃꯔꯃꯗꯤ ꯑꯩꯈꯣꯌ ꯈꯨꯗꯤꯡꯃꯛꯅꯥ ꯄꯔꯁꯣꯅꯦꯜ ꯄ꯭ꯂꯦꯁꯔꯁꯤꯡ ꯄꯥꯝꯃꯤ ꯃꯗꯨꯗꯤ .
dont make a million hearts sing only ours We want to see our familys,NOT MAKE A MILLION HEARTS SING ONLY ONLY ꯑꯩꯈꯣꯌꯒꯤ ꯏꯃꯨꯡ ꯃꯅꯨꯡꯁꯤꯡꯒꯥ ꯎꯅꯕꯥ ꯑꯩꯈꯣꯌꯅꯥ ꯄꯥꯝꯂꯤꯕꯥ
homeland or go to school or learn about astronomy We want things we,ꯍꯣꯃꯂꯦꯟꯗ ꯅꯠꯔꯒꯥ ꯁ꯭ꯀꯨꯂꯗꯥ ꯆꯠꯄꯥ ꯅꯠꯔꯒꯥ ꯑꯦꯁ꯭ꯠꯔꯣꯅꯣꯃꯤꯒꯤ ꯃꯔꯃꯗꯥ ꯈꯉꯕꯥ ꯑꯩꯈꯣꯌꯅꯥ ꯄꯣꯠꯁꯤꯡ ꯄꯥꯝꯃꯤ ꯑꯩꯈꯣꯌꯅꯥ
have a hard time explaining to people no matter how sympathetic they,ꯃꯈꯣꯌꯅꯥ ꯀꯌꯥ ꯌꯥꯝꯅꯥ ꯃꯤꯅꯨꯡꯁꯤ ꯂꯩꯠꯔꯕꯥ ꯃꯑꯣꯡꯗꯥ ꯃꯤꯌꯥꯃꯗꯥ ꯈꯉꯍꯅꯕꯗꯥ ꯑꯋꯥꯕꯥ ꯃꯇꯝ ꯑꯃꯥ ꯐꯥꯑꯣꯕꯤꯌꯨ
may be Because real dreams are like our fingerprints They come from,ꯃꯔꯃꯗꯤ ꯑꯁꯦꯡꯕꯥ ꯃꯪꯂꯥꯅꯁꯤꯡ ꯑꯁꯤ ꯑꯩꯈꯣꯌꯒꯤ ꯐꯤꯉ꯭ꯒꯔ ꯄ꯭ꯔꯤꯟꯇꯁꯤꯡꯒꯨꯝꯅꯥ ꯃꯈꯣꯌ ꯑꯁꯤ .
that inner genius I was talking about,ꯑꯩꯅꯥ ꯋꯥꯔꯤ ꯁꯥꯟꯅꯔꯝꯕꯥ ꯑꯗꯨ ꯅꯨꯡꯒꯤ ꯑꯣꯏꯕꯥ ꯖꯤꯅꯤꯁ ꯑꯗꯨ .
You can count on that Anytime theres something you really want,ꯑꯗꯣꯝꯅꯥ ꯇꯁꯦꯡꯅꯥ ꯄꯥꯝꯂꯤꯕꯥ ꯋꯥꯐꯝ ꯑꯃꯥ ꯊꯦꯔꯤꯁ ꯊꯦꯔꯤꯖꯗꯥ ꯊꯥꯖꯕꯥ ꯊꯝꯕꯥ ꯌꯥꯏ .
something that rings a bell inside you and you dont even know why it,ꯑꯗꯣꯃꯒꯤ ꯃꯅꯨꯡꯗꯥ ꯕꯦꯜ ꯑꯃꯥ ꯁꯣꯛꯂꯕꯥ ꯋꯥꯐꯝ ꯑꯃꯥ ꯑꯃꯁꯨꯡ ꯑꯗꯣꯝꯅꯥ ꯀꯔꯤꯒꯤꯅꯣ ꯍꯥꯌꯕꯥ ꯐꯥꯑꯣꯕꯥ ꯈꯉꯗꯦ .
comes from a part of you that is unlike anyone else Thats the real you,ꯑꯗꯣꯃꯒꯤ ꯁꯔꯨꯛ ꯑꯃꯗꯒꯤ ꯂꯥꯀꯄꯅꯤ ꯃꯗꯨꯗꯤ ꯑꯇꯣꯞꯄꯥ ꯀꯅꯥꯒꯨꯝꯕꯥ ꯑꯃꯒꯥ ꯃꯥꯟꯅꯗꯕꯥ ꯑꯗꯨꯅꯤ ꯃꯗꯨꯗꯤ ꯑꯁꯦꯡꯕꯥ ꯅꯍꯥꯛ
the one with original vision who sees the world in a way that is all your,ꯃꯥꯂꯦꯝ ꯑꯁꯤꯕꯨ ꯑꯗꯣꯃꯒꯤ ꯄꯨꯝꯅꯃꯛ ꯑꯣꯏꯕꯥ ꯃꯑꯣꯡꯗꯥ ꯎꯕꯥ ꯉꯝꯕꯥ ꯑꯔꯤꯕꯥ ꯃꯤꯠꯌꯦꯡ ꯑꯗꯨ .
own,ꯏꯁꯥꯒꯤ ꯑꯣꯏꯕ
Unlike escape dreams you dont muse easily about real dreams As a,ꯑꯦꯁ꯭ꯀꯦꯞ ꯗ꯭ꯔꯤꯃꯁꯤꯡꯒꯥ ꯃꯥꯟꯅꯗꯕꯥ ꯅꯍꯥꯛꯅꯥ ꯇꯁꯦꯡꯅꯥ ꯃꯪꯂꯥꯅꯒꯤ ꯃꯇꯥꯡꯗꯥ ꯐꯖꯅꯥ ꯃ꯭ꯌꯨꯖ ꯇꯧꯗꯦ as as
matter of fact you might have to go digging to find them because they,ꯃꯦꯇꯔ ꯑꯣꯐ ꯐꯦꯛꯇ ꯅꯍꯥꯛꯅꯥ ꯃꯈꯣꯌꯕꯨ ꯊꯤꯅꯕꯒꯤꯗꯃꯛ ꯈꯟꯗꯨꯅꯥ ꯆꯠꯄꯥ ꯇꯥꯕꯅꯤ ꯃꯔꯃꯗꯤ ꯃꯈꯣꯌꯅꯥ .
often hide themselves Why? Because remembering them can be a very,ꯑꯌꯥꯝꯕꯥ ꯃꯇꯃꯗꯥ ꯃꯈꯣꯌ ꯃꯁꯥꯕꯨ ꯀꯔꯤꯒꯤꯅꯣ?
emotional experience,ꯏꯃꯣꯁꯅꯦꯜ ꯑꯦꯛꯁꯄꯔꯤꯑꯦꯟꯁ
They are the stuff that true adventure is made of Its an interesting thing,ꯃꯈꯣꯌꯁꯤꯡ ꯑꯁꯤ ꯇ꯭ꯔꯨ ꯑꯦꯗꯚꯦꯟꯆꯔ ꯑꯁꯤ ꯃꯁꯤꯒꯤ ꯏꯟꯇꯔꯦꯁ꯭ꯇꯤꯡ ꯑꯣꯏꯕꯥ ꯋꯥꯐꯝ ꯑꯃꯅꯤ ꯍꯥꯌꯅꯥ ꯂꯧꯕꯥ ꯄꯣꯠꯂꯃꯁꯤꯡꯅꯤ .
to note that grandiose escape dreamslike flying jet fighters or,ꯅꯣꯠ ꯇꯧꯅꯕꯥ ꯍꯥꯌꯔꯕꯗꯥ ꯒ꯭ꯔꯦꯟꯗꯤꯌꯁ ꯑꯦꯁ꯭ꯀꯦꯞ ꯁꯨꯞꯅꯒꯤ ꯎꯔꯤꯕꯥ ꯖꯦꯠ ꯐꯥꯏꯇꯔꯁꯤꯡ ꯅꯠꯔꯒꯥ
wrestling alligatorsare very easy to think about and very risky to,ꯔꯦꯁ꯭ꯇꯂꯤꯡ ꯑꯦꯂꯤꯒꯦꯇꯔꯁꯤꯡ ꯑꯁꯤ ꯌꯥꯝꯅꯥ ꯂꯥꯏꯅꯥ ꯈꯅꯕꯥ ꯑꯃꯁꯨꯡ ꯌꯥꯝꯅꯥ ꯔꯤꯁ꯭ꯛ ꯂꯩꯕꯥ .
actually do while real dreamslike asking someone to marry you or,ꯇꯁꯦꯡꯅꯥ ꯇꯧꯕꯥ ꯃꯇꯃꯗꯥ ꯑꯁꯦꯡꯕꯥ ꯁꯨꯞꯅꯒꯤ ꯀꯅꯥꯒꯨꯝꯕꯥ ꯑꯃꯅꯥ ꯅꯍꯥꯀꯄꯨ ꯂꯨꯍꯣꯡꯅꯕꯥ ꯍꯥꯌꯔꯀꯄꯥ ꯃꯇꯃꯗꯥ ꯅꯠꯠꯔꯒꯥ
deciding to go back to school at the age of fiftyscare the hell out of,ꯆꯍꯤ ꯐꯤꯐꯇꯤꯁꯀꯦꯌꯔ ꯗ ꯍꯦꯜ ꯑꯥꯎꯠ ꯑꯣꯐ ꯑꯩꯆ.ꯑꯥꯏ.ꯇꯤ.
you when you think about them and usually involve no real risk at all,ꯅꯍꯥꯛꯅꯥ ꯃꯈꯣꯌꯒꯤ ꯃꯔꯃꯗꯥ ꯈꯜꯂꯀꯄꯥ ꯃꯇꯃꯗꯥ ꯑꯃꯁꯨꯡ ꯃꯍꯧꯁꯥꯅꯥ ꯑꯁꯦꯡꯕꯥ ꯔꯤꯁ꯭ꯛ ꯑꯃꯠꯇꯥ ꯌꯥꯎꯗꯦ꯫
As I said real dreams dont require you to abandon your family quit,ꯑꯩꯅꯥ ꯍꯥꯌꯈꯤꯕꯒꯨꯝꯅꯥ ꯑꯁꯦꯡꯕꯥ ꯃꯪꯂꯥꯅꯁꯤꯡ ꯑꯁꯤ ꯅꯍꯥꯛꯅꯥ ꯅꯍꯥꯛꯀꯤ ꯏꯃꯨꯡ ꯃꯅꯨꯡ ꯊꯥꯗꯣꯀꯄꯥ ꯃꯊꯧ ꯇꯥꯗꯦ ꯀ꯭ꯕꯤꯠ
your job and move to Tahiti with your paintbrush They just require,ꯑꯗꯣꯃꯒꯤ ꯊꯕꯛ ꯑꯃꯁꯨꯡ ꯑꯗꯣꯃꯒꯤ ꯄꯦꯟꯇꯕ꯭ꯔꯥꯁꯀꯥ ꯂꯣꯌꯅꯅꯥ ꯇꯥꯍꯤꯇꯤꯗꯥ ꯆꯪꯕꯤꯌꯨ ꯃꯈꯣꯌꯅꯥ ꯈꯛꯇꯃꯛ ꯃꯊꯧ ꯇꯥꯏ꯫
that you search your soul for that deep dream you put asideand go for,ꯑꯗꯣꯝꯅꯥ ꯑꯗꯣꯃꯒꯤ ꯊꯋꯥꯏ ꯑꯗꯨ ꯑꯗꯣꯝꯅꯥ ꯃꯄꯥꯟꯗꯥ ꯊꯝꯂꯤꯕꯥ ꯑꯗꯨꯒꯨꯝꯂꯕꯥ ꯑꯊꯣꯏꯕꯥ ꯃꯪꯂꯥꯟ ꯑꯗꯨ ꯃꯪꯐꯥꯑꯣꯅꯍꯅꯕꯥ ꯑꯗꯨꯅꯤ ꯑꯃꯁꯨꯡ ꯃꯗꯨꯒꯤꯗꯃꯛ ꯆꯠꯂꯨ .
it,ꯃꯁꯤ
And watch your life light up,ꯑꯃꯁꯨꯡ ꯅꯍꯥꯛꯀꯤ ꯄꯨꯟꯁꯤꯕꯨ ꯃꯉꯥꯜ ꯄꯤꯕꯥ ꯌꯦꯡꯕꯤꯌꯨ
You will find that the difference between your life when youre just,ꯑꯗꯣꯝꯅꯥ ꯑꯗꯣꯃꯒꯤ ꯄꯨꯟꯁꯤꯒꯤ ꯃꯔꯛꯇꯥ ꯂꯩꯔꯤꯕꯥ ꯈꯦꯠꯅꯕꯥ ꯑꯗꯨ ꯑꯗꯣꯝꯅꯥ ꯈꯖꯤꯛꯇꯪ ꯈꯖꯤꯛꯇꯪ .
marking time and your life when youre involved with a personal,ꯃꯥꯔꯛ ꯇꯧꯕꯥ ꯃꯇꯝ ꯑꯃꯁꯨꯡ ꯅꯍꯥꯛꯀꯤ ꯄꯨꯟꯁꯤ ꯑꯗꯨ ꯅꯍꯥꯛꯅꯥ ꯄꯔꯁꯣꯅꯦꯜ ꯑꯃꯒꯥ ꯃꯔꯤ ꯂꯩꯅꯕꯥ ꯃꯇꯃꯗꯥ .
beloved dream is astonishing,ꯅꯨꯡꯁꯤꯖꯔꯕꯥ ꯃꯪꯂꯥꯟ ꯑꯁꯤ ꯑꯉꯀꯄꯥ ꯑꯃꯅꯤ
There you are All your excuses are gone,ꯃꯐꯝ ꯑꯗꯨꯗꯥ ꯅꯈꯣꯌꯅꯥ ꯅꯈꯣꯌꯒꯤ ꯑꯦꯛꯁꯛꯌꯨꯖ ꯄꯨꯝꯅꯃꯛ ꯂꯣꯏꯔꯦ .
So why are you still scared? Because although you dont have to give up a life of security to lead a,ꯑꯗꯨꯅꯥ ꯀꯔꯤꯒꯤꯗꯃꯛ ꯍꯧꯖꯤꯛ ꯐꯥꯑꯣꯕꯥ ꯂꯥꯡꯇꯛꯅꯔꯤꯕꯅꯣ?
life of adventure you do have to take an emotional chance when you let,ꯂꯥꯏꯐ ꯑꯣꯐ ꯑꯦꯗꯚꯦꯟꯆꯔ ꯅꯍꯥꯛꯅꯥ ꯂꯦꯠ ꯇꯧꯕꯥ ꯃꯇꯃꯗꯥ ꯏꯃꯣꯁꯅꯦꯜ ꯆꯥꯟꯁ ꯑꯃꯥ ꯂꯧꯕꯥ ꯇꯥꯕꯅꯤ
yourself love something Daring to live your dream is very intense It,ꯅꯍꯥꯛꯀꯤ ꯃꯪꯂꯥꯟ ꯑꯗꯨ ꯍꯤꯡꯅꯕꯒꯤ ꯊꯧꯅꯥ ꯂꯩꯕꯥ ꯄꯣꯠꯁꯛ ꯑꯃꯥ ꯅꯍꯥꯛꯀꯤ ꯏꯁꯥꯅꯥ ꯅꯨꯡꯁꯤꯖꯩ ꯑꯁꯤ ꯌꯥꯝꯅꯥ ꯏꯅꯇꯦꯟꯁ ꯑꯣꯏꯔꯦ ꯃꯁꯤ
fully productive even thinking that you have the right to live a,ꯃꯄꯨꯡ ꯐꯥꯅꯥ ꯄ꯭ꯔꯗꯛꯇꯤꯕ ꯑꯣꯏꯕꯥ ꯐꯥꯑꯣꯕꯥ ꯅꯍꯥꯛꯅꯥ ꯍꯤꯡꯅꯕꯒꯤ ꯍꯛ ꯂꯩ ꯍꯥꯌꯅꯥ ꯈꯅꯕꯥ ꯐꯥꯑꯣꯕꯥ .
wonderful lifethis is no small matter Thats where the real fear is,ꯑꯉꯀꯄꯥ ꯄꯨꯟꯁꯤ ꯑꯁꯤ ꯑꯁꯦꯡꯕꯥ ꯑꯀꯤꯕꯥ ꯑꯗꯨ ꯀꯗꯥꯏꯗꯥ ꯂꯩꯕꯒꯦ ꯍꯥꯌꯕꯗꯨ ꯑꯄꯤꯀꯄꯥ ꯋꯥꯐꯝ ꯑꯃꯠꯇꯥ ꯂꯩꯇꯦ꯫
its much too risky to move Let me give you a very common example,ꯃꯁꯤꯒꯤ ꯌꯥꯝꯅꯥ ꯔꯤꯁ꯭ꯛ ꯂꯩꯕꯥ ꯑꯁꯤ ꯆꯠꯊꯣꯛ ꯆꯠꯁꯤꯟ ꯇꯧꯕꯥ ꯌꯥꯍꯅꯕꯤꯌꯨ ꯑꯩꯅꯥ ꯑꯗꯣꯃꯗꯥ ꯌꯥꯝꯅꯥ ꯀꯃꯟ ꯑꯣꯏꯕꯥ ꯈꯨꯗꯝ ꯑꯃꯥ ꯄꯤꯕꯤꯌꯨ
Jerry says he has to change his whole lifestyle to follow his dream of,ꯖꯦꯔꯤꯅꯥ ꯍꯥꯌ ꯃꯗꯨꯗꯤ ꯃꯍꯥꯛꯅꯥ ꯃꯍꯥꯛꯀꯤ ꯃꯪꯂꯥꯟ ꯑꯗꯨ ꯃꯪꯐꯥꯑꯣꯅꯍꯟꯅꯕꯥ ꯃꯍꯥꯛꯀꯤ ꯄꯨꯟꯁꯤ ꯃꯍꯤꯡ ꯄꯨꯝꯅꯃꯛ ꯍꯣꯡꯗꯣꯀꯄꯥ ꯇꯥꯏ
because my job exhausts me Anyway my wife has a right to expect us,ꯃꯔꯃꯗꯤ ꯑꯩꯒꯤ ꯊꯕꯛꯅꯥ ꯑꯩꯕꯨ ꯀꯔꯤꯒꯨꯝꯕꯥ ꯃꯑꯣꯡ ꯑꯃꯗꯥ ꯑꯩꯒꯤ ꯅꯨꯄꯤꯅꯥ ꯑꯩꯈꯣꯌꯕꯨ ꯑꯦꯛꯁꯄꯦꯛꯇ ꯇꯧꯕꯒꯤ ꯍꯛ ꯂꯩꯔꯤ
to spend some time together,ꯄꯨꯟꯅꯥ ꯃꯇꯝ ꯈꯔꯥ ꯂꯦꯅꯃꯤꯟꯅꯅꯕꯥ .
His wife laughed Are you kidding? Hes so unhappy that I spend the,ꯃꯍꯥꯛꯀꯤ ꯅꯨꯄꯤꯅꯥ ꯅꯣꯀꯈꯤꯕꯔꯥ ꯅꯉꯅꯥ ꯋꯥꯔꯤ ꯁꯥꯔꯤꯕꯔꯥ?
whole evening consoling him I wish hed do anything that would make,ꯍꯣꯜ ꯏꯚꯤꯅꯤꯡ ꯀꯟꯁꯣꯂꯤꯡ ꯃꯍꯥꯀꯄꯨ ꯑꯩꯅꯥ ꯋꯥꯁꯀꯆꯔꯤ ꯃꯗꯨꯗꯤ ꯀꯔꯤꯒꯨꯝꯕꯥ ꯈꯔꯥ ꯇꯧꯕꯥ ꯌꯥꯕꯥ ꯀꯔꯤꯒꯨꯝꯕꯥ ꯈꯔꯥ ꯇꯧꯕꯥ
him happy! Ive got my own stuff to do! Jerry blushed and said that was probably true I write and edit all,ꯃꯍꯥꯛ ꯅꯨꯡꯉꯥꯏꯕꯥ ꯐꯥꯑꯣꯏ!
day They love me there Im good at what I do I even have a future,day ꯃꯈꯣꯌꯅꯥ ꯑꯩꯕꯨ ꯅꯨꯡꯁꯤꯖꯩ ꯃꯐꯝ ꯑꯗꯨꯗꯥ ꯏꯝ ꯒꯨꯗ ꯑꯦꯠ ꯑꯩꯅꯥ ꯇꯧꯔꯤꯕꯥ ꯑꯁꯤ ꯑꯩꯒꯤ ꯇꯨꯡꯒꯤ ꯐꯤꯕꯝ ꯐꯥꯑꯣꯕꯥ ꯂꯩꯔꯤ
with this company But I cant bear to think that Im going to end up an,ꯀꯝꯄꯦꯅꯤ ꯑꯁꯤꯒꯥ ꯂꯣꯌꯅꯅꯥ ꯑꯗꯨꯕꯨ ꯑꯩꯍꯥꯛꯅꯥ ꯋꯥꯈꯜ ꯈꯅꯕꯥ ꯉꯃꯗꯦ ꯃꯗꯨꯗꯤ ꯏꯝ ꯒꯣꯌꯤꯡ ꯇꯨ ꯑꯦꯟꯗ ꯑꯞ ꯑꯦ .
editor It makes me resent the hell out of this job which is probably,ꯑꯦꯗꯤꯇꯔ ꯃꯁꯤꯅꯥ ꯑꯩꯍꯥꯀꯄꯨ ꯊꯕꯛ ꯑꯁꯤꯗꯒꯤ ꯍꯦꯜ ꯑꯥꯎꯠ ꯇꯧꯕꯗꯥ ꯅꯨꯡꯉꯥꯏꯇꯕꯥ ꯐꯥꯑꯣꯍꯜꯂꯤ ꯃꯗꯨꯗꯤ ꯃꯁꯤ ꯑꯣꯏꯔꯃꯒꯅꯤ꯫
what exhausts me Look I wrote wonderful plays in college I won,what exhouss me look ꯑꯩꯅꯥ ꯀꯣꯂꯦꯖꯇꯥ ꯑꯉꯀꯄꯥ ꯄ꯭ꯂꯦꯁꯤꯡ ꯏꯈꯤ ꯑꯩꯅꯥ ꯃꯥꯏ ꯄꯥꯀꯈꯤ
prizes! I had a great future! I cant write with this damned job And I,ꯃꯅꯥꯁꯤꯡ!
cant quit it either Im not willing to starve and live in a garret,ꯀꯦꯟꯇ ꯀ꯭ꯕꯤꯠ ꯏꯠ ꯅꯠꯔꯒꯥ ꯏꯝ ꯅꯠ ꯋꯤꯂꯤꯡ ꯇꯨ ꯁ꯭ꯇꯥꯔꯚ ꯑꯦꯟꯗ ꯂꯥꯏꯚ ꯏꯟ ꯑꯦ ꯒ꯭ꯌꯥꯔꯦꯠ
Mary Jane and Donna thought like Jerry,ꯃꯦꯔꯤ ꯖꯦꯟ ꯑꯃꯁꯨꯡ ꯗꯣꯅꯥꯅꯥ ꯖꯦꯔꯤꯒꯨꯝꯅꯥ ꯈꯅꯈꯤ
Mary Jane I have to leave my job That way Ill be forced to take the,ꯃꯦꯔꯤ ꯖꯦꯟ ꯑꯩꯅꯥ ꯑꯩꯒꯤ ꯊꯕꯛ ꯑꯗꯨ ꯊꯥꯗꯣꯀꯄꯥ ꯇꯥꯏ ꯃꯗꯨꯗꯤ ill ill be fort to take the take
big chance and sing professionally,ꯑꯆꯧꯕꯥ ꯆꯥꯟꯁ ꯑꯃꯁꯨꯡ ꯄ꯭ꯔꯣꯐꯦꯁꯅꯦꯜ ꯑꯣꯏꯅꯥ ꯏꯁꯩ ꯁꯀꯄꯥ
Donna I have to leave this secretarial job or Ill be inferior like my,ꯗꯣꯅꯥ ꯑꯩꯅꯥ ꯁꯦꯛꯔꯦꯇꯔꯤꯒꯤ ꯊꯕꯛ ꯑꯁꯤ ꯊꯥꯗꯣꯀꯄꯥ ꯇꯥꯏ ꯅꯠꯔꯒꯥ ꯑꯩꯒꯤ ꯃꯇꯧꯒꯨꯝ ꯏꯅꯐꯦꯔꯤꯌꯔ ꯑꯣꯏꯕꯥ ꯇꯥꯏ꯫
sisters said I was,ꯁꯤꯁ꯭ꯇꯔꯁꯤꯡꯅꯥ ꯍꯥꯌꯈꯤ ꯑꯩꯍꯥꯛ .
But Jerry Mary Jane and Donna have it all wrong They think they,ꯑꯗꯨꯕꯨ ꯖꯦꯔꯤ ꯃꯦꯔꯤ ꯖꯦꯟ ꯑꯃꯁꯨꯡ ꯗꯣꯅꯥꯅꯥ ꯄꯨꯝꯅꯃꯛ ꯑꯔꯥꯅꯕꯥ ꯇꯧꯏ ꯃꯈꯣꯌꯅꯥ ꯈꯜꯂꯤ
cant succeed because of their jobs In fact they cant succeed without,ꯃꯈꯣꯌꯒꯤ ꯊꯕꯀꯁꯤꯡꯅꯥ ꯃꯔꯝ ꯑꯣꯏꯗꯨꯅꯥ ꯃꯈꯣꯌꯅꯥ ꯃꯥꯌ ꯄꯥꯀꯄꯥ ꯉꯃꯗꯦ ꯃꯈꯣꯌꯅꯥ ꯃꯥꯌ ꯄꯥꯀꯄꯥ ꯉꯃꯗꯦ ꯌꯥꯑꯣꯗꯅꯥ
them! Ill show what I mean,ꯃꯈꯣꯏ!
Exercise 2 An Exercise for Job Haters,ꯑꯦꯛꯁꯔꯁꯥꯏꯖ ꯲ ꯊꯕꯛ ꯍꯦꯇꯔꯁꯤꯡꯒꯤꯗꯃꯛ ꯑꯦꯛꯁꯔꯁꯥꯏꯖ ꯑꯃꯥ
Take out a pencil and paper and write across the top of the page I,ꯄꯦꯟꯁꯤꯜ ꯑꯃꯁꯨꯡ ꯄꯦꯄꯔ ꯑꯃꯥ ꯂꯧꯊꯣꯀꯎ ꯑꯃꯁꯨꯡ ꯄꯦꯖ ꯑꯗꯨꯒꯤ ꯃꯊꯛꯇꯥ ꯏꯕꯤꯌꯨ I
dont want to like this job because,ꯊꯕꯛ ꯑꯁꯤ ꯂꯥꯏꯛ ꯇꯧꯕꯥ ꯄꯥꯃꯗꯦ ꯃꯔꯃꯗꯤ
