en,mni-Mtei
and I shall now proceed to consider them in the order in which they stand in,ꯑꯃꯁꯨꯡ ꯑꯩꯍꯥꯛꯅꯥ ꯍꯧꯖꯤꯛ ꯃꯈꯣꯌꯕꯨ ꯃꯈꯣꯌꯅꯥ ꯂꯦꯞꯂꯤꯕꯥ ꯑꯣꯔꯗꯔ ꯑꯗꯨꯗꯥ ꯈꯟꯅꯅꯕꯥ ꯃꯈꯥ ꯆꯠꯊꯒꯅꯤ꯫
the table,ꯇꯦꯕꯜ ꯑꯗꯨ .
[27] All combination (conjunctio) is either composition (compositio) or,[27] ꯀꯝꯕꯤꯅꯦꯁꯟ ꯄꯨꯝꯅꯃꯛ (ꯀꯟꯖꯨꯃꯇꯤꯑꯣ) ꯑꯁꯤ ꯀꯝꯄꯣꯖꯤꯁꯟ (ꯀꯝꯄꯣꯖꯤꯇꯤꯚ) ꯅꯠꯠꯔꯒꯥ .
"connection (nexus). The former is the synthesis of a manifold, the parts of which",ꯀꯅꯦꯛꯁꯟ (ꯅꯦꯛꯁꯁ)꯫
"do not necessarily belong to each other. For example, the two triangles into",ꯑꯃꯒꯥ ꯑꯃꯒꯥ ꯇꯉꯥꯏꯐꯗꯅꯥ ꯂꯩꯔꯣꯏꯗꯕꯅꯤ꯫
"which a square is divided by a diagonal, do not necessarily belong to each other,","ꯁ꯭ꯛꯕ꯭ꯌꯥꯔ ꯑꯃꯅꯥ ꯗꯥꯏꯒꯣꯟ ꯑꯃꯅꯥ ꯈꯥꯌꯗꯣꯀꯄꯥ, ꯑꯃꯒꯥ ꯑꯃꯒꯥ ꯇꯉꯥꯏꯐꯗꯅꯥ ꯂꯩꯕꯥ ꯅꯠꯇꯦ, ."
and of this kind is the synthesis of the homogeneous in everything that can be,ꯑꯃꯁꯨꯡ ꯃꯁꯤꯒꯤ ꯃꯈꯜ ꯑꯁꯤꯒꯤ ꯃꯅꯨꯡꯗꯥ ꯌꯥꯑꯣꯕꯥ ꯌꯥꯕꯥ ꯄꯣꯠ ꯈꯨꯗꯤꯡꯃꯛꯇꯥ ꯍꯣꯃꯣꯖꯦꯅꯤꯛ ꯑꯣꯏꯕꯥ ꯁꯤꯟꯊꯦꯁꯤꯁꯅꯤ꯫
mathematically considered. This synthesis can be divided into those of,ꯃꯦꯊꯃꯦꯇꯤꯀꯦꯜ ꯑꯣꯏꯅꯥ ꯈꯟꯅꯈꯤ꯫
"aggregation and coalition, the former of which is applied to extensive, the latter","ꯑꯦꯒ꯭ꯔꯤꯒꯦꯁꯟ ꯑꯃꯁꯨꯡ ꯀꯣꯑꯣꯂꯤꯁꯟ, ꯃꯗꯨꯒꯤ ꯍꯥꯟꯅꯒꯤ ꯑꯗꯨ ꯄꯥꯛ ꯁꯟꯅꯥ ​​ꯆꯠꯅꯩ, ꯇꯨꯡꯒꯤ ."
to intensive quantities. The second sort of combination (nexus) is the synthesis,ꯏꯟꯇꯦꯟꯁꯤꯕ ꯀ꯭ꯕꯥꯟꯇꯤꯇꯤꯁꯤꯡꯗꯥ꯫
"of a manifold, in so far as its parts do belong necessarily to each other; for","ꯃꯦꯅꯤꯐꯣꯜꯗ ꯑꯃꯒꯤ, ꯃꯁꯤꯒꯤ ꯁꯔꯨꯀꯁꯤꯡ ꯑꯁꯤ ꯑꯃꯒꯥ ꯑꯃꯒꯥ ꯇꯉꯥꯏꯐꯗꯅꯥ ꯂꯩꯕꯒꯨꯝ;"
"example, the accident to a substance, or the effect to the cause. Consequently it is","ꯈꯨꯗꯝ ꯑꯣꯏꯅꯥ, ꯄꯣꯠꯁꯛ ꯑꯃꯗꯥ ꯑꯦꯛꯁꯤꯗꯦꯟꯇ, ꯅꯠꯠꯔꯒꯥ ꯃꯔꯝ ꯑꯗꯨꯗꯥ ꯄꯤꯕꯥ ꯏꯐꯦꯛꯇ ꯑꯗꯨ꯫"
"a synthesis of that which though heterogeneous, is represented as connected à","ꯍꯦꯇꯦꯔꯣꯖꯦꯅꯤꯛ ꯑꯣꯏꯔꯕꯁꯨ, ꯀꯟꯅꯦꯛꯇ ꯇꯧꯕꯥ à ."
priori. This combination—not an arbitrary one—I entitle dynamical because it,ꯄ꯭ꯔꯥꯏꯑꯣꯔꯤꯇꯤ ꯑꯣꯏꯕꯥ꯫
"concerns the connection of the existence of the manifold. This, again, may be",ꯃꯦꯅꯤꯐꯣꯜꯗꯀꯤ ꯂꯩꯔꯤꯕꯥ ꯑꯁꯤꯒꯥ ꯃꯔꯤ ꯂꯩꯅꯕꯒꯥ ꯃꯔꯤ ꯂꯩꯅꯩ꯫
"divided into the physical synthesis, of the phenomena divided among each other,","ꯐꯤꯖꯤꯀꯦꯜ ꯁꯤꯟꯊꯦꯁꯤꯁꯇꯥ ꯈꯥꯌꯗꯣꯀꯄꯥ, ꯑꯃꯒꯥ ꯑꯃꯒꯥ ꯃꯔꯛꯇꯥ ꯈꯥꯌꯗꯣꯀꯄꯥ ꯐꯤꯚꯃꯁꯤꯡꯒꯤ,"
"and the metaphysical synthesis, or the connection of phenomena à priori in the","ꯑꯃꯁꯨꯡ ꯃꯦꯇꯥꯐꯤꯁꯤꯀꯦꯜ ꯁꯤꯟꯊꯦꯁꯤꯁ, ꯅꯠꯔꯒꯥ ꯐꯤꯅꯣꯃꯦꯅꯥ à ꯄ꯭ꯔꯥꯏꯑꯣꯔꯤꯒꯤ ꯀꯅꯦꯛꯁꯟ ꯑꯗꯨ ."
faculty of cognition,ꯐꯦꯀꯜꯇꯤ ꯑꯣꯐ ꯀꯣꯒꯅꯤꯁꯟ .
1. AXIOMS OF INTUITION,꯱.ꯏꯟꯠꯌꯨꯏꯇꯤꯖꯃꯒꯤ ꯑꯦꯛꯁꯤꯃꯁꯤꯡ .
The principle of these is: All Intuitions are Extensive Quantities,ꯃꯁꯤꯒꯤ ꯄ꯭ꯔꯤꯟꯁꯤꯄꯜ ꯑꯁꯤ: ꯏꯟꯠꯌꯨꯏꯇꯤ ꯄꯨꯝꯅꯃꯛ ꯑꯁꯤ ꯄꯥꯛ ꯆꯥꯎꯔꯕꯥ ꯃꯁꯤꯡꯅꯤ .
PROOF,ꯁꯥꯈꯤ
"All phenomena contain, as regards their form, an intuition in space and","ꯐꯤꯚꯝ ꯄꯨꯝꯅꯃꯛꯇꯥ ꯃꯈꯣꯌꯒꯤ ꯃꯑꯣꯡ ꯃꯇꯧꯒꯤ ꯃꯇꯥꯡꯗꯥ, ꯁ꯭ꯄꯦꯁꯇꯥ ꯏꯟꯠꯌꯨꯏꯇꯤꯖꯝ ꯑꯃꯥ ꯑꯃꯁꯨꯡ ."
"time, which lies à priori at the foundation of all without exception","ꯃꯇꯝ, ꯃꯁꯤꯅꯥ à priori at the foundation of all oal without exception"
"Phenomena, therefore, cannot be apprehended, that is, received into","ꯃꯔꯝ ꯑꯗꯨꯅꯥ ꯐꯤꯚꯃꯁꯤꯡ ꯑꯁꯤ ꯂꯧꯁꯤꯅꯕꯥ ꯉꯃꯗꯦ, ꯍꯥꯌꯕꯗꯤ 2019ꯗꯥ꯫"
"empirical consciousness otherwise than through the synthesis of a manifold,","ꯃꯦꯅꯤꯐꯣꯜꯗ ꯑꯃꯒꯤ ꯁꯤꯟꯊꯦꯁꯤꯁꯀꯤ ꯈꯨꯠꯊꯥꯡꯗꯥ ꯅꯠꯇꯅꯥ ꯑꯇꯣꯞꯄꯥ ꯃꯑꯣꯡ ꯑꯃꯗꯥ ꯑꯦꯝꯄꯤꯔꯤꯀꯦꯜ ꯀꯟꯁꯆꯤꯌꯟꯁ,"
through which the representations of a determinate space or time are,ꯃꯁꯤꯒꯤ ꯈꯨꯠꯊꯥꯡꯗꯥ ꯗꯤꯇꯔꯃꯤꯅꯦꯠ ꯁ꯭ꯄꯦꯁ ꯅꯠꯠꯔꯒꯥ ꯃꯇꯝ ꯑꯃꯒꯤ ꯔꯤꯞꯔꯖꯦꯟꯇꯦꯁꯅꯁꯤꯡ ꯑꯁꯤ .
"generated; that is to say, through the composition of the homogeneous and",ꯁꯦꯃꯒꯠꯄꯥ;
the consciousness of the synthetical unity of this manifold (homogeneous),ꯃꯁꯤꯒꯤ ꯃꯦꯅꯤꯐꯣꯜꯗ ꯑꯁꯤꯒꯤ ꯁꯤꯟꯊꯦꯇꯤꯛ ꯑꯣꯏꯕꯥ ꯑꯄꯨꯅꯕꯥ (ꯍꯣꯃꯣꯖꯦꯅꯤꯛ) ꯑꯁꯤꯒꯤ ꯀꯟꯁꯇꯤꯠꯌꯨꯁꯟ
"Now the consciousness of a homogeneous manifold in intuition, in so far as","ꯍꯧꯖꯤꯛ ꯏꯟꯠꯌꯨꯏꯇꯤꯖꯃꯗꯥ ꯍꯣꯃꯣꯖꯦꯅꯤꯛ ꯃꯦꯅꯤꯐꯣꯜꯗ ꯑꯃꯒꯤ ꯀꯟꯁꯆꯤꯌꯟꯁ, ꯏꯟ ꯏꯟꯇꯤꯎꯇꯤꯖ"
"thereby the representation of an object is rendered possible, is the","ꯃꯁꯤꯅꯥ ꯄꯣꯠꯁꯛ ꯑꯃꯒꯤ ꯔꯤꯞꯔꯖꯦꯟꯇꯦꯁꯟ ꯑꯁꯤ ꯑꯣꯏꯊꯣꯀꯄꯥ ꯌꯥꯕꯥ ꯑꯣꯏꯍꯜꯂꯤ, ."
"conception of a quantity (quanti). Consequently, even the perception of an",ꯀ꯭ꯕꯥꯟꯇꯤꯇꯤ ꯑꯃꯒꯤ ꯀꯟꯁꯦꯄꯁꯟ (ꯀ꯭ꯕꯥꯟꯇꯤ)꯫
object as phenomenon is possible only through the same synthetical unity of,ꯑꯣꯕꯖꯦꯛꯇ ꯑꯣꯏꯅꯥ ꯐꯤꯅꯣꯃꯦꯟ ꯑꯁꯤ ꯆꯞ ꯃꯥꯟꯅꯕꯥ ꯁꯤꯟꯊꯦꯇꯤꯛ ꯑꯣꯏꯕꯥ ꯑꯄꯨꯅꯕꯥ ꯑꯁꯤꯒꯤ ꯈꯨꯠꯊꯥꯡꯗꯥ ꯈꯛꯇꯃꯛ ꯑꯣꯏꯊꯣꯀꯄꯥ ꯌꯥꯏ꯫
"the manifold of the given sensuous intuition, through which the unity of the","ꯄꯤꯔꯤꯕꯥ ꯁꯦꯟꯁ꯭ꯌꯨꯜ ꯏꯟꯠꯌꯨꯏꯇꯤꯖ ꯑꯁꯤꯒꯤ ꯃꯈꯜ ꯀꯌꯥꯒꯤ ꯃꯑꯣꯡ ꯃꯇꯧ, ꯃꯁꯤꯒꯤ ꯈꯨꯠꯊꯥꯡꯗꯥ ꯑꯄꯨꯅꯕꯥ ."
composition of the homogeneous manifold in the conception of a quantity is,ꯀ꯭ꯕꯥꯟꯇꯤꯇꯤ ꯑꯃꯒꯤ ꯀꯟꯁꯦꯄꯁꯟꯗꯥ ꯍꯣꯃꯣꯖꯦꯅꯤꯛ ꯃꯦꯅꯤꯐꯣꯜꯗꯀꯤ ꯀꯝꯄꯣꯖꯤꯁꯟ ꯑꯁꯤ .
"cogitated; that is to say, all phenomena are quantities, and extensive",ꯀꯣꯖꯤꯇꯦꯗ ꯇꯧꯕꯥ;
"quantities, because as intuitions in space or time they must be represented","ꯃꯁꯤꯡꯁꯤꯡ, ꯃꯔꯃꯗꯤ ꯁ꯭ꯄꯦꯁ ꯅꯠꯔꯒꯥ ꯃꯇꯃꯗꯥ ꯏꯟꯠꯌꯨꯏꯇꯤꯖ ꯑꯣꯏꯅꯥ ꯃꯈꯣꯌ ꯑꯁꯤ ꯔꯤꯞꯔꯖꯦꯟꯇ ꯇꯧꯒꯗꯕꯅꯤ ."
by means of the same synthesis through which space and time themselves,ꯁ꯭ꯄꯦꯁ ꯑꯃꯁꯨꯡ ꯇꯥꯏꯝ ꯃꯁꯥꯃꯛꯀꯤ ꯈꯨꯠꯊꯥꯡꯗꯥ ꯆꯞ ꯃꯥꯟꯅꯕꯥ ꯁꯤꯟꯊꯦꯁꯤꯁꯀꯤ ꯈꯨꯠꯊꯥꯡꯗꯥ .
are determined,ꯑꯁꯤ ꯂꯦꯄꯊꯣꯛꯂꯤ ꯫
An extensive quantity I call that wherein the representation of the parts,ꯄꯥꯛ ꯆꯥꯎꯔꯕꯥ ꯃꯁꯤꯡ ꯑꯃꯥ ꯑꯩꯅꯥ ꯀꯧꯏ ꯃꯗꯨꯗꯤ ꯁꯔꯨꯀꯁꯤꯡ ꯑꯗꯨꯒꯤ ꯔꯤꯞꯔꯖꯦꯟꯇꯦꯁꯟ ꯑꯗꯨ .
renders possible (and therefore necessarily antecedes) the representation of,ꯒꯤ ꯔꯤꯞꯔꯖꯦꯟꯇꯦꯁꯟ ꯑꯗꯨ ꯑꯣꯏꯊꯣꯀꯄꯥ ꯌꯥꯕꯥ (ꯑꯗꯨꯒꯥ ꯃꯔꯝ ꯑꯁꯤꯅꯥ ꯇꯉꯥꯏꯐꯗꯅꯥ ꯑꯦꯟꯇꯤꯁꯦꯗꯦꯁ) ꯔꯦꯟꯗꯔ ꯇꯧꯏ꯫
"the whole. I cannot represent to myself any line, however small, without",ꯄꯨꯝꯅꯃꯛ ꯑꯁꯤ꯫
"drawing it in thought, that is, without generating from a point all its parts","ꯃꯁꯤ ꯋꯥꯈꯂꯗꯥ ꯁꯦꯝꯕꯥ, ꯍꯥꯌꯕꯗꯤ ꯄꯣꯏꯟꯇ ꯑꯃꯗꯒꯤ ꯃꯁꯤꯒꯤ ꯁꯔꯨꯛ ꯄꯨꯝꯅꯃꯛ ꯖꯦꯅꯦꯔꯦꯠ ꯇꯧꯗꯅꯥ"
"one after another, and in this way alone producing this intuition. Precisely","ꯑꯃꯒꯤ ꯃꯇꯨꯡꯗꯥ ꯑꯃꯒꯤ, ꯑꯃꯁꯨꯡ ꯃꯁꯤꯒꯤ ꯃꯑꯣꯡ ꯑꯁꯤꯅꯥ ꯈꯛꯇꯅꯥ ꯏꯟꯠꯌꯨꯏꯇꯤ ꯑꯁꯤ ꯄꯨꯊꯣꯀꯏ꯫"
"the same is the case with every, even the smallest, portion of time. I cogitate","ꯃꯇꯃꯒꯤ ꯁꯔꯨꯛ ꯈꯨꯗꯤꯡꯃꯛ, ꯈ꯭ꯕꯥꯏꯗꯒꯤ ꯑꯄꯤꯀꯄꯥ ꯁꯔꯨꯛ ꯐꯥꯑꯣꯕꯥ ꯑꯗꯨꯃꯛ ꯑꯣꯏꯔꯤ꯫"
"therein only the successive progress from one moment to another, and","ꯃꯗꯨꯗꯥ ꯃꯤꯀꯨꯞ ꯑꯃꯗꯒꯤ ꯑꯇꯣꯞꯄꯥ ꯑꯃꯗꯥ ꯇꯨꯡꯗꯥ ꯂꯥꯀꯄꯥ ꯄ꯭ꯔꯣꯒ꯭ꯔꯦꯁ ꯑꯗꯨ ꯈꯛꯇꯃꯛ, ꯑꯃꯁꯨꯡ ."
"hence, by means of the different portions of time and the addition of them, a","ꯃꯔꯝ ꯑꯁꯤꯅꯥ ꯃꯇꯃꯒꯤ ꯇꯣꯉꯥꯟ ꯇꯣꯉꯥꯅꯕꯥ ꯁꯔꯨꯀꯁꯤꯡꯒꯤ ꯈꯨꯠꯊꯥꯡꯗꯥ ꯑꯃꯁꯨꯡ ꯃꯈꯣꯌꯕꯨ ꯍꯥꯄꯆꯤꯟꯗꯨꯅꯥ, ꯑꯦ."
determinate quantity of time is produced. As the pure intuition in all,ꯃꯇꯃꯒꯤ ꯂꯦꯞꯄꯥ ꯂꯩꯇꯕꯥ ꯃꯁꯤꯡ ꯄꯨꯊꯣꯀꯏ꯫
"phenomena is either time or space, so is every phenomenon in its character","ꯐꯤꯚꯝ ꯑꯁꯤ ꯃꯇꯝ ꯅꯠꯔꯒꯥ ꯃꯐꯝ ꯑꯣꯏꯔꯕꯁꯨ, ꯃꯁꯤꯒꯤ ꯃꯑꯣꯡ ꯃꯇꯧ ꯑꯁꯤꯗꯥ ꯂꯩꯔꯤꯕꯥ ꯐꯤꯚꯝ ꯈꯨꯗꯤꯡꯃꯛꯁꯨ ."
"of intuition an extensive quantity, inasmuch as it can only be cognized in","ꯑꯣꯐ ꯏꯟꯠꯌꯨꯏꯇꯤꯖ ꯑꯁꯤ ꯄꯥꯛ-ꯆꯥꯎꯕꯥ ꯃꯁꯤꯡꯅꯤ, ꯃꯔꯃꯗꯤ ꯃꯁꯤ ꯲꯰꯲꯰ꯗꯥ ꯈꯛꯇꯃꯛ ꯀꯣꯒꯅꯤꯖ ꯇꯧꯕꯥ ꯌꯥꯏ꯫"
our apprehension by successive synthesis (from part to part). All,ꯇꯨꯡꯗꯥ ꯂꯥꯀꯄꯥ ꯁꯤꯟꯊꯦꯁꯤꯁ (ꯄꯥꯔꯠ ꯑꯃꯗꯒꯤ ꯁꯔꯨꯛ ꯑꯃꯗꯥ)ꯅꯥ ꯑꯩꯈꯣꯌꯒꯤ ꯑꯀꯤꯕꯥ ꯄꯣꯀꯍꯅꯕꯥ꯫
"phenomena are, accordingly, to be considered as aggregates, that is, as a","ꯐꯤꯚꯃꯁꯤꯡ ꯑꯁꯤ, ꯃꯗꯨꯒꯤ ꯃꯇꯨꯡ ꯏꯟꯅꯥ, ꯑꯦꯒ꯭ꯔꯤꯒꯦꯇꯔ ꯑꯣꯏꯅꯥ ꯂꯧꯕꯥ, ꯍꯥꯌꯕꯗꯤ ꯑꯦ."
collection of previously given parts; which is not the case with every sort of,ꯃꯃꯥꯡꯗꯥ ꯄꯤꯈꯤꯕꯥ ꯁꯔꯨꯀꯁꯤꯡ ꯈꯣꯃꯖꯤꯅꯕꯥ;
"quantities, but only with those which are represented and apprehended by","ꯃꯁꯤꯡꯁꯤꯡ, ꯑꯗꯨꯕꯨ ꯁꯨꯞꯅꯒꯤ ꯔꯤꯞꯔꯗꯛꯇꯤꯚ ꯑꯣꯏꯕꯥ ꯑꯃꯁꯨꯡ ꯂꯧꯁꯤꯅꯕꯥ ꯌꯥꯕꯥ ꯃꯔꯤꯁꯤꯡꯈꯛꯇꯒꯥ ꯂꯣꯌꯅꯅꯥ"
us as extensive,ꯑꯩꯈꯣꯌ ꯑꯁꯤ ꯄꯥꯛ ꯁꯟꯅꯥ ​​.
"On this successive synthesis of the productive imagination, in the","ꯄ꯭ꯔꯣꯗꯛꯇꯤꯕ ꯏꯃꯦꯖꯤꯅꯦꯁꯅꯒꯤ ꯇꯨꯡꯗꯥ ꯂꯥꯛꯀꯗꯕꯥ ꯁꯤꯟꯊꯦꯁꯤꯁ ꯑꯁꯤꯒꯤ ꯃꯇꯥꯡꯗꯥ, ."
"generation of figures, is founded the mathematics of extension, or geometry,","ꯐꯤꯒꯔꯁꯤꯡꯒꯤ ꯖꯦꯅꯔꯦꯁꯟ, ꯑꯁꯤ ꯑꯦꯛꯁꯇꯦꯟꯁꯟ, ꯅꯠꯔꯒꯥ ꯖꯤꯑꯣꯃꯦꯠꯔꯤꯒꯤ ꯃꯦꯊꯃꯦꯇꯤꯛꯁ, ꯌꯨ.ꯑꯦꯁ."
"with its axioms, which express the conditions of sensuous intuition à priori,","ꯃꯁꯤꯒꯤ ꯑꯦꯛꯁꯤꯃꯁꯤꯡꯒꯥ ꯂꯣꯌꯅꯅꯥ, ꯃꯁꯤꯅꯥ ꯁꯦꯟꯁ꯭ꯌꯨꯁ ꯏꯟꯠꯌꯨꯏꯁꯟ à ꯄ꯭ꯔꯥꯏꯑꯣꯔꯤꯒꯤ ꯀꯟꯗꯤꯁꯅꯁꯤꯡ ꯐꯣꯡꯗꯣꯛꯂꯤ,"
under which alone the schema of a pure conception of external intuition can,ꯃꯁꯤꯒꯤ ꯃꯈꯥꯗꯥ ꯃꯁꯥ ꯃꯊꯟꯇꯥ ꯃꯄꯥꯅꯒꯤ ꯏꯟꯠꯌꯨꯏꯇꯤꯒꯤ ꯑꯁꯦꯡꯕꯥ ꯋꯥꯈꯜꯂꯣꯟ ꯑꯃꯒꯤ ꯁ꯭ꯀꯤꯝ ꯑꯁꯤ .
"exist; for example, “be tween two points only one straight line is possible,”",ꯂꯩꯕ;
"“two straight lines cannot enclose a space,” etc. These are the axioms which","“ꯁ꯭ꯠꯔꯦꯠ ꯂꯥꯏꯟ ꯑꯅꯤꯅꯥ ꯁ꯭ꯄꯦꯁ ꯑꯃꯥ ꯌꯥꯑꯣꯕꯥ ꯉꯃꯗꯦ,” ꯑꯁꯤꯅꯆꯤꯡꯕꯥ ꯑꯁꯤ ꯑꯦꯛꯁꯤꯃꯁꯤꯡꯅꯤ ꯃꯗꯨꯗꯤ ꯃꯈꯣꯌꯁꯤꯡ ꯑꯁꯤ ."
properly relate only to quantities (quanta) as such,ꯃꯑꯣꯡ ꯆꯨꯝꯅꯥ ꯃꯔꯤ ꯂꯩꯅꯕꯥ ꯀ꯭ꯕꯥꯟꯇꯤꯇꯤꯁꯤꯡ (ꯀ꯭ꯕꯥꯟꯇ) ꯑꯁꯤ ꯑꯁꯤꯒꯨꯝꯕꯥ ꯃꯑꯣꯡꯗꯥ .
"But, as regards the quantity of a thing (quantitas), that is to say, the","ꯑꯗꯨꯕꯨ, ꯄꯣꯠ ꯑꯃꯒꯤ ꯃꯁꯤꯡꯒꯤ ꯃꯇꯥꯡꯗꯥ (ꯀ꯭ꯕꯥꯟꯇꯤꯇꯥꯁ) ꯍꯥꯌꯕꯗꯤ ꯍꯥꯌꯕꯗꯤ, ꯍꯥꯌꯕꯗꯤ ."
"answer to the question: “How large is this or that object?” although, in",ꯋꯥꯍꯪ ꯑꯁꯤꯒꯤ ꯄꯥꯎꯈꯨꯝ: “ꯃꯁꯤ ꯅꯠꯠꯔꯒꯥ ꯄꯣꯠꯁꯛ ꯑꯗꯨ ꯀꯌꯥ ꯌꯥꯝꯅꯥ ꯆꯥꯎꯕꯒꯦ?”
"respect to this question, we have various propositions synthetical and","ꯋꯥꯍꯪ ꯑꯁꯤꯕꯨ ꯏꯀꯥꯌ ꯈꯨꯝꯅꯕꯥ, ꯑꯩꯈꯣꯌꯒꯤ ꯇꯣꯉꯥꯟ ꯇꯣꯉꯥꯅꯕꯥ ꯄ꯭ꯔꯣꯄꯣꯖꯦꯂꯁꯤꯡ ꯁꯤꯟꯊꯦꯇꯤꯀꯜ ꯑꯃꯁꯨꯡ ."
"immediately certain (indemonstrabilia); we have, in the proper sense of the",ꯈꯨꯗꯛꯇꯥ ꯑꯀꯛꯅꯕꯥ (ꯏꯟꯗꯦꯃꯣꯟꯁꯠꯔꯕꯤꯂꯤꯌꯥ);
"term, no axioms. For example, the propositions: “If equals be added to","ꯇꯔꯝ, ꯑꯦꯛꯁꯤꯝ ꯑꯃꯠꯇꯥ ꯂꯩꯇꯦ꯫"
"equals, the wholes are equal”; “If equals be taken from equals, the","ꯏꯀꯨꯏ ꯀꯨꯏꯗꯅꯥ, ꯄꯨꯝꯅꯃꯛ ꯑꯁꯤ ꯃꯥꯟꯅꯕꯥ ꯑꯣꯏ”;"
"remainders are equal”; are analytical, because I am immediately conscious",ꯂꯦꯃꯍꯧꯔꯤꯕꯥ ꯃꯤꯑꯣꯏꯁꯤꯡ ꯑꯁꯤ ꯃꯥꯟꯅꯕꯥ ꯑꯣꯏ”;
of the identity of the production of the one quantity with the production of,ꯋꯥꯟ ꯀ꯭ꯕꯥꯟꯇꯤꯇꯤꯒꯥ ꯂꯣꯌꯅꯅꯥ ꯄ꯭ꯔꯣꯗꯛꯁꯟ ꯇꯧꯕꯒꯤ ꯃꯁꯛ ꯑꯗꯨ .
the other; whereas axioms must be à priori synthetical propositions. On the,ꯑꯇꯣꯞꯄꯥ ꯑꯃꯅꯥ;
"other hand, the self-evident propositions as to the relation of numbers, are","ꯑꯃꯔꯣꯃꯗꯥ, ꯃꯁꯤꯡꯒꯤ ꯃꯔꯤꯒꯤ ꯃꯇꯥꯡꯗꯥ ꯃꯁꯥꯅꯥ ꯇꯥꯛꯂꯕꯥ ꯄ꯭ꯔꯣꯄꯣꯖꯦꯂꯁꯤꯡ, ."
"certainly synthetical but not universal, like those of geometry, and for this","ꯇꯁꯦꯡꯅꯥ ꯁꯤꯟꯊꯦꯇꯤꯛ ꯑꯣꯏꯕꯥ ꯑꯗꯨꯕꯨ ꯌꯨꯅꯤꯚꯔꯁꯦꯜ ꯑꯣꯏꯕꯥ ꯅꯠꯇꯦ, ꯖꯤꯑꯣꯃꯦꯠꯔꯤꯒꯤ ꯃꯇꯨꯡ ꯏꯟꯅꯥ, ꯑꯃꯁꯨꯡ ꯃꯁꯤꯒꯤꯗꯃꯛꯇꯥ"
"reason cannot be called axioms, but numerical formulae. That 7 + 5 = 12 is","ꯃꯔꯝ ꯑꯁꯤꯕꯨ ꯑꯦꯛꯁꯤꯝ ꯍꯥꯌꯅꯥ ꯀꯧꯕꯥ ꯌꯥꯗꯦ, ꯑꯗꯨꯕꯨ ꯅ꯭ꯌꯨꯃꯔꯤꯛ ꯐꯣꯔꯃꯨꯂꯥꯁꯤꯡ꯫"
"not an analytical proposition. For neither in the representation of seven, nor",ꯑꯦꯅꯥꯂꯥꯏꯇꯤꯀꯦꯜ ꯄ꯭ꯔꯣꯄꯣꯖꯦꯜ ꯑꯃꯥ ꯅꯠꯇꯦ꯫
"of five, nor of the composition of the two numbers, do I cogitate the number","ꯃꯉꯥꯒꯤ ꯃꯅꯨꯡꯗꯥ, ꯅꯠꯔꯒꯥ ꯃꯁꯤꯡ ꯑꯅꯤ ꯑꯁꯤꯒꯤ ꯀꯝꯄꯣꯖꯤꯁꯅꯒꯤ, ꯑꯩꯅꯥ ꯃꯁꯤꯡ ꯑꯁꯤ ꯀꯣꯖꯤꯇꯦꯠ ꯇꯧꯗꯦ ."
"twelve. (Whether I cogitate the number in the addition of both, is not at",ꯇꯔꯥꯅꯤꯊꯣꯏ.
"present the question; for in the case of an analytical proposition, the only",ꯋꯥꯍꯪ ꯑꯗꯨ ꯄꯤꯌꯨ;
point is whether I really cogitate the predicate in the representation of the,ꯄꯣꯏꯟꯇ ꯑꯁꯤ ꯑꯩꯍꯥꯛꯅꯥ ꯇꯁꯦꯡꯅꯥ ꯗꯤ ꯔꯤꯞꯔꯖꯦꯟꯇꯦꯁꯟꯗꯥ ꯄ꯭ꯔꯦꯗꯤꯀꯦꯠ ꯑꯁꯤ ꯀꯣꯖꯤꯇꯦꯠ ꯇꯧꯕꯔꯥ ꯍꯥꯌꯕꯗꯨꯅꯤ꯫
"subject.) But although the proposition is synthetical, it is nevertheless only a","ꯁꯕꯖꯦꯛꯇ.) ꯑꯗꯨꯕꯨ ꯄ꯭ꯔꯣꯄꯣꯖꯦꯜ ꯑꯁꯤ ꯁꯤꯟꯊꯦꯇꯤꯀꯜ ꯑꯣꯏꯔꯕꯁꯨ, ꯃꯁꯤ ꯑꯗꯨꯝ ꯑꯣꯏꯅꯃꯛ ꯁꯨꯞꯅꯇꯒꯤ ꯑꯦ ."
singular proposition. In so far as regard is here had merely to the synthesis,ꯁꯤꯉ꯭ꯒꯨꯂꯥꯔ ꯄ꯭ꯔꯣꯄꯣꯖꯦꯜ꯫
"of the homogeneous (the units), it cannot take place except in one manner,","ꯍꯣꯃꯣꯖꯦꯅꯤꯛ (ꯌꯨꯅꯤꯇꯁꯤꯡ)ꯒꯤ ꯃꯅꯨꯡꯗꯥ, ꯃꯁꯤ ꯃꯑꯣꯡ ꯑꯃꯈꯛꯇꯗꯥ ꯅꯠꯇꯅꯥ ꯊꯣꯀꯄꯥ ꯌꯥꯔꯣꯏ,"
although our use of these numbers is afterwards general. If I say: “A,ꯑꯩꯈꯣꯌꯅꯥ ꯃꯁꯤꯡ ꯑꯁꯤ ꯁꯤꯖꯤꯟꯅꯕꯥ ꯑꯁꯤ ꯃꯇꯨꯡꯗꯥ ꯖꯦꯅꯔꯦꯜ ꯑꯣꯏꯔꯕꯁꯨ꯫
"triangle can be constructed with three lines, any two of which taken","ꯇ꯭ꯔꯥꯏꯑꯦꯉ꯭ꯒꯜ ꯑꯁꯤ ꯂꯥꯏꯟ ꯑꯍꯨꯃꯒꯥ ꯂꯣꯌꯅꯅꯥ ꯁꯦꯝꯕꯥ ꯌꯥꯏ, ꯃꯗꯨꯒꯤ ꯃꯅꯨꯡꯗꯥ ꯑꯅꯤ ꯑꯃꯅꯥ ꯂꯧꯈꯤꯕꯥ ."
"together are greater than the third,” I exercise merely the pure function of","ꯄꯨꯟꯅꯥ ꯇꯔꯦꯠꯇꯒꯤ ꯍꯦꯟꯅꯥ ꯆꯥꯎꯏ,” ꯑꯩꯅꯥ ꯁꯨꯞꯅꯇꯒꯤ ꯁꯨꯞꯅꯒꯤ ꯁꯨꯞꯅꯒꯤ ꯐꯉ꯭ꯀꯁꯟ ꯑꯗꯨ ꯁꯨꯞꯅꯒꯤ ꯊꯕꯛ ꯑꯣꯏꯅꯥ ꯄꯥꯡꯊꯣꯛꯂꯤ꯫"
"the productive imagination, which may draw the lines longer or shorter and","ꯄ꯭ꯔꯗꯛꯇꯤꯕ ꯏꯃꯦꯖꯤꯅꯦꯁꯟ, ꯃꯁꯤꯅꯥ ꯂꯥꯏꯅꯁꯤꯡ ꯑꯗꯨ ꯍꯦꯟꯅꯥ ꯁꯥꯡꯅꯥ ꯅꯠꯔꯒꯥ ꯍꯦꯟꯅꯥ ꯀꯨꯞꯄꯥ ꯑꯃꯁꯨꯡ ."
"construct the angles at its pleasure. On the contrary, the number seven is",ꯑꯦꯉ꯭ꯒꯂꯁꯤꯡ ꯑꯗꯨ ꯃꯗꯨꯒꯤ ꯅꯨꯡꯉꯥꯏꯕꯗꯥ ꯁꯦꯝꯃꯨ꯫
"possible only in one manner, and so is likewise the number twelve, which","ꯑꯣꯏꯊꯣꯀꯄꯥ ꯌꯥꯕꯥ ꯃꯑꯣꯡ ꯑꯃꯈꯛꯇꯗꯥ, ꯑꯃꯁꯨꯡ ꯃꯔꯝ ꯑꯁꯤꯅꯥ ꯃꯁꯤꯡ ꯇꯔꯥꯅꯤ, ꯃꯗꯨꯁꯨ ."
"results from the synthesis of seven and five. Such propositions, then, cannot",꯷ ꯑꯃꯁꯨꯡ ꯃꯉꯥꯒꯤ ꯁꯤꯟꯊꯦꯁꯤꯁꯇꯒꯤ ꯐꯪꯂꯀꯄꯥ ꯐꯂꯁꯤꯡ꯫
"be termed axioms (for in that case we should have an infinity of these), but","ꯑꯦꯛꯁꯤꯃꯁꯤꯡ ꯍꯥꯌꯅꯥ ꯃꯤꯡꯊꯣꯅꯕꯥ (ꯃꯔꯃꯗꯤ ꯑꯩꯈꯣꯌꯅꯥ ꯍꯥꯌꯔꯤꯕꯥ ꯑꯁꯤꯒꯤ ꯃꯅꯨꯡꯗꯥ ꯏꯅꯐꯤꯅꯤꯇꯤ ꯑꯃꯥ ꯂꯩꯒꯗꯕꯅꯤ), ꯑꯗꯨꯕꯨ ."
numerical formulae,ꯅ꯭ꯌꯨꯃꯔꯤꯛ ꯐꯣꯔꯃꯨꯂꯥꯁꯤꯡ .
This transcendental principle of the mathematics of phenomena greatly,ꯃꯁꯤꯒꯤ ꯇ꯭ꯔꯥꯟꯁꯦꯟꯗꯦꯟꯇꯜ ꯄ꯭ꯔꯤꯟꯁꯤꯄꯜ ꯑꯁꯤ ꯃꯦꯊꯃꯦꯇꯤꯛꯁꯀꯤ ꯃꯇꯥꯡꯗꯥ ꯌꯥꯝꯅꯥ ꯆꯥꯎꯅꯥ .
enlarges our à priori cognition. For it is by this principle alone that pure,ꯑꯩꯈꯣꯌꯒꯤ à ꯄ꯭ꯔꯥꯏꯑꯣꯔꯤ ꯀꯣꯒꯅꯤꯁꯟ ꯑꯁꯤ ꯍꯦꯟꯅꯥ ꯆꯥꯎꯊꯣꯀꯍꯜꯂꯤ꯫
mathematics is rendered applicable in all its precision to objects of,ꯃꯦꯊꯃꯦꯇꯤꯛꯁ ꯑꯁꯤ ꯲꯰꯲꯰ꯒꯤ ꯑꯣꯕꯖꯦꯛꯇꯁꯤꯡꯗꯥ ꯃꯁꯤꯒꯤ ꯄ꯭ꯔꯤꯁꯤꯁꯟ ꯄꯨꯝꯅꯃꯛꯇꯥ ꯑꯦꯞꯂꯤꯀꯦꯕꯜ ꯑꯣꯏꯅꯥ ꯔꯦꯟꯗꯔ ꯇꯧꯏ꯫
"experience, and without it the validity of this application would not be so","ꯑꯦꯛꯁꯄꯤꯔꯤꯑꯦꯟꯁ, ꯑꯃꯁꯨꯡ ꯃꯁꯤ ꯌꯥꯑꯣꯗꯅꯥ ꯑꯦꯞꯂꯤꯀꯦꯁꯟ ꯑꯁꯤꯒꯤ ꯚꯦꯂꯤꯗꯤꯇꯤ ꯑꯁꯤ ꯑꯗꯨꯃꯛ ꯑꯣꯏꯔꯣꯏ"
"self-evident; on the contrary, contradictions and confusions have often",ꯁꯦꯜꯐ-ꯏꯚꯤꯗꯦꯟꯇ ꯑꯣꯏꯕꯥ;
arisen on this very point. Phenomena are not things in themselves,ꯌꯥꯝꯅꯥ ꯊꯨꯅꯥ ꯋꯥꯐꯝ ꯑꯁꯤꯒꯤ ꯃꯇꯥꯡꯗꯥ ꯂꯥꯀꯄꯥ꯫
Empirical intuition is possible only through pure intuition (of space and,ꯑꯦꯝꯄꯤꯔꯤꯀꯦꯜ ꯏꯟꯠꯌꯨꯏꯇꯤꯖꯝ ꯑꯁꯤ ꯁꯨꯞꯅꯒꯤ ꯏꯟꯠꯌꯨꯏꯇꯤꯖ (ꯁ꯭ꯄꯦꯁ ꯑꯃꯁꯨꯡ .
"time); consequently, what geometry affirms of the latter, is indisputably",ꯃꯇꯝ);
"valid of the former. All evasions, such as the statement that objects of sense",ꯍꯥꯟꯅꯒꯤ ꯑꯗꯨꯒꯤ ꯚꯦꯂꯤꯗ ꯑꯣꯏꯕꯥ꯫
"do not conform to the rules of construction in space (for example, to the","ꯁ꯭ꯄꯦꯁꯇꯥ ꯀꯟꯁꯠꯔꯛꯁꯅꯒꯤ ꯅꯤꯌꯃꯁꯤꯡꯒꯥ ꯀꯣꯟꯅꯒꯅꯨ (ꯈꯨꯗꯝ ꯑꯣꯏꯅꯥ, ."
"rule of the infinite divisibility of lines or angles), must fall to the ground","ꯂꯥꯏꯟ ꯅꯠꯠꯔꯒꯥ ꯑꯦꯉ꯭ꯒꯂꯁꯤꯡꯒꯤ ꯂꯣꯏꯕꯥ ꯅꯥꯏꯗꯕꯥ ꯗꯤꯚꯤꯖꯤꯕꯤꯂꯤꯇꯤꯒꯤ ꯅꯤꯌꯝ), ꯒ꯭ꯔꯥꯎꯟꯗꯗꯥ ꯁꯣꯏꯗꯅꯥ ꯁꯣꯏꯒꯗꯕꯅꯤ꯫"
"For, if these objections hold good, we deny to space, and with it to all","ꯃꯔꯃꯗꯤ, ꯀꯔꯤꯒꯨꯝꯕꯥ ꯑꯣꯕꯖꯦꯛꯁꯅꯁꯤꯡ ꯑꯁꯤ ꯑꯐꯕꯥ ꯑꯣꯏꯔꯕꯗꯤ, ꯑꯩꯈꯣꯌꯅꯥ ꯁ꯭ꯄꯦꯁꯇꯥ, ꯑꯃꯁꯨꯡ ꯃꯁꯤꯒꯥ ꯂꯣꯌꯅꯅꯥ ꯄꯨꯝꯅꯃꯛꯇꯥ ꯌꯥꯅꯤꯡꯗꯦ꯫"
"mathematics, objective validity, and no longer know wherefore, and how","ꯃꯦꯊꯃꯦꯇꯤꯛꯁ, ꯑꯣꯕꯖꯦꯛꯇꯤꯕ ꯚꯦꯂꯤꯗꯤꯇꯤ, ꯑꯃꯁꯨꯡ ꯃꯐꯝ ꯑꯃꯗꯥ ꯍꯦꯛꯇꯥ ꯈꯉꯕꯥ ꯍꯧꯔꯔꯣꯏ, ꯑꯃꯁꯨꯡ ꯃꯇꯧ ꯀꯔꯝꯅꯥ ."
"far, mathematics can be applied to phenomena. The synthesis of spaces and","ꯌꯥꯝꯅꯥ ꯂꯥꯞꯅꯥ, ꯃꯦꯊꯃꯦꯇꯤꯛꯁ ꯑꯁꯤ ꯐꯤꯚꯃꯁꯤꯡꯗꯥ ꯁꯤꯖꯤꯟꯅꯕꯥ ꯌꯥꯏ꯫"
"times as the essential form of all intuition, is that which renders possible the","ꯏꯟꯠꯌꯨꯏꯇꯤ ꯄꯨꯝꯅꯃꯛꯀꯤ ꯇꯉꯥꯏ ꯐꯗꯕꯥ ꯃꯑꯣꯡ ꯑꯣꯏꯅꯥ ꯃꯇꯃꯁꯤꯡ, ꯃꯁꯤꯅꯥ ꯑꯣꯏꯊꯣꯀꯄꯥ ꯌꯥꯕꯥ ꯑꯗꯨꯅꯤ ꯍꯥꯌꯅꯥ ."
"apprehension of a phenomenon, and therefore every external experience,","ꯐꯤꯚꯝ ꯑꯃꯒꯤ ꯃꯇꯥꯡꯗꯥ ꯋꯥꯈꯜ ꯋꯥꯕꯥ, ꯑꯃꯁꯨꯡ ꯃꯔꯝ ꯑꯁꯤꯅꯥ ꯃꯄꯥꯅꯒꯤ ꯑꯦꯛꯁꯄꯔꯤꯑꯦꯟꯁ ꯈꯨꯗꯤꯡꯃꯛ,"
consequently all cognition of the objects of experience; and whatever,ꯃꯔꯝ ꯑꯁꯤꯅꯥ ꯑꯦꯛꯁꯄꯔꯤꯌꯦꯟꯁꯀꯤ ꯑꯣꯕꯖꯦꯛꯇꯁꯤꯡꯒꯤ ꯀꯣꯒꯅꯤꯁꯟ ꯄꯨꯝꯅꯃꯛ;
"mathematics in its pure use proves of the former, must necessarily hold","ꯃꯁꯤꯒꯤ ꯄ꯭ꯌꯨꯔ ꯌꯨꯖꯗꯥ ꯃꯦꯊꯃꯦꯇꯤꯛꯁ ꯑꯁꯤ ꯍꯥꯟꯅꯒꯤ ꯑꯗꯨꯒꯤ ꯄ꯭ꯔꯃꯥꯟ ꯑꯣꯏꯔꯤ, ꯇꯉꯥꯏꯐꯗꯅꯥ ꯊꯃꯒꯗꯕꯅꯤ꯫"
good of the latter. All objections are but the chicaneries of an ill-instructed,ꯇꯨꯡꯗꯥ ꯂꯥꯀꯄꯥ ꯑꯐꯕꯥ꯫
"reason, which erroneously thinks to liberate the objects of sense from the","ꯃꯔꯝ, ꯃꯗꯨ ꯑꯔꯥꯅꯕꯥ ꯃꯑꯣꯡꯗꯥ ꯈꯜꯂꯤ ꯃꯗꯨꯗꯤ ꯁꯦꯟꯁꯀꯤ ꯄꯣꯠꯂꯃꯁꯤꯡꯕꯨ ꯂꯤꯕꯔꯦꯠ ꯇꯧꯕꯥ ."
"formal conditions of our sensibility, and represents these, although mere","ꯑꯩꯈꯣꯌꯒꯤ ꯁꯦꯟꯁꯤꯕꯤꯂꯤꯇꯤꯒꯤ ꯐꯣꯔꯃꯦꯜ ꯀꯟꯗꯤꯁꯅꯁꯤꯡ, ꯑꯃꯁꯨꯡ ꯃꯈꯣꯌꯁꯤꯡ ꯑꯁꯤ ꯔꯤꯞꯔꯖꯦꯟꯇ ꯇꯧꯔꯤ, ꯁꯨꯞꯅꯒꯤ ."
"phenomena, as things in themselves, presented as such to our","ꯐꯤꯚꯃꯁꯤꯡ ꯑꯁꯤ ꯃꯁꯥꯅꯥ ꯃꯁꯥꯕꯨ ꯄꯣꯠꯂꯨꯝ ꯑꯣꯏꯅꯥ ꯄꯤꯖꯔꯤ, ꯑꯩꯈꯣꯌꯒꯤ [...]"
"understanding. But in this case, no à priori synthetical cognition of them",ꯂꯧꯁꯤꯅꯕꯥ ꯉꯝꯕꯥ꯫
"could be possible, consequently not through pure conceptions of space and","ꯑꯣꯏꯊꯣꯀꯄꯥ ꯌꯥꯏ, ꯃꯔꯝ ꯑꯁꯤꯅꯥ ꯁ꯭ꯄꯦꯁꯀꯤ ꯄ꯭ꯌꯨꯔ ꯀꯟꯁꯦꯄꯁꯅꯁꯤꯡꯒꯤ ꯈꯨꯠꯊꯥꯡꯗꯥ ꯑꯣꯏꯔꯣꯏ ꯑꯃꯁꯨꯡ ."
"the science which determines these conceptions, that is to say, geometry,","ꯍꯥꯌꯔꯤꯕꯥ ꯋꯥꯈꯜꯂꯣꯅꯁꯤꯡ ꯑꯁꯤ ꯂꯦꯄꯊꯣꯛꯂꯤꯕꯥ ꯁꯥꯏꯟꯁ ꯑꯁꯤ, ꯍꯥꯌꯕꯗꯤ ꯖꯤꯑꯣꯃꯦꯠꯔꯤ,"
would itself be impossible,ꯃꯁꯥꯅꯥ ꯃꯁꯥꯕꯨ ꯑꯣꯏꯊꯣꯀꯄꯥ ꯉꯃꯗꯕꯥ .
2. ANTICIPATIONS OF PERCEPTION,ꯋꯥꯈꯜ ꯂꯧꯁꯤꯡꯒꯤ ꯑꯦꯟꯇꯤꯁꯤꯄꯦꯁꯅꯁꯤꯡ ꯲.
"The principle of these is: In all phenomena the Real, that which is an","ꯃꯁꯤꯒꯤ ꯄ꯭ꯔꯤꯟꯁꯤꯄꯜ ꯑꯁꯤ: ꯐꯤꯚꯝ ꯄꯨꯝꯅꯃꯛꯇꯥ ꯑꯁꯦꯡꯕꯥ, ꯑꯗꯨ ꯑꯦꯟ."
"object of sensation, has Intensive Quantity, that is, has a Degree","ꯁꯦꯟꯁꯁꯀꯤ ꯑꯣꯕꯖꯦꯛꯇ, ꯏꯟꯇꯦꯟꯁꯤꯕ ꯀ꯭ꯕꯥꯟꯇꯤꯇꯤ ꯂꯩ, ꯍꯥꯌꯕꯗꯤ ꯗꯤꯒ꯭ꯔꯤ ꯑꯃꯥ ꯂꯩ꯫"
PROOF,ꯁꯥꯈꯤ
