en,mni-Mtei
"the determining, but only that of the determinable self, that is, of my","ꯗꯤꯇꯔꯃꯤꯅꯦꯁꯟ, ꯑꯗꯨꯕꯨ ꯗꯤꯇꯔꯃꯤꯅꯦꯕꯜ ꯁꯦꯜꯐꯀꯤ, ꯍꯥꯌꯕꯗꯤ ꯑꯩꯒꯤ ."
internal intuition (in so far as the manifold contained in it can be connected,ꯏꯟꯇꯔꯅꯦꯜ ꯏꯟꯠꯌꯨꯏꯇꯤꯖ (ꯃꯁꯤꯗꯥ ꯌꯥꯑꯣꯔꯤꯕꯥ ꯃꯦꯅꯤꯐꯣꯜꯗ ꯑꯗꯨ ꯐꯥꯑꯣꯕꯥ ꯁꯝꯅꯍꯅꯕꯥ ꯌꯥꯏ .
conformably with the general condition of the unity of apperception in,꯲꯰꯲꯰ꯗꯥ ꯑꯦꯄꯔꯁꯦꯄꯁꯅꯒꯤ ꯑꯄꯨꯅꯕꯥ ꯑꯁꯤꯒꯤ ꯖꯦꯅꯔꯦꯜ ꯀꯟꯗꯤꯁꯅꯒꯥ ꯂꯣꯌꯅꯅꯥ ꯀꯅꯐꯣꯔꯃꯦꯕꯜ ꯑꯣꯏꯅꯥ .
"thought), is the object","ꯋꯥꯈꯜ), ꯑꯁꯤ ꯄꯣꯠꯁꯛ ꯑꯗꯨꯅꯤ ."
1. In all judgements I am the determining subject of that relation which,1. ꯋꯥꯌꯦꯜ ꯄꯨꯝꯅꯃꯛꯇꯥ ꯑꯩꯍꯥꯛ ꯔꯤꯂꯦꯁꯅꯁꯤꯞ ꯑꯗꯨꯒꯤ ꯗꯤꯇꯔꯃꯤꯅꯦꯁꯟ ꯁꯕꯖꯦꯛꯇꯅꯤ ꯃꯗꯨꯗꯤ .
"constitutes a judgement. But that the I which thinks, must be considered as",ꯖꯖꯃꯦꯟꯇ ꯑꯃꯥ ꯑꯣꯏꯅꯥ ꯁꯦꯃꯒꯠꯂꯤ꯫
"in thought always a subject, and as a thing which cannot be a predicate to","ꯋꯥꯈꯜꯂꯣꯅꯗꯥ ꯃꯇꯝ ꯄꯨꯝꯅꯃꯛꯇꯥ ꯍꯤꯔꯝ ꯑꯃꯥ ꯑꯣꯏꯅꯥ, ꯑꯃꯁꯨꯡ ꯋꯥꯐꯝ ꯑꯃꯥ ꯑꯣꯏꯅꯥ ."
"thought, is an apodeictic and identical proposition. But this proposition does","ꯋꯥꯈꯜ, ꯑꯦꯄꯣꯗꯦꯛꯇꯤꯛ ꯑꯃꯁꯨꯡ ꯃꯥꯟꯅꯕꯥ ꯄ꯭ꯔꯣꯄꯣꯖꯦꯜ ꯑꯃꯅꯤ꯫"
"not signify that I, as an object, am, for myself, a self-subsistent being or","ꯑꯩꯍꯥꯛ, ꯄꯣꯠꯁꯛ ꯑꯃꯥ ꯑꯣꯏꯅꯥ, ꯑꯩꯍꯥꯛꯀꯤꯗꯃꯛꯇꯗꯤ, ꯃꯁꯥꯅꯥ ꯃꯁꯥꯕꯨ ꯊꯥꯖꯕꯥ ꯃꯤꯑꯣꯏ ꯑꯃꯥ ꯑꯣꯏꯅꯥ ꯅꯠꯔꯒꯥ ."
substance. This latter statement—an ambitious one—requires to be,ꯄꯣꯠꯂꯝ.
supported by data which are not to be discovered in thought; and are,ꯋꯥꯈꯂꯗꯥ ꯊꯤꯖꯤꯅꯒꯗꯕꯥ ꯗꯦꯇꯥꯅꯥ ꯁꯄꯣꯔꯠ ꯇꯧꯕꯥ;
perhaps (in so far as I consider the thinking self merely as such) not to be,ꯌꯥꯑꯣꯔꯃꯒꯗꯕꯗꯤ (ꯑꯩꯅꯥ ꯈꯜꯂꯤꯕꯥ ꯑꯁꯤ ꯁꯨꯞꯅꯇꯒꯤ ꯋꯥꯈꯜ ꯈꯟꯊꯕꯥ ꯑꯁꯤꯒꯨꯝꯅꯥ) ꯑꯣꯏꯔꯣꯏꯗꯕꯅꯤ꯫
discovered in the thinking self at all,ꯊꯤꯡꯀꯤꯡ ꯁꯦꯜꯐꯇꯥ ꯃꯄꯨꯡ ꯐꯥꯅꯥ ꯊꯤꯗꯣꯀꯈꯤ
"2. That the I or Ego of apperception, and consequently in all thought, is","2. i or ego of apperception, ꯑꯃꯁꯨꯡ ꯃꯁꯤꯒꯤ ꯃꯍꯩ ꯑꯣꯏꯅꯥ ꯋꯥꯈꯜ ꯄꯨꯝꯅꯃꯛꯇꯥ, ."
"singular or simple, and cannot be resolved into a plurality of subjects, and","ꯁꯤꯉ꯭ꯒꯨꯂꯥꯔ ꯅꯠꯠꯔꯒꯥ ꯁꯤꯝꯄꯜ, ꯑꯃꯁꯨꯡ ꯁꯕꯖꯦꯛꯇꯁꯤꯡꯒꯤ ꯃꯁꯤꯡ ꯌꯥꯝꯂꯕꯥ ꯃꯑꯣꯡꯗꯥ ꯔꯤꯖꯣꯂꯕ ꯇꯧꯕꯥ ꯌꯥꯔꯣꯏ, ꯑꯃꯁꯨꯡ ."
therefore indicates a logically simple subject—this is self-evident from the,ꯃꯔꯝ ꯑꯗꯨꯅꯥ ꯂꯣꯖꯤꯀꯦꯜ ꯑꯣꯏꯅꯥ ꯏꯆꯝ ꯆꯝꯕꯥ ꯍꯤꯔꯝ ꯑꯃꯥ ꯇꯥꯀꯏ—ꯃꯁꯤꯅꯥ ꯃꯁꯥꯅꯥ ꯃꯁꯥꯕꯨ ꯊꯥꯖꯕꯥ ꯉꯃꯖꯕꯥ ꯋꯥꯐꯝ ꯑꯃꯅꯤ꯫
"very conception of an Ego, and is consequently an analytical proposition","ꯏꯒꯣ ꯑꯃꯒꯤ ꯌꯥꯝꯅꯥ ꯀꯟꯁꯦꯄꯁꯟ, ꯑꯃꯁꯨꯡ ꯃꯁꯤꯒꯤ ꯃꯍꯩ ꯑꯣꯏꯅꯥ ꯑꯦꯅꯥꯂꯥꯏꯇꯤꯀꯦꯜ ꯄ꯭ꯔꯣꯄꯣꯖꯦꯜ ꯑꯃꯥ ꯑꯣꯏꯔꯤ"
But this is not tantamount to declaring that the thinking Ego is a simple,ꯑꯗꯨꯕꯨ ꯃꯁꯤ ꯋꯥꯈꯜ ꯈꯅꯕꯒꯤ ꯏꯒꯣ ꯑꯁꯤ ꯏꯆꯝ ꯆꯝꯕꯥ ꯋꯥꯐꯝ ꯑꯃꯅꯤ ꯍꯥꯌꯅꯥ ꯂꯥꯎꯊꯣꯀꯄꯥ ꯑꯁꯤꯒꯥ ꯃꯥꯟꯅꯗꯕꯥ ꯅꯠꯇꯦ꯫
substance—for this would be a synthetical proposition. The conception of,ꯁꯕ꯭ꯁꯇꯦꯟꯁ—ꯃꯔꯃꯗꯤ ꯃꯁꯤ ꯁꯤꯟꯊꯦꯇꯤꯀꯜ ꯄ꯭ꯔꯣꯄꯣꯖꯦꯜ ꯑꯃꯥ ꯑꯣꯏꯒꯅꯤ꯫
"substance always relates to intuitions, which with me cannot be other than","ꯄꯕ꯭ꯂꯤꯀꯦꯁꯟ ꯑꯁꯤ ꯃꯇꯝ ꯄꯨꯝꯅꯃꯛꯇꯥ ꯏꯟꯠꯌꯨꯏꯇꯤꯖꯁꯤꯡꯒꯥ ꯃꯔꯤ ꯂꯩꯅꯩ, ꯃꯗꯨ ꯑꯩꯒꯥ ꯂꯣꯌꯅꯅꯥ ꯑꯇꯣꯞꯄꯥ ꯑꯣꯏꯕꯥ ꯌꯥꯔꯣꯏ꯫"
"sensuous, and which consequently lie completely out of the sphere of the","ꯁꯦꯟꯁ꯭ꯌꯨꯂꯁ, ꯑꯃꯁꯨꯡ ꯃꯁꯤꯒꯤ ꯃꯍꯩ ꯑꯣꯏꯅꯥ ꯃꯄꯨꯡ ꯐꯥꯅꯥ ꯂꯦꯡꯗꯕꯥ ꯃꯑꯣꯡꯗꯥ ."
understanding and its thought: but to this sphere belongs the affirmation,ꯂꯧꯁꯤꯅꯕꯥ ꯑꯃꯁꯨꯡ ꯃꯁꯤꯒꯤ ꯋꯥꯈꯜꯂꯣꯟ: ꯑꯗꯨꯕꯨ ꯃꯁꯤꯒꯤ ꯃꯇꯥꯡꯗꯥ ꯋꯥꯐꯝ ꯑꯁꯤ ꯑꯦꯐꯤꯃꯦꯁꯟ ꯑꯁꯤꯒꯤ ꯃꯅꯨꯡ ꯆꯜꯂꯤ .
"that the Ego is simple in thought. It would indeed be surprising, if the",ꯏꯒꯣ ꯑꯁꯤ ꯋꯥꯈꯂꯗꯥ ꯏꯆꯝ ꯆꯝꯕꯥ ꯑꯣꯏ ꯍꯥꯌꯕꯁꯤꯅꯤ꯫
"conception of “substance,” which in other cases requires so much labour to",“ꯁꯕꯁ꯭ꯇꯦꯟꯁ” ꯍꯥꯌꯕꯥ ꯋꯥꯈꯜꯂꯣꯟ ꯑꯁꯤ ꯑꯇꯣꯞꯄꯥ ꯀꯦꯁꯁꯤꯡꯗꯥ ꯑꯁꯨꯛ ꯌꯥꯝꯅꯥ ꯂꯦꯕꯔ ꯇꯧꯕꯥ ꯃꯊꯧ ꯇꯥꯔꯤꯕꯥ ꯑꯁꯤ .
distinguish from the other elements presented by intuition—so much,ꯏꯟꯠꯌꯨꯏꯇꯤꯖꯅꯥ ꯄꯤꯔꯤꯕꯥ ꯑꯇꯣꯞꯄꯥ ꯑꯦꯂꯤꯃꯦꯟꯇꯁꯤꯡꯗꯒꯤ ꯈꯦꯠꯅꯕꯥ ꯊꯃꯒꯗꯕꯅꯤ—ꯑꯁꯨꯛ ꯌꯥꯝꯅꯥ .
"trouble, too, to discover whether it can be simple (as in the case of the parts","ꯑꯋꯥꯕꯥ, ꯃꯁꯤꯁꯨ, ꯃꯁꯤ ꯏꯆꯝ ꯆꯝꯕꯥ ꯑꯣꯏꯕꯥ ꯌꯥꯕꯔꯥ ꯍꯥꯌꯕꯗꯨ ꯈꯉꯗꯣꯛꯅꯕꯥ (ꯄꯥꯔꯇꯁꯤꯡꯒꯤ ꯃꯇꯥꯡꯗꯥ ꯑꯣꯏꯔꯀꯄꯒꯨꯝꯅꯥ ."
"of matter)—should be presented immediately to me, as if by revelation, in","of matter)—ꯑꯩꯉꯣꯟꯗꯥ ꯈꯨꯗꯛꯇꯥ ꯄꯤꯒꯗꯕꯅꯤ, ꯐꯣꯡꯗꯣꯀꯄꯒꯤ ꯃꯇꯨꯡ ꯏꯟꯅꯥ, ꯲꯰꯲꯰ꯗꯥ ꯄꯤꯒꯗꯕꯅꯤ꯫"
the poorest mental representation of all,ꯄꯨꯝꯅꯃꯛꯀꯤ ꯈ꯭ꯕꯥꯏꯗꯒꯤ ꯂꯥꯌꯔꯕꯥ ꯃꯦꯟꯇꯦꯜ ꯔꯤꯞꯔꯖꯦꯟꯇꯦꯁꯟ
3. The proposition of the identity of my Self amidst all the manifold,꯳.ꯃꯅꯤꯐꯣꯜꯗ ꯄꯨꯝꯅꯃꯛꯀꯤ ꯃꯔꯛꯇꯥ ꯑꯩꯒꯤ ꯏꯁꯥꯒꯤ ꯑꯥꯏꯗꯦꯟꯇꯤꯇꯤꯒꯤ ꯄ꯭ꯔꯣꯄꯣꯖꯦꯜ
"representations of which I am conscious, is likewise a proposition lying in",ꯑꯩꯍꯥꯛꯅꯥ ꯀꯟꯁꯆꯤꯌꯁꯟ ꯑꯣꯏꯔꯤꯕꯥ ꯔꯤꯞꯔꯖꯦꯟꯇꯦꯁꯅꯁꯤꯡ ꯑꯁꯤ ꯃꯇꯧ ꯑꯁꯨꯝꯅꯥ ꯄ꯭ꯔꯣꯄꯣꯖꯦꯜ ꯑꯃꯅꯤ ꯑꯃꯁꯨꯡ
"the conceptions themselves, and is consequently analytical. But this identity","ꯀꯟꯁꯦꯄꯁꯅꯁꯤꯡ ꯃꯁꯥꯃꯛ, ꯑꯃꯁꯨꯡ ꯃꯁꯤꯒꯤ ꯃꯍꯩ ꯑꯣꯏꯅꯥ ꯑꯦꯅꯥꯂꯥꯏꯇꯤꯀꯦꯜ ꯑꯣꯏ꯫"
"of the subject, of which I am conscious in all its representations, does not","ꯍꯤꯔꯝ ꯑꯁꯤꯒꯤ ꯃꯇꯥꯡꯗꯥ, ꯃꯁꯤꯒꯤ ꯃꯇꯥꯡꯗꯥ ꯑꯩꯍꯥꯛꯅꯥ ꯃꯁꯤꯒꯤ ꯔꯤꯞꯔꯖꯦꯟꯇꯦꯁꯟ ꯄꯨꯝꯅꯃꯛꯇꯥ ꯀꯟꯁꯤꯌꯦꯟꯇ ꯑꯣꯏꯔꯤ, ."
"relate to or concern the intuition of the subject, by which it is given as an","ꯃꯔꯤ ꯂꯩꯅꯕꯥ ꯅꯠꯔꯒꯥ ꯍꯤꯔꯝ ꯑꯁꯤꯒꯤ ꯏꯟꯠꯌꯨꯏꯇꯤꯖꯃꯒꯥ ꯃꯔꯤ ꯂꯩꯅꯕꯥ, ꯃꯁꯤꯒꯤ ꯃꯇꯨꯡ ꯏꯟꯅꯥ ꯃꯁꯤ ꯑꯃꯥ ꯑꯣꯏꯅꯥ ꯄꯤꯔꯤ꯫"
"object. This proposition cannot therefore enounce the identity of the person,",ꯄꯣꯠꯂꯝ.
by which is understood the consciousness of the identity of its own,ꯃꯁꯤꯅꯥ ꯃꯁꯥꯒꯤ ꯑꯣꯏꯕꯥ ꯃꯁꯛ ꯑꯗꯨꯒꯤ ꯃꯇꯥꯡꯗꯥ ꯈꯉꯕꯥ ꯑꯗꯨ ꯈꯉꯕꯥ ꯉꯝꯃꯤ .
substance as a thinking being in all change and variation of circumstances,ꯁꯕ꯭ꯁꯟꯁ ꯑꯦꯖ ꯑꯦ ꯊꯤꯡꯀꯤꯡ ꯕꯤꯌꯤꯡ ꯏꯟ ꯑꯣꯜ ꯆꯦꯟꯖ ꯑꯃꯁꯨꯡ ꯚꯦꯔꯤꯑꯦꯁꯟ ꯑꯣꯐ ꯁꯤꯆꯨꯌꯦꯁꯟ
"To prove this, we should require not a mere analysis of the proposition, but","ꯃꯁꯤ ꯄ꯭ꯔꯃꯥꯟ ꯇꯧꯅꯕꯒꯤꯗꯃꯛ ꯑꯩꯈꯣꯌꯅꯥ ꯄ꯭ꯔꯣꯄꯣꯖꯦꯜ ꯑꯁꯤꯒꯤ ꯁꯨꯞꯅꯒꯤ ꯑꯦꯅꯥꯂꯥꯏꯁꯤꯁ ꯑꯃꯥ ꯈꯛꯇꯃꯛ ꯃꯊꯧ ꯇꯥꯗꯦ, ꯑꯗꯨꯕꯨ ."
synthetical judgements based upon a given intuition,ꯑꯄꯤꯕꯥ ꯏꯟꯠꯌꯨꯏꯁꯟ ꯑꯃꯗꯥ ꯌꯨꯝꯐꯝ ꯑꯣꯏꯕꯥ ꯁꯤꯟꯊꯦꯇꯤꯀꯜ ꯖꯖꯃꯦꯟꯇꯁꯤꯡ
"4. I distinguish my own existence, as that of a thinking being, from that","4. ꯑꯩꯅꯥ ꯑꯩꯒꯤ ꯏꯁꯥꯒꯤ ꯂꯩꯔꯤꯕꯥ ꯑꯁꯤ, ꯋꯥꯈꯜ ꯈꯅꯕꯥ ꯃꯤꯑꯣꯏ ꯑꯃꯒꯤ ꯃꯁꯛ ꯑꯣꯏꯅꯥ, ꯃꯗꯨꯗꯒꯤ ꯈꯦꯠꯅꯍꯜꯂꯤ꯫"
of other things external to me—among which my body also is reckoned,ꯑꯩꯒꯤ ꯃꯄꯥꯟꯊꯣꯡꯒꯤ ꯑꯣꯏꯕꯥ ꯑꯇꯩ ꯄꯣꯠꯁꯀꯁꯤꯡꯒꯤ—ꯃꯗꯨꯒꯤ ꯃꯅꯨꯡꯗꯥ ꯑꯩꯒꯤ ꯍꯀꯆꯥꯡꯁꯨ ꯍꯤꯁꯥꯕ ꯇꯧꯏ .
"This is also an analytical proposition, for other things are exactly those","ꯃꯁꯤꯁꯨ ꯑꯦꯅꯥꯂꯥꯏꯇꯤꯀꯦꯜ ꯄ꯭ꯔꯣꯄꯣꯖꯦꯜ ꯑꯃꯅꯤ, ꯃꯔꯃꯗꯤ ꯑꯇꯣꯞꯄꯥ ꯋꯥꯐꯃꯁꯤꯡ ꯑꯁꯤ ꯇꯁꯦꯡꯅꯥ ."
which I think as different or distinguished from myself. But whether this,ꯃꯗꯨ ꯑꯩꯍꯥꯛꯅꯥ ꯑꯩꯍꯥꯛꯀꯤ ꯏꯁꯥꯗꯒꯤ ꯇꯣꯉꯥꯅꯕꯥ ꯅꯠꯔꯒꯥ ꯇꯣꯞ ꯇꯣꯞꯄꯥ ꯑꯣꯏꯅꯥ ꯈꯜꯂꯤ꯫
consciousness of myself is possible without things external to me; and,ꯑꯩꯒꯤ ꯏꯁꯥꯒꯤ ꯀꯟꯁꯇꯤꯠꯌꯨꯁꯟ ꯑꯁꯤ ꯑꯩꯒꯤ ꯃꯄꯥꯟꯗꯥ ꯂꯩꯕꯥ ꯄꯣꯠꯁꯤꯡ ꯌꯥꯑꯣꯗꯅꯥ ꯑꯣꯏꯊꯣꯀꯄꯥ ꯌꯥꯏ;
whether therefore I can exist merely as a thinking being (without being,ꯃꯔꯝ ꯑꯗꯨꯅꯥ ꯑꯩꯍꯥꯛ ꯁꯨꯞꯅꯇꯒꯤ ꯋꯥꯈꯜ ꯈꯅꯕꯥ ꯃꯤꯑꯣꯏ ꯑꯃꯥ ꯑꯣꯏꯅꯥ ꯂꯩꯕꯥ ꯉꯃꯒꯗ꯭ꯔꯥ (ꯃꯗꯨ ꯌꯥꯑꯣꯗꯅꯥ .
man)—cannot be known or inferred from this proposition,ꯃꯤꯑꯣꯏ)—ꯄ꯭ꯔꯣꯄꯣꯖꯦꯜ ꯑꯁꯤꯗꯒꯤ ꯈꯉꯕꯥ ꯅꯠꯔꯒꯥ ꯂꯧꯁꯤꯅꯕꯥ ꯌꯥꯔꯣꯏ .
Thus we have gained nothing as regards the cognition of myself as,ꯑꯁꯨꯝꯅꯥ ꯑꯩꯈꯣꯌꯅꯥ ꯑꯩꯍꯥꯛꯀꯤ ꯏꯁꯥꯒꯤ ꯀꯣꯒꯅꯤꯁꯅꯒꯤ ꯃꯇꯥꯡꯗꯥ ꯀꯔꯤꯒꯨꯝꯕꯥ ꯑꯃꯠꯇꯥ ꯐꯪꯈꯤꯗꯦ .
"object, by the analysis of the consciousness of my Self in thought. The","ꯑꯣꯕꯖꯦꯛꯇ, ꯋꯥꯈꯂꯗꯥ ꯑꯩꯒꯤ ꯏꯁꯥꯒꯤ ꯀꯟꯁꯇꯤꯠꯌꯨꯁꯅꯒꯤ ꯑꯦꯅꯥꯂꯥꯏꯁꯤꯁꯅꯥ꯫"
logical exposition of thought in general is mistaken for a metaphysical,ꯂꯣꯖꯤꯀꯦꯜ ꯑꯦꯛꯁꯄꯣꯖꯤꯁꯟ ꯑꯣꯐ ꯊꯣꯠ ꯑꯁꯤ ꯃꯍꯧꯁꯥꯅꯥ ꯃꯦꯇꯥꯐꯤꯁꯤꯀꯦꯜ ꯑꯃꯥ ꯑꯣꯏꯅꯥ ꯑꯔꯥꯅꯕꯥ ꯃꯑꯣꯡꯗꯥ ꯂꯧꯏ꯫
determination of the object,ꯄꯣꯠꯁꯛ ꯑꯗꯨ ꯂꯦꯄꯊꯣꯀꯄꯥ .
"Our Critique would be an investigation utterly superfluous, if there","ꯑꯩꯈꯣꯌꯒꯤ ꯀ꯭ꯔꯤꯇꯤꯀꯦꯜ ꯑꯁꯤ ꯏꯅꯚꯦꯁ꯭ꯇꯤꯒꯦꯁꯟ ꯑꯃꯥ ꯑꯣꯏꯒꯅꯤ, ꯀꯔꯤꯒꯨꯝꯕꯥ ꯃꯐꯝ ꯑꯗꯨꯗꯥ ꯂꯩꯔꯕꯗꯤ"
"existed a possibility of proving à priori, that all thinking beings are in","o priori ꯒꯤ ꯄ꯭ꯔꯃꯥꯟ ꯇꯧꯕꯒꯤ ꯑꯣꯏꯊꯣꯀꯄꯥ ꯑꯃꯥ ꯂꯩ, ꯃꯗꯨꯗꯤ ꯋꯥꯈꯜ ꯈꯅꯕꯒꯤ ꯃꯤꯑꯣꯏ ꯄꯨꯝꯅꯃꯛ ꯑꯁꯤ ."
"themselves simple substances, as such, therefore, possess the inseparable","ꯃꯈꯣꯌ ꯃꯁꯥꯃꯛ ꯏꯆꯝ ꯆꯝꯕꯥ ꯄꯣꯠꯁꯀꯁꯤꯡ, ꯃꯔꯝ ꯑꯗꯨꯅꯥ, ꯃꯔꯝ ꯑꯁꯤꯅꯥ, ꯇꯣꯈꯥꯌꯕꯥ ꯂꯩꯇꯕꯥ ꯄꯣꯠꯁꯀꯁꯤꯡ ."
"attribute of personality, and are conscious of their existence apart from and","ꯄꯔꯁꯣꯅꯦꯂꯤꯇꯤꯒꯤ ꯑꯦꯠꯔꯤꯕꯤꯎꯠ, ꯑꯃꯁꯨꯡ ꯃꯈꯣꯌꯒꯤ ꯂꯩꯐꯃꯒꯤ ꯃꯇꯥꯡꯗꯥ ꯈꯪꯖꯤꯅꯕꯥ ꯑꯃꯁꯨꯡ 1000 ꯑꯃꯁꯨꯡ"
unconnected with matter. For we should thus have taken a step beyond the,ꯄꯣꯠꯁꯛ ꯑꯃꯒꯥ ꯁꯝꯅꯗꯕꯥ꯫
"world of sense, and have penetrated into the sphere of noumena; and in this","ꯁꯦꯟꯁꯀꯤ ꯃꯥꯂꯦꯝ, ꯑꯃꯁꯨꯡ ꯅꯧꯃꯦꯅꯥꯒꯤ ꯂꯃꯗꯥ ꯆꯪꯁꯤꯜꯂꯛꯂꯦ;"
case the right could not be denied us of extending our knowledge in this,ꯀꯦꯁ ꯑꯁꯤꯅꯥ ꯑꯩꯈꯣꯌꯒꯤ ꯂꯧꯁꯤꯡ ꯑꯁꯤ ꯁꯥꯡꯗꯣꯀꯄꯒꯤ ꯍꯛ ꯑꯗꯨ ꯑꯩꯈꯣꯌꯗꯥ ꯄꯤꯁꯤꯅꯕꯥ ꯉꯃꯈꯤꯗꯦ .
"sphere, of establishing ourselves, and, under a favouring star, appropriating","ꯁ꯭ꯐꯤꯔ, ꯑꯩꯈꯣꯌ ꯏꯁꯥꯕꯨ ꯂꯤꯡꯈꯠꯄꯥ, ꯑꯃꯁꯨꯡ, ꯃꯇꯦꯡ ꯄꯥꯡꯂꯤꯕꯥ ꯁ꯭ꯇꯥꯔ ꯑꯃꯒꯤ ꯃꯈꯥꯗꯥ, ꯑꯦꯞꯔꯣꯞꯔꯤꯌꯦꯇꯤꯡ"
"to ourselves possessions in it. For the proposition: “Every thinking being, as",ꯃꯁꯤꯗꯥ ꯂꯩꯔꯤꯕꯥ ꯄꯣꯠꯂꯃꯁꯤꯡ ꯑꯁꯤ ꯑꯩꯈꯣꯌ ꯏꯁꯥꯗꯥ꯫
"such, is simple substance,” is an à priori synthetical proposition; because in","ꯑꯁꯤꯒꯨꯝꯕꯥ, ꯑꯁꯤ ꯏꯆꯝ ꯆꯝꯕꯥ ꯄꯣꯠꯁꯛ ꯑꯃꯅꯤ,” ꯑꯁꯤ à poori synthetical ꯄ꯭ꯔꯣꯄꯣꯖꯦꯜ ꯑꯃꯅꯤ;"
"the first place it goes beyond the conception which is the subject of it, and","ꯑꯍꯥꯅꯕꯥ ꯃꯐꯃꯗꯥ ꯃꯁꯤꯅꯥ ꯃꯁꯤꯒꯤ ꯁꯕꯖꯦꯛꯇ ꯑꯣꯏꯔꯤꯕꯥ ꯀꯟꯁꯦꯄꯁꯟ ꯑꯗꯨꯗꯒꯤ ꯍꯦꯟꯅꯥ ꯆꯠꯂꯤ, ꯑꯃꯁꯨꯡ ."
"adds to the mere notion of a thinking being the mode of its existence, and in","ꯋꯥꯈꯜ ꯈꯅꯕꯥ ꯑꯃꯒꯤ ꯁꯨꯞꯅꯒꯤ ꯋꯥꯈꯜꯂꯣꯟ ꯑꯗꯨꯗꯥ ꯍꯥꯄꯆꯤꯜꯂꯤ, ꯑꯃꯁꯨꯡ ꯃꯁꯤꯒꯤ ꯃꯅꯨꯡꯗꯥ, ꯑꯃꯁꯨꯡ ꯳."
the second place annexes a predicate (that of simplicity) to the latter,ꯑꯅꯤꯁꯨꯕꯥ ꯃꯐꯝ ꯑꯁꯤꯅꯥ ꯇꯨꯡꯗꯥ ꯂꯥꯀꯄꯥ ꯄ꯭ꯔꯦꯗꯤꯀꯦꯠ ꯑꯃꯥ (ꯁꯤꯝꯄꯂꯁꯤꯇꯤ ꯂꯩꯕꯥ) ꯑꯦꯟꯁꯦꯛꯁꯟ ꯇꯧꯏ꯫
conception—a predicate which it could not have discovered in the sphere of,ꯀꯟꯁꯦꯄꯁꯟ—ꯃꯁꯤꯒꯤ ꯁ꯭ꯐꯤꯔꯗꯥ ꯃꯈꯣꯌꯅꯥ ꯊꯤꯗꯣꯀꯄꯥ ꯉꯃꯗꯕꯥ ꯄ꯭ꯔꯦꯗꯤꯀꯦꯠ ꯑꯃꯥ .
experience. It would follow that à priori synthetical propositions are,ꯊꯦꯡꯅꯔꯛꯈꯤꯕ.
"possible and legitimate, not only, as we have maintained, in relation to","ꯑꯣꯏꯊꯣꯀꯄꯥ ꯌꯥꯕꯥ ꯑꯃꯁꯨꯡ ꯂꯦꯖꯤꯁ꯭ꯂꯦꯇꯤꯕ ꯑꯣꯏꯕꯥ, ꯑꯩꯈꯣꯌꯅꯥ ꯉꯥꯛꯇꯨꯅꯥ ꯊꯝꯂꯤꯕꯥ ꯑꯁꯤꯒꯨꯝꯅꯥ, ꯃꯁꯤꯒꯥ ꯃꯔꯤ ꯂꯩꯅꯅꯥ,"
"objects of possible experience, and as principles of the possibility of this","ꯑꯣꯏꯊꯣꯀꯄꯥ ꯌꯥꯕꯥ ꯑꯦꯛꯁꯄꯔꯤꯑꯦꯟꯁꯀꯤ ꯑꯣꯕꯖꯦꯛꯇꯁꯤꯡ, ꯑꯃꯁꯨꯡ ꯃꯁꯤꯒꯤ ꯑꯣꯏꯊꯣꯀꯄꯥ ꯌꯥꯕꯒꯤ ꯄ꯭ꯔꯤꯟꯁꯤꯄꯜ ꯑꯣꯏꯅꯥ ."
"experience itself, but are applicable to things in themselves—an inference","ꯑꯦꯛꯁꯄꯔꯤꯑꯦꯟꯁ ꯃꯁꯥꯃꯛ, ꯑꯗꯨꯕꯨ ꯃꯈꯣꯌ ꯃꯁꯥꯗꯥ ꯂꯩꯔꯤꯕꯥ ꯄꯣꯠꯁꯤꯡꯗꯥ ꯑꯦꯞꯂꯤꯀꯦꯕꯜ ꯑꯣꯏ—ꯏꯅꯐꯦꯟꯁ ꯑꯃꯥ"
"which makes an end of the whole of this Critique, and obliges us to fall","ꯃꯁꯤꯅꯥ ꯀ꯭ꯔꯤꯇꯤꯀꯦꯜ ꯑꯁꯤꯒꯤ ꯃꯄꯨꯡ ꯑꯣꯏꯕꯥ ꯋꯥꯐꯝ ꯑꯃꯥ ꯂꯣꯏꯁꯤꯜꯂꯤ, ꯑꯃꯁꯨꯡ ꯑꯩꯈꯣꯌꯗꯥ ꯁꯣꯏꯗꯅꯥ ꯁꯣꯏꯗꯅꯥ ꯁꯣꯏꯗꯅꯥ ꯁꯣꯏꯗꯅꯥ ꯁꯣꯏꯗꯅꯥ ꯁꯣꯏꯗꯅꯥ ꯁꯣꯏꯗꯅꯥ ꯁꯣꯏꯗꯅꯥ ꯁꯣꯏꯗꯅꯥ ꯁꯣꯏꯗꯅꯥ ꯁꯣꯏꯗꯅꯥ ꯁꯣꯏꯗꯅꯥ ꯁꯣꯏꯗꯅꯥ ꯁꯣꯏꯗꯅꯥ ꯁꯣꯏꯗꯅꯥ ꯁꯣꯏꯗꯅꯥ ꯁꯣꯏꯗꯅꯥ ꯁꯣꯏꯗꯅꯥ ꯁꯣꯏꯗꯅꯥ ꯁꯣꯏꯗꯅꯥ ꯁꯣꯏꯗꯅꯥ ꯁꯣꯏꯗꯅꯥ ꯁꯣꯏꯗꯅꯥ ꯁꯣꯏꯗꯅꯥ ꯁꯣꯏꯗꯅꯥ ꯁꯣꯏꯗꯅꯥ ꯁꯣꯏꯗꯅꯥ ꯁꯣꯏꯗꯅꯥ ꯁꯣꯏꯗꯅꯥ ꯁꯣꯏꯗꯅꯥ ꯁꯣꯏꯗꯅꯥ ꯁꯣꯏꯗꯅꯥ ꯁꯣꯏꯗꯅꯥ ꯁꯣꯏꯗꯅꯥ ꯁꯣꯏꯗꯅꯥ ꯁꯣꯏꯗꯅꯥ ꯁꯣꯏꯗꯅꯥ ꯁꯣꯏꯗꯅꯥ ꯁꯣꯏꯗꯅꯥ ꯁꯣꯏꯗꯅꯥ ꯁꯣꯏꯗꯅꯥ ꯁꯣꯏꯗꯅꯥ ꯁꯣꯏꯗꯅꯥ ꯁꯣꯏꯗꯅꯥ ꯁꯣꯏꯗꯅꯥ ꯁꯣꯏꯗꯅꯥ ꯁꯣꯏꯗꯅꯥ ꯁꯣꯏꯗꯅꯥ ꯁꯣꯏꯗꯅꯥ ꯁꯣꯏꯗꯅꯥ ꯁꯣꯏꯗꯅꯥ ꯁꯣꯏꯗꯅꯥ ꯁꯣꯏꯗꯅꯥ ꯁꯣꯏꯗꯅꯥ ꯁꯣꯏꯗꯅꯥ ꯁꯣꯏꯗꯅꯥ"
back on the old mode of metaphysical procedure. But indeed the danger is,ꯃꯦꯇꯥꯐꯤꯁꯤꯀꯦꯜ ꯄ꯭ꯔꯣꯁꯤꯖꯔꯒꯤ ꯑꯔꯤꯕꯥ ꯃꯣꯗ ꯑꯗꯨꯗꯥ ꯍꯜꯂꯀꯎ꯫
"not so great, if we look a little closer into the question","ꯑꯁꯨꯛ ꯌꯥꯝꯅꯥ ꯑꯆꯧꯕꯥ ꯅꯠꯇꯦ, ꯀꯔꯤꯒꯨꯝꯕꯥ ꯑꯩꯈꯣꯌꯅꯥ ꯋꯥꯍꯪ ꯑꯁꯤꯒꯤ ꯃꯅꯨꯡꯗꯥ ꯈꯔꯥ ꯍꯦꯟꯅꯥ ꯅꯛꯅꯔꯕꯗꯤ ."
"There lurks in the procedure of rational Psychology a paralogism, which","ꯔꯦꯁ꯭ꯅꯦꯜ ꯁꯥꯏꯀꯣꯂꯣꯖꯤꯒꯤ ꯄ꯭ꯔꯣꯁꯤꯗ꯭ꯌꯨꯔꯗꯥ ꯄꯦꯔꯥꯂꯣꯖꯤꯖꯝ ꯑꯃꯥ ꯂꯦꯞꯂꯤ, ꯃꯗꯨ ."
is represented in the following syllogism:,ꯑꯁꯤ ꯃꯈꯥꯗꯥ ꯄꯤꯔꯤꯕꯥ ꯁꯤꯂꯣꯖꯤꯖꯝ ꯑꯁꯤꯗꯥ ꯔꯤꯞꯔꯖꯦꯟꯇ ꯇꯧꯔꯤ:
"That which cannot be cogitated otherwise than as subject, does not exist","ꯁꯕ꯭ꯖꯦꯛꯇ ꯑꯣꯏꯅꯥ ꯅꯠꯇꯅꯥ ꯑꯇꯣꯞꯄꯥ ꯃꯑꯣꯡꯗꯥ ꯀꯣꯖꯤꯇꯦꯗ ꯇꯧꯕꯥ ꯉꯃꯗꯕꯥ ꯑꯗꯨ, ꯂꯩꯇꯦ ."
"otherwise than as subject, and is therefore substance","ꯅꯠꯇꯕꯥ ꯑꯁꯤ ꯁꯕꯖꯦꯛꯇ ꯑꯣꯏꯅꯥ ꯅꯠꯇꯅꯥ, ꯑꯃꯁꯨꯡ ꯃꯔꯝ ꯑꯁꯤꯅꯥ ꯄꯣꯠꯁꯛ ꯑꯁꯤ ."
"A thinking being, considered merely as such, cannot be cogitated","ꯋꯥꯈꯜ ꯈꯅꯕꯥ ꯃꯤꯑꯣꯏ ꯑꯃꯅꯥ, ꯁꯨꯞꯅꯒꯤ ꯃꯗꯨꯒꯨꯝꯅꯥ ꯂꯧꯅꯔꯤꯕꯥ ꯑꯁꯤ ꯀꯣꯖꯤꯇꯦꯗ ꯑꯣꯏꯕꯥ ꯌꯥꯔꯣꯏ ."
otherwise than as subject,ꯅꯠꯇꯕꯥ ꯑꯁꯤ ꯁꯕꯖꯦꯛꯇ ꯑꯣꯏꯅꯥ .
"Therefore it exists also as such, that is, as substance","ꯃꯔꯝ ꯑꯗꯨꯅꯥ ꯃꯁꯤꯁꯨ ꯑꯗꯨꯃꯛ ꯂꯩꯔꯤ, ꯍꯥꯌꯕꯗꯤ, ꯄꯣꯠꯁꯛ ꯑꯃꯥ ꯑꯣꯏꯅꯥ ."
In the major we speak of a being that can be cogitated generally and in,ꯃꯦꯖꯔꯗꯥ ꯑꯩꯈꯣꯌꯅꯥ ꯃꯍꯧꯁꯥꯅꯥ ꯑꯃꯁꯨꯡ ꯲꯰꯲꯰ꯗꯥ ꯀꯣꯖꯤꯇꯦꯠ ꯇꯧꯕꯥ ꯌꯥꯕꯥ ꯖꯤꯕ ꯑꯃꯒꯤ ꯃꯇꯥꯡꯗꯥ ꯋꯥꯔꯤ ꯁꯥꯔꯤ꯫
"every relation, consequently as it may be given in intuition. But in the","ꯃꯔꯤ ꯈꯨꯗꯤꯡꯃꯛ, ꯃꯗꯨꯒꯤ ꯃꯍꯩ ꯑꯣꯏꯅꯥ ꯏꯟꯠꯌꯨꯏꯁꯅꯗꯥ ꯄꯤꯕꯥ ꯌꯥꯕꯥ ꯃꯑꯣꯡꯗꯥ꯫"
minor we speak of the same being only in so far as it regards itself as,ꯃꯥꯏꯅꯣꯔꯤꯇꯤ ꯑꯩꯈꯣꯌꯅꯥ ꯆꯞ ꯃꯥꯟꯅꯕꯥ ꯖꯤꯕ ꯑꯁꯤ ꯃꯁꯥꯃꯀꯄꯨ ꯃꯁꯥꯅꯥ ꯃꯁꯥꯕꯨ ꯂꯧꯖꯕꯥ ꯉꯃꯖꯕꯥ ꯃꯑꯣꯡꯗꯥ ꯈꯛꯇꯃꯛ ꯉꯥꯡꯏ꯫
"subject, relatively to thought and the unity of consciousness, but not in","ꯁꯕꯖꯦꯛꯇ, ꯔꯤꯂꯦꯇꯤꯕ ꯑꯣꯏꯅꯥ ꯋꯥꯈꯜ ꯑꯃꯁꯨꯡ ꯀꯟꯁꯇꯤꯠꯌꯨꯁꯅꯒꯤ ꯑꯄꯨꯅꯕꯥ, ꯑꯗꯨꯕꯨ ꯲꯰꯲꯰ꯗꯥ꯫"
"relation to intuition, by which it is presented as an object to thought. Thus","ꯏꯟꯠꯌꯨꯏꯇꯤꯖꯒꯥ ꯃꯔꯤ ꯂꯩꯅꯕꯥ, ꯃꯁꯤꯅꯥ ꯃꯁꯤꯕꯨ ꯋꯥꯈꯂꯒꯤ ꯑꯣꯕꯖꯦꯛꯇ ꯑꯃꯥ ꯑꯣꯏꯅꯥ ꯄꯤꯔꯤ꯫"
the conclusion is here arrived at by a Sophisma figurae dictionis.[44],ꯋꯥꯔꯣꯏꯁꯤꯟ ꯑꯁꯤ ꯃꯐꯝ ꯑꯁꯤꯗꯥ ꯁꯣꯐꯤꯁꯃꯥ ꯐꯤꯒꯔ ꯗꯤꯛꯁꯅꯥꯏꯅꯥ ꯌꯧꯔꯀꯏ꯫[44]
[44] Thought is taken in the two premisses in two totally different senses. In the,[44] ꯋꯥꯈꯜꯂꯣꯟ ꯑꯁꯤ ꯃꯄꯨꯡ ꯐꯥꯅꯥ ꯇꯣꯉꯥꯅꯕꯥ ꯁꯦꯟꯁ ꯑꯅꯤꯗꯥ ꯄ꯭ꯔꯤꯃꯤꯁ ꯑꯅꯤꯗꯥ ꯂꯧꯏ꯫
"major it is considered as relating and applying to objects in general,","ꯃꯦꯖꯔ ꯑꯁꯤ ꯃꯔꯤ ꯂꯩꯅꯕꯥ ꯑꯃꯁꯨꯡ ꯃꯍꯧꯁꯥꯅꯥ ꯄꯣꯠꯁꯤꯡꯗꯥ ꯑꯦꯞꯂꯥꯏ ꯇꯧꯕꯥ ꯍꯥꯌꯅꯥ ꯂꯧꯅꯩ, ."
"consequently to objects of intuition also. In the minor, we understand it as",ꯃꯔꯝ ꯑꯁꯤꯅꯥ ꯏꯟꯠꯌꯨꯏꯇꯤꯒꯤ ꯑꯣꯕꯖꯦꯛꯇꯁꯤꯡꯗꯁꯨ꯫
"relating merely to self-consciousness. In this sense, we do not cogitate an object,",ꯁꯨꯞꯅꯒꯤ ꯁꯦꯜꯐ-ꯀꯟꯁꯏꯌꯅꯒꯥ ꯃꯔꯤ ꯂꯩꯅꯕꯥ꯫
"but merely the relation to the self-consciousness of the subject, as the form of","ꯑꯗꯨꯕꯨ ꯁꯨꯞꯅꯒꯤ ꯁꯕ꯭ꯖꯦꯛꯇꯀꯤ ꯃꯁꯥꯒꯤ ꯑꯣꯏꯕꯥ ꯋꯥꯈꯜꯂꯣꯅꯒꯥ ꯂꯩꯅꯕꯥ ꯃꯔꯤ ꯑꯗꯨ, ꯃꯗꯨꯒꯤ ꯃꯑꯣꯡ ꯑꯣꯏꯅꯥ ."
thought. In the former premiss we speak of things which cannot be cogitated,ꯋꯥꯈꯜ.
"otherwise than as subjects. In the second, we do not speak of things, but of",ꯑꯇꯣꯞꯄꯥ ꯃꯑꯣꯡꯗꯥ ꯁꯕꯖꯦꯛꯇ ꯑꯣꯏꯅꯥ ꯂꯧꯕꯥ ꯌꯥꯏ꯫
"thought (all objects being abstracted), in which the Ego is always the subject of","ꯋꯥꯈꯜ (ꯑꯗꯨꯕꯨ ꯑꯦꯕꯁ꯭ꯠꯔꯦꯛꯇ ꯇꯧꯔꯤꯕꯥ ꯄꯣꯠꯁꯛ ꯄꯨꯝꯅꯃꯛ), ꯃꯗꯨꯗꯥ ꯏꯒꯣꯅꯥ ꯃꯇꯝ ꯄꯨꯝꯕꯗꯥ ."
"consciousness. Hence the conclusion cannot be, “I cannot exist otherwise than as",ꯋꯥꯈꯜ ꯇꯥꯕ.
"subject”; but only “I can, in cogitating my existence, employ my Ego only as the","subject”;ꯑꯗꯨꯕꯨ “ꯑꯩꯍꯥꯛꯅꯥ, ꯑꯩꯍꯥꯛꯀꯤ ꯂꯩꯔꯤꯕꯥ ꯑꯁꯤ ꯀꯣꯖꯤꯇꯦꯠ ꯇꯧꯕꯗꯥ, ꯑꯩꯍꯥꯛꯀꯤ ꯏꯒꯣ ꯑꯁꯤ ꯁꯨꯞꯅꯇꯒꯤ ꯗꯤ."
"subject of the judgement.” But this is an identical proposition, and throws no",ꯖꯖꯃꯦꯟꯇꯀꯤ ꯁꯕꯖꯦꯛꯇ꯫”
light on the mode of my existence,ꯑꯩꯒꯤ ꯂꯩꯔꯤꯕꯥ ꯃꯑꯣꯡ ꯃꯇꯧ ꯑꯗꯨꯗꯥ ꯃꯉꯥꯜ ꯄꯤꯕꯥ
"That this famous argument is a mere paralogism, will be plain to any one","ꯃꯁꯤꯒꯤ ꯃꯃꯤꯡ ꯂꯩꯔꯕꯥ ꯋꯥꯐꯝ ꯑꯁꯤ ꯁꯨꯞꯅꯒꯤ ꯄꯦꯔꯥꯂꯣꯖꯤꯖꯝ ꯑꯃꯈꯛꯇꯅꯤ, ꯀꯅꯥꯒꯨꯝꯕꯥ ꯑꯃꯠꯇꯗꯥ ꯃꯌꯦꯛ ꯁꯦꯡꯅꯥ ꯎꯕꯥ ꯐꯪꯒꯅꯤ"
who will consider the general remark which precedes our exposition of the,ꯑꯩꯈꯣꯌꯒꯤ ꯑꯦꯛꯁꯄꯣꯖꯤꯁꯅꯒꯤ ꯃꯃꯥꯡꯗꯥ ꯂꯩꯔꯤꯕꯥ ꯖꯦꯅꯔꯦꯜ ꯔꯤꯃꯥꯔꯛ ꯑꯗꯨ ꯀꯅꯥꯅꯥ ꯈꯟꯅꯒꯅꯤ .
"principles of the pure understanding, and the section on noumena. For it","ꯄ꯭ꯌꯨꯔ ꯑꯣꯏꯕꯥ ꯂꯧꯁꯤꯡꯒꯤ ꯄ꯭ꯔꯤꯟꯁꯤꯄꯂꯁꯤꯡ, ꯑꯃꯁꯨꯡ ꯅꯧꯃꯦꯅꯥꯒꯤ ꯃꯇꯥꯡꯗꯥ ꯁꯦꯛꯁꯟ꯫"
"was there proved that the conception of a thing, which can exist per se—","ꯃꯐꯝ ꯑꯗꯨꯗꯥ ꯋꯥꯐꯝ ꯑꯃꯒꯤ ꯀꯟꯁꯦꯄꯁꯟ ꯑꯗꯨ, ꯃꯗꯨ ꯃꯁꯥꯅꯥ ꯃꯁꯥꯕꯨ ꯂꯩꯖꯕꯥ ꯌꯥꯏ ꯍꯥꯌꯕꯥ ꯄ꯭ꯔꯃꯥꯟ ꯇꯧꯈꯤꯕꯔꯥ—"
"only as a subject and never as a predicate, possesses no objective reality;","ꯁꯕꯖꯦꯛꯇ ꯑꯃꯥ ꯑꯣꯏꯅꯥ ꯈꯛꯇꯃꯛ ꯑꯃꯁꯨꯡ ꯀꯩꯗꯧꯅꯨꯡꯗꯥ ꯄ꯭ꯔꯦꯗꯤꯀꯦꯠ ꯑꯣꯏꯅꯥ, ꯑꯣꯕꯖꯦꯛꯇꯤꯕ ꯔꯤꯑꯦꯂꯤꯇꯤ ꯑꯃꯠꯇꯥ ꯂꯩꯇꯦ;"
"that is to say, we can never know whether there exists any object to",ꯍꯥꯌꯕꯗꯤ ꯑꯩꯈꯣꯌꯅꯥ ꯀꯩꯗꯧꯅꯨꯡꯗꯥ ꯈꯉꯕꯥ ꯉꯝꯂꯣꯏ ꯃꯗꯨꯗꯤ ꯀꯔꯤꯒꯨꯝꯕꯥ ꯄꯣꯠꯁꯛ ꯑꯃꯠꯇꯥ ꯂꯩꯕ꯭ꯔꯥ .
"correspond to the conception; consequently, the conception is nothing more",ꯋꯥꯈꯜꯂꯣꯟ ꯑꯗꯨꯒꯥ ꯃꯥꯟꯅꯩ;
"than a conception, and from it we derive no proper knowledge. If this","ꯀꯟꯁꯦꯄꯁꯟ ꯑꯃꯗꯒꯤ ꯍꯦꯟꯅꯥ, ꯑꯃꯁꯨꯡ ꯃꯁꯤꯗꯒꯤ ꯑꯩꯈꯣꯌꯅꯥ ꯃꯇꯤꯛ ꯆꯥꯕꯥ ꯂꯧꯁꯤꯡ ꯑꯃꯠꯇꯥ ꯐꯪꯗꯦ꯫"
"conception is to indicate by the term substance, an object that can be given,","ꯀꯟꯁꯦꯄꯁꯟ ꯍꯥꯌꯕꯁꯤ ꯄꯣꯠꯁꯛ ꯑꯃꯥ, ꯄꯤꯕꯥ ꯌꯥꯕꯥ ꯄꯣꯠꯁꯛ ꯑꯃꯅꯥ ꯇꯥꯀꯄꯅꯤ, ."
"if it is to become a cognition, we must have at the foundation of the",ꯀꯔꯤꯒꯨꯝꯕꯥ ꯃꯁꯤ ꯀꯣꯒꯅꯤꯁꯟ ꯑꯃꯥ ꯑꯣꯏꯔꯛꯂꯕꯗꯤ ꯑꯩꯈꯣꯌꯅꯥ ꯌꯨꯃꯐꯝ ꯑꯣꯏꯔꯒꯥ .
"cognition a permanent intuition, as the indispensable condition of its","ꯀꯣꯒꯅꯤꯁꯟ ꯄꯔꯃꯦꯅꯦꯟꯇ ꯏꯟꯠꯌꯨꯏꯇꯤꯖꯝ ꯑꯃꯥ, ꯃꯁꯤꯒꯤ ꯇꯉꯥꯏꯐꯗꯕꯥ ꯀꯟꯗꯤꯁꯟ ꯑꯣꯏꯅꯥ ."
