en,mni-Mtei
try to work out an agreement with the person so you can,"ꯃꯤꯑꯣꯏ ꯑꯗꯨꯒꯥ ꯂꯣꯌꯅꯅꯥ ꯌꯥꯅꯆꯦ ꯑꯃꯥ ꯁꯦꯝꯅꯕꯥ ꯍꯣꯠꯅꯧ, ꯃꯔꯝ ꯑꯗꯨꯅꯥ ꯅꯍꯥꯛꯅꯥ ."
feel reasonably sure it won't happen again. It's also a,"ꯃꯔꯝ ꯆꯥꯅꯥ ꯁꯣꯌꯗꯅꯥ ꯐꯥꯎꯒꯅꯤ, ꯃꯁꯤ ꯑꯃꯨꯛ ꯍꯟꯅꯥ ꯊꯣꯛꯂꯔꯣꯏ꯫"
good idea to soft out what made you vulnerable in the,ꯑꯐꯕꯥ ꯋꯥꯈꯜꯂꯣꯟ ꯑꯗꯨꯅꯥ ꯅꯍꯥꯀꯄꯨ ꯀꯔꯤ ꯑꯣꯏꯍꯅꯈꯤꯕꯒꯦ ꯍꯥꯌꯕꯗꯨ ꯁꯣꯐ꯭ꯠ ꯑꯥꯎꯠ ꯇꯧꯕꯥ
first place and change your anitude or behavior. Know-,ꯑꯍꯥꯅꯕꯥ ꯃꯐꯃꯗꯥ ꯑꯃꯁꯨꯡ ꯅꯍꯥꯛꯀꯤ ꯑꯦꯅꯤꯠꯌꯨꯗ ꯅꯠꯠꯔꯒꯥ ꯂꯃꯆꯠ-ꯁꯥꯖꯠ ꯍꯣꯡꯗꯣꯀꯎ꯫
astated will allow you to forget as well as forgive,ꯑꯦꯁ꯭ꯇꯦꯇꯦꯗꯅꯥ ꯑꯗꯣꯝꯕꯨ ꯀꯥꯑꯣꯊꯣꯀꯄꯒꯥ ꯂꯣꯌꯅꯅꯥ ꯃꯥꯡꯖꯧꯅꯅꯥ .
t3sl,ꯇꯤ.꯳ꯑꯦꯁ.ꯑꯦꯜ.
GET OUT OF YOUR OlqN lrAY,ꯑꯗꯣꯃꯒꯤ ꯑꯣꯂꯀꯅꯂꯗꯒꯤ ꯊꯣꯛꯂꯛꯇꯨꯅꯥ ꯂꯥꯀꯄꯤꯌꯨ .
USABLE INSIGHT',ꯁꯤꯖꯤꯟꯅꯕꯥ ꯌꯥꯕꯥ ꯋꯥꯈꯜꯂꯣꯟ'꯫
We forgive when we no longer ned t0 blame; we,ꯑꯩꯈꯣꯌꯅꯥ ꯍꯧꯖꯤꯛ ꯅꯦꯗ ꯇꯤ꯰ ꯗꯣꯁ ꯇꯧꯔꯛꯂꯣꯏꯗꯕꯥ ꯃꯇꯃꯗꯥ ꯑꯩꯈꯣꯌꯅꯥ ꯃꯥꯡꯖꯧꯅꯅꯥ ꯍꯥꯌꯖꯔꯤ;
forget when we n0 longer need ta rcmember,ꯑꯩꯈꯣꯌꯅꯥ N0 ꯍꯦꯟꯅꯥ ꯃꯊꯧ ꯇꯥꯕꯥ ꯃꯇꯃꯗꯥ ꯀꯥꯑꯣꯊꯣꯀꯎ ta rcmember
Tmrnc Acnoirt,ꯇꯤ.ꯑꯦꯝ.ꯑꯥꯔ.ꯑꯦꯟ.ꯁꯤ.
costing you,ꯃꯃꯜ ꯌꯥꯝꯅꯥ ꯇꯥꯡꯕꯥ .
what you would need from him or her in order to,ꯑꯗꯣꯝꯅꯥ ꯃꯍꯥꯛꯀꯤ ꯃꯐꯃꯗꯒꯤ ꯀꯔꯤ ꯃꯊꯧ ꯇꯥꯒꯅꯤ ꯍꯥꯌꯕꯗꯨꯒꯤ ꯃꯇꯨꯡ ꯏꯟꯅꯥ
feel safe in the future,ꯇꯨꯡꯗꯥ ꯁꯦꯐ ꯑꯣꯏꯕꯥ ꯐꯥꯑꯣꯒꯅꯤ
problem,ꯁꯤꯡꯅꯕ
cruTence,ꯀ꯭ꯔꯌꯨꯇꯦꯟꯁ .
"future, you will find it easier to forget the past","ꯇꯨꯡꯒꯤ ꯐꯤꯕꯝ, ꯑꯗꯣꯝꯅꯥ ꯍꯧꯈꯤꯕꯥ ꯃꯇꯝ ꯀꯥꯑꯣꯊꯣꯀꯄꯗꯥ ꯍꯦꯟꯅꯥ ꯂꯥꯌꯊꯣꯀꯍꯜꯂꯒꯅꯤ"
[36],[꯳꯶] ꯑꯃꯁꯨꯡ ꯑꯦꯟ.
Assuming They Don't Want,ꯃꯈꯣꯌꯅꯥ ꯄꯥꯃꯗꯦ ꯍꯥꯌꯅꯥ ꯂꯧꯔꯒꯥ .
Anything in Return,ꯔꯤꯇꯔꯟ ꯇꯧꯕꯥ ꯌꯥꯕꯥ ꯄꯣꯠꯁꯛ ꯑꯃꯠꯇꯥ .
"""Before bonoaing moruy from a friend, dccidc","""ꯃꯔꯨꯞ ꯑꯃꯗꯒꯤ ꯕꯣꯅꯣꯌꯤꯡ ꯃꯣꯔꯨꯌꯒꯤ ꯃꯃꯥꯡꯗꯥ, ꯗꯤ.ꯁꯤ.ꯁꯤ.ꯑꯥꯏ.ꯗꯤ.ꯁꯤ."
"which you nced more.""",ꯃꯗꯨ ꯅꯍꯥꯛꯅꯥ ꯑꯦꯟ.ꯁꯤ.ꯏ.ꯗꯤ.
_ADDISON H. HAILOCK,_ꯑꯦꯗꯤꯁꯟ ꯑꯩꯆ.
Hillary wanted very much to finish her graduate studies,ꯍꯤꯂꯥꯔꯤꯅꯥ ꯃꯍꯥꯛꯀꯤ ꯒ꯭ꯔꯦꯖꯨꯑꯦꯠ ꯇꯝꯕꯥ ꯂꯣꯏꯁꯤꯟꯅꯕꯥ ꯌꯥꯝꯅꯥ ꯄꯥꯝꯂꯝꯃꯤ
"and become a psychotherapist. Low on money, she had",ꯑꯃꯁꯨꯡ ꯁꯥꯏꯀꯣꯊꯦꯔꯥꯄꯤꯁ꯭ꯠ ꯑꯃꯥ ꯑꯣꯏꯔꯀꯏ꯫
"been on sabbatical for three years, working for an ac-","ꯆꯍꯤ ꯑꯍꯨꯃꯒꯤ ꯑꯣꯏꯅꯥ ꯁꯦꯕꯇꯤꯀꯦꯂꯗꯥ ꯂꯩꯔꯀꯈꯤ, ꯑꯦ.ꯁꯤ.-ꯒꯤꯗꯃꯛ ꯊꯕꯛ ꯇꯧꯈꯤ꯫"
counting firm and taking whatever courses she could af-,ꯐꯔꯝ ꯀꯥꯎꯟꯇ ꯇꯧꯕꯥ ꯑꯃꯁꯨꯡ ꯃꯍꯥꯛꯅꯥ ꯇꯧꯕꯥ ꯌꯥꯕꯥ ꯀꯣꯔꯁꯁꯤꯡ ꯂꯧꯕꯥ-
ford. Then she got lucky. FIer sister and brother had a,ꯐꯣꯔꯗ ꯑꯃꯁꯨꯡ ꯑꯦꯝ.
sudden business success and offered to pay for her,ꯈꯉꯍꯧꯗꯅꯥ ꯂꯂꯣꯟ-ꯏꯇꯤꯛꯀꯤ ꯃꯥꯌ ꯄꯥꯀꯄꯥ ꯑꯃꯁꯨꯡ ꯃꯍꯥꯛꯀꯤꯗꯃꯛ ꯁꯦꯜ ꯄꯤꯅꯕꯥ ꯍꯥꯌꯖꯈꯤ
"schooling. 'Just finish your training and be successful,""",ꯁ꯭ꯀꯨꯜ ꯇꯝꯕꯥ꯫
"they said graciously. ""That's all the payback we want.""",ꯃꯈꯣꯌꯅꯥ ꯊꯧꯖꯥꯜ ꯍꯩꯅꯥ ꯍꯥꯌꯈꯤ꯫
On the surface they were true to their word: Hillary,ꯃꯊꯛꯇꯥ ꯃꯈꯣꯌꯅꯥ ꯃꯈꯣꯌꯒꯤ ꯋꯥꯍꯩꯗꯥ ꯑꯆꯨꯝꯕꯥ ꯍꯥꯌꯔꯝꯃꯤ: ꯍꯤꯂꯥꯔꯤ
was not expected to pay a penny in return. But she dis-,ꯃꯗꯨꯒꯤ ꯃꯍꯨꯠꯇꯥ ꯄꯦꯅꯤ ꯑꯃꯥ ꯄꯤꯒꯅꯤ ꯍꯥꯌꯅꯥ ꯊꯥꯖꯈꯤꯗꯦ꯫
"covered she had accumulated other, more subtle debts","ꯀꯚꯔ ꯃꯍꯥꯛꯅꯥ ꯑꯇꯣꯞꯄꯥ, ꯍꯦꯟꯅꯥ ꯃꯌꯦꯛ ꯁꯦꯡꯕꯥ ꯂꯟ-ꯊꯨꯃꯁꯤꯡ ꯄꯨꯊꯣꯀꯈꯤꯕꯅꯤ"
"Suddenly, she was expected to navel cross-country for",ꯈꯉꯍꯧꯗꯅꯥ ꯃꯍꯥꯛꯅꯥ ꯀ꯭ꯔꯣꯁ-ꯀꯟꯠꯔꯤꯒꯤꯗꯃꯛ ꯑꯦꯟ.ꯑꯦ.ꯚꯤ.
"family functions, where she was clearly expected to men-","ꯏꯃꯨꯡꯒꯤ ꯊꯕꯀꯁꯤꯡ, ꯃꯐꯝ ꯑꯗꯨꯗꯥ ꯃꯍꯥꯛ ꯃꯌꯦꯛ ꯁꯦꯡꯅꯥ ꯅꯨꯄꯥꯁꯤꯡꯗꯥ ꯊꯥꯖꯕꯥ ꯊꯃꯈꯤ-"
tion at every oppornrnlty how much she appreciated her,tion at every oppornrnlty ꯃꯍꯥꯛꯅꯥ ꯃꯍꯥꯀꯄꯨ ꯀꯌꯥ ꯌꯥꯝꯅꯥ ꯊꯥꯒꯠꯈꯤꯕꯒꯦ
"benefactors. As her training progressed, her siblings",ꯕꯦꯅꯦꯐꯤꯁꯔꯤꯁꯤꯡ꯫
would phone regularly to discuss problems with their,ꯃꯈꯣꯌꯒꯤ ꯃꯔꯛꯇꯥ ꯁꯃꯁ꯭ꯌꯥꯁꯤꯡ ꯈꯟꯅꯅꯕꯥ ꯆꯥꯡ ꯅꯥꯏꯅꯥ ꯐꯣꯟ ꯇꯧꯔꯛꯀꯅꯤ꯫
"children, spouses and each other. They were getting their","ꯑꯉꯥꯡꯁꯤꯡ, ꯂꯣꯌꯅꯕꯤꯁꯤꯡ ꯑꯃꯁꯨꯡ ꯑꯃꯒꯥ ꯑꯃꯒꯥ꯫"
t37),ꯇꯤ꯳꯷) ꯑꯃꯁꯨꯡ ꯑꯦꯟ.
GET OUT OF YOUR O$fN'OTAY,ꯅꯍꯥꯛꯀꯤ o$fn'otay ꯗꯒꯤ ꯊꯣꯛꯂꯛꯀꯅꯨ
money's worth in public displays of gratitude and free,ꯃꯤꯌꯥꯃꯒꯤ ꯊꯥꯒꯠꯄꯥ ꯑꯃꯁꯨꯡ ꯐ꯭ꯔꯤ ꯑꯣꯏꯕꯥ ꯃꯤꯌꯥꯃꯒꯤ ꯗꯤꯁꯞꯂꯦꯁꯁꯤꯡꯗꯥ ꯁꯦꯂꯒꯤ ꯃꯃꯜ
"advice. They had been generous, but not entirely selfless",ꯄꯥꯎꯇꯥꯛ.
"""If I'd have known what was expected of me, I'd have","""ꯀꯔꯤꯒꯨꯝꯕꯥ ꯑꯩꯅꯥ ꯑꯩꯒꯤ ꯃꯐꯃꯗꯒꯤ ꯀꯔꯤ ꯑꯥꯁꯥ ꯇꯧꯔꯝꯕꯒꯦ ꯍꯥꯌꯕꯗꯨ ꯈꯉꯂꯝꯂꯕꯗꯤ ꯑꯩꯅꯥ ."
"taken out a bank loan,"" said Hillary","ꯕꯦꯉ꯭ꯛ ꯂꯣꯟ ꯑꯃꯥ ꯂꯧꯊꯣꯀꯈꯤ,” ꯍꯥꯌꯅꯥ ꯍꯤꯂꯥꯔꯤꯅꯥ ꯍꯥꯌꯈꯤ꯫"
Hillary discovered the emotional equivalent of,ꯍꯤꯂꯥꯔꯤꯅꯥ ꯏꯃꯣꯁꯅꯦꯜ ꯏꯀꯨꯏꯕꯦꯜ ꯑꯣꯏꯕꯥ ꯑꯗꯨ ꯊꯤꯗꯣꯀꯈꯤ꯫
"""There's no such thing as a free lunch."" Consciously or","""ꯐ꯭ꯔꯤ ꯂꯟꯆ ꯍꯥꯌꯕꯥ ꯑꯁꯤꯒꯨꯝꯕꯥ ꯋꯥꯐꯝ ꯑꯃꯠꯇꯥ ꯂꯩꯇꯦ꯫"""
"unconsciously, nearly everyone keeps score of favors and","ꯋꯥꯈꯜ ꯈꯟꯊꯗꯅꯥ, ꯆꯥꯎꯔꯥꯛꯅꯥ ꯃꯤꯑꯣꯏ ꯈꯨꯗꯤꯡꯃꯛꯅꯥ ꯃꯇꯦꯡ ꯄꯥꯡꯕꯒꯤ ꯁ꯭ꯀꯣꯔ ꯑꯃꯁꯨꯡ ."
"gestures, and everyone is sensitive to being shortchanged","ꯖꯤꯖꯔꯁꯤꯡ, ꯑꯃꯁꯨꯡ ꯃꯤꯄꯨꯝ ꯈꯨꯗꯤꯡꯃꯛ ꯁꯣꯔꯇꯆꯦꯟꯖ ꯇꯧꯕꯗꯥ ꯁꯦꯟꯁꯤꯇꯤꯕ ꯑꯣꯏ ."
"The suings attached can be exact equivalents, such as","ꯑꯦꯇꯦꯆ ꯇꯧꯔꯤꯕꯥ ꯁꯨꯏꯪꯁꯤꯡ ꯑꯁꯤ ꯆꯞ ꯃꯥꯟꯅꯕꯥ ꯃꯑꯣꯡꯗꯥ ꯑꯣꯏꯕꯥ ꯌꯥꯏ, ꯃꯈꯣꯌ ꯑꯗꯨꯗꯤ ."
when you are expected to spend as much money on a,ꯑꯗꯣꯝꯅꯥ ꯑꯦ.ꯇꯤ.
birthday gift as was spent on yours. Other times the ex-,ꯅꯈꯣꯌꯒꯤ ꯃꯊꯛꯇꯥ ꯁꯤꯖꯤꯟꯅꯈꯤꯕꯥ ꯃꯇꯨꯡ ꯏꯟꯅꯥ ꯃꯄꯣꯛ ꯅꯨꯃꯤꯠꯀꯤ ꯒꯤꯐꯠ꯫
"pectation is subtle-an extravagant display of gratitude,","ꯄꯦꯛꯇꯦꯁꯟ ꯑꯁꯤ ꯃꯌꯦꯛ ꯁꯦꯡꯕꯥ-ꯒ꯭ꯔꯦꯇꯤꯆꯨꯗꯀꯤ ꯑꯦꯛꯁꯠꯔꯥꯚꯥꯒꯦꯟꯇ ꯗꯤꯁꯞꯂꯦ ꯑꯃꯅꯤ,"
"perhaps, or a change in behavior-and we end up feeling","ꯌꯥꯑꯣꯔꯃꯒꯗ꯭ꯔꯥ, ꯅꯠꯔꯒꯥ ꯂꯃꯆꯠ-ꯁꯥꯖꯠꯇꯥ ꯑꯍꯣꯡꯕꯥ ꯑꯃꯥ ꯂꯥꯀꯄꯥ-ꯑꯗꯨꯒꯥ ꯑꯩꯈꯣꯌꯅꯥ ꯐꯤꯜꯂꯤꯡ ꯇꯧꯕꯥ ꯂꯣꯏꯁꯤꯜꯂꯤ꯫"
"confused, betrayed and manipulated. If it happens often","ꯋꯥꯈꯜ ꯋꯥꯕꯥ, ꯊꯥꯗꯣꯀꯄꯥ ꯑꯃꯁꯨꯡ ꯃꯦꯅꯤꯄꯨꯂꯦꯠ ꯇꯧꯕꯥ꯫"
"enough we can become cynical and adopt a hardened,","ꯃꯇꯤꯛ ꯆꯥꯅꯥ ꯑꯩꯈꯣꯌꯅꯥ ꯁꯤꯅꯤꯌꯔ ꯑꯣꯏꯕꯥ ꯌꯥꯏ ꯑꯃꯁꯨꯡ ꯍꯥꯔꯗꯟ ꯑꯃꯥ ꯑꯦꯗꯣꯞꯇ ꯇꯧꯕꯥ ꯌꯥꯏ,"
"""Don't do me any favors"" attitude","""ꯑꯩꯉꯣꯟꯗꯥ ꯀꯔꯤꯒꯨꯝꯕꯥ ꯈꯔꯥ ꯇꯧꯔꯣꯏꯗꯕꯅꯤ"" ꯍꯥꯌꯕꯥ ꯋꯥꯈꯜꯂꯣꯟ ꯑꯁꯤ"
Why do we want to believe that people who give to,ꯀꯔꯤꯒꯤꯗꯃꯛ ꯑꯩꯈꯣꯌꯅꯥ ꯊꯥꯖꯕꯥ ꯄꯥꯝꯂꯤꯕꯅꯣ ꯃꯗꯨꯗꯤ ꯃꯤꯁꯤꯡꯅꯥ ꯄꯤꯕꯥ ꯃꯤꯑꯣꯏꯁꯤꯡ .
us expect nothing in return? Because the desire for un-,ꯑꯩꯈꯣꯌꯅꯥ ꯃꯗꯨꯒꯤ ꯃꯍꯨꯠꯇꯥ ꯀꯔꯤꯒꯨꯝꯕꯥ ꯑꯃꯠꯇꯥ ꯑꯥꯁꯥ ꯇꯧꯗꯦ?
conditional love springs eternal. 'We want to be given to,ꯀꯟꯗꯤꯁꯅꯦꯜ ꯂꯥꯚ ꯑꯁꯤ ꯂꯣꯝꯕꯥ ꯅꯥꯏꯗꯕꯥ ꯑꯣꯏ꯫
iust because we exist-as we had been or yearned to be,iust ꯃꯔꯃꯗꯤ ꯑꯩꯈꯣꯌꯅꯥ ꯂꯩꯔꯤ-ꯑꯩꯈꯣꯌꯅꯥ ꯂꯩꯔꯝꯕꯥ ꯅꯠꯔꯒꯥ ꯌꯥꯝꯅꯥ ꯋꯥꯅꯥ ꯊꯣꯀꯈꯤꯕꯥ ꯑꯗꯨꯒꯨꯝꯅꯥ .
"as children, before we grew up and people started asking","ꯑꯉꯥꯡ ꯑꯣꯏꯔꯤꯉꯩꯗꯥ, ꯑꯩꯈꯣꯌꯅꯥ ꯆꯥꯎꯔꯀꯄꯥ ꯑꯃꯁꯨꯡ ꯃꯤꯌꯥꯝꯅꯥ ꯍꯪꯂꯀꯄꯥ ꯍꯧꯗ꯭ꯔꯤꯉꯩꯒꯤ ꯃꯃꯥꯡꯗꯥ"
for something back. $fhen people give to us and imply,ꯀꯔꯤꯒꯨꯝꯕꯥ ꯈꯔꯥꯒꯤꯗꯃꯛ꯫
that they expect nothing in return (usually out of polite-,ꯃꯈꯣꯌꯅꯥ ꯃꯗꯨꯒꯤ ꯃꯍꯨꯠꯇꯥ ꯀꯔꯤꯒꯨꯝꯕꯥ ꯑꯃꯠꯇꯥ ꯑꯥꯁꯥ ꯇꯧꯗꯦ (ꯃꯍꯧꯁꯥꯅꯥ ꯄꯣꯂꯤꯇꯤꯀꯦꯜ ꯑꯣꯏꯅꯥ-
"ness), it evokes ttrat childlike feeling of being cherished","ꯅꯦꯁ), ꯃꯁꯤꯅꯥ ttrat childlike feeling of being charished ."
as something special. No wonder we want to believe it,ꯑꯈꯟꯅꯕꯥ ꯋꯥꯐꯝ ꯑꯃꯥ ꯑꯣꯏꯅꯥ꯫
"That's why, when we discover there really are strings at-","ꯃꯔꯝ ꯑꯁꯤꯅꯥ, ꯑꯩꯈꯣꯌꯅꯥ ꯈꯉꯂꯀꯄꯥ ꯃꯇꯃꯗꯥ ꯇꯁꯦꯡꯅꯥ ꯁ꯭ꯠꯔꯤꯡꯁꯤꯡ ꯂꯩꯔꯤ-"
"tached, we feel not only betrayed and angry but foolish","ꯇꯆ꯭ꯆ, ꯑꯩꯈꯣꯌꯅꯥ ꯊꯥꯖꯕꯥ ꯊꯝꯕꯥ ꯑꯃꯁꯨꯡ ꯑꯁꯥꯑꯣꯕꯥ ꯈꯛꯇꯥ ꯅꯠꯇꯅꯥ ꯃꯨꯔꯈ ꯑꯣꯏꯕꯥ ꯐꯥꯑꯣꯏ"
for having deceived ourselves with a childlike wish,ꯑꯉꯥꯡ ꯑꯣꯏꯔꯤꯉꯩꯒꯤ ꯑꯄꯥꯝꯕꯁꯤꯡꯒꯥ ꯂꯣꯌꯅꯅꯥ ꯑꯩꯈꯣꯌ ꯏꯁꯥꯕꯨ ꯂꯃꯖꯤꯡꯕꯤꯕꯒꯤꯗꯃꯛ .
"When you accept someone's generosity, you might","ꯀꯅꯥꯒꯨꯝꯕꯥ ꯑꯃꯒꯤ ꯃꯤꯅꯨꯡꯁꯤ ꯑꯗꯨ ꯅꯍꯥꯛꯅꯥ ꯌꯥꯕꯥ ꯃꯇꯃꯗꯥ, ꯅꯍꯥꯛꯅꯥ ."
"take on a debt you do not even know you owe, and ifyou","ꯂꯧꯕꯥ ꯌꯥꯕꯥ ꯂꯂꯣꯟ-ꯏꯇꯤꯛꯀꯤ ꯊꯕꯛ ꯑꯃꯥ ꯂꯧꯈꯠꯂꯨ ꯅꯍꯥꯛꯅꯥ ꯔ꯭ꯏꯟ ꯑꯃꯥ ꯂꯧꯕꯥ ꯐꯥꯑꯣꯕꯥ ꯌꯥꯗꯦ, ꯑꯃꯁꯨꯡ ꯀꯔꯤꯒꯨꯝꯕꯥ ꯅꯍꯥꯛꯅꯥ ."
"fail to pay it back, you will be punished for reasons you","ꯃꯁꯤ ꯄꯤꯕꯥ ꯉꯃꯗꯕꯥ, ꯅꯍꯥꯛꯅꯥ ꯃꯔꯃꯁꯤꯡꯒꯤꯗꯃꯛ ꯆꯩꯔꯥꯛ ꯄꯤꯒꯅꯤ"
"cannot comprehend. To prevent this, it's a good idea to",ꯂꯧꯁꯤꯅꯕꯥ ꯉꯃꯗꯦ꯫
[38],[꯳꯸] ꯑꯃꯁꯨꯡ ꯑꯦꯟ.
ASSUMING THEY DON'T ''TANTAI{YTHING IN RETURN,ꯃꯈꯣꯌꯅꯥ ''ꯇꯥꯟꯇꯥꯏ{ything in return .
assurne that a payback is expected. You can confirm this,ꯄꯦꯕꯦꯛ ꯑꯃꯥ ꯂꯥꯛꯀꯅꯤ ꯍꯥꯌꯅꯥ ꯊꯥꯖꯕꯥ ꯄꯤꯔꯤ꯫
"by saying to the giver, ""I hope I'm in a position to do ttre","ꯄꯤꯔꯤꯕꯥ ꯃꯤꯑꯣꯏ ꯑꯗꯨꯗꯥ ꯍꯥꯌꯗꯨꯅꯥ, ""ꯑꯩꯍꯥꯛꯅꯥ ꯑꯥꯁꯥ ꯇꯧꯏ ꯃꯗꯨꯗꯤ ꯑꯩꯍꯥꯛ ꯇꯤ.ꯇꯤ.ꯑꯥꯔ.ꯏ."
"same for you sometime."" Even if they insist they want","same for yo for you fomat ꯃꯇꯝ ꯑꯃꯗꯥ꯫"" ꯃꯈꯣꯌꯅꯥ ꯄꯥꯝꯂꯤꯕꯃꯈꯩ ꯃꯈꯣꯌꯅꯥ ꯄꯥꯝꯂꯤꯕꯃꯈꯩ"
"nothing, imagine what a fair payback would be and get","ꯀꯔꯤꯁꯨ ꯂꯩꯇꯦ, ꯀꯔꯤ ꯐꯦꯌꯔ ꯄꯦꯕꯦꯛ ꯑꯃꯥ ꯑꯣꯏꯒꯅꯤ ꯍꯥꯌꯕꯗꯨ ꯈꯅꯕꯤꯌꯨ ꯑꯃꯁꯨꯡ ꯐꯪꯒꯅꯤ"
"ready to follow through, just in case. In general, it is safer","ꯐꯣꯂꯣ ꯊ꯭ꯔꯨ ꯇꯧꯅꯕꯥ ꯁꯦꯝ ꯁꯥꯔꯦ, ꯁꯨꯞꯅꯇꯒꯤ ꯀꯦꯁ ꯑꯃꯗꯥ꯫"
to assume too much is expected rather than too little,ꯌꯥꯝꯅꯥ ꯅꯦꯝꯅꯥ ꯂꯧꯕꯒꯤ ꯃꯍꯨꯠꯇꯥ ꯌꯥꯝꯅꯥ ꯍꯦꯟꯅꯥ ꯊꯥꯖꯕꯥ ꯊꯝꯕꯥ ꯌꯥꯏ ꯍꯥꯌꯅꯥ ꯂꯧꯕꯥ ꯌꯥꯏ꯫
"Otherwise, you might think your debt has been repaid","ꯅꯠꯔꯕꯗꯤ, ꯅꯍꯥꯛꯅꯥ ꯅꯍꯥꯛꯀꯤ ꯁꯦꯟꯗꯣꯏ ꯑꯗꯨ ꯔꯤꯄꯦꯌꯔ ꯇꯧꯔꯦ ꯍꯥꯌꯅꯥ ꯈꯜꯂꯃꯒꯅꯤ ."
only to discover that it hasn't,ꯈꯛꯇꯗꯥ ꯃꯁꯤ ꯈꯉꯗꯅꯕꯥ .
Try to determine at the outset whether the act is a,ꯍꯧꯔꯀꯄꯗꯥ ꯑꯦꯛꯇ ꯑꯁꯤ ꯑꯦ .
"gift, a favor or a loan. Each carries with it a different","ꯒꯤꯐꯠ, ꯐꯦꯕꯔ ꯅꯠꯠꯔꯒꯥ ꯂꯣꯟ ꯑꯃꯥ꯫"
obligation. A gift requires at leasr a thank-you; a favor,ꯏꯅꯗꯕ ꯌꯥꯗꯕ.
requires a similar action when your positions are re-,ꯅꯍꯥꯛꯀꯤ ꯄꯣꯖꯤꯁꯅꯁꯤꯡ ꯑꯗꯨ ꯑꯃꯨꯛ ꯍꯟꯅꯥ ꯂꯥꯀꯄꯥ ꯃꯇꯃꯗꯥ ꯃꯥꯟꯅꯕꯥ ꯑꯦꯛꯁꯟ ꯑꯃꯥ ꯃꯊꯧ ꯇꯥꯏ-
versed; a loan requires payment in kind,ꯕꯔꯁꯦꯗ ꯇꯧꯕꯥ;
Those distinctions are equally important when you,ꯍꯥꯌꯔꯤꯕꯥ ꯈꯦꯠꯅꯕꯁꯤꯡ ꯑꯁꯤ ꯑꯗꯣꯝꯅꯥ ꯃꯇꯝ ꯑꯁꯤꯗꯥ ꯆꯞ ꯃꯥꯟꯅꯅꯥ ꯃꯔꯨ ꯑꯣꯏ ꯫
are the giver. Don't kid yourself into thinking you are a,ꯑꯁꯤ ꯄꯤꯕꯥ ꯉꯝꯕꯥ ꯑꯗꯨꯅꯤ꯫
saint who gives to others and wants nothing in return. If,ꯑꯇꯣꯞꯄꯗꯥ ꯄꯤꯕꯥ ꯑꯃꯁꯨꯡ ꯃꯗꯨꯒꯤ ꯃꯍꯨꯠꯇꯥ ꯀꯔꯤꯒꯨꯝꯕꯥ ꯑꯃꯠꯇꯥ ꯄꯥꯃꯗꯕꯥ ꯁꯟꯇ꯫
"you :ue not clear about what you really expect, you can","you :ue ꯑꯗꯣꯝꯅꯥ ꯇꯁꯦꯡꯅꯥ ꯀꯔꯤ ꯑꯥꯁꯥ ꯇꯧꯔꯤꯕꯒꯦ ꯍꯥꯌꯕꯗꯨ ꯃꯌꯦꯛ ꯁꯦꯡꯅꯥ ꯂꯩꯇꯦ, ꯑꯗꯣꯝꯅꯥ ꯇꯧꯕꯥ ꯉꯃꯒꯅꯤ"
jeopardize relationships by seeing yourself as a victim,ꯅꯍꯥꯛꯀꯤ ꯅꯁꯥꯕꯨ ꯚꯤꯛꯇꯤꯝ ꯑꯃꯥ ꯑꯣꯏꯅꯥ ꯎꯍꯟꯗꯨꯅꯥ ꯃꯔꯤꯁꯤꯡꯗꯥ ꯈꯨꯗꯣꯡꯊꯤꯕꯥ ꯊꯣꯀꯍꯜꯂꯨ
"You might even withhold your trust and affection, and","ꯅꯍꯥꯛꯅꯥ ꯅꯍꯥꯛꯀꯤ ꯊꯥꯖꯕꯥ ꯑꯃꯁꯨꯡ ꯅꯨꯡꯁꯤꯕꯥ ꯑꯗꯨ ꯐꯥꯑꯣꯕꯥ ꯊꯤꯡꯂꯃꯒꯅꯤ, ꯑꯃꯁꯨꯡ ."
neither you nor the other person will know what has come,ꯅꯉ ꯅꯠꯔꯒꯥ ꯑꯇꯣꯞꯄꯥ ꯃꯤꯑꯣꯏ ꯑꯗꯨꯅꯥ ꯂꯥꯀꯈꯤꯕꯥ ꯑꯗꯨ ꯈꯉꯂꯔꯣꯏ
over you,ꯑꯗꯣꯃꯒꯤ ꯃꯊꯛꯇꯥ .
"USABLE INSIGHT,","ꯁꯤꯖꯤꯟꯅꯕꯥ ꯌꯥꯕꯥ ꯋꯥꯈꯜꯂꯣꯟ, ."
There are always strings attached,ꯃꯇꯝ ꯄꯨꯝꯅꯃꯛꯇꯥ ꯁ꯭ꯠꯔꯤꯡꯁꯤꯡ ꯑꯦꯇꯦꯆ ꯇꯧꯏ .
Tnrcnc Acnon,ꯇꯤ.ꯑꯦꯟ.ꯑꯥꯔ.ꯁꯤ.ꯑꯦꯟ.ꯁꯤ.
"of receiving something in return, and don't become","ꯃꯗꯨꯒꯤ ꯃꯍꯨꯠꯇꯥ ꯀꯔꯤꯒꯨꯝꯕꯥ ꯈꯔꯥ ꯐꯪꯕꯒꯤ, ꯑꯃꯁꯨꯡ ."
embittered by this realization,ꯃꯁꯤꯒꯤ ꯔꯤꯑꯦꯂꯥꯏꯖꯦꯁꯟ ꯑꯁꯤꯅꯥ ꯑꯦꯝꯕꯤꯠ ꯇꯧꯕꯥ .
[3e],[꯳ꯏ] ꯑꯃꯁꯨꯡ ꯑꯦꯟ.
GET OUT OFYOUR OITNWAY,ꯅꯍꯥꯛꯀꯤ ꯑꯣꯏꯇꯅꯋꯦꯗꯒꯤ ꯊꯣꯛꯂꯀꯄꯥ ꯌꯥꯏ
loan,ꯄꯨꯍꯟꯕ
perhaps find an occasion to offer a rcciprocal gift or,ꯑꯥꯔ.ꯁꯤ.ꯁꯤ.ꯄꯤ.ꯔꯣꯀꯦꯜ ꯒꯤꯐꯠ ꯅꯠꯠꯔꯒꯥ .
a display of thoughtfrrlness,ꯋꯥꯈꯜꯂꯣꯅꯒꯤ ꯗꯤꯁꯞꯂꯦꯁ ꯑꯃꯥ .
reilrn,ꯔꯦꯏꯂꯔꯟ ꯇꯧꯕꯥ
witlr what you intend to PaY it back,witlr ꯅꯍꯥꯛꯅꯥ ꯃꯁꯤ ꯄꯤꯅꯕꯥ ꯋꯥꯁꯀꯈꯤꯕꯥ ꯑꯗꯨ
t40 l,ꯇꯤ꯴꯰ ꯑꯦꯜ.
Playing It Safe,ꯃꯁꯤ ꯁꯥꯐꯅꯥ ꯁꯥꯟꯅꯕꯥ .
"""One doesn't discmter rcw lands without","""ꯀꯅꯥꯒꯨꯝꯕꯥ ꯑꯃꯅꯥ ꯑꯥꯔ.ꯁꯤ.ꯗꯕ꯭ꯜꯌꯨ."
consenting to lose sight of shore for a very,ꯌꯥꯝꯅꯥ ꯑꯃꯒꯤꯗꯃꯛ ꯁꯣꯔꯗꯥ ꯃꯤꯠꯌꯦꯡ ꯊꯃꯗꯅꯕꯥ ꯑꯌꯥꯕꯥ ꯄꯤꯕꯥ
"long time.""","ꯃꯇꯝ ꯁꯥꯡꯅꯥ꯫"""
_ANDRE GIDE,_ꯑꯟꯗ꯭ꯔꯦ ꯒꯤꯗꯦ .
A man from a tribe in a nonindustrial culnrre was brought,ꯅꯟ-ꯏꯟꯗꯁ꯭ꯠꯔꯤꯌꯦꯜ ꯀꯨꯂꯅꯔ ꯑꯃꯗꯥ ꯂꯩꯕꯥ ꯇ꯭ꯔꯥꯏꯕ ꯑꯃꯗꯒꯤ ꯃꯤꯑꯣꯏ ꯑꯃꯥ ꯄꯨꯔꯀꯈꯤ꯫
"to New York City. Asked his impressions, he noted sor-",ꯅ꯭ꯌꯨ ꯌꯣꯔꯛ ꯁꯤꯇꯤꯗꯥ ꯆꯠꯈꯤ꯫
rowfully that everyone he saw on the street was looking,ꯂꯝꯕꯤꯗꯥ ꯆꯠꯂꯤꯕꯥ ꯃꯤꯑꯣꯏ ꯈꯨꯗꯤꯡꯃꯛꯅꯥ ꯌꯦꯡꯂꯤ ꯍꯥꯌꯕꯥ ꯑꯁꯤ ꯅꯤꯡꯊꯤꯖꯅꯥ .
"down. ""They don't see the skyr"" he said",ꯃꯈꯥꯗ.
That observation captures what we miss out on,ꯑꯗꯨꯒꯨꯝꯕꯥ ꯑꯣꯕꯖꯥꯔꯕꯦꯁꯟ ꯑꯗꯨꯅꯥ ꯑꯩꯈꯣꯌꯅꯥ ꯊꯦꯡꯅꯔꯤꯕꯥ ꯑꯗꯨ .
when we don't take chances. The familiar expression,ꯑꯩꯈꯣꯌꯅꯥ ꯆꯥꯟꯁ ꯂꯧꯗꯕꯥ ꯃꯇꯃꯗꯥ꯫
"""Look where you're going"" makes sense if you are nav-","""ꯌꯦꯡꯎ ꯅꯍꯥꯛꯅꯥ ꯆꯠꯂꯤꯕꯥ ꯃꯐꯝ ꯑꯗꯨ ꯌꯦꯡꯕꯤꯌꯨ"" ꯍꯥꯌꯕꯁꯤ ꯅꯍꯥꯛꯅꯥ ꯅꯕ-"
igating the streets of Manhattan or driving on a freeway,ꯃꯦꯅꯍꯥꯇꯅꯒꯤ ꯂꯝꯕꯤꯁꯤꯡꯗꯥ ꯏꯒꯠ ꯇꯧꯕꯥ ꯅꯠꯠꯔꯒꯥ ꯐ꯭ꯔꯤꯋꯦ ꯑꯃꯗꯥ ꯒꯥꯔꯤ ꯊꯧꯕꯥ
"It tells you to watch out for obstacles-good advice, but","ꯃꯁꯤꯅꯥ ꯑꯗꯣꯃꯗꯥ ꯑꯊꯤꯡꯕꯥ-ꯑꯐꯕꯥ ꯄꯥꯎꯇꯥꯀꯁꯤꯡ ꯌꯦꯡꯁꯤꯟꯅꯕꯥ ꯍꯥꯌꯔꯤ, ꯑꯗꯨꯕꯨ"
deadly if taken as a principle for living your life. It can,ꯀꯔꯤꯒꯨꯝꯕꯥ ꯅꯍꯥꯛꯀꯤ ꯄꯨꯟꯁꯤ ꯍꯤꯡꯅꯕꯒꯤ ꯄ꯭ꯔꯤꯟꯁꯤꯄꯜ ꯑꯃꯥ ꯑꯣꯏꯅꯥ ꯂꯧꯔꯕꯗꯤ ꯁꯤꯕꯥ ꯌꯥꯕꯥ꯫
make you overly cautious. You will slow down and,ꯅꯍꯥꯀꯄꯨ ꯌꯥꯝꯅꯥ ꯆꯦꯀꯁꯤꯅꯍꯅꯒꯗꯕꯅꯤ꯫
"maybe even lose your sense of direction entirely. Yes,",ꯅꯍꯥꯛꯀꯤ ꯃꯥꯏꯀꯩꯒꯤ ꯁꯦꯟꯁ ꯑꯗꯨ ꯃꯄꯨꯡ ꯐꯥꯅꯥ ꯃꯥꯡꯍꯅꯕꯥ ꯐꯥꯑꯣꯕꯥ ꯌꯥꯏ꯫
there are situations in which it is better to be safe than,ꯃꯁꯤꯗꯒꯤ ꯍꯦꯟꯅꯥ ꯁꯥꯐꯕꯥ ꯑꯣꯏꯕꯥ ꯐꯤꯚꯃꯁꯤꯡ ꯂꯩꯔꯤ ꯫
"sorry. But if you always play it safe, it's a safe bet you'll",ꯁꯣꯏꯈ꯭ꯔꯦ.
end up sorry,ꯂꯣꯏꯁꯤꯅꯕꯤꯌꯨ ꯁꯣꯔꯤ
Jonathan was a highly successful software designer,ꯖꯣꯅꯥꯊꯟ ꯑꯁꯤ ꯌꯥꯝꯅꯥ ꯃꯥꯌ ꯄꯥꯀꯄꯥ ꯁꯣꯐ꯭ꯇꯋꯦꯔ ꯗꯤꯖꯥꯏꯅꯔ ꯑꯃꯥ ꯑꯣꯏꯔꯝꯃꯤ
in his late thirties. By all appearances he had an ided life:,ꯃꯍꯥꯛꯀꯤ ꯇꯔꯥꯁꯨꯕꯥ ꯆꯍꯤꯆꯥꯗꯥ꯫
"a big home in Beverly Hills, a wife who was both beautiful","ꯕꯦꯚꯥꯔꯂꯤ ꯍꯤꯂꯁꯇꯥ ꯂꯩꯕꯥ ꯑꯆꯧꯕꯥ ꯌꯨꯝ ꯑꯃꯥ, ꯃꯍꯥꯛ ꯑꯅꯤꯃꯛ ꯐꯖꯔꯕꯥ ꯅꯨꯄꯤ ꯑꯃꯅꯤ"
[41 ],[41] ꯑꯃꯁꯨꯡ ꯑꯦꯟ.
"and successful, two kids who made him proud, presti-","ꯑꯃꯁꯨꯡ ꯃꯥꯌ ꯄꯥꯀꯄꯥ, ꯃꯍꯥꯀꯄꯨ ꯆꯥꯎꯊꯣꯀꯆꯕꯥ ꯄꯣꯀꯍꯅꯈꯤꯕꯥ ꯑꯉꯥꯡ ꯑꯅꯤ, ꯄ꯭ꯔꯦꯁ꯭ꯇꯤ-"
gious awards and a salary so big he was embarrassed,ꯒꯤꯌꯥꯁ ꯑꯦꯋꯥꯔꯗ ꯑꯃꯁꯨꯡ ꯁꯦꯂꯔꯤ ꯑꯃꯥ ꯑꯁꯨꯛ ꯆꯥꯎꯕꯥ ꯃꯍꯥꯛꯅꯥ ꯏꯀꯥꯏꯕꯥ ꯄꯣꯀꯈꯤ
when it was reported in the papers. But Jonathan was,ꯄꯦꯄꯔꯁꯤꯡꯗꯥ ꯔꯤꯄꯣꯔꯠ ꯇꯧꯔꯀꯄꯥ ꯃꯇꯃꯗꯥ꯫
unhappy. Fourteen years earlier he had made a splash in,ꯅꯨꯡꯉꯥꯏꯇꯕꯥ ꯐꯣꯡꯗꯣꯀꯄꯥ꯫
Silicon Valley as a bold young innovator with daring,ꯁꯤꯂꯤꯀꯣꯟ ꯚꯦꯂꯤ ꯑꯁꯤ ꯊꯧꯅꯥ ꯂꯩꯕꯥ ꯊꯧꯅꯥ ꯂꯩꯕꯥ ꯅꯍꯥ ꯑꯣꯏꯔꯤꯕꯥ ꯏꯅꯣꯕꯦꯇꯔ ꯑꯃꯥ ꯑꯣꯏꯅꯥ .
ideas. \7hen the early products he created became a huge,ꯋꯥꯈꯜꯂꯣꯅꯁꯤꯡ꯫
"success, he signed a long-term deal with a maior com-","ꯃꯥꯌ ꯄꯥꯀꯄꯥ, ꯃꯍꯥꯛꯅꯥ ꯃꯥꯏꯌꯔ ꯀꯝ-ꯒꯥ ꯂꯣꯌꯅꯅꯥ ꯃꯇꯝ ꯁꯥꯡꯅꯥ ꯌꯥꯅꯈꯤꯕꯥ ꯌꯥꯅꯈꯤꯕꯥ ꯑꯃꯥ ꯈꯨꯠꯌꯦꯛ ꯄꯤꯅꯈꯤ꯫"
"pany. Settled, secure and celebrated, he went on to man-",ꯄꯥꯅꯤ꯫
age a division *tat produced excellent products-but sale,ꯆꯍꯤ ꯑꯦ ꯗꯤꯕꯤꯖꯟ *ꯇꯥꯠ ꯄꯨꯊꯣꯀꯈꯤꯕꯥ ꯑꯐꯕꯥ ꯄꯣꯠꯊꯣꯀꯁꯤꯡ-ꯑꯗꯨꯕꯨ ꯌꯣꯅꯕꯥ
products. He had learned how to give consumers and,ꯄꯣꯠꯊꯣꯀꯁꯤꯡ꯫
"stockholders what they wanted, but he was no longer bold","ꯁ꯭ꯇꯣꯀꯍꯣꯜꯗꯔꯁꯤꯡꯅꯥ ꯃꯈꯣꯌꯅꯥ ꯄꯥꯝꯂꯤꯕꯗꯨ, ꯑꯗꯨꯕꯨ ꯃꯍꯥꯛ ꯍꯧꯖꯤꯛ ꯕꯣꯜꯗ ꯑꯣꯏꯔꯦ"
"and brash, and it bothered him. ""I've lost my creative","ꯑꯃꯁꯨꯡ ꯕ꯭ꯔꯥꯁ, ꯑꯃꯁꯨꯡ ꯃꯁꯤꯅꯥ ꯃꯍꯥꯀꯄꯨ ꯋꯥꯍꯜꯂꯀꯈꯤ꯫"
"edger"" he lamented. ""I was a visionary' Now I'm a num-","ꯑꯦꯗꯖꯔ"" ꯃꯍꯥꯛꯅꯥ ꯋꯥ ꯉꯥꯡꯈꯤ꯫ ""ꯑꯩꯍꯥꯛ ꯚꯤꯖꯅꯔꯤ ꯑꯃꯥ ꯑꯣꯏꯔꯝꯃꯤ' ꯍꯧꯖꯤꯛ ꯑꯩꯍꯥꯛ ꯅꯝ-"
"bers guy.""","ꯕꯦꯔꯁ ꯒꯥꯏ꯫"""
"""LVhithq is fud tlw visiorcry glcam?","""lvhithq ꯑꯁꯤ ꯐꯗ ꯇꯤ.ꯑꯦꯜ.ꯗꯕ꯭ꯜꯌꯨ.ꯚꯤꯁꯤꯑꯣꯔꯛꯔꯤ ꯖꯤ.ꯑꯦꯜ.ꯁꯤ.ꯑꯦ.ꯑꯦꯝ."
"V(here * it ruw, the glory and the dteam?""","v(ꯃꯐꯃꯁꯤꯗꯥ * ꯃꯁꯤ ꯔꯨꯜ, ꯃꯁꯛ ꯑꯃꯁꯨꯡ ꯗ꯭ꯇꯤꯝ?"""
_WILLUM'VORDSWORTH,_ꯋꯤꯂꯝ’ꯚꯣꯔꯗꯁꯋꯔꯗ .
Jonathan had become good at looking where he was,ꯖꯣꯅꯥꯂꯤꯅꯥ ꯃꯍꯥꯛꯀꯤ ꯃꯐꯝ ꯑꯗꯨ ꯌꯦꯡꯕꯗꯥ ꯍꯩꯕꯥ ꯑꯣꯏꯔꯝꯂꯒꯅꯤ .
"going, but he wanted once again to go where he was look-","ꯆꯠꯄꯥ, ꯑꯗꯨꯕꯨ ꯃꯍꯥꯛꯅꯥ ꯑꯃꯨꯛ ꯍꯟꯅꯥ ꯃꯍꯥꯛꯅꯥ ꯌꯦꯡꯂꯤꯕꯥ ꯃꯐꯝ ꯑꯗꯨꯗꯥ ꯆꯠꯄꯥ ꯄꯥꯃꯈꯤ-"
ing,ing ꯇꯧꯕꯥ ꯌꯥꯏ꯫
To look where you are going is to be motivated by,ꯅꯍꯥꯛꯅꯥ ꯆꯠꯂꯤꯕꯥ ꯃꯐꯝ ꯑꯗꯨ ꯌꯦꯡꯅꯕꯒꯤꯗꯃꯛ 2019 ꯒꯤ ꯃꯇꯦꯡꯅꯥ ꯃꯣꯇꯤꯚꯦꯠ ꯇꯧꯒꯗꯕꯅꯤ꯫
"fear; to go where you are looking is to be driven by desire,",ꯑꯀꯤꯕ;
confidence and vision. If you know you can handle what-,ꯊꯥꯖꯕꯥ ꯑꯃꯁꯨꯡ ꯃꯤꯠꯌꯦꯡ ꯊꯝꯕꯥ꯫
"ever cracks and bumps come along, you do not have to","ꯑꯦꯚꯥꯔ ꯀ꯭ꯔꯦꯛ ꯑꯃꯁꯨꯡ ꯕꯝꯄꯁ ꯂꯥꯀꯏ, ꯅꯍꯥꯛꯅꯥ ꯃꯊꯧ ꯇꯥꯗꯦ"
"watch the pavement all the time. Instead, you can move",ꯃꯇꯝ ꯄꯨꯝꯅꯃꯛꯇꯥ ꯄꯦꯚꯃꯦꯟꯇ ꯑꯗꯨ ꯌꯦꯡꯎ꯫
full speed ahead with your eye on your goal,ꯑꯗꯣꯃꯒꯤ ꯄꯥꯟꯗꯝ ꯑꯗꯨꯗꯥ ꯑꯗꯣꯃꯒꯤ ꯃꯤꯠꯌꯦꯡꯒꯥ ꯂꯣꯌꯅꯅꯥ ꯃꯄꯨꯡ ꯐꯥꯅꯥ ꯈꯣꯡꯖꯦꯜ ꯌꯥꯡꯅꯥ ꯃꯥꯡꯂꯣꯃꯗꯥ ꯆꯪꯁꯤꯅꯕꯥ
The inclination either to play it safe or take risks can,ꯏꯅꯛꯂꯤꯅꯦꯁꯟ ꯑꯁꯤ ꯅꯠꯠꯔꯒꯥ ꯃꯁꯤꯕꯨ ꯁꯥꯐꯅꯥ ꯁꯥꯟꯅꯕꯥ ꯅꯠꯠꯔꯒꯥ ꯔꯤꯁ꯭ꯛ ꯂꯧꯕꯥ ꯌꯥꯏ .
usually be traced to childhood. All children are adven-,ꯃꯍꯧꯁꯥꯅꯥ ꯑꯉꯥꯡ ꯑꯣꯏꯔꯤꯉꯩꯗꯥ ꯇ꯭ꯔꯦꯁ ꯇꯧꯕꯥ ꯌꯥꯏ꯫
"turous and curious. If, when they get hurt or things go",ꯇꯨꯔꯨꯁ ꯑꯃꯁꯨꯡ ꯀ꯭ꯌꯨꯔꯤꯌꯁ ꯑꯣꯏꯕꯥ꯫
"wrong, their parents respond angrily, as in, ""Don't let me","ꯑꯔꯥꯅꯕꯥ, ꯃꯈꯣꯌꯒꯤ ꯃꯃꯥ-ꯃꯄꯥꯅꯥ ꯑꯔꯥꯅꯕꯥ ꯄꯥꯎꯈꯨꯝ ꯄꯤꯔꯀꯏ, as in, ""ꯑꯩꯕꯨ ꯌꯥꯑꯣꯍꯅꯕꯤꯌꯨ"
PLAYING IT SAFE,ꯃꯁꯤ ꯁꯥꯐꯅꯥ ꯁꯥꯟꯅꯕꯥ .
"see you do ttrat againr"" or fearfully, as in, ""Don't do that","See you do ttrat aganer"" ꯅꯠꯔꯒꯥ ꯑꯀꯤꯕꯥ ꯄꯣꯀꯍꯟꯗꯨꯅꯥ, as in, ""ꯗꯟ ꯗꯣ’ꯇ ꯗꯣ’"
"or you'll get hurtr"" they are likely, as adults, to play it","ꯅꯠꯔꯒꯥ ꯅꯍꯥꯛꯅꯥ ꯁꯣꯀꯄꯥ ꯌꯥꯏ"" ꯃꯈꯣꯌꯅꯥ, ꯑꯍꯜ ꯑꯣꯏꯔꯕꯥ ꯑꯣꯏꯅꯥ, ꯃꯁꯤ ꯁꯥꯟꯅꯕꯒꯤ ꯑꯣꯏꯊꯣꯀꯄꯥ ꯂꯩꯕꯅꯤ"
