en,mni-Mtei
Everyone has their own eccentricities or awkward behaviours. But if your patterns of,ꯃꯤ ꯈꯨꯗꯤꯡꯃꯛꯀꯤ ꯃꯁꯥꯒꯤ ꯑꯣꯏꯕꯥ ꯑꯦꯛꯁꯦꯟꯠꯔꯤꯁꯤꯇꯤ ꯅꯠꯠꯔꯒꯥ ꯑꯁꯣꯅꯕꯥ ꯂꯃꯆꯠ-ꯁꯥꯖꯠ ꯂꯩ꯫
"thinking and behaving make relating to others very difficult, you may receive a diagnosis","ꯋꯥꯈꯜ ꯈꯅꯕꯥ ꯑꯃꯁꯨꯡ ꯂꯃꯆꯠ-ꯁꯥꯖꯠ ꯆꯠꯄꯥ ꯑꯁꯤ ꯑꯇꯣꯞꯄꯁꯤꯡꯒꯥ ꯃꯔꯤ ꯂꯩꯅꯕꯥ ꯌꯥꯝꯅꯥ ꯑꯔꯨꯕꯥ ꯑꯣꯏ, ꯅꯍꯥꯛꯅꯥ ꯗꯥꯏꯒ꯭ꯅꯣꯁꯤꯁ ꯑꯃꯥ ꯐꯪꯂꯕꯥ ꯌꯥꯏ"
of schizotypal personality disorder,ꯑꯣꯐ ꯁ꯭ꯀꯤꯖꯣꯇꯥꯏꯄꯥꯜ ꯄꯔꯁꯣꯅꯦꯂꯤꯇꯤ ꯗꯤꯁꯑꯣꯔꯗꯔ
"Unlike in schizophrenia, you usually would not experience psychosis. However, you may:","ꯁ꯭ꯀꯤꯖꯣꯐ꯭ꯔꯦꯅꯤꯌꯥꯒꯥ ꯃꯥꯟꯅꯗꯕꯥ ꯃꯑꯣꯡꯗꯥ, ꯅꯍꯥꯛꯅꯥ ꯃꯍꯧꯁꯥꯅꯥ ꯁꯥꯏꯀꯣꯁꯤꯁ (sychosis) ꯊꯦꯡꯅꯔꯣꯏ꯫"
experience distorted thoughts or perceptions,ꯗꯤꯁ꯭ꯇꯣꯔꯇꯦꯗ ꯊꯤꯡꯁ ꯅꯠꯠꯔꯒꯥ ꯄꯔꯁꯦꯄꯁꯅꯁꯤꯡ ꯑꯦꯛꯁꯄꯤꯔꯤꯑꯦꯟꯁ ꯇꯧꯕꯥ
find making close relationships extremely difficult,ꯅꯛꯅꯕꯥ ꯃꯔꯤꯁꯤꯡ ꯁꯦꯝꯕꯥ ꯌꯥꯝꯅꯥ ꯂꯨꯕꯥ .
"think and express yourself in ways that others find 'odd', using unusual words or","ꯑꯇꯣꯞꯄꯕꯨ ‘ꯑꯆꯧꯕꯥ’ ꯑꯣꯏꯅꯥ ꯎꯕꯥ ꯃꯑꯣꯡꯗꯥ, ꯑꯆꯝꯕꯥ ꯋꯥꯍꯩꯁꯤꯡ ꯁꯤꯖꯤꯟꯅꯗꯨꯅꯥ ꯅꯠꯠꯔꯒꯥ ꯈꯟꯊꯕꯥ ꯉꯝꯕꯥ ꯃꯑꯣꯡꯗꯥ ꯅꯍꯥꯛꯀꯤ ꯅꯁꯥꯕꯨ ꯈꯅꯕꯤꯌꯨ꯫"
"phrases, making relating to others difficult","ꯋꯥꯍꯩ ꯄꯔꯦꯡꯁꯤꯡ, ꯑꯇꯣꯞꯄꯁꯤꯡꯒꯥ ꯃꯔꯤ ꯂꯩꯅꯕꯥ ꯑꯁꯤ ꯑꯔꯨꯕꯥ ꯑꯣꯏꯍꯅꯕꯥ"
believe that you can read minds or that you have special powers such as a ‘sixth,ꯑꯗꯣꯝꯅꯥ ꯋꯥꯈꯜ ꯄꯥꯕꯥ ꯉꯃꯒꯅꯤ ꯅꯠꯔꯒꯥ ꯑꯗꯣꯃꯒꯤ ꯑꯈꯟꯅꯕꯥ ꯁꯛꯇꯤꯁꯤꯡ ꯍꯥꯌꯕꯗꯤ ‘꯶ꯁꯨꯕꯥ .
sense’,ꯐꯥꯎꯕ'
feel anxious and tense with others who do not share these beliefs,ꯊꯥꯖꯕꯁꯤꯡ ꯑꯁꯤ ꯁꯦꯌꯔ ꯇꯧꯗꯕꯥ ꯑꯇꯣꯞꯄꯁꯤꯡꯒꯥ ꯂꯣꯌꯅꯅꯥ ꯋꯥꯈꯜ ꯋꯥꯕꯥ ꯑꯃꯁꯨꯡ ꯋꯥꯈꯜ ꯅꯨꯡꯉꯥꯏꯇꯕꯥ ꯐꯥꯑꯣꯕꯤꯌꯨ
"feel very anxious and paranoid in social situations, finding it hard to relate to","ꯈꯨꯟꯅꯥꯏꯒꯤ ꯑꯣꯏꯕꯥ ꯐꯤꯚꯃꯁꯤꯡꯗꯥ ꯌꯥꯝꯅꯥ ꯋꯥꯅꯥ ꯑꯃꯁꯨꯡ ꯄꯦꯔꯥꯅꯣꯏꯗ ꯑꯣꯏꯅꯥ ꯐꯥꯎꯏ, ꯃꯗꯨꯒꯥ ꯃꯔꯤ ꯂꯩꯅꯕꯥ ꯌꯥꯝꯅꯥ ꯂꯨꯅꯥ ꯈꯪꯕꯥ ꯐꯥꯎꯕꯥ꯫"
others,ꯑꯇꯣꯞꯄꯁꯤꯡꯅꯥ ꯑꯦꯝ.ꯑꯦꯁ.ꯑꯦꯝ.ꯏ.
See our pages on schizophrenia or schizoaffective disorder for more information on the,ꯁ꯭ꯀꯤꯖꯣꯐ꯭ꯔꯦꯅꯤꯌꯥ ꯅꯠꯠꯔꯒꯥ ꯁ꯭ꯀꯤꯖꯣꯑꯦꯐꯦꯛꯇꯤꯚ ꯗꯤꯁꯑꯣꯔꯗꯔꯒꯤ ꯃꯇꯥꯡꯗꯥ ꯑꯩꯈꯣꯌꯒꯤ ꯄꯦꯖꯁꯤꯡ ꯑꯁꯤ ꯍꯦꯟꯅꯥ ꯐꯕꯥ ꯏꯅꯐꯣꯔꯃꯦꯁꯅꯒꯤꯗꯃꯛꯇꯥ ꯌꯦꯡꯕꯤꯌꯨ꯫
feelings and symptoms associated with schizoid and schizotypal personality disorders,ꯁ꯭ꯀꯤꯖꯣꯏꯗ ꯑꯃꯁꯨꯡ ꯁ꯭ꯀꯤꯖꯣꯇꯥꯏꯄꯜ ꯄꯔꯁꯣꯅꯦꯂꯤꯇꯤ ꯗꯤꯁꯑꯣꯔꯗꯔꯁꯤꯡꯒꯥ ꯃꯔꯤ ꯂꯩꯅꯕꯥ ꯐꯤꯚꯝ ꯑꯃꯁꯨꯡ ꯂꯥꯏꯑꯣꯡꯁꯤꯡ
"""I always feel rather 'thrown' when someone doesn't do what I expect them to do","""ꯑꯩꯍꯥꯛꯅꯥ ꯃꯇꯝ ꯄꯨꯝꯅꯃꯛꯇꯥ ꯃꯗꯨꯒꯤ ꯃꯍꯨꯠꯇꯥ 'ꯊ꯭ꯔꯣꯟ' ꯑꯣꯏꯅꯥ ꯐꯥꯑꯣꯏ ꯃꯗꯨꯗꯤ ꯀꯅꯥꯒꯨꯝꯕꯥ ꯑꯃꯅꯥ ꯑꯩꯍꯥꯛꯅꯥ ꯃꯈꯣꯌꯅꯥ ꯇꯧꯒꯅꯤ ꯍꯥꯌꯅꯥ ꯊꯥꯖꯕꯥ ꯑꯗꯨ ꯇꯧꯗꯕꯥ ꯃꯇꯃꯗꯥ ."
Knowing there are lots of ways in which the problem could be approached would have,ꯄ꯭ꯔꯣꯕ꯭ꯂꯦꯝ ꯑꯁꯤ ꯂꯥꯀꯄꯥ ꯌꯥꯕꯒꯤ ꯃꯑꯣꯡ ꯀꯌꯥ ꯑꯃꯥ ꯂꯩꯔꯤ ꯍꯥꯌꯕꯥ ꯈꯉꯕꯅꯥ .
"made me feel a lot more prepared for what came next.""",ꯃꯊꯪꯗꯥ ꯂꯥꯀꯈꯤꯕꯥ ꯑꯗꯨꯒꯤꯗꯃꯛ ꯑꯩꯉꯣꯟꯗꯥ ꯌꯥꯝꯅꯥ ꯍꯦꯟꯅꯥ ꯁꯦꯝ ꯁꯥꯗꯨꯅꯥ ꯂꯩꯍꯅꯈꯤ꯫”
Antisocial personality disorder (ASPD),ꯑꯦꯟꯇꯤꯁꯣꯁꯤꯑꯦꯜ ꯄꯔꯁꯣꯅꯦꯂꯤꯇꯤ ꯗꯤꯁꯑꯣꯔꯗꯔ (ꯑꯦ.ꯑꯦꯁ.ꯄꯤ.ꯗꯤ.)
"It is natural to sometimes put our own needs, pleasure or personal gain before those of","ꯀꯔꯤꯒꯨꯝꯕꯥ ꯃꯇꯃꯗꯥ ꯑꯩꯈꯣꯌꯒꯤ ꯏꯁꯥꯒꯤ ꯗꯔꯀꯥꯔ ꯑꯣꯏꯕꯁꯤꯡ, ꯅꯨꯡꯉꯥꯏꯕꯥ ꯅꯠꯔꯒꯥ ꯂꯅꯥꯏꯒꯤ ꯑꯣꯏꯕꯥ ꯀꯥꯟꯅꯕꯥ ꯑꯗꯨ ꯃꯃꯥꯡꯗꯥ ꯊꯝꯕꯥ ꯑꯁꯤ ꯃꯍꯧꯁꯥꯅꯤ ꯫"
"others around us. However, if these actions occur very frequently and you struggle to",ꯑꯩꯈꯣꯌꯒꯤ ꯑꯀꯣꯌꯕꯗꯥ ꯂꯩꯔꯤꯕꯥ ꯑꯇꯣꯞꯄꯁꯤꯡ꯫
© Mind 2020,© ꯃꯥꯏꯟꯗ ꯲꯰꯲꯰ .
5,꯵ ꯑꯃꯁꯨꯡ ꯵.
"keep stability in your life, or you regularly act impulsively out of anger or lack of","ꯅꯍꯥꯛꯀꯤ ꯄꯨꯟꯁꯤꯗꯥ ꯇꯪꯗꯨ ꯂꯩꯇꯥꯕꯥ ꯊꯝꯃꯨ, ꯅꯠꯠꯔꯒꯥ ꯅꯍꯥꯛꯅꯥ ꯆꯥꯡ ꯅꯥꯏꯅꯥ ꯏꯝꯄꯂꯁꯤꯕꯜ ꯑꯣꯏꯅꯥ ꯑꯁꯥꯑꯣꯕꯥ ꯅꯠꯠꯔꯒꯥ ꯑꯋꯥꯠꯄꯥ ꯂꯩꯍꯟꯗꯅꯕꯥ ꯊꯕꯛ ꯇꯧꯏ꯫"
"consideration for others, this could lead to a diagnosis of antisocial personality disorder","ꯑꯇꯣꯞꯄꯁꯤꯡꯒꯤꯗꯃꯛꯇꯥ ꯈꯟꯅ-ꯅꯩꯅꯕꯥ, ꯃꯁꯤꯅꯥ ꯑꯦꯟꯇꯤꯁꯣꯁꯤꯑꯦꯜ ꯄꯔꯁꯣꯅꯦꯂꯤꯇꯤ ꯗꯤꯁꯑꯣꯔꯗꯔꯒꯤ ꯗꯥꯏꯑꯦꯒ꯭ꯅꯣꯁꯤꯁ ꯑꯃꯥ ꯊꯣꯀꯍꯅꯕꯥ ꯌꯥꯏ"
You may:,ꯅꯍꯥꯛꯅꯥ ꯇꯧꯕꯥ ꯌꯥꯏ:
"put yourself in dangerous or risky situations, often without thinking about the",ꯈꯨꯗꯣꯡꯊꯤꯅꯤꯉꯥꯏ ꯑꯣꯏꯕꯥ ꯅꯠꯠꯔꯒꯥ ꯈꯨꯗꯣꯡꯊꯤꯅꯤꯉꯥꯏ ꯑꯣꯏꯕꯥ ꯐꯤꯚꯃꯁꯤꯡꯗꯥ ꯅꯍꯥꯛꯅꯥ ꯃꯁꯥꯃꯀꯄꯨ ꯈꯟꯊꯗꯅꯥ ꯊꯃꯒꯗꯕꯅꯤ꯫
consequences for yourself or other people,ꯅꯍꯥꯛꯀꯤ ꯅꯠꯠꯔꯒꯥ ꯑꯇꯣꯞꯄꯥ ꯃꯤꯑꯣꯏꯁꯤꯡꯒꯤꯗꯃꯛ ꯐꯂꯁꯤꯡ
behave dangerously and sometimes illegally (you may have a criminal record),ꯈꯨꯗꯣꯡꯊꯤꯅꯤꯉꯥꯏ ꯑꯣꯏꯕꯥ ꯃꯑꯣꯡꯗꯥ ꯂꯃꯆꯠ-ꯁꯥꯖꯠ ꯆꯠꯄꯥ ꯑꯃꯁꯨꯡ ꯀꯔꯤꯒꯨꯝꯕꯥ ꯃꯇꯃꯗꯥ ꯑꯥꯏꯟꯅꯥ ꯌꯥꯗꯕꯥ ꯃꯑꯣꯡꯗꯥ (ꯅꯍꯥꯛꯅꯥ ꯀ꯭ꯔꯤꯃꯤꯅꯦꯜ ꯔꯦꯀꯣꯔꯗ ꯑꯃꯥ ꯂꯩꯕꯥ ꯌꯥꯏ)
behave in ways that are unpleasant for others,ꯑꯇꯣꯞꯄꯁꯤꯡꯒꯤꯗꯃꯛꯇꯥ ꯅꯨꯡꯉꯥꯏꯇꯕꯥ ꯃꯑꯣꯡꯗꯥ ꯂꯃꯆꯠ ꯁꯥꯖꯠ ꯆꯠꯄꯥ
"feel very easily bored and act on impulse – for example, you may find it difficult to","ꯌꯥꯝꯅꯥ ꯐꯖꯅꯥ ꯕꯣꯔ ꯇꯧꯕꯥ ꯑꯃꯁꯨꯡ ꯏꯝꯄꯂꯁꯇꯥ ꯊꯕꯛ ꯇꯧꯕꯥ – ꯈꯨꯗꯝ ꯑꯣꯏꯅꯥ, ꯅꯍꯥꯛꯅꯥ ꯃꯁꯤ ꯌꯥꯝꯅꯥ ꯂꯨꯕꯥ ꯑꯣꯏꯅꯥ ꯎꯕꯥ ꯌꯥꯏ"
hold down a job for long,ꯃꯇꯝ ꯁꯥꯡꯅꯥ ꯊꯕꯛ ꯑꯃꯥ ꯊꯝꯃꯨ .
behave aggressively and get into fights easily,ꯑꯦꯒ꯭ꯔꯦꯁꯤꯚ ꯑꯣꯏꯅꯥ ꯂꯃꯆꯠ-ꯁꯥꯖꯠ ꯆꯠꯄꯥ ꯑꯃꯁꯨꯡ ꯐꯖꯅꯥ ꯂꯥꯟ ꯁꯣꯛꯅꯔꯀꯄꯥ
"do things even though they may hurt people – to get what you want, putting your","ꯃꯈꯣꯌꯅꯥ ꯃꯤꯑꯣꯏꯕꯗꯥ ꯑꯋꯥꯕꯥ ꯄꯤꯔꯕꯁꯨ ꯊꯕꯀꯁꯤꯡ ꯇꯧꯕꯤꯌꯨ – ꯅꯍꯥꯛꯅꯥ ꯄꯥꯝꯂꯤꯕꯗꯨ ꯐꯪꯅꯕꯥ, ꯅꯍꯥꯛꯀꯤ ."
needs and desires above other people's,ꯑꯇꯣꯞꯄꯥ ꯃꯤꯑꯣꯏꯁꯤꯡꯒꯤ ꯃꯊꯛꯇꯥ ꯗꯔꯀꯥꯔ ꯑꯣꯏꯕꯁꯤꯡ ꯑꯃꯁꯨꯡ ꯑꯄꯥꯝꯕꯁꯤꯡ
"have problems with empathy – for example, you may not feel or show any sense","ꯏꯝꯄꯥꯇꯤꯒꯤ ꯃꯇꯥꯡꯗꯥ ꯁꯃꯁ꯭ꯌꯥ ꯂꯩꯕꯥ – ꯈꯨꯗꯝ ꯑꯣꯏꯅꯥ, ꯅꯍꯥꯛꯅꯥ ꯋꯥꯈꯜ ꯅꯨꯡꯉꯥꯏꯇꯕꯥ ꯑꯃꯠꯇꯥ ꯎꯕꯥ ꯅꯠꯠꯔꯒꯥ ꯎꯠꯄꯥ ꯉꯃꯗꯕꯥ ꯌꯥꯏ"
of guilt if you have mistreated others,ꯀꯔꯤꯒꯨꯝꯕꯥ ꯅꯍꯥꯛꯅꯥ ꯑꯇꯣꯞꯄꯁꯤꯡꯕꯨ ꯂꯥꯟꯅꯥ ꯂꯃꯖꯤꯡꯈꯤꯕꯥ ꯑꯣꯏꯔꯕꯗꯤ ꯒꯨꯂꯠ
have had a diagnosis of conduct disorder before the age of 15,ꯆꯍꯤ 15ꯒꯤ ꯃꯃꯥꯡꯗꯥ ꯀꯟꯗꯥꯛꯇ ꯗꯤꯁꯑꯣꯔꯗꯔꯒꯤ ꯗꯥꯏꯑꯦꯒ꯭ꯅꯣꯁꯤꯁ ꯑꯃꯥ ꯂꯩꯔꯦ꯫
This diagnosis includes ‘psychopathy’ and 'sociopathy'. These terms are no longer used in,ꯃꯁꯤꯒꯤ ꯗꯥꯏꯒ꯭ꯅꯣꯁꯤꯁ ꯑꯁꯤꯗꯥ ‘ꯁꯥꯏꯀꯣꯄꯦꯊꯤ’ ꯑꯃꯁꯨꯡ ‘ꯁꯣꯁꯤꯑꯣꯄꯦꯊꯤ’ ꯌꯥꯑꯣꯔꯤ꯫
the Mental Health Act but a ‘psychopathy checklist’ questionnaire may be used in your,ꯃꯦꯟꯇꯦꯜ ꯍꯦꯜꯊ ꯑꯦꯛꯇ ꯑꯗꯨꯕꯨ ‘ꯁꯥꯏꯀꯣꯄꯦꯊꯤ ꯆꯦꯀꯂꯤꯁ꯭ꯠ’ ꯀ꯭ꯕꯦꯁꯅꯔ ꯑꯃꯥ ꯅꯍꯥꯛꯀꯤ .
assessment,ꯌꯦꯡꯁꯤꯟꯕ
"""As a child anger seemed to be my only way to express how I felt.""","""ꯑꯉꯥꯡ ꯑꯣꯏꯔꯤꯉꯩꯗꯥ ꯑꯁꯥꯑꯣꯕꯥ ꯑꯁꯤ ꯑꯩꯒꯤ ꯄꯨꯛꯅꯤꯡꯗꯥ ꯀꯔꯤ ꯐꯥꯑꯣꯈꯤꯕꯒꯦ ꯍꯥꯌꯕꯗꯨ ꯐꯣꯡꯗꯣꯀꯄꯒꯤ ꯑꯩꯒꯤ ꯑꯃꯠꯇꯥ ꯉꯥꯏꯔꯕꯥ ꯄꯥꯝꯕꯩ ꯑꯣꯏꯅꯥ ꯎꯈꯤ꯫"""
Borderline personality disorder (BPD),ꯕꯣꯔꯗꯔꯂꯥꯏꯟ ꯄꯔꯁꯣꯅꯦꯂꯤꯇꯤ ꯗꯤꯁꯑꯣꯔꯗꯔ (ꯕꯤ.ꯄꯤ.ꯗꯤ.)
Borderline personality disorder (BPD) is also known as emotionally unstable personality,ꯕꯣꯔꯗꯔꯂꯥꯏꯟ ꯄꯔꯁꯣꯅꯦꯂꯤꯇꯤ ꯗꯤꯁꯑꯣꯔꯗꯔ (BPD) ꯑꯁꯤ ꯏꯃꯣꯁꯅꯦꯜ ꯑꯣꯏꯅꯥ ꯑꯅꯁ꯭ꯇꯦꯕꯜ ꯑꯣꯏꯕꯥ ꯄꯔꯁꯣꯅꯦꯂꯤꯇꯤ ꯍꯥꯌꯅꯥꯁꯨ ꯈꯪꯅꯩ꯫
disorder (EUPD),ꯗꯤꯁꯑꯣꯔꯗꯔ (ꯏ.ꯌꯨ.ꯄꯤ.ꯗꯤ.) ꯑꯁꯤ ꯌꯥꯑꯣꯔꯤ꯫
"We can all experience difficulties with our relationships, self-image and emotions. But you","ꯑꯩꯈꯣꯌ ꯄꯨꯝꯅꯃꯛꯅꯥ ꯑꯩꯈꯣꯌꯒꯤ ꯃꯔꯤ, ꯁꯦꯜꯐ-ꯏꯃꯦꯖ ꯑꯃꯁꯨꯡ ꯏꯃꯣꯁꯅꯁꯤꯡꯗꯥ ꯑꯋꯥꯕꯥ ꯊꯦꯡꯅꯕꯥ ꯌꯥꯏ꯫"
might get a diagnosis of BPD/EUPD if these feel consistently unstable or intense and,ꯀꯔꯤꯒꯨꯝꯕꯥ ꯍꯥꯌꯔꯤꯕꯁꯤꯡ ꯑꯁꯤ ꯂꯦꯞꯇꯅꯥ ꯑꯅꯁ꯭ꯇꯦꯕꯜ ꯅꯠꯠꯔꯒꯥ ꯏꯟꯇꯦꯟꯁꯤꯚ ꯑꯣꯏꯔꯕꯗꯤ ꯑꯃꯁꯨꯡ 1.0.
cause you significant problems in daily life,ꯅꯨꯡꯇꯤꯒꯤ ꯄꯨꯟꯁꯤꯗꯥ ꯃꯔꯨꯑꯣꯏꯕꯥ ꯁꯃꯁ꯭ꯌꯥꯁꯤꯡ ꯊꯣꯀꯍꯜꯂꯤ
You may:,ꯅꯍꯥꯛꯅꯥ ꯇꯧꯕꯥ ꯌꯥꯏ:
"feel very worried about people abandoning you, and either do anything to stop","ꯃꯤꯌꯥꯝꯅꯥ ꯅꯍꯥꯀꯄꯨ ꯊꯥꯗꯣꯀꯄꯥ ꯃꯇꯃꯗꯥ ꯌꯥꯝꯅꯥ ꯋꯥꯅꯥ ꯐꯥꯑꯣꯏ, ꯑꯃꯁꯨꯡ ꯅꯠꯠꯔꯒꯥ ꯊꯤꯡꯅꯕꯥ ꯀꯔꯤꯒꯨꯝꯕꯥ ꯈꯔꯥ ꯇꯧꯕꯥ"
that happening or push them away,ꯃꯗꯨ ꯊꯣꯀꯄꯥ ꯅꯠꯔꯒꯥ ꯃꯈꯣꯌꯕꯨ ꯂꯥꯟꯊꯣꯀꯄꯥ .
"have very intense emotions that can change quickly (for example, from feeling","ꯌꯥꯝꯅꯥ ꯊꯨꯅꯥ ꯍꯣꯡꯂꯀꯄꯥ ꯌꯥꯕꯥ ꯌꯥꯝꯅꯥ ꯁꯥꯊꯤꯕꯥ ꯏꯃꯣꯁꯅꯁꯤꯡ ꯂꯩꯕꯥ (ꯈꯨꯗꯝ ꯑꯣꯏꯅꯥ, ꯐꯤꯜꯂꯤꯡꯗꯒꯤ"
very happy and confident in the morning to feeling low and sad in the afternoon),ꯌꯥꯝꯅꯥ ꯅꯨꯡꯉꯥꯏꯕꯥ ꯑꯃꯁꯨꯡ ꯑꯌꯨꯛꯇꯥ ꯅꯨꯃꯤꯗꯥꯡꯋꯥꯏꯔꯃꯗꯥ ꯋꯥꯈꯜ ꯋꯥꯕꯥ ꯑꯃꯁꯨꯡ ꯅꯨꯡꯉꯥꯏꯇꯕꯥ ꯐꯥꯑꯣꯕꯒꯤ ꯊꯥꯖꯕꯥ ꯂꯩꯕꯥ)
"not have a strong sense of who you are or what you want from life, with your","ꯅꯍꯥꯛ ꯀꯅꯥꯅꯣ ꯅꯠꯔꯒꯥ ꯅꯍꯥꯛꯅꯥ ꯄꯨꯟꯁꯤꯗꯒꯤ ꯀꯔꯤ ꯄꯥꯝꯂꯤꯕꯒꯦ ꯍꯥꯌꯕꯒꯤ ꯑꯀꯅꯕꯥ ꯋꯥꯈꯜꯂꯣꯟ ꯑꯃꯥ ꯂꯩꯔꯣꯏꯗꯕꯅꯤ, ꯅꯍꯥꯛꯀꯤ"
ideas about this changing significantly depending on who you're with,ꯃꯁꯤꯒꯤ ꯃꯇꯥꯡꯗꯥ ꯋꯥꯈꯜꯂꯣꯅꯁꯤꯡ ꯑꯁꯤ ꯑꯗꯣꯝꯅꯥ ꯀꯅꯥꯒꯥ ꯂꯣꯌꯅꯅꯥ ꯂꯩꯔꯤꯕꯒꯦ ꯍꯥꯌꯕꯒꯤ ꯃꯇꯨꯡ ꯏꯟꯅꯥ ꯃꯁꯛ ꯊꯣꯛꯅꯥ ꯍꯣꯡꯂꯛꯂꯤ꯫
find it very hard to make and keep stable relationships or friendships,ꯇꯪꯗꯨ ꯂꯩꯇꯥꯕꯥ ꯃꯔꯤ ꯅꯠꯠꯔꯒꯥ ꯃꯔꯨꯞ-ꯃꯄꯥꯡ ꯑꯣꯏꯕꯒꯤ ꯃꯔꯤ ꯁꯦꯝꯕꯥ ꯑꯃꯁꯨꯡ ꯊꯝꯕꯥ ꯑꯁꯤ ꯌꯥꯝꯅꯥ ꯂꯨꯕꯥ ꯑꯣꯏꯌꯨ .
"act impulsively and do things that could harm you (such as binge eating, using","ꯏꯝꯄꯂꯁꯤꯚ ꯑꯣꯏꯅꯥ ꯊꯕꯛ ꯇꯧ ꯑꯃꯁꯨꯡ ꯅꯍꯥꯀꯄꯨ ꯁꯣꯀꯍꯅꯕꯥ ꯌꯥꯕꯥ ꯊꯕꯀꯁꯤꯡ (ꯃꯔꯨꯑꯣꯏꯅꯥ ꯆꯥꯕꯥ, ꯁꯤꯖꯤꯟꯅꯕꯥ, ꯁꯤꯖꯤꯟꯅꯕꯥ ꯑꯁꯤꯅꯆꯤꯡꯕꯥ ꯊꯕꯀꯁꯤꯡ ꯄꯥꯡꯊꯣꯀꯎ"
drugs or driving dangerously),ꯗ꯭ꯔꯒꯁꯤꯡ ꯅꯠꯠꯔꯒꯥ ꯈꯨꯗꯣꯡꯊꯤꯅꯤꯉꯥꯏ ꯑꯣꯏꯅꯥ ꯗ꯭ꯔꯥꯏꯚꯤꯡ ꯇꯧꯕꯥ)꯫
have suicidal thoughts,ꯃꯁꯥꯅꯥ ꯃꯁꯥꯕꯨ ꯁꯤꯖꯕꯒꯤ ꯋꯥꯈꯜꯂꯣꯟ ꯂꯩꯕꯥ .
self-harm,ꯁꯦꯜꯐ-ꯍꯥꯔꯝ .
feel empty and lonely a lot of the time,ꯃꯇꯝ ꯀꯌꯥ ꯑꯃꯥ ꯏꯪꯅꯥ ꯂꯩꯕꯥ ꯑꯃꯁꯨꯡ ꯇꯪꯗꯨ ꯂꯩꯇꯥꯕꯥ ꯐꯥꯑꯣꯕꯥ .
"get very angry, and struggle to control your anger","ꯌꯥꯝꯅꯥ ꯋꯥꯅꯥ ꯊꯣꯀꯎ, ꯑꯃꯁꯨꯡ ꯅꯍꯥꯛꯀꯤ ꯑꯁꯥꯑꯣꯕꯥ ꯑꯗꯨ ꯀꯟꯠꯔꯣꯜ ꯇꯧꯅꯕꯥ ꯍꯣꯠꯅꯧ"
struggle to trust other people,ꯑꯇꯣꯞꯄꯥ ꯃꯤꯑꯣꯏꯁꯤꯡꯗꯥ ꯊꯥꯖꯕꯥ ꯊꯝꯅꯕꯥ ꯂꯥꯟꯊꯦꯡꯅꯕꯥ
"experience other mental health problems alongside BPD,","ꯕꯤ.ꯄꯤ.ꯗꯤ.ꯒꯥ ꯂꯣꯌꯅꯅꯥ ꯑꯇꯣꯞꯄꯥ ꯃꯦꯟꯇꯦꯜ ꯍꯦꯜꯊ ꯄ꯭ꯔꯣꯕ꯭ꯂꯦꯃꯁꯤꯡ ꯊꯦꯡꯅꯕꯥ,"
"including anxiety, depression, eating problems and post-traumatic stress disorder","ꯌꯥꯑꯣꯅꯥ ꯋꯥꯈꯜ ꯋꯥꯕꯥ, ꯋꯥꯈꯜ ꯅꯨꯡꯉꯥꯏꯇꯕꯥ, ꯆꯥꯕꯒꯤ ꯁꯃꯁ꯭ꯌꯥ ꯑꯃꯁꯨꯡ ꯄꯣꯁ꯭ꯠ-ꯇ꯭ꯔꯣꯃꯥꯇꯤꯛ ꯁ꯭ꯠꯔꯦꯁ ꯗꯤꯁꯑꯣꯔꯗꯔ"
"When very stressed, sometimes you might:","ꯌꯥꯝꯅꯥ ꯋꯥꯅꯥ ꯊꯣꯀꯄꯥ ꯃꯇꯃꯗꯥ, ꯀꯔꯤꯒꯨꯝꯕꯥ ꯃꯇꯃꯗꯥ ꯅꯍꯥꯛꯅꯥ:"
feel paranoid,ꯐꯤꯜ ꯄꯦꯔꯥꯅꯣꯏꯗ .
"have psychotic experiences, such as seeing or hearing things that other people","ꯁꯥꯏꯀꯣꯇꯤꯛ ꯑꯦꯛꯁꯄꯔꯤꯑꯦꯟꯁꯁꯤꯡ ꯂꯩꯕꯥ, ꯍꯥꯌꯕꯗꯤ ꯑꯇꯩ ꯃꯤꯑꯣꯏꯁꯤꯡꯅꯥ ꯁꯦꯝꯕꯥ ꯄꯣꯠꯁꯀꯁꯤꯡ ꯎꯕꯥ ꯅꯠꯠꯔꯒꯥ ꯇꯥꯕꯥ ꯑꯁꯤꯅꯆꯤꯡꯕꯥ꯫"
don't,ꯇꯧꯅꯨ
© Mind 2020,© ꯃꯥꯏꯟꯗ ꯲꯰꯲꯰ .
6,꯶ ꯑꯃꯁꯨꯡ ꯶.
feel numb or 'checked out' and not remember things very well after they've,ꯋꯥꯈꯜ ꯅꯨꯡꯉꯥꯏꯇꯕꯥ ꯅꯠꯠꯔꯒꯥ ‘ꯆꯦꯛ ꯑꯥꯎꯠ’ ꯇꯧꯕꯥ ꯑꯃꯁꯨꯡ ꯃꯈꯣꯌꯅꯥ ꯌꯥꯝꯅꯥ ꯐꯖꯅꯥ ꯅꯤꯡꯁꯤꯡꯕꯥ ꯉꯃꯗꯕꯥ
happened (known as dissociation),ꯊꯣꯀꯈꯤꯕꯥ (ꯗꯤꯁꯑꯣꯔꯗꯔ ꯍꯥꯌꯅꯥ ꯈꯉꯅꯕꯥ)
BPD is currently the most commonly diagnosed personality disorder. You can read more,ꯕꯤ.ꯄꯤ.ꯗꯤ.ꯅꯥ ꯍꯧꯖꯤꯛꯀꯤ ꯑꯣꯏꯅꯥ ꯈ꯭ꯕꯥꯏꯗꯒꯤ ꯀꯃꯟ ꯑꯣꯏꯅꯥ ꯂꯥꯌꯦꯡꯂꯤꯕꯥ ꯄꯔꯁꯣꯅꯦꯂꯤꯇꯤ ꯗꯤꯁꯑꯣꯔꯗꯔꯅꯤ꯫
about it on our pages on borderline personality disorder (BPD),ꯕꯣꯔꯗꯔꯂꯥꯏꯟ ꯄꯔꯁꯣꯅꯦꯂꯤꯇꯤ ꯗꯤꯁꯑꯣꯔꯗꯔ (ꯕꯤ.ꯄꯤ.ꯗꯤ.)ꯒꯤ ꯃꯇꯥꯡꯗꯥ ꯑꯩꯈꯣꯌꯒꯤ ꯄꯦꯖꯁꯤꯡꯗꯥ ꯃꯁꯤꯒꯤ ꯃꯇꯥꯡꯗꯥ
"""BPD is like having no emotional buffer. I can go from nothing to suddenly extremely","""ꯕꯤ.ꯄꯤ.ꯗꯤ. ꯑꯁꯤ ꯏꯃꯣꯁꯅꯦꯜ ꯕꯐꯔ ꯑꯃꯠꯇꯥ ꯂꯩꯇꯕꯒꯥ ꯃꯥꯟꯅꯩ꯫ ꯑꯩꯅꯥ ꯀꯔꯤꯒꯨꯝꯕꯥ ꯑꯃꯠꯇꯥꯗꯒꯤ ꯈꯉꯍꯧꯗꯅꯥ ꯌꯥꯝꯅꯥ ꯌꯥꯝꯅꯥ ꯆꯠꯄꯥ ꯉꯝꯃꯤ"
"overwhelming emotions and I struggle with expressing them healthily.""",ꯑꯆꯧꯕꯥ ꯏꯃꯣꯁꯅꯁꯤꯡ ꯑꯃꯁꯨꯡ ꯑꯩꯅꯥ ꯃꯈꯣꯌꯕꯨ ꯍꯀꯆꯥꯡ ꯐꯅꯥ ꯐꯣꯡꯗꯣꯀꯄꯒꯥ ꯂꯣꯌꯅꯅꯥ ꯂꯥꯟꯊꯦꯡꯅꯔꯤ꯫”
Histrionic personality disorder,ꯍꯤꯁ꯭ꯠꯔꯤꯌꯟ ꯄꯔꯁꯣꯅꯦꯂꯤꯇꯤ ꯗꯤꯁꯑꯣꯔꯗꯔ ꯂꯩꯕꯥ
Most people enjoy being given compliments or positive feedback about their actions. But if,ꯑꯌꯥꯝꯕꯥ ꯃꯤꯑꯣꯏꯁꯤꯡꯅꯥ ꯃꯈꯣꯌꯒꯤ ꯑꯦꯛꯁꯅꯁꯤꯡꯒꯤ ꯃꯇꯥꯡꯗꯥ ꯀꯝꯞꯂꯤꯃꯦꯟꯇ ꯇꯧꯕꯥ ꯅꯠꯠꯔꯒꯥ ꯄꯣꯖꯤꯇꯤꯚ ꯑꯣꯏꯕꯥ ꯐꯤꯗꯕꯦꯛ ꯄꯤꯕꯗꯥ ꯅꯨꯡꯉꯥꯏꯕꯥ ꯐꯥꯑꯣꯏ꯫
"you depend very heavily on being noticed, or are seeking approval so much that this","ꯑꯗꯣꯝꯅꯥ ꯌꯥꯝꯅꯥ ꯂꯨꯅꯥ ꯂꯧꯕꯗꯥ ꯃꯈꯥ ꯄꯣꯜꯂꯤ, ꯅꯠꯔꯒꯥ ꯑꯦꯞꯔꯨꯕꯦꯜ ꯑꯁꯤ ꯑꯁꯨꯛ ꯌꯥꯝꯅꯥ ꯊꯤꯔꯤ ꯃꯗꯨꯗꯤ ꯃꯁꯤꯅꯥ ."
"affects your day-to-day living, you might get a diagnosis of histrionic personality disorder","ꯅꯍꯥꯛꯀꯤ ꯅꯨꯃꯤꯠ ꯈꯨꯗꯤꯡꯒꯤ ꯄꯨꯟꯁꯤꯗꯥ ꯑꯀꯥꯌꯕꯥ ꯄꯤ, ꯅꯍꯥꯛꯅꯥ ꯍꯤꯁ꯭ꯠꯔꯤꯌꯟ ꯄꯔꯁꯣꯅꯦꯂꯤꯇꯤ ꯗꯤꯁꯑꯣꯔꯗꯔꯒꯤ ꯗꯥꯏꯑꯦꯒ꯭ꯅꯣꯁꯤꯁ ꯑꯃꯥ ꯂꯧꯕꯥ ꯌꯥꯏ"
You may:,ꯅꯍꯥꯛꯅꯥ ꯇꯧꯕꯥ ꯌꯥꯏ:
feel very uncomfortable if you are not the centre of attention,ꯀꯔꯤꯒꯨꯝꯕꯥ ꯅꯍꯥꯛꯅꯥ ꯁꯦꯟꯇꯔ ꯑꯣꯐ ꯑꯦꯇꯦꯟꯁꯟ ꯑꯣꯏꯔꯕꯗꯤ ꯌꯥꯝꯅꯥ ꯅꯨꯡꯉꯥꯏꯇꯕꯥ ꯐꯥꯎꯕꯤꯌꯨ
feel that you have to entertain people,ꯑꯗꯣꯝꯅꯥ ꯃꯤꯁꯤꯡꯕꯨ ꯅꯨꯡꯉꯥꯏꯍꯅꯒꯗꯕꯅꯤ ꯍꯥꯌꯅꯥ ꯐꯥꯑꯣꯕꯤꯌꯨ .
"constantly seek, or feel dependent on, the approval of others","ꯑꯇꯣꯞꯄꯒꯤ ꯑꯌꯥꯕꯥ ꯂꯧꯕꯥ ꯂꯦꯞꯇꯅꯥ ꯊꯤꯕꯤꯌꯨ, ꯅꯠꯔꯒꯥ ꯃꯈꯥ ꯄꯣꯜꯂꯤ ꯍꯥꯌꯅꯥ ꯐꯥꯑꯣꯕꯤꯌꯨ"
make rash decisions,ꯔꯦꯁ ꯋꯥꯔꯦꯄꯁꯤꯡ ꯂꯧꯕꯥ .
flirt or behave/dress provocatively to ensure that you remain the centre of,ꯐ꯭ꯂꯤꯔꯠ ꯅꯠꯠꯔꯒꯥ ꯕꯤꯍꯦꯚ/ꯗ꯭ꯔꯦꯁ ꯄ꯭ꯔꯣꯚꯣꯀꯦꯇꯤꯕ ꯑꯣꯏꯅꯥ ꯅꯍꯥꯛꯅꯥ ꯁꯦꯟꯇꯔ ꯑꯣꯏꯅꯥ ꯂꯩꯍꯟꯅꯕꯥ .
attention,ꯄꯨꯛꯅꯤꯡ ꯆꯤꯡꯁꯤꯟꯕ
get a reputation for being dramatic and overemotional,ꯅꯥꯠꯀꯤ ꯑꯣꯏꯕꯥ ꯑꯃꯁꯨꯡ ꯍꯦꯟꯅꯥ ꯏꯃꯣꯁꯅꯦꯜ ꯑꯣꯏꯕꯥ ꯃꯤꯡꯆꯠ ꯑꯃꯥ ꯐꯪꯕꯤꯌꯨ
be easily influenced by others,ꯑꯇꯣꯞꯄꯁꯤꯡꯅꯥ ꯐꯖꯅꯥ ꯏꯊꯤꯜ ꯄꯤꯕꯥ .
"""After being told my diagnosis I was then able to understand how and why I behaved the","""ꯑꯩꯒꯤ ꯗꯥꯏꯒ꯭ꯅꯣꯁꯤꯁ ꯍꯥꯌꯅꯥ ꯍꯥꯌꯔꯕꯥ ꯃꯇꯨꯡꯗꯥ ꯑꯩꯍꯥꯛꯅꯥ ꯃꯗꯨꯒꯤ ꯃꯇꯨꯡꯗꯥ ꯑꯩꯍꯥꯛꯅꯥ ꯀꯔꯝꯅꯥ ꯑꯃꯁꯨꯡ ꯀꯔꯤꯒꯤꯗꯃꯛꯇꯥ ꯂꯃꯆꯠ ꯁꯥꯖꯠ ꯆꯠꯈꯤꯕꯅꯣ ꯍꯥꯌꯕꯗꯨ ꯈꯉꯕꯥ ꯉꯃꯈꯤ ꯫"""
"way I did: my life made a little bit more sense.""",ꯑꯩꯅꯥ ꯇꯧꯈꯤꯕꯥ ꯃꯑꯣꯡ: ꯑꯩꯒꯤ ꯄꯨꯟꯁꯤꯅꯥ ꯈꯔꯥ ꯍꯦꯟꯅꯥ ꯋꯥꯈꯜ ꯂꯧꯁꯤꯡ ꯄꯤꯈꯤ꯫”
Narcissistic personality disorder,ꯅꯥꯔꯁꯤꯁꯤꯁ꯭ꯇꯤꯛ ꯄꯔꯁꯣꯅꯦꯂꯤꯇꯤ ꯗꯤꯁꯑꯣꯔꯗꯔ ꯂꯩꯕꯥ .
"It is human nature to be aware of our own needs, to express them, and to want others to","ꯑꯩꯈꯣꯌꯒꯤ ꯏꯁꯥꯒꯤ ꯗꯔꯀꯥꯔ ꯑꯣꯏꯕꯁꯤꯡ ꯈꯉꯕꯥ, ꯃꯈꯣꯌꯕꯨ ꯐꯣꯡꯗꯣꯀꯄꯥ ꯑꯃꯁꯨꯡ ꯑꯇꯣꯞꯄꯕꯨ ꯄꯥꯃꯖꯕꯥ ꯑꯁꯤ ꯃꯤꯑꯣꯏꯕꯒꯤ ꯃꯍꯧꯁꯥꯅꯤ ꯫"
"be aware of our abilities and achievements. These are not bad traits. However, if these",ꯑꯩꯈꯣꯌꯒꯤ ꯇꯧꯕꯥ ꯉꯝꯕꯁꯤꯡ ꯑꯃꯁꯨꯡ ꯑꯦꯆꯤꯕꯃꯦꯟꯇꯁꯤꯡ ꯈꯉꯖꯤꯅꯕꯤꯌꯨ꯫
"thoughts, feelings and behaviours are very extreme and cause problems in relating to","ꯋꯥꯈꯜ, ꯐꯤꯚꯝ ꯑꯃꯁꯨꯡ ꯂꯃꯆꯠ-ꯁꯥꯖꯠ ꯑꯁꯤ ꯌꯥꯝꯅꯥ ꯁꯥꯊꯤꯕꯅꯤ ꯑꯃꯁꯨꯡ ꯃꯁꯤꯒꯥ ꯃꯔꯤ ꯂꯩꯅꯕꯥ ꯋꯥꯐꯃꯁꯤꯡꯗꯥ ꯁꯃꯁ꯭ꯌꯥ ꯊꯣꯀꯍꯜꯂꯤ꯫"
"others, you may get a diagnosis of narcissistic personality disorder","ꯑꯇꯣꯞꯄꯁꯤꯡ, ꯅꯍꯥꯛꯅꯥ ꯅꯥꯔꯁꯤꯁꯤꯁ꯭ꯇꯤꯛ ꯄꯔꯁꯣꯅꯦꯂꯤꯇꯤ ꯗꯤꯁꯑꯣꯔꯗꯔꯒꯤ ꯗꯥꯏꯑꯦꯒ꯭ꯅꯣꯁꯤꯁ ꯑꯃꯥ ꯂꯧꯕꯥ ꯌꯥꯏ"
You may:,ꯅꯍꯥꯛꯅꯥ ꯇꯧꯕꯥ ꯌꯥꯏ:
"believe that there are special reasons that make you different, better or more","ꯑꯗꯣꯃꯕꯨ ꯇꯣꯉꯥꯟ ꯇꯣꯉꯥꯅꯕꯥ, ꯍꯦꯟꯅꯥ ꯐꯕꯥ ꯅꯠꯔꯒꯥ ꯍꯦꯟꯅꯥ ꯐꯕꯥ ꯑꯣꯏꯍꯜꯂꯤꯕꯥ ꯑꯈꯟꯅꯕꯥ ꯃꯔꯃꯁꯤꯡ ꯂꯩ ꯍꯥꯌꯅꯥ ꯊꯥꯖꯕꯤꯌꯨ꯫"
deserving than others,ꯑꯇꯣꯞꯄꯁꯤꯡꯗꯒꯤ ꯍꯦꯟꯅꯥ ꯃꯊꯧ ꯇꯥꯕꯥ .
"have fragile self-esteem, so that you rely on others to recognise your worth and","ꯐ꯭ꯔꯦꯏꯖꯜ ꯁꯦꯜꯐ-ꯏꯁ꯭ꯇꯤꯝ ꯂꯩꯕꯥ, ꯃꯗꯨꯅꯥ ꯅꯍꯥꯛꯅꯥ ꯅꯍꯥꯛꯀꯤ ꯃꯒꯨꯟ ꯑꯗꯨ ꯈꯉꯗꯣꯛꯅꯕꯥ ꯑꯇꯣꯞꯄꯁꯤꯡꯗꯥ ꯊꯥꯖꯕꯥ ꯊꯝꯕꯥ ꯑꯃꯁꯨꯡ ."
your needs,ꯅꯈꯣꯌꯒꯤ ꯗꯔꯀꯥꯔ ꯑꯣꯏꯕꯁꯤꯡ ꯑꯗꯨ .
feel upset if others ignore you and don’t give you what you feel you deserve,ꯀꯔꯤꯒꯨꯝꯕꯥ ꯑꯇꯣꯞꯄꯁꯤꯡꯅꯥ ꯅꯍꯥꯀꯄꯨ ꯌꯦꯡꯁꯤꯅꯕꯤꯗꯕꯥ ꯑꯃꯁꯨꯡ ꯅꯍꯥꯛꯅꯥ ꯐꯪꯐꯝ ꯊꯣꯀꯄꯥ ꯑꯗꯨ ꯅꯍꯥꯛꯅꯥ ꯄꯤꯗꯕꯥ ꯑꯣꯏꯔꯕꯗꯤ ꯋꯥꯈꯜ ꯅꯨꯡꯉꯥꯏꯇꯕꯥ ꯐꯥꯎꯕꯤꯌꯨ
resent other people’s successes,ꯑꯇꯣꯞꯄꯒꯤ ꯃꯥꯌ ꯄꯥꯀꯄꯁꯤꯡ ꯑꯗꯨ ꯅꯨꯡꯉꯥꯏꯇꯕꯥ ꯑꯃꯅꯤ
"put your own needs above other people’s, and demand they do too","ꯑꯗꯣꯃꯒꯤ ꯏꯁꯥꯒꯤ ꯗꯔꯀꯥꯔ ꯑꯣꯏꯕꯁꯤꯡ ꯑꯗꯨ ꯑꯇꯣꯞꯄꯥ ꯃꯤꯑꯣꯏꯁꯤꯡꯒꯤ ꯃꯊꯛꯇꯥ ꯊꯝꯃꯨ, ꯑꯃꯁꯨꯡ ꯃꯈꯣꯌꯁꯨ ꯇꯧꯅꯕꯥ ꯗꯤꯃꯥꯟꯗ ꯇꯧꯕꯤꯌꯨ"
be seen as selfish and dismissive or unaware of other people's needs,ꯃꯁꯥꯒꯤ ꯑꯣꯏꯖꯕꯥ ꯊꯤꯕꯥ ꯑꯃꯁꯨꯡ ꯃꯤꯄꯥꯏꯕꯥ ꯄꯣꯀꯍꯅꯕꯥ ꯅꯠꯠꯔꯒꯥ ꯑꯇꯣꯞꯄꯥ ꯃꯤꯑꯣꯏꯁꯤꯡꯒꯤ ꯃꯊꯧ ꯇꯥꯕꯁꯤꯡ ꯑꯗꯨ ꯈꯉꯕꯥ ꯉꯃꯗꯕꯥ ꯑꯣꯏꯅꯥ ꯎꯕꯥ
Avoidant personality disorder,ꯑꯦꯕꯣꯔꯁꯟ ꯄꯔꯁꯣꯅꯦꯂꯤꯇꯤ ꯗꯤꯁꯑꯣꯔꯗꯔ ꯂꯩꯕꯥ꯫
"We all have things, places or people we don't like, or which make us anxious. But if these","ꯑꯩꯈꯣꯌ ꯄꯨꯝꯅꯃꯛꯀꯤ ꯄꯣꯠꯁꯤꯡ, ꯃꯐꯃꯁꯤꯡ ꯅꯠꯔꯒꯥ ꯑꯩꯈꯣꯌꯅꯥ ꯄꯥꯃꯗꯕꯥ ꯃꯤꯑꯣꯏꯁꯤꯡ ꯂꯩꯔꯤ, ꯅꯠꯔꯒꯥ ꯑꯩꯈꯣꯌꯕꯨ ꯋꯥꯈꯜ ꯋꯥꯕꯥ ꯊꯣꯀꯍꯜꯂꯤ꯫"
"things cause so much anxiety that you struggle to maintain relationships in your life, you","ꯋꯥꯐꯃꯁꯤꯡ ꯑꯁꯤꯅꯥ ꯑꯁꯨꯛ ꯌꯥꯝꯅꯥ ꯋꯥꯈꯜ ꯋꯥꯕꯥ ꯊꯣꯀꯍꯜꯂꯤ ꯃꯗꯨꯗꯤ ꯅꯍꯥꯛꯅꯥ ꯅꯍꯥꯛꯀꯤ ꯄꯨꯟꯁꯤꯗꯥ ꯃꯔꯤ ꯊꯝꯅꯕꯒꯤꯗꯃꯛ ꯂꯥꯟꯊꯦꯡꯅꯔꯤ, ꯅꯍꯥꯛꯅꯥ ."
may get a diagnosis of avoidant personality disorder (sometimes also called anxious,ꯑꯦꯕꯣꯏꯗꯦꯟꯇ ꯄꯔꯁꯣꯅꯦꯂꯤꯇꯤ ꯗꯤꯁꯑꯣꯔꯗꯔꯒꯤ ꯗꯥꯏꯑꯦꯒ꯭ꯅꯣꯁꯤꯁ ꯑꯃꯥ ꯂꯧꯕꯥ ꯌꯥꯏ (ꯀꯔꯤꯒꯨꯝꯕꯥ ꯃꯇꯃꯗꯥ ꯑꯦꯟꯁꯤꯌꯁ ꯍꯥꯌꯅꯥꯁꯨ ꯀꯧꯏ꯫
personality disorder),ꯄꯔꯁꯣꯅꯦꯂꯤꯇꯤ ꯗꯤꯁꯑꯣꯔꯗꯔ)꯫
You may:,ꯅꯍꯥꯛꯅꯥ ꯇꯧꯕꯥ ꯌꯥꯏ:
avoid work or social activities that mean you must be with others,ꯑꯗꯣꯝꯅꯥ ꯑꯇꯣꯞꯄꯒꯥ ꯂꯣꯌꯅꯅꯥ ꯂꯩꯒꯗꯕꯅꯤ ꯍꯥꯌꯅꯥ ꯂꯧꯔꯤꯕꯥ ꯊꯕꯛ ꯅꯠꯔꯒꯥ ꯈꯨꯟꯅꯥꯏꯒꯤ ꯊꯕꯛ ꯊꯧꯔꯃꯁꯤꯡꯗꯒꯤ ꯂꯥꯞꯅꯥ ꯂꯩꯌꯨ .
expect disapproval and criticism and be very sensitive to it,ꯗꯤꯁꯑꯦꯞꯔꯨꯕꯦꯜ ꯑꯃꯁꯨꯡ ꯀ꯭ꯔꯤꯇꯤꯁꯤꯖꯃꯁꯨ ꯑꯥꯁꯥ ꯇꯧꯕꯤꯌꯨ ꯑꯃꯁꯨꯡ ꯃꯁꯤꯗꯥ ꯌꯥꯝꯅꯥ ꯁꯦꯟꯁꯤꯇꯤꯕ ꯑꯣꯏꯒꯅꯤ .
© Mind 2020,© ꯃꯥꯏꯟꯗ ꯲꯰꯲꯰ .
7,꯷ ꯑꯃꯁꯨꯡ ꯷.
