en,mni-Mtei
"recall, are similar throughout one’s lifespan. People, regardless of their","ꯅꯤꯡꯁꯤꯡꯕꯤꯌꯨ, ꯀꯅꯥꯒꯨꯝꯕꯥ ꯑꯃꯒꯤ ꯄꯨꯟꯁꯤꯒꯤ ꯃꯇꯝ ꯄꯨꯝꯅꯃꯛꯇꯥ ꯃꯥꯟꯅꯩ꯫"
"age, gradually lose memories. They  however, regain them if reminders","ꯆꯍꯤ, ꯇꯞꯅꯥ ꯇꯞꯅꯥ ꯃꯦꯃꯣꯔꯤꯁꯤꯡ ꯃꯥꯡꯈꯤ꯫"
"are provided. In addition, the more times a memory is retrieved, the more",ꯄꯤꯔꯤ꯫
"enduring the memory becomes (Rovee-Collier, 1993)","ꯂꯦꯡꯗꯕꯥ ꯃꯦꯃꯣꯔꯤ ꯑꯗꯨ ꯑꯣꯏꯔꯀꯏ (ꯔꯣꯚꯤ-ꯀꯣꯂꯤꯌꯔ, ꯱꯹꯹꯳)꯫"
Working Memory Capacity,ꯋꯥꯔꯀꯤꯡ ꯃꯦꯃꯣꯔꯤ ꯀꯦꯄꯥꯁꯤꯇꯤ ꯂꯩꯕꯥ .
The working memory capacity improves with age. This is due mainly to,ꯋꯥꯔꯀꯤꯡ ꯃꯦꯃꯣꯔꯤ ꯀꯦꯄꯥꯁꯤꯇꯤ ꯑꯁꯤ ꯆꯍꯤꯒꯥ ꯂꯣꯌꯅꯅꯥ ꯐꯒꯠꯂꯀꯏ꯫
improvements in the operating efficiency or executive control of the,ꯒꯤ ꯑꯣꯄꯔꯦꯇꯤꯡ ꯏꯐꯤꯁꯤꯑꯦꯟꯁꯤ ꯅꯠꯔꯒꯥ ꯑꯦꯒꯖꯤꯛꯌꯨꯇꯤꯕ ꯀꯟꯠꯔꯣꯂꯗꯥ ꯑꯍꯣꯡꯕꯥ ꯄꯨꯔꯀꯄꯥ
"working memory (Case and Okamotor, 1996). In practical terms, the","ꯋꯥꯔꯀꯤꯡ ꯃꯦꯃꯣꯔꯤ (ꯀꯦꯁ ꯑꯃꯁꯨꯡ ꯑꯣꯀꯥꯃꯣꯇꯔ, 1996)꯫"
number of chunks of information held in the working memory increases,ꯋꯥꯔꯀꯤꯡ ꯃꯦꯃꯣꯔꯤꯗꯥ ꯊꯝꯂꯤꯕꯥ ꯏꯅꯐꯣꯔꯃꯦꯁꯅꯒꯤ ꯁꯔꯨꯛ ꯃꯁꯤꯡ ꯍꯦꯅꯒꯠꯂꯀꯏ
with age,ꯆꯍꯤꯒꯥ ꯂꯣꯌꯅꯅꯥ .
Speed of Information Processing,ꯏꯅꯐꯣꯔꯃꯦꯁꯟ ꯄ꯭ꯔꯣꯁꯦꯁꯤꯡꯒꯤ ꯈꯣꯡꯖꯦꯜ
"As the child attains higher maturational levels, their speed of",ꯑꯉꯥꯡ ꯑꯗꯨꯅꯥ ꯍꯦꯟꯅꯥ ꯋꯥꯡꯕꯥ ꯃꯦꯆ꯭ꯌꯨꯔꯦꯁꯅꯦꯜ ꯂꯦꯚꯦꯂꯁꯤꯡ ꯐꯪꯕꯅꯥ ꯃꯔꯝ ꯑꯣꯏꯗꯨꯅꯥ ꯃꯈꯣꯌꯒꯤ ꯈꯣꯡꯖꯦꯜ ꯑꯗꯨ .
information processing increases rapidly. The efficiency of information,ꯏꯅꯐꯣꯔꯃꯦꯁꯟ ꯄ꯭ꯔꯣꯁꯦꯁꯤꯡ ꯑꯁꯤ ꯌꯥꯝꯅꯥ ꯊꯨꯅꯥ ꯍꯦꯅꯒꯠꯂꯀꯏ꯫
"processing also improves. That is, less effort is needed to process any",ꯄ꯭ꯔꯣꯁꯦꯁꯤꯡꯁꯨ ꯐꯒꯠꯂꯀꯏ꯫
bit of information,ꯏꯅꯐꯣꯔꯃꯦꯁꯅꯒꯤ ꯕꯤꯠ .
Memory Control Strategies,ꯃꯦꯃꯣꯔꯤ ꯀꯟꯠꯔꯣꯜ ꯇꯧꯕꯒꯤ ꯊꯧꯑꯣꯡꯁꯤꯡ .
"With increasing maturation, the child’s memory control strategies","ꯃꯦꯆ꯭ꯌꯨꯔꯦꯁꯟ ꯍꯦꯅꯒꯠꯂꯀꯄꯒꯥ ꯂꯣꯌꯅꯅꯥ, ꯑꯉꯥꯡ ꯑꯗꯨꯒꯤ ꯃꯦꯃꯣꯔꯤ ꯀꯟꯠꯔꯣꯜ ꯁ꯭ꯠꯔꯥꯇꯦꯖꯤꯁꯤꯡ"
become more sophisticated. The child’s conscious and intentional u s e,ꯍꯦꯟꯅꯥ ꯁꯣꯐꯤꯁ꯭ꯇꯤꯀꯦꯠ ꯑꯣꯏꯕꯥ꯫
o f   memory tactics increases. There is evidence of increasing use of,o f ꯃꯦꯃꯣꯔꯤ ꯇꯥꯀꯄꯤ-ꯇꯝꯕꯤꯕꯒꯤ ꯆꯥꯡ ꯍꯦꯅꯒꯠꯂꯀꯏ꯫
"rehearsal, repetition and practice to aid memory as children become","ꯔꯤꯍꯔꯕꯜ, ꯔꯤꯄꯤꯇꯦꯁꯟ ꯑꯃꯁꯨꯡ ꯄ꯭ꯔꯦꯛꯇꯤꯁ ꯇꯧꯗꯨꯅꯥ ꯑꯉꯥꯡꯁꯤꯡꯅꯥ ꯑꯣꯏꯔꯀꯄꯗꯒꯤ ꯃꯦꯃꯣꯔꯤꯗꯥ ꯃꯇꯦꯡ ꯄꯥꯡꯅꯕꯥ ."
older,ꯑꯍꯜ ꯑꯣꯏꯔꯕꯥ ꯃꯤꯑꯣꯏꯁꯤꯡ .
Growth of Meta-memory,ꯃꯦꯇꯥ-ꯃꯦꯃꯣꯔꯤꯒꯤ ꯆꯥꯎꯈꯠꯄꯥ .
Meta-memory increases with age and increasing maturation. Meta-,ꯆꯍꯤ ꯑꯃꯁꯨꯡ ꯃꯦꯆ꯭ꯌꯨꯔ ꯍꯦꯅꯒꯠꯂꯀꯄꯒꯥ ꯂꯣꯌꯅꯅꯥ ꯃꯦꯇꯥ-ꯃꯦꯃꯣꯔꯤ ꯍꯦꯅꯒꯠꯂꯀꯏ꯫
memory is the understanding and knowledge children have about,ꯃꯦꯃꯣꯔꯤ ꯍꯥꯌꯕꯁꯤ ꯑꯉꯥꯡꯁꯤꯡꯅꯥ ꯄꯤꯔꯤꯕꯥ ꯂꯧꯁꯤꯡ ꯑꯃꯁꯨꯡ ꯂꯧꯁꯤꯡ ꯑꯁꯤꯅꯤ ꯫
"memory and memory process. As children become older, they become",ꯃꯦꯃꯣꯔꯤ ꯑꯃꯁꯨꯡ ꯃꯦꯃꯣꯔꯤ ꯄ꯭ꯔꯣꯁꯦꯁ꯫
"more aware that memory can fail (Lewis and Mitchell, 1994). They","ꯃꯦꯃꯣꯔꯤ ꯑꯁꯤ ꯃꯥꯌꯄꯥꯀꯄꯥ ꯌꯥꯏ ꯍꯥꯌꯕꯁꯤ ꯍꯦꯟꯅꯥ ꯈꯪꯖꯤꯅꯒꯗꯕꯅꯤ (Lewis and Mitchell, 1994)꯫"
realise that forgetting occurs frequently when children come to this,ꯑꯉꯥꯡꯁꯤꯡꯅꯥ ꯃꯁꯤꯒꯤ ꯃꯇꯥꯡꯗꯥ ꯂꯥꯀꯄꯥ ꯃꯇꯃꯗꯥ ꯀꯥꯑꯣꯊꯣꯀꯄꯥ ꯑꯁꯤ ꯌꯥꯝꯅꯥ ꯇꯣꯏꯅꯥ ꯊꯣꯀꯏ ꯍꯥꯌꯕꯥ ꯈꯉꯕꯥ
PED121,ꯄꯤ.ꯏ.ꯗꯤ.꯱꯲꯱ ꯑꯃꯁꯨꯡ ꯑꯦꯟ.
MODULE 2,ꯃꯣꯗ꯭ꯌꯨꯜ ꯲.
63,꯶꯳ ꯑꯃꯁꯨꯡ ꯑꯦꯟ.
awareness; they consciously spend more time studying or rehearsing any,ꯈꯪꯕ;
material they wish to remember in future,ꯇꯨꯡꯗꯥ ꯃꯈꯣꯌꯅꯥ ꯅꯤꯡꯁꯤꯡꯅꯤꯡꯂꯤꯕꯥ ꯃꯆꯥꯀꯁꯤꯡ
Content Knowledge,ꯀꯟꯇꯦꯟꯇ ꯅꯣꯂꯦꯖ
"With age, the quantity of information a child stores and recalls in","ꯆꯍꯤꯒꯥ ꯂꯣꯌꯅꯅꯥ, ꯑꯉꯥꯡ ꯑꯃꯅꯥ ꯊꯝꯂꯤꯕꯥ ꯏꯅꯐꯣꯔꯃꯦꯁꯅꯒꯤ ꯃꯁꯤꯡ ꯑꯃꯁꯨꯡ 2019ꯗꯥ ꯔꯤꯀꯣꯜ ꯇꯧꯏ꯫"
virtually all domains of knowledge increases remarkably. Increase in,ꯋꯥꯔꯆꯨꯑꯦꯜ ꯑꯣꯏꯅꯥ ꯂꯧꯁꯤꯡꯒꯤ ꯗꯣꯃꯦꯟ ꯄꯨꯝꯅꯃꯛ ꯁꯤꯡꯊꯥꯅꯤꯡꯉꯥꯏ ꯑꯣꯏꯅꯥ ꯍꯦꯅꯒꯠꯂꯀꯏ꯫
content knowledge leads to increases in how children recall as well as,ꯀꯟꯇꯦꯟꯇ ꯅꯣꯂꯦꯖꯅꯥ ꯑꯉꯥꯡꯁꯤꯡꯅꯥ ꯃꯇꯧ ꯀꯔꯝꯅꯥ ꯔꯤꯀꯣꯜ ꯇꯧꯕꯒꯦ ꯍꯥꯌꯕꯗꯨ ꯍꯦꯅꯒꯠꯍꯅꯕꯗꯥ ꯃꯇꯦꯡ ꯄꯥꯡꯕꯇꯥ ꯅꯠꯇꯅꯥ .
what they can remember. As the amount of information on a given topic,ꯃꯈꯣꯌꯅꯥ ꯅꯤꯡꯁꯤꯡꯕꯥ ꯉꯝꯕꯥ ꯑꯗꯨ꯫
"stored in the memory grows, it becomes easier to learn new, but related","ꯃꯦꯃꯣꯔꯤꯗꯥ ꯁ꯭ꯇꯣꯔ ꯇꯧꯔꯤꯕꯥ ꯑꯁꯤ ꯍꯦꯅꯒꯠꯂꯀꯏ, ꯑꯅꯧꯕꯥ ꯇꯝꯕꯗꯥ ꯍꯦꯟꯅꯥ ꯂꯥꯌꯕꯥ ꯑꯣꯏꯔꯀꯏ, ꯑꯗꯨꯕꯨ ꯃꯔꯤ ꯂꯩꯅꯕꯥ"
"material. Prior memories provide a context for new information (Harris,",ꯃꯆꯥꯛ.
"Durso, Mergler and Jones, 1990)","ꯗꯨꯔꯁꯣ, ꯃꯦꯔꯒꯂꯔ ꯑꯃꯁꯨꯡ ꯖꯣꯅꯁ, ꯱꯹꯹꯰)"
2.3.5     Factors that Influence Cognitive Development,2.3.5 ꯀꯣꯒꯅꯤꯇꯤꯚ ꯗꯤꯚꯦꯂꯄꯃꯦꯟꯇꯗꯥ ꯁꯥꯐꯨ ꯄꯤꯔꯤꯕꯥ ꯐꯦꯛꯇꯔꯁꯤꯡ
Several factors influence cognitive development. We discuss three,ꯐꯦꯛꯇꯔ ꯀꯌꯥꯅꯥ ꯀꯣꯒꯅꯤꯇꯤꯚ ꯗꯤꯚꯦꯂꯄꯃꯦꯟꯇꯗꯥ ꯁꯥꯐꯨ ꯄꯤ꯫
"factors, namely: maturation, experience and social transmission","ꯐꯦꯛꯇꯔꯁꯤꯡ, ꯍꯥꯌꯕꯗꯤ: ꯃꯦꯆ꯭ꯌꯨꯔꯦꯁꯟ, ꯑꯦꯛꯁꯄꯤꯔꯤꯑꯦꯟꯁ ꯑꯃꯁꯨꯡ ꯁꯣꯁꯤꯑꯦꯜ ꯇ꯭ꯔꯥꯟꯁꯃꯤꯁꯟ"
Maturation,ꯃꯦꯆ꯭ꯌꯨꯔ ꯑꯣꯏꯕꯥ .
Maturation is the natural unfolding of a person’s biological potential.   It,ꯃꯦꯆ꯭ꯌꯨꯔꯦꯁꯟ ꯍꯥꯌꯕꯁꯤ ꯃꯤꯑꯣꯏ ꯑꯃꯒꯤ ꯕꯥꯏꯑꯣꯂꯣꯖꯤꯀꯦꯜ ꯄꯣꯇꯦꯟꯁꯤꯑꯦꯜ ꯑꯗꯨ ꯃꯍꯧꯁꯥꯒꯤ ꯑꯣꯏꯕꯥ ꯃꯑꯣꯡꯗꯥ ꯑꯅꯐꯣꯜꯗ ꯇꯧꯕꯅꯤ꯫
is a sequence of changes in the body systems that are governed by a,ꯑꯁꯤ ꯑꯦ.ꯑꯦ.
genetic blueprint. Maturation defines the readiness of an individual to,ꯖꯤꯅꯦꯇꯤꯛ ꯕ꯭ꯂꯨꯞꯔꯤꯟꯇ꯫
"develop specific tasks. Thus, the level of maturation delimits the level",ꯑꯀꯛꯅꯕꯥ ꯊꯕꯀꯁꯤꯡ ꯁꯦꯃꯒꯠꯄꯥ꯫
of cognitive functioning.   This means that the nature of the cognitive,ꯀꯣꯒꯅꯤꯇꯤꯕ ꯐꯉ꯭ꯀꯁꯅꯒꯤ ꯃꯇꯥꯡꯗꯥ ꯋꯥꯐꯝ ꯊꯃꯈꯤ꯫
tasks a child is able to benefit from at any stage of development will,ꯊꯕꯀꯁꯤꯡ ꯑꯁꯤ ꯑꯉꯥꯡ ꯑꯃꯅꯥ ꯆꯥꯎꯈꯠꯄꯒꯤ ꯇꯥꯉ꯭ꯀꯛ ꯑꯃꯍꯦꯛꯇꯗꯥ ꯀꯥꯟꯅꯕꯥ ꯐꯪꯒꯗꯕꯥ ꯊꯕꯀꯁꯤꯡ .
depend on their biological readiness or maturation. Maturation is,ꯃꯈꯣꯌꯒꯤ ꯕꯥꯏꯑꯣꯂꯣꯖꯤꯀꯦꯜ ꯔꯦꯗꯤꯑꯣ ꯅꯠꯠꯔꯒꯥ ꯃꯦꯆ꯭ꯌꯨꯔꯦꯁꯅꯒꯤ ꯃꯈꯥ ꯄꯣꯜꯂꯤ꯫
"important because before any stimulus can set off a response, the child","ꯃꯔꯨꯑꯣꯏꯕꯥ ꯃꯔꯃꯗꯤ ꯁ꯭ꯇꯤꯝꯌꯨꯜ ꯑꯃꯍꯦꯛꯇꯅꯥ ꯔꯦꯁ꯭ꯄꯣꯟꯁ ꯑꯃꯥ ꯄꯤꯕꯥ ꯉꯃꯗ꯭ꯔꯤꯉꯩ ꯃꯃꯥꯡꯗꯥ, ꯑꯉꯥꯡ ꯑꯗꯨꯅꯥ"
must be capable of exhibiting that response,ꯑꯗꯨꯒꯨꯝꯕꯥ ꯔꯦꯁ꯭ꯄꯣꯟꯁ ꯑꯗꯨ ꯎꯠꯄꯥ ꯉꯝꯕꯥ ꯑꯣꯏꯒꯗꯕꯅꯤ .
"As stated earlier, the child’s initial schemes of the world develop from","ꯃꯃꯥꯡꯗꯥ ꯍꯥꯌꯈꯤꯕꯒꯨꯝꯅꯥ, ꯑꯉꯥꯡ ꯑꯗꯨꯒꯤ ꯑꯍꯥꯅꯕꯥ ꯁ꯭ꯀꯤꯃꯁꯤꯡ ꯑꯁꯤ 1000 ꯗꯒꯤ ꯍꯦꯟꯅꯥ ꯆꯥꯎꯈꯠꯂꯀꯏ꯫"
"the child’s motor actions. Primarily, motor actions are genetically pre-",ꯑꯉꯥꯡ ꯑꯗꯨꯒꯤ ꯃꯣꯇꯣꯔ ꯑꯦꯛꯁꯅꯁꯤꯡ꯫
"wired. Maturation gets them expressed. Equally, the appearance of",ꯋꯥꯏꯔ ꯇꯧꯕꯥ꯫
"some specific mental operations, such as conservation, relativity,","ꯑꯀꯛꯅꯕꯥ ꯃꯦꯟꯇꯦꯜ ꯑꯣꯄꯔꯦꯁꯟ ꯈꯔꯗꯤ, ꯍꯥꯌꯕꯗꯤ ꯀꯟꯖꯔꯕꯦꯁꯟ, ꯔꯤꯂꯦꯇꯤꯚꯤꯇꯤ,"
proportional and propositional reasoning requires some level of,ꯄ꯭ꯔꯣꯄꯣꯔꯆꯨꯑꯦꯜ ꯑꯃꯁꯨꯡ ꯄ꯭ꯔꯣꯄꯣꯖꯦꯜ ꯔꯤꯖꯅꯦꯂꯒꯤ ꯑꯣꯏꯅꯥ ꯂꯦꯚꯦꯜ ꯈꯔꯗꯤ ꯃꯊꯧ ꯇꯥꯏ꯫
maturation,ꯃꯦꯆ꯭ꯌꯨꯔ ꯑꯣꯏꯕꯥ .
"More specifically, the five-year-old child cannot represent their route to","ꯍꯦꯟꯅꯥ ꯃꯌꯦꯛ ꯁꯦꯡꯅꯥ ꯍꯥꯌꯔꯕꯗꯥ, ꯆꯍꯤ ꯃꯉꯥꯒꯤ ꯑꯉꯥꯡ ꯑꯗꯨꯅꯥ ꯃꯈꯣꯌꯒꯤ ꯂꯝꯕꯤ ꯑꯗꯨ 10000ꯒꯤ ꯃꯅꯨꯡꯗꯥ ꯔꯤꯞꯔꯗꯛꯇ ꯇꯧꯕꯥ ꯉꯃꯗꯦ꯫"
the school on paper. The same child goes to and returns from the school,ꯀꯥꯒꯖꯗꯥ ꯂꯩꯕꯥ ꯁ꯭ꯀꯨꯜ꯫
without an escort. A ten- y e a r - o l d  child can mentally represent their,ꯑꯦꯁ꯭ꯀꯣꯔꯠ ꯑꯃꯥ ꯌꯥꯑꯣꯗꯅꯥ꯫
route on paper. A seven-year-old child will not grasp the significance of,ꯀꯥꯒꯖꯗꯥ ꯆꯠꯄꯥ ꯂꯝꯕꯤ꯫
Newton’s first law of motion:,ꯅꯤꯎꯇꯅꯒꯤ ꯑꯍꯥꯅꯕꯥ ꯂꯣ ꯑꯣꯐ ꯃꯣꯁꯟ:
An object that would move on a physical surface and not experience,ꯐꯤꯖꯤꯀꯦꯜ ꯁꯔꯐꯦꯁ ​​ꯑꯃꯗꯥ ꯆꯪꯁꯤꯅꯕꯥ ꯑꯃꯁꯨꯡ ꯑꯦꯛꯁꯄꯔꯤꯌꯦꯟꯁ ꯂꯩꯇꯕꯥ ꯄꯣꯠꯁꯛ ꯑꯃꯥ .
friction does not exist in the seven year old’s experiential world.   The,ꯐ꯭ꯔꯤꯛꯁꯟ ꯑꯁꯤ ꯆꯍꯤ ꯷ꯀꯤ ꯑꯦꯛꯁꯄꯤꯔꯤꯑꯦꯟꯁꯤꯑꯦꯜ ꯋꯥꯔꯜꯗꯇꯥ ꯂꯩꯇꯦ꯫
"task is a propositional problem. Also, the seven year old child can only",ꯊꯕꯛ ꯑꯁꯤ ꯄ꯭ꯔꯣꯄꯣꯖꯦꯜ ꯄ꯭ꯔꯣꯕ꯭ꯂꯦꯝ ꯑꯃꯅꯤ꯫
memorise the definition of density of an object. Density is a derived,ꯄꯣꯠꯁꯛ ꯑꯃꯒꯤ ꯗꯦꯟꯁꯤꯇꯤꯒꯤ ꯋꯥꯍꯟꯊꯣꯛ ꯑꯗꯨ ꯅꯤꯡꯁꯤꯡꯕꯤꯌꯨ꯫
quantity – the ratio of mass to volume of the object. Most adolescents,ꯃꯁꯤꯡ – ꯄꯣꯠꯁꯛ ꯑꯗꯨꯒꯤ ꯃꯥꯁ ꯑꯃꯁꯨꯡ ꯚꯣꯜꯌꯨꯃꯒꯤ ꯔꯦꯁꯤꯑꯣ꯫
PED121,ꯄꯤ.ꯏ.ꯗꯤ.꯱꯲꯱ ꯑꯃꯁꯨꯡ ꯑꯦꯟ.
CHILDHOOD AND ADOLESCENT PSYCHOLOGY,ꯑꯉꯥꯡ ꯑꯣꯏꯔꯤꯉꯩ ꯑꯃꯁꯨꯡ ꯏꯅꯈꯠꯂꯛꯂꯤꯕꯥ ꯁꯥꯏꯀꯣꯂꯣꯖꯤ
64,꯶꯴ ꯑꯃꯁꯨꯡ ꯑꯦꯟ.
would understand these concepts. This means that some basic mental,ꯍꯥꯌꯔꯤꯕꯥ ꯋꯥꯈꯜꯂꯣꯅꯁꯤꯡ ꯑꯁꯤ ꯈꯉꯂꯃꯒꯅꯤ꯫
structures must exist in a child’s schemes before they are able to benefit,ꯁ꯭ꯠꯔꯀꯆꯔꯁꯤꯡ ꯑꯁꯤ ꯑꯉꯥꯡ ꯑꯃꯒꯤ ꯁ꯭ꯀꯤꯃꯁꯤꯡꯗꯥ ꯃꯈꯣꯌꯅꯥ ꯀꯥꯟꯅꯕꯥ ꯐꯪꯗ꯭ꯔꯤꯉꯩ ꯃꯃꯥꯡꯗꯥ ꯂꯩꯒꯗꯕꯅꯤ
"from some kinds of knowledge. In other words, maturation limits what",ꯃꯈꯜ ꯑꯃꯒꯤ ꯂꯧꯁꯤꯡꯗꯒꯤ꯫
cognitive abilities a child develops and when they are developed,ꯀꯣꯒꯅꯤꯇꯤꯚ ꯑꯦꯕꯤꯂꯤꯇꯤꯁꯤꯡ ꯑꯁꯤ ꯑꯉꯥꯡ ꯑꯃꯅꯥ ꯁꯦꯃꯒꯠꯂꯀꯄꯥ ꯑꯃꯁꯨꯡ ꯃꯈꯣꯌ ꯑꯁꯤ ꯁꯦꯃꯒꯠꯂꯀꯄꯥ ꯃꯇꯃꯗꯥ .
Experience,ꯊꯦꯡꯅꯔꯛꯈꯤꯕ
Experience has to do with environmental stimulation. Experience of the,ꯑꯦꯛꯁꯄꯔꯤꯌꯦꯟꯁ ꯑꯁꯤ ꯑꯀꯣꯌꯕꯒꯤ ꯐꯤꯕꯃꯒꯤ ꯊꯧꯅꯥꯒꯥ ꯃꯔꯤ ꯂꯩꯅꯩ꯫
"physical world is crucial to cognitive development. As earlier stated,",ꯐꯤꯖꯤꯀꯦꯜ ꯋꯥꯔꯜꯗ ꯑꯁꯤ ꯀꯣꯒꯅꯤꯇꯤꯕ ꯗꯤꯕꯦꯂꯄꯃꯦꯟꯇꯀꯤꯗꯃꯛ ꯌꯥꯝꯅꯥ ꯃꯔꯨ ꯑꯣꯏ꯫
knowledge is constructed from the child’s actions on the environment,ꯅꯣꯂꯦꯖ ꯑꯁꯤ ꯑꯉꯥꯡ ꯑꯗꯨꯅꯥ ꯑꯀꯣꯌꯔꯣꯅꯒꯤ ꯃꯇꯥꯡꯗꯥ ꯇꯧꯔꯤꯕꯥ ꯊꯕꯀꯁꯤꯡꯗꯒꯤ ꯁꯦꯃꯒꯠꯂꯤ꯫
"That is, schemes are constructed through experiencing. The child’s ideas",ꯍꯥꯌꯕꯗꯤ ꯁ꯭ꯀꯤꯃꯁꯤꯡ ꯑꯁꯤ ꯑꯦꯛꯁꯄꯔꯤꯑꯦꯟꯁꯀꯤ ꯈꯨꯠꯊꯥꯡꯗꯥ ꯁꯦꯃꯒꯠꯂꯤ꯫
"about the attributes, uses, and relationships among different aspects of the","ꯒꯤ ꯇꯣꯉꯥꯟ ꯇꯣꯉꯥꯅꯕꯥ ꯃꯁꯀꯁꯤꯡꯒꯤ ꯃꯔꯛꯇꯥ ꯂꯩꯔꯤꯕꯥ ꯑꯦꯠꯔꯤꯕ꯭ꯌꯨꯠꯁꯤꯡ, ꯌꯨꯖꯁꯤꯡ ꯑꯃꯁꯨꯡ ꯃꯔꯤꯁꯤꯡꯒꯤ ꯃꯇꯥꯡꯗꯥ ."
"environment are arrived at through their own experiences. For example,",ꯃꯈꯣꯌꯒꯤ ꯃꯁꯥꯒꯤ ꯑꯣꯏꯕꯥ ꯑꯦꯛꯁꯄꯔꯤꯌꯦꯟꯁꯁꯤꯡꯒꯤ ꯈꯨꯠꯊꯥꯡꯗꯥ ꯑꯀꯣꯌꯕꯒꯤ ꯐꯤꯕꯝ ꯌꯧꯔꯦ꯫
the child comes to know that the breast nipple is soft and pleasant,ꯑꯉꯥꯡ ꯑꯗꯨꯅꯥ ꯈꯪꯂꯀꯏ ꯃꯗꯨꯗꯤ ꯕ꯭ꯔꯦꯁ꯭ꯠ ꯅꯤꯄꯥꯜ ꯑꯗꯨ ꯇꯔꯨ-ꯇꯅꯥꯅꯕꯥ ꯑꯃꯁꯨꯡ ꯅꯨꯡꯉꯥꯏꯕꯥ .
through their experience of sucking; that a piece of stone is coarse,ꯃꯈꯣꯌꯒꯤ ꯆꯨꯝꯅꯒꯤ ꯑꯦꯛꯁꯄꯔꯤꯌꯦꯟꯁꯀꯤ ꯈꯨꯠꯊꯥꯡꯗꯥ;
through their experience of rubbing or biting; that a concrete block is,ꯃꯈꯣꯌꯒꯤ ꯑꯦꯛꯁꯄꯔꯤꯌꯦꯟꯁꯀꯤ ꯈꯨꯠꯊꯥꯡꯗꯥ ꯔꯕ ꯇꯧꯕꯥ ꯅꯠꯠꯔꯒꯥ ꯆꯦꯅꯕꯥ;
heavier than a block of wood through their experience of lifting. These,ꯃꯈꯣꯌꯒꯤ ꯂꯤꯐꯇꯤꯡꯒꯤ ꯑꯦꯛꯁꯄꯔꯤꯌꯦꯟꯁꯀꯤ ꯈꯨꯠꯊꯥꯡꯗꯥ ꯎꯒꯤ ꯕ꯭ꯂꯣꯛ ꯑꯃꯗꯒꯤ ꯍꯦꯟꯅꯥ ꯂꯨꯝꯕꯥ꯫
experiences and the child’s abstractions from them constitute the,ꯑꯦꯛꯁꯄꯔꯤꯌꯦꯟꯁꯁꯤꯡ ꯑꯃꯁꯨꯡ ꯃꯈꯣꯌꯗꯒꯤ ꯂꯥꯀꯄꯥ ꯑꯉꯥꯡꯁꯤꯡꯒꯤ ꯑꯦꯕꯁ꯭ꯠꯔꯦꯛꯁꯅꯁꯤꯡ ꯑꯁꯤꯅꯥ .
building blocks for cognitive growth and development. Maturation may,ꯀꯣꯒꯅꯤꯇꯤꯕ ꯒ꯭ꯔꯣꯊ ꯑꯃꯁꯨꯡ ꯗꯤꯕꯦꯂꯄꯃꯦꯟꯇꯀꯤꯗꯃꯛ ꯕꯤꯜꯗꯤꯡ ꯕ꯭ꯂꯣꯀꯁꯤꯡ꯫
"have taken its course but without relevant experiences, specific","ꯃꯁꯤꯒꯤ ꯀꯣꯔꯁ ꯑꯁꯤ ꯂꯧꯈ꯭ꯔꯦ ꯑꯗꯨꯕꯨ ꯃꯔꯤ ꯂꯩꯅꯕꯥ ꯑꯦꯛꯁꯄꯔꯤꯌꯦꯟꯁꯁꯤꯡ ꯌꯥꯑꯣꯗꯅꯥ, ꯑꯀꯛꯅꯕꯥ ."
behaviours will not appear,ꯂꯃꯆꯠ-ꯁꯥꯖꯠꯁꯤꯡ ꯂꯥꯀꯄꯥ ꯌꯥꯔꯣꯏ .
Social Transmission,ꯁꯣꯁꯤꯌꯦꯜ ꯇ꯭ꯔꯥꯟꯁꯃꯤꯁꯟ ꯇꯧꯕꯥ
Children live and grow up in more than one social setting. What happens,ꯑꯉꯥꯡꯁꯤꯡꯅꯥ ꯁꯣꯁꯤꯑꯦꯜ ꯁꯦꯇꯤꯡ ꯑꯃꯗꯒꯤ ꯍꯦꯟꯅꯥ ꯍꯤꯡꯏ ꯑꯃꯁꯨꯡ ꯆꯥꯎꯈꯠꯂꯀꯏ꯫
"in the child’s family, school, neighbourhood, the peer group, and society","ꯑꯉꯥꯡ ꯑꯗꯨꯒꯤ ꯏꯃꯨꯡ-ꯃꯅꯨꯡ, ꯁ꯭ꯀꯨꯜ, ꯌꯨꯃꯊꯣꯡ, ꯄꯤꯌꯔ ꯒ꯭ꯔꯨꯞ ꯑꯃꯁꯨꯡ ꯁꯣꯁꯥꯏꯇꯤꯗꯥ"
at large is very crucial in defining the course and content of cognitive,ꯑꯦꯠ ꯂꯥꯔꯖ ꯑꯁꯤ ꯀꯣꯒꯅꯤꯇꯤꯕꯀꯤ ꯀꯣꯔꯁ ꯑꯃꯁꯨꯡ ꯀꯟꯇꯦꯟꯇ ꯗꯤꯐꯤꯅꯤꯁꯟ ꯇꯧꯕꯗꯥ ꯌꯥꯝꯅꯥ ꯃꯔꯨ ꯑꯣꯏ꯫
development,ꯆꯥꯎꯈꯠꯄ
What this means is that the social and cultural contexts in which the,ꯃꯁꯤꯅꯥ ꯇꯥꯀꯄꯗꯤ ꯁꯣꯁꯤꯑꯦꯜ ꯑꯃꯁꯨꯡ ꯀꯂꯆꯔꯦꯜ ꯀꯟꯇꯦꯛꯁꯁꯤꯡꯗꯥ ꯌꯥꯑꯣꯔꯤꯕꯥ ꯑꯁꯤ .
"child lives, and the people they live among markedly influence their","ꯑꯉꯥꯡꯁꯤꯡꯒꯤ ꯄꯨꯟꯁꯤ, ꯑꯃꯁꯨꯡ ꯃꯈꯣꯌꯅꯥ ꯍꯤꯡꯂꯤꯕꯥ ꯃꯤꯑꯣꯏꯁꯤꯡ ꯑꯁꯤꯅꯥ ꯃꯈꯣꯌꯒꯤ ꯃꯔꯛꯇꯥ ꯃꯁꯛ ꯊꯣꯛꯅꯥ ꯏꯊꯤꯜ ꯄꯤ꯫"
development,ꯆꯥꯎꯈꯠꯄ
"Bronfenbrenner’s ecological theory, details social systems, ranging from","ꯕ꯭ꯔꯣꯅꯐꯦꯅꯕ꯭ꯔꯦꯅꯔꯒꯤ ꯏꯀꯣꯂꯣꯖꯤꯀꯦꯜ ꯊꯤꯑꯣꯔꯤ, ꯁꯣꯁꯤꯑꯦꯜ ꯁꯤꯁ꯭ꯇꯦꯃꯁꯤꯡꯒꯤ ꯑꯀꯨꯞꯄꯥ ꯃꯔꯣꯂꯁꯤꯡ, ."
close interpersonal interactions to broad-based influences of culture that,ꯀꯂꯆꯔꯒꯤ ꯕ꯭ꯔꯣꯗ-ꯕꯦꯖ ꯏꯅꯐ꯭ꯂꯨꯑꯦꯟꯁꯁꯤꯡꯒꯥ ꯅꯛꯅꯕꯥ ꯏꯟꯇꯔꯄꯔꯁꯣꯅꯦꯜ ꯏꯟꯇꯔꯦꯛꯁꯅꯁꯤꯡ ꯑꯗꯨ .
define what is knowable and what behaviours are allowable within the,ꯈꯉꯕꯥ ꯉꯝꯕꯥ ꯑꯃꯁꯨꯡ ꯀꯔꯤ ꯂꯃꯆꯠ-ꯁꯥꯖꯠꯁꯤꯡ ꯑꯁꯤ ꯑꯌꯥꯕꯥ ꯄꯤꯕꯒꯦ ꯍꯥꯌꯕꯗꯨ ꯂꯦꯄꯊꯣꯀꯎ꯫
"child’s social setting (Bronfenbrenner, 2000). The ecological theory","ꯑꯉꯥꯡꯒꯤ ꯁꯣꯁꯤꯑꯦꯜ ꯁꯦꯇꯤꯡ (ꯕ꯭ꯔꯣꯅꯐꯦꯅꯕ꯭ꯔꯦꯅꯔ, 2000)꯫"
draws attention to the critical role social transmission plays in child,ꯑꯉꯥꯡ ꯑꯣꯏꯔꯤꯉꯩꯗꯥ ꯁꯣꯁꯤꯑꯦꯜ ꯇ꯭ꯔꯥꯟꯁꯃꯤꯁꯟꯅꯥ ꯂꯧꯔꯤꯕꯥ ꯃꯔꯨꯑꯣꯏꯕꯥ ꯊꯧꯗꯥꯡ ꯑꯗꯨꯗꯥ ꯄꯨꯛꯅꯤꯡ ꯆꯪꯏ
development,ꯆꯥꯎꯈꯠꯄ
"In considering family influence on cognitive development, one examines","ꯀꯣꯒꯅꯤꯇꯤꯕ ꯗꯤꯕꯦꯂꯄꯃꯦꯟꯇꯗꯥ ꯏꯃꯨꯡꯒꯤ ꯏꯅꯐ꯭ꯂꯨꯑꯦꯟꯁ ꯑꯗꯨ ꯈꯟꯅꯕꯗꯥ, ꯀꯅꯥꯒꯨꯝꯕꯥ ꯑꯃꯅꯥ ꯌꯦꯡꯁꯤꯜꯂꯤ"
the impact of the family psychodynamics: the presence for the child of,ꯏꯃꯨꯡꯒꯤ ꯁꯥꯏꯀꯣꯗꯥꯏꯅꯥꯃꯤꯀꯁꯤꯡꯒꯤ ꯏꯝꯄꯦꯛꯇ: ꯑꯉꯥꯡ ꯑꯗꯨꯒꯤꯗꯃꯛ ꯂꯩꯔꯤꯕꯥ ꯑꯁꯤ
one or both parents; the family size; family cohesion; poverty level of,ꯃꯃꯥ-ꯃꯄꯥ ꯑꯃꯅꯥ ꯅꯠꯠꯔꯒꯥ ꯑꯅꯤꯃꯛ;
family; language structure; religion; urban-rural location; family values,ꯏꯃꯨꯡ ꯃꯅꯨꯡ;
"and aspiration, and others. The question would be: how does the","ꯑꯃꯁꯨꯡ ꯑꯦꯁ꯭ꯄꯤꯔꯦꯁꯟ, ꯑꯃꯁꯨꯡ ꯑꯇꯩꯁꯤꯡ꯫"
interplay of these forces in the family system impact on the child’s,ꯐꯦꯃꯤꯂꯤ ꯁꯤꯁ꯭ꯇꯦꯃꯗꯥ ꯂꯩꯔꯤꯕꯥ ꯐꯣꯔꯁꯁꯤꯡ ꯑꯁꯤꯒꯤ ꯏꯟꯇꯔꯞꯂꯦꯌꯔꯅꯥ ꯑꯉꯥꯡ ꯑꯗꯨꯒꯤ ꯃꯊꯛꯇꯥ ꯄꯤꯔꯤꯕꯥ ꯁꯥꯐꯨ ꯑꯗꯨ .
cognitive development? The valence of the interaction will determine,ꯀꯣꯒꯅꯤꯇꯤꯕ ꯗꯤꯕꯦꯂꯄꯃꯦꯟꯇ?
the direction of influence,ꯏꯅꯐ꯭ꯂꯨꯑꯦꯟꯖꯥꯒꯤ ꯃꯥꯌꯀꯩ ꯑꯗꯨ .
PED121,ꯄꯤ.ꯏ.ꯗꯤ.꯱꯲꯱ ꯑꯃꯁꯨꯡ ꯑꯦꯟ.
MODULE 2,ꯃꯣꯗ꯭ꯌꯨꯜ ꯲.
65,꯶꯵ ꯑꯃꯁꯨꯡ ꯑꯦꯟ.
"Culture, in the ecological theory, defined  broadly in terms of ethnicity,","ꯀꯂꯆꯔ, ꯏꯀꯣꯂꯣꯖꯤꯀꯦꯜ ꯊꯤꯑꯣꯔꯤꯗꯥ, ꯏꯊꯅꯤꯛ ꯑꯣꯏꯕꯥ ꯃꯑꯣꯡꯗꯥ ꯄꯥꯛ ꯁꯟꯅꯥ ​​ꯋꯥꯍꯟꯊꯣꯛ ꯄꯤꯕꯥ,"
"values and customs. In Nigeria for example, some ethnic groups are",ꯚꯦꯜꯌꯨꯁꯤꯡ ꯑꯃꯁꯨꯡ ꯆꯠꯅꯕꯤꯁꯤꯡ꯫
battling with low enrolment of the girl child in schools; while some other,ꯁ꯭ꯀꯨꯂꯁꯤꯡꯗꯥ ꯅꯨꯄꯤꯃꯆꯥ ꯑꯉꯥꯡ ꯑꯗꯨꯒꯤ ꯑꯦꯅꯔꯣꯂꯃꯦꯟꯇ ꯂꯣꯒꯥ ꯂꯣꯌꯅꯅꯥ ꯂꯥꯟꯊꯦꯡꯅꯕꯥ;
ethnic groups are battling with low boy child enrolment in school. This,ꯏꯊꯅꯤꯛ ꯀꯥꯡꯂꯨꯄꯁꯤꯡꯅꯥ ꯁ꯭ꯀꯨꯂꯗꯥ ꯂꯣ ꯕꯣꯏ ꯆꯥꯏꯜꯗ ꯑꯦꯅꯔꯣꯂꯃꯦꯟꯇꯒꯥ ꯂꯥꯟꯊꯦꯡꯅꯔꯤ꯫
"reflects different values placed on gender role. Also, some ethnic groups",ꯖꯦꯟꯗꯔꯒꯤ ꯊꯧꯗꯥꯡꯗꯥ ꯊꯝꯂꯤꯕꯥ ꯇꯣꯉꯥꯟ ꯇꯣꯉꯥꯅꯕꯥ ꯚꯦꯜꯌꯨꯁꯤꯡ ꯑꯗꯨ ꯔꯤꯐ꯭ꯂꯦꯛꯇ ꯇꯧꯏ꯫
in Nigeria place more premiums on inordinate quest for material wealth;,ꯅꯥꯏꯖꯦꯔꯤꯌꯥꯗꯥ ꯃꯆꯥꯛ-ꯃꯊꯨꯃꯒꯤ ꯂꯟ-ꯊꯨꯃꯒꯤ ꯃꯇꯥꯡꯗꯥ ꯍꯦꯟꯅꯥ ꯄ꯭ꯔꯤꯃꯤꯌꯝ ꯊꯝꯕꯥ;
while some place more premiums on education. Still some ethnic groups,ꯑꯗꯨꯒꯥ ꯈꯔꯅꯥ ꯑꯦꯖꯨꯀꯦꯁꯅꯒꯤ ꯃꯇꯥꯡꯗꯥ ꯍꯦꯟꯅꯥ ꯄ꯭ꯔꯤꯃꯤꯌꯝ ꯊꯝꯂꯤ꯫
are laissez-faire about life generally. These are reflections of different,ꯑꯁꯤ ꯃꯍꯧꯁꯥꯅꯥ ꯄꯨꯟꯁꯤꯒꯤ ꯃꯔꯃꯗꯥ ꯂꯦꯁꯖ-ꯐꯦꯌꯔꯅꯤ꯫
"customs and worldview. Nevertheless, they affect what is transmitted",ꯆꯠꯅꯕꯤ ꯑꯃꯁꯨꯡ ꯃꯥꯂꯦꯃꯒꯤ ꯑꯣꯏꯕꯥ ꯋꯥꯈꯜꯂꯣꯟ꯫
socially and same impacts on child rearing practices. Child rearing,ꯑꯉꯥꯡ ꯄꯣꯀꯄꯒꯤ ꯊꯧꯑꯣꯡꯁꯤꯡꯗꯥ ꯁꯣꯁꯤꯑꯦꯜ ꯑꯃꯁꯨꯡ ꯆꯞ ꯃꯥꯟꯅꯕꯥ ꯏꯝꯄꯦꯛꯇꯁꯤꯡ꯫
practices influence cognitive development,ꯄ꯭ꯔꯦꯛꯇꯤꯁꯁꯤꯡꯅꯥ ꯀꯣꯒꯅꯤꯇꯤꯕ ꯗꯤꯕꯦꯂꯄꯃꯦꯟꯇꯗꯥ ꯁꯥꯐꯨ ꯄꯤꯔꯤ
A very important aspect of Bronfenbrenner’s ecological theory is what,ꯕ꯭ꯔꯣꯅꯐꯦꯅꯕ꯭ꯔꯦꯅꯔꯒꯤ ꯏꯀꯣꯂꯣꯖꯤꯀꯦꯜ ꯊꯤꯑꯣꯔꯤꯒꯤ ꯌꯥꯝꯅꯥ ꯃꯔꯨꯑꯣꯏꯕꯥ ꯃꯁꯛ ꯑꯃꯗꯤ ꯀꯔꯤꯅꯣ ꯍꯥꯌꯕꯁꯤꯅꯤ꯫
he called socio-historical conditions of children’s development,ꯃꯍꯥꯛꯅꯥ ꯑꯉꯥꯡꯁꯤꯡꯒꯤ ꯆꯥꯎꯈꯠꯄꯒꯤ ꯁꯣꯁꯤꯑꯣ-ꯍꯤꯁ꯭ꯇꯣꯔꯤꯀꯦꯜ ꯀꯟꯗꯤꯁꯅꯁꯤꯡ ꯍꯥꯌꯅꯥ ꯀꯧꯈꯤ
Children growing up in the present generation have some historical,ꯍꯧꯖꯤꯛꯀꯤ ꯃꯤꯔꯣꯂꯗꯥ ꯆꯥꯎꯈꯠꯂꯛꯂꯤꯕꯥ ꯑꯉꯥꯡꯁꯤꯡꯗꯥ ꯄꯨꯋꯥꯔꯤꯒꯤ ꯑꯣꯏꯕꯥ ꯋꯥꯐꯝ ꯈꯔꯥ ꯂꯩꯔꯤ ꯫
events peculiar to their own cohort. These include: increasing dual,ꯃꯈꯣꯌ ꯃꯁꯥꯒꯤ ꯀꯣꯍꯣꯔꯇꯀꯤ ꯃꯁꯛ ꯊꯣꯀꯄꯥ ꯊꯧꯗꯣꯀꯁꯤꯡ꯫
career marriage; and day-care for children; increasing poverty among,ꯀꯦꯔꯤꯌꯔ ꯂꯨꯍꯣꯡꯕꯥ;
families; increasing divorce and family disruption; decline in societal,ꯏꯃꯨꯡ ꯃꯅꯨꯡꯁꯤꯡ;
"values; information and communication technology, and globalisation",ꯚꯦꯜꯌꯨꯁꯤꯡ;
Children born ten years ago were not exposed to some of these influences,ꯆꯍꯤ ꯱꯰ꯒꯤ ꯃꯃꯥꯡꯗꯥ ꯄꯣꯀꯈꯤꯕꯥ ꯑꯉꯥꯡꯁꯤꯡ ꯑꯁꯤ ꯑꯁꯤꯒꯨꯝꯕꯥ ꯏꯅꯐ꯭ꯂꯨꯑꯦꯟꯖꯥ ꯈꯔꯗꯤ ꯊꯦꯡꯅꯈꯤꯗꯦ .
in their childhood and these impacts on cognitive development,ꯃꯈꯣꯌꯒꯤ ꯑꯉꯥꯡ ꯑꯣꯏꯔꯤꯉꯩꯒꯤ ꯃꯇꯃꯗꯥ ꯑꯃꯁꯨꯡ ꯀꯣꯒꯅꯤꯇꯤꯕ ꯗꯤꯕꯦꯂꯄꯃꯦꯟꯇꯗꯥ ꯄꯤꯔꯤꯕꯥ ꯁꯥꯐꯨꯁꯤꯡ ꯑꯁꯤꯅꯥ .
"Concisely, social transmission is a critical factor in determining not only","ꯊꯣꯏꯗꯣꯛ ꯍꯦꯟꯗꯣꯛꯅꯥ ꯍꯥꯌꯔꯕꯗꯥ, ꯁꯣꯁꯤꯑꯦꯜ ꯇ꯭ꯔꯥꯟꯁꯃꯤꯁꯟ ꯑꯁꯤ ꯁꯨꯞꯅꯒꯤ ꯂꯦꯄꯊꯣꯀꯄꯗꯥ ꯃꯔꯨꯑꯣꯏꯕꯥ ꯐꯦꯛꯇꯔ ꯑꯃꯅꯤ"
the content but also the course of cognitive development. We should,ꯀꯟꯇꯦꯟꯇ ꯑꯗꯨꯕꯨ ꯀꯣꯒꯅꯤꯇꯤꯕ ꯗꯤꯕꯦꯂꯄꯃꯦꯟꯇꯀꯤ ꯀꯣꯔꯁꯁꯨ ꯌꯥꯑꯣꯔꯤ꯫
look at a child’s cognitive development as affected by several socio-,ꯑꯉꯥꯡ ꯑꯃꯒꯤ ꯀꯣꯒꯅꯤꯇꯤꯚ ꯗꯤꯚꯦꯂꯄꯃꯦꯟꯇ ꯑꯗꯨ ꯁꯣꯁꯤꯑꯣ-ꯅꯥ ꯁꯣꯀꯍꯜꯂꯕꯥ ꯃꯑꯣꯡꯗꯥ ꯌꯦꯡꯎ꯫
cultural factors,ꯀꯂꯆꯔꯦꯜ ꯐꯦꯛꯇꯔꯁꯤꯡ .
2.3.6   Educational Implications,꯲.꯳.꯶ ꯑꯦꯖꯨꯀꯦꯁꯅꯦꯜ ꯏꯝꯞꯂꯤꯀꯦꯁꯅꯁꯤꯡ .
"From our discussions, so far, it is obvious that cognitive development is","ꯑꯩꯈꯣꯌꯒꯤ ꯈꯟꯅ-ꯅꯩꯅꯕꯁꯤꯡꯗꯒꯤ, ꯍꯧꯖꯤꯛ ꯐꯥꯑꯣꯕꯗꯥ, ꯃꯁꯤ ꯃꯌꯦꯛ ꯁꯦꯡꯏ ꯃꯗꯨꯗꯤ ꯀꯣꯒꯅꯤꯇꯤꯕ ꯗꯤꯕꯦꯂꯄꯃꯦꯟꯇ ꯑꯁꯤ ."
a very important aspect of human development. The amazing capacity,ꯃꯤꯑꯣꯏꯕꯒꯤ ꯆꯥꯎꯈꯠꯄꯒꯤ ꯌꯥꯝꯅꯥ ꯃꯔꯨꯑꯣꯏꯕꯥ ꯃꯁꯛ ꯑꯃꯥ꯫
