en,mni-Mtei
"of giving. If you act needy, people will see you as a",ꯄꯤꯕꯥ꯫
taker-and it is very hard to give to a taker. But if you,ꯇꯦꯀꯔ-ꯑꯗꯨꯒꯥ ꯇꯦꯀꯔ ꯑꯃꯗꯥ ꯄꯤꯕꯥ ꯑꯁꯤ ꯌꯥꯝꯅꯥ ꯂꯨꯏ꯫
"act needful, people will see you as reaching out for what","ꯃꯊꯧ ꯇꯥꯕꯥ ꯊꯕꯛ ꯇꯧꯕꯥ, ꯃꯤꯌꯥꯝꯅꯥ ꯅꯍꯥꯀꯄꯨ ꯀꯔꯤꯒꯤꯗꯃꯛꯇꯥ ꯌꯧꯕꯥ ꯉꯃꯒꯅꯤ ꯍꯥꯌꯅꯥ ꯎꯒꯅꯤ"
"you deserve rather than grabbing. In all likelihood, they",ꯑꯗꯣꯝꯅꯥ ꯒ꯭ꯔꯦꯕ ꯇꯧꯕꯒꯤ ꯃꯍꯨꯠꯇꯥ ꯐꯪꯐꯝ ꯊꯣꯀꯏ꯫
will give you what you need,ꯑꯗꯣꯝꯅꯥ ꯃꯊꯧ ꯇꯥꯔꯤꯕꯥ ꯑꯗꯨ ꯄꯤꯒꯅꯤ .
USABI'E INSIGHT',usabi'e ꯏꯅꯁꯥꯏꯠ'꯫
Being needy begets nesentment. Being unneedy,ꯃꯊꯧ ꯇꯥꯕꯥ ꯑꯣꯏꯕꯅꯥ ꯅꯦꯁꯦꯟꯇꯦꯁꯟ ꯄꯣꯀꯍꯜꯂꯤ꯫
begets frustration. Being needful begets help,ꯐ꯭ꯔꯁ꯭ꯇꯦꯁꯟ ꯄꯣꯀꯍꯜꯂꯤ꯫
Terunc AcroN,ꯇꯦꯔꯨꯅꯛ ꯑꯦꯛꯔꯣꯟ ꯴.
"Realize ttrat if you're too demanding, people may",ꯔꯤꯑꯦꯂꯥꯏꯖ ꯇꯧꯕꯥ ꯇꯤ.ꯇꯤ.ꯑꯥꯔ.ꯑꯦ.ꯇꯤ.
"initially give you what you want, but ttrey'll soon start","ꯑꯍꯥꯅꯕꯗꯥ ꯅꯍꯥꯛꯅꯥ ꯄꯥꯝꯂꯤꯕꯗꯨ ꯄꯤꯌꯨ, ꯑꯗꯨꯕꯨ ttray ꯑꯁꯤ ꯑꯊꯨꯕꯥ ꯃꯇꯃꯗꯥ ꯍꯧꯔꯒꯅꯤ"
to resent you,ꯑꯗꯣꯃꯕꯨ ꯅꯨꯡꯉꯥꯏꯇꯕꯥ ꯐꯥꯑꯣꯍꯟꯅꯕꯥ .
"Realize that if you act unneedy, you make it impos-",ꯀꯔꯤꯒꯨꯝꯕꯥ ꯅꯍꯥꯛꯅꯥ ꯃꯊꯧ ꯇꯥꯗꯕꯥ ꯊꯕꯛ ꯇꯧꯔꯕꯗꯤ ꯅꯍꯥꯛꯅꯥ ꯃꯗꯨ ꯑꯣꯏꯍꯜꯂꯤ ꯍꯥꯌꯅꯥ ꯈꯪꯖꯤꯅꯕꯤꯌꯨ-
"sible for people to give to you, and they will feel frus-","ꯃꯤꯁꯤꯡꯅꯥ ꯅꯉꯣꯟꯗꯥ ꯄꯤꯕꯤꯅꯕꯥ ꯁꯤꯕꯜ, ꯑꯃꯁꯨꯡ ꯃꯈꯣꯌꯅꯥ ꯐ꯭ꯔꯁ-"
trated,ꯇ꯭ꯔꯦꯇꯦꯗ ꯑꯣꯏꯕꯥ꯫
"Learn to express clearly what you need from others,","ꯑꯇꯣꯞꯄꯗꯒꯤ ꯅꯍꯥꯛꯅꯥ ꯃꯊꯧ ꯇꯥꯔꯤꯕꯥ ꯑꯗꯨ ꯃꯌꯦꯛ ꯁꯦꯡꯅꯥ ꯐꯣꯡꯗꯣꯀꯄꯥ ꯇꯃꯁꯤꯜꯂꯨ,"
and don't make it sound like a demand,ꯑꯃꯁꯨꯡ ꯃꯁꯤ ꯗꯤꯃꯥꯟꯗ ꯑꯃꯒꯨꯝꯅꯥ ꯁꯣꯟꯊꯍꯜꯂꯣꯏꯗꯕꯅꯤ .
te4 l,ꯇꯤ.ꯏ.꯴ ꯑꯦꯜ.
and that it's okay for them to need you,ꯑꯃꯁꯨꯡ ꯃꯈꯣꯌꯅꯥ ꯑꯗꯣꯃꯒꯤ ꯃꯊꯧ ꯇꯥꯕꯥ ꯑꯁꯤ ꯑꯐꯕꯥ ꯑꯃꯅꯤ ꯍꯥꯌꯕꯥ .
ciation,ꯁꯤꯌꯦꯁꯟ ꯇꯧꯕꯥ
upset or holding a gnrdge,ꯖꯤ.ꯑꯦꯟ.ꯑꯥꯔ.ꯗꯤ.ꯖꯤ.ꯏ.
Ies],ꯑꯥꯏ.ꯏ.ꯑꯦꯁ.
Having Unrealistic ExPectations,ꯑꯅꯔꯤꯑꯦꯂꯤꯁ꯭ꯇꯤꯛ ꯑꯦꯛꯁꯄꯦꯛꯇꯦꯁꯟ ꯂꯩꯕꯥ .
"""Oft expectation Jails, and most oft there","""ꯑꯣꯐ ꯑꯦꯛꯁꯄꯦꯛꯇꯦꯁꯟ ꯖꯦꯂꯁꯤꯡ, ꯑꯃꯁꯨꯡ ꯑꯌꯥꯝꯕꯥ ꯃꯇꯃꯗꯥ ꯃꯐꯝ ꯑꯗꯨꯗꯥ ."
"Where most it promises.""",ꯃꯐꯝ ꯑꯗꯨꯗꯥ ꯑꯌꯥꯝꯕꯅꯥ ꯋꯥꯁꯀꯄꯤꯔꯤ꯫”
:SHAKESPF.4RE,:ꯁꯦꯀꯦꯁꯞꯐ.꯴ꯔꯦ
Maxine came to me for help with what seemed to be a,ꯃꯦꯛꯁꯤꯃꯝ ꯑꯁꯤ ꯑꯩꯉꯣꯟꯗꯥ ꯃꯇꯦꯡ ꯄꯥꯡꯅꯕꯥ ꯂꯥꯀꯈꯤꯕꯥ ꯑꯗꯨꯒꯨꯝꯂꯕꯥ ꯋꯥꯐꯝ ꯑꯃꯥ ꯑꯣꯏꯅꯥ ꯎꯕꯥ ꯐꯪꯈꯤ꯫
reasonable goal: to get back together with her ex-,ꯃꯔꯝ ꯆꯥꯕꯥ ꯄꯥꯟꯗꯝ: ꯃꯍꯥꯛꯀꯤ ꯑꯦꯛꯁ-
husband. She mentioned several perfectly good reasons,ꯃꯄꯨꯔꯣꯏꯕ.
why the marriage would work like a dream this time,ꯂꯨꯍꯣꯡꯕꯥ ꯑꯁꯤꯅꯥ ꯀꯔꯤꯒꯤꯗꯃꯛ ꯍꯟꯗꯛꯀꯤ ꯃꯇꯝ ꯑꯁꯤꯗꯥ ꯃꯪꯂꯥꯟ ꯑꯃꯒꯨꯝ ꯊꯕꯛ ꯇꯧꯒꯅꯤ .
"around, even though the first attempt had been a night-","ꯑꯀꯣꯌꯕꯗꯥ, ꯑꯍꯥꯅꯕꯥ ꯍꯣꯠꯅꯕꯥ ꯑꯗꯨ ꯅꯨꯃꯤꯠ ꯑꯃꯥ ꯑꯣꯏꯔꯕꯁꯨ-"
mare. She knew what had gone wrong and exactly what,ꯃꯥꯔꯦ ꯍꯥꯌꯅꯥ ꯈꯉꯅꯕꯥ꯫
she and her ex-husband had to do to fix the relationship,ꯃꯍꯥꯛ ꯑꯃꯁꯨꯡ ꯃꯍꯥꯛꯀꯤ ꯑꯦꯛꯁ-ꯃꯄꯨꯔꯣꯏꯕꯥ ꯑꯁꯤꯅꯥ ꯃꯔꯤ ꯑꯁꯤ ꯁꯦꯃꯗꯣꯛꯅꯕꯥ ꯇꯧꯒꯗꯕꯥ ꯊꯕꯛ ꯑꯃꯥ ꯇꯧꯈꯤ
"Having personally helped many ex-spouses to recouple,","ꯃꯁꯥꯅꯥ ꯃꯁꯥꯕꯨ ꯑꯦꯛꯁ-ꯁ꯭ꯄꯣꯎꯖ ꯀꯌꯥꯗꯥ ꯃꯇꯦꯡ ꯄꯥꯡꯈꯤꯕꯥ, ꯌꯨ.ꯑꯦꯁ."
I thought she was approaching the reconciliation sensi-,ꯑꯩꯍꯥꯛꯅꯥ ꯈꯜꯂꯃꯈꯤ ꯃꯗꯨꯗꯤ ꯃꯍꯥꯛꯅꯥ ꯔꯤꯀꯣꯟꯁꯤꯂꯤꯌꯦꯁꯟ ꯁꯦꯟꯁꯤ-
bly. It was only when I asked about her ex-husband's,ꯕ꯭ꯂꯥꯏ ꯇꯧꯕꯥ꯫
attitude that I realized how deluded she was. Her former,ꯑꯦꯇꯤꯆꯨꯗ ꯑꯗꯨ ꯑꯩꯍꯥꯛꯅꯥ ꯈꯉꯂꯀꯈꯤ ꯃꯗꯨꯗꯤ ꯃꯍꯥꯛ ꯀꯌꯥ ꯌꯥꯝꯅꯥ ꯂꯥꯡꯇꯛꯅꯈꯤꯕꯒꯦ ꯍꯥꯌꯕꯗꯨ꯫
spouse had already remarried and fathered npo children,ꯅꯨꯄꯥ ꯅꯠꯠꯔꯒꯥ ꯅꯨꯄꯤꯅꯥ ꯍꯥꯟꯅꯅꯥ ꯑꯃꯨꯛ ꯍꯟꯅꯥ ꯂꯨꯍꯣꯡꯈ꯭ꯔꯦ ꯑꯃꯁꯨꯡ ꯑꯦꯟ.ꯄꯤ.ꯑꯣ.
Maxine had turned something she wanted into,ꯃꯦꯛꯁꯤꯅꯥ ꯃꯍꯥꯛꯅꯥ ꯄꯥꯃꯖꯕꯥ ꯄꯣꯠꯁꯛ ꯑꯃꯥ ꯑꯣꯟꯊꯣꯀꯈꯤ .
"something she absolutely had to have, and then held onto","ꯃꯍꯥꯛꯅꯥ ꯃꯄꯨꯡ ꯐꯥꯅꯥ ꯂꯩꯒꯗꯕꯥ ꯋꯥꯐꯝ ꯑꯃꯥ, ꯑꯃꯁꯨꯡ ꯃꯗꯨꯒꯤ ꯃꯇꯨꯡꯗꯥ ꯊꯃꯈꯤꯕꯥ ꯋꯥꯐꯝ ꯑꯃꯥ ."
that attitude even after her goal had turned into a pipe,ꯃꯍꯥꯛꯀꯤ ꯄꯥꯟꯗꯝ ꯑꯗꯨ ꯄꯥꯏꯞ ꯑꯣꯏꯅꯥ ꯑꯣꯟꯊꯣꯛꯂꯕꯥ ꯃꯇꯨꯡꯗꯁꯨ ꯃꯗꯨꯒꯤ ꯋꯥꯈꯜꯂꯣꯟ ꯑꯗꯨ .
"dream. She not only set herself up to be devastated, she",ꯃꯪ.
allowed her fantasy to consume time and energy that,ꯃꯍꯥꯛꯀꯤ ꯐꯦꯟꯁꯤꯇꯤ ꯑꯁꯤ ꯃꯇꯝ ꯑꯃꯁꯨꯡ ꯏꯅꯔꯖꯤ ꯀꯟꯖꯨꯝ ꯇꯧꯕꯥ ꯌꯥꯍꯅꯈꯤ ꯃꯗꯨꯗꯤ .
might have been used to improve her life or develop a,ꯃꯍꯥꯛꯀꯤ ꯄꯨꯟꯁꯤ ꯐꯒꯠꯍꯟꯅꯕꯥ ꯅꯠꯠꯔꯒꯥ ꯑꯃꯥ ꯁꯦꯃꯒꯠꯅꯕꯥ ꯁꯤꯖꯤꯟꯅꯔꯝꯕꯥ ꯌꯥꯏ꯫
recl relationship,RECLꯒꯤ ꯃꯔꯤ ꯂꯩꯅꯕꯥ
Ie6),ꯑꯥꯏ.ꯏ.꯶) ꯑꯃꯁꯨꯡ ꯑꯦꯝ.
HAVING TINREALISTIC EXPECTATIONS,ꯇꯤꯅꯔꯤꯑꯦꯂꯤꯁ꯭ꯇꯤꯛ ꯑꯦꯛꯁꯄꯦꯛꯇꯦꯁꯟ ꯂꯩꯕꯥ .
"In my experience, most of our expectittions are fair",ꯑꯩꯒꯤ ꯑꯦꯛꯁꯄꯔꯤꯌꯦꯟꯁꯇꯥ ꯑꯩꯈꯣꯌꯒꯤ ꯑꯦꯛꯁꯄꯦꯛꯇꯦꯁꯟ ꯑꯌꯥꯝꯕꯗꯤ ꯐꯩ .
"and reasonable. However, *rey are not always realistic. It",ꯑꯃꯁꯨꯡ ꯃꯔꯝ ꯆꯥꯕꯥ꯫
"is reasonable to start a new career at midlife, but it is not","ꯑꯁꯤ ꯃꯤꯗꯂꯥꯏꯐꯇꯥ ꯑꯅꯧꯕꯥ ꯀꯦꯔꯤꯌꯔ ꯑꯃꯥ ꯍꯧꯕꯥ ꯑꯁꯤ ꯃꯔꯝ ꯆꯥꯕꯥ ꯑꯣꯏ, ꯑꯗꯨꯕꯨ ꯃꯁꯤ ."
realistic to expect it to be easy or result in immediate,ꯔꯤꯑꯦꯂꯤꯁ꯭ꯇꯤꯛ ꯑꯣꯏꯕꯥ ꯑꯁꯤ ꯐꯖꯅꯥ ꯑꯣꯏꯒꯅꯤ ꯍꯥꯌꯅꯥ ꯊꯥꯖꯕꯥ ꯊꯝꯕꯥ ꯅꯠꯔꯒꯥ ꯈꯨꯗꯛꯀꯤ ꯑꯣꯏꯕꯥ ꯐꯜ ꯂꯩꯕꯥ .
success. It is reasonable to expect a friend to understand,ꯃꯥꯏ ꯄꯥꯛꯄ.
"your feelings, but it might not be realistic if he or she is","ꯅꯍꯥꯛꯀꯤ ꯋꯥꯈꯜ ꯑꯗꯨ, ꯑꯗꯨꯕꯨ ꯀꯔꯤꯒꯨꯝꯕꯥ ꯃꯍꯥꯛꯅꯥ ꯑꯣꯏꯔꯕꯗꯤ ꯃꯗꯨ ꯔꯤꯑꯦꯂꯤꯁ꯭ꯇꯤꯛ ꯑꯣꯏꯗꯕꯥ ꯌꯥꯏ ."
"a very analytic, solution-oriented person","ꯌꯥꯝꯅꯥ ꯑꯦꯅꯥꯂꯥꯏꯇꯤꯛ ꯑꯣꯏꯕꯥ, ꯁꯣꯂꯨꯁꯟ-ꯑꯣꯔꯤꯑꯦꯟꯇꯦꯗ ꯑꯣꯏꯕꯥ ꯃꯤꯑꯣꯏ ꯑꯃꯥ"
People who habitually choose unrealistic goals allow,ꯑꯅꯔꯤꯑꯦꯂꯤꯁ꯭ꯇꯤꯛ ꯑꯣꯏꯕꯥ ꯄꯥꯟꯗꯃꯁꯤꯡ ꯍꯦꯕꯤꯇꯦꯜ ꯑꯣꯏꯅꯥ ꯈꯅꯕꯥ ꯃꯤꯑꯣꯏꯁꯤꯡꯅꯥ ꯑꯌꯥꯕꯥ ꯄꯤꯔꯤ
wishful thinking to override their grip on common sense,ꯀꯝꯃꯟ ꯁꯦꯟꯁꯇꯥ ꯃꯈꯣꯌꯒꯤ ꯒ꯭ꯔꯤꯞ ꯑꯗꯨ ꯑꯣꯚꯔꯔꯥꯏꯗ ꯇꯧꯅꯕꯥ ꯋꯥꯁꯛ ꯂꯧꯕꯒꯤ ꯋꯥꯈꯜꯂꯣꯟ
"In their minds, if they want something, it must be feasible","ꯃꯈꯣꯌꯒꯤ ꯋꯥꯈꯂꯗꯥ, ꯀꯔꯤꯒꯨꯝꯕꯥ ꯃꯈꯣꯌꯅꯥ ꯀꯔꯤꯒꯨꯝꯕꯥ ꯈꯔꯥ ꯄꯥꯝꯂꯕꯗꯤ ꯃꯗꯨ ꯑꯣꯏꯊꯣꯀꯄꯥ ꯌꯥꯕꯥ ꯑꯣꯏꯒꯗꯕꯅꯤ ."
"to attain it. They like to gamble on big payoffs, but they",ꯃꯁꯤ ꯐꯪꯅꯕꯥ꯫
'need a Las Vegas bookmaker to help them calculate the,‘ꯃꯊꯧ ꯇꯥꯕꯥ ꯂꯥꯁ ꯚꯦꯒꯥꯁ ꯕꯨꯀꯃꯦꯀꯔ ꯑꯃꯥ ꯃꯊꯧ ꯇꯥꯏ ꯃꯈꯣꯌꯅꯥ ꯂꯦꯄꯊꯣꯀꯄꯗꯥ ꯃꯇꯦꯡ ꯄꯥꯡꯒꯅꯤ꯫
odds. They don't assess realistically whether they have,ꯇꯣꯉꯥꯟꯕꯁꯤꯡ.
"the talent, resources and sawy to realize their dreams,","ꯃꯈꯣꯌꯒꯤ ꯃꯪꯂꯥꯅꯁꯤꯡ ꯑꯗꯨ ꯃꯪꯐꯥꯑꯣꯅꯍꯟꯅꯕꯥ ꯇꯦꯂꯦꯟꯇ, ꯔꯤꯁꯣꯔꯁꯁꯤꯡ ꯑꯃꯁꯨꯡ ꯁꯥꯋꯤ,"
and whether conditions are favorable. To make matters,ꯑꯃꯁꯨꯡ ꯀꯟꯗꯤꯁꯅꯁꯤꯡ ꯑꯁꯤ ꯃꯇꯦꯡ ꯄꯥꯡꯕꯔꯥ ꯍꯥꯌꯕꯗꯨ ꯌꯦꯡꯁꯤꯅꯒꯅꯤ꯫
"worse, they are usually so sure of their prospects that they","ꯃꯁꯤꯗꯒꯤ ꯍꯦꯟꯅꯥ ꯐꯠꯇꯕꯥ, ꯃꯈꯣꯌꯅꯥ ꯃꯍꯧꯁꯥꯅꯥ ꯃꯈꯣꯌꯒꯤ ꯄ꯭ꯔꯣꯁ꯭ꯄꯦꯛꯇꯁꯤꯡ ꯑꯗꯨ ꯑꯁꯨꯛ ꯌꯥꯝꯅꯥ ꯊꯥꯖꯩ ꯃꯗꯨꯗꯤ ꯃꯈꯣꯌꯅꯥ ."
fail to set up contingency plans or prepare themselves,ꯀꯟꯇꯤꯟꯖꯦꯟꯁꯤ ꯄ꯭ꯂꯥꯅꯁꯤꯡ ꯁꯦꯝꯕꯥ ꯅꯠꯠꯔꯒꯥ ꯃꯈꯣꯌ ꯃꯁꯥꯕꯨ ꯁꯦꯝ ꯁꯥꯕꯥ ꯉꯃꯗꯕꯥ .
"emotionally for defeat. As a result, they don't merely have",ꯏꯃꯣꯁꯅꯦꯜ ꯑꯣꯏꯅꯥ ꯃꯥꯏꯊꯤꯕꯥ ꯄꯤꯅꯕꯒꯤꯗꯃꯛ꯫
"setbacks, they fall back all the way to square one, and","ꯁꯦꯇꯕꯦꯀꯁꯤꯡ, ꯃꯈꯣꯌꯅꯥ ꯁ꯭ꯛꯕ꯭ꯌꯥꯔ ꯋꯥꯟ ꯐꯥꯑꯣꯕꯥ ꯆꯠꯂꯤ, ꯑꯃꯁꯨꯡ ."
sometimes even further. And each loss increases the need,ꯀꯔꯤꯒꯨꯝꯕꯥ ꯃꯇꯃꯗꯥ ꯃꯁꯤꯗꯒꯤꯁꯨ ꯍꯦꯟꯅꯥ꯫
"for quick vindication, which makes longshots even more","ꯀꯨꯏꯛ ꯚꯤꯟꯗꯤꯀꯦꯁꯅꯒꯤꯗꯃꯛ, ꯃꯁꯤꯅꯥ ꯂꯣꯡꯁꯣꯠꯁꯤꯡ ꯍꯦꯟꯅꯥ ꯍꯦꯅꯒꯠꯍꯜꯂꯤ"
attractive,ꯄꯨꯛꯅꯤꯡ ꯆꯤꯡꯁꯤꯟꯕ
'Attachment is the great fabricator of ilhsions;,‘ꯑꯦꯇꯥꯆꯃꯦꯟꯇ ꯑꯁꯤ ꯏꯂꯍꯁꯤꯡꯒꯤ ꯑꯆꯧꯕꯥ ꯐꯦꯕ꯭ꯔꯤꯀꯦꯁꯟꯅꯤ;
reality can be attained only bjt somnne,ꯔꯤꯑꯦꯂꯤꯇꯤ ꯑꯁꯤ ꯕꯤꯖꯦꯠ ꯁꯣꯃꯟ ꯈꯛꯇꯗꯥ ꯐꯪꯒꯅꯤ
"who is detached.""","ꯀꯅꯥꯅꯥ ꯗꯤꯇꯆ ꯇꯧꯔꯤ꯫"""
_SIMONE IVEIL,_ꯁꯤꯃꯣꯟ ꯏꯚꯦꯏꯜ
"Of course, it's fine to be a big thinker if you're also","ꯇꯁꯦꯡꯕꯗꯤ, ꯀꯔꯤꯒꯨꯝꯕꯥ ꯅꯍꯥꯛꯅꯥ ꯃꯗꯨꯁꯨ ꯑꯣꯏꯔꯕꯗꯤ ꯑꯆꯧꯕꯥ ꯋꯥꯈꯜ ꯈꯅꯕꯥ ꯑꯃꯥ ꯑꯣꯏꯕꯥ ꯑꯁꯤ ꯐꯩ ."
a big doer. Real doers and visionaries are different from,ꯑꯆꯧꯕꯥ ꯗꯣꯌꯔ ꯑꯃꯥ꯫
unrealistic dreamers in these respects: they take pleasure,ꯍꯥꯌꯔꯤꯕꯥ ꯋꯥꯐꯃꯁꯤꯡ ꯑꯁꯤꯗꯥ ꯑꯅꯔꯤꯑꯦꯂꯤꯁ꯭ꯇꯤꯛ ꯗ꯭ꯔꯤꯃꯔꯁꯤꯡ: ꯃꯈꯣꯌꯅꯥ ꯅꯨꯡꯉꯥꯏꯕꯥ ꯂꯧꯏ
"in the sheer pursuit of their goals, not just the outcome;","ꯃꯈꯣꯌꯒꯤ ꯄꯥꯟꯗꯃꯁꯤꯡꯒꯤ ꯁꯦꯌꯥꯔ ꯄꯔꯁꯨꯏꯠ ꯑꯗꯨꯗꯥ, ꯃꯗꯨꯒꯤ ꯃꯍꯩ ꯑꯗꯨ ꯈꯛꯇꯥ ꯅꯠꯇꯅꯥ;"
Ie7 ),ꯑꯥꯏ.ꯏ.꯷ ) ꯑꯃꯁꯨꯡ ꯑꯦꯟ.
GET OUT OF YOUR OITN WAY,ꯑꯗꯣꯃꯒꯤ oitn way ꯗꯒꯤ ꯊꯣꯛꯂꯛꯇꯨꯅꯥ .
they know that if they fall on their faces they can pick,ꯃꯈꯣꯌꯅꯥ ꯈꯉꯏ ꯃꯗꯨꯗꯤ ꯀꯔꯤꯒꯨꯝꯕꯥ ꯃꯈꯣꯌꯅꯥ ꯃꯈꯣꯌꯒꯤ ꯃꯥꯌꯊꯣꯡꯗꯥ ꯁꯣꯛꯂꯕꯗꯤ ꯃꯈꯣꯌꯅꯥ ꯂꯧꯕꯥ ꯌꯥꯏ .
themselves up and be okay; they know the odds and are,ꯃꯈꯣꯌ ꯃꯁꯥꯅꯥ ꯑꯞ ꯑꯃꯁꯨꯡ ꯑꯣꯀꯦ ꯑꯣꯏꯌꯨ;
prepared for possible defeat. One hugely successful en-,ꯑꯣꯏꯊꯣꯀꯄꯥ ꯌꯥꯕꯥ ꯃꯥꯏꯊꯤꯕꯥ ꯄꯤꯅꯕꯒꯤꯗꯃꯛ ꯁꯦꯝ ꯁꯥꯈꯤ꯫
trepreneur I know has turned many a long shot into a,ꯇ꯭ꯔꯦꯞꯔꯦꯅꯔꯅꯥ ꯑꯩꯅꯥ ꯈꯉꯂꯤꯕꯥ ꯂꯝꯕꯤ ꯀꯌꯥ ꯑꯃꯥ ꯑꯣꯟꯊꯣꯀꯈ꯭ꯔꯦ꯫
"victory. He takes on risky projects all the time, buthe has",ꯃꯥꯏꯄꯥꯀꯄꯥ꯫
no illusions about their potential and prepares himself,ꯃꯈꯣꯌꯒꯤ ꯄꯣꯇꯦꯟꯁꯤꯌꯦꯂꯒꯤ ꯃꯇꯥꯡꯗꯥ ꯏꯜꯌꯨꯁꯟ ꯑꯃꯠꯇꯥ ꯂꯩꯇꯦ ꯑꯃꯁꯨꯡ ꯃꯁꯥꯃꯀꯄꯨ ꯁꯦꯝ ꯁꯥꯗꯨꯅꯥ ꯂꯩꯔꯤ
financially and emotionally to not be devastated if he,ꯁꯦꯜ-ꯊꯨꯃꯒꯤ ꯑꯣꯏꯅꯥ ꯑꯃꯁꯨꯡ ꯏꯃꯣꯁꯅꯦꯜ ꯑꯣꯏꯅꯥ ꯀꯔꯤꯒꯨꯝꯕꯥ ꯃꯍꯥꯛꯅꯥ .
should fail,ꯁꯣꯏꯗꯅꯥ ꯁꯣꯏꯗꯅꯥ ꯁꯣꯏꯗꯅꯥ ꯁꯣꯏꯗꯅꯥ ꯁꯣꯏꯗꯅꯥ ꯁꯣꯏꯗꯅꯥ ꯁꯣꯏꯗꯅꯥ ꯁꯣꯏꯗꯅꯥ ꯁꯣꯏꯗꯅꯥ ꯁꯣꯏꯗꯅꯥ .
"If you are going to take on long shots, it is not only","ꯀꯔꯤꯒꯨꯝꯕꯥ ꯅꯍꯥꯛꯅꯥ ꯂꯣꯡ ꯁꯣꯠꯊꯔꯀꯄꯥ ꯑꯣꯏꯔꯕꯗꯤ, ꯃꯁꯤ ꯈꯛꯇꯃꯛ ꯅꯠꯇꯦ꯫"
vital to have the wherewithal to achieve them but to make,ꯃꯈꯣꯌꯁꯤꯡ ꯑꯁꯤ ꯐꯪꯅꯕꯒꯤꯗꯃꯛ ꯑꯗꯨꯕꯨ ꯁꯦꯝꯅꯕꯥ ꯋꯥꯐꯝ ꯑꯁꯤ ꯊꯝꯅꯕꯥ ꯃꯔꯨ ꯑꯣꯏꯕꯥ [...]
snre you can handle failure. If you want to have,snre ꯅꯍꯥꯛꯅꯥ ꯐꯦꯜ ꯑꯣꯏꯕꯥ ꯍꯦꯟꯗꯜ ꯇꯧꯕꯥ ꯌꯥꯏ꯫
"something and you don't get it, you'll be disappointed. If","ꯀꯔꯤꯒꯨꯝꯕꯥ ꯈꯔꯥ ꯑꯃꯁꯨꯡ ꯅꯍꯥꯛꯅꯥ ꯐꯪꯗꯦ, ꯅꯍꯥꯛꯅꯥ ꯅꯨꯡꯉꯥꯏꯇꯕꯥ ꯐꯥꯑꯣꯒꯅꯤ꯫"
"you need to have it and you don't get it, you'll be de-","ꯅꯍꯥꯛꯅꯥ ꯃꯁꯤ ꯂꯩꯕꯥ ꯃꯊꯧ ꯇꯥꯏ ꯑꯃꯁꯨꯡ ꯅꯍꯥꯛꯅꯥ ꯐꯪꯗꯦ, ꯅꯍꯥꯛꯅꯥ ꯗꯤ-"
"pressed. lf you just gottahave it and you don't get it, you'll",ꯄ꯭ꯔꯦꯁ ꯇꯧꯔꯕꯥ꯫
be devastated,ꯃꯥꯡꯍꯟ ꯇꯥꯀꯍꯅꯕꯥ ꯌꯥꯕꯥ .
I encourage my patients to appraise how realistic,ꯑꯩꯍꯥꯛꯅꯥ ꯑꯩꯍꯥꯛꯀꯤ ꯑꯅꯥꯕꯁꯤꯡꯗꯥ ꯃꯇꯧ ꯀꯔꯝꯅꯥ ꯔꯤꯑꯦꯂꯤꯁ꯭ꯇꯤꯛ ꯑꯣꯏꯕꯥ .
their goals are and to set their expectations appropriately,ꯃꯈꯣꯌꯒꯤ ꯄꯥꯟꯗꯃꯁꯤꯡꯗꯤ ꯑꯃꯁꯨꯡ ꯃꯈꯣꯌꯒꯤ ꯑꯦꯁ꯭ꯄꯤꯔꯦꯁꯅꯁꯤꯡ ꯑꯗꯨ ꯃꯇꯤꯛ ꯆꯥꯅꯥ ꯂꯦꯄꯊꯣꯛꯅꯕꯥ .
"If your goal is unrealistic, don't go after it with a ""gofia","ꯀꯔꯤꯒꯨꯝꯕꯥ ꯅꯍꯥꯛꯀꯤ ꯄꯥꯟꯗꯝ ꯑꯗꯨ ꯑꯅꯔꯤꯑꯦꯂꯤꯁ꯭ꯇꯤꯛ ꯑꯣꯏꯔꯕꯗꯤ, ꯃꯗꯨꯒꯤ ꯃꯇꯨꯡꯗꯥ ""ꯒꯣꯐꯤꯌꯥ ."
"have it"" attitude. It's far safer to lean toward needing it","have it"" attitude. ꯃꯁꯤ ꯃꯊꯧ ꯇꯥꯕꯒꯤ ꯃꯥꯌꯀꯩꯗꯥ ꯂꯦꯞꯄꯥ ꯑꯁꯤ ꯌꯥꯝꯅꯥ ꯍꯦꯟꯅꯥ ꯁꯥꯐꯕꯅꯤ꯫"
or wanting it. This is especially true in relationships. As,ꯅꯠꯔꯒꯥ ꯄꯥꯃꯖꯕꯥ꯫
"a rule, since other people are so unpredictable, it is best","ꯅꯤꯌꯝ ꯑꯃꯅꯥ, ꯑꯇꯣꯞꯄꯥ ꯃꯤꯑꯣꯏꯁꯤꯡꯅꯥ ꯑꯁꯨꯛ ꯌꯥꯝꯅꯥ ꯊꯥꯖꯗꯕꯥ ꯃꯔꯝꯅꯥ, ꯃꯁꯤ ꯈ꯭ꯕꯥꯏꯗꯒꯤ ꯐꯩ"
to treat your expectations as wants,ꯑꯗꯣꯃꯒꯤ ꯑꯦꯛꯁꯄꯦꯛꯇꯦꯁꯅꯁꯤꯡ ꯑꯗꯨ ꯄꯥꯝꯂꯤ ꯍꯥꯌꯅꯥ ꯂꯧꯅꯕꯒꯤꯗꯃꯛ .
"If you treat a long shot like a sure thing, it's a sure","ꯀꯔꯤꯒꯨꯝꯕꯥ ꯅꯍꯥꯛꯅꯥ ꯂꯣꯡ ꯁꯣꯠ ꯑꯃꯥ ꯁꯣꯏꯗꯕꯥ ꯄꯣꯠꯁꯛ ꯑꯃꯒꯨꯝ ꯂꯧꯔꯕꯗꯤ, ꯃꯁꯤ ꯁꯣꯌꯗꯅꯥ ꯑꯣꯏꯒꯅꯤ ."
thing you will end up disappointed. But if you treat a,ꯋꯥꯐꯝ ꯑꯁꯤ ꯑꯗꯣꯝꯅꯥ ꯅꯨꯡꯉꯥꯏꯇꯕꯥ ꯐꯥꯑꯣꯕꯥ ꯂꯣꯏꯁꯤꯅꯒꯅꯤ꯫
"long shot like a long shot and a sure thing like a sure thing,","ꯂꯝꯕꯥ ꯁꯣꯠꯊꯔꯕꯥ ꯁꯣꯠ ꯑꯃꯗꯤ ꯁꯣꯌꯗꯕꯥ ꯄꯣꯠꯁꯛ ꯑꯃꯒꯨꯝ ꯁꯣꯌꯗꯕꯥ ꯋꯥꯐꯝ ꯑꯃꯥ,"
you :re a good bet to get everything you deserve out of,YOU :ꯑꯗꯣꯝꯅꯥ ꯐꯪꯐꯝ ꯊꯣꯀꯄꯥ ꯈꯨꯗꯤꯡꯃꯛ ꯐꯪꯅꯕꯥ ꯑꯐꯕꯥ ꯕꯦꯠ ꯑꯃꯥ
life,ꯄꯨꯟꯁꯤ
tesl,ꯇꯦꯁꯜ ꯇꯧꯕꯥ ꯌꯥꯏ꯫
HAVING I.AIREALISTIC EXPECTATIONS,i.airealistic ꯑꯦꯛꯁꯄꯦꯛꯇꯦꯁꯟ ꯂꯩꯕꯥ .
"USABLE INSIGHT,","ꯁꯤꯖꯤꯟꯅꯕꯥ ꯌꯥꯕꯥ ꯋꯥꯈꯜꯂꯣꯟ, ."
Just because it's reasonable doesn't mean it's,ꯃꯔꯝ ꯆꯥꯕꯥ ꯑꯣꯏꯕꯅꯥ ꯃꯔꯝ ꯑꯣꯏꯗꯨꯅꯥ ꯃꯁꯤꯅꯤ ꯍꯥꯌꯕꯥ ꯅꯠꯇꯦ .
realistic,ꯔꯤꯑꯦꯂꯤꯁ꯭ꯇꯤꯛ ꯑꯣꯏꯕꯥ .
Tnxrruc Acnoru,ꯇꯤ.ꯑꯦꯟ.ꯑꯦꯛꯁ.ꯑꯥꯔ.ꯑꯥꯔ.ꯌꯨ.ꯁꯤ.
likely it is to happen,ꯑꯣꯏꯊꯣꯀꯄꯥ ꯌꯥꯏ ꯃꯗꯨꯗꯤ ꯃꯁꯤ ꯊꯣꯛꯀꯅꯤ .
to accomplish what has to be done,ꯇꯧꯒꯗꯕꯥ ꯊꯕꯀꯁꯤꯡ ꯑꯗꯨ ꯃꯄꯨꯡ ꯐꯥꯍꯟꯅꯕꯥ .
unrealistic and 10 being a sure thing. The lower the,ꯑꯅꯔꯤꯑꯦꯂꯤꯁ꯭ꯇꯤꯛ ꯑꯃꯁꯨꯡ ꯱꯰ ꯑꯣꯏꯕꯥ ꯁꯣꯏꯗꯅꯥ ꯑꯣꯏꯕꯥ꯫
"score, the more important it is to have a backup plan","ꯁ꯭ꯀꯣꯔ, ꯕꯦꯀꯑꯞ ꯄ꯭ꯂꯥꯟ ꯑꯃꯥ ꯂꯩꯕꯥ ꯑꯁꯤ ꯍꯦꯟꯅꯥ ꯃꯔꯨꯑꯣꯏ꯫"
that will work,ꯃꯗꯨ ꯊꯕꯛ ꯑꯣꯏꯅꯥ ꯄꯥꯡꯊꯣꯛꯀꯅꯤ ꯫
"to have itr"" or ""gotta have itr"" according to how re-","to have itr"" ꯅꯠꯔꯒꯥ ""ꯒꯣꯠꯇꯥ ꯂꯩꯕꯥ ꯑꯥꯏ.ꯇꯤ.ꯑꯥꯔ.""ꯒꯤ ꯃꯇꯨꯡ ꯏꯟꯅꯥ ꯃꯇꯧ ꯀꯔꯝꯅꯥ ꯔꯤ-"
alistic your goal is,ꯑꯦꯂꯤꯁ꯭ꯇꯤꯛ ꯑꯣꯏꯅꯥ ꯑꯗꯣꯃꯒꯤ ꯄꯥꯟꯗꯃꯗꯤ .
you're prepared to be devastated,ꯑꯗꯣꯝ ꯃꯥꯡꯍꯟ ꯇꯥꯀꯍꯅꯕꯥ ꯉꯝꯅꯕꯥ ꯁꯦꯝ ꯁꯥꯔꯦ .
leel,ꯂꯤꯜ ꯑꯣꯏꯕꯥ ꯌꯥꯏ꯫
Trnng to Take Care of Everybody,ꯃꯤꯄꯨꯝ ꯈꯨꯗꯤꯡꯃꯀꯄꯨ ꯌꯦꯡꯁꯤꯟꯅꯕꯥ trnng .
"""It is easier to ntend neglect than","""ꯃꯁꯤꯗꯒꯤ ꯍꯦꯟꯅꯥ ꯅꯦꯒꯂꯦꯠ ꯇꯧꯕꯗꯥ ꯍꯦꯟꯅꯥ ꯂꯥꯌꯕꯥ ꯑꯣꯏ꯫"""
"to quichen lotse.""","ꯇꯨ ꯀ꯭ꯕꯤꯆꯦꯟ ꯂꯣꯠꯁꯦ꯫"""
"-s,4/NTJEROi'E","-ꯑꯦꯁ,꯴/ꯑꯦꯟ.ꯇꯤ.ꯖꯦꯔꯣꯏ'ꯏ."
"""I don', know the kelt to success, but the key to","""ꯑꯩꯍꯥꯛ ꯗꯣꯟ’, ꯃꯥꯏ ꯄꯥꯀꯄꯒꯤ ꯀꯦꯜꯇ ꯑꯁꯤ ꯈꯉꯕꯤꯌꯨ, ꯑꯗꯨꯕꯨ ꯃꯁꯤꯒꯤ ꯃꯔꯨꯑꯣꯏꯕꯥ ꯑꯁꯤ ."
"failure is n try m Plcase aneryone.""","ꯐꯦꯏꯂꯔ ꯑꯁꯤ n try m plcase aneryone."""
_BILLCOSBY,_ꯕꯤꯂꯀꯣꯁꯕꯤ
"\trflhenever I feel overextended, I think of the street per-","\trflhenever ꯑꯩꯅꯥ ꯑꯣꯚꯔꯑꯦꯛꯁꯇꯦꯟꯗ ꯇꯧꯕꯥ ꯐꯥꯑꯣꯏ, ꯑꯩꯅꯥ ꯂꯝꯕꯤ ꯑꯁꯤ per-"
"former in Venice, Califbrnia, who iuggles chain saws' I","ꯍꯥꯟꯅꯒꯤ ꯚꯦꯅꯤꯁꯇꯥ, ꯀꯦꯂꯤꯐꯕ꯭ꯔꯅꯤꯌꯥꯗꯥ, ꯃꯈꯣꯌꯅꯥ ꯑꯥꯏ.ꯌꯨ.ꯖꯤ.ꯖꯤ.ꯑꯦꯜ.ꯑꯦꯁ."
am awed by the intensity with which he concentrates on,ꯃꯍꯥꯛꯅꯥ ꯀꯟꯁꯦꯟꯠꯔꯦꯠ ꯇꯧꯔꯤꯕꯥ ꯏꯟꯇꯦꯟꯁꯤꯇꯤ ꯑꯗꯨꯅꯥ ꯃꯔꯝ ꯑꯣꯏꯗꯨꯅꯥ ꯋꯥꯈꯜ ꯅꯨꯡꯉꯥꯏꯇꯕꯥ ꯐꯥꯑꯣꯏ꯫
each ferocious saw as he plucks it from the air. The,ꯃꯍꯥꯛꯅꯥ ꯅꯨꯡꯁꯤꯠꯇꯒꯤ ꯂꯧꯊꯣꯀꯄꯥ ꯃꯇꯃꯗꯥ ꯐꯤꯔꯣꯁꯤꯌꯦꯜ ꯑꯣꯏꯕꯥ ꯁꯣ ꯈꯨꯗꯤꯡꯃꯛ꯫
"slightest distraction, and he could easily lose an arm","ꯈ꯭ꯕꯥꯏꯗꯒꯤ ꯍꯦꯟꯅꯥ ꯂꯨꯝꯅꯥ ꯂꯧꯕꯥ, ꯑꯃꯁꯨꯡ ꯃꯍꯥꯛꯅꯥ ꯌꯥꯝꯅꯥ ꯂꯥꯏꯅꯥ ꯈꯨꯠꯁꯥ ꯑꯃꯥ ꯃꯥꯡꯈꯤꯕꯥ ꯌꯥꯏ ."
"Like the iuggler, I need to focus sharply on each role",ꯑꯥꯏ.ꯌꯨ.ꯖꯤ.ꯑꯦꯜ.ꯒꯤ ꯃꯇꯧꯒꯨꯝꯅꯥ ꯑꯩꯍꯥꯛꯅꯥ ꯊꯧꯗꯥꯡ ꯈꯨꯗꯤꯡꯃꯛꯇꯥ ꯌꯥꯝꯅꯥ ꯃꯤꯠꯌꯦꯡ ꯆꯪꯕꯥ ꯃꯊꯧ ꯇꯥꯏ .
"I play-husband, father, son, brother, therapist, friend,","ꯑꯩꯅꯥ ꯄ꯭ꯂꯦ-ꯄꯨꯁꯕꯦꯟꯗ, ꯃꯄꯥ, ꯃꯆꯥꯅꯨꯄꯥ, ꯃꯔꯨꯞ, ꯊꯦꯔꯥꯄꯤꯁ꯭ꯠ, ꯃꯔꯨꯞ,"
teacher-only in some respects my task is harder: the,ꯑꯣꯖꯥ ꯈꯛꯇꯅꯥ ꯍꯤꯔꯝ ꯈꯔꯗꯥ ꯑꯩꯒꯤ ꯊꯕꯛ ꯑꯁꯤ ꯍꯦꯟꯅꯥ ꯀꯅꯈꯠꯂꯛꯂꯤ:
"performer juggles chain saws, but I have to iuggle people","ꯄꯔꯐꯣꯔꯃꯔ ꯖꯨꯒꯂꯁ ꯆꯦꯟ ꯁꯣꯁꯤꯡ, ꯑꯗꯨꯕꯨ ꯑꯩꯍꯥꯛꯅꯥ ꯃꯤꯑꯣꯏꯁꯤꯡ ꯑꯁꯤ ꯏꯎꯒꯒ꯭ꯂꯦ ꯇꯧꯕꯥ ꯇꯥꯕꯅꯤ"
"Because all my roles are important, and the amount of","ꯃꯔꯃꯗꯤ ꯑꯩꯒꯤ ꯊꯧꯗꯥꯡ ꯄꯨꯝꯅꯃꯛ ꯑꯁꯤ ꯃꯔꯨꯑꯣꯏ, ꯑꯃꯁꯨꯡ ꯃꯁꯤꯒꯤ ꯆꯥꯡ ꯑꯁꯤ ."
"time I can give to them is limited,I have to make sure that","ꯑꯩꯍꯥꯛꯅꯥ ꯃꯈꯣꯌꯗꯥ ꯄꯤꯕꯥ ꯌꯥꯕꯥ ꯃꯇꯝ ꯑꯁꯤ ꯂꯤꯃꯤꯇꯦꯗ ꯑꯣꯏ,ꯑꯩꯍꯥꯛꯅꯥ ꯁꯣꯏꯗꯅꯥ ꯍꯥꯌꯒꯗꯕꯅꯤ ꯃꯗꯨꯗꯤ ."
every person who matters to me does not feel neglected,ꯑꯩꯉꯣꯟꯗꯥ ꯃꯔꯨ ꯑꯣꯏꯕꯥ ꯃꯤꯑꯣꯏ ꯈꯨꯗꯤꯡꯃꯛ ꯃꯤꯄꯥꯏꯕꯥ ꯐꯥꯑꯣꯗꯦ .
For a busy person' trying to do iustice to everyone's,ꯃꯤ ꯌꯥꯝꯅꯥ ꯇꯤꯅꯕꯥ ꯃꯤꯑꯣꯏ ꯑꯃꯒꯤꯗꯃꯛ ꯃꯤꯄꯨꯝ ꯈꯨꯗꯤꯡꯃꯛꯀꯤ ꯑꯥꯏ.ꯑꯦꯁ.ꯇꯤ.
needs is self-defeating because you usually end up doing,ꯃꯊꯧ ꯇꯥꯕꯁꯤꯡ ꯑꯁꯤ ꯃꯁꯥꯅꯥ ꯃꯁꯥꯕꯨ ꯊꯥꯖꯖꯕꯥ ꯑꯁꯤꯅꯤ ꯃꯔꯃꯗꯤ ꯅꯍꯥꯛꯅꯥ ꯃꯍꯧꯁꯥꯅꯥ ꯇꯧꯕꯥ ꯂꯣꯏꯔꯦ
"iustice to no one, including yourself. If you spread your-","iustice ꯀꯅꯥꯒꯨꯝꯕꯥ ꯑꯃꯠꯇꯗꯥ, ꯅꯍꯥꯛ ꯅꯁꯥꯒꯥ ꯂꯣꯌꯅꯅꯥ꯫"
[100],[꯱꯰꯰] ꯒꯤ ꯃꯇꯨꯡ ꯏꯟꯅꯥ ꯑꯦꯟ.
TRYING TO TAKE CARE OF EVERYBODY,ꯃꯤꯄꯨꯝ ꯈꯨꯗꯤꯡꯃꯀꯄꯨ ꯌꯦꯡꯁꯤꯟꯅꯕꯥ ꯍꯣꯠꯅꯕꯥ
"self too thin, you not only risk burnout but the scorn and","ꯁꯦꯜꯐ ꯇꯨ ꯊꯤꯟ, ꯅꯍꯥꯛꯅꯥ ꯃꯩ ꯆꯥꯀꯄꯒꯤ ꯔꯤꯁ꯭ꯛ ꯂꯩꯕꯇꯥ ꯅꯠꯇꯅꯥ ꯁ꯭ꯀꯣꯔ ꯇꯧꯕꯥ ꯑꯃꯁꯨꯡ ."
anger of people who expect you to be there for them,ꯃꯈꯣꯌꯒꯤꯗꯃꯛ ꯃꯐꯝ ꯑꯗꯨꯗꯥ ꯂꯩꯒꯅꯤ ꯍꯥꯌꯅꯥ ꯊꯥꯖꯕꯥ ꯃꯤꯑꯣꯏꯁꯤꯡꯒꯤ ꯑꯁꯥꯑꯣꯕꯥ .
"""The fact is that the Americans are not a","""ꯋꯥꯐꯝ ꯑꯁꯤ ꯑꯃꯦꯔꯤꯀꯥꯅꯁꯤꯡ ꯑꯁꯤ ꯑꯦꯟ.ꯗꯤ.ꯑꯦ."
thoughtful people; they are too busy n stap and,ꯋꯥꯈꯜ ꯋꯥꯕꯥ ꯃꯤꯑꯣꯏꯁꯤꯡ;
"question their aalues. """,ꯃꯈꯣꯌꯒꯤ ꯑꯌꯨꯀꯁꯤꯡꯗꯥ ꯋꯥꯍꯪ ꯍꯪꯕꯤꯌꯨ꯫
"_IVIU,IAM MI.PH","_iviu,iam ꯃꯤ.ꯄꯤ.ꯑꯩꯆ."
The key is to make each person feelimportant when,ꯃꯔꯨ ꯑꯣꯏꯕꯥ ꯑꯁꯤ ꯃꯤꯑꯣꯏ ꯈꯨꯗꯤꯡꯃꯀꯄꯨ ꯐꯤꯜ ꯇꯧꯕꯥ ꯃꯇꯃꯗꯥ .
"you're with them. Of the many busy people I know, the",ꯅꯈꯣꯌꯅꯥ ꯃꯈꯣꯌꯒꯥ ꯂꯣꯌꯅꯅꯥ ꯂꯩꯔꯤ꯫
ones who manage their juggling acts best are those who,ꯃꯈꯣꯌꯒꯤ ꯖꯒꯂꯤꯡ ꯑꯦꯛꯇꯁꯤꯡ ꯈ꯭ꯕꯥꯏꯗꯒꯤ ꯐꯕꯥ ꯃꯑꯣꯡꯗꯥ ꯃꯦꯅꯦꯖ ꯇꯧꯔꯤꯕꯥ ꯃꯤꯑꯣꯏꯁꯤꯡ ꯑꯁꯤ .
give each activity and each person their undivided atten-,ꯊꯕꯛ ꯈꯨꯗꯤꯡꯃꯛ ꯑꯃꯁꯨꯡ ꯃꯤꯑꯣꯏ ꯈꯨꯗꯤꯡꯃꯛꯇꯥ ꯃꯈꯣꯌꯒꯤ ꯑꯟꯗꯗꯤꯚꯥꯏꯗ ꯑꯦꯇꯦꯟꯁ ꯄꯤꯕꯥ-
"tion. At the office, they are totally engaged in their work;",ꯇꯤꯟ꯫
"at home, the office is history and they focus on their roles",ꯌꯨꯃꯗꯥ ꯑꯣꯐꯤꯁ ꯑꯁꯤ ꯄꯨꯋꯥꯔꯤꯅꯤ ꯑꯃꯁꯨꯡ ꯃꯈꯣꯌꯅꯥ ꯃꯈꯣꯌꯒꯤ ꯊꯧꯗꯥꯡꯁꯤꯡꯗꯥ ꯃꯤꯠꯌꯦꯡ ꯊꯝꯂꯤ .
"as spouses and parents; when they are with their mother,",ꯃꯄꯨꯔꯣꯏꯕꯥ ꯑꯃꯁꯨꯡ ꯃꯃꯥ-ꯃꯄꯥ ꯑꯣꯏꯅꯥ;
"boss or accountant, they are immersed in the roles of","ꯕꯣꯁ ꯅꯠꯔꯒꯥ ꯑꯦꯀꯥꯎꯟꯇꯦꯟꯇ ꯑꯣꯏꯅꯥ, ꯃꯈꯣꯌꯅꯥ ꯊꯧꯗꯥꯡꯁꯤꯡ ꯑꯗꯨꯗꯥ ꯂꯨꯄꯆꯔꯤ꯫"
"adult child, employee or client. Each entrance and exit is","ꯑꯦꯗꯜꯇ ꯑꯣꯏꯕꯥ ꯑꯉꯥꯡ, ꯏꯃꯞꯂꯣꯌꯤ ꯅꯠꯠꯔꯒꯥ ꯀ꯭ꯂꯥꯏꯑꯦꯟꯇ꯫"
"crisp, and most of the time no one feels shortchanged","ꯀ꯭ꯔꯤꯁ꯭ꯞ, ꯑꯃꯁꯨꯡ ꯑꯌꯥꯝꯕꯥ ꯃꯇꯃꯗꯥ ꯀꯅꯥꯒꯨꯝꯕꯥ ꯑꯃꯠꯇꯅꯥ ꯁꯣꯔꯇꯆꯦꯟꯖ ꯇꯧꯕꯥ ꯐꯥꯑꯣꯗꯦ"
