en,mni-Mtei
Mind is committed to ensuring that voices on all sides of this debate are heard. This,ꯋꯥꯈꯜꯂꯣꯟ ꯑꯁꯤꯒꯤ ꯃꯥꯌꯀꯩ ꯈꯨꯗꯤꯡꯃꯛꯇꯥ ꯈꯣꯟꯖꯦꯂꯁꯤꯡ ꯁꯣꯏꯗꯅꯥ ꯇꯥꯕꯥ ꯉꯝꯅꯕꯥ ꯋꯥꯈꯂꯅꯥ ꯋꯥꯁꯛꯂꯤ꯫
includes those who:,ꯌꯥꯑꯣꯔꯤꯕꯁꯤꯡ ꯑꯗꯨꯗꯤ:
understand their experiences and behaviours as a disorder,ꯃꯈꯣꯌꯒꯤ ꯑꯦꯛꯁꯄꯔꯤꯑꯦꯟꯁꯁꯤꯡ ꯑꯃꯁꯨꯡ ꯂꯃꯆꯠ-ꯁꯥꯖꯠꯁꯤꯡ ꯑꯁꯤ ꯗꯤꯁꯑꯣꯔꯗꯔ ꯑꯃꯥ ꯑꯣꯏꯅꯥ ꯈꯪꯖꯤꯅꯕꯤꯌꯨ
think of them as a natural reaction to adversity,ꯃꯈꯣꯌꯕꯨ ꯑꯋꯥ-ꯑꯅꯥꯁꯤꯡꯒꯤ ꯃꯍꯧꯁꯥꯒꯤ ꯑꯣꯏꯕꯥ ꯔꯤꯑꯦꯛꯁꯟ ꯑꯃꯥ ꯑꯣꯏꯅꯥ ꯈꯅꯕꯤꯌꯨ .
reject the personality disorder label,ꯄꯔꯁꯣꯅꯦꯂꯤꯇꯤ ꯗꯤꯁꯑꯣꯔꯗꯔ ꯂꯦꯕꯦꯜ ꯑꯗꯨ ꯔꯤꯖꯦꯛꯇ ꯇꯧꯕꯥ
do not fully agree with the label but accept it being as a way to access support,ꯂꯦꯕꯦꯂꯒꯥ ꯃꯄꯨꯡ ꯐꯥꯅꯥ ꯌꯥꯅꯕꯥ ꯇꯧꯔꯣꯏꯗꯕꯅꯤ ꯑꯗꯨꯕꯨ ꯃꯁꯤ ꯁꯄꯣꯔꯠ ꯑꯦꯛꯁꯦꯁ ꯇꯧꯕꯒꯤ ꯃꯑꯣꯡ ꯑꯃꯥ ꯑꯣꯏꯅꯥ ꯌꯥꯕꯤꯌꯨ
If you have been diagnosed with a personality disorder but you're concerned that this isn't,ꯀꯔꯤꯒꯨꯝꯕꯥ ꯅꯍꯥꯛꯅꯥ ꯄꯔꯁꯣꯅꯦꯂꯤꯇꯤ ꯗꯤꯁꯑꯣꯔꯗꯔ ꯑꯃꯥ ꯂꯩꯔꯦ ꯍꯥꯌꯅꯥ ꯈꯪꯂꯕꯗꯤ ꯃꯁꯤ ꯅꯠꯇꯦ ꯍꯥꯌꯅꯥ ꯅꯍꯥꯛꯅꯥ ꯋꯥꯈꯜ ꯇꯥꯔꯤ .
"right for you, we have information on what you can do if you think your diagnosis is","ꯑꯗꯣꯃꯒꯤꯗꯃꯛꯇꯥ ꯆꯨꯝꯃꯤ, ꯀꯔꯤꯒꯨꯝꯕꯥ ꯑꯗꯣꯝꯅꯥ ꯑꯗꯣꯃꯒꯤ ꯗꯥꯏꯒ꯭ꯅꯣꯁꯤꯁ ꯑꯁꯤ ."
wrong,ꯑꯔꯥꯟꯕ
Specialists disagree about how to understand personality disorders,ꯁ꯭ꯄꯦꯁꯤꯑꯦꯂꯤꯁ꯭ꯇꯁꯤꯡꯅꯥ ꯄꯔꯁꯣꯅꯦꯂꯤꯇꯤ ꯗꯤꯁꯑꯣꯔꯗꯔꯁꯤꯡ ꯑꯁꯤ ꯀꯔꯝꯅꯥ ꯂꯧꯁꯤꯅꯒꯗꯒꯦ ꯍꯥꯌꯕꯒꯤ ꯃꯇꯥꯡꯗꯥ ꯌꯥꯅꯤꯡꯗꯕꯥ ꯐꯣꯡꯗꯣꯛꯂꯤ
The system of personality disorder diagnosis we list on our page on types of personality,ꯄꯔꯁꯣꯅꯦꯂꯤꯇꯤ ꯗꯤꯁꯑꯣꯔꯗꯔ ꯗꯥꯏꯒ꯭ꯅꯣꯁꯤꯁꯀꯤ ꯁꯤꯁ꯭ꯇꯦꯝ ꯑꯁꯤ ꯑꯩꯈꯣꯌꯅꯥ ꯄꯔꯁꯣꯅꯦꯂꯤꯇꯤꯒꯤ ꯃꯈꯂꯁꯤꯡꯒꯤ ꯃꯇꯥꯡꯗꯥ ꯑꯩꯈꯣꯌꯒꯤ ꯄꯦꯖꯗꯥ ꯂꯤꯁ꯭ꯠ ꯇꯧꯏ
"disorder is the one psychiatrists tend to use in the UK. However, some psychiatrists",ꯗꯤꯁꯑꯣꯔꯗꯔ ꯍꯥꯌꯕꯁꯤ ꯌꯨ.ꯀꯦ.ꯗꯥ ꯁꯤꯖꯤꯟꯅꯕꯥ ꯌꯥꯕꯥ ꯁꯥꯏꯀꯤꯌꯥꯠꯔꯤꯀꯁꯤꯡꯅꯤ꯫
disagree with its use and find it unhelpful because:,ꯃꯁꯤꯒꯤ ꯁꯤꯖꯤꯟꯅꯐꯝ ꯑꯁꯤꯒꯥ ꯌꯥꯅꯕꯥ ꯌꯥꯗꯕꯥ ꯑꯃꯁꯨꯡ ꯃꯁꯤꯕꯨ ꯃꯇꯦꯡ ꯄꯥꯡꯗꯕꯥ ꯑꯣꯏꯅꯥ ꯎꯕꯤꯌꯨ ꯃꯔꯃꯗꯤ:
© Mind 2020,© ꯃꯥꯏꯟꯗ ꯲꯰꯲꯰ .
10,꯱꯰ ꯑꯃꯁꯨꯡ ꯱꯰.
Most people who are diagnosed with a personality disorder do not fit any one,ꯄꯔꯁꯣꯅꯦꯂꯤꯇꯤ ꯗꯤꯁꯑꯣꯔꯗꯔ ꯑꯃꯥ ꯂꯩꯕꯥ ꯃꯤꯑꯣꯏ ꯑꯌꯥꯝꯕꯗꯤ ꯀꯅꯥꯒꯨꯝꯕꯥ ꯑꯃꯠꯇꯥ ꯐꯤꯠ ꯑꯣꯏꯗꯦ
"category, and may be diagnosed with more than one","ꯀꯦꯇꯦꯒꯣꯔꯤ, ꯑꯃꯁꯨꯡ ꯑꯃꯗꯒꯤ ꯍꯦꯟꯅꯥ ꯂꯩꯕꯥ ꯌꯥꯏ ꯍꯥꯌꯅꯥ ꯈꯪꯂꯕꯥ ꯌꯥꯏ꯫"
Some people believe the focus should instead be on what each person needs in,ꯃꯤꯑꯣꯏ ꯈꯔꯅꯥ ꯊꯥꯖꯩ ꯃꯗꯨꯗꯤ ꯃꯤꯠꯌꯦꯡ ꯑꯁꯤ ꯃꯗꯨꯒꯤ ꯃꯍꯨꯠꯇꯥ ꯃꯤꯑꯣꯏ ꯈꯨꯗꯤꯡꯃꯛꯅꯥ ꯃꯊꯧ ꯇꯥꯔꯤꯕꯥ ꯑꯗꯨꯗꯥ ꯌꯥꯑꯣꯒꯗꯕꯅꯤ ꯍꯥꯌꯅꯥ ꯊꯥꯖꯩ꯫
"order to deal with their problems and discover new ways of living, not what","ꯃꯈꯣꯌꯒꯤ ꯄ꯭ꯔꯣꯕ꯭ꯂꯦꯃꯁꯤꯡ ꯊꯦꯡꯅꯅꯕꯥ ꯑꯃꯁꯨꯡ ꯑꯅꯧꯕꯥ ꯄꯨꯟꯁꯤ ꯃꯍꯤꯡ ꯑꯃꯥ ꯊꯤꯗꯣꯛꯅꯕꯥ ꯑꯣꯔꯗꯔ ꯇꯧꯕꯤꯌꯨ, ꯀꯔꯤ ꯇꯧꯔꯣꯏꯗꯕꯅꯤ꯫"
category they are in,ꯀꯦꯇꯦꯒꯣꯔꯤ ꯃꯈꯣꯌꯅꯥ ꯲꯰꯲꯰ꯗꯥ ꯂꯩꯔꯤ꯫
It doesn't take social context into enough account,ꯃꯁꯤꯅꯥ ꯁꯣꯁꯤꯌꯦꯜ ꯀꯟꯇꯦꯛꯁꯇꯥ ꯃꯇꯤꯛ ꯆꯥꯕꯥ ꯑꯦꯀꯥꯎꯟꯇꯇꯥ ꯂꯧꯗꯦ .
People are complicated. There are many social factors that can affect our capacity to,ꯃꯤꯌꯥꯝ ꯑꯁꯤ ꯌꯥꯝꯅꯥ ꯂꯨꯕꯥ ꯑꯃꯅꯤ꯫
"cope, to relate to others and to respond to stress. For example:","ꯀꯣꯞ, ꯑꯇꯣꯞꯄꯁꯤꯡꯒꯥ ꯃꯔꯤ ꯂꯩꯅꯕꯥ ꯑꯃꯁꯨꯡ ꯁ꯭ꯠꯔꯦꯁꯀꯤ ꯄꯥꯎꯈꯨꯝ ꯄꯤꯕꯥ꯫"
"Experiencing trauma in childhood (such as abuse or neglect), or trauma that lasted","ꯑꯉꯥꯡ ꯑꯣꯏꯔꯤꯉꯩꯗꯥ ꯇ꯭ꯔꯥꯎꯃꯥ (ꯑꯦꯕ꯭ꯌꯨꯖ ꯅꯠꯠꯔꯒꯥ ꯅꯦꯒꯂꯦꯛꯇꯒꯨꯝꯕꯥ) ꯊꯦꯡꯅꯕꯥ, ꯅꯠꯠꯔꯒꯥ ꯂꯦꯡꯗꯅꯥ ꯂꯩꯕꯥ ꯇ꯭ꯔꯥꯎꯃꯥ ꯊꯦꯡꯅꯕꯥ꯫"
for a long time,ꯃꯇꯝ ꯁꯥꯡꯅꯥ .
"Issues to do with your situation and environment, such as poverty and social","ꯑꯗꯣꯃꯒꯤ ꯐꯤꯚꯝ ꯑꯃꯁꯨꯡ ꯑꯀꯣꯌꯕꯒꯥ ꯃꯔꯤ ꯂꯩꯅꯕꯥ ꯋꯥꯐꯃꯁꯤꯡ, ꯍꯥꯌꯕꯗꯤ ꯂꯥꯌꯔꯕꯥ ꯑꯃꯁꯨꯡ ꯈꯨꯟꯅꯥꯏꯒꯤ ꯑꯣꯏꯕꯥ ꯋꯥꯐꯃꯁꯤꯡ"
"deprivation, or having to move home to a totally new place or culture","ꯁꯣꯠꯊꯔꯕꯥ, ꯅꯠꯠꯔꯒꯥ ꯃꯄꯨꯡꯐꯥꯅꯥ ꯑꯅꯧꯕꯥ ꯃꯐꯝ ꯅꯠꯠꯔꯒꯥ ꯀꯂꯆꯔ ꯑꯃꯗꯥ ꯌꯨꯃꯗꯥ ꯆꯠꯄꯥ ꯃꯊꯧ ꯇꯥꯕꯥ"
"Experiencing stigma and discrimination, like racism, sexism, homophobia, biphobia","ꯔꯦꯁꯤꯖꯝ, ꯁꯦꯛꯁꯤꯖꯝ, ꯍꯣꯃꯣꯐꯣꯕꯤꯌꯥ, ꯕꯥꯏꯐꯣꯕꯤꯌꯥꯒꯨꯝꯕꯥ ꯁ꯭ꯇꯤꯒꯃꯥ ꯑꯃꯁꯨꯡ ꯗꯤꯁꯛꯔꯤꯃꯤꯅꯦꯁꯟ ꯊꯦꯡꯅꯕꯥ"
or transphobia,ꯅꯠꯠꯔꯒꯥ ꯇ꯭ꯔꯥꯟꯁꯐꯣꯕꯤꯌꯥ .
If people have treated you badly in past relationships (including your parents or,ꯀꯔꯤꯒꯨꯝꯕꯥ ꯃꯤꯌꯥꯝꯅꯥ ꯅꯍꯥꯀꯄꯨ ꯍꯧꯈꯤꯕꯥ ꯃꯔꯤꯁꯤꯡꯗꯥ (ꯅꯍꯥꯛꯀꯤ ꯃꯃꯥ-ꯃꯄꯥꯁꯤꯡ ꯅꯠꯠꯔꯒꯥ ꯌꯥꯎꯅꯥ) ꯐꯠꯇꯅꯥ ꯂꯥꯌꯦꯡꯈꯤꯕꯥ ꯑꯣꯏꯔꯕꯗꯤ꯫
carers),ꯀꯦꯌꯔꯔꯁꯤꯡ) ꯑꯃꯁꯨꯡ ꯑꯦꯝ.
Any of these can lead to you often feeling overwhelmed with unbearable feelings. This,ꯃꯁꯤꯒꯤ ꯃꯅꯨꯡꯗꯥ ꯑꯃꯍꯦꯛꯇꯅꯥ ꯅꯍꯥꯛꯅꯥ ꯑꯌꯥꯝꯕꯥ ꯃꯇꯃꯗꯥ ꯋꯥꯈꯜ ꯅꯨꯡꯉꯥꯏꯇꯕꯥ ꯐꯥꯎꯔꯀꯄꯥ ꯌꯥꯏ꯫
can make it very difficult to deal with the daily challenges of adult life,ꯑꯍꯜ ꯑꯣꯏꯔꯕꯥ ꯄꯨꯟꯁꯤꯒꯤ ꯅꯨꯃꯤꯠ ꯈꯨꯗꯤꯡꯒꯤ ꯑꯣꯏꯕꯥ ꯁꯤꯡꯅꯕꯁꯤꯡ ꯑꯁꯤ ꯊꯦꯡꯅꯕꯗꯥ ꯌꯥꯝꯅꯥ ꯑꯋꯥꯕꯥ ꯑꯣꯏꯍꯅꯕꯥ ꯉꯃꯒꯅꯤ
"For more information on how traumatic experiences may affect your mental health, see","ꯇ꯭ꯔꯥꯎꯃꯦꯇꯤꯛ ꯑꯦꯛꯁꯄꯔꯤꯑꯦꯟꯁꯁꯤꯡꯅꯥ ꯅꯍꯥꯛꯀꯤ ꯃꯦꯟꯇꯦꯜ ꯍꯦꯂꯊꯇꯥ ꯀꯔꯝꯅꯥ ꯁꯣꯀꯍꯅꯕꯒꯦ ꯍꯥꯌꯕꯒꯤ ꯃꯇꯥꯡꯗꯥ ꯑꯍꯦꯅꯕꯥ ꯏꯅꯐꯣꯔꯃꯦꯁꯅꯒꯤꯗꯃꯛꯇꯥ, ꯌꯦꯡꯕꯤꯌꯨ꯫"
our pages on trauma,ꯇ꯭ꯔꯥꯎꯃꯥꯗꯥ ꯂꯩꯕꯥ ꯑꯩꯈꯣꯌꯒꯤ ꯄꯦꯖꯁꯤꯡ
The term itself can be stigmatising,ꯋꯥꯍꯩ ꯑꯁꯤ ꯃꯁꯥꯃꯛ ꯁ꯭ꯇꯤꯒꯃꯥꯏꯖ ꯇꯧꯕꯥ ꯌꯥꯏ .
Some people feel that the term 'personality disorder' can sound very judgmental. Being,ꯃꯤꯑꯣꯏ ꯈꯔꯅꯥ ‘ꯄꯔꯁꯣꯅꯦꯂꯤꯇꯤ ꯗꯤꯁꯑꯣꯔꯗꯔ’ ꯍꯥꯌꯕꯥ ꯋꯥꯍꯩ ꯑꯁꯤ ꯌꯥꯝꯅꯥ ꯋꯥꯅꯥ ꯊꯣꯀꯄꯥ ꯌꯥꯏ ꯍꯥꯌꯅꯥ ꯈꯜꯂꯤ꯫
given a diagnosis or label of personality disorder can feel as if you're being told there's,ꯄꯤꯔꯕꯗꯤ ꯄꯔꯁꯣꯅꯦꯂꯤꯇꯤ ꯗꯤꯁꯑꯣꯔꯗꯔꯒꯤ ꯗꯥꯏꯑꯦꯒ꯭ꯅꯣꯁꯤꯁ ꯅꯠꯠꯔꯒꯥ ꯂꯦꯕꯦꯜ ꯑꯃꯥ ꯄꯤꯕꯅꯥ ꯅꯍꯥꯀꯄꯨ ꯈꯪꯍꯜꯂꯤꯕꯥ ꯃꯑꯣꯡꯗꯥ ꯐꯥꯎꯕꯥ ꯌꯥꯏ꯫
"something wrong with who you are. You may feel upset, insulted and excluded. Language",ꯑꯗꯣꯝ ꯀꯅꯥꯅꯣ ꯍꯥꯌꯕꯗꯨꯗꯥ ꯀꯔꯤꯒꯨꯝꯕꯥ ꯈꯔꯥ ꯇꯧꯕꯥ꯫
evolves and it may be that a different term will be used by professionals in future,ꯏꯚꯣꯜꯌꯨꯕ ꯇꯧꯏ ꯑꯃꯁꯨꯡ ꯃꯁꯤ ꯑꯣꯏꯊꯣꯀꯄꯥ ꯌꯥꯏ ꯃꯗꯨꯗꯤ ꯇꯣꯉꯥꯅꯕꯥ ꯋꯥꯍꯩ ꯑꯃꯥ ꯇꯨꯡꯗꯥ ꯄ꯭ꯔꯣꯐꯦꯁ꯭ꯅꯦꯂꯁꯤꯡꯅꯥ ꯁꯤꯖꯤꯟꯅꯒꯅꯤ .
"""Stigma can sometime come from the professionals themselves, whether intentionally or","""ꯁ꯭ꯇꯤꯒꯃꯥ ꯑꯁꯤ ꯀꯔꯤꯒꯨꯝꯕꯥ ꯃꯇꯃꯗꯥ ꯄ꯭ꯔꯣꯐꯦꯁ꯭ꯅꯦꯂꯁꯤꯡ ꯃꯁꯥꯃꯛꯇꯒꯤ ꯂꯥꯀꯄꯥ ꯌꯥꯏ, ꯏꯅꯇꯦꯟꯁꯅꯦꯜ ꯑꯣꯏꯔꯕꯁꯨ ꯅꯠꯠꯔꯒꯥ ."
"not.""","ꯅꯠꯇꯕ."""
It's important to remember that you're not alone – there are other people out there,ꯃꯁꯤ ꯅꯤꯡꯁꯤꯡꯕꯥ ꯌꯥꯝꯅꯥ ꯃꯔꯨ ꯑꯣꯏ ꯃꯗꯨꯗꯤ ꯅꯍꯥꯛ ꯅꯁꯥꯃꯛ ꯅꯠꯇꯦ – ꯃꯐꯝ ꯑꯗꯨꯗꯥ ꯑꯇꯣꯞꯄꯥ ꯃꯤꯑꯣꯏꯁꯤꯡꯁꯨ ꯂꯩꯔꯤ
"experiencing what you are. However you choose to make sense of your difficulties, you",ꯅꯍꯥꯛꯅꯥ ꯂꯩꯔꯤꯕꯥ ꯑꯗꯨ ꯑꯦꯛꯁꯄꯔꯤꯑꯦꯟꯁ ꯇꯧꯕꯥ꯫
deserve to be treated fairly. Here are some options you can consider:,ꯅꯤꯡꯊꯤꯅꯥ ꯌꯦꯡꯁꯤꯅꯕꯒꯤ ꯃꯊꯧ ꯇꯥꯔꯤ꯫
Show people this information to help them understand more about what your,ꯏꯅꯐꯣꯔꯃꯦꯁꯟ ꯑꯁꯤ ꯃꯤꯌꯥꯃꯗꯥ ꯇꯥꯀꯄꯤꯅꯕꯥ ꯃꯈꯣꯌꯗꯥ ꯅꯍꯥꯛꯀꯤ ꯃꯔꯃꯗꯥ ꯍꯦꯟꯅꯥ ꯈꯉꯕꯗꯥ ꯃꯇꯦꯡ ꯄꯥꯡꯅꯕꯥ ꯇꯥꯀꯄꯤꯌꯨ
diagnosis really means,ꯗꯥꯏꯒ꯭ꯅꯣꯁꯤꯁ ꯍꯥꯌꯕꯁꯤ ꯇꯁꯦꯡꯅꯥ ꯍꯥꯌꯔꯕꯗꯥ .
Get involved in your treatment – our pages on seeking help for a mental health,ꯑꯗꯣꯃꯒꯤ ꯂꯥꯌꯦꯡ ꯑꯗꯨꯗꯥ ꯁꯔꯨꯛ ꯌꯥꯕꯤꯌꯨ – ꯃꯦꯟꯇꯦꯜ ꯍꯦꯜꯊꯀꯤꯗꯃꯛ ꯃꯇꯦꯡ ꯄꯥꯡꯅꯕꯥ ꯑꯩꯈꯣꯌꯒꯤ ꯄꯦꯖꯁꯤꯡ
"problem and advocacy provide guidance on having your say in your treatment,","ꯄ꯭ꯔꯣꯕ꯭ꯂꯦꯝ ꯑꯃꯁꯨꯡ ꯑꯦꯗꯚꯣꯀꯦꯁꯤꯅꯥ ꯅꯍꯥꯛꯀꯤ ꯂꯥꯏꯌꯦꯡꯗꯥ ꯅꯍꯥꯛꯀꯤ ꯋꯥꯐꯝ ꯂꯩꯕꯒꯤ ꯃꯇꯥꯡꯗꯥ ꯂꯃꯖꯤꯡ-ꯂꯃꯇꯥꯛ ꯄꯤꯔꯤ,"
making your voice heard and steps you can take if you're not happy with your,ꯅꯍꯥꯛꯀꯤ ꯈꯣꯟꯖꯦꯜ ꯇꯥꯕꯥ ꯑꯃꯁꯨꯡ ꯅꯍꯥꯛꯅꯥ ꯂꯧꯈꯠꯄꯥ ꯌꯥꯕꯥ ꯈꯣꯡꯊꯥꯡꯁꯤꯡ ꯑꯗꯨ ꯅꯍꯥꯛꯅꯥ ꯅꯨꯡꯉꯥꯏꯕꯥ ꯐꯥꯑꯣꯗ꯭ꯔꯕꯗꯤ ꯅꯍꯥꯛꯅꯥ ꯂꯧꯕꯥ ꯌꯥꯕꯥ ꯈꯣꯡꯊꯥꯡꯁꯤꯡ
care,ꯀꯦꯌꯔ .
Know your rights – our pages on legal rights provide more information,ꯅꯍꯥꯛꯀꯤ ꯍꯀꯁꯤꯡ ꯈꯪꯖꯤꯅꯕꯤꯌꯨ – ꯑꯥꯏꯅꯒꯤ ꯑꯣꯏꯕꯥ ꯍꯀꯁꯤꯡꯒꯤ ꯃꯇꯥꯡꯗꯥ ꯑꯩꯈꯣꯌꯒꯤ ꯄꯦꯖꯁꯤꯡ ꯍꯦꯟꯅꯥ ꯏꯅꯐꯣꯔꯃꯦꯁꯟ ꯄꯤꯌꯨ
Take action with Mind – see our campaigning page for details of the different ways,ꯋꯥꯈꯜꯂꯣꯅꯒꯥ ꯂꯣꯌꯅꯅꯥ ꯑꯦꯛꯁꯟ ꯂꯧꯈꯠꯀꯗꯕꯅꯤ – ꯇꯣꯉꯥꯟ ꯇꯣꯉꯥꯅꯕꯥ ꯃꯑꯣꯡꯁꯤꯡꯒꯤ ꯑꯀꯨꯞꯄꯥ ꯃꯔꯣꯂꯁꯤꯡꯒꯤꯗꯃꯛ ꯑꯩꯈꯣꯌꯒꯤ ꯀꯦꯝꯄꯦꯏꯟ ꯄꯦꯖ ꯑꯁꯤ ꯌꯦꯡꯕꯤꯌꯨ
you can get involved in helping us to challenge stigma,ꯑꯗꯣꯝꯅꯥ ꯑꯩꯈꯣꯌꯗꯥ ꯁ꯭ꯇꯤꯒꯃꯥ ꯆꯦꯂꯦꯟꯖ ꯇꯧꯕꯗꯥ ꯃꯇꯦꯡ ꯄꯥꯡꯕꯗꯥ ꯁꯔꯨꯛ ꯌꯥꯕꯥ ꯌꯥꯒꯅꯤ
"That said, it takes energy to challenge stigma. When you are particularly unwell you may","ꯍꯥꯌꯕꯗꯤ, ꯃꯁꯤꯅꯥ ꯑꯦꯅꯔꯖꯤ ꯑꯁꯤ ꯁ꯭ꯇꯤꯒꯃꯥ ꯆꯦꯂꯦꯟꯖ ꯇꯧꯕꯗꯥ ꯆꯪꯏ꯫"
not have the capacity to do any of these things. Be kind to yourself and try not to put,ꯑꯁꯤꯒꯨꯝꯕꯥ ꯊꯕꯀꯁꯤꯡ ꯑꯁꯤꯒꯤ ꯃꯅꯨꯡꯗꯥ ꯑꯃꯠꯇꯥ ꯇꯧꯕꯒꯤ ꯀꯦꯄꯥꯁꯤꯇꯤ ꯂꯩꯇꯦ꯫
yourself under pressure to do anything other than rest and recover when that is what,ꯅꯍꯥꯛꯀꯤ ꯏꯁꯥꯕꯨ ꯄ꯭ꯔꯦꯁꯔꯒꯤ ꯃꯈꯥꯗꯥ ꯂꯩꯕꯥ ꯑꯇꯣꯞꯄꯥ ꯊꯕꯛ ꯑꯃꯥ ꯇꯧꯅꯕꯥ ꯑꯃꯁꯨꯡ ꯃꯗꯨ ꯑꯣꯏꯔꯀꯄꯥ ꯃꯇꯃꯗꯥ ꯔꯤꯀꯣꯚꯔ ꯇꯧꯕꯥ ꯌꯥꯕꯥ ꯑꯇꯣꯞꯄꯥ ꯊꯕꯛ ꯑꯃꯥ ꯇꯧꯅꯕꯥ
you need,ꯑꯗꯣꯝꯅꯥ ꯃꯊꯧ ꯇꯥꯔꯤ
© Mind 2020,© ꯃꯥꯏꯟꯗ ꯲꯰꯲꯰ .
11,꯱꯱ ꯑꯃꯁꯨꯡ ꯱꯱꯫
See our advocacy page and useful contacts page for more information if you need,ꯀꯔꯤꯒꯨꯝꯕꯥ ꯅꯍꯥꯛꯅꯥ ꯃꯊꯧ ꯇꯥꯔꯕꯗꯤ ꯑꯍꯦꯅꯕꯥ ꯏꯅꯐꯣꯔꯃꯦꯁꯅꯒꯤꯗꯃꯛꯇꯥ ꯑꯩꯈꯣꯌꯒꯤ ꯑꯦꯗꯚꯣꯀꯦꯁꯤ ꯄꯦꯖ ꯑꯃꯁꯨꯡ ꯀꯥꯟꯅꯕꯥ ꯀꯟꯇꯦꯛꯇ ꯄꯦꯖꯁꯤꯡ ꯌꯦꯡꯕꯤꯌꯨ꯫
support with having a say in your treatment,ꯅꯍꯥꯛꯀꯤ ꯂꯥꯏꯌꯦꯡꯗꯥ ꯋꯥꯐꯝ ꯑꯃꯥ ꯂꯩꯕꯒꯥ ꯂꯣꯌꯅꯅꯥ ꯁꯄꯣꯔꯠ ꯇꯧꯕꯥ
"""The stigma of being violent and dangerous is the worst for me. I am a caring and","""ꯍꯤꯡꯁꯥ ꯑꯃꯁꯨꯡ ꯈꯨꯗꯣꯡꯊꯤꯅꯤꯡꯉꯥꯏ ꯑꯣꯏꯕꯥ ꯋꯥꯐꯝ ꯑꯁꯤ ꯑꯩꯒꯤꯗꯃꯛꯇꯗꯤ ꯈ꯭ꯕꯥꯏꯗꯒꯤ ꯍꯦꯟꯅꯥ ꯐꯠꯇꯕꯥ ꯑꯣꯏꯔꯤ꯫ ꯑꯩꯍꯥꯛ ꯃꯤꯅꯨꯡꯁꯤ ꯂꯩꯕꯥ ꯃꯤꯁꯛ ꯑꯃꯅꯤ ꯑꯃꯁꯨꯡ ."
"empathetic soul who would do anything for the people I love.""",ꯑꯩꯅꯥ ꯅꯨꯡꯁꯤꯖꯕꯥ ꯃꯤꯑꯣꯏꯁꯤꯡꯒꯤꯗꯃꯛ ꯀꯔꯤꯒꯨꯝꯕꯥ ꯈꯔꯥ ꯇꯧꯕꯥ ꯉꯃꯒꯗꯕꯥ ꯃꯤꯅꯨꯡꯁꯤ ꯂꯩꯕꯥ ꯊꯋꯥꯏ꯫”
Could my diagnosis be wrong?,ꯑꯩꯒꯤ ꯗꯥꯏꯑꯦꯒ꯭ꯅꯣꯁꯤꯁ ꯑꯁꯤ ꯑꯔꯥꯅꯕꯥ ꯑꯣꯏꯕꯥ ꯌꯥꯏ?
"Some symptoms of personality disorder can be very similar to, or appear","ꯄꯔꯁꯣꯅꯦꯂꯤꯇꯤ ꯗꯤꯁꯑꯣꯔꯗꯔꯒꯤ ꯂꯥꯏꯑꯣꯡ ꯈꯔꯗꯤ ꯌꯥꯝꯅꯥ ꯃꯥꯟꯅꯕꯥ ꯑꯣꯏꯕꯥ ꯌꯥꯏ, ꯅꯠꯠꯔꯒꯥ ꯊꯣꯀꯄꯥ ꯌꯥꯏ"
"alongside, other mental health problems. Depending on your mood and what's","ꯃꯁꯤꯒꯥ ꯂꯣꯌꯅꯅꯥ, ꯑꯇꯣꯞꯄꯥ ꯃꯦꯟꯇꯦꯜ ꯍꯦꯜꯊ ꯄ꯭ꯔꯣꯕ꯭ꯂꯦꯃꯁꯤꯡ꯫"
"happening in your life when you speak to mental health professionals, they might find it",ꯃꯦꯟꯇꯦꯜ ꯍꯦꯜꯊ ꯄ꯭ꯔꯣꯐꯦꯁ꯭ꯅꯦꯂꯁꯤꯡꯒꯥ ꯋꯥꯔꯤ ꯁꯥꯅꯔꯀꯄꯥ ꯃꯇꯃꯗꯥ ꯑꯗꯣꯃꯒꯤ ꯄꯨꯟꯁꯤꯗꯥ ꯊꯣꯛꯂꯤꯕꯥ ꯊꯧꯗꯣꯛ ꯑꯗꯨ ꯃꯈꯣꯌꯅꯥ ꯐꯪꯂꯃꯒꯅꯤ
hard to identify the diagnosis that best fits your experiences,ꯅꯍꯥꯛꯀꯤ ꯑꯦꯛꯁꯄꯔꯤꯌꯦꯟꯁꯁꯤꯡꯒꯥ ꯈ꯭ꯕꯥꯏꯗꯒꯤ ꯆꯨꯅꯕꯥ ꯗꯥꯏꯑꯦꯒ꯭ꯅꯣꯁꯤꯁ ꯑꯗꯨ ꯈꯪꯗꯣꯀꯄꯥ ꯉꯃꯗꯕꯥ
"If you're worried that your diagnosis doesn't reflect the way you feel, it's important to","ꯀꯔꯤꯒꯨꯝꯕꯥ ꯅꯍꯥꯛꯅꯥ ꯅꯍꯥꯛꯀꯤ ꯗꯥꯏꯑꯦꯒ꯭ꯅꯣꯁꯤꯁ ꯑꯗꯨ ꯅꯍꯥꯛꯅꯥ ꯐꯥꯑꯣꯔꯤꯕꯥ ꯃꯑꯣꯡ ꯑꯗꯨ ꯔꯤꯐ꯭ꯂꯦꯛꯇ ꯇꯧꯗꯦ ꯍꯥꯌꯅꯥ ꯋꯥꯈꯜ ꯇꯥꯔꯕꯗꯤ, ꯃꯁꯤꯒꯤꯗꯃꯛꯇꯥ ꯃꯔꯨꯑꯣꯏ꯫"
discuss it with a mental health professional so you can make sure you're getting the,ꯃꯁꯤꯒꯤ ꯃꯇꯥꯡꯗꯥ ꯃꯦꯟꯇꯦꯜ ꯍꯦꯜꯊ ꯄ꯭ꯔꯣꯐꯦꯁ꯭ꯅꯦꯜ ꯑꯃꯒꯥ ꯋꯥꯔꯤ ꯁꯥꯅꯕꯤꯌꯨ ꯃꯗꯨꯅꯥ ꯑꯗꯣꯝꯅꯥ ꯁꯣꯏꯗꯅꯥ ꯐꯪꯂꯤ ꯍꯥꯌꯕꯥ ꯁꯣꯏꯗꯅꯥ ꯈꯉꯕꯥ ꯉꯃꯒꯅꯤ꯫
right treatment and support to help you,ꯑꯗꯣꯃꯕꯨ ꯃꯇꯦꯡ ꯄꯥꯡꯅꯕꯥ ꯑꯆꯨꯝꯕꯥ ꯂꯥꯌꯦꯡ ꯑꯃꯁꯨꯡ ꯁꯄꯣꯔꯠ
"See our pages on seeking help for a mental health problem, advocacy and complaining","ꯃꯦꯟꯇꯦꯜ ꯍꯦꯜꯊ ꯄ꯭ꯔꯣꯕ꯭ꯂꯦꯝ ꯑꯃꯥ, ꯑꯦꯗꯚꯣꯀꯦꯁꯤ ꯑꯃꯁꯨꯡ ꯀꯃꯞꯂꯦꯟꯇ ꯑꯃꯒꯤꯗꯃꯛꯇꯥ ꯃꯇꯦꯡ ꯂꯧꯕꯒꯤ ꯃꯇꯥꯡꯗꯥ ꯑꯩꯈꯣꯌꯒꯤ ꯄꯦꯖꯁꯤꯡ ꯌꯦꯡꯕꯤꯌꯨ"
about health and social care for information on how to make sure your voice is heard,ꯅꯍꯥꯛꯀꯤ ꯈꯣꯟꯖꯦꯜ ꯑꯗꯨ ꯀꯔꯝꯅꯥ ꯇꯥꯒꯅꯤ ꯍꯥꯌꯕꯒꯤ ꯃꯇꯥꯡꯗꯥ ꯏꯅꯐꯣꯔꯃꯦꯁꯅꯒꯤꯗꯃꯛꯇꯥ ꯍꯀꯁꯦꯜ ꯑꯃꯁꯨꯡ ꯁꯣꯁꯤꯑꯦꯜ ꯀꯦꯌꯔꯒꯤ ꯃꯇꯥꯡꯗꯥ
and what you can do if you're not happy with your doctor,ꯑꯃꯁꯨꯡ ꯀꯔꯤꯒꯨꯝꯕꯥ ꯅꯍꯥꯛꯅꯥ ꯅꯍꯥꯛꯀꯤ ꯗꯣꯛꯇꯔꯒꯥ ꯇꯥꯟꯅꯔꯕꯗꯤ ꯅꯍꯥꯛꯅꯥ ꯀꯔꯤ ꯇꯧꯕꯥ ꯌꯥꯕꯒꯦ ꯍꯥꯌꯕꯗꯨ .
How can I help myself?,ꯑꯩꯍꯥꯛꯅꯥ ꯃꯇꯧ ꯀꯔꯝꯅꯥ ꯏꯁꯥꯕꯨ ꯃꯇꯦꯡ ꯄꯥꯡꯒꯅꯤ?
"If you experience a personality disorder, every day might feel like a struggle and there","ꯀꯔꯤꯒꯨꯝꯕꯥ ꯅꯍꯥꯛꯅꯥ ꯄꯔꯁꯣꯅꯦꯂꯤꯇꯤ ꯗꯤꯁꯑꯣꯔꯗꯔ ꯑꯃꯥ ꯊꯦꯡꯅꯔꯕꯗꯤ, ꯅꯨꯃꯤꯠ ꯈꯨꯗꯤꯡꯒꯤ ꯂꯥꯅꯐꯝ ꯑꯃꯥ ꯑꯣꯏꯅꯥ ꯐꯥꯑꯣꯔꯀꯄꯥ ꯌꯥꯏ ꯑꯃꯁꯨꯡ ꯃꯐꯝ ꯑꯗꯨꯗꯥ"
may be times when everything seems too much to cope with. There are coping strategies,ꯄꯨꯝꯅꯃꯛ ꯑꯁꯤ ꯊꯦꯡꯅꯕꯗꯥ ꯌꯥꯝꯅꯥ ꯋꯥꯕꯥ ꯑꯣꯏꯅꯥ ꯎꯕꯥ ꯃꯇꯃꯁꯤꯡ ꯑꯣꯏꯕꯥ ꯌꯥꯏ꯫
that can help though. Below are some ideas of things you can do to help yourself both,ꯑꯗꯨꯕꯨ ꯃꯇꯦꯡ ꯄꯥꯡꯕꯥ ꯉꯃꯒꯅꯤ꯫
now and in the longer-term,ꯍꯧꯖꯤꯛ ꯑꯃꯁꯨꯡ ꯍꯦꯟꯅꯥ ꯁꯥꯡꯂꯕꯥ ꯃꯇꯝ ꯑꯁꯤꯗꯥ .
Different things work for different people at different times so try to be kind to yourself if,ꯇꯣꯉꯥꯟ-ꯇꯣꯉꯥꯅꯕꯥ ꯋꯥꯐꯃꯁꯤꯡꯅꯥ ꯇꯣꯉꯥꯟ-ꯇꯣꯉꯥꯅꯕꯥ ꯃꯇꯃꯗꯥ ꯇꯣꯉꯥꯟ-ꯇꯣꯉꯥꯅꯕꯥ ꯃꯇꯃꯗꯥ ꯊꯕꯛ ꯇꯧꯏ ꯃꯔꯝ ꯑꯗꯨꯅꯥ ꯀꯔꯤꯒꯨꯝꯕꯥ ꯅꯍꯥꯛꯅꯥ ꯃꯁꯥꯃꯀꯄꯨ ꯃꯤꯅꯨꯡꯁꯤ ꯂꯩꯅꯕꯥ ꯍꯣꯠꯅꯧ꯫
some things don't work for you. We are all unique so things you find helpful when you,ꯋꯥꯐꯝ ꯈꯔꯗꯤ ꯑꯗꯣꯃꯒꯤꯗꯃꯛ ꯊꯕꯛ ꯇꯧꯗꯦ꯫
"are struggling may be really personal to you, and may change over time","ꯂꯥꯟꯊꯦꯡꯅꯔꯤꯕꯥ ꯑꯁꯤ ꯑꯗꯣꯃꯒꯤꯗꯃꯛꯇꯥ ꯇꯁꯦꯡꯅꯥ ꯄꯔꯁꯣꯅꯦꯜ ꯑꯣꯏꯕꯥ ꯌꯥꯏ, ꯑꯃꯁꯨꯡ ꯃꯇꯃꯒꯤ ꯃꯇꯨꯡ ꯏꯟꯅꯥ ꯍꯣꯡꯂꯀꯄꯥ ꯌꯥꯏ"
What can I do now?,ꯍꯧꯖꯤꯛ ꯑꯩꯅꯥ ꯀꯔꯤ ꯇꯧꯕꯥ ꯌꯥꯕꯒꯦ?
What can I do in the longer-term?,ꯃꯇꯝ ꯁꯥꯡꯅꯥ ꯑꯩꯅꯥ ꯀꯔꯤ ꯇꯧꯕꯥ ꯌꯥꯕꯒꯦ?
What can I do now?,ꯍꯧꯖꯤꯛ ꯑꯩꯅꯥ ꯀꯔꯤ ꯇꯧꯕꯥ ꯌꯥꯕꯒꯦ?
If you're experiencing lots of difficult feelings and are particularly overwhelmed it can be,ꯀꯔꯤꯒꯨꯝꯕꯥ ꯅꯍꯥꯛꯅꯥ ꯑꯔꯨꯕꯥ ꯐꯤꯚꯝ ꯀꯌꯥ ꯑꯃꯥ ꯊꯦꯡꯅꯔꯕꯗꯤ ꯑꯃꯁꯨꯡ ꯃꯔꯨꯑꯣꯏꯅꯥ ꯌꯥꯝꯅꯥ ꯋꯥꯅꯥ ꯊꯣꯛꯂꯕꯗꯤ ꯃꯗꯨ ꯑꯣꯏꯕꯥ ꯌꯥꯏ꯫
useful to break things down and focus on one thing at a time. Below is a list of tips and,ꯄꯣꯠꯁꯤꯡ ꯊꯨꯒꯥꯏꯕꯥ ꯑꯃꯁꯨꯡ ꯃꯇꯝ ꯑꯃꯗꯥ ꯋꯥꯐꯝ ꯑꯃꯗꯥ ꯃꯤꯠꯌꯦꯡ ꯊꯝꯕꯥ ꯀꯥꯟꯅꯕꯥ꯫
techniques which might help you through difficult periods and over time you might develop,ꯑꯔꯨꯕꯥ ꯃꯇꯃꯁꯤꯡꯒꯤ ꯃꯅꯨꯡꯗꯥ ꯑꯃꯁꯨꯡ ꯃꯇꯃꯒꯤ ꯃꯇꯨꯡ ꯏꯟꯅꯥ ꯑꯗꯣꯝꯅꯥ ꯗꯤꯕꯦꯂꯞ ꯇꯧꯕꯥ ꯌꯥꯕꯥ ꯇꯦꯛꯅꯤꯀꯁꯤꯡ
your own techniques to add to this list,ꯂꯤꯁ꯭ꯠ ꯑꯁꯤꯗꯥ ꯍꯥꯄꯆꯤꯟꯅꯕꯥ ꯑꯗꯣꯃꯒꯤ ꯏꯁꯥꯒꯤ ꯇꯦꯛꯅꯤꯀꯁꯤꯡ
"If you're feeling angry, frustrated or restless","ꯀꯔꯤꯒꯨꯝꯕꯥ ꯅꯍꯥꯛꯅꯥ ꯋꯥꯈꯜ ꯅꯨꯡꯉꯥꯏꯇꯕꯥ, ꯋꯥꯈꯜ ꯅꯨꯡꯉꯥꯏꯇꯕꯥ ꯅꯠꯠꯔꯒꯥ ꯋꯥꯈꯜ ꯅꯨꯡꯉꯥꯏꯇꯕꯥ ꯐꯥꯎꯔꯕꯗꯤ"
What you could do to get through it:,ꯃꯁꯤꯒꯤ ꯃꯅꯨꯡꯗꯥ ꯆꯪꯁꯤꯟꯅꯕꯥ ꯅꯍꯥꯛꯅꯥ ꯇꯧꯕꯥ ꯌꯥꯕꯥ ꯊꯕꯀꯁꯤꯡ:
try a breathing exercise,ꯁ꯭ꯕꯔ ꯍꯣꯅꯕꯒꯤ ꯑꯦꯛꯁꯔꯁꯥꯏꯖ ꯑꯃꯥ ꯍꯣꯠꯅꯧ
"turn up your favourite music, and dance or sing","ꯅꯍꯥꯛꯀꯤ ꯅꯨꯡꯁꯤꯖꯔꯕꯥ ꯃ꯭ꯌꯨꯖꯤꯛ ꯑꯗꯨ ꯇꯩꯁꯤꯜꯂꯨ, ꯑꯃꯁꯨꯡ ꯅꯥꯠ ꯅꯠꯠꯔꯒꯥ ꯏꯁꯩ ꯁꯀꯎ꯫"
"do something with your hands, like fixing something or making something",ꯀꯔꯤꯒꯨꯝꯕꯥ ꯄꯣꯠꯁꯛ ꯑꯃꯥ ꯁꯦꯃꯖꯤꯅꯕꯥ ꯅꯠꯠꯔꯒꯥ ꯀꯔꯤꯒꯨꯝꯕꯥ ꯑꯃꯥ ꯁꯦꯝꯕꯥ ꯑꯁꯤꯒꯨꯝꯕꯥ ꯊꯕꯛ ꯑꯃꯥ ꯅꯍꯥꯛꯀꯤ ꯈꯨꯠꯅꯥ ꯇꯧꯕꯥ
"do something creative like colouring, drawing, creative writing or making music","ꯃꯆꯨ, ꯗ꯭ꯔꯣꯏꯪ, ꯀ꯭ꯔꯤꯌꯦꯇꯤꯕ ꯑꯣꯏꯕꯥ ꯏꯕꯥ ꯅꯠꯠꯔꯒꯥ ꯃ꯭ꯌꯨꯖꯤꯛ ꯁꯦꯝꯕꯥ ꯑꯁꯤꯅꯆꯤꯡꯕꯥ ꯀ꯭ꯔꯤꯌꯦꯇꯤꯕ ꯑꯣꯏꯕꯥ ꯊꯕꯛ ꯑꯃꯥ ꯇꯧꯕꯤꯌꯨ꯫"
write in a journal,ꯖꯔꯅꯦꯜ ꯑꯃꯗꯥ ꯏꯕꯤꯌꯨ
take a shower - some people find trying a cold shower in particular can help,ꯁꯣꯔꯣꯛ ꯑꯃꯥ ꯂꯧꯈꯠꯂꯨ - ꯃꯤꯑꯣꯏ ꯈꯔꯅꯥ ꯃꯔꯨꯑꯣꯏꯅꯥ ꯀꯣꯜꯗ ꯁꯣꯔ ꯑꯃꯥ ꯍꯣꯠꯅꯕꯅꯥ ꯃꯇꯦꯡ ꯄꯥꯡꯕꯥ ꯉꯃꯒꯅꯤ ꯍꯥꯌꯅꯥ ꯈꯜꯂꯤ
See our page on how to manage anger for more tips,ꯑꯍꯦꯅꯕꯥ ꯇꯤꯄꯁꯤꯡꯒꯤꯗꯃꯛꯇꯥ ꯑꯁꯥꯑꯣꯕꯥ ꯑꯁꯤ ꯀꯔꯝꯅꯥ ꯃꯦꯅꯦꯖ ꯇꯧꯒꯅꯤ ꯍꯥꯌꯕꯒꯤ ꯃꯇꯥꯡꯗꯥ ꯑꯩꯈꯣꯌꯒꯤ ꯄꯦꯖ ꯑꯁꯤ ꯌꯦꯡꯕꯤꯌꯨ
© Mind 2020,© ꯃꯥꯏꯟꯗ ꯲꯰꯲꯰ .
12,꯱꯲ ꯑꯃꯁꯨꯡ ꯱꯲.
"If you're feeling depressed, sad or lonely","ꯀꯔꯤꯒꯨꯝꯕꯥ ꯅꯍꯥꯛꯅꯥ ꯋꯥꯈꯜ ꯅꯨꯡꯉꯥꯏꯇꯕꯥ, ꯋꯥꯈꯜ ꯅꯨꯡꯉꯥꯏꯇꯕꯥ ꯅꯠꯠꯔꯒꯥ ꯇꯪꯗꯨ ꯂꯩꯇꯥꯕꯥ ꯐꯥꯑꯣꯔꯕꯗꯤ"
What you could do to get through it:,ꯃꯁꯤꯒꯤ ꯃꯅꯨꯡꯗꯥ ꯆꯪꯁꯤꯟꯅꯕꯥ ꯅꯍꯥꯛꯅꯥ ꯇꯧꯕꯥ ꯌꯥꯕꯥ ꯊꯕꯀꯁꯤꯡ:
get comfy and watch your favourite TV show,ꯀꯝꯐꯤ ꯂꯧꯕꯤꯌꯨ ꯑꯃꯁꯨꯡ ꯑꯗꯣꯃꯒꯤ ꯅꯨꯡꯁꯤꯖꯔꯕꯥ ꯇꯤ.ꯚꯤ.
read a favourite book,ꯌꯥꯝꯅꯥ ꯄꯥꯝꯅꯕꯥ ꯂꯥꯏꯔꯤꯛ ꯑꯃꯥ ꯄꯥꯕꯤꯌꯨ
write all your negative feelings on a piece of paper and scrunch or tear it up,ꯄꯦꯄꯔ ꯑꯃꯗꯥ ꯅꯍꯥꯛꯀꯤ ꯅꯦꯒꯦꯇꯤꯚ ꯐꯤꯜꯂꯤꯡ ꯄꯨꯝꯅꯃꯛ ꯏꯌꯨ ꯑꯃꯁꯨꯡ ꯃꯗꯨ ꯀꯨꯄꯁꯤꯜꯂꯨ ꯅꯠꯠꯔꯒꯥ ꯃꯗꯨ ꯂꯧꯊꯣꯀꯎ
listen to a song or watch a video you find uplifting,ꯏꯁꯩ ꯑꯃꯥ ꯇꯥꯕꯤꯌꯨ ꯅꯠꯔꯒꯥ ꯑꯗꯣꯝꯅꯥ ꯅꯨꯡꯉꯥꯏꯕꯥ ꯐꯣꯡꯗꯣꯀꯄꯥ ꯚꯤꯗꯤꯑꯣ ꯑꯃꯥ ꯌꯦꯡꯕꯤꯌꯨ
write a comforting letter to the part of yourself that is feeling sad or alone,ꯅꯨꯡꯉꯥꯏꯇꯕꯥ ꯅꯠꯠꯔꯒꯥ ꯋꯥꯈꯜ ꯅꯨꯡꯉꯥꯏꯇꯕꯥ ꯐꯥꯑꯣꯔꯤꯕꯥ ꯅꯍꯥꯛꯀꯤ ꯁꯔꯨꯛ ꯑꯗꯨꯗꯥ ꯅꯨꯡꯉꯥꯏꯕꯥ ꯆꯤꯊꯤ ꯑꯃꯥ ꯏꯕꯤꯌꯨ
cuddle a pet or a soft toy,ꯄꯣꯠꯁꯛ ꯑꯃꯥ ꯅꯠꯠꯔꯒꯥ ꯇꯔꯨ ꯇꯅꯥꯅꯕꯥ ꯄꯣꯠꯁꯛ ꯑꯃꯥ ꯀꯨꯄꯁꯤꯜꯂꯨ꯫
See our page on self-care for depression for more tips,ꯑꯍꯦꯅꯕꯥ ꯇꯤꯄꯁꯤꯡꯒꯤꯗꯃꯛꯇꯥ ꯗꯤꯞꯔꯦꯁꯅꯒꯤꯗꯃꯛꯇꯥ ꯁꯦꯜꯐ-ꯀꯦꯌꯔꯒꯤ ꯃꯇꯥꯡꯗꯥ ꯑꯩꯈꯣꯌꯒꯤ ꯄꯦꯖ ꯑꯁꯤ ꯌꯦꯡꯕꯤꯌꯨ
"If you're feeling anxious, panicky or tense","ꯀꯔꯤꯒꯨꯝꯕꯥ ꯅꯍꯥꯛꯅꯥ ꯋꯥꯈꯜ ꯋꯥꯕꯥ, ꯋꯥꯈꯜ ꯅꯨꯡꯉꯥꯏꯇꯕꯥ ꯅꯠꯠꯔꯒꯥ ꯋꯥꯈꯜ ꯅꯨꯡꯉꯥꯏꯇꯕꯥ ꯐꯥꯑꯣꯔꯕꯗꯤ꯫"
What you could do to get through it:,ꯃꯁꯤꯒꯤ ꯃꯅꯨꯡꯗꯥ ꯆꯪꯁꯤꯟꯅꯕꯥ ꯅꯍꯥꯛꯅꯥ ꯇꯧꯕꯥ ꯌꯥꯕꯥ ꯊꯕꯀꯁꯤꯡ:
"make yourself a hot drink and drink it slowly, noticing the taste and smell, the","ꯃꯁꯥꯃꯀꯄꯨ ꯑꯁꯥꯕꯥ ꯊꯛꯅꯕꯥ ꯏꯁꯤꯡ ꯑꯃꯥ ꯁꯦꯝꯃꯨ ꯑꯃꯁꯨꯡ ꯃꯗꯨ ꯇꯞꯅꯥ ꯇꯞꯅꯥ ꯊꯀꯎ, ꯃꯗꯨꯒꯤ ꯃꯃꯤ ꯑꯃꯁꯨꯡ ꯃꯃꯤ ꯑꯗꯨ ꯈꯪꯖꯤꯅꯕꯤꯌꯨ, ."
