en,mni-Mtei
School Experience,ꯁ꯭ꯀꯨꯂꯒꯤ ꯑꯦꯛꯁꯄꯤꯔꯤꯑꯦꯟꯁ ꯂꯩꯕꯥ
The school language environment will also play a significant role in,ꯁ꯭ꯀꯨꯜ ꯂꯣꯂꯒꯤ ꯑꯀꯣꯌꯕꯅꯥ ꯲꯰꯲꯰ꯗꯥ ꯃꯔꯨꯑꯣꯏꯕꯥ ꯊꯧꯗꯥꯡ ꯂꯧꯒꯅꯤ꯫
language development. A school with adequate library resources for,ꯂꯣꯜ ꯁꯦꯃꯒꯠꯄꯥ꯫
"language teaching, and a school with good language model will foster","ꯂꯣꯜ ꯇꯝꯕꯤꯕꯥ, ꯑꯃꯁꯨꯡ ꯑꯐꯕꯥ ꯂꯣꯜ ꯃꯣꯗꯦꯜ ꯂꯩꯕꯥ ꯁ꯭ꯀꯨꯜ ꯑꯃꯅꯥ ꯌꯣꯀꯈꯠꯀꯅꯤ"
"language development. Conversely, a school with impoverished",ꯂꯣꯜ ꯁꯦꯃꯒꯠꯄꯥ꯫
language environment will not encourage fast rate of language,ꯂꯣꯂꯒꯤ ꯑꯀꯣꯌꯕꯅꯥ ꯂꯣꯂꯒꯤ ꯈꯣꯡꯖꯦꯜ ꯌꯥꯡꯅꯥ ꯔꯦꯠ ꯇꯧꯕꯥ ꯑꯁꯤ ꯄꯨꯛꯅꯤꯡ ꯊꯧꯒꯠꯂꯣꯏ
"development. In a second language situation, teachers are strong models",ꯆꯥꯎꯈꯠꯄ.
for language development. If teachers are inefficient in their use of,ꯂꯣꯜ ꯆꯥꯎꯈꯠꯍꯟꯅꯕꯒꯤꯗꯃꯛ꯫
"language, there will be a ripple effect on the children’s language","ꯂꯣꯜ, ꯑꯉꯥꯡꯁꯤꯡꯒꯤ ꯂꯣꯟꯗꯥ ꯔꯤꯄꯕ꯭ꯂꯤꯛ ꯏꯐꯦꯛꯇ ꯑꯃꯥ ꯂꯩꯒꯅꯤ"
development,ꯆꯥꯎꯈꯠꯄ
3.3.4 Educational Implications,꯳.꯳.꯴ ꯑꯦꯖꯨꯀꯦꯁꯅꯦꯜ ꯏꯝꯞꯂꯤꯀꯦꯁꯅꯁꯤꯡ .
The educational implications for language development are as follows:,ꯂꯣꯜ ꯁꯦꯃꯒꯠꯄꯒꯤ ꯃꯍꯩ-ꯃꯁꯤꯡꯒꯤ ꯑꯣꯏꯕꯥ ꯋꯥꯐꯃꯁꯤꯡ ꯑꯁꯤ ꯃꯈꯥꯗꯥ ꯄꯤꯔꯤ:
Language is the means by which the child expresses complex information,ꯂꯣꯜ ꯍꯥꯌꯕꯁꯤ ꯑꯉꯥꯡ ꯑꯗꯨꯅꯥ ꯀꯝꯞꯂꯦꯛꯁ ꯑꯣꯏꯕꯥ ꯏꯅꯐꯣꯔꯃꯦꯁꯟ ꯐꯣꯡꯗꯣꯀꯄꯒꯤ ꯄꯥꯝꯕꯩꯅꯤ .
about their thought and understanding of the world. A child with good,ꯃꯥꯂꯦꯃꯒꯤ ꯃꯔꯃꯗꯥ ꯃꯈꯣꯌꯒꯤ ꯋꯥꯈꯜꯂꯣꯟ ꯑꯃꯁꯨꯡ ꯂꯧꯁꯤꯡꯒꯤ ꯃꯇꯥꯡꯗꯥ꯫
language facility is able to communicate more effectively than the child,ꯂꯣꯜ ꯐꯦꯁꯤꯂꯤꯇꯤ ꯑꯁꯤꯅꯥ ꯑꯉꯥꯡ ꯑꯗꯨꯗꯒꯤ ꯍꯦꯟꯅꯥ ꯏꯐꯦꯛꯇꯤꯕ ꯑꯣꯏꯅꯥ ꯄꯥꯎ ꯐꯥꯑꯣꯅꯕꯥ ꯉꯝꯃꯤ
with poor language facility. Effective communication results in more,ꯂꯣꯂꯒꯤ ꯈꯨꯗꯣꯡꯆꯥꯕꯥ ꯐꯪꯗꯕꯥ꯫
fruitful social intercourse. Fruitful interpersonal experience helps in,ꯃꯍꯩ ꯌꯥꯜꯂꯕꯥ ꯁꯣꯁꯤꯑꯦꯜ ꯏꯟꯇꯔꯀꯣꯔꯁ꯫
confidence building. Self-confidence is related to self-esteem.   Self-,ꯊꯥꯖꯕꯥ ꯁꯦꯃꯒꯠꯄꯥ꯫
"esteem is related to self-efficacy beliefs. Indeed, adequate language",ꯏꯁ꯭ꯇꯤꯃꯦꯠ ꯑꯁꯤ ꯁꯦꯜꯐ-ꯑꯦꯐꯤꯀꯦꯁꯅꯒꯤ ꯊꯥꯖꯕꯁꯤꯡꯒꯥ ꯃꯔꯤ ꯂꯩꯅꯩ꯫
"facility should help the child develop appropriate sense of values, and a","ꯐꯦꯁꯤꯂꯤꯇꯤ ꯑꯁꯤꯅꯥ ꯑꯉꯥꯡ ꯑꯗꯨꯕꯨ ꯃꯇꯤꯛ ꯆꯥꯕꯥ ꯚꯦꯜꯌꯨꯁꯤꯡ ꯁꯦꯃꯒꯠꯄꯗꯥ ꯃꯇꯦꯡ ꯄꯥꯡꯒꯗꯕꯅꯤ, ꯑꯃꯁꯨꯡ ꯑꯦ."
healthy attitude towards people and life. These are important socio-,ꯃꯤꯑꯣꯏꯕꯁꯤꯡ ꯑꯃꯁꯨꯡ ꯄꯨꯟꯁꯤꯒꯤ ꯃꯇꯥꯡꯗꯥ ꯍꯀꯆꯥꯡ ꯐꯕꯥ ꯋꯥꯈꯜꯂꯣꯟ꯫
cognitive variables that are related to school adjustment and,ꯁ꯭ꯀꯨꯜ ꯑꯦꯗꯖꯁ꯭ꯇꯃꯦꯟꯇꯒꯥ ꯃꯔꯤ ꯂꯩꯅꯕꯥ ꯀꯣꯒꯅꯤꯇꯤꯚ ꯚꯦꯔꯤꯑꯦꯕꯂꯁꯤꯡ ꯑꯃꯁꯨꯡ .
academic achievement,ꯑꯦꯀꯥꯗꯦꯃꯤꯛ ꯑꯦꯆꯤꯕꯃꯦꯟꯇ ꯇꯧꯕꯥ
"Language is involved in thinking,","ꯂꯣꯜ ꯑꯁꯤ ꯋꯥꯈꯜ ꯈꯅꯕꯥ, ."
"memory reasoning,","ꯃꯦꯃꯣꯔꯤ ꯔꯤꯖꯅꯦꯜ ꯑꯣꯏꯕꯥ, ."
"planning, and problem solving. Therefore, adequate facility in","ꯄ꯭ꯂꯥꯅꯤꯡ, ꯑꯃꯁꯨꯡ ꯄ꯭ꯔꯣꯕ꯭ꯂꯦꯝ ꯁꯣꯜꯕ ꯇꯧꯕꯥ꯫"
language usage will also engender faster development of these,ꯂꯣꯜ ꯁꯤꯖꯤꯟꯅꯕꯅꯥ ꯍꯥꯌꯔꯤꯕꯁꯤꯡ ꯑꯁꯤ ꯌꯥꯝꯅꯥ ꯊꯨꯅꯥ ꯆꯥꯎꯈꯠꯍꯅꯕꯁꯨ ꯉꯃꯒꯅꯤ꯫
cognitive abilities. These cognitive abilities are positively related,ꯀꯣꯒꯅꯤꯇꯤꯕ ꯑꯦꯕꯤꯂꯤꯇꯤꯁꯤꯡ꯫
to school achievement,ꯁ꯭ꯀꯨꯜ ꯑꯦꯆꯤꯕꯃꯦꯟꯇ ꯇꯧꯕꯥ .
Since children understand language before they speak the,ꯃꯔꯃꯗꯤ ꯑꯉꯥꯡꯁꯤꯡꯅꯥ ꯂꯣꯜ ꯇꯝꯕꯒꯤ ꯃꯃꯥꯡꯗꯥ ꯂꯣꯜ ꯈꯉꯕꯥ .
"language, teachers are reminded that concrete experiences","ꯂꯣꯜ, ꯑꯣꯖꯥꯁꯤꯡꯗꯥ ꯅꯤꯡꯁꯤꯡꯍꯜꯂꯤ ꯃꯗꯨꯗꯤ ꯀꯟꯠꯔꯦꯛꯇ ꯑꯦꯛꯁꯄꯔꯤꯑꯦꯟꯁꯁꯤꯡ"
enhance children’s interaction with their environment,ꯑꯉꯥꯡꯁꯤꯡꯅꯥ ꯃꯈꯣꯌꯒꯤ ꯑꯀꯣꯌꯔꯣꯅꯒꯥ ꯂꯣꯌꯅꯅꯥ ꯏꯟꯇꯔꯦꯛꯁꯟ ꯍꯦꯅꯒꯠꯍꯅꯕꯥ
Adequate experiences provided early in the child’s life stimulate,ꯑꯉꯥꯡ ꯑꯗꯨꯒꯤ ꯄꯨꯟꯁꯤꯗꯥ ꯇꯣꯏꯅꯥ ꯄꯤꯕꯥ ꯃꯇꯤꯛ ꯆꯥꯕꯥ ꯑꯦꯛꯁꯄꯔꯤꯌꯦꯟꯁꯁꯤꯡ ꯑꯗꯨ ꯁ꯭ꯇꯤꯝꯌꯨꯜ ꯇꯧꯕꯥ ꯌꯥꯏ꯫
schema elaboration. The child’s understanding of things and,ꯁ꯭ꯀꯤꯝ ꯏꯂꯥꯕꯔꯦꯁꯟ ꯇꯧꯕꯥ꯫
events in their immediate environment will facilitate language,ꯃꯈꯣꯌꯒꯤ ꯈꯨꯗꯛꯀꯤ ꯑꯣꯏꯕꯥ ꯑꯀꯣꯌꯕꯗꯥ ꯊꯣꯀꯄꯥ ꯊꯧꯗꯣꯀꯁꯤꯡꯅꯥ ꯂꯣꯂꯗꯥ ꯂꯥꯏꯊꯣꯀꯍꯜꯂꯒꯅꯤ .
development,ꯆꯥꯎꯈꯠꯄ
The language model in the child’s immediate environment,ꯑꯉꯥꯡ ꯑꯗꯨꯒꯤ ꯈꯨꯗꯛꯀꯤ ꯑꯣꯏꯕꯥ ꯑꯀꯣꯌꯕꯗꯥ ꯂꯩꯕꯥ ꯂꯣꯂꯒꯤ ꯃꯣꯗꯦꯜ ꯑꯗꯨ .
influences language development. The school authorities are,ꯂꯣꯜ ꯁꯦꯃꯒꯠꯄꯗꯥ ꯁꯥꯐꯨ ꯄꯤꯔꯤ꯫
advised to provide rich language environment to foster language,ꯂꯣꯜ ꯌꯣꯀꯈꯠꯅꯕꯥ ꯔꯤꯆ ꯂꯣꯂꯒꯤ ꯑꯀꯣꯌꯕꯥ ꯄꯤꯅꯕꯥ ꯄꯥꯎꯇꯥꯛ ꯄꯤꯈ꯭ꯔꯦ
development of school children,ꯁ꯭ꯀꯨꯂꯒꯤ ꯑꯉꯥꯡꯁꯤꯡꯒꯤ ꯗꯤꯚꯦꯂꯄꯃꯦꯟꯇ
It is important that early,ꯃꯁꯤ ꯃꯔꯨꯑꯣꯏꯕꯥ ꯑꯃꯅꯤ ꯃꯗꯨꯗꯤ ꯉꯟꯅꯥ [...]
childhood,ꯑꯉꯥꯡ ꯑꯣꯏꯔꯤꯉꯩ ꯃꯇꯝ
education,ꯃꯍꯩ ꯃꯁꯤꯡ
providers,ꯄ꯭ꯔꯣꯚꯥꯏꯗꯔꯁꯤꯡꯅꯥ ꯑꯦꯝ.ꯑꯦꯁ.ꯑꯦꯝ.ꯏ.
implement the National Policy on Education provision that the,ꯑꯦꯖꯨꯀꯦꯁꯅꯒꯤ ꯄ꯭ꯔꯣꯕꯤꯖꯅꯒꯤ ꯃꯇꯥꯡꯗꯥ ꯅꯦꯁ꯭ꯅꯦꯜ ꯄꯣꯂꯤꯁꯤ ꯑꯁꯤ ꯊꯕꯛ ꯑꯣꯏꯅꯥ ꯄꯥꯌꯈꯠꯄꯥ .
"language of instruction should be the vernacular, and that the","ꯏꯅꯁ꯭ꯠꯔꯀꯁꯅꯒꯤ ꯂꯣꯜ ꯑꯁꯤ ꯕꯔꯅꯥꯀꯨꯂꯥꯔ ꯑꯣꯏꯒꯗꯕꯅꯤ, ꯑꯃꯁꯨꯡ ꯃꯗꯨ ."
second language should be taught as a subject. This will ensure,ꯑꯅꯤꯁꯨꯕꯥ ꯂꯣꯜ ꯑꯁꯤ ꯍꯤꯔꯝ ꯑꯃꯥ ꯑꯣꯏꯅꯥ ꯇꯝꯕꯤꯒꯗꯕꯅꯤ꯫
PED121,ꯄꯤ.ꯏ.ꯗꯤ.꯱꯲꯱ ꯑꯃꯁꯨꯡ ꯑꯦꯟ.
CHILDHOOD AND ADOLESCENT PSYCHOLOGY,ꯑꯉꯥꯡ ꯑꯣꯏꯔꯤꯉꯩ ꯑꯃꯁꯨꯡ ꯏꯅꯈꯠꯂꯛꯂꯤꯕꯥ ꯁꯥꯏꯀꯣꯂꯣꯖꯤ
76,꯷꯶ .
that children master the first language before being exposed to,ꯑꯉꯥꯡꯁꯤꯡꯅꯥ ꯑꯍꯥꯅꯕꯥ ꯂꯣꯟꯗꯥ ꯑꯦꯛꯁꯄꯣꯖ ꯇꯧꯗ꯭ꯔꯤꯉꯩꯗꯥ ꯑꯍꯥꯅꯕꯥ ꯂꯣꯜ ꯃꯥꯁ꯭ꯇꯔ ꯇꯧꯕꯥ .
"the second language. In this way, children will reap the benefit",ꯑꯅꯤꯁꯨꯕꯥ ꯂꯣꯜ꯫
of bilingualism,ꯕꯥꯏꯂꯤꯉ꯭ꯒꯨꯑꯦꯂꯤꯖꯃꯒꯤ ꯃꯇꯥꯡꯗꯥ ꯋꯥꯐꯝ ꯀꯌꯥ ꯊꯃꯈꯤ꯫
3.4,꯳.꯴ ꯑꯣꯏꯈꯤ꯫
Summary,ꯁꯝꯂꯞꯄ ꯋꯥꯔꯣꯜ
You should have learnt that language is a form of communication using,ꯂꯣꯜ ꯑꯁꯤ ꯁꯤꯖꯤꯟꯅꯗꯨꯅꯥ ꯄꯥꯎ ꯐꯥꯑꯣꯅꯕꯒꯤ ꯃꯑꯣꯡ ꯑꯃꯅꯤ ꯍꯥꯌꯕꯥ ꯅꯍꯥꯛꯅꯥ ꯈꯉꯒꯗꯕꯅꯤ꯫
"a system of symbols; you should also have learnt the definition, process",ꯁꯤꯝꯕꯣꯂꯁꯤꯡꯒꯤ ꯁꯤꯁ꯭ꯇꯦꯝ ꯑꯃꯥ;
of language development from childhood to adolescence. You should be,ꯑꯉꯥꯡ ꯑꯣꯏꯔꯤꯉꯩꯗꯒꯤ ꯍꯧꯅꯥ ꯏꯅꯈꯠꯂꯀꯄꯥ ꯐꯥꯑꯣꯕꯒꯤ ꯂꯣꯜ ꯗꯤꯕꯦꯂꯄꯃꯦꯟꯇꯀꯤ ꯃꯇꯥꯡꯗꯥ ꯋꯥꯐꯝ ꯀꯌꯥ ꯊꯃꯈꯤ꯫
familiar with the factors that influence language development and the,ꯂꯣꯜ ꯁꯦꯃꯒꯠꯄꯗꯥ ꯁꯥꯐꯨ ꯄꯤꯔꯤꯕꯥ ꯐꯦꯛꯇꯔꯁꯤꯡ ꯑꯁꯤ ꯈꯉꯕꯥ ꯑꯃꯁꯨꯡ .
educational implication to language development,ꯂꯣꯜ ꯁꯦꯃꯒꯠꯄꯗꯥ ꯑꯦꯖꯨꯀꯦꯁꯅꯦꯜ ꯏꯝꯞꯂꯤꯀꯦꯁꯟ .
Self-Assessment Exercises,ꯁꯦꯜꯐ-ꯑꯦꯁꯦꯁꯃꯦꯟꯇ ꯑꯦꯛꯁꯔꯁꯥꯏꯖꯁꯤꯡ .
Fill the Blank,ꯕ꯭ꯂꯦꯉ꯭ꯛ ꯑꯗꯨ ꯃꯄꯨꯡ ꯐꯥꯍꯅꯕꯥ .
1,꯱.
"It is a systematic, meaningful arrangement of, which provides the","ꯃꯁꯤ ꯁꯤꯁ꯭ꯇꯦꯃꯦꯇꯤꯛ ꯑꯣꯏꯕꯥ, ꯑꯔꯊ ꯂꯩꯕꯥ ꯊꯧꯔꯥꯡ ꯑꯃꯅꯤ, ꯃꯁꯤꯅꯥ ꯄꯤꯔꯤꯕꯥ ."
basis for communication symbols,ꯀꯝꯝꯌꯨꯅꯤꯀꯦꯁꯟ ꯁꯤꯝꯕꯣꯂꯁꯤꯡꯒꯤ ꯌꯨꯝꯐꯝ .
2,꯲ ꯑꯃꯁꯨꯡ ꯲.
"Language has three main characteristics namely  phonology,","ꯂꯣꯂꯗꯥ ꯃꯔꯨꯑꯣꯏꯕꯥ ꯃꯁꯛ ꯑꯍꯨꯝ ꯍꯥꯌꯕꯗꯤ ꯐꯣꯅꯣꯂꯣꯖꯤ, ."
morphemes and semantics,ꯃꯣꯔꯐꯦꯝ ꯑꯃꯁꯨꯡ ꯁꯦꯃꯦꯟꯇꯤꯀꯁꯤꯡ .
3,꯳ ꯑꯃꯁꯨꯡ ꯳.
Factors  that can influence language include the followings except,ꯂꯣꯂꯗꯥ ꯏꯊꯤꯜ ꯄꯤꯕꯥ ꯉꯝꯕꯥ ꯐꯦꯛꯇꯔꯁꯤꯡꯅꯥ ꯃꯈꯥꯗꯥ ꯄꯤꯔꯤꯕꯥ ꯑꯁꯤ ꯌꯥꯑꯣꯔꯤꯕꯁꯤꯡ ꯑꯁꯤ ꯌꯥꯑꯣꯔꯤ꯫
"maturation, language ---------- and school experience","ꯃꯦꯆ꯭ꯌꯨꯔꯦꯁꯟ, ꯂꯣꯜ ---------- ꯑꯃꯁꯨꯡ ꯁ꯭ꯀꯨꯂꯒꯤ ꯑꯦꯛꯁꯄꯔꯤꯌꯦꯟꯁ"
4,꯴ ꯑꯃꯁꯨꯡ ꯴.
Bilingualism is the use of more than ---------language,ꯕꯥꯏꯂꯤꯉ꯭ꯒꯨꯑꯦꯂꯤꯖꯝ ꯍꯥꯌꯕꯁꯤ ꯍꯦꯟꯅꯥ --------- ꯂꯣꯂꯒꯤ ꯁꯤꯖꯤꯟꯅꯐꯝꯅꯤ꯫
5,꯵ ꯑꯃꯁꯨꯡ ꯵.
Halophrases.is -------------uttered,ꯍꯥꯂꯣꯐ꯭ꯔꯌꯥꯁ.ꯏꯁ ---------------
3.5  References/Further Readings/Web Sources,꯳.꯵ ꯔꯤꯐꯔꯦꯟꯁꯁꯤꯡ/ꯃꯈꯥ ꯇꯥꯕꯥ ꯔꯤꯗꯤꯡꯁꯤꯡ/ꯋꯦꯕ ꯁꯣꯔꯁꯁꯤꯡ
"Chomsky, N. (1978). “On the Biological Basis of Language Capacities”","ꯆꯣꯃꯁ꯭ꯀꯤ, ꯑꯦꯟ.(꯱꯹꯷꯸) ꯑꯃꯁꯨꯡ ꯑꯦꯝ."
"In Miller, G.A. & Lennenberg, E. (eds.). Psychology and Biology",ꯃꯤꯂꯔꯗꯥ ꯂꯩꯕꯥ ꯖꯤ.ꯑꯦ.
of Language and Thought. New York: Academic Press,ꯂꯣꯜ ꯑꯃꯁꯨꯡ ꯋꯥꯈꯜꯂꯣꯅꯒꯤ꯫
"Genesse, F.   (1994).   Bilingualism.   In   Ramachandran,   V.S.   (ed.)","ꯖꯤꯅꯦꯁꯦ, ꯑꯦꯐ.(꯱꯹꯹꯴) ꯑꯃꯁꯨꯡ ꯑꯦꯝ."
Encyclopedia of Human Behaviour. San Diego: Academic Press,ꯃꯤꯑꯣꯏꯕꯒꯤ ꯂꯃꯆꯠ-ꯁꯥꯖꯠꯀꯤ ꯑꯦꯅꯁꯥꯏꯛꯂꯣꯄꯤꯗꯤꯌꯥ꯫
"Hart, B. Risley & R.T. (1995). Meaningful Differences in the Everyday","ꯍꯥꯔꯠ, ꯕꯤ.ꯔꯤꯁꯂꯦ ꯑꯃꯁꯨꯡ ꯑꯥꯔ.ꯇꯤ."
Experience of Young American Children. Baltimore: Brookes,ꯅꯍꯥ ꯑꯣꯏꯔꯤꯕꯥ ꯑꯃꯦꯔꯤꯀꯥꯒꯤ ꯑꯉꯥꯡꯁꯤꯡꯒꯤ ꯑꯦꯛꯁꯄꯔꯤꯌꯦꯟꯁ꯫
"Romaine, S. (1994). Bilingualism (2nd ed.). London: Blackwell","ꯔꯣꯃꯦꯟ, ꯑꯦꯁ.(꯱꯹꯹꯴) ꯑꯃꯁꯨꯡ ꯑꯦꯝ."
PED121,ꯄꯤ.ꯏ.ꯗꯤ.꯱꯲꯱ ꯑꯃꯁꯨꯡ ꯑꯦꯟ.
MODULE 2,ꯃꯣꯗ꯭ꯌꯨꯜ ꯲.
77,꯷꯷ ꯑꯃꯁꯨꯡ ꯑꯦꯟ.
3.6  Possible Answers to Self-Assessment Exercise(s),꯳.꯶ ꯁꯦꯜꯐ-ꯑꯦꯁꯦꯁꯃꯦꯟꯇ ꯑꯦꯛꯁꯔꯁꯥꯏꯖ(ꯁꯤꯡ)ꯒꯤ ꯑꯣꯏꯊꯣꯀꯄꯥ ꯌꯥꯕꯥ ꯄꯥꯎꯈꯨꯃꯁꯤꯡ
Answers to Self-Assessment Exercises,ꯁꯦꯜꯐ-ꯑꯦꯁꯦꯁꯃꯦꯟꯇ ꯑꯦꯛꯁꯔꯁꯥꯏꯖꯁꯤꯡꯒꯤ ꯄꯥꯎꯈꯨꯃꯁꯤꯡ
1. Symbols,꯱.ꯒꯤ ꯆꯤꯟ ꯱.
2.  Semantics,꯲.ꯁꯦꯃꯦꯟꯇꯤꯛ ꯑꯣꯏꯕꯥ ꯲.
3.   Model,꯳.ꯃꯣꯗꯦꯜ ꯳.
4.   One,꯴.
5.  One-word,꯵.ꯋꯥꯍꯩ ꯑꯃꯈꯛ
PED121,ꯄꯤ.ꯏ.ꯗꯤ.꯱꯲꯱ ꯑꯃꯁꯨꯡ ꯑꯦꯟ.
CHILDHOOD AND ADOLESCENT PSYCHOLOGY,ꯑꯉꯥꯡ ꯑꯣꯏꯔꯤꯉꯩ ꯑꯃꯁꯨꯡ ꯏꯅꯈꯠꯂꯛꯂꯤꯕꯥ ꯁꯥꯏꯀꯣꯂꯣꯖꯤ
78,꯷꯸ ꯑꯃꯁꯨꯡ ꯑꯦꯟ.
UNIT 4,ꯌꯨꯅꯤꯠ ꯴.
EMOTIONAL DEVELOPMENT,ꯏꯃꯣꯁꯅꯦꯜ ꯗꯤꯚꯦꯂꯄꯃꯦꯟꯇ
CONTENTS,ꯀꯟꯇꯦꯟꯇꯁꯤꯡ ꯑꯁꯤ .
4.1,꯴.꯱ ꯑꯣꯏꯈꯤ꯫
Introduction,ꯁꯛꯇꯥꯛꯄ
4.2,꯴.꯲ ꯑꯣꯏꯈꯤ꯫
Learning Outcomes,ꯇꯝꯕꯒꯤ ꯃꯍꯩꯁꯤꯡ .
4.3      Title of the Main Sections,꯴.꯳ ꯃꯔꯨꯑꯣꯏꯕꯥ ꯁꯦꯛꯁꯅꯁꯤꯡꯒꯤ ꯇꯥꯏꯇꯦꯜ
4.3.1       Meaning and Types of Emotions,꯴.꯳.꯱ꯒꯤ ꯑꯔꯊ ꯑꯃꯁꯨꯡ ꯏꯃꯣꯁꯅꯁꯤꯡꯒꯤ ꯃꯈꯂꯁꯤꯡ
4.3.2       Trends of Emotional Development,꯴.꯳.꯲ ꯏꯃꯣꯁꯅꯦꯜ ꯗꯤꯕꯦꯂꯄꯃꯦꯟꯇꯀꯤ ꯇ꯭ꯔꯦꯟꯗꯁꯤꯡ
4.3.3        Factors that Influence Emotional Development,4.3.3 ꯏꯃꯣꯁꯅꯦꯜ ꯗꯤꯚꯦꯂꯄꯃꯦꯟꯇꯗꯥ ꯁꯥꯐꯨ ꯄꯤꯔꯤꯕꯥ ꯐꯦꯛꯇꯔꯁꯤꯡ
4.3.4        Educational Implications,꯴.꯳.꯴ ꯑꯦꯖꯨꯀꯦꯁꯅꯒꯤ ꯃꯇꯥꯡꯗꯥ ꯋꯥꯐꯝ ꯀꯌꯥ ꯊꯃꯈꯤ꯫
4.4      Conclusion,꯴.꯴ ꯂꯣꯏꯁꯤꯅꯕꯥ
4.5,꯴.꯵ ꯑꯣꯏꯈꯤ꯫
Summary,ꯁꯝꯂꯞꯄ ꯋꯥꯔꯣꯜ
4.6,꯴.꯶ ꯑꯣꯏꯈꯤ꯫
References/Further Readings/Web Sources/Web Sources,ꯔꯤꯐꯔꯦꯟꯁꯁꯤꯡ/ꯃꯈꯥ ꯇꯥꯕꯥ ꯔꯤꯗꯤꯡꯁꯤꯡ/ꯋꯦꯕ ꯁꯣꯔꯁꯁꯤꯡ/ꯋꯦꯕ ꯁꯣꯔꯁꯁꯤꯡ
3.1,꯳.꯱ ꯑꯣꯏꯈꯤ꯫
Introduction,ꯁꯛꯇꯥꯛꯄ
Human beings are said to be creatures of emotions. Emotions provide,ꯃꯤꯑꯣꯏꯕꯅꯥ ꯏꯃꯣꯁꯅꯒꯤ ꯖꯤꯕꯁꯤꯡꯅꯤ ꯍꯥꯌꯅꯥ ꯍꯥꯌꯅꯩ꯫
the force that enable human beings to deal with different circumstances,ꯃꯤꯑꯣꯏꯕꯅꯥ ꯇꯣꯉꯥꯟ ꯇꯣꯉꯥꯅꯕꯥ ꯐꯤꯚꯃꯁꯤꯡ ꯊꯦꯡꯅꯕꯥ ꯉꯃꯍꯜꯂꯤꯕꯥ ꯐꯣꯔꯁ ꯑꯁꯤꯅꯥ .
of life. Emotions provide the motivation for action under difficult,ꯑꯣꯐ ꯂꯥꯏꯐ꯫
situations. Emotions add pleasure to our experiences,ꯐꯤꯚꯃꯁꯤꯡ꯫
"On the other hand, emotions could also becloud one’s enjoyment of","ꯑꯃꯔꯣꯃꯗꯥ, ꯏꯃꯣꯁꯅꯁꯤꯡꯅꯥ ꯀꯅꯥꯒꯨꯝꯕꯥ ꯑꯃꯒꯤ ꯅꯨꯡꯉꯥꯏꯕꯁꯨ ꯌꯥꯑꯣꯕꯥ ꯌꯥꯏ ."
"life’s opportunities. Indeed, emotions add colour and spice to one’s life",ꯄꯨꯟꯁꯤꯒꯤ ꯈꯨꯗꯣꯡꯆꯥꯕꯁꯤꯡ꯫
"In this unit, we examine the meaning of emotions, and types of emotions","ꯌꯨꯅꯤꯠ ꯑꯁꯤꯗꯥ ꯑꯩꯈꯣꯌꯅꯥ ꯏꯃꯣꯁꯅꯁꯤꯡꯒꯤ ꯑꯔꯊ, ꯑꯃꯁꯨꯡ ꯏꯃꯣꯁꯟ ꯃꯈꯂꯁꯤꯡ ꯌꯦꯡꯁꯤꯜꯂꯤ"
We discuss the sequence of emotional development. .We also outline,ꯑꯩꯈꯣꯌꯅꯥ ꯏꯃꯣꯁꯅꯦꯜ ꯗꯤꯕꯦꯂꯄꯃꯦꯟꯇꯀꯤ ꯁꯤꯛꯕꯦꯟꯁ ꯑꯗꯨ ꯈꯟꯅꯔꯤ꯫
"some factors that influence the development of emotions. Finally, we",ꯏꯃꯣꯁꯅꯁꯤꯡ ꯁꯦꯃꯒꯠꯄꯗꯥ ꯁꯥꯐꯨ ꯄꯤꯔꯤꯕꯥ ꯐꯦꯛꯇꯔ ꯈꯔꯗꯤ꯫
examine the educational significance of emotions,ꯏꯃꯣꯁꯅꯁꯤꯡꯒꯤ ꯃꯍꯩ-ꯃꯁꯤꯡꯒꯤ ꯃꯔꯨꯑꯣꯏꯕꯥ ꯑꯗꯨ ꯌꯦꯡꯁꯤꯅꯕꯥ .
3.2 Learning Outcomes,꯳.꯲ ꯇꯝꯅꯕꯒꯤ ꯐꯂꯁꯤꯡ .
"By the end of this unit, you should be able to:","ꯌꯨꯅꯤꯠ ꯑꯁꯤꯒꯤ ꯑꯔꯣꯏꯕꯗꯥ, ꯅꯍꯥꯛꯅꯥ ꯃꯈꯥꯗꯥ ꯄꯤꯔꯤꯕꯁꯤꯡꯁꯤ ꯇꯧꯕꯥ ꯉꯃꯒꯗꯕꯅꯤ:"
Define emotions,ꯏꯃꯣꯁꯅꯁꯤꯡ ꯗꯤꯐꯥꯏꯟ ꯇꯧꯕꯥ
"List two types of emotions, and list examples of each type","ꯏꯃꯣꯁꯟ ꯃꯈꯜ ꯑꯅꯤꯒꯤ ꯂꯤꯁ꯭ꯠ ꯑꯃꯥ ꯁꯦꯝꯃꯨ, ꯑꯃꯁꯨꯡ ꯃꯈꯜ ꯈꯨꯗꯤꯡꯃꯛꯀꯤ ꯈꯨꯗꯃꯁꯤꯡ ꯂꯤꯁ꯭ꯠ ꯇꯧꯕꯤꯌꯨ"
Outline the pattern of emotional development in children,ꯑꯉꯥꯡꯁꯤꯡꯗꯥ ꯏꯃꯣꯁꯅꯦꯜ ꯗꯤꯚꯦꯂꯄꯃꯦꯟꯇꯒꯤ ꯃꯑꯣꯡ-ꯃꯇꯧ ꯑꯗꯨ ꯑꯥꯎꯇꯂꯥꯏꯟ ꯇꯧꯕꯥ
Describe two major factors that influence emotional development,ꯏꯃꯣꯁꯅꯦꯜ ꯗꯤꯚꯦꯂꯄꯃꯦꯟꯇꯗꯥ ꯁꯥꯐꯨ ꯄꯤꯔꯤꯕꯥ ꯑꯆꯧꯕꯥ ꯐꯦꯛꯇꯔ ꯑꯅꯤꯒꯤ ꯃꯇꯥꯡꯗꯥ ꯈꯪꯍꯜꯂꯨ꯫
Explain the role of emotions in human learning and adjustment,ꯃꯤꯑꯣꯏꯕꯒꯤ ꯇꯝꯕꯤꯕꯥ ꯑꯃꯁꯨꯡ ꯑꯦꯗꯖꯁ꯭ꯇꯃꯦꯟꯇꯇꯥ ꯏꯃꯣꯁꯅꯁꯤꯡꯒꯤ ꯊꯧꯗꯥꯡ ꯑꯗꯨ ꯁꯟꯗꯣꯛꯅꯥ ꯇꯥꯀꯄꯥ
PED121,ꯄꯤ.ꯏ.ꯗꯤ.꯱꯲꯱ ꯑꯃꯁꯨꯡ ꯑꯦꯟ.
MODULE 2,ꯃꯣꯗ꯭ꯌꯨꯜ ꯲.
79,꯷꯹ ꯑꯃꯁꯨꯡ ꯑꯦꯟ.
4.3,꯴.꯳ ꯑꯣꯏꯈꯤ꯫
Title of the Main Section,ꯃꯔꯨꯑꯣꯏꯕꯥ ꯁꯦꯛꯁꯅꯒꯤ ꯇꯥꯏꯇꯦꯜ
4.31  Meaning and Types of Emotions,꯴.꯳꯱ꯒꯤ ꯑꯔꯊ ꯑꯃꯁꯨꯡ ꯏꯃꯣꯁꯅꯁꯤꯡꯒꯤ ꯃꯈꯂꯁꯤꯡ
The discussion will be under the following sub-heads,ꯈꯟꯅ-ꯅꯩꯅꯕꯥ ꯑꯁꯤ ꯃꯈꯥꯗꯥ ꯄꯤꯔꯤꯕꯥ ꯁꯕ-ꯍꯦꯗꯁꯤꯡ ꯑꯁꯤꯒꯤ ꯃꯈꯥꯗꯥ ꯂꯩꯒꯅꯤ ꯫
The Meaning of Emotions,ꯏꯃꯣꯁꯅꯁꯤꯡꯒꯤ ꯑꯔꯊ .
The nonprofessional conceives emotions as the outward expression of,ꯅꯟ-ꯄ꯭ꯔꯣꯐꯦꯁ꯭ꯅꯦꯂꯅꯥ ꯏꯃꯣꯁꯅꯁꯤꯡꯕꯨ ꯃꯄꯥꯟꯊꯣꯡꯒꯤ ꯑꯣꯏꯕꯥ ꯑꯦꯛꯁꯞꯔꯦꯁꯟ ꯑꯣꯏꯅꯥ ꯈꯅꯒꯠꯂꯤ .
"fear, anger, terror, embarrassment, disgust, sorrow, jealousy, shame,","ꯑꯀꯤꯕꯥ, ꯑꯁꯥꯑꯣꯕꯥ, ꯇꯦꯔꯣꯔꯤꯖꯝ, ꯏꯀꯥꯏꯕꯥ, ꯃꯤꯅꯨꯡꯁꯤ ꯂꯩꯠꯔꯕꯥ, ꯁꯣꯀꯄꯥ, ꯏꯔꯥꯠꯄꯥ, ꯂꯥꯡꯇꯛꯅꯕꯥ,"
"laughter, joy, grief, and others. Psychologists in agreement that emotion","ꯅꯣꯀꯄꯥ, ꯍꯔꯥꯑꯣꯕꯥ, ꯁꯣꯀꯄꯥ ꯑꯃꯁꯨꯡ ꯑꯇꯩ꯫"
"originate from internal processes that involve the nervous system, the","ꯅꯔꯚ ꯁꯤꯁ꯭ꯇꯦꯃꯒꯥ ꯃꯔꯤ ꯂꯩꯅꯕꯥ ꯃꯅꯨꯡꯒꯤ ꯑꯣꯏꯕꯥ ꯊꯧꯑꯣꯡꯁꯤꯡꯗꯒꯤ ꯍꯧꯔꯀꯄꯅꯤ, ."
"endocrine system, and the psychological situation. According","ꯑꯦꯅꯗꯣꯛꯔꯤꯟ ꯁꯤꯁ꯭ꯇꯦꯝ, ꯑꯃꯁꯨꯡ ꯁꯥꯏꯀꯣꯂꯣꯖꯤꯀꯦꯜ ꯑꯣꯏꯕꯥ ꯐꯤꯚꯝ꯫"
to,ꯒꯤ ꯃꯇꯨꯡ ꯏꯟꯅꯥ .
"Durojaiye (1976), emotion is an expression of inner feelings, which","ꯗꯨꯔꯣꯖꯥꯏꯌ (꯱꯹꯷꯶), ꯏꯃꯣꯁꯟ ꯑꯁꯤ ꯅꯨꯡꯒꯤ ꯑꯣꯏꯕꯥ ꯋꯥꯈꯜꯂꯣꯅꯁꯤꯡꯒꯤ ꯑꯦꯛꯁꯞꯔꯦꯁꯟ ꯑꯃꯅꯤ, ꯃꯁꯤꯅꯥ ."
aroused by one’s own behaviour or the behaviour of others,ꯃꯁꯥꯒꯤ ꯑꯣꯏꯕꯥ ꯂꯃꯆꯠ-ꯁꯥꯖꯠ ꯅꯠꯠꯔꯒꯥ ꯑꯇꯣꯞꯄꯒꯤ ꯂꯃꯆꯠ-ꯁꯥꯖꯠꯅꯥ ꯊꯣꯀꯍꯅꯕꯥ
Emotions can trigger a variety of behaviours in the individual feeling the,ꯏꯃꯣꯁꯅꯁꯤꯡꯅꯥ ꯃꯤꯑꯣꯏ ꯑꯃꯗꯥ ꯃꯈꯜ ꯀꯌꯥꯒꯤ ꯂꯃꯆꯠ-ꯁꯥꯖꯠꯁꯤꯡ ꯊꯣꯀꯍꯅꯕꯥ ꯌꯥꯏ ꯍꯥꯌꯅꯥ ꯐꯤꯜꯂꯤꯡ ꯇꯧꯕꯥ ꯌꯥꯏ꯫
"emotion. In new-borns, emotions trigger facial expressions of smiling,",ꯏꯃꯣꯁꯟ꯫
"anger, or sadness. In older persons, emotions can trigger affective","ꯑꯁꯥꯑꯣꯕꯥ, ꯅꯠꯠꯔꯒꯥ ꯋꯥꯈꯜ ꯅꯨꯡꯉꯥꯏꯇꯕꯥ꯫"
"experiences, indicating pleasure or displeasure. Emotions can stimulate","ꯑꯦꯛꯁꯄꯔꯤꯌꯦꯟꯁꯁꯤꯡ, ꯅꯨꯡꯉꯥꯏꯕꯥ ꯅꯠꯠꯔꯒꯥ ꯅꯨꯡꯉꯥꯏꯇꯕꯥ ꯐꯣꯡꯗꯣꯀꯄꯥ꯫"
"an individual to generate cognitive explanation, an attribution for the","ꯃꯤꯑꯣꯏ ꯑꯃꯅꯥ ꯀꯣꯒꯅꯤꯇꯤꯕ ꯑꯦꯛꯁꯞꯂꯦꯟ ꯇꯧꯕꯥ, ꯑꯦꯠꯔꯤꯕ꯭ꯌꯨꯁꯟ ꯑꯃꯥ ꯑꯣꯏꯅꯥ ꯑꯦꯟ.ꯗꯤ.ꯑꯦ."
cause of the event,ꯊꯧꯔꯝ ꯑꯁꯤꯒꯤ ꯃꯔꯝ .
"Emotions can trigger internal adjustment, such as increased heart rate","ꯏꯃꯣꯁꯅꯁꯤꯡꯅꯥ ꯏꯟꯇꯔꯅꯦꯜ ꯑꯦꯗꯖꯁ꯭ꯇꯃꯦꯟꯇ ꯊꯣꯀꯍꯅꯕꯥ ꯌꯥꯏ, ꯃꯗꯨꯗꯤ ꯍꯥꯔꯠ ꯔꯦꯠ ꯍꯦꯅꯒꯠꯂꯀꯄꯥ ꯑꯁꯤꯅꯆꯤꯡꯕꯅꯤ꯫"
"Emotions can produce expressive behaviour, such as laughing or crying","ꯏꯃꯣꯁꯅꯁꯤꯡꯅꯥ ꯑꯦꯛꯁꯞꯔꯦꯁꯤꯕ ꯕꯤꯍꯦꯕꯤꯌꯔ, ꯍꯥꯌꯕꯗꯤ ꯅꯣꯛꯅꯕꯥ ꯅꯠꯠꯔꯒꯥ ꯀꯞꯄꯥ ꯑꯁꯤ ꯊꯣꯀꯍꯅꯕꯥ ꯌꯥꯏ ."
"Emotions can also generate goal-directed behaviour, such as helping or",ꯏꯃꯣꯁꯅꯁꯤꯡꯅꯥ ꯄꯥꯟꯗꯝ ꯊꯝꯂꯤꯕꯥ ꯅꯠꯠꯔꯒꯥ ꯃꯇꯦꯡ ꯄꯥꯡꯕꯥ ꯑꯁꯤꯒꯨꯝꯕꯥ
rescuing a person whose life is threatened. The usefulness of any,ꯄꯨꯟꯁꯤꯕꯨ ꯈꯨꯗꯣꯡꯊꯤꯕꯥ ꯅꯪꯍꯜꯂꯤꯕꯥ ꯃꯤꯑꯣꯏ ꯑꯃꯕꯨ ꯔꯦꯁ꯭ꯛꯌꯨ ꯇꯧꯕꯥ꯫
"emotion will depend on the type of the emotion, its intensity, its","ꯏꯃꯣꯁꯟ ꯑꯁꯤ ꯏꯃꯣꯁꯅꯒꯤ ꯃꯈꯜ, ꯃꯁꯤꯒꯤ ꯏꯟꯇꯦꯟꯁꯤꯇꯤ, ꯃꯁꯤꯒꯤ ꯃꯈꯥ ꯄꯣꯜꯂꯤ"
"frequency, and its duration","ꯐ꯭ꯔꯤꯛꯕꯦꯟꯁꯤ, ꯑꯃꯁꯨꯡ ꯃꯁꯤꯒꯤ ꯃꯇꯝ ꯑꯁꯤ ."
Types of Emotions,ꯏꯃꯣꯁꯅꯁꯤꯡꯒꯤ ꯃꯈꯂꯁꯤꯡ .
"There are two major types of emotions.   They are pleasant emotions,",ꯏꯃꯣꯁꯅꯒꯤ ꯑꯆꯧꯕꯥ ꯃꯈꯜ ꯑꯅꯤ ꯂꯩ꯫
and unpleasant emotions,ꯑꯃꯁꯨꯡ ꯅꯨꯡꯉꯥꯏꯇꯕꯥ ꯏꯃꯣꯁꯅꯁꯤꯡ .
"Pleasant Emotions include the emotion of pleasure, happiness, love or","ꯅꯨꯡꯉꯥꯏꯕꯥ ꯏꯃꯣꯁꯅꯁꯤꯡꯒꯤ ꯃꯅꯨꯡꯗꯥ ꯅꯨꯡꯉꯥꯏꯕꯥ, ꯅꯨꯡꯉꯥꯏꯕꯥ, ꯅꯨꯡꯁꯤꯕꯥ ꯅꯠꯠꯔꯒꯥ ."
"affection, delight, and others. These emotions are characterised by","ꯅꯨꯡꯁꯤꯕꯥ, ꯅꯨꯡꯉꯥꯏꯕꯥ ꯑꯃꯁꯨꯡ ꯑꯇꯩ꯫"
"pleasant body sensations, warmth and a general feeling of wellness","ꯅꯨꯡꯉꯥꯏꯕꯥ ꯍꯀꯆꯥꯡꯒꯤ ꯁꯦꯟꯁꯅꯁꯤꯡ, ꯋꯥꯔꯝ ꯑꯃꯁꯨꯡ ꯋꯦꯂꯅꯦꯁꯀꯤ ꯖꯦꯅꯔꯦꯜ ꯐꯤꯜꯂꯤꯡ ꯑꯃꯥ"
Pleasant emotions can be a source of goal-directed activities. They can,ꯅꯨꯡꯉꯥꯏꯕꯥ ꯏꯃꯣꯁꯅꯁꯤꯡ ꯑꯁꯤ ꯄꯥꯟꯗꯝ ꯊꯝꯂꯤꯕꯥ ꯊꯕꯛ ꯊꯧꯔꯃꯁꯤꯡꯒꯤ ꯍꯧꯔꯀꯐꯝ ꯑꯃꯥ ꯑꯣꯏꯕꯥ ꯌꯥꯏ꯫
"enhance achievement motivation, and overall accomplishment in life. In","ꯑꯦꯆꯤꯚꯃꯦꯟꯇ ꯃꯣꯇꯤꯚꯦꯁꯟ ꯍꯦꯅꯒꯠꯍꯅꯕꯥ, ꯑꯃꯁꯨꯡ ꯄꯨꯟꯁꯤꯗꯥ ꯑꯄꯨꯅꯕꯥ ꯑꯣꯏꯅꯥ ꯄꯥꯡꯊꯣꯀꯄꯥ꯫"
"new born, pleasant emotions trigger attachment bonding. Attachment","ꯑꯅꯧꯕꯥ ꯄꯣꯀꯄꯥ, ꯅꯨꯡꯉꯥꯏꯕꯥ ꯏꯃꯣꯁꯅꯁꯤꯡꯅꯥ ꯑꯦꯇꯦꯆꯃꯦꯟꯇ ꯕꯣꯟꯗꯤꯡ ꯊꯣꯀꯍꯜꯂꯤ꯫"
bonding is a psychological process that describes an infant’s connection,ꯕꯣꯟꯗꯤꯡ ꯍꯥꯌꯕꯁꯤ ꯏꯅꯐꯦꯟꯇ ꯑꯃꯒꯤ ꯀꯅꯦꯛꯁꯟ ꯑꯗꯨ ꯇꯥꯀꯄꯥ ꯁꯥꯏꯀꯣꯂꯣꯖꯤꯀꯦꯜ ꯄ꯭ꯔꯣꯁꯦꯁ ꯑꯃꯅꯤ
"with caregiver, providing a sense of safety and security","ꯀꯦꯌꯔꯒꯤꯚꯔꯒꯥ ꯂꯣꯌꯅꯅꯥ, ꯁꯦꯐꯇꯤ ꯑꯃꯁꯨꯡ ꯁꯦꯛꯌꯨꯔꯤꯇꯤꯒꯤ ꯋꯥꯈꯜꯂꯣꯟ ꯑꯃꯥ ꯄꯤꯕꯥ"
"Unpleasant Emotions include emotions such as grief, fear, worry, anxiety,","ꯅꯨꯡꯉꯥꯏꯇꯕꯥ ꯏꯃꯣꯁꯅꯁꯤꯡꯒꯤ ꯃꯅꯨꯡꯗꯥ ꯁꯣꯀꯄꯥ, ꯑꯀꯤꯕꯥ, ꯋꯥꯈꯜ ꯅꯨꯡꯉꯥꯏꯇꯕꯥ, ꯋꯥꯈꯜ ꯅꯨꯡꯉꯥꯏꯇꯕꯥ ꯑꯁꯤꯅꯆꯤꯡꯕꯥ ꯏꯃꯣꯁꯅꯁꯤꯡꯒꯤ ꯃꯅꯨꯡꯗꯥ ꯌꯥꯑꯣꯔꯤ꯫"
"guilt, jealousy, shame, and others. Unpleasant emotions are characterised","ꯃꯔꯥꯜ, ꯏꯔꯥꯠꯄꯥ, ꯂꯥꯡꯇꯛꯅꯕꯥ ꯑꯃꯁꯨꯡ ꯑꯇꯩ꯫"
"by distressful behaviours such as muscular tension, facial contortions, and","ꯃꯁꯜ ꯇꯦꯟꯁꯟ, ꯐꯦꯁꯤꯑꯦꯜ ꯀꯟꯇꯔꯁꯟ, ꯑꯃꯁꯨꯡ 1000ꯒꯤ ꯑꯣꯏꯕꯥ ꯑꯋꯥꯕꯥ ꯂꯃꯆꯠ-ꯁꯥꯖꯠꯁꯤꯡꯅꯥ ꯃꯔꯝ ꯑꯣꯏꯗꯨꯅꯥ꯫"
PED121,ꯄꯤ.ꯏ.ꯗꯤ.꯱꯲꯱ ꯑꯃꯁꯨꯡ ꯑꯦꯟ.
CHILDHOOD AND ADOLESCENT PSYCHOLOGY,ꯑꯉꯥꯡ ꯑꯣꯏꯔꯤꯉꯩ ꯑꯃꯁꯨꯡ ꯏꯅꯈꯠꯂꯛꯂꯤꯕꯥ ꯁꯥꯏꯀꯣꯂꯣꯖꯤ
80,꯸꯰ ꯑꯃꯁꯨꯡ ꯑꯦꯟ.
"general agitation. In new-borns, unpleasant emotions are expressed in",ꯖꯦꯅꯦꯔꯦꯜ ꯑꯦꯖꯤꯇꯦꯁꯟ ꯇꯧꯕꯥ꯫
"hysterical crying. Intense, frequent, and long lasting unpleasant emotional",ꯍꯤꯁ꯭ꯠꯔꯤꯀꯦꯜ ꯑꯣꯏꯕꯥ ꯀ꯭ꯔꯥꯏꯌꯤꯡ ꯇꯧꯕꯥ꯫
