en,mni-Mtei
"The main purpose of a SWOT is to promote the identified strengths, reduce weaknesses, exploiting the","SWOT ꯑꯃꯒꯤ ꯃꯔꯨꯑꯣꯏꯕꯥ ꯄꯥꯟꯗꯃꯗꯤ ꯃꯁꯛ ꯈꯪꯗꯣꯛꯂꯕꯥ ꯄꯥꯉ꯭ꯒꯂꯁꯤꯡ ꯌꯣꯀꯈꯠꯄꯥ, ꯑꯁꯣꯅꯕꯥ ꯍꯟꯊꯍꯅꯕꯥ, ꯁꯤꯖꯤꯟꯅꯕꯥ ꯑꯁꯤꯅꯤ ꯫"
opportunities and having contingency plans to minimize threats,ꯈꯨꯗꯣꯡꯆꯥꯕꯁꯤꯡ ꯑꯃꯁꯨꯡ ꯈꯨꯗꯣꯡꯊꯤꯕꯁꯤꯡ ꯍꯟꯊꯍꯟꯅꯕꯥ ꯀꯟꯇꯤꯟꯖꯦꯟꯁꯤ ꯄ꯭ꯂꯥꯅꯁꯤꯡ ꯂꯩꯕꯥ
There are many benefits and advantages of using SWOT Analysis for personal development. It is good for,ꯄꯔꯁꯣꯅꯦꯜ ꯗꯤꯕꯦꯂꯄꯃꯦꯟꯇꯀꯤꯗꯃꯛ ꯑꯦꯁ.ꯗꯕ꯭ꯜꯌꯨ.ꯑꯣ.ꯇꯤ.ꯒꯤ ꯑꯦꯅꯥꯂꯥꯏꯁꯤꯁ ꯁꯤꯖꯤꯟꯅꯕꯒꯤ ꯀꯥꯟꯅꯕꯥ ꯑꯃꯁꯨꯡ ꯀꯥꯟꯅꯕꯥ ꯀꯌꯥ ꯂꯩꯔꯤ꯫
your success and betterment. Some of the most common benefits of conducting a personal SWOT analysis,ꯑꯗꯣꯃꯒꯤ ꯃꯥꯌ ꯄꯥꯀꯄꯥ ꯑꯃꯁꯨꯡ ꯍꯦꯟꯅꯥ ꯐꯕꯥ꯫
have been mentioned below,ꯃꯈꯥꯗꯥ ꯄꯅꯈ꯭ꯔꯦ
Helps to develops strategies to attain your goals,ꯑꯗꯣꯃꯒꯤ ꯄꯥꯟꯗꯃꯁꯤꯡ ꯐꯪꯅꯕꯥ ꯁ꯭ꯠꯔꯦꯇꯦꯖꯤꯁꯤꯡ ꯁꯦꯃꯒꯠꯄꯗꯥ ꯃꯇꯦꯡ ꯄꯥꯡꯏ
You can be better than your friends and colleagues,ꯅꯍꯥꯛꯀꯤ ꯃꯔꯨꯄꯁꯤꯡ ꯑꯃꯁꯨꯡ ꯊꯕꯛ ꯇꯧꯃꯤꯟꯅꯔꯤꯕꯁꯤꯡꯗꯒꯤ ꯍꯦꯟꯅꯥ ꯐꯕꯥ ꯑꯣꯏꯕꯥ ꯌꯥꯏ .
Shows where you currently stand on the path of success,ꯍꯧꯖꯤꯛ ꯑꯗꯣꯝꯅꯥ ꯃꯥꯌ ꯄꯥꯀꯄꯒꯤ ꯂꯝꯕꯤꯗꯥ ꯂꯦꯞꯂꯤꯕꯥ ꯃꯐꯝ ꯑꯗꯨ ꯎꯠꯂꯤ
Measures your scopes of reaching desired goals,ꯑꯄꯥꯝꯕꯥ ꯄꯥꯟꯗꯃꯁꯤꯡ ꯐꯪꯅꯕꯒꯤ ꯑꯗꯣꯃꯒꯤ ꯁ꯭ꯀꯣꯄꯁꯤꯡ ꯑꯗꯨ ꯌꯦꯡꯁꯤꯜꯂꯤ
"Boosts your career, life and personality","ꯅꯍꯥꯛꯀꯤ ꯀꯦꯔꯤꯌꯔ, ꯂꯥꯏꯐ ꯑꯃꯁꯨꯡ ꯄꯔꯁꯣꯅꯦꯂꯤꯇꯤ ꯍꯦꯅꯒꯠꯍꯜꯂꯤ"
Helps to better understand who you really are as a person,ꯃꯤꯑꯣꯏ ꯑꯃꯥ ꯑꯣꯏꯅꯥ ꯑꯗꯣꯝ ꯇꯁꯦꯡꯅꯥ ꯀꯅꯥꯅꯣ ꯍꯥꯌꯕꯗꯨ ꯍꯦꯟꯅꯥ ꯈꯉꯕꯗꯥ ꯃꯇꯦꯡ ꯄꯥꯡꯏ .
Maximizes your strengths and diminishes your weaknesses,ꯅꯍꯥꯛꯀꯤ ꯄꯥꯉ꯭ꯒꯂꯁꯤꯡ ꯑꯗꯨ ꯃꯦꯛꯁꯤꯃꯥꯏꯖ ꯇꯧꯏ ꯑꯃꯁꯨꯡ ꯅꯍꯥꯛꯀꯤ ꯑꯋꯥꯠꯄꯥ ꯑꯗꯨ ꯍꯟꯊꯍꯜꯂꯤ
Explores and also enhances your soft skills and hard skills,ꯑꯦꯛꯁꯞꯂꯣꯔ ꯇꯧꯏ ꯑꯃꯁꯨꯡ ꯅꯍꯥꯛꯀꯤ ꯁꯣꯐ꯭ꯠ ꯁ꯭ꯀꯤꯂꯁꯤꯡ ꯑꯃꯁꯨꯡ ꯍꯥꯔꯗ ꯁ꯭ꯀꯤꯂꯁꯤꯡꯁꯨ ꯍꯦꯅꯒꯠꯍꯜꯂꯤ
It helps you understand your preferences and personality traits,ꯃꯁꯤꯅꯥ ꯅꯍꯥꯛꯀꯤ ꯄꯁꯟꯗꯁꯤꯡ ꯑꯃꯁꯨꯡ ꯄꯔꯁꯣꯅꯦꯂꯤꯇꯤꯒꯤ ꯃꯑꯣꯡ-ꯃꯇꯧꯁꯤꯡ ꯈꯪꯕꯗꯥ ꯃꯇꯦꯡ ꯄꯥꯡꯏ .
"Focuses on your attitudes, abilities, skills, capabilities and capacities","ꯑꯗꯣꯃꯒꯤ ꯋꯥꯈꯜꯂꯣꯟ, ꯇꯧꯕꯥ ꯉꯝꯕꯁꯤꯡ, ꯍꯩꯁꯤꯡꯕꯥ, ꯇꯧꯕꯥ ꯉꯝꯕꯁꯤꯡ ꯑꯃꯁꯨꯡ ꯀꯦꯄꯥꯁꯤꯇꯤꯁꯤꯡꯗꯥ ꯃꯤꯠꯌꯦꯡ ꯊꯝꯂꯤ"
1.8.2,꯱.꯸.꯲.
USING THE SWOT ANALYSIS TOOL:,SWOT ꯑꯦꯅꯥꯂꯥꯏꯁꯤꯁꯀꯤ ꯈꯨꯠꯂꯥꯏ ꯁꯤꯖꯤꯟꯅꯗꯨꯅꯥ:
Strengths:,ꯄꯥꯉ꯭ꯒꯂꯁꯤꯡ: ꯱.
These are the traits or skills that set you apart from others. Questions to ask include:,ꯍꯥꯌꯔꯤꯕꯥ ꯂꯃꯆꯠ-ꯁꯥꯖꯠ ꯅꯠꯔꯒꯥ ꯁ꯭ꯀꯤꯂꯁꯤꯡ ꯑꯁꯤ ꯑꯗꯣꯃꯕꯨ ꯑꯇꯣꯞꯄꯁꯤꯡꯗꯒꯤ ꯇꯣꯉꯥꯟꯅꯥ ꯇꯥꯍꯜꯂꯤ꯫
"What benefits do you have which others do not have? This could include skills, education, or",ꯑꯗꯣꯃꯒꯤ ꯃꯐꯃꯗꯥ ꯀꯔꯤ ꯀꯥꯟꯅꯕꯥ ꯐꯪꯕꯒꯦ ꯍꯥꯌꯕꯗꯨ ꯑꯇꯣꯞꯄꯁꯤꯡꯗꯥ ꯀꯔꯤ ꯂꯩꯕꯒꯦ?
connections,ꯀꯅꯦꯛꯁꯅꯁꯤꯡ .
What are you better at than anyone else?,ꯑꯗꯣꯝꯅꯥ ꯑꯇꯣꯞꯄꯥ ꯀꯅꯥꯒꯨꯝꯕꯥ ꯑꯃꯠꯇꯗꯒꯤ ꯍꯦꯟꯅꯥ ꯐꯕꯥ ꯀꯔꯤ ꯂꯩꯔꯤꯕꯒꯦ?
What personal resources do you have access to?,ꯀꯔꯤ ꯄꯔꯁꯣꯅꯦꯜ ꯔꯤꯁꯣꯔꯁꯁꯤꯡꯒꯤ ꯑꯦꯛꯁꯦꯁ ꯂꯩꯕꯒꯦ?
What do other people see as your strengths?,ꯑꯇꯣꯞꯄꯥ ꯃꯤꯑꯣꯏꯁꯤꯡꯅꯥ ꯑꯗꯣꯃꯒꯤ ꯄꯥꯉ꯭ꯒꯜ ꯑꯣꯏꯅꯥ ꯀꯔꯤ ꯎꯔꯤꯕꯒꯦ?
Which achievements are you most proud of?,ꯑꯗꯣꯝꯅꯥ ꯈ꯭ꯕꯥꯏꯗꯒꯤ ꯆꯥꯎꯊꯣꯀꯆꯕꯥ ꯐꯥꯑꯣꯔꯤꯕꯥ ꯑꯦꯆꯤꯕꯃꯦꯟꯇꯁꯤꯡ ꯑꯗꯨ ꯀꯅꯥꯅꯣ?
What values do you believe in that others fail to show?,ꯑꯇꯣꯞꯄꯁꯤꯡꯅꯥ ꯎꯠꯄꯥ ꯉꯃꯗꯕꯥ ꯍꯥꯌꯕꯁꯤꯗꯥ ꯑꯗꯣꯝꯅꯥ ꯀꯔꯤ ꯚꯦꯜꯌꯨꯁꯤꯡ ꯊꯥꯖꯔꯤꯕꯒꯦ?
Are you part of a network no one else is involved in? What connections do you have with,ꯑꯗꯣꯝ ꯑꯇꯣꯞꯄꯥ ꯀꯅꯥꯒꯨꯝꯕꯥ ꯑꯃꯠꯇꯅꯥ ꯌꯥꯑꯣꯗꯕꯥ ꯅꯦꯇꯋꯥꯔꯛ ꯑꯃꯒꯤ ꯁꯔꯨꯛ ꯑꯃꯥ ꯑꯣꯏꯔꯤꯕꯔꯥ?
powerful people?,ꯁꯛꯇꯤ ꯂꯩꯔꯕꯥ ꯃꯤꯑꯣꯏꯁꯤꯡ?
Weaknesses:,ꯋꯥꯏꯀꯅꯦꯁꯁꯤꯡ: ꯱.
This part examines the areas in which you need to improve and the things that will set you back in your,ꯃꯁꯤꯒꯤ ꯁꯔꯨꯛ ꯑꯁꯤꯅꯥ ꯑꯗꯣꯝꯅꯥ ꯑꯍꯣꯡꯕꯥ ꯄꯨꯔꯀꯄꯥ ꯃꯊꯧ ꯇꯥꯕꯥ ꯃꯐꯃꯁꯤꯡ ꯑꯃꯁꯨꯡ ꯑꯗꯣꯃꯒꯤ ꯃꯐꯃꯗꯥ ꯑꯃꯨꯛ ꯍꯟꯅꯥ ꯁꯦꯃꯒꯗꯧꯔꯤꯕꯥ ꯋꯥꯐꯃꯁꯤꯡ ꯑꯗꯨ ꯌꯦꯡꯁꯤꯜꯂꯤ꯫
career. Questions to consider include:,ꯄꯨꯟꯁꯤ ꯂꯝꯕꯤ.
What work do you usually avoid because of lack of confidence?,ꯊꯥꯖꯕꯥ ꯋꯥꯠꯄꯅꯥ ꯃꯔꯝ ꯑꯣꯏꯗꯨꯅꯥ ꯑꯗꯣꯝꯅꯥ ꯃꯍꯧꯁꯥꯅꯥ ꯀꯔꯤ ꯊꯕꯛ ꯊꯤꯡꯂꯤꯕꯒꯦ?
What do people think you weaknesses are?,ꯃꯤꯌꯥꯝꯅꯥ ꯅꯈꯣꯌꯒꯤ ꯑꯋꯥꯠꯄꯥ ꯑꯁꯤ ꯀꯔꯤꯅꯣ ꯍꯥꯌꯅꯥ ꯈꯜꯂꯤꯕꯒꯦ?
Are you happy with your education and skills training?,ꯑꯗꯣꯃꯒꯤ ꯑꯦꯖꯨꯀꯦꯁꯟ ꯑꯃꯁꯨꯡ ꯁ꯭ꯀꯤꯜ ꯇ꯭ꯔꯦꯅꯤꯡꯗꯥ ꯑꯗꯣꯝ ꯅꯨꯡꯉꯥꯏꯕꯥ ꯐꯥꯑꯣꯕꯤꯕ꯭ꯔꯥ?
Do you have any negative work habits?,ꯑꯗꯣꯃꯒꯤ ꯅꯦꯒꯦꯇꯤꯕ ꯑꯣꯏꯕꯥ ꯊꯕꯛꯀꯤ ꯍꯩꯅꯕꯤ ꯂꯩꯕ꯭ꯔꯥ?
Which of your personality traits hold you back?,ꯅꯍꯥꯛꯀꯤ ꯄꯔꯁꯣꯅꯦꯂꯤꯇꯤ ꯇ꯭ꯔꯦꯇꯁꯤꯡꯒꯤ ꯃꯅꯨꯡꯗꯥ ꯀꯅꯥꯅꯥ ꯅꯍꯥꯀꯄꯨ ꯊꯤꯡꯖꯤꯜꯂꯤꯕꯒꯦ?
Opportunities:,ꯈꯨꯗꯣꯡꯆꯥꯕꯁꯤꯡ:
"For the opportunities section, look at the external factors you can take advantage of to pursue a promotion,","ꯈꯨꯗꯣꯡꯆꯥꯕꯁꯤꯡꯒꯤ ꯁꯦꯛꯁꯅꯒꯤꯗꯃꯛ, ꯄ꯭ꯔꯣꯃꯣꯁꯟ ꯑꯃꯥ ꯆꯠꯊꯅꯕꯥ ꯅꯍꯥꯛꯅꯥ ꯀꯥꯟꯅꯕꯥ ꯂꯧꯕꯥ ꯌꯥꯕꯥ ꯃꯄꯥꯅꯒꯤ ꯋꯥꯐꯃꯁꯤꯡ ꯌꯦꯡꯕꯤꯌꯨ,"
find a new job or determine a career direction,ꯑꯅꯧꯕꯥ ꯊꯕꯛ ꯑꯃꯥ ꯊꯤꯕꯥ ꯅꯠꯠꯔꯒꯥ ꯀꯦꯔꯤꯌꯔꯒꯤ ꯃꯥꯏꯀꯩ ꯑꯃꯥ ꯂꯦꯄꯊꯣꯀꯄꯥ
What new technology can assist you?,ꯑꯅꯧꯕꯥ ꯇꯦꯛꯅꯣꯂꯣꯖꯤꯅꯥ ꯑꯗꯣꯃꯗꯥ ꯃꯇꯦꯡ ꯄꯥꯡꯕꯥ ꯉꯃꯒꯅꯤ?
Can you take advantage of the market in its present state?,ꯑꯗꯣꯝꯅꯥ ꯃꯁꯤꯒꯤ ꯍꯧꯖꯤꯛ ꯂꯩꯔꯤꯕꯥ ꯐꯤꯚꯝ ꯑꯁꯤꯗꯥ ꯀꯩꯊꯦꯜ ꯑꯁꯤꯒꯤ ꯀꯥꯟꯅꯕꯥ ꯂꯧꯕꯥ ꯉꯃꯒꯗ꯭ꯔꯥ?
Do you have a network of strategic contacts to offer good advice or help you?,ꯑꯐꯕꯥ ꯄꯥꯎꯇꯥꯛ ꯄꯤꯅꯕꯥ ꯅꯠꯔꯒꯥ ꯑꯗꯣꯃꯗꯥ ꯃꯇꯦꯡ ꯄꯥꯡꯅꯕꯥ ꯁ꯭ꯠꯔꯦꯇꯦꯖꯤꯛ ꯀꯟꯇꯦꯛꯇꯀꯤ ꯅꯦꯇꯋꯔꯛ ꯑꯃꯥ ꯂꯩꯕꯔꯥ?
Is any of your competitors failing to do something important? Can you take advantage of it?,ꯅꯍꯥꯛꯀꯤ ꯀꯝꯄꯤꯇꯤꯇꯔꯁꯤꯡꯒꯤ ꯃꯔꯛꯇꯒꯤ ꯀꯅꯥꯒꯨꯝꯕꯥ ꯑꯃꯅꯥ ꯃꯔꯨꯑꯣꯏꯕꯥ ꯊꯕꯛ ꯑꯃꯥ ꯇꯧꯕꯥ ꯉꯃꯗ꯭ꯔꯤꯕꯔꯥ?
Is there a need in your company which no one is filling?,ꯑꯗꯣꯃꯒꯤ ꯀꯝꯄꯦꯅꯤꯗꯥ ꯀꯅꯥꯒꯨꯝꯕꯥ ꯑꯃꯠꯇꯅꯥ ꯃꯄꯨꯡ ꯐꯥꯗꯕꯥ ꯃꯊꯧ ꯇꯥꯕꯥ ꯑꯃꯥ ꯂꯩꯕꯔꯥ?
Could you create an opportunity by offering solutions to problems?,ꯑꯗꯣꯝꯅꯥ ꯁꯃꯁ꯭ꯌꯥꯁꯤꯡꯒꯤ ꯁꯣꯂꯨꯁꯅꯁꯤꯡ ꯄꯤꯗꯨꯅꯥ ꯈꯨꯗꯣꯡꯆꯥꯕꯥ ꯑꯃꯥ ꯁꯦꯃꯒꯠꯄꯥ ꯉꯃꯒꯗ꯭ꯔꯥ?
Threats:,ꯊ꯭ꯔꯦꯠꯁꯤꯡ: ꯱.
This part takes into account the external factors that could hurt your chances to attain your goals. The,ꯃꯁꯤꯒꯤ ꯁꯔꯨꯛ ꯑꯁꯤꯅꯥ ꯅꯍꯥꯛꯀꯤ ꯄꯥꯟꯗꯃꯁꯤꯡ ꯐꯪꯅꯕꯒꯤ ꯅꯍꯥꯛꯀꯤ ꯆꯥꯟꯁꯁꯤꯡꯗꯥ ꯑꯀꯥꯌꯕꯥ ꯄꯤꯕꯥ ꯌꯥꯕꯥ ꯃꯄꯥꯅꯒꯤ ꯋꯥꯐꯃꯁꯤꯡ ꯑꯗꯨ ꯌꯦꯡꯁꯤꯜꯂꯤ꯫
factors to take into account include:,ꯂꯧꯈꯠꯀꯗꯕꯥ ꯐꯦꯛꯇꯔꯁꯤꯡꯗꯤ ꯃꯈꯥꯗꯥ ꯄꯤꯔꯤꯕꯁꯤꯡꯁꯤꯅꯤ:
What hindrances do you currently face at work?,ꯍꯧꯖꯤꯛ ꯑꯗꯣꯝꯅꯥ ꯊꯕꯛꯇꯥ ꯀꯔꯤ ꯑꯊꯤꯡꯕꯥ ꯊꯝꯂꯤꯕꯒꯦ?
Is any of your co-workers competing with you for projects or roles?,ꯑꯗꯣꯃꯒꯤ ꯀꯣ-ꯑꯣꯔꯀꯔꯁꯤꯡꯒꯤ ꯃꯔꯛꯇꯥ ꯀꯅꯥꯒꯨꯝꯕꯥ ꯑꯃꯅꯥ ꯑꯗꯣꯃꯒꯥ ꯄ꯭ꯔꯣꯖꯦꯛꯇꯁꯤꯡ ꯅꯠꯔꯒꯥ ꯊꯧꯗꯥꯡꯁꯤꯡꯒꯤꯗꯃꯛ ꯀꯝꯄꯤꯇꯤꯁꯟ ꯇꯧꯔꯤꯕꯔꯥ?
Is your job changing?,ꯅꯍꯥꯛꯀꯤ ꯊꯕꯛ ꯑꯗꯨ ꯍꯣꯡꯂꯛꯂꯤꯕꯔꯥ?
Can technological changes threaten your position?,ꯇꯦꯛꯅꯣꯂꯣꯖꯤꯒꯤ ꯑꯍꯣꯡꯕꯁꯤꯡꯅꯥ ꯑꯗꯣꯃꯒꯤ ꯄꯣꯖꯤꯁꯟꯗꯥ ꯆꯩꯊꯦꯡ ꯄꯤꯕꯥ ꯉꯃꯒꯗ꯭ꯔꯥ?
Could any of your weaknesses lead to threats?,ꯑꯗꯣꯃꯒꯤ ꯑꯋꯥꯠꯄꯥ ꯑꯃꯅꯥ ꯈꯨꯗꯣꯡꯊꯤꯕꯥ ꯊꯣꯀꯍꯅꯕꯥ ꯉꯃꯒꯗ꯭ꯔꯥ?
1.8.3,꯱.꯸.꯳ ꯑꯃꯁꯨꯡ ꯑꯦꯝ.
EXAMPLE OF SWOT ANALYSIS:,SWOT ꯑꯦꯅꯥꯂꯥꯏꯁꯤꯁꯀꯤ ꯈꯨꯗꯝ:
SWOT tool used by a small independent book store:,ꯑꯄꯤꯀꯄꯥ ꯃꯅꯤꯡꯇꯝꯕꯥ ꯂꯥꯏꯔꯤꯛ ꯁ꯭ꯇꯣꯔ ꯑꯃꯅꯥ ꯁꯤꯖꯤꯟꯅꯕꯥ SWOT ꯇꯨꯜ:
HELPFUL,ꯃꯇꯦꯡ ꯑꯣꯏꯕ
HARMFUL,ꯈꯨꯗꯣꯡꯊꯤꯅꯤꯡꯉꯥꯏ ꯑꯣꯏꯕ
INTERNAL,ꯃꯅꯨꯡꯒꯤ
STRENGTHS:,ꯄꯥꯉ꯭ꯒꯂꯁꯤꯡ: ꯱.
Our workers are well educated,ꯑꯩꯈꯣꯌꯒꯤ ꯁꯤꯟꯃꯤꯁꯤꯡ ꯑꯁꯤ ꯌꯥꯝꯅꯥ ꯂꯥꯏꯔꯤꯛ ꯍꯩꯕꯥ ꯃꯤꯑꯣꯏꯁꯤꯡꯅꯤ ꯫
students who love books,ꯂꯥꯏꯔꯤꯀꯁꯤꯡ ꯅꯨꯡꯁꯤꯕꯥ ꯃꯍꯩꯔꯣꯏꯁꯤꯡ
The space is attractive and inviting,ꯁ꯭ꯄꯦꯁ ꯑꯁꯤ ꯄꯨꯛꯅꯤꯡ ꯆꯤꯡꯁꯤꯟꯅꯤꯡꯉꯥꯏ ꯑꯣꯏꯕꯥ ꯑꯃꯁꯨꯡ ꯀꯧꯅꯤꯡꯉꯥꯏ ꯑꯣꯏꯕꯥ .
Customers are supportive of small,ꯀꯁ꯭ꯇꯃꯔꯁꯤꯡꯅꯥ ꯑꯄꯤꯀꯄꯥ [...]
book store,ꯕꯨꯛ ꯁ꯭ꯇꯣꯔ
Popular cafe makes it easy for,ꯃꯤꯌꯥꯝꯅꯥ ꯄꯥꯝꯅꯕꯥ ꯀꯦꯐꯦꯅꯥ ꯌꯥꯝꯅꯥ ꯂꯥꯏꯅꯥ ꯆꯠꯄꯥ ꯉꯃꯍꯜꯂꯤ .
customers,ꯀꯁ꯭ꯇꯃꯔꯁꯤꯡꯅꯥ ꯑꯦꯝ.ꯑꯦꯁ.ꯑꯦꯝ.ꯏ.
to,ꯒꯤ ꯃꯇꯨꯡ ꯏꯟꯅꯥ .
linger,ꯂꯤꯉ꯭ꯒꯔ .
and,ꯑꯃꯁꯨꯡ
find,ꯊꯤꯕ
something to buy,ꯀꯔꯤꯒꯨꯝꯕꯥ ꯈꯔꯥ ꯂꯧꯕꯥ ꯌꯥꯕꯥ .
WEAKNESSES:,ꯋꯥꯏꯀꯅꯦꯁꯁꯤꯡ: ꯱.
Space is tight,ꯁ꯭ꯄꯦꯁ ꯑꯁꯤ ꯇꯞꯅꯥ ꯇꯞꯅꯥ .
Bank gave us a limited loan,ꯕꯦꯉ꯭ꯀꯅꯥ ꯑꯩꯈꯣꯌꯗꯥ ꯂꯤꯃꯤꯇꯦꯗ ꯂꯣꯟ ꯑꯃꯥ ꯄꯤꯈꯤ
Business is slower during summer,ꯑꯌꯨꯛꯀꯤ ꯃꯇꯃꯗꯥ ꯕꯤꯖꯤꯅꯦꯁ ꯑꯁꯤ ꯍꯦꯟꯅꯥ ꯇꯞꯅꯥ ꯆꯠꯂꯤ .
vacation,ꯁꯨꯇꯤ
EXTERNAL,ꯃꯄꯥꯟꯊꯣꯡꯒꯤ
OPPORTUNITIES:,ꯈꯨꯗꯣꯡꯆꯥꯕꯁꯤꯡ:
We can have local authors give,ꯑꯩꯈꯣꯌꯅꯥ ꯂꯣꯀꯦꯜ ꯑꯣꯊꯣꯔꯤꯇꯤꯁꯤꯡꯗꯥ ꯄꯤꯕꯥ ꯌꯥꯏ .
lectures and book signings,ꯂꯦꯀꯆꯔ ꯑꯃꯁꯨꯡ ꯕꯨꯛ ꯁꯥꯏꯟ ꯇꯧꯕꯥ
We,ꯑꯩꯈꯣꯏ
can,ꯉꯝꯕ
make,ꯁꯦꯝꯕ
personalized,ꯄꯔꯁꯣꯅꯦꯂꯥꯏꯖ ꯇꯧꯕꯥ
recommendations,ꯄꯥꯎꯇꯥꯀꯁꯤꯡ .
to,ꯒꯤ ꯃꯇꯨꯡ ꯏꯟꯅꯥ .
long,ꯑꯁꯥꯡꯕ
term,ꯋꯥꯍꯩ
customers,ꯀꯁ꯭ꯇꯃꯔꯁꯤꯡꯅꯥ ꯑꯦꯝ.ꯑꯦꯁ.ꯑꯦꯝ.ꯏ.
We can deliver the same day to,ꯑꯩꯈꯣꯌꯅꯥ ꯅꯨꯃꯤꯠ ꯑꯗꯨꯃꯛꯇꯗꯥ ꯄꯤꯕꯥ ꯉꯃꯒꯅꯤ ꯫
mobility impaired customers,ꯃꯣꯕꯤꯂꯤꯇꯤꯗꯥ ꯁꯣꯀꯍꯜꯂꯕꯥ ꯀꯁ꯭ꯇꯃꯔꯁꯤꯡ
We can feature things that appeal to,ꯑꯩꯈꯣꯌꯅꯥ ꯌꯥꯝꯅꯥ ꯅꯨꯡꯉꯥꯏꯕꯥ ꯋꯥꯐꯃꯁꯤꯡ ꯐꯣꯡꯗꯣꯀꯄꯥ ꯉꯃꯒꯅꯤ꯫
summer tourists,ꯑꯌꯨꯛꯀꯤ ꯇꯨꯔꯤꯁ꯭ꯇꯁꯤꯡꯅꯥ ꯌꯨ.ꯑꯦꯁ.
We can start a frequent buyer,ꯑꯩꯈꯣꯌꯅꯥ ꯆꯥꯡ ꯅꯥꯏꯅꯥ ꯀ꯭ꯔꯦꯇꯥ ꯑꯃꯥ ꯍꯧꯕꯥ ꯌꯥꯏ .
program,ꯄ꯭ꯔꯣꯒ꯭ꯔꯥꯝ ꯑꯁꯤꯒꯤ ꯃꯇꯥꯡꯗꯥ ꯋꯥ ꯉꯥꯡꯈꯤ꯫
THREATS:,ꯊ꯭ꯔꯦꯠꯁꯤꯡ: ꯱.
Large chains have more buying,ꯑꯆꯧꯕꯥ ꯆꯦꯅꯁꯤꯡꯗꯥ ꯍꯦꯟꯅꯥ ꯂꯧꯕꯥ ꯌꯥꯕꯥ .
power,ꯄꯥꯡꯒꯜ
E-books and e-book readers,ꯏ-ꯕꯨꯛ ꯑꯃꯁꯨꯡ ꯏ-ꯕꯨꯛ ꯄꯥꯔꯤꯕꯁꯤꯡ
Younger generations don’t read as,ꯅꯍꯥ ꯑꯣꯏꯔꯤꯕꯥ ꯃꯤꯔꯣꯂꯁꯤꯡꯅꯥ ꯄꯥꯔꯤꯕꯥ ꯑꯁꯤ .
much,ꯑꯌꯥꯝꯕ
Nearby public library reopened,ꯃꯅꯥꯛ ꯅꯀꯄꯗꯥ ꯂꯩꯕꯥ ꯄꯕ꯭ꯂꯤꯛ ꯂꯥꯏꯕ꯭ꯔꯦꯔꯤ ꯑꯃꯨꯛ ꯍꯟꯅꯥ ꯍꯥꯡꯗꯣꯀꯈꯤ
after two years,ꯆꯍꯤ ꯑꯅꯤꯒꯤ ꯃꯇꯨꯡꯗꯥ .
UNIT II  ATTITUDE & MOTIVATION,ꯌꯨꯅꯤꯠ II ꯑꯦꯇꯤꯆꯨꯗ ꯑꯃꯁꯨꯡ ꯃꯣꯇꯤꯕꯦꯁꯟ .
Attitude - Concept - Significance - Factors affecting attitudes - Positive attitude –,ꯑꯦꯇꯤꯆꯨꯗ - ꯋꯥꯈꯜꯂꯣꯟ - ꯃꯔꯨꯑꯣꯏꯕꯥ - ꯑꯦꯇꯤꯆꯨꯗꯇꯥ ꯁꯣꯀꯍꯜꯂꯤꯕꯥ ꯐꯦꯛꯇꯔꯁꯤꯡ - ꯄꯣꯖꯤꯇꯤꯕ ꯑꯣꯏꯕꯥ ꯋꯥꯈꯜꯂꯣꯟ –
Advantages –Negative attitude- Disadvantages - Ways to develop positive attitude -,ꯀꯥꯟꯅꯕꯁꯤꯡ –ꯅꯦꯒꯦꯇꯤꯕ ꯑꯦꯇꯤꯆꯨꯗ- ꯈꯨꯗꯣꯡꯆꯥꯗꯕꯁꯤꯡ - ꯄꯣꯖꯤꯇꯤꯕ ꯑꯣꯏꯕꯥ ꯋꯥꯈꯜꯂꯣꯟ ꯁꯦꯃꯒꯠꯅꯕꯥ ꯄꯥꯝꯕꯩꯁꯤꯡ -
Differences between personalities having positive and negative attitude. Concept of,ꯄꯣꯖꯤꯇꯤꯕ ꯑꯃꯁꯨꯡ ꯅꯦꯒꯦꯇꯤꯕ ꯑꯦꯇꯤꯆꯨꯗ ꯂꯩꯕꯥ ꯄꯔꯁꯣꯅꯦꯂꯤꯇꯤꯁꯤꯡꯒꯤ ꯃꯔꯛꯇꯥ ꯂꯩꯔꯤꯕꯥ ꯈꯦꯠꯅꯕꯥ꯫
motivation - Significance – Internal and external motives - Importance of self- motivation-,ꯃꯣꯇꯤꯕꯦꯁꯟ - ꯃꯔꯨꯑꯣꯏꯕꯥ – ꯃꯅꯨꯡꯒꯤ ꯑꯃꯁꯨꯡ ꯃꯄꯥꯅꯒꯤ ꯃꯣꯇꯤꯕꯁꯤꯡ - ꯁꯦꯜꯐ-ꯃꯣꯇꯤꯕꯦꯁꯅꯒꯤ ꯃꯔꯨꯑꯣꯏꯕꯥ-
Factors leading to de-motivation,ꯗꯤ-ꯃꯣꯇꯤꯕꯦꯁꯟ ꯊꯣꯀꯍꯜꯂꯤꯕꯥ ꯐꯦꯛꯇꯔꯁꯤꯡ .
2.1,꯲.꯱ ꯑꯃꯁꯨꯡ ꯲.
DEFINITION:,ꯋꯥꯡꯟꯊꯣꯛ:
"An attitude is a positive, negative, or mixed evaluation of an object that is expressed at some level","ꯑꯦꯇꯤꯆꯨꯗ ꯍꯥꯌꯕꯁꯤ ꯂꯦꯚꯦꯜ ꯈꯔꯗꯥ ꯐꯣꯡꯗꯣꯀꯄꯥ ꯄꯣꯠꯁꯛ ꯑꯃꯒꯤ ꯄꯣꯖꯤꯇꯤꯚ, ꯅꯦꯒꯦꯇꯤꯚ ꯅꯠꯠꯔꯒꯥ ꯃꯤꯛꯁ ꯏꯚꯥꯜꯌꯨꯑꯦꯁꯟ ꯑꯃꯅꯤ"
of intensity. It usually implies feelings that are either positive or negative,ꯏꯟꯇꯦꯟꯁꯤꯇꯤꯒꯤ ꯃꯇꯥꯡꯗꯥ ꯋꯥꯐꯝ ꯊꯃꯈꯤ꯫
Attitudes are our established ways of responding to people and situations that we have learned,ꯑꯦꯇꯤꯆꯨꯗꯁꯤꯡ ꯑꯁꯤ ꯑꯩꯈꯣꯌꯅꯥ ꯇꯃꯈꯤꯕꯥ ꯃꯤꯑꯣꯏꯁꯤꯡ ꯑꯃꯁꯨꯡ ꯐꯤꯚꯃꯁꯤꯡꯗꯥ ꯄꯥꯎꯈꯨꯝ ꯄꯤꯕꯒꯤ ꯑꯩꯈꯣꯌꯒꯤ ꯂꯤꯡꯈꯠꯂꯛꯂꯤꯕꯥ ꯃꯑꯣꯡꯁꯤꯡꯅꯤ ꯫
"based on the beliefs, values and assumptions we hold and our life experiences","ꯑꯩꯈꯣꯌꯅꯥ ꯊꯝꯂꯤꯕꯥ ꯊꯥꯖꯕꯁꯤꯡ, ꯚꯦꯜꯌꯨꯁꯤꯡ ꯑꯃꯁꯨꯡ ꯋꯥꯈꯜꯂꯣꯅꯁꯤꯡ ꯑꯃꯁꯨꯡ ꯑꯩꯈꯣꯌꯒꯤ ꯄꯨꯟꯁꯤꯒꯤ ꯑꯦꯛꯁꯄꯔꯤꯌꯦꯟꯁꯁꯤꯡꯗꯥ ꯌꯨꯝꯐꯝ ꯑꯣꯏꯔꯒꯥ"
Our attitude towards a person or event is displaced through our behaviour as a result of interaction,"ꯃꯤꯑꯣꯏ ꯑꯃꯒꯤ ꯅꯠꯔꯒꯥ ꯊꯧꯗꯣꯛ ꯑꯃꯒꯤ ꯃꯇꯥꯡꯗꯥ ꯑꯩꯈꯣꯌꯒꯤ ꯋꯥꯈꯜꯂꯣꯟ ꯑꯁꯤ ꯑꯩꯈꯣꯌꯒꯤ ꯂꯃꯆꯠ-ꯁꯥꯖꯠꯀꯤ ꯈꯨꯠꯊꯥꯡꯗꯥ ꯂꯧꯊꯣꯀꯏ, ꯃꯁꯤꯅꯥ ꯏꯟꯇꯔꯦꯛꯁꯅꯒꯤ ꯃꯍꯩ ꯑꯣꯏꯅꯥ ."
with that person. A person’s attitude represents how he or she feels about something or their state of mind,ꯃꯤꯑꯣꯏ ꯑꯗꯨꯒꯥ ꯂꯣꯌꯅꯅꯥ꯫
Example:,ꯈꯨꯗꯝ:
"If one can have a good (or positive) attitude toward their work, it means they feel good about their",ꯀꯔꯤꯒꯨꯝꯕꯥ ꯀꯅꯥꯒꯨꯝꯕꯥ ꯑꯃꯅꯥ ꯃꯈꯣꯌꯒꯤ ꯊꯕꯛꯀꯤ ꯃꯇꯥꯡꯗꯥ ꯑꯐꯕꯥ (ꯅꯠꯔꯒꯥ ꯄꯣꯖꯤꯇꯤꯕ ꯑꯣꯏꯕꯥ) ꯋꯥꯈꯜꯂꯣꯟ ꯑꯃꯥ ꯂꯩꯕꯥ ꯉꯝꯂꯕꯗꯤ ꯃꯈꯣꯌꯅꯥ ꯃꯈꯣꯌꯒꯤ ꯃꯔꯃꯗꯥ ꯅꯨꯡꯉꯥꯏꯕꯥ ꯐꯥꯑꯣꯒꯅꯤ ꯍꯥꯌꯕꯅꯤ꯫
"work, their job, their organisation, etc","ꯊꯕꯛ, ꯃꯈꯣꯌꯒꯤ ꯊꯕꯛ, ꯃꯈꯣꯌꯒꯤ ꯑꯣꯔꯒꯅꯥꯏꯖꯦꯁꯟ ꯑꯁꯤꯅꯆꯤꯡꯕꯥ"
"If one can have a bad (or negative) attitude, it means they dislike their environment no matter",ꯀꯔꯤꯒꯨꯝꯕꯥ ꯀꯅꯥꯒꯨꯝꯕꯥ ꯑꯃꯅꯥ ꯐꯠꯇꯕꯥ (ꯅꯠꯔꯒꯥ ꯅꯦꯒꯦꯇꯤꯕ) ꯑꯦꯇꯤꯆꯨꯗ ꯑꯃꯥ ꯂꯩꯕꯥ ꯉꯝꯂꯕꯗꯤ ꯃꯈꯣꯌꯅꯥ ꯃꯈꯣꯌꯒꯤ ꯑꯀꯣꯌꯕꯕꯨ ꯌꯥꯝꯅꯥ ꯅꯨꯡꯁꯤꯖꯩ ꯍꯥꯌꯕꯁꯤꯅꯤ
what is going around them,ꯃꯈꯣꯌꯒꯤ ꯑꯀꯣꯌꯕꯗꯥ ꯀꯔꯤ ꯆꯠꯂꯤꯕꯒꯦ .
2.2,꯲.꯲.
CONCEPT OF ATTITUDE:,ꯑꯦꯇꯤꯆꯨꯗꯀꯤ ꯋꯥꯈꯜꯂꯣꯟ:
The concept of attitude occupies a very favoured position in social psychology and is considered,ꯑꯦꯇꯤꯆꯨꯗꯀꯤ ꯋꯥꯈꯜꯂꯣꯟ ꯑꯁꯤꯅꯥ ꯁꯣꯁꯤꯑꯦꯜ ꯁꯥꯏꯀꯣꯂꯣꯖꯤꯗꯥ ꯌꯥꯝꯅꯥ ꯃꯇꯦꯡ ꯄꯥꯡꯕꯥ ꯄꯣꯖꯤꯁꯟ ꯑꯃꯥ ꯂꯧꯏ ꯑꯃꯁꯨꯡ ꯃꯁꯤ ꯈꯟꯅꯩ .
very important for every individual who wants success in their life,ꯃꯈꯣꯌꯒꯤ ꯄꯨꯟꯁꯤꯗꯥ ꯃꯥꯌ ꯄꯥꯀꯄꯥ ꯄꯥꯝꯂꯤꯕꯥ ꯃꯤꯑꯣꯏ ꯈꯨꯗꯤꯡꯃꯛꯀꯤꯗꯃꯛ ꯌꯥꯝꯅꯥ ꯃꯔꯨꯑꯣꯏꯕꯥ
"Attitudes are evaluative statements, either favourable or unfavourable, concerning objects, people","ꯑꯦꯇꯤꯆꯨꯗꯁꯤꯡ ꯑꯁꯤ ꯏꯚꯥꯜꯌꯨꯑꯦꯇꯤꯕ ꯁ꯭ꯇꯦꯇꯃꯦꯟꯇꯁꯤꯡꯅꯤ, ꯃꯈꯣꯌꯅꯥ ꯌꯥꯝꯅꯥ ꯐꯕꯥ ꯅꯠꯔꯒꯥ ꯑꯐꯕꯥ ꯑꯣꯏꯗꯕꯥ, ꯄꯣꯠꯁꯤꯡꯒꯥ ꯃꯔꯤ ꯂꯩꯅꯕꯥ ꯋꯥꯐꯃꯁꯤꯡꯅꯤ, ꯃꯤꯑꯣꯏꯁꯤꯡꯅꯤ꯫"
or events. They reflect how one feels about something,ꯅꯠꯔꯒꯥ ꯊꯧꯗꯣꯀꯁꯤꯡ꯫
Example:,ꯈꯨꯗꯝ:
"When you say “I like Mathematics”, you are expressing your attitude towards the subject of mathematics","ꯅꯍꯥꯛꯅꯥ “ꯑꯩꯅꯥ ꯃꯦꯊꯃꯦꯇꯤꯛꯁ ꯄꯥꯝꯃꯤ” ꯍꯥꯌꯔꯀꯄꯥ ꯃꯇꯃꯗꯥ, ꯅꯍꯥꯛꯅꯥ ꯃꯦꯊꯃꯦꯇꯤꯛꯁꯀꯤ ꯃꯇꯥꯡꯗꯥ ꯅꯍꯥꯛꯀꯤ ꯋꯥꯈꯜꯂꯣꯟ ꯑꯗꯨ ꯐꯣꯡꯗꯣꯛꯂꯤ"
2.3,꯲.꯳ ꯑꯃꯁꯨꯡ ꯲.
THREE CONCEPTS OF ATTITUDE:,ꯑꯦꯇꯤꯆꯨꯗꯀꯤ ꯋꯥꯈꯜꯂꯣꯟ ꯑꯍꯨꯝ:
1. Cognitive Attitude:,꯱.ꯀꯣꯒꯅꯤꯇꯤꯕ ꯑꯦꯇꯤꯆꯨꯗ:
Our belief in something is the cognitive attitude,ꯀꯔꯤꯒꯨꯝꯕꯥ ꯑꯃꯗꯥ ꯑꯩꯈꯣꯌꯒꯤ ꯊꯥꯖꯕꯥ ꯑꯁꯤ ꯀꯣꯒꯅꯤꯇꯤꯕ ꯑꯦꯇꯤꯆꯨꯗꯅꯤ .
Example: “Gender discrimination is widespread”  - This is an opinion which evaluates the topic of,ꯈꯨꯗꯝ: “ꯖꯦꯟꯗꯔ ꯗꯤꯁꯛꯔꯤꯃꯤꯅꯦꯁꯟ ꯑꯁꯤ ꯄꯥꯛ-ꯆꯥꯎꯅꯥ ꯁꯟꯗꯣꯀꯏ” - ꯃꯁꯤ ꯋꯥꯈꯜꯂꯣꯟ ꯑꯃꯅꯤ ꯑꯃꯁꯨꯡ ꯃꯁꯤꯒꯤ ꯍꯤꯔꯝ ꯑꯁꯤ ꯏꯚꯥꯜꯌꯨꯑꯦꯠ ꯇꯧꯏ
discrimation based on gender,ꯖꯦꯟꯗꯔꯗꯥ ꯌꯨꯝꯐꯝ ꯑꯣꯏꯕꯥ ꯈꯦꯟꯅꯕꯥ ꯊꯝꯕꯥ
2. Affective Attitude:,꯲.ꯑꯦꯐꯦꯛꯇꯤꯚ ꯑꯦꯇꯤꯆꯨꯗ:
It is the emotional or feeling segment of attitude,ꯃꯁꯤ ꯏꯃꯣꯁꯅꯦꯜ ꯅꯠꯔꯒꯥ ꯐꯤꯜꯂꯤꯡ ꯁꯦꯒꯃꯦꯟꯇ ꯑꯣꯐ ꯑꯦꯇꯤꯆꯨꯗꯅꯤ .
Example: “I don’t like Jon because he discriminates against minorities.”,ꯈꯨꯗꯝ: “ꯑꯩꯅꯥ ꯖꯣꯟ ꯑꯁꯤ ꯌꯥꯝꯅꯥ ꯄꯥꯃꯗꯦ ꯃꯔꯃꯗꯤ ꯃꯍꯥꯛꯅꯥ ꯃꯥꯏꯅꯣꯔꯤꯇꯤꯁꯤꯡꯕꯨ ꯈꯦꯠꯅꯕꯥ ꯊꯃꯗꯦ꯫”
3. Behavioural attitude:,꯳.ꯕꯤꯍꯦꯕꯤꯌꯔꯜ ꯑꯦꯇꯤꯆꯨꯗ:
It refers to an intention to behave in a certain way toward someone or something,ꯃꯁꯤꯅꯥ ꯀꯅꯥꯒꯨꯝꯕꯥ ꯑꯃꯕꯨ ꯅꯠꯠꯔꯒꯥ ꯀꯔꯤꯒꯨꯝꯕꯥ ꯑꯃꯒꯤ ꯃꯇꯥꯡꯗꯥ ꯑꯀꯛꯅꯕꯥ ꯃꯑꯣꯡꯗꯥ ꯂꯃꯆꯠ ꯁꯥꯖꯠ ꯆꯠꯄꯒꯤ ꯏꯟꯇꯦꯟꯁꯟ ꯑꯃꯕꯨ ꯈꯪꯅꯩ꯫
Example: Employees working in an organisation commonly can follow certain behaviour for the purpose,ꯈꯨꯗꯝ: ꯑꯣꯔꯒꯥꯅꯥꯏꯖꯦꯁꯟ ꯑꯃꯗꯥ ꯃꯍꯧꯁꯥꯅꯥ ꯊꯕꯛ ꯇꯧꯔꯤꯕꯥ ꯑꯦꯃꯞꯂꯣꯌꯔꯁꯤꯡꯅꯥ ꯄꯥꯟꯗꯝ ꯑꯗꯨꯒꯤꯗꯃꯛꯇꯥ ꯑꯀꯛꯅꯕꯥ ꯂꯃꯆꯠ-ꯁꯥꯖꯠꯁꯤꯡ ꯉꯥꯛꯅꯥ ꯆꯠꯄꯥ ꯌꯥꯏ
of betterment of the organisation,ꯑꯣꯔꯒꯅꯥꯏꯖꯦꯁꯟ ꯑꯁꯤꯒꯤ ꯍꯦꯟꯅꯥ ꯐꯕꯥ .
2.4,꯲.꯴ ꯑꯃꯁꯨꯡ ꯑꯦꯟ.
SIGNIFICANCE OR IMPORTANCE OF ATTITUDE:,ꯑꯦꯇꯤꯆꯨꯗꯀꯤ ꯃꯔꯨꯑꯣꯏꯕꯥ ꯅꯠꯠꯔꯒꯥ ꯃꯔꯨꯑꯣꯏꯕꯥ:
Attitude plays a very important role for achieving the success.  It is more important than,ꯃꯥꯌ ꯄꯥꯀꯄꯥ ꯑꯁꯤ ꯐꯪꯅꯕꯒꯤꯗꯃꯛ ꯑꯦꯇꯤꯆꯨꯗꯅꯥ ꯌꯥꯝꯅꯥ ꯃꯔꯨꯑꯣꯏꯕꯥ ꯊꯧꯗꯥꯡ ꯂꯧꯔꯤ꯫
"education, money, knowledge, intelligence, talents or skills","ꯑꯦꯖꯨꯀꯦꯁꯟ, ꯁꯦꯟ, ꯂꯧꯁꯤꯡ, ꯂꯧꯁꯤꯡ, ꯇꯦꯂꯦꯟꯇ ꯅꯠꯠꯔꯒꯥ ꯁ꯭ꯀꯤꯂꯁꯤꯡ"
"It applies to every sphere of life, including one's personal and professional life. Can an executive",ꯃꯁꯤ ꯀꯅꯥꯒꯨꯝꯕꯥ ꯑꯃꯒꯤ ꯄꯔꯁꯣꯅꯦꯜ ꯑꯃꯁꯨꯡ ꯄ꯭ꯔꯣꯐꯦꯁꯅꯦꯜ ꯂꯥꯏꯐ ꯌꯥꯑꯣꯅꯥ ꯄꯨꯟꯁꯤꯒꯤ ꯂꯝ ꯈꯨꯗꯤꯡꯃꯛꯇꯥ ꯆꯠꯅꯩ꯫
be a good executive without a good attitude? Can a student be a good student without a good attitude? Can,ꯑꯐꯕꯥ ꯋꯥꯈꯜꯂꯣꯟ ꯂꯩꯇꯕꯥ ꯑꯐꯕꯥ ꯑꯦꯒꯖꯤꯛꯌꯨꯇꯤꯕ ꯑꯃꯥ ꯑꯣꯏꯕꯤꯌꯨ?
"a parent, teacher, salesman, employer, employee be good in their roles without a good attitude?","ꯃꯃꯥ-ꯃꯄꯥ ꯑꯃꯥ, ꯑꯣꯖꯥ, ꯁꯦꯂꯁꯃꯦꯟ, ꯏꯃꯞꯂꯣꯌꯔ, ꯏꯃꯞꯂꯣꯌꯔ ꯑꯃꯥ ꯑꯐꯕꯥ ꯋꯥꯈꯜꯂꯣꯟ ꯂꯩꯇꯅꯥ ꯃꯈꯣꯌꯒꯤ ꯊꯧꯗꯥꯡꯁꯤꯡꯗꯥ ꯑꯐꯕꯥ ꯑꯣꯏꯒꯗ꯭ꯔꯥ?"
The foundation of success regardless of your chosen field is attitude. If attitude is such a critical,ꯅꯍꯥꯛꯅꯥ ꯈꯅꯈꯤꯕꯥ ꯂꯝ ꯑꯗꯨ ꯌꯦꯡꯂꯒꯥ ꯃꯥꯌ ꯄꯥꯀꯄꯒꯤ ꯌꯨꯝꯐꯝ ꯑꯁꯤ ꯑꯦꯇꯤꯆꯨꯗꯅꯤ꯫
"factor in success, shouldn't you examine your attitude toward life and ask how your attitude will affect","ꯃꯥꯌ ꯄꯥꯀꯄꯗꯥ ꯐꯦꯛꯇꯔ ꯑꯣꯏꯒꯗꯕꯅꯤ, ꯅꯍꯥꯛꯅꯥ ꯄꯨꯟꯁꯤꯒꯤ ꯃꯇꯥꯡꯗꯥ ꯅꯍꯥꯛꯀꯤ ꯋꯥꯈꯜꯂꯣꯟ ꯑꯗꯨ ꯌꯦꯡꯁꯤꯅꯒꯗꯕꯅꯤ ꯑꯃꯁꯨꯡ ꯅꯍꯥꯛꯀꯤ ꯑꯦꯇꯤꯆꯨꯗ ꯑꯗꯨ ꯀꯔꯝꯅꯥ ꯁꯣꯀꯍꯅꯒꯅꯤ ꯍꯥꯌꯅꯥ ꯍꯪꯂꯣꯏꯗꯕꯅꯤ꯫"
your goals?,ꯑꯗꯣꯃꯒꯤ ꯄꯥꯟꯗꯃꯁꯤꯡ?
Example:,ꯈꯨꯗꯝ:
"Journalists, friends, armed forces, Specialists and event their father laughed at an idea of an aeroplane","ꯄꯥꯎꯃꯤꯁꯤꯡ, ꯃꯔꯨꯄꯁꯤꯡ, ꯑꯥꯔꯝ ꯐꯣꯔꯁꯁꯤꯡ, ꯁ꯭ꯄꯦꯁꯤꯑꯦꯂꯤꯁ꯭ꯇꯁꯤꯡ ꯑꯃꯁꯨꯡ ꯊꯧꯔꯝ ꯃꯈꯣꯌꯒꯤ ꯃꯄꯥꯅꯥ ꯑꯦꯌꯔꯞꯂꯦꯟ ꯑꯃꯒꯤ ꯋꯥꯈꯜꯂꯣꯟ ꯑꯃꯗꯥ ꯅꯣꯀꯈꯤ"
