en,mni-Mtei
who from all outward appearances are similar Yet one is suc,ꯀꯅꯥꯅꯥ ꯃꯄꯥꯟꯗꯥ ꯊꯣꯀꯄꯥ ꯃꯑꯣꯡ ꯄꯨꯝꯅꯃꯛꯇꯒꯤ ꯃꯥꯟꯅꯕꯥ ꯑꯣꯏꯔꯕꯁꯨ ꯑꯃꯅꯥ SUC .
cessful the other a failure One lives above that glass ceiling,ꯁꯦꯁꯐꯨꯜ ꯑꯣꯏꯕꯥ ꯑꯇꯣꯞꯄꯥ ꯑꯃꯥ ꯐꯦꯏꯂꯔ ꯑꯃꯅꯥ ꯒ꯭ꯂꯥꯁ ꯁꯤꯂꯤꯡ ꯑꯗꯨꯒꯤ ꯃꯊꯛꯇꯥ ꯍꯤꯡꯂꯤ .
xii  Introduction,xii ꯏꯅꯠꯔꯣꯗ꯭ꯌꯨꯁꯟ ꯇꯧꯕꯥ
where only winners dwell Th e other looks up longingly ask,ꯃꯐꯝ ꯑꯗꯨꯗꯥ ꯃꯥꯏꯄꯥꯛꯂꯕꯁꯤꯡ ꯈꯛꯇꯅꯥ ꯂꯩꯔꯤ th e other looks up lowingly ask
ing himself Why are they up there and Im still struggling,ing ꯃꯁꯥꯃꯀꯁꯨ ꯀꯔꯤꯒꯤꯗꯃꯛ ꯃꯈꯣꯌꯅꯥ ꯃꯐꯝ ꯑꯗꯨꯗꯥ ꯂꯩꯔꯤꯕꯅꯣ ꯑꯃꯁꯨꯡ ꯏꯝ ꯍꯧꯖꯤꯀꯁꯨ ꯂꯥꯟꯊꯦꯡꯅꯔꯤ
down here? Some people think the big boys and big girls residing above,ꯃꯐꯝ ꯑꯁꯤꯗꯥ ꯃꯈꯥꯗꯥ ꯂꯩꯕꯔꯥ?
the glass ceiling are shielding their turf and wont let anyone,ꯒ꯭ꯂꯥꯁ ꯁꯤꯂꯤꯡ ꯑꯁꯤꯅꯥ ꯃꯈꯣꯌꯒꯤ ꯇꯔꯐ ꯑꯗꯨ ꯉꯥꯀꯊꯣꯛꯂꯤ ꯑꯃꯁꯨꯡ ꯀꯅꯥꯒꯨꯝꯕꯥ ꯑꯃꯠꯇꯅꯥ .
else in Th ats not true Th ey want you to break through It can,else in th ats not true th ey ꯅꯍꯥꯛꯅꯥ ꯃꯁꯤ ꯊꯨꯒꯥꯏꯕꯥ ꯄꯥꯝꯃꯤ .
be lonely up there In a sense they are auditioning you to be,ꯃꯈꯣꯌꯅꯥ ꯅꯈꯣꯌꯕꯨ ꯑꯣꯗꯤꯁꯟ ꯇꯧꯔꯤ ꯍꯥꯌꯕꯥ ꯃꯑꯣꯡ ꯑꯃꯗꯥ ꯃꯐꯝ ꯑꯗꯨꯗꯥ ꯇꯪꯗꯨ ꯂꯩꯇꯥꯕꯥ ꯑꯣꯏꯌꯨ .
one of them,ꯃꯈꯣꯌꯒꯤ ꯃꯅꯨꯡꯗꯥ ꯑꯃꯅꯥ .
I have several actor friends who after not making the,ꯑꯩꯒꯤ ꯑꯦꯛꯇꯔ ꯐ꯭ꯔꯦꯟꯗ ꯀꯌꯥ ꯑꯃꯥ ꯂꯩꯔꯤ ꯃꯈꯣꯌꯅꯥ ꯁꯦꯝꯂꯕꯥ ꯃꯇꯨꯡꯗꯥ .
cut in an audition dont realize the directors are even more,ꯀꯀꯊꯠꯂꯒꯥ ꯑꯣꯗꯤꯁꯟꯗꯥ ꯗꯥꯏꯔꯦꯛꯇꯔꯁꯤꯡ ꯑꯁꯤ ꯍꯦꯟꯅꯥ ꯍꯦꯟꯅꯥ ꯂꯩꯔꯤ ꯍꯥꯌꯕꯥ ꯈꯉꯕꯥ .
disappointed Th ey are desperate to  nd the right person to,ꯅꯤꯡꯍꯟꯅꯗꯕꯥ ꯊ ey are desperate to nd the right person to
cast Likewise big winners long to  nd others to welcome to,ꯀꯥꯁ꯭ꯠ ꯇꯧꯔꯀꯄꯒꯥ ꯂꯣꯌꯅꯅꯥ ꯑꯆꯧꯕꯥ ꯃꯥꯏꯄꯥꯀꯄꯁꯤꯡ ꯂꯣꯡ ꯇꯨ ꯅ꯭ꯗ ꯑꯇꯣꯞꯄꯁꯤꯡꯗꯥ ꯇꯔꯥꯝꯅꯥ ꯑꯣꯀꯆꯔꯤ꯫
their club Like all of us they want to enjoy the company of,ꯃꯈꯣꯌꯒꯤ ꯀ꯭ꯂꯕ ꯑꯩꯈꯣꯌ ꯄꯨꯝꯅꯃꯛꯒꯨꯝꯅꯥ ꯃꯈꯣꯌꯅꯥ ꯀꯝꯄꯦꯅꯤ ꯑꯁꯤ ꯅꯨꯡꯉꯥꯏꯅꯥ ꯂꯧꯕꯥ ꯄꯥꯝꯃꯤ꯫
companions on their own level Unfortunately many people,ꯃꯈꯣꯌ ꯃꯁꯥꯒꯤ ꯊꯥꯛꯇꯥ ꯂꯩꯕꯥ ꯃꯔꯨꯄꯁꯤꯡꯅꯥ ꯅꯨꯡꯉꯥꯏꯇꯕꯥ ꯋꯥꯐꯝ ꯑꯃꯥ ꯑꯣꯏꯅꯥ ꯃꯤꯑꯣꯏ ꯀꯌꯥ ꯑꯃꯥ
who think the big cats are biased dont recognize that their,ꯀꯅꯥꯅꯥ ꯈꯜꯂꯤꯕꯒꯦ ꯕꯤꯒ ꯀꯦꯇꯁꯤꯡ ꯑꯁꯤ ꯕꯥꯏꯑꯦꯖ ꯑꯣꯏꯔꯦ ꯃꯗꯨꯗꯤ ꯃꯈꯣꯌꯒꯤ .
own blunders barred them from being accepted,ꯃꯁꯥꯒꯤ ꯕ꯭ꯂꯨꯟꯗꯔꯁꯤꯡꯅꯥ ꯃꯈꯣꯌꯕꯨ ꯌꯥꯕꯥ ꯉꯃꯍꯟꯗꯅꯥ ꯊꯃꯈꯤ
Back to the Laboratory,ꯂꯦꯕꯣꯔꯦꯇꯔꯤꯗꯥ ꯑꯃꯨꯛ ꯍꯟꯅꯥ ꯆꯠꯄꯥ
Th e professor repeats his question Which of these gentlemen,Th e ꯄ꯭ꯔꯣꯐꯦꯁꯔꯅꯥ ꯃꯍꯥꯛꯀꯤ ꯋꯥꯍꯪ ꯑꯁꯤ ꯍꯟꯖꯤꯟ ꯍꯟꯖꯤꯟ ꯍꯥꯌꯔꯤꯕꯁꯤ ꯀꯅꯥꯅꯣ ꯍꯥꯌꯕꯒꯤ ꯃꯔꯨꯄꯁꯤꯡ ꯑꯁꯤꯒꯤ ꯃꯅꯨꯡꯗꯥ ꯀꯅꯥꯅꯥ
is the CEO and which cleans the  oors? You shrug I give up,ꯁꯤ.ꯏ.ꯑꯣ. ꯑꯃꯁꯨꯡ ꯀꯅꯥꯅꯥ ꯑꯣꯔꯁꯁꯤꯡ ꯁꯦꯡꯗꯣꯛꯂꯤꯕꯅꯣ?
Th e professor smiles turns to his subjects and says Th ank,Th e ꯄ꯭ꯔꯣꯐꯦꯁꯔ ꯁ꯭ꯃꯥꯏꯂꯁꯅꯥ ꯃꯍꯥꯛꯀꯤ ꯁꯕꯖꯦꯛꯇꯁꯤꯡꯗꯥ ꯂꯥꯀꯏ ꯑꯃꯁꯨꯡ ꯍꯥꯌꯔꯤ th ank
that the experiment is over Grasping their blankets tightly,ꯑꯦꯛꯁꯄꯔꯤꯃꯦꯟꯇ ꯑꯁꯤ ꯃꯈꯣꯌꯒꯤ ꯀꯝꯕꯂꯁꯤꯡ ꯆꯦꯠꯅꯥ ꯒ꯭ꯔꯦꯁ ꯇꯧꯕꯥ ꯑꯣꯚꯔꯅꯤ ꯍꯥꯌꯕꯥ .
around themselves they stand,ꯃꯈꯣꯌ ꯃꯁꯥꯒꯤ ꯑꯀꯣꯌꯕꯗꯥ ꯃꯈꯣꯌꯅꯥ ꯂꯦꯞꯂꯤ .
Subject number one turns to subject number two and says,ꯁꯕꯖꯦꯛꯇ ꯅꯝꯕꯔ ꯑꯃꯥ ꯁꯕꯖꯦꯛꯇ ꯅꯝꯕꯔ ꯑꯅꯤꯗꯥ ꯑꯣꯟꯊꯣꯛꯇꯨꯅꯥ ꯍꯥꯌꯔꯤ
Bet youre glad thats over Joe Good job! Walking out the,ꯕꯦꯠ ꯌꯨꯔꯦ ꯒ꯭ꯂꯥꯗ ꯊ꯭ꯌꯥꯇꯁ ꯑꯣꯚꯥꯔ ꯖꯣ ꯒꯨꯗ ꯖꯕ!
door he looks at you and says I know that must have been an,ꯊꯣꯡ ꯃꯍꯥꯛꯅꯥ ꯅꯉꯕꯨ ꯌꯦꯡꯂꯒꯥ ꯍꯥꯌ ꯑꯩꯅꯥ ꯈꯉꯏ ꯃꯗꯨꯗꯤ ꯁꯣꯌꯗꯅꯥ ꯑꯣꯏꯔꯝꯂꯒꯅꯤ꯫
uncomfortable experiment for both of you I hope the next is,ꯑꯗꯣꯝ ꯑꯅꯤꯃꯛꯀꯤꯗꯃꯛ ꯑꯅꯀꯝꯐꯣꯔꯇꯦꯕꯜ ꯑꯦꯛꯁꯄꯔꯤꯃꯦꯟꯇ ꯑꯩꯍꯥꯛꯅꯥ ꯑꯥꯁꯥ ꯇꯧꯔꯤ ꯃꯗꯨꯗꯤ ꯃꯊꯪꯒꯤ
pleasanter You must be doing very important research,Plasser ꯑꯗꯣꯝꯅꯥ ꯌꯥꯝꯅꯥ ꯃꯔꯨꯑꯣꯏꯕꯥ ꯔꯤꯁꯔꯆ ꯇꯧꯕꯥ ꯇꯥꯏ .
Introduction  xiii,ꯏꯅꯠꯔꯣꯗ꯭ꯌꯨꯁꯟ XIII .
As subject number two starts to leave he says Glad I,ꯁꯕꯖꯦꯛꯇ ꯅꯝꯕꯔ ꯑꯅꯤ ꯊꯥꯗꯣꯀꯄꯥ ꯍꯧꯔꯀꯄꯅꯤ ꯍꯥꯌꯅꯥ ꯃꯍꯥꯛꯅꯥ ꯍꯥꯌꯔꯤ GLAD I .
could help you out He pauses for a moment at the door,ꯃꯇꯦꯡ ꯄꯥꯡꯕꯥ ꯉꯃꯒꯅꯤ ꯅꯉꯕꯨ ꯃꯍꯥꯛꯅꯥ ꯊꯣꯡꯗꯥ ꯃꯤꯀꯨꯞ ꯑꯃꯒꯤ ꯑꯣꯏꯅꯥ ꯊꯃꯖꯤꯜꯂꯤ .
looking expectant Th e professor hands him some money,ꯂꯨꯀꯤꯡ ꯑꯦꯛꯁꯄꯦꯛꯇꯦꯟꯇ ꯊ ꯏ ꯄ꯭ꯔꯣꯐꯦꯁꯔꯗꯥ ꯃꯍꯥꯀꯄꯨ ꯁꯦꯜ ꯈꯔꯥ ꯄꯤꯈ꯭ꯔꯦ
Subject number two quickly takes it and starts to put it in his,ꯁꯕꯖꯦꯛꯇ ꯅꯝꯕꯔ ꯑꯅꯤꯅꯥ ꯊꯨꯅꯥ ꯂꯧꯈꯠꯇꯨꯅꯥ ꯃꯍꯥꯛꯀꯤ .
pocket    until he realizes he doesnt have one,ꯄꯣꯀꯦꯠ ꯑꯗꯨ ꯃꯍꯥꯛꯅꯥ ꯈꯉꯗ꯭ꯔꯤꯐꯥꯑꯣꯕꯥ ꯃꯍꯥꯛꯀꯤ ꯑꯃꯠꯇꯥ ꯂꯩꯇꯦ ꯍꯥꯌꯕꯥ ꯈꯉꯕꯥ ꯐꯥꯑꯣꯕꯥ .
Th e professor closes the door and once again asks you the,Th e ꯄ꯭ꯔꯣꯐꯦꯁꯔꯅꯥ ꯊꯣꯡ ꯂꯣꯟꯗꯨꯅꯥ ꯑꯃꯨꯛ ꯍꯟꯅꯥ ꯑꯗꯣꯃꯗꯥ ꯍꯪꯂꯤ
big question So my dear student which is the CEO and,ꯑꯆꯧꯕꯥ ꯋꯥꯍꯪ ꯑꯗꯨꯅꯥ ꯑꯩꯒꯤ ꯅꯨꯡꯁꯤꯔꯕꯥ ꯏꯔꯩꯕꯥꯀꯆꯥꯁꯤꯡꯅꯥ ꯁꯤ.ꯏ.ꯑꯣ.
which is the cleaner? With a big smile you con dently reply Th e  rst is the,ꯀ꯭ꯂꯤꯅꯔ ꯑꯁꯤ ꯀꯅꯥꯅꯣ?
CEO,ꯁꯤ.ꯏ.ꯑꯣ.
Right! Th e professor is ecstatic And how did you,ꯆꯨꯝꯃꯤ!
know? You conjecture Well the  rst fellow was concerned with,ꯈꯪꯕ?
the other mans feelings and ours too Th e other guy come to,ꯑꯇꯣꯞꯄꯥ ꯃꯟꯁ ꯐꯤꯜꯂꯤꯡꯁ ꯑꯃꯁꯨꯡ ꯑꯩꯈꯣꯌꯒꯤꯁꯨ th e ꯑꯇꯣꯞꯄꯥ ꯃꯤꯑꯣꯏ ꯑꯃꯅꯥ ꯂꯥꯀꯄꯥ
think of it said I am glad I could help you out putting the,think of it say thas i at ꯑꯩꯅꯥ ꯅꯈꯣꯌꯗꯥ ꯃꯇꯦꯡ ꯄꯥꯡꯕꯗꯥ ꯅꯨꯡꯉꯥꯏꯕꯥ ꯐꯥꯑꯣꯏ ꯃꯗꯨꯗꯤ ꯑꯩꯅꯥ .
emphasis on himself Th at made it sound like we owed him,emphasis on elsself th at made it sound like ꯑꯩꯈꯣꯌꯅꯥ ꯃꯍꯥꯀꯄꯨ ꯔ꯭ꯏꯟ ꯄꯤꯈꯤ
something,ꯀꯔꯤꯒꯨꯝꯕ ꯑꯃ
Exactly! With a eureka expression the professor clari es,ꯆꯞ ꯆꯥꯅ!
You see the  rst gentleman put himself in the other persons,ꯑꯗꯣꯝꯅꯥ ꯎꯕꯤꯔꯃꯒꯅꯤ ꯑꯥꯔ.ꯑꯦꯁ.ꯇꯤ.
mindset thus creating an instant connection with him He,ꯃꯥꯏꯟꯗꯁꯦꯠꯅꯥ ꯑꯁꯨꯝꯅꯥ ꯃꯍꯥꯛꯀꯥ ꯂꯣꯌꯅꯅꯥ ꯊꯨꯅꯥ ꯀꯅꯦꯛꯁꯟ ꯑꯃꯥ ꯁꯦꯃꯒꯠꯂꯤ ꯃꯍꯥꯛꯅꯥ .
predicted Joes discomfort and  complimented him to alleviate,ꯄ꯭ꯔꯤꯗꯤꯛꯇꯦꯗ ꯖꯣꯁ ꯗꯤꯁꯀꯝꯄꯣꯔꯠ ꯇꯧꯈꯤ ꯑꯃꯁꯨꯡ ꯃꯍꯥꯀꯄꯨ ꯀꯝꯞꯂꯤꯃꯦꯟꯇ ꯇꯧꯈꯤ ꯃꯗꯨꯗꯤ ꯃꯁꯤ ꯍꯟꯊꯍꯅꯈꯤ
it,ꯃꯁꯤ
Th e second fellow because he had the you owe me atti,Th e ꯁꯦꯀꯦꯟꯗ ꯐꯦꯂꯣ ꯃꯔꯃꯗꯤ ꯃꯍꯥꯛꯅꯥ ꯅꯍꯥꯛꯅꯥ ꯑꯩꯕꯨ attti .
tude encouraged me to pay him o  Th us we have no further,ꯇꯨꯗꯦꯅꯥ ꯑꯩꯉꯣꯟꯗꯥ ꯃꯍꯥꯀꯄꯨ ꯁꯦꯜ ꯄꯤꯅꯕꯥ ꯄꯨꯛꯅꯤꯡ ꯊꯧꯒꯠꯈꯤ o th ꯑꯩꯈꯣꯌꯗꯥ ꯑꯩꯈꯣꯌꯅꯥ ꯃꯈꯥ ꯇꯥꯅꯥ ꯂꯩꯇꯦ
debt to him,ꯃꯍꯥꯛꯀꯤ ꯃꯐꯃꯗꯥ ꯂꯂꯣꯟ ꯏꯇꯤꯛ ꯇꯧꯕꯥ
You agree Yes whereas if the  rst man asked us a small,ꯅꯍꯥꯛꯅꯥ ꯌꯥꯔꯦ ꯍꯣꯌ ꯃꯗꯨꯗꯤ ꯀꯔꯤꯒꯨꯝꯕꯥ ꯑꯥꯔ.ꯑꯦꯁ.ꯇꯤ.ꯒꯤ ꯃꯤꯑꯣꯏ ꯑꯗꯨꯅꯥ ꯑꯩꯈꯣꯌꯗꯥ ꯑꯄꯤꯀꯄꯥ ꯑꯃꯥ ꯍꯪꯂꯕꯗꯤ
favor even years from now we would gladly grant it,ꯍꯧꯖꯤꯛ ꯆꯍꯤ ꯀꯌꯥꯗꯒꯤ ꯐꯥꯑꯣꯕꯥ ꯃꯇꯦꯡ ꯄꯥꯡꯕꯤꯌꯨ ꯑꯩꯈꯣꯌꯅꯥ ꯍꯔꯥꯑꯣꯅꯥ ꯄꯤꯕꯤꯒꯅꯤ
Uh but Professor you hesitantly ask Why were they,ꯎꯍ ꯑꯗꯨꯕꯨ ꯄ꯭ꯔꯣꯐꯦꯁꯔ ꯅꯍꯥꯛꯅꯥ ꯍꯦꯁꯤꯇꯦꯟꯇ ꯑꯣꯏꯅꯥ ꯍꯪꯂꯤ ꯃꯗꯨꯗꯤ ꯀꯔꯤꯒꯤꯗꯃꯛ ꯃꯈꯣꯌ ꯑꯁꯤ .
naked? He answers Th e reason I stripped them of their clothes,ꯅꯒ꯭ꯟ ꯇꯧꯕꯥ?
for this experiment was to shrink their comfort level and thus,ꯃꯔꯃꯗꯤ ꯃꯁꯤꯒꯤ ꯑꯦꯛꯁꯄꯔꯤꯃꯦꯟꯇ ꯑꯁꯤ ꯃꯈꯣꯌꯒꯤ ꯅꯨꯡꯉꯥꯏꯕꯒꯤ ꯊꯥꯛ ꯑꯗꯨ ꯍꯟꯊꯍꯅꯒꯗꯕꯅꯤ ꯑꯃꯁꯨꯡ ꯃꯔꯝ ꯑꯁꯤꯅꯥ .
xiv  Introduction,xiv ꯏꯅꯠꯔꯣꯗ꯭ꯌꯨꯁꯟ ꯇꯧꯕꯥ
see how each would react in a strange or new situationas we,ꯑꯆꯝꯕꯥ ꯅꯠꯔꯒꯥ ꯑꯅꯧꯕꯥ ꯐꯤꯚꯝ ꯑꯃꯗꯥ ꯑꯃꯃꯃꯅꯥ ꯃꯇꯧ ꯀꯔꯝꯅꯥ ꯔꯤꯑꯦꯛꯇ ꯇꯧꯒꯅꯤ ꯍꯥꯌꯕꯗꯨ ꯌꯦꯡꯕꯤꯌꯨ ꯑꯩꯈꯣꯌꯅꯥ .
all must do daily,ꯄꯨꯝꯅꯃꯛ ꯅꯨꯃꯤꯠ ꯈꯨꯗꯤꯡꯒꯤ ꯇꯧꯒꯗꯕꯥ ꯊꯕꯀꯁꯤꯡ
Th e professor looks at you Did you sense how much more,Th e professor looks at you did you sense ꯀꯌꯥ ꯍꯦꯟꯅꯥ ꯍꯦꯟꯅꯥ
con dent the CEO was? Th at was because he predicted how,ꯀꯟ ꯗꯦꯟꯇ ꯁꯤ.ꯏ.ꯑꯣ.
the other fellow felt being put in that painful position Th ere,ꯑꯇꯣꯞꯄꯥ ꯃꯔꯨꯞ ꯑꯗꯨꯅꯥ ꯑꯗꯨꯒꯨꯝꯕꯥ ꯑꯋꯥꯕꯥ ꯄꯣꯖꯤꯁꯟ ꯑꯗꯨꯗꯥ ꯊꯃꯈꯤꯕꯥ ꯑꯗꯨ ꯐꯥꯑꯣꯈꯤ th ere
his  rst words? Bet youre glad thats over Joe Good job! He,ꯃꯍꯥꯛꯀꯤ ꯑꯥꯔ.ꯑꯦꯁ.ꯇꯤ.ꯒꯤ ꯋꯥꯍꯩꯁꯤꯡ?
sensed that Joe needed a selfesteem booster,ꯖꯣꯏꯅꯥ ꯁꯦꯜꯐ-ꯏꯁ꯭ꯇꯤꯝ ꯕꯨꯁ꯭ꯇꯔ ꯑꯃꯥ ꯃꯊꯧ ꯇꯥꯔꯦ ꯍꯥꯌꯕꯥ ꯈꯉꯈꯤ
He was also con dent because over the years people have,ꯃꯍꯥꯀꯄꯨꯁꯨ ꯀꯟꯗꯦꯟꯇ ꯑꯣꯏꯈꯤ ꯃꯔꯃꯗꯤ ꯆꯍꯤ ꯀꯌꯥꯗꯒꯤ ꯃꯤꯑꯣꯏ ꯀꯌꯥꯅꯥ .
given him their respect and warmth And why is that? Because,ꯃꯍꯥꯀꯄꯨ ꯃꯈꯣꯌꯒꯤ ꯏꯀꯥꯌꯈꯨꯝꯅꯕꯥ ꯑꯃꯁꯨꯡ ꯅꯨꯡꯁꯤꯕꯥ ꯑꯗꯨ ꯄꯤꯔꯒꯥ ꯑꯃꯁꯨꯡ ꯀꯔꯤꯒꯤꯗꯃꯛ ꯃꯗꯨ ꯑꯣꯏꯔꯤꯕꯅꯣ?
he treats everyone the way he did the three of us He predicted,ꯃꯍꯥꯛꯅꯥ ꯐꯣꯡꯗꯣꯀꯈꯤꯕꯥ ꯑꯩꯈꯣꯌ ꯑꯍꯨꯝ ꯑꯗꯨ ꯃꯍꯥꯛꯅꯥ ꯇꯧꯈꯤꯕꯥ ꯃꯑꯣꯡ ꯑꯗꯨꯗꯥ ꯃꯍꯥꯛꯅꯥ ꯃꯤꯄꯨꯝ ꯈꯨꯗꯤꯡꯃꯀꯄꯨ ꯌꯦꯡꯁꯤꯜꯂꯤ꯫
our various emotions and responded accordingly,ꯑꯩꯈꯣꯌꯒꯤ ꯇꯣꯉꯥꯟ ꯇꯣꯉꯥꯅꯕꯥ ꯏꯃꯣꯁꯅꯁꯤꯡ ꯑꯃꯁꯨꯡ ꯃꯗꯨꯒꯤ ꯃꯇꯨꯡ ꯏꯟꯅꯥ ꯄꯥꯎꯈꯨꯝ ꯄꯤꯈꯤ꯫
Th e CEO also thought about our emotions He under,Th e ꯁꯤ.ꯏ.ꯑꯣ.ꯁꯨ ꯑꯩꯈꯣꯌꯒꯤ ꯏꯃꯣꯁꯅꯁꯤꯡꯒꯤ ꯃꯇꯥꯡꯗꯁꯨ ꯈꯅꯈꯤ he under
stood that conducting an experiment with two naked men was,ꯂꯦꯞꯄꯥ ꯂꯩꯇꯅꯥ ꯃꯤ ꯑꯅꯤꯒꯥ ꯂꯣꯌꯅꯅꯥ ꯑꯦꯛꯁꯄꯔꯤꯃꯦꯟꯇ ꯑꯃꯥ ꯄꯥꯡꯊꯣꯀꯄꯥ ꯑꯁꯤ .
probably uncomfortable for us as well Do you remember what,ꯑꯩꯈꯣꯌꯒꯤꯗꯃꯛꯇꯁꯨ ꯅꯨꯡꯉꯥꯏꯇꯕꯥ ꯐꯥꯑꯣꯒꯅꯤ ꯃꯗꯨꯗꯤ ꯑꯗꯣꯝꯅꯥ ꯀꯔꯤ ꯅꯤꯡꯁꯤꯡꯂꯤꯕꯅꯣ
he said? You do He forecast our emotions and expressed trust in,ꯃꯍꯥꯛꯅꯥ ꯍꯥꯌꯈꯤ?
the signi cance of our research He then wished us well,ꯑꯩꯈꯣꯌꯒꯤ ꯔꯤꯁꯔꯆꯀꯤ ꯁꯤꯒꯅꯦꯆꯔ ꯑꯁꯤꯅꯥ ꯃꯗꯨꯒꯤ ꯃꯇꯨꯡꯗꯥ ꯃꯍꯥꯛꯅꯥ ꯑꯩꯈꯣꯌꯗꯥ ꯌꯥꯝꯅꯥ ꯌꯥꯏꯐ-ꯄꯥꯎꯖꯦꯜ ꯄꯤꯈꯤ
Th e Di erence Between Winners and,Th e di erence ꯃꯔꯛꯇꯥ ꯃꯥꯏꯄꯥꯛꯂꯕꯁꯤꯡ ꯑꯃꯁꯨꯡ .
Losers in Life,ꯄꯨꯟꯁꯤꯗꯥ ꯃꯥꯡꯈꯤꯕꯥ .
Th e CEO displayed what I call Emotional Prediction or EP He,Th e ꯁꯤ.ꯏ.ꯑꯣ.ꯅꯥ ꯑꯩꯅꯥ ꯏꯃꯣꯁꯅꯦꯜ ꯄ꯭ꯔꯤꯗꯤꯛꯁꯟ ꯅꯠꯔꯒꯥ ꯏ.ꯄꯤ.
was able to predict how Joe the professor and you would feel,ꯖꯣꯏ ꯄ꯭ꯔꯣꯐꯦꯁꯔ ꯑꯃꯁꯨꯡ ꯑꯗꯣꯝꯅꯥ ꯀꯔꯝꯅꯥ ꯐꯥꯑꯣꯒꯅꯤ ꯍꯥꯌꯕꯥ ꯋꯥꯐꯝ ꯑꯁꯤ ꯂꯥꯎꯊꯣꯀꯄꯥ ꯉꯃꯈꯤ .
right after the experiment With just a few sentences he con,ꯁꯨꯞꯅꯒꯤ ꯁꯦꯟꯁꯟ ꯈꯔꯈꯛꯇꯒꯥ ꯂꯣꯌꯅꯅꯥ ꯑꯦꯛꯁꯄꯔꯤꯃꯦꯟꯇ ꯇꯧꯔꯕꯥ ꯃꯇꯨꯡꯗꯥ ꯃꯍꯥꯛꯅꯥ ꯀꯟ .
nected with everyone and made them feel more comfortable,ꯃꯤꯄꯨꯝ ꯈꯨꯗꯤꯡꯃꯛꯀꯥ ꯂꯣꯌꯅꯅꯥ ꯅꯦꯛꯇ ꯇꯧꯕꯥ ꯑꯃꯁꯨꯡ ꯃꯈꯣꯌꯕꯨ ꯍꯦꯟꯅꯥ ꯅꯨꯡꯉꯥꯏꯕꯥ ꯐꯥꯑꯣꯍꯅꯕꯥ
Some people instinctively possess this heretofore unnamed,ꯃꯤꯑꯣꯏ ꯈꯔꯅꯥ ꯏꯅꯁ꯭ꯇꯤꯠꯌꯨꯁꯅꯦꯜ ꯑꯣꯏꯅꯥ ꯃꯁꯤꯒꯤ ꯃꯃꯤꯡ ꯊꯣꯜꯂꯕꯥ .
quality Unfortunately the majority doesnt EP is so complex,ꯀ꯭ꯕꯥꯂꯤꯇꯤ ꯅꯨꯡꯉꯥꯏꯇꯕꯥ ꯋꯥꯐꯝ ꯑꯃꯅꯥ ꯃꯦꯖꯣꯔꯤꯇꯤ ꯗꯣꯟ ꯏ.ꯄꯤ.
that people can seldom predict their own emotions let alone,ꯃꯤꯌꯥꯝꯅꯥ ꯃꯈꯣꯌꯒꯤ ꯏꯃꯣꯁꯅꯁꯤꯡ ꯑꯗꯨ ꯌꯥꯝꯅꯥ ꯊꯨꯅꯥ ꯂꯥꯎꯊꯣꯀꯄꯥ ꯉꯃꯒꯅꯤ ꯍꯥꯌꯕꯁꯤꯅꯤ .
those of others,ꯑꯇꯣꯞꯄꯁꯤꯡꯒꯤ ꯑꯣꯏꯅꯥ .
Introduction  xv,ꯏꯅꯠꯔꯣꯗ꯭ꯌꯨꯁꯟ ꯇꯧꯕꯥ ꯑꯦꯛꯁ.ꯚꯤ.
In a study published in the Journal of Personality and Social,ꯖꯔꯅꯦꯜ ꯑꯣꯐ ꯄꯔꯁꯣꯅꯦꯂꯤꯇꯤ ꯑꯃꯁꯨꯡ ꯁꯣꯁꯤꯑꯦꯜ .
Psychology researchers queried students in the weeks before a,ꯁꯥꯏꯀꯣꯂꯣꯖꯤ ꯔꯤꯁꯔꯆꯔꯁꯤꯡꯅꯥ ꯃꯍꯩꯔꯣꯏꯁꯤꯡꯗꯥ ꯋꯥꯍꯪ ꯍꯪꯈꯤ ꯃꯗꯨꯗꯤ ꯅꯨꯃꯤꯠ ꯈꯔꯅꯤꯒꯤ ꯃꯃꯥꯡꯗꯥ ꯑꯦ.
major exam about how they would feel in the hours immediately,ꯈꯨꯗꯛꯇꯥ ꯄꯨꯡꯁꯤꯡꯗꯥ ꯃꯈꯣꯌꯅꯥ ꯀꯔꯝꯅꯥ ꯐꯥꯑꯣꯒꯅꯤ ꯍꯥꯌꯕꯒꯤ ꯃꯇꯥꯡꯗꯥ ꯃꯦꯖꯔ ꯑꯦꯀꯖꯥꯝ
before and just after the test Later the researchers asked them,ꯃꯃꯥꯡ ꯑꯃꯁꯨꯡ ꯃꯇꯨꯡꯗꯥ ꯇꯦꯁ꯭ꯠ ꯇꯧꯔꯕꯥ ꯃꯇꯨꯡꯗꯥ ꯔꯤꯁꯔꯆꯔꯁꯤꯡꯅꯥ ꯃꯈꯣꯌꯗꯥ ꯍꯪꯈꯤ
about their feelings just before grades were posted Finally the,ꯒ꯭ꯔꯦꯗ ꯄꯣꯁ꯭ꯠ ꯇꯧꯗ꯭ꯔꯤꯉꯩ ꯃꯃꯥꯡꯗꯥ ꯃꯈꯣꯌꯒꯤ ꯐꯤꯚꯃꯁꯤꯡꯒꯤ ꯃꯇꯥꯡꯗꯥ ꯑꯔꯣꯏꯕꯗꯥ .
researchers inquired Precisely how will you feel if you pass? What about if you fail? Very few students could accurately,ꯔꯤꯁꯔꯆꯔꯁꯤꯡꯅꯥ ꯇꯁꯦꯡꯅꯥ ꯍꯪꯈꯤ ꯃꯗꯨꯗꯤ ꯀꯔꯤꯒꯨꯝꯕꯥ ꯅꯍꯥꯛꯅꯥ ꯄꯥꯁ ꯇꯧꯔꯕꯗꯤ ꯅꯍꯥꯛꯅꯥ ꯀꯔꯝꯅꯥ ꯐꯥꯑꯣꯒꯅꯤ?
predict what their own emotional reactions would be,ꯃꯈꯣꯌꯒꯤ ꯃꯁꯥꯒꯤ ꯑꯣꯏꯕꯥ ꯏꯃꯣꯁꯅꯦꯜ ꯔꯤꯑꯦꯛꯁꯅꯁꯤꯡ ꯑꯗꯨ ꯀꯔꯤ ꯑꯣꯏꯒꯅꯤ ꯍꯥꯌꯕꯗꯨ ꯂꯥꯎꯊꯣꯀꯄꯥ .
Th ats where you come in By the time you have  nished,Th ats ꯅꯍꯥꯛꯅꯥ ꯂꯥꯀꯄꯥ ꯃꯇꯃꯗꯥ ꯅꯍꯥꯛꯅꯥ ꯂꯥꯀꯄꯥ ꯃꯇꯃꯗꯥ .
this book you will sense other peoples emotions even before,ꯂꯥꯏꯔꯤꯛ ꯑꯁꯤ ꯑꯗꯣꯝꯅꯥ ꯑꯇꯣꯞꯄꯥ ꯃꯤꯑꯣꯏꯁꯤꯡꯒꯤ ꯏꯃꯣꯁꯅꯁꯤꯡ ꯑꯗꯨꯁꯨ ꯁꯦꯟꯁ ꯇꯧꯒꯅꯤ .
they understand them You can then connect with them,ꯃꯈꯣꯌꯅꯥ ꯃꯈꯣꯌꯕꯨ ꯈꯉꯏ ꯃꯗꯨꯒꯤ ꯃꯇꯨꯡꯗꯥ ꯃꯈꯣꯌꯒꯥ ꯁꯝꯅꯕꯥ ꯌꯥꯒꯅꯤ .
accordingly Th is does not mean you have to be a CEO or,ꯃꯁꯤꯒꯤ ꯃꯇꯨꯡ ꯏꯟꯅꯥ ꯊ ꯑꯁꯤ ꯅꯍꯥꯛꯅꯥ ꯁꯤ.ꯏ.ꯑꯣ.
even want to be It does mean however you must have Emo,ꯐꯥꯑꯣꯕꯥ ꯄꯥꯝꯃꯤ ꯃꯁꯤꯅꯥ ꯇꯥꯀꯄꯗꯤ ꯑꯗꯨꯝ ꯑꯣꯏꯅꯃꯛ ꯅꯍꯥꯛꯅꯥ ꯏꯃꯣ ꯂꯩꯒꯗꯕꯅꯤ
tional Prediction to achieve your highest goalswhatever they,ꯑꯗꯣꯃꯒꯤ ꯈ꯭ꯕꯥꯏꯗꯒꯤ ꯋꯥꯡꯕꯥ ꯄꯥꯟꯗꯃꯁꯤꯡ ꯐꯪꯅꯕꯥ ꯇꯤꯅꯦꯜ ꯄ꯭ꯔꯤꯗꯤꯛꯁꯟ ꯃꯈꯣꯌꯅꯥ ꯀꯔꯤ ꯍꯥꯌꯒꯅꯤ
a better job or just being able to connect with people,ꯍꯦꯟꯅꯥ ꯐꯕꯥ ꯊꯕꯛ ꯑꯃꯥ ꯅꯠꯠꯔꯒꯥ ꯃꯤꯑꯣꯏꯕꯁꯤꯡꯒꯥ ꯁꯝꯅꯍꯅꯕꯥ ꯉꯝꯕꯥ ꯈꯛꯇꯃꯛ .
How Does Emotional Prediction Di er,ꯃꯇꯧ ꯀꯔꯝꯅꯥ ꯏꯃꯣꯁꯅꯦꯜ ꯄ꯭ꯔꯤꯗꯤꯛꯁꯟ ꯗꯤ ꯑꯦꯔ .
from Emotional Intelligence? Good question Emotional intelligence is the concept Daniel,ꯏꯃꯣꯁꯅꯦꯜ ꯏꯟꯇꯦꯂꯤꯖꯦꯟꯁꯇꯒꯤ?
Goleman  eshed out in his excellent book of the same name,ꯒꯣꯂꯦꯝꯌꯥꯅꯅꯥ ꯃꯍꯥꯛꯀꯤ ꯃꯃꯤꯡ ꯂꯩꯔꯕꯥ ꯂꯥꯏꯔꯤꯛ ꯑꯁꯤꯗꯥ ꯑꯦꯁꯦꯗ ꯇꯧꯈꯤ
It involves 1 knowing your own emotions 2 managing your,ꯃꯁꯤꯗꯥ 1 ꯅꯍꯥꯛꯀꯤ ꯏꯁꯥꯒꯤ ꯏꯃꯣꯁꯅꯁꯤꯡ ꯈꯉꯕꯥ 2 ꯅꯍꯥꯛꯀꯤ .
own emotions 3 motivating yourself 4 recognizing emo,ꯃꯁꯥꯒꯤ ꯏꯃꯣꯁꯅꯁꯤꯡ ꯳ ꯃꯣꯇꯤꯚꯦꯇꯤꯡ ꯅꯍꯥꯛꯀꯤ ꯏꯁꯥꯕꯨ ꯃꯣꯇꯤꯕꯦꯇꯤꯡ ꯴ ꯔꯤꯀꯣꯒꯅꯤꯁꯟ ꯏꯃꯣ
tions in others and 5 handling relationships,tions in others ꯑꯃꯁꯨꯡ 5 ꯍꯦꯟꯗꯜ ꯇꯧꯕꯥ ꯃꯔꯤꯁꯤꯡ
Emotional Prediction is yet another layer of communicat,ꯏꯃꯣꯁꯅꯦꯜ ꯄ꯭ꯔꯤꯗꯤꯛꯁꯟ ꯑꯁꯤ ꯀꯝꯝꯌꯨꯅꯤꯀꯦꯠꯀꯤ ꯑꯇꯣꯞꯄꯥ ꯂꯦꯌꯔ ꯑꯃꯅꯤ .
ing It is predicting ahead of time what someones immediate or,ing it ꯍꯥꯌꯕꯁꯤ ꯀꯅꯥꯒꯨꯝꯕꯥ ꯑꯃꯅꯥ ꯈꯨꯗꯛꯀꯤ ꯑꯣꯏꯕꯥ ꯅꯠꯔꯒꯥ .
distant emotions will be in reaction to something said or done,ꯂꯥꯞꯅꯥ ꯂꯩꯕꯥ ꯏꯃꯣꯁꯅꯁꯤꯡ ꯑꯁꯤ ꯍꯥꯌꯈꯤꯕꯥ ꯅꯠꯔꯒꯥ ꯇꯧꯈꯤꯕꯥ ꯋꯥꯐꯝ ꯑꯃꯒꯤ ꯔꯤꯑꯦꯛꯁꯟ ꯑꯣꯏꯒꯅꯤ .
You can then orchestrate your own behavior accordingly usu,ꯃꯗꯨꯒꯤ ꯃꯇꯨꯡꯗꯥ ꯅꯍꯥꯛꯅꯥ ꯃꯗꯨꯒꯤ ꯃꯇꯨꯡ ꯏꯟꯅꯥ ꯅꯍꯥꯛꯀꯤ ꯏꯁꯥꯒꯤ ꯂꯃꯆꯠ-ꯁꯥꯖꯠ ꯑꯗꯨ ꯑꯣꯔꯀꯦꯁ꯭ꯠ ꯇꯧꯕꯥ ꯌꯥꯏ .
ally to reinforce the con dence and selfrespect of those you,ꯑꯦꯂꯥꯏ ꯇꯧꯅꯕꯥ ꯅꯍꯥꯛꯅꯥ ꯀꯟꯗꯦꯟꯁ ꯑꯃꯁꯨꯡ ꯁꯦꯜꯐ-ꯔꯤꯗꯁ꯭ꯄꯦꯛꯇ ꯑꯗꯨ ꯅꯍꯥꯛꯅꯥ ꯍꯦꯟꯅꯥ ꯆꯦꯠꯁꯤꯂꯍꯟꯅꯕꯥ ꯅꯍꯥꯛꯅꯥ .
xvi  Introduction,XVI ꯒꯤ ꯃꯇꯥꯡꯗꯥ ꯋꯥꯔꯣꯜ ꯄꯤꯕꯥ
you and boosts your own selfcon dence Why? Because you,ꯑꯗꯣꯝ ꯑꯃꯁꯨꯡ ꯑꯗꯣꯃꯒꯤ ꯏꯁꯥꯒꯤ ꯁꯦꯜꯐꯀꯣꯟ ꯗꯦꯟꯁ ꯕꯨꯁ꯭ꯠ ꯇꯧꯔꯤꯕꯅꯣ?
will soon be in the habit of reacting sensitively to others and,ꯑꯊꯨꯕꯥ ꯃꯇꯃꯗꯥ ꯑꯇꯣꯞꯄꯁꯤꯡꯗꯥ ꯁꯦꯟꯁꯤꯇꯤꯕ ꯑꯣꯏꯅꯥ ꯔꯤꯑꯦꯛꯇ ꯇꯧꯕꯒꯤ ꯆꯠꯅꯕꯤꯗꯥ ꯂꯩꯒꯅꯤ ꯑꯃꯁꯨꯡ .
thus receiving positive feedback from everyone,ꯑꯁꯤꯒꯨꯝꯅꯥ ꯃꯤꯄꯨꯝ ꯈꯨꯗꯤꯡꯃꯛꯇꯒꯤ ꯄꯣꯖꯤꯇꯤꯕ ꯑꯣꯏꯕꯥ ꯐꯤꯗꯕꯦꯛ ꯂꯧꯕꯥ .
Th e majority of peoples reactions to you are subconscious,Th e ꯃꯦꯖꯣꯔꯤꯇꯤ ꯑꯣꯐ ꯄꯤꯄꯂꯁ ꯔꯤꯑꯦꯛꯁꯅꯁꯤꯡ ꯑꯁꯤ ꯑꯗꯣꯃꯒꯤ ꯃꯐꯃꯗꯥ ꯁꯕꯀꯟꯁꯤꯌꯦꯟꯇꯅꯤ .
Th eir quicksilver responses bypass the brain and go right to,Th eir QuickSilver ꯔꯦꯁꯄꯣꯟꯁꯁꯤꯡꯅꯥ ꯕ꯭ꯔꯦꯟ ꯑꯗꯨ ꯕꯥꯏꯄꯥꯁ ꯇꯧꯗꯨꯅꯥ ꯊꯨꯅꯥ ꯆꯠꯂꯨ꯫
their gut Malcolm Gladwells wellresearched book Blink,ꯃꯈꯣꯌꯒꯤ ꯒꯠ ꯃꯥꯂꯀꯣꯝ ꯒ꯭ꯂꯦꯗꯋꯦꯂꯁ ꯋꯦꯂꯔꯤꯁꯔꯆ ꯇꯧꯕꯥ ꯂꯥꯏꯔꯤꯛ ꯕ꯭ꯂꯤꯉ꯭ꯛ
proved and popularized the concept People no longer doubt,ꯄ꯭ꯔꯃꯥꯟ ꯑꯃꯁꯨꯡ ꯃꯤꯌꯥꯝꯅꯥ ꯄꯥꯝꯅꯕꯥ ꯋꯥꯈꯜꯂꯣꯟ ꯑꯁꯤ ꯍꯧꯖꯤꯛ ꯆꯤꯡꯅꯕꯥ ꯂꯩꯔꯣꯏ
this unseen reality and the pivotal role it plays,ꯃꯁꯤꯒꯤ ꯎꯕꯥ ꯐꯪꯗꯕꯥ ꯔꯤꯑꯦꯂꯤꯇꯤ ꯑꯃꯁꯨꯡ ꯃꯁꯤꯅꯥ ꯂꯧꯔꯤꯕꯥ ꯃꯔꯨꯑꯣꯏꯕꯥ ꯊꯧꯗꯥꯡ ꯑꯁꯤ .
Emotional Prediction Is Vital,ꯏꯃꯣꯁꯅꯦꯜ ꯄ꯭ꯔꯤꯗꯤꯛꯁꯟ ꯑꯁꯤ ꯌꯥꯝꯅꯥ ꯃꯔꯨꯑꯣꯏ .
for Love to Last,ꯂꯥꯚ ꯇꯨ ꯂꯥꯁ꯭ꯠ .
I have often wondered how people who once loved each other,ꯑꯩꯍꯥꯛꯅꯥ ꯑꯌꯥꯝꯕꯅꯥ ꯈꯅꯖꯩ ꯃꯗꯨꯗꯤ ꯃꯇꯧ ꯀꯔꯝꯅꯥ ꯃꯇꯝ ꯑꯃꯗꯥ ꯑꯃꯒꯥ ꯑꯃꯒꯥ ꯅꯨꯡꯁꯤꯅꯔꯝꯕꯥ ꯃꯤꯑꯣꯏꯁꯤꯡ .
lived together even created a child or built a company together,ꯄꯨꯟꯅꯥ ꯂꯩꯃꯤꯟꯅꯈꯤꯕꯥ ꯑꯉꯥꯡ ꯑꯃꯥ ꯐꯥꯑꯣꯕꯥ ꯁꯦꯃꯈꯤ ꯅꯠꯔꯒꯥ ꯄꯨꯟꯅꯥ ꯀꯝꯄꯦꯅꯤ ꯑꯃꯥ ꯁꯥꯈꯤ
can wind up in a state of mutual loathing,ꯅꯥꯀꯜ ꯑꯅꯤꯒꯤ ꯂꯣꯊꯤꯡꯒꯤ ꯐꯤꯚꯝ ꯑꯃꯗꯥ ꯋꯥꯏꯟꯊꯕꯥ ꯌꯥꯏ .
More than 40 percent of todays marriages end in divorce,ꯉꯁꯤꯒꯤ ꯂꯨꯍꯣꯡꯕꯒꯤ ꯆꯥꯗꯥ ꯴꯰ ꯍꯦꯟꯅꯥ ꯇꯂꯥꯛ ꯑꯍꯨꯃꯒꯤ ꯃꯅꯨꯡꯗꯥ ꯂꯣꯏꯔꯦ .
many of them bitter If partners are blind to each others emo,ꯃꯈꯣꯌ ꯀꯌꯥ ꯑꯃꯅꯥ ꯀꯔꯤꯒꯨꯝꯕꯥ ꯄꯥꯔꯇꯅꯔꯁꯤꯡꯅꯥ ꯑꯃꯒꯥ ꯑꯃꯒꯥ ꯃꯤꯠ ꯎꯗꯕꯥ ꯑꯣꯏꯔꯕꯗꯤ ꯏꯃꯣ .
tions their loving moments can morph into hidden hostility,tions ꯃꯈꯣꯌꯒꯤ ꯅꯨꯡꯁꯤꯕꯥ ꯃꯇꯃꯁꯤꯡ ꯑꯁꯤ ꯂꯣꯠꯁꯤꯜꯂꯕꯥ ꯌꯦꯛꯅꯕꯥ ꯑꯣꯏꯅꯥ ꯃꯑꯣꯡ ꯆꯨꯝꯅꯥ ꯆꯠꯄꯥ ꯉꯃꯒꯅꯤ .
People often hold their explosive feelings inside like undeto,ꯃꯤꯌꯥꯝꯅꯥ ꯑꯌꯥꯝꯕꯅꯥ ꯃꯈꯣꯌꯒꯤ ꯑꯦꯛꯁꯞꯂꯣꯁꯤꯚ ꯐꯤꯜꯂꯤꯡꯁꯤꯡ ꯑꯗꯨ ꯃꯅꯨꯡꯗꯥ ꯎꯟꯗꯦꯇꯣꯒꯨꯝꯅꯥ ꯊꯝꯃꯤ .
nated grenades Th en one day he says one more thing that,nated grenades th en ꯅꯨꯃꯤꯠ ꯑꯃꯗꯥ ꯃꯍꯥꯛꯅꯥ ꯍꯥꯌꯔꯤꯕꯁꯤ ꯑꯍꯦꯅꯕꯥ ꯋꯥꯐꯝ ꯑꯃꯅꯤ ꯃꯗꯨꯗꯤ .
con rms Hes a dictator Or she does something that abso,ꯀꯟ ꯔꯝꯁ ꯍꯦꯁ ꯑꯦ ꯗꯤꯛꯇꯦꯇꯔ ꯅꯠꯔꯒꯥ ꯃꯍꯥꯛꯅꯥ ꯇꯧꯕꯥ ꯌꯥꯕꯥ ꯊꯕꯛ ꯑꯃꯥ꯫
lutely proves Shes a twit! Th at is the tipping point When the couple recognizes that,ꯂꯨꯇꯦꯂꯤ ꯄ꯭ꯔꯣꯚꯁ ꯁꯦꯁ ꯑꯦ ꯇ꯭ꯕꯤꯠ!
they receive more pain from the relationship than pleasure,ꯃꯈꯣꯌꯅꯥ ꯅꯨꯡꯉꯥꯏꯕꯗꯒꯤ ꯍꯦꯟꯅꯥ ꯃꯔꯤ ꯑꯗꯨꯗꯒꯤ ꯍꯦꯟꯅꯥ ꯑꯋꯥꯕꯥ ꯐꯪꯏ .
one of them pulls the pin Th e injuries are intense Th e couple,ꯃꯈꯣꯌꯒꯤ ꯃꯅꯨꯡꯗꯥ ꯑꯃꯅꯥ ꯄꯤꯟ th e ꯑꯁꯣꯛ-ꯑꯄꯅꯁꯤꯡ ꯑꯗꯨ ꯄꯨꯜꯂꯤ th e couple .
splits,ꯁ꯭ꯞꯂꯤꯠꯁꯤꯡ .
Psychiatrists and psychologists have acknowledged the,ꯁꯥꯏꯀꯤꯌꯥꯠꯔꯤꯛ ꯑꯃꯁꯨꯡ ꯁꯥꯏꯀꯣꯂꯣꯖꯤꯁ꯭ꯇꯁꯤꯡꯅꯥ ꯌꯥꯔꯦ ꯍꯥꯌꯅꯥ ꯂꯧꯅꯔꯤ꯫
pleasurepain principle since 300 bc when the Greek phi,ꯒ꯭ꯔꯤꯛ ꯐꯥꯏ ꯇꯧꯕꯥ ꯃꯇꯃꯗꯥ ꯈ꯭ꯔ꯭ꯏꯁ꯭ꯇꯒꯤ ꯃꯃꯥꯡ ꯳꯰꯰ ꯗꯒꯤ ꯄ꯭ꯂꯦꯁꯄꯦꯟ ꯄ꯭ꯔꯤꯟꯁꯤꯄꯜ
losopher Epicurus put pen to papyrus Sigmund Freud often,ꯂꯣꯁꯐꯔ ꯏꯄꯤꯛꯌꯨꯔꯁꯅꯥ ꯄꯦꯟ ꯑꯁꯤ ꯄꯦꯄꯤꯔꯥꯁ ꯁꯤꯒꯃꯨꯟꯗ ꯐ꯭ꯔꯣꯏꯗꯇꯥ ꯑꯌꯥꯝꯕꯅꯥ ꯊꯃꯈꯤ
