en,mni-Mtei
inasmuch as time is contained in every empirical representation of the,ꯃꯇꯝ ꯑꯁꯤ ꯑꯦꯝꯄꯤꯔꯤꯀꯦꯜ ꯔꯤꯞꯔꯖꯦꯟꯇꯦꯁꯟ ꯈꯨꯗꯤꯡꯃꯛꯇꯥ ꯃꯇꯝ ꯑꯁꯤ ꯌꯥꯑꯣꯔꯤꯕꯅꯤꯅꯥ .
manifold. Thus an application of the category to phenomena becomes,ꯃꯦꯅꯤꯐꯣꯜꯗ ꯇꯧꯕꯥ꯫
"possible, by means of the transcendental determination of time, which, as","ꯑꯣꯏꯊꯣꯀꯄꯥ ꯌꯥꯕꯥ, ꯇ꯭ꯔꯥꯟꯁꯦꯟꯗꯦꯟꯇꯜ ꯗꯤꯇꯔꯃꯤꯅꯦꯁꯟ ꯑꯣꯐ ꯇꯥꯏꯃꯒꯤ ꯈꯨꯠꯊꯥꯡꯗꯥ, ꯃꯗꯨ, ꯑꯦ.ꯑꯦꯁ."
"the schema of the conceptions of the understanding, mediates the","ꯂꯧꯁꯤꯡꯒꯤ ꯋꯥꯈꯜꯂꯣꯅꯁꯤꯡꯒꯤ ꯁ꯭ꯀꯤꯝ ꯑꯁꯤꯅꯥ, ꯃꯁꯤꯒꯤ ꯃꯔꯛꯇꯥ ꯂꯩꯕꯥ ꯋꯥꯐꯃꯁꯤꯡ"
subsumption of the latter under the former,ꯍꯥꯟꯅꯒꯤ ꯃꯈꯥꯗꯥ ꯇꯨꯡꯗꯥ ꯂꯥꯀꯄꯥ ꯑꯁꯤꯒꯤ ꯁꯕꯁꯝꯄꯤꯁꯟ .
"After what has been proved in our deduction of the categories, no one, it","ꯀꯦꯇꯦꯒꯣꯔꯤꯁꯤꯡ ꯑꯁꯤꯒꯤ ꯑꯩꯈꯣꯌꯒꯤ ꯗꯤꯗꯛꯁꯅꯗꯥ ꯄ꯭ꯔꯃꯥꯟ ꯇꯧꯔꯕꯥ ꯃꯇꯨꯡꯗꯥ ꯀꯅꯥꯒꯨꯝꯕꯥ ꯑꯃꯠꯇꯅꯥ, ꯃꯁꯤ ."
"is to be hoped, can hesitate as to the proper decision of the question,","ꯑꯁꯤ ꯑꯥꯁꯥ ꯇꯧꯕꯅꯤ, ꯋꯥꯍꯪ ꯑꯁꯤꯒꯤ ꯃꯇꯤꯛ ꯆꯥꯕꯥ ꯋꯥꯔꯦꯞ ꯂꯧꯕꯗꯥ ꯋꯥꯈꯜ ꯋꯥꯕꯥ ꯌꯥꯏ,"
whether the employment of these pure conceptions of the understanding,ꯂꯧꯁꯤꯡꯒꯤ ꯑꯁꯦꯡꯕꯥ ꯋꯥꯈꯜꯂꯣꯅꯁꯤꯡ ꯑꯁꯤ ꯊꯕꯛ ꯑꯣꯏꯅꯥ ꯄꯥꯡꯊꯣꯀꯄꯗꯥ .
"ought to be merely empirical or also transcendental; in other words,",ꯁꯨꯞꯅꯒꯤ ꯑꯦꯝꯄꯤꯔꯤꯀꯦꯜ ꯑꯣꯏꯕꯥ ꯅꯠꯠꯔꯒꯥ ꯇ꯭ꯔꯥꯟꯁꯦꯟꯗꯦꯟꯇ ꯑꯣꯏꯕꯥ ꯑꯣꯏꯒꯗꯕꯅꯤ;
"whether the categories, as conditions of a possible experience, relate à priori","ꯀꯦꯇꯦꯒꯣꯔꯤꯁꯤꯡ ꯑꯁꯤ, ꯑꯣꯏꯊꯣꯀꯄꯥ ꯌꯥꯕꯥ ꯑꯦꯛꯁꯄꯔꯤꯌꯦꯟꯁ ꯑꯃꯒꯤ ꯀꯟꯗꯤꯁꯟ ꯑꯣꯏꯅꯥ, à priori ꯒꯤ ꯃꯔꯤ ꯂꯩꯅꯕꯔꯥ?"
"solely to phenomena, or whether, as conditions of the possibility of things","ꯁꯨꯞꯅꯒꯤ ꯐꯤꯚꯃꯁꯤꯡꯗꯥ, ꯅꯠꯔꯒꯥ ꯄꯣꯠꯁꯤꯡꯒꯤ ꯑꯣꯏꯊꯣꯀꯄꯥ ꯌꯥꯕꯒꯤ ꯀꯟꯗꯤꯁꯅꯁꯤꯡ ꯑꯣꯏꯅꯥ, ."
"in general, their application can be extended to objects as things in","ꯃꯍꯧꯁꯥꯅꯥ, ꯃꯈꯣꯌꯒꯤ ꯑꯦꯞꯂꯤꯀꯦꯁꯟ ꯑꯁꯤ ꯄꯣꯠꯁꯤꯡ ꯑꯣꯏꯅꯥ ꯄꯣꯠꯁꯤꯡꯗꯥ ꯄꯤꯕꯥ ꯌꯥꯏ ."
"themselves. For we have there seen that conceptions are quite impossible,",ꯃꯈꯣꯏ ꯃꯁꯥꯃꯛ.
"and utterly without signification, unless either to them, or at least to the","ꯑꯃꯁꯨꯡ ꯃꯄꯨꯡ ꯐꯥꯅꯥ ꯁꯤꯒꯅꯦꯆꯔ ꯌꯥꯑꯣꯗꯅꯥ, ꯃꯈꯣꯌꯗꯥ ꯅꯠꯔꯒꯥ ꯌꯥꯃꯗ꯭ꯔꯕꯗꯥ ."
"elements of which they consist, an object be given; and that, consequently,","ꯃꯈꯣꯌꯅꯥ ꯁꯦꯝꯕꯥ ꯏꯂꯤꯃꯦꯟꯇꯁꯤꯡ, ꯄꯣꯠꯁꯛ ꯑꯃꯥ ꯄꯤꯕꯥ;"
they cannot possibly apply to objects as things in themselves without regard,ꯃꯈꯣꯌꯅꯥ ꯄꯣꯠꯁꯀꯁꯤꯡꯗꯥ ꯃꯈꯣꯌ ꯃꯁꯥꯃꯀꯄꯨ ꯌꯦꯡꯁꯤꯅꯕꯤꯕꯥ ꯌꯥꯗꯅꯥ ꯄꯣꯠꯁꯛ ꯑꯣꯏꯅꯥ ꯁꯤꯖꯤꯟꯅꯕꯥ ꯌꯥꯔꯣꯏ .
"to the question whether and how these may be given to us; and, further, that",ꯍꯥꯌꯔꯤꯕꯁꯤꯡ ꯑꯁꯤ ꯑꯩꯈꯣꯌꯗꯥ ꯄꯤꯕꯥ ꯌꯥꯕꯔꯥ ꯑꯃꯁꯨꯡ ꯀꯔꯝꯅꯥ ꯄꯤꯒꯅꯤ ꯍꯥꯌꯕꯒꯤ ꯋꯥꯍꯪ ꯑꯁꯤ;
the only manner in which objects can be given to us is by means of the,ꯑꯩꯈꯣꯌꯗꯥ ꯄꯣꯠꯁꯤꯡ ꯄꯤꯕꯥ ꯌꯥꯕꯥ ꯑꯃꯠꯇꯥ ꯉꯥꯏꯔꯕꯥ ꯃꯑꯣꯡꯗꯤ .
"modification of our sensibility; and, finally, that pure à priori conceptions,",ꯑꯩꯈꯣꯌꯒꯤ ꯁꯦꯟꯁꯤꯕꯤꯂꯤꯇꯤꯒꯤ ꯃꯣꯗꯤꯐꯤꯀꯦꯁꯟ;
"in addition to the function of the understanding in the category, must","ꯀꯦꯇꯦꯒꯣꯔꯤꯗꯥ ꯂꯩꯔꯤꯕꯥ ꯂꯧꯁꯤꯡꯒꯤ ꯐꯉ꯭ꯀꯁꯅꯒꯤ ꯃꯊꯛꯇꯥ, ꯃꯊꯧ ꯇꯥꯏ ꯫"
"contain à priori formal conditions of sensibility (of the internal sense,","ꯁꯦꯟꯁꯤꯕꯤꯂꯤꯇꯤꯒꯤ ꯐꯣꯔꯃꯦꯜ ꯀꯟꯗꯤꯁꯅꯁꯤꯡ (ꯏꯟꯇꯔꯅꯦꯜ ꯁꯦꯟꯁꯀꯤ, ."
"namely), which again contain the general condition under which alone the","ꯄꯜꯂꯕꯗꯥ, ꯃꯁꯤꯗꯥ ꯑꯃꯨꯛ ꯍꯟꯅꯥ ꯌꯥꯑꯣꯔꯤꯕꯥ ꯖꯦꯅꯔꯦꯜ ꯀꯟꯗꯤꯁꯟ ꯑꯗꯨ ꯃꯁꯥꯅꯥ ꯃꯁꯥꯕꯨ ."
category can be applied to any object. This formal and pure condition of,ꯀꯦꯇꯦꯒꯣꯔꯤ ꯑꯁꯤ ꯄꯣꯠꯁꯛ ꯑꯃꯍꯦꯛꯇꯗꯥ ꯑꯦꯞꯂꯥꯏ ꯇꯧꯕꯥ ꯌꯥꯏ꯫
"sensibility, to which the conception of the understanding is restricted in its","ꯁꯦꯟꯁꯤꯕꯤꯂꯤꯇꯤ, ꯃꯁꯤꯗꯥ ꯂꯧꯁꯤꯡꯒꯤ ꯀꯟꯁꯦꯄꯁꯟ ꯑꯁꯤ ꯑꯥꯏ.ꯇꯤ.ꯑꯦꯁ."
"employment, we shall name the schema of the conception of the","ꯏꯃꯞꯂꯣꯏꯃꯦꯟꯇ, ꯑꯩꯈꯣꯌꯅꯥ ꯀꯟꯁꯦꯄꯁꯅꯒꯤ ꯁ꯭ꯀꯤꯝ ꯑꯁꯤꯒꯤ ꯃꯃꯤꯡ ꯊꯣꯅꯒꯅꯤ ꯫"
"understanding, and the procedure of the understanding with these schemata","ꯂꯧꯁꯤꯅꯕꯥ, ꯑꯃꯁꯨꯡ ꯁ꯭ꯀꯤꯃꯇꯥ ꯑꯁꯤꯒꯥ ꯂꯣꯌꯅꯅꯥ ꯂꯧꯁꯤꯅꯕꯒꯤ ꯊꯧꯑꯣꯡ ꯑꯁꯤ ."
we shall call the schematism of the pure understanding,ꯑꯩꯈꯣꯌꯅꯥ ꯑꯁꯦꯡꯕꯥ ꯂꯧꯁꯤꯡꯒꯤ ꯁ꯭ꯀꯦꯃꯦꯇꯤꯖꯝ ꯍꯥꯌꯅꯥ ꯀꯧꯒꯅꯤ .
"The schema is, in itself, always a mere product of the imagination. But,","ꯁ꯭ꯀꯤꯝ ꯑꯁꯤ, ꯃꯁꯥ ꯃꯊꯟꯇꯥ, ꯃꯇꯝ ꯄꯨꯝꯅꯃꯛꯇꯥ ꯏꯃꯦꯖꯤꯅꯦꯁꯅꯒꯤ ꯁꯨꯞꯅꯒꯤ ꯄꯣꯠꯊꯣꯛ ꯑꯃꯈꯛꯇꯅꯤ꯫"
"as the synthesis of imagination has for its aim no single intuition, but","ꯏꯃꯦꯖꯤꯅꯦꯁꯅꯒꯤ ꯁꯤꯟꯊꯦꯁꯤꯁ ꯑꯁꯤꯅꯥ ꯃꯁꯤꯒꯤ ꯄꯥꯟꯗꯝ ꯑꯁꯤꯒꯤꯗꯃꯛꯇꯥ ꯑꯃꯠꯇꯥ ꯑꯣꯏꯕꯥ ꯏꯟꯠꯌꯨꯏꯇꯤꯖ ꯂꯩꯇꯦ, ꯑꯗꯨꯕꯨ ."
"merely unity in the determination of sensibility, the schema is clearly","ꯁꯦꯟꯁꯤꯕꯤꯂꯤꯇꯤꯒꯤ ꯋꯥꯔꯦꯞ ꯂꯧꯕꯗꯥ ꯁꯨꯞꯅꯇꯒꯤ ꯑꯄꯨꯅꯕꯥ, ꯁ꯭ꯀꯤꯝ ꯑꯁꯤ ꯃꯌꯦꯛ ꯁꯦꯡꯅꯥ [...]"
"distinguishable from the image. Thus, if I place five points one after",ꯏꯃꯦꯖ ꯑꯁꯤꯗꯒꯤ ꯈꯦꯠꯅꯕꯥ ꯊꯃꯕꯥ꯫
"another.... this is an image of the number five. On the other hand, if I only",ꯑꯇꯣꯞꯄꯥ.... ꯃꯁꯤ ꯅꯝꯕꯔ ꯃꯉꯥꯒꯤ ꯏꯃꯦꯖ ꯑꯃꯅꯤ꯫
"think a number in general, which may be either five or a hundred, this","ꯃꯍꯧꯁꯥꯅꯥ ꯅꯝꯕꯔ ꯑꯃꯥ ꯈꯅꯕꯤꯌꯨ, ꯃꯗꯨ ꯃꯉꯥ ꯅꯠꯔꯒꯥ ꯂꯤꯁꯤꯡ ꯑꯃꯥ ꯑꯣꯏꯕꯥ ꯌꯥꯏ, ꯃꯁꯤ ."
thought is rather the representation of a method of representing in an image,ꯋꯥꯈꯜ ꯑꯁꯤ ꯃꯗꯨꯒꯤ ꯃꯍꯨꯠꯇꯥ ꯏꯃꯦꯖ ꯑꯃꯗꯥ ꯔꯤꯞꯔꯖꯦꯟꯇ ꯇꯧꯕꯒꯤ ꯃꯑꯣꯡ ꯑꯃꯒꯤ ꯔꯤꯞꯔꯖꯦꯟꯇꯦꯁꯟ ꯑꯗꯨꯅꯤ .
"a sum (e.g., a thousand) in conformity with a conception, than the image","ꯏꯃꯦꯖꯗꯒꯤ ꯍꯦꯟꯅꯥ, ꯀꯟꯁꯦꯄꯁꯟ ꯑꯃꯒꯥ ꯆꯨꯅꯕꯥ ꯁꯣꯝ ꯑꯃꯥ (ꯈꯨꯗꯝ ꯑꯣꯏꯅꯥ, ꯂꯤꯁꯤꯡ ꯑꯃꯥ) ."
"itself, an image which I should find some little difficulty in reviewing, and","ꯃꯁꯥꯃꯛ, ꯑꯩꯅꯥ ꯔꯤꯚꯤꯌꯨ ꯇꯧꯕꯗꯥ ꯑꯄꯤꯀꯄꯥ ꯑꯋꯥꯕꯥ ꯈꯔꯥ ꯊꯦꯡꯅꯒꯗꯕꯥ ꯏꯃꯦꯖ ꯑꯃꯥ, ꯑꯃꯁꯨꯡ ."
comparing with the conception. Now this representation of a general,ꯋꯥꯈꯜꯂꯣꯟ ꯑꯗꯨꯒꯥ ꯆꯥꯡꯗꯝꯅꯕꯥ꯫
"procedure of the imagination to present its image to a conception, I call the","ꯃꯁꯤꯒꯤ ꯏꯃꯦꯖ ꯑꯁꯤ ꯀꯟꯁꯦꯄꯁꯟ ꯑꯃꯗꯥ ꯄꯤꯅꯕꯥ ꯏꯃꯦꯖꯤꯅꯦꯁꯅꯒꯤ ꯄ꯭ꯔꯣꯁꯤꯗ꯭ꯌꯨꯔ, ꯑꯩꯅꯥ ꯀꯧꯏ꯫"
schema of this conception,ꯃꯁꯤꯒꯤ ꯋꯥꯈꯜꯂꯣꯟ ꯑꯁꯤꯒꯤ ꯁ꯭ꯀꯤꯝ .
"In truth, it is not images of objects, but schemata, which lie at the","ꯑꯆꯨꯝꯕꯗꯤ, ꯃꯁꯤ ꯄꯣꯠꯁꯀꯁꯤꯡꯒꯤ ꯃꯁꯛ ꯅꯠꯇꯦ, ꯁ꯭ꯀꯤꯃꯇꯥꯅꯤ, ꯃꯈꯣꯌꯁꯤꯡ ꯑꯁꯤ ."
foundation of our pure sensuous conceptions. No image could ever be,ꯑꯩꯈꯣꯌꯒꯤ ꯄ꯭ꯌꯨꯔ ꯁꯦꯟꯁ꯭ꯌꯨꯁ ꯀꯟꯁꯦꯄꯁꯅꯁꯤꯡꯒꯤ ꯌꯨꯝꯐꯝ꯫
adequate to our conception of a triangle in general. For the generalness of,ꯃꯍꯧꯁꯥꯅꯥ ꯇ꯭ꯔꯥꯏꯑꯦꯉ꯭ꯒꯜ ꯑꯃꯒꯤ ꯃꯇꯥꯡꯗꯥ ꯑꯩꯈꯣꯌꯒꯤ ꯋꯥꯈꯜꯂꯣꯟ ꯑꯗꯨꯒꯥ ꯆꯨꯅꯕꯥ꯫
"the conception it never could attain to, as this includes under itself all","ꯃꯁꯤꯅꯥ ꯀꯩꯗꯧꯅꯨꯡꯗꯥ ꯐꯪꯂꯃꯗꯕꯥ ꯋꯥꯈꯜꯂꯣꯟ ꯑꯗꯨ, ꯃꯔꯃꯗꯤ ꯃꯁꯤꯗꯥ ꯃꯁꯥꯒꯤ ꯃꯈꯥꯗꯥ ꯄꯨꯝꯅꯃꯛ ꯌꯥꯑꯣꯔꯤ"
"triangles, whether right-angled, acute-angled, etc., whilst the image would","ꯇ꯭ꯔꯥꯏꯑꯦꯉ꯭ꯒꯂꯁꯤꯡ, ꯔꯥꯏꯠ-ꯑꯦꯉ꯭ꯒꯦꯜ ꯑꯣꯏꯔꯕꯁꯨ, ꯑꯦꯛꯌꯨꯠ-ꯑꯦꯉ꯭ꯒꯦꯜ ꯑꯣꯏꯔꯕꯁꯨ, ꯑꯁꯤꯅꯆꯤꯡꯕꯥ, ꯑꯗꯨꯒꯥ ꯏꯃꯦꯖ ꯑꯁꯤꯅꯥ ꯑꯣꯏꯒꯅꯤ"
always be limited to a single part of this sphere. The schema of the triangle,ꯃꯇꯝ ꯄꯨꯝꯅꯃꯛꯇꯥ ꯁ꯭ꯐꯤꯔ ꯑꯁꯤꯒꯤ ꯁꯔꯨꯛ ꯑꯃꯈꯛꯇꯗꯥ ꯂꯤꯃꯤꯠ ꯇꯧꯕꯤꯌꯨ꯫
"can exist nowhere else than in thought, and it indicates a rule of the","ꯋꯥꯈꯜꯂꯣꯅꯗꯥ ꯅꯠꯇꯅꯥ ꯑꯇꯣꯞꯄꯥ ꯃꯐꯝ ꯑꯃꯠꯇꯗꯥ ꯂꯩꯕꯥ ꯌꯥꯏ, ꯑꯃꯁꯨꯡ ꯃꯁꯤꯅꯥ ."
synthesis of the imagination in regard to pure figures in space. Still less is,ꯁ꯭ꯄꯦꯁꯇꯥ ꯂꯩꯕꯥ ꯑꯁꯦꯡꯕꯥ ꯐꯤꯒꯔꯁꯤꯡꯒꯤ ꯃꯇꯥꯡꯗꯥ ꯏꯃꯦꯖꯤꯅꯦꯁꯅꯒꯤ ꯁꯤꯟꯊꯦꯁꯤꯁ꯫
"an object of experience, or an image of the object, ever to the empirical","ꯑꯦꯛꯁꯄꯔꯤꯑꯦꯟꯁꯀꯤ ꯑꯣꯕꯖꯦꯛꯇ ꯑꯃꯥ, ꯅꯠꯔꯒꯥ ꯄꯣꯠꯁꯛ ꯑꯗꯨꯒꯤ ꯏꯃꯦꯖ ꯑꯃꯥ, ꯃꯇꯝ ꯑꯃꯠꯇꯗꯥ ꯑꯦꯝꯄꯤꯔꯤꯀꯦꯂꯗꯥ ."
"conception. On the contrary, the conception always relates immediately to",ꯀꯟꯁꯦꯄꯁꯟ ꯇꯧꯕꯥ꯫
"the schema of the imagination, as a rule for the determination of our",ꯑꯩꯈꯣꯌꯒꯤ ꯋꯥꯔꯦꯞ ꯂꯧꯕꯒꯤ ꯅꯤꯌꯝ ꯑꯃꯥ ꯑꯣꯏꯅꯥ ꯏꯃꯦꯖꯃꯦꯟꯇꯀꯤ ꯁ꯭ꯀꯤꯝ ꯑꯁꯤ .
"intuition, in conformity with a certain general conception. The conception","ꯏꯟꯠꯌꯨꯏꯇꯤꯖ, ꯑꯀꯛꯅꯕꯥ ꯖꯦꯅꯦꯔꯦꯜ ꯀꯟꯁꯦꯄꯁꯟ ꯑꯃꯒꯥ ꯆꯨꯅꯕꯥ ꯃꯑꯣꯡꯗꯥ꯫"
"of a dog indicates a rule, according to which my imagination can delineate","ꯀꯨꯠꯇꯥ ꯑꯃꯅꯥ ꯅꯤꯌꯝ ꯑꯃꯥ ꯇꯥꯀꯏ, ꯃꯁꯤꯒꯤ ꯃꯇꯨꯡ ꯏꯟꯅꯥ ꯑꯩꯒꯤ ꯏꯃꯦꯖꯃꯦꯟꯇ ꯑꯁꯤ ꯂꯦꯄꯊꯣꯀꯄꯥ ꯉꯃꯒꯅꯤ"
"the figure of a four-footed animal in general, without being limited to any","ꯃꯍꯧꯁꯥꯅꯥ ꯐꯨꯠ ꯃꯔꯤꯒꯤ ꯁꯥ ꯑꯃꯒꯤ ꯐꯤꯒꯔ, ꯑꯃꯠꯇꯥ ꯌꯥꯑꯣꯗꯅꯥ ."
"particular individual form which experience presents to me, or indeed to","ꯑꯀꯛꯅꯕꯥ ꯃꯤꯑꯣꯏ ꯑꯃꯒꯤ ꯃꯑꯣꯡ ꯃꯇꯧ ꯑꯗꯨꯅꯥ ꯑꯦꯛꯁꯄꯔꯤꯌꯦꯟꯁꯅꯥ ꯑꯩꯉꯣꯟꯗꯥ ꯄꯤꯔꯤꯕꯥ, ꯅꯠꯔꯒꯥ ꯇꯁꯦꯡꯅꯥ"
any possible image that I can represent to myself in concreto. This,ꯀꯅꯛꯔꯦꯇꯣꯗꯥ ꯑꯩꯍꯥꯛꯅꯥ ꯏꯁꯥꯃꯀꯄꯨ ꯔꯤꯞꯔꯖꯦꯟꯇ ꯇꯧꯕꯥ ꯌꯥꯕꯥ ꯑꯣꯏꯊꯣꯀꯄꯥ ꯌꯥꯕꯥ ꯏꯃꯦꯖ ꯑꯃꯥ ꯍꯦꯛꯇꯥ꯫
schematism of our understanding in regard to phenomena and their mere,ꯐꯤꯚꯃꯁꯤꯡ ꯑꯃꯁꯨꯡ ꯃꯈꯣꯌꯒꯤ ꯁꯨꯞꯅꯒꯤ ꯑꯩꯈꯣꯌꯒꯤ ꯂꯧꯁꯤꯡꯒꯤ ꯁ꯭ꯀꯦꯃꯦꯇꯤꯖꯝ
"form, is an art, hidden in the depths of the human soul, whose true modes of","ꯐꯔꯝ, ꯑꯁꯤ ꯀꯂꯥ ꯑꯃꯅꯤ, ꯃꯤꯑꯣꯏꯕꯒꯤ ꯊꯋꯥꯏꯒꯤ ꯑꯋꯥꯡꯕꯗꯥ ꯂꯣꯠꯇꯨꯅꯥ ꯂꯩꯕꯥ, ꯃꯈꯣꯌꯒꯤ ꯑꯁꯦꯡꯕꯥ ꯃꯑꯣꯡꯁꯤꯡ ꯑꯗꯨ ."
action we shall only with difficulty discover and unveil. Thus much only,ꯑꯦꯛꯁꯟ ꯑꯩꯈꯣꯌꯅꯥ ꯑꯋꯥꯕꯥ ꯇꯥꯔꯀꯄꯒꯥ ꯂꯣꯌꯅꯅꯥ ꯈꯉꯕꯥ ꯑꯃꯁꯨꯡ ꯐꯣꯡꯗꯣꯀꯄꯥ ꯈꯛꯇꯃꯛ ꯇꯧꯒꯅꯤ꯫
can we say: “The image is a product of the empirical faculty of the,ꯑꯩꯈꯣꯌꯅꯥ ꯍꯥꯌꯕꯥ ꯉꯃꯒꯗ꯭ꯔꯥ: “ꯏꯃꯦꯖ ꯑꯁꯤ ꯑꯦꯝꯄꯤꯔꯤꯀꯦꯜ ꯐꯦꯀꯜꯇꯤꯒꯤ ꯄꯣꯠꯊꯣꯛ ꯑꯃꯅꯤ
productive imagination—the schema of sensuous conceptions (of figures in,ꯄ꯭ꯔꯗꯛꯇꯤꯕ ꯏꯃꯦꯖꯤꯅꯦꯁꯟ—ꯁꯦꯟꯁ꯭ꯌꯨꯁ ꯀꯟꯁꯦꯄꯁꯅꯁꯤꯡꯒꯤ ꯁ꯭ꯀꯤꯝ (ꯐꯤꯒꯔꯁꯤꯡꯒꯤ ꯃꯇꯥꯡꯗꯥ ꯳.
"space, for example) is a product, and, as it were, a monogram of the pure","ꯁ꯭ꯄꯦꯁ, ꯈꯨꯗꯝ ꯑꯣꯏꯅꯥ) ꯑꯁꯤ ꯄꯣꯠꯊꯣꯛ ꯑꯃꯅꯤ, ꯑꯃꯁꯨꯡ ꯍꯥꯌꯕꯗꯤ ꯄ꯭ꯌꯨꯔ ꯑꯣꯏꯕꯥ ꯃꯣꯅꯣꯒ꯭ꯔꯥꯝ ꯑꯃꯅꯤ꯫"
"imagination à priori, whereby and according to which images first become","ꯏꯃꯦꯖꯤꯅꯦꯁꯟ à Priori, ꯃꯗꯨꯗꯥ ꯑꯃꯁꯨꯡ ꯃꯗꯨꯒꯤ ꯃꯇꯨꯡ ꯏꯟꯅꯥ ꯏꯃꯦꯖꯁꯤꯡ ꯑꯗꯨ ꯑꯍꯥꯅꯕꯥ ꯑꯣꯏꯅꯥ ꯑꯣꯏꯔꯀꯏ꯫"
"possible, which, however, can be connected with the conception only","ꯑꯣꯏꯊꯣꯀꯄꯥ ꯌꯥꯕꯥ, ꯃꯗꯨ, ꯑꯗꯨꯝ ꯑꯣꯏꯅꯃꯛ, ꯀꯟꯁꯦꯄꯁꯅꯒꯥ ꯃꯔꯤ ꯂꯩꯅꯕꯥ ꯑꯣꯏꯕꯥ ꯌꯥꯏ ."
"mediately by means of the schema which they indicate, and are in","ꯃꯈꯣꯌꯅꯥ ꯇꯥꯀꯄꯥ, ꯑꯃꯁꯨꯡ 2018ꯗꯥ ꯂꯩꯔꯤꯕꯥ ꯁ꯭ꯀꯤꯃꯒꯤ ꯈꯨꯠꯊꯥꯡꯗꯥ ꯃꯦꯗꯤꯌꯝ ꯑꯣꯏꯅꯥ"
"themselves never fully adequate to it.” On the other hand, the schema of a",ꯃꯈꯣꯌ ꯃꯁꯥꯃꯛ ꯀꯩꯗꯧꯅꯨꯡꯗꯥ ꯃꯄꯨꯡ ꯐꯥꯅꯥ ꯃꯇꯤꯛ ꯆꯥꯗꯦ꯫”
pure conception of the understanding is something that cannot be reduced,ꯂꯧꯁꯤꯡꯒꯤ ꯄ꯭ꯌꯨꯔ ꯀꯟꯁꯦꯄꯁꯟ ꯑꯁꯤ ꯍꯟꯊꯍꯅꯕꯥ ꯉꯃꯗꯕꯥ ꯋꯥꯐꯝ ꯑꯃꯅꯤ .
into any image—it is nothing else than the pure synthesis expressed by the,ꯏꯃꯦꯖ ꯑꯃꯍꯦꯛꯇꯗꯥ—ꯃꯁꯤꯅꯥ ꯐꯣꯡꯗꯣꯀꯄꯥ ꯑꯁꯦꯡꯕꯥ ꯁꯤꯟꯊꯦꯁꯤꯁ ꯑꯗꯨꯗꯒꯤ ꯍꯦꯟꯅꯥ ꯑꯇꯣꯞꯄꯥ ꯑꯃꯠꯇꯥ ꯅꯠꯇꯦ꯫
"category, conformably, to a rule of unity according to conceptions. It is a","ꯀꯦꯇꯦꯒꯣꯔꯤ, ꯀꯅꯐꯣꯔꯃꯦꯕꯜ ꯑꯣꯏꯅꯥ, ꯀꯟꯁꯦꯄꯁꯅꯒꯤ ꯃꯇꯨꯡ ꯏꯟꯅꯥ ꯑꯄꯨꯅꯕꯥ ꯔꯨꯜ ꯑꯃꯗꯥ꯫"
"transcendental product of the imagination, a product which concerns the","ꯏꯃꯦꯖꯤꯅꯦꯁꯅꯒꯤ ꯇ꯭ꯔꯥꯟꯁꯦꯟꯗꯦꯟꯇꯜ ꯄ꯭ꯔꯗꯛꯇ, ꯃꯁꯤꯒꯤ ꯃꯇꯥꯡꯗꯥ ꯋꯥꯐꯝ ꯑꯃꯥ ꯌꯥꯑꯣꯕꯥ ꯄꯣꯠꯊꯣꯛ ꯑꯃꯅꯤ꯫"
"determination of the internal sense, according to conditions of its form","ꯏꯟꯇꯔꯅꯦꯜ ꯁꯦꯟꯁ ꯑꯗꯨ ꯂꯦꯄꯊꯣꯀꯄꯥ, ꯃꯁꯤꯒꯤ ꯃꯑꯣꯡ ꯃꯇꯧꯒꯤ ꯀꯟꯗꯤꯁꯅꯁꯤꯡꯒꯤ ꯃꯇꯨꯡ ꯏꯟꯅꯥ"
"(time) in respect to all representations, in so far as these representations","(ꯃꯇꯝ) ꯔꯤꯞꯔꯖꯦꯟꯇꯦꯁꯟ ꯄꯨꯝꯅꯃꯛꯀꯤ ꯃꯇꯥꯡꯗꯥ, ꯍꯧꯖꯤꯛ ꯐꯥꯑꯣꯕꯗꯥ ꯔꯤꯞꯔꯖꯦꯟꯇꯦꯁꯅꯁꯤꯡ ꯑꯁꯤꯒꯤ ꯃꯇꯨꯡ ꯏꯟꯅꯥ"
"must be conjoined à priori in one conception, conformably to the unity of","ꯀꯟꯁꯦꯄꯁꯟ ꯑꯃꯗꯥ à priori ꯀꯟꯖ꯭ꯌꯨꯝ ꯇꯧꯕꯥ ꯇꯥꯏ, ꯃꯁꯤꯒꯤ ꯑꯄꯨꯅꯕꯥ ꯑꯁꯤꯒꯥ ꯀꯣꯟꯅꯅꯥ ꯆꯠꯄꯥ ꯌꯥꯏ꯫"
apperception,ꯑꯦꯄꯔꯁꯦꯄꯁꯟ ꯇꯧꯕꯥ ꯌꯥꯏ꯫
Without entering upon a dry and tedious analysis of the essential,ꯇꯉꯥꯏ ꯐꯗꯕꯥ ꯑꯗꯨꯒꯤ ꯁꯨꯡꯕꯥ ꯑꯃꯁꯨꯡ ꯇꯃꯊꯤꯕꯥ ꯑꯦꯅꯥꯂꯥꯏꯁꯤꯁ ꯑꯃꯗꯥ ꯆꯪꯗꯅꯥ .
requisites of transcendental schemata of the pure conceptions of the,ꯒꯤ ꯄ꯭ꯌꯨꯔ ꯀꯟꯁꯦꯄꯁꯅꯁꯤꯡꯒꯤ ꯇ꯭ꯔꯥꯟꯁꯦꯟꯗꯦꯟꯇꯜ ꯁ꯭ꯀꯤꯃꯇꯥꯒꯤ ꯃꯊꯧ ꯇꯥꯕꯁꯤꯡ
"understanding, we shall rather proceed at once to give an explanation of",ꯂꯧꯁꯤꯟꯗꯨꯅꯥ ꯑꯩꯈꯣꯌꯅꯥ ꯃꯗꯨꯒꯤ ꯃꯍꯨꯠꯇꯥ ꯑꯃꯨꯛ ꯍꯟꯅꯥ ꯃꯈꯥ ꯆꯠꯊꯒꯅꯤ ꯍꯥꯌꯕꯒꯤ ꯃꯇꯥꯡꯗꯥ ꯃꯌꯦꯛ ꯁꯦꯡꯅꯥ ꯇꯥꯀꯄꯥ ꯑꯃꯥ ꯄꯤꯔꯒꯅꯤ꯫
"them according to the order of the categories, and in connection therewith","ꯃꯈꯣꯌꯁꯤꯡ ꯑꯁꯤ ꯀꯦꯇꯦꯒꯣꯔꯤꯁꯤꯡꯒꯤ ꯑꯣꯔꯗꯔꯒꯤ ꯃꯇꯨꯡ ꯏꯟꯅꯥ, ꯑꯃꯁꯨꯡ ꯃꯁꯤꯒꯥ ꯃꯔꯤ ꯂꯩꯅꯅꯥ ."
For the external sense the pure image of all quantities (quantorum) is,ꯃꯄꯥꯅꯒꯤ ꯁꯦꯟꯁꯀꯤꯗꯃꯛ ꯃꯁꯤꯡ ꯄꯨꯝꯅꯃꯛꯀꯤ (ꯀ꯭ꯕꯥꯟꯇꯣꯔꯝ) ꯑꯁꯦꯡꯕꯥ ꯏꯃꯦꯖ ꯑꯁꯤ .
"space; the pure image of all objects of sense in general, is time. But the pure",ꯑꯍꯥꯡꯕ;
"schema of quantity (quantitatis) as a conception of the understanding, is","ꯂꯧꯁꯤꯡꯒꯤ ꯋꯥꯈꯜꯂꯣꯟ ꯑꯃꯥ ꯑꯣꯏꯅꯥ ꯀ꯭ꯕꯥꯟꯇꯤꯇꯤ (ꯀ꯭ꯕꯥꯟꯇꯤꯇꯥꯇꯤꯁ)ꯒꯤ ꯁ꯭ꯀꯤꯝ, ꯑꯁꯤ ."
"number, a representation which comprehends the successive addition of one","ꯅꯝꯕꯔ, ꯑꯃꯒꯤ ꯃꯇꯨꯡ ꯏꯟꯅꯥ ꯑꯦꯗꯤꯁꯟ ꯑꯃꯥ ꯌꯥꯑꯣꯕꯥ ꯔꯤꯞꯔꯖꯦꯟꯇꯦꯁꯟ ꯑꯃꯥ ."
"to one (homogeneous quantities). Thus, number is nothing else than the",ꯑꯃꯗꯥ (ꯍꯣꯃꯣꯖꯦꯅꯤꯛ ꯃꯁꯤꯡ)꯫
"unity of the synthesis of the manifold in a homogeneous intuition, by means","ꯍꯣꯃꯣꯖꯦꯅꯤꯛ ꯏꯟꯠꯌꯨꯏꯇꯤꯖ ꯑꯃꯗꯥ ꯃꯦꯅꯤꯐꯣꯜꯗꯀꯤ ꯁꯤꯟꯊꯦꯁꯤꯁꯀꯤ ꯑꯄꯨꯅꯕꯥ, ꯈꯨꯠꯊꯥꯡꯗꯥ"
of my generating time itself in my apprehension of the intuition,ꯏꯟꯠꯌꯨꯏꯇꯤꯒꯤ ꯃꯇꯥꯡꯗꯥ ꯑꯩꯒꯤ ꯋꯥꯈꯂꯗꯥ ꯂꯥꯀꯄꯥ ꯃꯇꯃꯗꯥ ꯑꯩꯒꯤ ꯖꯦꯅꯔꯦꯇꯤꯡ ꯇꯥꯏꯝ ꯃꯁꯥꯃꯛꯀꯤ .
"Reality, in the pure conception of the understanding, is that which","ꯔꯤꯑꯦꯂꯤꯇꯤ, ꯂꯧꯁꯤꯡꯒꯤ ꯄ꯭ꯌꯨꯔ ꯀꯟꯁꯦꯄꯁꯟꯗꯥ, ꯃꯗꯨꯅꯤ"
"corresponds to a sensation in general; that, consequently, the conception of",ꯃꯍꯧꯁꯥꯅꯥ ꯁꯦꯟꯁꯟ ꯑꯃꯒꯥ ꯃꯥꯟꯅꯩ;
which indicates a being (in time). Negation is that the conception of which,ꯃꯁꯤꯅꯥ ꯖꯤꯕ ꯑꯃꯥ (ꯃꯇꯝ ꯑꯃꯗꯥ) ꯇꯥꯀꯏ꯫
represents a not-being (in time). The opposition of these two consists,ꯅꯠꯇꯕꯥ (ꯃꯇꯝ ꯑꯃꯗꯥ) ꯑꯃꯥ ꯔꯤꯞꯔꯖꯦꯟꯇ ꯇꯧꯏ꯫
"therefore in the difference of one and the same time, as a time filled or a","ꯃꯔꯝ ꯑꯗꯨꯅꯥ ꯃꯇꯝ ꯑꯃꯒꯤ ꯈꯦꯠꯅꯕꯥ ꯑꯗꯨꯗꯥ, ꯃꯇꯝ ꯂꯣꯏꯔꯕꯥ ꯅꯠꯔꯒꯥ ꯑꯦ ."
"time empty. Now as time is only the form of intuition, consequently of",ꯃꯇꯝ ꯏꯝꯄꯣꯔꯠ ꯇꯧꯕꯥ꯫
"objects as phenomena, that which in objects corresponds to sensation is the","ꯑꯣꯕꯖꯦꯛꯇꯁꯤꯡ ꯑꯁꯤ ꯐꯤꯚꯝ ꯑꯣꯏꯅꯥ, ꯄꯣꯠꯁꯤꯡꯗꯥ ꯂꯩꯔꯤꯕꯥ ꯑꯗꯨ ꯁꯦꯟꯁꯁꯀꯥ ꯃꯥꯟꯅꯕꯥ ꯑꯗꯨꯅꯤ ꯫"
"transcendental matter of all objects as things in themselves (Sachheit,","ꯃꯁꯥ ꯃꯊꯟꯇꯥ ꯄꯣꯠ ꯑꯣꯏꯅꯥ ꯄꯣꯠ ꯈꯨꯗꯤꯡꯃꯛꯀꯤ ꯇ꯭ꯔꯥꯟꯁꯦꯟꯗꯦꯟꯇꯜ ꯃꯦꯇꯔ (ꯁꯥꯆꯍꯦꯠ, ."
reality). Now every sensation has a degree or quantity by which it can fill,ꯇꯁꯦꯡꯕ).
"time, that is to say, the internal sense in respect of the representation of an","ꯃꯇꯝ, ꯍꯥꯌꯕꯗꯤ ꯑꯃꯒꯤ ꯔꯤꯞꯔꯖꯦꯟꯇꯦꯁꯅꯒꯤ ꯃꯇꯥꯡꯗꯥ ꯏꯟꯇꯔꯅꯦꯜ ꯁꯦꯟꯁ ꯑꯁꯤ ."
"object, more or less, until it vanishes into nothing (= 0 = negatio). Thus","ꯄꯣꯠꯁꯛ, ꯍꯦꯟꯅꯥ ꯅꯠꯠꯔꯒꯥ ꯍꯦꯟꯅꯥ, ꯃꯁꯤ ꯀꯔꯤꯒꯨꯝꯕꯥ ꯑꯃꯠꯇꯥ ꯂꯩꯇꯕꯥ (= 0 = ꯅꯦꯒꯥꯇꯤꯑꯣ)ꯗꯥ ꯃꯥꯡꯈꯤꯕꯥ ꯐꯥꯎꯕꯥ꯫"
"there is a relation and connection between reality and negation, or rather a","ꯔꯤꯑꯦꯂꯤꯇꯤ ꯑꯃꯁꯨꯡ ꯅꯦꯒꯦꯁꯅꯒꯤ ꯃꯔꯛꯇꯥ ꯂꯩꯔꯤꯕꯥ ꯃꯔꯤ ꯑꯃꯁꯨꯡ ꯃꯔꯤ ꯑꯃꯥ ꯂꯩꯔꯤ, ꯅꯠꯔꯒꯥ ꯃꯗꯨꯒꯤ ꯃꯍꯨꯠꯇꯥ ꯑꯦ ."
"transition from the former to the latter, which makes every reality","ꯍꯥꯟꯅꯒꯤ ꯑꯗꯨꯗꯒꯤ ꯇꯨꯡꯗꯥ ꯂꯥꯀꯄꯥ ꯇ꯭ꯔꯥꯟꯁꯤꯁꯟ, ꯃꯗꯨꯅꯥ ꯔꯤꯑꯦꯂꯤꯇꯤ ꯈꯨꯗꯤꯡꯃꯛ ."
representable to us as a quantum; and the schema of a reality as the quantity,ꯀ꯭ꯕꯥꯟꯇꯝ ꯑꯃꯥ ꯑꯣꯏꯅꯥ ꯑꯩꯈꯣꯌꯗꯥ ꯔꯤꯞꯔꯖꯦꯟꯇ ꯇꯧꯕꯥ;
"of something in so far as it fills time, is exactly this continuous and uniform","ꯃꯇꯝ ꯑꯗꯨ ꯃꯄꯨꯡ ꯐꯥꯍꯅꯕꯥ ꯐꯥꯑꯣꯕꯗꯥ ꯀꯔꯤꯒꯨꯝꯕꯥ ꯑꯃꯒꯤ, ꯇꯁꯦꯡꯅꯥ ꯃꯁꯤꯒꯤ ꯀꯟꯇꯤꯟꯌꯨꯑꯣꯁ ꯑꯃꯁꯨꯡ ꯌꯨꯅꯤꯐꯣꯔꯝ ꯑꯁꯤꯅꯤ ."
"generation of the reality in time, as we descend in time from the sensation",ꯃꯇꯃꯒꯤ ꯃꯇꯨꯡ ꯏꯟꯅꯥ ꯃꯇꯝ ꯆꯥꯅꯥ ꯂꯥꯀꯄꯥ ꯃꯇꯃꯗꯥ ꯔꯤꯑꯦꯂꯤꯇꯤꯒꯤ ꯖꯦꯅꯔꯦꯁꯟ ꯑꯁꯤ ꯁꯦꯟꯁꯁꯇꯒꯤ
"which has a certain degree, down to the vanishing thereof, or gradually","ꯃꯁꯤꯗꯥ ꯑꯀꯛꯅꯕꯥ ꯗꯤꯒ꯭ꯔꯤ ꯑꯃꯥ ꯂꯩ, ꯃꯗꯨꯒꯤ ꯃꯊꯛꯇꯥ ꯂꯣꯏꯕꯥ ꯐꯥꯑꯣꯕꯥ, ꯅꯠꯔꯒꯥ ꯇꯞꯅꯥ ꯇꯞꯅꯥ ."
ascend from negation to the quantity thereof,ꯅꯦꯒꯦꯁꯅꯗꯒꯤ ꯃꯗꯨꯒꯤ ꯃꯁꯤꯡꯗꯥ ꯍꯦꯅꯒꯠꯂꯦ
"The schema of substance is the permanence of the real in time; that is, the",ꯄꯣꯠꯁꯛ ꯑꯁꯤꯒꯤ ꯁ꯭ꯀꯤꯝ ꯑꯁꯤ ꯃꯇꯃꯒꯤ ꯃꯇꯨꯡ ꯏꯟꯅꯥ ꯔꯤꯑꯦꯂꯒꯤ ꯄꯔꯃꯥꯅꯦꯟꯁꯅꯤ;
representation of it as a substratum of the empirical determination of time; a,ꯃꯇꯃꯒꯤ ꯑꯦꯝꯄꯤꯔꯤꯀꯦꯜ ꯗꯤꯇꯔꯃꯤꯅꯦꯁꯅꯒꯤ ꯁꯕꯁ꯭ꯠꯔꯦꯇꯝ ꯑꯃꯥ ꯑꯣꯏꯅꯥ ꯃꯁꯤꯕꯨ ꯔꯤꯞꯔꯖꯦꯟꯇꯦꯁꯟ ꯇꯧꯕꯥ;
"substratum which therefore remains, whilst all else changes. (Time passes",ꯃꯔꯝ ꯑꯗꯨꯅꯥ ꯑꯇꯣꯞꯄꯥ ꯄꯨꯝꯅꯃꯛ ꯍꯣꯡꯂꯀꯄꯒꯥ ꯂꯣꯌꯅꯅꯥ ꯂꯩꯔꯤꯕꯥ ꯁꯕꯁ꯭ꯠꯔꯦꯇꯝ꯫
"not, but in it passes the existence of the changeable. To time, therefore,","ꯅꯠꯇꯦ, ꯑꯗꯨꯕꯨ ꯃꯁꯤꯗꯥ ꯍꯣꯡꯂꯛꯂꯤꯕꯥ ꯑꯗꯨꯒꯤ ꯂꯩꯔꯤꯕꯥ ꯃꯑꯣꯡ ꯑꯗꯨ ꯄꯥꯁ ꯇꯧꯏ꯫"
"which is itself unchangeable and permanent, corresponds that which in the","ꯃꯁꯥꯅꯥ ꯃꯁꯥꯕꯨ ꯍꯣꯡꯗꯣꯀꯄꯥ ꯉꯃꯗꯕꯥ ꯑꯃꯁꯨꯡ ꯄꯔꯃꯦꯅꯦꯟꯇ ꯑꯣꯏꯕꯥ, ꯲꯰꯲꯰ꯒꯤ ꯃꯅꯨꯡꯗꯥ ꯂꯩꯕꯥ ꯑꯗꯨꯒꯥ ꯃꯥꯟꯅꯩ꯫"
"phenomenon is unchangeable in existence, that is, substance, and it is only","ꯐꯤꯚꯝ ꯑꯁꯤ ꯑꯍꯣꯡꯕꯥ ꯄꯨꯔꯀꯄꯥ ꯉꯃꯗꯕꯥ, ꯍꯥꯌꯕꯗꯤ ꯄꯣꯠꯁꯛ ꯑꯃꯅꯤ, ꯑꯃꯁꯨꯡ ꯃꯁꯤ ꯈꯛꯇꯃꯛ ."
by it that the succession and coexistence of phenomena can be determined,ꯃꯁꯤꯒꯤ ꯃꯇꯨꯡ ꯏꯟꯅꯥ ꯐꯤꯚꯃꯁꯤꯡꯒꯤ ꯃꯇꯨꯡ ꯏꯟꯅꯥ ꯑꯃꯁꯨꯡ ꯄꯨꯟꯅꯥ ꯂꯩꯃꯤꯟꯅꯕꯥ ꯑꯁꯤ ꯂꯦꯄꯊꯣꯀꯄꯥ ꯉꯃꯒꯅꯤ ꯫
in regard to time.),ꯃꯇꯃꯒꯤ ꯃꯇꯥꯡꯗꯥ꯫)
"The schema of cause and of the causality of a thing is the real which,","ꯃꯔꯝ ꯑꯃꯒꯤ ꯑꯃꯁꯨꯡ ꯄꯣꯠ ꯑꯃꯒꯤ ꯀꯧꯖꯦꯂꯤꯇꯤꯒꯤ ꯁ꯭ꯀꯤꯝ ꯑꯁꯤ ꯑꯁꯦꯡꯕꯥꯅꯤ ꯃꯗꯨꯗꯤ,"
"when posited, is always followed by something else. It consists, therefore,","ꯄꯣꯖꯤꯇꯤꯕ ꯑꯣꯏꯕꯥ ꯃꯇꯃꯗꯥ, ꯃꯇꯝ ꯄꯨꯝꯅꯃꯛꯇꯥ ꯑꯇꯣꯞꯄꯥ ꯑꯃꯅꯥ ꯇꯨꯡ ꯏꯟꯗꯨꯅꯥ ꯆꯠꯂꯤ꯫"
"in the succession of the manifold, in so far as that succession is subjected to","ꯃꯦꯅꯤꯐꯣꯜꯗꯀꯤ ꯃꯇꯨꯡ ꯏꯟꯅꯥ, ꯁꯛꯁꯤꯁꯟ ꯑꯗꯨ ꯃꯈꯥ ꯇꯥꯅꯥ ꯆꯠꯊꯔꯀꯄꯥ ꯃꯇꯃꯗꯥ ."
a rule,ꯅꯤꯌꯝ ꯑꯃꯥ .
"The schema of community (reciprocity of action and reaction), or the","ꯀꯝꯌꯨꯅꯤꯇꯤꯒꯤ ꯁ꯭ꯀꯤꯝ (ꯑꯦꯛꯁꯟ ꯑꯃꯁꯨꯡ ꯔꯤꯑꯦꯛꯁꯅꯒꯤ ꯔꯦꯁꯤꯞꯔꯣꯁꯤꯇꯤ), ꯅꯠꯔꯒꯥ ."
